country_code	url	title	description	image_url	publish_date	source
br	https://www.gazetadopovo.com.br/republica/pgr-pf-encontrou-ligacao-aliados-bolsonaro-atos-8-janeiro/	PGR diz à PF que encontrou ligação entre aliados de Bolsonaro e atos de 8/1 - Gazeta do Povo	Gonet afirma que há elementos que indicam a atuação de aliados de Bolsonaro para a "eclosão dos atos depredatórios" de 8/1. Leia na Gazeta do Povo.	https://media.gazetadopovo.com.br/2024/10/17151913/brasilia-protestos-foto-joedson-alves-agencia-brasil-660x372.jpg	2024-10-18 17:44:00	Gazeta do Povo
br	https://g1.globo.com/sp/sao-paulo/eleicoes/2024/noticia/2024/10/19/o-que-dizem-os-planos-de-nunes-e-boulos-sobre-crise-climatica-e-meio-ambiente-prefeito-nao-cita-podas-e-deputado-e-generico.ghtml	O que dizem os planos de Nunes e Boulos sobre crise climática e meio ambiente: prefeito não cita podas, e deputado é genérico - G1	Cidade de São Paulo sofreu com as consequências das mudanças climáticas nos últimos dias, e o assunto ficou no centro do debate. Confira propostas dos dois candidatos que se enfrentam no segundo turno das eleições municipais.	https://s2-g1.glbimg.com/1S0DnEQyAk2_VR84jD2tWhwlFs8=/1200x/smart/filters:cover():strip_icc()/i.s3.glbimg.com/v1/AUTH_59edd422c0c84a879bd37670ae4f538a/internal_photos/bs/2024/A/p/6uYdbiRyWcQKWcSsbhGQ/1729180529129979.jpg	2024-10-19 09:00:25	G1
br	https://g1.globo.com/rj/rio-de-janeiro/noticia/2024/10/19/policias-sao-acionadas-hospital-federal-de-bonsucesso.ghtml	No 5º dia de protesto, polícias Militar e Federal retiram manifestantes do Hospital Federal de Bonsucesso para nova direção assumir - G1	PM diz que prédio foi reintegrado. Uma audiência de conciliação estava marcada para segunda-feira. Sindicato dos Servidores da Saúde afirma que a categoria está insatisfeita com as condições de trabalho e não concorda com a descentralização da gestão dos hospitais federais. 	https://s2-g1.glbimg.com/eSyVB53_pu3nUov1JgDnYPRUw98=/1200x/smart/filters:cover():strip_icc()/s02.video.glbimg.com/x720/13026817.jpg	2024-10-19 10:43:20	G1
br	https://metsul.com/veja-a-previsao-do-tempo-para-o-fim-de-semana-do-ultimo-grenal-do-ano/	Veja a previsão do tempo para o fim de semana do último Grenal do ano - MetSul.com	Confira a previsão do tempo detalhada da MetSul Meteorologia para este fim de semana de Grenal no Rio Grande do Sul.	https://metsul.com/wp-content/uploads/2024/10/tempo1910.jpg	2024-10-19 10:05:32	MetSul.com
br	https://www.poder360.com.br/poder-congresso/lira-critica-propostas-que-proibem-uso-do-bolsa-familia-em-apostas/	Lira critica propostas que proíbem uso do Bolsa Família em apostas - Poder360	Arthur Lira, não vê eficiência em vetar o benefício para jogos, mas em endurecer regras de propagandas. Leia no Poder360.	https://static.poder360.com.br/2024/09/Turismo-Lula-ArthurLira-CelsoSabino-SilvioCostaFilho-Tamareira-41-848x477.jpg	2024-10-19 09:02:07	Poder360
br	https://g1.globo.com/rj/rio-de-janeiro/noticia/2024/10/19/empresas-que-ganharam-r-50-milhoes-da-fundacao-saude-tem-mesmo-endereco-de-firmas-da-familia-do-diretor-do-instituto.ghtml	Empresas que ganharam R$ 50 milhões da Fundação Saúde têm mesmo endereço de firmas da família do diretor do instituto - G1	O RJ2 foi até a Rua Dom Walmor, no Centro de Nova Iguaçu, investigar como duas pequenas salas comerciais abrigam tantas empresas e contratos públicos. 	https://s2-g1.glbimg.com/v95mDfamha6_Kp3k7Y2O5H7tqZc=/1200x/smart/filters:cover():strip_icc()/s03.video.glbimg.com/x720/13026050.jpg	2024-10-19 07:00:56	G1
br	https://g1.globo.com/politica/eleicoes/2024/eleicao-em-numeros/noticia/2024/10/19/as-cidades-brasileiras-que-ha-mais-de-20-anos-so-elegem-homens-para-prefeito-vice-e-vereador.ghtml	As cidades brasileiras que há mais de 20 anos só elegem homens para prefeito, vice e vereador - G1	Enquanto as mulheres são 52,4% do eleitorado, neste ano, elas representaram 15,4% das prefeitas eleitas e 18,2% das vereadoras.	https://s2-g1.glbimg.com/XbjgnKoCGo6MsEAh065adGJbjcM=/1200x/smart/filters:cover():strip_icc()/i.s3.glbimg.com/v1/AUTH_59edd422c0c84a879bd37670ae4f538a/internal_photos/bs/2024/T/C/YsNtx5RwSwG3VZw3vi7A/posseboavista.jpg	2024-10-19 14:59:53	G1
br	https://g1.globo.com/politica/noticia/2024/10/19/repatriacao-6o-voo-chega-ao-brasil-com-212-passageiros-e-um-pet.ghtml	Brasil já repatriou 1,3 mil que estavam no Líbano; sexto voo chegou neste sábado - G1	Ao todo, governo estima que 3 mil brasileiros queiram deixar o país em razão do conflito entre Israel e o Hezbollah. Mais de 1,3 mil cidadãos já foram repatriados.	https://s2-g1.glbimg.com/55QMekPpKKsMolpevHnnS39RlNo=/1200x/smart/filters:cover():strip_icc()/i.s3.glbimg.com/v1/AUTH_59edd422c0c84a879bd37670ae4f538a/internal_photos/bs/2024/P/b/QXWBE3TbKzPM2t9xJ49g/captura-de-tela-2024-10-01-145012.png	2024-10-19 10:51:38	G1
br	https://veja.abril.com.br/coluna/matheus-leitao/frase-do-dia-2405	Vladimir Putin: Frase do dia - VEJA	Vladimir Putin	https://veja.abril.com.br/wp-content/uploads/2024/03/GettyImages-2084805514.jpg?quality=70&strip=info&crop=1&resize=1080,565	2024-10-19 10:00:41	VEJA
br	https://www.cartacapital.com.br/politica/stf-rejeita-pedido-de-bolsonaro-para-encerrar-inquerito-sobre-vazamento-de-dados-sigilosos/	STF rejeita pedido de Bolsonaro para encerrar inquérito sobre vazamento de dados sigilosos - CartaCapital	O caso entrou em julgamento na Primeira Turma. Prevaleceu o voto do ministro Alexandre de Moraes	https://www.cartacapital.com.br/wp-content/uploads/2024/05/bolsonaroemoraes.png	2024-10-18 20:36:00	CartaCapital
br	https://oglobo.globo.com/mundo/noticia/2024/10/19/israel-lanca-folhetos-sobre-gaza-mostrando-com-fotos-do-corpo-de-sinwar-hamas-nao-governara-mais.ghtml	Israel lança folhetos sobre Gaza com fotos do corpo de Sinwar: 'Hamas não governará mais' - O Globo	Após morte de líder do grupo terrorista,  aiatolá Ali Khamenei afirma que 'Hamas está vivo e continuará vivo'	https://s2-oglobo.glbimg.com/Zl2LjiyymfulAizn05OaClHGDwY=/1200x/smart/filters:cover():strip_icc()/i.s3.glbimg.com/v1/AUTH_da025474c0c44edd99332dddb09cabe8/internal_photos/bs/2024/E/n/0AO8EKQzmUqqssiBStsw/628926.jpeg	2024-10-19 14:14:10	O Globo
br	https://revistaoeste.com/brasil/defesa-civil-emite-alerta-para-chuvas-intensas-em-sao-paulo/	Defesa Civil emite alerta para chuvas intensas em São Paulo - Revista Oeste	A previsão é de acumulados de até 250 mm de precipitação em algumas regiões do Estado	https://medias.revistaoeste.com/wp-content/uploads/2024/10/Chuvas-alagam-SP-scaled.jpg	2024-10-19 09:00:00	Revista Oeste
br	https://oglobo.globo.com/politica/eleicoes-2024/noticia/2024/10/18/derrotas-da-esquerda-levam-pt-a-apoiar-nomes-da-direita-no-segundo-turno-e-provocam-divisao-no-partido.ghtml	Derrotas da esquerda levam PT a apoiar nomes da direita no segundo turno e provocam divisão no partido - O Globo	Petistas estão entre a estratégia de chancelar a opção 'menos pior' ou de não ter nenhuma posição	https://s2-oglobo.glbimg.com/ZS2xNYDvoEE68FAspnIP2XI4lcU=/1200x/smart/filters:cover():strip_icc()/i.s3.glbimg.com/v1/AUTH_da025474c0c44edd99332dddb09cabe8/internal_photos/bs/2023/h/S/XsG2HET2GSao7n7ahBvg/105246334-pa-brasilia-df-08-12-2023-lula-participa-da-conferencia-eleitoral-pt-2024-ato-politico-d.jpg	2024-10-18 06:30:25	O Globo
br	https://www.metropoles.com/colunas/guilherme-amado/ministra-manda-investigar-uso-do-ministerio-na-defesa-de-silvio-almeida	Ministra manda investigar uso do ministério na defesa de Silvio Almeida - Metrópoles	Ministério apura uso dos canais oficiais para defender então ministro Silvio Almeida, acusado de assédio sexual	https://uploads.metroimg.com/wp-content/uploads/2024/09/06085101/Silvio-Almeida-4-1.jpg	2024-10-19 08:30:29	Metrópoles
br	https://www.metropoles.com/colunas/igor-gadelha/os-favoritos-para-a-presidencia-da-camara-no-grupo-de-zap-do-pt	Os favoritos para a presidência da Câmara no grupo de "zap" do PT - Metrópoles	Presidência da Câmara foi um dos assuntos mais comentados no grupo de WhatsApp dos deputados federais petistas nos últimos dias	https://uploads.metroimg.com/wp-content/uploads/2024/10/18163135/bancada-pt.jpg	2024-10-19 08:00:06	Metrópoles
br	https://noticias.uol.com.br/eleicoes/2024/10/19/datafolha-mostra-recuperacao-de-boulos-entre-eleitores-de-marcal-pos-apagao.htm	Datafolha mostra recuperação de Boulos entre eleitores de Marçal pós-apagão - UOL Confere	A nova pesquisa do Datafolha, divulgada nesta quinta-feira (17), mostrou Guilherme Boulos (PSOL) ganhando espaço entre os eleitores de Pablo Marçal (PRTB). O levantamento foi o primeiro feito pelo instituto após o apagão que atingiu a capital paulista 	https://conteudo.imguol.com.br/c/noticias/48/2024/08/28/pablo-marcal-prtb-e-guilherme-boulos-psol-empatam-tecnicamente-em-pesquisa-da-futura-inteligencia-divulgada-nesta-quarta-28-1724857395672_v2_615x300.png	2024-10-19 08:30:00	UOL Confere
br	https://www.gazetadopovo.com.br/mundo/drone-lancado-contra-a-casa-de-netanyahu-no-norte-de-israel-diz-porta-voz/	Ataque de drone na casa de Benjamin Netanyahu - Gazeta do Povo	Ataque de drone na casa de Benjamin Netanyahu. Um drone lançado do Líbano atingiu a casa de veraneio de Benjamin Netanyahu em Cesareia, Israel, dois dias após a morte do líder do Hamas, Yahya Sinwar. Embora sem vítimas, o ataque intensifica as tensões com o Hezbollah. Netanyahu afirma que 'nada irá nos deter'.	https://media.gazetadopovo.com.br/2024/10/06105131/Benjamin-Netanyahu-rejeita-criticas-de-macron-sobre-fornecimento-de-armas-a-israel-660x372.jpg	2024-10-19 12:28:00	Gazeta do Povo
br	https://www.poder360.com.br/poder-economia/lula-nao-tem-como-simplesmente-acabar-com-apostas-diz-advogado/	Lula não tem como simplesmente acabar com apostas, diz advogado - Poder360	Luiz Felipe Attié afirma que fala do presidente sobre o tema foi mais uma “pressão” para que bets sigam regulamentação. Leia no Poder360.	None	2024-10-19 11:01:11	Poder360
br	https://g1.globo.com/sp/sao-paulo/noticia/2024/10/19/ao-menos-quatro-bairros-ficam-sem-energia-apos-chuva-fraca-em-sp.ghtml	Após chuva moderada, Grande SP registra queda de energia em mais de 100 mil imóveis, segundo a Enel - G1	Somente na capital, quatro bairros ficaram no escuro: Pinheiros, Vila Andrade, Jabaquara e Santo Amaro	https://s2-g1.glbimg.com/xdaUlsNijocb9mMD_M0LgRRFt94=/1200x/smart/filters:cover():strip_icc()/i.s3.glbimg.com/v1/AUTH_59edd422c0c84a879bd37670ae4f538a/internal_photos/bs/2024/G/l/g5rFB9SGmsDBwLh4xaOw/whatsapp-image-2024-10-16-at-08.31.48.jpeg	2024-10-19 16:48:34	G1
br	https://www.cartacapital.com.br/politica/governador-da-bahia-decreta-tres-dias-de-luto-apos-massacre-em-escola/	Governador da Bahia decreta três dias de luto após massacre em escola – Política - CartaCapital	Aluno matou três colegas em escola no norte do estado	https://www.cartacapital.com.br/wp-content/uploads/2024/10/54072919192_ad3a875e2b_h.jpg	2024-10-19 14:32:00	CartaCapital
br	https://g1.globo.com/ce/ceara/noticia/2024/10/19/entenda-proposta-feita-por-empresaria-que-afirma-ter-posse-de-80percent-da-vila-de-jericoacoara.ghtml	Entenda proposta feita por empresária que afirma ter posse de 80% da Vila de Jericoacoara - G1	Paraíso turístico e um dos mais cobiçados destinos no Nordeste brasileiro, a Vila de Jericoacoara, no litoral do Ceará, entrou no centro de uma disputa depois que uma empresária reivindicou 80% daquelas terras. PGE-CE media acordo com empresária.	https://s2-g1.glbimg.com/mm4Y8i5SPlq4nFMNJxzgwdePXK0=/1200x/smart/filters:cover():strip_icc()/i.s3.glbimg.com/v1/AUTH_59edd422c0c84a879bd37670ae4f538a/internal_photos/bs/2024/h/H/wkOmjmRLKpNbe4HQbwTg/jericoacoara-2a.jpg	2024-10-19 09:00:15	G1
br	https://www.poder360.com.br/poder-gente/cantora-que-fez-danca-erotica-quer-ser-ministra-da-educacao/	Cantora que fez dança erótica quer ser ministra da Educação - Poder360	Tertuliana Lustosa viralizou depois de se apresentar em cima de uma cadeira na Universidade Federal do Maranhão. Leia no Poder360.	None	2024-10-19 12:23:38	Poder360
br	https://oglobo.globo.com/brasil/noticia/2024/10/19/foto-de-lucas-bove-com-ex-jovem-pan-teria-causado-briga-com-influenciadora-cintia-chagas-diz-site.ghtml	Foto de Lucas Bove com ex-Jovem Pan teria causado briga com influenciadora Cintia Chagas, diz site - O Globo	Deputado estadual está sendo acusado pela ex-esposa, a influenciadora Cíntia Chagas, de agressão física e ameaças	https://s2-oglobo.glbimg.com/y21tgIDVvpww_wi3rtQkkC5KurU=/1200x/smart/filters:cover():strip_icc()/i.s3.glbimg.com/v1/AUTH_da025474c0c44edd99332dddb09cabe8/internal_photos/bs/2024/v/6/I11fO6SSSX2DM6IB03Xg/cintia.jpg	2024-10-19 12:48:51	O Globo
br	https://revistaoeste.com/politica/o-que-esta-em-jogo-na-disputa-pela-prefeitura-de-natal-rn/	O que está em jogo na disputa pela Prefeitura de Natal (RN) - Revista Oeste	Paulinho Freire, apoiado por Bolsonaro, e Natália Bonavides, respaldada por Lula, competem no segundo turno na capital do Rio Grande do Norte	https://medias.revistaoeste.com/wp-content/uploads/2024/10/Design-sem-nome-2-1-e1729276514805.jpg	2024-10-19 10:31:00	Revista Oeste
br	https://oglobo.globo.com/esportes/noticia/2024/10/19/surfista-italiana-morre-apos-ataque-de-peixe-espada-na-indonesia.ghtml	Surfista italiana morre após ataque de peixe-espada, em Mentawai, na Indonésia - O Globo	Giulia Manfrini, de 36 anos, também era influenciadora; ela foi socorrida, mas não resistiu aos ferimentos	https://s2-oglobo.glbimg.com/3YR0l3PQKTIbe4tT6NHQ1P0CL_Y=/1200x/smart/filters:cover():strip_icc()/i.s3.glbimg.com/v1/AUTH_da025474c0c44edd99332dddb09cabe8/internal_photos/bs/2024/t/d/PdbBDaT4Ka0umodpKXYg/fotojet-18-.jpg	2024-10-19 17:35:36	O Globo
br	https://oglobo.globo.com/rio/noticia/2024/10/19/vaquinha-online-e-criada-para-ajudar-familia-de-professor-colombiano-morto-no-rio-a-realizar-translado-do-corpo.ghtml	Vaquinha online é criada para ajudar família de professor colombiano que morreu no Rio a realizar translado do corpo - O Globo	Manuel Felipe Martínez Mantilla dava aula na Universidade Nacional da Colômbia e viajou para a cidade para participar de um congresso	https://s2-oglobo.glbimg.com/i935TTr2QpOp1-9pT-TFxkWu8Do=/1200x/smart/filters:cover():strip_icc()/i.s3.glbimg.com/v1/AUTH_da025474c0c44edd99332dddb09cabe8/internal_photos/bs/2024/W/i/C8FAKlQf2OVZ47T3kLhQ/captura-de-tela-2024-10-18-185631.jpg	2024-10-19 12:56:10	O Globo
br	https://www.bbc.com/portuguese/articles/cd7x9q8090jo	Eleição em Fortaleza: como jovem bolsonarista pode desbancar esquerda após vinte anos - BBC News Brasil	André Fernades (PL), de 26 anos, moderou discurso na disputa pela capital cearense com Evando Leitão (PT)	https://ichef.bbci.co.uk/news/1024/branded_portuguese/08f4/live/e9c15a20-8cca-11ef-81f8-1f28bcc5be15.png	2024-10-18 10:20:27	BBC News Brasil
br	https://bmcnews.com.br/2024/10/19/bolsa-familia-19-10-emite-comunicado-para-todos-os-nis/	Bolsa Família 19/10 emite comunicado para todos os NIS - BM&C NEWS	O Bolsa Família é um importante programa social do Brasil, destinado a auxiliar famílias de baixa renda em todo o	https://bmcnews.com.br/wp-content/uploads/2024/08/bolsa-familia_1722364913947.jpg	2024-10-19 09:00:00	BM&C NEWS
br	https://noticias.uol.com.br/colunas/a-hora/2024/10/19/a-conspiracao-que-impediu-sao-paulo-de-enterrar-seus-fios.htm	A Hora: A 'conspiração' que impediu São Paulo de enterrar seus fios - UOL Confere	O emaranhado de fios sobre São Paulo é um retrato da voracidade de um mercado desregulamentado e sem supervisão. São, na maioria, fibras ópticas de dezenas de telecoms diferentes que pagam aluguel à dona dos postes, a Enel, para pendurar neles a maçaro	https://conteudo.imguol.com.br/c/noticias/62/2024/01/15/enel-1705353598366_v2_615x300.jpg	2024-10-19 12:30:00	UOL Confere
br	https://www1.folha.uol.com.br/poder/2024/10/policia-de-sp-identifica-e-busca-suspeito-de-ataque-a-prefeito-de-taboao-da-serra.shtml	Polícia de SP identifica e busca suspeito de ataque a prefeito de Taboão da Serra - UOL	Ataque contra José Aprígio da Silva nesta sexta-feira foi registrado como tentativa de homicídio	https://f.i.uol.com.br/fotografia/2024/10/18/17292772576712ad49ecfec_1729277257_3x2_rt.jpg	2024-10-19 12:52:00	UOL
br	https://oglobo.globo.com/rio/noticia/2024/10/19/homens-armados-invadem-a-muzema-favela-dominada-pelo-trafico-na-zona-oeste-do-rio-veja-video.ghtml	Milicianos armados invadem a Muzema, favela dominada pelo tráfico na Zona Oeste do Rio; veja vídeo - O Globo	Nesta semana, nove ônibus foram sequestrados no Itanhangá	https://s2-oglobo.glbimg.com/6CAFtRF-W0OS_V3HklUC4PK9S54=/1200x/smart/filters:cover():strip_icc()/i.s3.glbimg.com/v1/AUTH_da025474c0c44edd99332dddb09cabe8/internal_photos/bs/2024/C/v/xXbLfYT4SUSPHrVjVuWw/whatsapp-image-2024-10-19-at-12.54.10.jpeg	2024-10-19 17:02:30	O Globo
br	https://olhardigital.com.br/2024/10/19/ciencia-e-espaco/terra-ultrapassa-quase-7-de-9-limites-planetarios-e-corre-risco-de-catastrofes-irreversiveis/	Terra ultrapassa quase 7 de 9 limites planetários e corre risco de catástrofes irreversíveis - Olhar Digital	Novo estudo, feito pelo Instituto Potsdam para Pesquisa sobre o Impacto Climático, alerta para impacto na estabilidade do meio ambiente	https://olhardigital.com.br/wp-content/uploads/2024/10/recife-de-corais-scaled.jpg	2024-10-19 14:09:00	Olhar Digital
br	https://www.plural.jor.br/curitiba/curitiba-tem-duas-novas-pesquisas-sobre-segundo-turno-veja-os-resultados/	Curitiba tem duas novas pesquisas sobre segundo turno; veja os resultados - - Jornal Plural Curitiba	None	None	2024-10-19 13:42:11	Jornal Plural Curitiba
br	https://news.google.com/rss/articles/CBMixAFBVV95cUxOUXRWdnJwc1cxYzJNTENZMktzUlR4cFd5RzlCV3hBX0VYZVFDVXhfZlEwN1cwZ1FxcnZBc094N3RjbmpfVi1jY3lvcHFETUtZczFkTjA2X1BEOGxFa2YyMGNyVXA0TEpndHVEZUNxQVRCQXpsX0dpLU5NYU0zdFQ4OUg5dVBYWG5YOEFkRWdwUERSWXIyQUZhd1NQMXhrUlJVUjFHaEV0NGtINkhiSkdWclNYTk8tVEdNYWRRakNRSnZvcHNI?oc=5	Seul diz que Coreia do Norte enviou tropas para apoiar Rússia contra a Ucrânia - R7	None	None	2024-10-19 16:03:46	R7
br	https://noticias.uol.com.br/internacional/ultimas-noticias/2024/10/19/mortes-ataque-israel-leste-libano.htm	Prefeito está entre os mortos no leste do Líbano após bombardeio israelense - UOL Confere	Ao menos quatro pessoas morreram, incluindo um prefeito, após um bombardeio israelense no leste do Líbano, neste sábado (19).O que aconteceuAtaque aéreo teve como alvo um apartamento residencial na cidade de Baaloul, no oeste do Vale do Bekaa. As infor	https://conteudo.imguol.com.br/c/noticias/1d/2024/10/19/ataque-aereo-israelense-a-uma-area-nos-arredores-da-cidade-oriental-de-baalbek-no-vale-de-bekaa-1729344309434_v2_615x300.jpg	2024-10-19 13:59:10	UOL Confere
br	https://www.metropoles.com/saude/entenda-chip-da-beleza-proibido-anvisa	Chip da beleza: entenda o que é o dispositivo proibido pela Anvisa - Metrópoles	Implante hormonal conhecido como chip da beleza foi proibido pela agência nesta sexta por oferecer muitos riscos graves à saúde	https://uploads.metroimg.com/wp-content/uploads/2024/10/19082243/chip-da-beleza.jpg	2024-10-19 11:44:31	Metrópoles
br	https://www.metropoles.com/colunas/guilherme-amado/como-aliados-de-boulos-explicam-eleitores-de-lula-que-pendem-a-nunes	Como aliados de Boulos explicam eleitores de Lula que pendem a Nunes - Metrópoles	Pesquisas eleitorais têm mostrado uma fatia do eleitorado de Lula que prefere votar em Ricardo Nunes, e não em Boulos	https://uploads.metroimg.com/wp-content/uploads/2024/10/18175703/Lula-e-Guilherme-Boulos.jpg	2024-10-19 10:30:17	Metrópoles
br	https://g1.globo.com/rj/rio-de-janeiro/noticia/2024/10/19/policia-civil-investigacao-sobre-orgaos-transplantados-com-hiv.ghtml	Polícia Civil conclui primeira parte da investigação sobre órgãos transplantados com HIV; saiba o que dizem os depoimentos - G1	Justiça manteve a prisão temporária dos 4 funcionários do laboratório PCS Saleme.	https://s2-g1.glbimg.com/SRk4k_qCr8JHGXn0LJnrq-NXc74=/1200x/smart/filters:cover():strip_icc()/s01.video.glbimg.com/x720/13026068.jpg	2024-10-19 09:59:40	G1
br	https://oglobo.globo.com/rio/noticia/2024/10/18/minha-filha-foi-levar-a-estela-no-medico-e-voltou-carregando-ela-nos-bracos-desmaiada-e-sangrando-diz-avo-de-menina-de-3-anos-baleada-na-cabeca.ghtml	'Minha filha foi levar a Estela no médico e voltou carregando ela nos braços, desmaiada e sangrando', diz avó de menina de 3 anos baleada na cabeça - O Globo	A dona de casa Walkiria Alves, avó da menina Estela de Oliveira Ferreira, de 3 anos, diz a criança foi baleada na cabeça ao sair de casa com os pais	https://s2-oglobo.glbimg.com/sMyCVDKOOOrJJDHrJpMykg_ptBM=/1200x/smart/filters:cover():strip_icc()/i.s3.glbimg.com/v1/AUTH_da025474c0c44edd99332dddb09cabe8/internal_photos/bs/2024/D/K/wvV7s5RhaaUw4gVIVO0w/whatsapp-image-2024-10-18-at-15.42.33.jpeg	2024-10-18 18:54:04	O Globo
br	https://metsul.com/onde-vai-ter-chuva-com-temporais-isolados-neste-fim-de-semana/	Onde vai ter chuva com temporais isolados neste fim de semana - MetSul.com	Leia boletim da MetSul Meteorologia com as áreas do Brasil que mais devem ter chuva e risco de temporais isolados neste fim de semana.	https://metsul.com/wp-content/uploads/2024/10/brasil1910b.jpg	2024-10-19 13:01:47	MetSul.com
br	https://www.em.com.br/politica/2024/10/6968495-bolsonaro-chega-em-belo-horizonte-para-campanha-de-engler.html	Bolsonaro chega em Belo Horizonte para campanha de Engler - Estado de Minas	O ex-presidente Jair Bolsonaro participa em Belo Horizonte de motocarreata na corrida eleitoral pelo segundo turno do candidato do PL, Bruno Engler	https://midias.em.com.br/_midias/jpg/2024/10/19/520x405/1_bolsonaro_bh_campanha_bruno_engler-40825750.jpeg?20241019105320?20241019105320	2024-10-19 14:07:00	Estado de Minas
br	https://news.google.com/rss/articles/CBMimAFBVV95cUxNZWpaQzFKVy0tVjZ5Vk54Y21YRS1PZExNb1FSQm9JZWdBbXVBZXJNSk40OG5XSGYxSlZMbllxQ0F4MEQ3RU9rSlE4ZDNmWmxCSHFXM2RPdVg3TGtqV2JrRF94WXJiYVpGenpERXpXWjRfWURrd19UaFZzM1hnSDdEMUo4bV9yaEpPTWFHT01LZ3gzc0VZZFowYQ?oc=5	Cuba sofre apagão total após colapso do sistema energético - O Antagonista	None	None	2024-10-19 12:29:00	O Antagonista
br	https://news.google.com/rss/articles/CBMiwAFBVV95cUxNR3VyWXRDRVdVV19xYlctN2hxbVBja2VOQVBCdE5HdzhTcVItcWY1UUctMkZpWDktWE41eUxjTTFobnA0RGlkbnlhZnhUWVhseW1qaVJ6dkhqOXhJakZPRTN2TG9ibmlNMTd0SF9PNWlzVnVaRzR1alNXdm9ybE16MFI1WFR1eEZULTRSNlphVVprRUo5dWh2bnZfckVPa3huM21NTDZ1c3JjZTBKaGpVQWhSTHRuNWlCLWhDcTNXT3k?oc=5	Eleições dos EUA: Donald Trump se aproxima de Kamala em pesquisas - UOL Confere	A menos de vinte dias das eleições presidenciais dos Estados Unidos, o candidato republicano Donald Trump tem apresentado melhora nas pesquisas e até mesmo aparecido a frente de Kamala Harris em algumas delas. Confira os principais levantamentos sobre 	https://conteudo.imguol.com.br/c/noticias/11/2024/09/27/kamala-harris-em-um-evento-na-pensilvania-e-donald-trump-dando-entrevista-em-nova-york-1727470962320_v2_615x300.png	2024-10-19 12:30:00	UOL Confere
br	https://g1.globo.com/rs/rio-grande-do-sul/noticia/2024/10/19/gemeas-igrejinha-veja-o-que-se-sabe.ghtml	'A única coisa que eu dei para elas foi amor', diz pai de gêmeas que morreram em intervalo de oito dias no RS; veja o que se sabe - G1	Manuela Pereira, de seis anos, morreu no dia 7 de outubro, em Igrejinha. Já a irmã, Antônia, morreu no dia 15. Mãe das gêmeas está presa temporariamente suspeita de duplo homicídio. Pai, que não é investigado, prestou depoimento à polícia.	https://s2-g1.glbimg.com/UhaXeuJfVS_k7A1oIswQDUvdR5Y=/1200x/smart/filters:cover():strip_icc()/i.s3.glbimg.com/v1/AUTH_59edd422c0c84a879bd37670ae4f538a/internal_photos/bs/2024/P/i/5BhxviSAO6ahqxoCCWwA/gemeas.png	2024-10-19 07:00:25	G1
br	https://noticias.uol.com.br/ultimas-noticias/agencia-estado/2024/10/18/pl-expulsa-deputado-que-promoveu-encontro-para-apoiar-candidato-petista-em-fortaleza.htm	PL expulsa deputado que promoveu encontro para apoiar candidato petista em Fortaleza - UOL Confere	O Partido Liberal (PL) expulsou o deputado federal cearense Júnior Mano, que organizou nesta quarta-feira, 16, um encontro entre prefeitos para sinalizar apoio a Evandro Leitão, candidato petista que concorre à prefeitura de Fortaleza no segundo turno 	https://conteudo.imguol.com.br/c/noticias/e5/2021/08/06/o-deputado-junior-mano-1628266629192_v2_615x300.jpg	2024-10-18 23:02:00	UOL Confere
br	https://www.gazetadopovo.com.br/vida-e-cidadania/com-voto-de-zanin-stf-forma-maioria-contra-revista-intima-para-entrada-em-presidios/	STF forma maioria contra revista íntima para entrada em presídios - Gazeta do Povo	A tese que está sendo fixada pelo STF admite a busca pessoal como algo excepcional, com autorização do visitante e desde que não vexatória.	https://media.gazetadopovo.com.br/2024/09/25175610/testemunhas-de-jeova-stf-660x372.jpg	2024-10-18 16:33:00	Gazeta do Povo
br	https://ge.globo.com/futebol/times/botafogo/noticia/2024/10/19/tiquinho-soares-volta-a-fazer-gol-depois-de-quase-tres-meses-e-comemora-quebra-de-jejum.ghtml	Tiquinho Soares volta a fazer gol depois de quase três meses e comemora quebra de jejum - Globo	Centroavante perdeu posição no time com a chegada de Igor Jesus, mas volta marcar e quase decreta vitória	https://s2-ge.glbimg.com/INsXCUMwDuP2iFkefzPXzp0ulLo=/600x0/filters:quality(50)/https://i.s3.glbimg.com/v1/AUTH_bc8228b6673f488aa253bbcb03c80ec5/internal_photos/bs/2024/n/E/yUjxa1T2WDBo9MtGPC7g/50.jpg	2024-10-19 15:00:18	Globo
