country_code	url	title	description	image_url	publish_date	source
br	https://oglobo.globo.com/rio/noticia/2024/11/23/bala-perdida-atinge-condominio-onde-mora-claudio-castro-na-barra-da-tijuca.ghtml	Bala perdida atinge condomínio onde mora Cláudio Castro na Barra da Tijuca - O Globo	Morador compartilhou ocorrido em grupo de vizinhos do complexo de apartamentos	https://s2-oglobo.glbimg.com/lr4IxLpIgjJFDLUZY2RwD80c7ZQ=/1200x/smart/filters:cover():strip_icc()/i.s3.glbimg.com/v1/AUTH_da025474c0c44edd99332dddb09cabe8/internal_photos/bs/2024/f/S/YixJvZQM2m9qjQwvJMOQ/foto-bala-perdida.jpg	2024-11-23 15:28:59	O Globo
br	https://oglobo.globo.com/rio/noticia/2024/11/23/nove-suspeitos-sao-presos-e-armas-sao-apreendidas-em-operacao-no-rio-das-pedras-apos-tentativa-de-invasao-de-traficantes.ghtml	Nove suspeitos são presos e mais de 30 armas são apreendidas no Rio das Pedras, após tentativa de invasão de traficantes - O Globo	Um suspeito foi encontrado morto e outro foi encaminhado para hospital da região com ferimentos	https://s2-oglobo.glbimg.com/bvlp9pH6uaMazgFLJRV99dGP6Jo=/1200x/smart/filters:cover():strip_icc()/i.s3.glbimg.com/v1/AUTH_da025474c0c44edd99332dddb09cabe8/internal_photos/bs/2024/W/F/6Jip8HTDuDsBzx3FWSmQ/whatsapp-image-2024-11-23-at-15.31.46.jpeg	2024-11-23 19:15:34	O Globo
br	https://oglobo.globo.com/esportes/futebol/flamengo/noticia/2024/11/23/gabigol-da-esperancas-pela-permanencia-no-flamengo-podem-e-irao-acontecer-milagres.ghtml	Gabigol dá esperança à torcida de que pode permanecer no Flamengo: 'podem e irão acontecer milagres!' - O Globo	Atacante deixou o recado em postagem de comemoração dos cinco anos do segundo título Libertadores do rubro-negro	https://s2-oglobo.glbimg.com/iFdQjnbgIwQRnXeFyDj2td_3fn4=/1200x/smart/filters:cover():strip_icc()/i.s3.glbimg.com/v1/AUTH_da025474c0c44edd99332dddb09cabe8/internal_photos/bs/2024/6/E/p86A7vTyGMUD980cnIzg/109109524-belo-horizonte-10-11-2024-gabigol-do-flamengo-comemora-o-ta-tulo-da-copa-do-brasil-apa3s-1-.jpg	2024-11-23 18:02:32	O Globo
br	https://www.poder360.com.br/poder-congresso/mourao-rejeita-possibilidade-de-golpe-e-desqualifica-plano-contra-lula/	Mourão rejeita possibilidade de golpe e desqualifica plano contra Lula - Poder360	Em podcast, ex-vice-presidente disse que considera plano de ação revelado pela PF como irrealizável e sem apoio das Forças Armadas	https://static.poder360.com.br/2024/05/HamiltonMourao-VicePresidente-Senador-PoderEntrevista-Estudio-Poder360-22-1-scaled-1-848x477.jpg	2024-11-23 01:58:46	Poder360
br	https://g1.globo.com/mundo/ucrania-russia/noticia/2024/11/23/russia-tem-o-mais-vasto-arsenal-de-misseis-do-mundo-com-capacidade-para-chegar-a-europa-e-aos-eua-veja-principais.ghtml	Rússia tem o mais vasto arsenal de mísseis do mundo, com capacidade para chegar à Europa e aos EUA; veja principais - G1		https://s2-g1.glbimg.com/apnV6XK9GO81tHFFxI-09cXur_E=/1200x0/https://i.s3.glbimg.com/v1/AUTH_59edd422c0c84a879bd37670ae4f538a/internal_photos/bs/2024/B/Y/2q47VzTrC4noZEfk2RjA/221124-info-arsenal-misseis-russia-3-.png	2024-11-23 08:00:29	G1
br	https://www.cartacapital.com.br/educacao/se-eu-nao-te-matar-diretor-de-escola-militar-do-tocantins-e-afastado-apos-cantico-violento/	'Se eu não te matar': Diretor de escola militar do Tocantins é afastado após cântico violento – Educação - CartaCapital	O caso aconteceu no Colégio Militar Euclides Bezerra Gerais, localizado em Paranã, no sul do estado	https://www.cartacapital.com.br/wp-content/uploads/2024/11/escola_militar_tocantins1.jpg	2024-11-23 18:11:00	CartaCapital
br	https://metsul.com/2024-11-23-tempo-chuva-nordeste-bahia-salvador/	Chuva aumenta em parte do Nordeste do Brasil - MetSul.com	Veja mapa com a projeção de chuva para sete dias no Nordeste do Brasil e leia a análise da MetSul Meteorologia.	https://metsul.com/wp-content/uploads/2024/11/nordeste2311B.jpg	2024-11-23 23:31:01	MetSul.com
br	https://g1.globo.com/sp/sao-paulo/noticia/2024/11/23/homem-que-tentou-arrancar-crianca-de-baba-e-investigado-por-tentativa-de-sequestro.ghtml	Homem que tentou arrancar criança de babá é investigado por tentativa de sequestro - G1		https://s2-g1.glbimg.com/PBzSe7sHrO8EdtXatsFtEzGVbQs=/1280x0/https://thumbor.globoi.com/unsafe/fit-in/1280x720/s04.video.glbimg.com/deo/vi/79/46/13124679	2024-11-23 17:22:36	G1
br	https://www.infomoney.com.br/mundo/putin-assina-lei-que-perdoa-dividas-de-novos-recrutas-russos-para-guerra-na-ucrania/	Putin assina lei que perdoa dívidas de novos recrutas russos para guerra na Ucrânia - InfoMoney	A lei se aplica a todos os recrutas em potencial que tiveram processos de cobrança de dívidas abertos contra eles antes de 1º de dezembro	https://www.infomoney.com.br/wp-content/uploads/2024/06/2024-06-20T164458Z_1_LYNXMPEK5J0NB_RTROPTP_4_VIETNAM-RUSSIA-PUTIN.jpg?fit=921%2C614&quality=70&strip=all	2024-11-23 19:33:00	InfoMoney
br	https://www.infomoney.com.br/consumo/lotofacil-confira-as-15-dezenas-sorteadas-pelo-concurso-3251/	Lotofácil: confira as 15 dezenas sorteadas pelo concurso 3251 - InfoMoney	A estimativa de prêmio do concurso é R$ 1,7 milhão	https://www.infomoney.com.br/wp-content/uploads/2024/09/Image-9.jpg?quality=70	2024-11-23 23:24:59	InfoMoney
br	https://motorsport.uol.com.br/stockcar-br/news/stock-car-camilo-desabafa-apos-vitoria-nunca-vi-final-de-campeonato-como-esse/10675881/	Stock Car - Camilo desabafa após vitória: “Nunca vi final de campeonato como esse” - UOL	Piloto da Ipiranga Racing não poupou palavras sobre situação atual da temporada, envolvendo confusão por causa das punições	https://cdn-6.motorsport.com/images/amp/0rGB87O2/s6/thiago-camilo.jpg	2024-11-23 20:04:31	UOL
br	https://www.poder360.com.br/poder-internacional/7-paises-europeus-ja-tem-ordem-para-prender-netanyahu/	7 países europeus já têm ordem para prender Netanyahu - Poder360	Desde a emissão do mandado de prisão pela Tribunal de Haia, 12 nações europeias se manifestaram; 4 não deixaram claro o que fariam	https://static.poder360.com.br/2024/09/netanyahu-848x477.jpg	2024-11-23 22:21:35	Poder360
br	https://noticias.uol.com.br/internacional/ultimas-noticias/2024/11/23/embaixada-argentina-que-esta-sob-tutela-do-brasil-sofre-cerco-em-caracas.htm	Embaixada argentina, sob tutela do Brasil, sofre cerco em Caracas - UOL Confere	Asilados venezuelanos na embaixada argentina em Caracas, sob a tutela do Brasil desde agosto, denunciaram neste sábado (23) um cerco policial ao prédio.Segundo os opositores, drones e agentes encapuzados foram usados na operação, intensificando o clima	https://conteudo.imguol.com.br/c/noticias/d7/2024/11/23/imagens-do-cerco-a-embaixada-da-argentina-em-caracas-1732412468693_v2_615x300.png	2024-11-24 03:22:10	UOL Confere
br	https://jovempan.com.br/noticias/brasil/novas-imagens-mostram-que-estudante-deu-tapa-em-viatura-antes-de-ser-morto-por-policial.html	Novas imagens mostram que estudante deu tapa em viatura antes de ser morto por policial - Jovem Pan	Marco Aurélio Acosta caminhava sem camisa por uma rua na zona sul de São Paulo quando viu o carro da PM, acertou o retrovisor e fugiu; agentes perseguiram o jovem e afirmam que houve resistência	https://jpimg.com.br/uploads/2024/11/estudante-policia.png	2024-11-23 09:10:55	Jovem Pan
br	https://oglobo.globo.com/politica/noticia/2024/11/23/mp-do-tcu-pede-suspensao-de-salarios-de-bolsonaro-e-outros-24-militares-indiciados-por-golpe-de-estado.ghtml	MP do TCU pede suspensão de salários de Bolsonaro e outros 24 militares indiciados por golpe de Estado - O Globo	O subprocurador-geral Lucas Furtado pediu, ainda, para suspender qualquer pagamento remuneratório aos outros indiciados que porventura recebam verba dos cofres públicos federais, incluindo do Fundo Partidário	https://s2-oglobo.glbimg.com/7phKYPMM-oHaIVF45-2UElnU70I=/1200x/smart/filters:cover():strip_icc()/i.s3.glbimg.com/v1/AUTH_da025474c0c44edd99332dddb09cabe8/internal_photos/bs/2024/N/O/3lR0LNSAAmoAYQkNevpg/100994283-brazilian-president-and-candidate-for-the-liberal-party-pl-jair-bolsonaro-leaves-after-hol.jpg	2024-11-23 14:58:39	O Globo
br	https://www.correiobraziliense.com.br/mundo/2024/11/6995325-milei-torna-publica-ruptura-com-vice-presidente-e-diz-que-ela-nao-participa-do-governo.html	Milei rompe com a própria vice e diz que ela não participará do governo - Correio Braziliense	As tensões entre os dois vêm crescendo desde que o início do governo e agora parecem ter chegado a um ponto sem retorno	https://midias.correiobraziliense.com.br/_midias/jpg/2024/11/19/675x450/1_28ce4310_a4ca_11ef_970e_8fbcc7d140cd-41869104.jpg?20241119073629?20241119073629	2024-11-23 18:45:00	Correio Braziliense
br	https://agenciabrasil.ebc.com.br/geral/noticia/2024-11/tse-unificado-divulgados-horarios-das-provas-em-8-de-dezembro	TSE Unificado: divulgados horários das provas em 8 de dezembro - EBC - Empresa Brasil de Comunicação	Provas objetivas serão feitas em turnos distintos e têm caráter eliminatório e classificatório. Para o cargo de analista judiciário ocorrerá no turno matutino e cargos de técnico judiciário, a partir das 15h30, no horário de Brasília.	https://imagens.ebc.com.br/r3YgluyLijfaV0pS_suj6Ok2IYc=/1600x800/https://agenciabrasil.ebc.com.br/sites/default/files/thumbnails/image/predio-tse_mcamgo_abr_22062023-4.jpg?itok=oLtXuATp	2024-11-23 13:35:00	EBC - Empresa Brasil de Comunicação
br	https://www.metropoles.com/sao-paulo/delator-do-pcc-2o-suspeito-de-execucao-era-socio-de-olheiro-em-adega	Delator do PCC: 2º suspeito de execução era sócio de olheiro em adega - Metrópoles	Kauê Coelho e Matheus Augusto, suspeitos de envolvimento na morte de Gritzbach, eram sócios de uma adega e "amigos próximos", diz processo	https://uploads.metroimg.com/wp-content/uploads/2024/11/23131647/kaue-matheus.jpg	2024-11-23 16:38:04	Metrópoles
br	https://www.infomoney.com.br/mundo/venezuela-investigara-oposicionista-maria-corina-machado-por-apoiar-sancoes-dos-eua/	Venezuela investigará oposicionista María Corina Machado por apoiar sanções dos EUA - InfoMoney	María Corina será investigada por manifestar apoio a um projeto de lei aprovado esta semana pela Câmara dos Deputados dos EUA que impediria o governo americano de contratar empresa que faça negócio com o país	https://www.infomoney.com.br/wp-content/uploads/2024/03/2024-03-20T235848Z_1_LYNXNPEK2J0XH_RTROPTP_4_VENEZUELA-ELECTION-MACHADO.jpg?quality=70	2024-11-23 15:13:22	InfoMoney
br	https://www.cartacapital.com.br/sociedade/cerca-de-30-mil-candidatos-negros-voltam-a-disputar-vagas-no-cnu/	Cerca de 30 mil candidatos negros voltam a disputar vagas no CNU – Sociedade - CartaCapital	No total, número de candidatos reintegrados chega a 32.260	https://www.cartacapital.com.br/wp-content/uploads/2024/11/cpnu_17_0.jpg	2024-11-22 18:19:00	CartaCapital
br	https://jovempan.com.br/noticias/politica/advogado-de-mauro-cid-volta-atras-apos-confirmar-que-tenente-coronel-sabia-do-plano-para-matar-lula.html	Advogado de Mauro Cid volta atrás após confirmar que tenente-coronel sabia do plano para matar Lula - Jovem Pan	Cezar Bitencourt se retratou, esclarecendo que não se referiu a um 'plano de morte'; esquema foi revelado pela Operação Contragolpe, que culminou na prisão preventiva de quatro militares e um policial federal	https://jpimg.com.br/uploads/2023/07/fotografia-2-1.png	2024-11-22 22:06:15	Jovem Pan
br	https://colunadofla.com/2024/11/flamengo-reinaugura-estadio-no-acre-em-jogo-com-ingressos-esgotados-entenda/	Flamengo reinaugura estádio no Acre em jogo com ingressos esgotados; entenda - Coluna do Fla	A equipe sub-20 do Flamengo vai disputar um amistoso neste domingo (24), contra a equipe do Santa Cruz, em Rio Branco, no Acre.	https://colunadofla.com/wp-content/uploads/2024/11/sub-20-flamengo.jpg	2024-11-24 01:08:27	Coluna do Fla
br	https://colunadofla.com/2024/11/corinthians-ameaca-colocar-flamengo-na-justica-por-atitude-em-caso-hugo-souza/	Corinthians ameaça colocar Flamengo na Justiça por atitude em ‘caso Hugo Souza’ - Coluna do Fla	O Corinthians prepara uma última investida por Hugo Souza e ameaça colocar o Flamengo na justiça caso o clube recuse novamente.	https://colunadofla.com/wp-content/uploads/2024/11/hugo-souza-.jpg	2024-11-23 23:05:48	Coluna do Fla
br	https://www.nsctotal.com.br/noticias/novo-estadio-do-flamengo-veja-imagens-e-detalhes-do-projeto	Novo estádio do Flamengo: Veja imagens e detalhes do projeto - NSC Total	Confira os detalhes e as imagens do projeto do novo estádio do Flamengo no Gazômetro que foi apresentado aos sócios	https://img.nsctotal.com.br/wp-content/uploads/2024/11/projeto-do-novo-estadio-do-flamengo-6.jpg	2024-11-23 20:55:00	NSC Total
br	https://g1.globo.com/sp/sao-paulo/noticia/2024/11/23/video-ex-marido-e-preso-apos-atirar-e-matar-mulher-na-regiao-da-25-de-marco.ghtml	VÍDEO: Homem é preso após matar a tiros a ex-mulher na região da 25 de Março - G1		https://s2-g1.glbimg.com/RpuQksM6ZPWcYYnkffx58b1v_Co=/1280x0/https://thumbor.globoi.com/unsafe/fit-in/1280x720/s04.video.glbimg.com/deo/vi/43/58/13125843	2024-11-24 00:07:00	G1
br	https://www.cartacapital.com.br/artigo/envio-de-minas-antipessoal-dos-eua-para-a-ucrania-impoe-30-anos-de-retrocesso-nas-leis-da-guerra/	Envio de minas antipessoal dos EUA para a Ucrânia impõe 30 anos de retrocesso nas leis da guerra - CartaCapital	São proibidos meios e métodos que não diferenciem alvos legítimos (militares em combate) de civis	https://www.cartacapital.com.br/wp-content/uploads/2024/11/US-Arms.jpg	2024-11-22 23:00:00	CartaCapital
br	https://noticiasdatv.uol.com.br/noticia/novelas/volta-por-cima-madalena-socorre-inimiga-na-rua-e-desconfia-de-doenca-esquisita-128390	Volta por Cima: Madalena socorre inimiga na rua e desconfia de doença esquisita - Notícias da TV	Resumo: Madalena (Jéssica Ellen) ficará desconfiada sobre a suposta doença misteriosa de Cacá (Pri Helena) em Volta por Cima	https://noticiasdatv.uol.com.br/media/uploads/artigos_2024/volta-por-cima-madalena-jessica-ellen-doenca-esquisita-1611.jpg	2024-11-23 16:00:00	Notícias da TV
br	https://www.poder360.com.br/poder-justica/braga-netto-nega-tentativa-de-golpe-e-plano-para-matar-lula/	Braga Netto nega tentativa de golpe e plano para matar Lula - Poder360	Ex-ministro também criticou “tese da imprensa” sobre “golpe dentro do golpe” para tirar Bolsonaro caso plano desse certo. Leia no Poder360.	https://static.poder360.com.br/2024/02/braga-netto-sergio-lima-2-848x477.png	2024-11-23 21:24:10	Poder360
br	https://g1.globo.com/meio-ambiente/noticia/2024/11/23/greta-thunberg-chama-rascunho-da-cop29-de-completo-desastre-e-sentenca-de-morte.ghtml	Greta Thunberg chama rascunho da COP29 de 'completo desastre' e 'sentença de morte' - G1		https://s2-g1.glbimg.com/lujAFP2kKvTzXWhiAX6vMB6E2EU=/1200x/smart/filters:cover():strip_icc()/i.s3.glbimg.com/v1/AUTH_59edd422c0c84a879bd37670ae4f538a/internal_photos/bs/2024/d/z/zvzUMATkWtJlOc5wCudg/greta.jpg	2024-11-23 17:29:11	G1
br	https://noticias.r7.com/brasilia/moraes-autoriza-anderson-torres-a-sair-de-casa-para-cuidar-da-mae-a-noite-e-aos-fins-de-semana-23112024/	Moraes autoriza Anderson Torres a sair de casa para cuidar da mãe à noite e aos fins de semana - R7	O ministro Alexandre de Moraes, do Supremo Tribunal Federal, autorizou neste sábado (23) o ex-ministro da Justiça e ex-secretário de Segurança Pública do Distrito Federal Anderson Torres a sair de casa no período noturno e aos fins de semana para acompanhar o tratamento da mãe doente. A autorização limita-se ao deslocamento de Torres de casa até residência da mãe e ao Hospital Brasília, onde ela está internada. 	https://newr7-r7-prod.web.arc-cdn.net/resizer/v2/VVHXW2B7TFJDDLWFVDPB5FMJEI.jpg?smart=true&auth=7e4960353e9c7ae4649786c2f9616cd691a41f542b70e11d80acac134b8f78d1&width=1200&height=630	2024-11-23 17:08:22	R7
br	https://www.intercept.com.br/2024/11/23/forcas-armadas-viraram-fabrica-de-terroristas/	Forças armadas viraram fábrica de terroristas, é preciso aniquilar o golpismo - Intercept Brasil	Provas robustas do envolvimento de dezenas de militares, muitos de alta patente, em plano golpista e homicida obriga limpeza radical nas forças armadas.	https://www.intercept.com.br/wp-content/plugins/seox-image-magick/imagick_convert.php?width=1200&height=627&format=webp&quality=91&imagick=uploads.intercept.com.br/2024/11/image.png	2024-11-23 11:00:00	Intercept Brasil
br	https://colunadofla.com/2024/11/racing-vence-cruzeiro-e-campeao-da-sul-americana-e-se-garante-na-libertadores-2025-fla-tem-vaga/	Racing vence Cruzeiro, é campeão da Sul-Americana e se garante na Libertadores 2025; Fla tem vaga - Coluna do Fla	Racing (ARG) controla Cruzeiro na final da Sul-Americana e se garante na fase de grupos da Libertadores 2025, que terá o Flamengo	https://colunadofla.com/wp-content/uploads/2024/11/racing-cruzeiro-sul-americana-libertadores-flamengo.jpg	2024-11-23 22:35:45	Coluna do Fla
br	https://www.f1mania.net/f1/f1-qual-horario-e-onde-assistir-o-gp-de-las-vegas-desta-madrugada-veja-aqui/	F1: Qual horário e onde assistir o GP de Las Vegas desta madrugada? Veja aqui - F1Mania.net	O aguardado GP de Las Vegas acontece na madrugada deste domingo (24), às 3h no horário de Brasília, trazendo a penúltima etapa da temporada 2024 da Fórmula 1.	https://www.f1mania.net/wp-content/uploads/2023/11/0001253645_HiRes_0Y2QEG20EVCL940J3DRUZ0W71M4C.jpg	2024-11-23 22:00:24	F1Mania.net
br	https://www.infomoney.com.br/consumo/mega-sena-veja-as-dezenas-sorteadas-do-concurso-2799/	Mega-Sena: veja as dezenas sorteadas do concurso 2799 - InfoMoney	Os números sorteados foram 01 – 31 – 38 – 40 – 45 – 60	https://www.infomoney.com.br/wp-content/uploads/2024/10/loteria_mega-sena_Rafa-Neddermeyer-Agencia-Brasil.webp?quality=70	2024-11-23 23:13:36	InfoMoney
br	https://www.meutimao.com.br/noticias-do-corinthians/493560/fator-casa-representa-expectativa-otimista-para-o-corinthians-no-confronto-contra-o-vasco	Fator casa representa expectativa otimista para o Corinthians no confronto contra o Vasco - Meu Timão	Na Neo Química Arena, o Corinthians vai enfrentar o Vasco, o quarto pior mandante do Campeonato Brasileiro. Além disso, o Timão conta com uma sequência histórica como mandante no confronto.	https://www.meutimao.com.br/fotos-do-corinthians/w941/2024/10/20/mosaico_da_torcida_do_corinthians_na_neo_quimica_lo2h.jpg	2024-11-23 23:35:00	Meu Timão
br	https://oglobo.globo.com/economia/negocios/noticia/2024/11/23/frigorificos-brasileiros-suspendem-fornecimento-ao-carrefour-apos-decisao-da-rede-de-cortar-carne-brasileira-na-franca.ghtml	Frigoríficos brasileiros suspendem vendas ao Carrefour após rede vetar carne brasileira na França - O Globo	JBS, com a marca Friboi, Marfrig e Masterboi iniciaram a interrupção às lojas do Brasil na quinta-feira, relatam fontes a par das negociações	https://s2-oglobo.glbimg.com/7BSrWhvzdaOkQlTgnsy37CdKROA=/1200x/smart/filters:cover():strip_icc()/i.s3.glbimg.com/v1/AUTH_da025474c0c44edd99332dddb09cabe8/internal_photos/bs/2024/Z/1/ZI5FeETsytYfqYsvLo6A/311321719.jpg	2024-11-23 22:30:40	O Globo
br	https://revistaquem.globo.com/entretenimento/series-e-filmes/noticia/2024/11/fernanda-paes-leme-fala-de-cena-de-sexo-com-bruna-marquezine-surpresa-de-viver-uma-personagem-bissexual.ghtml	Fernanda Paes Leme fala de cena de sexo com Bruna Marquezine: 'Surpresa de viver uma personagem bissexual' - QUEM Acontece	Atriz interpreta Alice em 'Amor da Minha Vida', nova série do Disney+	https://s2-quem.glbimg.com/S22VAgDUcGQ4YL2yFVQGEj3E5NQ=/1200x/smart/filters:cover():strip_icc()/i.s3.glbimg.com/v1/AUTH_b0f0e84207c948ab8b8777be5a6a4395/internal_photos/bs/2024/s/n/KfTFiFRYKACtulUkTZig/fepaesleme-1729704939-3485340107940907431-19131468-1-.jpg	2024-11-23 14:19:24	QUEM Acontece
br	https://www.lance.com.br/fora-de-campo/fluminense-x-fortaleza-pc-oliveira-analisa-possivel-penalti-e-cita-jogo-do-palmeiras.html	Fluminense x Fortaleza: PC Oliveira analisa possível pênalti e cita jogo do Palmeiras - LANCE!	O jogo entre Fluminense e Fortaleza, no Maracanã, foi marcado por uma polêmica na última sexta-feira (22).	https://lncimg.lance.com.br/cdn-cgi/image/width=1280,height=720,quality=75,fit=cover,format=webp/uploads/2024/08/pc-oliveira2.jpg	2024-11-23 09:10:00	LANCE!
br	https://noticias.uol.com.br/ultimas-noticias/agencia-estado/2024/11/23/governador-aliado-de-bolsonaro-diz-que-pais-vive-tiroteio-e-defende-paz-para-trabalhar.htm	Governador aliado de Bolsonaro diz que País vive 'tiroteio' e defende 'paz para trabalhar' - UOL Confere	Aliado do ex-presidente Jair Bolsonaro (PL), indiciado pela Polícia Federal por golpe de Estado, o governador de Santa Catarina, Jorginho Mello (PL), disse neste sábado, 23, que o Brasil "precisa de paz para trabalhar" e que o clima de "	https://conteudo.imguol.com.br/c/noticias/5a/2024/01/03/20abr2023---o-governador-de-santa-catarina-jorginho-mello-durante-evento-em-palmeira-1704308641270_v2_615x300.jpg	2024-11-23 21:58:00	UOL Confere
br	https://placar.com.br/brasileirao/ao-vivo-atletico-go-x-palmeiras-pela-35a-rodada-do-brasileirao/	AO VIVO: Atlético-GO x Palmeiras pela 35ª rodada do Brasileirão - Placar	Verdão faz 1 a 0 no Castelo do Dragão, conta com tropeço do Botafogo e assume ponta a três rodadas do fim	https://placar.com.br/wp-content/uploads/2024/09/53930914817_242dcc9286_o-1.jpg	2024-11-23 22:00:01	Placar
br	https://colunadofla.com/2024/11/botafogo-pipoca-e-palmeiras-assume-a-lideranca-do-brasileirao-flamengo-pode-se-aproximar-nesta-terca/	Botafogo ‘pipoca’ e Palmeiras assume a liderança do Brasileirão; Flamengo pode se aproximar nesta terça - Coluna do Fla	O Flamengo não entra em campo neste final de semana, mas aproveitou para assistir a mais uma 'pipocada' do Botafogo.	https://colunadofla.com/wp-content/uploads/2024/11/botafogo-atletico-go.jpg	2024-11-24 00:31:10	Coluna do Fla
br	https://www1.folha.uol.com.br/mundo/2024/11/quem-e-o-antissistema-que-pode-complicar-o-governo-do-futuro-presidente-do-uruguai.shtml	Quem é o antissistema que pode complicar o governo do futuro presidente do Uruguai - UOL	Antivacina e negacionista climático, partido do deputado Gustavo Salle será peça-chave para aprovar projetos na Câmara	https://f.i.uol.com.br/fotografia/2024/11/22/17322937476740b473bc47e_1732293747_3x2_rt.jpg	2024-11-23 09:00:00	UOL
br	https://noataque.com.br/futebol/copa-sul-americana/time/cruzeiro/noticia/2024/11/23/matheus-pereira-chora-e-expressa-dor-em-dobro-com-vice-do-cruzeiro-na-sul-americana/	Matheus Pereira chora e expressa ‘dor em dobro’ com vice do Cruzeiro na Sul-Americana - No Ataque	Matheus Pereira diz que derrota na final da Sul-Americana é a mais dolorosa da carreira e se declara ao Cruzeiro: 'Clube do meu coração'	https://noataque.com.br/wp-content/uploads/2024/11/mp10.jpg	2024-11-24 01:07:03	No Ataque
br	https://www1.folha.uol.com.br/mercado/2024/11/governo-preve-incluir-bloqueio-de-emendas-parlamentares-em-pacote-de-contencao-de-gastos.shtml	Governo prevê incluir bloqueio de emendas parlamentares em pacote de contenção de gastos - UOL	Planalto está preocupado com comunicação das medidas e quer mostrar que todos os segmentos vão contribuir com ajuste	https://f.i.uol.com.br/fotografia/2024/11/22/17323112456740f8cd78494_1732311245_3x2_rt.jpg	2024-11-23 02:00:00	UOL
br	https://noataque.com.br/futebol/brasileirao-serie-a/time/atletico-mg/noticia/2024/11/23/atletico-empata-com-sao-paulo-pelo-brasileiro-e-completa-um-mes-sem-vitorias/	Atlético empata com São Paulo pelo Brasileiro e completa um mês sem vitórias - No Ataque	Após começo intenso, Atlético cedeu empate ao São Paulo pelo Campeonato Brasileiro e segue em busca de quebrar sequência negativa	https://noataque.com.br/wp-content/uploads/2024/11/WhatsApp-Image-2024-11-23-at-23.24.57.jpeg	2024-11-24 02:34:15	No Ataque
br	https://trivela.com.br/brasil/corinthians-jogadores-apoio-augusto-melo-impeachment/	Corinthians: ação em defesa de Augusto Melo partiu de lideranças e levou presidente às lágrimas - Trivela	Praticamente todo elenco do Corinthians manifestou apoio público ao presidente Augusto Melo, alvo de um pedido de impeachment que será votado nesta	https://trivela.com.br/wp-content/uploads/2024/09/imago1039294483h-scaled.jpg	2024-11-24 02:27:00	Trivela
br	https://www.infomoney.com.br/consumo/quina-confira-as-dezenas-sorteadas-do-concurso-6589/	Quina: confira as dezenas sorteadas do concurso 6589 - InfoMoney	O prêmio do concurso é de R$ 12.630.539,78	https://www.infomoney.com.br/wp-content/uploads/2024/08/quina-caixa-divulgacao.png?quality=70	2024-11-23 23:17:05	InfoMoney
br	https://news.google.com/rss/articles/CBMi7gFBVV95cUxOb1ZQellXbmJoLWJfRl9lTG5FaVBTSlEwRTJTNVEyQ2E4VE1qcXFHaWdrRjEwWjVOZ2RqbV9GRGcwaG9uRkxXTjh5Y2p2S2dhY2JMRVJpOElVNFRhYWQ5WUYyTW1iaHJRTzJUVk0zXzhzMy1Nbl9DNjRjVHlSWHBNYzY3TnpudnZhc1lGSDRlRHp6d2x3LWZ3MnJ4SFpIakNDUFFLQWVDUkJRdXczdHVMWUgtdXNZbDBocFJwazRlM1F5cTFwVjVPdUZ3MkttTFFUWGc2QWpLZkRJNl9DbWMxeHN3TEsyT3NaWFM2MTRn0gHzAUFVX3lxTFBwMmFFSTEwRzdVTTdMN0Q4alBfWnBUZEZDUU50dnJnX1NCYW83LUJqdXZ2UEVYenlkb25XOERET3dmWTM3bC1ReU1FZlF5SmNHWHl3UUhENzJDR3JlRHRfV2UzQUJ5ZVBVNnp4QXhZd0t6ak40bTN3clRWd3A5bVU1SFFnZkRHVkdQeUZTWDhEckg4VUFZc29YXzB4d1lVOVFyeXlxcU0wNXVjZ3hZay05ZDY1VkNPWk9iSTEzNzhjTTFDaVhQeDdtdmlJdThaMTk4QnJmZ0haTUk1dm41eG5UQTl3UXR4R3dfblFpSzBsN205WQ?oc=5	'Dinheiro para o que é essencial não vai faltar', diz Tebet sobre corte de gastos do Governo Lula - Diário do Nordeste	None	None	2024-11-23 16:16:00	Diário do Nordeste
