country_code	url	title	description	image_url	publish_date	source
br	https://g1.globo.com/rj/rio-de-janeiro/noticia/2024/10/18/socio-do-pcs-descartou-supostas-evidencias-no-dia-que-caso-saiu-na-imprensa-diz-tecnica-presa.ghtml	Sócio do PCS descartou supostas 'evidências' no dia que caso saiu na imprensa, diz técnica presa - G1	Jacqueline Iris Bacellar, cuja assinatura aparece em um dos laudos que atestaram que os doadores de órgãos não tinham HIV, disse aos investigadores que Matheus Bandoli Vieira, sócio do PCS, guardava documentos do laboratório em sua empresa.	https://s2-g1.glbimg.com/wLbAun1-bOVixXNrE5tXzr4SjaU=/1200x/smart/filters:cover():strip_icc()/i.s3.glbimg.com/v1/AUTH_59edd422c0c84a879bd37670ae4f538a/internal_photos/bs/2024/t/s/oHBFaeTbyUzZutBZQJdQ/matheus-.jpeg	2024-10-18 20:09:46	G1
br	https://www.gazetadopovo.com.br/republica/pgr-pf-encontrou-ligacao-aliados-bolsonaro-atos-8-janeiro/	PGR diz à PF que encontrou ligação entre aliados de Bolsonaro e atos de 8/1 - Gazeta do Povo	Gonet afirma que há elementos que indicam a atuação de aliados de Bolsonaro para a "eclosão dos atos depredatórios" de 8/1. Leia na Gazeta do Povo.	https://media.gazetadopovo.com.br/2024/10/17151913/brasilia-protestos-foto-joedson-alves-agencia-brasil-660x372.jpg	2024-10-18 17:44:00	Gazeta do Povo
br	https://www.cartacapital.com.br/cartaexpressa/eduardo-leite-declara-voto-em-candidato-do-pt-contra-adversario-do-pl-em-pelotas/	Eduardo Leite declara voto em candidato do PT contra adversário do PL em Pelotas - CartaCapital	Em Porto Alegre, por outro lado, o governador apoia Sebastião Melo (MDB) contra Maria do Rosário (PT)	https://www.cartacapital.com.br/wp-content/uploads/2024/05/Leite-1.jpg	2024-10-18 21:58:00	CartaCapital
br	https://g1.globo.com/meio-ambiente/noticia/2024/10/19/terra-pode-ja-ter-ultrapassado-7-dos-seus-9-limites-planetarios-entenda-o-que-sao.ghtml	Terra pode já ter ultrapassado 7 dos seus 9 limites planetários; entenda o que são - G1	Constatação é de um novo estudo, feito por pesquisadores do Instituto Potsdam para Pesquisa sobre o Impacto Climático (PIK), que analisaram os processos essenciais para a manutenção do equilíbrio ambiental na Terra.	https://s2-g1.glbimg.com/cqDNP8lnkT1YbpnHmBseZ-1u1p0=/1200x/smart/filters:cover():strip_icc()/i.s3.glbimg.com/v1/AUTH_59edd422c0c84a879bd37670ae4f538a/internal_photos/bs/2024/B/j/TyDUAhTPW2OBBj8krW4g/image.png	2024-10-19 08:00:37	G1
br	https://www.cartacapital.com.br/politica/pl-expulsa-deputado-que-esteve-em-ato-de-apoio-a-evandro-leitao-pt-em-fortaleza/	PL expulsa deputado que esteve em ato de apoio a Evandro Leitão (PT) em Fortaleza – Política - CartaCapital	O petista enfrenta André Fernandes (PL). 'O partido hoje é extrema-direita e o extremismo não faz parte dos meus princípios', diz Júnior Mano	https://www.cartacapital.com.br/wp-content/uploads/2024/10/Snapinsta.app_463656007_18467475553050868_5605786613098218284_n_1080.jpg	2024-10-18 21:42:00	CartaCapital
br	https://agenciabrasil.ebc.com.br/internacional/noticia/2024-10/coreia-do-norte-declara-coreia-do-sul-pais-hostil	Coreia do Norte declara Coreia do Sul "país hostil" - EBC - Empresa Brasil de Comunicação	Justificada pela alteração constitucional, o país norte-coreano bombardeou trechos de estradas e vias férreas na fronteira com o país inimigo.	https://imagens.ebc.com.br/TBEL7p-lf2FmE3e1DNwWILg_dMI=/1600x800/https://agenciabrasil.ebc.com.br/sites/default/files/thumbnails/image/636643322974939267w.jpg?itok=dKOWe1sy	2024-10-17 14:44:00	EBC - Empresa Brasil de Comunicação
br	https://g1.globo.com/sp/sao-paulo/eleicoes/2024/noticia/2024/10/19/o-que-dizem-os-planos-de-nunes-e-boulos-sobre-crise-climatica-e-meio-ambiente-prefeito-nao-cita-podas-e-deputado-e-generico.ghtml	O que dizem os planos de Nunes e Boulos sobre crise climática e meio ambiente: prefeito não cita podas, e deputado é genérico - G1	Cidade de São Paulo sofreu com as consequências das mudanças climáticas nos últimos dias, e o assunto ficou no centro do debate. Confira propostas dos dois candidatos que se enfrentam no segundo turno das eleições municipais.	https://s2-g1.glbimg.com/1S0DnEQyAk2_VR84jD2tWhwlFs8=/1200x/smart/filters:cover():strip_icc()/i.s3.glbimg.com/v1/AUTH_59edd422c0c84a879bd37670ae4f538a/internal_photos/bs/2024/A/p/6uYdbiRyWcQKWcSsbhGQ/1729180529129979.jpg	2024-10-19 09:00:25	G1
br	https://g1.globo.com/rj/rio-de-janeiro/noticia/2024/10/19/policias-sao-acionadas-hospital-federal-de-bonsucesso.ghtml	No 5º dia de protesto, polícias Militar e Federal retiram manifestantes do Hospital Federal de Bonsucesso para nova direção assumir - G1	PM diz que prédio foi reintegrado. Uma audiência de conciliação estava marcada para segunda-feira. Sindicato dos Servidores da Saúde afirma que a categoria está insatisfeita com as condições de trabalho e não concorda com a descentralização da gestão dos hospitais federais. 	https://s2-g1.glbimg.com/eSyVB53_pu3nUov1JgDnYPRUw98=/1200x/smart/filters:cover():strip_icc()/s02.video.glbimg.com/x720/13026817.jpg	2024-10-19 10:43:20	G1
br	https://www.gazetadopovo.com.br/economia/centrais-sindicais-criticam-lula-mudar-regras-seguro-desemprego/	Centrais sindicais criticam governo Lula por mudar regras do seguro-desemprego - Gazeta do Povo	Cinco centrais, menos a CUT, aliada histórica de Lula, criticaram mudança no seguro-desemprego. Leia na Gazeta do Povo.	https://media.gazetadopovo.com.br/2024/10/18111135/fernando-haddad-com-lula-foto-fabio-rodrigues-pozzebom-agencia-brasil-1-660x372.jpg	2024-10-18 14:12:00	Gazeta do Povo
br	https://metsul.com/veja-a-previsao-do-tempo-para-o-fim-de-semana-do-ultimo-grenal-do-ano/	Veja a previsão do tempo para o fim de semana do último Grenal do ano - MetSul.com	Confira a previsão do tempo detalhada da MetSul Meteorologia para este fim de semana de Grenal no Rio Grande do Sul.	https://metsul.com/wp-content/uploads/2024/10/tempo1910.jpg	2024-10-19 10:05:32	MetSul.com
br	https://www.poder360.com.br/poder-congresso/lira-critica-propostas-que-proibem-uso-do-bolsa-familia-em-apostas/	Lira critica propostas que proíbem uso do Bolsa Família em apostas - Poder360	Arthur Lira, não vê eficiência em vetar o benefício para jogos, mas em endurecer regras de propagandas. Leia no Poder360.	https://static.poder360.com.br/2024/09/Turismo-Lula-ArthurLira-CelsoSabino-SilvioCostaFilho-Tamareira-41-848x477.jpg	2024-10-19 09:02:07	Poder360
br	https://g1.globo.com/rj/rio-de-janeiro/noticia/2024/10/19/empresas-que-ganharam-r-50-milhoes-da-fundacao-saude-tem-mesmo-endereco-de-firmas-da-familia-do-diretor-do-instituto.ghtml	Empresas que ganharam R$ 50 milhões da Fundação Saúde têm mesmo endereço de firmas da família do diretor do instituto - G1	O RJ2 foi até a Rua Dom Walmor, no Centro de Nova Iguaçu, investigar como duas pequenas salas comerciais abrigam tantas empresas e contratos públicos. 	https://s2-g1.glbimg.com/v95mDfamha6_Kp3k7Y2O5H7tqZc=/1200x/smart/filters:cover():strip_icc()/s03.video.glbimg.com/x720/13026050.jpg	2024-10-19 07:00:56	G1
br	https://g1.globo.com/politica/eleicoes/2024/eleicao-em-numeros/noticia/2024/10/19/as-cidades-brasileiras-que-ha-mais-de-20-anos-so-elegem-homens-para-prefeito-vice-e-vereador.ghtml	As cidades brasileiras que há mais de 20 anos só elegem homens para prefeito, vice e vereador - G1	Enquanto as mulheres são 52,4% do eleitorado, neste ano, elas representaram 15,4% das prefeitas eleitas e 18,2% das vereadoras.	https://s2-g1.glbimg.com/XbjgnKoCGo6MsEAh065adGJbjcM=/1200x/smart/filters:cover():strip_icc()/i.s3.glbimg.com/v1/AUTH_59edd422c0c84a879bd37670ae4f538a/internal_photos/bs/2024/T/C/YsNtx5RwSwG3VZw3vi7A/posseboavista.jpg	2024-10-19 14:59:53	G1
br	https://g1.globo.com/politica/noticia/2024/10/19/repatriacao-6o-voo-chega-ao-brasil-com-212-passageiros-e-um-pet.ghtml	Brasil já repatriou 1,3 mil que estavam no Líbano; sexto voo chegou neste sábado - G1	Ao todo, governo estima que 3 mil brasileiros queiram deixar o país em razão do conflito entre Israel e o Hezbollah. Mais de 1,3 mil cidadãos já foram repatriados.	https://s2-g1.glbimg.com/55QMekPpKKsMolpevHnnS39RlNo=/1200x/smart/filters:cover():strip_icc()/i.s3.glbimg.com/v1/AUTH_59edd422c0c84a879bd37670ae4f538a/internal_photos/bs/2024/P/b/QXWBE3TbKzPM2t9xJ49g/captura-de-tela-2024-10-01-145012.png	2024-10-19 10:51:38	G1
br	https://veja.abril.com.br/coluna/matheus-leitao/frase-do-dia-2405	Vladimir Putin: Frase do dia - VEJA	Vladimir Putin	https://veja.abril.com.br/wp-content/uploads/2024/03/GettyImages-2084805514.jpg?quality=70&strip=info&crop=1&resize=1080,565	2024-10-19 10:00:41	VEJA
br	https://www.cartacapital.com.br/politica/stf-rejeita-pedido-de-bolsonaro-para-encerrar-inquerito-sobre-vazamento-de-dados-sigilosos/	STF rejeita pedido de Bolsonaro para encerrar inquérito sobre vazamento de dados sigilosos - CartaCapital	O caso entrou em julgamento na Primeira Turma. Prevaleceu o voto do ministro Alexandre de Moraes	https://www.cartacapital.com.br/wp-content/uploads/2024/05/bolsonaroemoraes.png	2024-10-18 20:36:00	CartaCapital
br	https://oglobo.globo.com/mundo/noticia/2024/10/19/israel-lanca-folhetos-sobre-gaza-mostrando-com-fotos-do-corpo-de-sinwar-hamas-nao-governara-mais.ghtml	Israel lança folhetos sobre Gaza com fotos do corpo de Sinwar: 'Hamas não governará mais' - O Globo	Após morte de líder do grupo terrorista,  aiatolá Ali Khamenei afirma que 'Hamas está vivo e continuará vivo'	https://s2-oglobo.glbimg.com/Zl2LjiyymfulAizn05OaClHGDwY=/1200x/smart/filters:cover():strip_icc()/i.s3.glbimg.com/v1/AUTH_da025474c0c44edd99332dddb09cabe8/internal_photos/bs/2024/E/n/0AO8EKQzmUqqssiBStsw/628926.jpeg	2024-10-19 14:14:10	O Globo
br	https://revistaoeste.com/brasil/defesa-civil-emite-alerta-para-chuvas-intensas-em-sao-paulo/	Defesa Civil emite alerta para chuvas intensas em São Paulo - Revista Oeste	A previsão é de acumulados de até 250 mm de precipitação em algumas regiões do Estado	https://medias.revistaoeste.com/wp-content/uploads/2024/10/Chuvas-alagam-SP-scaled.jpg	2024-10-19 09:00:00	Revista Oeste
br	https://g1.globo.com/rj/rio-de-janeiro/noticia/2024/10/19/video-bandidos-armados-muzema-na-zona-oeste-do-rio.ghtml	VÍDEO: dezenas de milicianos armados com fuzis e pistolas tentam invadir a Muzema, na Zona Oeste do Rio - G1	Região, que já foi dominada pela milícia, é atualmente controlada pelo Comando Vermelho. 	https://s2-g1.glbimg.com/0VS6F-fgm4viFwkdOhYv3PaDruQ=/1200x/smart/filters:cover():strip_icc()/s03.video.glbimg.com/x720/13026910.jpg	2024-10-19 14:19:32	G1
br	https://oglobo.globo.com/politica/eleicoes-2024/noticia/2024/10/18/derrotas-da-esquerda-levam-pt-a-apoiar-nomes-da-direita-no-segundo-turno-e-provocam-divisao-no-partido.ghtml	Derrotas da esquerda levam PT a apoiar nomes da direita no segundo turno e provocam divisão no partido - O Globo	Petistas estão entre a estratégia de chancelar a opção 'menos pior' ou de não ter nenhuma posição	https://s2-oglobo.glbimg.com/ZS2xNYDvoEE68FAspnIP2XI4lcU=/1200x/smart/filters:cover():strip_icc()/i.s3.glbimg.com/v1/AUTH_da025474c0c44edd99332dddb09cabe8/internal_photos/bs/2023/h/S/XsG2HET2GSao7n7ahBvg/105246334-pa-brasilia-df-08-12-2023-lula-participa-da-conferencia-eleitoral-pt-2024-ato-politico-d.jpg	2024-10-18 06:30:25	O Globo
br	https://www.metropoles.com/colunas/guilherme-amado/ministra-manda-investigar-uso-do-ministerio-na-defesa-de-silvio-almeida	Ministra manda investigar uso do ministério na defesa de Silvio Almeida - Metrópoles	Ministério apura uso dos canais oficiais para defender então ministro Silvio Almeida, acusado de assédio sexual	https://uploads.metroimg.com/wp-content/uploads/2024/09/06085101/Silvio-Almeida-4-1.jpg	2024-10-19 08:30:29	Metrópoles
br	https://www.metropoles.com/colunas/igor-gadelha/os-favoritos-para-a-presidencia-da-camara-no-grupo-de-zap-do-pt	Os favoritos para a presidência da Câmara no grupo de "zap" do PT - Metrópoles	Presidência da Câmara foi um dos assuntos mais comentados no grupo de WhatsApp dos deputados federais petistas nos últimos dias	https://uploads.metroimg.com/wp-content/uploads/2024/10/18163135/bancada-pt.jpg	2024-10-19 08:00:06	Metrópoles
br	https://noticias.uol.com.br/eleicoes/2024/10/19/datafolha-mostra-recuperacao-de-boulos-entre-eleitores-de-marcal-pos-apagao.htm	Datafolha mostra recuperação de Boulos entre eleitores de Marçal pós-apagão - UOL Confere	A nova pesquisa do Datafolha, divulgada nesta quinta-feira (17), mostrou Guilherme Boulos (PSOL) ganhando espaço entre os eleitores de Pablo Marçal (PRTB). O levantamento foi o primeiro feito pelo instituto após o apagão que atingiu a capital paulista 	https://conteudo.imguol.com.br/c/noticias/48/2024/08/28/pablo-marcal-prtb-e-guilherme-boulos-psol-empatam-tecnicamente-em-pesquisa-da-futura-inteligencia-divulgada-nesta-quarta-28-1724857395672_v2_615x300.png	2024-10-19 08:30:00	UOL Confere
br	https://noticias.uol.com.br/internacional/ultimas-noticias/2024/10/19/pesquisas-eleicoes-eua-kamala-harris-donald-trump.htm	Eleições dos EUA: Donald Trump se aproxima de Kamala em pesquisas - UOL Confere	A menos de vinte dias das eleições presidenciais dos Estados Unidos, o candidato republicano Donald Trump tem apresentado melhora nas pesquisas e até mesmo aparecido a frente de Kamala Harris em algumas delas. Confira os principais levantamentos sobre 	https://conteudo.imguol.com.br/c/noticias/11/2024/09/27/kamala-harris-em-um-evento-na-pensilvania-e-donald-trump-dando-entrevista-em-nova-york-1727470962320_v2_615x300.png	2024-10-19 12:30:00	UOL Confere
br	https://noticias.uol.com.br/colunas/jamil-chade/2024/10/18/putin-elogia-proposta-de-brasil-e-china-para-guerra-na-ucrania-boa-base.htm	Jamil Chade: Putin elogia proposta de Brasil e China para guerra na Ucrânia: 'Boa base' - UOL Confere	O presidente da Rússia, Vladimir Putin, afirmou nesta sexta-feira que considera a proposta do Brasil e China para encontrar uma solução pacífica para a guerra na Ucrânia como "uma boa base". Mas lamentou que o governo ucraniano não esteja int	https://conteudo.imguol.com.br/c/noticias/29/2023/04/15/o-presidente-lula-pt-ao-lado-do-presidente-da-china-xi-jinping-1681565573544_v2_615x300.jpg	2024-10-18 18:43:10	UOL Confere
br	https://www.poder360.com.br/poder-justica/stf-forma-nova-maioria-para-proibir-revista-intima-em-presidios/	STF forma nova maioria para proibir revista íntima em presídios - Poder360	Ministros votam contra a inspeção vexatória de partes íntimas de visitantes de presos; provas obtidas a partir da prática não serão válidas. Leia no Poder360.	None	2024-10-18 17:21:14	Poder360
br	https://www.gazetadopovo.com.br/mundo/drone-lancado-contra-a-casa-de-netanyahu-no-norte-de-israel-diz-porta-voz/	Ataque de drone na casa de Benjamin Netanyahu - Gazeta do Povo	Ataque de drone na casa de Benjamin Netanyahu. Um drone lançado do Líbano atingiu a casa de veraneio de Benjamin Netanyahu em Cesareia, Israel, dois dias após a morte do líder do Hamas, Yahya Sinwar. Embora sem vítimas, o ataque intensifica as tensões com o Hezbollah. Netanyahu afirma que 'nada irá nos deter'.	https://media.gazetadopovo.com.br/2024/10/06105131/Benjamin-Netanyahu-rejeita-criticas-de-macron-sobre-fornecimento-de-armas-a-israel-660x372.jpg	2024-10-19 12:28:00	Gazeta do Povo
br	https://g1.globo.com/sp/sao-paulo/eleicoes/2024/noticia/2024/10/19/policia-localiza-dois-veiculos-que-teriam-sido-usados-no-atentado-contra-o-prefeito-de-taboao-da-serra.ghtml	Polícia localiza dois veículos que teriam sido usados no atentado contra o prefeito de Taboão da Serra - G1	Aprígio estava em um carro blindado e foi baleado na clavícula, ele segue internado na UTI do Albert Einstein. Os dois veículos foram encontrados em Osasco, um deles foi localizado em uma residência e o dono do carro está sendo procurado. 	https://s2-g1.glbimg.com/NmD14vGNKlcTmk_HiKv6KZfFBxA=/1200x/smart/filters:cover():strip_icc()/i.s3.glbimg.com/v1/AUTH_59edd422c0c84a879bd37670ae4f538a/internal_photos/bs/2024/w/m/mi7MV6Q52uq0pVdwzYiw/fg246730.jpg	2024-10-19 13:08:27	G1
br	https://oglobo.globo.com/mundo/noticia/2024/10/19/sobrevivente-de-ataque-ao-charlie-hebdo-e-encontrado-morto-em-quarto-de-hotel.ghtml	Sobrevivente de ataque ao Charlie Hebdo é encontrado morto em quarto de hotel - O Globo	Procuradoria de Paris anunciou neste sábado a abertura de uma investigação para determinar a causa da morte Simon Fieschi	https://s2-oglobo.glbimg.com/Qa7Ls3zUIzrfvMsK2HsrAeBFmZk=/1200x/smart/filters:cover():strip_icc()/i.s3.glbimg.com/v1/AUTH_da025474c0c44edd99332dddb09cabe8/internal_photos/bs/2024/J/6/E3mQerREeEIH5xwL3KiQ/108854326-in-this-picture-taken-on-on-january-7-2023-charlie-hebdo-webmaster-simon-fieschi-c-speaks.jpg	2024-10-19 16:22:13	O Globo
br	https://www.poder360.com.br/poder-economia/lula-nao-tem-como-simplesmente-acabar-com-apostas-diz-advogado/	Lula não tem como simplesmente acabar com apostas, diz advogado - Poder360	Luiz Felipe Attié afirma que fala do presidente sobre o tema foi mais uma “pressão” para que bets sigam regulamentação. Leia no Poder360.	None	2024-10-19 11:01:11	Poder360
br	https://g1.globo.com/sp/santos-regiao/noticia/2024/10/19/guarda-de-transito-fica-pendurada-em-capo-de-carro-apos-tentar-parar-motorista-que-fugiu-do-guincho-video.ghtml	Guarda de trânsito se agarra em capô de carro após tentar parar motorista que fugiu do guincho; VÍDEO - G1	Servidora municipal foi 'carregada' por alguns metros sobre o capô do veículo em Santos (SP). 	https://s2-g1.glbimg.com/v054-AuKAuUGs_cXHEji_eo6tkk=/1200x/smart/filters:cover():strip_icc()/s03.video.glbimg.com/x720/13026402.jpg	2024-10-19 08:59:13	G1
br	https://g1.globo.com/sp/sao-paulo/noticia/2024/10/19/ao-menos-quatro-bairros-ficam-sem-energia-apos-chuva-fraca-em-sp.ghtml	Após chuva moderada, Grande SP registra queda de energia em mais de 100 mil imóveis, segundo a Enel - G1	Somente na capital, quatro bairros ficaram no escuro: Pinheiros, Vila Andrade, Jabaquara e Santo Amaro	https://s2-g1.glbimg.com/xdaUlsNijocb9mMD_M0LgRRFt94=/1200x/smart/filters:cover():strip_icc()/i.s3.glbimg.com/v1/AUTH_59edd422c0c84a879bd37670ae4f538a/internal_photos/bs/2024/G/l/g5rFB9SGmsDBwLh4xaOw/whatsapp-image-2024-10-16-at-08.31.48.jpeg	2024-10-19 16:48:34	G1
br	https://www.cartacapital.com.br/politica/governador-da-bahia-decreta-tres-dias-de-luto-apos-massacre-em-escola/	Governador da Bahia decreta três dias de luto após massacre em escola – Política - CartaCapital	Aluno matou três colegas em escola no norte do estado	https://www.cartacapital.com.br/wp-content/uploads/2024/10/54072919192_ad3a875e2b_h.jpg	2024-10-19 14:32:00	CartaCapital
br	https://noticias.uol.com.br/eleicoes/2024/10/19/live-lula-boulos-cancelamento-passeata.htm	Lula diz que não vai bater boca e que era obrigação de Nunes podar árvores - UOL Confere	Em uma live marcada às pressas com o candidato à Prefeitura de São Paulo Guilherme Boulos (PSOL), o presidente Lula (PT) disse que não quer "ficar batendo boca" com Tarcísio de Freitas (Republicanos) e Ricardo Nunes (MDB) sobre a responsabili	https://conteudo.imguol.com.br/c/noticias/b2/2024/10/19/19out2024---guilherme-boulos-psol-e-lula-pt-em-live-apos-o-cancelamento-do-ato-de-campanha-em-sao-paulo-1729356386541_v2_615x300.jpg	2024-10-19 18:28:47	UOL Confere
br	https://www.plural.jor.br/curitiba/curitiba-tem-duas-novas-pesquisas-sobre-segundo-turno-veja-os-resultados/?__cf_chl_rt_tk=1l96GkNSqQnzNY6jKpnjVLZCyfNAMZlIyJYwNPCdTq0-1729364444-1.0.1.1-4pp0T22nDCSEjyRrHoQ0cRfctHQ0kYakEf3TdjZ.Z14	Curitiba tem duas novas pesquisas sobre segundo turno; veja os resultados - - Jornal Plural Curitiba	None	None	2024-10-19 13:42:11	Jornal Plural Curitiba
br	https://g1.globo.com/ce/ceara/noticia/2024/10/19/entenda-proposta-feita-por-empresaria-que-afirma-ter-posse-de-80percent-da-vila-de-jericoacoara.ghtml	Entenda proposta feita por empresária que afirma ter posse de 80% da Vila de Jericoacoara - G1	Paraíso turístico e um dos mais cobiçados destinos no Nordeste brasileiro, a Vila de Jericoacoara, no litoral do Ceará, entrou no centro de uma disputa depois que uma empresária reivindicou 80% daquelas terras. PGE-CE media acordo com empresária.	https://s2-g1.glbimg.com/mm4Y8i5SPlq4nFMNJxzgwdePXK0=/1200x/smart/filters:cover():strip_icc()/i.s3.glbimg.com/v1/AUTH_59edd422c0c84a879bd37670ae4f538a/internal_photos/bs/2024/h/H/wkOmjmRLKpNbe4HQbwTg/jericoacoara-2a.jpg	2024-10-19 09:00:15	G1
br	https://www.poder360.com.br/poder-gente/cantora-que-fez-danca-erotica-quer-ser-ministra-da-educacao/	Cantora que fez dança erótica quer ser ministra da Educação - Poder360	Tertuliana Lustosa viralizou depois de se apresentar em cima de uma cadeira na Universidade Federal do Maranhão. Leia no Poder360.	None	2024-10-19 12:23:38	Poder360
br	https://news.google.com/rss/articles/CBMiqwFBVV95cUxQd3M3NnZlVm05VFd2eEJwMEUyLTJZeTl4VEtKZnF6Sk9uZGw4a3NaNkNHSnkyRHpWS1U5WWprOFd1bk5RMld4MjZJdVAyNER4MXIydGVHRGU2QkZZRTdnQnR5VDhveUNEakZjT0NJRHl4RWsycjFDN2stajExTExOM2UtY3FKT2xKQzZHdTI1T0h4MVR3ak9WUTg0NEV1RVBKRkx1S1NYZnRINzg?oc=5	Prefeito está entre os mortos no leste do Líbano após bombardeio israelense - UOL Confere	Ao menos quatro pessoas morreram, incluindo um prefeito, após um bombardeio israelense no leste do Líbano, neste sábado (19).O que aconteceuAtaque aéreo teve como alvo um apartamento residencial na cidade de Baaloul, no oeste do Vale do Bekaa. As infor	None	2024-10-19 13:59:10	UOL Confere
br	https://oglobo.globo.com/brasil/noticia/2024/10/19/foto-de-lucas-bove-com-ex-jovem-pan-teria-causado-briga-com-influenciadora-cintia-chagas-diz-site.ghtml	Foto de Lucas Bove com ex-Jovem Pan teria causado briga com influenciadora Cintia Chagas, diz site - O Globo	Deputado estadual está sendo acusado pela ex-esposa, a influenciadora Cíntia Chagas, de agressão física e ameaças	https://s2-oglobo.glbimg.com/y21tgIDVvpww_wi3rtQkkC5KurU=/1200x/smart/filters:cover():strip_icc()/i.s3.glbimg.com/v1/AUTH_da025474c0c44edd99332dddb09cabe8/internal_photos/bs/2024/v/6/I11fO6SSSX2DM6IB03Xg/cintia.jpg	2024-10-19 12:48:51	O Globo
br	https://www.itatiaia.com.br/cidades/2024/10/19/mais-de-400-cidades-mineiras-estao-em-alerta-para-fortes-chuvas-neste-sabado-19-veja-lista	Mais de 400 cidades mineiras estão em alerta para fortes chuvas neste sábado (19); veja lista - Itatiaia	Há risco de corte de energia elétrica, estragos em plantações, queda de árvores e de alagamentos	https://medias.itatiaia.com.br/dims4/default/cd2c197/2147483647/strip/true/crop/1200x630+0+23/resize/1200x630!/format/webp/quality/90/?url=https%3A%2F%2Fk2-prod-radio-itatiaia.s3.us-east-1.amazonaws.com%2Fbrightspot%2Fc2%2F67%2F174c0bfe17a44214ab70b667b16a%2Fdomingo-de-pascoa-sera-de-chuva-em-bh-e-outras-cidades-de-minas-03867ab5-35fe-49a7-bd7a-88951815b6c4-large.jpg	2024-10-19 10:29:00	Itatiaia
br	https://revistaoeste.com/politica/o-que-esta-em-jogo-na-disputa-pela-prefeitura-de-natal-rn/	O que está em jogo na disputa pela Prefeitura de Natal (RN) - Revista Oeste	Paulinho Freire, apoiado por Bolsonaro, e Natália Bonavides, respaldada por Lula, competem no segundo turno na capital do Rio Grande do Norte	https://medias.revistaoeste.com/wp-content/uploads/2024/10/Design-sem-nome-2-1-e1729276514805.jpg	2024-10-19 10:31:00	Revista Oeste
br	https://oantagonista.com.br/mundo/cuba-sofre-apagao-total-apos-colapso-do-sistema-energetico/	Cuba sofre apagão total após colapso do sistema energético - O Antagonista	None	None	2024-10-19 12:29:00	O Antagonista
br	https://oglobo.globo.com/esportes/noticia/2024/10/19/surfista-italiana-morre-apos-ataque-de-peixe-espada-na-indonesia.ghtml	Surfista italiana morre após ataque de peixe-espada, em Mentawai, na Indonésia - O Globo	Giulia Manfrini, de 36 anos, também era influenciadora; ela foi socorrida, mas não resistiu aos ferimentos	https://s2-oglobo.glbimg.com/3YR0l3PQKTIbe4tT6NHQ1P0CL_Y=/1200x/smart/filters:cover():strip_icc()/i.s3.glbimg.com/v1/AUTH_da025474c0c44edd99332dddb09cabe8/internal_photos/bs/2024/t/d/PdbBDaT4Ka0umodpKXYg/fotojet-18-.jpg	2024-10-19 17:35:36	O Globo
br	https://oglobo.globo.com/rio/noticia/2024/10/19/vaquinha-online-e-criada-para-ajudar-familia-de-professor-colombiano-morto-no-rio-a-realizar-translado-do-corpo.ghtml	Vaquinha online é criada para ajudar família de professor colombiano que morreu no Rio a realizar translado do corpo - O Globo	Manuel Felipe Martínez Mantilla dava aula na Universidade Nacional da Colômbia e viajou para a cidade para participar de um congresso	https://s2-oglobo.glbimg.com/i935TTr2QpOp1-9pT-TFxkWu8Do=/1200x/smart/filters:cover():strip_icc()/i.s3.glbimg.com/v1/AUTH_da025474c0c44edd99332dddb09cabe8/internal_photos/bs/2024/W/i/C8FAKlQf2OVZ47T3kLhQ/captura-de-tela-2024-10-18-185631.jpg	2024-10-19 12:56:10	O Globo
br	https://www.bbc.com/portuguese/articles/cd7x9q8090jo	Eleição em Fortaleza: como jovem bolsonarista pode desbancar esquerda após vinte anos - BBC News Brasil	André Fernades (PL), de 26 anos, moderou discurso na disputa pela capital cearense com Evando Leitão (PT)	https://ichef.bbci.co.uk/news/1024/branded_portuguese/08f4/live/e9c15a20-8cca-11ef-81f8-1f28bcc5be15.png	2024-10-18 10:20:27	BBC News Brasil
br	https://bmcnews.com.br/2024/10/19/bolsa-familia-19-10-emite-comunicado-para-todos-os-nis/	Bolsa Família 19/10 emite comunicado para todos os NIS - BM&C NEWS	O Bolsa Família é um importante programa social do Brasil, destinado a auxiliar famílias de baixa renda em todo o	https://bmcnews.com.br/wp-content/uploads/2024/08/bolsa-familia_1722364913947.jpg	2024-10-19 09:00:00	BM&C NEWS
