country_code	url	title	description	image_url	publish_date	source
br	https://www.contabeis.com.br/noticias/68125/resultado-final-da-prova-de-titulos-do-cnu-sera-divulgado-hoje-19/	Resultado final da prova de títulos do CNU será divulgado hoje (19) - Contábeis	Candidatos podem consultar resultados na área do participante, no site do CNU.	https://www.contabeis.com.br/assets/img/news/resultado-final-da-prova-de-titulos-do-cnu-sera-divulgado-hoje-19-.png	2024-11-19 19:00:01	Contábeis
br	https://oglobo.globo.com/rio/noticia/2024/11/19/nao-me-canso-dessa-paisagem-diz-biden-a-paes-sobre-o-rio-netas-ficaram-encantadas-com-o-cristo-redentor.ghtml	'Não me canso dessa paisagem', diz Biden a Paes sobre o Rio; netas 'ficaram encantadas' com o Cristo Redentor - O Globo	Passeio da família do presidente americano no monumento foi compartilhado no Instagram	https://s2-oglobo.glbimg.com/3oXtfpLBU4ynWz_nkxEPokRtKl0=/1200x/smart/filters:cover():strip_icc()/i.s3.glbimg.com/v1/AUTH_da025474c0c44edd99332dddb09cabe8/internal_photos/bs/2024/d/V/sAL6ViSsO4cedqCltwQg/lula-biden-paes.jpeg	2024-11-19 18:06:47	O Globo
br	https://metsul.com/vento-com-rajadas-fortes-vai-acompanhar-a-chuva-no-feriado/	Vento com rajadas fortes vai acompanhar a chuva no feriado - MetSul.com	Feriado no Rio Grande do Sul será marcada pela instabilidade com centro de baixa pressão que traz chuva e vento.	https://metsul.com/wp-content/uploads/2024/11/chuva1911f.jpg	2024-11-19 23:01:29	MetSul.com
br	https://valor.globo.com/brasil/g20-no-brasil/noticia/2024/11/19/analise-com-trump-ao-lado-milei-podera-cumprir-na-africa-do-sul-a-ameaca-feita-no-rio.ghtml	Análise: Com Trump ao lado, Milei poderá cumprir na África do Sul a ameaça feita no Rio - Valor Econômico	Na Argentina, os movimentos de Milei no Rio foram vistos mais como um aceno ao seu eleitorado do que como uma possibilidade real de “estragar” a pauta brasileira do G20	https://s2-valor.glbimg.com/zjqU7INCaEdtC9lG2k5qLprWcJw=/1200x/smart/filters:cover():strip_icc()/i.s3.glbimg.com/v1/AUTH_63b422c2caee4269b8b34177e8876b93/internal_photos/bs/2024/2/d/skmKuDQRaYIlsWJy91ng/61778cf458fa440a875417c6fcd21369-0-19e14ee7a772449d879f766965fb10d7.jpg	2024-11-19 13:33:54	Valor Econômico
br	https://oantagonista.com.br/brasil/pf-pede-anulacao-de-delacao-premiada-de-mauro-cid/	PF pede anulação de delação premiada de Mauro Cid - O Antagonista	None	None	2024-11-19 22:08:57	O Antagonista
br	https://www12.senado.leg.br/noticias/videos/2024/11/dia-da-consciencia-negra-e-feriado-nacional-pela-primeira-vez	Dia da Consciência Negra é feriado nacional pela primeira vez - Senado	O Dia da Consciência Negra, em 20 de novembro, marca a morte de Zumbi dos Palmares, um dos símbolos nacionais pela resistência à escravidão e enfrentamento ao racismo. Em 2011, a data entrou no calendário oficial e passou a ser celebrada como o Dia da Consciência Negra, e já era considerada feriado em alguns estados e municípios. Mas foi somente em 2023 que o Congresso Nacional aprovou a lei que transformou o Dia da Consciência Negra em feriado nacional. Em 2024, a data será comemorada, pela primeira vez, em todo o país.	https://www12.senado.leg.br/noticias/videos/2024/11/dia-da-consciencia-negra-e-feriado-nacional-pela-primeira-vez/@@images/40fb7ee2-f1fb-493d-b6e8-0d886bc29be8.jpeg	2024-11-19 11:54:19	Senado
br	https://www.poder360.com.br/poder-brasil/escala-6-x-1-e-um-pouco-de-exagero-afirma-temer/	Escala 6 X 1 é “um pouco de exagero”, afirma Temer - Poder360	Ex-presidente diz que “discussão é válida”, mas “não sabe dizer” aonde “se vai chegar” com a PEC sobre o fim da jornada. Leia no Poder360.	https://static.poder360.com.br/2022/07/Temer-Sergio-Lima-Poder360-25-848x477.webp	2024-11-19 07:23:53	Poder360
br	https://capitalreset.uol.com.br/carbono/ultimas-camara-aprova-lei-que-cria-mercado-regulado-de-carbono/	ÚLTIMAS: Câmara aprova lei que cria mercado regulado de carbono - Capital Reset	Texto vai para a sanção do presidente e traz as definições do sistema que impõe limites a grandes poluidores	https://capitalreset.uol.com.br/wp-content/plugins/seox-image-magick/imagick_convert.php?width=1200&height=627&format=.jpg&quality=91&imagick=uploads.capitalreset.com/wp-content/uploads/2022/05/Mercado-carbono-CO2.jpg	2024-11-19 22:23:11	Capital Reset
br	https://www.infomoney.com.br/mercados/ibovespa-sobe-apoiado-em-itau-mas-petrobras-limita-ganhos/	Ibovespa sobe apoiado em Itaú, mas Petrobras limita ganhos - InfoMoney	Índice de referência do mercado acionário brasileiro, o Ibovespa subiu 0,34%, a 128.197,25 pontos	https://www.infomoney.com.br/wp-content/uploads/2020/08/Stocksss.jpg?quality=70	2024-11-19 22:07:45	InfoMoney
br	https://www.poder360.com.br/poder-internacional/saiba-onde-cada-delegacao-do-g20-se-hospedou-no-rio/	Saiba onde cada delegação do G20 se hospedou no Rio - Poder360	O bairro de Copacabana, na zona sul, abrigou 13 das 19 delegações dos países integrantes do grupo. Leia no Poder360.	https://static.poder360.com.br/2024/11/fachada-fairmont-hotel-rio-848x477.jpeg	2024-11-19 22:57:14	Poder360
br	https://neofeed.com.br/economia/roberto-campos-neto-os-malvados-da-faria-lima-e-a-dica-para-o-governo/	Roberto Campos Neto, os "malvados da Faria Lima" e a "dica" para o governo - NeoFeed	O presidente do BC Roberto Campos Neto adverte que, sem medidas que reduzam os prêmios de risco dos ativos, governo não vai atingir equilíbrio fiscal	https://neofeed.com.br/wp-content/uploads/2024/06/roberto-campos-neto.webp	2024-11-19 17:19:00	NeoFeed
br	https://www.infomoney.com.br/politica/camara-aprova-projeto-que-muda-regras-das-emendas-parlamentares-texto-vai-a-sancao/	Câmara aprova projeto que muda regras das emendas parlamentares; texto vai à sanção - InfoMoney	O projeto de lei já havia sido aprovado anteriormente pela Câmara. Mas, como houve alterações feitas pelo Senado no texto original, a proposta teve de ser novamente analisada pelos deputados	https://www.infomoney.com.br/wp-content/uploads/2024/11/camara-dos-deputados-plenario.jpg	2024-11-19 21:43:45	InfoMoney
br	https://news.google.com/rss/articles/CBMi5AFBVV95cUxOSG1rX0NEWDJESFNaV2owdllWbmoyOHdoZm9MVXdoeHN1VGtRblJzck9HamVuN1Q5RHB0NF9QMGpsLTFRaUZkVGVPeU1CaEdiblZNRWx2UDUtbEI3NkFWeDlyVUdDdExkSDRBOFVwUjhnSC1fVmZfcXVPS2VmSkRiUEx0TWRlOUVVY0k4NjJNTFM2N0g5b2ZQTHBraTlFdVB1T1h6UXpnYmtZTFh4NkVYOUZ4dHF1LVNtYktsYTNtVlV6cWk1ZDRCc2hsVVRqYkdQb3FJbjRBR0pJMkpINGo3WVk3SnE?oc=5	Visita de Estado do Presidente da China – Brasília, 20 de novembro de 2024 — Ministério das Relações Exteriores - Instituto Nacional de Tecnologia da Informação - ITI	None	None	2024-11-19 14:17:21	Instituto Nacional de Tecnologia da Informação - ITI
br	https://ge.globo.com/basquete/nba/noticia/2024/11/19/ronaldinho-gaucho-prestigia-nets-x-hornets-e-troca-jogo-da-selecao-pela-nba.ghtml	Ronaldinho Gaúcho prestigia Nets x Hornets e "troca" jogo da seleção pela NBA - Globo.com	Campeão mundial com amarelinha em 2002, ex-craque está em Nova York assistindo a partida que acontece no mesmo momento de Brasil x Uruguai pelas Eliminatórias da Copa do Mundo	https://s2-ge.glbimg.com/8Q6i1FEhrRYum_320jYdJJ98y-A=/1200x/smart/filters:cover():strip_icc()/i.s3.glbimg.com/v1/AUTH_bc8228b6673f488aa253bbcb03c80ec5/internal_photos/bs/2024/O/t/1Ra5QVQDuvRRcqIkPTMA/ronaldinho-gaucho-na-nba.jfif	2024-11-20 02:17:03	Globo.com
br	https://news.google.com/rss/articles/CBMiYkFVX3lxTFBaU1VTS1FDU2lVZ1V0UmRRMlJacl9qa1g0cTNSQ3FfSnowTjZZYTVtSlVrM25iQlA5cnR1YVBwQ2ZiQ1NZQmNKbFAxQ0hrUnRJYmN4SVFOX3J1azZUeERDb0Z30gFnQVVfeXFMTVZ1NGtPbEFzS2hIUXZqWExxeFh2UkpNaUZGcHYwT3hTc3N6ZjBYNjl6V3BDOHhxZDNPWVltTlhuWm1sR3NXakdmRXJPeF9sOVdnSFc2Z2kyOVY3WUxQWFR4SDRXTVpQZw?oc=5	Plano para matar Lula: como kids pretos tramaram dar golpe e assassinar presidente eleito, Alckmin e Moraes, segundo a PF - BBC News Brasil	Documentos intitulados 'Copa 2022' e 'Punhal Verde e Amarelo' trazem detalhes sobre o monitoramento e a possível execução de três figuras importantes após as eleições de 2022.	https://ichef.bbci.co.uk/news/1024/branded_portuguese/81d4/live/a0d8c670-a68f-11ef-8ab9-9192db313061.jpg	2024-11-20 01:34:44	BBC News Brasil
br	https://revistaoeste.com/mundo/lula-cancela-coletiva-g20/	Depois de quase 3 horas de atraso, Lula cancela coletiva final no G20 - Revista Oeste	O encontro com jornalistas brasileiros e estrangeiros tinha sido convocado em uma sala separada do Museu de Arte Moderna (MAM) do Rio	https://medias.revistaoeste.com/wp-content/uploads/2024/11/Plenaria-do-G202.jpeg	2024-11-19 22:31:58	Revista Oeste
br	https://jovempan.com.br/noticias/brasil/policia-civil-de-sp-oferece-r-50-mil-por-informacoes-de-suspeito-na-morte-de-delator-do-pcc.html	Polícia Civil de SP oferece R$ 50 mil por informações de suspeito na morte de delator do PCC - Jovem Pan	Kauê do Amaral Coelho, de 29 anos, é considerado um olheiro no aeroporto de Guarulhos e é suspeito de envolvimento no ataque que resultou na morte de Antônio Vinícius Gritzbach	https://jpimg.com.br/uploads/2024/11/kaue-do-amaral-coelho.jpg	2024-11-19 19:38:52	Jovem Pan
br	https://www.infomoney.com.br/mercados/dolar-hoje-abertura-fechamento-comercial-turismo-19112024/	Dólar sobe 0,34%, a R$ 5,76, com aversão global a risco após alerta de Putin - InfoMoney	Na segunda-feira, o dólar à vista fechou o dia em baixa de 0,65%, cotado a 5,7484 reais	https://www.infomoney.com.br/wp-content/uploads/2024/07/2024-07-03T174308Z_1_LYNXMPEK620VM_RTROPTP_4_DOLAR-ABRE.jpg?quality=70	2024-11-19 20:28:00	InfoMoney
br	https://news.google.com/rss/articles/CBMirgFBVV95cUxPZFYtY292aUtHcFhlblBaRWN6SnREM2UtZUI0WWdJQXJ4MjN0WGV6NkYwZ2x4M2dKVjVYYk5Rdy1ESnFWQUNlXzJmYXhrUnd5VVN3RkQ3R1dIZzU2RGRMUmZSYllnRnU3ZHFBMUlhdkNXb1dMTnZQeEY2Tm13M3Z2b0FUM0dyMTYwaVk2N083QVhIQzRVaDlOM2ZBaVM4WWJLM1lvRVhMWlNwOHI5d3c?oc=5	Crusoé: EUA reconhecem Edmundo González como presidente eleito da Venezuela - O Antagonista	None	None	2024-11-19 21:33:03	O Antagonista
br	https://www.cartacapital.com.br/mundo/apoiada-pelos-eua-ucrania-usa-misseis-de-longo-alcance-contra-russia-e-abre-nova-fase-do-conflito/	Apoiada pelos EUA, Ucrânia usa mísseis de longo alcance contra Rússia e abre 'nova fase' do conflito - CartaCapital	Putin acusa Exército ucraniano de disparar seis mísseis norte-americanos do tipo ATACMS; Zelenksy não confirma os disparos, mas não esconde intenção de usar o arsenal fornecido por Biden	https://www.cartacapital.com.br/wp-content/uploads/2024/11/Captura-de-Tela-2024-11-19-às-12.51.43.png	2024-11-19 16:14:00	CartaCapital
br	https://colunadofla.com/2024/11/com-2-jogadores-do-flamengo-brasil-e-uruguai-divulgam-escalacoes-para-jogo-pelas-eliminatorias/	Com 2 jogadores do Flamengo, Brasil e Uruguai divulgam escalações para jogo pelas Eliminatórias - Coluna do Fla	A Seleção Brasileira entra em campo nesta terça-feira (19), às 21h45 (horário de Brasília), para enfrentar o Uruguai, na Arena Fonte Nova.	https://colunadofla.com/wp-content/uploads/2024/11/gerson-selecao-brasileira-flamengo.jpg	2024-11-20 00:22:06	Coluna do Fla
br	https://colunadofla.com/2024/11/gerson-desabafa-e-faz-pedido-para-proximos-jogos-da-selecao-brasileira/	Gerson desabafa e faz pedido para próximos jogos da Seleção Brasileira - Coluna do Fla	Após jogo da Seleção Brasileira, Gerson, meia do Flamengo e autor do gol da 'Canarinho', fez uma análise do momento e pediu foco.	https://colunadofla.com/wp-content/uploads/2024/11/gerson-brasil.jpg	2024-11-20 03:20:09	Coluna do Fla
br	https://tv.sbt.com.br/programas/jornalismo/fofocalizando/noticia/278986-justica-nega-habeas-corpus-a-ex-bailarina-do-faustao-natacha-horana	Justiça nega habeas corpus à ex-bailarina do Faustão, Natacha Horana - SBT	Ex-integrante do programa "Domingão do Faustão" segue detida em São Paulo, após prisão por envolvimento com o tráfico e lavagem de dinheiro	https://static.sbt.com.br/noticias/images/278986.jpg	2024-11-19 21:18:00	SBT
br	https://colunadofla.com/2024/11/agora-flamengo-ganha-reforco-de-ultima-hora-no-ataque-para-jogo-contra-o-cuiaba/	AGORA | Flamengo ganha reforço de última hora no ataque para jogo contra o Cuiabá - Coluna do Fla	AGORA | Flamengo ganha reforço de última hora no ataque para jogo contra o Cuiabá. Bruno Henrique reforça o time do Flamengo em jogo amanhã	https://colunadofla.com/wp-content/uploads/2024/11/bruno-henrique-e-gabigol-copa-do-brasil.png	2024-11-20 02:43:23	Coluna do Fla
br	https://g1.globo.com/loterias/mega-sena/noticia/2024/11/19/mega-sena-concurso-2798-resultado.ghtml	Mega-Sena, concurso 2.798: prêmio acumula e vai a R$ 18 milhões - G1		https://s2-g1.glbimg.com/nfAEcd67g_P2tkeXJx8xRovF1gc=/1218x0/https://i.s3.glbimg.com/v1/AUTH_59edd422c0c84a879bd37670ae4f538a/internal_photos/bs/2024/u/O/2jqXiuQdaeQxCYRYr6BQ/mega-sena-concurso-2.798.png	2024-11-19 23:02:47	G1
br	https://www.lance.com.br/onde-assistir/jogo-corinthians-hoje-20-11-2024-saiba-onde-assistir-horario-e-escalacoes.html	Jogo do Corinthians hoje: onde assistir, horário e escalações - LANCE!	Em jogo hoje, o Corinthians recebe o Cruzeiro pelo Brasileirão. No primeiro turno da competição, o Timão perdeu por 3 a 0.	https://lncimg.lance.com.br/cdn-cgi/image/width=1280,height=720,quality=75,fit=cover,format=webp/uploads/2024/11/jogo-corinthians-hoje-scaled-aspect-ratio-512-320.jpg	2024-11-19 23:00:00	LANCE!
br	https://news.google.com/rss/articles/CBMivwFBVV95cUxNYk1sSnh4T0ZHV0d4SmdKLVJ1eFhoMUZjVTRtR3NHRGJVS3pjRXh0TTZxNHdfamw3WXpfWm5NRkRHS3BnS043b0h1MXZTU3NRT2NES2FkSVpLdTBrQ1lFWFJ3S2Z5eklKek1qRkpoU3hlZFU3bWgyM005VHBDWDI4NW1QMVlZY2h6eWdGWmZ2MGtKVWZkc2dmSFVBUXhwZlFPN1hfd3E1dEhYWVotMjJuU0xlMjhMUHIzdEV3aEc4Z9IBzgFBVV95cUxOMTJmd1pxZnBaMFI4Ni16RmFrZG1Hc0gwTEpHdE05b0ZBVVRyU19vc1VoSVFDaHh6TnhmOEp6U1l3dHZVYWZFRWw0T1RrTUxDRHRLdTdWUEwzcF9FWFJSWEozZTZETW1odTRjTGNfby1ZWXhVdWQ1d1RMZ2hUZVVmRkhqdzZSdFJMcDR5Zi1HVUZaeTU2eDg3b1JKMkZzRmhtV0FOV1FsaUdTUkxUWnNfZW5BeXc4bzVxb2FWT2szQ3FoRUVfQ2IyUUl2WTNxZw?oc=5	Rafael Nadal dá adeus ao tênis com eliminação da Espanha na Copa Davis - Globo.com	Ex-número 1 do mundo perdeu para o holandês Botic van de Zandschulp no primeiro dos três jogos que determinaram a eliminação espanhola por 2 a 1. Mundo do esporte inicia homenagens	https://s2-ge.glbimg.com/jMHkHZ0hcIeaqubvO1zRohPN4x4=/1200x/smart/filters:cover():strip_icc()/i.s3.glbimg.com/v1/AUTH_bc8228b6673f488aa253bbcb03c80ec5/internal_photos/bs/2024/o/y/AA5BwUQLq5xWxKXJ87vQ/2024-11-19t232243z-1571281011-up1ekbj1sxu03-rtrmadp-3-tennis-daviscup.jpg	2024-11-19 23:38:11	Globo.com
br	https://noticiasdatv.uol.com.br/noticia/a-fazenda/enquete-a-fazenda-16-albert-babi-gui-e-sacha-estao-na-roca-vote-128561	Enquete A Fazenda 16: Albert, Babi, Gui e Sacha estão na roça; vote - Notícias da TV	Albert Bressan, Babi Muniz, Gui Vieira e Sacha Bali estão na nona roça de A Fazenda 16. Os roceiros foram definidos na noite desta terça (19)	https://noticiasdatv.uol.com.br/media/uploads/artigos_2024/albert-babi-gui-sacha-afazenda-record.jpg	2024-11-20 03:03:00	Notícias da TV
br	https://revistaoeste.com/politica/tres-dias-depois-de-janja-xingar-elon-musk-governo-lula-firma-acordo-com-empresa-chinesa-rival-da-starlink/	Três dias depois de Janja xingar Elon Musk, governo Lula firma acordo com empresa chinesa rival da Starlink - Revista Oeste	A SpaceSail oferece internet de alta velocidade via satélites de órbita baixa	https://medias.revistaoeste.com/wp-content/uploads/2024/11/Elon-Musk-2.jpg	2024-11-20 00:35:00	Revista Oeste
br	https://www.goal.com/br/listas/ex-real-madrid-sugerido-cargo-tecnico-santos/blt2f2c4e48d9c42d90	Ex-Real Madrid é sugerido para o cargo de técnico do Santos - GOAL Brasil	Ex-lateral direito gostaria de atuar no Brasil e entende que o Peixe é uma boa oportunidade para a carreira de treinador	https://assets.goal.com/images/v3/getty-78880925/crop/MM5DEMZTGI5DCMZRGI5G433XMU5DCMBUHIYA====/GettyImages-78880925.jpg	2024-11-19 12:21:00	GOAL Brasil
br	https://www.poder360.com.br/poder-gente/internautas-resgatam-post-de-felipe-neto-nunca-recebi-1-centavo/	Felipe Neto disse em 2023 que “nunca” recebeu dinheiro do governo - Poder360	Influencer diz ser sócio minoritário de empresa de eventos, que deixou de pagar R$ 14,3 milhões em impostos com o Perse. Leia no Poder360.	https://static.poder360.com.br/2024/10/felipe-neto-livro-odio-848x477.jpg	2024-11-19 19:33:22	Poder360
br	https://noataque.com.br/futebol/brasileirao-serie-a/time/atletico-mg/noticia/2024/11/19/atletico-x-botafogo-desfalques-e-provaveis-escalacoes-pelo-brasileiro/	Atlético x Botafogo: desfalques e prováveis escalações pelo Brasileiro - No Ataque	Em prévia da final da Libertadores, Galo e Glorioso se enfrentarão nesta quarta-feira (20/11), às 21h30, pelo Brasileiro	https://noataque.com.br/wp-content/uploads/2024/11/milito-artur-atletico-botafogo.jpg	2024-11-19 17:42:11	No Ataque
br	https://news.google.com/rss/articles/CBMiugFBVV95cUxQdlJNUW0xdjJ2OElkY19BN0tNYWl3SWRraGs3cDY4b2oyZ25BdmhMZl9SMmVtVlMyMjdNVWE5MW5VemtCc0JVd3U5eVFtVi1CaHFJNFFvN2lmWnVxSlpVSUJUQWw2Ni1PQmxKZWEtR1VUV3E5a256M2Y3aFU5Z0dyWVJaRkhuUnNVSHMzOXZpcERWMG9SWk11cUM0bkxUNlh2ZjJHVXNaWXpnZzZCYjZxWjUyUmg0UHpPR3c?oc=5	Brasileirão 2024: Informações de ingressos para partidas contra Criciúma e Cuiabá - Fluminense Football Club	Brasileirão 2024: Informações de ingressos para partidas contra Criciúma e Cuiabá	https://s3.amazonaws.com/assets-fluminense/posts/12298/53928805272_1bf2aa4337_c_banner.jpg?1732051600	2024-11-19 21:27:16	Fluminense Football Club