country_code	url	title	description	image_url	publish_date	source
br	https://g1.globo.com/pop-arte/musica/noticia/2024/11/14/grammy-latino-2024-veja-os-vencedores-das-principais-categorias.ghtml	Grammy Latino 2024: Veja os brasileiros vencedores e os perdedores da premiação - G1		https://s2-g1.glbimg.com/Kfcu5AKGom5EXWuwgOExMrfkSns=/1440x0/https://i.s3.glbimg.com/v1/AUTH_59edd422c0c84a879bd37670ae4f538a/internal_photos/bs/2024/q/p/hv5ExyRzWD2BAYLsX1ag/captura-de-tela-2024-11-14-221838.png	2024-11-15 01:22:00	G1
br	https://monitordomercado.com.br/noticias/171517-festa-declarada-com-a-nova-lei-feriado-nos-dias-18-e-19-e-confirmado/	Festa declarada com a nova Lei: feriado nos dias 18 e 19 é confirmado! - Monitor do Mercado	A cidade do Rio de Janeiro se prepara para sediar a Cúpula do G20 em novembro de 2024, um evento	https://monitordomercado.com.br/wp-content/uploads/2024/07/466fa6ae-2da6-48df-b6d0-632c6bc0c7b9_resized.png	2024-11-14 22:18:55	Monitor do Mercado
br	https://oglobo.globo.com/mundo/noticia/2024/11/14/cristina-kirchner-perde-aposentadoria-vitalicia-apos-condenacao-por-corrupcao.ghtml	Cristina Kirchner perde aposentadoria vitalícia após condenação por corrupção - O Globo	Medida implicará uma poupança para o Estado de 21 milhões de pesos por mês (cerca de R$ 121 mil)	https://s2-oglobo.glbimg.com/GJT1tOxSLiTJ9qggieyLMgbrAi4=/1200x/smart/filters:cover():strip_icc()/i.s3.glbimg.com/v1/AUTH_da025474c0c44edd99332dddb09cabe8/internal_photos/bs/2024/C/y/N5V6IZTreyBIpAZJBzeQ/cristina-kirchner-afp.jpg	2024-11-14 17:37:33	O Globo
br	https://g1.globo.com/sp/sorocaba-jundiai/noticia/2024/11/14/policia-civil-cumpre-mandados-de-busca-e-apreensao-na-casa-de-suspeitos-de-enviarem-e-mails-com-ameacas-a-autoridades.ghtml	Homem é preso suspeito de ameaçar explodir prédio do Congresso Nacional; Polícia Civil cumpriu mandados no interior de SP - G1		https://s2-g1.glbimg.com/ORCK_qK_j1qNR6doONLYgNAtGiU=/1200x/smart/filters:cover():strip_icc()/i.s3.glbimg.com/v1/AUTH_59edd422c0c84a879bd37670ae4f538a/internal_photos/bs/2024/A/e/yf4JAYSxqtQOwKGmjBwg/whatsapp-image-2024-11-14-at-17.42.44.jpeg	2024-11-14 21:05:40	G1
br	https://www.nsctotal.com.br/noticias/ao-vivo-venezuela-brasil-pelas-eliminatorias-da-copa	Vini Jr. perde pênalti e Brasil fica no empate com a Venezuela pelas Eliminatórias da Copa - NSC Total	Acompanhe ao vivo o jogo entre Brasil x Venezuela na abertura da 11ª rodada das Eliminatórias da Copa do Mundo	https://img.nsctotal.com.br/wp-content/uploads/2024/11/Vini-Jr.-perde-penalti-e-Brasil-fica-no-empate-com-a-Venezuela-pelas-Eliminatorias-da-Copa.jpg	2024-11-15 00:22:20	NSC Total
br	https://www.diarioceleste.com.br/noticias-do-cruzeiro/jornalista-sugere-gabigol-cruzeiro-2025/	Jornalista faz publicação sobre Gabigol e agita torcida do Cruzeiro - Diário Celeste	A diretoria do Cruzeiro tem conversas para contratar o jogador para 2025	https://www.diarioceleste.com.br/wp-content/uploads/2024/11/vene-casagrande-faz-publicacao-sobre-gabigol-e-cruzeiro.jpg	2024-11-14 22:42:00	Diário Celeste
br	https://www.nsctotal.com.br/noticias/veja-os-numeros-sorteados-no-concurso-3245-da-lotofacil-com-premio-de-r-17-milhao	Veja os números sorteados no concurso 3245 da Lotofácil, com prêmio de R$ 1,7 milhão - NSC Total	A Caixa Econômica Federal sorteia nesta quinta-feira (14) o concurso 3245 da Lotofácil. O prêmio para quem acertar as 15 dezenas sorteadas é de R$ 1,7	https://img.nsctotal.com.br/wp-content/uploads/2024/11/Lotofacil.jpg	2024-11-14 22:43:56	NSC Total
br	https://oglobo.globo.com/economia/noticia/2024/11/14/campos-neto-diz-pec-da-escala-6x1-e-prejudicial-ao-trabalhador-e-que-brasil-nao-pode-ter-cultura-antiempresario.ghtml	Campos Neto diz que fim da escala 6x1 é prejudicial ao trabalhador: 'Brasil não pode ter cultura antiempresário' - O Globo	Para o presidente do Banco Central, proposta que reduz jornada semanal vai aumentar o custo do trabalho, gerar informalidade e reduzir produtividade	https://s2-oglobo.glbimg.com/G8F7J6qR_HIaAUCgCOvJ1Ko4cGA=/1200x/smart/filters:cover():strip_icc()/i.s3.glbimg.com/v1/AUTH_da025474c0c44edd99332dddb09cabe8/internal_photos/bs/2024/P/o/DYMfGBSAOFCj6BA299Ww/108195026-sp-eco-sao-paulo-sp-19-08-2024-entrevista-com-roberto-campos-neto-presidente.jpg	2024-11-14 18:43:28	O Globo
br	https://revistaoeste.com/brasil/assassinato-de-delator-do-pcc-pericia-mostra-que-municoes-sao-de-armas-encontradas-no-dia-seguinte/	Assassinato de delator do PCC: perícia mostra que munições são de armas encontradas no dia seguinte - Revista Oeste	O crime, ocorrido na tarde da sexta-feira 8, resultou na morte de Antonio Vinicius Lopes Gritzbach	https://medias.revistaoeste.com/wp-content/uploads/2024/11/Guarulhos.jpg	2024-11-14 22:34:51	Revista Oeste
br	https://www.poder360.com.br/poder-gente/caso-homem-bomba-cria-campanha-contra-anistia-pelo-8-de-janeiro/	Caso homem-bomba cria campanha contra anistia pelo 8 de Janeiro - Poder360	Internautas também fizeram memes sobre os bolsonaristas pró-anistia envolvidos nos atentados e o ataque ao STF. Leia no Poder360.	https://static.poder360.com.br/2024/11/craque-do-jogo-1-848x477.jpg	2024-11-14 21:29:23	Poder360
br	https://www.em.com.br/politica/2024/11/6988809-governo-zema-nega-que-privatizacao-da-cemig-repetira-crise-de-sao-paulo.html	Governo Zema nega que privatização da Cemig repetirá crise de São Paulo - Estado de Minas	Mateus Simões afirmou que as propostas de privatização das estatais mantém governança do Executivo estadual	https://midias.correiobraziliense.com.br/_midias/jpg/2024/05/27/675x450/1_jair_amaralemd_a_press-37462658.jpg?20240912143325?20240912143325	2024-11-14 19:43:00	Estado de Minas
br	https://www.poder360.com.br/poder-governo/janja-critica-governo-da-argentina-durante-abertura-do-g20-social/	Janja critica governo da Argentina durante abertura do G20 Social - Poder360	Primeira-dama disse que país se recusou a assinar resolução do grupo de trabalho pela igualdade de gênero. Leia no Poder360.	https://static.poder360.com.br/2024/11/janja-g20-social-14nov2024-848x477.jpg	2024-11-14 22:38:29	Poder360
br	https://www.gov.br/inep/pt-br/assuntos/noticias/enem/enem-2024-mec-e-inep-divulgam-gabaritos-e-cadernos-de-questoes	Enem 2024: MEC e Inep divulgam gabaritos e Cadernos de Questões - Instituto Nacional de Tecnologia da Informação - ITI	Material está disponível no portal do Instituto. Divulgação, prevista para 20 de novembro, foi antecipada; Resultados finais serão publicados em janeiro de 2025	https://www.gov.br/inep/pt-br/assuntos/noticias/enem/enem-2024-mec-e-inep-divulgam-gabaritos-e-cadernos-de-questoes/cabecalho-enem-2024-1.jpg/@@images/eb7dbeef-1a7d-48aa-aa6d-d5b719256297.jpeg	2024-11-14 11:55:16	Instituto Nacional de Tecnologia da Informação - ITI
br	https://www.poder360.com.br/poder-governo/bolsonaro-zoa-janja-por-pronunciar-inresponsavel-e-ploblemas/	Bolsonaro zoa Janja por pronunciar "inresponsável" e "ploblemas" - Poder360	Primeira-dama cometeu erro de pronúncia ao falar sobre riscos do uso do avião presidencial; Bolsonaro fez piada com o erro. Leia no Poder360	https://static.poder360.com.br/2023/12/bolsonaro-natal-planalto-dez-2021-848x477.jpg	2024-11-14 16:12:30	Poder360
br	https://www.gov.br/mds/pt-br/noticias-e-conteudos/desenvolvimento-social/noticias-desenvolvimento-social/mds-unifica-pagamento-do-bolsa-familia-para-711-municipios-em-novembro	MDS unifica pagamento do Bolsa Família para 711 municípios em novembro - Instituto Nacional de Tecnologia da Informação - ITI	Nesta quinta-feira (14.11), mais de 2,6 milhões de famílias em cidades que tiveram situação de emergência ou estado calamidade pública decretado poderão movimentar o benefício recebido	https://www.gov.br/mds/pt-br/noticias-e-conteudos/desenvolvimento-social/noticias-desenvolvimento-social/mds-unifica-pagamento-do-bolsa-familia-para-711-municipios-em-novembro/ag_br.jpeg/@@images/0f8e12eb-bc69-448e-95d3-1bc5e93c1b42.jpeg	2024-11-14 04:40:52	Instituto Nacional de Tecnologia da Informação - ITI
br	https://www.bbc.com/portuguese/articles/cvg48zpzl7do	15 de novembro, Proclamação da República: por que historiadores concordam que monarquia sofreu um 'golpe' - BBC News Brasil	Quase um século e meio depois, tema ainda suscita debates; primeiras críticas apareceram meses após Marechal Deodoro da Fonseca proclamar a República.	https://ichef.bbci.co.uk/news/1024/branded_portuguese/7d56/live/418eef30-a204-11ef-8ab9-9192db313061.jpg	2024-11-14 10:27:55	BBC News Brasil
br	https://noataque.com.br/lutas/noticia/2024/11/14/tyson-x-paul-onde-assistir-a-luta-de-boxe-horario-e-card-completo/	Tyson x Paul: onde assistir à luta de boxe, horário e card completo - No Ataque	Mike e Paul finalmente se enfrentarão na luta de boxe mais aguardada do ano. O duelo será nesta sexta-feira (15/11)	https://noataque.com.br/wp-content/uploads/2024/06/Tyson-Paul.jpg	2024-11-14 17:15:56	No Ataque
br	https://noataque.com.br/futebol/copa-do-brasil/time/atletico-mg/noticia/2024/11/14/responsavel-por-arremessar-bomba-em-fotografo-e-identificado-diz-vice-governador-de-mg/	Responsável por arremessar bomba em fotógrafo é identificado, diz vice-governador de MG - No Ataque	Vice-governador de Minas Gerais, Mateus Simões (NOVO) falou sobre os incidentes na Arena MRV durante a final da Copa do Brasil entre Atlético e Flamengo	https://noataque.com.br/wp-content/uploads/2024/11/fotografo-arenamrv.jpg	2024-11-14 22:13:37	No Ataque
br	https://www.infomoney.com.br/mercados/nubank-roxo34-acoes-despencam-cerca-de-10-apos-balanco-e-corte-de-recomendacao/	Nubank: ações fecham em queda de 2,9% na NYSE após balanço e corte de recomendação - InfoMoney	Itaú BBA considera que nome pode apresentar bons dados no longo prazo mas que desaceleração de receita assusta no momento	https://www.infomoney.com.br/wp-content/uploads/2021/12/ipo-nubank-nyse-nubr33-e1639073832869.jpg?quality=70	2024-11-14 21:54:14	InfoMoney
br	https://www.espn.com.br/futebol/artigo/_/id/14443363/portuguesa-saf-investimento-milionario-serie-a-cinco-anos-modelo-palmeiras	Investimento milionário em SAF, Série A em até cinco anos e 'modelo' Palmeiras: como será a 'nova' Portuguesa - ESPN.com.br	ESPN traz detalhes de como deverá ser o projeto da SAF da Portuguesa	https://a4.espncdn.com/combiner/i?img=%2Fphoto%2F2024%2F1114%2Fr1414725_1296x729_16%2D9.jpg	2024-11-14 16:03:00	ESPN.com.br
br	https://valor.globo.com/brasil/noticia/2024/11/14/ibc-br-previa-do-pib-sobe-08percent-em-setembro-acima-das-expectativas.ghtml	IBC-Br, 'prévia do PIB', sobe 0,84% em setembro, acima das expectativas - Valor Econômico	O indicador do BC, de frequência mensal, permite acompanhamento mais frequente da evolução da atividade econômica	https://s2-valor.glbimg.com/TkFDTEiXQVwdD1pcuLwbUFxToro=/1200x/smart/filters:cover():strip_icc()/i.s3.glbimg.com/v1/AUTH_63b422c2caee4269b8b34177e8876b93/internal_photos/bs/2020/Y/r/vFxLtaRLG03PiFn35G4w/bill-oxford-fgqsewtsjy-unsplash.jpg	2024-11-14 12:31:23	Valor Econômico
br	https://www.poder360.com.br/brasil/pontes-e-alvo-de-criticas-por-chamar-explosoes-de-terrorismo/	Marcos Pontes é criticado por chamar explosões de "terrorismo" - Poder360	Próximo de Jair Bolsonaro, o advogado Fábio Wajngarten afirmou ser preciso encontrar o cérebro de Marcos Pontes no espaço. Leia no Poder360.	https://static.poder360.com.br/2022/08/MarcosPontes-Astronauta-Candidato-Senado-35-848x477.jpg	2024-11-14 20:09:38	Poder360
br	https://www.cartacapital.com.br/politica/stf-rejeita-recurso-e-mantem-pena-de-prisao-contra-collor/	STF rejeita recurso e mantém pena de prisão contra Collor – Política - CartaCapital	Ex-presidente recorreu de condenação em uma tentativa de evitar o regime fechado	https://www.cartacapital.com.br/wp-content/uploads/2024/11/1081460-df_img_1170.jpg	2024-11-14 19:39:00	CartaCapital
br	https://oglobo.globo.com/mundo/noticia/2024/11/14/abertura-do-g20-social-e-marcada-por-atrasos-e-confusao-na-entrada.ghtml	Abertura do G20 social é marcada por atrasos e confusão na entrada - O Globo	Representantes da sociedade civil foram barrados e houve bate-boca com membros da organização; profissionais da imprensa, mesmo credenciados, tiveram passagem impedida	https://s2-oglobo.glbimg.com/3f7CUitaXGlkZkU83CI-Uhd1yuY=/1200x/smart/filters:cover():strip_icc()/i.s3.glbimg.com/v1/AUTH_da025474c0c44edd99332dddb09cabe8/internal_photos/bs/2024/e/B/b0byvMTjCefzv9lzT37w/whatsapp-image-2024-11-14-at-15.43.35.jpeg	2024-11-14 18:11:13	O Globo
br	https://oantagonista.com.br/mundo/crusoe-trump-vai-inaugurar-os-estados-unidos-da-florida/	Crusoé: Trump vai inaugurar os Estados Unidos da Flórida - O Antagonista	None	None	2024-11-14 20:26:12	O Antagonista
br	https://www.infomoney.com.br/business/justica-absolve-samarco-pelo-rompimento-da-barragem-de-mariana-mg/	Justiça absolve Samarco pelo rompimento da barragem de Mariana (MG) - InfoMoney	Rompimento da barragem causou a destruição dos distritos de Bento Rodrigues e Paracatu de Baixo, resultando na morte de 19 pessoas e na devastação de comunidades inteiras	https://www.infomoney.com.br/wp-content/uploads/2024/08/tragedia-mariana-vale.jpg?quality=70	2024-11-14 16:51:05	InfoMoney
br	https://www.meutimao.com.br/noticias-do-corinthians/492909/atacante-do-corinthians-participa-em-vitoria-de-virada-sobre-a-argentina-veja-como-foi	Atacante do Corinthians participa em vitória de virada sobre a Argentina; veja como foi - Meu Timão	As Eliminatórias Sul-Americanas para a Copa do Mundo de 2026 contaram com surpresas nesta quinta-feira. A vitória do Paraguai sobre a Argentina, por 2 a 1, teve a participação de Ángel Romero.	https://cdn.meutimao.com.br/_upload/noticia/2024/11/14/romerou-entrou-aos-27-minutos-do-segundo-tempo-bi941w.jpg	2024-11-15 01:34:00	Meu Timão
br	https://www.itatiaia.com.br/entretenimento/2024/11/14/viih-tube-segue-na-uti-e-sem-previsao-de-alta-veja-novo-boletim-medico	Viih Tube segue na UTI e sem previsão de alta; veja novo boletim médico - Itatiaia	Viih Tube foi hospitalizada três dias após nascimento do segundo filho	https://medias.itatiaia.com.br/dims4/default/445f0e4/2147483647/strip/true/crop/1290x677+0+349/resize/1200x630!/format/webp/quality/90/?url=https%3A%2F%2Fk2-prod-radio-itatiaia.s3.us-east-1.amazonaws.com%2Fbrightspot%2Fb3%2F27%2Fa5db86e74e02b4942219a26e01a6%2Fviih-tube-eliezer.jpg	2024-11-15 01:16:00	Itatiaia
br	https://noticiasdatv.uol.com.br/noticia/a-fazenda/a-fazenda-16-enquete-revela-qual-peoa-sera-eliminada-do-reality-hoje-128339	A Fazenda 16: Enquete revela qual peoa será eliminada do reality hoje - Notícias da TV	Gizelly Bicalho deve ser eliminada de A Fazenda 16 na noite desta quinta-feira (14). A advogada enfrenta Flora Cruz e Vanessa Carvalho na berlinda	https://noticiasdatv.uol.com.br/media/uploads/artigos_2024/-flora-gizelly-vanessa-record-afazenda.jpg	2024-11-14 23:15:00	Notícias da TV
br	https://gauchazh.clicrbs.com.br/cultura-e-lazer/musica/noticia/2024/11/linkin-park-anuncia-show-em-porto-alegre-cm3hbj7r3000y01edk57wsg3s.html	Linkin Park anuncia shows no Brasil, incluindo Porto Alegre - GZH	Porto Alegre será última parada da From Zero World Tour em 2025. Antes, o grupo passará por outras três cidades brasileiras.	https://www.rbsdirect.com.br/filestore/6/0/6/5/6/0/5_6fe4ac526375af3/5065606_4095a5cdd280cab.jpg?w=1200&h=630&a=c&version=1575255600	2024-11-14 19:40:31	GZH
br	https://extra.globo.com/economia/noticia/2024/11/mega-sena-nao-tem-ganhadores-e-premio-vai-para-r-85-milhoes.ghtml	Mega-Sena não tem ganhadores, e prêmio vai para R$ 8,5 milhões - Extra	Quina teve 44 apostas ganhadoras, e cada uma vai receber R$ 50.046,40	https://s2-extra.glbimg.com/xfydWeRgtOTtaQZRUpz1MxGZl_E=/1200x/smart/filters:cover():strip_icc()/i.s3.glbimg.com/v1/AUTH_1f551ea7087a47f39ead75f64041559a/internal_photos/bs/2023/c/Z/EYI4NqQNuyVfgEyARtDg/mega-sena3.jpg	2024-11-14 10:21:58	Extra