country_code	url	title	description	image_url	publish_date	source
br	https://www.gazetadopovo.com.br/republica/pgr-pf-encontrou-ligacao-aliados-bolsonaro-atos-8-janeiro/	PGR diz à PF que encontrou ligação entre aliados de Bolsonaro e atos de 8/1 - Gazeta do Povo	Gonet afirma que há elementos que indicam a atuação de aliados de Bolsonaro para a "eclosão dos atos depredatórios" de 8/1. Leia na Gazeta do Povo.	https://media.gazetadopovo.com.br/2024/10/17151913/brasilia-protestos-foto-joedson-alves-agencia-brasil-660x372.jpg	2024-10-18 17:44:00	Gazeta do Povo
br	https://g1.globo.com/sp/sao-paulo/eleicoes/2024/noticia/2024/10/19/o-que-dizem-os-planos-de-nunes-e-boulos-sobre-crise-climatica-e-meio-ambiente-prefeito-nao-cita-podas-e-deputado-e-generico.ghtml	O que dizem os planos de Nunes e Boulos sobre crise climática e meio ambiente: prefeito não cita podas, e deputado é genérico - G1	Cidade de São Paulo sofreu com as consequências das mudanças climáticas nos últimos dias, e o assunto ficou no centro do debate. Confira propostas dos dois candidatos que se enfrentam no segundo turno das eleições municipais.	https://s2-g1.glbimg.com/1S0DnEQyAk2_VR84jD2tWhwlFs8=/1200x/smart/filters:cover():strip_icc()/i.s3.glbimg.com/v1/AUTH_59edd422c0c84a879bd37670ae4f538a/internal_photos/bs/2024/A/p/6uYdbiRyWcQKWcSsbhGQ/1729180529129979.jpg	2024-10-19 09:00:25	G1
br	https://metsul.com/veja-a-previsao-do-tempo-para-o-fim-de-semana-do-ultimo-grenal-do-ano/	Veja a previsão do tempo para o fim de semana do último Grenal do ano - MetSul.com	Confira a previsão do tempo detalhada da MetSul Meteorologia para este fim de semana de Grenal no Rio Grande do Sul.	https://metsul.com/wp-content/uploads/2024/10/tempo1910.jpg	2024-10-19 10:05:32	MetSul.com
br	https://www.poder360.com.br/poder-congresso/lira-critica-propostas-que-proibem-uso-do-bolsa-familia-em-apostas/	Lira critica propostas que proíbem uso do Bolsa Família em apostas - Poder360	Arthur Lira, não vê eficiência em vetar o benefício para jogos, mas em endurecer regras de propagandas. Leia no Poder360.	https://static.poder360.com.br/2024/09/Turismo-Lula-ArthurLira-CelsoSabino-SilvioCostaFilho-Tamareira-41-848x477.jpg	2024-10-19 09:02:07	Poder360
br	https://g1.globo.com/politica/noticia/2024/10/19/repatriacao-6o-voo-chega-ao-brasil-com-212-passageiros-e-um-pet.ghtml	Brasil já repatriou 1,3 mil que estavam no Líbano; sexto voo chegou neste sábado - G1	Ao todo, governo estima que 3 mil brasileiros queiram deixar o país em razão do conflito entre Israel e o Hezbollah. Mais de 1,3 mil cidadãos já foram repatriados.	https://s2-g1.glbimg.com/55QMekPpKKsMolpevHnnS39RlNo=/1200x/smart/filters:cover():strip_icc()/i.s3.glbimg.com/v1/AUTH_59edd422c0c84a879bd37670ae4f538a/internal_photos/bs/2024/P/b/QXWBE3TbKzPM2t9xJ49g/captura-de-tela-2024-10-01-145012.png	2024-10-19 10:51:38	G1
br	https://veja.abril.com.br/coluna/matheus-leitao/frase-do-dia-2405	Vladimir Putin: Frase do dia - VEJA	Vladimir Putin	https://veja.abril.com.br/wp-content/uploads/2024/03/GettyImages-2084805514.jpg?quality=70&strip=info&crop=1&resize=1080,565	2024-10-19 10:00:41	VEJA
br	https://www.cartacapital.com.br/politica/stf-rejeita-pedido-de-bolsonaro-para-encerrar-inquerito-sobre-vazamento-de-dados-sigilosos/	STF rejeita pedido de Bolsonaro para encerrar inquérito sobre vazamento de dados sigilosos - CartaCapital	O caso entrou em julgamento na Primeira Turma. Prevaleceu o voto do ministro Alexandre de Moraes	https://www.cartacapital.com.br/wp-content/uploads/2024/05/bolsonaroemoraes.png	2024-10-18 20:36:00	CartaCapital
br	https://oglobo.globo.com/mundo/noticia/2024/10/19/israel-lanca-folhetos-sobre-gaza-mostrando-com-fotos-do-corpo-de-sinwar-hamas-nao-governara-mais.ghtml	Israel lança folhetos sobre Gaza com fotos do corpo de Sinwar: 'Hamas não governará mais' - O Globo	Após morte de líder do grupo terrorista,  aiatolá Ali Khamenei afirma que 'Hamas está vivo e continuará vivo'	https://s2-oglobo.glbimg.com/Zl2LjiyymfulAizn05OaClHGDwY=/1200x/smart/filters:cover():strip_icc()/i.s3.glbimg.com/v1/AUTH_da025474c0c44edd99332dddb09cabe8/internal_photos/bs/2024/E/n/0AO8EKQzmUqqssiBStsw/628926.jpeg	2024-10-19 14:14:10	O Globo
br	https://www.metropoles.com/colunas/guilherme-amado/ministra-manda-investigar-uso-do-ministerio-na-defesa-de-silvio-almeida	Ministra manda investigar uso do ministério na defesa de Silvio Almeida - Metrópoles	Ministério apura uso dos canais oficiais para defender então ministro Silvio Almeida, acusado de assédio sexual	https://uploads.metroimg.com/wp-content/uploads/2024/09/06085101/Silvio-Almeida-4-1.jpg	2024-10-19 08:30:29	Metrópoles
br	https://www.metropoles.com/colunas/igor-gadelha/os-favoritos-para-a-presidencia-da-camara-no-grupo-de-zap-do-pt	Os favoritos para a presidência da Câmara no grupo de "zap" do PT - Metrópoles	Presidência da Câmara foi um dos assuntos mais comentados no grupo de WhatsApp dos deputados federais petistas nos últimos dias	https://uploads.metroimg.com/wp-content/uploads/2024/10/18163135/bancada-pt.jpg	2024-10-19 08:00:06	Metrópoles
br	https://noticias.uol.com.br/eleicoes/2024/10/19/datafolha-mostra-recuperacao-de-boulos-entre-eleitores-de-marcal-pos-apagao.htm	Datafolha mostra recuperação de Boulos entre eleitores de Marçal pós-apagão - UOL Confere	A nova pesquisa do Datafolha, divulgada nesta quinta-feira (17), mostrou Guilherme Boulos (PSOL) ganhando espaço entre os eleitores de Pablo Marçal (PRTB). O levantamento foi o primeiro feito pelo instituto após o apagão que atingiu a capital paulista 	https://conteudo.imguol.com.br/c/noticias/48/2024/08/28/pablo-marcal-prtb-e-guilherme-boulos-psol-empatam-tecnicamente-em-pesquisa-da-futura-inteligencia-divulgada-nesta-quarta-28-1724857395672_v2_615x300.png	2024-10-19 08:30:00	UOL Confere
br	https://www.gazetadopovo.com.br/mundo/drone-lancado-contra-a-casa-de-netanyahu-no-norte-de-israel-diz-porta-voz/	Ataque de drone na casa de Benjamin Netanyahu - Gazeta do Povo	Ataque de drone na casa de Benjamin Netanyahu. Um drone lançado do Líbano atingiu a casa de veraneio de Benjamin Netanyahu em Cesareia, Israel, dois dias após a morte do líder do Hamas, Yahya Sinwar. Embora sem vítimas, o ataque intensifica as tensões com o Hezbollah. Netanyahu afirma que 'nada irá nos deter'.	https://media.gazetadopovo.com.br/2024/10/06105131/Benjamin-Netanyahu-rejeita-criticas-de-macron-sobre-fornecimento-de-armas-a-israel-660x372.jpg	2024-10-19 12:28:00	Gazeta do Povo
br	https://www.poder360.com.br/poder-economia/lula-nao-tem-como-simplesmente-acabar-com-apostas-diz-advogado/	Lula não tem como simplesmente acabar com apostas, diz advogado - Poder360	Luiz Felipe Attié afirma que fala do presidente sobre o tema foi mais uma “pressão” para que bets sigam regulamentação. Leia no Poder360.	None	2024-10-19 11:01:11	Poder360
br	https://g1.globo.com/sp/sao-paulo/noticia/2024/10/19/ao-menos-quatro-bairros-ficam-sem-energia-apos-chuva-fraca-em-sp.ghtml	Após chuva moderada, Grande SP registra queda de energia em mais de 100 mil imóveis, segundo a Enel - G1	Somente na capital, quatro bairros ficaram no escuro: Pinheiros, Vila Andrade, Jabaquara e Santo Amaro	https://s2-g1.glbimg.com/xdaUlsNijocb9mMD_M0LgRRFt94=/1200x/smart/filters:cover():strip_icc()/i.s3.glbimg.com/v1/AUTH_59edd422c0c84a879bd37670ae4f538a/internal_photos/bs/2024/G/l/g5rFB9SGmsDBwLh4xaOw/whatsapp-image-2024-10-16-at-08.31.48.jpeg	2024-10-19 16:48:34	G1
br	https://www.cartacapital.com.br/politica/governador-da-bahia-decreta-tres-dias-de-luto-apos-massacre-em-escola/	Governador da Bahia decreta três dias de luto após massacre em escola – Política - CartaCapital	Aluno matou três colegas em escola no norte do estado	https://www.cartacapital.com.br/wp-content/uploads/2024/10/54072919192_ad3a875e2b_h.jpg	2024-10-19 14:32:00	CartaCapital
br	https://www.poder360.com.br/poder-gente/cantora-que-fez-danca-erotica-quer-ser-ministra-da-educacao/	Cantora que fez dança erótica quer ser ministra da Educação - Poder360	Tertuliana Lustosa viralizou depois de se apresentar em cima de uma cadeira na Universidade Federal do Maranhão. Leia no Poder360.	None	2024-10-19 12:23:38	Poder360
br	https://oglobo.globo.com/brasil/noticia/2024/10/19/foto-de-lucas-bove-com-ex-jovem-pan-teria-causado-briga-com-influenciadora-cintia-chagas-diz-site.ghtml	Foto de Lucas Bove com ex-Jovem Pan teria causado briga com influenciadora Cintia Chagas, diz site - O Globo	Deputado estadual está sendo acusado pela ex-esposa, a influenciadora Cíntia Chagas, de agressão física e ameaças	https://s2-oglobo.glbimg.com/y21tgIDVvpww_wi3rtQkkC5KurU=/1200x/smart/filters:cover():strip_icc()/i.s3.glbimg.com/v1/AUTH_da025474c0c44edd99332dddb09cabe8/internal_photos/bs/2024/v/6/I11fO6SSSX2DM6IB03Xg/cintia.jpg	2024-10-19 12:48:51	O Globo
br	https://revistaoeste.com/politica/o-que-esta-em-jogo-na-disputa-pela-prefeitura-de-natal-rn/	O que está em jogo na disputa pela Prefeitura de Natal (RN) - Revista Oeste	Paulinho Freire, apoiado por Bolsonaro, e Natália Bonavides, respaldada por Lula, competem no segundo turno na capital do Rio Grande do Norte	https://medias.revistaoeste.com/wp-content/uploads/2024/10/Design-sem-nome-2-1-e1729276514805.jpg	2024-10-19 10:31:00	Revista Oeste
br	https://oglobo.globo.com/esportes/noticia/2024/10/19/surfista-italiana-morre-apos-ataque-de-peixe-espada-na-indonesia.ghtml	Surfista italiana morre após ataque de peixe-espada, em Mentawai, na Indonésia - O Globo	Giulia Manfrini, de 36 anos, também era influenciadora; ela foi socorrida, mas não resistiu aos ferimentos	https://s2-oglobo.glbimg.com/3YR0l3PQKTIbe4tT6NHQ1P0CL_Y=/1200x/smart/filters:cover():strip_icc()/i.s3.glbimg.com/v1/AUTH_da025474c0c44edd99332dddb09cabe8/internal_photos/bs/2024/t/d/PdbBDaT4Ka0umodpKXYg/fotojet-18-.jpg	2024-10-19 17:35:36	O Globo
br	https://noticias.uol.com.br/colunas/a-hora/2024/10/19/a-conspiracao-que-impediu-sao-paulo-de-enterrar-seus-fios.htm	A Hora: A 'conspiração' que impediu São Paulo de enterrar seus fios - UOL Confere	O emaranhado de fios sobre São Paulo é um retrato da voracidade de um mercado desregulamentado e sem supervisão. São, na maioria, fibras ópticas de dezenas de telecoms diferentes que pagam aluguel à dona dos postes, a Enel, para pendurar neles a maçaro	https://conteudo.imguol.com.br/c/noticias/62/2024/01/15/enel-1705353598366_v2_615x300.jpg	2024-10-19 12:30:00	UOL Confere
br	https://olhardigital.com.br/2024/10/19/ciencia-e-espaco/terra-ultrapassa-quase-7-de-9-limites-planetarios-e-corre-risco-de-catastrofes-irreversiveis/	Terra ultrapassa quase 7 de 9 limites planetários e corre risco de catástrofes irreversíveis - Olhar Digital	Novo estudo, feito pelo Instituto Potsdam para Pesquisa sobre o Impacto Climático, alerta para impacto na estabilidade do meio ambiente	https://olhardigital.com.br/wp-content/uploads/2024/10/recife-de-corais-scaled.jpg	2024-10-19 14:09:00	Olhar Digital
br	https://g1.globo.com/rj/rio-de-janeiro/noticia/2024/10/19/policia-civil-investigacao-sobre-orgaos-transplantados-com-hiv.ghtml	Polícia Civil conclui primeira parte da investigação sobre órgãos transplantados com HIV; saiba o que dizem os depoimentos - G1	Justiça manteve a prisão temporária dos 4 funcionários do laboratório PCS Saleme.	https://s2-g1.glbimg.com/SRk4k_qCr8JHGXn0LJnrq-NXc74=/1200x/smart/filters:cover():strip_icc()/s01.video.glbimg.com/x720/13026068.jpg	2024-10-19 09:59:40	G1
br	https://oglobo.globo.com/rio/noticia/2024/10/18/minha-filha-foi-levar-a-estela-no-medico-e-voltou-carregando-ela-nos-bracos-desmaiada-e-sangrando-diz-avo-de-menina-de-3-anos-baleada-na-cabeca.ghtml	'Minha filha foi levar a Estela no médico e voltou carregando ela nos braços, desmaiada e sangrando', diz avó de menina de 3 anos baleada na cabeça - O Globo	A dona de casa Walkiria Alves, avó da menina Estela de Oliveira Ferreira, de 3 anos, diz a criança foi baleada na cabeça ao sair de casa com os pais	https://s2-oglobo.glbimg.com/sMyCVDKOOOrJJDHrJpMykg_ptBM=/1200x/smart/filters:cover():strip_icc()/i.s3.glbimg.com/v1/AUTH_da025474c0c44edd99332dddb09cabe8/internal_photos/bs/2024/D/K/wvV7s5RhaaUw4gVIVO0w/whatsapp-image-2024-10-18-at-15.42.33.jpeg	2024-10-18 18:54:04	O Globo
br	https://metsul.com/onde-vai-ter-chuva-com-temporais-isolados-neste-fim-de-semana/	Onde vai ter chuva com temporais isolados neste fim de semana - MetSul.com	Leia boletim da MetSul Meteorologia com as áreas do Brasil que mais devem ter chuva e risco de temporais isolados neste fim de semana.	https://metsul.com/wp-content/uploads/2024/10/brasil1910b.jpg	2024-10-19 13:01:47	MetSul.com
br	https://g1.globo.com/rs/rio-grande-do-sul/noticia/2024/10/19/gemeas-igrejinha-veja-o-que-se-sabe.ghtml	'A única coisa que eu dei para elas foi amor', diz pai de gêmeas que morreram em intervalo de oito dias no RS; veja o que se sabe - G1	Manuela Pereira, de seis anos, morreu no dia 7 de outubro, em Igrejinha. Já a irmã, Antônia, morreu no dia 15. Mãe das gêmeas está presa temporariamente suspeita de duplo homicídio. Pai, que não é investigado, prestou depoimento à polícia.	https://s2-g1.glbimg.com/UhaXeuJfVS_k7A1oIswQDUvdR5Y=/1200x/smart/filters:cover():strip_icc()/i.s3.glbimg.com/v1/AUTH_59edd422c0c84a879bd37670ae4f538a/internal_photos/bs/2024/P/i/5BhxviSAO6ahqxoCCWwA/gemeas.png	2024-10-19 07:00:25	G1
br	https://g1.globo.com/rj/rio-de-janeiro/noticia/2024/10/19/video-bandidos-armados-muzema-na-zona-oeste-do-rio.ghtml	VÍDEO: dezenas de milicianos armados com fuzis e pistolas tentam invadir a Muzema, na Zona Oeste do Rio - G1	Região, que já foi dominada pela milícia, é atualmente controlada pelo Comando Vermelho. 	https://s2-g1.glbimg.com/0VS6F-fgm4viFwkdOhYv3PaDruQ=/1200x/smart/filters:cover():strip_icc()/s03.video.glbimg.com/x720/13026910.jpg	2024-10-19 14:19:32	G1
br	https://www.terra.com.br/noticias/eleicoes/boulos-cancela-caminhada-com-lula-em-sao-paulo-devido-a-chuva,20ab94029a1eaa07f4d9c1ee0c75f13fmzcyu80p.html	Boulos cancela caminhada com Lula em São Paulo devido à chuva - Terra	Evento estava marcado para acontecer nesta manhã, mas foi impedido pelo mau tempo	https://p2.trrsf.com/image/fget/cf/1200/630/middle/images.terra.com/2024/10/19/caminhada-boulos-rhoe7knfs4dv.jpg	2024-10-19 14:12:00	Terra
br	https://www.canalrural.com.br/tempo/tempestade-que-acertaria-sao-paulo-em-cheio-e-deslocada-para-outros-dois-estados/	Tempestade que acertaria São Paulo em cheio é deslocada para outros dois estados - Canal Rural	Tempestade perdeu força na madrugada de sexta para sábado, sem gerar transtornos para o estado, qe sofreu um apagão no dia 11 de outubro	https://imagens-cdn.canalrural.com.br/wp-content/uploads/previsao-do-tempo-alerta-para-tempestade-e-ventania-temporais-chuva.jpg	2024-10-19 15:40:41	Canal Rural
br	https://g1.globo.com/sc/santa-catarina/noticia/2024/10/19/incendios-criminosos-bloqueiam-vias-grande-florianopolis-investiga.ghtml	Incêndios criminosos bloqueiam vias na Grande Florianópolis; casos são investigados - G1	Governo confirmou sete prisões, dois foragidos e um óbito de suspeito em confronto com policiais. As ações, segundo o Executivo, foram coordenadas por uma facção criminosa.	https://s2-g1.glbimg.com/VmaBzVptqjhyC4QX6jftJVXLvhU=/1200x/smart/filters:cover():strip_icc()/s04.video.glbimg.com/x720/13027903.jpg	2024-10-19 18:13:10	G1
br	https://istoedinheiro.com.br/coreia-do-norte-enviara-12-mil-soldados-para-ucrania-diz-seul/	Coreia do Norte enviará 12 mil soldados para Ucrânia, diz Seul - Istoé Dinheiro	Segundo agência de inteligência da Coreia do Sul, militares vão lutar ao lado da Rússia. Primeiro batalhão norte-coreano já está sendo treinado em território russo.A Coreia do Norte decidiu enviar 12 mil soldados do...	https://istoedinheiro.com.br/wp-content/uploads/sites/17/2024/10/70532288_303.jpg	2024-10-18 13:52:00	Istoé Dinheiro
br	https://oglobo.globo.com/rio/noticia/2024/10/19/servidores-sao-retirados-de-protesto-em-frente-ao-hospital-federal-de-bonsucesso-para-nova-direcao-assumir.ghtml	Servidores são retirados de protesto em frente ao Hospital Federal de Bonsucesso para nova direção assumir - O Globo	Manifestantes se posicionaram contra mudança e estiveram na porta da unidade por cinco dias; policiais foram acionados	https://s2-oglobo.glbimg.com/Cbxq-qPOIt6ko_fjLn2SPwtEefE=/1200x/smart/filters:cover():strip_icc()/i.s3.glbimg.com/v1/AUTH_da025474c0c44edd99332dddb09cabe8/internal_photos/bs/2024/4/Y/l2onHRSbWg1akOfSA9lw/hfb.jpeg	2024-10-19 12:15:14	O Globo
br	https://revistaoeste.com/economia/os-detalhes-da-bilionaria-proposta-de-acordo-da-vale-pelo-desastre-em-mariana/	Os detalhes da bilionária proposta de acordo da Vale pelo desastre em Mariana - Revista Oeste	A empresa informou que as discussões envolvem um valor de cerca de R$ 170 bilhões	https://medias.revistaoeste.com/wp-content/uploads/2024/10/Mariana.jpg	2024-10-19 12:28:00	Revista Oeste
br	https://jovempan.com.br/noticias/mundo/israel-diz-ter-destruido-centro-de-comando-do-hezbollah-no-sul-do-libano.html	Israel diz ter destruído centro de comando do Hezbollah no sul do Líbano - Jovem Pan	Neste sábado (19), Estado judeu detectou a chegada de cerca de 180 projéteis disparados, que causaram a morte de um homem de 50 anos na cidade israelense de Acre	https://jpimg.com.br/uploads/2024/10/1d8efd4f182d83ce53a2bda44e350838d92c9ccc.jpg	2024-10-19 14:12:04	Jovem Pan
br	https://noticias.uol.com.br/colunas/carlos-madeiro/2024/10/19/disputa-posse-jericoacara-ceara.htm	Carlos Madeiro: Dona de 80% de Jeri (CE) surge após 40 anos, pede terras e retoma 49 mil m² - UOL Confere	Um dos destinos mais badalados e visitados do Nordeste, Jericoacoara é alvo de uma polêmica. Após 40 anos, uma empresária procurou o estado para alegar que terrenos que somam 7,1 milhões de m², equivalente a 80% da área onde está a vila —com suas	https://conteudo.imguol.com.br/c/galeria/93/2022/03/18/ruelas-de-jericoacoara-1647613931353_v2_615x300.jpg	2024-10-19 12:30:00	UOL Confere
br	https://news.google.com/rss/articles/CBMie0FVX3lxTFBoRWU2M2dWeGJRWWdnQXlOTkoyelMwTGhxb01yZjR2M1ZmSE4zQjZSdU1NZDVNLWpiRVhlbTVjcEM1WEpOTkM4WXk0V0pQcG1Bb0ptVkdGQUE5Umd3OXcydGtqX0NPX2RIaWhBbS10Q0lxSEdaeHhhM1RwRQ?oc=5	Chip da beleza: entenda o que é o dispositivo proibido pela Anvisa - Metrópoles	Implante hormonal conhecido como chip da beleza foi proibido pela agência nesta sexta por oferecer muitos riscos graves à saúde	https://uploads.metroimg.com/wp-content/uploads/2024/10/19082243/chip-da-beleza.jpg	2024-10-19 11:44:31	Metrópoles
br	https://jovempan.com.br/noticias/mundo/cuba-continua-no-escuro-apos-apagao-total-que-paralisou-economia-e-deixa-10-milhoes-sem-energia.html	Cuba continua no escuro após apagão total que paralisou economia e deixa 10 milhões sem energia - Jovem Pan	O presidente cubano, Miguel Díaz-Canel, afirmou que o governo trabalha 'com absoluta prioridade' para restabelecer a energia o mais rápido possível, mas não deu previsão de quando ela retorna	https://jpimg.com.br/uploads/2024/10/cda5e660eb18bac1e36350bb4a28437f54360317.jpg	2024-10-19 11:26:02	Jovem Pan
br	https://www.em.com.br/gerais/2024/10/6968435-bh-chuva-continua-neste-sabado-19-10-veja-a-previsao-do-tempo.html	BH: chuva continua neste sábado (19/10)? Veja a previsão do tempo - Estado de Minas	Capital mineira terá céu nublado, pancadas de chuva e umidade em níveis saudáveis; alerta para ventos fortes e raios	https://midias.em.com.br/_midias/jpg/2024/10/14/520x405/1_whatsapp_image_2024_10_14_at_08_01_52-40679498.jpeg?20241014082022?20241014082022	2024-10-19 10:47:00	Estado de Minas
br	https://g1.globo.com/go/goias/noticia/2024/10/19/senador-jorge-kajuru-tem-videos-intimos-vazados-desagradavel-pra-caramba.ghtml	Senador Jorge Kajuru tem vídeos íntimos vazados: ‘Desagradável pra caramba’ - G1	Senador disse que tudo aconteceu em 2007, ou seja, há quase 20 anos. Ele vai procurar a polícia para denunciar o caso.	https://s2-g1.glbimg.com/PsabalqtVAPy6uS4b5sZ6wG0_uU=/1200x/smart/filters:cover():strip_icc()/i.s3.glbimg.com/v1/AUTH_59edd422c0c84a879bd37670ae4f538a/internal_photos/bs/2021/p/R/401KbsTsi15Kf7a8RR9w/jorge-kajuru.jpg	2024-10-19 19:35:28	G1
br	https://oglobo.globo.com/rio/noticia/2024/10/19/policial-militar-e-morto-a-tiros-em-seu-dia-de-folga-na-baixada-fluminense.ghtml	Policial militar é morto a tiros em seu dia de folga na Baixada Fluminense - O Globo	PM informou que o corpo do sargento foi encontrado também com sinais de queimadura; o caso está sendo investigado	https://s2-oglobo.glbimg.com/1R0onhLxqyyWFR0UfQ-LB1c3RXM=/1200x/smart/filters:cover():strip_icc()/i.s3.glbimg.com/v1/AUTH_da025474c0c44edd99332dddb09cabe8/internal_photos/bs/2022/S/5/mSdDymTD2go1mrHVYcZA/98482121-bx-rio-de-janeiro-rj-05-04-2022-policia-civil-investiga-morte-de-tres-jovens-em-nova.jpg	2024-10-19 14:42:42	O Globo
br	https://noticias.uol.com.br/internacional/ultimas-noticias/2024/10/19/pesquisas-eleicoes-eua-kamala-harris-donald-trump.htm	Eleições dos EUA: Donald Trump se aproxima de Kamala em pesquisas - UOL Confere	A menos de vinte dias das eleições presidenciais dos Estados Unidos, o candidato republicano Donald Trump tem apresentado melhora nas pesquisas e até mesmo aparecido a frente de Kamala Harris em algumas delas. Confira os principais levantamentos sobre 	https://conteudo.imguol.com.br/c/noticias/11/2024/09/27/kamala-harris-em-um-evento-na-pensilvania-e-donald-trump-dando-entrevista-em-nova-york-1727470962320_v2_615x300.png	2024-10-19 12:30:00	UOL Confere
br	https://g1.globo.com/sp/sao-paulo/eleicoes/2024/noticia/2024/10/19/policia-localiza-dois-veiculos-que-teriam-sido-usados-no-atentado-contra-o-prefeito-de-taboao-da-serra.ghtml	Polícia localiza dois veículos que teriam sido usados no atentado contra o prefeito de Taboão da Serra - G1	Aprígio estava em um carro blindado e foi baleado na clavícula, ele segue internado na UTI do Albert Einstein. Os dois veículos foram encontrados em Osasco, um deles foi localizado em uma residência e o dono do carro está sendo procurado. 	https://s2-g1.glbimg.com/NmD14vGNKlcTmk_HiKv6KZfFBxA=/1200x/smart/filters:cover():strip_icc()/i.s3.glbimg.com/v1/AUTH_59edd422c0c84a879bd37670ae4f538a/internal_photos/bs/2024/w/m/mi7MV6Q52uq0pVdwzYiw/fg246730.jpg	2024-10-19 13:08:27	G1
br	https://extra.globo.com/rio/noticia/2024/10/se-nao-fosse-atendida-prontamente-poderia-morrer-relata-medica-do-hospital-que-atendeu-uma-paciente-que-utilizou-ozempic-falsificado.ghtml	'Poderia morrer', diz médica sobre paciente internada após usar produto falsificado vendido como Ozempic - Extra	A vítima teve um quadro de  hipoglicemia grave e foi internada no Copa D'Or, em Copacabana, Zona Sul do Rio	https://s2-extra.glbimg.com/oqB6gnTs1fEniByPynewYWKcWnc=/1200x/smart/filters:cover():strip_icc()/i.s3.glbimg.com/v1/AUTH_1f551ea7087a47f39ead75f64041559a/internal_photos/bs/2024/K/K/1AROuUQpaamJGi811BBA/whatsapp-image-2024-10-19-at-16.01.55.jpeg	2024-10-19 19:05:03	Extra
br	https://www.plural.jor.br/curitiba/curitiba-tem-duas-novas-pesquisas-sobre-segundo-turno-veja-os-resultados/	Curitiba tem duas novas pesquisas sobre segundo turno; veja os resultados - - Jornal Plural Curitiba	None	None	2024-10-19 13:42:11	Jornal Plural Curitiba
br	https://www.poder360.com.br/poder-justica/stj-pode-ficar-sem-integrante-do-mpf-pela-1a-vez-desde-1988/	STJ pode ficar sem integrante do MPF pela 1ª vez desde 1988 - Poder360	STJ tem obrigação constitucional de ter ministros vindos do MP; hoje, há 4 representantes dos MPs estaduais. Leia no Poder360.	https://static.poder360.com.br/2018/07/laurita-vaz-presidente-do-stj-1.jpg	2024-10-19 12:27:53	Poder360
br	https://www.em.com.br/politica/2024/10/6968495-bolsonaro-chega-em-belo-horizonte-para-campanha-de-engler.html	Bolsonaro chega em Belo Horizonte para campanha de Engler - Estado de Minas	O ex-presidente Jair Bolsonaro participa em Belo Horizonte de motocarreata na corrida eleitoral pelo segundo turno do candidato do PL, Bruno Engler	https://midias.em.com.br/_midias/jpg/2024/10/19/520x405/1_bolsonaro_bh_campanha_bruno_engler-40825750.jpeg?20241019105320?20241019105320	2024-10-19 14:07:00	Estado de Minas
br	https://revistaoeste.com/politica/ex-aliado-de-bolsonaro-que-orou-por-lula-deixa-grupo-da-oposicao-no-whatsapp/	Ex-aliado de Bolsonaro que 'orou' por Lula deixa grupo da oposição no WhatsApp - Revista Oeste	Otoni de Paula (MDB-RJ) se aproximou do atual presidente e se distanciou dos partidos de direita	https://medias.revistaoeste.com/wp-content/uploads/2024/10/Lula-13.jpg	2024-10-19 16:58:00	Revista Oeste
br	https://g1.globo.com/mundo/noticia/2024/10/19/aeroporto-da-nova-zelandia-proibe-abracos-por-mais-de-3-minutos.ghtml	Aeroporto da Nova Zelândia proíbe abraços por mais de 3 minutos - G1	Medida visa aumentar a quantidade de carros que deixam os passageiros na área de desembarque. Abraços mais duradouros podem ser feitos no estacionamento pago, diz diretor do aeroporto.	https://s2-g1.glbimg.com/KoJELGY_lMmw-HyEExD5VD5l8pQ=/1200x/smart/filters:cover():strip_icc()/i.s3.glbimg.com/v1/AUTH_59edd422c0c84a879bd37670ae4f538a/internal_photos/bs/2024/Z/E/0OFGr2REW6r3miURCvgQ/image-1-resizedimagewzywmcw0mdrd.jpg	2024-10-19 20:41:35	G1
br	https://www.nsctotal.com.br/noticias/internacional-x-gremio-pela-serie-a-onde-assistir-e-horario-do-grenal-443	Internacional x Grêmio pela Série A: Onde assistir e horário do Grenal 443 - NSC Total	Internacional e Grêmio disputam o Grenal 443 neste sábado (18), às 16h (horário de Brasília), pela 30º rodada do Brasileirão. A partida será no estádio	https://img.nsctotal.com.br/wp-content/uploads/2024/10/internacional-gremio-grenal.jpg	2024-10-19 14:27:22	NSC Total
