country_code	url	title	description	image_url	publish_date	source
de	https://www.spiegel.de/panorama/gesellschaft/autoritarismus-studie-mehr-als-die-haelfte-der-deutschen-im-alltag-unzufrieden-mit-demokratie-a-6995ac0f-bf2c-444b-be26-e85381804df5	Autoritarismus-Studie: Jeder fünfte Deutsche zeigt sich offen für Diktatur - DER SPIEGEL	Zwar stehen laut einer Umfrage immer noch neun von zehn Deutschen hinter der Demokratie als Idee. Rund ein Fünftel aber kann auch einer Diktatur »unter bestimmten Umständen« zumindest teilweise etwas abgewinnen.	https://cdn.prod.www.spiegel.de/images/6bc3a5e6-4a87-4c34-9287-f1344ce6caad_w1200_r1.778_fpx38.43_fpy44.99.jpg	2024-11-13 11:35:00	DER SPIEGEL
de	https://www.zeit.de/politik/deutschland/2024-11/regierungserklaerung-christian-lindner-olaf-scholz-wirtschaft-kritik	"Wir haben im Kabinett nicht mehr über dasselbe Land gesprochen" - ZEIT Campus	FDP-Chef Christian Lindner hat SPD und Grüne für die wirtschaftliche Lage verantwortlich gemacht. Er forderte einen Kurswechsel: erst Wachstum, dann Bürgergeld.	None	2024-11-13 15:09:29	ZEIT Campus
de	https://www.spiegel.de/politik/deutschland/bundeshaushalt-soli-zuschlag-vor-dem-verfassungsgericht-a-e50f084f-8c57-4378-aac0-45c1838d8cf2	Bundeshaushalt: Soli-Zuschlag vor dem Verfassungsgericht - DER SPIEGEL	Die Verteidiger des Soli haben beim Bundesverfassungsgericht keinen leichten Stand. Erste Äußerungen der Richter lassen eine schwierige Entscheidung erwarten – mit einer eher knappen Mehrheit.	https://cdn.prod.www.spiegel.de/images/fd3d13db-0827-4a6b-92b5-c026f04145a2_w1200_r1.778_fpx33.02_fpy49.99.jpg	2024-11-13 16:19:00	DER SPIEGEL
de	https://www.handelsblatt.com/politik/deutschland/neuwahlen-jetzt-live-kanzler-scholz-gibt-nach-ampel-aus-regierungserklaerung-ab/30074918.html	Neuwahlen: Jetzt live: Kanzler Scholz gibt nach Ampel-Aus Regierungserklärung ab - Handelsblatt 	None	None	2024-11-13 11:19:00	Handelsblatt 
de	https://www.sportschau.de/tennis/starker-zverev-ringt-auch-ruud-nieder,atp-finals-116.html	ATP Finals: Zverev gelingt gegen Ruud zweiter Sieg - Sportschau	Alexander Zverev hat mit einem konzentrierten Auftritt gegen den Norweger Casper Ruud seinen zweiten Sieg bei den ATP Finals eingesammelt.	https://images.sportschau.de/image/19386628-4716-4940-86f7-01dec638c4bb/AAABkyeDBcU/AAABkZLhkrw/16x9-1280/zverev-584.jpg	2024-11-13 21:20:33	Sportschau
de	https://www.spiegel.de/panorama/justiz/missbrauchsvorwuerfe-lehrer-mit-baseballschlaeger-niedergeschlagen-a-b5575516-ef90-4d2a-a3bb-87d6c7919f1c	(S+) Missbrauchsvorwürfe: Lehrer mit Baseballschläger niedergeschlagen - DER SPIEGEL	Ein junger Mann soll versucht haben, seinen ehemaligen Lehrer mit einem Baseballschläger zu töten. Vor Gericht zeigt sich nun: Der Lehrer ist womöglich nicht nur Opfer, sondern auch selbst Täter.	https://cdn.prod.www.spiegel.de/images/8449a8ae-868b-4227-bae2-55dfb7f16b34_w1200_r1.778_fpx33.34_fpy50.jpg	2024-11-13 20:30:00	DER SPIEGEL
de	https://www.tagesspiegel.de/wirtschaft/wenn-der-bund-nicht-zahlt-muss-es-fallen-soder-stellt-zukunft-des-deutschlandtickets-infrage-12681797.html	„Wenn der Bund es nicht bezahlt, muss es fallen“ Söder stellt Zukunft des Deutschlandtickets infrage - Tagesspiegel	Die Verkehrsminister der Länder sorgen sich nach dem Ampel-Aus um das Fortbestehen des Deutschlandtickets. Bayerns Ministerpräsident Söder meint, der Bund sollte es finanzieren.	https://www.tagesspiegel.de/images/12691739/alternates/BASE_16_9_W1400/1731419224000/csu-chef-soder.jpeg	2024-11-12 14:34:00	Tagesspiegel
de	https://www.tag24.de/nachrichten/regionales/sachsen/erzgebirge-nachrichten/wintersport-in-gefahr-kritische-abstimmung-ueber-verkauf-der-liftanlagen-in-oberwiesenthal-3333469	Wintersport in Gefahr? Kritische Abstimmung über Verkauf der Liftanlagen in Oberwiesenthal - TAG24	Am Dienstag wird über die Zukunft der Schwebebahn und der zu ihr gehörenden Liftanlagen entschieden. Ein Millionär ist interessiert. | TAG24	https://media.tag24.de/1200x800/u/q/uqctk844en5xjxuk7y4a1zskj79e3x15.jpg	2024-11-13 10:00:02	TAG24
de	https://www.tagesschau.de/ausland/europa/ukraine-trump-102.html	Ukraine nach Wahl von Trump: "Schlimmer kann es nicht werden" - tagesschau.de	Die Menschen in der Ukraine sind müde vom Krieg und schauen gebannt nach Washington. Ihr Schicksal könnte in den Händen des designierten US-Präsidenten Trump liegen. Manche üben sich in vorsichtigem Optimismus. Von Rebecca Barth.	https://images.tagesschau.de/image/5164dd1c-0677-4344-8ab8-ce57aa62d5d8/AAABkyb5igU/AAABkZLhkrw/16x9-1280/ukraine-usa-flagge-100.jpg	2024-11-13 19:21:00	tagesschau.de
de	https://taz.de/AfD-schlecht-aufgestellt-fuer-Neuwahlen/!6049044/	AfD schlecht aufgestellt für Neuwahlen: Überfordert und überrumpelt - taz.de	Erst hat die AfD das Ende der Ampel gefordert, jetzt ist sie von vorgezogenen Neuwahlen überfordert. Vor allem in NRW und Bayern gibt es Probleme.	https://taz.de/picture/7350481/1200/AfD-Neuwahlen-Probleme--1.jpeg	2024-11-12 16:30:51	taz.de
de	https://www.tagesspiegel.de/politik/es-muss-jetzt-schnell-gehen-bundestagsabgeordnete-reichen-antrag-fur-afd-verbot-ein-12698951.html	„Es muss jetzt schnell gehen“: Bundestagsabgeordnete reichen Antrag für AfD-Verbot ein - Tagesspiegel	Die rechtlichen Hürden sind hoch, dennoch ist der fraktionsübergreifende Antrag für ein AfD-Verbotsverfahren nun auf den Weg gebracht. Fraktionsübergreifend stehen 113 Abgeordnete dahinter.	https://www.tagesspiegel.de/images/11053021/alternates/BASE_16_9_W1400/1731505056000/demo-gegen-rechts-vorm-brandenburger-tor-in-berlin-berlin-deutschland-14-januar-2024-tausende-menschen-demonstriere.jpeg	2024-11-13 13:32:00	Tagesspiegel
de	https://www.wiwo.de/politik/deutschland/bundesregierung-am-ende-die-ampel-hat-fertig-hurra/30084558.html	Ampel-Aus: Hurra, die Ampel hat fertig! - WirtschaftsWoche	None	None	2024-11-13 18:45:00	WirtschaftsWoche
de	https://www.pv-magazine.de/2024/11/13/bundeskabinett-verabschiedet-enwg-novelle/	Bundeskabinett verabschiedet EnWG-Novelle - pv magazine Deutschland	None	None	2024-11-13 15:33:58	pv magazine Deutschland
de	https://www.tagesschau.de/wirtschaft/arbeitsmarkt/zukunft-der-rente-102.html	Rentenversicherung sieht Ampel-Aus gelassen - tagesschau.de	Nach dem Scheitern der Ampel steht das geplante Rentenpaket II vor dem Aus. Wie geht es weiter, und was bedeutet das monatelange Machtvakuum für die Alterssicherung? Die Deutsche Rentenversicherung gibt sich gelassen. Von Nikolaus Nützel.	https://images.tagesschau.de/image/b1d6ce2c-cd67-45d0-bc68-c9addd0149fa/AAABkmZEbxo/AAABkZLhkrw/16x9-1280/rentner-arbeit-104.jpg	2024-11-13 16:56:00	tagesschau.de
de	https://www.tagesspiegel.de/internationales/pete-hegseth-als-verteidigungsminister-nominiert-trump-will-harten-und-klugen-fox-news-moderator-in-die-us-regierung-holen-12694976.html	Pete Hegseth als Verteidigungsminister nominiert Trump will „harten und klugen“ Fox-News-Moderator in die US-Regierung holen - Tagesspiegel	Bislang moderiert Pete Hegseth eine Morgensendung im TV. Künftig soll der Militärveteran das Pentagon leiten. Die US-Armee werde somit „wieder großartig sein“, erklärte Trump.	https://www.tagesspiegel.de/images/12695099/alternates/BASE_16_9_W1400/1731485023000/files-us-politics-cabinet-trump-hegseth.jpeg	2024-11-13 10:16:00	Tagesspiegel
de	https://www1.wdr.de/nachrichten/landespolitik/demo-gegen-sparen-im-sozialen-bereich-100.html	Große Kundgebung gegen das Sparen im sozialen Bereich - WDR Nachrichten	None	None	2024-11-13 05:00:00	WDR Nachrichten
de	https://www.tagesschau.de/ausland/amerika/explosionen-brasilia-100.html	Brasiliens Oberstes Gericht nach Explosionen in der Nähe evakuiert - tagesschau.de	In Brasilien ist der Oberste Gerichtshof nach zwei Explosionen in der Nähe des Gebäudes evakuiert worden. Die Polizei gab an, es sei ein Toter gefunden worden. Die Hintergründe sind noch unklar.	https://images.tagesschau.de/image/f6d5bbd5-a690-4be6-87c7-81454947cdc0/AAABkyhSBWo/AAABkZLhkrw/16x9-1280/explosionen-brasilia-102.jpg	2024-11-14 06:07:00	tagesschau.de
de	https://www.zeit.de/politik/ausland/2024-11/marco-rubio-usa-aussenminister-donald-trump	Marco Rubio: Aus "Little Marco" wird Trumps Außenminister - ZEIT Campus	Marco Rubio ist Hardliner mit außenpolitischer Erfahrung, der sich Donald Trumps Welt geschmeidig angepasst hat. Doch mit ihm könnten kommunikative Kanäle möglich sein.	https://img.zeit.de/politik/ausland/2024-11/marco-rubio-usa-aussenminister-donald-trump-bild/wide__1300x731	2024-11-13 21:51:15	ZEIT Campus
de	https://www.zeit.de/wissen/umwelt/2024-11/global-carbon-project-oel-gas-kohle-redkordhoch	Global Carbon Project: Menschheit verbrennt mehr Öl, Gas und Kohle als je zuvor - ZEIT Campus	Der Ausstoß von Kohlendioxid durch das Verbrennen fossiler Energieträger erreicht 2024 ein Rekordhoch. Laut Wissenschaftlern könnte er in Zukunft noch weiter steigen.	https://img.zeit.de/wissen/umwelt/2024-11/erdoel-kohle-gas-cop-klima/wide__1300x731	2024-11-13 04:28:24	ZEIT Campus
de	https://www.rbb24.de/politik/beitrag/2024/11/berlin-lachgas-verbot-partydroge-distickstoffmonoxid-n2o.html	Psychoaktive Substanzen: Bundeskabinett einigt sich auf Verbot von Lachgas und K.O.-Tropfen - rbb24		https://www.rbb24.de/content/dam/rbb/rbb/rbb24/2024/2024_11/dpa-account/lachgas-leere-flaschen.jpg.jpg/size=708x398.jpg	2024-11-13 13:45:00	rbb24
de	https://www.zeit.de/gesellschaft/zeitgeschehen/2024-11/thailand-warnung-anschlagsgefahr-full-moon-partys	Thailand: Warnung vor Anschlagsgefahr bei Full-Moon-Partys - ZEIT Campus	Vor der bei Urlaubern beliebten Full-Moon-Party auf der Insel Koh Phangan gibt es Hinweise auf mögliche Anschläge. Die Deutsche Botschaft sprach eine Reisewarnung aus.	https://img.zeit.de/gesellschaft/zeitgeschehen/2024-11/thailand-kho-phangan-full-moon-party-reisewarnung-bild/wide__1300x731	2024-11-14 05:20:37	ZEIT Campus
de	https://www.mdr.de/nachrichten/deutschland/politik/neuwahlen-kleinparteien-benachteiligt-unterschriften-volt-freie-waehler-oedp-100.html	Volt, Die Partei, Freie Wähler – Wie Kleinparteien in die Bundestagswahl 2025 gehen - MDR	Für Kleinparteien wird es stressig: Um an den Neuwahlen im Februar teilnehmen zu können, müssen sie viele Unterschriften sammeln. Das könnte nicht jede Partei in so kurzer Zeit schaffen.	https://www.mdr.de/nachrichten/mdraktuell-bundestagswahl-130_v-variantBig16x9_wm-true_zc-ecbbafc6.jpg?version=47760	2024-11-13 11:06:00	MDR
de	https://www.zeit.de/politik/ausland/2024-11/elon-musk-sergio-mattarella-italien-migration	Migrationspolitik: Italiens Präsident weist Einmischung von Elon Musk zurück - ZEIT Campus	"Diese Richter müssen weg" – so hatte Musk die Gerichtsentscheidung über das italienische Asylabkommen mit Albanien kommentiert. Nun hat Präsident Mattarella reagiert.	https://img.zeit.de/politik/deutschland/2024-11/sergio-mattarella/wide__1300x731	2024-11-13 18:39:21	ZEIT Campus
de	https://www.fr.de/hessen/teilweise-verschoben-besoldungserhoehung-fuer-beamte-wird-zr-93407256.html	Besoldungserhöhung für Beamte wird teilweise verschoben - fr.de	None	https://www.fr.de/assets/images/36/187/36187881-landeshaushalt-22fe.jpg	2024-11-14 03:56:00	fr.de
de	https://www.merkur.de/bayern/flachland-der-erste-schnee-ist-da-dwd-vorhersage-betrifft-auch-mehrere-regionen-im-93410180.html	Schneewalze rollt über Bayern hinweg – Winterzauber selbst in München - Merkur.de	None	https://www.merkur.de/assets/images/36/201/36201166-wie-im-winterzauber-im-bayerischen-wald-fiel-am-mittwochabend-reichlich-schnee-2yoVqIe05qfe.jpg	2024-11-13 20:31:00	Merkur.de
de	https://www.telepolis.de/features/Grundsteuer-Chaos-Wenn-das-Finanzamt-Gartenland-zu-Gold-macht-10025393.html	Grundsteuer-Chaos: Wenn das Finanzamt Gartenland zu Gold macht - Telepolis	Ein Gartengrundstück für 33.000 Euro gekauft, plötzlich soll es 852.000 Euro wert sein. Die neue Grundsteuer macht aus einem Garten ein teures Goldstück.	https://heise.cloudimg.io/bound/1200x1200/q85.png-lossy-85.webp-lossy-85.foil1/_www-heise-de_/imgs/18/4/7/1/1/0/6/4/grundsteuer-2-2-5e0568509f0b9656.jpeg	2024-11-13 06:00:00	Telepolis
de	https://www.tagesspiegel.de/berlin/glaube-nicht-dass-sie-notwendig-sind-berlins-verkehrssenatorin-gegen-u-bahn-wagen-nur-fur-frauen-12695546.html	„Glaube nicht, dass sie notwendig sind“ Berlins Verkehrssenatorin gegen U-Bahn-Wagen nur für Frauen - Tagesspiegel	153 Sexualdelikte registrierte die Berliner Polizei im vergangenen Jahr an U-Bahnhöfen. Die Grünen fordern ein neues Schutzkonzept für Frauen – Senatorin Ute Bonde hält davon nichts.	https://www.tagesspiegel.de/images/12700679/alternates/BASE_16_9_W1400/1731516490000/u-bahnhof-berliner-straaye-u-bahnhof-berliner-straaye-u-station-berliner-straaye-u-station-berliner-straaye.jpeg	2024-11-13 15:31:00	Tagesspiegel
de	https://www.faz.net/aktuell/politik/verfassungsschutzchef-muss-gehen-weil-er-fuer-den-bundestag-kandidiert-110108729.html	Verfassungsschutzchef muss gehen, weil er für den Bundestag kandidiert - FAZ - Frankfurter Allgemeine Zeitung	None	None	2024-11-13 13:40:28	FAZ - Frankfurter Allgemeine Zeitung
de	https://www.tagesspiegel.de/internationales/wegen-einer-durchwuhlten-unterwascheschublade-melania-trump-sagt-traditionelles-treffen-mit-jill-biden-ab-12695462.html	Wegen durchwühlter Unterwäscheschublade? Melania Trump sagt traditionelles Treffen mit Jill Biden ab - Tagesspiegel	Nach einer US-Wahl werden der designierte Präsident und dessen Frau traditionell ins Weiße Haus eingeladen. Melania Trump wird den Termin einem Bericht zufolge allerdings nicht wahrnehmen.	https://www.tagesspiegel.de/images/12695399/alternates/BASE_16_9_W1400/1731480170000/republican-presidential-nominee-donald-trump-holds-election-night-event-in-west-palm-beach.jpeg	2024-11-13 08:51:26	Tagesspiegel
de	https://www.tagesschau.de/ausland/uswahl/gaetz-nominierung-justizressort-100.html	Reaktionen auf Gaetz-Nominierung: Trumps "Hammer" sorgt für Sprachlosigkeit - tagesschau.de	"Der Hammer der Gerechtigkeit" komme, so der Kommentar von Elon Musk zur Nominierung von Matt Gaetz zum Justizminister. Der bezeichnete sich selbst auch schon mal als "Aufwiegler" - und würde auch seinen eigenen Job abschaffen. Von S. Hesse.	https://images.tagesschau.de/image/dade0ba0-b642-4094-ad00-e04d4066a1fb/AAABkylBTVs/AAABkZLhkrw/16x9-1280/gaetz-104.jpg	2024-11-14 05:59:00	tagesschau.de
de	https://www.spiegel.de/ausland/usa-donald-trump-trifft-joe-biden-und-raunt-von-dritter-amtszeit-a-fc4fbb78-26ff-42d3-8ec9-83d47d2690f8	Trump trifft Biden – und raunt bereits von dritter Amtszeit - DER SPIEGEL	Er selbst verweigerte Joe Biden 2020 noch den Empfang. Nun traf Donald Trump im Weißen Haus dennoch seinen Nachfolger und Vorgänger und gab sich versöhnlich – bis es um seinen eigenen Abschied als US-Präsident ging.	https://cdn.prod.www.spiegel.de/images/9e06bf57-642e-4a52-8902-a50a8d0c858a_w1200_r1.778_fpx48_fpy37.jpg	2024-11-13 19:47:00	DER SPIEGEL
de	https://www.handelsblatt.com/politik/deutschland/neuwahlen-soeder-habeck-ist-das-gesicht-der-krise/30074918.html	Neuwahlen: Söder: „Habeck ist das Gesicht der Krise“ - Handelsblatt 	None	None	2024-11-13 14:43:00	Handelsblatt 
de	https://www.spiegel.de/ausland/russland-wladimir-putin-reduziert-zahlungen-an-verwundete-soldaten-offenbar-drastisch-a-74e1eac2-fb43-493a-a7a7-0392fda27a9a	Russland: Wladimir Putin reduziert Zahlungen an verwundete Soldaten drastisch - DER SPIEGEL	Zehntausende Soldaten sind bei Russlands Angriffskrieg gegen die Ukraine bereits getötet und verletzt worden – die Zahlen steigen weiter. Nun streicht Präsident Putin die Entschädigungen für Verwundete zusammen.	https://cdn.prod.www.spiegel.de/images/2b456bcd-61ae-4070-bfd1-44cb72d89443_w1200_r1.778_fpx44_fpy50.jpg	2024-11-14 07:18:00	DER SPIEGEL
de	https://www.t-online.de/nachrichten/deutschland/innenpolitik/id_100529570/-maischberger-zum-ampel-aus-hat-olaf-scholz-einen-deal-gemacht-.html	"Maischberger": "Bin gar nicht so sicher, dass Scholz Kanzlerkandidat wird" - t-online	Für Hubertus Heil kann es nur einen SPD-Kanzlerkandidaten geben. Sandra Maischberger aber fragt: Schlägt bei einem CDU-Sieg die Stunde von Boris Pistorius?	https://images.t-online.de/2024/11/pDtfVrwzfd8K/0x209:4000x2250/fit-in/1200x0/julia-kloeckner-cdu-bei-einer-aktuellen-stunde-im-bundestag-archivbild.jpg	2024-11-13 00:54:33	t-online
de	https://www.hessenschau.de/politik/bundestagswahl/bundestagswahl-termin-fuer-neuwahlen-stellt-hessen-vor-herausforderungen-v6,wahltermin-bundestagswahl-100.html	Bundestagswahl: Termin für Neuwahlen stellt Hessen vor Herausforderungen - hessenschau.de	Am 23. Februar soll ein neuer Bundestag gewählt werden. Bundespräsident Steinmeier hält den von den Fraktionschefs von Union, SPD und Grünen ins Auge gefassten Termin für möglich. Hessen sieht sich gut aufgestellt. Eine Stadt verhängte bereits eine Urlaubssperre für die Zeit um den Jahreswechsel.	https://www.hessenschau.de/politik/bundestag-leer-100~_t-1731409139579_v-16to9__retina.jpg	2024-11-13 15:33:00	hessenschau.de
de	https://www.spiegel.de/ausland/polen-usa-eroeffnen-raketenstuetzpunkt-im-norden-des-landes-und-veraergern-damit-russland-a-fff5964e-944a-4005-aab0-b3a4b3668c06	Polen: USA eröffnen Raketenstützpunkt im Norden des Landes und verärgern Russland - DER SPIEGEL	Russlands Angriff auf die Ukraine offenbart die Risiken an der Ostflanke der Nato: Eine US-Basis in Nordpolen stärkt nun den Schutz vor Raketenangriffen – und wird aus Moskau scharf kritisiert.	https://cdn.prod.www.spiegel.de/images/612eec8d-f042-41e0-ad1b-5d3ffbe68739_w1200_r1.778_fpx40_fpy43.jpg	2024-11-14 01:25:00	DER SPIEGEL
de	https://news.google.com/rss/articles/CBMixAFBVV95cUxON0ZVTlBodUd3cFlZTUltVEZoWFk5Z1FwRDhmS21yZklleGhSd2lpRFZvdTQ0SEMyV0JRTWk5THNsYkZKSUd5aWZ3alhzeTRxTkJxQ2l3WnhJeXNEOXdMeHQwZ3ItZGdQVl9hSmxDbzU0bEZiUDBNVkhnNWlUMEcxZ2ZiQWpnQlRDOG5ZWkpsOThLMTQ3enBkT2ZDNF8yYUVldGhwajFhX3RXXzd0c25vWkVUR3dCdmtnQjE4Vjd2S0NXTmNW?oc=5	Treffen in Brüssel - Rutte und Blinken kündigen Reaktion auf nordkoreanischen Einsatz gegen die Ukraine an - Deutschlandfunk	Angesichts der nordkoreanischen Beteiligung am Krieg gegen die Ukraine hat NATO-Generalsekretär Rutte zu weiterer Unterstützung für das angegriffene Land aufgerufen. Nach Gesprächen mit US-Außenminister Blinken und EU-Vertretern in Brüssel sagte er, man müsse mehr tun, um die Ukraine im Kampf zu halten und so die russischen Angriffe so weit wie möglich zurückzudrängen.	None	2024-11-13 22:35:26	Deutschlandfunk
de	https://www.handelsblatt.com/politik/deutschland/neuwahl-start-up-unternehmer-diskutieren-anderen-umgang-mit-der-afd/100088088.html	Neuwahl: Start-up-Unternehmer diskutieren anderen Umgang mit der AfD - Handelsblatt 	None	None	2024-11-13 12:52:29	Handelsblatt 
de	https://www.hessenschau.de/panorama/a66-gesperrt-wiesbaden-rechnet-mit-verkehrschaos-v4,betonplatten-100.html	Wiesbaden fürchtet Verkehrschaos: A66 wegen kaputter Betonplatten gesperrt - hessenschau.de	Wegen gebrochener Fahrbahnplatten ist die A66 gesperrt worden. Die Umleitung führt direkt durch Wiesbaden. Die Stadt befürchtet ein Verkehrschaos und rät von Fahrten zu Stoßzeiten ab.	https://www.hessenschau.de/wirtschaft/salzbachtalbruecke-sperrung-112~_t-1624262454635_v-16to9__retina.jpg	2024-11-14 05:32:00	hessenschau.de
de	https://www.spiegel.de/ausland/usa-republikaner-verteidigen-mehrheit-im-repraesentantenhaus-a-bb1fe982-2e6a-40f2-b928-c7fdc820e8dc	USA: Republikaner verteidigen Mehrheit im Repräsentantenhaus - DER SPIEGEL	Noch stehen einige Ergebnisse aus – einzuholen ist die Führung der Republikaner im Repräsentantenhaus jedoch nicht mehr. Mit der Mehrheit in beiden Kongresskammern eröffnen sich für Trump womöglich große Spielräume.	https://cdn.prod.www.spiegel.de/images/b04e70e7-11a0-49b5-8910-e71dd83ed31e_w1200_r1.778_fpx46_fpy52.jpg	2024-11-14 06:01:00	DER SPIEGEL
de	https://www.tagesschau.de/ausland/amerika/trump-prozess-geheimdokumente-100.html	Affäre um Geheimdokumente: Sonderermittler beantragt Pause in Trump-Verfahren - tagesschau.de	Vor seiner Wiederwahl zum US-Präsidenten musste sich Trump einer Reihe von Ermittlungen stellen. Sein Sieg sorgt nun dafür, dass zwei Verfahren auf Bundesebene vor dem Aus stehen. Sonderermittler Smith beantragte einen Fristaufschub.	https://images.tagesschau.de/image/0956103d-3529-4794-9752-69ad6a50767f/AAABifpIi2E/AAABkZLhkrw/16x9-1280/smith-110.jpg	2024-11-14 07:03:00	tagesschau.de
de	https://www.n-tv.de/panorama/Sex-Boykott-in-den-USA-wegen-Trump-Sieg-article25358249.html	4B-Bewegung geht viral: Sex-Boykott in den USA wegen Trump-Sieg - n-tv NACHRICHTEN	Donald Trump gewinnt die US-Wahlen deutlich. Damit hat die Mehrheit für einen Kandidaten gestimmt, der wegen sexuellen Missbrauchs verurteilt wurde. Deshalb rufen Frauen in den USA zum Boykott von Männern auf.	https://bilder4.n-tv.de/img/incoming/crop25358267/6341329316-cImg_16_9-w1200/490269161.jpg	2024-11-13 11:59:00	n-tv NACHRICHTEN
de	https://www.welt.de/politik/ausland/article254502794/Amsterdam-Mob-jagte-Israelis-Wilders-fordert-Abschiebung-verurteilter-Randalierer.html	Amsterdam: Mob jagte Israelis – Wilders fordert Abschiebung verurteilter Randalierer - WELT	Angriffe auf israelische Fußballfans und Jagd auf Juden durch arabische Männergruppen – der niederländische Politiker Gert Wilders will dies ahnden. Er spricht sich für den Entzug der niederländischen Staatsbürgerschaft für alle aus, die Doppelstaatler sind.	https://img.welt.de/img/politik/ausland/mobile254503112/9077936817-ci16x9-w1200/Dutch-MP-and-President-of-the-far-r.jpg	2024-11-13 16:46:54	WELT
de	https://www.deutschlandfunk.de/staatsanwaltschaft-fordert-haft-und-entzug-des-passiven-wahlrechts-fuer-le-pen-102.html	Frankreich - Staatsanwaltschaft fordert Haft und Entzug des passiven Wahlrechts für Le Pen - Deutschlandfunk	Im Pariser Prozess gegen die Rechtspopulistin Le Pen wegen des Vorwurfs der Veruntreuung von EU-Geldern hat die Staatsanwaltschaft fünf Jahre Haft gefordert.	https://bilder.deutschlandfunk.de/2f/57/16/83/2f571683-d179-4373-b824-f1e94e2f5bab/marine-le-pen-108-1920x1080.jpg	2024-11-13 22:35:26	Deutschlandfunk
de	https://www.n-tv.de/politik/Neubrandenburg-erlaubt-Hissen-der-Regenbogenfahne-article25360151.html	AfD-Abgeordnete verließen Saal: Neubrandenburg erlaubt Hissen der Regenbogenfahne - n-tv NACHRICHTEN	Bundesweit sorgt die Stadt Neubrandenburg für Aufsehen, weil sie das Hissen der Regenbogenfahne auf dem Bahnhofsplatz verbietet. Einen Monat später stimmen Abgeordnete mehrheitlich dafür, die Fahne als Symbol für Vielfalt anzuerkennen. Einige Abgeordnete verlassen vor Abstimmung den Saal.	https://bilder2.n-tv.de/img/incoming/crop25360149/2041324914-cImg_16_9-w1200/488253092.jpg	2024-11-13 21:02:00	n-tv NACHRICHTEN
de	https://www.lto.de/recht/hintergruende/h/interview-zur-schuldenbremse-mit-ferdinand-kirchhof	Ex-Verfassungsrichter Kirchhof zum Thema Schuldenbremse - Legal Tribune Online	None	https://www.lto.de/fileadmin/files/artikel/2024/November/lindner_scholu_.jpg	2024-11-13 13:17:58	Legal Tribune Online
de	https://www.tagesschau.de/ausland/amerika/usa-mehrheitsfuehrer-senat-neue-minister-100.html	South Dakotas Senator Thune wird Mehrheitsführer im US-Senat - tagesschau.de	John Thune wird nach dem Wahlsieg der Republikaner neuer Mehrheitsführer im US-Senat. Der Senator von South Dakota hat sich von einem Kritiker zu einem Unterstützer des neu gewählten Präsidenten Trump gewandelt.	https://images.tagesschau.de/image/ac865f46-2c47-4659-8f59-b2f62a48536c/AAABkybWLgg/AAABkZLhkrw/16x9-1280/john-thune-100.jpg	2024-11-13 18:43:00	tagesschau.de
de	https://www.zeit.de/gesellschaft/zeitgeschehen/2024-11/schleswig-holstein-elmshorn-terror-anschlag-verdaechtiger-ermittlungen	Vereitelter Anschlag: Terrorverdächtiger aus Elmshorn wusste von Ermittlungen - ZEIT Campus	Obwohl er wusste, dass er beobachtet wird, soll der 17-Jährige aus Elmshorn seine Anschlagspläne vorangetrieben haben. Laut Ermittlern stand der Zielort noch nicht fest.	https://img.zeit.de/gesellschaft/zeitgeschehen/2024-11/elmshorn-anschlag-islamistisch-schleswig-holstein/wide__1300x731	2024-11-13 17:51:02	ZEIT Campus
de	https://taz.de/Pflegehelfer-sollen-abgeschoben-werden/!6045721/	Pflegehelfer sollen abgeschoben werden: Wichtig aber nicht gewollt - taz.de	Ein Heim für Demenzkranke bei Bremen fürchtet, schließen zu müssen. Ein Drittel der Pflegekräfte kommt aus Kolumbien und soll abgeschoben werden.	https://taz.de/picture/7354094/1200/oktoberfest-wilstedt-1.jpeg	2024-11-13 23:32:15	taz.de
de	https://www.handelsblatt.com/unternehmen/energie/energie-rwe-chef-haelt-deutsches-atom-comeback-fuer-sehr-unrealistisch/100088192.html	Energie: RWE-Chef hält deutsches Atom-Comeback für „sehr unrealistisch“ - Handelsblatt 	None	None	2024-11-13 15:01:52	Handelsblatt 