country_code	url	title	description	image_url	publish_date	source
de	https://www.ndr.de/nachrichten/niedersachsen/Stromtrasse-SuedLink-Erste-Kabel-in-Niedersachsen-verlegt,suedlink326.html	Hauptschlagader der Energiewende: Bau der Stromtrasse SuedLink geht voran - NDR.de	Die Trasse SuedLink soll Strom vom Norden in den Süden liefern - und so die Energiewende voranbringen. In Heeslingen in Niedersachsen begann nun offiziell die Verlegung des ersten Teilstücks.	https://www.ndr.de/nachrichten/niedersachsen/suedlink334_v-contentxl.jpg	2024-10-22 16:56:00	NDR.de
de	https://www.br.de/nachrichten/bayern/aiwangers-waermestrategie-laesst-fragen-offen,URwiHY6	Aiwangers Wärmestrategie lässt Fragen offen - BR24	Wie schafft es Bayern, die Heizungen bis 2040 klimaneutral zu machen, wie es das Klimaschutzgesetz der Staatsregierung vorsieht? Dazu hat Aiwangers Wirtschaftsministerium  eine "Wärmestrategie" vorgelegt. Sie lässt Fragen offen. Eine Analyse.	https://img.br.de/082699a2-9711-42de-ace9-48c49476e9b2.jpeg?q=80&rect=735%2C614%2C3495%2C1968&w=1600&h=900	2024-10-22 16:30:01	BR24
de	https://www1.wdr.de/nachrichten/catcalling-niedersachsen-gesetzesentwurf-102.html	Obszöne Gesten und Beleidigungen: "Catcalling" soll verboten werden - WDR Nachrichten	None	None	2024-10-23 09:49:00	WDR Nachrichten
de	https://www.tagesspiegel.de/gesundheit/kassenleitung-selbst-bezahlt-verbraucherzentrale-kritisiert-falsches-abkassieren-bei-zahlreichen-arzten-12579707.html	Kassenleistung selbst bezahlt? Verbraucherzentrale kritisiert falsches Abkassieren bei zahlreichen Ärzten - Tagesspiegel	Brustkrebs-Vorsorge, Sehtests, Hautkrebs-Screening: All das rechnen Mediziner offenbar immer wieder als Selbstzahlerleistung ab, obwohl die Krankenkasse zahlen müsste.	https://www.tagesspiegel.de/images/9860660/alternates/BASE_16_9_W1400/1692184486000/krebsvorsorge-hautkrebs.jpeg	2024-10-23 11:23:37	Tagesspiegel
de	https://www.rbb24.de/politik/beitrag/2024/10/berlin-ex-senatoren-verlassen-linkspartei-lederer-breitenbach.html	Lederer, Breitenbach, Scheel: Mehrere Ex-Senatoren verlassen Linkspartei - rbb24	Verlorene Landtagswahlen, Konkurrenz durch das BSW und Antisemitismus: Die Linke steckt in einer schweren Krise. Nun erklären mehrere prominente Mitglieder des Berliner Landesverbands ihren Austritt aus der Partei.	https://www.rbb24.de/content/dam/rbb/rbb/rbb24/2024/2024_10/dpa-account/lederer.jpg.jpg/size=708x398.jpg	2024-10-23 14:37:00	rbb24
de	https://www.mdr.de/nachrichten/thueringen/sued-thueringen/sonneberg/krankenhaus-neuhaus-schliesst-100.html	Krankenhaus in Neuhaus am Rennweg wird geschlossen - MDR	Das Krankenhaus in Neuhaus am Rennweg wird noch in diesem Jahr geschlossen. Die Patienten sollen künftig vor allem in Sonneberg versorgt werden. Insgesamt fallen 60 Betten weg, auch Kündigungen wird es geben.	https://cdn.mdr.de/nachrichten/thueringen/sued-thueringen/sonneberg/regiomed-neuhaus-krankenhaus-102_v-variantBig16x9_wm-true_zc-ecbbafc6.jpg?version=57154	2024-10-23 14:54:00	MDR
de	https://www1.wdr.de/nachrichten/deutschlandweit-erster-mpox-fall-der-neuen-variante-in-koeln-bestaetigt-100.html	Nach Infektion mit neuer Variante in Köln: Was man über Mpox wissen muss - WDR Nachrichten	None	None	2024-10-22 14:01:06	WDR Nachrichten
de	https://www.spektrum.de/alias/bilder-der-woche/kometen-tsuchinshan-atlas-die-letzte-cance-zur-sichtung/2239321	Kometen: Tsuchinshan-Atlas - die letzte Chance zur Sichtung - Spektrum.de	Der Komet ist nur noch wenige Tage zu sehen	https://static.spektrum.de/fm/912/f1920x1080/ATLAS.jpg	2024-10-23 14:50:50	Spektrum.de
de	https://www.spiegel.de/ausland/baden-wuerttemberg-mehr-geld-fuer-familie-des-in-mannheim-getoeteten-polizisten-a-c9c8866e-6fb2-4657-bc5f-d1bac2652536	Baden-Württemberg: Mehr Geld für Familie des in Mannheim getöteten Polizisten - DER SPIEGEL	Stirbt ein Polizist im Dienst, wird seine Familie entschädigt. Diese Summe will die baden-württembergische Landesregierung nun anheben. Und auch für zwei in diesem Jahr getötete Beamte rückwirkend auszahlen.	https://cdn.prod.www.spiegel.de/images/44510a36-1500-4736-b4ab-f7ee670fb566_w1200_r1.778_fpx51_fpy57.jpg	2024-10-23 17:35:00	DER SPIEGEL
de	https://www.sueddeutsche.de/panorama/gisele-pelicot-avignon-prozess-vergewaltigung-lux.KwNYAxv7ctWgwfgiC7PouM	Vergewaltigungsprozess in Avignon: Gisèle Pelicot warnt vor Tätern - Süddeutsche Zeitung - SZ.de	Gisèle Pelicot will mit ihrer Aussage vor Gericht anderen Frauen Mut machen. 	https://www.sueddeutsche.de/2024/10/23/8a2a9ddc-86cb-4f83-8d0b-44595318ca75.jpeg?q=60&fm=webp&width=1200&rect=0%2C203%2C4000%2C2250	2024-10-23 13:48:53	Süddeutsche Zeitung - SZ.de
de	https://www.ndr.de/nachrichten/mecklenburg-vorpommern/Maritimes-Hauptquartier-in-Rostock-Moskau-bestellt-deutschen-Botschafter-ein,ctfbaltic102.html	Kein NATO-Hauptquartier: Moskau bestellt Deutschen Botschafter ein - Auswärtiges Amt spricht von Missverständnis - NDR.de	Einen Tag nach der Einweihung des maritimen taktischen Hauptquartiers in Rostock hat Russland den deutschen Botschafter in Moskau einbestellt. Das Auswärtige Amt spricht von einem "Missverständnis".	https://www.ndr.de/nachrichten/mecklenburg-vorpommern/ctf100_v-contentxl.jpg	2024-10-22 15:56:00	NDR.de
de	https://www.bild.de/politik/ausland-und-internationales/nach-irans-angriffen-zielt-israel-auf-das-wohnhaus-des-ober-mullahs-67176e79a0e636753eda737d	Nach Irans Angriffen: Zielt Israel auf das Wohnhaus des Ober-Mullahs? - BILD	None	None	2024-10-23 13:13:25	BILD
de	https://www.tagesschau.de/ausland/europa/ungarn-orban-nationalfeiertag-100.html	Ungarns Ministerpräsident Orban ruft zu Widerstand gegen EU auf - tagesschau.de	Die EU wolle Ungarns Regierung stürzen und eine "Marionettenregierung" installieren. In einer Rede greift Ministerpräsident Orban Brüssel mit unbewiesenen Vorwürfen an. Politisch steht er unter Druck wie lange nicht.	https://images.tagesschau.de/image/b5aebc94-e120-441c-b4fe-ed463b72de2e/AAABkrq1QLE/AAABkZLhkrw/16x9-1280/orban-420.jpg	2024-10-23 19:27:00	tagesschau.de
de	https://www.mdr.de/nachrichten/sachsen/leipzig/leipzig-leipzig-land/verkehr-fussball-rb-liverpool-mpk-stau-100.html	Champions League und Ministerpräsidenten-Treffen in Leipzig: Sperrzonen und Umleitungen - MDR	Wegen des Champions-League-Spiels von RB Leipzig gegen den FC Liverpool und der Ministerpräsidenten-Konferenz kommt es in Leipzig ab Mittwoch zu zahlreichen Straßensperrungen und Umleitungen. Das müssen Sie wissen.	https://cdn.mdr.de/nachrichten/sachsen/leipzig/leipzig-leipzig-land/mpk-kongresshalle-zoo-politiker-kretschmer-104_v-variantBig16x9_wm-true_zc-ecbbafc6.jpg?version=31452	2024-10-22 19:39:02	MDR
de	https://www.br.de/nachrichten/deutschland-welt/stoltenberg-putin-weiss-dass-ein-nuklearkrieg-nicht-gewonnen-werden-kann,US2Mmsu	"Putin weiß, dass ein Nuklearkrieg nicht gewonnen werden kann" - BR24	Um Frieden in der Ukraine zu erreichen, dürfe die militärische Unterstützung nicht nachlassen, fordert Ex-Nato-Generalsekretär Stoltenberg. Im Interview mit dem Bayerischen Rundfunk äußerte er sich auch zu Donald Trump und dem Nahen Osten. 	https://img.br.de/af4ea94f-7abe-473d-a01e-5b168c16e674.jpeg?q=80&rect=502%2C313%2C2058%2C1155&w=1600&h=900	2024-10-23 15:42:12	BR24
de	https://www.fr.de/politik/koennten-sogar-putins-kampfjets-fliegen-nordkoreas-soldaten-wohl-am-ukraine-krieg-beteiligt-zr-93370234.html	„Könnten sogar Putins Kampfjets fliegen“: Nordkoreas Soldaten wohl am Ukraine-Krieg beteiligt - fr.de	None	https://www.fr.de/assets/images/35/167/35167589-ukraine-krieg-russischer-kampfjet-su-25-2jSRhodOyTfe.jpg	2024-10-23 17:19:00	fr.de
de	https://www.spiegel.de/panorama/erschossener-mann-war-wohl-mehrfach-ziel-von-angriffen-a-3dc8766c-0571-4730-b49d-5715a82ac065	Erschossener Mann war wohl mehrfach Ziel von Angriffen - DER SPIEGEL	Vor einem Fitnessstudio in Köln wurde am Dienstag ein Mann getötet. Zuvor schossen Unbekannte wohl schon mindestens zweimal auf ihn. Die Ermittler haben einen klaren Verdacht, in welchem Milieu die Taten passierten.	https://cdn.prod.www.spiegel.de/images/7c46e288-20e2-4ba4-80c0-3f8e82e1c30f_w1200_r1.778_fpx68.66_fpy45.jpg	2024-10-23 18:07:00	DER SPIEGEL
de	https://www.welt.de/kultur/article254149128/Wie-die-Tagesschau-Stimmung-gegen-die-OERR-Reform-macht.html	Wie die „Tagesschau“ Stimmung gegen die ÖRR-Reform macht - WELT	In dieser Woche beraten die Ministerpräsidenten über die Zukunft des ÖRR. Auf ihren reichweitenstarken Social-Media-Kanälen macht ausgerechnet die „Tagesschau“-Redaktion jetzt Stimmung gegen die anstehende Reform. Und suggeriert, es ginge um Zensur.	https://img.welt.de/img/incoming/mobile254153576/8527935997-ci16x9-w1200/Franziska-Zimmerer-Autorenfoto-NEU-DI.jpg	2024-10-23 14:53:56	WELT
de	https://www.spiegel.de/panorama/usedom-hunderte-gefaehrliche-militaerkartuschen-geborgen-a-54b2862b-5158-4c61-8852-a5a96d53b7bc	Usedom: Hunderte gefährliche Militärkartuschen geborgen - DER SPIEGEL	Ein Baggerfahrer hat auf Usedom Behälter mit Hexachlorethan und womöglich weiteren Substanzen gefunden. Weil er sich anschließend »wie betrunken« fühlte, rückten Einsatzkräfte in Spezialmontur an.	https://cdn.prod.www.spiegel.de/images/9b3d00fb-47a0-4e6f-a6e1-3a2da6a04c58_w1200_r1.778_fpx28.13_fpy50.jpg	2024-10-23 16:56:00	DER SPIEGEL
de	https://www.br.de/nachrichten/bayern/urteil-euro-5-dieselfahrverbote-in-muenchen-wahrscheinlicher,US1W6Kn	Euro-5-Dieselfahrverbote in München werden wahrscheinlicher - BR24	Im Ringen um die richtigen Maßnahmen zur Luftreinhaltung in München ist eine neue richterliche Entscheidung gefallen. Euro-5-Dieselfahrverbote werden damit wahrscheinlicher. Doch ohnehin könnte sich die Diskussion bald verschärfen.	https://img.br.de/496aaee6-b7fa-4172-9ec3-8ffcb185f728.jpeg?q=80&rect=1096%2C288%2C5426%2C3049&w=1600&h=900	2024-10-23 12:47:34	BR24
de	https://www.welt.de/politik/ausland/us-wahl/plus254143766/US-Demoskop-Frank-Luntz-In-den-letzten-20-30-Tagen-ist-Harris-abgrundtief-schlecht-geworden.html	„In den letzten 20, 30 Tagen ist Harris abgrundtief schlecht geworden“ - WELT	Nach Trumps TV-Debatte mit Kamala Harris hielt der renommierte Wahlforscher Frank Luntz den Republikaner für „erledigt“. Im Interview erklärt er, warum es nicht dazu kam – im Gegenteil –, welche Umfrageergebnisse ihn besonders schockieren und was er für den Wahltag erwartet.	https://img.welt.de/img/politik/ausland/mobile254147388/8327931957-ci16x9-w1200-fnov-fpotl-fpi157750653/DWO-Teaser-USWahl-Themen-js.jpg	2024-10-23 11:20:10	WELT
de	https://www.sportschau.de/fussball/championsleague/drei-raphinha-treffer-barca-demuetigt-die-bayern,cl-barcelona-bayern-100.html	Hansi Flicks Barcelona demoniert die Bayern - Sportschau	In einer äußerst schnellen und intensiven Partie hat der FC Barcelona Bayern München eiskalt ausgekontert. Kapitän Raphinha allein traf dreimal.	https://images.sportschau.de/image/40be449d-92b0-456f-b5e0-f5ed465fdb1f/AAABkrshytQ/AAABkZLhkrw/16x9-1280/raphinha-jubel-102.jpg	2024-10-23 20:53:00	Sportschau
de	https://www.dwdl.de/meinungen/100113/vernunft__effizienz_ein_dwdlvorschlag_zur_spartensenderreform/?utm_source=&utm_medium=&utm_campaign=&utm_term=	Vernunft & Effizienz: Ein DWDL-Vorschlag zur Spartensender-Reform - DWDL.de	ARD und ZDF müssen aller Voraussicht nach die Spartensender reduzieren; es droht ein Verteilungskampf. Dabei liegt eine sinnvolle Aufstellung auf der Hand, wenn man Stärken und Schwächen betrachtet. Ein Serviervorschlag, formuliert von Uwe Mantel - getragen von der gesamten DWDL-Redaktion.	https://www.dwdl.de/images/1664204856_ard-zdf.jpg	2024-10-22 22:00:00	DWDL.de
de	https://news.google.com/rss/articles/CCAiCzJDR25BMzFFbkdJmAEB?oc=5	Trump gegen Harris: Sorge vor Gewaltausbruch in den USA | Markus Lanz vom 22. Oktober 2024 - ZDFheute Nachrichten	None	None	2024-10-23 07:00:02	ZDFheute Nachrichten
de	https://www.tagesschau.de/ausland/asien/libanon-israel-hisbollah-safi-al-din-100.html	Israel meldet Tod von ranghohem Hisbollah-Funktionär - tagesschau.de	Israels Militär hat nach eigenen Angaben vor etwa drei Wochen den ranghohen Hisbollah-Funktionär Safi al-Din im Libanon getötet. Er galt als aussichtsreichster Nachfolger für den zuvor getöteten Generalsekretär Nasrallah.	https://images.tagesschau.de/image/9c5eb7e5-7d4e-4a95-a74c-8bb71c4a2529/AAABkrbbMJM/AAABkZLhkrw/16x9-1280/safi-al-din-100.jpg	2024-10-23 00:51:00	tagesschau.de
de	https://www.swr.de/swraktuell/rheinland-pfalz/elektronische-patientenakte-kommt-im-januar-faq-was-muss-ich-wissen-102.html	Elektronische Patientenakte: Was bringt die ePA? Kann ich ihr widersprechen? Was geschieht mit den Daten? - SWR Aktuell	Mitte Januar wird die elektronische Patientenakte für alle eingeführt. Sie soll die Behandlung im Krankheits- oder Notfall entscheidend verbessern. Was hat es mit der ePA genau auf sich?	https://www.swr.de/swraktuell/rheinland-pfalz/1729681803300%2Celektronische-patientenakte-app-einfuehrung-januar-100~_v-16x9@2dL_-6c42aff4e68b43c7868c3240d3ebfa29867457da.jpg	2024-10-23 11:17:00	SWR Aktuell
de	https://www.tagesspiegel.de/politik/die-zeit-fur-impulse-ist-vorbei-stephan-weil-findet-habecks-deutschlandfonds-idee-ungenugend-12584783.html	„Die Zeit für Impulse ist vorbei“ Stephan Weil findet Habecks Deutschlandfonds-Idee ungenügend - Tagesspiegel	Niedersachsens Ministerpräsident wünscht mehr Tempo bei der Bekämpfung der Wirtschaftskrise. Hinter den Ideen von Wirtschaftsminister Habeck sieht er viele „Fragezeichen“. 	https://www.tagesspiegel.de/images/11775671/alternates/BASE_16_9_W1400/1729701381000/festakt-50-jahre-golf-produktion-bei-volkswagen-in-wolfsburg-festakt-50-jahre-golf-produktion-eventraum-buhne-stephan.jpeg	2024-10-23 19:03:00	Tagesspiegel
de	https://www.spiegel.de/wirtschaft/ukraine-g7-gewaehren-multimilliardenkredit-aus-eingefrorenem-russischen-vermoegen-a-c91fa53c-9838-4292-b68f-08eb3a771524	Ukraine: G7 gewähren Multimilliardenkredit aus eingefrorenem russischen Vermögen - DER SPIEGEL	Mehr Geld für Kiew: Die G7-Länder stellen der Ukraine laut US-Finanzministerin Yellen 50 Milliarden Dollar zur Verfügung. Der Kredit soll indirekt von Russland gezahlt werden.	https://cdn.prod.www.spiegel.de/images/d6f05c98-c2db-40a2-90db-3113eed826f1_w1200_r1.778_fpx48_fpy43.jpg	2024-10-23 14:58:00	DER SPIEGEL
de	https://www.n-tv.de/panorama/Mutter-und-ihre-zwei-Kinder-tot-Ungluecksfahrer-von-Esslingen-schweigt-und-muss-Bluttest-machen-article25309762.html	Unglücksfahrer von Esslingen unter Verdacht der fahrlässigen Tötung - n-tv NACHRICHTEN	In Esslingen kommt am Abend ein Fahrer mit seinem Wagen von der Straße ab und erfasst auf dem Gehweg eine Mutter mit ihren beiden Kindern. Alle drei sind sofort tot. Der Autofahrer verweigert die Aussage und muss sich jetzt einem Bluttest unterziehen.	https://bilder3.n-tv.de/img/incoming/crop25309738/6671322180-cImg_16_9-w1200/489298808.jpg	2024-10-23 12:22:00	n-tv NACHRICHTEN
de	https://www.sueddeutsche.de/politik/deutschland-grossbritannien-verteidigungsbuendnis-russland-trump-lux.WEU3mWTZcEkUp44a2eowaT	Deutsch-britisches Abkommen zu Verteidigung und Rüstung - Süddeutsche Zeitung - SZ.de	Es ist das erste große deutsch-britische Abkommen seit dem Brexit – man will gemeinsam Waffen und Drohnen entwickeln und Meere schützen.	https://www.sueddeutsche.de/2024/10/23/0e42cbd7-2ade-45ff-b3f6-2225e0aab0b5.jpeg?q=60&fm=webp&width=1200&rect=133%2C500%2C3733%2C2100	2024-10-23 15:08:45	Süddeutsche Zeitung - SZ.de
de	https://www.deutschlandfunk.de/kein-buergergeld-mehr-fuer-ukrainer-lindner-will-neuen-rechtsstatus-fuer-gefluechtete-100.html	Soziales - Kein Bürgergeld mehr für Ukrainer - Lindner will neuen Rechtsstatus für Geflüchtete - Deutschlandfunk	Bundesfinanzminister Lindner schlägt einen neuen Rechtsstatus für Geflüchtete aus der Ukraine vor, um die Kosten für das Bürgergeld zu senken.	https://bilder.deutschlandfunk.de/4f/38/8e/6e/4f388e6e-8e76-4ef9-920e-c68f9c23f576/buergergeld-130-1920x1080.jpg	2024-10-23 12:23:29	Deutschlandfunk
de	https://www.rnd.de/politik/hisbollah-und-hamas-wo-kommt-das-geld-fuer-die-terroristen-her-XOX6TEEF2FB5XN7Z5RUD6KXCZU.html	Hisbollah und Hamas: Woher kommt das Geld für die Terroristen? - RND	Israel hatte zuletzt verstärkt das Finanzsystem der Hisbollah ins Visier genommen. Nun will die Armee einen Bunker entdeckt haben, in dem ein Millionenvermögen lagerte. Wie aber kommen Hamas und Hisbollah zu solchen Vermögen? Ein Experte erklärt die verschlungenen Wege der Terror-Millionen. 	https://www.rnd.de/resizer/v2/KDAYOAEK45GIXJCKHPN3D6PCRM.jpg?auth=a104b0540a040f68987b78e728f02640163dae357633554654e26738c4f9dc81&quality=70&width=1200&height=630&smart=true	2024-10-22 20:44:02	RND
de	https://www.zeit.de/politik/ausland/2024-10/donald-trump-aeusserungen-adolf-hitler-ex-stabschef-john-kelly-usa-wahl-kamala-harris-kritik	USA: Empörung über Trumps mutmaßliche Hitler-Begeisterung - zeit.de	Donald Trumps früherer Stabschef berichtet, der republikanische Präsidentschaftskandidat habe Adolf Hitler verharmlost. Kamala Harris nennt das "zutiefst beunruhigend".	https://img.zeit.de/politik/ausland/2024-10/donald-trump-aeusserungen-adolf-hitler-ex-stabschef-john-kelly-usa-wahl-kamala-harris-kritik-bild/wide__1300x731	2024-10-23 20:51:07	zeit.de
de	https://www.mdr.de/nachrichten/thueringen/sued-thueringen/sonneberg/mutter-lauscha-vermisst-aufgetaucht-100.html	In Thüringen vermisste Frau wieder aufgetaucht - MDR	Die seit Samstag in Lauscha vermisste Mutter ist am Mittwoch aufgegriffen worden. Der Polizei zufolge wurde sie wohlauf in Rheinland-Pfalz gefunden. Nach ihr hatten zeitweise rund 100 Helfer gesucht.	https://cdn.mdr.de/nachrichten/thueringen/sued-thueringen/sonneberg/lauscha-grosseinsatz-suche-vermissten-104_v-variantBig16x9_wm-true_zc-ecbbafc6.jpg?version=18999	2024-10-23 19:37:22	MDR
de	https://www.br.de/nachrichten/bayern/soeder-verordnet-muenchner-flughafen-reibungslosen-ferienstart,US2GNJN	Söder verordnet Münchner Flughafen reibungslosen Ferienstart - BR24	Keine langen Warteschlangen und keine genervten Passagiere. Das fordert nach dem Chaos am Münchner Flughafen Ministerpräsident Söder. Als Mit-Eigentümer hat der Freistaat hohes Interesse an einem funktionierenden Flughafen.	https://img.br.de/1c24635a-8497-4652-b539-f269375d87da.jpeg?q=80&rect=0%2C105%2C1024%2C577&w=1600&h=900	2024-10-23 15:48:12	BR24
de	https://www.tagesspiegel.de/politik/wahlkampf-mit-der-krise-statt-krisenbekampfung-diese-regierung-hat-deutschland-nicht-verdient-12583790.html	Wahlkampf mit der Krise statt Krisenbekämpfung Diese Regierung hat Deutschland nicht verdient - Tagesspiegel	SPD, Grüne und FDP glauben selbst nicht mehr an eine gemeinsame Antwort auf die Wirtschaftskrise. Statt das Land zu regieren, haben sie den Wahlkampf begonnen. 	https://www.tagesspiegel.de/images/12583808/alternates/BASE_16_9_W1400/1729693404000/christian-lindner-robert-habeck-und-olaf-scholz-in-der-193-sitzung-des-deutschen-bundestages-im-reichstagsgebaude-ber.jpeg	2024-10-23 15:18:54	Tagesspiegel
de	https://www.ruhrnachrichten.de/bvb/dortmund-bricht-in-madrid-auseinander-massive-kritik-an-sahin-und-can-bvb-podcast-459-w951480-2001414777/	Dortmund bricht in Madrid auseinander – massive Kritik an Sahin und Can BVB-Podcast 459 - Ruhr Nachrichten	Dortmund zeigt auch bei Real zwei Gesichter. Auf furiose 45 Minuten folgt der komplette Einbruch. Massive Kritik gibt es an Sahin und Can. Der BVB-Podcast.	https://www.ruhrnachrichten.de/wp-content/uploads/2024/10/23/10/630_0900_4197866_489223316-1648x824.jpg	2024-10-23 10:24:23	Ruhr Nachrichten
de	https://taz.de/Geplante-Justizreform-in-Italien/!6041429/	Geplante Justizreform in Italien: Das Revanchefoul - taz.de	Italiens rechte Regierung erklärt per Dekret 19 Staaten zu sicheren Herkunftsländern und schießt gegen die Justiz. Dahinter steckt ein langfristiger Plan.	https://taz.de/picture/7313092/1200/36834360-1.jpeg 	2024-10-22 18:06:44	taz.de
de	https://news.google.com/rss/articles/CBMiyAFBVV95cUxPUEJiNmxZR0NmSzVvWF8tRWk4YVFMRFluTVUwUjFYQzdyckNIMGVjYVZ2RG1Ua2UzdVpLUWVMck4tdnFVTTRFMm1UTC0wQTMtWGVraHJTV2lHUkpsRUs4b0lZdWlhdW1TSVJLdXhYakI5ZnVOa05ocGJxUkNWU2pJeG9wSXNocDdEcmhJekxBMGhGTW9MR3dsZHVXY3dPRkhFbWtPTmtmQUs5Mkl1YTYyc1N4aHVDZHRsQnBGRE1tU3pUN1d6NDFyRQ?oc=5	Ankara: Vier Tote bei Anschlag auf Rüstungsfirma in der Türkei - Handelsblatt 	None	None	2024-10-23 17:25:30	Handelsblatt 
de	https://www.tagesschau.de/ausland/brics-gipfel-guterres-100.html	BRICS-Gipfel: Putin sieht "multipolare Weltordnung" entstehen - tagesschau.de	Russlands Präsident Putin hat den BRICS-Gipfel offiziell eröffnet. Ihm zufolge bilde sich die von der Gruppe angestrebte "multipolare Weltordnung". Neben mehreren Staatschefs ist auch UN-Generalsekretär Guterres angereist.	https://images.tagesschau.de/image/e28a58ab-74bf-455b-99af-369a4518ebd7/AAABkrlYmn8/AAABkZLhkrw/16x9-1280/putin-1266.jpg	2024-10-23 16:32:00	tagesschau.de
de	https://www.watson.de/leben/digital/439853845-zeitumstellung-winterzeit-handys-stellen-sich-nur-bei-richtiger-einstellung-um	Automatische Zeitumstellung beim Handy? Diese Option muss eingestellt sein - watson	Die Umstellung auf die Winterzeit steht kurz bevor. Aber stellt das Handy sich auch automatisch um?	https://www.watson.de/imgdb/f61b/Qx,F,0,104,2001,1124,831,556,332,299/3433576305892080	2024-10-23 15:01:00	watson
de	https://news.google.com/rss/articles/CBMiaEFVX3lxTE90aWwwZHkybjE2bWIzT1kxZU0wS2lyZXVoZ3RxTGFTZUR3SEFoQlEtUTRCTWZwNTdsV3dfWWVKVGlTUWE1Ql9hRUFvNnNpVXRNNmRaUUlzN0lpRUlmRWxMcU9PZWJOdkFU?oc=5	Regierungsbildung in Österreich: FPÖ bleibt außen vor - taz.de	Bundespräsident erteilt der zweitplatzierten ÖVP den Auftrag zur Regierungsbildung. Denn mit der rechtsradikalen FPÖ will bisher niemand regieren.	https://taz.de/picture/7313593/1200/Oesterreich-Regierung-Van-der-Bellen-1.jpeg 	2024-10-23 06:53:49	taz.de
de	https://www.zeit.de/politik/ausland/2024-10/krieg-nahost-aussenministerin-annalena-baerbock-libanon-humanitaere-hilfe	Krieg in Nahost: Baerbock fordert von Israel mehr humanitäre Hilfe für Gaza - zeit.de	Der Libanon stehe "am Rande des Kollaps", mahnt Außenministerin Baerbock bei ihrem Besuch in Beirut. Sie forderte mehr Hilfen und eine "tragfähige diplomatische Lösung".	https://img.zeit.de/politik/ausland/2024-10/annalena-baerbock-besuch-libanon-humanitaere-hilfe-bild/wide__1300x731	2024-10-23 13:20:29	zeit.de
de	https://www.berliner-zeitung.de/politik-gesellschaft/koalitionsabsage-an-wagenknecht-bsw-empoert-ueber-antrag-von-cdu-kiesewetter-li.2265091	Koalitionsabsage an Wagenknecht? BSW empört über Antrag von CDU-Kiesewetter - Berliner Zeitung	In der CDU werden die Rufe nach einem BSW-Unvereinbarkeitsbeschluss lauter. Der Verteidigungspolitiker Roderich Kiesewetter will eine Entscheidung auf dem nächsten Parteitag.	https://berliner-zeitung.imgix.net/2024/10/23/37e63131-a011-4f4c-8b75-27d3a24ab61c.jpeg?w=1024&auto=format	2024-10-23 15:17:53	Berliner Zeitung
de	https://jungefreiheit.de/politik/deutschland/2024/entmachtet-wagenknecht-ihre-thueringer-statthalterin-wolf/	Entmachtet Wagenknecht ihre Thüringer Statthalterin Wolf? - JUNGE FREIHEIT Die unabhängige Wochenzeitung für Debatte	Im BSW spitzt sich der Konflikt zwischen der Namensgeberin und der Thüringer Landeschefin Wolf zu. Es geht um die Regierungsbeteiligung. Die Satzung gibt Wagenknecht ein scharfes Schwert in die Hand.	https://assets.jungefreiheit.de/2024/10/480712219-1.jpg	2024-10-23 07:56:48	JUNGE FREIHEIT Die unabhängige Wochenzeitung für Debatte
de	https://www.bild.de/politik/inland/brisante-dokumente-carolabruecke-haette-laengst-gesperrt-werden-muessen-671640cf1eb02276e252fe85	Gutachten: Carolabrücke in Dresden hätte längst gesperrt werden müssen! - BILD	Neue Enthüllungen um den Einsturz der Carolabrücke in Dresden: Die Stadt vernachlässigte offenbar Sanierungsmaßnahmen und ignorierte Gutachten.	https://images.bild.de/671640cf1eb02276e252fe85/64f75186dd53c378d2a5fd1544ccdb61,c3dba3ba?w=1280	2024-10-22 09:54:44	BILD
de	https://www.spiegel.de/politik/deutschland/ricarda-lang-scheidende-gruenen-chefin-spricht-selbstkritisch-ueber-ihre-amtszeit-a-4f8c78b7-1e35-4244-b32a-53aabaf1dc03	Ricarda Lang spricht selbstkritisch über ihre Amtszeit - DER SPIEGEL	Für Ricarda Lang ist der Rückzug aus der Grünen-Parteiführung emotional. In einem Interview zieht sie nun Bilanz und erzählt, bei welchem Thema sie aus ihrer Sicht gescheitert ist.	https://cdn.prod.www.spiegel.de/images/aa5ad9a5-6aaf-4d91-a50f-cb31754a041f_w1200_r1.778_fpx54_fpy44.jpg	2024-10-23 09:52:00	DER SPIEGEL
de	https://news.google.com/rss/articles/CBMiwwFBVV95cUxNNjYzbmVtQi1fbllUa2RaWUhQcmNFZEhMNjZjZUdUTERIaTluci1SSEtJTnk0MkVONFNrazZ0TmktME15Y3VfM1NMSXRnT05nT04tTUJXd3VQUnlaeloxdjUwRlU5Y1RIYzh5cVJtbGFQVnRGeHJkekMtd3c1bVlRQlI5eXFkaU5yUDFuQkVZRTNwMm9kNlA5dldSQUZvOWd6czJjbS1qR3RBVUtzX1VHWU05R1NlMzJmUGxBeG81Ukk3Mms?oc=5	CDU-Generalsekretärin Bischof rudert nach "Talahon"-Aussage zurück - hessenschau.de	Für ein Zeitungsinterview erhielt CDU-Generalsekretärin Anna-Maria Bischof ordentlich Gegenwind. Sie beklagte darin "die Einbürgerung einer ganzen Talahon-Generation". Nach Kritik auch aus der eigenen Koalition rudert sie zurück. 	https://www.hessenschau.de/politik/anna-maria-bischof-100~_t-1729686592869_v-16to9__retina.jpg	2024-10-23 10:10:44	hessenschau.de
