country_code	url	title	description	image_url	publish_date	source
de	https://www.sportschau.de/regional/br/br-champions-league-fc-bayern-vor-benfica-es-ist-ein-finale-100.html	Nur Platz 23: Champions League - FC Bayern vor Benfica: "Es ist ein Finale" - Sportschau	Nach zwei Niederlagen in Serie will der FC Bayern in der Königsklasse endlich wieder gewinnen. Joao Palhinha spricht von einem Finale. Vincent Kompany rechnet derweil vor, warum er das ein wenig gelassener sieht.	https://images.sportschau.de/image/dd0b3df9-62b0-40e5-bfbe-28bf3afdb7f3/AAABkv1NQ50/AAABkZLhkrw/16x9-1280/br-vincent-kompany-130.jpg	2024-11-05 16:31:34	Sportschau
de	https://www.n-tv.de/politik/Klingbeil-Deutschland-jetzt-in-der-Verantwortung-article25340424.html	"Ergebnis wird Welt verändern": SPD-Chef Klingbeil: Trump-Sieg wird die Welt verändern - n-tv NACHRICHTEN	Der sich abzeichnende Sieg von Donald Trump bei der US-Präsidentschaftswahl bringt laut Lars Klingbeil weitreichende Konsequenzen mit sich. Die USA könnten weniger international eingreifen – was Deutschland und Europa in die Pflicht nimmt.	https://bilder4.n-tv.de/img/incoming/crop25340427/8061321036-cImg_16_9-w1200/491009027.jpg	2024-11-06 07:46:00	n-tv NACHRICHTEN
de	https://www.handelsblatt.com/politik/international/us-wahl-erst-herrscht-in-kiew-die-ruhe-vor-dem-sturm-dann-gibt-es-whiskey/100084132.html	US-Wahl: Erst herrscht in Kiew die Ruhe vor dem Sturm, dann gibt es Whiskey - Handelsblatt 	None	None	2024-11-06 08:45:30	Handelsblatt 
de	https://www.zeit.de/politik/deutschland/2024-11/boris-pistorius-wehrpflicht-kabinett-abstimmung	Boris Pistorius: Kabinett billigt Pläne für neuen Wehrdienst - zeit.de	Die Bundesregierung hat den Plänen von Verteidigungsminister Boris Pistorius für einen neuen Wehrdienst zugestimmt. Im Ernstfall sollen 460.000 Soldaten bereitstehen.	https://img.zeit.de/politik/deutschland/2024-11/kabinett-wehrdienst-bild/wide__1300x731	2024-11-06 11:20:58	zeit.de
de	https://www.tagesschau.de/inland/regional/sachsen/saechsische-separatisten-afd-landesverband-100.html	AfD schließt mutmaßliche Mitglieder von rechtsextremistischer Gruppe aus - tagesschau.de	Der sächsische AfD Landesverband hat den Ausschluss von drei Parteimitgliedern beschlossen. Ihnen wird vorgeworfen, Teil der mutmaßlich rechtsterroristischen Gruppe "Sächsische Separatisten" zu sein.	https://images.tagesschau.de/image/15836b2b-2233-4473-8559-10e6dd26de4a/AAABkwFrSe4/AAABkZLhkrw/16x9-1280/mdr-grosse-durchsuchungsmassnahmen-bei-einem-beschuldigten-im-dresdner-westen-100.jpg	2024-11-06 13:44:00	tagesschau.de
de	https://www.tagesschau.de/ausland/asien/netanyahu-gallant-opposition-100.html	Israels Opposition geschlossen gegen Gallant-Rauswurf - tagesschau.de	Israels Opposition gilt als zerstritten - und blass, wenn es um den Widerstand gegen die Regierung geht. Doch nach dem Rauswurf von Verteidigungsminister Gallant stellt sie sich geschlossen gegen Premier Netanyahu und ruft zu massiven Protesten auf.	https://images.tagesschau.de/image/fab35db0-546b-4228-ad49-50a2ada55f21/AAABkwGaF5E/AAABkZLhkrw/16x9-1280/lapid-112.jpg	2024-11-06 14:54:00	tagesschau.de
de	https://www.tagesschau.de/inland/innenpolitik/kritische-infrastruktur-kabinett-100.html	Bundeskabinett beschließt besseren Schutz der kritischen Infrastruktur - tagesschau.de	Sabotage, Terroranschläge, Naturkatastrophen: Deutschlands kritische Infrastruktur ist vielen Risiken ausgesetzt. Um die Versorgung der Bevölkerung widerstandsfähiger zu machen, hat das Kabinett einen neuen Gesetzesentwurf verabschiedet.	https://images.tagesschau.de/image/e1958775-1a24-4538-8580-d745eb74e1f1/AAABkwGtQUk/AAABkZLhkrw/16x9-1280/energie-140.jpg	2024-11-06 13:46:00	tagesschau.de
de	https://www.rbb24.de/panorama/beitrag/2024/11/festnahme-toetungsdelikt-berlin-marzahn-mordkommission.html	Mutter und zwei Kinder in Berlin-Marzahn getötet - Polizei nimmt Tatverdächtigen fest - rbb24	Am Sonntagnachmittag hatte die Berliner Polizei drei Leichen in einer Marzahner Wohnung entdeckt - eine Mutter und ihre beiden Kinder. Jetzt wurde der mutmaßliche Täter in Baden-Württemberg gefasst.	https://www.rbb24.de/content/dam/rbb/rbb/rbb24/2024/2024_11/dpa-account/mordkomission-t-ttungsdelikt-berlin-marzahn.jpg.jpg/size=708x398.jpg	2024-11-06 16:32:00	rbb24
de	https://www.zeit.de/politik/deutschland/2024-11/bundeskabinett-beschliesst-hoehere-sozialabgaben-gutverdiener	Sozialversicherung: Kabinett beschließt höhere Sozialabgaben für Gutverdiener - zeit.de	Besserverdienende sollen ab 2025 höhere Kranken-, Pflege- und Rentenbeiträge zahlen. Eine entsprechende Verordnung des Bundesarbeitsministers hat das Kabinett passiert.	https://img.zeit.de/politik/deutschland/2024-11/kabinett-hoehere-sozialabgaben-gutverdiener-bild/wide__1300x731	2024-11-06 12:39:30	zeit.de
de	https://www.sportschau.de/regional/wdr/wdr-der-verblasste-glanz-des-doublegewinners-bayer-leverkusen-100.html	0:4-Niederlage in Liverpool: Der verblasste Glanz des Doublegewinners Bayer Leverkusen - Sportschau	Bayer Leverkusen ist mit einer deutlichen Niederlage aus Liverpool zurückgekehrt. Die Mannschaft gibt zurzeit längst nicht mehr das Bild der vergangenen Saison ab. Das hat Gründe.	https://images.sportschau.de/image/193747bb-830b-47aa-9a05-39bae53a2bf8/AAABkwDhFno/AAABkZLhkrw/16x9-1280/wdr-bayer-spieler-granit-xhaka-jonathan-tah-edmond-tapsoba-florian-wirtz-von-links-in-liverpool-100.jpg	2024-11-06 09:53:00	Sportschau
de	https://www.spiegel.de/ausland/us-wahl-wie-es-bis-zur-machtuebergabe-weitergeht-a-dc3b523e-ef5a-4b8e-bc4a-06b0b7ab0b3f	Wie es nach der US-Wahl bis zur Machtübergabe weitergeht - DER SPIEGEL	Der Republikaner Donald Trump steht als Sieger der US-Präsidentschaftswahl fest. Was passiert nun, bis der 47. Präsident sein Amt antritt?	https://cdn.prod.www.spiegel.de/images/431468d3-6b8e-4be3-802c-7ee25965d475_w1200_r1.778_fpx43.34_fpy55.01.jpg	2024-11-06 16:27:00	DER SPIEGEL
de	https://www.zeit.de/politik/deutschland/2024-11/christian-lindner-ampelkoalition-fdp-usa-donald-trump	Christian Lindner: Besser schlecht regieren als nicht regieren - zeit.de	Es hatte bis gestern Nacht etwas Unernstes, dass Christian Lindner für ein paar Wählerstimmen die Regierung aufs Spiel setzt. Jetzt kann man das niemandem mehr erklären.	https://img.zeit.de/politik/deutschland/2024-11/christian-lindner-ampelkoalition-fdp-usa-donald-trump-bild/wide__1300x731	2024-11-06 16:32:57	zeit.de
de	https://www.sportschau.de/mehr-sport/brisantes-sportfoerdergesetz-der-steinige-weg-zum-ziel,sportfoerdergesetz-spitzensport-106.html	Beschluss der Bundesregierung: Brisantes Sportfördergesetz - Der steinige Weg zum Ziel - Sportschau	Das Sportfördergesetz nimmt die nächste Hürde, ist vom Bundeskabinett beschlossen worden. Doch im Ziel ist es noch lange nicht - und die Athleten fühlen sich übergangen.	https://images.sportschau.de/image/32bbb3d9-3a9b-4fb9-9bf0-2d0ca28103e9/AAABkwHQIlI/AAABkZLhkrw/16x9-1280/faeser-scholz-102.jpg	2024-11-06 14:10:00	Sportschau
de	https://www.tagesschau.de/wirtschaft/unternehmen/bmw-gewinneinbrauch-china-100.html	BMW-Gewinne brechen um mehr als 80 Prozent ein - tagesschau.de	Der deutsche Autobauer BMW musste im dritten Quartal einen deutlichen Gewinneinbruch verkraften. Grund dafür war neben einem umfangreichen Rückruf vor allem der sinkende Absatz in China.	https://images.tagesschau.de/image/90681667-2aaa-45e0-8e85-3ca76e8f15ff/AAABkwDV90U/AAABkZLhkrw/16x9-1280/bmw-266.jpg	2024-11-06 10:01:00	tagesschau.de
de	https://www.handelsblatt.com/politik/international/nach-der-us-wahl-das-ist-trumps-schattenkabinett/100086393.html	Nach der US-Wahl: Das ist Trumps Schattenkabinett - Handelsblatt 	None	None	2024-11-06 12:02:09	Handelsblatt 
de	https://www.fr.de/politik/us-wahl-live-donald-trump-republikaner-wahlsieg-weisses-haus-kamala-harris-demokraten-senat-zr-93396259.html	Trump gewinnt US-Wahl: Verwunderung über Harris – Militärs in großer Sorge - fr.de	None	https://www.fr.de/assets/images/36/128/36128368-donald-trump-hat-die-us-wahl-2024-gewonnen-1MBF2M8Vbffe.jpg	2024-11-06 17:15:00	fr.de
de	https://www.tagesschau.de/ausland/uswahl/donald-trump-wahlsieg-100.html	Republikaner Donald Trump gewinnt US-Präsidentenwahl - tagesschau.de	Nach dem Sieg von Donald Trump in den umkämpften Bundesstaaten Pennsylvania, Wisconsin, Georgia und North Carolina steht fest: Der Republikaner hat die erforderliche Mehrheit an Wahlleuten erreicht und wird nächster US-Präsident.	https://images.tagesschau.de/image/f86cd17f-7abe-4dbd-a811-e9960c8ee9fc/AAABkwBkq_M/AAABkZLhkrw/16x9-1280/trump-3590.jpg	2024-11-06 12:09:00	tagesschau.de
de	https://www.zeit.de/politik/deutschland/2024-11/usa-wahl-trump-wagenknecht-buendnis-deutschland	Reaktionen auf US-Wahl: Wagenknecht fordert nach Trump-Sieg mehr Distanz Deutschlands zu USA - zeit.de	Unter Trump steht Deutschland eine "gnadenlose Zollpolitik" bevor, sagt Sahra Wagenknecht. Von der SPD- und CDU-Führung erwartet sie mehr Distanz zu den USA.	https://img.zeit.de/politik/deutschland/2024-11/sahra-wagenknecht-trump-sieg-distanz-usa-bild/wide__1300x731	2024-11-06 14:31:04	zeit.de
de	https://www.ndr.de/nachrichten/info/Donald-Trump-siegt-bei-der-US-Wahl-2024-gegen-Kamala-Harris-die-Reaktionen,uswahlnordreaktionen100.html	Donald Trump gewinnt US-Wahl 2024 gegen Kamala Harris: Reaktionen aus dem Norden - NDR.de	Donald Trump hat die US-Präsidentschaftswahl gewonnen. Viele Politikerinnen und Politiker aus Niedersachsen, Schleswig-Holstein, Mecklenburg-Vorpommern und Hamburg sind sich einig: Deutschland muss zukünftig wirtschaftlich und sicherheitspolitisch unabhängiger werden von den USA.	https://www.ndr.de/trump1268_v-contentxl.jpg	2024-11-06 17:27:00	NDR.de
de	https://www.spiegel.de/wirtschaft/unternehmen/tesla-aktie-gewinnt-angesichts-von-wahrscheinlichem-trump-sieg-deutlich-a-88b76931-0482-47c2-808d-5a83b7005e07	Tesla-Aktie gewinnt angesichts von wahrscheinlichem Trump-Sieg deutlich - DER SPIEGEL	An den Börsen werden bereits Gewinner und Verlierer des Wahlsiegs von Donald Trump gekürt. Der Tesla-Konzern von Trump-Freund Elon Musk profitiert, das Regime in Teheran hat ein Währungsproblem.	https://cdn.prod.www.spiegel.de/images/1dfe865f-4eca-49dc-bc01-f7c2ffa3bd5f_w1200_r1.778_fpx47.83_fpy46.96.jpg	2024-11-06 11:21:00	DER SPIEGEL
de	https://www.tagesspiegel.de/internationales/harris-verliert-wichtige-swing-states-us-medien-erklaren-trump-zum-wahlsieger-12652409.html	Swing States strafen Harris ab Trump holt auch Pennsylvania – nur noch vier Wahlmänner bis zum Sieg - Tagesspiegel	Es hatte sich bereits Stunden zuvor abgezeichnet, nun prognostizieren CNN und Co.: Donald Trump wird erneut US-Präsident. Er könnte alle Swing States gegen Kamala Harris gewonnen haben.	https://www.tagesspiegel.de/images/12657722/alternates/BASE_16_9_W1400/1730911498000/topshot-us-vote-politics-harris.jpeg	2024-11-06 07:11:00	Tagesspiegel
de	https://www.deutschlandfunk.de/treffen-des-koalitionsausschusses-im-kanzleramt-ampel-regierung-ringt-um-ihre-zukunft-100.html	Haushaltsstreit - Treffen des Koalitionsausschusses im Kanzleramt - Ampel-Regierung ringt um ihre Zukunft - Deutschlandfunk	Die Spitzen der Ampel-Koalition sind am Abend zu einem Treffen im Kanzleramt zusammengekommen, das über die Zukunft des Regierungsbündnisses entscheiden könnte. Ziel der Krisengespräche im Koalitionsausschuss ist es, eine Lösung für den seit Wochen währenden Streit um die Haushalts- und Wirtschaftspolitik zu finden.	https://bilder.deutschlandfunk.de/26/62/9f/a2/26629fa2-7923-4741-a459-0705bfb4242a/scholz-kanzleramt-koalitionsausschuss-100-1920x1080.jpg	2024-11-06 18:05:24	Deutschlandfunk
de	https://www.n-tv.de/politik/US-wahl-2024/Faschist-Trump-als-Oberbefehlshaber-US-Militaers-graut-es-vor-Trumps-autoritaeren-Bestrebungen-article25341963.html	"Faschist" Trump als Oberbefehlshaber: US-Militärs graut es vor Trumps autoritären Bestrebungen - n-tv NACHRICHTEN	Donald Trump wird zum zweiten Mal Präsident der Vereinigten Staaten und damit erneut auch Oberbefehlshaber der US-Streitkräfte. Viele fürchten, er könnte seine Macht für seine eigenen Ziele nutzen. Militärs, die Trump aus der ersten Amtszeit kennen, warnen vor seinen autoritären Bestrebungen.	https://bilder3.n-tv.de/img/incoming/crop25342042/8561324574-cImg_16_9-w1200/124990129.jpg	2024-11-06 13:15:00	n-tv NACHRICHTEN
de	https://www.mdr.de/nachrichten/sachsen/politik/landtagswahl/sondierung-cdu-bsw-spd-gescheitert-wagenknecht-100.html	Keine Brombeer-Koalition in Sachsen - CDU und SPD geben Wagenknecht die Schuld - MDR	Das Bündnis Sahra Wagenknecht hat die Sondierungen mit CDU und SPD zu einem Regierungsbündnis in Sachsen für gescheitert erklärt. Ausschlaggebend seien Differenzen bei der sogenannten Friedensformel gewesen.	https://cdn.mdr.de/nachrichten/sachsen/sondierung-gescheitert-104_v-variantBig16x9_wm-true_zc-ecbbafc6.jpg?version=14145	2024-11-06 16:40:00	MDR
de	https://www.merkur.de/wirtschaft/koalition-am-rande-des-zusammenbruchs-rentner-koennten-die-leidtragenden-der-ampel-krise-sein-zr-93391451.html	Koalitionskrise: Rentner könnten die Auswirkungen vom Ampel-Aus zu spüren bekommen - Merkur.de	None	https://www.merkur.de/assets/images/36/38/36038681-unstimmigkeiten-um-die-wirtschaftspolitische-lage-in-deutschland-habeck-scholz-und-lindner-haben-jeweils-ihre-eigenen-plaene-3Kfe.jpg	2024-11-06 16:06:00	Merkur.de
de	https://www.spiegel.de/ausland/us-wahl-so-haben-die-staaten-beim-abtreibungsrecht-entschieden-a-b90a74f4-813d-4f40-b1f7-44a23edd6277	Abtreibungsrecht bei der US-Wahl: So haben die Staaten entschieden - DER SPIEGEL	In zehn US-Bundesstaaten haben Wählende über das Thema Schwangerschaftsabbrüche abgestimmt. Nicht überall passt das Ergebnis zu dem der Präsidentschaftswahl. Der Überblick.	https://cdn.prod.www.spiegel.de/images/612f69b7-fd08-4c2b-9718-c603b05a7a91_w1200_r1.778_fpx35.05_fpy49.99.jpg	2024-11-06 12:40:00	DER SPIEGEL
de	https://www.tagesschau.de/ausland/europa/ukraine-nordkorea-kriegshilfe-100.html	Nordkoreanische Truppen laut Ukraine bereits im Einsatz - tagesschau.de	In der russischen Grenzregion Kursk hat es laut der Ukraine erstmals Zusammenstöße zwischen ukrainischen und nordkoreanischen Truppen gegeben. Bis zu 15.000 nordkoreanische Soldaten könnten sich demnach in Russland befinden.	https://images.tagesschau.de/image/887a313e-3ef3-4c85-94e0-3c2f062bc05b/AAABkvGzMlc/AAABkZLhkrw/16x9-1280/selenskyj-722.jpg	2024-11-06 11:01:00	tagesschau.de
de	https://news.google.com/rss/articles/CBMisgFBVV95cUxOSFYxM3VPeVZhY2tzM3FUUUktbEx3b0lrYjhYMHgwUWY5RmhIcHo3QnNsQ0FkSHdiYlJSWFVfU2N6SlNZaERkZmVrOWxZbjBMeDVqdkhDUFQwMUNJZ2RiR0paNjN1OVE4QUpIbWY3M0xxdzFXeUppanNieG0wRDhQd0VRMnUyMlFLVlhvYXh4TGwzOG12U3lWeDBkRTlpTG9uUllFc2VwX0Z5RVN6UnNmQlln0gGwAUFVX3lxTE91eGVoaDZNeGJ3VXJMaUJTZGZrQ3dtd0NhUG9UVlBvenhrZFVWN0xFZTJyT1oyVm9WdU5XMFNZMDk3NVd5ekR0UVJ2Q2NGMk5lV3RBVVpLOU1EWkp6ZWs5SF9VMUpQUTMxNkVaVTdrcjVYLXJTMElpRG9hTzBTN3JUdG83Z0ZYTFNTb1d3ZVMtOWgxQW01REVpUWtkTnotMmhic3JFb1lUQ1Y5d1FpdXQ0?oc=5	Guten Morgen, NRW! - WDR Nachrichten	None	None	2024-11-06 08:04:16	WDR Nachrichten
de	https://www.faz.net/aktuell/politik/inland/krise-der-ampel-steinmeier-in-austausch-mit-scholz-und-merz-110094054.html	Krise der Ampel: Steinmeier in Austausch mit Scholz und Merz - FAZ - Frankfurter Allgemeine Zeitung	None	None	2024-11-06 15:02:03	FAZ - Frankfurter Allgemeine Zeitung
de	https://news.google.com/rss/articles/CBMiugFBVV95cUxPR1NrdzRzbHZ6U1g3WHhBTzVybnZPQXJJbzJVV3pYMXl3U2RCOW5HVmJEUkNIQjFwQWlqTE5tdDhMNU1YdmdXQ3NFeGQyWGxGUzhhX20xZUlLWk5Pd3dvaHY1enZRdUJMTkZtamdacHF0Q1IwNXlKZGJ6RHV2ZTNhLWw4TkxiZXRhU1I4V3NmZHUyZ1VQOWJWeUR5MDdOLWo4VDlsX0hWaVcwZkx2N0VPQ2R0SkpCVzdpRHc?oc=5	Großes Fan-Chaos vor Anpfiff! Bayern reagiert - SPORT1	None	None	2024-11-06 18:09:16	SPORT1
de	https://www.handelsblatt.com/politik/international/us-wahl-2024-wahllokale-in-umkaempften-staaten-geschlossen-trump-gewinnt-in-north-carolina/29669594.html	US-Wahl: Wahllokale in umkämpften Staaten geschlossen - Handelsblatt 	None	None	2024-11-06 03:24:00	Handelsblatt 
de	https://news.google.com/rss/articles/CBMitgFBVV95cUxPMkZDZllZVV9oZDNMLXRtbDFHeFJja1ZIR1VYRkFMUlhYUFpuVVU2d25TeFFqSkpQcDQ3R183RzRLNTQ0YXVMSGlEWGJxMGRNa1pMbFJoSWlET09WOEZzWFdXQ3Frbk8wNW9feEd2VC02SzZRdW1PNFhZSi1pZkVLVFJQakxucTg5SmZoblpkSTJqVF9KQTBqTnY5MURQcWJEdXRnWUl2czhEZHlyQTFpbDVQczVqQQ?oc=5	Marktbericht: Nach Trump Sieg: Ernüchterung an der Börse - tagesschau.de	None	None	2024-11-06 15:20:00	tagesschau.de
de	https://news.google.com/rss/articles/CBMirwFBVV95cUxPbE1uLWJGUXhUOGs4NjM3ZmNmaDQ2b0xFUmtZRDJYNWIyXzZ1ZFhoYmtFVnVvajAyajVaSk16UlAydkVHSWdLOEwtQU9FTTg1ZzVYZW1uZEY1a19BYWtwYkk4QWM0Tll1aV9YZEctbUpiZ19TRUlwTnJCMDlrNzQtVmd1MndUbnoyU0JQdkNxX2txTDREdDlYWkxZUFRsVUVzNXdQRWpjTkV6N2tEUGQw?oc=5	"SZ" vermeldet Absage für DFB-Team: Paul Wanner will (noch) nicht zu Nagelsmann - Sportschau	None	None	2024-11-06 16:10:00	Sportschau