country_code	url	title	description	image_url	publish_date	source
de	https://www.tagesschau.de/wirtschaft/verbraucher/weinlese-winzer-wein-verbrauch-trauben-ernte-wetter-niederschlaege-100.html	Deutsche Winzer ernten deutlich weniger Trauben - tagesschau.de	Die Weinlese fällt 2024 voraussichtlich so niedrig aus wie seit 2017 nicht mehr, berichtet das deutsche Weininstitut. In einigen Anbaugebieten kam es wetterbedingt sogar teilweise zu totalen Verlusten.	https://images.tagesschau.de/image/59fabf2c-8be1-4c51-95fd-5ff3b4cd4183/AAABksIr0-M/AAABkZLhkrw/16x9-1280/deutscher-wein-100.jpg	2024-10-25 07:25:00	tagesschau.de
de	https://www.tagesschau.de/ausland/europa/tuerkei-pkk-anschlag-106.html	PKK bekennt sich zu Anschlag in Ankara - tagesschau.de	Die verbotene kurdische Arbeiterpartei PKK hat den Anschlag mit fünf Toten in Ankara für sich reklamiert. Zuvor identifizierte die türkische Regierung bereits die mutmaßlichen Attentäter als PKK-Mitglieder.	https://images.tagesschau.de/image/ba2a4533-38cb-4833-968b-d63237513fd6/AAABkr680fM/AAABkZLhkrw/16x9-1280/ankara-anschlag-116.jpg	2024-10-25 10:41:00	tagesschau.de
de	https://www.rbb24.de/panorama/beitrag/2024/10/berlin-tausende-antraege-aenderung-geschlecht-name-selbstbestimmungsgesetz.html	Selbstbestimmungsgesetz: Mehr als 1.200 Anträge auf Änderung von Geschlecht und Name in Berlin - rbb24	Geschlecht und Name an die eigene Lebenswirklichkeit anpassen - das ist ab dem 1. November mit dem Selbstbestimmungsgesetz mit vergleichsweise wenig Hürden möglich. Anträge sind bereits gestellt werden und die Zahlen zeigen: Das Interesse ist da.	https://www.rbb24.de/content/dam/rbb/rbb/rbb24/2024/2024_10/imago-images/standesamt-kreuzberg.jpg.jpg/size=708x398.jpg	2024-10-25 10:43:00	rbb24
de	https://www.rbb24.de/politik/beitrag/2024/10/kantstrasse-radweg-fahrstreifen-neuordnung.html	Fahrstreifen auf der Kantstraße sollen neu geordnet werden - rbb24	Die Berliner Verkehrsverwaltung und der Bezirk Charlottenburg-Wilmersdorf haben sich geeinigt: Die Fahrstreifen auf der Kantstraße sollen neu geordnet werden. Damit soll der Brandschutz für die Anwohner gewährleistet werden.	https://www.rbb24.de/content/dam/rbb/rbb/rbb24/2024/2024_10/imago-images/kantstrasse-verkehr.jpg.jpg/size=708x398.jpg	2024-10-25 11:27:00	rbb24
de	https://www.nzz.ch/feuilleton/bauhaus-expertin-barbara-steiner-kritisiert-afd-reinstes-moderne-bashing-ld.1854146	Bauhaus-Expertin Barbara Steiner kritisiert AfD: «Reinstes Moderne-Bashing» - Neue Zürcher Zeitung - NZZ	Die AfD hat das Bauhaus als Irrweg der Moderne bezeichnet, der eine «menschenfeindliche» Architektur hervorgebracht habe. Barbara Steiner, Direktorin der Stiftung Bauhaus Dessau, hält dagegen.	https://img.nzz.ch/2024/10/25/279b23ad-d17f-4fb4-b9ae-e995e54ca7bf.jpeg?width=1200&height=675&fit=bounds&quality=75&auto=webp&crop=3662,2060,x0,y295&wmark=nzz	2024-10-25 03:30:00	Neue Zürcher Zeitung - NZZ
de	https://www.ndr.de/nachrichten/hamburg/Kurioser-Fall-in-Hamburg-Zebrastreifen-kostet-Bezirk-Tausende-Euro,zebrastreifenlangenhorn100.html	Kurioser Fall in Hamburg: Zebrastreifen kostet Bezirk Tausende Euro - NDR.de	Ein aufgemalter Zebrastreifen in Langenhorn könnte für den Bezirk Nord richtig teuer werden. Mehrere Wochen sorgte die falsche Fußgängerüberquerung für Verwirrung bei Autofahrerinnen und Autofahrern.	https://www.ndr.de/nachrichten/hamburg/zebrastreifen162_v-contentxl.jpg	2024-10-25 15:23:00	NDR.de
de	https://www.sportschau.de/regional/ndr/ndr-furiose-wueck-premiere-dfb-frauen-gewinnen-gegen-england-100.html	Sieben Tore in Wembley: Furiose Wück-Premiere - DFB-Frauen gewinnen gegen England - Sportschau	Die deutschen Fußballerinnen lieferten beim Debüt von Bundestrainer Christian Wück ein Spektakel und gewannen verdient im Londoner Wembley-Stadion.	https://images.sportschau.de/image/641fc3aa-d470-4260-9022-1a7c8b88560f/AAABksVdL9E/AAABkZLhkrw/16x9-1280/ndr-die-deutschen-fussballerinnen-feiern-ein-tor-von-giulia-gwinn-m-im-wembley-stadion-gegen-england-100.jpg	2024-10-25 21:20:00	Sportschau
de	https://www.sportschau.de/fussball/bundesliga2/sc-paderborn-schiesst-1-fc-koeln-tiefer-in-die-krise,zweite-bundesliga-koe-scp-100.html	Doppelpack von Michel: SC Paderborn schießt 1. FC Köln tiefer in die Krise - Sportschau	Dem 1. FC Köln stehen ungemütliche Tage bevor: Gegen den SC Paderborn musste der Bundesliga-Absteiger den nächsten heftigen Rückschlag hinnehmen.	https://images.sportschau.de/image/39828e7b-2a9d-4448-b264-5c623ca8d539/AAABksTsrYk/AAABkZLhkrw/16x9-1280/paderborn-michel-jubel-100.jpg	2024-10-25 20:10:00	Sportschau
de	https://www.tagesschau.de/inland/innenpolitik/junge-union-halle-100.html	Junge Union bestätigt Winkel als Vorsitzenden der Jungen Union - tagesschau.de	239 von 266 Stimmen hat Johannes Winkel in Halle (Saale) bekommen. Damit bleibt der 32-Jährige Chef der Jungen Union. Auf deren "Deutschlandtag" forderte CDU-Generalsekretär Linnemann starke Änderungen in der Migrationspolitik.	https://images.tagesschau.de/image/95b4cc60-021f-4a88-842d-4238239b3ac5/AAABksW2jMg/AAABkZLhkrw/16x9-1280/johannes-winkel-100.jpg	2024-10-25 22:05:00	tagesschau.de
de	https://taz.de/Krise-der-Linkspartei/!6043072/	Krise der Linkspartei: Ein Tropfen reicht, um das Fass zum Überlaufen zu bringen - taz.de	Gerade hat die Linkspartei eine neue Führung gewählt, treten prominente Mitglieder aus. Davon wird die Welt allerdings auch nicht besser.	https://taz.de/picture/7318679/1200/36800022-1.jpeg 	2024-10-25 17:53:16	taz.de
de	https://www.zeit.de/politik/deutschland/2024-10/ukrainische-gefluechtete-wie-asylbewerber-behandeln	Ukrainische Geflüchtete: Landkreistag fordert weniger Unterstützung für ukrainische Geflüchtete - zeit.de	Ukrainische Geflüchtete sollten dem Landkreistag zufolge den gleichen Status wie Asylbewerber erhalten. Außerdem bräuchten die Jobcenter deutlich mehr Geld.	https://img.zeit.de/politik/deutschland/2024-10/landkreistag-ukrainische-gefluechtete-wie-asylbewerber-behandeln-bild/wide__1300x731	2024-10-26 02:07:28	zeit.de
de	https://www.gladbachlive.de/news/gladbach-remis-in-mainz-trainer-meinungen-gehen-auseinander-885493	„Musst du gewinnen“ Remis in Mainz: Meinungen der Trainer gehen auseinander – Kleindienst zufrieden - GladbachLIVE	Punktgewinn für Borussia Mönchengladbach! Das sind die Stimmen und Reaktionen der Spieler und Verantwortlichen nach dem 1:1 am achten Spieltag der Bundesliga gegen den FSV Mainz 05.	https://image.ds.dumont.de/2024/10/25/2912ada0-32eb-4f32-a467-3588313e49c1.jpeg?w=3000&auto=format&q=75&format=auto&s=26b164107ea73e5263b50a2d3ddd893b	2024-10-25 21:12:31	GladbachLIVE
de	https://www.wiwo.de/politik/ausland/us-wahl-2024-deshalb-fuehrt-donald-trump-ploetzlich-in-einigen-umfragen/30056170.html	US-Wahl 2024: Deshalb führt Donald Trump plötzlich in Umfragen - WirtschaftsWoche	None	None	2024-10-25 10:14:06	WirtschaftsWoche
de	https://www.berliner-zeitung.de/politik-gesellschaft/wagenknechts-wende-bsw-gibt-in-thueringen-bei-sondierungen-alle-positionen-auf-li.2266136	Wagenknechts Wende: BSW gibt in Thüringen bei Sondierungen alle Positionen auf - Berliner Zeitung	Das BSW hat in Thüringen offenbar alle kontroversen Positionen aufgegeben – Russland, Gas, Corona, Verfassungsschutz. Die Fans der Partei dürften sich wundern.	https://berliner-zeitung.imgix.net/2024/10/25/e45c163f-5503-4437-b365-64733adcec6f.jpeg?w=1024&auto=format	2024-10-25 19:38:47	Berliner Zeitung
de	https://www.tagesspiegel.de/gesellschaft/panorama/hessen-todliche-polizeischusse-in-hessen-frau-ohne-scharfe-waffe-12595331.html	„Sieht einer scharfen Waffe zum Verwechseln ähnlich“ Von Polizisten getötete Frau trug keine mit Munition beladene Waffe - Tagesspiegel	Nach den tödlichen Schüssen auf eine Frau vor einer Polizeistation in Nordhessen sind viele Fragen offen. Den Ermittlungen zufolge richtete sie eine Waffe auf die Beamten, die nicht scharf war.	https://www.tagesspiegel.de/images/12595328/alternates/BASE_16_9_W1400/1729859452000/frau-zieht-waffe-gegen-beamte-und-wird-erschossen.jpeg	2024-10-25 12:30:37	Tagesspiegel
de	https://www.morgenpost.de/politik/article407548436/explosionen-in-teheran-israel-schlaegt-offenbar-zurueck.html	Israel greift Militär-Ziele im Iran an – Teheran will reagieren - Berliner Morgenpost	Explosionen in Tel Aviv: Der lang erwartete Rückschlag Israels gegen den Iran erfolgt gezielt. Teheran sperrt den Luftraum – stellt den Angriff aus Tel Aviv aber als harmlos dar.	https://img.sparknews.funkemedien.de/407548488/407548488_1729905987_v16_9_1600.jpeg	2024-10-26 06:06:00	Berliner Morgenpost
de	https://www.berliner-zeitung.de/politik-gesellschaft/auch-bsw-stimmt-fuer-afd-antrag-landtag-in-sachsen-bekommt-corona-untersuchungsausschuss-li.2265969	Auch BSW stimmt für AfD-Antrag: Landtag in Sachsen bekommt Corona-Untersuchungsausschuss - Berliner Zeitung	Künftig soll im sächsischen Landtag die Corona-Politik aufgearbeitet werden. Neben der AfD stellte auch die Wagenknecht-Partei einen Antrag. Dieser fiel jedoch durch.	https://berliner-zeitung.imgix.net/2024/10/25/c9a36978-98a7-45a5-bf07-7df855d98f18.jpeg?w=1024&auto=format	2024-10-25 15:11:14	Berliner Zeitung
de	https://www.welt.de/wirtschaft/article254190414/TK-Statistik-Krankschreibungen-steigen-seit-Jahresbeginn-auf-Rekordwert.html	TK-Statistik: Krankschreibungen steigen seit Jahresbeginn auf Rekordwert - WELT	Nie zuvor haben sich in den ersten neun Monaten eines Jahres so viele Versicherte krankschreiben lassen wie 2024, teilt die TK mit. Vor allem Erkältungskrankheiten nehmen zu. Wissenschaftler haben aber einen anderen Grund für die steigenden Zahlen gefunden.	https://img.welt.de/img/wirtschaft/mobile254190960/0127931567-ci16x9-w1200/Krankschreibung.jpg	2024-10-25 23:28:20	WELT
de	https://www.fr.de/panorama/jahrhundertwinter-in-deutschland-wetterexperte-erklaert-eiszeit-szenario-zr-93374747.html	Jahrhundertwinter in Deutschland? Wetterexperte erklärt Eiszeit-Szenario - fr.de	None	https://www.fr.de/assets/images/35/993/35993500-nach-heftigem-schneetreiben-und-eisregen-sind-strommasten-zusammengebrochen-36fe.jpg	2024-10-26 05:09:00	fr.de
de	https://www.lvz.de/lokales/leipzig/von-der-mpk-in-die-disco-ministerpraesidenten-feiern-in-leipzigs-elsterartig-EGBLSS43XVDNZKXPMJCERBEWJ4.html	Von der MPK in die Disco: Ministerpräsidenten feiern in Leipzigs „Elsterartig“ - Leipziger Volkszeitung	Der zweite Tag der Ministerpräsidentenkonferenz in Leipzig ist planmäßig zu Ende gegangen. Dutzende Demonstrierende erwarteten die Länderchefs am Zoo. Die MPK-Chef-Organisatorin zeigte sich sehr zufrieden mit den Abläufen in Leipzig. 	https://www.lvz.de/resizer/v2/IYX7AYP4IREV7ANSUCIMIQIM7Y.jpg?auth=5c687fe39e24a31a0e19cbd95289b397163463fd7011c2146eefca0582bd2ec5&quality=70&width=1200&height=630&smart=true	2024-10-25 14:45:36	Leipziger Volkszeitung
de	https://www.tagesschau.de/ausland/amerika/biden-indigene-entschuldigung-100.html	Misshandlung in Internaten: Biden bittet Indigene um Entschuldigung - tagesschau.de	150 Jahre lang wurden indigene Kinder in den USA in staatliche Zwangsinternate gesteckt und dort misshandelt. Hunderte Kinder starben. US-Präsident Biden hat nun erstmals eine historische Entschuldigung an die Indigenen gerichtet.	https://images.tagesschau.de/image/a6c105f6-9c7a-4b60-a710-a58f69c64654/AAABkseUgww/AAABkZLhkrw/16x9-1280/biden-indigene-100.jpg	2024-10-26 07:34:00	tagesschau.de
de	https://www.zeit.de/digital/internet/2024-10/us-wahl-betrugsvideo-stimmzettel-russland	US-Wahl: Angebliches Wahlbetrugsvideo offenbar von Russland erstellt - zeit.de	US-Behörden werfen russischen Akteuren vor, einen gefälschten Clip auf der Plattform X verbreitet zu haben. Darin werden angeblich Stimmzettel für Trump zerrissen. 	https://img.zeit.de/digital/internet/2024-10/us-wahl-betrugsvideo-stimmzettel-russland-1/wide__1300x731	2024-10-26 05:31:16	zeit.de
de	https://www.mdr.de/nachrichten/sachsen-anhalt/halle/halle/dreifache-mutter-vermisst-tot-obduktion-104.html	Vermisste dreifache Mutter aus Halle ist tot: Obduktion angeordnet - MDR	Eine Frau aus Halle ist fast zwei Wochen lang vermisst worden. Nun gibt es traurige Gewissheit: Die dreifache Mutter ist tot. Eine Obduktion ihrer Leiche soll die Todesursache klären.	https://cdn.mdr.de/presse/bild-obduktionssaal-100_v-variantBig16x9_wm-true_zc-ecbbafc6.jpg?version=52145	2024-10-26 07:08:02	MDR
de	https://www.tagesschau.de/ausland/asien/sturm-trami-philippinen-100.html	Zerstörung und Tote durch Sturm "Trami" auf den Philippinen - tagesschau.de	Auch wenn der Sturm "Trami" nicht als ausgewachsener Taifun eingestuft wird, sind die Folgen enorm: Viele Häuser auf den Philippinen sind zerstört, manche Gegenden unpassierbar. Mehr als 60 Menschen starben.	https://images.tagesschau.de/image/0b414bc9-a619-4beb-9ddd-8451df7280fe/AAABksJL6U0/AAABkZLhkrw/16x9-1280/trami-philippinen-102.jpg	2024-10-25 08:55:00	tagesschau.de
de	https://www.lvz.de/lokales/leipzig/leipzig-13-jaehrige-soll-ihre-7-jaehrige-schwester-getoetet-haben-FR67MZZPHJBU5HTETTCMXU3OVA.html	Leipzig: 13-Jährige soll ihre 7-jährige Schwester getötet haben - Leipziger Volkszeitung	Schockierender Fall in einem Mehrfamilienhaus im Leipziger Stadtteil Kleinzschocher: Laut Polizei hat eine 13-Jährige ihrer Schwester tödliche Verletzungen zugefügt. Die Kripo ermittelt.	https://www.lvz.de/resizer/v2/SLRGPVHDFJBZHO4H3QV2LCTEBA.jpg?auth=8a20ac45da27a81c3cf590afc562c7e1951e41077e70d714c757c28da273a7d6&quality=70&width=1200&height=630&smart=true	2024-10-26 08:35:55	Leipziger Volkszeitung
de	https://www.tagesschau.de/wissen/gesundheit/zeitumstellung-normalzeit-100.html	Sommerzeit - Normalzeit: Ist denn schon wieder Zeitumstellung? - tagesschau.de	Jedes halbe Jahr die selbe Frage: Stellen wir die Uhr eine Stunde vor oder zurück? Und jedes Mal wird darüber diskutiert, ob die Sommer- oder die Normalzeit besser ist. Von Constanze Fett.	https://images.tagesschau.de/image/bb2b08de-8737-436c-8e0e-00c8ce4e0e49/AAABhnvE_b0/AAABkZLhkrw/16x9-1280/zeitumstellung-205.jpg	2024-10-26 09:07:00	tagesschau.de
de	https://www1.wdr.de/nachrichten/zukunft-von-ard-und-zdf-laenderchefs-wollen-weniger-tv-und-radiosender-100.html	Zukunft von ARD und ZDF: Länderchefs einigen sich auf Reformen - WDR Nachrichten	None	None	2024-10-25 14:12:00	WDR Nachrichten
de	https://www.mdr.de/nachrichten/sachsen/chemnitz/kulturhauptstadt-veranstaltungen-programm-steht-fest-kultur-news-100.html	Chemnitz Kulturhauptstadt 2025: Diese Veranstaltungen sind im Programm geplant - MDR	Mit großen Ausstellungen, wie zu Evard Munch, aber auch mit Projekten aus der Nachbarschaft will Chemnitz als Kulturhauptstadt 2025 Millionen anlocken. Nun wurde das Programm unter dem Motto "C the Unseen" vorgestellt. 	https://cdn.mdr.de/nachrichten/sachsen/chemnitz/chemnitz-stollberg/kulturhauptstadt-230_v-variantBig16x9_wm-true_zc-ecbbafc6.jpg?version=59686	2024-10-25 10:41:19	MDR
de	https://www.saarbruecker-zeitung.de/saarland/saar-wirtschaft/batteriehersteller-svolt-stellt-betrieb-in-europa-ein_aid-120384207	Alle Mitarbeiter entlassen: Aus für SVolt in Europa verkündet - Saarbrücker Zeitung	Nach SZ-Information hat SVolt Europe all seine Mitarbeiter gekündigt. Der Betrieb wird Ende Januar 2025 eingestellt. Gerüchten zufolge könnte SVolt einen anderen Standort in Europa planen. 	None	2024-10-25 11:18:00	Saarbrücker Zeitung
de	https://www.tagesschau.de/ausland/amerika/vance-hackerangriff-china-100.html	Berichte: Chinesische Cyberangriffe auf Telefone von Trump und Vance - tagesschau.de	Chinesische Hacker haben US-Medienberichten zufolge die Telefone von Trump und seinem Vizekandidaten Vance ins Visier genommen. Auch das Umfeld von Harris sei betroffen. Ob Daten gestohlen wurden, ist unklar.	https://images.tagesschau.de/image/6e973d61-8ca6-4ea8-bdbf-9ecfae758f83/AAABksfXZnc/AAABkZLhkrw/16x9-1280/trump-vance-120.jpg	2024-10-26 08:32:00	tagesschau.de
de	https://www.br.de/nachrichten/sport/2-bundesliga-1-fc-nuernberg-ssv-jahn-regensburg-zehn-tore-spektakel-kloses-fcn-demuetigt-jahn,USE6phi	Elf-Tore-Spektakel in Nürnberg: Kloses Club demütigt Regensburg - BR24	In einem verrückten Spiel schlägt der 1. FC Nürnberg den SSV Jahn Regensburg mit 8:3 (3:2) und nimmt den Rückenwind aus dem Frankenderby mit. Die Oberpfälzer beenden zwar ihre Torflaute, sind aber weiter in akuter Abstiegsgefahr.	https://img.br.de/3e504ee0-b2a3-4205-b2af-ac925335c917.jpeg?q=80&rect=0%2C78%2C3833%2C2155&w=1600&h=900	2024-10-26 07:42:21	BR24
de	https://www.tag24.de/thema/baby/lebendig-im-sarg-totes-baby-erwacht-bei-eigener-beerdigung-3328391	Lebendig im Sarg: Totes Baby erwacht bei eigener Beerdigung - TAG24	In Brasilien wurde ein neun Monate altes Kind fälschlicherweise für tot erklärt. Kurz darauf verstarb das Baby aber wirklich. | TAG24	https://media.tag24.de/1200x800/z/n/znt9prkn1v01yn9dazkd78axjeio7x0t.jpg	2024-10-26 04:00:02	TAG24
de	https://www.sportnews.bz/artikel/wintersport/ski-alpin/live-los-gehts-weltcup-auftakt-der-frauen-in-soelden	LIVE | Los geht’s: Weltcup-Auftakt der Frauen in Sölden - SportNews.bz	Der Tag des Skiweltcup-Auftakts 2024/25 ist da! Am Rettenbachferner in Sölden führt nach dem 1. Durchgang die US-Amerikanerin Mikaela Shiffrin. Die Azzurre um Federica Brignone sind in Lauerposition. Was sich im Finale tut, erfahren Sie ab 13 Uhr im SportNews-Liveticker.	https://s3-images.sportnews.bz/_images/fit/1000x563/img/2024/10/federica-brignone-liegt-auf-rang-3.jpg	2024-10-26 07:49:11	SportNews.bz
de	https://www.fr.de/politik/im-ukraine-krieg-soeldner-berichtet-von-acht-toten-offizieren-unter-nordkorea-soldaten-93372562.html	Im Ukraine-Krieg: Söldner berichtet von acht toten Offizieren unter Nordkorea-Soldaten - fr.de	None	https://www.fr.de/assets/images/35/834/35834058-kim-jong-un-nordkorea-3Tfe.jpg	2024-10-26 10:03:00	fr.de
de	https://www.fr.de/politik/georgien-wahl-russland-eu-regierung-opposition-autoritaer-militaer-besetzung-agenten-zr-93374903.html	Georgien wählt am Abgrund: „Wofür Putin Jahre gebraucht hat, machen sie in zwei Monaten“ - fr.de	None	https://www.fr.de/assets/images/35/969/35969974-eu-oder-russland-georgien-steht-vor-einer-schicksalswahl-putins-russland-gibt-der-regierungspartei-offenbar-die-richtung-vor-3fFHulhnCWfe.jpg	2024-10-26 10:13:00	fr.de
de	https://www.fr.de/politik/russland-ukraine-krieg-brics-staaten-keine-rueckendeckung-fuer-wladimir-putin-93373135.html	Keine Rückendeckung für Putin: Brics-Staaten zieren sich bei weiterer Russland-Unterstützung - fr.de	None	https://www.fr.de/assets/images/35/970/35970227-narenda-modi-wladimir-putin-und-xi-jinping-beim-brics-gipfel-in-kasan-alexander-shcherbak-imago-3Rfe.jpg	2024-10-26 09:19:00	fr.de
de	https://www.zeit.de/gesellschaft/2024-10/ermittlungen-verdacht-misshandlung-gefangene-justizvollzugsanstalt-augsburg-gablingen	JVA Augsburg-Gablingen: Gefängnismitarbeiter in Bayern sollen Häftlinge misshandelt haben - zeit.de	Die Staatsanwaltschaft in Augsburg ermittelt gegen Mitarbeiter der dortigen Justizvollzugsanstalt. Sie sollen Gefangene geschlagen und anderweitig malträtiert haben.	https://img.zeit.de/gesellschaft/2024-10/jva-augsburg-gablingen/wide__1300x731	2024-10-26 05:22:51	zeit.de
de	https://www.faz.net/aktuell/politik/inland/kommentar-zur-ampel-hoffentlich-hat-es-bald-ein-ende-110070636.html	Kommentar zur Ampel: Hoffentlich hat es bald ein Ende - FAZ - Frankfurter Allgemeine Zeitung	None	None	2024-10-25 18:26:17	FAZ - Frankfurter Allgemeine Zeitung
de	https://taz.de/Getoetete-Journalisten-im-Libanon/!6045031/	Getötete Journalisten im Libanon: Israels Militär griff Unterkunft von TV-Team an - taz.de	Im libanesischen Hasbaya wurden drei Journalisten bei einem Angriff auf ihre Unterkunft getötet. Nicht nur der Libanon wirft Israel Absicht vor.	https://taz.de/picture/7318592/1200/0071-1.jpeg 	2024-10-25 14:47:57	taz.de
de	https://www.bild.de/regional/berlin/kadewe-raub-verdaechtiger-khalil-el-zein-stellt-asylantrag-in-berlin-671b88fe8f9b8c158219c102	KaDeWe-Raub-Verdächtiger Khalil El Zein stellt Asylantrag in Berlin - BILD	None	None	2024-10-26 06:24:15	BILD
de	https://news.google.com/rss/articles/CBMivwFBVV95cUxQRUtkaDZWb2x1MVBfWk11d1kxVjRnZEdRMVQwM1hJSVdmamJjbDZnVVJFcG9RMWFtMEJvSGlkZ3Ayd2NneXIxWGkwTUhYZ2pWcWJDOU9naDRwRTFVa2c3SmNHb0dSNGlsVm1DYnVYVlJueVhyNDI0NWRoRlVBd1FpWTlFU3BVU2hzSEtQNnVZUGZNYVJNYm5jWVN6M2xqMDV5WTAzQUNLeEdDZC1iR2tLclFnVmhGdHdrOFY5V1Bjbw?oc=5	„Euer Russland ist unser China“, bekommt Habeck von den Indern zu hören - WELT	Der Besuch von Robert Habeck in Indien zeigt: Bei seinen Partnern ist Deutschland nicht mehr allzu wählerisch. Um von China unabhängiger zu werden, umgarnt die Regierung das riesige Land, trotz teils anderer Wertvorstellungen. Gerade Habeck ist bereit, einiges über Bord zu werfen.	https://img.welt.de/img/wirtschaft/mobile254194230/9477938937-ci16x9-w1200/Wirtschaftsminister-Habeck-in-Indien-3.jpg	2024-10-25 16:00:50	WELT
de	https://news.google.com/rss/articles/CBMi_wFBVV95cUxOQ2VFZ1VFeE9CcDNzNUZHSUVqUGp6a2ZRX1dnbGx5LWdUb3ZBck9SYlBrZ3duRUdiTE9jSEtWVFpPZHNPZ0h4ZXRyZzl1cjk2cHh4Z2VoNjdXb3pLT0NZeUpFcFhwbnhuRXhtay0zcDR0MjBObkQ4X3R2UlZlRHlid0pVQ0lCTWFpOGFVNmdreHRkcTNLd2xsX2JLRUNNYlRnUXVsQVhqSjZaQmpYUlRYY0RaNWZvNUJlZHR5d1ZtZzZ4YVhKMlVkaU00TmlMTDR4QjFNVkVlcng4Ui10a1NGRE9hWjE5VDBZcWwxYWpORm45TGNjQU00bEhQNjBuSTA?oc=5	Reaktionen auf Özdemirs Kandidatur: »Vermutlich greift bei ihm die pure Angst um sich« - DER SPIEGEL	Cem Özdemir will Ministerpräsident in Baden-Württemberg werden. Gegenüber dem SPIEGEL loben die ersten Landespolitiker den Entschluss. Andere frotzeln über das lange Zögern des Grünen.	https://cdn.prod.www.spiegel.de/images/7bba1da6-72af-41b7-85c4-7383b931d0c8_w1200_r1.778_fpx51_fpy47.jpg	2024-10-25 10:06:00	DER SPIEGEL
de	https://www.n-tv.de/panorama/Vermisster-in-Erzgebirgsstollen-fuer-tot-erklaert-article25315014.html	Leiche bleibt im Bergwerk: Vermisster in Erzgebirgsstollen für tot erklärt - n-tv NACHRICHTEN	Ein Mann betritt einen alten Bergwerksstollen im Erzgebirge und wird seitdem nicht wiedergesehen. Mehrere Tage läuft die Suche nach ihm. Jetzt wird die Bergung abgebrochen und der Mann für tot erklärt. Das liegt nicht nur am hohen Aufwand, der nötig wäre. 	https://bilder3.n-tv.de/img/incoming/crop25314962/1691325963-cImg_16_9-w1200/487947314.jpg	2024-10-25 11:53:01	n-tv NACHRICHTEN
de	https://www.welt.de/politik/ausland/us-wahl/article254200622/US-Wahlkampf-Washington-Post-spricht-keine-Wahlempfehlung-fuer-Harris-aus-Chefkommentator-kuendigt.html	„Washington Post“ spricht keine Wahlempfehlung für Harris aus – Chefkommentator kündigt - WELT	Erstmals seit Jahrzehnten bricht die US-Tageszeitung „Washington Post“ mit einer Tradition: Das Blatt, das Amazon-Gründer Jeff Bezos gehört, empfiehlt diesmal keinen US-Präsidentschaftskandidaten. Intern war die Entscheidung offenbar stark umstritten.	https://img.welt.de/img/politik/ausland/us-wahl/mobile254200684/5637933027-ci16x9-w1200/FILES-US-VOTE-MEDIA.jpg	2024-10-26 06:48:54	WELT
de	https://www.tagesschau.de/ausland/europa/niederlande-asylrecht-verschaerfung-100.html	Niederlande wollen Grenzen kontrollieren und Asylrecht verschärfen - tagesschau.de	Die niederländische Rechtsaußen-Regierung hat ein Gesetzespaket für härtere Asylregeln und Grenzkontrollen vorgelegt. Umstrittene Pläne zur Ausrufung eines Notstands wegen der "Asylkrise" sind jedoch vom Tisch.	https://images.tagesschau.de/image/27e36d14-9d65-426d-bff1-b9530b0f411b/AAABksUlwyM/AAABkZLhkrw/16x9-1280/dick-schoof-104.jpg	2024-10-25 19:48:00	tagesschau.de
de	https://www.mdr.de/nachrichten/thueringen/mitte-thueringen/erfurt/unfall-zwei-lkw-autobahn-100.html	A71 bei Erfurt 12 Stunden gesperrt: Schwerer Unfall mit zwei Lkw - MDR	Auf der A71 zwischen Erfurt-Bindersleben und Gispersleben gab es einen schweren Unfall mit zwei Lkw, die Mais sowie Katzenfutter geladen hatten. Die Fahrbahn in Richtung Norden musste für zwölf Stunden gesperrt werden.	https://cdn.mdr.de/nachrichten/thueringen/mitte-thueringen/erfurt/unfall-lkw-172_v-variantBig16x9_wm-true_zc-ecbbafc6.jpg?version=4519	2024-10-26 04:21:00	MDR
de	https://www.ndr.de/fernsehen/sendungen/nordmagazin/Neubrandenburg-Ist-der-demokratische-Konsens-am-Ende,nordmagazin123150.html	Neubrandenburg: Ist der demokratische Konsens am Ende? - NDR.de	Nach dem Flaggenstreit äußern Mitglieder verschiedener Parteien ein schlechtes Gewissen. Was hat die Abstimmung angerichtet?	https://www.ndr.de/fernsehen/screenshot1836354_v-contentxl.jpg	2024-10-24 17:30:00	NDR.de
de	https://www.handelsblatt.com/technik/forschung-innovation/flugtaxi-entwickler-lilium-kuendigt-insolvenzantrag-an-kurs-bricht-ein/100082586.html	Flugtaxi-Entwickler: Lilium kündigt Insolvenzantrag an – Kurs bricht ein - Handelsblatt 	None	None	2024-10-24 14:18:25	Handelsblatt 
de	https://www1.wdr.de/nachrichten/rheinland/erkelenz-bombenentschaerfung-100.html	Entwarnung nach Bomben-Entschärfung in Erkelenz - WDR Nachrichten	None	None	2024-10-25 20:15:00	WDR Nachrichten
de	https://www.faz.net/aktuell/feuilleton/medien/tv-kritik-maybrit-illner-was-olaf-scholz-am-meisten-fuerchtet-110068850.html	TV-Kritik Maybrit Illner: Was Olaf Scholz am meisten fürchtet - FAZ - Frankfurter Allgemeine Zeitung	None	None	2024-10-25 04:10:57	FAZ - Frankfurter Allgemeine Zeitung