country_code	url	title	description	image_url	publish_date	source
de	https://www.tagesschau.de/wirtschaft/verbraucher/weinlese-winzer-wein-verbrauch-trauben-ernte-wetter-niederschlaege-100.html	Deutsche Winzer ernten deutlich weniger Trauben - tagesschau.de	Die Weinlese fällt 2024 voraussichtlich so niedrig aus wie seit 2017 nicht mehr, berichtet das deutsche Weininstitut. In einigen Anbaugebieten kam es wetterbedingt sogar teilweise zu totalen Verlusten.	https://images.tagesschau.de/image/59fabf2c-8be1-4c51-95fd-5ff3b4cd4183/AAABksIr0-M/AAABkZLhkrw/16x9-1280/deutscher-wein-100.jpg	2024-10-25 07:25:00	tagesschau.de
de	https://www.tagesschau.de/ausland/europa/tuerkei-pkk-anschlag-106.html	PKK bekennt sich zu Anschlag in Ankara - tagesschau.de	Die verbotene kurdische Arbeiterpartei PKK hat den Anschlag mit fünf Toten in Ankara für sich reklamiert. Zuvor identifizierte die türkische Regierung bereits die mutmaßlichen Attentäter als PKK-Mitglieder.	https://images.tagesschau.de/image/ba2a4533-38cb-4833-968b-d63237513fd6/AAABkr680fM/AAABkZLhkrw/16x9-1280/ankara-anschlag-116.jpg	2024-10-25 10:41:00	tagesschau.de
de	https://www.rbb24.de/panorama/beitrag/2024/10/berlin-tausende-antraege-aenderung-geschlecht-name-selbstbestimmungsgesetz.html	Selbstbestimmungsgesetz: Mehr als 1.200 Anträge auf Änderung von Geschlecht und Name in Berlin - rbb24	Geschlecht und Name an die eigene Lebenswirklichkeit anpassen - das ist ab dem 1. November mit dem Selbstbestimmungsgesetz mit vergleichsweise wenig Hürden möglich. Anträge sind bereits gestellt werden und die Zahlen zeigen: Das Interesse ist da.	https://www.rbb24.de/content/dam/rbb/rbb/rbb24/2024/2024_10/imago-images/standesamt-kreuzberg.jpg.jpg/size=708x398.jpg	2024-10-25 10:43:00	rbb24
de	https://www.rbb24.de/politik/beitrag/2024/10/kantstrasse-radweg-fahrstreifen-neuordnung.html	Fahrstreifen auf der Kantstraße sollen neu geordnet werden - rbb24	Die Berliner Verkehrsverwaltung und der Bezirk Charlottenburg-Wilmersdorf haben sich geeinigt: Die Fahrstreifen auf der Kantstraße sollen neu geordnet werden. Damit soll der Brandschutz für die Anwohner gewährleistet werden.	https://www.rbb24.de/content/dam/rbb/rbb/rbb24/2024/2024_10/imago-images/kantstrasse-verkehr.jpg.jpg/size=708x398.jpg	2024-10-25 11:27:00	rbb24
de	https://www.nzz.ch/feuilleton/bauhaus-expertin-barbara-steiner-kritisiert-afd-reinstes-moderne-bashing-ld.1854146	Bauhaus-Expertin Barbara Steiner kritisiert AfD: «Reinstes Moderne-Bashing» - Neue Zürcher Zeitung - NZZ	Die AfD hat das Bauhaus als Irrweg der Moderne bezeichnet, der eine «menschenfeindliche» Architektur hervorgebracht habe. Barbara Steiner, Direktorin der Stiftung Bauhaus Dessau, hält dagegen.	https://img.nzz.ch/2024/10/25/279b23ad-d17f-4fb4-b9ae-e995e54ca7bf.jpeg?width=1200&height=675&fit=bounds&quality=75&auto=webp&crop=3662,2060,x0,y295&wmark=nzz	2024-10-25 03:30:00	Neue Zürcher Zeitung - NZZ
de	https://www.ndr.de/nachrichten/hamburg/Kurioser-Fall-in-Hamburg-Zebrastreifen-kostet-Bezirk-Tausende-Euro,zebrastreifenlangenhorn100.html	Kurioser Fall in Hamburg: Zebrastreifen kostet Bezirk Tausende Euro - NDR.de	Ein aufgemalter Zebrastreifen in Langenhorn könnte für den Bezirk Nord richtig teuer werden. Mehrere Wochen sorgte die falsche Fußgängerüberquerung für Verwirrung bei Autofahrerinnen und Autofahrern.	https://www.ndr.de/nachrichten/hamburg/zebrastreifen162_v-contentxl.jpg	2024-10-25 15:23:00	NDR.de
de	https://www.sportschau.de/regional/ndr/ndr-furiose-wueck-premiere-dfb-frauen-gewinnen-gegen-england-100.html	Sieben Tore in Wembley: Furiose Wück-Premiere - DFB-Frauen gewinnen gegen England - Sportschau	Die deutschen Fußballerinnen lieferten beim Debüt von Bundestrainer Christian Wück ein Spektakel und gewannen verdient im Londoner Wembley-Stadion.	https://images.sportschau.de/image/641fc3aa-d470-4260-9022-1a7c8b88560f/AAABksVdL9E/AAABkZLhkrw/16x9-1280/ndr-die-deutschen-fussballerinnen-feiern-ein-tor-von-giulia-gwinn-m-im-wembley-stadion-gegen-england-100.jpg	2024-10-25 21:20:00	Sportschau
de	https://www.sportschau.de/fussball/bundesliga2/sc-paderborn-schiesst-1-fc-koeln-tiefer-in-die-krise,zweite-bundesliga-koe-scp-100.html	Doppelpack von Michel: SC Paderborn schießt 1. FC Köln tiefer in die Krise - Sportschau	Dem 1. FC Köln stehen ungemütliche Tage bevor: Gegen den SC Paderborn musste der Bundesliga-Absteiger den nächsten heftigen Rückschlag hinnehmen.	https://images.sportschau.de/image/39828e7b-2a9d-4448-b264-5c623ca8d539/AAABksTsrYk/AAABkZLhkrw/16x9-1280/paderborn-michel-jubel-100.jpg	2024-10-25 20:10:00	Sportschau
de	https://www.tagesschau.de/inland/innenpolitik/junge-union-halle-100.html	Junge Union bestätigt Winkel als Vorsitzenden der Jungen Union - tagesschau.de	239 von 266 Stimmen hat Johannes Winkel in Halle (Saale) bekommen. Damit bleibt der 32-Jährige Chef der Jungen Union. Auf deren "Deutschlandtag" forderte CDU-Generalsekretär Linnemann starke Änderungen in der Migrationspolitik.	https://images.tagesschau.de/image/95b4cc60-021f-4a88-842d-4238239b3ac5/AAABksW2jMg/AAABkZLhkrw/16x9-1280/johannes-winkel-100.jpg	2024-10-25 22:05:00	tagesschau.de
de	https://taz.de/Krise-der-Linkspartei/!6043072/	Krise der Linkspartei: Ein Tropfen reicht, um das Fass zum Überlaufen zu bringen - taz.de	Gerade hat die Linkspartei eine neue Führung gewählt, treten prominente Mitglieder aus. Davon wird die Welt allerdings auch nicht besser.	https://taz.de/picture/7318679/1200/36800022-1.jpeg 	2024-10-25 17:53:16	taz.de
de	https://www.zeit.de/politik/deutschland/2024-10/ukrainische-gefluechtete-wie-asylbewerber-behandeln	Ukrainische Geflüchtete: Landkreistag fordert weniger Unterstützung für ukrainische Geflüchtete - zeit.de	Ukrainische Geflüchtete sollten dem Landkreistag zufolge den gleichen Status wie Asylbewerber erhalten. Außerdem bräuchten die Jobcenter deutlich mehr Geld.	https://img.zeit.de/politik/deutschland/2024-10/landkreistag-ukrainische-gefluechtete-wie-asylbewerber-behandeln-bild/wide__1300x731	2024-10-26 02:07:28	zeit.de
de	https://www.welt.de/wirtschaft/article254194232/Euer-Russland-ist-unser-China-bekommt-Habeck-von-den-Indern-zu-hoeren.html	„Euer Russland ist unser China“, bekommt Habeck von den Indern zu hören - WELT	Der Besuch von Robert Habeck in Indien zeigt: Bei seinen Partnern ist Deutschland nicht mehr allzu wählerisch. Um von China unabhängiger zu werden, umgarnt die Regierung das riesige Land, trotz teils anderer Wertvorstellungen. Gerade Habeck ist bereit, einiges über Bord zu werfen.	https://img.welt.de/img/wirtschaft/mobile254194230/9477938937-ci16x9-w1200/Wirtschaftsminister-Habeck-in-Indien-3.jpg	2024-10-25 16:00:50	WELT
de	https://www.gladbachlive.de/news/gladbach-remis-in-mainz-trainer-meinungen-gehen-auseinander-885493	„Musst du gewinnen“ Remis in Mainz: Meinungen der Trainer gehen auseinander – Kleindienst zufrieden - GladbachLIVE	Punktgewinn für Borussia Mönchengladbach! Das sind die Stimmen und Reaktionen der Spieler und Verantwortlichen nach dem 1:1 am achten Spieltag der Bundesliga gegen den FSV Mainz 05.	https://image.ds.dumont.de/2024/10/25/2912ada0-32eb-4f32-a467-3588313e49c1.jpeg?w=3000&auto=format&q=75&format=auto&s=26b164107ea73e5263b50a2d3ddd893b	2024-10-25 21:12:31	GladbachLIVE
de	https://www.wiwo.de/politik/ausland/us-wahl-2024-deshalb-fuehrt-donald-trump-ploetzlich-in-einigen-umfragen/30056170.html	US-Wahl 2024: Deshalb führt Donald Trump plötzlich in Umfragen - WirtschaftsWoche	None	None	2024-10-25 10:14:06	WirtschaftsWoche
de	https://www.berliner-zeitung.de/politik-gesellschaft/wagenknechts-wende-bsw-gibt-in-thueringen-bei-sondierungen-alle-positionen-auf-li.2266136	Wagenknechts Wende: BSW gibt in Thüringen bei Sondierungen alle Positionen auf - Berliner Zeitung	Das BSW hat in Thüringen offenbar alle kontroversen Positionen aufgegeben – Russland, Gas, Corona, Verfassungsschutz. Die Fans der Partei dürften sich wundern.	https://berliner-zeitung.imgix.net/2024/10/25/e45c163f-5503-4437-b365-64733adcec6f.jpeg?w=1024&auto=format	2024-10-25 19:38:47	Berliner Zeitung
de	https://www.tagesspiegel.de/gesellschaft/panorama/hessen-todliche-polizeischusse-in-hessen-frau-ohne-scharfe-waffe-12595331.html	„Sieht einer scharfen Waffe zum Verwechseln ähnlich“ Von Polizisten getötete Frau trug keine mit Munition beladene Waffe - Tagesspiegel	Nach den tödlichen Schüssen auf eine Frau vor einer Polizeistation in Nordhessen sind viele Fragen offen. Den Ermittlungen zufolge richtete sie eine Waffe auf die Beamten, die nicht scharf war.	https://www.tagesspiegel.de/images/12595328/alternates/BASE_16_9_W1400/1729859452000/frau-zieht-waffe-gegen-beamte-und-wird-erschossen.jpeg	2024-10-25 12:30:37	Tagesspiegel
de	https://www.morgenpost.de/panorama/article407541248/nach-sieben-monaten-auf-iss-vier-raumfahrer-wieder-auf-der-erde.html	ISS-Raumfahrer endlich zurück auf der Erde – mit brisantem Gepäck - Berliner Morgenpost	Die vier Raumfahrer landeten nach einer 30-stündigen Fahrt geplant im Meer. Im Gepäck haben die vier ISS-Rückkehrer wichtige Ergebnisse.	https://img.sparknews.funkemedien.de/407541366/407541366_1729844726_v16_9_1600.jpeg	2024-10-25 08:25:27	Berliner Morgenpost
de	https://www.morgenpost.de/politik/article407548436/explosionen-in-teheran-israel-schlaegt-offenbar-zurueck.html	Israel greift Militär-Ziele im Iran an – Teheran will reagieren - Berliner Morgenpost	Explosionen in Tel Aviv: Der lang erwartete Rückschlag Israels gegen den Iran erfolgt gezielt. Teheran sperrt den Luftraum – stellt den Angriff aus Tel Aviv aber als harmlos dar.	https://img.sparknews.funkemedien.de/407548488/407548488_1729905987_v16_9_1600.jpeg	2024-10-26 06:06:00	Berliner Morgenpost
de	https://www.tagesschau.de/ausland/europa/georgien-parlamentswahl-100.html	Parlamentswahl - Georgien vor unruhigen Tagen - tagesschau.de	Eine Entscheidung zwischen Krieg und Frieden, zwischen EU und Russland - Regierung und Opposition in Georgien beschreiben die Parlamentswahl heute als Schicksalswahl. Viele Menschen sorgen sich hingegen um ihre wirtschaftliche Lage. Von S. Stöber.	https://images.tagesschau.de/image/4d6e37e0-dddb-464e-8810-d550398300bb/AAABkr3USFo/AAABkZLhkrw/16x9-1280/georgien-demonstration-eu-orthodoxe-kirche-100.jpg	2024-10-26 05:02:00	tagesschau.de
de	https://www.fr.de/politik/ukraine-organisation-an-nordkorea-soldaten-angebot-russland-zr-93373209.html	Ukraine-Organisation fordert Putins Nordkorea-Soldaten zur Kapitulation auf – und macht ihnen Angebot - fr.de	None	https://www.fr.de/assets/images/35/890/35890736-auf-linie-getrimmt-nordkoreanische-soldaten-symbolfoto-2Qq1ukTX1rfe.jpg	2024-10-26 06:16:00	fr.de
de	https://www.berliner-zeitung.de/politik-gesellschaft/auch-bsw-stimmt-fuer-afd-antrag-landtag-in-sachsen-bekommt-corona-untersuchungsausschuss-li.2265969	Auch BSW stimmt für AfD-Antrag: Landtag in Sachsen bekommt Corona-Untersuchungsausschuss - Berliner Zeitung	Künftig soll im sächsischen Landtag die Corona-Politik aufgearbeitet werden. Neben der AfD stellte auch die Wagenknecht-Partei einen Antrag. Dieser fiel jedoch durch.	https://berliner-zeitung.imgix.net/2024/10/25/c9a36978-98a7-45a5-bf07-7df855d98f18.jpeg?w=1024&auto=format	2024-10-25 15:11:14	Berliner Zeitung
de	https://www.br.de/nachrichten/wissen/coronavirus-variante-xec-symptome-verbreitung-und-impfung,URw88T9	Coronavirus-Variante XEC: Symptome, Verbreitung und Impfung - BR24	Die Corona-Variante XEC breitet sich seit einigen Wochen in Deutschland aus. Gefährlicher als die vorherigen scheint sie nach bisherigen Erkenntnissen aber nicht zu sein. Ein Überblick über den aktuellen Stand der Forschung.	https://img.br.de/2e24ab1f-1e55-412c-82a0-65d6b298613f.jpeg?q=80&rect=346%2C988%2C4172%2C2345&w=1600&h=900	2024-10-26 04:12:32	BR24
de	https://www.welt.de/wirtschaft/article254190414/TK-Statistik-Krankschreibungen-steigen-seit-Jahresbeginn-auf-Rekordwert.html	TK-Statistik: Krankschreibungen steigen seit Jahresbeginn auf Rekordwert - WELT	Nie zuvor haben sich in den ersten neun Monaten eines Jahres so viele Versicherte krankschreiben lassen wie 2024, teilt die TK mit. Vor allem Erkältungskrankheiten nehmen zu. Wissenschaftler haben aber einen anderen Grund für die steigenden Zahlen gefunden.	https://img.welt.de/img/wirtschaft/mobile254190960/0127931567-ci16x9-w1200/Krankschreibung.jpg	2024-10-25 23:28:20	WELT
de	https://www.fr.de/panorama/jahrhundertwinter-in-deutschland-wetterexperte-erklaert-eiszeit-szenario-zr-93374747.html	Jahrhundertwinter in Deutschland? Wetterexperte erklärt Eiszeit-Szenario - fr.de	None	https://www.fr.de/assets/images/35/993/35993500-nach-heftigem-schneetreiben-und-eisregen-sind-strommasten-zusammengebrochen-36fe.jpg	2024-10-26 05:09:00	fr.de
de	https://www.lvz.de/lokales/leipzig/von-der-mpk-in-die-disco-ministerpraesidenten-feiern-in-leipzigs-elsterartig-EGBLSS43XVDNZKXPMJCERBEWJ4.html	Von der MPK in die Disco: Ministerpräsidenten feiern in Leipzigs „Elsterartig“ - Leipziger Volkszeitung	Der zweite Tag der Ministerpräsidentenkonferenz in Leipzig ist planmäßig zu Ende gegangen. Dutzende Demonstrierende erwarteten die Länderchefs am Zoo. Die MPK-Chef-Organisatorin zeigte sich sehr zufrieden mit den Abläufen in Leipzig. 	https://www.lvz.de/resizer/v2/IYX7AYP4IREV7ANSUCIMIQIM7Y.jpg?auth=5c687fe39e24a31a0e19cbd95289b397163463fd7011c2146eefca0582bd2ec5&quality=70&width=1200&height=630&smart=true	2024-10-25 14:45:36	Leipziger Volkszeitung
de	https://www.tagesschau.de/ausland/amerika/biden-indigene-entschuldigung-100.html	Misshandlung in Internaten: Biden bittet Indigene um Entschuldigung - tagesschau.de	150 Jahre lang wurden indigene Kinder in den USA in staatliche Zwangsinternate gesteckt und dort misshandelt. Hunderte Kinder starben. US-Präsident Biden hat nun erstmals eine historische Entschuldigung an die Indigenen gerichtet.	https://images.tagesschau.de/image/a6c105f6-9c7a-4b60-a710-a58f69c64654/AAABkseUgww/AAABkZLhkrw/16x9-1280/biden-indigene-100.jpg	2024-10-26 07:34:00	tagesschau.de
de	https://www.zeit.de/digital/internet/2024-10/us-wahl-betrugsvideo-stimmzettel-russland	US-Wahl: Angebliches Wahlbetrugsvideo offenbar von Russland erstellt - zeit.de	US-Behörden werfen russischen Akteuren vor, einen gefälschten Clip auf der Plattform X verbreitet zu haben. Darin werden angeblich Stimmzettel für Trump zerrissen. 	https://img.zeit.de/digital/internet/2024-10/us-wahl-betrugsvideo-stimmzettel-russland-1/wide__1300x731	2024-10-26 05:31:16	zeit.de
de	https://www.welt.de/politik/ausland/article254196962/Niederlande-praesentiert-verschaerfte-Asylregeln-Grenzkontrollen-noch-im-November.html	Grenzkontrollen noch im November – Niederlande präsentiert verschärfte Asylregeln - WELT	Die Koalition in den Niederlanden will das Asylrecht verschärfen. Dazu gehört die Einführung von Grenzkontrollen noch in diesem Jahr, illegale Migranten sollen nach Deutschland und Belgien zurückgeschickt werden. Die Kritik an den Plänen ist nicht nur bei der Opposition groß.	https://img.welt.de/img/bildergalerien/mobile254197162/5377939507-ci16x9-w1200/Der-neue-niederlaendische-Ministerpraesident-Dick-Schoof.jpg	2024-10-25 16:33:41	WELT
de	https://www.welt.de/vermischtes/kriminalitaet/article254198870/Frauenleiche-im-Neckar-Polizei-nimmt-Verdaechtigen-fest-und-durchsucht-Fluechtlingsunterkunft.html	Frauenleiche im Neckar: Polizei nimmt Verdächtigen fest und durchsucht Flüchtlingsunterkunft - WELT	Am Sonntag wird im Neckar bei Nürtingen eine tote Frau gefunden. Wenige Tage später kommen die Beamten einem Mann auf die Spur und nehmen ihn fest. Der 37-jährige Iraner soll das Opfer gekannt haben.	https://img.welt.de/img/vermischtes/kriminalitaet/mobile254198950/9967931467-ci16x9-w1200/Trauer-nach-Unfall-mit-drei-Toten.jpg	2024-10-25 17:45:49	WELT
de	https://www.mdr.de/nachrichten/sachsen-anhalt/halle/halle/dreifache-mutter-vermisst-tot-obduktion-104.html	Vermisste dreifache Mutter aus Halle ist tot: Obduktion angeordnet - MDR	Eine Frau aus Halle ist fast zwei Wochen lang vermisst worden. Nun gibt es traurige Gewissheit: Die dreifache Mutter ist tot. Eine Obduktion ihrer Leiche soll die Todesursache klären.	https://cdn.mdr.de/presse/bild-obduktionssaal-100_v-variantBig16x9_wm-true_zc-ecbbafc6.jpg?version=52145	2024-10-26 07:08:02	MDR
de	https://www.tagesschau.de/ausland/asien/sturm-trami-philippinen-100.html	Zerstörung und Tote durch Sturm "Trami" auf den Philippinen - tagesschau.de	Auch wenn der Sturm "Trami" nicht als ausgewachsener Taifun eingestuft wird, sind die Folgen enorm: Viele Häuser auf den Philippinen sind zerstört, manche Gegenden unpassierbar. Mehr als 60 Menschen starben.	https://images.tagesschau.de/image/0b414bc9-a619-4beb-9ddd-8451df7280fe/AAABksJL6U0/AAABkZLhkrw/16x9-1280/trami-philippinen-102.jpg	2024-10-25 08:55:00	tagesschau.de
de	https://www.lvz.de/lokales/leipzig/leipzig-13-jaehrige-soll-ihre-7-jaehrige-schwester-getoetet-haben-FR67MZZPHJBU5HTETTCMXU3OVA.html	Leipzig: 13-Jährige soll ihre 7-jährige Schwester getötet haben - Leipziger Volkszeitung	Schockierender Fall in einem Mehrfamilienhaus im Leipziger Stadtteil Kleinzschocher: Laut Polizei hat eine 13-Jährige ihrer Schwester tödliche Verletzungen zugefügt. Die Kripo ermittelt.	https://www.lvz.de/resizer/v2/SLRGPVHDFJBZHO4H3QV2LCTEBA.jpg?auth=8a20ac45da27a81c3cf590afc562c7e1951e41077e70d714c757c28da273a7d6&quality=70&width=1200&height=630&smart=true	2024-10-26 08:35:55	Leipziger Volkszeitung
de	https://www.fr.de/wirtschaft/voellig-verrueckt-putin-auf-dem-brics-gipfel-russlands-wirtschaftsagenda-droht-zu-kollabieren-zr-93373575.html	„Völlig verrückt“ – Putin auf dem BRICS-Gipfel: Russlands Wirtschaftsagenda droht zu kollabieren - fr.de	None	https://www.fr.de/assets/images/35/989/35989083-der-chinesische-praesident-xi-jinping-und-der-russische-praesident-wladimir-putin-2p2s8EuDc8fe.jpg	2024-10-26 02:58:00	fr.de
de	https://www.tagesschau.de/wissen/gesundheit/zeitumstellung-normalzeit-100.html	Sommerzeit - Normalzeit: Ist denn schon wieder Zeitumstellung? - tagesschau.de	Jedes halbe Jahr die selbe Frage: Stellen wir die Uhr eine Stunde vor oder zurück? Und jedes Mal wird darüber diskutiert, ob die Sommer- oder die Normalzeit besser ist. Von Constanze Fett.	https://images.tagesschau.de/image/bb2b08de-8737-436c-8e0e-00c8ce4e0e49/AAABhnvE_b0/AAABkZLhkrw/16x9-1280/zeitumstellung-205.jpg	2024-10-26 09:07:00	tagesschau.de
de	https://www1.wdr.de/nachrichten/zukunft-von-ard-und-zdf-laenderchefs-wollen-weniger-tv-und-radiosender-100.html	Zukunft von ARD und ZDF: Länderchefs einigen sich auf Reformen - WDR Nachrichten	None	None	2024-10-25 14:12:00	WDR Nachrichten
de	https://news.google.com/rss/articles/CBMiyAFBVV95cUxOb1RWRXdYSzZ6TnVBYzY4bGU5TkNZc1liSkVoU2poMkRtYmtPdnRSNkNUOVdUT0NIdnU0VmJLemNXZjFWM2JHOTJaRzJ0enQ5NmoyRW9OdzkwdXRVNUd2OFI3YVlrVk5sMnBOZVRFRVpxRTBmN1Fkbzd5NWVVbzFQX3FkMUNjV1VsRWdYOWtlYnFUeWtweF8wSTZhMHdkQnZ2YTk3aWhlYmdtMTNUZjliSHZ6MjctZUxvMmROamUybTE3ZUxPMUtJVA?oc=5	Libanon - Israels Armeechef: Hisbollah-Befehlskette "gründlich zerschlagen" - Ende der Kämpfe möglich - Deutschlandfunk	Das israelische Militär hält ein Ende der Kämpfe gegen die Hisbollah im Libanon für möglich. Generalstabschef Halevi stellte einen Abschluss des Einsatzes in Aussicht, da man die oberste Befehlskette der Hisbollah gründlich zerschlagen habe. Gleichzeitig gab es neue Angriffe im Libanon und in Israel.	None	2024-10-25 21:25:23	Deutschlandfunk
de	https://www.zeit.de/politik/deutschland/2024-10/ampelkoalition-christian-lindner-olaf-scholz-robert-habeck-wirtschaft	Ampelkoalition: Christian Lindner teilt gegen Olaf Scholz und Robert Habeck aus - zeit.de	Der Bundesfinanzminister kritisiert, wirtschaftspolitische Vorstöße der Ampelpolitiker seien nicht abgestimmt. Die Koalition will er allerdings nicht platzen lassen.	https://img.zeit.de/politik/deutschland/2024-10/ampelkoalition-christian-lindner-olaf-scholz-robert-habeck-wirtschaft-bild-2/wide__1300x731	2024-10-24 22:41:36	zeit.de
de	https://www.spiegel.de/panorama/bayern-gefaengnismitarbeiter-der-jva-augsburg-gablingen-sollen-haeftlinge-misshandelt-haben-a-b5d54da6-e909-4c24-b45a-a8965fe9baad	Bayern: Gefängnismitarbeiter der JVA Augsburg-Gablingen sollen Häftlinge misshandelt haben - DER SPIEGEL	Die Staatsanwaltschaft in Augsburg ermittelt wohl gegen Mitarbeiter der Justizvollzugsanstalt Augsburg-Gablingen. Laut Medienberichten soll es dort zu Misshandlungen von Gefangenen gekommen sein.	https://cdn.prod.www.spiegel.de/images/ca6594e0-a361-4dcb-91d4-b6747c75e249_w1200_r1.778_fpx43.14_fpy50.jpg	2024-10-26 08:47:00	DER SPIEGEL
de	https://www.faz.net/aktuell/politik/inland/baden-wuerttemberg-oezdemir-will-ministerpraesident-werden-110069188.html	Baden-Württemberg: Özdemir will Ministerpräsident werden - FAZ - Frankfurter Allgemeine Zeitung	None	None	2024-10-25 10:07:40	FAZ - Frankfurter Allgemeine Zeitung
de	https://www.mdr.de/nachrichten/sachsen/chemnitz/kulturhauptstadt-veranstaltungen-programm-steht-fest-kultur-news-100.html	Chemnitz Kulturhauptstadt 2025: Diese Veranstaltungen sind im Programm geplant - MDR	Mit großen Ausstellungen, wie zu Evard Munch, aber auch mit Projekten aus der Nachbarschaft will Chemnitz als Kulturhauptstadt 2025 Millionen anlocken. Nun wurde das Programm unter dem Motto "C the Unseen" vorgestellt. 	https://cdn.mdr.de/nachrichten/sachsen/chemnitz/chemnitz-stollberg/kulturhauptstadt-230_v-variantBig16x9_wm-true_zc-ecbbafc6.jpg?version=59686	2024-10-25 10:41:19	MDR
de	https://www.mdr.de/nachrichten/sachsen/chemnitz/annaberg-aue-schwarzenberg/vermisster-stollen-keine-bergung-leiche-100.html	Annaberg-Buchholz: Vermisster im Bergwerksstollen wird nicht geborgen - MDR	Im Fall eines Vermissten in einem alten Bergwerkstollen nehmen Polizei, Oberbergamt und die Stadt Annaberg-Buchholz den Tod des Mannes an. Der Leichnam soll wohl nicht geborgen werden.	https://cdn.mdr.de/nachrichten/sachsen/chemnitz/annaberg-aue-schwarzenberg/vermissten-suche-frohnau-102_v-variantBig16x9_wm-true_zc-ecbbafc6.jpg?version=1422	2024-10-25 09:32:00	MDR
de	https://www.saarbruecker-zeitung.de/saarland/saar-wirtschaft/batteriehersteller-svolt-stellt-betrieb-in-europa-ein_aid-120384207	Alle Mitarbeiter entlassen: Aus für SVolt in Europa verkündet - Saarbrücker Zeitung	Nach SZ-Information hat SVolt Europe all seine Mitarbeiter gekündigt. Der Betrieb wird Ende Januar 2025 eingestellt. Gerüchten zufolge könnte SVolt einen anderen Standort in Europa planen. 	None	2024-10-25 11:18:00	Saarbrücker Zeitung
de	https://www.tagesschau.de/ausland/amerika/vance-hackerangriff-china-100.html	Berichte: Chinesische Cyberangriffe auf Telefone von Trump und Vance - tagesschau.de	Chinesische Hacker haben US-Medienberichten zufolge die Telefone von Trump und seinem Vizekandidaten Vance ins Visier genommen. Auch das Umfeld von Harris sei betroffen. Ob Daten gestohlen wurden, ist unklar.	https://images.tagesschau.de/image/6e973d61-8ca6-4ea8-bdbf-9ecfae758f83/AAABksfXZnc/AAABkZLhkrw/16x9-1280/trump-vance-120.jpg	2024-10-26 08:32:00	tagesschau.de
de	https://www.br.de/nachrichten/sport/2-bundesliga-1-fc-nuernberg-ssv-jahn-regensburg-zehn-tore-spektakel-kloses-fcn-demuetigt-jahn,USE6phi	Elf-Tore-Spektakel in Nürnberg: Kloses Club demütigt Regensburg - BR24	In einem verrückten Spiel schlägt der 1. FC Nürnberg den SSV Jahn Regensburg mit 8:3 (3:2) und nimmt den Rückenwind aus dem Frankenderby mit. Die Oberpfälzer beenden zwar ihre Torflaute, sind aber weiter in akuter Abstiegsgefahr.	https://img.br.de/3e504ee0-b2a3-4205-b2af-ac925335c917.jpeg?q=80&rect=0%2C78%2C3833%2C2155&w=1600&h=900	2024-10-26 07:42:21	BR24
de	https://www.spiegel.de/ausland/kamala-harris-vs-donald-trump-washington-post-verzichtet-auf-wahlempfehlung-a-6778a222-6d1a-407d-b181-a6f2cecbda53	»Washington Post« verzichtet auf Wahlempfehlungen - DER SPIEGEL	Nach der »Los Angeles Times« verzichtet auch die »Washington Post« darauf, sich für einen Kandidaten auszusprechen. Das Blatt, das dem Amazon-Milliardär Bezos gehört, wolle zurück zu seinen Wurzeln.	https://cdn.prod.www.spiegel.de/images/36efa438-6174-425b-bdd6-0eeb272a1089_w1200_r1.778_fpx51_fpy40.jpg	2024-10-25 20:54:00	DER SPIEGEL
de	https://www.tag24.de/thema/baby/lebendig-im-sarg-totes-baby-erwacht-bei-eigener-beerdigung-3328391	Lebendig im Sarg: Totes Baby erwacht bei eigener Beerdigung - TAG24	In Brasilien wurde ein neun Monate altes Kind fälschlicherweise für tot erklärt. Kurz darauf verstarb das Baby aber wirklich. | TAG24	https://media.tag24.de/1200x800/z/n/znt9prkn1v01yn9dazkd78axjeio7x0t.jpg	2024-10-26 04:00:02	TAG24
de	https://news.google.com/rss/articles/CBMivwFBVV95cUxQdzFPWW5SX0RSUy1wSXViNDlYZ2RiaTFMdm9ZR1NoQWJuU3RhT0p6eFlZMXMyWVE1YkFWak93MWxpRkZKQXBpNDd2aF9ScVpEOG1CdVQ5QW1ScW9zVVdZeFFRVHpTdDNIM09ueWZYaHk1X280OW1oa2hxZjB3dDNES2lVbG9rUEl4TkgwT2o2eHdCTGJCRUFRaXRWeW5JeXhaMEQzekdLdVBNM25fTDR6dlB1MGtYRDZEY19xNC1Jaw?oc=5	Bayerischer Flugtaxi-Entwickler: Lilium kündigt nach Aus von Staatshilfe Insolvenz an - n-tv NACHRICHTEN	Vergeblich hat der Flugtaxi-Entwickler Lilium auf Staatshilfe gehofft. Jetzt kündigt das Unternehmen Insolvenz für die beiden wichtigsten Töchter, Lilium GmbH und Lilium eAircraft GmbH, in Eigenverwaltung an. Die Zukunft des Startups ist damit völlig offen.	https://bilder4.n-tv.de/img/incoming/crop25314571/8581324440-cImg_16_9-w1200/e197cfedc8a56e479bc438d607dcc932.jpg	2024-10-25 08:37:00	n-tv NACHRICHTEN
de	https://news.google.com/rss/articles/CBMihgFBVV95cUxOLV9TZGFsakhsYVlDSDR0VXdWSktSV3U4ODJ3NTZKbENjMU5ZTjFKd3RSUnZYeENILUYwTUNnbndOXzdEUVVwS1gyel9MampkemhHcnZ6eUlGYk5icl9WcGQyMjBEZDg5SktzNWlIeVdWTUVabTE3Q0x3UGZWQWx3Snc0YS0td9IBhAFBVV95cUxQVkx1bWhsWTEwY0ZBZmtCOF94a0Q3VjJoOGVfNHZCN2E0eHZ4aGpZa0huOUJHRXI2WDYzazd3Nlh3bTJqZjV4UXc5VUxaaEtLWlkzVnJVZ2FMd2Y4WUt6WWt4Rk9OTWRRQUloS0xER0hYcUJ3S3h1SkF6Nmh2dWpHQkNydHQ?oc=5	Entwarnung nach Bomben-Entschärfung in Erkelenz - WDR Nachrichten	None	None	2024-10-25 20:15:00	WDR Nachrichten
