country_code	url	title	description	image_url	publish_date	source
fr	https://www.footmarseille.com/107160-lom-va-sensibiliser-les-supporters-sur-les-chants-discriminatoires	OM-PSG - L’OM va sensibiliser les supporters sur les chants discriminatoires - Foot Marseille	None	None	2024-10-26 06:24:00	Foot Marseille
fr	https://www.ouest-france.fr/economie/budget/attention-les-radars-automatiques-pourront-detecter-trois-nouvelles-infractions-des-2025-f79634f4-92d8-11ef-9584-d56c57ed8897	Attention, les radars automatiques pourront détecter trois nouvelles infractions dès 2025 - Ouest-France	Plusieurs centaines de radars vont être dotés de nouvelles fonctionnalités en 2025. En plus de la vitesse excessive, ces appareils pourront détecter trois nouvelles infractions : le non-respect de la distance de sécurité entre véhicules, l’utilisation du téléphone au volant et le non-port de la ceinture. 	https://media.ouest-france.fr/v1/pictures/MjAyNDEwN2NiNDM1ZGM1MGUzMzBlOTk4Y2M3MzFlNTFiYjUzZmE?width=1260&height=708&focuspoint=50%2C25&cropresize=1&client_id=bpeditorial&sign=6d054077bdac7209949b3b4740bdefee1c7cb713ea31e31831618c84bae80d98	2024-10-26 10:00:12	Ouest-France
fr	https://www.huffingtonpost.fr/life/article/oeufs-rappeles-pour-risque-de-salmonelle-comment-cette-bacterie-repandue-peut-contaminer-la-nourriture-clx1_115436.html	Comment la salmonelle, une bactérie répandue, peut contaminer la nourriture - Le HuffPost	Souvent, tout commence par un manquement aux règles d'hygiène.	None	2024-10-26 06:47:02	Le HuffPost
fr	https://www.ouest-france.fr/shopping/marques/lidl/vite-cest-le-moment-ou-jamais-de-commander-ce-robot-tondeuse-parkside-bientot-en-stock-chez-lidl-6c143a00-9221-11ef-83a4-0ededa6d6967	Vite, c’est le moment ou jamais de commander ce robot tondeuse Parkside bientôt en stock chez Lidl - Ouest-France	Un robot tondeuse est une machine très pratique qui va automatiser vos tâches d’entretien extérieur. Parkside propose plusieurs modèles répondant à différents besoins. Sur le site de vente en ligne Lidl, le robot tondeuse Parkside PMRA 20 est disponible à moins de 300 euros.	https://media.ouest-france.fr/v1/pictures/MjAyNDEwY2U5NTg4YzAxYjc3MmViYTY0ZWQ3M2E2ZTE2ZmUxNzM?width=1260&height=708&focuspoint=50%2C25&cropresize=1&client_id=bpeditorial&sign=e6a1f43c5d9b4450d4cf88c513321ee9565c2524b06289c631dfdb76c41002ad	2024-10-26 06:11:02	Ouest-France
fr	https://www.lequipe.fr/Natation/Actualites/Leon-marchand-remporte-le-400-m-4-nages-a-incheon-et-explose-son-propre-record-de-france/1516372	Léon Marchand remporte le 400 m 4 nages en petit bassin à Incheon et explose son propre record de France - L'Équipe	Aligné uniquement sur le 400 m 4 nages ce samedi à Incheon (Corée du Sud) dans le cadre de la Coupe du monde petit bassin, Léon Marchand s'est imposé en battant son propre record de France établi à Shanghai dimanche dernier.	https://medias.lequipe.fr/img-photo-jpg/leon-marchand-s-est-impose-sur-le-400-m-4-nages-en-battant-son-propre-record-de-france-3-58-30-v-jol/1500000002073607/0:0,1997:1332-640-427-75/db2ee.jpg	2024-10-26 12:29:42	L'Équipe
fr	https://la1ere.francetvinfo.fr/guadeloupe/black-out-en-guadeloupe-des-pillages-de-magasins-et-des-degradations-recenses-a-pointe-a-pitre-1531864.html	Black out en Guadeloupe : des pillages de magasins et des dégradations recensés à Pointe-à-Pitre - Outre-mer la 1ère	Plusieurs vols et actes de vandalisme ont été recensés, dans la nuit de vendredi à samedi 26 octobre, dans certains quartiers de Pointe-à-Pitre et des Abymes en Guadeloupe. Plusieurs vidéos, circulant sur les réseaux sociaux, font état de dégradations commises dans la soirée. Au total, 11 commerces ont été pillés, des heurts ont éclaté et les forces de police ont procédé à deux interpellations.	https://la1ere.francetvinfo.fr/image/3sAQRVbHyrCe-t-sNkurhW3oGnM/930x620/outremer/2024/10/26/whatsapp-image-2024-10-26-at-06-36-17-671ccd0245f99523027572.jpeg	2024-10-26 11:31:14	Outre-mer la 1ère
fr	https://www.footmercato.net/a7918990503355845811-la-presse-espagnole-senflamme-pour-le-clasico-vinicius-jr-vole-la-vedette-a-mbappe	La presse espagnole s’enflamme pour le Clasico, Vinicius Jr vole la vedette à Mbappé - Foot Mercato	La presse espagnole s’enflamme pour le Clasico, focus sur le duel Lamine Yamal-Vinicius Jr et le choc très attendu entre l’OM et le PSG, retrouve (...) - Footmercato	https://assets-fr.imgfoot.com/media/cache/1200x675/photo-rvp-671cb5477e7a6.jpg	2024-10-26 09:28:04	Foot Mercato
fr	https://www.rtl.fr/actu/sciences-tech/fuite-de-donnees-chez-free-mobile-freebox-19-millions-de-fiches-clients-5-millions-d-iban-ce-que-l-on-sait-7900432338	Fuite de données chez Free Mobile/Freebox : 19 millions de fiches clients, 5 millions d'IBAN.... Ce que l'on sait - RTL	En début de semaine, un cybercriminel assurait détenir les fiches de tous les clients Free et Freebox ainsi que les identifiants bancaires de 5 millions d'abonnés à Internet.	https://images.rtl.fr/~c/2000v2000/rtl/www/1481107-une-enseigne-free-illustration.jpg	2024-10-26 11:53:04	RTL
fr	https://www.culturepsg.com/news/club/le-psg-refuse-toujours-de-payer-mbappe-et-le-renvoie-a-ses-engagements-publics-et-prives/53418	Club : Le PSG refuse toujours de payer Mbappé et le renvoie à ses « engagements publics et privés - CulturePSG.com	None	None	2024-10-26 08:44:00	CulturePSG.com
fr	https://www.envertetcontretous.fr/articles/caputo-joue-l-equipe-de-france-gagne-65796-1.html	Caputo joue, l'Équipe de France gagne - ASSE - Evect	C'était l'une des surprises de la liste de Laurent Bonadei, sélectionneur de l'Équipe de France féminine : la présence de Cindy Caputo, l'attaquante...	None	2024-10-26 08:00:00	Evect