country_code	url	title	description	image_url	publish_date	source
fr	https://legrandcontinent.eu/fr/2024/11/22/le-message-du-missile-oreshnik-comprendre-la-rhetorique-nucleaire-de-poutine-traduction-inedite/	Le message du missile Oreshnik : comprendre la rhétorique nucléaire de Poutine. Traduction inédite - Le Grand Continent	En lançant pour la première fois sur l’Ukraine jeudi 21 novembre un missile balistique à portée intermédiaire capable de transporter une ogive nucléaire, Poutine a pleinement fait entrer la rhétorique nucléaire dans sa guerre contre l'Ukraine et l'Europe. Le lendemain, au cours d’une allocution télévisée, le président russe a haussé d’un cran supplémentaire ses menaces à destination de l’Occident. Nous le traduisons — et commentons son intervention ligne à ligne.	https://legrandcontinent.eu/fr/wp-content/uploads/sites/2/2024/11/gc-poutineoreshnik-scaled.jpg	2024-11-22 17:01:13	Le Grand Continent
fr	https://www.bfmtv.com/paris/paris-la-mairie-demande-au-gouvernement-d-interdire-la-circulation-des-suv_AD-202411220924.html	Paris: la mairie demande au gouvernement d'interdire la circulation des SUV - BFM Paris Ile-de-France	La mairie de Paris souhaite voir interdire la circulation des SUV en raison de la "dangerosité" de ce type de véhicules, ce vendredi 22 novembre. Le Conseil de Paris a ainsi interpellé le gouvernement.	https://images.bfmtv.com/yuvcKvyWqIK2b02fGs6it-jHOtk=/362x675:1578x1359/1216x0/images/SUV-Paris-1798475.jpg	2024-11-22 17:56:50	BFM Paris Ile-de-France
fr	https://actu.fr/ile-de-france/paris_75056/le-directeur-de-sciences-po-paris-voulait-interdire-une-conference-de-rima-hassan-la-justice-lui-donne-tort_61903637.html	Le directeur de Sciences Po Paris voulait interdire une conférence de Rima Hassan, la justice lui donne tort - Actu Paris	None	None	2024-11-22 13:56:51	Actu Paris
fr	https://news.google.com/rss/articles/CBMiowJBVV95cUxNZFVuQnBDS2JrajNYcHIzQWZSc2tHZ04wMW9uYVlLWnZVRUFHQ21zcHdGT0J4Z19oMV8yWHhDbmU1cjVEbzFKVl9FUHFZcHF2ajZONkZkdmVCNVJFQmw1WVRVMmJfa2psdVF2TFppQlVOU2hod2ZyUTdFbW1JOUFIQmZKRENLeEVPcWR0RXdoT3k0bEtTMllVcTVBeXFhV3lyZXpuSHphX1g0bUMxQlMxUmxMSjR5cnFmaHVENTVaRS1oMnZfMklJRG1iNEpTcG5vVHl3X1ZXNmwtNTN2OWdESFJKM2xJWFhvdWp6ZTNzeFVHekEzQ004d0ZDaXFlTFYyMlNuQV9hMDQ3N0lFZThpdTFxdWlDZXEtZmgtZnFYUEVhVEHSAagCQVVfeXFMUG9MNldyc3pMUm9mem9qdmQzbmV0ZEo2dlZMRTFpMHlOeDVFZ2thTC1iZGJBcTFERVRSOHZPbHZEQ1BWbnJuSGlWR0tvcnhoS0VnQlZnX3RRTnU0OXhPdjV2cXVzRHFKWWRnMEJocVVHVjQyUTQ1U0NOT1FuellLTk44VU1TeWRFWWxieExkamxOS0dlVHhJWVVEQ1hvSGdQQ0NUcC1OTnNpTHF0VW1HUDluX29ZcE45cU9HdG1rLU5hS1IwNTRwb1ZRY0owcXNxY2MzdmQ5c2xmTUtCT1FQVTlsUEhRdzhZYXVyNWlmbmFmNS0tWV9JaUFIUmM0VDJRRnZDR3RfU2NEZC1XVzJSYlBneTdFb3Iza3lrZmNVVXJiTEVVUjdabUU?oc=5	EN DIRECT - Guerre en Ukraine : aucune "ligne rouge" pour le soutien à Kiev, assure le chef de la diplomatie française - TF1 INFO	None	None	2024-11-23 15:58:32	TF1 INFO
fr	https://www.linternaute.com/television/programme/6712250-miss-france-2024-aucune-candidate-n-a-trouve-la-reponse-a-cette-question-de-culture-generale-les-organisateurs-embarrasses/	Miss France 2024 : aucune candidate n'a trouvé la réponse à cette question de culture générale, les organisateurs embarrassés - Linternaute.com	Voilà qui met les organisateurs du concours Miss France dans l'embarras : toutes les candidates se sont trompées à cette question du test de culture générale. Et la raison est encore plus gênante...	https://img-4.linternaute.com/H2xXf0nWi7Ikwfc_2rhyjKoEe9E=/1500x/smart/14831e28f7354963a6c1b373f1f16070/ccmcms-linternaute/68070293.jpg	2024-11-23 11:54:48	Linternaute.com
fr	https://www.sudouest.fr/faits-divers/le-corps-a-commence-a-bouger-en-inde-un-medecin-ne-procede-pas-a-son-autopsie-il-se-reveille-quelques-instants-avant-son-incineration-22261231.php	« Le corps a commencé à bouger » : un médecin ne procède pas à son autopsie, il se réveille quelques instants avant son incinération - Sud Ouest	Transporté à l’hôpital après être tombé malade, un Indien de 25 ans a été déclaré mort par un médecin après une crise d’épilepsie. Alors qu’aucune autopsie n’a été réalisée, le jeune homme s’est réveillé peu de temps avant son incinération	https://media.sudouest.fr/22261231/1200x-1/dambin-7.jpg	2024-11-23 14:34:24	Sud Ouest
fr	https://www.ouest-france.fr/sante/jours-de-carence-les-praticiens-hospitaliers-exigent-le-retrait-immediat-e7c1d032-a918-11ef-8248-4f6efd927e57	Jours de carence : les praticiens hospitaliers exigent le « retrait immédiat » - Ouest-France	Une dizaine de syndicats représentant les praticiens hospitaliers s’élève contre le projet du gouvernement d’instaurer trois jours de carence en cas d’arrêt maladie pour les fonctionnaires. Ces organisations réclament le retrait de la mesure.	https://media.ouest-france.fr/v1/pictures/MjAyNDExODM0NWI0ZmUxNzI0NTQ2NWI1YjU3MjcwNmQ5MDc5ZDE?width=1260&height=708&focuspoint=50%2C25&cropresize=1&client_id=bpeditorial&sign=2c948e24986e62dc23f827e2cf7c326a94499f118cc760baa2042f1df8573395	2024-11-22 21:46:50	Ouest-France
fr	https://www.francetvinfo.fr/faits-divers/info-franceinfo-cinq-personnes-mises-en-examen-pour-avoir-monte-une-escroquerie-a-la-montre-de-luxe_6913652.html	Cinq personnes mises en examen pour avoir monté une escroquerie à la montre de luxe - franceinfo	L'enquête a commencé à la fin de l'année 2023. Des interpellations ont eu lieu mardi.	https://www.francetvinfo.fr/pictures/cBw9TEq_cVLln3B8uFijxE46z8Q/0x146:4300x2563/1500x843/2021/04/10/phpem4z3s.jpg	2024-11-23 05:12:32	franceinfo
fr	https://www.rugbyrama.fr/2024/11/23/xv-de-france-tournee-parfaite-leclair-bielle-biarrey-la-revue-de-presse-apres-france-argentine-12341953.php	"Tournée parfaite", "l’éclair Bielle-Biarrey", la revue de presse après France – Argentine - Rugbyrama	Au lendemain de la victoire française, la presse étrangère ne tarit pas d’éloges pour les hommes de Fabien Galthié. Convaincant face à l’Argentine, le XV de France termine sa tournée invaincu, dans le sillage d’un...	https://images.rugbyrama.fr/api/v1/images/view/67418a62bdf91031530fe0ca/large/image.jpg?v=7	2024-11-23 10:31:00	Rugbyrama