country_code	url	title	description	image_url	publish_date	source
fr	https://news.google.com/rss/articles/CBMikAFBVV95cUxQTWF1cXVwQTJmejN0TUwwNGU5WHd6MmhQX1p5REtxbTBSRi1NTDNmaERGNUU0cFBHd241WUR3Z0oxOGRqYTMxcDBWOXZsWHo3Um9KbVdKdnExamdSMlI3VGFXM2NZMkpObWV6Q0ZqcEtpRjhfV2xHdHAtR1AwVEd2WWFYbTB6aXNqcVBtZlotWUo?oc=5	L'OL maintenu à crédit, Grégory Schneider accuse - Foot01	None	None	2024-11-17 09:00:33	Foot01
fr	https://www.cnews.fr/sport/2024-11-17/jai-failli-mourir-les-revelations-de-mike-tyson-sur-son-etat-de-sante-apres-sa?__cf_chl_rt_tk=DRMGtX8JWnzU0pVt8Jwq_5QrB3FahlPTqd6BOFydW1c-1731855761-1.0.1.1-zf6dPVN.M2Pwg0qaSR8SHOjO669LgC3b0XcgPVFU.5c	«J’ai failli mourir» : les révélations de Mike Tyson sur son état de santé après sa défaite contre Jake Paul - CNEWS	None	None	2024-11-17 09:58:56	CNEWS
fr	https://www.francetvinfo.fr/sports/voile/vendee-globe/vendee-globe-2024-l-avance-de-jean-le-cam-se-reduit-avarie-pour-louis-burton-suivez-la-position-des-skippeurs-en-direct_6902780.html	Vendée Globe 2024 : l'avance de Jean Le Cam se réduit, avarie pour Louis Burton...Suivez la position des skippeurs en direct - franceinfo	Le skippeur de Bureau Vallée a décidé de poursuivre la course dimanche, mais doit procéder à des réparations sur son Imoca.	https://www.francetvinfo.fr/pictures/f8MS743yUb0j-Uaiq1IdeJR_QCc/0x295:5272x3259/1500x843/2024/11/17/vg2024-2408291845-tout-commence-en-finistere-arm-haute-definition-1-6739ab84db180694310383.jpg	2024-11-17 09:15:30	franceinfo
fr	https://www.lequipe.fr/Medias/Actualites/7-3-millions-de-telespectateurs-sur-tf1-pour-france-nouvelle-zelande/1520867	Médias : 7,3 millions de téléspectateurs sur TF1 pour France-Nouvelle-Zélande - L'Équipe	La victoire du XV de France sur les All Blacks (30-29), samedi soir au Stade de France, a été suivie par 7,3 millions de téléspectateurs sur TF1. Une audience très élevée.	https://medias.lequipe.fr/img-photo-jpg/le-succes-face-aux-all-blacks-de-l-equipe-de-france-emmenee-par-antoine-dupont-et-gael-fickou-a-ete-/1500000002085415/0:0,1998:1332-640-427-75/3503f.jpg	2024-11-17 09:32:28	L'Équipe
fr	https://www.lequipe.fr/Golf/Actualites/Dp-world-tour-championship-cap-sur-le-pga-tour-pour-rozner-mcilroy-sur-le-toit-de-l-europe/1520880	DP World Tour Championship : cap sur le PGA Tour pour Rozner, McIlroy sur le toit de l'Europe (Golf) - L'Équipe	Lors d'un finish irrespirable, le Français Antoine Rozner a arraché ce dimanche sa qualification pour le PGA Tour sur le dernier trou du DP World Tour Championship, qu'il termine à la 3e place (15e de la Race), tandis que Rory McIlroy, déjà assuré de la première place à la Race to Dubaï pour la sixième fois, remportait la finale, comme en 2012 et 2015.	https://medias.lequipe.fr/img-photo-jpg/antoine-rozner-en-action-ce-dimanche-a-dubai-a-qadri-ap/1500000002085455/0:0,1997:1331-640-427-75/464a0.jpg	2024-11-17 13:20:34	L'Équipe
fr	https://news.google.com/rss/articles/CBMimgJBVV95cUxONVc1Uk5reVZmS01HX2c4RlVLNmJSN2t5czc5V1I3QjBNejZ3U2FtMkNXV0dYSktVYUZsdUxMX0dkTGVRVXVtOXFiUXFNY0ROX2oyVFRGcDllSXNwRTh0bzlmWDFBZmRYRFdkZU5ZZmFNeklJdkhoRENRaHQ0YnhUYS1IWjI2UGJhWWl0ckthSE9jZzNNX3NwTVItYkZJV1VHdHpvdmZfRDlRNlJEZE45TzhkcjVOUHM1b1hHVVBhdnJwdHdBalBJRW4wT01wa1ZTclJ6aUFBNVMtcnZOb0trSThkM0c5bTYzUmRLdkR3REJ3RjhqYjFnYlgyNW1jbDA0ZkF3THV4UGdtSTFqRy04ckgwZTNSMmlJM1E?oc=5	Budget : le président du Medef s’oppose à la hausse du coût du travail et plaide pour la mise en place d’une « TVA sociale » - Le Monde	None	None	2024-11-17 09:23:15	Le Monde
fr	https://www.boursier.com/actions/actualites/news/robertet-precision-sur-l-evolution-de-l-actionnariat-943891.html	Robertet : précision sur l'évolution de l'actionnariat - Boursier.com	Le FSP, géré par ISALT, et Peugeot Invest acquièrent chacun une participation de 7,1% du capital de Robertet, pour un investissement individuel de 125 ME...	https://cdn-static.boursier.com/illustrations/photos/l_robertet3.jpg	2024-11-17 14:07:00	Boursier.com
fr	https://www.ouest-france.fr/societe/religions/pape-francois/le-pape-francois-evoque-les-accusations-de-genocide-a-gaza-c86c6cf8-a4d4-11ef-831d-1ac76626b0a8	Le pape François évoque les accusations de « génocide » à Gaza - Ouest-France	Pour la première fois, le pape François évoque les accusations de « génocide » à Gaza visant Israël, dans un livre à paraître et dont des extraits ont été publiés ce dimanche 17 novembre en Italie.	https://media.ouest-france.fr/v1/pictures/MjAyNDExZDY1YWM3ZThkMGI0ODgyYTJjMzJmMGVjODI2MmM5YWQ?width=1260&height=708&focuspoint=50%2C25&cropresize=1&client_id=bpeditorial&sign=d9a3a7a538de47766661763c102750bf26b03bc1819168891eecb657636e1a76	2024-11-17 11:36:49	Ouest-France
fr	https://news.google.com/rss/articles/CBMi7wFBVV95cUxNQ05aOGRiMEpwVk51SEJWMHNoNGhlZk50bU0tckQ1NXZLQVp6WFBNejFjdTVYZHhzX1RUeXVfa3NyRHJaMzFGUVJNdERhbTFrMXg4WnBpOUtmR1MxUDY1VjgySF9teG9RN1NxdTQ1RU9LeDlxc1NSaTJjMGhMbXZrVmJyMlJhb1JSOXM2elBJY2QzZEtIWXhUSnA5R19Uczl4N0lxZ2NFVkl2ZmRNdFlLT1RndVVpZTJzT3ZUZUlMWVY3eTJSRFRlS2FmQzY1UnlQZGhVbHZmVUhjYkN5MkpZa0o2d19HdlcyNVg5WkhWMA?oc=5	« Si tu lâches, c'est fini, tu coules », Randal Kolo Muani sur son statut de remplaçant au PSG - L'Équipe	Titulaire en sélection, remplaçant au PSG, Randal Kolo Muani veut continuer à s'accrocher pour que sa situation en club évolue positivement dans les semaines à venir, comme il l'a confié dans Téléfoot sur TF1.	https://medias.lequipe.fr/img-photo-jpg/randal-kolo-muani-lors-du-match-nul-contre-israel-0-0-s-mantey-l-equipe/1500000002085443/419:110,1662:939-640-427-75/c11e5.jpg	2024-11-17 11:17:58	L'Équipe