country_code	url	title	description	image_url	publish_date	source
fr	https://www.webgirondins.com/actualite-girondins-louison-billeau-fc-bressuire-apres-la-defaite-face-aux-girondins-c-est-la-difference-du-haut-niveau-127145	Louison Billeau (FC Bressuire) après la défaite face aux Girondins : “C'est la différence du haut niveau” - WebGirondins	Éliminé avec son club de Bressuire (R1), le défenseur est revenu sur cette rencontre et explique sur le point qui a fait la différence pour les Girondins de Bordeaux.	https://www.webgirondins.com/cache/images/_fa873a45be83716390e0a367aadf410a.jpg	2024-11-18 06:16:00	WebGirondins
fr	https://www.football365.fr/il-nest-pas-giroud-deschamps-expose-mbappe-10213691.html	« Il n’est pas Giroud », Deschamps expose Mbappé - Football365	Le sélectionneur de la France Didier Deschamps a réitéré sa position sur l'avenir international de Kylian Mbappé.	https://www.football365.fr/wp-content/uploads/se/2024/11/ICONSPORT_243792_0049.jpg	2024-11-18 07:06:00	Football365
fr	https://voilesetvoiliers.ouest-france.fr/course-au-large/vendee-globe/vendee-globe-sam-goodchild-sechappe-en-tete-louis-burton-en-grande-difficulte-39eba4e8-a56b-11ef-831d-1ac76626b0a8	Vendée Globe. Sam Goodchild s’échappe en tête, Louis Burton en grande difficulté - Voiles et Voiliers	Louis Burton pourra-t-il réparer son bateau fissuré ? C’est une des questions du jour pour ce candidat au podium qui avait terminé 3e du dernier Vendée Globe. « La question de l’abandon s’est posée, mais je ne veux pas m’y résoudre » dit le skipper de Bureau Vallée. Côté course, Sam Goodchild fait un énorme numéro. Il creuse l’écart ce lundi matin 18 novembre, en tête devant Sébastien Simon et Thomas Ruyant et avec plus de 170 milles d’avance sur les autres grands favoris. Quelle trajectoire !	https://media.ouest-france.fr/v1/pictures/MjAyNDExYTIyYWFiMWVlY2FkZjRlMjZjMjMxYjc1MWQ3MjdlMjY?width=1260&height=708&focuspoint=50%2C25&cropresize=1&client_id=bpeditorial&sign=772084e55cbf7d373a4731c148912e3d157c2561589fa8b199628e09002892b5	2024-11-18 06:24:45	Voiles et Voiliers
fr	https://news.google.com/rss/articles/CBMixwFBVV95cUxPWWg1QlFBbzVRSXFUX3pGTFowQ3FZU0VZM3ZHcmhGdWxvVlY2SWg5TnlzcDhXTVBxUVJwM2tJMC14alBKRlVWU0VNMkI5OFFMRVFLX29uZHo5blYzNGh4QkdLNC1rWHA0MG83c0tLU1BXN1RNd1JnSURoc3gya0hKVWlwaFZnUWpTc2hQVUNFNVBqOFZsTXR4eDhpMEFPUkI1MXhieWlKUHJENWw4ODllVm5PSk5jUE5HTFhKX0RjMXNhQUhuMDVj?oc=5	Ligue des Nations : les potentiels adversaires des Bleus en quarts de finale - Foot National	None	None	2024-11-18 06:22:00	Foot National
fr	https://www.francetvinfo.fr/faits-divers/charente-maritime-le-detenu-de-la-maison-d-arret-de-saintes-qui-s-est-evade-en-sortant-les-poubelles-a-ete-retrouve_6904700.html	Charente-Maritime : le détenu de la maison d'arrêt de Saintes qui s'est évadé en sortant les poubelles a été retrouvé - franceinfo	La cavale de l'homme de 28 ans, condamné pour vol par effraction, aura donc duré un peu plus de trois jours.	https://www.francetvinfo.fr/pictures/9HRfXD2XTHTc9ONna33Dbe0_TU0/0x189:2016x1323/1500x843/2024/11/14/maxradiofr014936-67361671c6d27896350458.jpg	2024-11-18 10:57:32	franceinfo
fr	https://www.cnews.fr/france/2024-11-18/voici-tout-ce-qui-va-changer-pour-les-retraites-partir-du-1er-janvier-2025-1589028?__cf_chl_rt_tk=wf6XvuipEZoYXU1U6HZbyCWVxlyMseufWTcJQb94GBs-1731934967-1.0.1.1-R6sFocGeejnq93sC5mvf9XQuObHH7.Eg9jcnA4wmb5Y	Voici tout ce qui va changer pour les retraités à partir du 1er janvier 2025 - CNEWS	None	None	2024-11-18 07:32:28	CNEWS
fr	https://www.francetvinfo.fr/replay-radio/le-brief-eco/l-enseigne-de-produits-de-la-maison-a-petits-prix-gifi-est-en-vente_6876167.html	L’enseigne de produits de la maison à petits prix GiFi est en vente - franceinfo	La rumeur planait elle est confirmée. Les repreneurs potentiels peuvent se manifester dès lundi. Les 6 500 collaborateurs veulent savoir dans quelles mains ils vont tomber.	https://www.francetvinfo.fr/pictures/EuejnTb6kiMRfKWPUhcr2GKPCSM/0x237:4080x2531/1500x843/2024/11/18/gifi-673ae473aabda671052834.jpg	2024-11-18 06:55:59	franceinfo
fr	https://actu.fr/sports/rugby/pro/la-liste-des-42-joueurs-pour-france-argentine-x-renforts-jalibert-toujours-absents_61876017.html	La liste des 42 joueurs pour France - Argentine : des renforts, Jalibert toujours absent - Actu Rugby	None	None	2024-11-17 19:39:37	Actu Rugby