country_code	url	title	description	image_url	publish_date	source
fr	https://www.francetvinfo.fr/monde/usa/presidentielle/donald-trump/donald-trump-choisit-la-juriste-pam-bondi-pour-le-ministere-de-la-justice-apres-le-retrait-de-matt-gaetz_6913496.html	Donald Trump choisit la juriste Pam Bondi pour le ministère de la Justice après le retrait de Matt Gaetz - franceinfo	Cette ancienne procureure a fait partie de l'équipe d'avocats du président élu lors de son procès en destitution au Sénat en 2020.	https://www.francetvinfo.fr/pictures/ME1DGk8PW-lZ0F9Evcl8-cO2cRg/0x12:1024x588/1500x843/2024/11/22/000-36mz3ge-6740db455be2a956548899.jpg	2024-11-22 19:29:24	franceinfo
fr	https://www.20minutes.fr/societe/4122918-20241122-chevaux-quoi-maladie-dangereuse-circulation-plusieurs-departements	Une maladie très dangereuse pour les chevaux circule activement en France - 20 Minutes	Une épidémie de rhinopneumonie, maladie virale contagieuse et mortelle pour les chevaux, inquiète le milieu équestre en France	https://img.20mn.fr/y2CFa6HXRVq3bQDldZW06yk/1444x920_illustration-d-un-cheval	2024-11-22 21:45:00	20 Minutes
fr	https://www.lejdd.fr/international/boualem-sansal-arrete-lalgerie-confirme-et-accuse-la-france-macronito-sioniste-152025	Boualem Sansal arrêté : l’Algérie confirme et accuse la France «macronito-sioniste» - Le Journal du dimanche	L’agence de presse d’Algérie a confirmé, vendredi 22 novembre, que Boualem Sansal a été arrêté par les autorités algériennes, dénonçant au passage le soutien de la classe politique française à l’écrivain.<br />
<br />
	https://www.lejdd.fr/lmnr/var/jdd/public/media/image/2024/11/22/21/sipa_01160186_000070-1.jpg?VersionId=SMDLHcwbexLKzGsjND_lu.X6jXX2Clp3	2024-11-22 20:20:43	Le Journal du dimanche
fr	https://www.lepopulaire.fr/limoges-87000/economie/les-agriculteurs-de-la-confederation-paysanne-manifestent-devant-une-concession-mercedes-a-limoges_14600285/	Pourquoi des agriculteurs ont manifesté devant une concession Mercedes à Limoges ? - Le Populaire du Centre	La Confédération Paysanne s’est démarquée des autres syndicats agricoles en organisant ce vendredi après-midi une manifestation en ZI.Nord à Limoges, devant le garage Mercedes, symbole, selon eux, des enseignes qui profiteront du Mercosur.	https://img.centrefrance.com/9Esekez2Bo6juzxD5-6YcsBVdsj0VRhxb1DdumBdWSc/rs:fit:657:438:1:0/bG9jYWw6Ly8vMDAvMDAvMDcvMjQvNzcvMjAwMDAwNzI0NzcxMw.webp	2024-11-22 19:56:00	Le Populaire du Centre
fr	https://actu.fr/meteo/neige-verglas-vent-plus-de-50-departements-en-vigilance-ce-samedi_61907383.html	Neige-verglas, vent : plus de 50 départements en vigilance ce samedi - actu.fr	L'épisode neigeux a un peu surpris son monde, ce jeudi 21 novembre 2024. Il s'achève doucement, mais continue à faire parler de lui... Avant l'arrivée de la tempête Bert.	https://static.actu.fr/uploads/2024/11/4d39ba92a04762149ba92a047f449bv.jpg	2024-11-23 07:29:46	actu.fr
fr	https://www.ouest-france.fr/meteo/neige/neige-et-verglas-la-circulation-reste-encore-difficile-par-endroits-en-sarthe-65cc2cb0-a8e8-11ef-8248-4f6efd927e57	Neige et verglas : la circulation reste encore difficile par endroits en Sarthe - Ouest-France	[Le Maine Libre] La circulation ce vendredi 22 novembre 2024 est globalement revenue à la normale. Mais des secteurs restent délicats sur le réseau secondaire, avec des routes fermées pour le week-end.	https://media.ouest-france.fr/v1/pictures/MjAyNDExNGQ4NzRiNjU1OGVjOTMyOWI5MmVkODc2ODU1YWMzZDg?width=1260&height=708&focuspoint=50%2C25&cropresize=1&client_id=bpeditorial&sign=42c78c6156418b2e6b2029692d273ad8d8465ce000ecf65e01784088ba4233c0	2024-11-22 16:12:07	Ouest-France
fr	https://www.lemonde.fr/international/article/2024/11/23/au-pakistan-au-moins-trente-deux-morts-dans-des-violences-opposant-sunnites-et-chiites_6410282_3210.html	Au Pakistan, au moins trente-deux morts dans des violences opposant sunnites et chiites - Le Monde	Ces violences ont eu lieu deux jours après des attaques visant des chiites, qui ont causé la mort de 43 personnes.	https://img.lemde.fr/2024/11/22/0/0/4947/3298/1440/960/60/0/58ba449_5322527-01-06.jpg	2024-11-23 10:33:44	Le Monde
fr	https://actualite.lachainemeteo.com/actualite-meteo/2024-11-23/hausse-spectaculaire-des-temperatures-plus-de-10-c-de-hausse-en-24-heures-73275	Hausse spectaculaire des températures : plus de 10°C de hausse en 24 heures - La Chaîne Météo	Alors que de l'air froid a envahi une grande partie du pays à l'arrière de la dépression Caetano, un brutal changement de situation météo s'opére sur la France ce week-end. Avec un flux qui bascule au sud à l'avant d'une perturbation sur le proche Atlantique, de l'air subtropical remonte depuis les Canaries jusque sur la partie nord de la France. - Actualités La Chaîne Météo	https://static1.mclcm.net/iod/images/v2/69/photo/424208/1200x630_100_300_000000x10x0.jpg?ts=20241122154601	2024-11-23 12:07:03	La Chaîne Météo
fr	https://www.natura-sciences.com/environnement/cop29-texte-financements-inacceptable.html	COP29 : Un texte sur les financements « inacceptable » - Natura Sciences	La COP29 qui se tient à Bakou en Azerbaïdjan jusqu'à ce vendredi 22 novembre doit trouver un nouvel accord sur les financements climat. L'enjeu est de	None	2024-11-22 14:55:11	Natura Sciences
fr	https://www.lefigaro.fr/faits-divers/blois-le-corps-d-une-femme-de-81-ans-decouvert-dans-un-sac-son-voisin-place-en-garde-a-vue-20241123	Blois : le corps d'une femme de 81 ans découvert dans un sac, son voisin placé en garde à vue - Le Figaro	L’octogénaire, dont la disparition a été signalée mardi, était en conflit avec son voisin au sujet de fuites d’eau. Son corps a été retrouvé «complètement replié», avec «le visage défoncé», dans une forêt à 3km de son domicile.	https://i.f1g.fr/media/cms/1200x630_crop/2024/11/23/9502a050dbd87416bd010abdbefbc9444edc4789540f073c73097ae5498f3672.jpg	2024-11-23 10:44:39	Le Figaro
fr	https://www.liberation.fr/politique/subventions-en-peril-pour-la-culture-dans-les-pays-de-la-loire-si-la-region-se-retire-je-ne-vois-pas-comment-continuer-20241123_A37K63SIEJBJBP5BJSYZPTV35E/	Subventions en péril pour la culture dans les Pays de la Loire : «Si la région se retire, je ne vois pas comment continuer - Libération	Désireuse d’aller plus loin que les demandes d’économie du gouvernement, la présidente de la région, Christelle Morançais, souhaite des coupes sévères. Le secteur culturel s’alarme de mesures qui anéantiraient son activité.	https://www.liberation.fr/resizer/L0a66WRgy2-YlduSipWgyYuY1es=/1200x630/filters:format(jpg):quality(70):focal(1602x933:1612x943)/cloudfront-eu-central-1.images.arcpublishing.com/liberation/PN7BVCLK3ZGMRGZCVA7MK6CT2M.jpg	2024-11-23 11:40:29	Libération
fr	https://france3-regions.francetvinfo.fr/auvergne-rhone-alpes/isere/grenoble/lilou-adolescente-de-16-ans-disparue-a-metz-et-contrainte-de-se-prostituer-un-homme-interpelle-a-grenoble-et-mis-en-examen-3065098.html	Lilou, adolescente de 16 ans, disparue à Metz et contrainte de se prostituer : un homme interpellé à Grenoble et mis en examen - France 3 Régions	Un homme, soupçonné de proxénétisme aggravé, a été interpellé et mis en examen à Grenoble (Isère), a indiqué le parquet ce samedi 23 novembre. Le suspect a été placé en détention provisoire. Il est suspecté d'avoir participé...	https://france3-regions.francetvinfo.fr/image/EgvMq_btRzc-NJ3ZTYbVPJAhlu8/930x620/regions/2024/11/23/maxnewsworldfive945319-6741bf2be9700181604971.jpg	2024-11-23 11:55:22	France 3 Régions
fr	https://www.lefigaro.fr/faits-divers/saint-mande-les-policiers-ouvrent-le-feu-sur-un-homme-arme-qui-les-avait-mis-en-joue-20241123	Saint-Mandé : les policiers ouvrent le feu sur un homme armé qui les avait mis en joue - Le Figaro	Le suspect, âgé de 22 ans, a été grièvement blessé dans la nuit de vendredi à samedi. Il aurait auparavant suivi un homme à la sortie du métro en le menaçant de mort.	https://i.f1g.fr/media/cms/1200x630_crop/2024/11/23/d0fca72d2801d17041b3863cdccc812c9be578d2f566796681cb972712cc3a3b.jpg	2024-11-23 11:16:23	Le Figaro
fr	https://france3-regions.francetvinfo.fr/normandie/calvados/une-femme-de-85-ans-meurt-d-une-intoxication-au-monoxyde-de-carbone-suite-aux-coupures-d-electricite-3064987.html	Une femme de 85 ans meurt d'une intoxication au monoxyde de carbone suite aux coupures d'électricité - France 3 Régions	La femme âgée est décédée vendredi 22 novembre 2024 dans le village d'Ussy (Calvados), privé d'électricité par les récentes intempéries. La gendarmerie confirme l'intoxication au monoxyde de carbone, causé par un chauffage...	None	2024-11-23 10:18:09	France 3 Régions
fr	https://rmcsport.bfmtv.com/tennis-de-table/direct-tennis-de-table-wtt-finals-suivez-la-finale-historique-des-freres-lebrun-en-double_LN-202411230206.html	DIRECT. Tennis de table (WTT Finals): sacre historique pour les Lebrun qui terminent l'année n°1 mondiaux en double - RMC Sport	Les frères Lebrun ont signé une performance doublement historique ce samedi à Fukuoka (Japon), en remportant le tournoi double des WTT Finals, et en terminant ainsi l'année numéros 1 mondiaux.	None	2024-11-23 13:51:00	RMC Sport
fr	https://france3-regions.francetvinfo.fr/bourgogne-franche-comte/doubs/recit-apocalyptique-10h30-dans-leur-voiture-on-etait-livres-a-nous-memes-ils-nous-racontent-leur-nuit-sur-l-a36-pris-au-piege-par-la-neige-3064885.html	RÉCIT. "Apocalyptique", "10h30 dans la voiture, "livrés à nous-mêmes", ils racontent leur longue nuit sur l'A36, pris au piège par la neige - France 3 Régions	Émilie et Lucil ont passé une nuit "apocalyptique" dans le pays de Montbéliard (Doubs), coincées dans leur voiture entre les camions immobilisés par la neige sur l'autoroute A36, dans la nuit du 21 au 22 novembre. Serge,...	https://france3-regions.francetvinfo.fr/image/81CpLGlWxTBAGMMsIqVxCsEocsM/930x620/regions/2024/11/22/maxbestof313267-6740bd2799a12169316358.jpg	2024-11-22 19:28:30	France 3 Régions
fr	https://www.francetvinfo.fr/france/auvergne-rhone-alpes/isere/grenoble/agent-municipal-tue-a-grenoble-le-suspect-arrete-au-portugal-accepte-d-etre-extrade_6913478.html	Agent municipal tué à Grenoble : le suspect arrêté au Portugal accepte d'être extradé - franceinfo	Le principal suspect a 19 condamnations à son casier judiciaire.	https://www.francetvinfo.fr/pictures/sDI777dAhsvuMY2pyx8LyidybTc/0x0:4800x2698/1500x843/2024/11/22/lilian1-6740d87b201b6103130388.jpg	2024-11-22 19:18:07	franceinfo
fr	https://www.leparisien.fr/politique/un-shutdown-a-lamericaine-ce-quil-se-passerait-si-la-france-ne-votait-pas-son-budget-22-11-2024-PITXM4ZYG5DHZHD7Z3LE6AIR7M.php	Un « shutdown » à l’américaine ? Ce qu’il se passerait si la France ne votait pas son budget - Le Parisien	Si le projet de loi de finances pour 2025 n’est pas voté en décembre, le pays entrera dans une période d’incertitude, qui n’interdit toutefo	https://www.leparisien.fr/resizer/rekoIR5IzUBRelUlPfJ4H8HtYsM=/1200x675/cloudfront-eu-central-1.images.arcpublishing.com/leparisien/HVSWRZUXNBGEDKVKMOSNS6SJCE.jpg	2024-11-22 18:30:00	Le Parisien
fr	https://www.caradisiac.com/la-faillite-de-northvolt-un-echec-cuisant-pour-l-industrie-europeenne-des-voitures-electriques-212449.htm	La faillite de Northvolt, un échec cuisant pour l'industrie européenne des voitures électriques - Caradisiac.com	None	None	2024-11-22 15:42:48	Caradisiac.com
fr	https://www.francetvinfo.fr/societe/debats/pantheon/emmanuel-macron-annonce-l-entree-au-pantheon-de-l-historien-et-resistant-marc-bloch-fusille-par-la-gestapo-en-1944_6914915.html	Emmanuel Macron annonce l'entrée au Panthéon de l'historien et résistant Marc Bloch, fusillé par la Gestapo en 1944 - franceinfo	La petite-fille de Marc Bloch a réagi à cette panthéonisation à venir en disant sa "très grande émotion et fierté".	https://www.francetvinfo.fr/pictures/Fg153BePbi7nhX0WMlsRyMt9KPI/0x1067:2518x2484/1500x843/2024/11/23/gettyimages-89863559-6741c2c41e3c4548884442.jpg	2024-11-23 14:59:27	franceinfo
fr	https://www.lemonde.fr/societe/article/2024/11/23/des-dizaines-de-manifestations-en-france-contre-les-violences-faites-aux-femmes-en-plein-proces-des-viols-de-mazan_6410654_3224.html	Violences faites aux femmes : des dizaines de manifestations se déroulent en France, en plein procès des viols de Mazan - Le Monde	Deux jours avant la Journée internationale pour l’élimination de la violence à l’égard des femmes, plus de 400 organisations et des personnalités ont appelé à la mobilisation.	https://img.lemde.fr/2024/11/23/0/0/3000/2000/1440/960/60/0/cf058a7_1732373005152-untitled-as103165.jpg	2024-11-23 14:07:42	Le Monde
fr	https://www.liberation.fr/societe/religions/pourquoi-le-pape-francois-a-choisi-de-se-rendre-en-corse-et-de-bouder-la-reouverture-de-notre-dame-20241123_GCYBO5GFJ5HZHECCXLGMPQ4N3E/	Pourquoi le pape François a choisi de se rendre en Corse et de bouder la réouverture de Notre-Dame - Libération	Le pape effectuera bien une visite à Ajaccio le dimanche 15 décembre, a confirmé le Vatican ce samedi 23 novembre. Un déplacement en adéquation avec l’intérêt papal pour «les périphéries», mais qui crispe les autorités françaises.	https://www.liberation.fr/resizer/6w11CnLT-nmSg5jv_BfwpLETtMg=/1200x630/filters:format(jpg):quality(70)/cloudfront-eu-central-1.images.arcpublishing.com/liberation/HUEYK6YAEZDQFN6MRHWKFZ3TM4.JPG	2024-11-23 11:05:14	Libération
fr	https://www.francetvinfo.fr/economie/crise/blocus-des-agriculteurs/il-y-a-une-incitation-a-la-surenchere-comment-les-elections-professionnelles-influencent-la-mobilisation-et-les-methodes-des-syndicats-d-agriculteurs_6910571.html	"Il y a une incitation à la surenchère" : comment les élections professionnelles influencent la mobilisation et les méthodes des syndicats d'agriculteurs - franceinfo	A deux mois d'un scrutin décisif dans les chambres d'agriculture, la Coordination rurale tente d'imposer ses méthodes musclées pour casser le monopole historique de la FNSEA et des Jeunes Agriculteurs.	https://www.francetvinfo.fr/pictures/Jtrg4jIViV8AXxkxUnRK-tk2N7s/0x325:6240x3835/1500x843/2024/11/21/dscf0138-673f584035003952331662.jpg	2024-11-23 06:00:39	franceinfo
fr	https://www.liberation.fr/societe/le-camp-du-struthof-approvisionnait-luniversite-de-strasbourg-en-etre-humains-pour-des-experiences-20241123_QSVTGTMX5BESPEFYU6DAFNSRXY/	«Le camp du Struthof approvisionnait l’université de Strasbourg en être humains pour des expériences» - Libération	Emmanuel Macron se rend ce samedi 23 novembre au Struthof, seul camp de concentration ouvert en France pendant la Seconde Guerre mondiale. Interview de Christian Bonah qui a enquêté sur le lien entre ce camp et l'université de Strasbourg.	https://www.liberation.fr/resizer/ozx6Relj0812JqTHbGlXPAMYIuQ=/1200x630/filters:format(jpg):quality(70):focal(2536x2634:2546x2644)/cloudfront-eu-central-1.images.arcpublishing.com/liberation/SW4P6Y4BDBFWNNJK5TXSCYBJHQ.jpg	2024-11-23 10:49:13	Libération
fr	https://www.cnews.fr/france/2024-11-23/ile-de-france-voici-les-12-caricatures-qui-seront-etudiees-dans-les-lycees-partir	Ile-de-France : voici les 12 caricatures qui seront étudiées dans les lycées à partir du mois janvier 2025 - CNEWS	None	None	2024-11-23 11:32:28	CNEWS
fr	https://www.lemonde.fr/politique/article/2024/11/23/la-france-insoumise-sous-le-feu-des-critiques-pour-avoir-propose-d-abroger-le-delit-d-apologie-du-terrorisme_6410789_823448.html	La France insoumise sous le feu des critiques pour avoir proposé d’abroger le délit d’apologie du terrorisme - Le Monde	La proposition de loi déposée par le parti de gauche veut supprimer ce délit créé par une loi de 2014, estimant que la loi du 29 juillet 1881, qui traite « des faits relevant des délits d’apologie de crime, d’apologie de crime de guerre, d’apologie de crime contre l’humanité », suffit en la matière.	https://img.lemde.fr/2024/06/28/0/0/2599/1733/1440/960/60/0/61e689c_1719556480684-000-34pq42z.jpg	2024-11-23 15:26:13	Le Monde
fr	https://www.ouest-france.fr/politique/institutions/senat/budget-de-la-secu-le-senat-vote-deux-rallonges-pour-la-dependance-f5aadcb0-a928-11ef-8248-4f6efd927e57	Budget de la Sécu : le Sénat vote deux rallonges et valide une hausse des retraites - Ouest-France	Le Sénat a décidé de soulager les finances des collectivités et des résidences pour personnes âgées en revalorisant les allocations des pensionnaires. Une hausse en deux temps des retraites en 2025, à hauteur de l’inflation, a aussi été votée.	https://media.ouest-france.fr/v1/pictures/MjAyNDExYTEyYzViMGJkYzBmMTgxMDkzMmJlMzcwZmRlYTU5YWY?width=1260&height=708&focuspoint=50%2C25&cropresize=1&client_id=bpeditorial&sign=dbda8635a948a86d70c89b28145626dab044859a82f4f831033ac74637f8b8a1	2024-11-23 00:02:01	Ouest-France
fr	https://www.20minutes.fr/societe/4122909-20241122-calais-marche-blanche-mere-deux-fils-decedes-accident-a26	Une marche blanche en mémoire d’une mère et ses fils tués sur l'A26 - 20 Minutes	Une marche blanche se tiendra ce samedi 23 novembre à Vimy (Pas-de-Calais) en mémoire de Laëtitia et ses deux fils, Naël et Yanis, morts dans un accident sur l’A26 le 16 novembre	https://img.20mn.fr/SBJOOHQcRFeCHoypH0VqrCk/1444x920_cars-pass-a-toll-collection-point-on-highway-a26-in-arras-on-october-10-2014-the-french-government-has-suspended-the-planned-introduction-of-a-new-environmental-ecotax-on-commercial-vehicles-carrying-cargo-of-more-than-3-5-tonnes-afp-photo-philippe-huguen-photo-by-philippe-huguen-afp	2024-11-22 19:37:00	20 Minutes
fr	https://www.20minutes.fr/monde/etats-unis/4122913-20241122-affaire-stormy-daniels-sentence-trump-suspendue-indefiniment-apres-victoire-presidentielle	La sentence de Trump dans l’affaire Stormy Daniels suspendue indéfiniment - 20 Minutes	Alors que ses avocats continuent de réclamer une annulation des poursuites, le juge consent à une suspension des procédures contre le président réélu Donald Trump dans le cadre de l’affaire Stormy Daniels	https://img.20mn.fr/XeAC8CDxQ32Ki_b-9U-C1yk/1444x920_donald-trump-et-stormy-daniels-archives	2024-11-22 19:40:00	20 Minutes
fr	https://www.france24.com/fr/am%C3%A9riques/20241123-le-chef-de-l-otan-mark-rutte-a-rencontr%C3%A9-donald-trump-au-%C3%A9tats-unis	Le chef de l'Otan Mark Rutte a rencontré Donald Trump aux États-Unis - FRANCE 24	Donald Trump et le patron de l'Otan, Mark Rutte, se sont rencontrés vendredi en Floride, a annoncé samedi la porte-parole de l'Alliance atlantique. Les deux hommes ont notamment abordé la "menace" que…	https://s.france24.com/media/display/f3712bf8-a977-11ef-b93b-005056a90284/w:1280/p:16x9/000_36N67EP.jpg	2024-11-23 09:02:31	FRANCE 24
fr	https://actu.fr/occitanie/villefranche-de-lauragais_31582/rugby-ce-joueur-va-connaitre-sa-grande-premiere-avec-le-stade-toulousain-et-il-est-originaire-du-lauragais_61907364.html	Rugby : ce joueur va connaître sa grande première avec le Stade Toulousain et il est originaire du Lauragais - actu.fr	Formé au club de rugby de Villefranche-de-Lauragais, Simon Daroque figure pour la première fois dans le groupe pro du Stade Toulousain pour la réception de Perpignan en Top 14. 	https://static.actu.fr/uploads/2024/11/simon-daroque-stade-toulousain-entrainement.jpg	2024-11-23 07:51:52	actu.fr
fr	https://www.francetvinfo.fr/monde/proche-orient/israel-palestine/mandat-d-arret-de-la-cpi-contre-benyamin-netanyahou-cette-decision-doit-etre-respectee-insiste-l-eurodeputee-valerie-hayer_6914753.html	Mandat d'arrêt de la CPI contre Benyamin Nétanyahou : "Cette décision doit être respectée", insiste l'eurodéputée Valérie Hayer - franceinfo	La Cour pénale internationale a émis, jeudi, des mandats d'arrêt visant le Premier ministre israélien.	https://www.francetvinfo.fr/pictures/Z8_OHNDcoWG0QeFEsXFgE53gshg/0x56:4000x2305/1500x843/2024/11/23/valerie-hayer-67419e25a1aac510070492.jpg	2024-11-23 09:23:31	franceinfo
fr	https://www.ouest-france.fr/monde/liban/guerre-au-proche-orient-immeuble-touche-a-beyrouth-gaza-sans-hopitaux-les-dernieres-infos-3f8ff077-5473-48fd-8b72-9934ff26edf0	Guerre au Proche-Orient. Au moins onze morts à Beyrouth, Gaza sans hôpitaux… Les dernières infos - Ouest-France	Au moins cinq frappes israéliennes ont touché le centre de Beyrouth ce samedi aux premières heures de la journée. Un immeuble de huit étages a été détruit dans l’attaque et plusieurs autres ont été endommagés. La banlieue sud de Beyrouth a aussi été pilonnée au cours de la nuit après des appels d’Israël à évacuer. À Gaza, les hôpitaux sont quant à eux contraints de réduire leur activité en raison du manque de carburant.	https://media.ouest-france.fr/v1/pictures/MjAyNDExMzAxMTA0OWYxZTIxN2VjMGE3M2I2MzE3YTE1MzRjM2Q?width=1260&height=708&focuspoint=50%2C25&cropresize=1&client_id=bpeditorial&sign=95a382e17b6e4151ed1bacded5471e4ec094d3d60d0798242df2b72952c76e7d	2024-11-23 04:45:14	Ouest-France
fr	https://www.lemonde.fr/international/live/2024/11/23/en-direct-guerre-en-ukraine-la-pologne-estime-que-le-tir-d-un-missile-balistique-par-la-russie-sur-dnipro-est-un-signe-de-desespoir-russe_6398132_3210.html	En direct, guerre en Ukraine : la Pologne estime que le tir d’un missile balistique par la Russie sur Dnipro est « un signe de désespoir » russe - Le Monde	« Nous voyons des signes indiquant que l’économie russe est sous tension, nous avons des rapports faisant état de désertions de soldats russes et, bien sûr, inviter des mercenaires de Corée du Nord n’est pas une démonstration de force », a estimé vendredi le ministre des affaires étrangères polonais, Radoslaw Sikorski.	https://img.lemde.fr/2024/11/23/446/0/4981/2490/1440/720/60/0/3768f16_2024-11-23t132739z-610943837-rc2o9bahv955-rtrmadp-3-ukraine-crisis-frontline.JPG	2024-11-23 13:26:57	Le Monde
fr	https://actu.fr/occitanie/toulouse_31555/ils-ont-essaye-de-l-etrangler-dit-le-maire-de-toulouse-un-elu-violemment-tabasse-lors-d-une-reunion_61907617.html	"Ils ont essayé de l'étrangler", dit le maire de Toulouse : un élu "violemment tabassé" lors d'une réunion - actu.fr	None	None	2024-11-23 12:23:51	actu.fr
fr	https://www.ledauphine.com/faits-divers-justice/2024/11/23/isere-grenoble-meurtre-dans-une-epicerie-africaine-l-auteur-toujours-en-fuite	Grenoble. Meurtre dans une épicerie africaine : un suspect interpellé - Le Dauphiné Libéré	None	None	2024-11-23 13:18:45	Le Dauphiné Libéré
fr	https://www.ouest-france.fr/meteo/tempete/tempete-caetano-le-chauffeur-vtc-nantais-emmene-des-philippins-jusqua-madrid-une-course-a-3-800-euros-8519d974-a8f6-11ef-b615-96f9c0483433	Tempête Caetano. Le chauffeur VTC nantais emmène des Philippins jusqu’à Madrid: une course à 3 800 € - Ouest-France	Échoués à l’aéroport de Nantes jeudi soir 21 novembre, sans moyen de rejoindre la capitale espagnole, un chauffeur de VTC nantais les a transportés dans la nuit. Ils étaient à Madrid, ce vendredi matin. Une course pas banale.	https://media.ouest-france.fr/v1/pictures/MjAyNDExNTA2NzE1MzNlNmIwNjg3N2E5MDA2MjRjODhiZjZiZjk?width=1260&height=708&focuspoint=50%2C25&cropresize=1&client_id=bpeditorial&sign=96ba75d7baf9bd342892785f14917afeb416ff75cdbc5c05c22491b076223679	2024-11-22 18:19:33	Ouest-France
fr	https://www.francetvinfo.fr/france/ile-de-france/paris-un-homme-tue-par-balle-dans-un-mcdonald-s-le-suspect-interpelle_6913286.html	Paris : un homme tué par balle dans un McDonald's, le suspect interpellé - franceinfo	Le principal suspect a tiré deux coups de feu en direction de la tête de la victime.	https://www.francetvinfo.fr/pictures/NViA3wBeqInXLoEHoZT_enXqMdU/0x167:4281x2576/1500x843/2021/11/25/phpYo57Kv.jpg	2024-11-22 16:44:49	franceinfo
fr	https://www.lequipe.fr/Football/match-direct/ligue-1/2024-2025/lens-om-live/655958	DIRECT. Lens-OM (Ligue 1 2024-2025) à suivre en direct - L'Équipe	Quelle première période intense à Lens où il ne manque que des buts. À domicile, les Lensois mettent une grosse pression sur un OM qui peut remercier Rulli auteur d'arrêts importants, ainsi que le manque de finition de Nzola, Machado et Da Costa.	https://medias.lequipe.fr/img-stade:football-jpg/stade/lens-stade-bollaert-delelis-jour/0-1000-0-99/	2024-11-23 15:37:12	L'Équipe
fr	https://www.letelegramme.fr/bretagne/a-rennes-deux-rixes-et-trois-blesses-par-arme-blanche-6708332.php	À Rennes, deux rixes et trois blessés par arme blanche - Le Télégramme	À Rennes, trois personnes ont été transportées à l’hôpital après avoir été blessées par arme blanche. L’une d’entre elles a également reçu des coups de marteau.	https://media.letelegramme.fr/api/v1/images/view/6741f6b36b0ea351184df83a/web_golden_xxl/6741f6b36b0ea351184df83a.1	2024-11-23 05:48:01	Le Télégramme
fr	https://www.bfmtv.com/people/j-ai-vu-des-choses-inacceptables-muriel-robin-reagit-a-la-condamnation-de-pierre-palmade_AN-202411230235.html	"J'ai vu des choses inacceptables": Muriel Robin réagit à la condamnation de Pierre Palmade - BFMTV	Invitée de C à Vous, sur France 5, Muriel Robin a réagi à la condamnation de son ancien ami, l'humoriste Pierre Palmade, à cinq ans de prison.	https://images.bfmtv.com/aRevArI8nT3V20cF8qoPatyFKDA=/190x76:1582x859/1392x0/images/Muriel-Robin-1707952.jpg	2024-11-23 08:47:07	BFMTV
