country_code	url	title	description	image_url	publish_date	source
fr	https://www.lefigaro.fr/conjoncture/il-ne-faut-pas-faire-d-erreurs-l-executif-renonce-a-legiferer-sur-les-casinos-en-ligne-dans-l-immediat-20241027	«Il ne faut pas faire d’erreurs»: l’exécutif renonce à légiférer sur les casinos en ligne dans l'immédiat - Le Figaro	Le gouvernement, qui prévoyait d’autoriser par ordonnance les casinos en ligne en France, fait finalement marche arrière, de crainte de pénaliser «un certain nombre d’acteurs», à commencer par les casinos physiques.	https://i.f1g.fr/media/cms/1200x630_crop/2024/10/27/64a7c964d13182c49a3d4a3829fc763bc662d01818d61bc98589baf7a7a9d133.jpg	2024-10-27 11:03:25	Le Figaro
fr	https://www.lequipe.fr/Tennis-de-table/Actualites/Felix-lebrun-remporte-le-wtt-champions-de-montpellier-et-entre-dans-l-histoire-du-tennis-de-table-francais/1516668	Félix Lebrun remporte le WTT Champions de Montpellier et entre, à 18 ans, dans l'histoire du tennis de table français - L'Équipe	Poussé par une Sud de France Arena acquise à sa cause, Félix Lebrun a remporté ce dimanche le WTT Champions de Montpellier en venant à bout du Japonais Tomokazu Harimoto en cinq manches (11-7, 11-9, 11-6, 8-11, 11-4). Jamais un Français n'avait gagné un tournoi de ce niveau.	https://medias.lequipe.fr/img-photo-jpg/felix-lebrun-a-vecu-une-journee-de-reve-ce-dimanche-e-garnier-l-equipe/1500000002074325/0:0,1997:1331-640-427-75/8393f.jpg	2024-10-27 16:57:24	L'Équipe
fr	https://www.lemonde.fr/societe/article/2024/10/27/pas-de-calais-un-migrant-meurt-lors-d-une-traversee-de-la-manche_6361201_3224.html	« Un homme de nationalité indienne d’environ 40 ans » est mort lors d’une tentative de traversée de la Manche - Le Monde	L’embarcation, en mauvais état, s’est dégonflée peu après le départ dimanche matin, laissant les migrants nager pour regagner la plage, sans gilets de sauvetage pour certains.	https://img.lemde.fr/2024/10/27/0/4/2548/1699/1440/960/60/0/98d8eb9_5084296-01-06.jpg	2024-10-27 10:08:48	Le Monde
fr	https://www.lequipe.fr/Football/Actualites/Franck-haise-apres-la-victoire-de-nice-contre-monaco-une-bonne-chose-pour-tout-le-monde-pour-moi-aussi/1516734	Franck Haise après la victoire de Nice contre Monaco : « Une bonne chose pour tout le monde, pour moi aussi » - L'Équipe	L'entraîneur de Nice Franck Haise s'est montré soulagé en conférence de presse, après le succès à domicile de son équipe face à Monaco (2-1) dans le derby de la Côte d'Azur.	https://medias.lequipe.fr/img-photo-jpg/-/1500000002074498/0:0,1996:1331-640-427-75/3d0fb.jpg	2024-10-27 20:22:03	L'Équipe
fr	https://www.footmercato.net/a2788850799980485209-real-madrid-la-grande-promesse-de-vinicius-junior	Real Madrid : la grande promesse de Vinicius Junior - Foot Mercato	Ce samedi, le FC Barcelone a humilié le Real Madrid en mondovision. En difficulté face aux Madrilènes depuis de nombreuses années, les Catalans o (...) - Footmercato	https://assets-fr.imgfoot.com/media/cache/1200x675/viniciusbvb.jpg	2024-10-27 20:52:43	Foot Mercato
fr	https://www.francetvinfo.fr/faits-divers/affaire-des-viols-de-mazan/proces-des-viols-de-mazan-un-faux-compte-sur-x-et-instagram-se-fait-passer-pour-gisele-pelicot_6863084.html	Procès des viols de Mazan : un faux compte sur X et Instagram se fait passer pour Gisèle Pelicot - franceinfo	Plusieurs internautes ont signalé des publications suspectes sur le compte X dénommé Gisèle Pelicot.	https://www.francetvinfo.fr/pictures/ueMmK6rjDByruYyfLPmrmO8gD6c/0x312:6000x3687/1500x843/2024/10/27/000-36k82x4-671e48e98a8be243517700.jpg	2024-10-27 15:46:50	franceinfo
fr	https://news.google.com/rss/articles/CBMiygFBVV95cUxNSmdjRnVjZWh3dlhsZHNRN2t0aUxRdDVsX043Q3lkeGVoYnJnSC02SWtyRi1fQl9XSDduSzVRSGMzSWw0d3lXTTZTUzdiNGxPOTZ6OWh6RjFJYUg3c1hGb3lmY3htWWY3aEpTQVpjRDAtVjRmaTVDTjl1WjBiZE1YbUp5OFNWcHBQeWRvbmpFaHVFd196bzFDS2pvdkdZZ244Unc1QVBfSnpzLWpzUlAzT2VIcUk2MXNwU05hWTQtZ2ZUeFp0dG4xLU1R?oc=5	Lyon-Auxerre : Mikautadze libéré, un arbitrage douteux… Les tops et les flops - Le Figaro	TOPS/FLOPS – Le doublé de Mikautadze, l’ambiance au Groupama Stadium ou un penalty litigieux : retrouvez nos tops et nos flops du match nul entre l’OL et l’AJ Auxerre ce dimanche (2-2).	None	2024-10-27 16:58:15	Le Figaro
fr	https://www.leparisien.fr/sports/football/ligue-1/om-psg-avant-meme-le-debut-du-clasico-des-chants-homophobes-entonnes-au-velodrome-27-10-2024-XJNI3X5F5ZFSHB7H6IRKSJ4KZM.php	OM-PSG : avant même le début du clasico, des chants homophobes entonnés au Vélodrome - Le Parisien	Malgré les avertissements d’avant-match, des chants homophobes sont descendus des tribunes marseillaises avant même le coup d’envoi de la re	https://www.leparisien.fr/resizer/mWdDEoimMFg2KJJuT81ysv8yw-k=/1200x675/cloudfront-eu-central-1.images.arcpublishing.com/leparisien/XWYHQQL4SFF7RFGFWOBRURBWTU.jpg	2024-10-27 18:13:00	Le Parisien
fr	https://www.rugbyrama.fr/2024/10/27/top-14-lhistoire-du-week-end-a-lyon-bayonne-montre-que-la-course-au-top-6-devient-credible-12287861.php	Top 14 – L’histoire du week-end : à Lyon, Bayonne montre que la course au top 6 devient crédible - Rugbyrama	Malgré une semaine agitée et un important turnover à Lyon, les Basques ont affiché des ambitions dignes d’un prétendant et décroché un succès aussi imprévu que mérité. De quoi les placer sur le podium au tiers du...	https://images.rugbyrama.fr/api/v1/images/view/671e7c29fd8d6129e4253ebc/large/image.jpg?v=5	2024-10-27 17:08:00	Rugbyrama
fr	https://www.lequipe.fr/Rugby/Actualites/L-ascenseur-emotionnel-express-de-nathanael-hulleu-castres-a-vannes/1516628	Top 14 : L'ascenseur émotionnel express de Nathanaël Hulleu (Castres) à Vannes - L'Équipe	Auteur d'un essai après 16 secondes de jeu sur la pelouse de Vannes, l'ailier de Castres Nathanaël Hulleu est sorti dix minutes plus tard, sur une civière, après un choc terrible.	https://medias.lequipe.fr/img-photo-jpg/nathanael-hulleu-sous-le-maillot-castrais-la-saison-derniere-f-lancelot-l-equipe/1500000002074177/10:156,1682:1272-640-427-75/6c7c3.jpg	2024-10-27 11:40:03	L'Équipe