country_code	url	title	description	image_url	publish_date	source
fr	https://www.lequipe.fr/Football/match-direct/ligue-des-champions/2024-2025/real-madrid-ac-milan-live/668019	DIRECT. Real Madrid-AC Milan (Ligue des champions 2024-2025) en direct - L'Équipe	Dans un bon soir, l'AC Milan est en train de jouer un vilain tour au Real sur son terrain. Avec des Leao, Morata et Pulisic inspirés, les Rossoneri sont devant grâce à Thiaw et Morata. Vinicius avait égalisé sur penalty tandis que Maignan a signé plusieurs parades, dont deux devant Mbappé, frustré.	https://medias.lequipe.fr/img-stade:football-jpg/stade/madrid-santiago-bernabeu/0-1000-0-99/	2024-11-05 20:51:51	L'Équipe
fr	https://news.google.com/rss/articles/CBMi5wFBVV95cUxPTFR4aG5HTGUyUE53eTdPaXpSQXR4MkJoUURCN1lzdU5aMnc2aE4zWmRvMExCbE9IN2MwdEtBdVZRbFNIOFM1NGV0Qk1qVzJGVHJuRHo0WWV0TW9VNkVoZ1RLbUY2NElFLWFkekFPUzdyT3RuZXZyVWE3RktpTmt5TzM1bWFMUEpZcU9acDdqdnNzcXkyVXg1RlBOMjVwX3FNcVpUZHRGd3VINFM4UmswLUNOUGt4U3RwMzg1SlRLaE95dUZTUzJ3RmswTExhUFV4LUpDQ2VYOTVHRHJ0UUpFaU0yVGwwTms?oc=5	L'enjeu, la hiérarchie des gardiens, Simeone, Griezmann, etc, la conf' complète de Luis Enrique avant PSG/Atlético - CulturePSG.com	None	None	2024-11-05 15:19:00	CulturePSG.com
fr	https://www.lefigaro.fr/social/sncf-les-syndicats-cheminots-appellent-a-une-journee-de-greve-le-21-novembre-20241105	SNCF : les syndicats appellent à la grève le 21 novembre et brandissent la menace d'une mobilisation en décembre - Le Figaro	Cette journée est «un ultimatum» avant «un mouvement de grève plus long et plus fort en décembre», préviennent-ils.	https://i.f1g.fr/media/cms/1200x630_crop/2024/11/05/d0a9b7d77862578aa5ab67e438b28c9cefec42ebc89f568d953939f842f719f3.jpg	2024-11-05 16:36:00	Le Figaro
fr	https://www.lemonde.fr/societe/article/2024/11/05/vincent-labrune-et-la-lfp-dans-le-viseur-de-la-justice_6377920_3224.html	Vincent Labrune et la LFP dans le viseur de la justice - Le Monde	Des perquisitions ont été menées, mardi 5 novembre, au siège parisien de la Ligue de football professionnel et du fonds d’investissement CVC, dans le cadre d’une enquête préliminaire menée notamment pour « détournement de fonds publics » et « corruption d’agent public ».	https://img.lemde.fr/2024/11/05/0/0/3975/2650/1440/960/60/0/d085d0f_1730819960819-875532.jpg	2024-11-05 16:57:38	Le Monde
fr	https://www.telerama.fr/series-tv/40-ans-de-canal-les-dix-meilleures-series-originales-de-la-chaine-cryptee-selon-telerama-7022895.php	40 ans de Canal : les dix meilleures séries originales de la chaîne cryptée selon “Télérama” - Télérama.fr	Crise de l’hôpital public, secrets de la DGSE, coulisses de la justice, machinations politiques, réinvention de la rupture amoureuse ou critique de l’ultralibéralisme sans scrupule… notre top 10 des créations Canal.	https://focus.telerama.fr/2024/10/31/0/333/1771/1181/1200/800/60/0/e838c40_1730396042890-2021003-136.jpg	2024-11-05 17:00:21	Télérama.fr
fr	https://www.lequipe.fr/Football/Actualites/-on-garde-cette-pression-avec-l-envie-de-continuer-a-performer-assure-eric-roy-avant-sparta-prague-brest/1518431	« On garde cette pression, avec l'envie de continuer à performer », assure Éric Roy avant Sparta Prague-Brest - L'Équipe	Éric Roy, l'entraîneur du Stade Brestois, espère pouvoir ramener un nouveau résultat de Prague, où son équipe défiera le Sparta mercredi soir (21 heures), pour le compte de la 4e journée de la Ligue des champions.	https://medias.lequipe.fr/img-photo-jpg/eric-roy-l-entraineur-de-brest-a-reau-l-equipe/1500000002079091/0:82,1998:1415-640-427-75/a52a6.jpg	2024-11-05 17:16:58	L'Équipe
fr	https://www.lavoixdunord.fr/1519753/article/2024-11-05/basket-nba-wembanyama-encore-sorti-un-geste-fou	Basket NBA : Wembanyama a encore sorti un geste fou - La Voix du Nord	Le Français Victor Wembanyama est en forme en ce début de saison de NBA. Le n°1 de...	https://lvdneng.rosselcdn.net/sites/default/files/dpistyles_v2/ena_16_9_extra_big/2024/11/05/node_1519753/61511408/public/2024/11/05/29020411.jpeg?itok=8ypHZE7Z1730814876	2024-11-05 13:54:07	La Voix du Nord
fr	https://www.footmercato.net/a5838503573425125030-le-real-madrid-recadre-froidement-kylian-mbappe	Le Real Madrid recadre froidement Kylian Mbappé - Foot Mercato	Recruté cet été par le Real Madrid, Kylian Mbappé suscite de nombreuses attentes. D’ailleurs, le club espagnol le lui a bien rappelé. Kylian Mbap (...) - Footmercato	https://assets-fr.imgfoot.com/media/cache/1200x675/kylian-mbappe-2425-66f3f2ef42c39.jpg	2024-11-05 09:59:51	Foot Mercato
fr	https://www.rugbyrama.fr/2024/11/05/xv-de-france-la-composition-probable-des-bleus-pour-le-japon-emilien-gailleton-yoram-moefana-au-centre-tevita-tatafu-vers-une-titularisation-12305056.php	La composition probable des Bleus pour le Japon : Moefana-Gailleton au centre, Tatafu vers une titularisation - Rugbyrama	L’entraînement du jour, à Marcoussis, a réservé quelques surprises. Au centre, Yoram Moefana sera-t-il préféré à Gaël Fickou pour affronter les Japonais à Saint-Denis ?	https://images.rugbyrama.fr/api/v1/images/view/672a4345d191d97c490152bb/large/image.jpg?v=5	2024-11-05 16:11:00	Rugbyrama