country_code	url	title	description	image_url	publish_date	source
fr	https://www.francetvinfo.fr/monde/russie/sommet-des-brics-une-demonstration-de-pouvoir-des-russes-qui-a-montre-ses-limites_6859169.html	Sommet des Brics : une démonstration de pouvoir des Russes qui a montré ses limites - franceinfo	Le sommet des principales économies émergentes du monde s’est achevé jeudi soir à Kazan, en Russie. Pendant trois jours, les pays de cette organisation ont dialogué sous les auspices de Vladimir Poutine, promu maître de cérémonie.	https://www.francetvinfo.fr/pictures/CX4zt7H9jjDGTtTRxfijwbtsLMo/0x624:6000x3997/1500x843/2024/10/25/000-36kp8v9-671b5ca166bfa921717983.jpg	2024-10-25 11:42:06	franceinfo
fr	https://www.bfmtv.com/societe/c-etait-ingerable-un-etudiant-se-suicide-apres-une-greffe-de-barbe-ratee-en-turquie_AV-202410251000.html	"C'était ingérable": un étudiant se suicide après une greffe de barbe ratée en Turquie - BFMTV	None	None	2024-10-25 20:51:52	BFMTV
fr	https://www.lemonde.fr/international/article/2024/10/26/joe-biden-presente-des-excuses-historiques-pour-les-atrocites-commises-dans-des-pensionnats-pour-amerindiens_6360115_3210.html	Joe Biden présente des excuses historiques pour les atrocités commises dans des pensionnats pour Amérindiens - Le Monde	Ces pensionnats, qui ont existé entre le début du XIXᵉ siècle et les années 1970, avaient pour objectif d’effacer la culture, la langue et l’identité des Amérindiens. Beaucoup d’enfants y ont subi des violences physiques, psychologiques ou sexuelles.	https://img.lemde.fr/2024/10/25/0/0/3201/2134/1440/960/60/0/1a0ce53_2024-10-25t174741z-296735577-rc2traaquaxy-rtrmadp-3-usa-biden-native-americans.JPG	2024-10-26 02:25:46	Le Monde
fr	https://www.francetvinfo.fr/monde/europe/georgie/cinq-questions-sur-les-elections-legislatives-en-georgie-cruciales-pour-l-avenir-europeen-et-democratique-du-pays_6850943.html	Cinq questions sur les élections législatives en Géorgie, cruciales pour l'avenir européen et démocratique du pays - franceinfo	Le parti Rêve géorgien, au pouvoir depuis douze ans, a développé un discours anti-occidental et voté des lois inspirées du voisin russe, au point de faire dérailler le récent processus d'adhésion à l'UE. L'opposition avance en ordre dispersé, mais un gouvernement de coalition est possible, en cas de victoire.	https://www.francetvinfo.fr/pictures/nAfFlDsU-lD1EtKkql7CnYzd-VQ/0x0:4501x2530/1500x843/2024/10/21/000-36kj3ll-67163e2acccdd588945246.jpg	2024-10-26 04:41:29	franceinfo
fr	https://www.ledauphine.com/faits-divers-justice/2024/10/25/deux-blesses-lors-d-une-nouvelle-fusillade-dans-le-quartier-saint-bruno	Grenoble. Deux blessés lors d'une nouvelle fusillade dans le quartier Saint-Bruno - Le Dauphiné Libéré	Une série de coups de feu a de nouveau retenti dans le quartier Saint-Bruno, réputé être l'un des principaux points de deal et de vente de cigarettes de contrebande de Grenoble, ce vendredi 25 octobre peu avant 21 heures.	https://cdn-s-www.ledauphine.com/images/F6740C81-FE4E-4C45-8318-A4BBE6396C03/FB1200/photo-1729885541.jpg	2024-10-25 19:45:00	Le Dauphiné Libéré
fr	https://www.lemonde.fr/international/live/2024/10/26/en-direct-presidentielle-americaine-2024-beyonce-affiche-son-soutien-a-kamala-harris-a-houston-donald-trump-confirme-vouloir-prendre-robert-f-kennedy-jr-dans-son-administration-s-il-est-elu-ce-qu-il-ne-fallait-pas-manquer-de-la-campagne_6357232_3210.html	Présidentielle américaine 2024 : Beyoncé affiche son soutien à Kamala Harris, Donald Trump confirme vouloir Robert F. Kennedy Jr dans son administration… ce qu’il ne fallait pas rater - Le Monde	Les deux candidats ont délaissé, vendredi, les Etats pivots pour se rendre au Texas. La démocrate a cherché à mobiliser les femmes, en replaçant le droit à l’avortement au centre de sa campagne, tandis que le républicain, lui, s’est adressé aux jeunes hommes en accordant une interview au podcast de Joe Rogan.	https://img.lemde.fr/2024/10/26/833/0/5000/2500/1440/720/60/0/a8d8bc9_5072315-01-06.jpg	2024-10-26 07:24:06	Le Monde
fr	https://www.20minutes.fr/monde/election-presidentielle-americaine/4117714-20241025-election-americaine-2024-derniers-sondages-entre-kamala-harris-donald-trump-dix-jours-scrutin	Harris légèrement en tête dans les sondages, mais Trump est bien là - 20 Minutes	Le duel entre Kamala Harris et Donald Trump, qui s'achèvera le 5 novembre, s’annonce comme l’un des plus incertains de l’histoire américaine récente	https://img.20mn.fr/CMOeu0oURK2ETkkbkifTayk/1444x920_le-suspense-est-total-entre-donald-trump-et-kamala-harris-a-deux-mois-du-vote	2024-10-25 13:22:00	20 Minutes
fr	https://actu.fr/auvergne-rhone-alpes/givors_69091/inondations-dans-le-rhone-la-question-de-la-fin-de-la-zone-commerciale-de-givors-se-pose_61787235.html	Inondations dans le Rhône : la question de la fin de la zone commerciale de Givors se pose - actu.fr	"La question se pose vraiment de maintenir un centre commercial" à Givors, estime la vice-présidente de la Métropole de Lyon Anne Grosperrin, après les inondations d'octobre.	https://static.actu.fr/uploads/2024/10/centre-commercial-givors-devaste-inondations.jpeg	2024-10-26 05:30:01	actu.fr
fr	https://news.google.com/rss/articles/CBMixgFBVV95cUxQdW9lVGZxYXhCM1pzYTBsRE9KZ2h2dFdNZ2hUbjRnbWladGYyczA4SkVBY0lQMTFwLU1BQlpTeHNYV29GaXRQRmZsV2NtUU1Eb1U2YlBPNExOTWw1MlMwY19OOFVrNm1TbkJwWWxlZ1lVangwbUhYMV96VlJiOHdUUUw0NnBFMFFDTDBiYlZNOFRkN1gxSHlIbmRHSWpLUWhWR2pjN2NmX2R3a2FXZFFSbjdRcU1fdjhYVXJaRkZ5N0k3SVhOMlE?oc=5	Intempéries : le fonds Barnier va être augmenté de 75 millions d'euros - Actu Orange	None	None	2024-10-25 15:55:00	Actu Orange
fr	https://www.lefigaro.fr/sports/football/ligue-2-l-incroyable-egalisation-a-la-derniere-minute-du-gardien-de-rodez-de-la-tete-20241026	Ligue 2 : l’incroyable égalisation à la dernière seconde du gardien de Rodez de la tête - Le Figaro	Lionel Mpasi a égalisé à la toute dernière minute en faveur de Rodez face à Lorient vendredi soir (3-3) en Ligue 2.	https://i.f1g.fr/media/cms/1200x630_crop/2024/10/26/da9d218acdbaa8cbea2ec090c10c6d10a462499487a7dd317a136930791b7277.jpg	2024-10-26 08:03:19	Le Figaro
fr	https://www.francetvinfo.fr/culture/jeux-video/reportage-a-la-paris-games-week-le-jeu-video-francais-independant-tente-de-rayonner-malgre-la-crise-du-secteur_6857771.html	REPORTAGE. À la Paris Games Week, le jeu vidéo français indépendant tente de rayonner malgré la crise du secteur - franceinfo	Le plus grand salon du jeu vidéo en France accueille gamers et curieux en tous genres jusqu'à dimanche. Une édition qui souhaite s'adresser à un public plus large alors que le secteur connaît de grosses difficultés.	https://www.francetvinfo.fr/pictures/wyOp7_-S--MI1E3CciSYWh9c8IU/0x624:6000x3997/1500x843/2024/10/24/000-36kp6r8-671a8eb0cd74a036053011.jpg	2024-10-26 08:05:32	franceinfo
fr	https://www.bfmtv.com/societe/euromillions-le-gagnant-d-un-million-d-euros-activement-recherche-par-la-francaise-des-jeux_AN-202410260242.html	Euromillions: le gagnant d'un million d'euros activement recherché par la Française des Jeux - BFMTV	Le vainqueur a jusqu'au 1er novembre à 23h59 pour se déclarer. Passé le délai de 60 jours laissé à disposition par la FDJ, il sera trop tard. 	https://images.bfmtv.com/_GcYdPQosyfsx00FIIR5OSWp7ks=/0x74:2048x1226/2048x0/images/Euromillions-une-personne-en-train-de-remplir-une-grille-1763350.jpg	2024-10-26 10:46:00	BFMTV
fr	https://www.rfi.fr/fr/asie-pacifique/20241025-soldats-nord-cor%C3%A9ens-ukraine-la-chine-marche-sur-des-%C5%93ufs	Soldats nord-coréens en Ukraine: la Chine marche sur des œufs - RFI	Au début du mois, la Chine et la Corée du Nord ont célébré leurs 75 ans de relations diplomatiques en réaffirmant des liens qu'elles avaient déjà décrits comme étant aussi étroits que les deux doigts…	https://s.rfi.fr/media/display/8f04ecbe-8ee6-11ef-ae75-005056a90284/w:1280/p:16x9/AP18248250921435.jpg	2024-10-25 13:05:56	RFI
fr	https://www.francebleu.fr/infos/faits-divers-justice/mort-d-emilio-a-alenya-on-avait-averti-on-aurait-pu-eviter-ca-temoigne-le-pere-de-l-adolescent-3709635	Meurtre d'un adolescent à Alénya : "On avait averti, on aurait pu éviter ça", témoigne le père d'Emilio - France Bleu	Damien Varin, le père d'Emilio, l'adolescent de 14 ans tué à Alénya (Pyrénées-Orientales), explique avoir alerté la justice à plusieurs reprises sur "les violences subies " par ses enfants chez son ex-femme. 	https://www.francebleu.fr/s3/cruiser-production-eu3/2024/10/0cf085b7-3914-48f5-bc90-baf310540c98/1200x680_sc_20241025-112037.jpg	2024-10-25 13:27:10	France Bleu
fr	https://www.sudouest.fr/societe/les-cyclistes-ne-respectent-pas-le-code-de-la-route-vraiment-21896139.php	« Les cyclistes ne respectent pas le code de la route », vraiment ? - Sud Ouest	C’est un argument que l’on a beaucoup entendu depuis la mort de Paul, cycliste de 27 ans tué sur une piste cyclable par un automobiliste en SUV le 15 octobre à Paris : les cyclistes ne respecteraient pas le code de la route. Et s’ils ont des accidents, ils n’auraient qu’à s’en prendre à eux-mêmes. Mais est-ce vraiment le cas ? A-t-on raison de mettre sur le même plan les autos, les bus, les camions et les cyclistes ?	https://media.sudouest.fr/21896139/1200x-1/so-57eb8d1d66a4bd7760bd52ef-ph0.jpg	2024-10-25 06:44:48	Sud Ouest
fr	https://www.lequipe.fr/Moto/Actualites/Enea-bastianini-remporte-le-sprint-du-gp-de-thailande-devant-jorge-martin-et-francesco-bagnaia/1516354	MotoGP : Enea Bastianini remporte le sprint du GP de Thaïlande devant Jorge Martin et Francesco Bagnaia - L'Équipe	Enea Bastianini (Ducati) a dominé le sprint de ce samedi à Buriram. L'Italien a devancé Jorge Martin (Pramac) qui a porté à 22 points son avance au Championnat sur Francesco Bagnaia (Ducati), troisième.	https://medias.lequipe.fr/img-photo-jpg/enea-bastianini-sur-le-circuit-de-buriram-m-jagielski-presse-sports/1500000002073567/0:0,1996:1331-640-427-75/68104.jpg	2024-10-26 08:30:27	L'Équipe
fr	https://www.francetvinfo.fr/faits-divers/enlevements/enlevement-de-santiago/enlevement-de-santiago-le-nourrisson-retrouve-et-ses-parents-interpelles_6861086.html	Enlèvement de Santiago : le nourrisson retrouvé et ses parents interpellés - franceinfo	Le nourrisson de 21 jours, né grand prématuré, a été retrouvé en bonne santé avec ses parents dans un hôtel aux alentours d’Amsterdam (Pays-Bas). Sous le coup d’un mandat d’arrêt européen, le couple a été arrêté.	https://www.francetvinfo.fr/pictures/feCsNF-zjCZNjnpL5EtnJgwAutk/162x0:1458x729/1500x843/2024/10/26/petitsantiago-671c810b5a0d1032314906.jpg	2024-10-26 05:45:29	franceinfo
fr	https://www.rtl.fr/actu/justice-faits-divers/mort-de-lina-je-ne-t-oublierai-jamais-s-est-exprime-tao-le-petit-ami-de-l-adolescente-a-ses-obseques-7900433219	Mort de Lina : "Je ne t'oublierai jamais", s'est exprimé Tao, le petit ami de l'adolescente à ses obsèques - RTL	Vendredi 25 octobre a été marqué par les obsèques de Lina. Sur place, l'émotion était vive, avec le discours du petit ami de Lina et de sa mère.	https://images.rtl.fr/~c/2000v2000/rtl/www/1709716-fanny-la-mere-de-lina-arrive-avec-ses-proches-a-l-eglise-saint-arnould-lors-des-funerailles-de-l-adolescente-le-25-octobre-2024.jpg	2024-10-26 03:45:00	RTL
fr	https://www.liberation.fr/politique/dictature-du-proletariat-hysterie-fiscale-comment-un-amendement-du-nfp-a-fait-disjoncter-la-taxe-sur-les-grandes-entreprises-20241026_OIH3W7ZENVD5FC5CR77A22G6Z4/	«Dictature du prolétariat», «hystérie fiscale»… comment un amendement NFP sur la taxation des grandes entreprises a fait disjoncter la macronie, la droite et le RN - Libération	En faisant passer, lors des débats sur le budget, un amendement qui porte jusqu’à 55 % l’impôt exceptionnel sur les grands groupes, la gauche a mis le feu à l’Assemblé. La majorité relative s’est même retrouvée à voter contre l’article de s	https://www.liberation.fr/resizer/DFCBQ9K3rq0HAbLhrHnTjYtBLXw=/1200x630/filters:format(jpg):quality(70):focal(3105x2375:3115x2385)/cloudfront-eu-central-1.images.arcpublishing.com/liberation/KAFRZSUQDRBKLBOC2EWUPMWXPE.jpg	2024-10-26 11:38:01	Libération
fr	https://www.bfmtv.com/economie/economie-social/finances-publiques/budget-2025-les-deputes-approuvent-un-retablissement-progressif-de-la-cvae_AD-202410260266.html	Budget 2025: les députés approuvent un rétablissement progressif de la CVAE - BFM Business	Un amendement du président de la commission des Finances Éric Coquerel (LFI) prévoit un rétablissement graduel de la CVAE, dans un premier temps pour les entreprises ayant un chiffre d'affaires supérieur à un milliard d'euros.	https://images.bfmtv.com/f0GILtGh74Mp3NVDlRsnPVJ4Ij4=/0x40:768x472/768x0/images/Le-president-de-la-commission-des-Finances-Eric-Coquerel-LFI-lors-d-une-seance-de-debat-sur-le-projet-de-loi-de-finances-2025-a-l-Assemblee-nationale-le-24-octobre-2024-a-Paris-1963091.jpg	2024-10-26 11:46:07	BFM Business
fr	https://www.lefigaro.fr/actualite-france/il-incarne-la-reussite-et-les-echecs-de-la-recherche-publique-le-cnrs-paradis-des-sciences-molles-qui-coute-cher-tres-cher-20241026	Il incarne la réussite et les échecs de la recherche publique : le CNRS, paradis des sciences «molles» qui coûte cher, très cher - Le Figaro	ANALYSE - Le statut garanti à vie et l'entre-soi dans la distribution des postes et des financements encouragent le pantouflage et favorisent le militantisme.	https://i.f1g.fr/media/cms/1200x630_crop/2024/10/24/a5654bcbdcb84c90052b1821afbf5cb9ba77b4bd72d9ac433dada7d60112ccbe.jpg	2024-10-26 12:00:00	Le Figaro
fr	https://news.google.com/rss/articles/CBMiiwJBVV95cUxOWnBzczgtMUFtMVpURmJHTFROQl81RTd4MEdBaHpaeEktUkFXTlUwcXlaNkR5OWdyZEFvQ3I3Z3JmRDZiU1FRUjlrd2JYZXhUN1p1ZHliakZOUnI4ZEhBUDZGS1k5S2FYUVFEZFJXNnl2TmYtZTQ3ZmgyVmoyOG9oLUF5LWsyTGhSODJDNmk2TjhIdFNybXdZR3FyQzB0WEcwUUlLbmdiLW1qNXRGOXVrcnRrbFczVzZVUzBXaXRWUFRhQW9jTnpYbjA1VEduWTRybXI0TmwzLTl1NFU4MHd6Y29VQV9rOV9fUXFFN2RqSkFXMjRYUXhTWi1kaUJCQ1VYaEJyZXRTOVpnNjg?oc=5	DIRECT. Spectacle de la Machine à Toulouse : que la fête commence ! Suivez avec nous le réveil des créatures et le premier jour du show - La Dépêche du Midi	None	None	2024-10-26 08:27:00	La Dépêche du Midi
fr	https://la1ere.francetvinfo.fr/martinique/violences-urbaines-en-martinique-un-homme-decede-des-personnes-blessees-par-balle-des-incendies-des-blocages-le-point-sur-la-nuit-1531861.html	Violences urbaines en Martinique : un homme décédé, des personnes blessées par balle, des incendies, des blocages... le point sur la nuit - Outre-mer la 1ère	La nuit du vendredi 25 au samedi 26 octobre semble avoir été un peu moins agitée. Les secours ont tout de même été mobilisés sur différentes communes. Un décès a été constaté à la Trinité, plusieurs blessures par balle et des incendies. Retour sur la nuit.	https://la1ere.francetvinfo.fr/image/dTw1Vp5TSuGUcwYi52Vkl6thRJg/930x620/outremer/2023/04/30/644d9f3501e77_police-pompiers.jpeg	2024-10-26 11:08:45	Outre-mer la 1ère
fr	https://www.francetvinfo.fr/replay-radio/c-est-mon-budget/bientot-l-hiver-la-loi-montagne-se-durcit-soit-un-petit-budget-pneus-a-venir_6832493.html	Bientôt l’hiver : la loi Montagne se durcit, soit un petit budget pneus à venir - franceinfo	Dès le 1er novembre, la loi Montagne impose de nouveaux standards pour pouvoir circuler dans les massifs français, ce qui implique un budget pneus à prévoir.	https://www.francetvinfo.fr/pictures/1LkXxzmNSIvW9Y_ocl-QkbOgdEU/0x0:2121x1192/1500x843/2024/10/24/gettyimages-1156729642-671a3ebb234e0693451470.jpg	2024-10-26 07:34:53	franceinfo
fr	https://www.tf1info.fr/justice-faits-divers/reportage-video-ils-ont-coupe-sous-le-grillage-pourquoi-les-vols-de-chiens-se-multiplient-2330641.html	"Ils ont coupé sous le grillage" : pourquoi les vols de chiens se multiplient en France - TF1 INFO	[VIDÉO] Dans l'Hexagone, les vols de chiens se multiplient et les malfrats n'hésitent pas à employer la violence.  Selon les races, la revente peut atteindre plusieurs milliers d'euros.  Une équipe de TF1 a rencontré plusieurs propriétaires encore traumatisés. - "Ils ont coupé sous le grillage" : pourquoi les vols de chiens se multiplient en France (Police, justice et faits divers) - TF1 INFO	https://photos.tf1info.fr/images/1280/720/chiens-voles-e81c5f-0@1x.jpeg?overlayImage=bG9nby10ZjFpbmZvLWRlZmF1bHQucG5n&overlayWidth=18&overlayGravity=northwest&s=78c802	2024-10-26 04:30:00	TF1 INFO
fr	https://www.leparisien.fr/culture-loisirs/miss-france/eve-gilles-miss-france-2024-revele-souffrir-de-dyskinesie-paroxystique-quelle-est-cette-maladie-26-10-2024-YQ6JGZVRRRHCPECXSQQNCUNOCE.php	Ève Gilles, Miss France 2024, révèle souffrir de dyskinésie paroxystique : quelle est cette maladie - Le Parisien	C’est via une vidéo ce samedi en fin de matinée sur le site Konbini qu’Ève Gilles, 21 ans, annonce souffrir depuis l’enfance d’une pathologi	https://www.leparisien.fr/resizer/NmWp2TXwH4n-9T8lXR_dYVQZJSo=/1200x675/cloudfront-eu-central-1.images.arcpublishing.com/leparisien/3PECHQZLKNCCBEAXGGJ2DG6JVQ.jpg	2024-10-26 11:00:00	Le Parisien
fr	https://www.lequipe.fr/Football/Actualites/Luis-enrique-psg-avant-om-psg-en-ligue-1-roberto-de-zerbi-est-un-entraineur-passionnant/1516376	Luis Enrique (PSG), avant OM-PSG en Ligue 1 : « Roberto De Zerbi est un entraîneur passionnant » - L'Équipe	Luis Enrique, l'entraîneur du PSG, à la veille du déplacement à Marseille dimanche (20 h 45), a fait part de son admiration à l'égard de son homologue marseillais.	https://medias.lequipe.fr/img-photo-jpg/luis-enrique-confiant-avant-le-classique-face-a-l-om-en-ligue-1-dimanche-a-reau-l-equipe/1500000002073626/0:0,1996:1330-640-427-75/48523.jpg	2024-10-26 12:36:27	L'Équipe
fr	https://www.francetvinfo.fr/politique/parlement-francais/assemblee-nationale/examen-du-budget-2025-a-l-assemblee-nationale-pourquoi-certains-groupes-retirent-ils-une-partie-de-leurs-amendements_6859331.html	Examen du budget 2025 à l'Assemblée nationale : pourquoi certains groupes retirent-ils une partie de leurs amendements ? - franceinfo	Le Nouveau Front populaire, le groupe de droite et une partie du bloc présidentiel ont renoncé ces dernières heures à des centaines d'amendements, alors qu'un vote sur la première partie du texte budgétaire doit théoriquement avoir lieu mardi.	https://www.francetvinfo.fr/pictures/piZpGzwGB7NB-JPx2vpOClavMio/0x509:8212x5126/1500x843/2024/10/25/000-36kq3ay-671ba15e90253791376571.jpg	2024-10-25 16:00:53	franceinfo
fr	https://news.google.com/rss/articles/CBMiuwFBVV95cUxPM0xsem1CTDJhTnYzelhjcnU1TXVwdkdDZzBsYUNNdm8xRFNYS0FoWEVxNTBNcF93RE5BVHcwSElIZlBMdWJVemJXMWxuVGV2S0EyMlBJYjBkWUJ4SkpldnIzbllTNG52QTRoSUZEdERnM0RuZFBvdloxeHVCY3lmZnJCdVdBVl9acU5XaUljbTVIVEp2UzR2aWl2NERHeU5FVXZta3dKUzl5elBKYUhtc2VGdWRsM2RJVnQw?oc=5	Après les frappes contre des cibles militaires près de Téhéran, Israël et l'Iran désormais en guerre ouverte - Le Figaro	None	None	2024-10-26 11:33:00	Le Figaro
fr	https://www.leparisien.fr/faits-divers/jaurais-du-partir-et-jaurais-pu-partir-au-proces-des-viols-de-mazan-les-aveux-calibres-dun-accuse-25-10-2024-546QT6DQLZA5RGOPSR7GK5ZB6E.php	« J’aurais dû partir et j’aurais pu partir » : au procès des viols de Mazan, les aveux calibrés d’un accusé - Le Parisien	S’il estime lui aussi avoir été dupé par Dominique Pelicot, Quentin H. est l’un des rares accusés à ne pas contester le viol. Un choix strat	https://www.leparisien.fr/resizer/VW0IIlnxNzyahk2JwTfv7MxYUpQ=/1200x675/cloudfront-eu-central-1.images.arcpublishing.com/leparisien/CL7HGUY5G5EHJHVWSVXSUWEXBU.jpg	2024-10-25 20:08:00	Le Parisien
fr	https://www.liberation.fr/international/amerique/presidentielle-americaine-le-prestigieux-washington-post-ne-prend-pas-parti-son-patron-jeff-bezos-montre-du-doigt-nous-allons-tous-mourir-dans-le-noir-et-jeff-bezos-a-eteint-la-lumiere-le-washington-post-critique-pour-sa-neutralite-20241026_VTPAXNPC3VFDPGDDVDN6A3LKJE/	«Nous allons tous mourir dans le noir et Jeff Bezos a éteint la lumière» : le «Washington Post» critiqué pour sa neutralité - Libération	Le directeur général William Lewis a fait savoir vendredi 25 octobre que le grand quotidien américain ne soutiendra pas Kamala Harris. Un revirement après avoir défendu les candidats démocrates à chaque élection depuis 2008.	https://www.liberation.fr/resizer/qqn2aP-zMMUB89V90QYPYZfGFNU=/1200x630/filters:format(jpg):quality(70)/cloudfront-eu-central-1.images.arcpublishing.com/liberation/GH4L7ARSFVHIPKU2OYXXPGFDFI.jpg	2024-10-26 08:57:50	Libération
fr	https://www.lemonde.fr/les-decodeurs/article/2024/10/26/passage-a-l-heure-d-hiver-pourquoi-le-changement-d-heure-est-si-critique_5348679_4355771.html	Passage à l’heure d’hiver : pourquoi le changement d’heure est si critiqué - Le Monde	La France passe à l’heure d’hiver, dans la nuit de samedi à dimanche : à 3 heures du matin, il sera 2 heures. La mesure, réintroduite en 1975 pour faire des économies d’énergie, pose plusieurs questions.	https://img.lemde.fr/2018/08/31/0/4/4791/3194/1440/960/60/0/6b454d8_K7Bp3e9w0yQRiTp6h6q1Wc7t.jpg	2024-10-26 14:01:19	Le Monde
fr	https://www.cnews.fr/france/2024-10-26/assemblee-nationale-sandrine-rousseau-assene-un-bras-dhonneur-inacheve-au	Assemblée nationale : Sandrine Rousseau assène un bras d’honneur «inachevé» au Rassemblement national, puis s’excuse - CNEWS	None	None	2024-10-26 07:43:00	CNEWS
fr	https://news.google.com/rss/articles/CBMi4AFBVV95cUxQVlBVMnVibjI0RDAxc192Q2x0Qm5kVEZrR3VrTzczemZENk1Hem1jekhNbjBUOWl2Y1dUbHB6U1Q5ZkNWOGRiQ1o0Qy1BbktvcVdzUk9wMjlEam1wZnQzMm9JSFhzcElLd3k3NzNGQVZ5bHpaZjhwN3lzRDl4RHcyeGhvMURqRGxDMEVnZVZtOUs5ZmFGTU1ieGVDcndLMkdGeHJjVWw5U3lSTkhkTGpPNG5IUW9hZHpFSHZGMlhLUWNUakxsd216VTBPNUdoRXVfUW9CcW5kaWRhdHB5MlRkUw?oc=5	Vigilance sur les cours d'eau, jusqu'à 200mm attendus dans le Var... suivez notre direct sur l'épisode méditerranéen - Nice matin	None	None	2024-10-26 07:51:00	Nice matin
fr	https://www.tf1info.fr/international/direct-guerre-ukraine-russie-zelensky-poutine-onu-soldats-coree-du-nord-les-dernieres-actualites-aujourd-hui-samedi-26-octobre-2024-2330666.html	EN DIRECT - Guerre en Ukraine : "Les meurtriers russes ont retrouvé leurs habitudes", dénonce Volodymyr Zelensky - TF1 INFO	[VIDÉO] Des frappes russes sur Dnipro et Kiev ont fait au moins six morts cette nuit. Des frappes dénoncées par le président ukrainien sur les réseaux sociaux. Suivez les dernières informations en direct. - EN DIRECT - Guerre en Ukraine : "Les meurtriers russes ont retrouvé leurs habitudes", dénonce Volodymyr Zelensky (International) - TF1 INFO	https://photos.tf1info.fr/images/1280/720/volodymyr-zelensky-onu-new-york-25-septembre-2024-0e39ba-0@1x.jpeg?overlayImage=bG9nby10ZjFpbmZvLWRlZmF1bHQucG5n&overlayWidth=18&overlayGravity=northwest&s=78c802	2024-10-26 12:22:25	TF1 INFO
fr	https://www.lefigaro.fr/faits-divers/lorient-trois-policiers-blesses-lors-d-une-attaque-au-sabre-20241026	Lorient : trois policiers blessés lors d’une attaque au sabre - Le Figaro	L'agresseur, un gérant d'entreprise de location de voitures de luxe, recevait la visite d'un huissier qui devait saisir les automobiles vendredi 25 octobre.	https://i.f1g.fr/media/cms/1200x630_crop/2024/10/26/e64e9b8e20e7c45caf184271c22363a7f590c20b51e094d2b0b7faab4f853b71.jpg	2024-10-26 09:30:12	Le Figaro
fr	https://www.leparisien.fr/faits-divers/meurtre-de-wilhem-houssin-a-rennes-cinq-hommes-condamnes-a-des-peines-de-10-a-20-ans-de-prison-26-10-2024-OHGONTSI7NBMNHJL3FFIMG5HLY.php	Meurtre de Wilhem Houssin à Rennes : cinq hommes condamnés à des peines de 10 à 20 ans de prison - Le Parisien	Ce musicien avait été battu à mort à Saint-Jacques-de-la-Lande, dans l’agglomération de Rennes, en juillet 2021. Sa mort avait suscité l’émo	https://www.leparisien.fr/resizer/Ztu4xhdoOp-xRunI2lb5agrP1IU=/1200x675/cloudfront-eu-central-1.images.arcpublishing.com/leparisien/CRAGOPWDYFFINMAMLPMZ6EACHA.jpg	2024-10-26 12:03:00	Le Parisien
fr	https://news.google.com/rss/articles/CBMihwJBVV95cUxNNkJmaEVoQ05QUTNjWk1nZ2RzMVJXbktXbUVSMHIxUmZ0Z3lzd2t0WGhscFQxQVk1TU1OZ3FYVVRWSF9DR3czTkRydWZjUWhtaFJJTTA2d1EtbjRvZE4zNDVLTko1UDctOHd2M3RZU0ZxLS1DcVAzeTdrekpJaXZVc1picGg2emx5XzZ4d0QwV3VVZnRQWnpZejZWUGZId3lkVzRWUGFpZXRqUzNQM0hGQTJxeDR2X05oR2VLeGdpU2pFajFmc1hJVkxxTVZqdmNBc0RHNFFlaF93OVNzRU5BQjBYM2lUVTRGQkJOazFtZnJsdmp3RG9senZ5YkFLa2RoYU1KdGp6OA?oc=5	Ukraine : « Quand on est pour la paix, on devrait préférer Donald Trump » à Kamala Harris, estime Sarah Knafo, eurodéputée Reconquête - Public Sénat	None	None	2024-10-26 04:34:29	Public Sénat
fr	https://news.google.com/rss/articles/CBMiqAJBVV95cUxQYTZDWERwUmQtZnF2Vkp1Z3VNUnk5N1p5NzFoMl9ZeWRlbkhzMDZhR3YxLXFkWjRRVlp0MHhxREZzM2RCXzlRdXE1VnJqZExacEtEM3YzakxqeHRtdndBTWpLYm5iSUY1VXZONE56WHUxZ0hyM2wxcy1Ld1g1dWNNdlM3eVk2WXptVHVMM1Z5ZzlqMVZkTXY0LTIyM2xjRks2VWktYl9JS0xrYmlYbmllWGhNcHJzN2VKYXhYUHJlT2UxQTdlNkdNRl96LXhMd1RNVmpwMEFaaFVmVno1SlpjMFZ6UHdwbnZGaURUUm5yVVllSEtUSEJvSTEzTkEyZXlXY3N2aDlLaldmdVVWNGp3X2FwSl9DUVRJamNtMFJFUG9CNl9USklVbQ?oc=5	En direct, guerre au Proche-Orient : le nord de la bande de Gaza vit ses « heures les plus sombres », selon le haut-commissaire des Nations unies aux droits de l’homme - Le Monde	None	None	2024-10-25 15:35:03	Le Monde
fr	https://www.ledauphine.com/faits-divers-justice/2024/10/26/abattu-au-milieu-de-la-circulation-a-pernes-les-fontaines-les-images-de-la-scene-de-crime	Vaucluse. Abattu au milieu de la circulation à Pernes-les-Fontaines : les images de la scène de crime - Le Dauphiné Libéré	Un habitant de Carpentras, âgé d’une trentaine d’années, a été tué par balles route d’Avignon à Pernes-les-Fontaines. La scène de crime s’étale ...	https://cdn-s-www.ledauphine.com/images/0E34C56E-B53E-4398-AABC-C3BF23E72999/FB1200/photo-1729920185.jpg	2024-10-26 05:25:00	Le Dauphiné Libéré
