country_code	url	title	description	image_url	publish_date	source
fr	https://www.liberation.fr/idees-et-debats/patrick-boucheron-lentree-au-pantheon-dun-historien-comme-marc-bloch-parle-davenir-20241124_HQMKVBAPQBHUJEAGZQWMISKOQM/	Patrick Boucheron : «L’entrée au Panthéon d’un historien comme Marc Bloch parle d’avenir» - Libération	Le professeur au Collège de France se réjouit de la future panthéonisation de l’historien et résistant. Et soutient la décision de la famille d’exclure l’extrême droite de la cérémonie.	https://www.liberation.fr/resizer/lkbKDh0Df7RaMsri8slfcOmb8eY=/1200x630/filters:format(jpg):quality(70):focal(1067x660:1077x670)/cloudfront-eu-central-1.images.arcpublishing.com/liberation/3BWKXUISUBFEDH6CBSAPFTCY2A.JPG	2024-11-24 13:15:03	Libération
fr	https://www.liberation.fr/idees-et-debats/tribunes/pays-de-la-loire-plus-de-500-artistes-et-professionnels-de-la-culture-se-mobilisent-contre-les-severes-coupes-budgetaires-20241124_A5G3X3AJAVAEFBGTR5QI3YT6PA/	Pays-de-la-Loire : plus de 500 artistes et professionnels de la culture se mobilisent contre les sévères coupes budgétaires - Libération	Alors que la présidente du conseil régional a annoncé une coupe drastique pouvant aller jusqu’à 73 % du budget de fonctionnement de la culture, un collectif d’artistes dénonce une décision qui s’apparenterait à un plan social de la culture.	https://www.liberation.fr/resizer/lRj-oclAKN0I9Sz-Kyzdq2y2awg=/1200x630/filters:format(jpg):quality(70)/cloudfront-eu-central-1.images.arcpublishing.com/liberation/4D3HDEUEOFGW5DSBYAQO5SGWNE.jpg	2024-11-24 13:18:45	Libération
fr	https://www.francebleu.fr/infos/politique/dans-les-bouches-du-rhone-le-rn-s-empare-de-rognac-a-un-an-et-demi-des-prochaines-municipales-1007517	Dans les Bouches-du-Rhône, le RN s'empare de Rognac à un an et demi des prochaines municipales - France Bleu	None	None	2024-11-24 19:22:26	France Bleu
fr	https://www.bfmtv.com/toulouse/toulouse-deux-adolescents-en-garde-a-vue-apres-un-meurtre_AD-202411240372.html	Toulouse: deux adolescents en garde à vue après un meurtre - BFMTV	Les deux adolescents de 15 et 16 ans sont soupçonnés du meurtre d'un homme de 40 ans, retrouvé mort à Blagnac, près de Toulouse, dans la nuit de ce vendredi 22 au samedi 23 novembre. 	None	2024-11-24 15:24:00	BFMTV
fr	https://www.francetvinfo.fr/monde/moyen-orient/pakistan-apres-des-affrontements-meurtriers-entre-sunnites-et-chiites-le-gouvernement-regional-annonce-une-treve-de-sept-jours_6916880.html	Pakistan : après des affrontements meurtriers entre sunnites et chiites, le gouvernement régional annonce une trêve de sept jours - franceinfo	Dans la province du Khyber-Pakhtunkhwa, le district du Kourram est le théâtre de violences confessionnelles depuis plusieurs mois.	https://www.francetvinfo.fr/pictures/XCeIj6BXoFqcLGA_MgYLQEVHYfc/0x205:2763x1758/1500x843/2024/11/24/000-36mz94c-67435fe066633054701997.jpg	2024-11-24 17:20:30	franceinfo
fr	https://www.ouest-france.fr/meteo/20-2-c-releves-dans-les-cotes-darmor-alors-quil-y-a-trois-jours-il-neigeait-2c92d372-aa41-11ef-8248-4f6efd927e57	20,2 °C relevés dans les Côtes-d’Armor, alors qu’il y a trois jours il neigeait… - Ouest-France	Si vous aviez sorti vos bonnets, écharpes et autres gants jeudi 21 novembre 2024, pour l’épisode de neige, vous pouvez les ranger ! Ce dimanche 24 novembre, il fait doux, très doux, entre 14 et 20 °C, dans les Côtes-d’Armor. La raison de ce redoux ? Un vent du sud qui souffle fort.	https://media.ouest-france.fr/v1/pictures/MjAyNDExZTg2YzQzZGQ1NzlmMjUzZjdmMWJmZWQ2YjY2MDk2ZmY?width=1260&height=708&focuspoint=50%2C25&cropresize=1&client_id=bpeditorial&sign=df82dade6644b98a82b6c7389883e319731e3ecd35d527e0e75e5d28abcf3040	2024-11-24 09:20:39	Ouest-France
fr	https://www.francetvinfo.fr/politique/front-national/il-ne-negocie-pas-avec-eux-face-au-rassemblement-national-la-difficile-equation-de-michel-barnier-pour-sauver-son-budget-et-son-gouvernement_6916775.html	"Il ne négocie pas avec eux" : face au Rassemblement national, la difficile équation de Michel Barnier pour sauver son budget et son gouvernement - franceinfo	Le Premier ministre reçoit Marine Le Pen lundi à Matignon pour discuter du budget, que la présidente du groupe RN à l'Assemblée menace de rejeter.	https://www.francetvinfo.fr/pictures/OGLjyZ5DaDFuNbv3xkwiOYBMofo/0x65:1900x1134/1500x843/2024/11/24/design-sans-titre-67434536f22ed421662957.jpg	2024-11-24 17:45:37	franceinfo
fr	https://www.lemonde.fr/planete/article/2024/11/24/traite-plastique-a-pusan-le-monde-au-defi-de-stopper-une-pollution-hors-de-controle_6412391_3244.html	Traité plastique : à Pusan, le monde au défi de stopper une pollution hors de contrôle - Le Monde	Les délégués de 175 pays sont attendus du 25 novembre au 1ᵉʳ décembre à Pusan, en Corée du Sud, pour finaliser un traité mondial visant à mettre fin à la pollution plastique. Mais les positions très éloignées des négociateurs laissent planer le spectre d’un échec.	https://img.lemde.fr/2024/11/22/0/0/5922/3948/1440/960/60/0/68e15c5_1732294793647-575354.jpg	2024-11-24 19:42:34	Le Monde
fr	https://www.lefigaro.fr/vox/culture/nous-ne-pouvons-concevoir-qu-un-ecrivain-soit-arrete-l-appel-de-30-laureats-du-grand-prix-de-l-academie-francaise-pour-boualem-sansal-20241124	L’appel de trente lauréats du grand prix de l’Académie française pour Boualem Sansal : « Nous ne pouvons concevoir qu’un écrivain soit arrêté » - Le Figaro	TRIBUNE. - L’écrivain Boualem Sansal, détenu depuis plus d’une semaine en Algérie, a reçu en 2015 le grand prix du roman décerné par l’Académie française. Les autres lauréats de ce prix prestigieux lancent un appel pressant au président algérien Tebboune.	https://i.f1g.fr/media/cms/1200x630_crop/2024/11/24/d64f3a1352516b156bab3cd58fca291414ea36d981a037b79817056cef37d1da.jpg	2024-11-24 12:20:00	Le Figaro
fr	https://www.francetvinfo.fr/politique/la-republique-en-marche/congres-de-renaissance-la-liste-de-gabriel-attal-seule-en-lice-obtient-93-des-voix_6916976.html	Congrès de Renaissance : la liste de Gabriel Attal, seule en lice, obtient 93% des voix - franceinfo	L'ancien Premier ministre a bénéficié du retrait de sa prédécesseure à Matignon, Elisabeth Borne, et doit désormais prendre le contrôle du parti début décembre.	https://www.francetvinfo.fr/pictures/-J5SwQbPcy0j8OXV1T4DkLq1q1I/0x250:5000x3061/1500x843/2024/11/24/080-hl-mkaczkowski-2562468-674380db05d8d632574395.jpg	2024-11-24 21:38:20	franceinfo
fr	https://www.lemonde.fr/international/article/2024/11/25/presidentielle-en-uruguay-la-gauche-revient-au-pouvoir-avec-la-victoire-de-yamandu-orsi_6412656_3210.html	Présidentielle en Uruguay : la gauche revient au pouvoir avec la victoire de Yamandu Orsi - Le Monde	Le représentant de l’alliance d’opposition Frente Amplio a devancé, au second tour, avec près de 52 % des voix, Alvaro Delgado, le candidat du Parti national (centre droit), qui était au pouvoir depuis 2020.	https://img.lemde.fr/2024/11/25/2/0/3254/2169/1440/960/60/0/bcc263a_5346618-01-06.jpg	2024-11-25 02:11:44	Le Monde
fr	https://www.francetvinfo.fr/culture/patrimoine/incendie-de-notre-dame-de-paris/la-moitie-des-francais-prevoit-de-visiter-la-cathedrale-notre-dame-de-paris-apres-sa-reouverture_6916574.html	La moitié des Français prévoit de visiter la cathédrale Notre-Dame de Paris après sa réouverture - franceinfo	Notre-Dame de Paris doit rouvrir au public le 8 décembre après cinq ans d'une reconstruction colossale à la suite de l'incendie qui l'a ravagée en 2019.	https://www.francetvinfo.fr/pictures/WqC9EHpqmgo-f0FS2iSW9IfifQo/0x0:5906x3320/1500x843/2024/11/24/notre-dame-6743038050e4b060729145.jpg	2024-11-24 20:00:01	franceinfo
fr	https://www.liberation.fr/international/europe/les-equipes-de-trump-et-biden-travaillent-a-un-arrangement-sur-le-conflit-poutine-promet-deffacer-les-dettes-des-soldats-le-lactu-de-la-guerre-en-ukraine-ce-dimanche-24-novembre-20241124_S67S7ZPE5BBFTHYUDGES6PHPTA/	Les équipes de Trump et Biden travaillent à un «arrangement» sur le conflit, Poutine promet d’effacer les dettes des soldats, l’actu de la guerre en Ukraine ce dimanche 24 novembre - Libération	L’essentiel des informations sur la guerre en Ukraine ce dimanche 24 novembre.	https://www.liberation.fr/resizer/v6XerFE_tXmkeW2DKYaETOROMUM=/1200x630/filters:format(jpg):quality(70):focal(2375x2362:2385x2372)/cloudfront-eu-central-1.images.arcpublishing.com/liberation/U4HGL4EUTJF77G3OLUY5GDKITI.JPG	2024-11-24 17:38:04	Libération
fr	https://www.lefigaro.fr/international/emirats-trois-arrestations-apres-le-meurtre-d-un-rabbin-20241125	Émirats : trois arrestations après le meurtre d'un rabbin - Le Figaro	Le ministère émirati de l’Intérieur a annoncé l’arrestation des «trois auteurs du meurtre» du rabbin israélo-moldave Tzvi Kogan, disparu depuis jeudi et retrouvé sans vie ce dimanche. Le gouvernement israélien dénonce «un acte odieux de terrorisme antisémite».	https://i.f1g.fr/media/cms/1200x630_crop/2024/11/25/73bbf6253500270ceb1f37a62067dce1e54ac5120bd39268e1712c37f64cdbcf.jpg	2024-11-25 00:15:11	Le Figaro
fr	https://www.ouest-france.fr/vendee-globe/vendee-globe-yoann-richomme-ameliore-son-propre-record-du-monde-de-distance-parcourue-en-24-heures-f63f44ba-aab1-11ef-b615-96f9c0483433	Vendée Globe. Yoann Richomme améliore son propre record du monde de distance parcourue en 24 heures - Ouest-France	Quatre jours seulement après avoir déjà établi le record de la plus longue distance parcourue en 24 h en solitaire à bord d’un Imoca mercredi 20 novembre, Yoann Richomme l’a encore amélioré, ce dimanche 24 novembre. Le skippeur de Paprec Arkea a parcouru 574 milles en une journée, soit 23 de plus que la fois précédente.	https://media.ouest-france.fr/v1/pictures/MjAyNDExNDkwMTgzOGE1MDJkMDBmYmFjY2ViNzZjOGM4NjEzMTg?width=1260&height=708&focuspoint=60%2C38&cropresize=1&client_id=bpeditorial&sign=c51da6d5406d5cea386147e8b35fb48d2ea293e858de290bfd7083a825aeae03	2024-11-24 22:39:49	Ouest-France
fr	https://www.ouest-france.fr/meteo/meteo-neuf-departements-du-centre-est-en-vigilance-orange-lundi-trafic-sncf-perturbe-cb5710ee-301b-4402-ae08-612c82b3113c	Météo : neuf départements du centre-est en vigilance orange lundi, trafic SNCF perturbé - Ouest-France	Météo-France a placé, dans la nuit de dimanche à lundi, neuf départements du centre-est en vigilance orange pour « vent violent » : pour réduire le risque d’accidents, la SNCF a annoncé l’interruption de nombreuses lignes de train dans la région Auvergne-Rhône-Alpes lundi 25 novembre.	https://media.ouest-france.fr/v1/pictures/MjAyNDExNzQ5ZDFlNjEzMWEwNGE5NTVkYWJjYmIxODcwYzU1MTU?width=1260&height=708&focuspoint=50%2C25&cropresize=1&client_id=bpeditorial&sign=9b671bff4436b60837c6a80e20b2535cc0d3ec57b9a38d53103220399280de8f	2024-11-25 01:09:57	Ouest-France
fr	https://www.francetvinfo.fr/politique/parlement-francais/senat/budget-2025-pourquoi-le-senat-est-en-position-de-force-pour-imprimer-sa-marque-sur-le-projet-de-loi_6908831.html	Budget 2025 : pourquoi le Sénat est en position de force pour imprimer sa marque sur le projet de loi - franceinfo	La droite et le centre, alliés dans le "socle commun" du gouvernement Barnier, sont majoritaires à la chambre haute, où ils comptent bien montrer une image plus constructive que lors des débats à l'Assemblée nationale.	https://www.francetvinfo.fr/pictures/6lHMTU7TnLH07t0jj54YdgG1AuA/0x68:1024x643/1500x843/2024/11/20/080-hl-acornu-2530195-673e06d78c3aa993973993.jpg	2024-11-25 04:59:18	franceinfo
fr	https://www.francetvinfo.fr/politique/francois-fillon/affaires-fillon/emplois-fictifs-a-l-assemblee-nationale-a-quelle-peine-sera-condamne-francois-fillon-par-la-cour-d-appel-de-paris_6916751.html	Emplois fictifs à l'Assemblée nationale : à quelle peine sera condamné François Fillon par la cour d'appel de Paris ? - franceinfo	Jugé définitivement coupable de détournement de fonds publics, l'ancien Premier ministre avait écopé en appel de quatre ans de prison, dont un ferme, et 350 000 euros d'amende. Ces peines sont réexaminées.	https://www.francetvinfo.fr/pictures/sAoXWChLjme0b4v_t1ejhKPIUAY/0x407:4960x3194/1500x843/2024/11/24/080-hl-gbedrignans-2049526-67433701e3ad4870685425.jpg	2024-11-25 05:05:01	franceinfo
fr	https://voilesetvoiliers.ouest-france.fr/course-au-large/vendee-globe/vendee-globe-les-favoris-aux-avant-postes-un-classement-enfin-significatif-et-un-nouveau-record-e6df719e-aae7-11ef-b615-96f9c0483433	Vendée Globe. Les favoris aux avant-postes, un classement enfin significatif, et un nouveau record - Voiles et Voiliers	On ne peut pas dire que l’on soit surpris de les voir, tous les trois, en tête du classement du Vendée Globe : Charlie Dalin, Thomas Ruyant et Yoann Richomme étaient dès le départ les grands favoris de ce tour du monde en solitaire. Yoann Richomme a même profité de la nuit pour améliorer son propre record des 24 heures : on est désormais à près de 580 milles, la barre des 600 milles approche…	https://media.ouest-france.fr/v1/pictures/MjAyNDExNzllNTBjZTk1NDk4NDNhNGJiM2EzNDkyMmFiNWViYmE?width=1260&height=708&focuspoint=50%2C25&cropresize=1&client_id=bpeditorial&sign=e8a777c223a1c3441597f538d22462a39357ebb86fa0327b55e24cc6bb6b4856	2024-11-25 06:31:16	Voiles et Voiliers
fr	https://www.lefigaro.fr/actualite-france/meurtre-de-victorine-denonce-par-son-meilleur-ami-le-suspect-face-a-la-justice-20241124	Meurtre de Victorine : dénoncé par son meilleur ami, le suspect face à la justice - Le Figaro	Ludovic Bertin, 29 ans, comparaît à partir de ce lundi devant la cour d’assises de l’Isère. Il encourt la perpétuité pour avoir tenté de violer, puis tué l’étudiante, ainsi que pour le viol d’une autre jeune femme, Vicky.	https://i.f1g.fr/media/cms/1200x630_crop/2024/11/24/04008ca9b6bd7e4f14f1f2800f2192e34740d44f0d92ea246b3dbc8c4eed499c.jpg	2024-11-24 17:53:00	Le Figaro
fr	https://www.lemonde.fr/international/article/2024/11/25/guerre-en-ukraine-l-envoi-de-troupes-occidentales-de-nouveau-en-discussion_6412802_3210.html	Guerre en Ukraine : l’envoi de troupes occidentales de nouveau en discussion - Le Monde	Dans la perspective d’un désengagement américain vis-à-vis de Kiev en raison du retour de Donald Trump à la Maison Blanche, Paris et Londres n’excluent pas de prendre la tête d’une coalition en Ukraine, selon des modalités qui restent à préciser.	https://img.lemde.fr/2024/11/11/0/0/6399/4266/1440/960/60/0/6c61f59_2024-11-11t122946z-434524028-rc203barltou-rtrmadp-3-remembrance-day-france-macron.JPG	2024-11-25 05:00:28	Le Monde
fr	https://www.francetvinfo.fr/monde/europe/union-europeenne/en-roumanie-un-candidat-prorusse-cree-la-surprise-a-la-presidentielle_6918044.html	En Roumanie, un candidat prorusse crée la surprise à la présidentielle - franceinfo	Calin Georgescu est arrivé en tête du premier tour avec 22,59% des suffrages, contre 19,55% pour le Premier ministre Marcel Ciolacu, selon des résultats quasi définitifs.	https://www.francetvinfo.fr/pictures/dSdbiTEYutyCnMykbjm_3d8RPW0/0x122:5535x3233/1500x843/2024/11/25/sipa-ap22920641-000002-6744116d1ca9f183220044.jpg	2024-11-25 07:06:35	franceinfo
fr	https://www.lemonde.fr/international/article/2024/11/24/le-mandat-d-arret-contre-netanyahou-source-de-discorde-au-sein-de-la-coalition-neerlandaise_6412524_3210.html	Le mandat d’arrêt contre Nétanyahou, source de discorde au sein de la coalition néerlandaise - Le Monde	Alors que le ministre des affaires étrangères des Pays Bas, où siège la Cour pénale internationale, a dû annuler une visite en Israël, le dirigeant d’extrême droite Geert Wilders, dont le parti domine la coalition au pouvoir, compte se rendre en Israël.	https://img.lemde.fr/2024/11/19/0/0/5320/3546/1440/960/60/0/d87e6f0_5295060-01-06.jpg	2024-11-24 22:08:46	Le Monde
fr	https://www.lemonde.fr/politique/article/2024/11/25/les-idees-du-rn-s-installent-dans-l-opinion-mais-le-doute-grandit-sur-sa-capacite-a-gouverner_6412870_823448.html	Les idées du RN s’installent dans l’opinion mais le doute grandit sur sa capacité à gouverner - Le Monde	Près de quatre Français sur dix valident les thèses du Rassemblement national, selon le baromètre annuel de l’institut Verian pour « Le Monde » sur l’image du parti d’extrême droite. Si la campagne des législatives a mis en avant son président, Jordan Bardella, elle a aussi laissé des traces.	https://img.lemde.fr/2024/11/24/1406/0/4480/2986/1440/960/60/0/2a52e85_1732461213074-12.jpg	2024-11-25 05:58:05	Le Monde
fr	https://actu.fr/ile-de-france/paris_75056/pluie-manifestation-trafic-sature-sur-les-routes-de-paris-et-d-ile-de-france-400-km-de-bouchons-cumules_61910463.html	Opération escargot sur les routes de Paris et d'Île-de-France, déjà plus de 400 km de bouchons cumulés - actu.fr	None	None	2024-11-25 07:30:00	actu.fr
fr	https://www.rtl.fr/actu/politique/notre-dame-de-paris-le-pape-ne-sera-pas-present-a-la-ceremonie-de-reouverture-incomprehension-a-l-elysee-7900443921	Notre-Dame de Paris : le pape ne sera pas présent à la cérémonie de réouverture, incompréhension à l'Élysée - RTL	La visite du pape François en Corse, le 15 décembre prochain, a été officialisée samedi. Le souverain pontife se rendra donc en France une semaine après la réouverture de Notre dame de Paris. Un choix qui laisse l'exécutif dans l'incompréhension.	https://images.rtl.fr/~c/2000v2000/rtl/www/1716755-le-pape-francois-au-vatican-en-novembre-2024.jpg	2024-11-24 06:40:00	RTL
fr	https://www.lemonde.fr/economie/article/2024/11/25/l-etat-achete-les-supercalculateurs-d-atos_6412941_3234.html	L’Etat achète les supercalculateurs d’Atos - Le Monde	Un accord a été trouvé pour nationaliser cette activité sensible du groupe d’informatique, utilisée notamment pour la dissuasion nucléaire.	https://img.lemde.fr/2024/11/25/0/20/4824/3216/1440/960/60/0/e29b9f0_1732520079936-000-322t7vk.jpg	2024-11-25 07:45:07	Le Monde
fr	https://www.20minutes.fr/sport/rugby/4123062-20241125-rugby-vii-an-apres-etre-mis-discipline-antoine-dupont-deja-designe-meilleur-joueur	Un an après s’être mis au rugby à VII, Antoine Dupont déjà meilleur joueur - 20 Minutes	Aux World Rugby Awards, Antoine Dupont est désormais le seul joueur masculin à remporter le titre de meilleur joueur à XV et à VII	https://img.20mn.fr/A-3reszgQaCYglhMRFL1yyk/1444x920_france-s-antoine-dupont-runs-with-the-ball-in-their-gold-medal-rugby-seven-s-match-against-fiji-at-the-stade-de-france-on-the-opening-day-of-the-paris-olympics-on-saturday-july-27-2024-france-won-the-match-by-28-7-04saidichristophe-sipa-13206-credit-christophe-saidi-sipa-2407281242	2024-11-25 01:54:00	20 Minutes
fr	https://www.ouest-france.fr/societe/faits-divers/en-bretagne-il-menace-un-commercant-avec-un-marteau-en-plein-marche-du-dimanche-matin-04be128a-aa5a-11ef-b615-96f9c0483433	En Bretagne, il menace un commerçant avec un marteau en plein marché du dimanche matin - Ouest-France	Ce dimanche 24 novembre 2024, à Quimper (Finistère), un trentenaire a menacé un commerçant du marché du Braden avec un marteau. Il a été interpellé par des policiers.	https://media.ouest-france.fr/v1/pictures/MjAyNDExZWIwZjJiYjE5MjY2N2JhMGNhZTRlNzdjNjEyYzljZGE?width=1260&height=708&focuspoint=50%2C25&cropresize=1&client_id=bpeditorial&sign=ba31108b8d5fd1a8bdd32da1047677116f39e64da60e886d0c3c2a0558e7aa5f	2024-11-24 12:07:25	Ouest-France
fr	https://www.latribune.fr/entreprises-finance/industrie/agroalimentaire-biens-de-consommation-luxe/fin-de-l-exoneration-des-titres-restaurants-40-000-emplois-menaces-1012236.html	Fin de l'exonération des titres-restaurants : 40.000 emplois menacés - La Tribune.fr	None	None	2024-11-25 06:14:00	La Tribune.fr
fr	https://www.20minutes.fr/justice/4123125-20241125-proces-viols-mazan-heure-requisitions-dominique-pelicot-complices	L’heure des réquisitions pour Dominique Pelicot et ses cinquante complices - 20 Minutes	Au procès des viols de Mazan, l’heure des réquisitoires a sonné pour Dominique Pelicot et les cinquante hommes qu’il a recrutés sur Internet pour violer sa femme, Gisèle, sous soumission chimique	https://img.20mn.fr/mnVwTlDQRgCW_TNyFS_KMik/1444x920_files-this-court-sketch-created-at-the-avignon-courthouse-in-avignon-south-eastern-france-on-october-11-2024-shows-defendant-dominique-pelicot-c-looking-up-in-front-of-his-former-partner-gisele-pelicot-r-during-his-trial-in-which-he-is-accused-of-drugging-his-wife-for-nearly-ten-years-and-inviting-strangers-to-rape-her-at-their-home-in-mazan-a-small-town-in-the-south-of-france-a-court-in-the-french-southern-town-of-avignon-is-trying-dominique-pelicot-a-71-year-old-retiree-for-repeatedly-raping-and-enlisting-dozens-of-strangers-to-rape-his-heavily-sedated-wife-in-her-own-bed-over-a-decade-fifty-other-men-aged-between-26-and-74-are-also-on-trial-for-alleged-involvement-in-a-case-that-has-horrified-france-the-court-proceedings-which-runs-until-december-20-2024-are-open-to-the-public-at-the-request-of-dominique-pelicot-s-ex-wife-and-victim-photo-by-benoit-peyrucq-afp	2024-11-25 05:36:00	20 Minutes
fr	https://www.cnews.fr/questions-du-jour/2024-11-25/etes-vous-choque-par-la-proposition-de-loi-lfi-visant-abroger-le-delit?__cf_chl_rt_tk=hKdbcKOy1NqjSg0JsOfJJNDK7i3GqwdhUojugk8cyCc-1732528840-1.0.1.1-16K4vycyOpvijZhNkU4rBaziY92A31wNl6xmteNJb2k	Êtes-vous choqué par la proposition de loi LFI visant à abroger le délit d'apologie du terrorisme - CNEWS	None	None	2024-11-25 05:15:33	CNEWS
fr	https://www.lemonde.fr/international/live/2024/11/25/en-direct-guerre-au-proche-orient-nouveaux-bombardements-sur-la-banlieue-sud-de-beyrouth-apres-un-appel-israelien-a-evacuer-le-secteur_6408012_3210.html	En direct, guerre au Proche-Orient : nouveaux bombardements sur la banlieue sud de Beyrouth, après un appel israélien à évacuer le secteur - Le Monde	Le ministre libanais de l’éducation avait annoncé dimanche soir la suspension des cours lundi à Beyrouth dans les écoles, instituts techniques et établissements d’enseignement supérieur privés, pour des raisons de « sécurité ».	https://img.lemde.fr/2024/11/25/336/0/4032/2016/1440/720/60/0/6bb6949_5348229-01-06.jpg	2024-11-25 08:56:02	Le Monde
fr	https://www.francetvinfo.fr/politique/nouveau-front-populaire/nouveau-front-populaire-jean-luc-melenchon-accuse-le-parti-socialiste-d-etre-en-train-d-organiser-un-nouveau-socle-commun_6916955.html	Nouveau Front populaire : Jean-Luc Mélenchon accuse le Parti socialiste d'être "en train d'organiser un nouveau socle commun" - franceinfo	Plusieurs figures du Parti socialiste veulent trouver les conditions d'une "non-censure" en cas de chute du gouvernement de Michel Barnier.	https://www.francetvinfo.fr/pictures/o6O8HteGNK3W2GR4qmb3P_9jFYM/0x30:5000x2841/1500x843/2024/11/24/080-hl-rcostaseca-2573697-6743776a0cc43956691609.jpg	2024-11-24 19:07:41	franceinfo
fr	https://www.ouest-france.fr/outre-mer/a-la-reunion-le-fleau-des-chiens-et-chats-tortures-dans-des-squats-bf28d580-aa71-11ef-97ac-3f45f231c487	À La Réunion, le fléau des chiens et chats torturés dans des squats - Ouest-France	Les premiers signalements datent de 2016 sur l’île de La Réunion. Des chiens avaient été torturés et retrouvés début août 2024 dans une ravine, à Saint-Denis. Mais depuis, le phénomène ne cesse de prendre de l’ampleur. Et de nouveaux lieux de tortures voient le jour partout sur l’île.	https://media.ouest-france.fr/v1/pictures/MjAyNDExZWQ1M2FlZjA2MGM3ZjY3ZWVhOGQ2MDdlMjU1NDQ1MTM?width=1260&height=708&focuspoint=49%2C70&cropresize=1&client_id=bpeditorial&sign=0932c6a577d2d1916442359bb320860dacf21eaeaaad2fbdd0f38aa9c6073736	2024-11-25 07:00:53	Ouest-France
fr	https://actu.fr/economie/colere-des-agriculteurs-une-action-coup-de-poing-dans-la-manche_61910387.html	Colère des agriculteurs : une « action coup de poing » dans la Manche - actu.fr	Ce 24 novembre 2024, la Coordination rurale de la Manche a réuni des agriculteurs et salariés du para-agricole pour une « action coup de poing » dans le sud du département.	https://static.actu.fr/uploads/2024/11/87e1736993476abe1736993477fe17v.jpg	2024-11-25 06:06:49	actu.fr
fr	https://www.francebleu.fr/infos/transports/des-trains-entre-paris-et-la-normandie-bloques-plusieurs-heures-des-passagers-passent-la-nuit-en-gare-d-evreux-2587817	Des trains entre Paris et la Normandie bloqués plusieurs heures, des passagers passent la nuit en gare d'Evreux - France Bleu	Plusieurs trains entre Paris et la Normandie ont été bloqués dans la nuit de dimanche à lundi. La SNCF évoque des problèmes d'alimentation électrique mais aussi d'animaux sur la voie. Des centaines de passagers ont passé plusieurs heures dans les voitures. Le trafic a repris vers 4 heures du matin.	https://www.francebleu.fr/s3/cruiser-production-eu3/2024/11/466081f8-a277-42eb-9b5d-3c294c638f29/1200x680_sc_train-marie-evreux.jpg	2024-11-25 05:38:35	France Bleu
fr	https://news.google.com/rss/articles/CBMi6wFBVV95cUxNNjJub2lFMlpMMlBBMDE5aEhWTHpKZ09kRWNaQzBZOWpMWGNvZlZCVG9zZE9YUnNRcVlLS2J1aU5SZ3lIMjJ3NnVldlc2WmxuNGVNdmd2UzNIMkRqZkt4U2NDSGtYN05oV2k0SjVjd0hNWHRKYW9DNG9QaklQYmxVV0xyaEM0SW1vdHBXQ2RkUUdxdDRtZTRGeVBLMDZkRWhXcEs1WGpwUFAtYzRXc0VaS3l1TUM3bklSWnFBMC1VS2VNcjgwNTVQaEFVN3VhamlXc0FvTTRJWnExWlZRVHRsbTg2ZWxRcDVvMTVN?oc=5	Féminicides : une femme est tuée par un proche toutes les dix minutes dans le monde - Le Monde	Selon les chiffres de l’ONU, 85 000 femmes ont été tuées de manière intentionnelle en 2023. Le foyer reste « l’endroit le plus dangereux » pour elles, puisque 60 % ont été tuées par « leur conjoint ou d’autres membres de leur famille ».	https://img.lemde.fr/2024/11/25/0/0/3000/2000/1440/960/60/0/23ff9e4_1732517027506-marcheviolencesfemmes-as103140.jpg	2024-11-25 07:07:43	Le Monde
