country_code	url	title	description	image_url	publish_date	source
fr	https://www.lequipe.fr/Tennis/Actualites/Battue-par-la-colombie-en-barrage-de-la-billie-jean-king-cup-la-france-est-releguee-en-deuxieme-division/1521027	BJK Cup : Battue par la Colombie en barrage de la Billie Jean King Cup, la France est reléguée en deuxième division - L'Équipe	La paire Chloé Paquet - Clara Burel s'est inclinée dans le double décisif en barrage de la Billie Jean King Cup, dimanche, face aux Colombiennes Camila Osorio et Emiliana Arango (6-3, 6-4). La France évoluera donc en deuxième division l'année prochaine.	https://medias.lequipe.fr/img-photo-jpg/chloe-paquet-a-perdu-avec-clara-burel-le-double-decisif-face-a-la-colombie-dimanche-b-papon-l-equipe/1500000002085831/0:0,1994:1330-640-427-75/2c281.jpg	2024-11-17 22:11:10	L'Équipe
fr	https://actu.fr/societe/agriculteurs-sncf-des-greves-tous-les-jours-cette-semaine-avant-un-mois-noir-de-contestation-sociale_61868359.html	Agriculteurs, SNCF… Des grèves tous les jours cette semaine, avant un mois noir de contestation sociale - actu.fr	La semaine qui arrive sera marquée par de nombreuses contestations sociales. Dès ce lundi 18 novembre 2024, les agriculteurs entrent en mobilisation. Voici à quoi s'attendre.	https://static.actu.fr/uploads/2024/11/newsmlafp-com-20240130t143331zpartners-080-hl-jcmilhet-2276982.jpg	2024-11-17 16:36:10	actu.fr
fr	https://www.20minutes.fr/societe/4121311-20241118-boulot-ca-paye-familles-economisent-pres-4-000-euros-an-grace-zero-dechet	« C’est du boulot mais ça paye »… Des familles économisent près de 4.000 euros par an grâce au zéro déchet - 20 Minutes	Parmi les nombreux habitants de Roubaix a avoir adopté la logique zéro déchet initiée par la mairie, certains ont optimisé leur démarche au point de réaliser d'impressionnantes économies	https://img.20mn.fr/VJ5UOtpcQL2fXCRJUOUccSk/1444x920_7eme-jour-de-greve-des-eboueurs-de-marseille-ici-le-quartier-noailles-dans-le-centre-ville	2024-11-18 05:02:00	20 Minutes
fr	https://www.lemonde.fr/planete/article/2024/11/18/inde-a-new-delhi-la-pollution-atmospherique-60-fois-superieure-aux-normes-de-l-oms_6399826_3244.html	Inde : à New Delhi, la pollution atmosphérique 60 fois supérieure aux normes de l’OMS - Le Monde	La ville est confrontée chaque hiver à des pics de pollution causés par les fumées toxiques des usines, du trafic routier et des brûlis agricoles saisonniers.	https://img.lemde.fr/2024/11/18/0/0/8416/5611/1440/960/60/0/dcbd301_f355f781ae4b4b32aa433e767d1c0849-0-bbbeecbe13314242bf701720da17b82c.jpg	2024-11-18 06:45:42	Le Monde
fr	https://www.lefigaro.fr/actualite-france/ou-fait-il-bon-vivre-pour-les-seniors-notre-classement-de-1000-villes-francaises-20241118	Où fait-il bon vivre pour les seniors ? Notre classement de 1000 villes françaises - Le Figaro	EXCLUSIF - Santé, commerces, loisirs, sécurité, environnement… Nous avons comparé les données de 1000 communes françaises. Découvrez celles où la vie est la plus douce pour les personnes âgées de plus de 60 ans.	https://i.f1g.fr/media/cms/1200x630_crop/2024/11/14/dd181cf62d59b90427501ae92701387432bb6b45f070c9590e07d295959849fa.jpg	2024-11-18 06:00:00	Le Figaro
fr	https://www.lemonde.fr/international/article/2024/11/18/la-nouvelle-diaspora-russe-se-mobilise-contre-poutine-a-berlin_6399896_3210.html	La nouvelle diaspora russe se mobilise contre Poutine à Berlin - Le Monde	Plusieurs centaines de personnes, arrivées en Europe depuis 2022, ont défilé dans la capitale allemande.	https://img.lemde.fr/2024/11/17/0/0/8640/5760/1440/960/60/0/13db8c6_bbcf0bf1faf540a5bb26593898c4e7be-0-5cb2083e7e4044d28a908ae798b9f455.jpg	2024-11-18 07:29:10	Le Monde
fr	https://www.leparisien.fr/faits-divers/identification-des-victimes-jeunes-disparus-ce-que-lon-sait-apres-laccident-de-la-route-qui-a-fait-cinq-morts-dans-le-tarn-17-11-2024-SOLB7YDNGBAPZNGXB2VNWPL6EI.php	Identification des victimes, jeunes disparus... ce que l’on sait après l’accident de la route qui a fait cinq morts dans le Tarn - Le Parisien	Une seule des cinq victimes, un jeune homme de vingt ans, a pu être identifié. Les identités des quatre autres personnes à bord tardent à êt	https://www.leparisien.fr/resizer/FkcdvVEPCbwZ5il9Noy2FYIoerM=/1200x675/cloudfront-eu-central-1.images.arcpublishing.com/leparisien/BF4TRA4SIPGBKI4AWZGR27J7CU.jpg	2024-11-17 20:04:00	Le Parisien
fr	https://www.francetvinfo.fr/economie/transports/sncf/greve-a-la-sncf/restez-du-cote-des-francais-lance-le-pdg-de-la-sncf-aux-cheminots-quatre-jours-avant-un-appel-a-la-greve_6903083.html	"Restez du côté des Français", lance le PDG de la SNCF aux cheminots, quatre jours avant un appel à la grève - franceinfo	Dans une interview à "La Tribune dimanche", Jean-Pierre Farandou assure que "les Français ne comprendraient pas une grève longue et dure en décembre".	https://www.francetvinfo.fr/pictures/HRqfdxe3dCEeoMG2Ug4MUg9KvhA/0x6:1024x582/1500x843/2024/11/17/000-34zn3d6-1-673a13f08c0dc386912643.jpg	2024-11-17 16:05:13	franceinfo
fr	https://www.ouest-france.fr/meteo/fortes-pluies-au-nord-neige-redoux-le-week-end-on-fait-le-point-sur-la-meteo-de-la-semaine-916e8088-a56a-11ef-831d-1ac76626b0a8	Fortes pluies au nord, neige, redoux le week-end… On fait le point sur la météo de la semaine - Ouest-France	Les températures devraient baisser dans la semaine, avant que le week-end ne soit marqué par un redoux. Côté précipitation, de fortes pluies touchent les côtes de la Manche en ce début de semaine, tandis que la neige devrait tomber sur l’est de la France.	https://media.ouest-france.fr/v1/pictures/MjAyNDExYmFkNzFjYzlkNDBkZDM3ZmY2ZDNkOTYzYTk4NmY5NDg?width=1260&height=708&focuspoint=50%2C25&cropresize=1&client_id=bpeditorial&sign=d0c0d99391706f04e7adbe2c37243f7d24436c1fbe81d673e8e107ce8493fbc3	2024-11-18 05:49:24	Ouest-France
fr	https://www.huffingtonpost.fr/divertissement/article/miss-univers-2024-la-danoise-victoria-kjaer-theilvig-sacree-voici-le-classement-des-trois-francaises_242334.html	Miss Univers 2024 : la Danoise Victoria Kjaer Theilvig sacrée, voici le classement des trois Françaises - Le HuffPost	None	None	2024-11-17 08:54:44	Le HuffPost
fr	https://www.ouest-france.fr/vendee-globe/video-arreter-le-massacre-du-vendee-globe-a-paris-les-coulisses-du-retour-de-maxime-sorel-3e659c46-a57e-11ef-831d-1ac76626b0a8	VIDÉO. « Arrêter le massacre… » : du Vendée Globe à Paris, les coulisses du retour de Maxime Sorel - Ouest-France	De retour en France à l’aéroport dimanche 17 novembre dans la soirée, le Malouin Maxime Sorel a diffusé les coulisses de son abandon du Vendée Globe 2024 à cause d’une rupture des ligaments de la cheville. Une vidéo chargée en émotions…	https://media.ouest-france.fr/v1/pictures/MjAyNDExNWYzOTRiNGE5MzNjNjI2ZDdiNWVmNGU4MGM5OWRkN2Y?width=1260&height=708&focuspoint=50%2C25&cropresize=1&client_id=bpeditorial&sign=f3f2c83585533066e7ff6bcfa744e7a6400c26d7892b6e1c6fd73b7062412d58	2024-11-18 07:47:59	Ouest-France
fr	https://www.lemonde.fr/societe/article/2024/11/17/au-proces-des-viols-de-mazan-l-epreuve-du-dernier-kilometre-des-interrogatoires_6398975_3224.html	Au procès des viols de Mazan, la si lourde épreuve du dernier kilomètre des interrogatoires - Le Monde	Après dix semaines d’audience, trois des derniers accusés ont été interrogés, vendredi 15 novembre, par la cour criminelle du Vaucluse.	https://img.lemde.fr/2024/11/17/0/0/4792/3195/1440/960/60/0/1bb7f83_1731853580629-000-36fy82u.jpg	2024-11-17 16:00:05	Le Monde
fr	https://www.corsematin.com/article/faits-diversjustice/4394926409487214/narcotrafic-et-crime-organise-la-feuille-de-route-des-ministres-difficilement-lisible-pour-le-monde-judiciaire-en-corse	Narcotrafic et crime organisé : la feuille de route des ministres difficilement lisible pour le monde judiciaire en Corse - Corse Matin	Narcotrafic et crime organisé : la feuille de route des ministres difficilement lisible pour le monde judiciaire en Corse	https://pictures.corsematin.com/cdn-cgi/image//media/melody/2024/11/18/c-photopqr-la-provence-vallauri-nicolas-marseille-08-11-2024-deplacement-de-didier-migaud-garde-des-1731909603_123e98cb1a376063e98cb1a37d93e9v_.jpg	2024-11-18 06:00:04	Corse Matin
fr	https://www.francetvinfo.fr/sports/voile/vendee-globe/vendee-globe-2024-sam-goodchild-passe-en-tete-et-prend-de-l-avance-suivez-la-position-des-skippeurs-en-direct_6904520.html	Vendée Globe 2024 : Sam Goodchild passe en tête et prend de l'avance... Suivez la position des skippeurs en direct - franceinfo	Le marin britannique a réussi à mieux exploiter les bascules de vent pour prendre la première position et se détacher de la flotte.	https://www.francetvinfo.fr/pictures/_4HhUZyINxcMNkF8tMtXOaF8gBQ/0x45:1024x621/1500x843/2024/11/18/066-dppi-30624007-014-673afc2ae9999314799480.jpg	2024-11-18 08:44:03	franceinfo
fr	https://www.lemonde.fr/sport/article/2024/11/18/football-l-olympique-lyonnais-d-un-modele-obsolete-a-un-modele-hasardeux_6400031_3242.html	« L’Olympique lyonnais, d’un modèle obsolète à un modèle hasardeux » - Le Monde	CHRONIQUE. En difficulté financière, menacé de relégation administrative et de régression sportive, le club, désormais propriété de l’Américain John Textor, navigue à vue, considère Jérôme Latta dans sa chronique.	https://img.lemde.fr/2024/11/18/0/0/6000/4000/1440/960/60/0/3b58f1c_1731916213262-000-33vc76p.jpg	2024-11-18 08:24:44	Le Monde
fr	https://www.lemonde.fr/international/article/2024/11/18/en-argentine-dialogue-difficile-entre-emmanuel-macron-et-javier-milei_6400273_3210.html	En Argentine, dialogue difficile entre Emmanuel Macron et Javier Milei - Le Monde	Premier dirigeant étranger à avoir rencontré Donald Trump depuis l’élection de ce dernier, le président Javier Milei a reçu Emmanuel Macron, dimanche, alors que Paris et Buenos Aires s’opposent sur des sujets majeurs, de la lutte contre le réchauffement climatique au traité de libre-échange UE-Mercosur.	https://img.lemde.fr/2024/11/18/0/0/7779/5186/1440/960/60/0/12be90c_1731922729210-556664.jpg	2024-11-18 10:14:59	Le Monde
fr	https://www.rtl.fr/actu/justice-faits-divers/info-rtl-crepol-un-an-apres-la-mort-de-thomas-les-difficiles-avancees-de-l-enquete-7900441396	INFO RTL - Crépol : un an après la mort de Thomas, les difficiles avancées de l’enquête - RTL	L’auteur du coup de couteau qui a tué le jeune amateur de rugby, âgé de 16 ans, à la fin d’un bal de village dans la Drôme, n’est toujours pas identifié.	https://images.rtl.fr/~c/2000v2000/rtl/www/1715322-une-marche-blanche-organisee-en-hommage-a-thomas-tue-lors-d-une-rixe-a-crepol.jpg	2024-11-18 05:26:16	RTL
fr	https://news.google.com/rss/articles/CBMivAFBVV95cUxQT05nckdDQW1WUFJyLXpFbFRsaGZ5OWlZeFNtQ1pxRFkwd3B6TndGa2V4X1N5eHhvbV81N2o4NFltMHZqU2dQeEFBVDhRRk4wak11bTVheGl5d3N3YW1TVWNsdlMybmc4bUdNR2NiZGpXT2RlZGhJOVJwRW51MHl0LTVrT1dOeGpnaFpPSWVKTFlqa0kwNU42d1FVanpOQy1mN2J0TEY2bzRfZE54dzh3TzQwLWNvX0dLaDBJMg?oc=5	Nice : Un homme armé retient de force une personne puis se suicide devant la police - 20 Minutes	La victime aurait eu le temps d'actionner une borne d'appel d'urgence pour prévenir les secours, dont l'arrivée aurait poussé le preneur d'otage à se suicider	https://img.20mn.fr/OQs6I2X7SLWlTZeOtopqjA/1444x920_illustration-police-municipale-nice	2024-11-18 05:28:00	20 Minutes
fr	https://www.francetvinfo.fr/faits-divers/prise-d-otages-dans-une-pizzeria-d-issy-les-moulineaux-l-homme-interpelle-hospitalise-sous-contrainte_6904661.html	Prise d'otages dans une pizzeria d’Issy-les-Moulineaux : l'homme interpellé hospitalisé sous contrainte - franceinfo	Arrêté samedi après-midi, l'homme de 38 ans s'était retranché avec une arme blanche dans le restaurant avec quatre personnes.	https://www.francetvinfo.fr/pictures/8lGXibxnjHwdiRL119RZklhnKZ0/0x98:1024x674/1500x843/2024/11/16/000-36mn6ev-67389f7a3b661415341216.jpg	2024-11-18 10:25:12	franceinfo
fr	https://www.20minutes.fr/faits_divers/4121839-20241118-doubs-cric-cede-homme-22-ans-meurt-ecrase-voiture	Doubs : Son cric cède, un homme de 22 ans meurt écrasé par sa voiture - 20 Minutes	Un jeune homme de 22 ans a été retrouvé mort sous son véhicule, dimanche dans le Doubs. Le cric qu'il avait placé afin de réparer sa voiture aurait rompu	https://img.20mn.fr/AVGK8ovjS4i-Al3I0jeS4ik/1444x920_illustration-photo-intervention-pompiers-nord-greuezfrancois-sipa-0240-2208160955	2024-11-18 06:38:00	20 Minutes
fr	https://www.lequipe.fr/Football/Actualites/Adrien-rabiot-encense-par-la-presse-italienne-apres-le-succes-des-bleus/1521087	Foot : Adrien Rabiot encensé par la presse italienne après le succès des Bleus en Ligue des nations - L'Équipe	Auteur d'un doublé pour ses retrouvailles avec l'Italie dimanche (victoire des Bleus 3-1), le milieu des Bleus Adrien Rabiot a été salué par la presse transalpine.	https://medias.lequipe.fr/img-photo-jpg/pour-son-retour-en-italie-rabiot-a-impressionne-l-equipe/1500000002086065/0:0,1500:1000-640-427-75/4fd4a.jpg	2024-11-18 09:39:23	L'Équipe
fr	https://www.20minutes.fr/societe/4121613-20241118-film-aussi-dur-vecu-atroce-histoire-laurence-karine-jambu-invite-tele	« Le film n’est pas aussi dur que ce qu’on a vécu »… L’atroce histoire de Laurence et Karine Jambu s’invite à la télé - 20 Minutes	Le téléfilm « Signalements » qui sera diffusé sur France 2 ce mercredi relate le parcours du combattant d’une femme pour sauver sa nièce des griffes d’un pédocriminel récidiviste	https://img.20mn.fr/fk3UuanVTGOYvOFYC420ISk/1444x920_l-histoire-de-karine-jambu-et-de-sa-tante-laurence-a-inspire-le-realisateur-eric-metayer-pour-le-film-signalements-retracant-les-errements-de-la-protection-de-l-enfance-face-aux-viols-et-violences-subis-par-celle-qui-n-etait-qu-une-enfant	2024-11-18 04:27:00	20 Minutes
fr	https://www.lemonde.fr/international/live/2024/11/18/en-direct-guerre-en-ukraine-le-bilan-du-bombardement-russe-sur-la-ville-de-soumy-atteint-onze-morts-dont-deux-enfants_6398132_3210.html?_staled_	En direct, guerre en Ukraine : le point sur la situation - Le Monde	Cette autorisation conduirait à « une situation fondamentalement nouvelle en termes d’implication des Etats-Unis dans ce conflit », a mis en garde Moscou. La France, par la voix de son ministre des affaires étrangères, a réaffirmé que la perspective de donner à Kiev les moyens de frapper des cibles sur le territoire russe restait « une option ».	https://img.lemde.fr/2024/11/17/343/0/3888/1944/1440/720/60/0/5db6fe9_5279807-01-06.jpg	2024-11-18 05:42:04	Le Monde
fr	https://www.20minutes.fr/societe/4121844-20241118-bretagne-tout-juste-sacre-champion-monde-pizzaiolo-ferme-subitement-restaurant	Bretagne : Tout juste sacré champion du monde, ce pizzaïolo ferme subitement son restaurant - 20 Minutes	Basé à Trégunc, Cyrille Auffret a laissé un message empreint d’émotion aux clients fidèles de La main à la pâte	https://img.20mn.fr/Uz6vf5tcS72OWMyWBQXVoyk/1444x920_cyrille-auffret-a-annonce-devoir-fermer-sa-pizzeria-moins-de-dix-jours-apres-avoir-remporte-le-trophee-mondial-de-la-pizza-organise-a-menton	2024-11-18 08:52:00	20 Minutes
fr	https://www.20minutes.fr/societe/4121834-20241118-direct-colere-agriculteurs-france-opposera-accord-affirme-emmanuel-macron	EN DIRECT Colère des agriculteurs : « La France n'est pas isolée » en Europ… - 20 Minutes	Suivez avec nous les dernières informations sur les actions menées ce lundi 18 novembre par le monde agricole pour tenter d'empêcher la signature du traité de libre-échange Mercosur	https://img.20mn.fr/k4RtVcX6SvOqOnRKgJqCdik/1444x920_des-agriculteurs-sur-des-tracteurs-bloquent-une-route-lors-d-une-manifestation-nationale-contre-l-accord-ue-mercosur-au-cannet-des-maures-dans-le-sud-de-la-france-le-18-novembre-2024	2024-11-18 06:40:25	20 Minutes
fr	https://www.lemonde.fr/international/live/2024/11/18/en-direct-guerre-en-ukraine-le-bilan-du-bombardement-russe-sur-la-ville-de-soumy-atteint-onze-morts-dont-deux-enfants_6398132_3210.html	En direct, guerre en Ukraine : les Etats-Unis jettent « de l’huile sur le feu » en autorisant les tirs de missiles à longue portée ATACMS en Russie, selon le Kremlin - Le Monde	Cette autorisation conduirait à « une situation fondamentalement nouvelle en termes d’implication des Etats-Unis dans ce conflit », a mis en garde Moscou. La France, par la voix de son ministre des affaires étrangères, a réaffirmé que la perspective de donner à Kiev les moyens de frapper des cibles sur le territoire russe restait « une option ».	https://img.lemde.fr/2024/11/17/343/0/3888/1944/1440/720/60/0/5db6fe9_5279807-01-06.jpg	2024-11-18 12:46:51	Le Monde
fr	https://www.liberation.fr/politique/proces-des-assistants-rn-yael-braun-pivet-absolument-effaree-par-les-commentaires-de-darmanin-cie-20241118_BM6OHIHH6BAELMF7IFVSI4DNWA/	Procès des assistants RN : Yaël Braun-Pivet «absolument effarée» par les commentaires de Darmanin & cie - Libération	Indiscrétions piquantes, maladresses vaches ou douces confessions: chaque jour, retrouvez les brèves qui auscultent le monde politique.	https://www.liberation.fr/resizer/d2rjRzb4-ApzYUTOeKM1aidq8Y8=/1200x630/filters:format(jpg):quality(70):focal(2514x1894:2524x1904)/cloudfront-eu-central-1.images.arcpublishing.com/liberation/4W6NQMSR5ZETHID2IMT3LG5U4A.jpg	2024-11-18 10:48:37	Libération
fr	https://www.charentelibre.fr/environnement/meteo-en-charente/meteo-en-france-ces-regions-qui-s-attendent-a-etre-recouvertes-de-neige-cette-semaine-22194117.php	Météo en France : ces régions qui s’attendent à être recouvertes de neige cette semaine - Charente Libre	L’hiver fait son retour en France cette semaine, avec une chute drastique des températures sur la majorité du pays.	https://media.charentelibre.fr/22194117/1200x-1/neig1.jpg	2024-11-18 06:44:56	Charente Libre
fr	https://www.ouest-france.fr/monde/etats-unis/trump-nomme-un-nouveau-chef-du-regulateur-des-telecoms-pour-demanteler-le-cartel-de-la-censure-bca38700-a55e-11ef-831d-1ac76626b0a8	Trump nomme un nouveau chef du régulateur des télécoms pour « démanteler le cartel de la censure » - Ouest-France	Le président-élu des États-Unis Donald Trump continue sa vague de nominations en vue de son investiture en janvier 2025. Dimanche, il a placé Brendan Carr, connu pour s’attaquer aux géants de la tech, à la tête de la FCC, le régulateur américain des télécoms.	https://media.ouest-france.fr/v1/pictures/MjAyNDExZTFmYjk1ZDYxYTIxYjk4NTk5NWQyNTIxMzM5MTNiNzc?width=1260&height=708&focuspoint=50%2C25&cropresize=1&client_id=bpeditorial&sign=338e0012c412c265799d792cc65d4711912f0aa698924eeaba80c14cb1eab68a	2024-11-18 04:06:47	Ouest-France
fr	https://actualite.lachainemeteo.com/alerte-meteo/8199-episode-de-fortes-pluies-et-de-vent-fort	Alerte Météo : Episode de fortes pluies et de vent fort - La Chaîne Météo	Une dépression creusée s'approche sur les Îles Britanniques et provoque un épisode de temps agité qui se met en place sur - Actualités La Chaîne Météo	https://static1.mclcm.net/iod/images/v2/69/cs/8199/1200x630_100_300_000000x10x0.jpg?ts=20241118115741	2024-11-18 10:54:36	La Chaîne Météo
fr	https://news.google.com/rss/articles/CBMi5gFBVV95cUxOUTdFLXZEbUQxT0ZPR3dUVFBrUWNzaWN0cDFnVFRQb2puWXhlN0h1VVk2TEVmeDVLY1JTUnBORUphZ3Yza0Z0bm9iU2FRdDI1bHhERDBWOHpZVEVhMEdOMXdxcWJYX213WjFReVVscXpQS3JKVjN1bDlzLUJLQmRWQklCY1R6alkyUm85b0pmNDh1MjYwN2VWU2FoTGt4N0JBYk54QlQzM01qSV9uTmhKTDlBdEFNSnJvY0FjTnI0X25aM3ZSY1FzRDJ3V0NsWTBheEZBaS1GeVlKQUdTUGJ4ZW5XTlk3dw?oc=5	Drame durant une bagarre entre jeunes : un adolescent de 17 ans tué par balles, ce que l’on sait - Centre Presse Aveyron	None	None	2024-11-18 07:11:00	Centre Presse Aveyron
fr	https://www.infos-dijon.com/news/bourgogne-franche-comte/bourgogne-franche-comte/hospices-de-beaune-une-vente-a-pres-de-14-millions-d-euros-ce-n-est-quand-meme-pas-si-mal.html	Hospices de Beaune : Une vente à près de 14 millions d’euros, ce n’est quand même pas si mal - infos-dijon.com		https://bourgogne-infos.com/medias/82487_1_full.jpg	2024-11-18 02:17:00	infos-dijon.com
fr	https://www.charentelibre.fr/france/plomberie-carrelage-la-policiere-haut-gradee-faisait-construire-sa-maison-par-ses-agents-au-noir-22195410.php	Plomberie, carrelage… La policière haut gradée faisait construire sa maison par ses agents, au noir - Charente Libre	« On lui a fait la plomberie, l’électricité, le carrelage… Tout, il n’y avait rien dans la maison, que les murs et le placo », dénonce sur France Bleu l’un des contractuels.	https://media.charentelibre.fr/22195410/1200x-1/000-36mb6pf.jpg	2024-11-18 11:00:19	Charente Libre
fr	https://news.google.com/rss/articles/CBMi-gFBVV95cUxNTkZOYlMwMlVnalpOakgyakN5ZjA3SHEwWlphaXNQWHJ4TWU0YkpfMlBCcFRESm1xZzhNU1RSSFNRcXkzSmNSenJuM2t1aHBycTZPdkJuNXpRamxwRi1CcTROTTJBR2xXbTNvMk1uYzA5SHNiTWx2LThDb0daUVN4NW1FVFFNMXI1bzVMNFdoN2tWRjF6YUJqa0lPSm11ZkVFRmRqbWtnZ3dvdF95a3d6QzFTTjNsQzJDZ3lvWDF0NFFtbkIxcDZIV3BXOFo2WHRmSm9DTFVodmRzQURwRWx1U0piVjVDWTdZeHREdXg2ZnE1MmFxWTFZcjJR?oc=5	Marseille : un homme interpellé en flagrant délit de viol sur une jeune femme de 19 ans - Le Parisien	La victime, une jeune femme de 19 ans, a été prise en charge par les secours et conduite à l’hôpital pour des examens médicaux.	None	2024-11-18 08:00:00	Le Parisien
fr	https://www.rfi.fr/fr/moyen-orient/20241117-liban-le-porte-parole-du-hezbollah-tu%C3%A9-dans-une-frappe-isra%C3%A9lienne-%C3%A0-beyrouth	Liban: le porte-parole du Hezbollah tué dans une frappe israélienne à Beyrouth - RFI	Au Liban, le porte-parole du Hezbollah, Mohammad Afif, a été tué dans un raid israélien qui a visé, ce dimanche 17 novembre, le QG du parti Baas, en plein cœur de Beyrouth. Sa mort a été confirmée par…	https://s.rfi.fr/media/display/cc225ae4-a4eb-11ef-8d3d-005056bfb2b6/w:1280/p:16x9/AP24322463530440.jpg	2024-11-17 14:04:31	RFI
fr	https://www.lemonde.fr/culture/article/2024/11/18/charles-dumont-compositeur-de-je-ne-regrette-rien-d-edith-piaf-est-mort_6400099_3246.html	Charles Dumont, compositeur de « Non, je ne regrette rien », d’Edith Piaf, est mort - Le Monde	Chanteur, auteur, compositeur, le musicien avait également collaboré avec Barbra Streisand, Dalida ou Tino Rossi. Il s’est éteint dans la nuit de dimanche à lundi à Paris, à l’âge de 95 ans.	https://img.lemde.fr/2024/11/18/0/0/5512/3675/1440/960/60/0/695305f_5284372-01-06.jpg	2024-11-18 08:42:39	Le Monde
fr	https://www.ouest-france.fr/sport/football/ligue-des-nations/italie-france-la-marseillaise-sifflee-par-les-supporters-italiens-a-san-siro-b46463ce-a573-11ef-b729-1d466315993e	Italie - France. La Marseillaise sifflée à San Siro : « Le monde va mal », déplore Deschamps - Ouest-France	Victorieux de l’Italie lors de la dernière journée de Ligue des nations (1-3) ce dimanche 17 novembre, les Bleus ont néanmoins vu leur hymne être copieusement sifflé par les supporters italiens. Le sélectionneur des Bleus Didier Deschamps s’en est indigné, à l’issue de la rencontre.	https://media.ouest-france.fr/v1/pictures/MjAyNDExY2VkYmMwZDlkY2ZkMTM4MzU2MGY3NTkwNzhiYWY2M2Y?width=1260&height=708&focuspoint=50%2C25&cropresize=1&client_id=bpeditorial&sign=8262543d9abef7c566e3ef37e97416d795ef069f2931fc1581444dcdf481e5a3	2024-11-18 06:37:09	Ouest-France
fr	https://www.corsematin.com/article/societe/3683470099770114/le-cardinal-bustillo-sur-la-venue-du-pape-a-ajaccio-cest-toute-la-corse-et-son-eglise-qui-laccueillent	Le cardinal Bustillo sur la venue du pape à Ajaccio : "C'est toute la Corse et son Église qui l'accueillent" - Corse Matin	Le cardinal Bustillo sur la venue du pape à Ajaccio : "C'est toute la Corse et son Église qui l'accueillent"	https://pictures.corsematin.com/cdn-cgi/image//media/melody/2024/11/17/cardinal-francois-bustillo-messe-pontificale-a-la-basilique-des-saints-apotres-rome-1731839448_a87e463ba9156cc7e463ba915a08e4v_.jpg	2024-11-17 10:30:49	Corse Matin
fr	https://actu.fr/sports/rugby/pro/xv-de-france-ces-discours-de-dupont-et-fickou-a-la-mi-temps-qui-ont-tout-change-face-aux-all-blacks_61876941.html	XV de France. Ces discours de Dupont et Fickou à la mi-temps qui ont tout changé face aux All Blacks - actu.fr	RUGBY. Malmenés pendant le premier acte contre les All Blacks, les Bleus se sont fait secouer dans les vestiaires à la mi-temps par des discours d'Antoine Dupont et de Gaël Fickou.	None	2024-11-18 10:29:36	actu.fr
fr	https://www.frandroid.com/bons-plans/2403838_boulanger-demarre-fort-pour-la-black-friday-week-les-25-bonnes-affaires-a-saisir	Boulanger démarre fort pour la Black Friday Week : les 25 bonnes affaires à saisir - Frandroid	None	None	2024-11-18 06:11:15	Frandroid
fr	https://www.public.fr/une-escort-girl-proche-de-pierre-palmade-fait-des-revelations-sur-leur-relation-plusieurs-fois-par-mois-durant-plusieurs-jours	Une escort girl proche de Pierre Palmade fait des révélations sur leur relation : « Plusieurs fois par mois, durant plusieurs jours - Public	Une escort girl proche de Pierre Palmade a fait des révélations sa relation avec l'humoriste qui a duré plusieurs années.	https://static.public.fr/wp-content/uploads/2024/11/ABACA_842000_004-2.jpg	2024-11-18 06:37:53	Public
fr	https://www.lequipe.fr/Football/Actualites/-je-suis-toujours-l-homme-de-la-situation-domenico-tedesco-selectionneur-de-la-belgique/1521100	« Je suis toujours l'homme de la situation », Domenico Tedesco, sélectionneur de la Belgique - L'Équipe	Le sélectionneur de la Belgique Domenico Tedesco espère sauver sa place après la défaite contre Israël dimanche (0-1).	https://medias.lequipe.fr/img-photo-jpg/domenico-tedesco-est-sous-pression-a-reau-l-equipe/1500000002086106/0:0,2000:1333-640-427-75/e3cc9.jpg	2024-11-18 11:03:07	L'Équipe
