country_code	url	title	description	image_url	publish_date	source
fr	https://www.liberation.fr/societe/vianney-dalancon-lintrigant-entrepreneur-derriere-le-raid-des-milliardaires-sur-lesj-paris-20241125_3U7RERLDLVFQJFILXM4WXX56RY/	Vianney d’Alançon, l’intrigant entrepreneur derrière le raid des milliardaires sur l’ESJ Paris - Libération	L’homme d’affaires a piloté le rachat de l’école de journalisme parisienne par un consortium désireux d’une formation «antiwoke» et écrasé par l’ombre de Vincent Bolloré.	https://www.liberation.fr/resizer/Vy_YdX7SinMKI_Du1dbRlR_eo7Q=/1200x630/filters:format(jpg):quality(70):focal(3350x2360:3360x2370)/cloudfront-eu-central-1.images.arcpublishing.com/liberation/FXW7O2GCUVEFPOO4UQ5ML6EPNA.jpg	2024-11-25 06:02:14	Libération
fr	https://www.lemonde.fr/international/live/2024/11/25/en-direct-guerre-en-ukraine-dix-neuf-blesses-et-plus-de-quarante-maisons-endommages-apres-l-attaque-aerienne-russe-sur-le-centre-de-kharkiv_6411296_3210.html	En direct, guerre en Ukraine : dix-neuf blessés et « plus de quarante maisons » endommagés après l’attaque aérienne russe sur le centre de Kharkiv - Le Monde	L’aviation russe a frappé lundi matin le centre de la deuxième plus grande ville d’Ukraine.	https://img.lemde.fr/2024/11/25/439/0/4412/2206/1440/720/60/0/4e1dec5_2024-11-25t090929z-1690161965-rc26cbaqbfew-rtrmadp-3-ukraine-crisis-attack-kharkiv.JPG	2024-11-25 09:20:22	Le Monde
fr	https://reporterre.net/Fin-de-la-COP29-les-pays-riches-imposent-un-accord-neocolonialiste	Fin de la COP29 : les pays riches imposent un accord « néocolonialiste » - Reporterre	Au bout de la nuit, un accord sur la finance climatique (300 milliards de dollars par an) a été conclu. La somme, près de cinq fois inférieure à celle dont ont besoin les pays du Sud, a provoqué leur colère.	https://reporterre.net/local/cache-gd2/aa/cc9553cd7e8bb0fd27e508966ea07e.jpg?1732443912	2024-11-24 10:25:00	Reporterre
fr	https://www.lemonde.fr/international/article/2024/11/24/avec-des-vents-violents-et-des-fortes-pluies-la-tempete-bert-continue-de-faire-des-degats-en-angleterre-et-au-pays-de-galles_6412491_3210.html	Vents violents et fortes pluies : la tempête Bert continue de faire des dégâts en Angleterre et au Pays de Galles - Le Monde	Une centaine d’alertes aux inondations sont encore en vigueur en Angleterre, en Ecosse et au Pays de Galles, avec des routes fermées à la circulation et des trains annulés.	https://img.lemde.fr/2024/11/24/0/0/7992/5328/1440/960/60/0/840eb48_2024-11-24t130327z-1242141016-rc2mbbamucf1-rtrmadp-3-europe-weather-britain.JPG	2024-11-25 07:05:35	Le Monde
fr	https://www.francetvinfo.fr/faits-divers/une-jeune-passagere-d-une-moto-tuee-lors-d-un-rodeo-urbain-a-bassens_6918203.html	Une jeune passagère d'une moto tuée lors d'un rodéo urbain à Bassens - franceinfo	Deux moto de cross sont entrées en collision dimanche, sur la rive droite de Bordeaux. Au même endroit, un jeune motard de 22 ans avait perdu la vie l'été dernier.	https://www.francetvinfo.fr/pictures/vn-Xx9JGBwYzBwPlaVMsEnOPZVA/0x253:4869x2992/1500x843/2024/11/25/maxstockworld451028-674437023ee6c085602558.jpg	2024-11-25 08:42:50	franceinfo
fr	https://www.lefigaro.fr/actualite-france/decouvrez-en-avant-premiere-le-top-10-des-ecoles-de-commerce-du-classement-2025-du-figaro-20241125	Écoles de commerce : découvrez en avant-première le top 10 du classement 2025 du Figaro - Le Figaro	EXCLUSIF - Voici les 10 meilleures écoles de notre palmarès qui paraîtra le 27 novembre.	https://i.f1g.fr/media/cms/1200x630_crop/2024/11/24/caa809a5a2bffdef4663be60adf5600aa621538c0260b5c567583efbf108f311.jpg	2024-11-25 06:00:00	Le Figaro
fr	https://www.i24news.tv/fr/actu/israel-en-guerre/artc-l-accord-qui-se-profile-pourrait-nuire-a-israel-affirme-un-responsable-politique-libanais-a-i24news	"L'accord qui se profile pourrait nuire à Israël", affirme un responsable politique libanais à i24NEWS - i24NEWS en Français	Les négociations de cessez-le-feu avancent mais la source a mis en garde contre les conséquences possibles pour Israël	https://cdn.i24news.tv/uploads/56/37/ea/3f/95/c6/65/7b/c8/7a/5a/f1/6c/f2/78/8b/5637ea3f95c6657bc87a5af16cf2788b.jpg	2024-11-25 09:20:16	i24NEWS en Français
fr	https://www.eurosport.fr/football/ligue-1/2024-2025/ligue-1-le-scenario-est-catastrophique-et-la-beaujoire-a-enfonce-le-fc-nantes_sto10401744/story.shtml	"Le scenario est catastrophique" : et la Beaujoire a enfoncé Nantes - Eurosport FR	Deux interruptions de match et une défaite : le FC Nantes et son stade de la Beaujoire n'ont pas passé un très bon dimanche après-midi face au Havre (0-2).	https://imgresizer.eurosport.com/unsafe/2400x1260/filters:format(jpeg):focal(1278x759:1280x757)/origin-imgresizer.eurosport.com/2024/11/24/4065525-82448148-2560-1440.jpg	2024-11-24 21:46:00	Eurosport FR
fr	https://www.footmercato.net/a3875167310759651233-nice-strasbourg-diego-moreira-en-a-marre	Nice - Strasbourg : Diego Moreira en a marre - Foot Mercato	En clôture de la 12e journée de Ligue 1, l’OGC Nice devait s’imposer contre le RC Strasbourg à domicile pour revenir dans le haut de tableau du c (...) - Footmercato	https://assets-fr.imgfoot.com/media/cache/1200x675/design-sans-titre-2024-09-29t222722-482.jpg	2024-11-24 22:04:00	Foot Mercato
fr	https://www.90min.com/fr/leganes-real-madrid-0-3-les-notes-du-succes-serieux-des-merengue-24-11-2024	Leganés - Real Madrid (0-3) : Les notes du succès sérieux des Merengue - 90min UK	Le Real Madrid ne manque pas sa reprise à Léganés (0-3). Après une première période plutôt ennuyante, les Merengue ont pris l'avantage grâce à Kylian Mbappé sur	https://images2.minutemediacdn.com/image/upload/c_crop,w_3500,h_1968,x_0,y_118/c_fill,w_1440,ar_16:9,f_auto,q_auto,g_auto/images/GettyImages/mmsport/90min_fr_international_web/01jdfs24tb04efd9b9kh.jpg	2024-11-24 19:24:17	90min UK
fr	https://lepetitlillois.com/2024/11/24/du-positif-et-du-negatif-lucas-chevalier-decrypte-losc-stade-rennais-le-match-piege/	Du positif et du négatif, Lucas Chevalier décrypte LOSC – Stade Rennais : « le match piège » - Le Petit Lillois	Lucas Chevalier a passé un après-midi tranquille ce dimanche, peu inquiété par le Stade Rennais, vaincu chez les Dogues (1-0). Aux premières loges, il se lançait ainsi dans une véritable analyse à notre micro, citant du positif et du négatif. Plus d’une heure après le coup de sifflet final, il fallait bien savourer le show […]	https://lepetitlillois.com/wp-content/uploads/2024/08/Copie-de-Creative-and-Minimal-Portfolio-Presentation-2024-08-11T113544.129-1000x600.png	2024-11-24 19:11:31	Le Petit Lillois
fr	https://www.basketusa.com/news/735941/le-mvp-de-la-nuit-jimmy-butler-cerebral/	Le MVP de la nuit | Jimmy Butler, le cérébral - BasketUSA	NBA - Après la performance de Jimmy Butler face aux Mavericks, Erik Spoelstra a loué son intelligence dans les prises de décision.	https://www.basketusa.com/wp-content/uploads/2024/11/butler-mavs-570x325.jpg	2024-11-25 06:58:34	BasketUSA