country_code	url	title	description	image_url	publish_date	source
fr	https://www.francetvinfo.fr/monde/japon/elections-legislatives-au-japon-le-parti-au-pouvoir-perd-sa-majorite-une-premiere-depuis-2009_6863018.html	Elections législatives au Japon : le parti conservateur au pouvoir perd sa majorité, une première depuis 2009 - franceinfo	Un tel résultat serait quasiment inédit dans l'histoire du Parti libéral-démocrate, qui a réussi à se maintenir au pouvoir pendant la quasi-totalité de ses 69 années d'existence.	https://www.francetvinfo.fr/pictures/IQ78vuPNEQ943gZeQtzfp6qgsxY/0x12:1024x588/1500x843/2024/10/27/053-ar-241027senkyo102-671e27f84925c888972157.jpg	2024-10-27 11:57:38	franceinfo
fr	https://www.lemonde.fr/international/live/2024/10/27/en-direct-guerre-en-ukraine-les-dernieres-informations_6360749_3210.html	En direct, guerre en Ukraine : la Russie et l’Ukraine disent avoir abattu plusieurs dizaines de drones sur leur territoire dans la nuit - Le Monde	Au cours de la nuit de samedi à dimanche, l’armée russe affirme avoir abattu 51 drones ukrainiens sur son territoire. Les Ukrainiens disent avoir détruit 41 des 80 drones lancés par les Russes, « la plupart dans les oblasts d’Odessa et de Kiev ».	https://img.lemde.fr/2024/10/26/633/0/5501/2750/1440/720/60/0/e975371_2024-10-26t091434z-8755772-rc25saambw0v-rtrmadp-3-ukraine-crisis-attack-dnipro.JPG	2024-10-27 11:39:50	Le Monde
fr	https://www.francetvinfo.fr/monde/proche-orient/guerre/direct-guerre-au-proche-orient-la-banlieue-sud-de-beyrouth-visee-par-de-nouveaux-bombardements-israeliens_6862778.html	DIRECT. Guerre au Proche-Orient : le président égyptien propose une trêve de deux jours à Gaza pour échanger quatre otages israéliens contre des prisonniers palestiniens - franceinfo	Cette pause devrait permettre d'ouvrir des négociations en vue d'un cessez-le-feu complet, a-t-il proposé depuis Le Caire.	https://www.francetvinfo.fr/pictures/N3q_KbVY1ZSh39ga0U0bqr1jC2Y/0x309:5949x3656/1500x843/2024/10/27/000-36kr4gx-671e804fd1082340324495.jpg	2024-10-27 18:47:53	franceinfo
fr	https://www.20minutes.fr/societe/4118049-20241027-val-marne-destruction-spectaculaire-trois-tours-habitation-annees-1960	Trois tours d’habitation des années 1960 détruites à Alfortville - 20 Minutes	Trois immeubles, qui dataient des années 1960, ont été détruites par foudroyage, dans le cadre des travaux de réaménagement de la ville d'Alfortville, dans le Val-de-Marne	https://img.20mn.fr/gim-IIGrS8yDFZLcZalwHik/1444x920_a-alfortville-dans-le-val-de-marne-les-trois-immeubles-de-15-a-18-etages-se-sont-effondres-en-quelques-secondes-detruits-par-440-kilos-d-explosifs-le-dimanche-27-octobre-2024	2024-10-27 15:39:00	20 Minutes
fr	https://www.francebleu.fr/infos/meteo/photo-un-pieton-sur-une-passerelle-secteur-de-sommieres-alors-que-le-gard-est-en-vigilance-jaune-7338726	PHOTO - Un piéton sur une passerelle secteur de Sommières alors que le Gard est en vigilance jaune - France Bleu	Des ponts et passerelles fermés par précaution en raison des fortes pluies. C'est le cas à chaque vigilance météo dans le Gard. Et pourtant, des imprudents comme ici dans le secteur de Sommières n'hésitent pas à prendre des risques.	None	2024-10-27 13:56:30	France Bleu
fr	https://www.liberation.fr/politique/emmanuel-macron-pouvait-etre-piste-grace-a-ses-gardes-du-corps-sur-strava-revele-le-monde-20241027_EF3BPJJ4DVC53DX6CRVBAY457U/	Emmanuel Macron pouvait être pisté grâce à ses gardes du corps sur l’application Strava, révèle le «Monde - Libération	En parcourant les données publiques partagées par les agents de sécurité du Président sur le réseau social sportif, les journalistes du «Monde» ont pu suivre à la trace certains déplacements à l’international du Président.	https://www.liberation.fr/resizer/dPR77AbhLK0rgdN5dpaN0hBktPA=/1200x630/filters:format(jpg):quality(70)/cloudfront-eu-central-1.images.arcpublishing.com/liberation/HFOV5VN7HJFDTD3Z7VYJ4BXEP4.jpg	2024-10-27 18:43:47	Libération
fr	https://www.francetvinfo.fr/economie/emploi/recherche-d-emploi/fonction-publique/arrets-maladies-des-fonctionnaires-effarement-et-sideration-de-la-cfdt-qui-juge-les-mesures-du-gouvernement-vieilles-et-inefficaces_6863345.html	Arrêts-maladies des fonctionnaires : "Effarement et sidération" de la CFDT qui juge les mesures du gouvernement "vieilles" et "inefficaces" - franceinfo	L'exécutif veut revoir les règles des arrêts de travail dans la fonction publique pour réaliser 5 milliards d'euros d'économie dans le volet "dépenses" de son projet de loi de finances 2025 examiné à partir de mardi à l'Assemblée.	https://www.francetvinfo.fr/pictures/IzsT_AWIugPlgXtbWU027Gyy_Ig/0x0:3523x1981/1500x843/2024/10/27/mylene-jacquot-671ea350743a7469274865.jpg	2024-10-27 20:34:16	franceinfo
fr	https://news.google.com/rss/articles/CCAiC1hZckV1ZTF6SEVZmAEB?oc=5	"Il va le tuer !" : Maxime a eu plusieurs fractures car il n'avançait pas assez vite - Le Parisien	None	None	2024-10-27 15:30:47	Le Parisien
fr	https://www.lavoixdunord.fr/1517084/article/2024-10-27/un-enfant-grievement-blesse-apres-une-chute-du-4e-etage-son-grand-frere-suspecte	Un enfant grièvement blessé après une chute du 4e étage, son grand frère suspecté de l’avoir poussé - La Voix du Nord	Un enfant de 8 ans est tombé du 4e étage de son immeuble ce dimanche matin et son p...	https://lvdneng.rosselcdn.net/sites/default/files/dpistyles_v2/ena_16_9_extra_big/2024/01/09/node_1517084/61368434/public/2024/01/09/10399594.jpeg?itok=Wme0MhLX1730047643	2024-10-27 16:46:02	La Voix du Nord
fr	https://www.francebleu.fr/infos/societe/proces-des-viols-de-mazan-j-ai-decide-de-rentrer-en-clinique-pour-plusieurs-jours-annonce-la-fille-de-gisele-pelicot-3977918	Procès des viols de Mazan : "J’ai décidé de rentrer en clinique pour plusieurs jours" annonce la fille de Gisèle Pelicot - France Bleu	La fille de Gisèle Pelicot a annoncé sur les réseaux sociaux entrer en clinique ce samedi 26 octobre. Alors que le procès des viols de Mazan est suspendu pour toute la semaine à la cour criminelle de Vaucluse, Caroline Darian dit aussi avoir besoin de prendre une pause.	None	2024-10-27 17:17:45	France Bleu
fr	https://www.lefigaro.fr/politique/rendre-l-entree-a-notre-dame-de-paris-payante-bayrou-pense-que-c-est-une-mauvaise-idee-20241027	Faire payer l’entrée de Notre-Dame de Paris : Bayrou pense que «c’est une mauvaise idée» - Le Figaro	Invité sur BFM, le président du MoDem a affirmé ne pas être favorable à la proposition de la ministre de la Culture, Rachida Dati.	https://i.f1g.fr/media/cms/1200x630_crop/2024/10/27/8eb7c4e15c5ca22fc52559c24febc7b58eaae3c0ae4c837c93758decd42985bf.jpg	2024-10-27 12:37:21	Le Figaro
fr	https://www.leparisien.fr/faits-divers/vosges-un-enfant-de-10-ans-retrouve-mort-par-son-pere-pres-dun-etang-27-10-2024-TPHTA33P7VBQVNUKYOWGEOCWCA.php	Vosges : un père retrouve le corps de son enfant de 10 ans près d’un étang - Le Parisien	Selon le procureur de la République d’Épinal, le père et son fils étaient arrivés la veille sur place pour pêcher et camper. 	https://www.leparisien.fr/resizer/XKO7Lofw4hPorg5H-wFLdnenRfU=/1200x675/cloudfront-eu-central-1.images.arcpublishing.com/leparisien/56OAVNTETZE6PF44RQCHI3EDOA.jpg	2024-10-27 19:16:00	Le Parisien
fr	https://www.bfmtv.com/politique/absence-des-deputes-a-l-assemblee-bayrou-denonce-un-comportement-inadmissible-et-criminel_VN-202410270218.html	Absence des députés à l'Assemblée: Bayrou dénonce un comportement "inadmissible" et "criminel" - BFMTV	VIDÉO - François Bayrou, président du Modem, était l'invité de BFM Politique ce dimanche 27 octobre. 	https://images.bfmtv.com/g2PeE7sUZx9aGY5UkHwGS3TM8k4=/0x0:1280x720/1280x0/images/Absence-des-deputes-a-l-Assemblee-Bayrou-denonce-un-comportement-inadmissible-et-criminel-1964772.jpg	2024-10-27 11:35:46	BFMTV
fr	https://www.francetvinfo.fr/societe/harcelement-sexuel/definition-penale-du-viol-le-garde-des-sceaux-didier-migaud-pret-a-travailler-pour-inscrire-la-notion-de-consentement-dans-le-droit-francais_6863291.html	Définition pénale du viol : le garde des Sceaux Didier Migaud prêt à travailler pour inscrire la notion de consentement dans le droit français - franceinfo	"Oui, je suis favorable à ce que nous puissions travailler à une [nouvelle] rédaction" de la loi, a redit le ministre de la Justice sur BFMTV, un mois après des propos similaires sur France Inter.	https://www.francetvinfo.fr/pictures/w_2S6QyTLL2UgT7WEMSq_nNDykc/0x290:5568x3420/1500x843/2024/10/27/080-hl-stenani-2555515-671e869b1da66976245432.jpg	2024-10-27 18:39:44	franceinfo
fr	https://www.ouest-france.fr/sport/formule-1/f1-le-classement-du-championnat-du-monde-des-constructeurs-apres-le-grand-prix-du-mexique-b0d2289c-94aa-11ef-bba1-911d20d147e0	F1. Le classement du championnat du monde des constructeurs après le Grand Prix du Mexique - Ouest-France	Longtemps en position de s’offrir un nouveau doublé après celui aux États-Unis dimanche dernier, Ferrari profite de la victoire de Carlos Sainz et du podium de Charles Leclerc (3e) pour prendre la deuxième place du championnat du monde des constructeurs après le Grand Prix du Mexique, disputé ce dimanche 27 octobre. L’écurie italienne profite d’une nouvelle course catastrophique de Sergio Perez (15e) pour passer devant Red Bull et revenir à 29 points de McLaren. Retrouvez le classement complet.	https://media.ouest-france.fr/v1/pictures/MjAyNDEwOWExOWVjM2M4ODJmMjE4MmM0MmFhZGNiYWRjMmNkYjc?width=1260&height=708&focuspoint=50%2C25&cropresize=1&client_id=bpeditorial&sign=28da7410eac61d46fd481b978c93906e3fa987d242f94419ae524d102b21808c	2024-10-27 22:01:25	Ouest-France
fr	https://www.bfmtv.com/paris/enlevement-de-santiago-des-proces-verbaux-contradictoires-sur-l-etat-de-sante-du-nourrisson_AN-202410270444.html	Enlèvement de Santiago : des procès-verbaux contradictoires sur l'état de santé du nourrisson - BFM Paris Ile-de-France	Dans les 48 heures suivant l'enlèvement de Santiago, deux procès-verbaux ont été rédigés par les enquêteurs. Consultés par BFMTV, ceux-ci présentent des différences notoires et non négligeables. 	https://images.bfmtv.com/INnnsecSxac-2eId-hsKKplo_e8=/0x40:768x472/768x0/images/La-maternite-de-l-hopital-Robert-Ballanger-le-22-octobre-2024-a-Aulnay-sous-Bois-en-Seine-Saint-Denis-ou-Santiago-un-nourrisson-de-17-jours-a-ete-enleve-par-ses-parents-1963115.jpg	2024-10-27 20:52:24	BFM Paris Ile-de-France
fr	https://la1ere.francetvinfo.fr/martinique/violences-urbaines-en-martinique-palmiers-royaux-coupes-encombrants-et-palettes-entravent-la-circulation-au-francois-1532128.html	Palmiers royaux coupés, encombrants et palettes entravent la circulation au François - Outre-mer la 1ère	Depuis hier (samedi 26 octobre), il est impossible de rejoindre la commune du François depuis Ducos par la RN6. Différents barrages ont été érigés aux alentours du rond-point la Martienne, à l'entrée du bourg. Ce dimanche 27 octobre, la circulation reste très difficile.	https://la1ere.francetvinfo.fr/image/k9Wr638r61rOanefKjkeg4g-O4U/930x620/outremer/2024/10/27/barrage-en-cours-martienne-francois-671e6a6bd4397864899835.png	2024-10-27 18:39:13	Outre-mer la 1ère
fr	https://www.francetvinfo.fr/monde/proche-orient/guerre/reportage-israel-ne-veut-pas-que-nous-puissions-porter-secours-aux-personnes-au-liban-les-ambulances-sont-prises-pour-cibles_6861689.html	"Israël ne veut pas que nous puissions porter secours aux personnes" : au Liban, les ambulances sont prises pour cibles - franceinfo	Les frappes se multiplient contre les secouristes, plus de 150 d'entre eux auraient déjà péri.	https://www.francetvinfo.fr/pictures/Ci6oqI5nvyO6ZPLJFR2kg5QslJE/0x172:3323x2042/1500x843/2024/10/26/ambulance-liban-671d3f6074a08128995838.jpg	2024-10-27 07:38:06	franceinfo
fr	https://www.letelegramme.fr/morbihan/lorient-56100/agression-au-sabre-a-lorient-lhomme-interpelle-a-ete-ecroue-6690973.php	Agression au sabre à Lorient : l’homme interpellé a été écroué - Le Télégramme	Le parquet de Lorient a ouvert une information judiciaire, à la suite de l’agression de policiers par un homme armé d’un sabre, vendredi 25 octobre. L’homme a été mis en examen et placé en détention provisoire.	https://media.letelegramme.fr/api/v1/images/view/671e670fa68ab5348574c2b7/web_golden_xxl/671e670fa68ab5348574c2b7.1	2024-10-27 15:37:27	Le Télégramme
fr	https://rmcsport.bfmtv.com/football/ligue-1/om-psg-les-justifications-de-l-arbitre-sur-le-carton-rouge-polemique-d-amine-harit_AV-202410270483.html	OM-PSG: les justifications de l'arbitre sur le carton rouge polémique d'Amine Harit - RMC Sport	Une fois le coup de sifflet final du Classique entre l'OM et le PSG, l'arbitre de la rencontre François Letexier a justifié, sur DAZN, sa décision d'attribuer un carton rouge à Amine Harit en première période.	https://images.bfmtv.com/6ByIgQkXwfvoQLZN0sHMg8Z0Y1Y=/0x65:2048x1217/images/Le-carton-rouge-inflige-par-Francois-Letexier-a-Amine-Harit-lors-du-Classique-OM-PSG-27-octobre-2024-1965010.jpg	2024-10-27 23:02:08	RMC Sport
fr	https://www.rugbyrama.fr/2024/10/27/top-14-les-notes-de-toulouse-toulon-un-ange-capuozzo-plane-dans-le-ciel-toulousain-marius-domon-se-saborde-12288044.php	Les notes de Toulouse – Toulon : Capuozzo plane, les arrières toulonnais se noient - Rugbyrama	Les Toulousains se sont largement imposés face à Toulon en clôture de la huitième journée de la première division (57-5). Dans la lignée des semaines précédentes, Ange Capuozzo et Juan Cruz Mallia ont été...	https://images.rugbyrama.fr/api/v1/images/view/671eb648bf0cbe258d1cffa9/large/image.jpg?v=5	2024-10-27 21:04:00	Rugbyrama
fr	https://www.lavoixdunord.fr/1516975/article/2024-10-27/un-francais-accuse-de-viols-sur-mineurs-extrade-du-chili-ou-il-avait-fui-l	Un Français accusé de viols sur mineurs extradé du Chili, où il avait fui l’an dernier pour refaire sa vie - La Voix du Nord	Un Franc-Comtois de 52 ans a été mis en examen pour une série d’actes pédophile...	https://lvdneng.rosselcdn.net/sites/default/files/dpistyles_v2/ena_16_9_extra_big/2024/10/27/node_1516975/61362424/public/2024/10/27/28455300.jpeg?itok=sqHHL0OP1730016008	2024-10-27 07:49:57	La Voix du Nord
fr	https://le10sport.com/football/ballon-dor-coup-de-theatre-pour-mbappe-718717	Ballon d'Or : Coup de théâtre pour Mbappé ? - Le10sport	Ce lundi soir, le Ballon d&#039;Or 2024 sera décerné au théâtre du Châtelet de Paris. Si Vinicius Jr, Jude Bellingham et Rodri sont les favoris pour recevoir ce prix individuel, Kylian Mbappé n&#039;est pas totalement hors course. En effet, l&#039;ancien attaquant du PSG -…	https://le10static.com/img/master/ICONSPORT_227934_0466_849a316fd0/ICONSPORT_227934_0466_849a316fd0.jpg	2024-10-27 22:00:57	Le10sport
fr	https://www.lequipe.fr/Tennis/Actualites/Giovanni-mpetshi-perricard-sacre-a-bale-il-y-aura-encore-des-hauts-et-des-bas/1516712	Giovanni Mpetshi Perricard, sacré à Bâle : « La manière dont on s'est entraîné a marché » (Tennis) - L'Équipe	Malgré son titre à l'ATP 500 de Bâle ce dimanche, Giovanni Mpetshi Perricard reste calme et mesuré, conscient que le chemin est encore long.	https://medias.lequipe.fr/img-photo-jpg/giovanni-mpetshi-perricard-sacre-a-bale-pierre-albouy-reuters/1500000002074426/0:0,1963:1308-640-427-75/1113a.jpg	2024-10-27 19:06:13	L'Équipe
fr	https://www.bfmtv.com/police-justice/ligne-rouge-sophie-marceau-rare-actrice-a-avoir-eleve-la-voix-contre-gerard-depardieu-il-y-a-40-ans_VN-202410270454.html	LIGNE ROUGE - Sophie Marceau, rare actrice à avoir élevé la voix contre Gérard Depardieu il y a 40 ans - BFMTV	VIDÉO - Gérard Depardieu sera jugé pour agressions sexuelles ce lundi 28 octobre à Paris. Le premier procès en France d'une personnalité de premier plan depuis la déferlante Me too en 2017. Gérard Depardieu est accusé par deux femmes pour des faits qui se seraient déroulés sur le tournage du film Les Volets...	https://images.bfmtv.com/KK1--BiPillxWu7ea0gjnN8uuS4=/0x0:1280x720/1280x0/images/LIGNE-ROUGE-Sophie-Marceau-rare-actrice-a-avoir-eleve-la-voix-contre-Gerard-Depardieu-il-y-a-40-ans-1964977.jpg	2024-10-27 21:11:01	BFMTV
fr	https://lepetitlillois.com/2024/10/27/jose-fonte-adam-ounas-jonathan-bamba-les-anciens-du-losc-nont-pas-manque-le-derby-du-nord/	José Fonte, Adam Ounas, Jonathan Bamba... Les anciens du LOSC n'ont pas manqué le Derby du Nord - Le Petit Lillois	Eternellement liés au LOSC, qui vient de s’offrir le scalp du RC Lens (0-2) au Stade Bollaert-Delelis, les anciens Dogues ne pouvaient manquer le Derby du Nord. Ils étaient nombreux devant la petite lucarne. « J’ai vécu une très bonne saison à Lille. Je me suis senti très bien, comme un membre d’une famille. L’esprit de […]	https://lepetitlillois.com/wp-content/uploads/2024/10/Copie-de-Creative-and-Minimal-Portfolio-Presentation-2024-10-27T174440.345-1000x600.png	2024-10-27 17:16:07	Le Petit Lillois
fr	https://actu.fr/sports/rugby/pro/top-14-colere-d-urios-tweet-d-o-connor-reaction-de-pats-ca-s-agite-a-clermont-apres-la-defaite-a-paris_61791693.html	Top 14. Colère d'Urios, tweet d'O'Connor, réaction de Pats... Ca s'agite à Clermont après la défaite à Paris - actu.fr	None	None	2024-10-27 15:12:13	actu.fr
fr	https://www.lemonde.fr/international/live/2024/10/27/en-direct-guerre-au-proche-orient-l-iran-promet-une-reponse-appropriee-apres-la-riposte-d-israel-l-egypte-propose-un-cessez-le-feu-de-deux-jours-a-gaza_6355666_3210.html	En direct, guerre au Proche-Orient : l’Iran promet une « réponse appropriée » après la riposte d’Israël ; l’Égypte propose un cessez-le-feu de deux jours à Gaza - Le Monde	Le Guide suprême iranien, Ali Khamenei, a notamment affirmé que l’attaque d’Israël « ne doit être ni exagérée ni minimisée », sans appeler à des représailles. La diplomatie iranienne a demandé au Conseil de sécurité de l’ONU de condamner les frappes israéliennes.	https://img.lemde.fr/2024/10/27/439/0/5272/2636/1440/720/60/0/97454ae_5083816-01-06.jpg	2024-10-27 22:06:58	Le Monde
fr	https://actu.fr/occitanie/toulouse_31555/spectacle-de-la-machine-a-toulouse-record-de-frequentation-ce-week-end-pour-l-opera-urbain_61792210.html	Spectacle de La Machine à Toulouse. Record de fréquentation ce week-end pour l'Opéra Urbain - Le Journal du Pays Yonnais	None	None	2024-10-27 21:29:34	Le Journal du Pays Yonnais
fr	https://www.midilibre.fr/2024/10/27/un-homme-tombe-dans-le-tarn-en-traversant-une-passerelle-en-partie-submergee-a-millau-les-pompiers-mobilises-pour-la-retrouver-12287754.php	Bravant l'interdiction d'accès sur une passerelle, une homme tombe dans le Tarn : emporté par les eaux, il est toujours porté disparu - Midi Libre	Un homme a chuté dans le Tarn ce dimanche en fin de matinée en traversant la passerelle du Saoutadou en partie submergée à Millau. Les pompiers ont déployé un dispositif pour le retrouver. 	https://images.midilibre.fr/api/v1/images/view/671e6d69eb987934485c2b39/large/image.jpg?v=5	2024-10-27 16:48:00	Midi Libre
fr	https://www.ouest-france.fr/meteo/tempete/sinistree-de-ciaran-et-lachee-par-son-assurance-elle-raconte-cetait-trop-cher-et-trop-risque-1ecaea06-9437-11ef-8d50-f75a8f5479a6	Sinistrée de Ciaran et lâchée par son assurance, elle raconte : « C’était trop cher et trop risqué » - Ouest-France	Dans la nuit du 1er au 2 novembre 2023, cette habitante de Châteaulin (Finistère) avait entendu le toit de sa maison s’envoler au passage de la tempête Ciaran. Un an après, elle ne dort pas les soirs de grand vent, la bâche temporaire prend l’eau et son assurance a résilié leur contrat. Témoignage.	https://media.ouest-france.fr/v1/pictures/MjAyNDEwZDVkOTg3ODg4NzRmNTZiM2U4NTgwOGJjYjhlN2RkOGI?width=1260&height=708&focuspoint=50%2C25&cropresize=1&client_id=bpeditorial&sign=f42331a8a1815fb77c4bbb4bf85d4509f0f0b93917e930de9b94ac7932a3d465	2024-10-27 10:48:30	Ouest-France
fr	https://www.lefigaro.fr/international/new-york-le-meeting-de-trump-au-madison-square-garden-fait-polemique-20241028	Insultes, racisme, crucifix... : le meeting de Trump à New York fait polémique - Le Figaro	Donald Trump s’est notamment attaqué à la communauté portoricaine lors de son meeting au Madison Square Garden dimanche, suscitant l’indignation sur les réseaux sociaux. Ses propos ont notamment fait réagir les artistes portoricains comme Ricky Martin et Bad Bunny.	https://i.f1g.fr/media/cms/1200x630_crop/2024/10/28/fb26850b1d1075c79000b1b70f0ad17420d658f2e90bf34bd6b74e6b80f6ad59.jpg	2024-10-28 02:04:39	Le Figaro
fr	https://www.ouest-france.fr/economie/budget-collectivites-etat/budget-2025-les-deputes-ne-parviennent-pas-au-terme-de-lexamen-de-la-partie-recettes-d42b5700-93fb-11ef-8d50-f75a8f5479a6	Budget 2025 : les députés ne parviennent pas au terme de l’examen de la partie recettes - Ouest-France	L’examen de la partie recettes du projet de loi de finances pour 2025 n’est pas arrivé à son terme lors de la clôture de la séance à l’Assemblée nationale samedi 26 octobre, à minuit. Les débats pourraient reprendre le 5 novembre prochain, une utilisation de l’article 49.3 de la Constitution n’est pas à écarter.	https://media.ouest-france.fr/v1/pictures/MjAyNDEwYWRmOWFjYmFhN2VhMDRhNjNkODE5NmJlY2E2NzE4MTc?width=1260&height=708&focuspoint=50%2C25&cropresize=1&client_id=bpeditorial&sign=32e305e444c0b32de1fc7027c00892c8e48ac2239fbf9e312adc271e0e6846be	2024-10-27 00:54:06	Ouest-France
fr	https://www.cnews.fr/monde/2024-10-27/georgie-la-presidente-denonce-une-falsification-totale-des-elections-legislatives?__cf_chl_rt_tk=BTNkttvIwcHuJykQXHm.wUrWlTtMDm42sMhS9V1_z1A-1730088032-1.0.1.1-zjHekhlovub3aoi.ExzUvJChP4E0Ts.FtusfALaS9aU	Géorgie : la présidente dénonce une «falsification totale» des élections législatives et appelle les Géorgiens à manifester - CNEWS	None	None	2024-10-27 20:02:42	CNEWS
fr	https://www.huffingtonpost.fr/france/article/dans-le-var-a-le-muy-un-pont-plie-par-la-pluie-des-centaines-de-vacanciers-bloques-dans-leur-residence_241436.html	Météo : Dans le Var, à Le Muy, un pont « plié » par la pluie bloque des centaines de vacanciers - Le HuffPost	Près de 700 vacanciers d’un domaine sont coupés du monde au Muy. Une personne est morte.	https://focus.huffingtonpost.fr/2024/10/27/18/0/763/429/1820/1023/75/0/2364f6a_1730048745566-capture-da-a-cran-2024-10-27-180510.jpg	2024-10-27 18:01:57	Le HuffPost
fr	https://news.google.com/rss/articles/CBMi5gFBVV95cUxPcHNiYlp3R1pvQWFlTTNDcC1GS3NIRUpBYnFtaHVLTkFGNWd1dTA3VHhzY2NXVzBfN21iR1VqbEFRX1lPYTNKTE53U01iaEtyNkpZTmVPRWF2TUVjZWlCbnYtUFZPQjYxSlBPNG9BT3Z3dFluQkpodGYtcWFMV3FBTklNZEhtd01LbnFiMmdGSHM1UFVVdExvQW5Xem15VEpvRDRJTW1EQUdYWTlqVHhOdFotem8wdFpQZ2s2NHRlSHFoM3N0Mk9Jd0s1Yzg4b2VzREZsSWZZNTFMdUpXZi1DZDIxMW5yZw?oc=5	Fusillade à Rennes et enfant blessé par balles sur fond de trafic de stupéfiants : où en est-on - Le Télégramme	None	None	2024-10-27 18:23:15	Le Télégramme
fr	https://france3-regions.francetvinfo.fr/provence-alpes-cote-d-azur/var/pluie-inondation-un-pere-de-famille-meurt-en-tentant-de-proteger-son-logement-dans-le-var-3051640.html	Pluie-inondation : un père de famille meurt en tentant de protéger son logement dans le Var - France 3 Régions	Les inondations qui ont touché le sud-est de la France ont fait une première victime. Un jeune père de famille est décédé des suites d'une crise cardiaque dans la soirée du samedi 28 octobre après avoir voulu protéger son...	https://france3-regions.francetvinfo.fr/image/AXDkuTJaN0KuPD9LxZ8knaEOTzY/930x620/regions/2024/10/27/telechargement-671e58166bfdb090047807.png	2024-10-27 15:19:13	France 3 Régions
fr	https://www.huffingtonpost.fr/international/video/donald-trump-invite-des-leaders-musulman-sur-scene-pour-son-meeting-dans-le-michigan_241431.html	Donald Trump invite des leaders musulman sur scène pour son meeting dans le Michigan - Le HuffPost	En meeting dans l’état clé du Michigan, le républicain a laissé la parole à l’imam Belal Alzuhairi qui a décrit Donald Trump comme le candidat de « la paix ».	None	2024-10-27 15:14:30	Le HuffPost
fr	https://www.tf1info.fr/politique/emmanuel-macron-au-maroc-le-programme-de-sa-visite-d-etat-pour-acter-la-reconciliation-entre-les-deux-pays-avec-le-roi-mohammed-vi-2330787.html	Emmanuel Macron au Maroc : le programme d'une visite d'État pour acter la réconciliation entre les deux pays - TF1 INFO	[VIDÉO] Invité par le roi Mohammed VI, Emmanuel Macron effectue une visite d'État au Maroc du 28 au 30 octobre. L'objectif : montrer que les deux pays sont alliés, malgré les diverses crises diplomatiques de ces dernières années. Les discussions devraient se concentrer autour de l'immigration et du Sahara occidental. - Emmanuel Macron au Maroc : le programme d'une visite d'État pour acter la réconciliation entre les deux pays (Politique) - TF1 INFO	https://photos.tf1info.fr/images/1280/720/emmanuel-macron-mohammed-vi-2018-4c8fdb-0@1x.jpeg?overlayImage=bG9nby10ZjFpbmZvLWRlZmF1bHQucG5n&overlayWidth=18&overlayGravity=northwest&s=78c802	2024-10-27 17:46:08	TF1 INFO
fr	https://www.huffingtonpost.fr/politique/article/sur-le-budget-le-rn-adresse-un-carton-rouge-a-barnier-et-le-menace-de-censure_241432.html	Le RN met un « carton rouge » au gouvernement sur le budget, et le menace de censure - Le HuffPost	Les dirigeants du parti lepéniste critiquent Michel Barnier, son budget et sa méthode. Jean-Philippe Tanguy parle même d’une « personnalité machiavélique. »	https://focus.huffingtonpost.fr/2022/07/23/27/0/3374/1897/1820/1023/75/0/f2a9387_1658616765519-5edd15092500007128eb2e43.jpeg	2024-10-27 15:34:47	Le HuffPost
