country_code	url	title	description	image_url	publish_date	source
fr	https://www.ouest-france.fr/meteo/inondation/disparu-dans-les-inondations-en-espagne-un-couple-de-retraites-retrouve-mort-dans-sa-voiture-b7f3688c-9b64-11ef-ab03-7ebf2cc7148e	Disparu dans les inondations en Espagne, un couple de retraités retrouvé mort dans sa voiture - Ouest-France	Deux retraités britanniques ont été retrouvés morts samedi 2 novembre près de Valence (Espagne). Les deux septuagénaires, qui étaient portés disparus, ont été découverts dans leur voiture, emportée par les eaux.	https://media.ouest-france.fr/v1/pictures/MjAyNDExNDNiMDUxN2IzMWZjNGRhMDA4NTUzYTg0NWI0MzA5ZjM?width=1260&height=708&focuspoint=50%2C29&cropresize=1&client_id=bpeditorial&sign=cacea794577b6dc2961f290ef6bceb1fa5a4074c82d10baf4024d7cdc92fb8ca	2024-11-05 11:39:22	Ouest-France
fr	https://www.huffingtonpost.fr/france/article/auchan-annonce-un-plan-social-d-ampleur-voici-la-liste-des-supermarches-qui-vont-fermer-leurs-portes_241806.html	Auchan annonce un plan social d’ampleur, voici la liste des supermarchés qui vont fermer leurs portes - Le HuffPost	Le groupe prévoit la fermeture d’une dizaine de points de vente non rentables, dont trois hypermarchés.	https://focus.huffingtonpost.fr/2024/05/01/0/0/5204/2927/1820/1023/75/0/66e7418_1714566653885-000-34p692a.jpg	2024-11-05 11:13:53	Le HuffPost
fr	https://www.tf1info.fr/justice-faits-divers/en-direct-proces-de-l-assassinat-de-samuel-paty-par-un-terroriste-la-personnalite-des-accuses-au-coeur-des-debats-les-dernieres-informations-2332283.html	EN DIRECT - Procès de l'assassinat de Samuel Paty : l'audience reprend en présence d'un accusé qui vient de "se blesser" - TF1 INFO	None	None	2024-11-05 14:58:06	TF1 INFO
fr	https://rmcsport.bfmtv.com/auto-moto/f1/f1-gp-du-bresil-ce-parieur-passe-une-cote-hallucinante-a-160-000-grace-au-double-podium-des-alpine_AV-202411050540.html	F1, GP du Brésil: ce parieur passe une cote hallucinante de 160.000 grâce au double podium des Alpine - RMC Sport	Un parieur français de 33 ans avait misé sur le double podium de Pierre Gasly et Esteban Ocon au Grand Prix de F1 du Brésil, avant même les qualifications. Une tentative folle, pour une cote à six chiffres, qui a rencontré le succès au terme d'un GP complètement dingue.	None	2024-11-05 12:03:40	RMC Sport
fr	https://www.sudouest.fr/gironde/camiran/un-motard-flashe-a-225-km-h-sur-une-route-limitee-a-80-km-h-en-gironde-22034298.php	Un motard flashé à 225 km/h sur une route limitée à 80 km/h en Gironde - Sud Ouest	Le 1er novembre, les gendarmes de la brigade motorisée de La Réole ont intercepté un motard en grand excès de vitesse sur une route départementale à Camiran, dans le Sud-Gironde	https://media.sudouest.fr/22034298/1200x-1/0.jpg	2024-11-05 08:54:42	Sud Ouest
fr	https://www.lefigaro.fr/international/traitre-qui-a-vendu-son-ame-a-la-france-ou-genie-de-la-litterature-le-goncourt-kamel-daoud-divise-l-algerie-20241105	«Traître qui a vendu son âme à la France» ou «génie de la littérature» : le Goncourt Kamel Daoud divise l’Algérie - Le Figaro	Couronné par le prestigieux prix littéraire, l’auteur franco-algérien suscite agacement et jalousie en Algérie, où ses partisans subissent les intimidations des autorités qui ont interdit à son éditeur, Gallimard, de participer au Salon international du livre d'Alger.	https://i.f1g.fr/media/cms/1200x630_crop/2024/11/05/9b829a3ed50f60fcfec3be59c8ae0998ee8ec88e5af37a8e786a62201d24f8e9.jpg	2024-11-05 10:53:34	Le Figaro
fr	https://www.francetvinfo.fr/societe/familles-royales/la-reine-camilla-annule-ses-engagements-en-raison-d-une-infection-pulmonaire_6879461.html	La reine Camilla annule ses apparitions publiques en raison d'une infection pulmonaire - franceinfo	L'épouse du roi d'Angleterre Charles III, âgée de 77 ans, va observer "une courte période de repos", a expliqué un porte-parole du palais de Buckingham.	https://www.francetvinfo.fr/pictures/BJuUycpWBlu43FfoC4l5AygVDsY/0x2:1024x578/1500x843/2024/11/05/000-36kh9mm-672a34cb3faf8504005916.jpg	2024-11-05 15:18:25	franceinfo
fr	https://www.liberation.fr/economie/economie-numerique/netflix-france-perquisition-en-cours-pour-blanchiment-de-fraude-fiscale-et-travail-dissimule-20241105_XSMLD56OVND3RJROGEZ7XI7Y4I/	Netflix France : perquisition pour blanchiment de fraude fiscale et travail dissimulé - Libération	Les locaux de la filiale française du géant du streaming ont été perquisitionnés ce mardi 5 novembre par des agents de l’Office central de lutte contre la corruption et du Parquet national financier.	https://www.liberation.fr/resizer/eHaKQl53zdw6gEsGFJkUaH2HcCQ=/1200x630/filters:format(jpg):quality(70):focal(2081x1530:2091x1540)/cloudfront-eu-central-1.images.arcpublishing.com/liberation/TVAZJ3KZUZEOHIAOEFRCH3MUCU.jpg	2024-11-05 11:02:52	Libération
fr	https://www.francebleu.fr/infos/societe/deviation-de-beynac-le-prefet-de-la-dordogne-signe-l-arrete-pour-autoriser-le-deuxieme-projet-6562300	Déviation de Beynac : le préfet de la Dordogne signe l'arrêté pour autoriser le deuxième projet - France Bleu	Le préfet de la Dordogne a rendu ce mardi 5 novembre une décision "attendue et difficile" dans le projet de déviation de Beynac. Jean-Sébastien Lamontagne a signé un arrêté pour autoriser le deuxième projet porté par le Conseil Départemental. 	https://www.francebleu.fr/s3/cruiser-production-eu3/2024/11/3b8e2f5a-8d94-4c65-819b-53b0fb9246c4/1200x680_sc_813156-m5gx9r6cub-whr.jpg	2024-11-05 13:44:57	France Bleu
fr	https://www.lemonde.fr/international/live/2024/11/05/en-direct-guerre-au-proche-orient-benyamin-netanyahou-limoge-le-ministre-de-la-defense-yoav-gallant-et-nomme-israel-katz-a-sa-place_6376613_3210.html?_staled_	En direct, guerre au Proche-Orient : nouveaux bombardements israéliens dans la bande de Gaza, au moins 29 morts - Le Monde	« La confiance » en Yoav Gallant s’est « érodée » durant la guerre à Gaza, a affirmé le premier ministre israélien dans une lettre adressée à l’ancien ministre de la défense.	https://img.lemde.fr/2024/10/13/365/0/4788/2394/1440/720/60/0/87bfeb7_2024-10-13t143137z-311521727-rc2pjaaxfqpg-rtrmadp-3-israel-iran-diplomacy.JPG	2024-11-05 13:01:08	Le Monde
fr	https://www.lequipe.fr/Tennis-de-table/Actualites/Alexis-lebrun-qualifie-pour-les-finales-du-circuit-wtt/1518360	Tennis de table : Alexis Lebrun qualifié pour les finales du circuit WTT - L'Équipe	Malgré sa défaite au premier tour du tournoi de Francfort, Alexis Lebrun a décroché son ticket en simple pour les finales du circuit WTT, où il rejoint son frère Félix.	https://medias.lequipe.fr/img-photo-jpg/alexis-lebrun-rejoint-son-frere-cadet-felix-dans-le-tournoi-final-du-circuit-mondial-e-garnier-l-equ/1500000002078902/0:0,1995:1330-640-427-75/3f4e4.jpg	2024-11-05 10:19:43	L'Équipe
fr	https://www.bfmtv.com/international/moyen-orient/israel/israel-netanyahu-limoge-son-ministre-de-la-defense-yoav-gallant_AD-202411050860.html	Israël: Netanyahu limoge son ministre de la Défense Yoav Gallant - BFMTV	Le Premier ministre israëlien Benjamin Netanyahu a placé, ce mardi 5 novembre, Israël Katz à la tête du ministère de la Défense.  	None	2024-11-05 18:19:03	BFMTV
fr	https://actu.fr/pays-de-la-loire/saint-andre-des-eaux_44151/inondations-etat-de-catastrophe-naturelle-reconnue-pour-quatre-communes-de-loire-atlantique_61825383.html	Inondations : état de catastrophe naturelle reconnue pour quatre communes de Loire-Atlantique - Le Journal du Pays Yonnais	None	None	2024-11-05 15:30:59	Le Journal du Pays Yonnais
fr	https://fr.euronews.com/my-europe/2024/11/05/les-troupes-nord-coreennes-en-russie-sont-bombardees-par-les-forces-ukrainiennes-selon-kie	Les troupes nord-coréennes en Russie sont bombardées par les forces ukrainiennes, selon Kiev - Euronews	Les troupes nord-coréennes récemment déployées pour aider la Russie dans sa guerre avec l'Ukraine ont essuyé des tirs ukrainiens, a déclaré mardi un responsable de Kyiv. #EuropeNews	https://static.euronews.com/articles/stories/08/83/23/96/1200x675_cmsv2_27d2b19c-c064-584a-b267-39d61ff666fb-8832396.jpg	2024-11-05 11:55:00	Euronews
fr	https://www.lemonde.fr/societe/article/2024/11/05/dans-l-enseignement-la-perspective-de-trois-jours-de-carence-en-cas-d-arret-maladie-ne-passe-pas_6376691_3224.html	Dans l’enseignement, la perspective de trois jours de carence en cas d’arrêt maladie ne passe pas - Le Monde	Alors que les professeurs sont moins souvent absents que la moyenne des fonctionnaires et des salariés du privé, le projet soutenu par le ministre de la fonction publique, Guillaume Kasbarian, leur paraît injuste. Et dangereux, pour un métier dont l’attractivité est déjà en berne.	https://img.lemde.fr/2024/11/04/0/0/5568/3712/1440/960/60/0/93cbb42_1730738420540-000-1rf09e.jpg	2024-11-05 05:15:00	Le Monde
fr	https://rmcsport.bfmtv.com/football/ligue-des-champions/direct-lille-juventus-suivez-en-live-le-match-de-la-quatrieme-journee-de-ligue-des-champions_LS-202411050630.html	DIRECT. Lille-Juventus: suivez en live le match de la quatrième journée de Ligue des champions - RMC Sport	Encore un duel de prestige pour le Losc avec la réception ce mardi de la Juventus lors de la quatrième journée de Ligue des champions. Face au Turin de Thiago Motta, le club nordiste voudra signer une troisième victoire d'affilée contre un cador continental. Battus d'entrée sur la scène européenne par le Sporting, les Lillois se sont ensuite parfaitement relancés en dominant le Real Madrid et l'Atlético. Un nouveau succès ce mardi contre les Bianconeri confirmerait la capacité de Bruno Genesio à battre les gros. Surtout, une belle performance contre les Turinois permettrait aux Dogues de croire de plus en plus clairement à une qualification. Le choc Lille-Juventus est à suivre dès 21h en direct commenté sur le site et l'application RMC Sport.	https://images.bfmtv.com/17b06JgJBH59u9dW-qRVUd5h3_Y=/0x24:2048x1176/images/Les-Lillois-Jonathan-David-et-Angel-Gomes-celebrent-un-but-en-Ligue-des-champions-le-23-octobre-2024-1970487.jpg	2024-11-05 18:52:12	RMC Sport
fr	https://www.francebleu.fr/infos/politique/plans-sociaux-michel-barnier-veut-savoir-ce-qu-auchan-et-michelin-ont-fait-de-l-argent-public-qu-on-leur-a-donne-5806662	Plans sociaux : Michel Barnier veut "savoir" ce qu'Auchan et Michelin ont fait "de l'argent public qu'on leur a donné" - France Bleu	None	None	2024-11-05 15:56:39	France Bleu
fr	https://www.footmercato.net/a1864902080664271332-le-stade-rennais-avance-sur-la-piste-sergio-conceicao	Le Stade Rennais avance sur la piste Sérgio Conceição - Foot Mercato	Le Stade Rennais avance sur le remplacement de Julien Stephan. Selon nos informations, Sérgio Conceição est une piste très sérieuse pour les Bret (...) - Footmercato	https://assets-fr.imgfoot.com/media/cache/1200x675/conceicao.jpg	2024-11-05 12:28:40	Foot Mercato
fr	https://www.lemonde.fr/afrique/article/2024/11/05/une-fuite-de-sextapes-sur-les-reseaux-sociaux-agite-la-guinee-equatoriale_6376905_3212.html	Une fuite de « sextapes » sur les réseaux sociaux agite la Guinée équatoriale - Le Monde	Plusieurs centaines de vidéos pornographiques impliquant un haut fonctionnaire et des femmes de dignitaires ont été diffusées sur les réseaux sociaux. Pour freiner leur propagation, le gouvernement a fortement réduit la performance du réseau Internet.	https://img.lemde.fr/2024/11/05/0/3/1203/802/1440/960/60/0/e162624_1730795322101-baltasar-ebang.png	2024-11-05 08:38:42	Le Monde
fr	https://www.welovetennis.fr/atp/atp-finals/djokovic-annonce-deux-mauvaises-nouvelles-javais-hate-de-jouer-le-masters-a-turin-mais-en-raison-de-ma-blessure-je-ne-jouerai-pas-la-semaine-prochaine	ATP - Finals > Djokovic annonce deux mauvaises nouvelles : "J'avais hâte de jouer le Masters à Turin, mais en raison de ma blessure, je ne jouerai pas la semaine prochaine" - We Love Tennis !	Ce qui devait arriver arriva. Novak Djokovic a bel et bien déclaré forfait pour le Masters, qui se dérou­lera à Turin du 12 au 19 novembre. Alors que les obser­va­teurs pensaient que le Serbe n’avait pas l’in­ten­tion de se rendre en Italie, il a expliqué avoir contracté une bles­sure, peut‐être lors de son exhi­bi­tion en […]	https://www.welovetennis.fr/wp-content/uploads/2024/08/Djokovic-904.jpg	2024-11-05 11:25:18	We Love Tennis !
fr	https://www.lemonde.fr/livres/article/2024/11/05/prix-femina-2024-miguel-bonnefoy-sacre-pour-le-reve-du-jaguar_6377343_3260.html	Prix Femina 2024 : Miguel Bonnefoy sacré pour « Le Rêve du jaguar » - Le Monde	Miguel Bonnefoy a exprimé sa joie au Musée Carnavalet-Histoire de Paris, soulignant l’importance de ce prix qu’il espérait depuis dix ans.	https://img.lemde.fr/2024/11/05/0/0/5625/3750/1440/960/60/0/7a58b9f_5167979-01-06.jpg	2024-11-05 13:36:48	Le Monde
fr	https://rmcsport.bfmtv.com/tennis/atp/tennis-le-message-d-excuses-d-ugo-humbert-critique-par-khachanov-pour-son-attitude_AV-202411050749.html	Tennis: le message d'excuses d'Ugo Humbert, critiqué par Khachanov pour son attitude - RMC Sport	Critiqué par Karen Khachanov à l'issue de sa victoire en demi-finale au Masters 1000 de Paris, Ugo Humbert a "contacté personnellement" le Russe pour s'excuser et assure avoir retenu la leçon.	https://images.bfmtv.com/CBLfv_ZzX-7NEoTBIzv4ec8wN84=/0x0:2048x1152/images/Ugo-Humbert-et-Karen-Khachanov-lors-du-Masters-1000-de-Paris-en-novembre-2024-1970578.jpg	2024-11-05 16:56:05	RMC Sport
fr	https://www.tf1.fr/tf1/plus-belle-la-vie/videos/plus-belle-la-vie-encore-plus-belle-du-mardi-5-novembre-2024-episode-206-85925137.html	Plus belle la vie, encore plus belle du mardi 5 novembre 2024 - Episode 206 - TF1+	L’enquête de nos policiers prend un tout autre tournant. De son côté, Blanche fait une nouvelle proposition à Ophélie. Alors que Gabriel continue de clamer son innocence, Thomas ne peut s’empêcher de douter de lui.. Retrouvez "Plus belle la vie, encore plus belle", du lundi au vendredi sur TF1. Retrouvez tous les épisodes, extraits et bonus tous les jours sur TF1+.	https://photos.tf1.fr/1200/720/vignette-16-9_pblv-23-off-1b13fa-726406-0@1x.jpg	2024-11-05 13:01:22	TF1+
fr	https://www.tf1info.fr/election-presidentielle-americaine/election-presidentielle-americaine-2024-un-engouement-en-berne-dans-les-derniers-meetings-de-donald-trump-2332417.html	Présidentielle américaine : un engouement en berne dans les derniers meetings de Donald Trump ? - TF1 INFO	None	None	2024-11-05 12:59:10	TF1 INFO
fr	https://www.onzemondial.com/ligue-1/ol-asse-un-arbitre-critique-designe-pour-le-derby-924417	OL – ASSE : un arbitre critiqué désigné pour le derby - Onze Mondial	None	None	2024-11-05 11:20:00	Onze Mondial
fr	https://rmcsport.bfmtv.com/football/ligue-des-champions/direct-ligue-des-champions-suivez-real-milan-et-le-multiplex-du-mardi-de-la-quatrieme-journee-en-live_LS-202411050646.html	DIRECT. Ligue des champions: Real-Milan, Liverpool, Manchester City, PSV... Suivez le multiplex en live - RMC Sport	Auteur d'un sans-faute en Ligue des champions, Liverpool accueille ce mardi le Bayer Leverkusen lors de la quatrième journée. L'occasion de belles retrouvailles entre Xabi Alonso, entraîneur du club allemand, et le public anglais à Anfield. Mais le choc de la soirée verra s'affronter le Real Madrid de Kylian Mbappé et l'AC Milan de Mike Maignan. Parmi les autres rencontres à suivre en direct, à noter l'alléchant duel entre le Sporting de Ruben Amorim et Manchester City, justement avant le départ du technicien à Manchester United. Le multiplex de la quatrième journée de Ligue des champions, c'est à suivre en direct commenté sur le site et l'application RMC Sport.	https://images.bfmtv.com/XXXzIuKDDhWH5cx7vruOvw5wS94=/160x2:1888x974/images/Kylian-Mbappe-et-Jude-Bellingham-celebrent-un-but-du-Real-Madrid-septembre-2024-1961475.jpg	2024-11-05 19:17:45	RMC Sport
fr	https://www.lemonde.fr/international/live/2024/11/05/en-direct-suivez-tout-au-long-de-la-nuit-les-resultats-de-l-election-presidentielle-americaine_6376692_3210.html	En direct : suivez tout au long de la nuit les résultats de l’élection présidentielle américaine - Le Monde	La plupart des bureaux de vote ont ouvert alors que plus de 82 millions de personnes ont déjà voté par anticipation dans un scrutin qui s’annonce très serré. Les premiers résultats partiels sont attendus dans la nuit aux Etats-Unis.	https://img.lemde.fr/2024/11/05/879/0/5271/2635/1440/720/60/0/efc93c1_1730837677141-876425.jpg	2024-11-05 20:20:46	Le Monde
fr	https://www.lefigaro.fr/international/election-presidentielle-americaine-le-fbi-s-inquiete-d-un-torrent-de-desinformation-provenant-de-russie-20241105	Élection présidentielle américaine: le FBI s’inquiète d’un «torrent de désinformation» provenant de Russie - Le Figaro	Les services de renseignements américains accusent Moscou de vouloir déstabiliser le scrutin, alors que plusieurs vidéos mettent en doute la fiabilité du processus électoral.	https://i.f1g.fr/media/cms/1200x630_crop/2024/11/05/e55e7e5bfb7cc8d6e9d42784f4e21a480b0e7a928108455e140eb89ea105e62c.jpg	2024-11-05 16:58:11	Le Figaro
fr	https://www.leparisien.fr/international/etats-unis/les-proud-boys-sont-la-pour-se-battre-comment-des-pro-trump-entendent-surveiller-la-presidentielle-americaine-05-11-2024-D2ETP72SABEZFKWFIGCKSAO7MI.php	« Les Proud Boys sont là pour se battre » : comment des pro-Trump entendent « surveiller » la présidentielle américaine - Le Parisien	Des milices patriotes américaines se mobilisent et pourraient intimider les électeurs sous couvert de « protection » du scrutin. Ce climat p	https://www.leparisien.fr/resizer/tfCmo7A3Dp9L-JaiQJTLCkh9BJI=/1200x675/cloudfront-eu-central-1.images.arcpublishing.com/leparisien/OPMKUORTUVH6LEVF6POQRIPFHQ.jpg	2024-11-05 14:36:00	Le Parisien
fr	https://www.20minutes.fr/societe/4119626-20241105-continuez-etre-con-marjane-satrapi-recadre-sandrine-rousseau-affaire-etudiante-iranienne	« Vous continuez à être con » : Marjane Satrapi recadre Sandrine Rousseau sur l’affaire de l’étudiante iranienne - 20 Minutes	L’autrice franco-iranienne de « Persepolis » dénonce un tweet de l’élue écolo à propos du voile	https://img.20mn.fr/p21BzNOyS0y0L5X08k4rRSk/1444x920_french-iranian-graphic-novelist-and-illustrator-marjane-satrapi-poses-during-the-unveiling-of-an-olympic-triptych-tapestry-created-for-the-paris-2024-olympic-games-designed-from-a-drawing-by-satrapi-at-the-mobilier-national-national-furniture-in-paris-on-march-12-2024-the-tapestry-will-be-exhibited-at-the-hotel-de-la-marine-from-june-21-2024-photo-by-bertrand-guay-afp	2024-11-05 09:34:00	20 Minutes
fr	https://www.ledauphine.com/faits-divers-justice/2024/11/05/mort-de-nicolas-une-fusillade-commanditee-pour-intimider	Ardèche. Mort de Nicolas : une fusillade commanditée pour intimider ? - Le Dauphiné Libéré	Les gardes à vue des deux suspects, interpellés trois jours après la fusillade mortelle survenue lors de la soirée d’Halloween devant une ...	https://cdn-s-www.ledauphine.com/images/345C3C7E-2400-46E6-84F6-BE9BD7FD15ED/FB1200/photo-1730835422.jpg	2024-11-05 18:56:00	Le Dauphiné Libéré
fr	https://www.lemonde.fr/international/live/2024/11/05/en-direct-guerre-en-ukraine-les-dernieres-informations_6373158_3210.html	En direct, guerre en Ukraine : les dernières informations - Le Monde	« Les premiers combats contre les soldats nord-coréens marquent un nouveau chapitre dans l’instabilité mondiale », estime le président ukrainien, Volodymyr Zelensky.	https://img.lemde.fr/2024/10/28/146/0/2323/1161/1440/720/60/0/31e5a47_3f8b2ae9fded4b75a6fec307d2e03c9f-0-88d680e4a129401b8de9bae5be7f919f.jpg	2024-11-05 20:00:05	Le Monde
fr	https://www.lemonde.fr/economie/article/2024/11/05/le-centre-de-paris-interdit-a-la-circulation-de-transit_6376907_3234.html	Le centre de Paris interdit à la circulation de transit - Le Monde	Déjà utilisé dans plusieurs grandes villes européennes, le dispositif de « zone à trafic limité » vise à réduire le passage automobile tout en favorisant l’usage des transports en commun et l’amélioration de la qualité de l’air.	https://img.lemde.fr/2024/11/05/0/0/6000/4000/1440/960/60/0/68e2b90_1730790365351-496889.jpg	2024-11-05 08:48:49	Le Monde
fr	https://www.ledauphine.com/faits-divers-justice/2024/11/05/violences-humiliation-abus-l-enfance-terrible-de-l-accuse-seropositif	Violences, humiliation, abus : l’enfance de l’accusé séropositif qui s’est rendu six fois chez les Pelicot - Le Dauphiné Libéré	Les personnalités de certains accusés ont été abordées ce mardi 5 novembre, dans le cadre de ce procès des ‘‘viols de Mazan’’. Dont celle de ...	https://cdn-s-www.ledauphine.com/images/8DE6B50D-DD3E-4173-A9A1-E65980FD08A2/FB1200/photo-1730836753.jpg	2024-11-05 20:15:00	Le Dauphiné Libéré
fr	https://www.bfmtv.com/police-justice/guadeloupe-deux-enfants-retrouves-decapites-leur-mere-hospitalisee-en-psychiatrie_AN-202411050538.html	Guadeloupe: deux enfants retrouvés décapités, leur mère hospitalisée en psychiatrie - BFMTV	Une enquête pour "meurtre par ascendant sur mineur de moins de 15 ans" a été ouverte par le parquet de Pointe-à-Pitre et confiée à la brigade de recherches de la gendarmerie de Pointe-à-Pitre.	https://images.bfmtv.com/uFPQPEa0mm9QYvS35K5jSwDI8AU=/0x106:2048x1258/2048x0/images/Gendarmerie-illustration-1964637.jpg	2024-11-05 12:01:56	BFMTV
fr	https://www.ouest-france.fr/societe/faits-divers/dans-le-coma-apres-avoir-saute-dune-voiture-en-marche-une-jeune-femme-est-morte-a-lhopital-6792136e-9b7a-11ef-ab03-7ebf2cc7148e	Dans le coma après avoir sauté d’une voiture en marche, une jeune femme est morte à l’hôpital - Ouest-France	Après neuf jours de coma, une jeune fille de 18 ans originaire de Drancy (Seine-Saint-Denis) est décédée à l’hôpital, lundi 4 novembre. Dans des circonstances qui restent à déterminer, elle avait sauté d’une voiture en marche à Épinay-sur-Seine, rapporte « Le Parisien ».	https://media.ouest-france.fr/v1/pictures/MjAyNDExN2MyNmM2MmEyN2YxYjVmMDkzOGY4OGRhNmY2NjhmNGM?width=1260&height=708&focuspoint=50%2C25&cropresize=1&client_id=bpeditorial&sign=87c096356897f9e991d94eb0242558b26f65976bbd2ef4c8cd696f510a8be4a3	2024-11-05 14:28:49	Ouest-France
fr	https://news.google.com/rss/articles/CBMikgJBVV95cUxNMG5ORUxCS1dXb2k2NVRvck1Da3AyWURaOHVfblBma2tzTWk4MTBpeDRHZlhDRkM2eXlfSlBFVTdfbGZtXzdWVFYwVFN4WnZjZ3Y5ZTBjekxqYVV6Y3c2b1ozcnAtUHM2YWFaNUdXcUtOSVo1SXRJVDllRld5di1zWTFJOGNlS25tTnpPbFBUdUx1SXY3c0xxanNyenRqSjZuN0NvMDg4RjI5ZmZ5NURNcmk1VTF3ODctT1p0NHVTTDZDOFBuSWh6d1J2ZlpQWjZwZlBTSnFtVjgxTm42bUVxWkwxd1RiVDZLeUhTbFJQREh5WUd3YXlYNWpLWF9FZV9zR2dFYVc1N2hla1BiY1hhTUd3?oc=5	« Il a la tête du Joker pendant qu’il me viole » : la glaçante déposition d’Isabelle, agressée à l’hôpital Cochin - Le Parisien	Au procès de Faïd A., jugé depuis lundi pour le viol d’une patiente inconsciente aux urgences de l’hôpital Cochin en octobre 2022, la partie	https://www.leparisien.fr/resizer/Y29tqCdBgP0Mdu89A_Vucn4TjKI=/1200x675/cloudfront-eu-central-1.images.arcpublishing.com/leparisien/RD3DEO6RTJF6NQBSEMLSUUWW3A.jpg	2024-11-05 11:16:00	Le Parisien
fr	https://www.francetvinfo.fr/politique/front-national/j-avais-du-mal-a-dire-mon-prenom-les-premiers-extraits-du-livre-de-jordan-bardella-devoiles_6879308.html	"J'avais du mal à dire mon prénom" : les premiers extraits du livre de Jordan Bardella dévoilés - franceinfo	À quatre jours de la sortie du premier ouvrage de Jordan Bardella, "Le Figaro Magazine" sort les bonnes feuilles du livre. Quelques extraits issus de plus de 300 pages écrites par le patron du Rassemblement national sur son enfance ou encore son rapport à la religion.	https://www.francetvinfo.fr/pictures/n6If05IlupZDOE9heQZ8J_kA5aM/0x0:4117x2315/1500x843/2024/09/26/bardella-66f4fde335393934981136.jpg	2024-11-05 14:29:56	franceinfo
fr	https://www.dna.fr/faits-divers-justice/2024/11/05/la-stele-en-hommage-aux-victimes-de-l-attentat-a-ete-degradee	Faits divers. Strasbourg : la stèle en hommage aux victimes de l’attentat a été dégradée - DNA - Dernières Nouvelles d'Alsace	Ce mardi 5 novembre vers 9 h place de la République à Strasbourg, des passants se sont étonnés de la dégradation de la stèle en hommage aux victimes de l’attentat du 11 décembre 2018.	https://cdn-s-www.dna.fr/images/F521F846-13AA-4D19-9C33-2F1EFFA5A873/FB1200/photo-1730807717.jpg	2024-11-05 09:57:00	DNA - Dernières Nouvelles d'Alsace
fr	https://www.francetvinfo.fr/elle-ressent-la-douleur-des-gens-jill-stein-candidate-ecologiste-qui-pourrait-faire-de-l-ombre-a-kamala-harris_6879002.html	"Elle ressent la douleur des gens" : Jill Stein, candidate écologiste qui pourrait faire de l'ombre à Kamala Harris - franceinfo	Elle est très populaire auprès de la communauté arabo-américaine pour avoir dénoncé les massacres de civils, pierre angulaire de son programme.	https://www.francetvinfo.fr/pictures/rWLvmVd1jIqyxctCSMyitd52M-Q/0x0:4298x2416/1500x843/2024/11/05/jill-stein-6729d2ce68390804022623.jpg	2024-11-05 11:15:32	franceinfo
fr	https://www.lequipe.fr/Football/Actualites/Monaco-avec-soungoutou-magassa-et-christian-mawissa-a-bologne-en-ligue-des-champions/1518455	Foot : Monaco avec Soungoutou Magassa et Christian Mawissa à Bologne en Ligue des champions - L'Équipe	L'AS Monaco va disputer son match de Ligue des champions à Bologne ce mardi soir avec les jeunes Soungoutou Magassa (21 ans) et Christian Mawissa (19 ans) dans le onze de départ.	https://medias.lequipe.fr/img-photo-jpg/magassa-et-mawissa-sont-titulaires-p-lahalle-l-equipe/1500000002079140/278:40,1949:1154-640-427-75/fdd60.jpg	2024-11-05 19:08:05	L'Équipe
