country_code	url	title	description	image_url	publish_date	source
fr	https://www.lemonde.fr/international/article/2024/11/17/en-abkhazie-des-manifestants-envahissent-le-parlement_6397720_3210.html	En Abkhazie, des manifestants envahissent le Parlement - Le Monde	La Russie souhaiterait intégrer cette petite République autoproclamée qui a unilatéralement déclaré son indépendance vis-à-vis de la Géorgie en 1992.	https://img.lemde.fr/2024/11/15/0/680/2655/1770/1440/960/60/0/919c0e7_8b2ca581d9aa459998b8f25b315cee65-0-15e5403e18ca4843a7b2fbba5c323efd.jpg	2024-11-16 23:30:03	Le Monde
fr	https://www.lemonde.fr/international/article/2024/11/17/le-president-chinois-xi-jinping-assure-joe-biden-d-une-transition-en-douceur-dans-les-relations-avec-les-etats-unis_6397753_3210.html	Le président chinois, Xi Jinping, assure Joe Biden d’une « transition en douceur » dans les relations avec les Etats-Unis - Le Monde	Les deux dirigeants se sont rencontrés en tête à tête, en marge du sommet de l’APEC au Pérou, samedi. Sans évoquer Donald Trump, Xi Jinping a averti qu’une relation stable entre la Chine et les Etats-Unis était essentielle pour « l’avenir et le destin de l’humanité ».	https://img.lemde.fr/2024/11/16/0/0/6000/4000/1440/960/60/0/c39254a_2024-11-16t212923z-1224884218-rc2f6bao9tst-rtrmadp-3-apec-peru-biden-xi.JPG	2024-11-16 23:38:46	Le Monde
fr	https://www.francetvinfo.fr/societe/harcelement-sexuel/violences-faites-aux-enfants-il-ne-suffit-pas-de-rappeler-qu-il-y-a-beaucoup-d-enfants-victimes-de-violences-extremes-il-faut-trouver-leur-nom-et-leur-visage-recommande-l-ancien-patron-de-la-ciivise_6901487.html	Violences faites aux enfants : "Il ne suffit pas de rappeler qu'il y a beaucoup d'enfants victimes, il faut trouver leur nom et leur visage", recommande l'ancien co-président de la Ciivise - franceinfo	Edouard Durand estime qu'"il ne faut pas attendre que ces enfants soient des adultes pour leur dire que c'est dommage".	https://www.francetvinfo.fr/pictures/fandLcyEwcvBKJZTA1uz8LdC6_Y/0x0:3726x2094/1500x843/2023/12/12/edouard-durand-6578b50b14591550062275.jpg	2024-11-16 19:00:00	franceinfo
fr	https://www.lemonde.fr/societe/article/2024/11/17/l-epreuve-anticipee-de-mathematiques-un-nouveau-casse-tete-dans-l-interminable-reforme-du-bac_6397855_3224.html	L’épreuve anticipée de mathématiques, un nouveau casse-tête dans l’interminable réforme du bac - Le Monde	Après de nombreux revirements ces dernières années, l’épreuve obligatoire de mathématiques devrait faire son retour, pour les élèves de 1ʳᵉ, en 2026. Mais son organisation pose de très nombreuses questions.	https://img.lemde.fr/2024/06/27/0/0/6000/4000/1440/960/60/0/8c6fd96_1719482777490-781134.jpg	2024-11-17 03:30:12	Le Monde
fr	https://www.lemonde.fr/politique/article/2024/11/17/budget-gerard-larcher-souhaite-que-l-effort-demande-aux-collectivites-soit-reduit-a-deux-milliards-d-euros_6397786_823448.html	Budget : Gérard Larcher souhaite que l’effort demandé aux collectivités soit réduit à 2 milliards d’euros - Le Monde	Alors que le gouvernement vise 5 milliards d’euros de prélèvement, le président du Sénat estime, dans un entretien au « Journal du dimanche », que les collectivités « ne sont pas coupables du creusement du déficit » public.	https://img.lemde.fr/2024/08/25/0/535/2823/1882/1440/960/60/0/f43a084_2024-08-25t155208z-1282913445-rc23n9al6jed-rtrmadp-3-ww2-anniversary-paris-liberation-macron.JPG	2024-11-17 01:01:28	Le Monde
fr	https://www.lemonde.fr/international/article/2024/11/17/complotiste-antivax-neveu-de-jfk-qui-est-robert-kennedy-jr-le-ministre-de-la-sante-choisi-par-donald-trump_6398060_3210.html	Complotiste, antivax, neveu de JFK... : qui est Robert Kennedy Jr, le ministre de la santé choisi par Donald Trump ? - Le Monde	Connu pour son scepticisme sur les vaccins, le neveu de John F. Kennedy a été nommé  ministre de la santé du futur gouvernement Trump. Sa première mission : s’attaquer aux grands laboratoires et aux agences de contrôle de la santé et de l’alimentation.	https://img.lemde.fr/2024/11/15/0/0/5500/3666/1440/960/60/0/42e8e87_1731697663692-124614.jpg	2024-11-17 05:00:21	Le Monde
fr	https://www.info-beaune.com/articles/2024/11/17/9026/vente-des-vins-hospices-de-beaune-dominic-west-eva-longoria-zabou-breitman-et-jean-reno-illuminent-la-soiree-au-clos-de-vougeot/	Vente des vins Hospices de Beaune - Dominic West, Eva Longoria, Zabou Breitman et Jean Reno illuminent la soirée au Clos de Vougeot - Info-Beaune.com		https://www.info-beaune.com/media/Jeannette/BOURGOGNECLOSVOUGEOTVENTE_1_2520.jpeg	2024-11-17 07:24:00	Info-Beaune.com
fr	https://www.ouest-france.fr/societe/faits-divers/homme-percute-par-un-rer-a-nanterre-un-agent-ratp-mis-en-examen-5b057ad2-a462-11ef-b729-1d466315993e	Homme percuté par un RER à Nanterre : un agent RATP mis en examen - Ouest-France	Lors d’une intervention d’agent de la sûreté RAPT jeudi 14 novembre, un jeune homme avait été percuté par un train et grièvement blessé. L’un des agents a été mis en examen ce samedi pour violences volontaires.	https://media.ouest-france.fr/v1/pictures/MjAyNDExNTk5YTgxYzhhNzU0Zjc1MWZjMjU2NzdlNWVmZTdiOGY?width=1260&height=708&focuspoint=50%2C25&cropresize=1&client_id=bpeditorial&sign=92c3af5f632ed6719c1600bdb6c6a694c537b1087ea7b813f7626e7889545373	2024-11-16 21:46:51	Ouest-France
fr	https://www.lemonde.fr/economie/article/2024/11/17/la-france-en-marche-vers-l-economie-de-guerre-blindes-missiles-munitions_6397922_3234.html	La France en marche vers l’économie de guerre : blindés, missiles, munitions... - Le Monde	En dépit des contraintes budgétaires, les dépenses d’armement s’envolent. L’industrie s’est mise en situation pour produire plus, les cadences s’accélèrent, tirées par des commandes inédites. Mais les capitaux et l’allègement des procédures tardent encore à venir.	https://img.lemde.fr/2024/11/15/0/0/5568/3712/1440/960/60/0/bfd7cbc_1731669081768-000-33mk2c7.jpg	2024-11-17 04:00:07	Le Monde
fr	https://www.rtl.fr/actu/justice-faits-divers/issy-les-moulineaux-ce-que-l-on-sait-de-la-prise-d-otage-dans-un-restaurant-7900441153	Prise d'otage à Issy-les-Moulineaux : ce que l'on sait - RTL	Un homme, armé d'un couteau, est retranché dans un restaurant à Issy-les-Moulineaux, aux portes de Paris, où il séquestre "trois ou quatre employés".	https://images.rtl.fr/~c/2000v2000/rtl/www/1715187-un-homme-arme-d-un-couteau-est-retranche-dans-le-restaurant-de-son-pere-a-issy-les-moulineaux-hauts-de-seine-avec-trois-ou-quatre-employes-et-la-police-est-sur-place.jpg	2024-11-16 15:06:52	RTL
fr	https://www.20minutes.fr/faits_divers/faits-divers-lyon/4121705-20241116-sdf-tue-lyon-homme-soupconne-meurtre-coups-parpaing-autres-tentatives-homicides-mis-examen	L’homme soupçonné du meurtre d’un SDF à Lyon mis en examen - 20 Minutes	Le suspect du meurtre d'un homme SDF à coups de parpaing à Lyon a été « mis en examen du chef de tentative d'assassinat », avec la même méthode à Évry, a indiqué le parquet	https://img.20mn.fr/cuWNJC0NQiOA3bODNR7OXCk/1444x920_illustration-of-a-illustration-of-a-policeman-near-notre-dame-in-paris-on-october-24-2024-hubertthomas-illustration-police-9-credit-thomas-hubert-sipa-2410241534	2024-11-16 12:49:00	20 Minutes
fr	https://www.ledauphine.com/faits-divers-justice/2024/11/16/isere-grenoble-des-coups-de-feu-tires-a-midi-dans-un-parc-jouxtant-la-rue-de-new-york	Grenoble. Des coups de feu tirés à midi dans un parc jouxtant la rue de New-York - Le Dauphiné Libéré	None	None	2024-11-16 15:33:00	Le Dauphiné Libéré
fr	https://www.francetvinfo.fr/monde/europe/manifestations-en-ukraine/guerre-en-ukraine-attaque-massive-de-la-russie-sur-le-reseau-energetique-ukrainien-la-pologne-fait-decoller-des-avions-de-chasse-pour-proteger-son-territoire_6902768.html	DIRECT. Guerre en Ukraine : Kiev rapporte "une des plus grandes" attaques aériennes russes depuis le début de l'invasion, la Pologne fait décoller des avions de chasse - franceinfo	Les bombardements russes visent notamment le réseau énergétique ukrainien, provoquant des coupures de courant dans plusieurs régions, annonce l'opérateur énergétique national.	https://www.francetvinfo.fr/pictures/EjTsDLJUWDu5FIKLVY_y6IG7FGg/0x122:1019x697/1500x843/2024/11/17/photo-2024-11-17-09-39-52-6739acc661f6c207975872.jpg	2024-11-17 07:32:01	franceinfo
fr	https://www.lemonde.fr/economie/article/2024/11/16/un-squelette-geant-de-dinosaure-vendu-6-millions-d-euros-dans-les-yvelines_6397588_3234.html	Un squelette géant de dinosaure vendu 6 millions d’euros dans les Yvelines - Le Monde	Composé de 75 % à 80 % des os d’origine, l’imposant spécimen est le plus grand dinosaure jamais mis aux enchères.	https://img.lemde.fr/2024/11/14/0/0/6000/4000/1440/960/60/0/3910dc3_5252374-01-06.jpg	2024-11-16 21:29:02	Le Monde
fr	https://www.foot-national.com/coupe-de-france/coupe-de-france-les-derniers-matchs-du-7e-tour-ce-dimanche-17-novembre-894328	Coupe de France : les derniers matchs du 7e tour ce dimanche 17 novembre - Foot National	None	None	2024-11-17 06:39:00	Foot National
fr	https://www.lemonde.fr/politique/article/2024/11/17/agriculteurs-en-cas-de-blocage-durable-ce-sera-tolerance-zero-previent-bruno-retailleau_6398671_823448.html	Agriculteurs : en cas de « blocage durable, ce sera tolérance zéro », prévient Bruno Retailleau - Le Monde	« Nous ne voulons pas bloquer les Français, mais les prendre à témoin », a affirmé dans le même temps le président de la FNSEA, Arnaud Rousseau, qui a annoncé que « 82 actions » étaient prévues à partir de dimanche après-midi et jusqu’à mardi.	https://img.lemde.fr/2024/11/15/1/0/8192/5461/1440/960/60/0/162f854_5258568-01-06.jpg	2024-11-17 12:18:17	Le Monde
fr	https://journaldesseniors.20minutes.fr/argent/contrat-senior-retraite-progressive-decouvrez-les-mesures-phares-du-nouvel-accord-sur-lemploi-des-plus-de-60-ans/	Contrat senior, retraite progressive : découvrez les mesures phares du nouvel accord sur l’emploi des plus de 60 ans - Journal des Seniors	Découvrez les mesures phares du nouvel accord sur l’emploi des seniors : retraite progressive élargie, contrat senior expérimental… Quels changements pour les plus de 60 ans et comment en profiter ?	https://journaldesseniors.20minutes.fr/wp-content/uploads/2024/11/emploi-senior.jpg	2024-11-17 07:34:44	Journal des Seniors
fr	https://www.20minutes.fr/monde/bresil/4121739-20241117-argentine-visite-buenos-aires-macron-compte-expliquer-milei-opposition-accord-mercosur	En Argentine, Macron va dire à Milei son refus de l’accord avec le Mercosur - 20 Minutes	Le président ira ensuite au Brésil, pour le G20, et au Chili afin de défendre les positions des agriculteurs français et l’Accord de Paris sur le climat	https://img.20mn.fr/vFhBsDZpR1eG3BV5Kjt8TCk/1444x920_french-president-emmanuel-macron-right-and-argentina-s-president-javier-milei-pose-after-their-meeting-at-the-elysee-palace-ahead-of-a-promised-spectacular-evening-opening-ceremony-at-the-2024-summer-olympics-friday-july-26-2024-in-paris-france-ap-photo-louise-delmotte-olybc139-24208386019107-2407261246	2024-11-17 02:22:00	20 Minutes
fr	https://www.leparisien.fr/sports/football/equipe-de-france/equipe-de-france-kylian-mbappe-est-dans-une-situation-compliquee-confie-didier-deschamps-17-11-2024-W3CCMEZUUNFOPPPFOSXS53JRHI.php	Équipe de France : « Kylian Mbappé est dans une situation compliquée », confie Didier Deschamps - Le Parisien	Dans Téléfoot ce dimanche, le sélectionneur national s’est exprimé sur la santé mentale de ses joueurs et en particulier celle de Kylian Mba	https://www.leparisien.fr/resizer/t3H6I1SEn54WtfE9oS_eCUdaRyU=/1200x675/cloudfront-eu-central-1.images.arcpublishing.com/leparisien/ILWPZ4NIWRDOXGNIM7UBEYDZBA.jpg	2024-11-17 11:55:00	Le Parisien
fr	https://www.lequipe.fr/Rugby/Actualites/-c-est-une-equipe-qui-manque-de-trop-de-choses-pour-etre-une-tres-grande-equipe-fustige-la-presse-anglaise-apres-la-defaite-face-a-l-afrique-du-sud/1520877	« C'est une équipe qui manque de trop de choses pour être une très grande équipe », fustige la presse anglaise après la défaite face à l'Afrique du Sud - L'Équipe	Après la défaite de l'Angleterre contre l'Afrique du Sud (29-20), la cinquième de rang pour les Anglais, la presse n'est pas tendre avec le XV de la Rose et son sélectionneur Steve Borthwick.	https://medias.lequipe.fr/img-photo-jpg/steve-borthwick-est-sous-le-feu-des-critiques-de-la-presse-anglaise-a-mounic-l-equipe/1500000002085447/0:0,1498:999-640-427-75/a4e49.jpg	2024-11-17 11:47:23	L'Équipe
fr	https://www.sudouest.fr/sport/rugby/diaporama-revivez-l-ambiance-de-la-victoire-l-us-dax-aux-depens-du-stade-montois-a-bayonne-22183007.php	Diaporama. Revivez l’ambiance de la victoire l’US Dax aux dépens du Stade Montois à Bayonne - Sud Ouest	Il n’y a pas eu photo dans ce derby délocalisé au stade Jean-Dauger à Bayonne où les Dacquois ont dominé les jaune et noir sur le score de 40 à 11. Une victoire importante pour la suite de la saison. Dans l’objectif de nos reporters photographes Isabelle Louvier et de Bertrand Lapègue, on vous propose de revivre cette belle ambiance	https://media.sudouest.fr/22183007/1200x-1/20241116192040-louv7393.jpg	2024-11-17 08:13:01	Sud Ouest
fr	https://www.lemonde.fr/sante/article/2024/11/17/trafic-de-drogue-l-appareil-judiciaire-a-pris-du-retard-dans-la-lutte-contre-le-crime-organise_6398468_1651302.html	Trafic de drogue : « L’appareil judiciaire a pris du retard dans la lutte contre le crime organisé » - Le Monde	Jean-François Ricard, ancien procureur national antiterroriste, a rédigé, cet été, un rapport sur la création d’un parquet national anticriminalité organisée, après avoir mené 200 entretiens avec tous les acteurs de la chaîne pénale. Dans un entretien au « Monde », il revient sur les enjeux de la création de cette institution nouvelle.	https://img.lemde.fr/2024/11/15/1/0/7488/4992/1440/960/60/0/3878a88_1731678009813-000-34lz6kh.jpg	2024-11-17 09:00:09	Le Monde
fr	https://www.letelegramme.fr/sports/voile/vendee-globe/ces-bateaux-qui-se-fissurent-ca-rappelle-de-mauvais-souvenirs-sur-le-vendee-globe-6704097.php	Ces bateaux qui se fissurent, ça rappelle de mauvais souvenirs sur le Vendée Globe… - Le Télégramme	Le « gros crac » et les fissures constatées samedi soir par Louis Burton sur son bateau Bureau Vallée inquiètent. Ça rappelle de mauvais souvenirs lors des dernières éditions du Vendée Globe.	https://media.letelegramme.fr/api/v1/images/view/6739e9a3b2bf6f219d49d11c/web_golden_xxl/6739e9a3b2bf6f219d49d11c.1	2024-11-17 09:58:22	Le Télégramme
fr	https://www.sudouest.fr/international/etats-unis/video-mma-donald-trump-et-elon-musk-au-sacre-de-la-legende-jon-jones-qui-reste-champion-des-poids-lourds-22183056.php	Vidéo. MMA : “Je suis fier d’être un champion américain et chrétien”, Jon Jones garde son titre sous les yeux de Donald Trump et Elon Musk - Sud Ouest	La star américaine Jon Jones, 37 ans, a conservé son titre de champion des lourds de l’UFC en mettant KO son compatriote Stipe Miocic à New York sous les yeux de Donald Trump et ses proches	https://media.sudouest.fr/22183056/1200x-1/20241117081105-41869112.jpg	2024-11-17 08:42:33	Sud Ouest
fr	https://news.google.com/rss/articles/CBMi0AFBVV95cUxNSVA2aS1TSDJ1SHFKcUdUQkpYeHFFd2dYS3Z3Qjh6UVBsZU9jZllvZzZzNWhSSzBRNFRDOTJpR1RaNXJpM0tXZ0tHRDh5WVhzRHllSEZTeFhoSGhuN2NvblNGTjhkd2YweGJnbzNEWThFelF6VkpGVk01S1puVHdMSWpfa1VMQ2RyTTFCbW5NaDVpUTNENXM0NjZhRFZRV3BxM0U1NXd6a3Qxc2l3dndCQVMyVGdsdlNLdXhLMlBWcGY4TGt1YXNndVh4ck9iOEZw?oc=5	Une voiture percute un platane et prend feu : cinq morts dans le drame sur une route du Tarn - Sud Ouest	Ce dimanche matin, cinq personnes sont décédées lors d’un accident de voiture dans le Tarn. Une enquête a été ouverte.	https://media.sudouest.fr/22183518/1200x-1/20241114182028-1411224dsc26.jpg	2024-11-17 09:50:40	Sud Ouest
fr	https://www.liberation.fr/international/moyen-orient/liban-un-responsable-du-hezbollah-etait-dans-limmeuble-vise-par-israel-a-beyrouth-20241117_GIN6CYFDUNCTRBQHA7X5M2ZW6Q/	Liban : un responsable du Hezbollah tué dans le raid israélien à Beyrouth - Libération	Une frappe israélienne a tué Mohammed Afif, responsable média du mouvement pro-iranien, ce dimanche 17 novembre dans un quartier de la capitale libanaise.	https://www.liberation.fr/resizer/n24QOrFkoLW1EBOx8tYvnlOOylM=/1200x630/filters:format(jpg):quality(70):focal(2711x2279:2721x2289)/cloudfront-eu-central-1.images.arcpublishing.com/liberation/PPAIUZAYMZDGTAQ4BF2MXMLLVQ.JPG	2024-11-17 12:29:00	Libération
fr	https://www.lemonde.fr/societe/article/2024/11/17/dans-le-val-de-marne-un-homme-tue-par-un-policier-apres-avoir-menace-des-agents_6398638_3224.html	Dans le Val-de-Marne, un homme tué par un policier après avoir « menacé » des agents - Le Monde	L’homme a brandi « une arme de poing », factice selon les premiers éléments de l’enquête, sur des policiers. D’après une source policière, l’agent a tiré à trois reprises.	https://img.lemde.fr/2024/10/24/0/0/3000/2000/1440/960/60/0/a8e7a15_1729786779689-frame-164.jpg	2024-11-17 11:54:33	Le Monde
fr	https://www.liberation.fr/politique/avec-ses-nominations-donald-trump-tue-letat-et-la-politique-20241116_FY6NVCI4FZFVFN42TM2UP2LCPI/	Avec ses nominations, Donald Trump tue l’Etat et la politique - Libération	En chargeant Elon Musk de détruire le service public, en confiant la défense à un clown télévisuel, la justice à un incompétent multicondamné et la santé à un antivax, Trump entraîne l’Amérique vers le fond.	https://www.liberation.fr/resizer/O9rSK6IEYcjykQX52vxA1YLazGU=/1200x630/filters:format(jpg):quality(70):focal(2483x948:2493x958)/cloudfront-eu-central-1.images.arcpublishing.com/liberation/X5AWYSLSOVH2BAIO3OQITDG5PI.JPG	2024-11-16 05:55:00	Libération
fr	https://www.francetvinfo.fr/politique/front-national/proces-des-assistants-parlementaires-du-fn-marine-le-pen-et-son-parti-peuvent-ils-sortir-renforces-de-cette-affaire_6897140.html	Procès des assistants parlementaires du FN : Marine Le Pen et son parti peuvent-ils sortir renforcés de cette affaire ? - franceinfo	Les procureurs réclament l'inéligibilité de la triple candidate à la présidentielle, une perspective qui alimente la rhétorique antisystème du parti.	https://www.francetvinfo.fr/pictures/5gfXcFuZH8kUXLduu6me6Wxe0tE/0x602:7342x4730/1500x843/2024/11/15/sipa-ap22898831-000008-673771d735aba712161930.jpg	2024-11-17 05:56:27	franceinfo
fr	https://www.lefigaro.fr/flash-actu/usa-trump-nomme-chris-wright-entrepreneur-dans-la-fracturation-hydraulique-secretaire-a-l-energie-20241116	Trump nomme le climatosceptique Chris Wright secrétaire à l'Énergie - Le Figaro	Ce PDG d’une entreprise spécialisée dans la très polluante activité de fracturation hydraulique sera chargé de déréguler le secteur.	https://i.f1g.fr/media/cms/1200x630_crop/2024/11/17/96b54439f8e79dbad09071949c0680e2a07ef131b8d4989d1b26f311ea2a6675.jpg	2024-11-16 21:49:00	Le Figaro
fr	https://www.francetvinfo.fr/monde/israel/israel-deux-fusees-eclairantes-tirees-pres-du-domicile-du-premier-ministre-benyamin-netanyahou-trois-suspects-arretes_6902720.html	Israël : deux fusées éclairantes tirées près du domicile du Premier ministre Benyamin Nétanyahou, trois suspects arrêtés - franceinfo	Le Premier ministre israélien n'était pas présent sur les lieux au moment des tirs, samedi soir. La justice a interdit de publier la moindre information sur l'enquête et l'identité des suspects pour un mois.	https://www.francetvinfo.fr/pictures/iIx-kgPRD4rKXB6hlJWNL1cbJ2Y/0x27:1024x602/1500x843/2024/11/17/000-36fj97z-6739951a98c7c513690036.jpg	2024-11-17 07:04:56	franceinfo
fr	https://www.leparisien.fr/meteo/la-neige-pourrait-tomber-en-plaine-jeudi-dans-le-nord-de-la-france-les-cartes-pour-comprendre-la-situation-17-11-2024-LV55ETYCG5BJZHW4ZXULU63G5A.php	La neige pourrait tomber en plaine jeudi dans le nord de la France : les cartes pour comprendre la situation - Le Parisien	La plupart des modèles météorologiques s’accordent sur la présence de flocons à basse altitude. Mais ils hésitent sur la localisation et l’i	https://www.leparisien.fr/resizer/XOpWogwPgpJ12Fvtfkka7deUbuI=/1200x675/cloudfront-eu-central-1.images.arcpublishing.com/leparisien/TJA2TRQQOFDGJKDMLDRPFZ7CWA.jpg	2024-11-17 12:27:00	Le Parisien
fr	https://www.lindependant.fr/2024/11/17/une-masse-dair-polaire-va-sabattre-ressenti-glacial-chutes-de-neige-en-plaine-giboulees-forts-coups-de-vent-une-meteo-hivernale-attendue-la-semaine-12327879.php	"Une masse d’air polaire va s’abattre" : ressenti "glacial", chutes de neige en plaine, giboulées, forts coups de vent… une météo hivernale attendue la semaine prochaine - L'Indépendant	Le retour des intempéries.	https://images.lindependant.fr/api/v1/images/view/6738f3f24f46086342703266/large/image.jpg?v=1	2024-11-17 05:03:00	L'Indépendant
fr	https://news.google.com/rss/articles/CBMi7AFBVV95cUxOWmxqeGZSU1FUbmNRREVQcmFXWkdfZjNhQkxUX1lxQXBhR2FZdWJZS2dGMzRaVF8wWkw1ZFZnODI5VE94VWtGa1pTVnhkR1lDUXd0TnJtbEFlaE9nelY0YVVsUlNDa09FQ29CNHhFODladXhFWXpSckZDaV9yVzluYWlvand0VlZqNEpHc0cyZC1TU1FrX3dDVklEcUs4M0QwUTlGYzZJMnNRcngyeHJZQ2Q2dnpneFR5cXowSDBQOVVRQUwzbVljcjdCNk94OGZsRFFtUkw3NkJYNmJVUjMwbEgtZXJKRWczd0Rrcg?oc=5	À Trégunc, après avoir été sacré champion du monde de la pizza, il met la clé sous la porte - Le Télégramme	À Trégunc, vendredi 15 novembre, l’annonce de la fermeture de la pizzeria « La main à la pâte » a fait l’effet d’un choc, dix jours après le sacre de Cyrille Auffret au Trophée mondial de la pizza, à Menton (06). Il s’explique dans un long message publié sur les réseaux sociaux.	https://media.letelegramme.fr/api/v1/images/view/6739c5dccc054642b842a57a/web_golden_xxl/6739c5dccc054642b842a57a.1	2024-11-17 10:28:38	Le Télégramme
fr	https://www.liberation.fr/sports/rugby/rugby-le-xv-de-france-bete-noire-des-all-blacks-20241117_7AAU2RWXTJCAVJTMWUCVOCP24A/	Rugby : le XV de France bête noire des All Blacks - Libération	Vainqueur 30-29 face à la Nouvelle-Zélande, à force d’abnégation et de solidarité, d’un adversaire qui l’a longtemps dominé, le XV de France a ravi samedi soir un Stade de France aussi comble que comblé.	https://www.liberation.fr/resizer/QMM6qdGu4pm7hJLQpCTlkSlUgN8=/1200x630/filters:format(jpg):quality(70):focal(3045x1877:3055x1887)/cloudfront-eu-central-1.images.arcpublishing.com/liberation/73VONDSRZNG4LBMUMHELE6TENU.JPG	2024-11-17 08:54:23	Libération
fr	https://www.leprogres.fr/faits-divers-justice/2024/11/17/saint-fons-un-homme-tue-a-l-arme-blanche-l-auteur-en-fuite	Métropole de Lyon. Saint-Fons : un homme tué à l'arme blanche, l'auteur en fuite - Le Progrès	None	None	2024-11-17 13:20:00	Le Progrès
fr	https://www.ladepeche.fr/2024/11/17/une-maman-et-ses-deux-enfants-de-8-et-10-ans-tues-dans-une-violente-collision-sur-lautoroute-12328787.php	Une maman et ses deux enfants de 8 et 10 ans tués dans une violente collision sur l’autoroute - La Dépêche du Midi	Une mère de famille et ses deux fils de 8 et 10 ans ont trouvé la mort dans une collision sur l’autoroute A26 dans le Pas-de-Calais. Les circonstances de l’accident ne sont pas clairement établies.	https://images.ladepeche.fr/api/v1/images/view/6739b43af9fb967c2a2b1f29/large/image.jpg?v=1	2024-11-17 09:16:00	La Dépêche du Midi
fr	https://www.leparisien.fr/oise-60/une-gendarme-et-un-policier-heros-de-la1-a-deux-ou-trois-minutes-pres-le-routier-brulait-dans-sa-cabine-17-11-2024-2C6WXQPCUFDC7GYP4743O3JJKI.php	Une gendarme et un policier héros de l’A1 : « À deux ou trois minutes près, le routier brûlait dans sa cabine - Le Parisien	Anthony Marsaudon, policier municipal à Rosny-sous-Bois (Seine-Saint-Denis) et Marina Arnold, gendarme du peloton d’autoroute de Senlis (Ois	https://www.leparisien.fr/resizer/0y4e7hvSL6mqZbbIu5a3Ezyo_wg=/1200x675/cloudfront-eu-central-1.images.arcpublishing.com/leparisien/3HNBXIWAE5HRNBSOGFIN4XCYEM.jpg	2024-11-17 11:54:00	Le Parisien
fr	https://www.sudouest.fr/sport/football/football-avant-italie-france-autour-des-bleus-le-desinteret-gagne-du-terrain-22152778.php	Football. Italie – France : autour des Bleus, le désintérêt gagne du terrain - Sud Ouest	Audiences en baisse, fin d’une génération, jeu ennuyeux, overdose de foot : la popularité des Bleus semble sur la pente descendante. Même s’il suffirait sans doute d’un rien, ou presque, pour la relancer	https://media.sudouest.fr/22152778/1200x-1/20241114214307-4131712.jpg	2024-11-17 05:30:00	Sud Ouest
fr	https://www.bfmtv.com/marseille/info-bfm-marseille-provence-un-homme-interpelle-en-flagrant-delit-alors-qu-il-violait-une-femme-aux-goudes_AN-202411170199.html	INFO BFM MARSEILLE PROVENCE. Un homme interpellé en flagrant délit alors qu'il violait une femme aux Goudes - BFM Marseille	INFO BFM Marseille Provence. Les faits se sont produits dans la nuit de vendredi à samedi aux Goudes, dans le 8e arrondissement de Marseille. L'homme interpellé est sous le coup d'une OQTF.	None	2024-11-17 09:41:48	BFM Marseille
fr	https://www.20minutes.fr/arts-stars/culture/4121750-20241117-miss-univers-2024-miss-danemark-remporte-concours-indira-ampiot-top-30	Miss Danemark couronnée Miss Univers, Indira Ampiot dans le top 30 - 20 Minutes	Victoria Kjaer, qui est danseuse professionnelle, a battu 130 concurrentes, un record pour le concours autrefois propriété de Donald Trump	https://img.20mn.fr/y3ALA4laQQGRSoh2Gmxw1yk/1444x920_victoria-kjaer-miss-danemark-a-ete-couronnee-miss-univers-2024-samedi-soir	2024-11-17 08:14:00	20 Minutes
