country_code	url	title	description	image_url	publish_date	source
gb	https://news.sky.com/story/how-donald-trump-will-change-british-politics-13249226	How Donald Trump will change British politics - Sky News	Sky News' deputy political editor Sam Coates and Politico's Jack Blanchard share their daily guide to the day ahead in politics in under 20 minutes.	https://e3.365dm.com/24/10/1600x900/skynews-pjas-politics-at-jack-and-sams_6709400.png?20241007140310	2024-11-06 07:36:45	Sky News
gb	https://www.politico.eu/article/eu-trade-war-donald-trump-elections-triumphs-board-tariffs-transatlantic-relations/	EU’s trade war nightmare gets real as Trump triumphs - POLITICO Europe	None	None	2024-11-06 11:08:00	POLITICO Europe
gb	https://www.theguardian.com/politics/2024/nov/06/hypocrisy-student-politics-and-scoring-cheap-points-kemikaze-gets-to-work	Hypocrisy, student politics and scoring cheap points: Kemi gets to work at PMQs - The Guardian	Tory leader makes clear on her debut that there will be no situation she is not capable of making worse	https://i.guim.co.uk/img/media/768a72ae323152e68eca284b2b7a5d73c0c75f36/0_168_5000_3000/master/5000.jpg?width=1200&height=630&quality=85&auto=format&fit=crop&overlay-align=bottom%2Cleft&overlay-width=100p&overlay-base64=L2ltZy9zdGF0aWMvb3ZlcmxheXMvdGctb3BpbmlvbnMucG5n&enable=upscale&s=2ace0ad4541b57c20ebdfc85b0605a7d	2024-11-06 18:03:00	The Guardian
gb	https://news.sky.com/story/irelands-taoiseach-simon-harris-calls-general-election-for-this-month-13249534	Ireland's Taoiseach Simon Harris calls general election for this month - Sky News	Mr Harris could have waited until March to go to the polls but he has been paving the way for an election in recent weeks.	https://e3.365dm.com/24/06/1600x900/skynews-simon-harris-prime-minister_6592870.jpg?20240627204850	2024-11-06 18:37:59	Sky News
gb	https://www.bbc.co.uk/news/articles/cwy5x7wr7peo	Ivanka, Melania, a golf champion: Who was in Trump's huge victory entourage? - BBC	A closer look at the dozens of family members, advisers and allies who joined the president-elect on stage.	https://ichef.bbci.co.uk/news/1024/branded_news/d251/live/1ec67fd0-9c65-11ef-8538-e1655f5a8342.jpg	2024-11-06 18:51:45	BBC
gb	https://www.independent.co.uk/news/uk/home-news/labour-smoking-ban-anti-vaping-bill-children-b2642193.html	Ban to stop children from ever smoking a cigarette to be introduced in Parliament - The Independent	Indoor smoking bans could also be extended to some outdoor places like children’s playgrounds  	https://static.independent.co.uk/2024/10/24/23/4552f62c278c953f1da347b5404a00e8Y29udGVudHNlYXJjaGFwaSwxNzI5ODk1NDg3-2.2912178.jpg?quality=75&width=1200&auto=webp	2024-11-06 05:22:20	The Independent
gb	https://www.ft.com/content/6275096d-c3d2-4351-b621-4c51bd713107	Ukrainians put on brave face after Donald Trump’s victory - Financial Times	Volodymyr Zelenskyy praises Republican’s ‘decisive leadership’ amid angst in Kyiv over how new US president will ‘end war’	https://www.ft.com/__origami/service/image/v2/images/raw/https%3A%2F%2Fwww.ft.com%2F__origami%2Fservice%2Fimage%2Fv2%2Fimages%2Fraw%2Fhttps%253A%252F%252Fd1e00ek4ebabms.cloudfront.net%252Fproduction%252F29d370d0-f958-4fa3-ac13-93076a6f1ff4.jpg%3Fsource%3Dnext-article%26fit%3Dscale-down%26quality%3Dhighest%26width%3D700%26dpr%3D1?source=next-opengraph&fit=scale-down&width=900	2024-11-06 11:06:27	Financial Times
gb	https://www.dcfc.co.uk/news/2024/11/team-news-coventry-city-vs-derby-county-november-2024	TEAM NEWS: Coventry City Vs Derby County - Derby County Football Club	Derby Countys line-up for tonights Sky Bet Championship clash away to Coventry City has been confirmed (7:45pm kick-off).	https://www.dcfc.co.uk/media/alter-image/crop/400/400/INSERT%20-%2004_Coventry%20City%20vs%20Derby%20County_6th%20Nov%202024.png	2024-11-06 18:49:23	Derby County Football Club
gb	https://www.planetrugby.com/news/all-blacks-great-makes-forthright-prediction-on-ireland-v-new-zealand-test	All Blacks great makes forthright prediction on Ireland v New Zealand Test - planetrugby.com	Although Ireland head into Saturday's clash with New Zealand as the world's top ranked side, Zinzan Brooke expects the All Blacks to beat their hosts.	https://d3gbf3ykm8gp5c.cloudfront.net/content/uploads/2024/11/06145349/Zinzan-Brooke-and-Will-Jordan-image.jpg	2024-11-06 16:02:37	planetrugby.com
gb	https://news.sky.com/story/woman-who-took-11-year-old-boy-to-tamworth-riot-reacts-angrily-as-shes-jailed-13249485	Woman who took 11-year-old boy to Tamworth riot reacts angrily as she's jailed - Sky News	Aimie Hodgkinson-Hedgecox was recorded shouting "incendiary and racist" remarks at police protecting asylum seekers housed at a Holiday Inn Express.	https://e3.365dm.com/24/09/1600x900/skynews-aimie-hodgkinson-hedgecox_6689365.jpg?20241106181422	2024-11-06 18:39:34	Sky News
gb	https://www.gov.uk/government/news/better-care-for-mental-health-patients-under-major-reforms	Better care for mental health patients under major reforms - GOV.UK	Mental Health Act reformed to improve treatment of patients and address disparities.	https://assets.publishing.service.gov.uk/media/672b4793fbd69e1861921bf6/s960_young-person-speaking-to-therapist.jpg	2024-11-06 00:06:48	GOV.UK
gb	https://www.ft.com/content/6e323b66-a873-439b-9b32-6a869f54d1b1	Tesla and US bank stocks jump in post-election trades as renewables slump - Financial Times	Companies whose fortunes are closely tied to US economy should benefit, say analysts	https://www.ft.com/__origami/service/image/v2/images/raw/https%3A%2F%2Fwww.ft.com%2F__origami%2Fservice%2Fimage%2Fv2%2Fimages%2Fraw%2Fhttps%253A%252F%252Fd1e00ek4ebabms.cloudfront.net%252Fproduction%252F39ee94e0-ffe7-422f-b4e4-bc64cd6198bd.jpg%3Fsource%3Dnext-article%26fit%3Dscale-down%26quality%3Dhighest%26width%3D700%26dpr%3D1?source=next-opengraph&fit=scale-down&width=900	2024-11-06 18:45:30	Financial Times
gb	https://news.sky.com/story/benjamin-mendy-tells-manchester-city-do-the-honourable-thing-after-club-ordered-to-pay-him-8-5m-13249396	Benjamin Mendy tells Manchester City 'do the honourable thing' after club ordered to pay him £8.5m - Sky News	Mendy took the Premier League champions to an employment tribunal, with a judge ruling he should be entitled to the majority of his £11m claim for unauthorised deductions from his wages by the club.	https://e3.365dm.com/23/07/1600x900/skynews-benjamin-mendy-manchester-city_6216640.jpg?20230719125616	2024-11-06 15:42:00	Sky News
gb	https://www.ft.com/content/4ef766c8-e9b1-40bd-8820-cf82625c28e5	Republicans take control of US Senate after flipping three seats - Financial Times	Democrats lose majority in Congress’s upper chamber after defeats in Ohio, Montana and West Virginia	https://www.ft.com/__origami/service/image/v2/images/raw/https%3A%2F%2Fd1e00ek4ebabms.cloudfront.net%2Fproduction%2F7c0add8d-cc59-41a0-b717-5511c938abae.jpg?source=next-barrier-page	2024-11-06 20:17:02	Financial Times
gb	https://www.skysports.com/football/club-brugge-vs-aston-villa/report/521662	Club Brugge 1-0 Aston Villa: Tyrone Mings concedes bizarre penalty as visitors' perfect Champions League start ends - Sky Sports	Aston Villa's perfect Champions League start came to an end after a bizarre penalty award saw Club Brugge beat the Premier League side 1-0.	https://e0.365dm.com/24/11/1600x900/skysports-tyron-mings-aston-villa_6741087.jpg?20241106215450	2024-11-06 22:07:30	Sky Sports
gb	https://www.si.com/soccer/manchester-united-players-at-risk-under-ruben-amorim	Five Manchester United Players at Risk of Being Dropped by Ruben Amorim - Sports Illustrated	A handful of Erik ten Hag's worst signings are under pressure with the arrival of the Portuguese manager.	https://images2.minutemediacdn.com/image/upload/c_crop,w_4500,h_2531,x_0,y_90/c_fill,w_1440,ar_16:9,f_auto,q_auto,g_auto/images/voltaxMediaLibrary/mmsport/si/01jc1480eg1yteh6e7ec.jpg	2024-11-06 19:38:18	Sports Illustrated
gb	https://www.independent.co.uk/tv/news/trump-election-victory-speech-b2642246.html	Donald Trump declares election victory as he hails ‘golden age’ for America - The Independent	Donald Trump declared victory in the US election as he hailed a  “golden age” for America. The Republican made the declaration, despite ballots still being counted in some swing states. Speaking at his campaign watch party in Palm Beach on Wednesday (6 November), Trump said: “This is the greatest political movement of all time and now it’s going to reach a new level of importance because we’re going to let our country heal.” Trump continued: “This will truly be the golden age of America.”	https://cdn.jwplayer.com/v2/media/WXYAAZh7/poster.jpg?width=720	2024-11-06 11:00:00	The Independent
gb	https://www.bbc.com/news/articles/cy9jxpj2lypo	Suzy Lamplugh murder suspect John Cannan dies in prison - BBC.com	John Cannan was serving a life sentence for the murder of Bristol woman Shirley Banks.	https://ichef.bbci.co.uk/news/1024/branded_news/ce0e/live/700253e0-9c67-11ef-8fdf-ab46abc92dba.jpg	2024-11-06 21:45:46	BBC.com
gb	https://www.liverpoolecho.co.uk/news/liverpool-news/huge-mistakes-days-leading-up-30314311	'Huge mistakes' in days leading up to death of much-loved former Liverpool ECHO journalist - Liverpool Echo	A difficult and distressing day of evidence heard of errors and mix-ups in the care provided to Dan Kay before he died	https://i2-prod.liverpoolecho.co.uk/article29732856.ece/ALTERNATES/s1200/2_DanKaygood.jpg	2024-11-06 19:54:00	Liverpool Echo
gb	https://www.bbc.co.uk/news/articles/c079d1p2rnlo	Farmers protest against 'attack on rural economy' - BBC	The government says the current system is "unaffordable" but farmers say they face huge tax bills.	https://ichef.bbci.co.uk/news/1024/branded_news/4580/live/ff208840-9c7a-11ef-ae3a-39473e628d3f.jpg	2024-11-06 12:53:45	BBC
gb	https://www.bbc.co.uk/news/articles/clyvllrw3dxo	Sarah McBride becomes first transgender Congress member - BBC	McBride expressed  gratitude to Delaware voters and their "values" and promised to work to improve their lives.	https://ichef.bbci.co.uk/news/1024/branded_news/2a48/live/9b42c6b0-9c31-11ef-82c3-45a801b7330b.jpg	2024-11-06 15:15:31	BBC
gb	https://www.arsenal.com/news/every-word-artetas-post-inter-milan-presser1	Every word from Arteta’s post-Inter Milan presser | Press conference | News - Arsenal.com	Find out what the boss had to say following our 1-0 defeat at Stadio San Siro on Wednesday night	https://www.arsenal.com/sites/default/files/styles/desktop_16x9/public/images/GettyImages-2183357017%20Cropped_cohlcdmh.jpg?h=58679785&auto=webp&itok=phZ-hcJO	2024-11-06 22:57:16	Arsenal.com
gb	https://www.bbc.com/news/articles/cvg599xx0gvo	Lee Anderson ordered to apologise for swearing at guard - BBC.com	The Reform UK MP “verbally insulted” a security officer twice when asked to show his pass, a report finds.	https://ichef.bbci.co.uk/news/1024/branded_news/bd6c/live/a84700c0-9c35-11ef-a65b-4d3707c63685.jpg	2024-11-06 14:57:58	BBC.com
gb	https://www.newstatesman.com/us-election-2024/2024/11/like-thatcherism-donald-trump-is-here-to-stay	Like Thatcherism, Donald Trump is here to stay - The New Statesman	The Maga movement has cultural roots that the left failed to understand or confront.	https://dl6pgk4f88hky.cloudfront.net/2024/11/06/Trump-1-800x418.jpg?1730937726	2024-11-06 11:37:53	The New Statesman
gb	https://news.sky.com/story/mpox-new-case-of-clade-1b-strain-detected-in-uk-13249510	Mpox: New case of Clade 1b strain detected in UK - Sky News	Four cases of the Clade 1b variant have been confirmed in the UK, all of them belonging to the same household, and health officials say the overall risk to the population remains low.	https://e3.365dm.com/24/10/1600x900/skynews-mpox-virus-electron_6712582.jpg?20241010162229	2024-11-06 17:03:45	Sky News
gb	https://www.manchestereveningnews.co.uk/sport/football/football-news/bernardo-silva-admission-force-immediate-30311668	Bernardo Silva admission may force immediate Pep Guardiola change at Man City - Manchester Evening News	None	None	2024-11-06 16:00:00	Manchester Evening News
gb	https://www.telegraph.co.uk/us/politics/2024/11/06/kamala-harris-speech-live-concedes-2024-election-trump/	Kamala Harris speech live: VP calls Trump to concede 2024 election - The Telegraph	None	None	2024-11-06 23:29:00	The Telegraph
gb	https://www.bbc.co.uk/news/articles/cgk132vymm0o	Donald Trump win provokes trade-offs and dilemmas for UK - BBC	The president-elect's positions on issues ranging from Ukraine to trade have implications for the UK.	https://ichef.bbci.co.uk/news/1024/branded_news/7924/live/c04dd7e0-9c92-11ef-9260-19e6a950e830.jpg	2024-11-06 23:08:43	BBC
gb	https://www.telegraph.co.uk/business/2024/11/06/why-trumps-victory-threatens-unravel-reeves-budget/	Why Trump’s victory threatens to unravel Reeves’s Budget and sink Europe - The Telegraph	None	None	2024-11-06 13:45:00	The Telegraph
gb	https://www.euronews.com/culture/2024/11/06/dejection-and-dismay-celebrity-reactions-to-kamala-harris-losing-the-election	Celebrities react to Kamala Harris losing the election - Euronews	With the results of the election now clear, more celebrities have publicly reacted with their disappointment that Kamala Harris won't be the next US president.	https://static.euronews.com/articles/stories/08/83/67/86/1200x675_cmsv2_105e0667-11dc-51d1-a400-66eed7fd412c-8836786.jpg	2024-11-06 18:03:47	Euronews
gb	https://news.google.com/rss/articles/CBMiXEFVX3lxTE9uVHdhTExkNXdPdmtvWmZabm5INHplOExvN2dGYnp3b3ZiekZnQ0RxMGxySnpHUlBEb2xuQTdmaUJjTVJjWWg3X3pXeno4b1BZSjlIak5fZUwxT3Z4?oc=5	Trump has won the election. What happens to his legal cases? - BBC	Donald Trump is facing three criminal cases and a sentencing over a felony conviction. 	https://ichef.bbci.co.uk/news/1024/branded_news/bc60/live/235c1b40-9c6a-11ef-8538-e1655f5a8342.jpg	2024-11-06 16:26:47	BBC
gb	https://news.stv.tv/scotland/police-make-19-arrests-and-warn-more-to-come-after-significant-bonfire-night-disorder	Police make 19 arrests and warn more to come after 'significant' Bonfire Night disorder - STV News	Large groups of youths threw fireworks and other projectiles at officers, vehicles and public property.	https://news.stv.tv/wp-content/uploads/2024/11/4864dafb55d05d74897fdce5dee7fd22-1730915433-social-default.jpg	2024-11-06 17:57:25	STV News
gb	https://www.bbc.com/news/articles/cwyxq58g08wo	Sara Sharif: Girl's stepmother was ‘possessed’, court told - BBC.com	A father accused of killing Sara Sharif says his daughter was abused by her stepmum, a court hears.	https://ichef.bbci.co.uk/news/1024/branded_news/72f7/live/03587d80-9c37-11ef-90bd-77d71458162e.jpg	2024-11-06 17:03:17	BBC.com
gb	https://thecritic.co.uk/a-constructive-opposition/	A constructive opposition - The Critic	Kemi Badenoch took her seat in the Commons to cheers from her own side, and gave a little wave to her husband Hamish, who was watching up in the gallery. She would, in the ensuing 30 minutes…	https://d3o5s8vs2wiz58.cloudfront.net/uploads/2024/11/Robert-Hutton-A-constructive-opposition-finesse-card.png	2024-11-06 17:08:45	The Critic
gb	https://www.independent.co.uk/news/uk/crime/newcastle-explosion-arrests-b2642447.html	Three arrested over cannabis production and deadly house explosion - The Independent	Archie York, 7, and Jason Laws, 35, died in the blast in Benwell, Newcastle upon Tyne, on 16 October	https://static.independent.co.uk/2024/10/22/19/b6d6463b024b70ce59eceb3f9af287ebY29udGVudHNlYXJjaGFwaSwxNzI5NzA2MDAz-2.77822850.jpg?quality=75&width=1200&auto=webp	2024-11-06 15:28:53	The Independent
gb	https://www.ft.com/content/d19506c2-98f6-4e20-b626-559a22829c9b	German coalition government collapses as Scholz sacks his finance minister - Financial Times	Departure of Christian Lindner marks the end of the country’s unpopular three-party administration	https://www.ft.com/__origami/service/image/v2/images/raw/https%3A%2F%2Fwww.ft.com%2F__origami%2Fservice%2Fimage%2Fv2%2Fimages%2Fraw%2Fhttps%253A%252F%252Fd1e00ek4ebabms.cloudfront.net%252Fproduction%252Fd17c4def-5e4c-49cb-8836-dcda5a30ffc6.jpg%3Fsource%3Dnext-article%26fit%3Dscale-down%26quality%3Dhighest%26width%3D700%26dpr%3D1?source=next-opengraph&fit=scale-down&width=900	2024-11-06 22:12:31	Financial Times
gb	https://www.bbc.co.uk/news/articles/c2dl0e4l7lzo	What Trump's win means for Ukraine, Middle East and China - BBC	Trump's promises on China as well as ending wars in Ukraine and the Middle East will soon be put to the test.	https://ichef.bbci.co.uk/news/1024/branded_news/175e/live/46d44820-9c62-11ef-82c3-45a801b7330b.jpg	2024-11-06 11:45:09	BBC
gb	https://www.bbc.com/news/articles/c2dl0e4l7lzo	Donald Trump can’t stop global climate action. If we stick together, it’s the US that will lose out - The Guardian	Trump's promises on China as well as ending wars in Ukraine and the Middle East will soon be put to the test.	https://ichef.bbci.co.uk/news/1024/branded_news/175e/live/46d44820-9c62-11ef-82c3-45a801b7330b.jpg	2024-11-06 22:49:00	The Guardian
gb	https://www.theguardian.com/politics/2024/nov/06/labour-beefs-up-ministerial-code-of-conduct-in-effort-to-restore-trust	Labour updates ministerial code of conduct in effort to restore trust - The Guardian	Ministers can still accept gifts but must declare their value in monthly register and ‘show good judgment’	https://i.guim.co.uk/img/media/71cba55f688088df6ea6807ed8459ee19f21498d/60_0_1798_1080/master/1798.jpg?width=1200&height=630&quality=85&auto=format&fit=crop&overlay-align=bottom%2Cleft&overlay-width=100p&overlay-base64=L2ltZy9zdGF0aWMvb3ZlcmxheXMvdGctZGVmYXVsdC5wbmc&enable=upscale&s=772656ce08fbc19cd5b03da149cb0d43	2024-11-06 17:51:00	The Guardian
gb	https://news.google.com/rss/articles/CBMi0wFBVV95cUxQRllOdGszZC0yUC05TEY4Z1RFaWZSRWVGYUVLQVpZd3RuXzlCbWdabGNyZ25CbjNsamVCSjB3MElRNzdlQ2FuMFVLd2hzYXpwMVhIaGRqQ05EcnFpNnhnbnRUTHhQYW1iOWtEQ1JiZF9QeHZSVHBZWWdmanRIYkVCekJhcUdZY2N1d2tDbTVmNFladW5fdFJoUEdhaFRFLWZBblFKanhxQmlLOXFRR1hjX203cmxGamF3bl9CVXdVMzlnNFRzTXdwTlU1eHlFLUJJUHI00gHYAUFVX3lxTE1nX1NhNzNlaEZBMmhVQUU5TnVzMnRlNy1pM1RsMVBTSzVuSGhYWTBmMjA0d1ZfSWpVVEpvcWY1WklGQk82TUdNS2NGM2Q2bnQxWFZzLUVqd3FwSFBCOENDd0JLdHltZW9nZ0UzMzVvak1nQVVsUWJQaHg5bzJFbU9KZ0FOaUo5VjRXcjM3czgwV2ZoOFRteTFFdGtUN2thQnhGSmhFLTVndkwzUG8ydWpPaWpiMG9tRWxsbW1jTXNtYTRncDhkazFJWUVub04xaW5oVVdndWdrdw?oc=5	Thomas Kwan: GP jailed for trying to kill mother's partner by poisoning him with fake COVID booster jab - Sky News	Thomas Kwan, 53, had initially denied attempted murder but changed his plea after he heard the prosecution open the case against him in October.	https://e3.365dm.com/24/10/1600x900/skynews-thomas-kwan-disguise_6709421.jpg?20241007141014	2024-11-06 12:45:00	Sky News
gb	https://www.bbc.com/news/articles/clyvllrw3dxo	Lucy Letby offered 'tips' on how to get away with murder, inquiry told - Sky News	McBride expressed  gratitude to Delaware voters and their "values" and promised to work to improve their lives.	https://ichef.bbci.co.uk/news/1024/branded_news/2a48/live/9b42c6b0-9c31-11ef-82c3-45a801b7330b.jpg	2024-11-06 21:03:35	Sky News
gb	https://www.theguardian.com/world/2024/nov/06/woman-unfairly-dismissed-over-gender-critical-views-to-get-69000-payout	Woman unfairly dismissed over gender-critical views to get £69,000 payout - The Guardian	Tribunal ruled in May that Roz Adams was constructively dismissed by Edinburgh Rape Crisis Centre	https://i.guim.co.uk/img/media/f04dd3bcbb4cee919eac0d2b30fb4596d0f8983d/0_16_5616_3371/master/5616.jpg?width=1200&height=630&quality=85&auto=format&fit=crop&overlay-align=bottom%2Cleft&overlay-width=100p&overlay-base64=L2ltZy9zdGF0aWMvb3ZlcmxheXMvdGctZGVmYXVsdC5wbmc&enable=upscale&s=e219cb0f7554c35ddca3e659febbf066	2024-11-06 19:05:00	The Guardian
gb	https://www.ft.com/content/002fe4ce-14f3-44b5-a617-6015d0c3e11d	US election 2024 as it happened: World leaders congratulate Trump, Republicans’ control of Senate swells - Financial Times		https://www.ft.com/__origami/service/image/v2/images/raw/https%3A%2F%2Fwww.ft.com%2F__origami%2Fservice%2Fimage%2Fv2%2Fimages%2Fraw%2Fhttps%253A%252F%252Fd1e00ek4ebabms.cloudfront.net%252Fproduction%252F9166b445-4964-40df-a6f4-c44171205fbb.jpg%3Fsource%3Dnext-article%26fit%3Dscale-down%26quality%3Dhighest%26width%3D700%26dpr%3D1?source=next-opengraph&fit=scale-down&width=900	2024-11-06 17:39:47	Financial Times
gb	https://www.manchestereveningnews.co.uk/news/uk-news/m6-crash-one-dead-multiple-30313825	M6 crash: One dead with multiple others seriously injured after lorry crosses carriageway and overturns - Manchester Evening News	None	None	2024-11-06 17:06:00	Manchester Evening News
gb	https://news.google.com/rss/articles/CBMijgFBVV95cUxOME04TXVueHRTRmVUbC13NTRKSlpzbXVYZHFiNm5vWGFYMjZYODB0cVBBaW5TLWQ2NGhhMlZ4STA4TTY1SEZoel9OREJUcVo4QTByRFlEdDJ1M2xSMXBGMUVhYmszWE1IUTVCbVI2QWhlV254anVERnAyNXdfZ1VZTHNiY043dF9iNlI3OExR0gGWAUFVX3lxTFB3d1p2YnVjTEZkV01uN1ZfTk1fSy04NjFjQVZTbFNPSlN4eElQbXNhSHhUODRPQ0xpSUthNFJxaEVGeDBFb2ZLMTRBNzRpVFV1eWMzVk94YTFHRDhBd1lyLV8wcXMybEtBNDZTaVpZakU1ZUpPMW1qU1YtQ2YxSzV1TXJ6RlVOWE9aM0VrNlZFOU9feUZtdw?oc=5	Inside Anfield: The unseen story of Liverpool 4-0 Leverkusen - Liverpool FC	Enjoy the unseen story of Liverpool's 4-0 win over Bayer Leverkusen in the Champions League with 'Inside Anfield'.	https://backend.liverpoolfc.com/sites/default/files/styles/lg/public/2024-11/inside-anfield-061124.jpg?itok=S_JC6FVD	2024-11-06 20:09:58	Liverpool FC
gb	https://www.eurosport.com/football/champions-league/2024-2025/live-crvena-zvezda-fc-barcelona_mtc1525267/live-commentary.shtml	Crvena Zvezda - FC Barcelona live: Champions League - Football - TNT Sports	Get the latest Football updates on Eurosport. Catch Crvena Zvezda - FC Barcelona live on 06/11/2024. Find scores, stats and comments in real time.	https://dnl.eurosport.com/sd/img/og/eurosport.jpg	2024-11-06 22:00:50	TNT Sports
gb	https://www.101greatgoals.com/free-bets/psg-vs-athletico-madrid-ucl-betting-offers-free-bets-betting-tips/	PSG vs Athletico Madrid - UCL Betting Offers, Free Bets & betting Tips - 101 Great Goals	Ahead of PSG vs Athletico Madrid, the best betting sites in the UK are offering top-quality welcome offers to new customers! Click here for more!	https://www.101greatgoals.com/wp-content/uploads/2024/11/Screenshot-2024-11-06-at-1.27.22 pm.png	2024-11-06 13:47:46	101 Great Goals
gb	https://www.dailymail.co.uk/femail/article-14049639/Winnie-Harlow-Heidi-Klum-joined-Robert-Irwin-star-studded-green-carpet-Prince-Williams-Earthshot-Prize-Awards-Cape-Town.html	Prince of Wales joins star-studded guests including Heidi Klum and Winnie Harlow at the Earthshot Awards in Ca - Daily Mail	Tonight's awards in Cape Town will be held in a reusable eco 'super dome' with a green carpets for guests who include host Billy Porter and models Heidi Klum and Winnie Harlow .	https://i.dailymail.co.uk/1s/2024/11/06/17/91766533-0-image-m-55_1730915276221.jpg	2024-11-06 17:04:02	Daily Mail
gb	https://www.ft.com/content/6804f4d4-3083-47db-a60b-a86f360e9341	US stocks hit record high and investors dump bonds after Donald Trump clinches victory - Financial Times	Dollar rallies in its best day in 2 years as ‘Trump trades’ sweep through global markets	https://www.ft.com/__origami/service/image/v2/images/raw/https%3A%2F%2Fwww.ft.com%2F__origami%2Fservice%2Fimage%2Fv2%2Fimages%2Fraw%2Fhttps%253A%252F%252Fd1e00ek4ebabms.cloudfront.net%252Fproduction%252F33d0ccee-6e58-4865-a02c-6e509809942f.jpg%3Fsource%3Dnext-article%26fit%3Dscale-down%26quality%3Dhighest%26width%3D700%26dpr%3D1?source=next-opengraph&fit=scale-down&width=900	2024-11-06 21:44:45	Financial Times
gb	https://news.google.com/rss/articles/CBMihgFBVV95cUxPUUxpazBlR0VlR2R2bDlPM1N3M181UG5heE1WbmZDMlRDRk5DZmMzOWhHQnp2Y0xpaXd2bzJKVVBSS0JaM3htRG9tZTFieWxNTjJGaGI0QTY0ZFZ5R2luTU1ieFRUcGptdlM1NzJjRGNCd0QzZC1ta1hwT01WSlpSUFZCQnhYdw?oc=5	Fans will love Christoph Baumgartner's claim about Celtic players - The Celtic Bhoys	None	None	2024-11-06 13:15:58	The Celtic Bhoys