country_code	url	title	description	image_url	publish_date	source
gb	https://news.sky.com/story/starmer-needs-to-suck-it-up-and-invite-donald-trump-on-a-state-visit-baroness-harriet-harman-says-13250040	Starmer needs to 'suck it up' and invite Donald Trump on a state visit, Baroness Harriet Harman says - Sky News	The prime minister congratulated the US president-elect on his victory but has previously called his comments "absolutely repugnant".	https://e3.365dm.com/24/11/1600x900/skynews-trump-starmer-electoral-dysfunction_6741738.jpg?20241107154828	2024-11-07 17:10:51	Sky News
gb	https://www.independent.co.uk/news/uk/politics/kemi-badenoch-poll-tory-leader-b2643357.html	Kemi Badenoch slashes two points off Labour’s lead in her first week as Tory leader - The Independent	Exclusive: The latest weekly tracker poll by Techne UK suggests that Kemi Badenoch has already made an impression with voters 	https://static.independent.co.uk/2024/11/06/13/7562e802f73998081501160ab999f098Y29udGVudHNlYXJjaGFwaSwxNzMwOTg0MjI4-2.78114883.jpg?quality=75&width=1200&auto=webp	2024-11-08 07:54:21	The Independent
gb	https://www.economist.com/interactive/graphic-detail/2024/11/07/five-charts-show-how-trump-won-the-election	Five charts show how Trump won the election - The Economist	Where did he pick up support compared with 2020?	https://www.economist.com/interactive/graphic-detail/2024/11/07/five-charts-show-how-trump-won-the-election/promo.jpg	2024-11-07 21:10:06	The Economist
gb	https://www.theguardian.com/politics/2024/nov/08/david-lammy-dismisses-past-criticism-donald-trump-old-news	Lammy dismisses past criticism calling Trump a ‘sociopath’ as ‘old news’ - The Guardian	British foreign secretary says many politicians have said ‘pretty ripe things’ about US president-elect	https://i.guim.co.uk/img/media/bda3538d102be22e8416aef84b457769cb2ea30f/0_0_4000_2400/master/4000.jpg?width=1200&height=630&quality=85&auto=format&fit=crop&overlay-align=bottom%2Cleft&overlay-width=100p&overlay-base64=L2ltZy9zdGF0aWMvb3ZlcmxheXMvdGctZGVmYXVsdC5wbmc&enable=upscale&s=c3618a33022a97c8e502688a2eea8c02	2024-11-08 18:00:00	The Guardian
gb	https://news.sky.com/story/leigh-pateman-admits-murder-of-woman-who-died-two-years-after-he-set-her-on-fire-13250555	Leigh Pateman admits murder of Ellen Marshall who died two years after he set her on fire - Sky News	Pateman caused "significant burns" to Ms Marshall after he poured petrol over her and set the fuel alight in Skegness in April 2021.	https://e3.365dm.com/24/11/1600x900/skynews-leigh-pateman-ellen-marshall_6742500.jpg?20241108133119	2024-11-08 14:03:45	Sky News
gb	https://news.stv.tv/west-central/man-charged-over-fatal-crash-after-woman-struck-by-pick-up-truck	Man charged over fatal crash after woman struck by pick-up truck - STV News	Victoria Cairns, 40, died in hospital four days after the incident.	https://news.stv.tv/wp-content/uploads/2024/11/cdc0f4c9d88647e3a1aa5da586decea0-1730986021-social-default.jpg	2024-11-07 20:28:24	STV News
gb	https://www.ft.com/content/6cfec250-0e0e-4cd8-ba97-60e07f5fae1d	‘Brave new world’: Donald Trump’s victory signals end of US-led postwar order - Financial Times	Election result throws multinational policymaking into disarray	https://www.ft.com/__origami/service/image/v2/images/raw/https%3A%2F%2Fd1e00ek4ebabms.cloudfront.net%2Fproduction%2Fdd33a55a-e9b3-456a-af95-2c0a2da6bbe7.jpg?source=next-article&fit=scale-down&quality=highest&width=700&dpr=1	2024-11-07 19:44:42	Financial Times
gb	https://www.ft.com/content/f4dbc0df-ab0d-431e-9886-44acd4236922	Francis Fukuyama: what Trump unleashed means for America - Financial Times	The Republican president-elect is inaugurating a new era in US politics and perhaps for the world as a whole	https://www.ft.com/__origami/service/image/v2/images/raw/https%3A%2F%2Fd1e00ek4ebabms.cloudfront.net%2Fproduction%2Fb0b5d6cd-8a03-4150-8f09-d40db81baec6.jpg?source=next-article&fit=scale-down&quality=highest&width=700&dpr=1	2024-11-08 05:02:03	Financial Times
gb	https://www.economist.com/leaders/2024/11/07/europe-needs-to-wake-up-and-look-after-itself	Europe needs to wake up and look after itself - The Economist	The biggest obstacle is Germany, which now urgently needs elections	https://www.economist.com/content-assets/images/20241109_LDP002.jpg	2024-11-07 14:13:37	The Economist
gb	https://www.theguardian.com/uk-news/2024/nov/08/met-officer-who-killed-jean-charles-de-menezes-on-tube-defends-his-actions	Met officer who killed Jean Charles de Menezes on tube defends his actions - The Guardian	Retired officer says he feared he was about to die when he shot innocent man he mistook for terrorist in 2005	https://i.guim.co.uk/img/media/853662149e084dbd0632bc6da9fff323d2889130/229_0_1098_659/master/1098.jpg?width=1200&height=630&quality=85&auto=format&fit=crop&overlay-align=bottom%2Cleft&overlay-width=100p&overlay-base64=L2ltZy9zdGF0aWMvb3ZlcmxheXMvdGctZGVmYXVsdC5wbmc&enable=upscale&s=9c9da4739dca620d1ef89b3414c875cf	2024-11-08 21:00:00	The Guardian
gb	https://www.bbc.com/news/articles/cr5mrp9g2n0o	Al Fayed: Watchdog to review police handling of abuse claims - BBC.com	The Independent Office for Police Conduct will review two cases the Met Police investigated in 2008 and 2013.	https://ichef.bbci.co.uk/news/1024/branded_news/f82b/live/8ad3c9f0-9e07-11ef-9260-19e6a950e830.jpg	2024-11-07 22:15:03	BBC.com
gb	https://www.theguardian.com/uk-news/2024/nov/08/anticyclonic-gloom-blamed-for-englands-cloudy-november-but-brighter-weather-ahead	‘Anticyclonic gloom’ blamed as English village sees no sunshine since October - The Guardian	UK has had average of just three hours of sun over past week, but skies should start to clear from Sunday	https://i.guim.co.uk/img/media/6d0e5a9d2f61fd84c0946b6e4dc1c4a5fc4c79aa/122_260_3370_2023/master/3370.jpg?width=1200&height=630&quality=85&auto=format&fit=crop&overlay-align=bottom%2Cleft&overlay-width=100p&overlay-base64=L2ltZy9zdGF0aWMvb3ZlcmxheXMvdGctZGVmYXVsdC5wbmc&enable=upscale&s=5c6d27fe9d564ad473ea695da36529db	2024-11-08 17:43:00	The Guardian
gb	https://www.telegraph.co.uk/us/news/2024/11/08/trump-prosecutor-jack-smith-cancels-court-dates/	Top Trump prosecutor cancels remaining court dates - The Telegraph	None	None	2024-11-08 19:31:00	The Telegraph
gb	https://news.sky.com/story/manchester-arena-survivors-awarded-45k-after-harassment-claim-against-former-tv-producer-13250608	Manchester Arena survivors awarded £45,000 after harassment claim against former TV producer Richard Hall - Sky News	Martin Hibbert and his daughter Eve were two of hundreds injured when Salman Abedi detonated a rucksack bomb at the Ariana Grande show on 22 May 2017.	https://e3.365dm.com/24/07/1600x900/skynews-richard-hall-court_6638865.jpg?20240725133522	2024-11-08 15:11:15	Sky News
gb	https://www.theguardian.com/politics/2024/nov/08/downing-street-to-appoint-new-us-ambassador-within-days	Downing Street to decide upon new US ambassador within days - The Guardian	David Miliband, Peter Mandelson and Cathy Ashton thought to be on shortlist for diplomatic role	https://i.guim.co.uk/img/media/f1d049f03c7d689cd6cd156ec5e74011f7c41cc7/0_200_3000_1800/master/3000.jpg?width=1200&height=630&quality=85&auto=format&fit=crop&overlay-align=bottom%2Cleft&overlay-width=100p&overlay-base64=L2ltZy9zdGF0aWMvb3ZlcmxheXMvdGctZGVmYXVsdC5wbmc&enable=upscale&s=d7cf852fc54a1d099ca030ef707086c2	2024-11-08 20:17:00	The Guardian
gb	https://www.bbc.com/news/articles/cr5mr7292plo	MSP husband of Strictly star Punan Krishan saves man's life - BBC.com	Dr Sandesh Gulhane, husband of TV doctor Punam Krishan, gave the man CPR at the Scottish Parliament.	https://ichef.bbci.co.uk/news/1024/branded_news/7776/live/8c804ca0-9db3-11ef-8b61-f31b39ee3253.jpg	2024-11-08 17:09:28	BBC.com
gb	https://www.theguardian.com/science/2024/nov/07/identity-of-casts-of-victims-at-pompeii-not-all-they-seem-research-suggests	Identity of casts of victims at Pompeii not all they seem, research suggests - The Guardian	Scientists studying DNA find one person in scene of cowering family was a man and not a ‘mother’	https://i.guim.co.uk/img/media/72bcff5cdfc724797f56014434a9504bd4bf6248/0_814_5440_3264/master/5440.jpg?width=1200&height=630&quality=85&auto=format&fit=crop&overlay-align=bottom%2Cleft&overlay-width=100p&overlay-base64=L2ltZy9zdGF0aWMvb3ZlcmxheXMvdGctZGVmYXVsdC5wbmc&enable=upscale&s=0c90980d436ce86966a51e615b803a69	2024-11-07 21:43:00	The Guardian
gb	https://www.bbc.co.uk/news/articles/cz9x32eeegko	Trump tariffs could cost UK £22bn of exports - BBC	The UK could face a £22bn hit to its exports if Donald Trump carries out his tariff threats, researchers say. 	https://ichef.bbci.co.uk/news/1024/branded_news/a26a/live/7fa9ab40-9dfc-11ef-8014-35a78d259b7b.jpg	2024-11-08 19:06:58	BBC
gb	https://www.bbc.com/news/articles/cn012ed0z2ro	Russia-Ukraine war: Russia jails soldiers who killed entire family in Ukraine - BBC.com	The sentence, handed down by a Russian court, is a rare example of the country holding its troops to account for war crimes.	https://ichef.bbci.co.uk/news/1024/branded_news/fe81/live/6d3baf20-9dee-11ef-808e-0dcb1d069917.jpg	2024-11-08 18:26:05	BBC.com
gb	https://www.ft.com/content/ccf49df1-9fcb-48ec-a4e8-e8ca5eaafd29	The Maga court: inside Donald Trump’s new White House - Financial Times	His first term was heavily reliant on the party establishment. The inner circle now includes several billionaires and is in tune with the ideas of the new right	https://www.ft.com/__origami/service/image/v2/images/raw/https%3A%2F%2Fd1e00ek4ebabms.cloudfront.net%2Fproduction%2Fa031d423-bc49-4420-8c6e-132c2f57903e.jpg?source=next-article&fit=scale-down&quality=highest&width=700&dpr=1	2024-11-08 19:01:12	Financial Times
gb	https://www.carbonbrief.org/experts-what-does-a-trump-presidency-mean-for-climate-action/	Experts: What does a Trump presidency mean for climate action? - Carbon Brief	None	None	2024-11-07 15:09:48	Carbon Brief
gb	https://www.theguardian.com/politics/2024/nov/08/jonathan-powell-tony-blair-former-chief-of-staff-appointed-national-security-adviser	Tony Blair’s former chief of staff appointed PM’s national security adviser - The Guardian	Jonathan Powell led talks on Chagos Islands in September and played key role in Good Friday agreement	https://i.guim.co.uk/img/media/21f624eccc92511743d6b828151ad987827e00a2/0_337_3744_2245/master/3744.jpg?width=1200&height=630&quality=85&auto=format&fit=crop&overlay-align=bottom%2Cleft&overlay-width=100p&overlay-base64=L2ltZy9zdGF0aWMvb3ZlcmxheXMvdGctZGVmYXVsdC5wbmc&enable=upscale&s=4ca5fc3b738c0181841d5ee57c0db1a4	2024-11-08 12:43:00	The Guardian
gb	https://news.sky.com/us-election-live	Trump elected president - Sky News	The US Justice Department has revealed criminal charges relating to a thwarted Iranian plot to kill Donald Trump before this week's presidential election; the president-elect has started appointing people in his top team.	https://e3.365dm.com/24/11/1600x900/skynews-trump-assassination_6742945.jpg?20241108211319	2024-11-05 23:03:10	Sky News
gb	https://www.ft.com/content/bfac800d-538d-4fac-a5ca-77b18c26f7aa	Putin says Trump’s Ukraine proposals merit attention - Financial Times	Russian president congratulates Republican leader on his election victory	https://www.ft.com/__origami/service/image/v2/images/raw/https%3A%2F%2Fd1e00ek4ebabms.cloudfront.net%2Fproduction%2Fb76fa901-2f77-43ff-b6f2-853801eb356f.jpg?source=next-article&fit=scale-down&quality=highest&width=700&dpr=1	2024-11-07 21:59:41	Financial Times
gb	https://www.bbc.com/news/articles/cqxwg3pjxleo	Government ditches ban on wood-burning stoves in newbuild homes - BBC.com	There had been concerns that a ban on wood and peat burners would have a negative impact on people living in rural areas.	https://ichef.bbci.co.uk/news/1024/branded_news/7167/live/a68c2ae0-9db5-11ef-8b61-f31b39ee3253.png	2024-11-08 14:36:33	BBC.com
gb	https://www.planetrugby.com/news/ireland-player-ratings-v-all-blacks-underwhelming-performances-as-the-benchs-mare-undoes-back-rowers-brilliance	Ireland player ratings v All Blacks: 'Underwhelming' performances as the bench's 'mare' undoes back-rowers 'brilliance' - planetrugby.com	Following Ireland's 23-13 loss to the All Blacks at the Aviva Stadium, here is how we rated Andy Farrell's men in their Autumn Nations Series defeat.	https://d3gbf3ykm8gp5c.cloudfront.net/content/uploads/2024/11/08222119/Ireland-players-James-Lowe-and-Josh-van-der-Flier-1.jpg	2024-11-08 22:36:52	planetrugby.com
gb	https://www.arsenal.com/news/team-news-mead-and-zinsberger-start	Team news: Mead and Zinsberger start - Arsenal.com	None	None	2024-11-08 18:02:28	Arsenal.com
gb	https://www.bbc.com/sport/tennis/articles/c2l97wp57l8o	Cameron Norrie reaches ATP Tour final by beating Corentin Moutet at Moselle Open - BBC.com	Britain's Cameron Norrie will contest his first ATP final since February 2023 after a straight-set victory over Corentin Moutet at the Moselle Open.	https://ichef.bbci.co.uk/news/1024/branded_sport/dbe8/live/cf4cdbc0-9def-11ef-828f-5bd3f69aa1a6.jpg	2024-11-08 17:13:52	BBC.com
gb	https://www.football.london/tottenham-hotspur-fc/news/new-tottenham-leader-emerging-club-30330552	The new Tottenham leader emerging at the club and Jose Mourinho's inadvertent role in Spurs defeat - Football.London	None	None	2024-11-08 16:40:31	Football.London
gb	https://www.telegraph.co.uk/us/politics/2024/11/08/iran-ordered-hitman-to-take-out-trump-during-election-week/	Trump assassination attempt latest: Iran ordered hitman during election week - The Telegraph	None	None	2024-11-08 20:13:00	The Telegraph
gb	https://www.independent.co.uk/news/world/europe/amsterdam-israel-football-ajax-maccabi-attacks-king-netherlands-b2643792.html	Dutch king says his nation failed Jewish community during football fan attacks – like during Second World War - The Independent	Amsterdam mayor condemns ‘hit and run’ attacks on Israeli football fans as ‘a dark day’ in city’s history	https://static.independent.co.uk/2024/11/08/11/SEI228745310.jpg?quality=75&width=1200&auto=webp	2024-11-08 19:29:43	The Independent
gb	https://news.sky.com/story/irish-prime-minister-simon-harris-sets-date-for-general-election-13250612	Irish president Michael D Higgins dissolves parliament beginning general election campaign - Sky News	The dissolution of Ireland's parliament on Friday  brings to an end the four-and-a-half-year lifespan of the historic Fine Gael, Fianna Fail and Green Party coalition government.	https://e3.365dm.com/24/11/1600x900/skynews-ireland-irish-politics_6742567.jpg?20241108144409	2024-11-08 16:52:30	Sky News
gb	https://www.bbc.co.uk/news/articles/cvg4387jd5xo	Sara Sharif's stepmother would not call 999, jury told - BBC	Beinash Batool searched on Google the difference between murder and manslaughter, a court hears.	https://ichef.bbci.co.uk/news/1024/branded_news/478e/live/d06e1c50-9dc5-11ef-935d-3107d1c873e8.jpg	2024-11-08 13:36:08	BBC
gb	https://www.bbc.com/news/articles/cwyge3grg7lo	Boy charged over £20,000 damage at Edinburgh Macklin Motors - BBC.com	Several vehicles on an Edinburgh forecourt had windows smashed and body work scratched during widespread disorder.	https://ichef.bbci.co.uk/news/1024/branded_news/0a7b/live/1b2381a0-9de8-11ef-af48-7de2c1e5f59f.jpg	2024-11-08 17:03:36	BBC.com
gb	https://consent.yahoo.com/v2/collectConsent?sessionId=4_cc-session_ba1bbd3c-f21f-430b-beab-428c693bb79b	Girona floods: Cars swept in Catalan holiday hotspot as Spain hit by more flash flooding - AOL UK	None	None	2024-11-08 13:09:42	AOL UK
gb	https://www.telegraph.co.uk/money/tax/inheritance/rachel-reeves-not-done-homework-family-farms/	Rachel Reeves hasn’t done her homework again – and it’s decimating the beating heart of Britain - The Telegraph	None	None	2024-11-07 09:00:00	The Telegraph
gb	https://theconversation.com/why-the-german-government-collapsed-and-what-to-expect-now-243164	Why the German government collapsed and what to expect now - The Conversation	After firing his coalition partner, chancellor Olaf Scholz is expected to call fresh elections in the new year.	https://images.theconversation.com/files/630949/original/file-20241108-17-ya8nfn.jpg?ixlib=rb-4.1.0&rect=20%2C10%2C6948%2C3469&q=45&auto=format&w=1356&h=668&fit=crop	2024-11-08 12:38:46	The Conversation
gb	https://www.bbc.com/news/articles/cje0y3gqw1po	John Smyth QC: Decades of abuse covered up by church, report says - BBC.com	John Smyth QC's abuse of more than 100 children and young men was covered up for years, a report concludes.	https://ichef.bbci.co.uk/news/1024/branded_news/2003/live/c6b64e60-9d22-11ef-a24f-d9fb8d8bafc4.jpg	2024-11-08 17:11:51	BBC.com
gb	https://www.bbc.co.uk/news/articles/c62467z05ego	People smuggler advertised Channel boat crossings on Facebook - BBC	Amanj Hasan Zada is jailed for running "a sophisticated enterprise" organising small boat crossings.	https://ichef.bbci.co.uk/news/1024/branded_news/6f66/live/184f1b00-9ddf-11ef-9260-19e6a950e830.jpg	2024-11-08 16:26:45	BBC
gb	https://www.bbc.co.uk/news/articles/c5ym2pn41rro	Zoe's Place hospice saved by huge charity appeal - BBC	The children's hospice provider needed to raise £6.4m within a month to secure its survival.	https://ichef.bbci.co.uk/news/1024/branded_news/4144/live/d9c01fa0-9dd0-11ef-8f96-81e1fa9aa97d.jpg	2024-11-08 12:18:02	BBC
gb	https://www.independent.co.uk/news/world/americas/us-politics/trump-election-news-results-live-updates-harris-b2643762.html	Election 2024 live updates: Trump begins transition; three charged in alleged Iranian plot to kill the president-elect - The Independent	President-elect Donald Trump names his victorious 2024 campaign manager as first-ever female White House chief of staff as he works on transition to Oval Office 	https://static.independent.co.uk/2024/11/07/15/SEI228572042.jpg?quality=75&width=1200&auto=webp	2024-11-09 00:00:52	The Independent
gb	https://www.bbc.co.uk/news/articles/cd9njklv5d8o	Sittingbourne: Government steps in over housing plan row - BBC	The housing secretary will decide if plans for 8,400 homes near Sittingbourne can go ahead.	https://ichef.bbci.co.uk/news/1024/branded_news/954c/live/566a3900-9db8-11ef-935d-3107d1c873e8.jpg	2024-11-08 10:08:54	BBC
gb	https://www.theguardian.com/world/2024/nov/08/relationship-between-uk-and-ukraine-has-worsened-since-labour-won-election	Relations between Ukraine and UK are worse under Labour, say Kyiv officials - The Guardian	Exclusive: Zelenskyy administration expresses frustration with Starmer over lack of missiles	https://i.guim.co.uk/img/media/d9e655aee7d0a9d354d986e33013e0608e82ebfc/0_93_4000_2400/master/4000.jpg?width=1200&height=630&quality=85&auto=format&fit=crop&overlay-align=bottom%2Cleft&overlay-width=100p&overlay-base64=L2ltZy9zdGF0aWMvb3ZlcmxheXMvdGctZGVmYXVsdC5wbmc&enable=upscale&s=9a8598402612415a8a1e9c8a74afadc4	2024-11-08 17:57:00	The Guardian
gb	https://www.bbc.co.uk/news/articles/cn5wel11pgdo	Nearly 70% of Gaza war dead women and children - UN - BBC	A UN agency verified victims from a six-month period and said it found international law violations.	https://ichef.bbci.co.uk/news/1024/branded_news/8572/live/04d49640-9de4-11ef-8538-e1655f5a8342.jpg	2024-11-08 13:20:21	BBC
gb	https://consent.yahoo.com/v2/collectConsent?sessionId=4_cc-session_a56b89d5-344a-43ac-bfc0-d87e5b839b74	Why could food prices go up when inflation is coming down? - Yahoo News UK	None	None	2024-11-08 08:54:44	Yahoo News UK
gb	https://www.independent.co.uk/life-style/georgina-cooper-dead-supermodel-age-46-b2643875.html	Supermodel Georgina Cooper dies aged 46 just months after getting married - The Independent	Cooper tragically died after developing ‘some health problems,’ her former agent says 	https://static.independent.co.uk/2024/11/08/16/PA-2125037-1.jpg?quality=75&width=1200&auto=webp	2024-11-08 17:07:00	The Independent
gb	https://www.bbc.com/sport/rugby-union/articles/ckgv4ez5jl1o	England v Australia: Wallabies plot Twickenham shock - BBC.com	England are favourites, but their ability to squander leads and signs of resurgence among Australia mean an upset is possible on Saturday.	https://ichef.bbci.co.uk/news/1024/branded_sport/08db/live/d5281ac0-9ded-11ef-8538-e1655f5a8342.jpg	2024-11-08 17:52:48	BBC.com
gb	https://www.liverpool.com/liverpool-fc-news/features/emery-favorite-liverpool-city-arsenal-30330766	Unai Emery declares 'complete favorite' in title race as Liverpool battles Man City and Arsenal - Liverpool.com	None	None	2024-11-08 17:20:45	Liverpool.com
gb	https://www.theguardian.com/football/2024/nov/08/england-did-not-contact-manchester-city-over-jack-grealish-claims-guardiola	England did not contact Manchester City over Jack Grealish, claims Guardiola - The Guardian	Pep Guardiola believes England did not consult Manchester City’s medical department before including Jack Grealish in their squad	https://i.guim.co.uk/img/media/00eb311afd74b13d03483b4634d3e8786d255a9c/0_239_7151_4291/master/7151.jpg?width=1200&height=630&quality=85&auto=format&fit=crop&overlay-align=bottom%2Cleft&overlay-width=100p&overlay-base64=L2ltZy9zdGF0aWMvb3ZlcmxheXMvdGctZGVmYXVsdC5wbmc&enable=upscale&s=c17dd3b2870578da031885eed0009d73	2024-11-08 22:30:00	The Guardian
gb	https://news.sky.com/story/trevor-sorbie-celebrity-hairdresser-dies-at-the-age-of-75-13250683	Trevor Sorbie: Celebrity hairdresser dies at the age of 75 - Sky News	The stylist revealed last month that he had been told he had just weeks to live after his bowel cancer spread to his liver.	https://e3.365dm.com/24/11/1600x900/skynews-trevor-sorbie-hairdresser_6742642.jpg?20241108154627	2024-11-08 17:09:37	Sky News