country_code	url	title	description	image_url	publish_date	source
gb	https://news.sky.com/story/taiwan-says-record-125-chinese-aircraft-and-17-warships-involved-in-military-exercise-13233417	Taiwan says 'record' 125 Chinese aircraft and 17 warships involved in military exercise - Sky News	A Chinese spokesman calls it a "major warning to those who back Taiwan independence", while the island's presidential office tells China to "stop threatening Taiwan's democracy and freedom".	https://e3.365dm.com/24/10/1600x900/skynews-china-taiwan_6715742.jpg?20241014135831	2024-10-14 13:35:04	Sky News
gb	https://www.lbc.co.uk/news/autumn-budget-2024-when-is-it-and-what-can-you-expect/	Autumn Budget 2024: When is it and what can you expect? - LBC	Chancellor Rachel Reeves will deliver Labour's first budget on Wednesday October 30 amid growing pressure to raise revenue and boost growth.	https://images.lbc.co.uk/images/682169?width=1200&crop=16_9&signature=ajlIYF_-nrX7uElUElW4msWmn50=	2024-10-14 11:53:48	LBC
gb	https://news.sky.com/story/riots-and-the-far-right-the-global-network-behind-the-violence-13232023	Riots and the far right: the global network behind the violence - Sky News	A wave of online misinformation helped spark the far-right riots in the UK after three children were killed in a stabbing attack in Southport. Sky News can now reveal who was driving the violence. 	https://e3.365dm.com/24/10/1600x900/skynews-cheshire-far-right_6716039.jpg?20241014185142	2024-10-15 03:32:52	Sky News
gb	https://www.theguardian.com/world/2024/oct/14/british-man-dies-fall-spanish-bridge-online-content	British man dies in fall from Spanish bridge ‘while creating online content’ - The Guardian	Unnamed 26-year-old fell while climbing 192-metre-high Castilla-La Mancha Bridge, authorities say	https://i.guim.co.uk/img/media/9671d57a020604bbb782ac1a56321f6a82df2c71/466_421_3733_2240/master/3733.jpg?width=1200&height=630&quality=85&auto=format&fit=crop&overlay-align=bottom%2Cleft&overlay-width=100p&overlay-base64=L2ltZy9zdGF0aWMvb3ZlcmxheXMvdGctZGVmYXVsdC5wbmc&enable=upscale&s=e4b162cea74b971ec09cb79b0209c7c2	2024-10-14 16:47:00	The Guardian
gb	https://www.politico.eu/article/king-charles-iii-snubbed-australia-state-leaders-visit-insult-uk/	‘A monumental insult’: Aussie state leaders snub King Charles visit - POLITICO Europe	It’s a “slap in the face,” a monarchist group’s spokesperson said.	https://www.politico.eu/cdn-cgi/image/width=1200,height=630,fit=crop,quality=80,onerror=redirect/wp-content/uploads/2024/10/14/GettyImages-2172367088-scaled.jpg	2024-10-14 16:04:00	POLITICO Europe
gb	https://www.ft.com/content/352a769e-0804-4843-9450-b28b01d40b17	EU countries call on Britain to commit to Brussels-led peacekeeping mission - Financial Times	Foreign ministers urge UK to take part in conflict prevention as London pushes for deeper security co-operation	https://www.ft.com/__origami/service/image/v2/images/raw/https%3A%2F%2Fwww.ft.com%2F__origami%2Fservice%2Fimage%2Fv2%2Fimages%2Fraw%2Fhttps%253A%252F%252Fd1e00ek4ebabms.cloudfront.net%252Fproduction%252Fe278981e-cf67-4e8a-b729-ff0f7a7731ad.jpg%3Fsource%3Dnext-article%26fit%3Dscale-down%26quality%3Dhighest%26width%3D700%26dpr%3D1?source=next-opengraph&fit=scale-down&width=900	2024-10-14 16:59:19	Financial Times
gb	https://www.theguardian.com/politics/2024/oct/15/david-cameron-planning-sanctions-two-israeli-ministers	David Cameron says he was planning sanctions against two Israeli ministers - The Guardian	Ex-foreign secretary says targeting of Bezalel Smotrich and Itamar Ben-Gvir was deemed too political amid election	https://i.guim.co.uk/img/media/b6ed284fc279db91dd10774e2892dde02c00ab1b/0_0_3794_2277/master/3794.jpg?width=1200&height=630&quality=85&auto=format&fit=crop&overlay-align=bottom%2Cleft&overlay-width=100p&overlay-base64=L2ltZy9zdGF0aWMvb3ZlcmxheXMvdGctZGVmYXVsdC5wbmc&enable=upscale&s=97f568aab5b20b6fdc9be8b147206a3d	2024-10-15 07:51:00	The Guardian
gb	https://www.theguardian.com/world/2024/oct/14/israeli-airstrike-kills-christian-town-northern-lebanon-gaza	Israeli airstrike kills more than 20 in northern Lebanon as UN peacekeeping row grows - The Guardian	Hezbollah fires rockets at Tel Aviv in wake of Israeli attack on Christian town, as UN security council voiced strong concern over IDF attacks on peacekeepers	https://i.guim.co.uk/img/media/d0d25319d0c6d31bc70ce47cc6feeea22b9879b9/383_144_3682_2209/master/3682.jpg?width=1200&height=630&quality=85&auto=format&fit=crop&overlay-align=bottom%2Cleft&overlay-width=100p&overlay-base64=L2ltZy9zdGF0aWMvb3ZlcmxheXMvdGctZGVmYXVsdC5wbmc&enable=upscale&s=4e52b51bbaea8d4b398172867fa4eb91	2024-10-14 17:42:00	The Guardian
gb	https://www.ft.com/content/5b884be4-c883-421b-89d6-32cf860e97df	Israel races to supply anti-missile shield - Financial Times	Intense war demands have left the IDF relying on the US to fill gaps in air defences	https://www.ft.com/__origami/service/image/v2/images/raw/https%3A%2F%2Fwww.ft.com%2F__origami%2Fservice%2Fimage%2Fv2%2Fimages%2Fraw%2Fhttps%253A%252F%252Fd1e00ek4ebabms.cloudfront.net%252Fproduction%252F3441250e-170d-4c8d-bd60-aa1a254d1cfe.jpg%3Fsource%3Dnext-article%26fit%3Dscale-down%26quality%3Dhighest%26width%3D700%26dpr%3D1?source=next-opengraph&fit=scale-down&width=900	2024-10-15 04:09:44	Financial Times
gb	https://www.bbc.com/news/articles/cy435yk4vj4o	Families 'left in lurch' on child autism diagnoses, report warns - BBC.com	Support services are failing to meet high demand, says the Children's Commissioner for England.	https://ichef.bbci.co.uk/news/1024/branded_news/28e9/live/c08af740-8ad3-11ef-9231-ffb18d2f2783.jpg	2024-10-15 02:53:48	BBC.com
gb	https://www.independent.co.uk/news/uk/politics/keir-starmer-commonwealth-summit-reparations-b2629318.html	‘We do not pay reparations’: Starmer rejects slavery atonement bid ahead of Commonwealth summit - The Independent	Sir Keir Starmer has set out the Labour government’s position on the slavery reparations ahead of the Commonwealth Heads of Government meeting this month 	https://static.independent.co.uk/2024/10/14/20/97d19964582333b91cfba879166dca34Y29udGVudHNlYXJjaGFwaSwxNzI5MDE5NDMw-2.77803579.jpg?quality=75&width=1200&auto=webp	2024-10-15 08:36:46	The Independent
gb	https://www.gov.uk/government/news/thousands-of-new-homes-to-be-built-as-government-unlocks-brownfield-sites	Thousands of new homes to be built as government unlocks brownfield sites - GOV.UK	Thousands of new homes to be built as part of the government’s plans to get the country building again.	https://assets.publishing.service.gov.uk/media/670e13d6080bdf716392f333/s960_2024-10-14_Housing_GOV.UK_HEADLINE.png	2024-10-14 23:00:00	GOV.UK
gb	https://www.bbc.com/news/articles/c2kdye8z8llo	'Pure chance' Dawn Sturgess sprayed herself with novichok before meeting daughter, inquiry hears - Sky News	Elliot wants to live independently - but making that happen proved a bigger challenge than he expected.	https://ichef.bbci.co.uk/news/1024/branded_news/c00a/live/6298c4d0-8a3a-11ef-81f8-1f28bcc5be15.png	2024-10-15 09:46:50	Sky News
gb	https://www.bbc.com/news/articles/cp95ld7mll5o	Chris Kaba shooting: Met Police officer gives evidence - BBC.com	Chris Kaba was shot in the head by a police marksman after being stopped in south London.	https://ichef.bbci.co.uk/news/1024/branded_news/eeff/live/0511a210-8a16-11ef-8936-1185f9e7d044.jpg	2024-10-14 20:10:05	BBC.com
gb	https://www.bbc.com/news/articles/cjd54zd0ezjo	Obesity: Unemployed could get weight loss jabs to return to work - BBC.com	The health secretary announces trials to explore the effect of weight loss drugs on worklessness.	https://ichef.bbci.co.uk/news/1024/branded_news/6dec/live/cd9a6070-8acd-11ef-b6b0-c9af5f7f16e4.png	2024-10-15 10:16:46	BBC.com
gb	https://www.lbc.co.uk/news/father-of-woman-died-ottoman-bed-collapsed-lost-son-16-motorbike-accident/	Devastated father of woman who died when her Ottoman bed collapsed also lost son, 16, in motorbike accident - LBC	The devastated father of a woman who died when her Ottoman bed collapsed on her also lost his son in a motorbike accident.	https://images.lbc.co.uk/images/682128?width=1200&crop=16_9&signature=R_WSAlr4oPbBxgqS_FcheRO3ARI=	2024-10-15 04:58:51	LBC
gb	https://www.theguardian.com/world/2024/oct/15/briton-adriana-brownlee-youngest-woman-to-climb-worlds-14-highest-peaks	Briton becomes youngest woman to climb world’s 14 highest peaks - The Guardian	Adriana Brownlee, 23, reaches summit of Shishapangma three years after setting target at top of Everest	https://i.guim.co.uk/img/media/b27395441112792d40b69b4cb1941fb4d6f7a43b/0_1430_3024_1813/master/3024.jpg?width=1200&height=630&quality=85&auto=format&fit=crop&overlay-align=bottom%2Cleft&overlay-width=100p&overlay-base64=L2ltZy9zdGF0aWMvb3ZlcmxheXMvdGctZGVmYXVsdC5wbmc&enable=upscale&s=fa3ba6ffca61a4c5a32a851f048dc151	2024-10-15 10:02:00	The Guardian
gb	https://news.sky.com/story/pure-chance-dawn-sturgess-sprayed-herself-with-novichok-before-meeting-daughter-inquiry-hears-13233880	'Pure chance' Dawn Sturgess sprayed herself with novichok before meeting daughter, inquiry hears - Sky News	The 44-year-old died after unwittingly applying the nerve agent to her skin following the discovery of a perfume bottle in Amesbury, Wiltshire, in July 2018.	https://e3.365dm.com/24/10/1600x900/skynews-dawn-sturgess-novichok_6716441.jpg?20241015105944	2024-10-15 09:46:50	Sky News
gb	https://www.politico.eu/article/eu-unite-pressing-israel-stop-attacking-un-forces-josep-borrell-lebanon/	EU unites in pressing Israel to stop attacking UN forces - POLITICO Europe	None	None	2024-10-14 14:26:00	POLITICO Europe
gb	https://www.bbc.co.uk/news/articles/cly78r8wzl2o	Kent: Brown bear recovering 'remarkably well' after brain surgery - BBC	'He still isn’t out of the woods and has a long way to go yet,' says Canterbury's Wildwood Trust. 	https://ichef.bbci.co.uk/news/1024/branded_news/828a/live/afcfe5d0-8ac6-11ef-942d-05f36e427c1d.jpg	2024-10-15 07:48:01	BBC
gb	https://www.bbc.com/news/articles/c8djn93l13po	Duchess shocked by sexual exploitation of refugees in Sudan - BBC.com	The Duchess of Edinburgh visits Chad and hears the experiences of women who have escaped violence in Sudan.	https://ichef.bbci.co.uk/news/1024/branded_news/8ccf/live/bb84e430-8a75-11ef-bda1-230324566b82.jpg	2024-10-15 01:44:42	BBC.com
gb	https://www.theguardian.com/politics/live/2024/oct/15/employers-national-insurance-reeves-starmer-streeting-uk-politics-live	Starmer rejects Tory claim raising employers’ national insurance would break manifesto promise – UK politics live - The Guardian	The prime minister said it was ‘very clear’ in the manifesto that Labour would not raise taxes on working people	https://i.guim.co.uk/img/media/70a867574d0741f6687a300f820b07cc5d84d1c3/0_166_5820_3492/master/5820.jpg?width=1200&height=630&quality=85&auto=format&fit=crop&overlay-align=bottom%2Cleft&overlay-width=100p&overlay-base64=L2ltZy9zdGF0aWMvb3ZlcmxheXMvdGctbGl2ZS5wbmc&enable=upscale&s=fa887b2fbb38a9cf879dfd1aaa93919d	2024-10-15 07:24:00	The Guardian
gb	https://www.independent.co.uk/news/uk/crime/sara-sharif-father-injuries-pakistan-stepmother-trial-latest-news-b2629467.html	Sara Sharif murder trial latest: Schoolgirl found with ‘disturbing’ injuries as father’s 999 call revealed - The Independent	Second day of trial underway after court heard on Monday Urfan Sharif told police ‘I’ve killed my daughter’ in 999 call	https://static.independent.co.uk/2024/10/14/02/64852edc5ae27f142ecac4e62e997ec0Y29udGVudHNlYXJjaGFwaSwxNzI4NzQ2ODM2-2.73729546.jpg?quality=75&width=1200&auto=webp	2024-10-15 05:27:20	The Independent
gb	https://news.google.com/rss/articles/CBMivgFBVV95cUxORHE1SHBjSHZnLW5CbjJzS2otcU5XT1NTbGdwdzA3TThyLUw0QkxOdUVOcTNFWjczR3Awd3Bmal9BeTgyNEQ0NXI5RVctQW14UGV3VThfZ3FGY1EtaF91ekZ3WlVpbU5lSVZWdzQ0dmJnQkJFaVRJRTJwWmlfcEV5b3lTYVctZkpsUkRYZzRJREFsemhfUVFXTF81SGFTa25fc1R5V0VWQ0FnS2o1OUlUd0d4UmJYVVhPcUJIT2ZR?oc=5	Harris turns Trump’s threats on ‘enemy within’ against him as she campaigns in battleground Pennsylvania - The Independent	The Vice President is taking the fight to Trump as polls tighten with just three weeks until Americans go to the polls on Election Day 	https://static.independent.co.uk/2024/10/15/01/SEI225645328.jpg?quality=75&width=1200&auto=webp	2024-10-15 00:48:57	The Independent
gb	https://www.theguardian.com/world/2024/oct/15/north-korea-blows-up-roads-to-south	North Korea blows up roads linking it with South, prompting warning shots at border - The Guardian	Roads have long been unused but destroying them sends clear message Pyongyang does not want to negotiate with Seoul, experts say	https://i.guim.co.uk/img/media/b086c84f823e9d884cedb70d688506cb750f7eb1/0_138_4128_2477/master/4128.jpg?width=1200&height=630&quality=85&auto=format&fit=crop&overlay-align=bottom%2Cleft&overlay-width=100p&overlay-base64=L2ltZy9zdGF0aWMvb3ZlcmxheXMvdGctZGVmYXVsdC5wbmc&enable=upscale&s=c49eae6d1faf0c779042166902e45ab5	2024-10-15 05:27:00	The Guardian
gb	https://www.bbc.com/news/articles/c93p4p473v2o	Capital gains tax won't rise to 39%, Keir Starmer suggests - BBC.com	The prime minister said reports the levy could be hiked to this level were "wide of the mark".	https://ichef.bbci.co.uk/news/1024/branded_news/e0e0/live/7d447240-8a4c-11ef-bfc8-8d44fdcd35f5.png	2024-10-15 03:19:20	BBC.com
gb	https://www.bbc.co.uk/news/articles/czj9ly33e7go	Jury shown CCTV of moments leading up to fatal stabbings - BBC	The teenagers were killed in a case of mistaken identity, the court has been told.	https://ichef.bbci.co.uk/news/1024/branded_news/05db/live/0b220d20-8a5c-11ef-bfff-fbac175bff93.jpg	2024-10-14 19:54:47	BBC
gb	https://www.ft.com/content/7280dc0c-51bf-45cc-a277-7f4a1d87c599	Canada and India expel diplomats over killing of Sikh activist - Financial Times	Countries’ relations at new low after allegations by Canadian police of ‘clandestine activities’ by envoys	https://www.ft.com/__origami/service/image/v2/images/raw/https%3A%2F%2Fd1e00ek4ebabms.cloudfront.net%2Fproduction%2F6f7a6419-1ef8-49ed-ba4d-7fccdac16397.jpg?source=next-barrier-page	2024-10-14 21:26:53	Financial Times
gb	https://www.independent.co.uk/news/uk/politics/starmer-investment-summit-labour-growth-b2628495.html	Starmer vows bonfire of red tape to get Britain building ahead of investment summit - The Independent	Sir Keir Starmer is pledging to ‘rip out the bureaucracy that blocks investment’ and ensure regulators prioritise economic growth in their decision-making	https://static.independent.co.uk/2024/10/12/06/e7f9f0a7a706fa0feedc302875cc9956Y29udGVudHNlYXJjaGFwaSwxNzI4NzY5NTgw-2.77762825.jpg?quality=75&width=1200&auto=webp	2024-10-14 08:06:59	The Independent
gb	https://news.sky.com/story/alex-salmonds-cause-of-death-confirmed-as-heart-attack-alba-party-says-13233713	Alex Salmond's cause of death confirmed as heart attack, Alba Party says - Sky News	The former Scottish first minister died suddenly aged 69 in North Macedonia on Saturday after collapsing in a crowded room during lunch.	https://e3.365dm.com/24/10/1600x900/skynews-salmond-alex_6714304.jpg?20241014222241	2024-10-14 22:11:02	Sky News
gb	https://www.theguardian.com/technology/2024/oct/14/new-bill-could-force-social-media-firms-to-make-content-less-addictive-for-children	New UK bill could force social media firms to make content less addictive for under 16s - The Guardian	The safer phones bill could ban companies from applying algorithms for young ‘doomscrolling’ teens	https://i.guim.co.uk/img/media/e1d528792380e9a2e7638aaba81b37a74dd2dd2e/0_264_3600_2159/master/3600.jpg?width=1200&height=630&quality=85&auto=format&fit=crop&overlay-align=bottom%2Cleft&overlay-width=100p&overlay-base64=L2ltZy9zdGF0aWMvb3ZlcmxheXMvdGctZGVmYXVsdC5wbmc&enable=upscale&s=f55f89d3006943d2904b86678734431c	2024-10-14 21:30:00	The Guardian
gb	https://www.bbc.co.uk/news/articles/c5y0303nynyo	NHS patient-safety system to be overhauled - BBC	The health secretary sets out a review of six key bodies, as changes to the main regulator are unveiled.	https://ichef.bbci.co.uk/news/1024/branded_news/13b1/live/dda36260-8a4a-11ef-b6b0-c9af5f7f16e4.jpg	2024-10-15 02:04:56	BBC
gb	https://www.bbc.co.uk/news/articles/c4g9wx2q09ko	Drone attack on Israel puts spotlight on Iron Dome's limitations - BBC	Drones are becoming a deadly headache for Israelis. How can its air defence system stop them?	https://ichef.bbci.co.uk/news/1024/branded_news/3541/live/bca0b570-8a6a-11ef-b6b0-c9af5f7f16e4.jpg	2024-10-14 20:50:29	BBC
gb	https://www.theguardian.com/world/2024/oct/15/prague-pub-crawl-ban-tourism-zdenek-hrib	Prague bans night-time pub crawls in bid to attract ‘more cultured, wealthier’ tourists - The Guardian	Deputy mayor says Czech capital doesn’t want type of visitor ‘who comes for a short time only to get drunk’	https://i.guim.co.uk/img/media/af013ca5ce493fade19857e0589b378858532ccf/0_169_4000_2400/master/4000.jpg?width=1200&height=630&quality=85&auto=format&fit=crop&overlay-align=bottom%2Cleft&overlay-width=100p&overlay-base64=L2ltZy9zdGF0aWMvb3ZlcmxheXMvdGctZGVmYXVsdC5wbmc&enable=upscale&s=d2bb5748928463e3866a50795116d75f	2024-10-15 09:43:00	The Guardian
gb	https://www.aljazeera.com/gallery/2024/10/14/deadly-israeli-strike-on-hospital-tent-camp-in-gaza	Deadly Israeli strike on hospital tent camp in Gaza - Al Jazeera English	None	https://www.aljazeera.com/wp-content/uploads/2024/10/2024-10-14T052456Z_533564001_RC24KAACWXIO_RTRMADP_3_ISRAEL-PALESTINIANS-GAZA-STRIKE-1728887790.jpg?resize=1920%2C1440	2024-10-14 10:21:49	Al Jazeera English
gb	https://www.bbc.co.uk/news/articles/c2kdye8z8llo	This young disabled man dreamed of having a job - the system had other ideas - BBC	Elliot wants to live independently - but making that happen proved a bigger challenge than he expected.	https://ichef.bbci.co.uk/news/1024/branded_news/76fe/live/c8ae8220-8add-11ef-b6b0-c9af5f7f16e4.png	2024-10-15 02:00:29	BBC
gb	https://news.google.com/rss/articles/CBMivgFBVV95cUxNUlQ2NnJXdEdfQm5QSnYyMXEtWlRLUXpZdjVMajVBY0w5ZWItZGlZN0JvS3F4TWVGQnA5YnhnRDNrSEx3dG9QVVBpVlh1ZWxXeGZkQmx5b0lMZHdJRmhTbEFiSHZ1NGRQcnlIcU9lR09IMVBRSHFEN3N3d0otSEN0TTAyVTZQbXR0NXlsdjYyYmE5UmdUZTlVRmN4dnVFYnBqWGVfZGVLcEZaVmNmdDhkWkJ5MDdEbFpZLTJkdC1B?oc=5	Kemi Badenoch Accidentally Describes The Social Model Of Disability - Forbes	None	None	2024-10-15 07:48:42	Forbes
gb	https://news.sky.com/story/chancellor-rachel-reeves-wouldnt-have-any-problems-getting-on-pando-ferry-after-previously-criticising-firms-disgraceful-behaviour-13233440	Chancellor Rachel Reeves 'wouldn't have any problems' getting on P&O ferry - after previously criticising firm's 'disgraceful behaviour' - Sky News	The chancellor distances herself from comments made by the transport secretary about P&O Ferries, which almost threatened a £1bn investment from the travel operator's Dubai-based owner DP World. 	https://e3.365dm.com/24/10/1600x900/skynews-rachel-reeves-chancellor_6715909.jpg?20241014165726	2024-10-14 16:03:07	Sky News
gb	https://www.bbc.com/weather/articles/cq5e6jne670o	Where to see Comet A3 this week in last chance for 80,000 years - BBC.com	Comet A3 was bright in the Monday evening sky and could be visible again on Tuesday - cloud permitting.	https://ichef.bbci.co.uk/news/1024/branded_weather/c598/live/d266a5d0-8ade-11ef-8665-81fa07595a0a.png	2024-10-15 10:07:40	BBC.com
gb	https://www.independent.co.uk/arts-entertainment/tv/news/strictly-come-dancing-wynne-evans-katya-jones-b2629294.html	Strictly pro makes admission about ‘silly’ Wynne Evans hand fiasco - The Independent	‘Hopefully this will be the end of it,’ Katya Jones said 	https://static.independent.co.uk/2024/10/15/07/Strictly-Katya-Jones-Wynne-Evans.jpg?quality=75&width=1200&auto=webp	2024-10-15 07:02:00	The Independent
gb	https://www.theguardian.com/business/2024/oct/15/uk-pay-growth-falls-interest-rate-cut-unemployment-rate	Pay growth in Great Britain falls below 5%, making interest rate cut more likely - The Guardian	Gap between wages and inflation narrows in August, as UK unemployment rate dips to 4%	https://i.guim.co.uk/img/media/1ef76310256ba5fc5562a4c67ec2f6033795550f/0_100_3000_1800/master/3000.jpg?width=1200&height=630&quality=85&auto=format&fit=crop&overlay-align=bottom%2Cleft&overlay-width=100p&overlay-base64=L2ltZy9zdGF0aWMvb3ZlcmxheXMvdGctZGVmYXVsdC5wbmc&enable=upscale&s=664f18ba0b5bc851978cd1ae6d500009	2024-10-15 06:49:00	The Guardian
gb	https://www.bbc.co.uk/sport/football/live/cx2k10jg33zt	Latest football news: Reaction to Wales' Nations League win - BBC	All the latest from the Nations League as Wales beat Montenegro, plus build-up to Scotland and Northern Ireland's matches.	https://static.files.bbci.co.uk/ws/simorgh-assets/public/sport/images/metadata/poster-1024x576.png	2024-10-15 01:14:00	BBC
gb	https://www.skysports.com/football/news/11095/13233817/thomas-tuchel-to-england-former-chelsea-and-bayern-munich-manager-in-pole-position-for-job-with-the-fa-in-talks	Thomas Tuchel to England: Former Chelsea and Bayern Munich manager in pole position for job with the FA in talks - Sky Sports	The FA have accelerated their search to name Gareth Southgates successor as England manager; Thomas Tuchel has been out of work since leaving Bayern Munich in May; the FA made an initial enquiry for Pep Guardiola but he is not currently an active candidate	https://e0.365dm.com/24/10/1600x900/skysports-tuchel-england_6716487.jpg?20241015114305	2024-10-15 11:04:49	Sky Sports
gb	https://www.bbc.co.uk/news/articles/c62gx6rvv5wo	Ukraine war: Meet Bucha's female unit who gun down Russian drones - BBC	The Witches of Bucha, as they call themselves, help protect Ukraine's skies from Russian drones. 	https://ichef.bbci.co.uk/news/1024/branded_news/fd21/live/690155a0-8aba-11ef-8936-1185f9e7d044.jpg	2024-10-15 04:31:28	BBC
gb	https://www.bbc.com/news/articles/cvgd0x7jlv5o	Sobriety: Jessie Hallett on quitting alcohol after 18-hour bender - BBC.com	Jessie, from Cardiff, realised she would go weeks without having one day of not drinking alcohol.	https://ichef.bbci.co.uk/news/1024/branded_news/c48d/live/26645c40-8a21-11ef-9511-a797176ecf47.jpg	2024-10-14 21:48:58	BBC.com
gb	https://www.independent.co.uk/news/world/americas/us-politics/harris-trump-polls-tracker-election-campaign-latest-b2628974.html	Can Kamala Harris beat Donald Trump? Latest poll updates from the 2024 election - The Independent	Here’s what the latest polls say about the 2024 presidential election, from The Independent’s data correspondent	https://static.independent.co.uk/2024/08/12/18/trump-harris-indycomp-polls-lj-%281%29.jpg?quality=75&width=1200&auto=webp	2024-10-14 15:00:11	The Independent
gb	https://www.kentlive.news/news/kent-news/victim-killed-canterbury-stabbing-named-9630917	Victim killed in Canterbury stabbing named locally as man with 'heart full of gold' - Kent Live	None	None	2024-10-14 15:22:04	Kent Live
gb	https://www.gbnews.com/politics/politics-latest-sadiq-khan-taylor-swift-sue-gray-yvette-cooper-met-police	Politics LIVE: Sadiq Khan now ADMITS to role in Taylor Swift security row as scandal refuses to go away - GB News	Stay up-to-date with live political coverage throughout the day from GB News	https://www.gbnews.com/media-library/starmer-sunak.png?id=53815204&width=1200&height=600&coordinates=0%2C20%2C0%2C80	2024-10-15 06:47:06	GB News
gb	https://news.google.com/rss/articles/CBMie0FVX3lxTE51TGgwTERhVFRTTVVIMUNhLWZWci1QMzN2OHFyMkVfXzlTakNweFlzNmRoWEFZZ3BHQTc0Vzc1Uk03emtna0FfVEFDdkhGSXhIeFY4RG8yQzV3eGRjOHJmcXBwRF8xM0s3RFVJb0M3Z1lnT3dVSk1vMzVTNA?oc=5	Totally nuts! Conker world rocked by cheating storm after men's champion found with steel conker in pocket - LBC	The World Conker Championships is investigating claims of cheating after the men's champion was discovered with a steel chestnut in his pocket.
	https://images.lbc.co.uk/images/682311?width=1200&crop=16_9&signature=hp0zxZupgKBQt_tfYV70Pe9NKjI=	2024-10-15 07:23:57	LBC
gb	https://www.ft.com/content/30a8a233-1c72-4d95-8e5e-55f7ae92e7bc	Israel assures US that retaliation against Iran will target military - Financial Times	Oil prices fall on signs Benjamin Netanyahu plans to avoid energy sector and nuclear sites	https://www.ft.com/__origami/service/image/v2/images/raw/https%3A%2F%2Fd1e00ek4ebabms.cloudfront.net%2Fproduction%2F84c17335-5fff-4d39-926a-05e411a8d831.jpg?source=next-barrier-page	2024-10-15 05:35:26	Financial Times