country_code	url	title	description	image_url	publish_date	source
gb	https://www.bbc.co.uk/news/articles/c4g5vwxgyx3o	Are North Korean troops joining Russia’s war in Ukraine? - BBC	Russia says no, but Ukraine and South Korea point to a deepening relationship between Pyongyang and Moscow.	https://ichef.bbci.co.uk/news/1024/branded_news/6ce3/live/2fc814e0-8bc3-11ef-95bb-91420efde733.jpg	2024-10-16 16:45:13	BBC
gb	https://news.sky.com/story/murder-arrests-over-death-of-toddler-in-northern-ireland-13233473	Murder arrests over death of toddler in Northern Ireland - Sky News	Police say Tavia Michella Ximenes Da Costa was pronounced dead at the scene on Sunday morning. Two women and a man are in custody.	https://e3.365dm.com/24/10/1600x900/skynews-northern-ireland-toddler-death_6717851.jpg?20241016174016	2024-10-16 16:49:18	Sky News
gb	https://www.aljazeera.com/news/2024/10/16/italy-sends-first-asylum-seekers-to-albania-under-controversial-deal	Italy sends first asylum seekers to Albania under controversial deal - Al Jazeera English	Rome boasts of deal processing asylum seekers outside EU. Critics complain of ‘cruel experiment’ that undermines rights.	https://www.aljazeera.com/wp-content/uploads/2024/10/libra-1729078984.jpg?resize=1920%2C1440	2024-10-16 13:36:37	Al Jazeera English
gb	https://www.politico.eu/article/ireland-ready-alone-restrict-trade-ties-israel-pm-simon-harris/	Ireland ready to go it alone and restrict trade ties with Israel, PM says - POLITICO Europe	None	None	2024-10-16 15:08:30	POLITICO Europe
gb	https://www.ft.com/content/8f788cdd-d1e4-468c-a3d2-fcd9a2e0a844	Keir Starmer and Rachel Reeves face down cabinet revolt over spending cuts - Financial Times	Ministers complain about Treasury approach as prime minister and chancellor finalise October 30 Budget 	https://www.ft.com/__origami/service/image/v2/images/raw/https%3A%2F%2Fwww.ft.com%2F__origami%2Fservice%2Fimage%2Fv2%2Fimages%2Fraw%2Fhttps%253A%252F%252Fd1e00ek4ebabms.cloudfront.net%252Fproduction%252F7892b72e-e47d-4aba-b15d-b0748460ffde.jpg%3Fsource%3Dnext-article%26fit%3Dscale-down%26quality%3Dhighest%26width%3D700%26dpr%3D1?source=next-opengraph&fit=scale-down&width=900	2024-10-16 17:22:21	Financial Times
gb	https://news.sky.com/story/explosions-seen-across-the-border-as-north-korea-blows-up-roads-linking-it-to-south-korea-13233864	Explosions seen across the border as North Korea blows up roads linking it to South Korea - Sky News	The move is seen as a further rejection by Kim Jong Un of any possibility of reunification with South Korea and comes amid rising tensions on the peninsula.	https://e3.365dm.com/24/10/1600x900/skynews-smoke-north-korea-roads_6716281.jpg?20241015073212	2024-10-15 10:08:14	Sky News
gb	https://news.sky.com/story/heartbreaking-story-behind-video-of-young-man-burnt-to-death-in-medical-compound-after-israeli-strike-13234035	Heartbreaking story behind video of young man burnt to death after Israeli strike - Sky News	Shaban al Dalu was sheltering in a tent in the compound of al Aqsa hospital with his parents and five siblings when an Israeli strike hit.	https://e3.365dm.com/24/10/1600x900/skynews-gaza-hospital_6716690.jpg?20241015152759	2024-10-15 22:41:15	Sky News
gb	https://www.bbc.co.uk/news/articles/c3e9q4nylwjo	Bowen: US threat to cut Israel military aid is sign of anger at broken promises - BBC	The letter criticising Israel over Gaza aid is an attempt to redress the balance between the US and its ally, our international editor says.	https://ichef.bbci.co.uk/news/1024/branded_news/0ec3/live/0e4e56a0-8bf8-11ef-93ff-f7ebb0faaff2.jpg	2024-10-16 19:50:49	BBC
gb	https://news.sky.com/story/two-children-among-five-dead-in-m6-crash-13234386	Two children among five dead in M6 crash - Sky News	The fatal collision happened on the northbound motorway, past Tebay services in Cumbria, at around 4pm on Tuesday.	https://e3.365dm.com/24/10/1600x900/skynews-m6-crash_6717286.jpg?20241016101551	2024-10-16 15:45:00	Sky News
gb	https://www.politico.eu/article/pmqs-rishi-sunak-wins-keir-starmer-calls-him-prime-minister-uk-david-lammy-china/	PMQs: Sunak wins … as Starmer calls him prime minister - POLITICO Europe	None	None	2024-10-16 13:34:00	POLITICO Europe
gb	https://www.middleeasteye.net/news/evidence-generals-plan-being-carried-out-northern-gaza-0	Israeli soldiers say 'Generals' Plan' already underway in northern Gaza - Middle East Eye	Reservists' comments to Haaretz add to the growing evidence that a plan to ethnically cleanse and occupy northern Gaza is being implemented	https://www.middleeasteye.net/sites/default/files/images-story/Gaza-Jabalia-AfterIsraeliStrike-15Oct2024-AFP.jpg	2024-10-16 08:40:29	Middle East Eye
gb	https://www.bbc.com/news/articles/cly4leklk3qo	Would raising employer National Insurance break Labour's pledge? - BBC.com	If the chancellor decides to increase NI for employers in the Budget would that be going back on previous promises?	https://ichef.bbci.co.uk/news/1024/branded_news/0d29/live/16721930-8afd-11ef-8936-1185f9e7d044.png	2024-10-15 15:16:27	BBC.com
gb	https://news.sky.com/story/met-office-issues-wind-warning-for-sunday-as-heavy-rain-hits-parts-of-uk-13234606	Met Office issues wind warning for Sunday - as heavy rain hits parts of UK - Sky News	Much of the country will have a windy end to the weekend, but temperatures over the coming days are expected to be warmer than average.	https://e3.365dm.com/24/10/1600x900/skynews-blackpool-reain-weather_6717456.jpg?20241016121832	2024-10-16 14:21:31	Sky News
gb	https://www.theguardian.com/uk-news/2024/oct/16/no-mechanical-failures-in-car-crash-that-killed-teenagers-in-north-wales-inquest-hears	Coroner raises concerns over new drivers taking passengers after north Wales crash - The Guardian	Hugo Morris, Harvey Owen, Wilf Fitchett, Jevon Hirst died after car came off rural road on a bend in November 2023	https://i.guim.co.uk/img/media/fe597625e04c8763b0396bc41726395f05211187/2_0_5904_3543/master/5904.jpg?width=1200&height=630&quality=85&auto=format&fit=crop&overlay-align=bottom%2Cleft&overlay-width=100p&overlay-base64=L2ltZy9zdGF0aWMvb3ZlcmxheXMvdGctZGVmYXVsdC5wbmc&enable=upscale&s=e551c4ed72d6e589db7f02f40995c74b	2024-10-16 14:44:00	The Guardian
gb	https://www.bbc.com/news/articles/cn9dn42xqg4o	Assisted Dying Legislation dangerous, Archbishop of Canterbury says - BBC.com	His comments came ahead of an assisted dying bill being introduced to Parliament. 
	https://ichef.bbci.co.uk/news/1024/branded_news/c988/live/1028f030-8b8e-11ef-b6b0-c9af5f7f16e4.jpg	2024-10-16 12:03:39	BBC.com
gb	https://www.independent.co.uk/news/uk/crime/sara-sharif-trial-stepmother-father-urfan-case-latest-news-b2630340.html	Pathologist tells jury what caused Sara Sharif’s death – trial latest - The Independent	Father Urfan Sharif, stepmother Beinash Batool and uncle Faisal Malik deny 10-year-old’s murder	https://static.independent.co.uk/2024/10/14/02/64852edc5ae27f142ecac4e62e997ec0Y29udGVudHNlYXJjaGFwaSwxNzI4NzQ2ODM2-2.73729546.jpg?quality=75&width=1200&auto=webp	2024-10-16 16:08:38	The Independent
gb	https://www.politico.eu/article/uk-sanctions-for-extremist-israel-ministers-bezalel-smotrich-itamar-ben-gvir/	UK ‘looking at’ sanctions for ‘extremist’ Israeli ministers - POLITICO Europe	None	None	2024-10-16 14:37:00	POLITICO Europe
gb	https://www.aljazeera.com/news/2024/10/16/netanyahu-wants-unifil-out-of-lebanon-why	Netanyahu wants UNIFIL out of Lebanon. Why? - Al Jazeera English	Experts warn a withdrawal will make it impossible to monitor violations of international law.	https://www.aljazeera.com/wp-content/uploads/2024/10/2024-09-30T203113Z_1868075896_RC22R3ADNZ9X_RTRMADP_3_ISRAEL-PALESTINIANS-LEBANON-UN-1728644209.jpg?resize=1920%2C1440	2024-10-16 13:00:51	Al Jazeera English
gb	https://www.standard.co.uk/news/london/tube-strike-aslef-london-underground-tfl-november-dates-b1188140.html	London Underground passengers face week-long strike misery in November - Evening Standard	Aslef has ordered the walkouts on November 7 and November 12 while RMT staff will strike over eight days	https://static.standard.co.uk/2023/03/14/16/newFile-1.jpg?width=1200&auto=webp&quality=75	2024-10-16 14:08:22	Evening Standard
gb	https://www.bbc.com/news/articles/c1wnxp970pdo	Former One direction singer Liam Payne dies in hotel balcony fall - BBC.com	The singer fell from the third floor of a hotel in Buenos Aires, Argentina, local media are reporting.	https://ichef.bbci.co.uk/news/1024/branded_news/0aba/live/63118ca0-8c0e-11ef-b6b0-c9af5f7f16e4.jpg	2024-10-16 22:16:08	BBC.com
gb	https://www.aljazeera.com/news/2024/10/16/israel-resumes-beirut-strikes-despite-us-opposition	Mayor among 16 killed in Israeli attack on south Lebanon municipal building - Al Jazeera English	None	https://www.aljazeera.com/wp-content/uploads/2024/10/AP24290172792566-1729061172.jpg?resize=1920%2C1440	2024-10-16 17:46:34	Al Jazeera English
gb	https://www.bbc.com/news/articles/czrmzm3113po	Why this month's inflation figure matters for you - BBC.com	The cost of living is always important but this month's has a particular extra impact for millions of people.	https://ichef.bbci.co.uk/news/1024/branded_news/1a57/live/3ac11670-8b97-11ef-ad63-6f68440cad48.jpg	2024-10-16 13:57:01	BBC.com
gb	https://www.bbc.com/news/articles/ckg9e0ydjxpo	No 10 denies Taylor Swift tickets were 'thank you' to Starmer - BBC.com	The singer received a police escort to her Wembley shows despite initial police reservatations. 	https://ichef.bbci.co.uk/news/1024/branded_news/d7c1/live/b7260460-8b19-11ef-a81b-b1eda9741da3.jpg	2024-10-15 18:47:41	BBC.com
gb	https://www.bbc.co.uk/news/articles/cglk706dr5lo	Blackpool woman who starved to death was unlawfully killed - BBC	A coroner says Debbie Leitch died from the effects of her severely emaciated and neglected state.	https://ichef.bbci.co.uk/news/1024/branded_news/831a/live/2f189c30-8bdd-11ef-ba67-51b142a6d01a.jpg	2024-10-16 17:37:26	BBC
gb	https://www.ft.com/content/dc4e2b30-08ca-4bfe-b37f-dda1b5b75ee2	General Sir Michael Jackson, 1944-2024 - Financial Times	Celebrated British soldier with varied and illustrious military career famed for clash with his Nato commander	https://www.ft.com/__origami/service/image/v2/images/raw/https%3A%2F%2Fwww.ft.com%2F__origami%2Fservice%2Fimage%2Fv2%2Fimages%2Fraw%2Fhttps%253A%252F%252Fd1e00ek4ebabms.cloudfront.net%252Fproduction%252F092db775-952b-4c42-abbe-e94e810d96e1.jpg%3Fsource%3Dnext-article%26fit%3Dscale-down%26quality%3Dhighest%26width%3D700%26dpr%3D1?source=next-opengraph&fit=scale-down&width=900	2024-10-15 23:19:47	Financial Times
gb	https://www.espncricinfo.com/story/pak-vs-eng-dynamic-duckett-gives-england-a-puncher-s-chance-on-turning-deck-1455590	Dynamic Duckett gives England a puncher's chance on turning deck - ESPNcricinfo	Vital century extends stellar record in Pakistan and stands as contrast to collapse that followed	https://img1.hscicdn.com/image/upload/f_auto/lsci/db/PICTURES/CMS/389100/389169.6.jpg	2024-10-16 15:19:03	ESPNcricinfo
gb	https://www.arsenal.com/news/team-news-codina-returns-starting-xi	Team news: Codina returns to starting XI - Arsenal.com	Renee Slegers has made just one change from the side who faced Chelsea at the weekend	https://www.arsenal.com/sites/default/files/styles/desktop_16x9/public/images/Codina-Everton.png?h=2f7a7c87&auto=webp&itok=NAt9EIFo	2024-10-16 17:50:36	Arsenal.com
gb	https://news.sky.com/story/sexual-misconduct-a-problem-right-across-nhs-as-whistleblowing-site-is-launched-13234289	Sexual misconduct is problem right across health service, says NHS chief - Sky News	The NHS says the new policy covers all sexual misconduct at work - whether in an NHS setting, a virtual environment or elsewhere.	https://e3.365dm.com/24/09/1600x900/skynews-nhs-healthcare-drones_6687957.jpg?20240916231809	2024-10-16 01:44:47	Sky News
gb	https://www.politico.eu/article/5-things-we-will-miss-britain-hereditary-peers-house-of-lords/	5 things we’ll miss as Britain’s hereditary peers face the chop - POLITICO Europe	None	None	2024-10-15 15:53:00	POLITICO Europe
gb	https://news.google.com/rss/articles/CBMilwFBVV95cUxOclMtRzNJLTdreWk4TnVSSkFFQVp0WUFFdGQ3WUhLV1VGdnBJeGEyNnI5VG5xa0hLYlRta0VJQnBBQmUzYlRRckJDcW9FdzFFU2xORndEOFhueGY1cGo4aVVlcXF3aG0zSnNscnZiakVmckFhNms3aUliUEVxaEhJUDJNbVpiZVVPQ3dCXzRJbDdKYXAwQ3Mw0gGXAUFVX3lxTE84b2w1bGpncGwwQmNCX0FTMUwyYlVneVQ2SVprMDlOOU1sM3NvVDZNdDlnaXYtYnppbWVra1N6SFdfMEFlZlN5YUJ4VXNsMDJYbHk1elZLanBpVEVoNk9FR29VbnRXZ0VGb2lrTUdHOXB4TFZZUFp5RFc3dlpQa1FCaEF5Y2xaVmZIUi1kUTZ0ckZaZE5xd2M?oc=5	Cabinet ministers contest chancellor’s planned cuts to their departments - The Guardian	Rachel Reeves aims to find £40bn in budget but several ministers have written to Keir Starmer about spending cuts	https://i.guim.co.uk/img/media/efb7fb220fc593304d203cd20674c941d1349f94/0_31_7787_4672/master/7787.jpg?width=1200&height=630&quality=85&auto=format&fit=crop&overlay-align=bottom%2Cleft&overlay-width=100p&overlay-base64=L2ltZy9zdGF0aWMvb3ZlcmxheXMvdGctZGVmYXVsdC5wbmc&enable=upscale&s=20746d7a7bd2a512e52463d38c8706ee	2024-10-16 08:43:00	The Guardian
gb	https://www.independent.co.uk/news/world/europe/ukraine-russia-war-updates-map-putin-north-korea-soldiers-b2629954.html	Ukraine live: Zelensky unveils ‘Victory Plan’ as Russia launches mass drone attack - The Independent	It comes after Putin’s forces fired 136  drones at Kyiv and other Ukrainian cities overnight on Wednesday 	https://static.independent.co.uk/2024/10/16/04/GettyImages-2159731404.jpg?quality=75&width=1200&auto=webp	2024-10-16 19:11:33	The Independent
gb	https://www.theguardian.com/uk-news/2024/oct/16/boy-killed-explosion-newcastle-benwell-elswick	Seven-year-old boy killed in ‘devastating explosion’ in Newcastle - The Guardian	Explosion and fire in residential Benwell and Elswick area destroyed house with six people also taken to hospital	https://i.guim.co.uk/img/media/a6356dba7e9de1950fbc1a45ec838f22da4e2c4b/0_0_4665_2799/master/4665.jpg?width=1200&height=630&quality=85&auto=format&fit=crop&overlay-align=bottom%2Cleft&overlay-width=100p&overlay-base64=L2ltZy9zdGF0aWMvb3ZlcmxheXMvdGctZGVmYXVsdC5wbmc&enable=upscale&s=cfd7ed8f079d879346a7d5d19ab3209e	2024-10-16 22:07:00	The Guardian
gb	https://www.bbc.co.uk/news/articles/cn9dnexgx01o	Zoe's Place baby hospice 'confident' it can be saved - BBC	The charity must raise more than £5m in a month to secure a new home.	https://ichef.bbci.co.uk/news/1024/branded_news/8070/live/94e38870-8b0d-11ef-9fc1-91bac8153a18.jpg	2024-10-15 16:23:45	BBC
gb	https://www.theguardian.com/politics/2024/oct/16/alex-salmond-body-private-donor-pay-flown-home	Private donor to pay for Alex Salmond’s body to be flown home - The Guardian	Move comes after Foreign Office rejected calls for RAF to arrange flight following Salmond’s death in North Macedonia	https://i.guim.co.uk/img/media/77d2cfb17a7b83f40d5489ca607264288daf1ba3/0_53_5416_3249/master/5416.jpg?width=1200&height=630&quality=85&auto=format&fit=crop&overlay-align=bottom%2Cleft&overlay-width=100p&overlay-base64=L2ltZy9zdGF0aWMvb3ZlcmxheXMvdGctZGVmYXVsdC5wbmc&enable=upscale&s=39873692f82bcf4c9fb7aa2c251687d2	2024-10-16 13:56:00	The Guardian
gb	https://news.sky.com/story/uk-says-india-needs-to-cooperate-with-canada-investigation-into-murder-of-top-sikh-activist-13234413	UK says India needs to co-operate with Canada investigation into murder of top Sikh activist - Sky News	Canada has accused India of assassinating a prominent Sikh separatist leader in British Columbia, with the two countries expelling each other's diplomats.	https://e3.365dm.com/23/09/1600x900/skynews-hardeep-singh-nijjar_6290069.jpg?20230919065647	2024-10-16 11:28:01	Sky News
gb	https://www.independent.co.uk/news/world/americas/us-politics/trump-donations-musk-republican-billionaires-harris-b2630316.html	Three billionaires have given $220 million combined to help get Trump elected - The Independent	The Tesla CEO and outspoken Trump supporter Elon Musk has given $75 million alone to a committee supporting the former president since July 	https://static.independent.co.uk/2024/10/16/15/SEI224589144.jpg?quality=75&width=1200&auto=webp	2024-10-16 15:16:35	The Independent
gb	https://www.theguardian.com/football/2024/oct/16/thomas-tuchel-focus-will-be-to-put-second-star-on-the-shirt-for-england-at-world-cup	Tuchel targets World Cup glory and admits it could be win or bust for him - The Guardian	German acknowledged it could be win or bust in 18-month deal and refused to confirm if Harry Kane will remain as captain	https://i.guim.co.uk/img/media/884d64255c276602863a12b6e79f24c9ab68f316/0_191_5719_3431/master/5719.jpg?width=1200&height=630&quality=85&auto=format&fit=crop&overlay-align=bottom%2Cleft&overlay-width=100p&overlay-base64=L2ltZy9zdGF0aWMvb3ZlcmxheXMvdGctZGVmYXVsdC5wbmc&enable=upscale&s=4522cc08036532d290fd1ccf0be4f7bf	2024-10-16 21:30:00	The Guardian
gb	https://news.google.com/rss/articles/CBMiWkFVX3lxTE5NMWJwOHJUR1B1emlld1gwamNEMFNLMnJuQTE2aG82WHoyQUdGT2pETkFCM3RNa2pSdTRHVFU5THVOSnNRNWxEcHlsbG1WNXphMUJnVnVodHpmUdIBX0FVX3lxTE5RdEQteGNvMTYzUmNkRG5YREl2dV90WFk1M0xnRllBU3IyY1ZETUktdFZuQWc2NkdCa3p1VkZ2cHRMeHM3TFgzaWo5Yl9nN0g2NU4wcDA5TnBUT0VxNi1F?oc=5	Lucy Letby gave baby overdose two years before murders - BBC.com	Lucy Letby was reportedly "unhappy" at being told she could no longer administer controlled drugs.	https://ichef.bbci.co.uk/news/1024/branded_news/f465/live/7e621a20-8bb3-11ef-9d07-73c97541fcc1.jpg	2024-10-16 16:07:50	BBC.com
gb	https://news.google.com/rss/articles/CBMivwFBVV95cUxQYzI0c3RRZVhlM1d6WWNJLUwyV0ZhS2c5NnpUeDJQUTVZRzJFN2UxdzRjWG0yZE8yVVhaaXAxaDhlNVctajZsbEVSWk9aclZsZ1ZkZ0RPNXpkaGNFRnBrX0J2a1hpWFROY2c5QkZ1TWVaNnZGbDBZQ05QQk5Ua211dlVEU0JlbnVGVEJ0M3l1djJlaUdTeFJQdE5sc3luME5oSGJrT0VnQTg4S09ja3lsblB1LTJ2M0hJX2JZVDB6a9IBvwFBVV95cUxOeGRqT0xZYXFldTl4ME1xYm1Fb0xTaWFkb3BCQll0a2FiVjQxbEZTMWY2RFA2LS01LWNVSzNKUWFZQWNDa2JuRElZZERqMWlfN1dRMjgzT1ByS3Z6cFpYcW5CYXJnaWtJWF93OWJ5ME9IN3RiQXlmcS1rSGJKdU1yWWs3cnUtYllsMjNrcWFjRDNyeUdVNUI4TXRqR3Rob0EzVUVkX1JZRjNpX09hSGJxR1NyMExtVUU4UWlvTm1NSQ?oc=5	Russia suspected of planting device on plane that caused UK warehouse fire - The Guardian	Exclusive: Police investigate whether spies placed incendiary package that caught alight in Birmingham	None	2024-10-16 15:45:00	The Guardian
gb	https://www.bbc.com/news/articles/c20jln81w72o	Government launches inquiry into Carer's Allowance payment scandal - BBC.com	Some carers had to pay back thousands of pounds to the government, pushing them into financial distress.	https://ichef.bbci.co.uk/news/1024/branded_news/c8d8/live/be4c3ab0-8bab-11ef-bf78-4dd729364dbf.png	2024-10-16 16:10:51	BBC.com
gb	https://news.google.com/rss/articles/CBMilwFBVV95cUxOZURIM2JyVlJ6QkwtbFJqR2xIdVVyc0Y0ZnR2cURBOWNPZk83MmwtUWtJdnJtUGw4WUVNUVJndnBJRzN6RU1odFV4WnhLLTE3RUFHVnhKX0o3enhrOUFkYTRIYmo3VTNMa005YzF5ZE1JQ2NLcWVPRzBrUC1fMnFhVndQbTdITDZkUG4wSlpabS1obFk3dFFR?oc=5	Flooding sparks chaos on the transport network in Flintshire and Wrexham - The Leader	None	None	2024-10-16 15:59:21	The Leader
gb	https://news.sky.com/story/paul-lowe-teenage-son-of-british-war-photographer-charged-with-his-murder-13234333	Paul Lowe: Teenage son of British war photographer charged with his murder - Sky News	Paul Lowe's son was arrested after he was seen driving his car away from the popular hiking trail in California where his father was killed.	https://e3.365dm.com/24/10/1600x900/skynews-kosovo-paul-lowe-exhibition_6717167.jpg?20241016081726	2024-10-16 09:41:25	Sky News
gb	https://www.standard.co.uk/news/crime/police-search-attacker-assault-man-son-notting-hill-westbourne-grove-b1188271.html	Police search for attacker after unprovoked assault on a father walking with his young son in Notting Hill - Evening Standard	The unprovoked attack happened on a busy street on a Saturday afternoon	https://static.standard.co.uk/2024/10/16/15/21/Appeal-GBH-suspect-Sat-5-Oct-Westbourne-Grove-W2.jpeg?width=1200&auto=webp&quality=75	2024-10-16 15:58:58	Evening Standard
gb	https://news.google.com/rss/articles/CBMiXEFVX3lxTFBFSm1xekNBdzNkSXA4UUNOWVp4OHRrZnE3TkdaMlJrNUM0OWtReE5LQjd3UkZnS0JsSXRSa1N4S0YxVUgwanFsVkVod1pZaF9LZ2RTcTVmMXkyLXp60gFiQVVfeXFMTkd5M3BxVDVxLVROa0tsbW1HdGJfZnJVVVUyNExCX0ZqbTBHamNaSjJtSEhWMG1qU01HaHV0VnBCZTRfdGFHamwtSUNPSnBOMWVvTHlGaThCSnA3d285R0RlOHc?oc=5	Chris Kaba: Officer 'thought colleague had been hit by car' - BBC	An officer at the fatal shooting of Chris Kaba tells a court she believed a colleague had been hit by a car.	https://ichef.bbci.co.uk/news/1024/branded_news/2c8f/live/4dcd04a0-8bc3-11ef-95bb-91420efde733.jpg	2024-10-16 14:26:01	BBC
gb	https://www.theguardian.com/society/2024/oct/16/demand-obesity-drugs-risks-overwhelming-nhs-doctors-letter-wes-streeting	Weight-loss drugs not the ‘holy grail’ for obesity crisis, says NHS England director - The Guardian	‘We cannot treat our way out of this’, says Stephen Powis, as doctors warn demand could overwhelm health service	https://i.guim.co.uk/img/media/3423f025c7bf2dc5b3a0f8f4d77600164981dc33/0_110_3500_2101/master/3500.jpg?width=1200&height=630&quality=85&auto=format&fit=crop&overlay-align=bottom%2Cleft&overlay-width=100p&overlay-base64=L2ltZy9zdGF0aWMvb3ZlcmxheXMvdGctZGVmYXVsdC5wbmc&enable=upscale&s=dde04f710c4eddfdba0d1f895e6da80f	2024-10-16 09:31:00	The Guardian
gb	https://www.theguardian.com/uk-news/2024/oct/16/salisbury-novichok-poisoning-inquiry-dawn-sturgess	Salisbury poisoning: woman ‘foamed at the mouth’ after spraying novichok on wrists, inquiry told - The Guardian	Dawn Sturgess, who died after using nerve agent as perfume, was ‘convulsing and foaming at the mouth’	https://i.guim.co.uk/img/media/ee68fdbbfd0a94c0fc9544f5013eba004b253e73/645_121_1275_765/master/1275.jpg?width=1200&height=630&quality=85&auto=format&fit=crop&overlay-align=bottom%2Cleft&overlay-width=100p&overlay-base64=L2ltZy9zdGF0aWMvb3ZlcmxheXMvdGctZGVmYXVsdC5wbmc&enable=upscale&s=0eb69eef189259f798600955549d7e5c	2024-10-16 16:33:00	The Guardian
gb	https://www.bbc.com/news/articles/cglk74dwg0ro	Imran Khan Oxford University chancellor bid rejected, says adviser - BBC.com	Mr Khan applied for the role from prison in Pakistan, where he has been for over a year.	https://ichef.bbci.co.uk/news/1024/branded_news/c327/live/ed57e280-8bc6-11ef-8d86-1db4e5175ccb.jpg	2024-10-16 16:04:46	BBC.com
gb	https://www.bbc.co.uk/news/articles/cx2kv219d2go	Georgia judge blocks ballot hand counting order - BBC	The hand count mandate was passed by the pro-Donald Trump majority on the Georgia election board last month.	https://ichef.bbci.co.uk/news/1024/branded_news/1f74/live/2e318870-8b99-11ef-8936-1185f9e7d044.jpg	2024-10-16 08:13:08	BBC
gb	https://www.bbc.com/news/articles/cx2kv219d2go	Russian man tells of survival struggle during 67 days adrift at sea - The Guardian	The hand count mandate was passed by the pro-Donald Trump majority on the Georgia election board last month.	https://ichef.bbci.co.uk/news/1024/branded_news/1f74/live/2e318870-8b99-11ef-8936-1185f9e7d044.jpg	2024-10-16 16:27:00	The Guardian
gb	https://www.derbytelegraph.co.uk/news/uk-world-news/derby-influencer-dies-after-falling-9636257	Derby influencer dies after falling from Castilla La Mancha bridge in Spain - Derbyshire Live	None	None	2024-10-16 09:43:00	Derbyshire Live