country_code	url	title	description	image_url	publish_date	source
gb	https://www.politico.eu/article/europe-leaders-congratulated-donald-trump-what-they-said-before-david-lammy-emmanuel-macron/	Europe’s leaders congratulated Trump. But here’s what they said about him before. - POLITICO Europe	None	None	2024-11-07 17:10:00	POLITICO Europe
gb	https://news.sky.com/story/women-with-menopause-symptoms-should-be-offered-hrt-as-first-line-treatment-says-updated-advice-13249550	Women with menopause symptoms ‘should be offered HRT as first-line treatment’, says updated advice - Sky News	The updated guidance comes after a draft document suggested CBT could be an alternative to hormone replacement therapy.	https://e3.365dm.com/23/05/1600x900/skynews-prescription-nhs-hrt_6160847.jpg?20230519181559	2024-11-07 01:19:50	Sky News
gb	https://www.glasgowlive.co.uk/news/glasgow-news/pictures-show-disgraceful-aftermath-glasgow-30315030	Pictures show disgraceful aftermath of Glasgow Bonfire Night as police probe begins - Glasgow Live	None	None	2024-11-07 06:43:00	Glasgow Live
gb	https://www.nottinghampost.com/news/nottingham-news/fireworks-thrown-fire-engines-through-9693837	Fireworks thrown at fire engines and through window as extent of trouble revealed - Nottinghamshire Live	None	None	2024-11-06 19:24:43	Nottinghamshire Live
gb	https://kyivindependent.com/ukrainian-soldiers-react-to-trumps-u-s-presidential-victory-this-could-be-a-disaster/	Ukrainian soldiers react to Trump's victory: 'This could be a disaster,' others say Biden was 'impotent' - Kyiv Independent	None	None	2024-11-06 20:38:50	Kyiv Independent
gb	https://www.theguardian.com/politics/2024/nov/07/starmer-lammy-and-farage-play-fantasy-phonecall-with-trump	Congratulations, your serene highness: Starmer, Farage and Lammy call Trump | John Crace - The Guardian	The PM offers warm compliments, Farage a trip to Clacton, and the president-elect tries his best to remember them both	https://i.guim.co.uk/img/media/e31abb0832fd0067b1c110f14382665e504a97fc/1917_1710_5445_3268/master/5445.jpg?width=1200&height=630&quality=85&auto=format&fit=crop&overlay-align=bottom%2Cleft&overlay-width=100p&overlay-base64=L2ltZy9zdGF0aWMvb3ZlcmxheXMvdGctb3BpbmlvbnMucG5n&enable=upscale&s=93243b96c57996497b6b11c6f9709e36	2024-11-07 20:15:00	The Guardian
gb	https://www.bbc.com/news/articles/c238g1x9l00o	Sainsbury's and M&S warn Budget changes may push up prices - BBC.com	A number of major firms have warned over the impact of higher National Insurance costs.	https://ichef.bbci.co.uk/news/1024/branded_news/6964/live/d0301810-9cf8-11ef-9d47-3962c94c3bbb.jpg	2024-11-07 23:31:45	BBC.com
gb	https://www.independent.co.uk/life-style/4b-movement-trump-election-win-south-korea-b2643558.html	What is the 4B movement and why are women talking about it in the wake of Trump’s election win? - The Independent	The 4B movement takes a bold stand against gender inequality – by boycotting men entirely	https://static.independent.co.uk/2024/11/06/21/newFile-1.jpg?quality=75&width=1200&auto=webp	2024-11-08 05:40:00	The Independent
gb	https://www.bbc.co.uk/news/articles/cx2y3mdv2y7o	Biden promises 'peaceful' transition as Democrats point fingers - BBC	Many Democrats blame the 81-year-old president for not dropping out of the presidential race sooner.	https://ichef.bbci.co.uk/news/1024/branded_news/58f0/live/0e27d550-9d2f-11ef-82c3-45a801b7330b.png	2024-11-07 17:32:42	BBC
gb	https://www.ft.com/content/bfac800d-538d-4fac-a5ca-77b18c26f7aa	Putin says Trump’s Ukraine proposals merit attention - Financial Times	Russian president congratulates Republican leader on his election victory	https://www.ft.com/__origami/service/image/v2/images/raw/https%3A%2F%2Fwww.ft.com%2F__origami%2Fservice%2Fimage%2Fv2%2Fimages%2Fraw%2Fhttps%253A%252F%252Fd1e00ek4ebabms.cloudfront.net%252Fproduction%252Fb76fa901-2f77-43ff-b6f2-853801eb356f.jpg%3Fsource%3Dnext-article%26fit%3Dscale-down%26quality%3Dhighest%26width%3D700%26dpr%3D1?source=next-opengraph&fit=scale-down&width=900	2024-11-07 21:59:41	Financial Times
gb	https://www.ft.com/content/61970b07-ff49-4fae-ac37-428dcc8900de	EU leaders strain for unity after Donald Trump win and German crisis - Financial Times	Bloc gathers in Budapest at summit hosted by Brussels’ antagonist Viktor Orbán	https://www.ft.com/__origami/service/image/v2/images/raw/https%3A%2F%2Fwww.ft.com%2F__origami%2Fservice%2Fimage%2Fv2%2Fimages%2Fraw%2Fhttps%253A%252F%252Fd1e00ek4ebabms.cloudfront.net%252Fproduction%252F6d0f3891-b6bc-4ce7-83af-80db928d30ab.jpg%3Fsource%3Dnext-article%26fit%3Dscale-down%26quality%3Dhighest%26width%3D700%26dpr%3D1?source=next-opengraph&fit=scale-down&width=900	2024-11-07 13:42:08	Financial Times
gb	https://www.bbc.com/news/articles/cz6jg6nw2zeo	Nurse's death linked to weight-loss drug Mounjaro approved on NHS - BBC.com	Susan McGowan from North Lanarkshire died two weeks after taking the drug tirzepatide, brand name Mounjaro.	https://ichef.bbci.co.uk/news/1024/branded_news/2254/live/e832ba00-9d14-11ef-a6bb-dbb5b4b7cd67.jpg	2024-11-08 00:50:36	BBC.com
gb	https://www.telegraph.co.uk/money/tax/inheritance/farmers-blocked-sharing-1m-inheritance-tax-relief-spouse/	Reeves stops farmers sharing inheritance tax relief with spouses - The Telegraph	None	None	2024-11-07 14:59:00	The Telegraph
gb	https://www.bbc.co.uk/news/articles/ckg7dgll07zo	Sara Sharif: Stepmum tied girl, 10, up with tape, jury told - BBC	A father accused of killing Sara Sharif says his wife tied the child up with tape, a court hears.	https://ichef.bbci.co.uk/news/1024/branded_news/6e76/live/b66b1390-9d06-11ef-b73e-5b38a3516be8.jpg	2024-11-07 13:04:52	BBC
gb	https://www.theguardian.com/world/2024/nov/08/tariffs-tech-and-taiwan-how-china-hopes-to-trump-proof-its-economy	Tariffs, tech and Taiwan: how China hopes to Trump-proof its economy - The Guardian	With $500bn worth of trade in the crosshairs of Donald Trump’s tariffs, Xi Jinping is preparing for four more years of unpredictability	https://i.guim.co.uk/img/media/eb2ab027d1c81d3f025ce884bec4248ea975a51a/95_233_2892_1736/master/2892.jpg?width=1200&height=630&quality=85&auto=format&fit=crop&overlay-align=bottom%2Cleft&overlay-width=100p&overlay-base64=L2ltZy9zdGF0aWMvb3ZlcmxheXMvdGctZGVmYXVsdC5wbmc&enable=upscale&s=2708849529b56ed391adf64b9ee6075b	2024-11-08 06:09:00	The Guardian
gb	https://www.theguardian.com/science/2024/nov/08/exciting-new-lupus-treatment-could-end-need-for-lifelong-medication	‘Exciting’ new lupus treatment could end need for lifelong medication - The Guardian	CAR T-cell genetic therapy, typically used in cancer patients, could lead to cure for the disease, says expert	https://i.guim.co.uk/img/media/e922a730dd0e4d15ccbfe815d93fd04e7c34bacb/0_355_6000_3600/master/6000.jpg?width=1200&height=630&quality=85&auto=format&fit=crop&overlay-align=bottom%2Cleft&overlay-width=100p&overlay-base64=L2ltZy9zdGF0aWMvb3ZlcmxheXMvdGctZGVmYXVsdC5wbmc&enable=upscale&s=2b0c587945ea8d217f96258b62d2a8a2	2024-11-08 06:00:00	The Guardian
gb	https://www.67hailhail.com/news/scottish-premiership-boss-delivers-glowing-celtic-verdict-after-excellent-leipzig-victory/	Scottish Premiership boss delivers glowing Celtic verdict after 'excellent' Leipzig victory - 67 Hail Hail - Celtic FC News	Heart of Midlothian boss Neil Critchley has praised Celtic for their excellent showing against RB Leipzig in the Champions League.	https://cdn1.67hailhail.com/uploads/18/2024/11/GettyImages-2171944151-scaled.jpg	2024-11-07 21:00:00	67 Hail Hail - Celtic FC News
gb	https://www.independent.co.uk/news/world/susie-wiles-trump-cabinet-chief-of-staff-net-worth-b2643600.html	Meet Susie Wiles, the ‘ice maiden’ who propelled Trump to victory – and is his new chief of staff - The Independent	On one hand, Susie Wiles is the generous neighbour who brings you casseroles and sends you flowers when you’re in the hospital. On the other, she’s a ruthless political operator who was the mastermind behind getting Donald Trump back to the White House. Alex Hannaford talks to those who know her to  find out how she became one of the few people who can handle her boss... 	https://static.independent.co.uk/2024/11/07/09/2024-11-06T074321Z_1471398118_HP1EKB60LG678_RTRMADP_3_USA-ELECTION-TRUMP.jpg?quality=75&width=1200&auto=webp	2024-11-08 04:55:35	The Independent
gb	https://www.bbc.co.uk/news/articles/c0mzlvgjz04o	Chris Kaba shooting claims fuelled 'dangerous narrative', police chief says - BBC	Britain’s most senior police officer accuses “those in positions of authority” of creating “rumour and innuendo”.	https://ichef.bbci.co.uk/news/1024/branded_news/e553/live/bfee77f0-9d91-11ef-8b89-915f95aa0c54.jpg	2024-11-08 05:47:37	BBC
gb	https://news.google.com/rss/articles/CBMi4wFBVV95cUxPcWlQMlJSX3VndUU1ZmVaeG1WUUtDQXQ4RTlETU5BazFHdHBxRHVIQWtfeTNrZXkwSHU1T3dJZWlOQzFaSERxY3M4WXZnbWVlSkJNUHEwYVBJQ3RwWFBhMjNqcDhtcUdpV0c0SUx1R2pmLVpmUklYWGtBeUk4aUpBZHpKWXc1M2NEZUhBSEQxS3F5VC1tQ2RuaUdvWlFwNndKdThLTmFwTzdYNE9qWXRaWXF0WTVCWjZOM0tPeFBYOGMtVmIxMW5fYmZiaGpja3kyR0JMR1FUdzNOcXdxWS1wUW1VNA?oc=5	Residents hit out at 'information vacuum' over hotel used for asylum seekers - as migrants tell of traumatic journeys - Sky News	The government said it would end the use of hotels for asylum seekers but, without warning, this one has been newly created. Residents only learned about the new arrivals because thousands of bookings were suddenly cancelled, along with meetings and wedding receptions.	https://e3.365dm.com/24/11/1600x900/skynews-altrincham-asylum-seekers_6742115.jpg?20241107233957	2024-11-08 04:11:39	Sky News
gb	https://www.standard.co.uk/sport/football/chelsea-fc-xi-vs-fc-noah-starting-lineup-confirmed-team-news-injury-latest-conference-league-today-b1192395.html	Chelsea XI vs Noah: Starting lineup and confirmed team news - Evening Standard	Academy duo Tyrique George and Samuel Rak-Sakyi join the squad	https://static.standard.co.uk/2024/09/20/13/57/EnzoMaresca24PredictedXIv1.jpeg?width=1200&auto=webp&quality=75	2024-11-07 20:00:00	Evening Standard
gb	https://www.lbc.co.uk/news/edinburgh-severed-head-decapitated-cowgate-named-police/	Elderly man decapitated after being 'struck by bus' in Edinburgh city centre named - LBC	An elderly man who was decapitated after being “struck by a bus" in Edinburgh city centre has been named as Michael Leneghan.	https://images.lbc.co.uk/images/686424?width=660&crop=16_9&signature=8gozZMznN67CXRHicxAKWgVDtcg=	2024-11-07 13:36:00	LBC
gb	https://www.mirror.co.uk/sport/football/match-reports/ange-postecoglou-tottenham-flaw-galatasaray-34063474	Ange Postecoglou pinpoints Tottenham's big flaw after Galatasaray stinker - The Mirror	None	None	2024-11-07 20:35:00	The Mirror
gb	https://www.bbc.co.uk/news/articles/c4g7jzz25gpo	Grievance panel saw Lucy Letby as 'victim of witch-hunt' - BBC	Lucy Letby made a formal complaint against doctors who accused her of harming babies, an inquiry hears.	https://ichef.bbci.co.uk/news/1024/branded_news/c9f8/live/37d1c140-9d07-11ef-b73e-5b38a3516be8.jpg	2024-11-07 13:29:47	BBC
gb	https://www.aljazeera.com/news/2024/11/8/israeli-football-fans-clash-with-protesters-in-amsterdam	Israeli football fans clash with protesters in Amsterdam - Al Jazeera English	None	https://www.aljazeera.com/wp-content/uploads/2024/11/12614346-1731043861.jpg?resize=1200%2C675	2024-11-08 08:40:15	Al Jazeera English
gb	https://www.theguardian.com/politics/2024/nov/08/david-lammy-dismisses-past-criticism-donald-trump-old-news	Lammy dismisses past criticism calling Trump a ‘sociopath’ as ‘old news’ - The Guardian	British foreign secretary says many politicians have said ‘pretty ripe things’ about US president-elect	https://i.guim.co.uk/img/media/bda3538d102be22e8416aef84b457769cb2ea30f/0_0_4000_2400/master/4000.jpg?width=1200&height=630&quality=85&auto=format&fit=crop&overlay-align=bottom%2Cleft&overlay-width=100p&overlay-base64=L2ltZy9zdGF0aWMvb3ZlcmxheXMvdGctZGVmYXVsdC5wbmc&enable=upscale&s=c3618a33022a97c8e502688a2eea8c02	2024-11-08 08:36:00	The Guardian
gb	https://www.politico.eu/article/pax-america-donald-trump-us-elections-president-reelection-deport/	The end of Pax Americana - POLITICO Europe	None	None	2024-11-08 03:00:00	POLITICO Europe
gb	https://news.sky.com/story/archbishop-of-canterbury-justin-welby-considered-resigning-over-appalling-barrister-abuse-scandal-13250363	Archbishop of Canterbury Justin Welby considered resigning over 'appalling' barrister abuse scandal - Sky News	John Smyth QC's abuse was covered up within the Church of England for years, an independent review found.	https://e3.365dm.com/24/11/1600x900/skynews-archisgop-of-canterbyry_6742126.jpg?20241108091504	2024-11-08 08:01:10	Sky News
gb	https://www.ft.com/content/f4dbc0df-ab0d-431e-9886-44acd4236922	Francis Fukuyama: what Trump unleashed means for America - Financial Times	Republican is inaugurating a new era in US politics and perhaps for the world as a whole	https://www.ft.com/__origami/service/image/v2/images/raw/https%3A%2F%2Fwww.ft.com%2F__origami%2Fservice%2Fimage%2Fv2%2Fimages%2Fraw%2Fhttps%253A%252F%252Fd1e00ek4ebabms.cloudfront.net%252Fproduction%252Fb0b5d6cd-8a03-4150-8f09-d40db81baec6.jpg%3Fsource%3Dnext-article%26fit%3Dscale-down%26quality%3Dhighest%26width%3D700%26dpr%3D1?source=next-opengraph&fit=scale-down&width=900	2024-11-08 05:02:03	Financial Times
gb	https://www.theguardian.com/environment/2024/nov/08/cop29-baku-climate-talks-odour-of-oil-return-of-trump-finance	Odour of oil and return of Trump hang heavy over Cop29 in Baku - The Guardian	Prospects of strong outcome appear dim but there is hope the talks will address pressing issue of climate finance	https://i.guim.co.uk/img/media/739a4c2919d1016b0abc34ab75cede70562e638b/0_531_6254_3753/master/6254.jpg?width=1200&height=630&quality=85&auto=format&fit=crop&overlay-align=bottom%2Cleft&overlay-width=100p&overlay-base64=L2ltZy9zdGF0aWMvb3ZlcmxheXMvdGctZGVmYXVsdC5wbmc&enable=upscale&s=ec02988f6a323d83f7125e906c2b1c3d	2024-11-08 06:00:00	The Guardian
gb	https://www.bbc.com/news/articles/cd9n79w8p7po	Germany engulfed by political crisis as Scholz coalition falls apart - BBC.com	Europe’s most powerful economy is left rudderless, when EU leaders are nervous about a new Trump presidency.	https://ichef.bbci.co.uk/news/1024/branded_news/c04e/live/b82ad6e0-9d04-11ef-8538-e1655f5a8342.jpg	2024-11-07 20:45:41	BBC.com
gb	https://www.channel4.com/news/factcheck/factcheck-six-charts-that-explain-trumps-decisive-us-presidential-election-win	FactCheck: six charts that explain Trump’s decisive US election win - Channel 4 News	None	https://fournews-assets-prod-s3-ew1-nmprod.s3.amazonaws.com/media/2024/11/AP24311280723208-scaled-e1730983542293-2000x959.jpg	2024-11-07 15:23:18	Channel 4 News
gb	https://www.lbc.co.uk/news/one-direction-star-liam-payne-death-not-suicide-argentina-prosecutors/	One Direction star Liam Payne's death 'not suicide' Argentina prosecutors say - as three people charged over death - LBC	One Direction star Liam Payne's death is not being treated as suicide, according to a new statement released by Argentina prosecutors.	https://images.lbc.co.uk/images/686553?width=1200&crop=16_9&signature=9SDMT_mMOiKbMf-WvPpdKT1itV8=	2024-11-08 06:42:00	LBC
gb	https://www.economist.com/europe/2024/11/07/spains-flood-poses-far-reaching-political-questions	Spain’s flood poses far-reaching political questions - The Economist	Over 200 died. Who is being blamed?	https://www.economist.com/content-assets/images/20241109_EUP003.jpg	2024-11-07 14:13:37	The Economist
gb	https://www.bbc.com/news/articles/c2dljljwkzyo	Anger at 'disrespectful' warning labels on Glasgow gravestones - BBC.com	The city council said it was a way to reach families where it was uncertain who had responsibility for the memorial.	https://ichef.bbci.co.uk/news/1024/branded_news/769f/live/1c24f280-9d2c-11ef-a24f-d9fb8d8bafc4.jpg	2024-11-08 06:30:54	BBC.com
gb	https://www.independent.co.uk/news/science/pompeii-victims-dna-vesuvius-eruption-discovery-b2643583.html	Pompeii DNA evidence leads to surprising new discovery about victims who died in Mount Vesuvius eruption - The Independent	New information from the study of Pompeii plaster casts has challenged previous interpretations 	https://static.independent.co.uk/2024/11/07/16/Low-Res_Pompeii-body-casts-2-CREDIT-Archeological-Park-of-Pompeii.jpg?quality=75&width=1200&auto=webp	2024-11-08 07:23:48	The Independent
gb	https://www.dailyrecord.co.uk/news/scottish-news/ex-rangers-star-kyle-hutton-34063107	Ex-Rangers star Kyle Hutton charged after woman dies following horror Rutherglen crash - Daily Record	None	None	2024-11-07 19:19:00	Daily Record
gb	https://www.standard.co.uk/sport/football/man-utd-vs-paok-live-stream-europa-league-2024-latest-score-result-watch-tv-team-news-b1192727.html	Man United vs PAOK: Europa League - LIVE! - Evening Standard	United pick up their first Europa League win of the season	https://static.standard.co.uk/2024/11/07/21/37/AmadDialloManUnited07112024.jpeg?width=1200&auto=webp&quality=75	2024-11-08 04:31:44	Evening Standard
gb	https://www.carbonbrief.org/experts-what-does-a-trump-presidency-mean-for-climate-action/	Experts: What does a Trump presidency mean for climate action? - Carbon Brief	None	None	2024-11-07 15:09:48	Carbon Brief
gb	https://www.bbc.com/news/articles/c3dep92x054o	Bat safety shed will cost £100m, says HS2 chairman - BBC.com	Sir Jon Thompson tells a conference there is "no evidence high-speed trains interfere with bats".	https://ichef.bbci.co.uk/news/1024/branded_news/493a/live/32881d70-9d15-11ef-9260-19e6a950e830.jpg	2024-11-07 20:33:16	BBC.com
gb	https://www.ft.com/content/783a573c-7ff3-461c-86f5-f194a89e3926	Goldman slashes European growth forecasts on Trump trouble - Financial Times	Elections have consequences	https://www.ft.com/__origami/service/image/v2/images/raw/https%3A%2F%2Fwww.ft.com%2F__origami%2Fservice%2Fimage%2Fv2%2Fimages%2Fraw%2Fhttps%253A%252F%252Fd1e00ek4ebabms.cloudfront.net%252Fproduction%252Ff481cb18-25aa-4d64-bbf2-0523d2c176ac.jpg%3Fsource%3Dnext-article%26fit%3Dscale-down%26quality%3Dhighest%26width%3D700%26dpr%3D1?source=next-opengraph&fit=scale-down&width=900	2024-11-07 08:15:39	Financial Times
gb	https://www.theguardian.com/uk-news/2024/nov/07/prince-william-relives-brutal-year-after-wifes-and-fathers-cancer-diagnoses	Prince William describes ‘brutal’ impact of wife’s and father’s cancer diagnoses - The Guardian	Royal says ‘it’s probably been the hardest year in my life’ as Catherine and King Charles underwent cancer treatment	https://i.guim.co.uk/img/media/0aef3f82b362786d0c6d11c925de803b36fc071e/0_1239_3812_2286/master/3812.jpg?width=1200&height=630&quality=85&auto=format&fit=crop&overlay-align=bottom%2Cleft&overlay-width=100p&overlay-base64=L2ltZy9zdGF0aWMvb3ZlcmxheXMvdGctZGVmYXVsdC5wbmc&enable=upscale&s=42693dfeb794545d1a780cece4adc553	2024-11-08 00:08:00	The Guardian
gb	https://www.politico.eu/article/british-mp-amesbury-charged-with-assault-after-clash-in-street/	British MP charged with assault after clash in street - POLITICO Europe	None	None	2024-11-07 13:39:00	POLITICO Europe
gb	https://www.bbc.com/news/articles/c789n4l2xpgo	UK interest rates cut to 4.75% but Bank hints fewer falls to come - BBC.com	Interest rates were cut to 4.75% but the Bank expects inflation to creep higher after last week's Budget.	https://ichef.bbci.co.uk/news/1024/branded_news/f4ad/live/57541b80-9d02-11ef-b73e-5b38a3516be8.jpg	2024-11-07 18:03:14	BBC.com
gb	https://www.bbc.co.uk/news/articles/cgj7gn9jeq5o	Father and son sentenced over Birmingham hitwoman murder plot - BBC	Mohammed Aslam and Mohammed Nazir were convicted of attempting to have a shop owner killed.	https://ichef.bbci.co.uk/news/1024/branded_news/17fc/live/6d429560-9d1c-11ef-8538-e1655f5a8342.jpg	2024-11-07 15:18:43	BBC
gb	https://www.bbc.co.uk/sport/rugby-union/articles/c1lgepp1g22o	England v Australia: Asher Opoku-Fordjour is new prop star - BBC	Asher Opoku-Fordjour is part of rich seam of front-row talent being moulded by coaches from a golden age of English forwards.	https://ichef.bbci.co.uk/news/1024/branded_sport/b915/live/0b56beb0-9d55-11ef-82c3-45a801b7330b.jpg	2024-11-08 07:27:54	BBC
gb	https://www.politico.eu/article/uk-nigel-farage-pat-mcfadden-no-need-help-talk-to-donald-trump-us-election/	UK to Nigel Farage: We don’t need your help to talk to Donald Trump - POLITICO Europe	Cabinet Office Minister Pat McFadden says Labour government in the UK will ‘have our own relationships.’	https://www.politico.eu/cdn-cgi/image/width=1200,height=630,fit=crop,quality=80,onerror=redirect/wp-content/uploads/2024/11/07/GettyImages-2172568531-scaled.jpg	2024-11-07 11:53:00	POLITICO Europe
gb	https://www.bbc.com/news/articles/c4g7jzz25gpo	Rangers player ratings vs Olympiacos: Classy midfield duo earn 8s in vital away point - GlasgowWorld	Lucy Letby made a formal complaint against doctors who accused her of harming babies, an inquiry hears.	https://ichef.bbci.co.uk/news/1024/branded_news/c9f8/live/37d1c140-9d07-11ef-b73e-5b38a3516be8.jpg	2024-11-07 20:01:00	GlasgowWorld
gb	https://www.wba.co.uk/news/carlos-corberans-thoughts-burnley-draw	Carlos Corberán's thoughts on Burnley draw - West Bromwich Albion	None	https://cdn.wba.co.uk/sites/default/files/styles/og_image_style_2_1/public/2024-11/carlospostburnley.jpg?h=84071268&itok=zuvEMtbY	2024-11-07 20:47:24	West Bromwich Albion
gb	https://www.bbc.com/news/articles/cly2nyz8384o	Man freed after appealing against summer riots sentence - BBC.com	Dylan Willis, 18, had his 14 month sentence suspended for two years by Court of Appeal judges. 	https://ichef.bbci.co.uk/news/1024/branded_news/9819/live/b704bab0-9d36-11ef-82c3-45a801b7330b.jpg	2024-11-07 17:15:18	BBC.com