country_code	url	title	description	image_url	publish_date	source
gb	https://www.thefa.com/news/2024/nov/18/fa-trophy-draw-20241118	Draw for the Isuzu FA Trophy Third Round Proper to be made live on talkSPORT 2 today - The FA	Read more	http://www.thefa.com/-/media/thefacom-new/images/competitions/the-buildbase-fa-trophy/2022/20221010-800-isuzu-fa-trophy-wembley.ashx?as=0&dmc=0&thn=0	2024-11-18 11:14:41	The FA
gb	https://news.sky.com/story/two-police-officers-charged-with-sexual-assault-of-woman-in-central-london-13256105	Two police officers charged with sexual assault of woman in central London - Sky News	The charges relate to an alleged incident at a venue in the capital in April while the officers were off-duty.	https://e3.365dm.com/24/11/1600x900/skynews-metropolitan-police_6750963.jpg?20241118102419	2024-11-18 10:20:40	Sky News
gb	https://www.ft.com/content/ee5b0bcc-f4c2-427f-98ef-8e3ee6c43ffa	Keir Starmer declines to rule out allowing Ukraine to use Storm Shadow missiles in Russia - Financial Times	Pressure rises on UK prime minister after Joe Biden authorised  use of US-supplied long-range weapons	https://www.ft.com/__origami/service/image/v2/images/raw/https%3A%2F%2Fd1e00ek4ebabms.cloudfront.net%2Fproduction%2F8cdc0fb3-d240-45b5-be72-f6dd644601cf.jpg?source=next-article&fit=scale-down&quality=highest&width=700&dpr=1	2024-11-18 19:14:41	Financial Times
gb	https://www.politico.eu/article/sweden-issues-pamphlet-warning-citizens-what-to-do-in-case-of-war/	Sweden issues pamphlet telling citizens what to do if Russia attacks - POLITICO Europe	Norway and Finland also launched a campaign to advise people what they should do in the event of an invasion.	https://www.politico.eu/cdn-cgi/image/width=1200,height=630,fit=crop,quality=80,onerror=redirect/wp-content/uploads/2024/11/18/defense-ministers-scaled.jpg	2024-11-18 16:19:00	POLITICO Europe
gb	https://www.independent.co.uk/news/world/europe/sumy-map-ukraine-ballistic-missile-russia-b2649010.html	Deadly Russian ballistic missiles rain down on Ukraine city after Biden announcement - The Independent	Two children were killed in the city of Sumy 	https://static.independent.co.uk/2024/11/18/09/Russia_Ukraine_War_75078.jpg?quality=75&width=1200&auto=webp	2024-11-18 12:22:00	The Independent
gb	https://www.theguardian.com/society/2024/nov/18/how-are-are-cabinet-ministers-likely-to-vote-on-assisted-dying	How are cabinet ministers likely to vote on assisted dying? - The Guardian	Cabinet ministers have been asked to stay neutral before the free vote but this is what we know about their positions	https://i.guim.co.uk/img/media/aaec7b93f53b8e0f4cb7fa491bbba950bf219ee4/0_486_8192_4918/master/8192.jpg?width=1200&height=630&quality=85&auto=format&fit=crop&overlay-align=bottom%2Cleft&overlay-width=100p&overlay-base64=L2ltZy9zdGF0aWMvb3ZlcmxheXMvdGctZGVmYXVsdC5wbmc&enable=upscale&s=f229bbd8900a20a99d1ea0271a2d1ef6	2024-11-18 17:14:00	The Guardian
gb	https://www.bbc.com/news/articles/c1wj5v711zzo	Children's homes: Providers' 'exploitative' profits to be curbed - BBC.com	The new measures aim to stop private care home providers benefiting excessively from a stretched system.	https://ichef.bbci.co.uk/news/1024/branded_news/7655/live/98c0c710-a542-11ef-bdf5-b7cb2fa86e10.jpg	2024-11-18 08:08:53	BBC.com
gb	https://www.bbc.co.uk/news/articles/c33elmnzj0po	Sudan war: Furious row at UN as Russia blocks peace move - BBC	The UK calls vetoing a ceasefire plan a "disgrace" but Russia says Sudan's sovereignty is being ignored.	https://ichef.bbci.co.uk/news/1024/branded_news/8f1a/live/b25ff3d0-a5d3-11ef-bdf5-b7cb2fa86e10.jpg	2024-11-18 18:06:12	BBC
gb	https://www.bbc.com/news/articles/c33elmnzj0po	Wales to form own deposit return scheme to encourage recycling - after glass bottles row - Sky News	The UK calls vetoing a ceasefire plan a "disgrace" but Russia says Sudan's sovereignty is being ignored.	https://ichef.bbci.co.uk/news/1024/branded_news/8f1a/live/b25ff3d0-a5d3-11ef-bdf5-b7cb2fa86e10.jpg	2024-11-18 16:52:30	Sky News
gb	https://pressgazette.co.uk/media_law/telegraph-allison-pearson-tweet-public-order-offence-law-change/	Telegraph calls for change in law after Allison Pearson accused of Public Order offence - Press Gazette	The deleted message from Telegraph journalist Allison Pearson on X which promoted a police investigation is still live on internet archive.	https://pressgazette.co.uk/wp-content/uploads/sites/7/web/q/y/j/Allison_Pearson.jpg?1731954593	2024-11-18 14:26:15	Press Gazette
gb	https://www.theguardian.com/society/2024/nov/18/more-than-one-in-three-uk-children-poverty-deprivation-record-high	More than one in three children in poverty as UK deprivation hits record high - The Guardian	Exclusive: Study finds almost quarter of UK population living in poverty, reaching the highest level this century	https://i.guim.co.uk/img/media/67aaaaeb14f0ad34efaac5ccc9ac454ec8afdb5f/0_126_4928_2957/master/4928.jpg?width=1200&height=630&quality=85&auto=format&fit=crop&overlay-align=bottom%2Cleft&overlay-width=100p&overlay-base64=L2ltZy9zdGF0aWMvb3ZlcmxheXMvdGctZGVmYXVsdC5wbmc&enable=upscale&s=7692a25c5b01bb820868c812b3c18d7a	2024-11-18 18:06:00	The Guardian
gb	https://www.theguardian.com/football/2024/nov/18/rodrigo-bentancur-tottenham-seven-match-ban-comments-son-heung-min	Rodrigo Bentancur hit with seven-match ban for comments about Son - The Guardian	Tottenham midfielder Rodrigo Bentancur has been given a seven-match domestic ban by the FA for an alleged racist remark made about teammate Son Heung-min in a TV interview	https://i.guim.co.uk/img/media/a3e4b97001596f11a6029468d6a63dbde931e8ad/806_433_2148_1289/master/2148.jpg?width=1200&height=630&quality=85&auto=format&fit=crop&overlay-align=bottom%2Cleft&overlay-width=100p&overlay-base64=L2ltZy9zdGF0aWMvb3ZlcmxheXMvdGctZGVmYXVsdC5wbmc&enable=upscale&s=f9b772c8d9ea87937fa22b16354d89ab	2024-11-18 18:22:00	The Guardian
gb	https://www.independent.co.uk/news/uk/home-news/queen-camilla-dog-beth-death-rspca-b2649111.html	Queen Camilla left ‘heartbroken’ after her beloved Jack Russell is put down - The Independent	The terrier was adopted by Camilla from the Battersea Dogs and Cats Home, along with her other dog Bluebell  	https://static.independent.co.uk/2024/11/18/16/GettyImages-1230027304.jpg?quality=75&width=1200&auto=webp	2024-11-18 16:05:00	The Independent
gb	https://www.theguardian.com/sport/2024/nov/18/inside-jokes-powering-raducanu-and-boulters-gb-team-to-bjk-cup-success	Inside jokes powering Raducanu and Boulter’s GB team to BJK Cup success - The Guardian	Togetherness off the court is key to captain Anne Keothavong’s strategy as Great Britain aim to reach first final for 43 years	https://i.guim.co.uk/img/media/c040752f6a6d0128eb4d18da3a7792bff06332e7/369_2_4425_2656/master/4425.jpg?width=1200&height=630&quality=85&auto=format&fit=crop&overlay-align=bottom%2Cleft&overlay-width=100p&overlay-base64=L2ltZy9zdGF0aWMvb3ZlcmxheXMvdGctZGVmYXVsdC5wbmc&enable=upscale&s=9bb2d53900ffb126779cea8c3774f98d	2024-11-18 18:11:00	The Guardian
gb	https://news.google.com/rss/articles/CBMiWkFVX3lxTE80N2VaNk8zVHZCbkVUOWRTUHo0aUJvOXl1ckl0cjlrVUl1ZEZCeTVQcmJwNjFpVWdIWllJZjloN0dlbHEtNFZla0h2ZTlYVDBHbFBPSWxUUnBjUdIBX0FVX3lxTE9sMXlfTzB3RlYyR2VPZ1loM24wRDc0ekdpV0hjbnpIUUhlWVg4VzE0dFREV2RURGhCSHdocXhMVmw2bk9HN1o2cnA0Vk95WHM1NDN4a3psOFRFdGtTOEFJ?oc=5	Farmers' protest heads to Westminster as inheritance tax anger grows - BBC.com	None	None	2024-11-18 16:55:41	BBC.com
gb	https://www.theguardian.com/uk-news/2024/nov/18/police-chief-calls-for-biggest-shake-up-of-england-and-wales-policing-since-1960s	Police chief calls for biggest shake-up of England and Wales policing since 1960s - The Guardian	Chair of National Police Chiefs’ Council says major changes needed urgently to make service fit for modern age	https://i.guim.co.uk/img/media/3a0234fa7c51f99f1e8acc58a9a168e0a3c39d01/0_360_8640_5184/master/8640.jpg?width=1200&height=630&quality=85&auto=format&fit=crop&overlay-align=bottom%2Cleft&overlay-width=100p&overlay-base64=L2ltZy9zdGF0aWMvb3ZlcmxheXMvdGctZGVmYXVsdC5wbmc&enable=upscale&s=fd405f01be0c79c420b110fca4314d79	2024-11-18 19:23:00	The Guardian
gb	https://news.sky.com/story/wales-to-form-own-deposit-return-scheme-after-glass-bottles-sparked-row-13256234	Wales to form own deposit return scheme to encourage recycling - after glass bottles row - Sky News	The previous UK government had ruled glass could not be included, but the Welsh government has announced it will now press ahead with its own scheme.	https://e3.365dm.com/24/11/1600x900/skynews-wales-recycling-reusing_6751164.jpg?20241118143037	2024-11-18 16:52:30	Sky News
gb	https://www.bbc.com/news/articles/cq8v4p2dj01o	Ask for Angela: Staff had no clue, says pub worker - BBC.com	A pub worker warns failures in the Ask for Angela safety scheme could put vulnerable women at risk.	https://ichef.bbci.co.uk/news/1024/branded_news/71ed/live/b7e7c2d0-a5a9-11ef-8ab9-9192db313061.jpg	2024-11-18 12:24:23	BBC.com
gb	https://www.bbc.com/news/articles/cwy582kl2n4o	Archbishop candidates need 'heads reading' - Bishop of Gloucester - BBC.com	The Bishop of Gloucester does not want the "very, very difficult" Archbishop of Canterbury job.	https://ichef.bbci.co.uk/news/1024/branded_news/8592/live/9f376a10-a4f0-11ef-9886-f1f9e5342481.jpg	2024-11-17 13:19:27	BBC.com
gb	https://www.dailymail.co.uk/news/article-14095795/keir-starmer-father-southport-killer-axel-rudakubana-asylum-case-downing-street.html	The truth about that Southport-Keir Starmer rumour that went viral on social media - Daily Mail	The claims were circulating on X, formerly known as Twitter, by commenters who were citing them as evidence of an alleged cover-up over the true circumstances of the Southport stabbings	https://i.dailymail.co.uk/1s/2024/11/18/13/92195745-0-image-m-12_1731937213794.jpg	2024-11-18 15:24:29	Daily Mail
gb	https://www.bbc.com/news/articles/cy4n103lxljo	Harry Kane attends statue unveiling with players from childhood club - BBC.com	England captain returns to his Walthamstow roots for unveiling ceremony of life-size statue kept hidden for four years.	https://ichef.bbci.co.uk/news/1024/branded_news/9920/live/9b581ee0-a5b2-11ef-a06c-9dea7ee6f37e.jpg	2024-11-18 15:25:54	BBC.com
gb	https://www.bbc.com/news/articles/crr91nn9n79o	Russia's response to US missiles will be 'appropriate and tangible' - BBC.com	US approval for Ukraine to strike inside Russia is a key move in the war as it reaches its 1,000th day.	https://ichef.bbci.co.uk/news/1024/branded_news/e59a/live/cba2ebb0-a5f4-11ef-8233-1b7eb95702a9.jpg	2024-11-18 21:03:50	BBC.com
gb	https://www.manchestereveningnews.co.uk/news/uk-news/uk-snow-live-met-office-30395872	UK snow LIVE: Met Office issues weather warnings as 20cm forecast - Manchester Evening News	None	None	2024-11-18 16:14:00	Manchester Evening News
gb	https://www.bbc.co.uk/news/articles/c7v3q8l7r43o	Harshita Brella murder: Family tells BBC they want 'justice' - bbc.co.uk	Ms Brella's family told the BBC she moved to the UK in April after marrying the man suspected of killing her.	https://ichef.bbci.co.uk/news/1024/branded_news/de12/live/c5b40b30-a5d6-11ef-9fb4-fd2d6da57766.jpg	2024-11-18 18:55:24	bbc.co.uk
gb	https://www.theguardian.com/world/2024/nov/18/telecoms-cable-in-baltic-sea-may-have-been-severed-says-finnish-owner	Telecoms cable in Baltic Sea may have been severed, says Finnish owner - The Guardian	Cinia working with authorities to investigate what caused outage in 745-mile line between Germany and Finland	https://i.guim.co.uk/img/media/b5e5bfcd19dcd9262f293d7d19df2bb7bbf6cb5e/0_95_6000_3600/master/6000.jpg?width=1200&height=630&quality=85&auto=format&fit=crop&overlay-align=bottom%2Cleft&overlay-width=100p&overlay-base64=L2ltZy9zdGF0aWMvb3ZlcmxheXMvdGctZGVmYXVsdC5wbmc&enable=upscale&s=17dc08f4f3f11fcc5ef919f40215c7f1	2024-11-18 18:41:00	The Guardian
gb	https://www.bbc.co.uk/news/articles/cq6lj0lgpl6o	De-icer teams and empty trains to help tackle any snow disruption across North West - bbc.co.uk	Staff armed with specialist anti-freeze kits will help clear icy spots on the railway, operators say.	https://ichef.bbci.co.uk/news/1024/branded_news/c7c4/live/7f4be450-a5d2-11ef-9fb4-fd2d6da57766.jpg	2024-11-18 18:22:26	bbc.co.uk
gb	https://www.bbc.com/news/articles/cq6lj0lgpl6o	Keir Starmer to urge G20 leaders to ‘double down’ on Ukraine support - Financial Times	Staff armed with specialist anti-freeze kits will help clear icy spots on the railway, operators say.	https://ichef.bbci.co.uk/news/1024/branded_news/c7c4/live/7f4be450-a5d2-11ef-9fb4-fd2d6da57766.jpg	2024-11-18 11:38:01	Financial Times
gb	https://www.liverpoolecho.co.uk/news/liverpool-news/man-arrested-suspicion-murder-after-30398977	Man arrested on suspicion of murder after woman found dead - Liverpool Echo	A 47-year-old man has been taken to a police station for questioning	https://i2-prod.liverpoolecho.co.uk/article30398995.ece/ALTERNATES/s1200/0_LEC_HR_181124_WaltonVillagearrest.png	2024-11-18 17:29:00	Liverpool Echo
gb	https://news.stv.tv/west-central/creator-of-viral-willy-wonka-experience-placed-on-sex-offenders-register	Creator of viral Willy Wonka experience placed on sex offenders register - STV News	William 'Billy' Coull was the man behind the disastrous Willy Wonka experience in Glasgow that went viral around the world.	https://news.stv.tv/wp-content/uploads/2024/11/41c822288d4824aac9bd2fb87ff3259f-1731942991-social-default.jpg	2024-11-18 15:24:24	STV News
gb	https://www.bbc.co.uk/news/articles/cy871v014rno	Thirlwall Inquiry: Letby concerns 'very much a police matter' - inquiry - bbc.co.uk	Police were not told that doctors believed Letby was killing babies for almost a year, an inquiry hears.	https://ichef.bbci.co.uk/news/1024/branded_news/d988/live/829bc4e0-a5cd-11ef-ba1e-872951c9e28a.jpg	2024-11-18 18:11:16	bbc.co.uk
gb	https://www.bbc.co.uk/news/articles/c1wj43vqdlpo	Delhi air pollution levels at 'severe plus', authorities say - bbc.co.uk	India's capital Delhi is experiencing one of its most polluted days this year.	https://ichef.bbci.co.uk/news/1024/branded_news/bd05/live/95646c80-a5cd-11ef-8ab9-9192db313061.jpg	2024-11-18 11:15:02	bbc.co.uk
gb	https://news.stv.tv/north/man-31-appears-in-court-charged-with-raping-girl-16-in-dundee-car-park	Man, 31, appears in court charged with raping girl, 16, in Dundee car park - STV News	The incident was reported to have happened between 1am and 1.30am on Sunday, November 10.	https://news.stv.tv/wp-content/uploads/2024/11/17bd9859b54f94796d0cd4d24095676f-1731343219-social-default.jpg	2024-11-18 17:40:27	STV News
gb	https://www.theguardian.com/world/2024/nov/18/gisele-pelicot-trial-children-devastation-caused-father	Gisèle Pelicot rape trial: children tell of ‘devastation’ caused by their father - The Guardian	Couple’s two sons and daughter beg Dominique Pelicot to reveal if other family members were abused	https://i.guim.co.uk/img/media/e94db77b19179710c00a7c5eaf2053831a04922a/0_376_5499_3299/master/5499.jpg?width=1200&height=630&quality=85&auto=format&fit=crop&overlay-align=bottom%2Cleft&overlay-width=100p&overlay-base64=L2ltZy9zdGF0aWMvb3ZlcmxheXMvdGctZGVmYXVsdC5wbmc&enable=upscale&s=f9bf181bd3059f32309d903431cc8bbd	2024-11-18 19:22:00	The Guardian
gb	https://news.stv.tv/north/teen-who-killed-bus-driver-sentenced-to-four-years	Teen who killed bus driver sentenced to four years - STV News	Keith Rollinson, 58, died of cardiac arrest following the assault in Elgin bus station on February 2, 2024.	https://news.stv.tv/wp-content/uploads/2024/02/7f518b08ff03b24efe6c4b0045ddc7fd-1707055297-social-default.jpg	2024-11-18 12:54:58	STV News
gb	https://www.ft.com/content/eb305c43-03c6-4cc9-9053-f0670fac8c73	Trump’s attack on the enemy within will delight America’s real foes - Financial Times	The president-elect is threatening to gut the institutions that make America great	https://www.ft.com/__origami/service/image/v2/images/raw/https%3A%2F%2Fd1e00ek4ebabms.cloudfront.net%2Fproduction%2Fe873a078-b63a-4188-8d95-22890884de35.jpg?source=next-article&fit=scale-down&quality=highest&width=700&dpr=1	2024-11-18 12:06:28	Financial Times
gb	https://www.politico.eu/article/olaf-scholz-germany-no-missiles-ukraine-volodymyr-zelenskyy-russia-war/	Olaf Scholz on German missiles for Ukraine: It’s still a no - POLITICO Europe	None	None	2024-11-18 14:06:00	POLITICO Europe
gb	https://www.independent.co.uk/news/uk/home-news/john-ellis-vet-suicide-winchester-b2649162.html	Vet killed himself after becoming distressed at wealthy owners asking him to put down their pets - The Independent	Dr John Ellis tricked a veterinary nurse to give him deadly medication by claiming he was going to put down a friend’s ‘large dog’  	https://static.independent.co.uk/2024/11/18/16/newFile-5.jpg?quality=75&width=1200&auto=webp	2024-11-18 20:13:00	The Independent
gb	https://news.sky.com/story/james-aspin-jailed-for-threatening-to-burn-down-every-newcastle-mosque-in-tiktok-video-13256301	James Aspin jailed for threatening to burn down every Newcastle mosque in TikTok video - Sky News	The judge took into account his ADHD and guilty plea but condemned the four-minute video as "hugely offensive and dangerous".	https://e3.365dm.com/24/11/1600x900/skynews-james-aspin-mosque-necastle_6751285.jpg?20241118165336	2024-11-18 17:37:30	Sky News
gb	https://www.dailymail.co.uk/news/article-14096379/xl-bully-owner-guilty-pet-mauled-walker-death.html	Owner of 'out of control' XL bully that mauled his neighbour to death after suddenly lunging at his throat in - Daily Mail	The harrowing final moments of a man who was mauled to death in a vicious XL Bully attack in Sunderland last year have been revealed.	https://i.dailymail.co.uk/1s/2024/11/18/12/91013493-0-image-m-33_1731933866371.jpg	2024-11-18 12:34:30	Daily Mail
gb	https://www.cityam.com/reeves-has-been-straight-with-the-public-no10-insists-amid-cv-row/	Reeves has been ‘straight with the public’, No10 insists amid CV row - City A.M.	Rachel Reeves has “restored financial stability”, No10 has insisted amid claims the Chancellor exaggerated her CV and work history.	None	2024-11-18 13:55:00	City A.M.
gb	https://news.google.com/rss/articles/CBMikAFBVV95cUxOMnZaNHZ2OV9OZTgxTlZ1MnR0TVppVWc4Rl9kcnRlcmtTQ3NYdlZpWTJqdU5HN2Q3WDgyd0J0T0dheFFOXy1OSlpwRWMtNkZDODI2Qk1ITGpRaWhiQkRESm9IdWFENHB2Z3RnSmwxYTVvaEJ4QzYzcXp0UkZpS1hfOVNYNXQyNVAyRTZOUjhTRzDSAZYBQVVfeXFMT2hZTWxhWjRQZXJGUkZBbTZjaXdpeU9fYU1EWVVqV05WeTdncl9VT3lTXzJaYzVSNmJsRDE4SUx0ZzhsOU9EeUd1MDllT0djOUl3al81TEpGZXZrT24zdkxVdUt5dFA4OWktNGJJclBBR3RFT1NCaDNBRnh4eXZqeFBKeGJZV25aVHdYOURCZXoydFFGdWJn?oc=5	Liam Payne’s funeral will take place this week but his manager Roger Nores is told he is ‘not wel... - The Sun	LIAM Payne will finally be laid to rest this week but his manager Roger Nores will not be in attendance. The Sun understands that Argentinian tycoon Roger “is not welcome” at the c…	https://www.thesun.co.uk/wp-content/uploads/2024/11/crop-31789263.jpg?strip=all&quality=100&w=1920&h=1080&crop=1	2024-11-18 16:32:17	The Sun
gb	https://www.ft.com/content/da8c29b0-0a90-4d2a-8535-c8459ccc7bb4	Chinese tech groups build AI teams in Silicon Valley - Financial Times	Alibaba, ByteDance and Meituan seek to poach top talent from US rivals despite Washington’s chip curbs	https://www.ft.com/__origami/service/image/v2/images/raw/https%3A%2F%2Fd1e00ek4ebabms.cloudfront.net%2Fproduction%2F071da99b-76d0-4b74-a76d-585943a0e5b7.jpg?source=next-article&fit=scale-down&quality=highest&width=700&dpr=1	2024-11-18 21:00:43	Financial Times
gb	https://www.planetrugby.com/news/%E2%81%A0what-if-wales-sack-warren-gatland-16-possible-options-to-replace-legendary-head-coach	⁠What if Wales sack Warren Gatland? 16 possible options to replace legendary head coach - planetrugby.com	Pressure is mounting on Wales head coach Warren Gatland, as his side find themselves in rotten form in 2024. 	https://d3gbf3ykm8gp5c.cloudfront.net/content/uploads/2024/11/18155525/Possible-options-to-replace-Warren-Gatland.jpg	2024-11-18 16:18:05	planetrugby.com
gb	https://news.google.com/rss/articles/CBMiXEFVX3lxTFBNdVVOc0s3Y1g0cmwyUjRKb1hEVFk4Q2tlRWZ1LXR6TV9HSlJlcFAwenlHTHVhRDY1aURpeVhDSDd4d1dZLWlORldFa0ZvYWhnWnZrc2FtdklHR0k20gFiQVVfeXFMTXNRVWo5RnRTa1hfUzdxZkJiOXFGQjA4TDBYOVgzMEJyRF83TXdabEhHclJQeDhIb2ZJLUNwRnBfcVM0TkozNVpMUlFrTFdla0RRNE1paXVYRTR3WWw3YkwtZkE?oc=5	Sara Sharif's stepmother and uncle not to give evidence in murder trial - bbc.co.uk	Beinash Batool and Faisal Malik decline to give evidence in their trial for Sara's murder.	https://ichef.bbci.co.uk/news/1024/branded_news/c946/live/c7a2e090-a26d-11ef-b7d1-01feab8933aa.jpg	2024-11-18 14:07:06	bbc.co.uk
gb	https://www.walesonline.co.uk/sport/rugby/rugby-news/day-welsh-rugby-collapsed-amid-30390949	The day Welsh rugby collapsed amid mass exodus and hopeless exasperation - Wales Online	None	None	2024-11-18 07:53:00	Wales Online
gb	https://www.bbc.com/news/articles/c5yxl3vzq32o	Davina McCall makes 'enormous leap forward' as she leaves ICU after surgery - BBC.com	The presenter's partner says she has made an "enormous leap forward" as he thanked well-wishers.	https://ichef.bbci.co.uk/news/1024/branded_news/f2af/live/4d3beb40-a5b9-11ef-8860-8b2612f9752e.jpg	2024-11-18 13:15:20	BBC.com
gb	https://news.google.com/rss/articles/CBMiqAFBVV95cUxNRVY4TzNTeG9JOUtvd3AxenpELVNLSHhUUEtPVGRaQ293WnVNNkRWM3FTYVhMUzhMZTJLNXJrbXc3d0F1QTVsNnZFM3VEMVZZZmhwaHFKVGVqZXVYMXd0bGFKR1h4eW1TSWJ4eXplZWF5QUFpSlN0UXFpb3dCd29PVUNqRnpndlp4Qm9lN3pMemRpUExlb2laX01CVURqb2xHeGJNSWxLZ1Y?oc=5	Ebosele given highest rating for Ireland as Vata scores for Under-21s - Watford Observer	None	None	2024-11-18 12:21:13	Watford Observer
gb	https://www.theguardian.com/sport/2024/nov/18/tennis-davis-cup-rafael-nadal-retirement	Rafael Nadal ‘in peace’ before curtain falls on legendary career at Davis Cup - The Guardian	Rafael Nadal says he is at peace with his efforts as he prepares to end his legendary career at the Davis Cup finals in Málaga this week	https://i.guim.co.uk/img/media/d6dd6c77d7fd2c380b96a621b663db47cc6a270f/0_192_3769_2262/master/3769.jpg?width=1200&height=630&quality=85&auto=format&fit=crop&overlay-align=bottom%2Cleft&overlay-width=100p&overlay-base64=L2ltZy9zdGF0aWMvb3ZlcmxheXMvdGctZGVmYXVsdC5wbmc&enable=upscale&s=efb09f2df6236209a83fc133856dde08	2024-11-18 21:11:00	The Guardian
gb	https://www.theguardian.com/football/live/2024/nov/18/poland-v-scotland-nations-league-live	Poland 1-2 Scotland: Nations League – as it happened - The Guardian	Andy Roberson’s injury-time header settled a pulsating game and earned Scotland a relegation playoff in the Nations League	https://i.guim.co.uk/img/media/b1d32f1f6aa76420055a5a67c2d42b46bc0d8fac/0_188_3445_2067/master/3445.jpg?width=1200&height=630&quality=85&auto=format&fit=crop&overlay-align=bottom%2Cleft&overlay-width=100p&overlay-base64=L2ltZy9zdGF0aWMvb3ZlcmxheXMvdGctbGl2ZS5wbmc&enable=upscale&s=d6e6c90b74db97f78f1da2d563877488	2024-11-18 18:55:00	The Guardian
gb	https://news.sky.com/story/british-airways-flights-delayed-after-technical-issue-13256373	British Airways flights delayed after 'technical issue' - Sky News	One passenger posted a picture on X showing passengers waiting on the tarmac.	https://e3.365dm.com/24/06/1600x900/skynews-british-airways-heathrow-airport_6591084.jpg?20240626092826	2024-11-18 20:15:00	Sky News