country_code	url	title	description	image_url	publish_date	source
gb	https://www.bbc.co.uk/news/articles/cp3w3z08gyjo	Man arrested after fatal multi-vehicle crash on A12 in Essex - BBC	A 58-year-old was killed in a collision involving three cars on the A12 in Essex, police say. 	https://ichef.bbci.co.uk/news/1024/branded_news/a84b/live/419d9370-9064-11ef-b9f2-63856b9adaaf.jpg	2024-10-22 10:33:13	BBC
gb	https://www.telegraph.co.uk/news/2024/10/22/chris-kaba-trial-firearms-officers-downing-street/	Downing Street backs ‘legal certainty’ for firearms officers after Chris Kaba murder trial - The Telegraph	Chris Kaba was shot in the head by Sgt Martyn Blake while trying to ram his way out of a police roadblock	https://www.telegraph.co.uk/content/dam/news/2024/10/22/TELEMMGLPICT000398892106_17296119770070_trans_NvBQzQNjv4BqpVlberWd9EgFPZtcLiMQf0Rf_Wk3V23H2268P_XkPxc.jpeg?impolicy=OG-Standard	2024-10-22 16:28:00	The Telegraph
gb	https://www.theguardian.com/environment/2024/oct/22/new-commission-may-ban-england-water-companies-from-making-a-profit	New commission may ban English water companies from making a profit - The Guardian	Defra body, created to overhaul system amid public fury, may force firms to be run for public good rather than shareholder returns	https://i.guim.co.uk/img/media/db6886decf5f010ab811f05d63c74f9c3c0aeef6/0_132_3859_2315/master/3859.jpg?width=1200&height=630&quality=85&auto=format&fit=crop&overlay-align=bottom%2Cleft&overlay-width=100p&overlay-base64=L2ltZy9zdGF0aWMvb3ZlcmxheXMvdGctZGVmYXVsdC5wbmc&enable=upscale&s=17f2bfc2bd75e3e4ef6bf23b531b89fb	2024-10-22 21:06:00	The Guardian
gb	https://www.middleeasteye.net/news/edge-gaza-israeli-settlers-applaud-thud-artillery-fire	As Gaza burns, Israeli settlers make 'real estate' plans - Middle East Eye	Cheered on by influential members of Netanyahu's far-right coalition, Israel's emboldened settler movement argues that Palestinians should leave the enclave	https://www.middleeasteye.net/sites/default/files/images-story/israel-gaza-conference-ben-gvir-october-2024-menahem-kahana-afp.jpg	2024-10-22 17:35:28	Middle East Eye
gb	https://www.bbc.com/news/articles/c70w094w6g8o	Sinn Féin leaders correct age of teen texted by senator on record - BBC.com	Michelle O'Neill and Mary Lou McDonald correct the record about the age of a teenage texted by Niall Ó Donnghaile.	https://ichef.bbci.co.uk/news/1024/branded_news/4238/live/382b6580-907b-11ef-8e6d-e3e64e16c628.jpg	2024-10-22 21:29:03	BBC.com
gb	https://www.thejc.com/news/uk/senior-london-psychology-lecturer-posts-gushing-sinwar-eulogy-ssz7zb22	Senior London psychology lecturer posts gushing Sinwar eulogy - The Jewish Chronicle	London Metropolitan University distances itself from academic’s post	https://www.thejc.com/api/v1/twitterImage?articleId=contentid/1eqh7q2kuct57i7ji73&noOverlayText=true	2024-10-22 16:56:36	The Jewish Chronicle
gb	https://www.theguardian.com/uk-news/2024/oct/22/body-found-in-search-for-missing-woman-victoria-taylor	Body found in search for missing woman Victoria Taylor - The Guardian	The 34-year-old was last seen at 9am on Monday 30 September in Malton, North Yorkshire	https://i.guim.co.uk/img/media/e4c4285e906c589b7d45e7a7fafb24716868b54f/0_727_1000_600/master/1000.jpg?width=1200&height=630&quality=85&auto=format&fit=crop&overlay-align=bottom%2Cleft&overlay-width=100p&overlay-base64=L2ltZy9zdGF0aWMvb3ZlcmxheXMvdGctZGVmYXVsdC5wbmc&enable=upscale&s=9391452a11b96a56538669c1a0dcb9ea	2024-10-22 15:32:00	The Guardian
gb	https://news.sky.com/story/families-pay-tribute-to-four-people-from-glasgow-killed-in-head-on-m6-collision-13235079	Families pay tribute to four people from Glasgow killed in head-on M6 collision - Sky News	The fatal collision happened on the northbound motorway, past Tebay services in Cumbria, at about 4pm on Tuesday 15 October.	https://e3.365dm.com/24/10/1600x900/skynews-jade-arran-filip-dominic_6724338.jpg?20241022164225	2024-10-22 15:51:25	Sky News
gb	https://www.bbc.co.uk/news/articles/c3rlrv1qewqo	China holds live-fire drills on island closest to Taiwan - BBC	The drills were held for more than four hours in Niushan, an island 105km from Taiwan.	https://ichef.bbci.co.uk/news/1024/branded_news/e889/live/83e46880-9037-11ef-bed0-99f0dd2b4f73.jpg	2024-10-22 07:00:38	BBC
gb	https://news.sky.com/story/i-was-called-curry-lover-and-humiliated-by-other-teachers-the-toxic-truth-about-staffroom-bullying-13238729	'I was called curry lover and humiliated by other teachers': The toxic truth about staffroom bullying - Sky News	Sky News exposes the scale of staff-on-staff bullying at UK schools from more than 320 current and former teachers. Some have suffered a devastating emotional toll and were paid thousands to "keep quiet".	https://e3.365dm.com/24/10/1600x900/skynews-teacher-bullying_6724269.png?20241022153349	2024-10-23 03:15:40	Sky News
gb	https://www.independent.co.uk/news/uk/home-news/king-charles-australia-sydney-samoa-camilla-royal-news-b2633906.html	Indigenous protestor arrested for attempting to confront King Charles – Royal family news - The Independent	Charles will be offered the title of high chief in Samoa during his three-day visit starting today	https://static.independent.co.uk/2024/10/23/04/SEI226721513.jpg?quality=75&width=1200&auto=webp	2024-10-22 20:00:52	The Independent
gb	https://www.skysports.com/football/arsenal-vs-shakhtar-donetsk/report/521635	Arsenal 1-0 Shakhtar Donetsk: Gunners win but Riccardo Calafiori forced off injured ahead of Liverpool clash - Sky Sports	Riccardo Calafiori was forced off with an injury and Leandro Trossard missed a penalty as Arsenal were made to sweat for a 1-0 win over Shakhtar Donetsk in the Champions League.	https://e0.365dm.com/24/10/1600x900/skysports-riccardo-calafiori_6724711.jpg?20241022215345	2024-10-23 00:00:00	Sky Sports
gb	https://www.bbc.co.uk/news/articles/cx2525892g2o	Maternity services in Northern Ireland: Review calls for overhaul - BBC	A review was recommended by a coroner who had ruled on the death of baby Jaxon McVey in 2017.	https://ichef.bbci.co.uk/news/1024/branded_news/1d16/live/0e5fd8b0-905f-11ef-b9f2-63856b9adaaf.jpg	2024-10-22 10:27:50	BBC
gb	https://www.cqc.org.uk/news/kate-terroni-leave-cqc	Kate Terroni to leave CQC - CQC	None	None	2024-10-22 13:39:09	CQC
gb	https://www.bbc.com/news/articles/cy808e4p9j9o	UK and Germany to sign landmark 'defence' treaty - BBC.com	The deal will see both countries work together to develop new long-range missiles and drones.  	https://ichef.bbci.co.uk/news/1024/branded_news/7c13/live/8c199da0-90a4-11ef-9a6f-f168a30a8766.jpg	2024-10-22 22:53:59	BBC.com
gb	https://news.sky.com/story/1-100-inmates-set-for-early-release-as-review-considers-tougher-punishments-outside-prison-13238424	1,100 inmates set for early release - as review considers tougher punishments outside prison - Sky News	As part of efforts to ease prison overcrowding, a government review into sentencing will consider nudge technology, sobriety tags and home detention curfews, with watches and apps used to encourage offenders to comply with certain conditions.	https://e3.365dm.com/24/10/1600x900/skynews-prison-jail_6723707.jpg?20241021222249	2024-10-22 07:28:44	Sky News
gb	https://www.birminghammail.co.uk/news/showbiz-tv/liam-payne-death-probe-sees-30207365	Liam Payne death probe sees police examine new footage amid 'drug delivery' - Birmingham Live	None	None	2024-10-22 17:54:00	Birmingham Live
gb	https://www.theguardian.com/society/2024/oct/23/muslims-bradford-assisted-dying-bill	‘God gives you life. God takes the life’: Muslims in Bradford concerned over assisted dying bill - The Guardian	MP for nearby Spen Valley’s bill to propose change in law is creating disquiet in a community already concerned about health provision after Covid	https://i.guim.co.uk/img/media/564c2317fc462e2fc8dc08bdf4d8c0006aa44a6f/0_424_6720_4032/master/6720.jpg?width=1200&height=630&quality=85&auto=format&fit=crop&overlay-align=bottom%2Cleft&overlay-width=100p&overlay-base64=L2ltZy9zdGF0aWMvb3ZlcmxheXMvdGctZGVmYXVsdC5wbmc&enable=upscale&s=4a5275655d7dc6b547e9a64e92366ab0	2024-10-23 04:00:00	The Guardian
gb	https://www.bbc.co.uk/news/articles/cwy9yd318reo	Reeves confirms Budget spending deals struck with all departments - BBC	Despite reports of internal rifts all government departments have agreed spending settlements, Reeves says.	https://ichef.bbci.co.uk/news/1024/branded_news/16b6/live/b85ca700-90a8-11ef-b3c2-754b6219680e.jpg	2024-10-23 04:30:41	BBC
gb	https://news.sky.com/story/starmer-insists-relationship-with-trump-has-not-been-jeopardised-by-blatant-foreign-interference-complaint-13239338	Starmer insists relationship with Trump has not been jeopardised by 'blatant foreign interference' complaint - Sky News	The prime minister says he "established a good relationship" with Mr Trump as he sought to downplay the role Labour Party activists were playing in the US election.	https://e3.365dm.com/24/10/1600x900/skynews-starmer-trump-composite_6724926.jpg?20241023065037	2024-10-23 05:37:30	Sky News
gb	https://www.telegraph.co.uk/politics/2024/10/23/starmer-really-angry-criminals-thank-him-early-release/	Starmer ‘really angry’ after criminals thank him for early release - The Telegraph	None	None	2024-10-23 05:00:00	The Telegraph
gb	https://www.dailymail.co.uk/news/article-13990861/newborn-baby-fighting-life-woman-plunge-death.html	Newborn baby fighting for its life after woman plunges to her death - Daily Mail	The little baby is today receiving 'critical care' after a woman, aged in her 30s, fell to her death from Shakespeare Towers in Burmantofts, Leeds, yesterday morning.	https://i.dailymail.co.uk/1s/2024/10/23/07/91176457-0-image-a-31_1729664846516.jpg	2024-10-23 06:31:31	Daily Mail
gb	https://www.bbc.co.uk/news/articles/cn4y42y5wn4o	Birds of prey deaths blamed on shooting estate gamekeepers - RSPB - BBC	The bird protection charity described the deaths as a 'national disgrace'.	https://ichef.bbci.co.uk/news/1024/branded_news/3e99/live/4f941330-905c-11ef-85c5-835c0e0a55bc.jpg	2024-10-23 00:19:26	BBC
gb	https://www.euronews.com/2024/10/22/idf-claims-to-have-found-hezbollah-bunker-full-of-cash-and-gold-under-beirut-hospital	IDF claims to have found Hezbollah bunker full of 'cash and gold' under Beirut hospital - Euronews	The hospital's director insists the facility has not been used by Hezbollah, and that the only subterranean areas there are underground operating theatres.	https://static.euronews.com/articles/stories/08/80/42/26/1200x675_cmsv2_29df45f1-6420-58a4-aacc-1f38e626c12e-8804226.jpg	2024-10-22 07:36:33	Euronews
gb	https://www.independent.co.uk/news/world/europe/south-north-korea-russia-soldiers-b2633452.html	South Korea warns it could arm Ukraine amid fears of Putin Kim Jong Un weapon swap - The Independent	South Korea claimed North Korea sent 1,500 special operation forces to Russia this month	https://static.independent.co.uk/2024/10/18/10/North-Korea-Russia_56257.jpg?quality=75&width=1200&auto=webp	2024-10-22 11:44:44	The Independent
gb	https://www.telegraph.co.uk/business/2024/10/22/reeves-rakes-in-record-inheritance-tax-receipts-budget/	Reeves rakes in record £2.2bn from ‘death tax’ - The Telegraph	None	None	2024-10-22 09:31:00	The Telegraph
gb	https://www.middleeasteye.net/news/us-intended-tell-uk-israel-used-stealth-drones-which-can-fly-over-iran	US intended to inform UK about Israeli stealth drone use over Iran - Middle East Eye	Top secret US government documents leaked last week show that Israel has been using a long-range surveillance drone capable of flying covertly over Iran	https://www.middleeasteye.net/sites/default/files/images-story/000_36H39B9.jpg	2024-10-22 13:42:23	Middle East Eye
gb	https://www.theguardian.com/football/2024/oct/22/manchester-city-pep-guardiola-john-stones-england-injury-angry	‘Never so angry’: Guardiola underlines Stones’ value by recalling fury at England injury - The Guardian	Pep Guardiola has stressed John Stones’s importance by revealing his anger when the defender was injured in England’s friendly against Belgium in March	https://i.guim.co.uk/img/media/82756b29aef29703f1338dc09df1052ac9a6427e/0_47_5499_3299/master/5499.jpg?width=1200&height=630&quality=85&auto=format&fit=crop&overlay-align=bottom%2Cleft&overlay-width=100p&overlay-base64=L2ltZy9zdGF0aWMvb3ZlcmxheXMvdGctZGVmYXVsdC5wbmc&enable=upscale&s=96a60b8119f3b8b536d5c68205676af1	2024-10-23 01:30:00	The Guardian
gb	https://news.google.com/rss/articles/CBMiWkFVX3lxTE5DZTB1M3Zhb0plNDBiT1RmSHM0a09PM1FPN0luYmZWOTVoWUx0Ml9mSFF2aWdIbzNBaXZNaFA5ZmNVczl0bTd6SWpfMzdZclZBeHVPMkJhQmJkd9IBX0FVX3lxTE5jR004NWFPZGhGS2g1aUE5dVpvNVFLMWltbElnVHJSclBBTDFHMGJGYkNScy1Qa01DYktpMzRnaHBQa3ZSLS00Q0pQREtrdzA0QVlZcHpPS1U2dGFjVVRR?oc=5	Veterans demand raising of £50m cap on gay ban payout - BBC.com	Leading charities have written to the prime minister, calling the average payments "unacceptably low".	https://ichef.bbci.co.uk/news/1024/branded_news/165e/live/f7eb6480-90c9-11ef-8d94-275c0d81f814.jpg	2024-10-22 23:02:52	BBC.com
gb	https://www.euronews.com/2024/10/23/russias-expanded-brics-meeting-sends-jitters-around-europe-putin-xi-turkey-china	Russia’s expanded BRICS meeting sends jitters around Europe - Euronews	China’s Xi Jinping, India’s Narendra Modi, Turkey’s Recep Tayyip Erdoğan and possibly even the UN Secretary General are attending a controversial meeting in Russia of a grouping that threatens to dwarf the EU’s economic clout.	https://static.euronews.com/articles/stories/08/80/59/48/1200x675_cmsv2_36df329e-f025-5831-ad5e-f282e17147cb-8805948.jpg	2024-10-23 05:31:18	Euronews
gb	https://www.bbc.com/news/articles/ckg0g33n3g6o	Jokey reform ideas removed from NHS consultation website - BBC.com	The health department says it is removing "irrelevant" posts from an online consultation.	https://ichef.bbci.co.uk/news/1024/branded_news/8d59/live/93485200-8fce-11ef-80a8-4be99bc37a5c.jpg	2024-10-21 17:09:40	BBC.com
gb	https://news.google.com/rss/articles/CBMimAFBVV95cUxNWF9GZTlMa3dWTC1LQnlGcGNEalRQY2l0R1FNdk92QWc2SXM5VFhLSEVIclNMa1ltWWhkVXlWSmp5NkhxQlBpaDBvSElBeDFlOUgxYmhxdUEzTkxUczdtSzEyaWlDNWtSTW1EUm5ZWW5VbEQyamNHd3d3WTNadk9RWE1mcHlGOXVIVGxBQzVCQkhXemI0U2FPbA?oc=5	Man charged over murder of woman attacked walking her dog - Sky News	Anita Rose, a mother-of-six, was found unconscious with serious head injuries on a track road by a cyclist.	None	2024-10-22 21:19:49	Sky News
gb	https://www.theguardian.com/commentisfree/2024/oct/23/moldova-eu-referendum-russia-brexit-europe	In Moldova, we held our EU referendum in Russia’s shadow. The result was too close for comfort - The Guardian	Like Brexit, our vote on Europe teetered on a knife-edge. While the pro-EU side scraped a win, Russia is waiting to undermine it, says Paula Erizanu, a Moldovan journalist and writer based in Chișinău	https://i.guim.co.uk/img/media/c262d3cd9216225bd88566691d2576e14af0fd02/0_207_5184_3110/master/5184.jpg?width=1200&height=630&quality=85&auto=format&fit=crop&overlay-align=bottom%2Cleft&overlay-width=100p&overlay-base64=L2ltZy9zdGF0aWMvb3ZlcmxheXMvdGctb3BpbmlvbnMucG5n&enable=upscale&s=ec4fe556f73264e8a4816041bf7cbdc5	2024-10-23 06:00:00	The Guardian
gb	https://www.bbc.co.uk/news/articles/cm242380133o	Israel says it killed Nasrallah's heir apparent - BBC	Lebanon's Hezbollah organisation has not confirmed Hashem Safieddine's death earlier this month.   	https://ichef.bbci.co.uk/news/1024/branded_news/d9d5/live/3e5d7770-90c3-11ef-af9e-9b6521640e96.jpg	2024-10-22 23:55:17	BBC
gb	https://www.lancs.live/news/celebs-tv/susanna-reid-interrupts-gmb-makes-30199980	Susanna Reid interrupts GMB as she makes tragic breaking news announcement - Lancs Live	None	None	2024-10-22 09:15:24	Lancs Live
gb	https://www.theguardian.com/politics/2024/oct/23/local-transport-funding-at-risk-as-reeves-considers-big-budget-cuts	Local transport funding at risk as Reeves considers big budget cuts - The Guardian	Exclusive: England mayors fear bus, tube and tram plans could be scrapped if Treasury reneges on agreed budgets	https://i.guim.co.uk/img/media/8c3f13ede57fa01c51d29f0814e6ee5947f1f774/0_549_8192_4915/master/8192.jpg?width=1200&height=630&quality=85&auto=format&fit=crop&overlay-align=bottom%2Cleft&overlay-width=100p&overlay-base64=L2ltZy9zdGF0aWMvb3ZlcmxheXMvdGctZGVmYXVsdC5wbmc&enable=upscale&s=e083b067b4e19d19a872d6f5b4a46a00	2024-10-23 07:07:00	The Guardian
gb	https://www.manchestereveningnews.co.uk/news/cost-of-living/what-could-announced-autumn-budget-30194288	What could be announced in Autumn Budget 2024 - from state pension rise to tax changes - Manchester Evening News	None	None	2024-10-22 18:14:00	Manchester Evening News
gb	https://www.theguardian.com/world/2024/oct/22/irish-pm-says-case-of-boy-whose-disappearance-went-unnoticed-is-disturbing	Murder case of unnoticed missing boy ‘utterly horrifying’, says Irish PM - The Guardian	Police believe eight-year-old Kyran Durnin disappeared two years ago and presume that he is now dead	https://i.guim.co.uk/img/media/9690e68f35dd2176be3f29cc937ac9a4e2406b96/0_1571_4284_2570/master/4284.jpg?width=1200&height=630&quality=85&auto=format&fit=crop&overlay-align=bottom%2Cleft&overlay-width=100p&overlay-base64=L2ltZy9zdGF0aWMvb3ZlcmxheXMvdGctZGVmYXVsdC5wbmc&enable=upscale&s=d91a155e6d08927ca4f48a6290550fc0	2024-10-22 17:44:00	The Guardian
gb	https://www.bbc.co.uk/news/articles/c3vkv4kwr06o	Starmer warns Russia attacks in Ukraine risk global food security - BBC	Despite the war, Ukraine is still a significant supplier of agricultural goods including grain.	https://ichef.bbci.co.uk/news/1024/branded_news/0136/live/c54e1f90-90b0-11ef-abfd-93fdbbdc7adf.jpg	2024-10-22 21:30:31	BBC
gb	https://www.gov.uk/government/news/uk-strengthens-national-security-and-bolsters-ukraines-war-chest-with-226-billion-military-loan	UK strengthens national security and bolsters Ukraine’s war chest with £2.26 billion military loan - GOV.UK	Ukraine will receive further funding to purchase essential military equipment to defend itself against Russia’s illegal invasion, as the Chancellor today announces that the Government will loan a further £2.26 billion in new money to Ukraine.	https://assets.publishing.service.gov.uk/media/6717645dd100972c0f4c9b5d/s960_Ukraine_PN_image__1_.jpeg	2024-10-21 23:00:00	GOV.UK
gb	https://www.bbc.com/news/articles/c1d5d6nng67o	Is the system letting down people who were harmed by Covid vaccines? - BBC.com	People affected by rare blood clots say they feel they have been airbrushed out of the pandemic.	https://ichef.bbci.co.uk/news/1024/branded_news/cb6a/live/79561300-908c-11ef-89ae-5575c76d98e6.png	2024-10-23 06:24:04	BBC.com
gb	https://www.theguardian.com/football/2024/oct/22/not-great-news-arteta-concerned-after-calafiori-joins-arsenal-injury-list	‘Not great news’: Arteta concerned after Calafiori joins Arsenal injury list - The Guardian	The defender was forced off during the second half of Arsenal’s win over Shakhtar, while Bukayo Saka is ‘unlikely’ to be fit for the Liverpool game	https://i.guim.co.uk/img/media/db8434161f09389c96c0e7cb0dd12ac82f18d19f/0_116_2313_1388/master/2313.jpg?width=1200&height=630&quality=85&auto=format&fit=crop&overlay-align=bottom%2Cleft&overlay-width=100p&overlay-base64=L2ltZy9zdGF0aWMvb3ZlcmxheXMvdGctZGVmYXVsdC5wbmc&enable=upscale&s=89fb93ccb11bbedba12bbee9eff56d60	2024-10-23 01:30:00	The Guardian
gb	https://news.sky.com/story/suspect-arrested-after-man-killed-and-another-injured-at-hamilton-community-centre-13238600	Suspect arrested after man killed and another injured at Hamilton community centre - Sky News	A 36-year-old man was pronounced dead at The Burnbank Centre after the alarm was raised on Monday afternoon while a 59-year-old man was taken to hospital.	https://e3.365dm.com/24/10/1600x900/skynews-hamilton-burnbank-centre_6723880.jpg?20241022091616	2024-10-22 08:53:47	Sky News
gb	https://www.bbc.com/news/articles/cx2525892g2o	Lee Hsien Yang: 'Persecuted' son of Singapore founder Lee Kuan Yew gains UK asylum - BBC	A review was recommended by a coroner who had ruled on the death of baby Jaxon McVey in 2017.	https://ichef.bbci.co.uk/news/1024/branded_news/1d16/live/0e5fd8b0-905f-11ef-b9f2-63856b9adaaf.jpg	2024-10-23 02:12:53	BBC
gb	https://www.bbc.com/news/articles/cm2y2r1knpmo	Norovirus: Vaccine to be trialled for vomiting bug - BBC.com	The easily spreadable virus can affect people of all ages and have huge consequences during winter.	https://ichef.bbci.co.uk/news/1024/branded_news/d5de/live/e636d580-9088-11ef-bac8-a32b12f57a35.jpg	2024-10-23 04:50:45	BBC.com
gb	https://www.bbc.com/news/articles/c93y31er2wzo	My greedy best friend stole £86,000 from my daughter's charity - BBC.com	Angela MacVicar feels "hurt and betrayed" by the crimes of Lindsay MacCallum, her best friend of decades.	https://ichef.bbci.co.uk/news/1024/branded_news/b4e8/live/50697c40-90b7-11ef-b3c2-754b6219680e.jpg	2024-10-23 05:47:24	BBC.com
gb	https://www.bbc.com/news/articles/cx252v6l60lo	Woman, 91, who killed toddler should not have been driving - inquiry - BBC.com	An FAI has called for a change to the laws about fitness to drive as the current system is "defective".	https://ichef.bbci.co.uk/news/1024/branded_news/d6b4/live/f23bfab0-8fbe-11ef-b3c2-754b6219680e.png	2024-10-22 16:41:43	BBC.com
gb	https://www.independent.co.uk/sport/football/aston-villa-bologna-champions-league-result-score-b2633808.html	Aston Villa take unlikely position as Unai Emery allows fans to dream again - The Independent	Aston Villa 2-0 Bologna:  Unai Emery’s men moved to the top of the Champions League as John McGinn and Jhon Duran made it three wins from three 	https://static.independent.co.uk/2024/10/22/21/2180327855.jpg?quality=75&width=1200&auto=webp	2024-10-22 23:52:00	The Independent
gb	https://www.bbc.com/news/articles/c3rlrv1qewqo	Leeds United boss on Largie Ramazani's injury and what worried him during Championship win over Watford - The Yorkshire Post	The drills were held for more than four hours in Niushan, an island 105km from Taiwan.	https://ichef.bbci.co.uk/news/1024/branded_news/e889/live/83e46880-9037-11ef-bed0-99f0dd2b4f73.jpg	2024-10-22 21:54:00	The Yorkshire Post
gb	https://www.eurosport.com/football/champions-league/2024-2025/live-real-madrid-borussia-dortmund_mtc1525244/live-commentary.shtml	Real Madrid - Borussia Dortmund live: Champions League - Football - TNT Sports	Get the latest Football updates on Eurosport. Catch Real Madrid - Borussia Dortmund live on 22/10/2024. Find scores, stats and comments in real time.	https://i.eurosport.com/2024/10/01/4046996-82077568-2560-1440.jpg	2024-10-22 21:00:36	TNT Sports