country_code	url	title	description	image_url	publish_date	source
gb	https://www.theguardian.com/world/2024/nov/15/john-smyth-victim-calls-for-more-bishops-to-resign-over-abuse-cover-up	John Smyth victim calls for more bishops to resign over abuse cover-up - The Guardian	Man beaten until he bled as a child says Stephen Conway, Jo Bailey Wells and others must ‘look at their consciences’	https://i.guim.co.uk/img/media/420a077939ed8b5c88d536e4d91095df96ab8268/0_78_1440_864/master/1440.jpg?width=1200&height=630&quality=85&auto=format&fit=crop&overlay-align=bottom%2Cleft&overlay-width=100p&overlay-base64=L2ltZy9zdGF0aWMvb3ZlcmxheXMvdGctZGVmYXVsdC5wbmc&enable=upscale&s=c5874aa4ecd65972979cc22a7564588b	2024-11-15 16:12:00	The Guardian
gb	https://www.ft.com/content/96b7d4f7-569d-4c16-b828-a6d48a906eae	Elon Musk’s mission to reinvent American government - Financial Times	Donald Trump has given the billionaire the task of slashing the size of the state. Similar efforts have fallen far short in the past	https://www.ft.com/__origami/service/image/v2/images/raw/https%3A%2F%2Fd1e00ek4ebabms.cloudfront.net%2Fproduction%2F25f7aa5a-7ad7-46c1-8d3a-55598c453ac3.jpg?source=next-article&fit=scale-down&quality=highest&width=700&dpr=1	2024-11-15 18:52:17	Financial Times
gb	https://www.lbc.co.uk/news/pregnant-wife-forced-to-direct-ambulance-to-hospital-as-husband-lay-dying-after/	Pregnant wife forced to direct ambulance to hospital as husband lay dying after driver 'didn't know directions' - LBC	The death of a motorcyclist could have been avoided after his pregnant wife was forced to direct the ambulance to hospital following an hour wait for the emergency services, an inquest has heard.	https://images.lbc.co.uk/images/687971?width=1200&crop=16_9&signature=ohGy2BUBM7I6DeNAeEYuCxWQ66I=	2024-11-15 14:29:00	LBC
gb	https://www.planetrugby.com/news/lawrence-dallaglio-springboks-have-an-inherent-advantage-as-ex-england-captain-pinpoints-how-steve-borthwicks-team-can-beat-them	Lawrence Dallaglio: Springboks have an 'inherent advantage' over England - planetrugby.com	Lawrence Dallaglio is talking about rugby matches between England and South Africa and why the Springboks hold an “inherent” advantage.	https://d3gbf3ykm8gp5c.cloudfront.net/content/uploads/2024/11/15150132/Springboks-captain-Siya-Kolisi-and-an-insert-of-ex-England-captain-Lawrence-Dallaglio-1.jpg	2024-11-15 15:03:44	planetrugby.com
gb	https://www.france24.com/en/europe/20241115-protesters-in-georgia-s-breakaway-region-abkhazia-storm-parliament-over-russian-investment-measure	Protesters storm parliament in Georgia separatist region Abkhazia over deal with Russia - FRANCE 24 English	Protesters stormed the parliament of Georgia's Russia-backed breakaway region of Abkhazia on Friday while the government was set to discuss a real-estate investment agreement with Russia. Some Abkhaz…	https://s.france24.com/media/display/0d16d0c6-a356-11ef-a969-005056a97e36/w:1280/p:16x9/2024-11-15T123810Z_1681289441_RC2O5BAJOBKL_RTRMADP_3_GEORGIA-ABKHAZIA-PARLIAMENT.JPG	2024-11-15 13:57:24	FRANCE 24 English
gb	https://www.thesun.co.uk/tvandshowbiz/31736849/paddy-mcguinness-cycling-children-in-need/	Paddy McGuinness in floods of tears as he raises ENORMOUS sum cycling across the UK for Children In Need... - The Sun	PADDY McGuinness has smashed his charity cycle for Children In Need – raising more than £7 MILLION for needy kids across the UK. An aching Paddy was overcome with emotion as he crossed the fi…	https://www.thesun.co.uk/wp-content/uploads/2024/11/crop-31737820.jpg?strip=all&quality=100&w=1920&h=1080&crop=1	2024-11-15 12:34:45	The Sun
gb	https://www.theguardian.com/football/2024/nov/15/belarus-nations-league-northern-ireland-russia-alexander-lukashenko	Presence of Belarus in international football is validation for a pariah state - The Guardian	Northern Ireland’s tie with eastern European nation can be viewed as a win for president Alexander Lukashenko	https://i.guim.co.uk/img/media/a03c1bdfafd97c62aaa60092d3b8e78e72082a50/0_279_4138_2483/master/4138.jpg?width=1200&height=630&quality=85&auto=format&fit=crop&overlay-align=bottom%2Cleft&overlay-width=100p&overlay-base64=L2ltZy9zdGF0aWMvb3ZlcmxheXMvdGctZGVmYXVsdC5wbmc&enable=upscale&s=9910a687f57ba1256428a9d5f06dd4e2	2024-11-15 11:23:00	The Guardian
gb	https://www.theguardian.com/uk-news/2024/nov/15/lucy-letby-inquiry-hospital-bosses-not-reporting-baby-deaths	‘Lack of transparency’ over spike in baby deaths, watchdog tells Letby inquiry - The Guardian	CQC official says hospital bosses had obligation to raise concerns during inspection nine months after first murder	https://i.guim.co.uk/img/media/6d90710cfa6cf6ef5abde5ac2e40e7be41fe665b/0_369_8088_4854/master/8088.jpg?width=1200&height=630&quality=85&auto=format&fit=crop&overlay-align=bottom%2Cleft&overlay-width=100p&overlay-base64=L2ltZy9zdGF0aWMvb3ZlcmxheXMvdGctZGVmYXVsdC5wbmc&enable=upscale&s=89cd2ba05617c6ba199ccdc54276bcc8	2024-11-15 18:16:00	The Guardian
gb	https://news.sky.com/story/sara-sharif-images-released-of-cricket-bat-and-pole-which-girls-dad-admits-he-used-to-attack-her-before-she-died-13254787	Sara Sharif's father denies her body was jetwashed before family fled to Pakistan - Sky News	Sara's father Urfan Sharif, his wife Beinash Batool, and his brother Faisal Malik are accused of being party to years-long abuse which culminated in her death. They all deny the charges against them.	https://e3.365dm.com/24/11/1600x900/skynews-sara-sharif-surrey-police_6749225.jpg?20241115175434	2024-11-15 18:34:39	Sky News
gb	https://theconversation.com/keir-starmer-says-the-uk-can-decarbonise-without-disruption-thats-neither-true-nor-helpful-243636	Keir Starmer says the UK can decarbonise without disruption – that’s neither true nor helpful - The Conversation	It’s the government’s job to make it easier and cheaper for people to change their lives.	https://images.theconversation.com/files/632096/original/file-20241114-15-tc4wx3.jpg?ixlib=rb-4.1.0&rect=0%2C682%2C5062%2C2531&q=45&auto=format&w=1356&h=668&fit=crop	2024-11-14 16:35:15	The Conversation
gb	https://www.planetrugby.com/news/ireland-unconvincingly-edge-argentina-to-bounce-back-from-all-blacks-defeat-claiming-a-hard-fought-three-point-victory	Ireland unconvincingly edge Argentina to bounce back from All Blacks defeat claiming a hard-fought three-point victory - planetrugby.com	Ireland bounced back from their second home loss under Andy Farrell to defeat Argentina 22-19 at the Aviva Stadium in Dublin on Friday evening.	https://d3gbf3ykm8gp5c.cloudfront.net/content/uploads/2024/11/15211637/Irelands-Joe-McCarthy-scores-their-sides-third-try-of-the-game-during-the-Autumn-international-match-at-the-Aviva-Stadium-Dublin..jpg	2024-11-15 22:19:26	planetrugby.com
gb	https://www.englandrugby.com/follow/news-media/england-name-team-face-australia	England A name team to face Australia A - England Rugby	None	None	2024-11-15 15:06:13	England Rugby
gb	https://www.ft.com/content/206b7a4a-5aa8-4f68-91c4-1dee12d17a97	Donald Trump’s cabinet picks: key players in the president-elect’s administration - Financial Times	The US political establishment has been shocked by some of the candidates, who still have to be confirmed by the Senate	https://www.ft.com/__origami/service/image/v2/images/raw/https%3A%2F%2Fd1e00ek4ebabms.cloudfront.net%2Fproduction%2Fc6173c2d-0c33-4427-8c75-192dd09c009b.jpg?source=next-article&fit=scale-down&quality=highest&width=700&dpr=1	2024-11-15 19:51:19	Financial Times
gb	https://www.bbc.com/news/articles/cwygw982e3xo	UK economy barely grew between July and September - BBC.com	The chancellor says she is "not satisfied" by the latest growth figures, which were weaker than expected.	https://ichef.bbci.co.uk/news/1024/branded_news/4eee/live/9aaa1880-a329-11ef-8081-4d8651dcd4f7.jpg	2024-11-15 15:39:38	BBC.com
gb	https://www.standard.co.uk/news/crime/girl-motorway-police-car-tamzin-hall-m5-b1194171.html	Teenage girl who died on motorway after fleeing police vehicle named - Evening Standard	Tamzin Hall was being taken in a police car to a custody suite when she was killed	https://static.standard.co.uk/2022/01/19/10/a60bc6669bb9db767cfad1e271f79aa7Y29udGVudHNlYXJjaGFwaSwxNjQyNjc1MjMy-2.64762692.jpg?width=1200&auto=webp&quality=75	2024-11-15 05:50:35	Evening Standard
gb	https://www.bbc.co.uk/news/articles/cev9nxnygzpo	Allison Pearson: Police defend investigation into journalist's tweet - BBC	The Daily Telegraph columnist said she was left “dumbstruck and upset” by a police visit to her home.	https://ichef.bbci.co.uk/news/1024/branded_news/f41f/live/9f6e0140-a2bd-11ef-bdf5-b7cb2fa86e10.jpg	2024-11-15 23:55:12	BBC
gb	https://www.ft.com/content/a3d6019a-f618-4a88-bf4b-e35c4b596f91	Donald Trump’s nominees heading for thorny confirmation process - Financial Times	Controversial picks such as Matt Gaetz and Robert F Kennedy Jr will face hurdles even in a Republican-controlled Senate	https://www.ft.com/__origami/service/image/v2/images/raw/https%3A%2F%2Fd1e00ek4ebabms.cloudfront.net%2Fproduction%2Fde966763-6e23-493e-a03f-724dadf66e80.jpg?source=next-article&fit=scale-down&quality=highest&width=700&dpr=1	2024-11-15 22:40:03	Financial Times
gb	https://www.ft.com/content/401e8947-bd02-4ac8-9fb2-eab01977eb4c	Vaccine stocks hit by Robert Kennedy Jr nomination - Financial Times	GSK, Sanofi and Moderna shares all sink after Donald Trump chooses vaccine sceptic as top US health official	https://www.ft.com/__origami/service/image/v2/images/raw/https%3A%2F%2Fd1e00ek4ebabms.cloudfront.net%2Fproduction%2Ffce86c56-9f37-40dd-836a-feccd0cd8ff7.jpg?source=next-article&fit=scale-down&quality=highest&width=700&dpr=1	2024-11-15 15:09:00	Financial Times
gb	https://www.bbc.co.uk/news/articles/c75lxypz7wqo	North Korean troops in Ukraine ‘grave escalation’, Scholz tells Putin - BBC	The German chancellor spoke to Russia's leader for the first time in nearly two years.	https://ichef.bbci.co.uk/news/1024/branded_news/396b/live/db4746b0-a374-11ef-a842-f9c49a4df51e.jpg	2024-11-15 18:37:02	BBC
gb	https://www.bbc.co.uk/news/articles/cy0l52rl863o	Police told not to stop car of Skye shooting suspect - BBC	An officer told a High Court trial in Edinburgh he was instructed to follow a shooting suspect's car as it left Skye.	https://ichef.bbci.co.uk/news/1024/branded_news/922a/live/db1665f0-a364-11ef-9167-89bb8c6cc34a.png	2024-11-15 15:45:02	BBC
gb	https://www.bbc.com/news/articles/c14lv7e61d3o	University cash crisis will get worse despite tuition fee rise, BBC told - BBC.com	More than three quarters of universities are expected to face financial problems next year.	https://ichef.bbci.co.uk/news/1024/branded_news/c006/live/66b8a290-a27e-11ef-9881-317cd05de9c4.jpg	2024-11-15 00:43:43	BBC.com
gb	https://news.sky.com/story/pictures-show-moment-israeli-bomb-exploded-at-beirut-apartment-block-13254979	Pictures show moment Israeli bomb exploded at Beirut apartment block - Sky News	The strike comes after days of intense Israeli bombardment of Lebanon's capital - coinciding with signs of movement in US-led diplomacy towards a ceasefire.	https://e3.365dm.com/24/11/1600x900/skynews-israel-lebanon-strikes_6749457.jpg?20241115230340	2024-11-15 23:39:09	Sky News
gb	https://www.belfastlive.co.uk/news/belfast-news/queens-hillary-clinton-protest-sees-30379970	Queen's Hillary Clinton protest sees three men charged with resisting police - Belfast Live	None	None	2024-11-15 13:04:00	Belfast Live
gb	https://www.theguardian.com/politics/2024/nov/15/tory-pair-backed-rushed-misjudged-asylum-site-purchase-watchdog-northeye	Tory pair backed ‘rushed and misjudged’ asylum site purchase, watchdog says - The Guardian	Robert Jenrick and Oliver Dowden were on committee that supported paying £15m for asbestos-ridden former prison	https://i.guim.co.uk/img/media/1ede75e3d39ddded7294b2d6c1abc9b8a6b71255/0_266_7932_4760/master/7932.jpg?width=1200&height=630&quality=85&auto=format&fit=crop&overlay-align=bottom%2Cleft&overlay-width=100p&overlay-base64=L2ltZy9zdGF0aWMvb3ZlcmxheXMvdGctZGVmYXVsdC5wbmc&enable=upscale&s=b4cb878c8a1a669867ff870561af84b9	2024-11-15 15:42:00	The Guardian
gb	https://schoolsweek.co.uk/ofsted-proposes-giving-schools-one-of-five-ratings-across-10-areas/	Ofsted plans five point grading system across 10 areas - Schools Week	Watchdog proposes grades from 'exemplary' to 'causing concern' against 10 areas including teaching	https://schoolsweek.co.uk/wp-content/uploads/2024/03/Ofsted-maginify-feat.jpg	2024-11-15 13:55:00	Schools Week
gb	https://www.rugbypass.com/news/joseph-suaalii-dropped-as-wallabies-change-6-for-wales/	Joseph Suaalii dropped as Wallabies change 6 for Wales - RugbyPass	Australia centre Joseph Suaalii has been dropped to the bench for the Wallabies' meeting with Wales on Sunday...	https://eu-cdn.rugbypass.com/wp/wp-content/uploads/2024/11/GettyImages-2183475888-1200x630.jpg	2024-11-15 14:43:23	RugbyPass
gb	https://www.theguardian.com/politics/2024/nov/15/uk-unhealthy-food-costs-268bn-a-year-report-food-farming-countryside-nhs	UK’s unhealthy food habits cost £268bn a year, report finds - The Guardian	Exclusive: Food, Farming and Countryside Commission added up cost to NHS and economy of diet-linked disease	https://i.guim.co.uk/img/media/36900ebc3b338e2c2cb1f5d6550496800b4d30c4/253_139_2995_1797/master/2995.jpg?width=1200&height=630&quality=85&auto=format&fit=crop&overlay-align=bottom%2Cleft&overlay-width=100p&overlay-base64=L2ltZy9zdGF0aWMvb3ZlcmxheXMvdGctZGVmYXVsdC5wbmc&enable=upscale&s=8a2e8dc062b5c152ae280bd041ef2510	2024-11-15 21:19:00	The Guardian
gb	https://www.goal.com/en-gb/lists/ruud-van-nistelrooy-man-utd-legend-applies-for-head-coach-role-english-club-old-trafford-exit/blt45f3595e0587a5c4	A new job for Ruud van Nistelrooy? Man Utd legend in battle with Frank Lampard after applying for head coach role with English club days after Old Trafford exit - Goal.com	Ruud van Nistelrooy intends to extend his stay on English shores as he has reportedly applied to a Championship club after leaving Manchester United.	https://assets.goal.com/images/v3/getty-2183008053/crop/MM5DIMZWGQ5DENBVGU5G433XMU5DAORZGM======/GettyImages-2183008053.jpg	2024-11-15 18:21:34	Goal.com
gb	https://www.bbc.com/news/articles/cev9nxnygzpo	Heaven nightclub shut after bouncer charged with raping drunk woman who had been turned away - Evening Standard	The Daily Telegraph columnist said she was left “dumbstruck and upset” by a police visit to her home.	https://ichef.bbci.co.uk/news/1024/branded_news/f41f/live/9f6e0140-a2bd-11ef-bdf5-b7cb2fa86e10.jpg	2024-11-15 21:30:59	Evening Standard
gb	https://www.bbc.com/news/articles/cx2nldyg3y6o	RAF Lossiemouth fighter jets track Russian bomber over North Sea - BBC.com	Two Typhon jets from RAF Lossiemouth were scrambled after the Russian aircraft were detected over the North Sea.	https://ichef.bbci.co.uk/news/1024/branded_news/161d/live/6ed51790-a343-11ef-8b2c-7bfe2eb25766.png	2024-11-15 12:16:13	BBC.com
gb	https://news.sky.com/story/three-police-officers-guilty-of-gross-misconduct-over-access-to-sarah-everard-murder-files-with-one-sacked-13254543	Three police officers guilty of gross misconduct over access to Sarah Everard murder files - with one sacked - Sky News	The murder of Sarah Everard, 33, at the hands of Wayne Couzens, a serving Metropolitan Police officer, shocked and outraged the nation, triggering protests calling for an end to violence against women.	https://e3.365dm.com/23/03/1600x900/skynews-sarah-everard-met-police_6096154.jpg?20230321153027	2024-11-15 15:17:25	Sky News
gb	https://www.manchestereveningnews.co.uk/news/greater-manchester-news/snow-greater-manchester-met-office-30382383	Will it snow in Greater Manchester? Met Office verdict as UK cold snap nears - Manchester Evening News	None	None	2024-11-15 16:25:00	Manchester Evening News
gb	https://news.sky.com/story/five-people-guilty-in-case-of-mistaken-identity-double-murder-of-teenage-boys-13253307	Five people guilty in case of mistaken-identity double murder of teenage boys in Bristol - Sky News	Mason Rist, 15, and Max Dixon, 16, were killed in a case of mistaken identity. Antony Snook, 45, Riley Tolliver, 18, and three boys aged 15, 16 and 17 have now been found guilty of their murders.	https://e3.365dm.com/24/11/1600x900/skynews-mason-rist-max-dixon_6749067.jpg?20241115150055	2024-11-15 16:54:03	Sky News
gb	https://www.theguardian.com/sport/2024/nov/15/watch-jake-paul-v-mike-tyson-netflix	What time is the Jake Paul v Mike Tyson fight and more pre-fight questions, answered - The Guardian	What time does it start? Why Netflix? And what about that 31-year age difference? We (mostly) have the answers	https://i.guim.co.uk/img/media/6f03667fed4dec718e4e8e1c2926885330ed806a/0_107_3550_2130/master/3550.jpg?width=1200&height=630&quality=85&auto=format&fit=crop&overlay-align=bottom%2Cleft&overlay-width=100p&overlay-base64=L2ltZy9zdGF0aWMvb3ZlcmxheXMvdGctZGVmYXVsdC5wbmc&enable=upscale&s=f7fc1561cfca69fea25c44eb2318377b	2024-11-16 02:16:00	The Guardian
gb	https://www.bbc.com/news/articles/cr4lkk1vy9vo	No 10 apologises after meat and alcohol served at Diwali event - BBC.com	A Tory MP accused No 10 of a "disappointing lack of knowledge" about the traditions of Hinduism. 	https://ichef.bbci.co.uk/news/1024/branded_news/ce00/live/7df3b5e0-a336-11ef-880a-b3f80b3eb14e.jpg	2024-11-15 11:10:14	BBC.com
gb	https://ukdefencejournal.org.uk/russian-spy-ship-currently-operating-near-british-coast/	Russian spy ship currently operating near British coast - UK Defence Journal	A Russian intelligence vessel, Yantar, has been spotted operating near critical underwater infrastructure in the Irish Sea and is currently being monitored by the British military.	https://ukdj.imgix.net/2024/11/Yantar_research_vessel_04.jpg?auto=compress%2Cformat&ixlib=php-3.3.1&s=e218c9d4afd5e7004705f4c08b34b9dd	2024-11-15 08:30:42	UK Defence Journal
gb	https://www.theguardian.com/uk-news/2024/nov/15/derbyshire-teenager-murder-baby-jailed-for-life	Derbyshire teenager who shook girlfriend’s baby to death jailed for life - The Guardian	Carl Alesbrook, now 19, unanimously convicted of murder over death of four-month-old Elijah Shemwell	https://i.guim.co.uk/img/media/e9b306656805fe33ce57339f27c322389855969a/0_31_1795_1077/master/1795.jpg?width=1200&height=630&quality=85&auto=format&fit=crop&overlay-align=bottom%2Cleft&overlay-width=100p&overlay-base64=L2ltZy9zdGF0aWMvb3ZlcmxheXMvdGctZGVmYXVsdC5wbmc&enable=upscale&s=14ed0e06d3795299d43101d59d17dbd7	2024-11-15 19:45:00	The Guardian
gb	https://news.google.com/rss/articles/CBMijgFBVV95cUxQb0lWNGxwdkdMOWFwN1VJRGJJWGRDZXo2NzB1Zk5DcTJ6VUpjaEl5SzRUaUU4eUVUM2VxNk52N1lZSGhHVGVweGdqSlEtV0g4d2E4aUtuVW05UGxrU1RWMl9Vb0NyYXY3enJaMGhMUl9lQXNRVER1N0RXamlQN3FLb2hmWFZaVXFfSTA4YmNn?oc=5	Dutch coalition survives (for now) after chaos fueled by fuming Geert Wilders - POLITICO Europe	None	None	2024-11-15 21:44:00	POLITICO Europe
gb	https://news.google.com/rss/articles/CBMieEFVX3lxTE4zRVlBRndiOXFIekFLaG44NW1UM0ZUTG5mNVp3czRTd2s2ZHhpb245ekVIN01XOVIxdGxxcGNDamVTMkVMSjlFSnhxaThDd3NzRnMtUXltV1FYS2wwT2lULWJHZnUzZ3I0N0RBZEFtcjJOaERES2lDMtIBeEFVX3lxTE1hUDNkMnQtOXoxaHgzUW1yc2twdHRUX1FQOE94TXpLbWg2ano2ZTM0QmdZOG5GcUhmMF9ndUdQLVJhQlFabjZfUWdDaHVzLTZZU2g0RVlFZC1VX0ZKTHBnOUJGbkFRclFPc2JHb3gzYVIyNTItRkJSTg?oc=5	Latest Pentagon report reveals hundreds of new UFO sightings - The Guardian	There are no suggestions of extraterrestrial origin, but that won’t settle any debates over the existence of alien life	https://i.guim.co.uk/img/media/50d4cbc76f8e800852315ab1205576967c362a96/0_541_5516_3309/master/5516.jpg?width=1200&height=630&quality=85&auto=format&fit=crop&overlay-align=bottom%2Cleft&overlay-width=100p&overlay-base64=L2ltZy9zdGF0aWMvb3ZlcmxheXMvdGctZGVmYXVsdC5wbmc&enable=upscale&s=7d68b20ceee932e6d7ecf53a356177ca	2024-11-15 18:45:00	The Guardian
gb	https://www.bbc.co.uk/news/articles/crr9n2w0lyzo	Sri Lanka: Left-leaning leader's coalition secures landslide victory - BBC	The parliamentary majority will allow Anura Kumara Dissanayake to consolidate power and advance reforms.	https://ichef.bbci.co.uk/news/1024/branded_news/fb98/live/f6461600-a3ae-11ef-bdf5-b7cb2fa86e10.jpg	2024-11-15 03:51:59	BBC
gb	https://www.goal.com/en-gb/lists/ruben-amorim-man-utd-kobbie-mainoo-amad-diallo-alejandro-garnacho/blt8724fb698b8a735e	Ruben Amorim demands Man Utd 'play without fear' as new coach insists youth is no excuse for Kobbie Mainoo, Amad Diallo and Alejandro Garnacho - Goal.com	Ruben Amorim wants his Manchester United team to "play without fear" as he insists Kobbie Mainoo & Co are "prepared" to cope with the pressure.	https://assets.goal.com/images/v3/getty-2182884040/crop/MM5DEMRQHE5DCMRUGM5G433XMU5DSNJRHIYA====/GettyImages-2182884040.jpg	2024-11-15 20:37:01	Goal.com
gb	https://www.bbc.com/news/articles/cvglrv7q945o	Prince Harry 'one of two claimants' still suing Sun publisher - BBC.com	Prince Harry and former Labour deputy leader Tom Watson are the two remaining claimants suing News Group Newspapers.	https://ichef.bbci.co.uk/news/1024/branded_news/971d/live/f89a8890-a346-11ef-b0f5-15ab15c44ed7.jpg	2024-11-15 16:35:55	BBC.com
gb	https://news.sky.com/story/davina-mccall-diagnosed-with-rare-brain-tumour-13254542	Davina McCall out of surgery after operation to remove brain tumour - Sky News	Urging her fans not to worry too much, the presenter said earlier today: "I am in a good space, and I have all the faith in the world in my surgeon and his team... He knows what he's doing, and I'm going to do the getting better bit after."	https://e3.365dm.com/24/11/1600x900/skynews-davina-mccall-nta_6748824.jpg?20241115094141	2024-11-15 19:07:30	Sky News
gb	https://edition.cnn.com/2024/11/15/world/video/new-zealand-parliament-haka-ldn-digvid	Video: New Zealand MPs disrupt parliament with haka - CNN	None	https://media.cnn.com/api/v1/images/stellar/prod/still-21127498-17720-936999999998-still-20241115084605588.jpg?c=16x9&q=w_800,c_fill	2024-11-15 09:14:47	CNN
gb	https://www.theguardian.com/politics/live/2024/nov/15/gdp-rachel-reeves-growth-figures-uk-politics-live	Shadow chancellor warns Reeves over EU ties after Bank chief says Brexit harming economy – as it happened - The Guardian	Mel Stride said there must be no suggestion of the UK going back into the EU single market or customs union	https://i.guim.co.uk/img/media/490a27d9e2f8b3999cae7a8685bf26ebedd8a167/789_470_4750_2850/master/4750.jpg?width=1200&height=630&quality=85&auto=format&fit=crop&overlay-align=bottom%2Cleft&overlay-width=100p&overlay-base64=L2ltZy9zdGF0aWMvb3ZlcmxheXMvdGctbGl2ZS5wbmc&enable=upscale&s=50b1eccc72776918455044ffd19de8d8	2024-11-15 09:13:00	The Guardian
gb	https://www.scotsman.com/sport/football/scotland-player-ratings-in-win-over-croatia-two-910s-wonderkid-tortures-ps78m-man-and-the-modric-megger-4869657	Scotland player ratings in win over Croatia: Two 9s, wonderkid tortures £78m man and Modric megger - The Scotsman	Marks out of ten for the Scotland players involved against Croatia at Hampden	https://www.scotsman.com/jpim-static/image/2024/11/15/20/37/21221195.jpeg?width=1200&auto=webp&quality=75&crop=3:2,smart&trim=	2024-11-15 21:43:00	The Scotsman
gb	https://www.ft.com/content/342e304b-4c09-4951-8bba-bc9a27ddb726	Valuations at Elon Musk’s SpaceX and xAI set to soar in new deals - Financial Times	Billionaire’s rocket builder plots huge share sale while AI start-up closes in on $5bn funding round	https://www.ft.com/__origami/service/image/v2/images/raw/https%3A%2F%2Fd1e00ek4ebabms.cloudfront.net%2Fproduction%2F391f3ee0-4f7c-47c9-9c71-7476e36ca4a8.jpg?source=next-article&fit=scale-down&quality=highest&width=700&dpr=1	2024-11-15 14:20:44	Financial Times
gb	https://www.thesun.co.uk/sport/31751004/paul-pogba-juventus-man-utd-arsenal-transfer-news/	Paul Pogba finally free to make Prem return as Juventus rip up ex-Man Utd star’s contract with blunt 3... - The Sun	JUVENTUS have ripped up Paul Pogba’s contract after his recent doping ban. Pogba, 31, was initially handed a four-year ban from football for a doping offence, before the suspension was&n…	https://www.thesun.co.uk/wp-content/uploads/2024/11/OFF-PLATFORM-pogba.jpg?strip=all&quality=100&w=1920&h=1080&crop=1	2024-11-15 20:24:55	The Sun
gb	https://news.google.com/rss/articles/CBMimgFBVV95cUxNeEJZelcxQkx6T2hJSGFlWTFKbHBOVGxrNkEtOEFxdmNIVmlYOTRlcjM3OW01ZGN0VWZuWkJ1eWlVR3VkNmRrNkhTbWZnRlA3MTEtNFpyalQ1MTZLVEFIMUlxdGRmVDhCQVZtLU5jY3JycDRXUDI3cnBaZVVfRllqR2ZpUDZlY0RXakFnZzZoZWVLWncxVE1qVl930gGiAUFVX3lxTE5yZDU2UXNOd01oR0l3RFFGenJaMzV2NVlTdGtOdGIxZ29pZTV1bk9uT1FPUzFJbGszY2lYUThSeVZTQzZ2eHR0MWRkbWNRcjlacTBhZmNkc0dnd3NlaG55bE54bDlzY2QtaFNvNkEtUlRfcGV0REFkclQ4cU1HaWdTM2pLd0Zsd3lpazR3Y3hPdGYyS000cld0VXhPOVp2OTNldw?oc=5	A goal and Player of the Match: Curtis Jones reacts to 'dream debut' for England - Liverpool FC	None	None	2024-11-15 09:55:33	Liverpool FC
gb	https://www.arsenal.com/news/every-word-renees-pre-spurs-presser	Every word of Renee’s pre-Spurs presser | Press conference | News - Arsenal.com	See what Renee Slegers had to say in her pre-Tottenham Hotspur press conference at Sobha Realty Training Centre on Friday	https://www.arsenal.com/sites/default/files/styles/desktop_16x9/public/images/Renee-press_hlpgfxcw.png?h=f246f76c&auto=webp&itok=AMb4QT4D	2024-11-15 15:38:56	Arsenal.com