country_code	url	title	description	image_url	publish_date	source
gb	https://www.ft.com/content/3c98661c-8b8b-4c84-b32a-611c1c59dd1b	Trump seeks pledge that his Treasury secretary will enact tough tariffs - Financial Times	President-elect’s key economic appointment has kicked off a fierce lobbying effort among his loyalists	https://www.ft.com/__origami/service/image/v2/images/raw/https%3A%2F%2Fd1e00ek4ebabms.cloudfront.net%2Fproduction%2F64e80228-80e4-4270-8cef-83d53024e68f.jpg?source=next-article&fit=scale-down&quality=highest&width=700&dpr=1	2024-11-17 17:40:19	Financial Times
gb	https://www.theguardian.com/sport/live/2024/nov/17/west-indies-v-england-fifth-mens-t20-cricket-international-live	West Indies v England: fifth men’s T20 cricket international – match abandoned - The Guardian	England’s final match of their West Indies tour was abandoned after heavy rain meaning Jos Buttler’s side won the five-game series 3-1	https://i.guim.co.uk/img/media/32f4b8f344e66167011bd4d6b2f662110fa3e38e/0_174_5224_3134/master/5224.jpg?width=1200&height=630&quality=85&auto=format&fit=crop&overlay-align=bottom%2Cleft&overlay-width=100p&overlay-base64=L2ltZy9zdGF0aWMvb3ZlcmxheXMvdGctbGl2ZS5wbmc&enable=upscale&s=03c32e69d83917235feb3e8cefab390b	2024-11-17 19:00:00	The Guardian
gb	https://www.bbc.co.uk/news/articles/ce9g4ln2d8eo	Keep protesting, says Navalny's widow at Berlin march - BBC	The march was led by Yulia Navalnaya, widow of Russian opposition leader Alexei Navalny, who died in February.	https://ichef.bbci.co.uk/news/1024/branded_news/4436/live/69005dc0-a4f1-11ef-9886-f1f9e5342481.jpg	2024-11-17 16:06:35	BBC
gb	https://www.ft.com/content/b92011cf-5c81-494a-a999-baba0a5a5fb7	Government could force pension funds to invest more in UK assets - Financial Times	Further measures may be taken if ‘megafund’ reforms fail to boost domestic investment, says pensions minister 	https://www.ft.com/__origami/service/image/v2/images/raw/https%3A%2F%2Fd1e00ek4ebabms.cloudfront.net%2Fproduction%2Ffaed8735-04fa-4710-b020-8f2fb204a90d.jpg?source=next-article&fit=scale-down&quality=highest&width=700&dpr=1	2024-11-18 05:00:50	Financial Times
gb	https://www.bbc.com/news/articles/cwy582kl2n4o	Archbishop candidates need 'heads reading' - Bishop of Gloucester - BBC.com	The Bishop of Gloucester does not want the "very, very difficult" Archbishop of Canterbury job.	https://ichef.bbci.co.uk/news/1024/branded_news/8592/live/9f376a10-a4f0-11ef-9886-f1f9e5342481.jpg	2024-11-17 13:19:27	BBC.com
gb	https://www.goal.com/en-gb/lists/lucas-digne-france-unlikely-hero-steps-up-inspire-les-bleus-italy-kylian-mbappe-absence/blta5b1ecd69c277359	Lucas Digne is France's unlikely hero! Aston Villa star steps up to inspire Les Bleus to victory against Italy in Kylian Mbappe's absence - Goal.com	It was the Lucas Digne and Adrien Rabiot show at San Siro on Sunday as France downed Italy 3-1 to top their Nations League group.	https://assets.goal.com/images/v3/bltdca1fb4d468228d8/crop/MM5DCNJXGA5DQOBTHJXG653FHIYDUMA=/unnamed.png	2024-11-17 22:07:43	Goal.com
gb	https://www.bbc.com/news/articles/cz6jywx37dlo	Stop Sextortion - bereaved parents' appeal to Nigerian criminals - BBC.com	Murray Dowey, from Dunblane, was only 16 when he ended his life last year.	https://ichef.bbci.co.uk/news/1024/branded_news/0a24/live/808dc4f0-a276-11ef-8ab9-9192db313061.jpg	2024-11-18 06:32:31	BBC.com
gb	https://www.ft.com/content/b7c1e6a9-6d0b-40c8-a463-92664ae84520	Donald Trump victory threatens to throw G20 initiatives into disarray - Financial Times	Argentina veto warning sparks fears conservatives will be emboldened to ditch global deals on climate and tax	https://www.ft.com/__origami/service/image/v2/images/raw/https%3A%2F%2Fd1e00ek4ebabms.cloudfront.net%2Fproduction%2F5cd1084d-dcf4-42b7-8084-a249555f9f46.jpg?source=next-article&fit=scale-down&quality=highest&width=700&dpr=1	2024-11-17 22:27:45	Financial Times
gb	https://www.theguardian.com/money/2024/nov/18/energy-bills-rise-in-january-price-cap-great-britain-dual-fuel-bill	Britons warned to expect ‘disappointing’ rise in energy bills in January - The Guardian	Price cap for Great Britain forecast to rise to £1,736 a year for average dual-fuel bill, according to Cornwall Insights	https://i.guim.co.uk/img/media/b4ca738aa7cc2c902541c69efe73349ed755a94e/0_53_3000_1800/master/3000.jpg?width=1200&height=630&quality=85&auto=format&fit=crop&overlay-align=bottom%2Cleft&overlay-width=100p&overlay-base64=L2ltZy9zdGF0aWMvb3ZlcmxheXMvdGctZGVmYXVsdC5wbmc&enable=upscale&s=9fc3fc8ed59a18588331d4861a76f9f9	2024-11-18 08:14:00	The Guardian
gb	https://news.sky.com/story/two-police-officers-charged-with-sexual-assault-of-woman-in-central-london-13256105	Two police officers charged with sexual assault of woman in central London - Sky News	The charges relate to an alleged incident at a venue in the capital in April while the officers were off-duty.	https://e3.365dm.com/24/11/1600x900/skynews-metropolitan-police_6750963.jpg?20241118102419	2024-11-18 10:30:00	Sky News
gb	https://www.bbc.com/news/articles/c1dp6wgk72ro	Keir Starmer to meet Chinese President Xi Jinping at G20 summit - BBC.com	The first in-person meeting since 2018 will come as the PM prioritises shoring up support for Ukraine.	https://ichef.bbci.co.uk/news/1024/branded_news/a8ae/live/31a3c6c0-a4fe-11ef-9886-f1f9e5342481.jpg	2024-11-18 08:43:37	BBC.com
gb	https://www.bbc.co.uk/news/articles/cq8v4p2dj01o	Ask for Angela: Staff had no clue, says pub worker - BBC	A pub worker warns failures in the Ask for Angela safety scheme could put vulnerable women at risk.	https://ichef.bbci.co.uk/news/1024/branded_news/1316/live/71b7a170-a36c-11ef-86fc-7b30264b589b.jpg	2024-11-18 01:14:46	BBC
gb	https://www.theguardian.com/society/2024/nov/18/bridget-phillipson-vote-against-assisted-dying-bill-wes-streeting	Bridget Phillipson says she is likely to vote against assisted dying bill - The Guardian	Education secretary urges ministers to keep discussion on policy behind the scenes after Wes Streeting voices opposition	https://i.guim.co.uk/img/media/83b1b9aae5051dc92582fd9c231480e0f984a33d/0_97_2920_1752/master/2920.jpg?width=1200&height=630&quality=85&auto=format&fit=crop&overlay-align=bottom%2Cleft&overlay-width=100p&overlay-base64=L2ltZy9zdGF0aWMvb3ZlcmxheXMvdGctZGVmYXVsdC5wbmc&enable=upscale&s=1e4bd4f359aef3c38be07187d206c1fd	2024-11-18 09:11:00	The Guardian
gb	https://www.ft.com/content/738314d3-621b-496b-8634-93560792de0d	Crackdown launched on child social care profiteering in England - Financial Times	Companies will be forced to disclose finances in bid to curb ‘excessive profits’ bankrupting councils 	https://www.ft.com/__origami/service/image/v2/images/raw/https%3A%2F%2Fd1e00ek4ebabms.cloudfront.net%2Fproduction%2F7b69a869-f993-4b02-a6e4-ba438eec8889.jpg?source=next-article&fit=scale-down&quality=highest&width=700&dpr=1	2024-11-18 00:01:34	Financial Times
gb	https://www.bbc.co.uk/news/articles/cz0memjm3jro	Lidia Thorpe: Australia senator censured for 'not my King' heckle - BBC	Lidia Thorpe has been rebuked by the Senate for yelling "not my King" during a protest last month.	https://ichef.bbci.co.uk/news/1024/branded_news/fe92/live/f71b2b70-a57e-11ef-a4fe-a3e9a6c5d640.jpg	2024-11-18 02:40:16	BBC
gb	https://news.sky.com/story/masked-burglars-raid-windsor-castle-grounds-while-william-kate-and-children-slept-at-home-on-estate-13256017	Masked burglars 'raid' Windsor Castle grounds 'while William, Kate and children slept at home on estate' - Sky News	Two men used a stolen truck to break through a security gate at the royal estate and reportedly fled with a pick-up truck and quad bike.	https://e3.365dm.com/24/11/1600x900/skynews-windsor-castle-royal-family_6750819.jpg?20241118064418	2024-11-18 09:33:45	Sky News
gb	https://www.bbc.co.uk/news/articles/cy4ng2873jro	'Starmer, meet us before it's too late' say nuclear test veterans - BBC	The last of 22,000 personnel who witnessed the UK’s nuclear bomb tests want answers from the PM. 	https://ichef.bbci.co.uk/news/1024/branded_news/c32c/live/b65c0600-a375-11ef-a4fe-a3e9a6c5d640.jpg	2024-11-18 01:04:02	BBC
gb	https://www.bbc.com/news/articles/cwy4xv5dy5yo	Farmers' protest heads to Westminster as inheritance tax anger grows - BBC.com	Starmer's farmer-alarmer in the Budget could crystalise anger over ministers’ perceived ignorance about agricultural life.	https://ichef.bbci.co.uk/news/1024/branded_news/0324/live/ee65cb60-a575-11ef-8ff0-1116633832ef.jpg	2024-11-17 23:48:51	BBC.com
gb	https://www.bbc.com/news/live/cx2ypggglglt	Sunday with Laura Kuenssberg: Transport Secretary Louise Haigh quizzed on bus fare cap hike - BBC.com	The Transport Secretary says the extra funding will help improve services across rural areas.	https://static.files.bbci.co.uk/ws/simorgh-assets/public/news/images/metadata/poster-1024x576.png	2024-11-17 10:07:30	BBC.com
gb	https://www.telegraph.co.uk/news/2024/11/17/police-focus-violent-crime-not-social-media-hate-speech/	Tackle violent crime instead of tweets, Starmer urges police after Allison Pearson row - The Telegraph	PM urges forces to ‘concentrate on what matters most to their communities’	None	2024-11-17 22:00:00	The Telegraph
gb	https://www.thefa.com/news/2024/nov/18/rodrigo-bentancur-sanctioned-181124	Rodrigo Bentancur sanctioned - The FA	None	None	2024-11-18 10:29:25	The FA
gb	https://www.theguardian.com/politics/2024/nov/17/keir-starmer-ukraine-top-of-the-agenda-g20	Keir Starmer promises Ukraine will be ‘top of the agenda’ at G20 - The Guardian	UK prime minister to meet world leaders at summit in Brazil that Vladimir Putin has declined to attend	https://i.guim.co.uk/img/media/d783948d4f9dbf9ce20f2d97a0e12003db26c978/0_1_4360_2616/master/4360.jpg?width=1200&height=630&quality=85&auto=format&fit=crop&overlay-align=bottom%2Cleft&overlay-width=100p&overlay-base64=L2ltZy9zdGF0aWMvb3ZlcmxheXMvdGctZGVmYXVsdC5wbmc&enable=upscale&s=658f7331b0e384c34dab1f2b867f821c	2024-11-17 17:37:00	The Guardian
gb	https://news.sky.com/story/trump-is-unlikely-to-take-bidens-advice-on-china-and-it-could-change-the-world-13255556	Trump is unlikely to take Biden's advice on China - and it could change the world - Sky News	"Be competition, not conflict," the outgoing US president said in his last meeting with Xi Jinping, in an apparent nod to Donald Trump. But the president-elect may have other ideas.	https://e3.365dm.com/24/11/1600x900/skynews-donald-trump-xi-jinping_6750240.jpg?20241117085654	2024-11-17 09:36:53	Sky News
gb	https://www.theguardian.com/uk-news/2024/nov/17/police-make-arrest-after-two-men-fatally-stabbed-in-manchester	Man detained under Mental Health Act after two fatal stabbings in Manchester - The Guardian	Man, 23, was arrested on suspicion of double murder in Moss Side that detectives regard as an isolated incident	https://i.guim.co.uk/img/media/a5f2c83317db6826da3dbd5cd0b3e2e7c62e6c55/0_342_3992_2396/master/3992.jpg?width=1200&height=630&quality=85&auto=format&fit=crop&overlay-align=bottom%2Cleft&overlay-width=100p&overlay-base64=L2ltZy9zdGF0aWMvb3ZlcmxheXMvdGctZGVmYXVsdC5wbmc&enable=upscale&s=521107ca114e38434b5a3ca95ae243c8	2024-11-17 19:57:00	The Guardian
gb	https://www.walesonline.co.uk/sport/rugby/rugby-news/todays-rugby-news-warren-gatland-30391644	Today's rugby news as Warren Gatland interview 'a tough watch' and former players stunned - Wales Online	None	None	2024-11-18 07:28:00	Wales Online
gb	https://ukdefencejournal.org.uk/britain-test-fires-new-cruise-missile/	Britain test fires new cruise missile - UK Defence Journal	Each F-35 jet can carry up to eight SPEAR-3 missiles, providing a long-range, stand-off capability for the Queen Elizabeth class aircraft carriers.	https://ukdj.imgix.net/2023/09/spear_ew_cloud_latest_production_v1.jpg?auto=compress%2Cformat&ixlib=php-3.3.1&s=b1a764792cb4be22363cef02bc71105d	2024-11-17 09:17:52	UK Defence Journal
gb	https://news.google.com/rss/articles/CBMiswFBVV95cUxQNUlVeFBwVHZhZlR4YlZPNVE3ODBVZXpPTmVXdjltSFhWSVpCeVpoLU11YmlPWFFiMjR2OWpyOG1HRnM1OXhYbHEydndXSERxeUJIWkozOHJQcVNMbS1fTkJwMmFXLVJFRGtmODVrcWxoZmxvT1dkZXFYclFwYTdGYTc1RTUtVnY5U19OLTNZSV9zOWhMYVV4VzZTWDlneTBjNTl6UnJmM19GRmxIcFAwbWFpMA?oc=5	Serious collision closes A5 road at busy Oswestry roundabout - Border Counties Advertizer	None	None	2024-11-17 18:08:46	Border Counties Advertizer
gb	https://news.stv.tv/entertainment/daughter-of-late-comic-janey-godley-wins-two-bafta-scotland-awards	Daughter of late comic Janey Godley wins two Bafta Scotland awards - STV News	Ashley Storrie joked that if her mother had been at the ceremony, she would have been ‘making it all about her’.	https://news.stv.tv/wp-content/uploads/2024/11/0e7ad22c0d0184fd8cbf6f2b866ff504-1731914294-social-default.jpg	2024-11-18 07:23:12	STV News
gb	https://www.politico.eu/article/hungary-united-states-approve-ukraine-strikes-russia/	Hungary slams Joe Biden’s approval for Ukraine to hit Russia with American weapons - POLITICO Europe	None	None	2024-11-18 09:13:00	POLITICO Europe
gb	https://news.google.com/rss/articles/CBMilAFBVV95cUxQdFVIX0E0TnRCSWcwbDdDamRoN2llODRkV0JOZUVKQ3AtbEtHNzM1MjNYUnR4SUJBNVJYaUNoV3pjYURueHc1RFBYT0oyWC1QaTA4dHZNdmNFTE1fQ1FsVWN6V0hEbm42cXZlV0xQRERfaEEwdnFBNXNPUlZvdFRGN3FrWThJMFRPNDRnUmJyaDVJWWVX?oc=5	UK braces for ‘disruptive snow’ as weather warnings cover swaths of country - The Guardian	Up to 20cm could hit worst-affected areas this week in Britain’s ‘first taste of winter’ this season	None	2024-11-18 11:17:06	The Guardian
gb	https://news.sky.com/story/ukraine-war-latest-putin-trump-zelenskyy-live-sky-news-12541713	Ukraine war latest: Kremlin offers first response after Biden allows Ukraine to use US missiles inside Russia - Sky News	Joe Biden has allowed Ukraine to strike inside Russia with long-range US missiles, prompting dire warnings from Moscow. Meanwhile, 11 people have been killed after major attacks in the Ukrainian city of Sumy.	https://e3.365dm.com/24/11/1600x900/skynews-actms-us_6750855.jpg?20241118080227	2024-11-18 12:51:29	Sky News
gb	https://news.sky.com/story/man-pleads-guilty-to-being-owner-of-dangerously-out-of-control-xl-bully-which-killed-his-neighbour-near-sunderland-13256132	Man pleads guilty to being owner of dangerously out-of-control XL bully which killed his neighbour near Sunderland - Sky News	The 54-year-old victim of the dog attack sustained fatal neck injuries in October 2023.	https://e3.365dm.com/24/11/1600x900/skynews-christopher-bell-newcastle-crown-court_6751010.jpg?20241118111118	2024-11-18 11:26:15	Sky News
gb	https://consent.yahoo.com/v2/collectConsent?sessionId=4_cc-session_70fbf7b2-69f1-427d-beeb-5b3d538a38ff	International manhunt launched for husband of Harshita Brella after body found in boot of car - Yahoo News UK	None	None	2024-11-17 17:13:21	Yahoo News UK
gb	https://www.manchestereveningnews.co.uk/news/uk-news/cold-blooded-murderers-three-words-30392336	'Cold-blooded' murderer's three words to police after prison escape sparked international hunt - Manchester Evening News	None	None	2024-11-18 07:46:00	Manchester Evening News
gb	https://news.sky.com/story/davina-mccall-makes-enormous-leap-forward-and-out-of-icu-after-surgery-to-remove-brain-tumour-13256188	Davina McCall makes 'enormous leap forward' and is out of ICU after surgery to remove brain tumour - Sky News	Presenter Davina McCall underwent surgery last week to remove a rare brain tumour called a colloid cyst.	https://e3.365dm.com/24/11/1600x900/skynews-davina-mccall-tv-presenter_6748945.jpg?20241115122308	2024-11-18 12:21:19	Sky News
gb	https://news.google.com/rss/articles/CBMiWkFVX3lxTE5DMXE1cHhHQ29scXBtLTFfYUJkeHhRX09nZUt0eVM4RnJPRjdEUmpDU213dUJHSnltZWpQOVUwWVNSSy1Qbnl6QndiWWpSSU5Ba2FSMTVRaFJFUdIBX0FVX3lxTE1Jd1Q5NjJBbDNIa1FXQnRZTmlRQkpkZEV2X0NXUjl3RTZ3c3k4U0VxSFpMaURFT2pvLWIyMXpsS0NRbU5Na2JWbTZRVE1ub3JSeWRxUlNyM3VYQ1ZaOTJV?oc=5	Gynaecology waiting lists in UK double, leaving women in pain - BBC.com	Around 630,000 women are waiting for gynaecology appointments as waiting lists double in four years.	https://ichef.bbci.co.uk/news/1024/branded_news/2a62/live/20d145a0-a294-11ef-b8c0-b996e628df5a.jpg	2024-11-18 01:42:19	BBC.com
gb	https://www.independent.co.uk/news/uk/politics/bus-services-funding-budget-louise-haigh-ps3-cap-b2648525.html	Revealed: These areas are set to get new funding to boost bus services – as £3 fare cap could be scrapped - The Independent	Transport secretary says investment would end ‘complicated and inconsistent’ funding models  	https://static.independent.co.uk/2024/09/09/19/33a26e179143b0d04457a18181294a03Y29udGVudHNlYXJjaGFwaSwxNzI1OTkwNTM0-2.33129620.jpg?quality=75&width=1200&auto=webp	2024-11-17 11:55:00	The Independent
gb	https://www.standard.co.uk/news/politics/uk-illegal-migration-italy-meloni-starmer-turkey-vietnam-b1194477.html	UK 'planning Meloni-style deals' to pay other countries in bid to stop illegal migration - Evening Standard	Yvette Cooper tipped to sign off agreements with Turkey, Vietnam and the Kurdish region	https://static.standard.co.uk/2024/09/17/13/7b67680e56a118b4502ac2df1cc2d19bY29udGVudHNlYXJjaGFwaSwxNzI2NjYyODY0-2.77482469.jpg?width=1200&auto=webp&quality=75	2024-11-17 09:06:43	Evening Standard
gb	https://www.theguardian.com/media/2024/nov/18/alan-jones-arrested-alleged-indecent-assaults-ntwnfb	Alan Jones charged with 24 indecent assault and sexual touching offences against eight victims - The Guardian	Former Sydney radio host – who has previously denied all allegations against him – charged over incidents that allegedly occurred between 2001 and 2019	https://i.guim.co.uk/img/media/46b4e2ddf5d5299fe3c8b84b3a31511a44e5697f/0_0_5976_3586/master/5976.jpg?width=1200&height=630&quality=85&auto=format&fit=crop&overlay-align=bottom%2Cleft&overlay-width=100p&overlay-base64=L2ltZy9zdGF0aWMvb3ZlcmxheXMvdGctZGVmYXVsdC5wbmc&enable=upscale&s=260499f6c25354104cd7f62a2b9431ef	2024-11-17 21:46:00	The Guardian
gb	https://www.walesonline.co.uk/sport/rugby/rugby-news/day-welsh-rugby-collapsed-amid-30390949	The day Welsh rugby collapsed amid mass exodus and hopeless exasperation - Wales Online	None	None	2024-11-18 07:53:00	Wales Online
gb	https://www.bbc.co.uk/news/articles/cjr4zwj2lgdo	Sweden, Finland and Norway release new advice on surviving war - BBC	Sweden said the new advice follows a worsening security situation, by which it means the war in Ukraine.	https://ichef.bbci.co.uk/news/1024/branded_news/fc14/live/e47e56e0-a39e-11ef-9f79-d39ab3e0f5c9.jpg	2024-11-18 00:03:49	BBC
gb	https://www.bbc.com/news/articles/cjr4zwj2lgdo	Grand Slam of Darts results: Luke Littler thrashes Martin Lukeman to go fifth in Order of Merit - BBC.com	Sweden said the new advice follows a worsening security situation, by which it means the war in Ukraine.	https://ichef.bbci.co.uk/news/1024/branded_news/fc14/live/e47e56e0-a39e-11ef-9f79-d39ab3e0f5c9.jpg	2024-11-17 20:59:25	BBC.com
gb	https://www.liverpoolecho.co.uk/news/liverpool-news/demolished-city-centre-landmark-meant-30392035	Demolished city centre landmark was meant to change Liverpool's skyline - Liverpool Echo	The Churchill Way Flyovers and elevated pedestrian walkway were relics from a long forgotten 'masterplan' for city	https://i2-prod.liverpoolecho.co.uk/article30392103.ece/ALTERNATES/s1200/0_XMAS-SPECIAL-City-pathways-in-the-sky-Churchill-Way-flyovers.jpg	2024-11-18 07:00:00	Liverpool Echo
gb	https://www.theguardian.com/tv-and-radio/2024/nov/18/tv-tonight-emily-watson-dune-prophecy	TV tonight: Emily Watson stars in the blockbuster Dune prequel - The Guardian	Ten thousand years before Timothée Chalamet arrived, the action of Dune: Prophecy centres on a religious order. Plus: Panorama probes technology to stem climate breakdown	https://i.guim.co.uk/img/media/3f5baf8473a52a4ac21105307c11b820c97df2ff/632_96_4492_2695/master/4492.jpg?width=1200&height=630&quality=85&auto=format&fit=crop&overlay-align=bottom%2Cleft&overlay-width=100p&overlay-base64=L2ltZy9zdGF0aWMvb3ZlcmxheXMvdGctZGVmYXVsdC5wbmc&enable=upscale&s=c9842871c02517d98d74916feab3ee3c	2024-11-18 06:20:00	The Guardian
gb	https://www.bbc.com/news/articles/cy4ng2873jro	Strictly Come Dancing: Wynne Evans slams media "lies" after exit - BBC.com	The last of 22,000 personnel who witnessed the UK’s nuclear bomb tests want answers from the PM. 	https://ichef.bbci.co.uk/news/1024/branded_news/c32c/live/b65c0600-a375-11ef-a4fe-a3e9a6c5d640.jpg	2024-11-18 08:48:45	BBC.com
gb	https://www.lbc.co.uk/news/vladimir-shklyarov-death-st-petersburg-ballet-star-fall/	Ballet star Vladimir Shklyarov who criticised Putin’s Ukraine invasion dies in fall from building in St Petersburg - LBC	An acclaimed Russian ballet dancer has died in a fall from his residential block in St Petersburg.
	https://images.lbc.co.uk/images/688239?width=1200&crop=16_9&signature=UZfHD4wzSju1NlqktVPGzlsf-bo=	2024-11-18 10:37:00	LBC
gb	https://www.theguardian.com/tv-and-radio/2024/nov/18/wise-told-morecambe-he-wanted-to-split-up-comedy-act-in-1950-letter-reveals	Wise told Morecambe he wanted to split up comedy act in 1950, letter reveals - The Guardian	Items up for auction from Eric Morecambe’s family home show Ernie Wise had doubts about pair’s future	https://i.guim.co.uk/img/media/6ebee0114d67f9b787f16b2b690526539ec3d625/0_1012_4035_2421/master/4035.jpg?width=1200&height=630&quality=85&auto=format&fit=crop&overlay-align=bottom%2Cleft&overlay-width=100p&overlay-base64=L2ltZy9zdGF0aWMvb3ZlcmxheXMvdGctZGVmYXVsdC5wbmc&enable=upscale&s=500266279c5237df66f7a04426f7ff7f	2024-11-18 07:00:00	The Guardian
gb	https://www.standard.co.uk/sport/football/england-player-ratings-vs-ireland-gordon-gallagher-b1194516.html	England player ratings vs Ireland: Anthony Gordon and Conor Gallagher shine for five-star Three Lions - Evening Standard	Interim boss Lee Carsley oversees a thumping 5-0 win in his final game in charge	https://static.standard.co.uk/2024/11/17/18/36/SEI229947595.jpeg?width=1200&auto=webp&quality=75	2024-11-17 19:56:28	Evening Standard
gb	https://www.dailymail.co.uk/sport/football/article-14093397/Taylor-Harwood-Bellis-England-Ireland-Roy-Keane-Nations-League.html	Roy Keane jokes about his daughter Leah's impending wedding to Taylor Harwood-Bellis after seeing his future s - Daily Mail	The Southampton star, 22, is engaged to Keane's daughter Leah - but did not hold back in his jubilant celebrations as England ran riot in Lee Carsley's final game.	https://i.dailymail.co.uk/1s/2024/11/17/19/92168859-0-image-a-17_1731871052939.jpg	2024-11-17 18:48:07	Daily Mail
gb	https://www.bbc.com/sport/cricket/articles/cm27rzdnlppo	Brendon McCullum: Key issues for England white-ball coach to address - BBC.com	Brendon McCullum will take over the England white-ball teams in the new year but what are the key issues he faces in the job?	https://ichef.bbci.co.uk/news/1024/branded_sport/44f0/live/d1a8bd10-a445-11ef-b819-cf82b4288c1b.jpg	2024-11-18 00:38:36	BBC.com