country_code	url	title	description	image_url	publish_date	source
il	https://13tv.co.il/item/news/domestic/internal/ys4ny-904307573/	"מסית נגד הרמטכ"ל בזמן מלחמה": עשרות תלונות הוגשו נגד ערוץ 14 - ערוץ 13	לאחר שבתוכנית "הפטריוטים" הוצג סרטון המעוות את פניו של רא"ל הלוי כשהוא מביט לעבר פאץ' עם הכיתוב "משיח", ואחרי שדובר צה"ל שיגר מכתב חריף בנושא, עשרות תלונות הוגשו לרשות השנייה. "בזמן שחיילי צה"ל נלחמים, נפצעים ומתים, בוחר ערוץ 14 להשתלח ברמטכ"ל ששומר על ערכי צה"ל", נכתב בתלונה אחת. מתלונן אחר הוסיף: "בזמן שהצבא נלחם במלחמת הקיום שלנו, ערוץ 14 מסית לפגיעה ברמטכ"ל שתחתיו משרתים הבנים שלנו"	https://media.reshet.tv/image/upload/t_og_image/v1729674594/uploads/2024/904307363.jpg	2024-10-23 16:01:29	ערוץ 13
il	https://www.sport5.co.il/articles.aspx?FolderID=274&docID=486775	רמי כהן יכנס מסיבת עיתונאים מיוחדת - ספורט 5	None	None	2024-10-24 08:46:18	ספורט 5
il	https://www.kan.org.il/content/kan-news/politic/815895/	רה"מ נתניהו על פגיעת הכטב"ם בביתו בקיסריה: "תהיה תגובה" - כאן | תאגיד השידור הישראלי	None	None	2024-10-24 03:23:24	כאן | תאגיד השידור הישראלי
il	https://www.davar1.co.il/552056/	דיווח: חיל האוויר של טורקיה תקף יעדים כורדיים בעיראק ובסוריה - דבר	המהלך בא כתגובה על התקיפה נגד חברת TUSAS הטורקית, שבה נהרגו חמישה בני אדם ונפצעו יותר מ-20, ומיוחסת לחמושים כורדים | בין היתר נטען כי בתקיפה הטורקית נפגעו יעדים אזרחיים	https://static.davar1.co.il/www/uploads/2024/10/kurdim.jpg	2024-10-24 08:24:00	דבר
il	https://www.calcalist.co.il/local_news/article/skcoglplke	קרן המטבע: ישראל תסיים את 2024 עם הגירעון הגבוה במערב - 9% - כלכליסט	לפי תחזית הגירעון המעודכנת של הקרן, תוספת החוב לשנתיים הקרובות תעמוד על כ-155 מיליארד שקל. ב-2025 הגירעון יהיה גבוה ב-28 מיליארד שקל ממה שסמוטריץ' הצהיר	https://pic1.calcalist.co.il/picserver3/crop_images/2024/07/06/rJ5f0ywDC/rJ5f0ywDC_93_144_1091_615_0_large.jpg	2024-10-24 05:10:00	כלכליסט
il	https://www.kan.org.il/content/kan-news/local/815731/	"לא שמחנו על חיסולו של סינוואר, התרענו שללא עסקה יקרה אסון" - כאן | תאגיד השידור הישראלי	None	None	2024-10-23 12:41:43	כאן | תאגיד השידור הישראלי
il	https://www.sport5.co.il/articles.aspx?FolderID=64&docID=486774	גיבור ואיש כדורגל: חייו של אחסאן דקסה ז"ל - ספורט 5	None	None	2024-10-24 12:48:44	ספורט 5
il	https://www.mako.co.il/news-world/2024_q4/Article-2da44e2e99eb291027.htm	חשש לאירוע ביטחוני בשגרירות ישראל בסיאול: פרץ למתחם, שבר ציוד ונמלט - mako	None	None	2024-10-24 13:33:00	mako
il	https://www.ynet.co.il/news/article/syzdz7ptr	81 תלונות על הטרדות מיניות נגד סוהרות | החיים בכלא אחרי פרשת הסרסור - ynet ידיעות אחרונות	תשע שנים מאז שהתפוצצה, אחת הפרשות החמורות בתולדות שב״ס הביאה לשלושה כתבי אישום בלבד. האונס, ההטרדות, התלונות שלא קיבלו מענה, התיקים שנסגרו - והחקירה שנפתחה אחרי המשפט המטלטל של המפקד שקבע: ״סרסור בחיילות חובה״. מה השתנה - והאם הסוהרות בטוחות?	https://ynet-pic1.yit.co.il/picserver5/crop_images/2023/05/17/SJb0yHcfB3/SJb0yHcfB3_0_131_1795_1011_0_large.jpg	2024-10-24 14:49:39	ynet ידיעות אחרונות
il	https://www.haaretz.co.il/news/law/2024-10-24/ty-article/.highlight/00000192-bed0-d84b-a3d6-bef6b4a80000	לבהרב־מיארה לא נותרה עוד ברירה. עליה לקרוא להדחתו של בן גביר מיד - הארץ	הארץ	https://img.haarets.co.il/bs/00000192-bed0-d84b-a3d6-bef6b4a80000/26/c0/dd0620ee488997343b3b58814240/228150.jpg?precrop=2200,1279,x0,y0&width=1200&height=630&cmsprod	2024-10-24 14:31:00	הארץ
il	https://www.maariv.co.il/news/military/article-1142422	ד"ר תציל אותי: צה"ל חושף - כך מצליח חיזבאללה להתנייד - מעריב און ליין	דובר צה"ל בערבית הזהיר כי צה"ל ער לשימוש שעושה חיזבאללה באמבולנסים להעברת פעילים ואמצעי לחימה והדגיש: "ננקוט בצעדים המתחייבים"	https://images.maariv.co.il/image/upload/f_auto,fl_lossy/c_fill,g_faces:center,w_1200/940303	2024-10-24 09:01:36	מעריב און ליין
il	https://www.inn.co.il/news/651485	תיעוד: צה"ל חיסל מחבל חיזבאללה במהלך שיגור כטב"ם - ערוץ 7	None	None	2024-10-24 15:41:00	ערוץ 7
il	https://www.ynet.co.il/news/article/b1sno9wgyl	כמיליארד דולר גויסו ללבנון, מקרון קרא להפסקת אש ועקץ את נתניהו - ynet ידיעות אחרונות	54 מדינות משתתפות בפריז בוועידה בינלאומית לתמיכה באוכלוסיית לבנון, ובצרפת הודיעו כי גויסו כמיליארד דולר למדינה - מהם 200 מיליון לצבאה. מקרון אמר כי "המלחמה חייבת להסתיים, תמרון צבאי לא יביא לפתרון", רמז שישראל "לא צריכה לייצא ללבנון" את המלחמה בעזה - ועקץ את התיאוריה של רה"מ	https://ynet-pic1.yit.co.il/picserver5/crop_images/2024/02/14/rJDdftcsa/rJDdftcsa_0_0_850_479_0_large.jpg	2024-10-24 13:42:38	ynet ידיעות אחרונות
il	https://www.ice.co.il/finance/news/article/1035065	מכה לסופרמרקטים בישראל? החרם של טורקיה עולה מדרגה - אייס	לאחר שנודע כי חלק מהסחורה הטורקית מוסלקת לישראל דרך המעברים, מעתה נדרש אישור ממשרד הכלכלה ברמאללה המעיד כי הסחורות אכן מיועדות לשטחים הפלסטיניים. מנגנון העקיפה העיקרי פועל באמצעות יבואנים פלסטינים המספקים הזמנות על שמם לספקים הטורקים	https://img.ice.co.il/giflib/news/16ice09042024.jpg	2024-10-24 15:46:00	אייס
il	https://www.mako.co.il/news-diplomatic/2024_q4/Article-ba5718cea87b291027.htm	N12 - שר החוץ האמריקני אישר למשפחות חטופים: "עובדים על עסקה... - mako	None	None	2024-10-23 05:02:00	mako
il	https://www.ynet.co.il/news/article/bypgcx00lje	בארה"ב מדברים על עסקה "קטנה" שתוביל לאחת גדולה: "סינוואר היה פסיכופת" - ynet ידיעות אחרונות		https://www.ynet.co.il/images/big_defual_image_1024_new.png	2024-10-24 17:07:13	ynet ידיעות אחרונות
il	https://www.ynet.co.il/news/article/byxlayuxjg	ביה"ח זיו: במהלך החג הגיעו 29 פצועים מהלחימה בצפון, בהם אחד במצב קשה - ynet ידיעות אחרונות		https://www.ynet.co.il/images/big_defual_image_1024_new.png	2024-10-24 16:25:03	ynet ידיעות אחרונות
il	https://www.maariv.co.il/news/military/Article-1142402	לשבור את ברי: המסר שהעבירה ישראל בתקיפות בצור - מעריב און ליין	פינוי שכונה שלמה בעיר הלבנונית והפצצות בביירות מסמנים מטרה חדשה - ראש הפרלמנט נביה ברי, המנהל את המו"מ עם ארה"ב. נתניהו ממהר לנצל את החלון המדיני שנותר עד הבחירות בארה"ב	https://images.maariv.co.il/image/upload/f_auto,fl_lossy/c_fill,g_faces:center,w_1200/940282	2024-10-24 05:46:49	מעריב און ליין
il	https://www.inn.co.il/news/651496	מכתב הפרידה שהשאיר רס"ן אסף לאימו - ערוץ 7	None	None	2024-10-24 17:19:00	ערוץ 7
il	https://www.msn.com/he-il/news/other/%D7%A2%D7%9C-%D7%90%D7%A3-%D7%98%D7%99%D7%91-%D7%94%D7%99%D7%97%D7%A1%D7%99%D7%9D-%D7%A2%D7%9D-%D7%94%D7%9E%D7%A2%D7%A8%D7%91-%D7%9E%D7%A9%D7%9C%D7%97%D7%AA-%D7%A8%D7%95%D7%A1%D7%99%D7%AA-%D7%A0%D7%97%D7%AA%D7%94-%D7%91%D7%99%D7%A9%D7%A8%D7%90%D7%9C-%D7%96%D7%95-%D7%94%D7%A1%D7%99%D7%91%D7%94/ar-AA1sR8xh	סמוך לחידוש המו"מ לעסקה עם ארה"ב: זאת המשלחת המפתיעה שהגיעה לארץ - MSN	None	None	2024-10-24 17:31:55	MSN
il	https://www.maariv.co.il/breaking-news/article-1142391	כוחות צה"ל עצרו מעל 200 מחבלים בג'באליה שברצועת עזה - מעריב און ליין	None	https://images.maariv.co.il/image/upload/894192	2024-10-24 04:26:00	מעריב און ליין
il	https://www.kan.org.il/content/kan-news/defense/live-815804/	משרד ההגנה הסורי: חייל סורי נהרג ו-7 בני אדם נפצעו בתקיפות בדמשק וחומס - כאן | תאגיד השידור הישראלי	None	None	2024-10-22 17:11:00	כאן | תאגיד השידור הישראלי
il	https://www.ice.co.il/social/news/article/1035063	ג'וליה שחר ויוגב מלכה בפציעה חמורה: "ריסקתי את הראש" - אייס	רגע אחד של פזיזות: כוכבת הטיקטוק ג׳וליה שחר נפצעה בתאונת צילום: "פתחתי את הראש, כאבים שאני לא יכולה להסביר לכם", היא תיארה בכאב. "הכל התחיל באתגר טיקטוק דבילי שלא צלח, וריסקתי את הראש שלי על אספלט	https://img.ice.co.il/giflib/news/גוליה ויוגב ללי קופר צילום שי תמיר  (2).jpg	2024-10-24 17:24:00	אייס
il	https://www.mako.co.il/news-military/036814c74a0e1910/Article-c28908aa19fb291026.htm	N12 - הותר לפרסום: ארבעה לוחמי מילואים נפלו בקרב בלבנון - mako	None	None	2024-10-24 17:28:00	mako
il	https://www.inn.co.il/news/651499	רמטכ"ל צבא ישראל חוזר על התפיסות השגויות - ערוץ 7	None	None	2024-10-24 17:37:00	ערוץ 7
il	https://www.haaretz.co.il/news/law/2024-10-24/ty-article/.premium/00000192-bf18-d84b-a3d6-bffe3a400000	בכיר במשטרה שהיה אחראי על חקירת תיק 4000 הודיע על פרישתו מהארגון - הארץ	הארץ	https://img.haarets.co.il/bs/00000192-bf18-d84b-a3d6-bffe3a400000/83/8d/084584424713b999f3cd2bf81b70/887544.jpg?precrop=2400,1395,x0,y208&width=1200&height=630&cmsprod	2024-10-24 16:51:00	הארץ
il	https://www.ynet.co.il/news/article/bjgbzuvxkg	צה"ל: כ-50 שיגורים מלבנון במטח לגליל המערבי - ynet ידיעות אחרונות		https://www.ynet.co.il/images/big_defual_image_1024_new.png	2024-10-24 07:17:25	ynet ידיעות אחרונות
il	https://www.maariv.co.il/news/israel/Article-1142460	שלושה בתים נפגעו בשריפה בכוכב יאיר: תושבים פונו מהמקום | צפו בתיעוד - מעריב און ליין	23 צוותי כבאות פועלים בסיוע של מטוסי כיבוי על מנת לכבות שריפת חורש גדולה שפרצה בסמוך ליישוב כוכב יאיר. שלושה בתים נפגעו. תושבים המתגוררים בחלק המזרחי של היישוב פונו	https://images.maariv.co.il/image/upload/f_auto,fl_lossy/c_fill,g_faces:center,w_1200/940324	2024-10-24 13:44:02	מעריב און ליין
il	https://13tv.co.il/item/news/politics/security/c0i48-904307939/	דיווח: ישראל דחתה את תגובתה באיראן בשל הדלפת מסמכי הפנטגון - ערוץ 13	בטיימס הבריטי דווח כי בשל הדלפת מסמכי הפנטגון, המפרטים את ההכנות לתקיפה באיראן, היא נדחתה על ידי ישראל. לפי מקור מודיעיני, ההדלפה עוררה "חשיבה מחודשת" בקרב בכירים - ודרך הפעולה הישראלית עודכנה בהתאם	https://media.reshet.tv/image/upload/t_og_image/v1727025056/uploads/2024/904265475.jpg	2024-10-24 10:06:14	ערוץ 13
il	https://www.ynet.co.il/news/article/r1pcczuekl	חוסל מחבל מאונר"א שפיקד על רצח 16 במיגונית | התמונה שנחשפה, וגבורת ענר - ynet ידיעות אחרונות	דובר צה"ל חשף כי חיל האוויר חיסל יחד עם שב"כ את מפקד הנוחבה מוחמד אבו עטיוי, שפיקד על הטבח במיגונית בכביש 232 - שממנה ענר שפירא ז"ל השליך חזרה אל המחבלים 7 רימונים, עד שהשמיני התפוצץ. 16 נרצחו באירוע, 4 נחטפו	https://ynet-pic1.yit.co.il/picserver5/crop_images/2024/10/24/BJgSDeG00lkg/BJgSDeG00lkg_0_127_1194_673_0_large.jpg	2024-10-24 18:35:42	ynet ידיעות אחרונות
il	https://www.ynet.co.il/news/article/s1svbowgjl	WSJ: הצווים בהאג נגד נתניהו וגלנט - הסחת דעת מההאשמות נגד התובע - ynet ידיעות אחרונות		https://www.ynet.co.il/images/big_defual_image_1024_new.png	2024-10-24 11:09:15	ynet ידיעות אחרונות
il	https://www.inn.co.il/news/651487	צה"ל חשף: כך התנהל הקשר בין חמאס לערוץ אל-ג'זירה - ערוץ 7	None	None	2024-10-24 15:46:00	ערוץ 7
il	https://www.bhol.co.il/news/1676697	חמולה עזתית תוקפת שוטרים בגרמניה בהפגנות נגד ישראל - בחדרי חרדים	משפחת ברבח העזתית, מונה 300 חברים בברלין, החברים נרשמים כמבקשי מקלט ומשתתפים בהפגנות אלימות שבהן הם משבחים את טבח שמחת תורה. בין חברי המשפחה נמנה האשים ברבח (18), שתועד מצולם עם כלי נשק	https://storage.bhol.co.il/articles/656776_tumb_1200X627.jpeg	2024-10-24 16:35:00	בחדרי חרדים
il	https://news.google.com/rss/articles/CBMiT0FVX3lxTE1oRTVnRDBnYWlzbXVYTUNTX1hQeTdCbGVOMHpGZ25HM3loaWoxUTAxcW96QmpiVnVEbGtNdUxXc1hZbS1qbm11bkV1bFNHM1E?oc=5	מוצאי חג שמחת תורה: כל אירועי “הקפות שניות” בבתי הכנסת ברחבי הארץ - JDN	None	None	2024-10-24 16:15:22	JDN
il	https://www.mako.co.il/news-world/2024_q4/Article-e6cd093e7fcb291026.htm	N12 - שני חשודים נעצרו באזור מפרץ ארוגם בסרי לנקה - mako	None	None	2024-10-24 05:34:00	mako
il	https://www.inn.co.il/news/651500	שידור חי: דובר צה"ל מוסר הודעה לתקשורת - ערוץ 7	None	None	2024-10-24 17:42:00	ערוץ 7
il	https://www.davar1.co.il/552019/	מזג האוויר: ללא שינוי בטמפרטורות, רוחות ערות ינשבו בהרי המרכז והצפון - דבר	מזג האוויר היום צפוי להיות בהיר ויבש, עם רוחות מזרחיות ערות | במהלך הלילה יתחזקו הרוחות בהרי הצפון והמרכז	https://static.davar1.co.il/www/uploads/2024/08/F220510YA109.jpg	2024-10-24 03:22:00	דבר
il	https://www.mako.co.il/news-n12_magazine/7c2e4b3aeab21910/Article-54efca4e31ea291026.htm	N12 - הקצין הבכיר שכבר יודע מה ואיפה ישראל תתקוף בתוך איראן - mako	None	None	2024-10-23 03:46:00	mako
il	https://www.bhol.co.il/news/1676700	לא תאמינו: המקומות בישראל שבהם לא נשמעה אזעקה מאז תחילת המלחמה - בחדרי חרדים	האזורים האלה כוללים את קיבוץ אליפז ופארק תמנע בדרום הערבה, קיבוץ סמר, חוות ער'נדל, מלון שחרות בחבל אילות והיישוב עזוז שבאזור ניצנה	https://storage.bhol.co.il/articles/51553_tumb_1200X627.jpeg	2024-10-24 16:59:00	בחדרי חרדים
il	https://www.kan.org.il/content/kan-news/global/815898/	כעס באוקראינה על מזכ"ל האו"ם בגלל ביקורו ברוסיה בהזמנתו של פוטין - כאן | תאגיד השידור הישראלי	None	None	2024-10-23 19:17:00	כאן | תאגיד השידור הישראלי
il	https://www.inn.co.il/news/651501	'למען אחי ורעי' עם משפחות החטופים - ערוץ 7	None	None	2024-10-24 17:52:00	ערוץ 7
il	https://www.inn.co.il/news/651504	צפו: מאות בהקפות שניות בתל אביב - ערוץ 7	None	None	2024-10-24 18:11:00	ערוץ 7
il	https://news.google.com/rss/articles/CBMiSEFVX3lxTE1BM0o4T3g0UGx4OU9kNGVYVnIyZU4tMktwLTBOWkdFSmZQbGhsWWJ1V0dOaXZJNm45SmJjYkZacGdNUDZUWjRyWg?oc=5	עמית סוסנה באו"ם: "הותקפתי מינית בצורה מחרידה" - ערוץ 7	None	None	2024-10-24 16:12:00	ערוץ 7
il	https://www.maariv.co.il/breaking-news/article-1142456	שריפה פרצה בכוכב יאיר; 18 צוותי לוחמי אש באזור, הבתים פונו מתושבים - מעריב און ליין	None	https://images.maariv.co.il/image/upload/940317	2024-10-24 13:10:00	מעריב און ליין
il	https://www.srugim.co.il/1052778-%D7%94%D7%95%D7%AA%D7%A8-%D7%9C%D7%A4%D7%A8%D7%A1%D7%95%D7%9D-%D7%90%D7%9C%D7%95-%D7%94%D7%97%D7%A9%D7%95%D7%93%D7%99%D7%9D-%D7%91%D7%A8%D7%99%D7%92%D7%95%D7%9C-%D7%9C%D7%98%D7%95%D7%91%D7%AA-%D7%90	כתב אישום חמור הוגש נגד 7 החשודים בריגול לאיראן - סרוגים	None	None	2024-10-23 06:35:43	סרוגים
il	https://www.news1.co.il/Archive/001-D-492347-00.html	News1 | מוסא אבו מרזוק: לבקשת פוטין - חמאס ישחרר בקרוב חטופים בעלי אזרחות רוסית - News1 מחלקה ראשונה	None	https://media.news1.co.il/UploadImages/NEWS1-13-523891627788544.jpg	2024-10-24 14:58:49	News1 מחלקה ראשונה
il	https://www.ynet.co.il/news/article/bktpbopg1x	לפחות 80 שיגורים מלבנון, בבוקר החג: ארבעה נפצעו בינוני וקל ליד נהריה - ynet ידיעות אחרונות	בבוקר שמחת תורה שוגרו מטחים כבדים מלבנון לאזור עכו, צפת ונהריה - שם נפגעו הארבעה מרסיסי רקטה שהתפוצצה. במקביל, בלבנון דווח על חיסול ראש עיר ושניים נוספים בדרום המדינה וסמוך לביירות. צה"ל: התקיפות בדאחייה יועדו לאתרי ייצור אמל"ח במבנים אזרחיים. איתרנו מתחמים המיועדים ליום פלישה	https://ynet-pic1.yit.co.il/picserver5/crop_images/2024/10/24/HkxEoWFvlyg/HkxEoWFvlyg_0_159_900_507_0_large.jpg	2024-10-24 09:00:11	ynet ידיעות אחרונות
il	https://www.inn.co.il/news/651506	הקפות של כאב ותפילה בבית הכנסת בבארי - ערוץ 7	None	None	2024-10-24 18:33:00	ערוץ 7
il	https://13tv.co.il/item/news/politics/security/ahb6r-904307429/	גלנט בשיחה עם טייסים: "אחרי שנתקוף באיראן, יידעו מה עשיתם" - ערוץ 13	שר הביטחון קיבל סקירה בבסיס חיל האוויר בחצרים, ושוחח עם טייסים וצוותים. "בכל מקום שניסו לפגוע בנו שילמו מחיר כבד", אמר גלנט, והוסיף: "כל מי שינסה לפגוע בנו ייפגע - והדבר הזה נכון גם לגבי איראן"	https://media.reshet.tv/image/upload/t_og_image/v1729683467/uploads/2024/904307437.jpg	2024-10-23 00:00:00	ערוץ 13
il	https://news.google.com/rss/articles/CBMijAFBVV95cUxPeERSLUVNcWNQQXJXdzMzdlkxNHJIc1JTMkQzU2llNnFkRWdmSW9oVDNEQkZSd2tOV0I0a00zRm1Ha1FHYmZ0OVVHdi0xN3ZnMmhUUXBxd3gtZG03MkdtaHY4OEdpcldtNExlckppM21SaFVHZExSeUFZdm1aaFk2ckoxSmNlYVo4TGRzSw?oc=5	N12 - היום ה-383 למלחמה | עדכונים שוטפים - mako	None	None	2024-10-23 01:58:00	mako