country_code	url	title	description	image_url	publish_date	source
il	https://www.mako.co.il/entertainment-celebs/world-2024/Article-ba53c340f8a9291026.htm	"הוא מת בגללך": ברשת מאשימים את ארוסתו לשעבר של ליאם פיין במותו - mako	None	None	2024-10-17 13:30:00	mako
il	https://www.maariv.co.il/news/world/article-1140786	זעמו על דברי נתניהו? משרד החוץ הרוסי: "מזהירים את ישראל מתקיפת מתקני הגרעין האיראניים" - מעריב און ליין	בראיון לעיתון הצרפתי ״לה פיגארו״, נתניהו גינה את אמירותיו האחרונות של הנשיא מקרון: ״סילף באופן מטריד את ההיסטוריה״. כמו כן, ייתכן כי דבריו של נתניהו על נשק רוסי שנמצא בלבנון, הובילו לתגובה זועמת 	https://images.maariv.co.il/image/upload/f_auto,fl_lossy/c_fill,g_faces:center,w_1200/502929	2024-10-17 13:06:16	מעריב און ליין
il	https://www.mako.co.il/travel-world/Article-3b21eda490b8291027.htm	כמו באגדות: איך זה שלא הרבה אנשים מגיעים למדינה הכי יפה באירופה? - mako	None	None	2024-10-18 02:58:03	mako
il	https://www.ice.co.il/research/news/article/1034364	סקר מנדטים מפתיע: נתניהו נחלש דווקא אחרי חיסול סינוואר - אייס	הליכוד, שצונחת ל-23 מנדטים בלבד, בעוד "המחנה הממלכתי" מתייצב על 20 מנדטים, מציגות תמונה מסקרנת, מעניין במיוחד הוא הנתון המתייחס למפלגה היפותטית בראשות נפתלי בנט. בתרחיש זה, מפלגתו של בנט זוכה ל-23 מנדטים, בעוד הליכוד צונח ל-18 מנדטים בלבד	https://img.ice.co.il/giflib/news/6ice03092024.jpg	2024-10-18 04:33:00	אייס
il	https://www.ynet.co.il/news/article/hkkmc81ekl	בישראל בודקים אם אקדח שנמצא ברשות סינוואר שייך לקצין צה"ל שנפל ב-2018 - ynet ידיעות אחרונות	סא"ל מחמוד חיר א-דין, שנהרג לפני שש שנים בחאן יונס, קיבל אחרי מותו אות ציון לשבח על פעילותו במבצע החשאי. אחרי חיסול רב-המרצחים ברפיח, נשלח לבדיקה אקדח שנמצא לצידו של סינוואר כדי לגלות אם כלי הנשק שייך לקצין	https://ynet-pic1.yit.co.il/picserver5/crop_images/2022/05/16/H1eGmzglv5/H1eGmzglv5_0_172_723_408_0_large.jpg	2024-10-18 04:34:19	ynet ידיעות אחרונות
il	https://www.kan.org.il/content/kan-news/defense/813686/	מחבל חיזבאללה בחקירתו: "התגייסתי כי הייתי צריך את הכסף" - כאן | תאגיד השידור הישראלי	None	None	2024-10-18 02:08:33	כאן | תאגיד השידור הישראלי
il	https://www.mako.co.il/men-men_news/Article-78f0a656a2b8291026.htm	יחידת החיסולים של העולם התחתון: "משלמים לנו הרבה כסף לבצע עבודות שחורות" - mako	None	None	2024-10-18 02:58:41	mako
il	https://www.maariv.co.il/breaking-news/article-1140941	בן גביר: "משבח ומברך את מפקדי ושוטרי מחוז ירושלים על סיכול פיגוע הטרור" - מעריב און ליין	None	https://images.maariv.co.il/image/upload/894192	2024-10-18 06:13:00	מעריב און ליין
il	https://news.walla.co.il/item/3698570	הותר לפרסום: 5 לוחמי סיירת גולני נפלו בקרב בדרום לבנון - וואלה! חדשות	הלוחמים הם רס"ן אופק בכר, בן 24 מנס ציונה, סרן אלעד סימן טוב, בן 23 מצופים, סמ"ר אלישיב איתן וידר, בן 22 מירושלים, סמ"ר יעקב הלל, בן 21 מירושלים וסמ"ר יהודה דרור יהלום, בן 21 מחברון. בקרב בו נפלו, נפצעו קצין ושני לוחמים באורח קשה, ופונו לטיפול בישראל	https://images.wcdn.co.il/f_auto,q_auto,w_1200,t_54/3/7/8/6/3786556-46.jpg	2024-10-17 20:01:00	וואלה! חדשות
il	https://www.sport5.co.il/articles.aspx?FolderID=405&docID=486232	הפספוס וחלוקת הכוחות: סיכום ההפסד של מכבי ת"א - ספורט 5	None	None	2024-10-18 03:31:42	ספורט 5