country_code	url	title	description	image_url	publish_date	source
il	https://www.haaretz.co.il/gallery/cinema/2024-11-18/ty-article-magazine/.premium/00000193-3947-de28-abdb-b9c73b280000	"אנשים אמרו דברים איומים על נתניהו. חלקם בטראומה" - הארץ	הארץ	https://img.haarets.co.il/bs/00000193-3947-de28-abdb-b9c73b280000/43/d3/6601166349f385bf908bce20fa84/59326411.JPG?precrop=683,397,x0,y211&width=1200&height=630&cmsprod	2024-11-18 04:00:00	הארץ
il	https://www.inn.co.il/news/653630	"פוגרום - אמירה פוליטית": ראש עיירית אמסטרדם באמירה מקוממת - ערוץ 7	None	None	2024-11-18 07:42:00	ערוץ 7
il	https://www.mako.co.il/news-columns/2024_q4/Article-0715412795a3391027.htm	N12 - האם ישראל מתערבת בלחימה בבלוצ'יסטן האיראנית? | אהוד יערי - mako	None	None	2024-11-18 13:09:00	mako
il	https://www.davar1.co.il/559214/	כ-200 מיועדים לגיוס השתתפו בכנס לגיוס מילואימניקים לחטיבה החרדית - דבר	צה"ל ערך את הכנס כחלק מתהליך הקמת פלוגות מילואים לחרדים שעברו את "גיל הפטור", פלוגות שהמגויסים אליהן יעברו הכשרת רובאי 07 במשך כחצי שנה ולאחריה ישתלבו במערך המילואים	https://static.davar1.co.il/www/uploads/2024/11/kenesidfharedim-1.jpg	2024-11-18 10:38:00	דבר
il	https://www.davar1.co.il/559158/	ועידת האקלים של האו"ם: המדינות העניות דורשות 1,300 מיליארד דולר, והמו"מ מתקדם לאט - דבר	ועידת Cop29 באזרבייג'ן נכנסה לשבוע השני, בלי להתקרב להסכמה על גובה הפיצוי שמדינות מפותחות ישלמו לאלו המתפתחות על נזקי האקלים ועל צמצום השימוש בדלקים מזהמים: "עדיין לא מורגשת כאן דחיפות" 	https://static.davar1.co.il/www/uploads/2024/11/activists.jpg	2024-11-18 08:23:00	דבר
il	https://www.globes.co.il/news/article.aspx?did=1001494272	החביא 2 מיליון שקל בתוך מזוודה במחסן, ולא דיווח למס הכנסה - גלובס	None	None	2024-11-18 13:01:24	גלובס
il	https://www.ice.co.il/media/news/article/1038536	אדוה דדון מגיבה לאובדן הכבד: "הלב כבר לא יכול להכיל" - אייס	הטרגדיה השלישית במשפחתו של גדי אייזנקוט, הרמטכ"ל ה-21 של ישראל וח"כ מטעם "המחנה הממלכתי", הותירה רבים בתחושת אבל כבד. איזנקוט שאיבד את בנו ואחיינו לפני כשנה נפרד אמש מאחיין נוסף, סרן יוגב פזי ז"ל ששיתף פוסט מצמרר לפני שלושה חודשים בלבד	https://img.ice.co.il/giflib/news/7ice03112021.jpg	2024-11-18 01:15:00	אייס
il	https://www.mako.co.il/news-world/2024_q4/Article-4ebda3034de3391026.htm	N12 - לאחר שנכשלה בסקר הגורלי: הסוקרת ה"אגדית" מאיווה פורשת - mako	None	None	2024-11-18 16:22:00	mako
il	https://www.davar1.co.il/559272/	בג"ץ הציע פשרה בעניין חוק המעונות, הצדדים יידרשו להשיב השבוע - דבר	השופטים הציעו שמשרד העבודה יפרסם תבחינים לסבסוד מעונות יום לכלל האוכלוסייה עד חודש מהיום, וכי משפחות האברכים המחויבים בגיוס ימשיכו לקבל סבסוד לתקופת מעבר של עוד 3 חודשים 	https://static.davar1.co.il/www/uploads/2024/11/F241118YS32_pr.jpg	2024-11-18 13:18:00	דבר
il	https://www.kan.org.il/content/kan-news/global/825956/	מפקדת משטרת ברלין: העיר מסוכנת ליהודים ולקהילה הגאה - כאן | תאגיד השידור הישראלי	None	None	2024-11-18 14:56:34	כאן | תאגיד השידור הישראלי
il	https://news.google.com/rss/articles/CBMic0FVX3lxTE1PX3ZnNUR2cTgyUkdfZzEyblZ2M2ZYb2N1a2JYX3FXMS1VdUx0blZubEpZUGMyUDI3SXppcTNMclcxckxLV2paWm5obndIYllfZ3poazdyZkNzQ3pHMU1GRlVoMDhCdEpmN1RlVDZMbkRTQnc?oc=5	חדשות ועדכונים - חוגגים חנוכה בחולון: הצגות גדולות במחיר קטן... - עיריית חולון	None	None	2024-11-18 09:23:56	עיריית חולון
il	https://www.mako.co.il/news-politics/2024_q4/Article-4f9e5153c1e3391026.htm	N12 - רוטמן סרב להקרין בוועדה שלו את סרטון החטוף סשה טרופנוב - mako	None	None	2024-11-18 07:20:00	mako
il	https://www.maariv.co.il/news/politics/article-1149243	פלדשטיין פנה לנתניהו בנוגע למסמך לפני ההדלפה - כך הגיב ראש הממשלה | דיווח - מעריב און ליין	לפי דיווח ב"כאן" דובר ראש הממשלה לשעבר אלי פלדשטיין פנה לבנימין נתניהו טרם הדלפת המסמך ל"בילד" הגרמני, ואמר כי יש בידיו "מסמך חדש שקשור למשא ומתן לשחרור החטופים"	https://images.maariv.co.il/image/upload/f_auto,fl_lossy/c_fill,g_faces:center,w_1200/944750	2024-11-18 18:46:47	מעריב און ליין
il	https://www.mako.co.il/news-politics/2024_q4/Article-facdffbb34f3391026.htm	N12 - אלף הצווים הראשונים כבר נשלחו: למה הצבא מסתפק ביעד מזערי? - mako	None	None	2024-11-18 13:02:00	mako
il	https://www.globes.co.il/news/article.aspx?did=1001494235	דיווח: ביידן אישר לאוקראינה לתקוף ברוסיה באמצעות טילים אמריקאים - גלובס	None	None	2024-11-17 19:43:33	גלובס
il	https://www.bhol.co.il/news/1678756	בשורה אדירה לאזרחים: מחירי מוצרי בסיס יוזלו בעשרות אחוזים - בחדרי חרדים	היבואנים שזכו במכסות התחייבו להוזלות משמעותיות של מחירי המוצרים לצרכנים, מהלך שמבטיח הפחתת מחירים של עשרות אחוזים בהשוואה לשנת 2023 | בין המוצרים שייהנו ממחירים מוזלים: מיץ ענבים, ירקות קפואים ועגבניות מרוסקות	https://storage.bhol.co.il/media/lt/1292254/gallery/413679_tumb_1200X627.jpg	2024-11-18 09:05:00	בחדרי חרדים
il	https://www.ynet.co.il/news/article/rkun5gkgjl	במשטרה מעדכנים שהיירוט בגוש דן לא צלח: "פגיעה ישירה של טיל במשקל רב" - ynet ידיעות אחרונות		https://www.ynet.co.il/images/big_defual_image_1024_new.png	2024-11-18 19:58:09	ynet ידיעות אחרונות
il	https://www.mako.co.il/news-politics/2024_q4/Article-64f4d72bd204391026.htm	אחרי העליהום בוועדה: האם נתניהו פתח בצעד ראשון להדחת היועמ"שית? - mako	None	None	2024-11-18 18:16:00	mako
il	https://www.jdn.co.il/news/2304205/	ראש הממשלה נואם בכנסת; האופוזיציה צורחת ומפריעה - JDN	None	None	2024-11-18 15:22:08	JDN
il	https://www.inn.co.il/news/653672	ד"ר מיכאל בן ארי: "אין סיכוי שפלדשטיין הכניס את החבל לתא" - ערוץ 7	None	None	2024-11-18 12:42:00	ערוץ 7
il	https://www.mako.co.il/news-politics/2024_q4/Article-7fb2ef2d6704391027.htm	N12 - האם צריך לפטר את היועמ"שית, וכמה מנדטים יקבל גלנט | סקר... - mako	None	None	2024-11-18 20:05:00	mako
il	https://www.inn.co.il/news/653673	כתב אישום נגד חשוד שפרסם הכפשות נגד עובדי ציבור באתר "עדנה קרנבל" - ערוץ 7	None	None	2024-11-18 12:46:00	ערוץ 7
il	https://www.ice.co.il/social/news/article/1038603	מגיש ערוץ 14 חוגג את ההישג: "מי שמאמין לא מפחד" - אייס	כתב הדיגיטל והמגיש בערוץ 14 מתרגש מההישג העצום: "צמרמורת כחול לבן"	https://img.ice.co.il/giflib/news/31ice28102024.jpg	2024-11-18 10:04:00	אייס
il	https://www.ynet.co.il/news/article/bktjvrwgyl	"אוזלת יד שיטתית": 81% מתיקי עבירות המין נסגרים ללא אישום | הנתונים המטרידים - ynet ידיעות אחרונות	הדוח השנתי של איגוד מרכזי הסיוע לנפגעות תקיפה מינית מציף את הטיפול הלקוי של משרדי הממשלה בנושא הסיוע לנפגעות ונפגעים - בעוד שמדי שנה פוחת מספר האסירים השפוטים על עבירות מין ששולבו בתוכנית שיקומית. עוד עולה כי רוב הפגיעות נעשו ע"י אדם מוכר לקורבן, וכי יש יותר הטרדות בעבודה	https://ynet-pic1.yit.co.il/picserver6/crop_images/2021/02/20/S1S937CWd/S1S937CWd_0_0_2000_1126_0_large.jpg	2024-11-18 04:45:51	ynet ידיעות אחרונות
il	https://www.sport5.co.il/articles.aspx?FolderID=274&docID=489162	''ג`ונתן מוטלי חתם בקבצת ג`י ליג'' - ספורט 5	None	None	2024-11-18 18:40:46	ספורט 5
il	https://www.ynet.co.il/news/article/bkzxbvwzyx	אם הנווט עתרה לבג"ץ: "קבורה צבאית מגיעה לבני בזכות ולא בחסד" - ynet ידיעות אחרונות	מירי, אימו של אסף דגן ששם קץ לחייו לאחר שנים שסבל מפוסט-טראומה, עתרה בבקשה לאפשר לה לערוך לבנה הלוויה צבאית: "צה"ל מגלה כפיות טובה קיצונית לקצין מצטיין ששירת את המדינה והצבא בנאמנות אין קץ". בני המשפחה שוחחו עם הנשיא הרצוג, ועתידים להיפגש עם השר כ"ץ	https://ynet-pic1.yit.co.il/picserver6/crop_images/2024/10/24/H1400N11OgJg/H1400N11OgJg_61_113_1155_651_0_large.jpg	2024-11-17 14:04:02	ynet ידיעות אחרונות
il	https://www.ynet.co.il/news/article/h1euwzfgkg	נסיעה גורלית: שליח ביידן מגיע ללבנון, אלו הסיכויים להסדרה בצפון - וכך היא תיראה - ynet ידיעות אחרונות	למרות ההרוגה בשפרעם, הטיל למרכז והתקיפה בביירות ליד מטה הממשלה - יש אפשרות ממשית להגעה להסדרה. הוכשטיין יגיע לביירות, ההערכה בארה"ב: הסיכוי - יותר מ-50%. תקופת היישום תהיה 60 ימי הפסקת אש, המבחן: אם חיזבאללה ייסוג לקו הליטאני. המשמעות, אם יהיה הסדר: ניתוק בין לבנון לעזה	https://ynet-pic1.yit.co.il/picserver6/crop_images/2024/11/17/SkM646PMJe/SkM646PMJe_0_267_3000_1689_0_large.jpg	2024-11-18 20:57:10	ynet ידיעות אחרונות
il	https://news.google.com/rss/articles/CBMiZEFVX3lxTE5XOXYtM0hGQWV0ZmxGcFN2aGhjMXRIWkJvQlNvTWFrOFZ6UGhnV3ZTdXpxUnJnUkNKREg3RElOa3R4ZkFUbHhTQXR3RUh3b3dHd1c1Q2cyQU1Xam1OZlNqeTlURks?oc=5	בהמשך לנפילה בשפרעם: אישה בשנות ה-50 נהרגה בזמן שהותה במרחב מוגן - מעריב און ליין	None	None	2024-11-18 17:32:00	מעריב און ליין
il	https://www.mako.co.il/news-military/036814c74a0e1910/Article-4950c266f7c3391027.htm	"יש משימות ומישהו צריך לעשות אותן": הלוחמים בקו הכפרים השני בעומק לבנון ממשיכים בתמרון הקרקעי - mako	לוחמי חטיבה 188, שנמצאים בנקודה הכי עמוקה אליה תמרן עד כה צה"ל, מאמינים כי החזרת תושבי הצפון לבתיהם מתקרבת אך מסייגים ואומרים כי "המשימה עדיין לא הושלמה"	https://img.mako.co.il/2024/11/17/in_lebanon_autoOrient.mxf_4_autoOrient_i.jpg	2024-11-18 11:12:00	mako
il	https://www.ynet.co.il/news/article/bjxxgc00myx	חיזבאללה הודיע: 4 פעילים חוסלו לצד דובר הארגון; השגריר האיראני יחזור לביירות - ynet ידיעות אחרונות		https://www.ynet.co.il/images/big_defual_image_1024_new.png	2024-11-18 14:43:55	ynet ידיעות אחרונות
il	https://www.themarker.com/realestate/2024-11-18/ty-article/.premium/00000193-4033-d824-afff-4ebf980a0000	סנקציות אמריקאיות על אמנה: האם 60 אלף איש לא יוכלו לשלם שכר דירה? - TheMarker	***	https://img.haarets.co.il/bs/00000193-4033-d824-afff-4ebf980a0000/6e/a8/01f8b2b74694a30cd4fef2fbf174/888331.jpg?&width=1200&height=630&cmsprod	2024-11-18 17:01:00	TheMarker
il	https://news.google.com/rss/articles/CBMizgJBVV95cUxNR1ROZUJKYlNtZHAtVDdaTlQ4ajk0Q2NBZ2doUW5sUnpQY2JQSnlDY25MbTBUekctRUV4c2pMd2lOUEdRcnp6V1g4bVBfMzlIVGEtMmNLbHU4eTZBek1SZkFfTkhoZERWa05xVmtUU3ZKNGdUbnJRMVdiR0tscEhFa3phZXozSzdqUDVQWUw1M1FkWF9iUURsRmZaZlRQTzh2YUpfRVk1TGd5UnZqcUNyWXVlQjF2bXpuVmJwVGJiQVFqYW5RbGlRMXhiRUpmSjN4QXBxS0tSdVdRSEVnSUpCT0Y1Szc2Rjd3ZWRfYlR3V2gwMkVpV3pueGI5QmNDOGZfSHEtOEJKQ2JRV3hxdVBYN0Nxa09YT0xqdHlyZGpOUGxvaDFiWGhTWmlRaDRRX1VKMWItd0l6MXRJWmFjUXdHLXppOTRWU3VhaEIxN2tR0gFeQVVfeXFMTTZjTkMwWUhtUjJ5aWFtc0NRa0xPamJFWXhPeDZJcW53QlgtMDV2SExEWGpQckVKS2RyS3doTlNRT3pJbEtxUFQtM2VDRmpTc1ZET0ZxeHY5YmVEc011UQ?oc=5	התראה מטאורולוגית בישראל; גשם ושטפונות. תחזית מזג אוויר - סרוגים	None	None	2024-11-18 16:05:09	סרוגים
il	https://www.jdn.co.il/video/2304086/	תיעוד ממנהרה בלבנון; הושמדו עשרות משגרים, רקטות ואמל"ח - JDN	None	https://www.jdn.co.il/wp-content/uploads/2024/11/WhatsApp_Image_2024-11-17_at_09.41.27_1.jpeg	2024-11-18 11:31:47	JDN
il	https://news.google.com/rss/articles/CBMiWkFVX3lxTE0tMlBPejRRdTlWWkF5ME4zcHlOanVRMGZoRzRGcFJCamtGNXU4TEtBaC1iX2R1SHV0ZDh3Q1RCOG1lSVRxOTRSTzV0STh6cHpvVUxnN3g2RVlQUQ?oc=5	הביקור החשאי של ראש השב"כ בטורקיה, וההכחשה: "משרדי חמאס לא הועברו לכאן" - ynet ידיעות אחרונות	ביקור חריג, במדינה שלפי הדיווחים מנעה ממטוס "כנף ציון" לחלוף מעליה: רונן בר נועד עם ראש הביון הטורקי, על רקע דיווחים - שבינתיים הוכחשו - לפיהם טורקיה מארחת בכירים בחמאס. בכיר ישראלי הבהיר: הטורקים לא ישמשו כמתווכים בעסקת חטופים	https://ynet-pic1.yit.co.il/picserver6/crop_images/2024/02/15/B111WgNqjjp/B111WgNqjjp_167_67_785_442_0_large.jpg	2024-11-18 16:52:32	ynet ידיעות אחרונות
il	https://www.mako.co.il/news-law/fb852268f2502910/Article-843529ed9af3391027.htm	N12 - שניים חשודים ב"אירוח" משליכי פצצות התאורה לבית רה"מ - mako	שני תושבי קיסריה זומנו לעדות פתוחה במשטרה, ובהמשך הודיעו להם שהם נחקרים באזהרה • בין השניים: קרוב משפחה של אחד החשודים שנעצרו כבר קודם לכן • להב 433: בוחרים שלא להגיב • פרסום ראשון	https://img.mako.co.il/2024/11/17/maonroham1711_autoOrient_i.jpg	2024-11-18 14:38:00	mako
il	https://www.maariv.co.il/breaking-news/article-1149170	היועמ"שית בתגובה לטענת השר בן גביר: " לא היה ולא נברא" - מעריב און ליין	None	https://images.maariv.co.il/image/upload/894192	2024-11-18 14:03:00	מעריב און ליין
il	https://www.inn.co.il/news/653708	ראש אכ"א היוצא: האמון בצבא - גם במימוש האחריות על ראשי צה"ל - ערוץ 7	None	None	2024-11-18 18:23:00	ערוץ 7
il	https://www.mako.co.il/news-military/036814c74a0e1910/Article-8128774e6e04391027.htm	N12 - לקראת הסדרה? הוכשטיין יגיע לביירות, חיזבאללה מגביר את האש - mako	None	None	2024-11-18 21:05:00	mako
il	https://www.ynet.co.il/news/article/s1c11gtf1e	"סוכל ניסיון איראני לחיסול שר המשפטים הקנדי בעבר, אביה של ח"כית לשעבר" - ynet ידיעות אחרונות	בקנדה דווח כי הרשויות סיכלו מזימה איראנית להתנקש בחיי פרופ' אירווין קוטלר, אביה החורג של מיכל קוטלר-וונש, שליחת משרד החוץ למאבק באנטישמיות. שני חשודים נעצרו	https://ynet-pic1.yit.co.il/picserver6/crop_images/2023/03/26/ry00TvA6g2/ry00TvA6g2_1021_80_245_138_0_large.jpg	2024-11-18 17:02:50	ynet ידיעות אחרונות
il	https://www.kan.org.il/content/kan-news/local/826024/	הסוף לחזירות במחירי הטיסות? רק אם תוותרו על הפיצוי בגין ביטול - כאן | תאגיד השידור הישראלי	None	None	2024-11-18 17:54:06	כאן | תאגיד השידור הישראלי
il	https://www.makorrishon.co.il/news/796948/	שעות לאחר אירוע ירי על אותו הציר: הרוג מפיצוץ רכב בפ"ת - Makor Rishon	None	None	2024-11-18 05:36:41	Makor Rishon
il	https://www.kipa.co.il/%D7%97%D7%93%D7%A9%D7%95%D7%AA/1192553-0/	גיבורה: שורדת השבי בתשובה מטלטלת לפעיל האנטי ישראלי - כיפה	None	None	2024-11-18 15:42:53	כיפה
il	https://www.srugim.co.il/1060867-%D7%90%D7%99%D7%A8%D7%95%D7%A2-%D7%91%D7%99%D7%98%D7%97%D7%95%D7%A0%D7%99-%D7%97%D7%A8%D7%99%D7%92-%D7%A0%D7%97%D7%A9%D7%A3-%D7%91%D7%92%D7%91%D7%95%D7%9C-%D7%9C%D7%91%D7%A0%D7%95%D7%9F	אירוע ביטחוני חריג נחשף בגבול לבנון - סרוגים	None	None	2024-11-18 15:08:40	סרוגים
il	https://www.jdn.co.il/news/2304128/	הלם וזעם בציבור החרדי; לפיד מעז פניו כנגד גדולי התורה וקורא להכניסם לכלא - JDN	None	None	2024-11-18 13:50:58	JDN
il	https://www.mako.co.il/men-men_news/Article-3295eb3b01f3391026.htm	הירי ברמת גן: עבריין נחשד כמחבל ונורה למוות ע"י עובר אורח - mako	None	None	2024-11-18 11:46:00	mako
il	https://news.google.com/rss/articles/CBMiZEFVX3lxTE9WVHdOcUg3TUxlWFd2Y0wxZGRfSXUyT3RHS0JEaTFTZ2FXQWdkSS1OeUpDUjRtMUFxMGVVa0lHdTZGQUVVRnh3ZjNTMEZ3VGxKYUtYZHJEd25CbjJsZ1FfZXI4Uk4?oc=5	יוון: פרו פלסטיניים שרפו דגלי ארצות הברית וישראל - כאן | תאגיד השידור הישראלי	None	None	2024-11-18 07:20:38	כאן | תאגיד השידור הישראלי
il	https://www.calcalist.co.il/local_news/article/h10k003wz1l	ההפיכה לא עוצרת: בין ה"טיהור" של היועמ"שים למוקש שמניח לוין בעליון - כלכליסט	הממשלה העלתה הילוך בניסיון להיפטר מהיועמ"שים ולהציב במקומם ממלאי מקום צייתניים. סילוק אנשי היועמ"שית יימשך במלחמת התשה מתלהמת של השרים מולה. ושר המשפטים לא מוותר על התנגדותו למינוי יצחק עמית לנשיא העליון, הפעם דרך בחירת נעם סולברג כמשנה לנשיא והתעקשות עליו כממלא המקום 	https://pic1.calcalist.co.il/picserver3/crop_images/2024/11/17/SJXLOoDzyl/SJXLOoDzyl_0_0_2000_1126_0_large.jpg	2024-11-17 18:56:00	כלכליסט
il	https://www.ynet.co.il/news/article/r1mgd8dmje	השגריר בוותיקן נגד האפיפיור: "7.10 היה טבח ג'נוסיידי, ישראל מגינה על אזרחיה" - ynet ידיעות אחרונות		https://www.ynet.co.il/images/big_defual_image_1024_new.png	2024-11-18 06:06:51	ynet ידיעות אחרונות
il	https://www.sport5.co.il/articles.aspx?FolderID=609&docID=489163	יקבל הזדמנות: השינוי המתוכנן במעמדו של דניאל פרץ בבאיירן - ספורט 5	None	None	2024-11-18 21:04:52	ספורט 5
il	https://www.mako.co.il/news-law/fb852268f2502910/Article-a23cd72bd204391026.htm	N12 - דיווח: לשכת רה"מ ביקשה חוות דעת שתאפשר לו לא להתייצב... - mako	בלשכה ביקשו משירות הביטחון הכללי להודיע שרה"מ "לא יכול לשהות באופן ממושך במקומות קבועים וידועים" • לפי הדיווח בעיתון הארץ, בארגון סירבו • בשב"כ בודקים איך ניתן לקיים את העדות בצורה מאובטחת, החל מ-2 בדצמבר	https://img.mako.co.il/2024/10/29/bibi29101_autoOrient_i.jpg	2024-11-18 17:07:00	mako