country_code	url	title	description	image_url	publish_date	source
il	https://www.mako.co.il/news-military/036814c74a0e1910/Article-cd95b3aae61a291026.htm	N12 - היום ה-379 למלחמה | עדכונים שוטפים - mako	None	None	2024-10-18 23:06:00	mako
il	https://www.mako.co.il/news-military/036814c74a0e1910/Article-44952045593a291026.htm	תושבים באזור גלילות שמעו אזעקה בלי התראות באפליקציית פיקוד העורף - זה ההסבר - mako	None	None	2024-10-19 07:48:40	mako
il	https://www.inn.co.il/news/651096	סקר: נפתלי בנט מרסק את האופוזיציה - ערוץ 7	None	None	2024-10-18 04:29:00	ערוץ 7
il	https://news.walla.co.il/item/3698193	כמו סינוואר, גם נסראללה עשה טעות אחת יותר מדי - וואלה! חדשות	מהרגע שהחליט לקשור את גורלו בגורל עזה, מזכ"ל חיזבאללה עשה סדרת שגיאות, שהסתיימה כשפגש את פצצות חיל האוויר. כעת וואלה חושף: איך פעלה תוכנית ההטעיה המתוחכמת נגדו, מה הצעד שגרם לישראל לאשר את חיסולו, ומה הפך אותו למטרה הרבה יותר נוחה ממנהיג חמאס	https://images.wcdn.co.il/f_auto,q_auto,w_1200,t_54/3/7/8/5/3785803-46.jpg	2024-10-19 01:22:00	וואלה! חדשות
il	https://www.jdn.co.il/j_world/2286809/	ההתבטאות המבהילה של מרן: מתי תפרוץ מלחמת גוג ומגוג – ומי ינצל? - JDN	None	None	2024-10-18 12:15:18	JDN
il	https://www.idf.il/%D7%90%D7%AA%D7%A8%D7%99-%D7%99%D7%97%D7%99%D7%93%D7%95%D7%AA/%D7%99%D7%95%D7%9E%D7%9F-%D7%94%D7%9E%D7%9C%D7%97%D7%9E%D7%94/%D7%9B%D7%9C-%D7%94%D7%9B%D7%AA%D7%91%D7%95%D7%AA/%D7%94%D7%A4%D7%A6%D7%95%D7%AA/%D7%94%D7%A8%D7%9E%D7%98%D7%9B-%D7%9C-%D7%A8%D7%90-%D7%9C-%D7%94%D7%A8%D7%A6%D7%99-%D7%94%D7%9C%D7%95%D7%99-%D7%9C%D7%9E%D7%A4%D7%A7%D7%93%D7%99-%D7%97%D7%98%D7%99%D7%91%D7%AA-%D7%92%D7%95%D7%9C%D7%A0%D7%99-%D7%91%D7%93%D7%A8%D7%95%D7%9D-%D7%9C%D7%91%D7%A0%D7%95%D7%9F/	הרמטכ"ל למפקדי גולני בדרום לבנון: "מעריכים כ-1,500 פעילי חיזבאללה הרוגים. העובדה שהם נכנעים - הישגים חשובים" - IDF	None	None	2024-10-18 14:15:10	IDF
il	https://ladaat.co/archives/80053	האדמו”ר מויז’ניץ: עברתי דברים קשים, אעבור גם את זה - לדעת	None	None	2024-10-17 23:54:13	לדעת
il	https://www.mako.co.il/news-columns/2024_q4/Article-4c7406c07d3a291027.htm	N12 - בליכוד כבר הוזים על התיישבות בעזה: לא בעבור זה נלחמנו - mako	None	None	2024-10-19 09:41:00	mako
il	https://www.mako.co.il/men-men_news/Article-78f0a656a2b8291026.htm	יחידת החיסולים של העולם התחתון: "משלמים לנו הרבה כסף לבצע עבודות שחורות" - mako	None	None	2024-10-18 02:58:41	mako
il	https://www.davar1.co.il/550602/	מזג האוויר: ירידה בטמפרטורות; הים התיכון מסוכן לרחצה - דבר	מזג האוויר צפוי להיות מעונן חלקית עד בהיר | הים התיכון יהיה מסוכן לרחצה, בשל גלים גבוהים | מחר תחול עלייה בטמפרטורות	https://static.davar1.co.il/www/uploads/2022/06/מטיילים-בגן-הלאומי-קיסריה.-אטי-קוריאט-אהרון-רשות-הטבע-והגנים2.jpg	2024-10-19 04:25:00	דבר
il	https://www.maariv.co.il/news/world/article-1141036	"אפס אינטליגנציה": האריס נעדרה מהאירוע - טראמפ ניצל את ההזדמנות לתקוף - מעריב און ליין	במהלך ארוחת צדקה יוקרתית, תקף הנשיא לשעבר טראמפ את סגנית הנשיא האריס, שנעדרה מהאירוע, ואמר: "כרגע יש לנו מישהו בבית הלבן שבקושי יכול לדבר, בקושי יכול לחבר שני משפטים קוהרנטיים"	https://images.maariv.co.il/image/upload/f_auto,fl_lossy/c_fill,g_faces:center,w_1200/932807	2024-10-18 17:16:22	מעריב און ליין
il	https://www.srugim.co.il/1051508-%D7%91%D7%90%D7%9E%D7%A6%D7%A2%D7%95%D7%AA-100-%D7%98%D7%95%D7%9F-%D7%97%D7%95%D7%9E%D7%A8-%D7%A0%D7%A4%D7%A5-%D7%A6%D7%94%D7%9C-%D7%94%D7%A9%D7%9E%D7%99%D7%93-%D7%90%D7%A8%D7%91%D7%A2-%D7%9E%D7%A0	באמצעות 100 טון חומר נפץ: צה"ל השמיד ארבע מנהרות בלבנון - סרוגים	None	None	2024-10-19 16:11:27	סרוגים
il	https://www.srugim.co.il/1051544-%D7%A0%D7%A1-%D7%91%D7%9E%D7%94%D7%9C%D7%9A-%D7%94%D7%A9%D7%91%D7%AA-%D7%A4%D7%99%D7%92%D7%95%D7%A2-%D7%93%D7%A8%D7%99%D7%A1%D7%94-%D7%91%D7%A6%D7%95%D7%9E%D7%AA-%D7%A2%D7%A4%D7%A8%D7%94-%D7%A6	נס במהלך השבת: פיגוע דריסה בצומת עפרה | צפו - סרוגים	None	None	2024-10-19 17:05:23	סרוגים
il	https://www.ynet.co.il/news/article/r1fohzllkx	הצעירה היזידית: "אולצתי לאכול בשר תינוקות בעיראק. חמאס לא שונה מדאעש" - ynet ידיעות אחרונות	כשבועיים לאחר שחולצה מרצועת עזה, סיפרה פאוזיה אמין סידו (21) על החטיפה, ההתעללות שעברה בעשור האחרון והחיים תחת מחבלי חמאס ודאעש. "כל בתי החולים ברצועה שימשו כבסיסי חמאס. לכולם היה נשק", סיפרה | קשה לקריאה	https://ynet-pic1.yit.co.il/picserver5/crop_images/2024/10/04/rJg4V11pRR/rJg4V11pRR_0_0_1280_720_0_large.jpg	2024-10-18 16:26:15	ynet ידיעות אחרונות
il	https://www.mako.co.il/entertainment-celebs/local-2024/Article-82d503f2520a291027.htm	"עשו עליה ארבעה וידואי הריגה והיא ניצלה" - mako	None	None	2024-10-18 15:36:00	mako
il	https://www.davar1.co.il/550745/	כטב"ם שוגר לעבר בית רה"מ בקיסריה, ופגע במבנה אחר, ללא נפגעים; נתניהו: "טעות מרה" - דבר	לשכת רה"מ: נתניהו ורעייתו לא היו במקום | נתניהו: "זה לא ירתיע אותי ואת מדינת ישראל להמשיך את מלחמת התקומה" | בקיסריה לא הופעלה אזעקה בזמן נפילת הכטב"ם | צה"ל: "האירוע מתוחקר"	https://static.davar1.co.il/www/uploads/2024/10/F241019FFF004_pr.jpg	2024-10-19 16:17:00	דבר
il	https://www.haaretz.co.il/news/politics/2024-10-19/ty-article/.premium/00000192-a5dc-daee-a9fb-efde27460000	הודלפו מסמכים המתארים לכאורה הכנות של ישראל לתקיפה באיראן - הארץ	הארץ	https://img.haarets.co.il/bs/00000192-a5dc-daee-a9fb-efde27460000/8d/b7/03111598478c96c1453185b1daef/764080.jpg?precrop=2400,1395,x0,y37&width=1200&height=630&cmsprod	2024-10-19 18:31:00	הארץ
il	https://www.idf.il/%D7%90%D7%AA%D7%A8%D7%99-%D7%99%D7%97%D7%99%D7%93%D7%95%D7%AA/%D7%99%D7%95%D7%9E%D7%9F-%D7%94%D7%9E%D7%9C%D7%97%D7%9E%D7%94/%D7%9B%D7%9C-%D7%94%D7%9B%D7%AA%D7%91%D7%95%D7%AA/%D7%94%D7%A4%D7%A6%D7%95%D7%AA/%D7%90%D7%95%D7%92%D7%93%D7%94-98-%D7%91%D7%9C%D7%91%D7%A0%D7%95%D7%9F/	ממצאי הפשיטה על מפקדות חיזבאללה: אוגדה 98 במרחב העמוק ביותר עד כה בפעילות הקרקעית - IDF	None	None	2024-10-19 12:00:01	IDF
il	https://www.davar1.co.il/550504/	מחבלים חדרו לישראל ליד ים המלח, 2 חיילי צה"ל נפצעו קל ובינוני בחילופי האש - דבר	תצפיתניות זיהו דמויות חשודות סמוך למושב נאות הכיכר, כוחות הוקפצו | 2 מחבלים חוסלו מטרים בודדים מגדר הגבול, נמשכות סריקות בשל חשד להימצאות מחבל נוסף | צבא ירדן: מי שחדרו אינם חיילים ירדנים	https://static.davar1.co.il/www/uploads/2024/10/neothakikar.jpeg	2024-10-18 10:52:00	דבר
il	https://www.ynet.co.il/news/article/bjg9enee1x	חקירה בבלגיה נגד חייל שלחם בעזה, החשד: "צלף שמעורב בהוצאה להורג של אזרחים" - ynet ידיעות אחרונות	לאחר חקירה עצמאית של עיתונאי פלסטיני שטען כי חיילים ביחידת רפאים יורים באזרחים לא חמושים, נפתחה בבלגיה חקירה בגין פשעי מלחמה נגד חייל בעל אזרחות ישראלית-בלגית. גורמים מדיניים: "ישראל עוקבת ומטפלת"	https://ynet-pic1.yit.co.il/picserver5/crop_images/2024/10/18/rJQLs40JgJl/rJQLs40JgJl_0_130_1601_901_0_large.jpg	2024-10-18 21:48:51	ynet ידיעות אחרונות
il	https://www.calcalist.co.il/world_news/article/s1sevywg1x	דוח: החלום האמריקאי עולה מיליון דולר יותר ממה שרוב האמריקאים ירוויחו בחייהם - כלכליסט	לפי חישוב שערך אתר המדיה הפיננסית Investopedia, החלום האמריקאי הקלאסי שכולל בית בפרברים, שני ילדים ומכונית בחניה עולה כיום 4.4 מיליון דולר, בעוד שאפילו לעשירון העליון של משקי הבית בארה"ב יש שווי חציוני של כ-3.8 מיליון דולר בלבד 	https://pic1.calcalist.co.il/picserver3/crop_images/2024/10/19/HkeNtkWlJe/HkeNtkWlJe_127_55_671_378_0_large.jpg	2024-10-19 08:49:00	כלכליסט
il	https://www.sport5.co.il/articles.aspx?FolderID=378&docID=486324	ידבר? "איש המפתח" בפרשת אמבפה נחשף - ספורט 5	None	None	2024-10-19 12:44:54	ספורט 5
il	https://www.mako.co.il/entertainment-celebs/local-2024/Article-a53091db2d4a291026.htm	הדר קרקו-בורנשטיין חושפת את השם של בנה השני - mako	None	None	2024-10-19 15:00:00	mako
il	https://www.themarker.com/weekend/2024-10-18/ty-article-magazine/.premium/00000192-8f86-d0b6-a5d6-df96bed30000	"חזרנו 20 שנה אחורה. אתה נוסע בכביש ולא רואה ניידות" - TheMarker	***	https://img.haarets.co.il/bs/00000192-8f86-d0b6-a5d6-df96bed30000/b1/2b/4dda15944e648676775afdae14a0/58869139.JPG?&width=1200&height=630&cmsprod	2024-10-18 03:06:00	TheMarker
il	https://www.mako.co.il/news-military/036814c74a0e1910/Article-afda28f93d5a291026.htm	N12 - צה"ל פרסם סרטונים של סינוואר מהלילה שלפני הטבח - mako	None	None	2024-10-19 17:41:00	mako
il	https://www.ynet.co.il/news/article/hk1ttd11l1x	מת מפצעיו ישי גרינבאום, שנפצע קשה בדרום לבנון: "העולם הפסיד" - ynet ידיעות אחרונות	ישי (נתנאל) גרינבאום, שבאזרחות טיפל בנפגעי טראומה לוחמים, נפצע קשה בדרום לבנון ב-9 באוקטובר - והוא החלל ה-748 מפרוץ המלחמה. רעייתו הדס: "הלב שבור ומנופץ לרסיסים". בחודש מרץ פרסם פוסט ארוך על 150 ימי מילואים: "כסמל חילקתי הוראות, כעובד סוציאלי זיהיתי מי נפגע חרדה"	https://ynet-pic1.yit.co.il/picserver5/crop_images/2024/10/19/HJOD7tbg1l/HJOD7tbg1l_0_150_1280_721_0_large.jpg	2024-10-19 19:06:50	ynet ידיעות אחרונות
il	https://www.makorrishon.co.il/news/791596/	שני לוחמים נפלו בקרב בצפון רצועת עזה | נפטר מפצעיו לוחם שנפצע בדרום לבנון - Makor Rishon	None	None	2024-10-19 17:00:42	Makor Rishon
il	https://www.ynet.co.il/news/article/b1jfr00blkx	זו החברה האמריקנית שצפויה לאבטח את הסיוע לעזה – וכך נראית התוכנית שלה - ynet ידיעות אחרונות	הקבינט ידון בהצעה של חברת GDC ל"בועות הומניטריות" ברצועה: יוצאי יחידות עילית מארה"ב ובריטניה אמורים לאבטח את השיירות ההומניטריות לשכונות שצה"ל יטהר. עוד ידונו השרים בתגובה לכטב"ם חיזבאללה ששוגר לבית נתניהו ובתקיפה באיראן. גורם ישראלי: "לא צפויה בינתיים פריצת דרך לעסקת חטופים"	https://ynet-pic1.yit.co.il/picserver5/crop_images/2024/10/14/SygQAcnqJyg/SygQAcnqJyg_0_0_1601_901_0_large.jpg	2024-10-19 19:42:59	ynet ידיעות אחרונות
il	https://www.themarker.com/captain-internet/2024-10-19/ty-article/.premium/00000192-a591-d1be-abbe-e5bb41ed0000	טיקטוק חסמה חשבון שהפיץ ידיעה שקרית על חילוץ חטופים - TheMarker	***	https://img.haarets.co.il/bs/00000192-a591-d1be-abbe-e5bb41ed0000/81/36/fa8890ee418f9beb293b43ebc033/gaqpvwoweaa-d1s.jpg?precrop=1179,685,x0,y0&width=1200&height=630&cmsprod	2024-10-19 16:29:00	TheMarker
il	https://www.mako.co.il/news-israel/2024_q4/Article-3b7e1b864f4a291027.htm	N12 - הרוג במטח לעכו, שיגור כטב"ם לבית נתניהו בקיסריה | חדשות... - mako	None	None	2024-10-19 15:39:00	mako
il	https://www.ynet.co.il/news/article/rkon3dbl1l	מצ"ח חוקרת מוות של עצור חיזבאללה בעת שהיה בידי צה"ל בלבנון - ynet ידיעות אחרונות	המשטרה הצבאית פתחה בחקירה פלילית לבירור נסיבות מותו של עצור חיזבאללה, שהיה תחת משמורת של צה"ל בשטח לבנון	https://ynet-pic1.yit.co.il/picserver5/crop_images/2024/10/19/SyuyiDWe1x/SyuyiDWe1x_0_78_1280_721_0_large.jpg	2024-10-19 18:37:38	ynet ידיעות אחרונות
il	https://news.walla.co.il/item/3698776	מחאת מטה משפחות החטופים: "למנף את ההישג הצבאי של חיסולו של סינוואר להישג מדיני" - וואלה! חדשות	שבועות חלפו מאז העצרת האחרונה והערב היא חזרה לכיכר החטופים בת''א. ההפגנה קראה להנהגת המדינה למנף את חיסול יחיא סינוואר לחידוש המשא ומתן לעסקת חטופים. באירוע נאמו אלי שתיוי, אביו של עידן שתיוי, שנחטף לעזה ולאחר שנה נודע כי נרצח ב-7.10	https://images.wcdn.co.il/f_auto,q_auto,w_1200,t_54/3/7/8/4/3784017-46.jpg	2024-10-19 09:24:00	וואלה! חדשות
il	https://www.ice.co.il/finance/news/article/1034449	מנכ"ל החברה הישראלית בהצעה מטורפת: מי יוכל לקבל 100,000 דולר? - אייס	בסרטון מיוחד מבטיח דניאל בירנבאום, מנכ"ל סודה סטרים לשעבר: "לפני מספר ימים הציע בנימין נתניהו מעבר חופשי והגנה לכל מי שיחזיר חטוף לישראל. אני רוצה להוסיף להצעה תגמול כספי, כל מי שיחזיר לישראל חטוף ישראלי חי - יקבל מאה אלף דולר, שישולמו במזומן או בביטקוין"	https://img.ice.co.il/giflib/news/F160328MA57.jpg	2024-10-19 18:18:00	אייס
il	https://www.ynet.co.il/news/article/ryyh00qbl1g	יועץ למנהיג אל-קאעידה קורא לחמאס לשחרר את החטופים - ynet ידיעות אחרונות	אחרי חיסול סינוואר, מוסטפה חמיד - שמקורב למנהיג הנוכחי של אל-קאעידה - אמר שהמשך החזקת החטופים הישראלים גורם נזק לתושבי רצועת עזה, ולכן חמאס צריך "לשחרר אותם מיד". לדבריו העיסוק בגורל החטופים גדול בהרבה מהעניין באסירים הפלסטינים שכלואים בישראל: "לאף אחד לא אכפת מהם"	https://ynet-pic1.yit.co.il/picserver5/crop_images/2024/10/17/rJd8BJJl1e/rJd8BJJl1e_0_0_1179_664_0_large.jpg	2024-10-19 15:07:07	ynet ידיעות אחרונות
il	https://news.google.com/rss/articles/CBMiSEFVX3lxTE1qOGlVWkluTzMxeUhOb0VzSzlDSFJmQTNxRXRFZzVkdEo0d3lKMFdZM1hSVW95MHBSUXh6bW1RN01DVFF1WTNWUQ?oc=5	יאיר גולן השתלח, עמית סגל לא נשאר חייב - ערוץ 7	None	None	2024-10-19 17:52:00	ערוץ 7
il	https://www.inn.co.il/news/651156	דקות לפני קצירת איבריו: המת התעורר לחיים - ערוץ 7	None	None	2024-10-19 19:38:00	ערוץ 7
il	https://www.inn.co.il/news/651154	פרופסור יהודה באואר, מגדולי חוקרי השואה בעולם הלך לעולמו בגיל 98 - ערוץ 7	None	None	2024-10-19 16:14:00	ערוץ 7
il	https://news.google.com/rss/articles/CBMiXkFVX3lxTFBMdWpkZnJLSWRXcTIwTXd3aTI0bW44TDdnVldDMGZUU0ZZMDc3TE5DWFJVUzFGZTJJdjlzaGl4b2NDay0zQ0hIenRGa3kzN2Z3N3VRTWVmY0RFMjZnSnc?oc=5	כתב אישום מטלטל: צמד האחים שתקפו מערכות בישראל במהלך טבח ה-7.10 | כל הפרטים - מעריב און ליין	כתב אישום הוגש בארצות הברית נגד צמד אחים סודנים, שהובילו מתקפות סייבר נרחבות נגד ישראל, כולל ביום הטבח הרצחני שאירע בחודש אוקטובר אשתקד	https://images.maariv.co.il/image/upload/f_auto,fl_lossy/c_fill,g_faces:center,w_1200/917360	2024-10-18 19:45:17	מעריב און ליין
il	https://www.inn.co.il/news/651151	בגלל האנטישמיות: צניחה דרמטית בתרומות להרווארד - ערוץ 7	None	None	2024-10-19 16:06:00	ערוץ 7
il	https://sports.walla.co.il/item/3698685	מכבי תל אביב ניצחה את מכבי חיפה 0:2 במשחק העונה הראשון - וואלה! ספורט	הצהובים חגגו במשחק הבית בטדי: קניקובסקי ניצל טעות גדולה של מוחמד כדי לכבוש שער יפהפה בבעיטה לחיבורים (18), מדמון הכפיל מקרוב (23), דוידה החמיץ פנדל (59)	https://images.wcdn.co.il/f_auto,q_auto,w_1200,t_54/3/7/8/6/3786973-46.jpg	2024-10-19 09:29:00	וואלה! ספורט
il	https://www.mako.co.il/news-military/036814c74a0e1910/Article-1e4dbd840dc9291026.htm	N12 - ריאיון עם אנדראה טננטי, דובר יוניפי"ל - mako	None	None	2024-10-18 15:10:00	mako
il	https://news.google.com/rss/articles/CBMiS0FVX3lxTE11Zm9yN2FpcVNTbGxGRGRwdThFeU1OR0tEbXpJNnJ5VjAzWHljWlV1M2RWUU0xTG1PdGlHZWpTUlBCRE1aMHlQZnBzZw?oc=5	פעילים זוטרים מנהיגים את חיזבאללה, שהשתפר בשיגור כטב"מים - בחדרי חרדים	None	None	2024-10-19 16:50:00	בחדרי חרדים
il	https://www.inn.co.il/news/651172	השחקן מאור שוויצר: "אני מניח תפילין, אבל לא ממקום דתי" - ערוץ 7	None	None	2024-10-19 20:22:00	ערוץ 7
il	https://www.idf.il/%D7%90%D7%AA%D7%A8%D7%99-%D7%99%D7%97%D7%99%D7%93%D7%95%D7%AA/%D7%99%D7%95%D7%9E%D7%9F-%D7%94%D7%9E%D7%9C%D7%97%D7%9E%D7%94/%D7%9B%D7%9C-%D7%94%D7%9B%D7%AA%D7%91%D7%95%D7%AA/%D7%94%D7%A4%D7%A6%D7%95%D7%AA/188-%D7%94%D7%A9%D7%9E%D7%99%D7%93%D7%95-%D7%9E%D7%A4%D7%A7%D7%93%D7%94-%D7%9E%D7%A8%D7%9B%D7%96%D7%99%D7%AA-%D7%AA%D7%AA-%D7%A7%D7%A8%D7%A7%D7%A2%D7%99%D7%AA-%D7%A9%D7%9C-%D7%97%D7%99%D7%96%D7%91%D7%90%D7%9C%D7%9C%D7%94-%D7%AA%D7%99%D7%A2%D7%95%D7%93/	לצד עשרות אמצעי לחימה שנתפסו והושמדו: 188 השמידו מפקדה מרכזית תת-קרקעית של חיזבאללה - IDF	None	None	2024-10-18 11:10:02	IDF
il	https://www.mivzaklive.co.il/archives/857337	צה"ל בודק את נסיבות האירוע בו נהרגו 5 חיילי סיירת גולני בלבנון - חדשות מבזק לייב - MivzakLive	בהתקלות שאירעה בים רביעי בין חיילי סיירת גולני שסרקו מבנה של כמה קומות בדרום לבנון, לבין ארבעה מחבלי חיזבאללה שהסתתרו באחת הקומות ובשלב מסוים הפתיעו אותם ופתחו עליהם באש, נהרגו חמישה חיילי הסיירת…	https://i0.wp.com/www.mivzaklive.co.il/wp-content/uploads/2024/10/-בכר-זל-e1729233846446.webp?fit=156%2C129&ssl=1	2024-10-18 06:49:26	חדשות מבזק לייב - MivzakLive
il	https://www.srugim.co.il/1051609-%D7%A0%D7%A4%D7%AA%D7%9C%D7%99-%D7%91%D7%A0%D7%98-%D7%A9%D7%95%D7%91%D7%A8-%D7%A9%D7%AA%D7%99%D7%A7%D7%94-%D7%A2%D7%93-%D7%94%D7%99%D7%95%D7%9D-%D7%A0%D7%9E%D7%A0%D7%A2%D7%AA%D7%99-%D7%9E%D7%9C	נפתלי בנט שובר שתיקה: "עד היום נמנעתי מלדבר על זה" - סרוגים	None	None	2024-10-19 17:56:08	סרוגים
il	https://www.bhol.co.il/news/1676452	איראן הכעיסה את לבנון: "התערבות פנימית מבישה" - בחדרי חרדים	ראש ממשלת לבנון הנחה את שר החוץ של לבנון לזמן את הממונה על שגרירות איראן במדינה, ולברר את דבריו של יו"ר הפרלמנט באיראן מוחמד באקר קאליבאף, שאמר בריאיון כי "טהרן מוכנה לנהל משא ומתן עם פריז בנוגע ליישום החלטה 1701"	https://storage.bhol.co.il/media/lt/1655390/gallery/747759_tumb_1200X627.jpg	2024-10-18 11:26:00	בחדרי חרדים
il	https://www.globes.co.il/news/article.aspx?did=1001492084	עובדי נמל ביוון עצרו אספקת אמל"ח לישראל - גלובס	None	None	2024-10-18 14:04:26	גלובס
il	https://www.calcalist.co.il/local_news/article/rkilxrwgjg	החרם הצרפתי: אסור לממשלה להשאיר שוב את התעשיות הביטחוניות לבדן במערכה - כלכליסט	צרפת מסרבת לאפשר השתתפות של התעשיות הביטחוניות הישראליות בתערוכה בעוד שבועיים. בחרם הקודם הממשלה לא נקפה אצבע. כעת, מוטב ששר החוץ ישראל כ"ץ ייכנס לאירוע, גם אם הדבר כרוך בהזנחת ההובי שלו ליצור תמונות מקניטות של אויבי ישראל ב־ChatGPT	https://pic1.calcalist.co.il/picserver3/crop_images/2024/10/19/r1uVnXZl1l/r1uVnXZl1l_0_136_787_444_0_large.jpg	2024-10-19 14:31:00	כלכליסט
il	https://www.ice.co.il/social/news/article/1034358	"שקע בהרס עצמי": הסיבות למוות של הזמר בן ה-31 נחשפות - אייס	בשעות שלפני מותו, דווח כי ליאם פיין התפרע בלובי המלון, ניפץ את המחשב הנייד שלו ונגרר חזרה לחדרו. הזמר בן ה-31 נאבק במשך שנים עם התמכרות לאלכוהול וסמים, אך מעולם לא חשף את מלוא היקף הבעיה. "הוא היה כלוא במעגל של הרס עצמי," אמר אחד המקורבים, "השדים שלו היו גדולים יותר ממה שהוא אי פעם הודה בפומבי"	https://img.ice.co.il/giflib/news/ליאם פיין.JPG	2024-10-18 03:29:00	אייס