country_code	url	title	description	image_url	publish_date	source
il	https://13tv.co.il/item/news/domestic/internal/nlqu1-904298766/	"הוא ירה באמא, אולי גם אחותנו מתה": הקלטות ילדי משפחת עידן - ערוץ 13	ב-7 באוקטובר 2023, ב-7:07 בבוקר, התקבלה שיחה במוקד משטרת ישראל. על הקו - מיכאל ועמליה עידן, שבמשפטם הראשון אמרו באומץ: "אנחנו ילדים - אבל זה בגלל שההורים שלנו מתו". זאת, בזמן שהם מתחבאים בארון הממ"ד, צופים באביהם רועי נרצח, בגופת אימם סמדר מוטלת לידם - וללא ידיעה מה עלה בגורל אחותם הקטנה אביגיל, שנחטפה לעזה. הגבורה והתושיה אינסופית של שני ילדים צעירים, מול כאוס מוחלט של המערכת	https://media.reshet.tv/image/upload/t_og_image/v1729013687/uploads/2024/904298801.jpg	2024-10-15 00:00:00	ערוץ 13
il	https://www.mako.co.il/travel-israel/Article-c11e8c78ac98291026.htm	ממש לא בתל אביב: הרחוב הזה הפך להיות אחד המבוקשים בארץ - mako	None	None	2024-10-16 02:44:02	mako
il	https://www.ice.co.il/financial-gossip/news/article/1034176	רוני מאנה חגג בחתונת איש התקשורת וחשף בטעות סודות מהברנז'ה - אייס	<p>איש העסקים רוני מאנה, חגג הלילה בחתונת בתו של איש התקשורת ודובר צה"ל לשעבר, אבי בניהו. החתונה, שזימנה אליה עיתונאים ואנשי תקשורת רבים, סיפקה הצצה לכמה מהסודות של הברנז'ה - כולל מפגש מעניין של מאנה עם המיליונר המקורב לנתניהו - בדיוק כפי שהוא היה</p>	https://img.ice.co.il/giflib/news/13262407050224154.jpg	2024-10-16 08:57:11	אייס
il	https://www.maariv.co.il/news/military/article-1140650	"החברים הכי טובים של חיזבאללה": ה"וול סטריט ג'ורנל" במאמר חסר תקדים נגד האו"ם ובעד ישראל - מעריב און ליין	"נראה שיוניפי"ל סוף סוף מצא את ייעודו: לעמוד בדרכה של ישראל", נכתב במאמר מערכת של אחד מכלי התקשורת הגדולים בעולם, תחת הכותרת "שומרי השלום של או"ם הם החברים הכי טובים של חיזבאללה"	https://images.maariv.co.il/image/upload/f_auto,fl_lossy/c_fill,g_faces:center,w_1200/938207	2024-10-16 09:09:58	מעריב און ליין
il	https://www.srugim.co.il/1051128-%D7%94%D7%A4%D7%95%D7%A8-%D7%A0%D7%A4%D7%9C-%D7%9B%D7%9A-%D7%AA%D7%99%D7%A8%D7%90%D7%94-%D7%94%D7%AA%D7%A7%D7%99%D7%A4%D7%94-%D7%A9%D7%9C-%D7%99%D7%A9%D7%A8%D7%90%D7%9C-%D7%91%D7%90%D7%99%D7%A8%D7%90	הפור נפל: כך תיראה התקיפה של ישראל באיראן - סרוגים	None	None	2024-10-16 06:42:00	סרוגים
il	https://www.globes.co.il/news/article.aspx?did=1001492058	מקרון נגד ישראל: צרפת שוב הרחיקה את ישראל מתערוכת נשק יוקרתית - גלובס	None	None	2024-10-16 04:56:13	גלובס
il	https://www.bhol.co.il/news/1676320	יואב אגמון הי"ד הובא למנוחות: "גדלת ועמדת בכל מה שהצבת לעצמך" - בחדרי חרדים	יואב אגמון, שנפל בבא"ח גולני מפגיעת הכטב"ם של חיזבאללה, הובא היום למנוחות. אביו ספד: "בחרת גולני. אמרת שאם כבר חי"ר אז הכי טוב. שמחנו שזה מה שבחרת"	https://storage.bhol.co.il/media/Storage/748318_tumb_1200X627.jpg	2024-10-15 14:50:00	בחדרי חרדים
il	https://www.mako.co.il/news-entertainment/2024_q4/Article-bf613cb86849291026.htm	N12 - בעקבות המצב הביטחוני: הופעתה של נועה קירל בפארק הירקון... - mako	None	None	2024-10-16 09:05:00	mako
il	https://www.inn.co.il/news/651016	צפו בתיעוד: מסתערבי מג"ב מחסלים מחבל חמוש שתכנן לבצע פיגוע לפני החג - ערוץ 7	None	None	2024-10-16 06:56:00	ערוץ 7
il	https://www.davar1.co.il/550064/	גבר בן 38 נעצר בנתב"ג: רשות המסים סיכלה ניסיון הברחת סמים מארצות הברית - דבר	נוסע אמריקאי שהגיע בטיסת אל על מניו יורק, עורר את חשדם של כלבני יחידת מטה הסמים | לאחר שנחשפו החומרים המסוכנים ברשותו, הנוסע הועבר להמשך טיפול במשטרה, והועבר לביקורת הגבולות לצורך גירושו מהארץ	https://static.davar1.co.il/www/uploads/2024/10/WhatsApp-Image-2024-10-16-at-11.20.10.jpeg	2024-10-16 12:07:00	דבר
il	https://www.kan.org.il/content/kan-news/opinions/812716/	טור דעה | מה עומד מאחורי התנהלות איראן והופעת קאאני בטהראן? - כאן | תאגיד השידור הישראלי	None	None	2024-10-15 07:16:57	כאן | תאגיד השידור הישראלי
il	https://www.mako.co.il/news-israel/2024_q4/Article-bdf7ed8f8909291026.htm	N12 - שנה לאחר תחקיר חדשות 12: העסק הלא חוקי של יו"ר סניף... - mako	None	None	2024-10-15 17:47:00	mako
il	https://www.ynet.co.il/economy/article/s1cl00rfrr	על אובדן הדרך הלאומית ועזיבת הארץ | טור - ynet ידיעות אחרונות	בשנתיים האחרונות ההפיכה המשפטית וזוועות ה-7 באוקטובר גרמו ליותר ישראלים לחפש אלטרנטיבות בחו"ל. הבעיה: למרות שיש הטוענים שאפשר להסתדר בלעדיהם, הרופאים שמחזיקים את מערכת הבריאות, עובדי ההייטק שאחראים על 50% מהיצוא והסגל הבכיר באוניברסיטאות שמכשיר אותם - מונים פחות מ-300 אלף איש. מספיק שרק חלק מהם יעזבו וספירלת הקריסה תחל 	https://ynet-pic1.yit.co.il/picserver5/crop_images/2020/02/11/9778447/9778447_0_0_1300_731_0_large.jpg	2024-10-16 04:19:29	ynet ידיעות אחרונות
il	https://www.mako.co.il/news-military/036814c74a0e1910/Article-18f9ac51f819291026.htm	N12 - מתקרבים לתקיפה באיראן: הצבא הציג תמהיל מטרות - mako	רה"מ, שר הביטחון והרמטכ"ל קיימו דיון ביטחוני שעסק בתקיפה אפשרית של ישראל בשטח איראן • הצבא שרטט בפני הדרג המדיני תרחישי תגובה שונים וסוללת "טאד" אמריקנית תוצב להגנה נוספת • תיאומים רגישים מול מדינות באזור	https://img.mako.co.il/2024/08/13/bitachon_autoOrient_i.jpg	2024-10-15 20:16:00	mako
il	https://www.mako.co.il/news-sport/world_soccer-2024_q4/Article-94e6333cfe39291027.htm	N12 - פנה לאלכוהול? כיצד אמבפה מתמודד עם המצב - mako	None	None	2024-10-16 06:29:30	mako
il	https://www.mako.co.il/news-israel/2024_q4/Article-c86771140c49291027.htm	N12 - היועמ"שית: "הממשלה לא רשאית לסבסד לימודי חרדים שלא... - mako	None	None	2024-10-16 11:10:00	mako
il	https://www.maariv.co.il/news/military/Article-1140682	כך השפילה ישראל את חיזבאללה: פרטים חדשים על מתקפת הביפרים - מעריב און ליין	סוכנות הידיעות רויטרס חשפה פרטים חדשים על מתקפת הביפרים, המיוחסת למוסד: חומרי הנפץ שהוחדרו למכשירים הוסוו באמצעות פלסטיק על מנת שלא יזוהו בשיקוף וכן נבנתה היסטוריית מכירה פיקטיבית למוצרים באינטרנט	https://images.maariv.co.il/image/upload/f_auto,fl_lossy/c_fill,g_faces:center,w_1200/933639	2024-10-16 12:45:21	מעריב און ליין
il	https://news.walla.co.il/item/3698344	שר החוץ האמריקני בלינקן שוקל להציג תוך שבועות תכנית ל"יום שאחרי" בעזה - וואלה! חדשות	בכירים אמריקנים אומרים כי התכנית תהיה מבוססת על הצעות שגובשו ע"י ישראל ואיחוד האמירויות. בלינקן סבור שבשעה שעסקת החטופים והפסקת האש בעזה תקועה, התוכנית ליום שאחרי היא "Plan B" אפשרי שיכול להתחיל לסמן נתיב ליציאה מהמלחמה	https://images.wcdn.co.il/f_auto,q_auto,w_1200,t_54/3/7/2/5/3725781-46.jpg	2024-10-16 00:30:00	וואלה! חדשות
il	https://www.ynet.co.il/news/article/hyiozp31ye	צה"ל: שני כטב"מים חצו מלבנון לאצבע הגליל, זוהו נפילות באזור - ynet ידיעות אחרונות		https://www.ynet.co.il/images/big_defual_image_1024_new.png	2024-10-15 21:46:22	ynet ידיעות אחרונות
il	https://www.maariv.co.il/news/world/Article-1140615	זו הכלכלה, טמבל: התחזית השחורה של המשקיעים בלבנון לחיזבאללה | עמית יגור - מעריב און ליין	המשקיעים מביטים קדימה ולראשונה מביעים באמצעות השקעותיהם תקווה להיחלשות דרמטית של האחיזה של חזבאללה ואיראן בלבנון. לבנון היא נייר הלקמוס של המציאות האזורית החדשה	https://images.maariv.co.il/image/upload/f_auto,fl_lossy/c_fill,g_faces:center,w_1200/938951	2024-10-16 06:32:37	מעריב און ליין
il	https://www.ynet.co.il/news/article/h1l897akjx	4 פצועים קל ופגיעה ישירה במג'ד אל-כרום: "אין מקלטים, לא מוכנים פה למלחמה" - ynet ידיעות אחרונות	מטח כבד שנורה מלבנון לאזור כרמיאל הוביל להרס רב ביישוב. "קרה פה נס", אמר עלי נאסר, תושב היישוב. עיסאם שמתגורר גם הוא במג'ד אל-כרום מחה על היעדר המרחבים המוגנים: "אנחנו לא מוכנים כמו במגזר היהודי. נכנסו 100 אנשים למקלט אחד"	https://ynet-pic1.yit.co.il/picserver5/crop_images/2024/10/16/r1g00ADQpyyx/r1g00ADQpyyx_0_0_1280_720_0_large.jpg	2024-10-16 12:33:29	ynet ידיעות אחרונות
il	https://www.mako.co.il/news-politics/2024_q4/Article-6914bb07b749291027.htm	"נערכים להתיישבות בעזה": ההזמנה ששלחה מאי גולן לחברי הליכוד ולשרים - mako	None	None	2024-10-16 09:10:00	mako
il	https://www.mako.co.il/news-military/036814c74a0e1910/Article-090c52264f49291026.htm	לאחר האיום של ארה"ב שנחשף ב-N12: עשרות משאיות סיוע הומניטרי הועברו לצפון הרצועה - mako	None	None	2024-10-16 10:52:00	mako
il	https://www.srugim.co.il/1051160-%D7%A6%D7%A8%D7%A4%D7%AA-%D7%9E%D7%AA%D7%93%D7%A8%D7%93%D7%A8%D7%AA-%D7%A2%D7%95%D7%93-%D7%90%D7%99%D7%A1%D7%95%D7%A8-%D7%94%D7%95%D7%98%D7%9C-%D7%A2%D7%9C-%D7%99%D7%A9%D7%A8%D7%90%D7%9C	צרפת מתדרדרת: עוד איסור הוטל על ישראל - סרוגים	None	https://www.srugim.co.il/i/wp-content/uploads/2024/10/shutterstock_2409931519-scaled__w600h400q80.jpg	2024-10-16 09:09:39	סרוגים
il	https://www.inn.co.il/news/650993	תושבת עוטף עזה זעקה מדם ליבה בוועדת הכנסת: כך לא נלחמים כדי לנצח, איפה המדינה? - ערוץ 7	None	None	2024-10-15 20:10:00	ערוץ 7
il	https://www.bhol.co.il/news/1676366	סמוטריץ': "קורא בכאב את דברי חברי החרדים, דוחה האולטימטום" - בחדרי חרדים	סמוטריץ' גינה את דרעי וגולדקנופף על דברים שאמרו בריאיונות חג בנושא חוק הגיוס ודחה את האולטימטום: "קורא בכאב שמפלח את הלב את דברי כמה מחברי הסיעות החרדיות בעניין השירות בצה"ל. דוחה גם בכל תוקף ניסיונות להציב אולטימטום לאישור תקציב המדינה"	https://storage.bhol.co.il/media/lt/1475339/gallery/314727_tumb_1200X627.jpg	2024-10-16 10:53:00	בחדרי חרדים
il	https://www.maariv.co.il/news/military/blog-1140584	אחראי על מתווי טרור רבים: מפקד חיזבאללה חוסל בלבנון - מעריב און ליין	 מטוסי קרב תקפו עשרות מטרות טרור של ארגון הטרור חיזבאללה במרחב נבטיה. כוחות אוגדה 91 פשטו על מערכת פירים ותשתיות תת-קרקעיות שנועדו לשמש את יחידת "רדואן"	https://images.maariv.co.il/image/upload/f_auto,fl_lossy/c_fill,g_faces:center,h_407,w_690/939105	2024-10-16 14:44:00	מעריב און ליין
il	https://www.bhol.co.il/news/1676338	איראן פועלת להעביר אמצעי לחימה לחיזבאללה, ותושב טהרן שמבקש שנתקוף את המשטר - בחדרי חרדים	איראן פועלת להעביר אמצעי לחימה לחיזבאללה ולתמוך בפעילות הארגון נגד ישראל. הסיוע מתבטא בין היתר בניסיונות להעביר אמצעי לחימה לארגון. אזרח איראני מבקש מישראל לא לתקוף תשתיות אזרחיות אלא להתמקד בתשתיות צבאיות ושל משמרות המהפכה	https://storage.bhol.co.il/media/Storage/698654_tumb_1200X627.jpg	2024-10-15 18:44:00	בחדרי חרדים
il	https://www.davar1.co.il/549866/	ראש ממשלת לבנון: "השגנו ערבויות אמריקניות לצמצום ההסלמה הישראלית בביירות" - דבר	לצד ההכחשות בישראל על הפחתת התקיפות של צה"ל בבירה הלבנונית, ראש ממשלת לבנון אמר לרשת 'אל ג'זירה' כי בלבנון פועלים להשיג הפסקת אש ויישום החלטה 1701	https://static.davar1.co.il/www/uploads/2024/10/AP111130013654.jpg	2024-10-15 14:02:00	דבר
il	https://www.calcalist.co.il/local_news/article/byzyzrtyje	לופטהנזה נקנסה ב-4 מיליון דולר בשל אפליית נוסעים חרדים - כלכליסט	משרד התחבורה האמריקאי הטיל את הקנס על חברת התעופה הגרמנית לאחר שבמאי 2022 אסרה על 128 נוסעים חרדים לעלות למטוס ובשל כך הם איחרו לטיסת קישור	https://pic1.calcalist.co.il/picserver3/crop_images/2022/01/15/S10WUNg6Y/S10WUNg6Y_0_0_2001_1126_0_large.jpg	2024-10-16 14:43:00	כלכליסט
il	https://www.sport5.co.il/articles.aspx?FolderID=405&docID=486107	סייבר לי: מכבי ת"א מצאה את המושיע שלה - ספורט 5	None	None	2024-10-16 03:37:42	ספורט 5
il	https://news.google.com/rss/articles/CBMiWkFVX3lxTE1wNkJBb01OTEhkTFhWamgwMElVNEF2X2ZZNU5qdVFKYjlQbjRyWjlhMDduVlFxLTZJbnJzWk0xV1AzSFU2UXJHaUZaRmxQY2lNTkxHeVRPZ0xSZw?oc=5	ראש ממשלת בריטניה: בוחנים סנקציות על סמוטריץ' ובן גביר - ynet ידיעות אחרונות	קיר סטארמר, מנהיג הלייבור, אמר כי אמירותיהם של שר האוצר והשר לביטחון לאומי בנוגע להתנהגות כלפי תושבי עזה "מתועבות". בן גביר: "בוז לספר הלבן". סמוטריץ': "המנדט הסתיים"	https://ynet-pic1.yit.co.il/picserver5/crop_images/2022/10/19/S111KWqTQj/S111KWqTQj_0_29_3000_1689_0_large.jpg	2024-10-16 13:14:32	ynet ידיעות אחרונות
il	https://www.idf.il/%D7%90%D7%AA%D7%A8%D7%99-%D7%99%D7%97%D7%99%D7%93%D7%95%D7%AA/%D7%99%D7%95%D7%9E%D7%9F-%D7%94%D7%9E%D7%9C%D7%97%D7%9E%D7%94/%D7%9B%D7%9C-%D7%94%D7%9B%D7%AA%D7%91%D7%95%D7%AA/%D7%94%D7%A4%D7%A6%D7%95%D7%AA/%D7%A4%D7%A2%D7%99%D7%9C%D7%95%D7%AA-%D7%A6%D7%95%D7%95%D7%AA-%D7%94%D7%A7%D7%A8%D7%91-%D7%94%D7%97%D7%98%D7%99%D7%91%D7%AA%D7%99-%D7%A9%D7%9C-%D7%92%D7%95%D7%9C%D7%A0%D7%99-%D7%91%D7%99%D7%9E%D7%9E%D7%94-%D7%94%D7%90%D7%97%D7%A8%D7%95%D7%A0%D7%94-%D7%91%D7%93%D7%A8%D7%95%D7%9D-%D7%9C%D7%91%D7%A0%D7%95%D7%9F/	חיסול מחבלים, חשיפת פירים ואיתור מחסני אמל"ח: הצצה לפעילות צק"ח גולני ביממה האחרונה בדרום לבנון - IDF	None	None	2024-10-16 12:25:12	IDF
il	https://news.google.com/rss/articles/CBMipAFBVV95cUxNYVhfTHp0eURfRndqa3lVTGZXQ1dFbFMxbDFKMlJ4ZWE2Y0h5eWk5YWpQWlRVZDUzNmFqSXRPVVdfdGtFWmNFenlDQS1yU293QUNibUtfa1JoTTBNa283NnJPR1BHc2tkMWZrc0lRdllObXljOFdtOC13c1M5UGZCeTFfUXJNS2lLckFwNE1WMVoyOU12Qkh4NE5NSW1aQVBoX3Z5Mg?oc=5	תושב פתח תקווה מואשם שגויס על ידי איראן להתנקש במדען ישראלי - הארץ	הארץ	https://img.haarets.co.il/bs/00000192-93f4-dbf3-a1be-dfff26690000/98/e6/1c30ed8243ad88c99917b95929a8/815526.jpg?precrop=2326,1352,x0,y199&width=1200&height=630&cmsprod	2024-10-16 07:00:00	הארץ
il	https://www.inn.co.il/news/651038	התשובה של סמוטריץ' לאיומי החרדים - ערוץ 7	None	None	2024-10-16 10:51:00	ערוץ 7
il	https://www.ynet.co.il/news/article/sj6bsmhjkg	בן הזוג של השוטר, בהספד קורע לב: "הבטחתי לך ילדים, הטבעת לא תרד ממני לעולם" - ynet ידיעות אחרונות	בהלוויית רס"ב אדיר קדוש, שנורה למוות בפיגוע, ספד לו בן זוגו אדי, שעימו היה אמור להתחתן בחודש הבא: "היית אומר לי - 'אני אמות גיבור'. מה אעשה עכשיו?". אמו של אדיר הבטיחה לאדי: "אתה תהיה איתי, אתה הבן שלי". אחיו, שחגג יום הולדת היום: "היית גיבור, והלכת גיבור". בן גביר: "פעלת ולא היססת"	https://ynet-pic1.yit.co.il/picserver5/crop_images/2024/10/15/rJ800DcX3kyg/rJ800DcX3kyg_0_75_1280_721_0_large.jpg	2024-10-15 18:01:46	ynet ידיעות אחרונות
il	https://www.ynet.co.il/news/article/b1qfjh21kl	צה"ל מאשר שתקף בדאחייה: "הופצץ אמל"ח אסטרטגי במחסן תת-קרקעי" - ynet ידיעות אחרונות		https://www.ynet.co.il/images/big_defual_image_1024_new.png	2024-10-16 04:46:00	ynet ידיעות אחרונות
il	https://www.inn.co.il/news/651045	צפו: פעילות גולני ביממה האחרונה בדרום לבנון - ערוץ 7	None	None	2024-10-16 12:29:00	ערוץ 7
il	https://www.calcalist.co.il/market/article/bjm00gqak1e	אל על מציעה לרכוש את ישראכרט לפי שווי של 3.1 מיליארד שקל - כלכליסט	לפי ההצעה, חברת התעופה תחזיק לאחר הרכישה ב-45% ממניות חברת כרטיסי האשראי הגדולה ביותר בישראל; היא מגיעה מספר ימים לאחר הצעה דומה של מנורה מבטחים; אל על: "ההצעה יוצרת לישראכרט גרעין שליטה משמעותי ויציב"	https://pic1.calcalist.co.il/picserver3/crop_images/2023/01/10/B1oQDyjqo/B1oQDyjqo_0_116_2000_1126_0_large.jpg	2024-10-16 11:29:00	כלכליסט
il	https://news.google.com/rss/articles/CBMiX0FVX3lxTFAtczhlSi1lckFHUVMzbGVjSE11UVNSdUpRLUdSaVI5aUZFZXVYOFdpOHc2RmdZMHhSQkc5Ynpxa0lINXc5djhUaGc1dGY5N1VYeEdDREZGMWZXV1hqNzNJ?oc=5	ענקית התעופה בבשורה חריגה: מבטלת את הטיסות לישראל עד מרץ 2025 - אייס	None	None	2024-10-16 08:41:00	אייס
il	https://www.ynet.co.il/news/article/skx001i6kkg	כך המכתב החריג מארה"ב עלול לסבך את ישראל בהאג - ynet ידיעות אחרונות	צווי מעצר נגד נתניהו וגלנט - בקרוב? המכתב האמריקני שמאיים באמברגו נשק חשף כי ישראל נאלצה להתחייב במרץ לשנות את מדיניות הסיוע ברצועה, ועלול לשמש נסיבות ראייתיות חזקות לשימוש התובע. אלה הדברים שצריך להוכיח קארים חאן, וכך מסייע לו הפרסום	https://ynet-pic1.yit.co.il/picserver5/crop_images/2024/05/20/Byd300yYQR/Byd300yYQR_0_0_850_479_0_large.jpg	2024-10-16 15:05:55	ynet ידיעות אחרונות
il	https://haifa.mynet.co.il/local_news/article/upuz1g21b	מתעדכן: נפילות במפרץ חיפה 15.10.24 - מיינט חיפה	אזעקות בחיפה ובקריות. נפילה זוהתה בקרית ביאליק. נפגע בניין מגורים משברי ירוט. לא ידוע על נפגעים. צה"ל מדווח על חיסול גורם בכיר בחיזבאללה	https://pic1.yitweb.co.il/picserver/mynet/crop_images/2024/10/15/Syjp8CoJye/Syjp8CoJye_0_0_640_360_0_large.jpg	2024-10-15 13:09:31	מיינט חיפה
il	https://www.maariv.co.il/news/world/Article-1140589	"הפנטזיה של כל האנטישמים": זעם בצרפת על העימות של מקרון עם ישראל - מעריב און ליין	דבריו של נשיא צרפת בישיבת ממשלה סגורה עוררו סערה בקרב הציבור הצרפתי. חברת  פרלמנט פרסמה ביקורת חריפה: "מערערים על הלגיטימיות של מדינת ישראל"	https://images.maariv.co.il/image/upload/f_auto,fl_lossy/c_fill,g_faces:center,w_1200/785911	2024-10-16 04:47:13	מעריב און ליין
il	https://www.haaretz.co.il/opinions/2024-10-15/ty-article-opinion/.premium/00000192-9045-d0b6-a5d6-d357b3360000	אחרי שנה של סוכות - הארץ	הארץ	https://img.haarets.co.il/bs/00000192-9045-d0b6-a5d6-d357b3360000/e6/0c/6b043e814af7a15110e568470d58/627121.jpg?&width=1200&height=630&cmsprod	2024-10-15 17:00:00	הארץ
il	https://www.davar1.co.il/549970/	עדכונים שוטפים / תקיפה על בניין עיריית א-נבטיה בדרום לבנון; שר החוץ של איראן: "נגיב לפעולה ישראלית" - דבר	אזעקות הופעלו באזור רמת דוד בעקבות מטרה חשודה שחצתה לשטח הארץ | אזעקה הופעלה בקיבוץ מפלסים, רקטה אחת מצפון הרצועה יורטה | שלושה גברים ואישה כבני 50 נפצעו מרסיסים במג'ד אל-כרום, אחרי מטח של כ-30 רקטות למרכז הגליל | שני מחסני אמל"ח אותרו בשטח אזרחי בדרום לבנון, עשרות מחבלים הותקפו מהאוויר	https://static.davar1.co.il/www/uploads/2024/10/0a4119f8-0c8f-4436-90da-529105fc0522.jpg	2024-10-15 21:23:00	דבר
il	https://www.themarker.com/podcasts/2024-10-15/ty-article-podcast/00000192-8fea-d9c2-a7f3-8feea1f70000	החדשות הטובות: יש מספיק מיירטים. הרעות: לא יגייסו חרדים גם עוד עשור - TheMarker	***	https://img.haarets.co.il/bs/00000188-0a25-d4b7-a3f9-cb272c340000/da/96/f419e21d4466a325c639248f0d32/29987-2.jpg?precrop=2200,1279,x0,y189&height=630&width=1200	2024-10-15 11:46:00	TheMarker
il	https://www.srugim.co.il/1050665-%D7%94%D7%9E%D7%95%D7%9E%D7%97%D7%94-%D7%9E%D7%A2%D7%A8%D7%99%D7%9A-%D7%96%D7%94-%D7%94%D7%A6%D7%A2%D7%93-%D7%94%D7%91%D7%90-%D7%A9%D7%9C-%D7%97%D7%99%D7%96%D7%91%D7%90%D7%9C%D7%9C%D7%94	המומחה מעריך: זה הצעד הבא של חיזבאללה - סרוגים	None	None	2024-10-15 05:22:09	סרוגים
il	https://www.mako.co.il/news-science/2024_q4/Article-1ddd768f0329291026.htm	N12 - מזג אוויר נוח בחג, ומתי נראה את הגשם? | התחזית - mako	בערב החג תורגש ירידה בטמפרטורות, וייתכנו גשמים בצפון • מגמת ההתקררות תורגש גם בימים הקרובים - ושיאה יהיה ביום שישי • לאחר מכן: הטמפרטורות חוזרות לעלות • התחזית המלאה	https://img.mako.co.il/2024/10/16/F241015DC19_autoOrient_i.jpg	2024-10-16 04:21:00	mako
il	https://www.ynet.co.il/news/article/hyhscghk1x	"18 מתוך 19 העובדים של נתניהו שקרנים": הציטוטים החדשים של ביידן, וחוסר האמון הגובר - ynet ידיעות אחרונות	החשש בממשל האמריקני, המחלוקת על התגובה באיראן והמו"מ לשחרור חטופים. בריאיון ל"וושינגטון פוסט" חשף העיתונאי בוב וודוורד פרטים נוספים על היחסים העכורים בין הנשיא לרה"מ. "ביידן מבין שישראל וארה"ב בנות ברית ודבק בכך אבל החשש שלו מנתניהו לא יכול להיות גדול יותר". בריאיון אחר טען: "כל מהלך לשחרור חטופים הונע על-ידי ארה"ב - בישראל לא הייתה תזוזה"	https://ynet-pic1.yit.co.il/picserver5/crop_images/2024/09/03/ByuHNlr3A/ByuHNlr3A_0_0_850_479_0_large.jpg	2024-10-16 01:25:33	ynet ידיעות אחרונות
il	https://news.google.com/rss/articles/CBMiqwFBVV95cUxQVEVyT1NueVVpMFNzQ3M0Y2NzNWdqdGxKT3A0UkI2S2tGTGJwZmpBVUNvVnFkdXFZOFFfemZNaFdHeWk2ZE9OeEdhZ2s2amJ6NlQ4Um9reDdKSHV3OXp4cS1UWmZxOEtic1BaVkJaNk9ncWR3bXdxTjlNSkVfdTU0aDBzNHpickpJTlFzMkVydUJTM0IwandkcDJFNzd6WnZqSjJZRUJWNldzNWc?oc=5	הצבא משעה חיילי מילואים שהודיעו כי יסרבו לשרת אם לא תקודם עסקת חטופים - הארץ	הארץ	https://img.haarets.co.il/bs/00000192-902f-d2db-ab97-ddffbfd80000/7f/70/a506ecdf43ec95063c849f357f11/115675.jpg?precrop=2400,1395,x0,y208&width=1200&height=630&cmsprod	2024-10-15 15:40:00	הארץ