country_code	url	title	description	image_url	publish_date	source
il	https://www.mako.co.il/news-israel/2024_q4/Article-d1f33e29963b291027.htm	N12 - לוחם במילואים ביקש עזרה, אלפים נרתמו: "הייתי בשוק" - mako	בהפוגות הקצרות מהמילואים בצפון שכר איתמר מלמן דירה, אך לא הספיק לרהט אותה • הוא ביקש עזרה ברשת ואלפים הציעו למסור לו רהיטים, מוצרי חשמל וגם לסייע בניקיון	https://img.mako.co.il/2024/10/22/hayal_autoOrient_i.jpg	2024-10-22 09:26:00	mako
il	https://www.davar1.co.il/551603/	מאות השתתפו בהלוויית שורדת הנובה שיראל גולן, שמתה מאובדנות; אביה: "יש עוד 3,000 שצריכים עזרה" - דבר	גולן, בת 22, סבלה מהידרדרות במצבה הנפשי מאז הטבח, ובמשפחתה סיפרו שלא קיבלה סיוע מספק מהמדינה | ועד משפחות נרצחי המסיבות ב-7.10: "מבחינתנו, שיראל היא נרצחת נובה, המדינה חייבת להתעורר"	https://static.davar1.co.il/www/uploads/2024/10/shirelgolan22102024.jpeg	2024-10-22 10:42:00	דבר
il	https://www.mako.co.il/finances-news/Article-3c48d2b0c64b291027.htm	האם נתניהו יקבל כסף לכיסו בעקבות הפגיעה בקיסריה? - mako	הפגיעה בביתו הפרטי של ראש הממשלה היא פגיעה בסמל שלטון שצריכה לקבל ביטוי מבחינה ביטחונית ומדינית. אבל כשהדבר מגיע לפיצוי, החוק היבש לא מבדיל בין אישי ציבור לאישים פרטיים. מומחי מס רכוש מסבירים מה ההליך הנהוג במק	None	2024-10-22 13:30:00	mako
il	https://www.haaretz.co.il/news/politics/2024-10-22/ty-article/00000192-b307-d542-a9ba-b34f96910000	כנס בינלאומי שתארח צרפת השבוע להפסקת הלחימה בלבנון מעורר דאגה בישראל - הארץ	הארץ	https://img.haarets.co.il/bs/00000192-b307-d542-a9ba-b34f96910000/47/de/404915f3465dac915fafef2a3b45/146252.jpg?precrop=2400,1395,x0,y184&width=1200&height=630&cmsprod	2024-10-22 11:35:00	הארץ
il	https://tmi.maariv.co.il/celebs-news/article-1141913	יאיר חושף את היחסים עם אביו - ראש הממשלה בנימין נתניהו - TMI	יום הולדתו ה-75 של ראש ממשלת ישראל, בנימין נתניהו, נערכה אתמול ובנו, יאיר, מיהר לברך אותו ברשתות החברתיות תוך שהוא מתייחס לשיגור הכטב"ם לביתם שבקיסריה לפני מספר ימים	https://images.maariv.co.il/image/upload/f_auto,fl_lossy/c_fill,g_faces:center,h_533,w_758/939954	2024-10-22 06:07:57	TMI
il	https://www.mako.co.il/travel-news/international/Article-c4c8aa3aae2b291027.htm	"אף ישראלי לא רצוי": בעל מסעדה ביעד הפופולרי גירש משפחה ישראלית - mako	None	None	2024-10-22 07:38:00	mako
il	https://www.ynet.co.il/news/article/ry6hsurlke	בלינקן הציג מפת דרכים לסיום המלחמה, וקרא לנתניהו: מתנו עוד את התגובה באיראן - ynet ידיעות אחרונות	רה"מ דן עם מזכיר המדינה בעזה, בלבנון וגם בשיגור הכטב"ם לעבר ביתו בקיסריה. על רקע מכתב האיום באמברגו: גורם במחלקת המדינה אמר שישראל התחייבה לנהוג בהתאם בנוגע לסיוע ההומניטרי. בלינקן: לנצל את חיסול סינוואר לעסקת חטופים ולחתור לסוף הפעולה בדרום לבנון. כך הגיב נתניהו למפת הדרכים	https://ynet-pic1.yit.co.il/picserver5/crop_images/2024/10/22/SkbWYMrgyg/SkbWYMrgyg_0_127_3000_1689_0_large.jpg	2024-10-22 17:30:41	ynet ידיעות אחרונות
il	https://www.ynet.co.il/news/article/hjgbzjrlkg	רצון ב"דם חדש" או "התערבות סעודית"? תעלומת החלפת ראש המודיעין המצרי - ynet ידיעות אחרונות	במצרים לא פרסמו סיבה רשמית להזזתו של עבאס כאמל הוותיק ולהחלפתו בחסן רשאד האלמוני. כאמל, לפי הדיווחים, מונה ליועצו האישי של הנשיא א-סיסי, מה שיכול היה להיתפס כקידום. אולם חרושת השמועות במצרים ובעולם הערבי מעלה סימני שאלה סביב החלפת התפקידים - עד כדי השפעה של יורש העצר הסעודי	https://ynet-pic1.yit.co.il/picserver5/crop_images/2024/10/16/rkjj68T1Jg/rkjj68T1Jg_0_47_1280_721_0_large.jpg	2024-10-22 18:13:45	ynet ידיעות אחרונות
il	https://news.google.com/rss/articles/CCAiC2NQdFEwd1pnMEpVmAEB?oc=5	"הבניינים קורסים - לאן נלך?": התגובות בלבנון בעקבות תקיפת כוחותינו בביירות - עכשיו 14	None	None	2024-10-21 05:43:52	עכשיו 14
il	https://www.srugim.co.il/1052531-%D7%AA%D7%99%D7%A2%D7%95%D7%93-%D7%93%D7%A8%D7%9E%D7%98%D7%99-%D7%A8%D7%A7%D7%98%D7%94-%D7%94%D7%AA%D7%A4%D7%95%D7%A6%D7%A6%D7%94-%D7%9E%D7%98%D7%A8%D7%99%D7%9D-%D7%A1%D7%A4%D7%95%D7%A8%D7%99%D7%9D	תיעוד דרמטי: רקטה התפוצצה מטרים ספורים מרכב חונה - סרוגים	None	None	2024-10-22 11:19:46	סרוגים
il	https://www.themarker.com/consumer/2024-10-22/ty-article/.premium/00000192-b423-d4c1-a7bf-b4af781f0000	ברקת נבהל מהזעם: הנחה להגביר את האכיפה בנושא סימון המחירים - TheMarker	***	https://img.haarets.co.il/bs/00000192-b423-d4c1-a7bf-b4af781f0000/bb/45/9aea95e44570ab38c9029b647f41/49244371.JPG?precrop=0,0,x776,y656&width=1200&height=630&cmsprod	2024-10-22 12:33:00	TheMarker
il	https://www.mako.co.il/news-military/036814c74a0e1910/Article-5f744df16f1b291027.htm	מתווה הוכשטיין: הרחבת המנדט של יוניפ"יל מצפון לנהר הליטני, חיזבאללה מסרב - mako	None	None	2024-10-22 06:39:00	mako
il	https://www.bhol.co.il/news/1676639	לאחר ההלשנה הרבי זעק: "עדיף לחזור לגור בין הגויים בפולין והונגריה" - בחדרי חרדים	לאחר שנעצרה שמחת בית השואבה בחצר קרעטשניף בקרית גת אנחנו מביאים את דבריו המלאים של הרבי שפרץ בדברי זעקה שלא כהרגלו: "עדיף לחזור לגור בין הגויים בפולין והונגריה. אני מוכן הרגע להיכנס לכלא ולשלם כל קנס שבעולם". האזינו לדבריו	https://storage.bhol.co.il/articles/749611_tumb_1200X627.jpg	2024-10-22 16:20:00	בחדרי חרדים
il	https://www.maariv.co.il/news/military/article-1142142	עכשיו זה רשמי: האשם ספי א-דין, יורשו של חסן נסראללה, חוסל על ידי צה"ל - מעריב און ליין	דובר צה"ל הודיע כי כעת ניתן לאשר שבתקיפה לפני כשלושה שבועות חוסלו בדאחייה שבביירות האשם ספי א-דין, ראש המועצה המבצעת של ארגון הטרור חיזבאללה וחסין עלי הזימה, ראש מטה המודיעין של חיזבאללה	https://images.maariv.co.il/image/upload/f_auto,fl_lossy/c_fill,g_faces:center,w_1200/936038	2024-10-22 20:10:16	מעריב און ליין
il	https://www.ynet.co.il/news/article/hjv611uhxkx	חצי מיליון תלמידים צפויים להישאר בבית: "הפער בין ילדי הצפון לשאר לא נורמלי" - ynet ידיעות אחרונות	זה שבועות ארוכים שגרת הלימודים בצפון לא קיימת, ולקראת סוף חופשות חגי תשרי והחזרה ללימודים ביום שישי - ההורים דורשים פתרון. אם לשניים מקיבוץ כפר סאלד: "מספיק עם אשליית הלימודים בזום, ילדים צריכים לפגוש אנשים אמיתיים". למרות זאת, ההערכה כרגע: לא צפוי שינוי דרמטי בהנחיות  	https://ynet-pic1.yit.co.il/picserver5/crop_images/2024/10/22/B1uMh8SlJx/B1uMh8SlJx_0_42_1280_721_0_large.jpg	2024-10-22 19:30:15	ynet ידיעות אחרונות
il	https://www.ynet.co.il/news/article/byhduxegkx	5 במקום אחד: "אלו חברי מועצת חמאס שיחליפו את סינוואר בהנהגה" - ynet ידיעות אחרונות	שני גורמים בחמאס אמרו ל-AFP כי מועצת בכירים שבסיסה בקטאר היא שתנהיג את ארגון הטרור במקומו של סינוואר שחוסל. ראש הלשכה המדינית לשעבר חאלד משעל, סגנו של סינוואר חליל אל-חיה, "המוח הכלכלי" זאהר ג'בארין, ראש מועצת השורא מוחמד דרוויש - וגם בכיר נוסף: זו ההנהגה החדשה	https://ynet-pic1.yit.co.il/picserver5/crop_images/2024/10/17/B1zYXAAyJe/B1zYXAAyJe_0_0_850_479_0_large.jpg	2024-10-21 22:09:08	ynet ידיעות אחרונות
il	https://www.bhol.co.il/news/1676626	הרשימה המלאה: המחבלים התרכזו ברחבת בית הספר - וחוסלו - בחדרי חרדים	צה"ל ושב"כ חיסלו לפחות 18 מחבלי חמאס והג'יהאד האסלאמי בנקודת ריכוז מחבלים בצפון רצועת עזה	https://storage.bhol.co.il/articles/749308_tumb_1200X627.jpg	2024-10-22 10:36:00	בחדרי חרדים
il	https://www.mako.co.il/nexter-news/Article-8eaf875d555b291027.htm	"מוות לישראל": שלטי החוצות האנטישמיים שהפתיעו את הנוסעים בארה"ב - mako	האקרים השתלטו על שני שלטי חוצות מחוץ לשיקגו והציגו מסרים אנטישמיים על גבי השלטים הדיגיטליים, שעליהם נכתב כי מומנו ע"י היוטיובר הפופולרי MrBeast. היוטיובר הכחיש קשר למעשה, יצר קשר עם הרשויות והמודעה הוסרה	None	2024-10-22 17:50:00	mako
il	https://www.kipa.co.il/%D7%97%D7%93%D7%A9%D7%95%D7%AA/1191166-0/	אב לשישה ורב אולפנה: הרב אבירם חריב מדולב נפל בלבנון - כיפה	None	None	2024-10-22 17:30:14	כיפה
il	https://tmi.maariv.co.il/celebs-news/article-1141942	פרסום ראשון: ירון אברהם צפוי להיעדר מהמסך בקרוב - ואנחנו גילינו מה הסיבה - TMI	ירון אברהם, נחשב לאחד העיתונאים המובילים והמוערכים במדינה, וחסרונו על המסך מורגש. כעת, נחשפת הסיבה לאחר שאברהם החליט לעבור הליך קוסמטי שישדרג לו את כל המראה 	https://images.maariv.co.il/image/upload/f_auto,fl_lossy/c_fill,g_faces:center,h_533,w_758/930564	2024-10-22 08:01:12	TMI
il	https://www.ice.co.il/media/news/article/1034889	כתב חדשות כאן 11 נפצע בלחימה בלבנון: "עומדים לצידו" - אייס	אחד מכתבי החדשות של כאן 11 הפסיק את תפקידו העיתונאי בתחילת המלחמה והתגייס למילואים. לאחר שנלחם בעזה הוא הוקפץ לדרום לבנון עם יחידתו ושם למרבה הצער, נפצע. כעת הוא בהחלמה בבית החולים	https://img.ice.co.il/giflib/news/13ice27042023.jpg	2024-10-22 12:44:00	אייס
il	https://www.bhol.co.il/news/1676617	הרמטכ"ל מסיר פאצ'ים עם הכיתוב "משיח" ממדיהם של לוחמים - בחדרי חרדים	לאחד הלוחמים אמר הרמטכ"ל: "אם אתה רוצה אתה יכול לשים את זה בפנים קרוב ללב, אבל על המדים - רק דברים צבאיים"	https://storage.bhol.co.il/media/Storage/749288_tumb_1200X627.jpg	2024-10-22 06:41:00	בחדרי חרדים
il	https://www.inn.co.il/news/651414	לפני שהספיקה להתנקש: תיעוד ממעצר החולייה שנשלחה על ידי איראן - ערוץ 7	None	None	2024-10-22 15:55:00	ערוץ 7
il	https://www.davar1.co.il/551557/	רצח כפול בכפר קאסם: בת 10 ובת 29 נרצחו ביריות - דבר	הנרצחות: מאי עיסא מהכפר וסיהאם מוסראתי מרמלה | אחיה של מוסראתי, בן 17, נפצע קשה	https://static.davar1.co.il/www/uploads/2018/08/180818_police1.jpg	2024-10-22 06:49:00	דבר
il	https://www.maariv.co.il/breaking-news/article-1142146	לאחר ההודעה הרשמית על חיסול ספי-א דין: תקיפות עוצמתיות בביירות | צפו - מעריב און ליין	None	https://images.maariv.co.il/image/upload/940118	2024-10-22 20:43:31	מעריב און ליין
il	https://www.mako.co.il/news-israel/2024_q4/Article-3583e89a601b291026.htm	N12 - אחרי כיסוי המצבה של חלל צה"ל - המשפחה התבקשה כעת להסיר... - mako	None	None	2024-10-22 06:25:00	mako
il	https://www.inn.co.il/news/651343	דניאלה וייס לערוץ 7: המטרה - להפוך התיישבות יהודית בעזה לריאלית - ערוץ 7	None	None	2024-10-22 04:11:00	ערוץ 7
il	https://sports.walla.co.il/item/3699398	טדי אישיוז: בית"ר ירושלים חגגה 2:3 גדול על מכבי חיפה - וואלה! ספורט	שלושה ימים אחרי ההפסד במשחק העונה, סגנית האלופה שבה לטדי ומלך השערים דין דוד העניק לה יתרון (21) אחרי בישול נפלא של דיא סבע. טוומאסי דאג לשוויון מוצדק (34)	https://images.wcdn.co.il/f_auto,q_auto,w_1200,t_54/3/7/8/8/3788547-46.jpg	2024-10-22 08:34:00	וואלה! ספורט
il	https://www.ice.co.il/culture/news/article/1034929	אבל בעולם התרבות: השחקן האהוב הלך לעולמו בגיל 68 - אייס	עצוב: השחקן האהוב מייקל ניומן, שכיכב בסדרה המיתולוגית "משמר המפרץ", שם גילם את דמותו של המציל, הלך לעולמו בגיל 68, זאת לאחר שסבל מסיבוכים בלב	https://img.ice.co.il/giflib/news/ניומן.JPG	2024-10-22 16:43:00	אייס
il	https://www.mako.co.il/news-military/036814c74a0e1910/Article-269e2a62794b291026.htm	N12 - מפקדי חטיבות בלבנון לרמטכ"ל: יש שחיקה וביקורת על... - mako	None	None	2024-10-22 16:02:00	mako
il	https://www.ynet.co.il/news/article/sy4phyhxjx	דרמה במשטרה: הודח היועמ"ש שיצא נגד בן גביר. בהרב מיארה: ההחלטה מוקפאת - ynet ידיעות אחרונות	תנ"צ אלעזר כהנא, שיצא נגד החלטת השר לביטחון לאומי לקדם את קצין המשטרה שהשליך רימון על מפגינים, הועבר מתפקידו. היועמ"שית למפכ"ל: "סיכמנו קודם להיפגש - ועדיין הודעת על העברתו מתפקידו. להדיח בהליך בזק את שומר הסף האמון על הטיפול במחאות זה מהלך חסר תקדים - ויש להקפיאו"	https://ynet-pic1.yit.co.il/picserver5/crop_images/2024/10/23/Hy011NcBl1l/Hy011NcBl1l_0_0_850_479_0_large.jpg	2024-10-22 21:27:19	ynet ידיעות אחרונות
il	https://www.mako.co.il/news-military/036814c74a0e1910/Article-a1d6f905a24b291027.htm	N12 - הותר לפרסום: הכטב"ם ששיגר חיזבאללה פגע בבית רה"מ... - mako	None	None	2024-10-22 12:34:00	mako
il	https://www.srugim.co.il/1052673-%D7%90%D7%96%D7%A2%D7%A7%D7%95%D7%AA-%D7%9C%D7%9C%D7%90-%D7%94%D7%A4%D7%A1%D7%A7%D7%94-%D7%9E%D7%9C%D7%99%D7%95%D7%9F-%D7%90%D7%99%D7%A9-%D7%91%D7%9E%D7%A7%D7%9C%D7%98%D7%99%D7%9D	אזעקות ללא הפסקה: מיליון איש במקלטים - סרוגים	None	None	2024-10-22 16:22:47	סרוגים
il	https://www.bhol.co.il/news/1676628	דובר חיזבאללה התרברב בשידור - ונאלץ לברוח בגלל תקיפה ישראלית - בחדרי חרדים	מסיבת העיתונאים שקיים האחראי על ההסברה בחיזבאללה נקטעה בעקבות התרעת פינוי של דובר צה"ל | צפו	https://storage.bhol.co.il/media/Storage/749311_tumb_1200X627.jpg	2024-10-22 11:46:00	בחדרי חרדים
il	https://www.ynet.co.il/news/article/hjvqcwbx1l	הותר לפרסום: רס"ן במיל' אבירם חריב נהרג בהיתקלות בדרום לבנון - ynet ידיעות אחרונות	סגן מפקד גדוד 9308 נפל בקרב בגזרה המערבית של דרום לבנון. חריב, בן 42 שמשמש גם כרב אולפנת דולב, הותיר אחריו אישה ו-6 ילדים. ראש מועצת בנימין: "עם ישראל איבד מחנך דגול, שלקח את הערכים אליהם חינך אל שדה הקרב"	https://ynet-pic1.yit.co.il/picserver5/crop_images/2024/10/22/Hy6HawSg1l/Hy6HawSg1l_0_33_488_275_0_large.jpg	2024-10-22 18:21:54	ynet ידיעות אחרונות
il	https://www.inn.co.il/news/651405	מפקד פיקוד צפון: פגענו קשות בחיזבאללה, נמשיך בנחישות - ערוץ 7	None	None	2024-10-22 14:28:00	ערוץ 7
il	https://www.mako.co.il/news-military/036814c74a0e1910/Article-2b62385bd44b291027.htm	N12 - דיווח: זו החשודה בהדלפת מסמכי הפנטגון על תקיפה באיראן - mako	None	None	2024-10-22 13:03:22	mako
il	https://www.maariv.co.il/journalists/opinions/Article-1142100	"המקל והגזר" - האסטרטגיה האיראנית למניעת התקיפה הישראלית באיראן - מעריב און ליין	מאז מתקפת הטילים על ישראל, ניתן להניח כי מחלחלת ההבנה בקרב הנהגה האיראנית כי הפעם הם יתקשו מאוד להמנע מתגובה ישראלית משמעותית כנגד מדינתם	https://images.maariv.co.il/image/upload/f_auto,fl_lossy/c_fill,g_faces:center,w_1200/936540	2024-10-22 16:50:24	מעריב און ליין
il	https://www.ynet.co.il/news/article/b1ohgghxjg	עוד פלסטינים מתפנים בצפון הרצועה, טענות לכיתור בתי חולים: "לא נעזוב" - ynet ידיעות אחרונות	צה"ל הורה למתגוררים במחסות בבית לאהיה לעזוב, ובג'באליה התפנו עוד תושבים. חלק סבורים שההוראות זמניות: "נחכה שהצבא ייצא, לא נוותר על המחנה". דובר צה"ל בערבית: "מחבלים מנסים להיטמע במתפנים - ונעצרים". ראש אונר"א: דרושה הפסקת אש זמנית, גם אם לשעות בודדות	https://ynet-pic1.yit.co.il/picserver5/crop_images/2024/10/22/SkgxLE7Sxye/SkgxLE7Sxye_285_359_2432_1369_0_large.jpg	2024-10-22 13:58:09	ynet ידיעות אחרונות
il	https://www.inn.co.il/news/651391	מפקד פיקוד הדרום ללוחמים: התקפות שהוביל אחסאן דקסה, הביאו לחיסול סינוואר - ערוץ 7	None	None	2024-10-22 11:38:00	ערוץ 7
il	https://www.mako.co.il/news-politics/2024_q4/Article-51de2352bf4b291026.htm	N12 - "הקפלניסטים הגיעו לסיים את מה שחיזבאללה לא הצליח" - mako	None	None	2024-10-22 17:41:00	mako
il	https://www.idf.il/%D7%90%D7%AA%D7%A8%D7%99-%D7%99%D7%97%D7%99%D7%93%D7%95%D7%AA/%D7%A4%D7%99%D7%A7%D7%95%D7%93-%D7%94%D7%A6%D7%A4%D7%95%D7%9F/%D7%9B%D7%9C-%D7%94%D7%9B%D7%AA%D7%91%D7%95%D7%AA/2024/%D7%9E%D7%99-%D7%94%D7%9D-%D7%AA%D7%99%D7%A7-%D7%94%D7%92%D7%95%D7%9C%D7%9F-%D7%95%D7%90%D7%99%D7%96%D7%95-%D7%9E%D7%9B%D7%94-%D7%94%D7%A0%D7%97%D7%99%D7%AA%D7%94-%D7%A2%D7%9C%D7%99%D7%94%D7%9D-%D7%9E%D7%95%D7%A0%D7%99%D7%AA-%D7%94%D7%9B%D7%A1%D7%A3/	הסוד שחיזבאללה ניסה להסתיר: מי הם "תיק הגולן"? ואיזו מכה הנחיתה עליהם "מונית הכסף"? - IDF	None	None	2024-10-22 06:03:15	IDF
il	https://www.mako.co.il/nexter-news/Article-07e4ae56194b291027.htm	וואטסאפ מכריזה על אחד השינויים החשובים בה - mako	None	None	2024-10-22 14:21:00	mako
il	https://www.maariv.co.il/news/military/article-1141957	הותר לפרסום: סמ"ר ישי מן נהרג בתאונת דרכים מבצעית בסמוך לרצועת עזה - מעריב און ליין	סמ"ר ישי מן, לוחם חטיבת הנח"ל, נהרג כחלק מתאונת דרכים מבצעית סמוך לרצועת עזה. ראש המועצה האזורית בנימין: "אנו מרגישים את מחירה הגדול והקשה של תקומת מדינת ישראל – נמשיך בראש מורם לניצחון מלא"	https://images.maariv.co.il/image/upload/f_auto,fl_lossy/c_fill,g_faces:center,w_1200/939972	2024-10-22 09:09:25	מעריב און ליין
il	https://13tv.co.il/item/entertainment/celebs/gossip/buquo-904305800/	באפטר פארטי של טקס פרסי המוזיקה 2000: שון 'דידי' קומבס נאשם באונס ילדה בת 13 יחד עם שני מפורסמים - ערוץ 13	תביעה חדשה מתווספת לשפע התלונות כנגד שון דידי, והפעם, אישה בת 37 שטוענת שכשהייתה בת 13 נאנסה על ידי המפיק המוזיקלי באפטר פארטי של טקס פרסי ה-MTV בשנת 2000, לצד שני מפורסמים נוספים	https://media.reshet.tv/image/upload/t_og_image/v1729584341/uploads/2024/904305848.webp	2024-10-22 08:21:57	ערוץ 13
il	https://www.mako.co.il/news-entertainment/2024_q4/Article-31bd04df7d3b291026.htm	N12 - הסרט "תיקי ביבי" שעורר סערה נמכר להפצה בשירות סטרימינג - mako	None	None	2024-10-22 10:49:00	mako
il	https://www.calcalist.co.il/investing/article/b1311kj4x1g	הביטוח הסיעודי של 2.6 מיליון איש יופקר בעוד חודשיים, והאחראים עסוקים בהאשמות - כלכליסט	אחרי שאף חברה לא התמודדה במכרז הסיעודי של כללית, סעיף מיוחד לחיסול עצמי של פוליסת מבוטחי הקופה יופעל בעוד 71 יום. כללית דורשת לאפשר למנורה להפעיל את הביטוח אך רשות שוק ההון חוששת ממונופול ומעוניינת במכרז חדש. המשבר עלול למוטט איתו את ענף הסיעוד כולו	https://pic1.calcalist.co.il/picserver3/crop_images/2019/04/28/902151/902151_0_0_1000_563_0_large.jpg	2024-10-22 03:10:00	כלכליסט
il	https://www.bhol.co.il/news/1676619	השר הנסתר: לא סופר את הציבור ומחרים את התקשורת הישראלית - בחדרי חרדים	השר רון דרמר מתראיין פעם אחר פעם לרשתות הטלוויזיה הזרות, לפודקאסטים בינלאומיים ומעניק ראיונות אישיים. התבטאות אחת קצרה שלו נמסרה ופורסמה בעיתון ישראלי מאז ה-7 באוקטובר	https://storage.bhol.co.il/articles/116388_tumb_1200X627.jpg	2024-10-22 06:37:00	בחדרי חרדים
il	https://www.sport5.co.il/articles.aspx?FolderID=403&docID=486603	הדעות חלוקות: התחזיות שלנו לעונת 24/25 ב-NBA - ספורט 5	None	None	2024-10-22 13:32:16	ספורט 5
il	https://13tv.co.il/item/entertainment/celebs/gossip/je2pl-904304225/	באשמת עובדי המלון? נחשפו פרטים חדשים על מותו של ליאם פיין - ערוץ 13	שני אנשי צוות שעבדו במלון בו שהה ליאם פיין ומצא את מותו נחקרו במשטרה בחשד שגרמו לכוכב "וואן דיירקשיין" לצרוך סמים ואלכוהול, ואף סיפקו לו אותם, זאת בעוד שהיה פיכח בתקופה האחרונה, מאז יצא מגמילה בשנה שעברה	https://media.reshet.tv/image/upload/t_og_image/v1729143984/uploads/2024/904299592.jpg	2024-10-21 06:41:55	ערוץ 13