country_code	url	title	description	image_url	publish_date	source
il	https://www.idf.il/%D7%90%D7%AA%D7%A8%D7%99-%D7%99%D7%97%D7%99%D7%93%D7%95%D7%AA/%D7%99%D7%95%D7%9E%D7%9F-%D7%94%D7%9E%D7%9C%D7%97%D7%9E%D7%94/%D7%9B%D7%9C-%D7%94%D7%9B%D7%AA%D7%91%D7%95%D7%AA/%D7%94%D7%A4%D7%A6%D7%95%D7%AA/%D7%AA%D7%99%D7%A2%D7%95%D7%93-%D7%9E%D7%A4%D7%A2%D7%99%D7%9C%D7%95%D7%AA-%D7%9B%D7%95%D7%97%D7%95%D7%AA-%D7%97%D7%98%D7%99%D7%91%D7%94-769-%D7%91%D7%93%D7%A8%D7%95%D7%9D-%D7%9C%D7%91%D7%A0%D7%95%D7%9F/	אותרה והוחרמה - מערכת טילים ניידת ובה 24 רקטות מוכנות לשיגור: תיעוד מפעילות כוחות חטיבה 769 בדרום לבנון - IDF	None	None	2024-11-09 16:22:20	IDF
il	https://www.idf.il/%D7%90%D7%AA%D7%A8%D7%99-%D7%99%D7%97%D7%99%D7%93%D7%95%D7%AA/%D7%99%D7%95%D7%9E%D7%9F-%D7%94%D7%9E%D7%9C%D7%97%D7%9E%D7%94/%D7%9B%D7%9C-%D7%94%D7%9B%D7%AA%D7%91%D7%95%D7%AA/%D7%94%D7%A4%D7%A6%D7%95%D7%AA/%D7%94%D7%A8%D7%9E%D7%98%D7%9B-%D7%9C-%D7%91%D7%94%D7%A2%D7%A8%D7%9B%D7%AA-%D7%9E%D7%A6%D7%91-%D7%91%D7%92-%D7%91%D7%90%D7%9C%D7%99%D7%94/	הרמטכ"ל בהערכת מצב בג'באליה: "מתוך העוצמה שאתם מפגינים - נדאג לביטחון אזרחינו ונשיב את חטופינו" - IDF	None	None	2024-11-09 16:53:57	IDF
il	https://www.bhol.co.il/news/1677982	איראן תכננה לרצוח את טראמפ, כולל שני אנשי עסקים יהודים - בחדרי חרדים	תוכנית איראן לרצוח את טראמפ נחשפה. שלושה הואשמו בתכנון להרוג את הנשיא הנבחר. הוצע להם 500 אלף דולר להרוג שני אנשי עסקים יהודים המתגוררים בארה"ב	https://storage.bhol.co.il/media/lt/1655319/gallery/746288_tumb_1200X627.jpg	2024-11-09 15:42:00	בחדרי חרדים
il	https://www.kan.org.il/content/kan-news/politic/822411/	התובע בהאג התבקש להשעות את עצמו בעקבות חקירה חדשה - כאן | תאגיד השידור הישראלי	None	None	2024-11-09 06:22:39	כאן | תאגיד השידור הישראלי
il	https://www.globes.co.il/news/article.aspx?did=1001493466	"הם ישלמו בגדול": המדינות שדונלד טראמפ שם על הכוונת - גלובס	&nbsp;	None	2024-11-09 19:01:36	גלובס
il	https://www.ice.co.il/social/news/article/1037336	מגישת i24news מתלוננת: "אולי זה היה נגמר אחרת" - אייס	נוה דרומי בפוסט נוקב: "אם לגלנט היה שביב מחשבה עצמאית מהסוג הזה, זה אולי היה נגמר אחרת. ומי שעדיין חלק במערכת ולוקה בקונספציה, שיסתכל באיזו שלוות נפש מקבל הציבור את לכתו של גלנט. זה לא בגלל שיש לציבור משהו נגד גלנט וזה לא שכולם מצביעי ליכוד. פשוט לרוב הישראלים יש משהו נגד אנשים שלא רוצים לנצח"	http://img.ice.co.il/giflib/news/7ice07052024.jpg	2024-11-10 07:07:00	אייס
il	https://www.kipa.co.il/%D7%97%D7%93%D7%A9%D7%95%D7%AA/1192015-0/	בשל המצב הביטחוני: אלו הנחיות פיקוד העורף המעודכנות - כיפה	None	None	2024-11-09 16:31:55	כיפה
il	https://www.mako.co.il/men-men_news/Article-274523f05b41391026.htm	הדירה שבה הסתתרה ענבל אור מהמשטרה: "חשבה שלא נגיע לשם" - mako	None	None	2024-11-10 06:33:00	mako
il	https://sport1.maariv.co.il/israeli-soccer/ligat-haal/article/1406438/	שחקן בית"ר ירושלים על המוקד: "איתו אנחנו שחקן פחות, חייבים להחליף אותו" - ספורט 1	הקבוצה מהבירה ניצחה את הפועל חיפה משער דרמטי של ז'נו בדקה ה-95 וטיפסה למקום הראשון בטבלה, אך האוהדים ברשתות החברתיות ביקרו: "יש חלוץ בטדי או שהוא עדיין בשנת חורף?". גם עדי יונה ספג אש	https://sport1images.maariv.co.il/image/upload/f_auto,fl_lossy,c_thumb,g_north,w_1200,h_630/1210354	2024-11-10 04:41:16	ספורט 1
il	https://www.haaretz.co.il/opinions/2024-11-10/ty-article-opinion/.premium/00000193-11e8-de12-adbb-93ffcbe10000	למה הם שונאים אותנו כל כך? לא, לא מפני שאנחנו יהודים - הארץ	הארץ	https://img.haarets.co.il/bs/00000193-11e8-de12-adbb-93ffcbe10000/84/1b/d4b271f04be68221992d6735e85c/486354-1.jpg?precrop=2400,1396,x0,y133&width=1200&height=630&cmsprod	2024-11-10 04:00:00	הארץ
il	https://www.ynet.co.il/news/article/byvs3jr11jg	4 שנים אחרי שנהרג: חבריו של אהוביה סנדק הודו ביידוי אבנים לעבר רכב פלסטיני - ynet ידיעות אחרונות	במסגרת עסקת טיעון, ביהמ"ש הרשיע את ארבעת חבריו של הנער בן ה-16, שהיו איתו ברכב שהתהפך במהלך מרדף משטרתי - מה שגרם למותו והצית מחאות. "המתינו שיעבור רכב שנוסעיו ערבים - והשליכו אבנים ממניע אידיאולוגי-גזעני", נכתב בהכרעת הדין. הם צפויים לקבל עבודות שירות של בין 6 ל-9 חודשים	https://ynet-pic1.yit.co.il/picserver5/crop_images/2020/12/21/BytMySA2v/BytMySA2v_0_0_640_360_0_large.jpg	2024-11-10 09:41:29	ynet ידיעות אחרונות
il	https://www.sport5.co.il/articles.aspx?FolderID=394&docID=488382	בושה: אוהדי ווידאד קזבלנקה תמכו בזייש - ספורט 5	None	None	2024-11-10 05:47:54	ספורט 5
il	https://www.mako.co.il/news-world/2024_q4/Article-606ccb23de41391026.htm	N12 - תיעוד דרמטי: ניסה לחטוף ילד חרדי בניו יורק - mako	None	None	2024-11-10 07:37:00	mako
il	https://www.ynet.co.il/news/article/bkwzb00tbje	טראמפ הכריז: ניקי היילי ומייק פומפאו לא יהיו חלק מהממשל שלי - ynet ידיעות אחרונות	אחרי שהוערך כי יציע תפקידים לשגרירה באו"ם ולמזכיר המדינה לשעבר - תומכים נלהבים של ישראל - טראמפ הודיע כי לא יזמין אותם להשתתף בקבינט המתגבש: "נהניתי לעבוד איתם ואני מודה להם על שירותם". גורמים ל"פוליטיקו": "טראמפ נכווה משניהם בעבר. יש מאמץ להימנע מבחירת אנשים ששואפים לרוץ לנשיאות"	https://ynet-pic1.yit.co.il/picserver5/crop_images/2024/11/07/SJ62erqWye/SJ62erqWye_0_0_3000_1689_0_large.jpg	2024-11-10 00:34:35	ynet ידיעות אחרונות
il	https://www.kan.org.il/content/kan-news/defense/822578/	התגובה של צה"ל לדוח שצפוי להכריז על הרעבה בצפון עזה - כאן | תאגיד השידור הישראלי	None	None	2024-11-09 20:29:29	כאן | תאגיד השידור הישראלי
il	https://www.mako.co.il/food-restaurants/restaurant-news/Article-3aac676a0841391026.htm	עוד אחת נפלה: מסעדת גורדוס נסגרת - mako	None	None	2024-11-10 05:37:00	mako
il	https://www.bhol.co.il/news/1678032	טראמפ זוכה באריזונה - ומשלים ניצחון בשבע המדינות המתנדנדות - בחדרי חרדים	נשיא ארה"ב הנבחר דונלד טראמפ ניצח באריזונה, ובכך השלים ניצחון בכל שבע המדינות המתנדנדות. במקביל, הרפובליקנים מתקרבים להשגת רוב גם בבית הנבחרים	https://storage.bhol.co.il/media/Storage/753618_tumb_1200X627.jpg	2024-11-10 06:59:00	בחדרי חרדים
il	https://www.ynet.co.il/news/article/rkhjeya11yx	46 דקות של זוועות: צה"ל פרסם את סרטוני העינויים בעזתים שאיתר ברצועה - ynet ידיעות אחרונות	אסיר תלוי מהתקרה, אחר כבול באכזריות: צה"ל איתר סרטונים מחקירות ועינויים של פלסטינים על-ידי אנשי חמאס, בשנים שלפני פתיחת המלחמה. בצה"ל אמרו כי הסרטונים "מתעדים את פעילות מוצב 17 ברצועה, שבו מתבצעות חקירות אכזריות באזרחים שנחשדים כמתנגדי חמאס". הוא פרסם 46 דקות מאותם סרטוני זוועה	https://ynet-pic1.yit.co.il/picserver5/crop_images/2024/11/10/HkfNrk7RWJe/HkfNrk7RWJe_0_0_1280_720_0_large.jpg	2024-11-10 11:59:19	ynet ידיעות אחרונות
il	https://www.ynet.co.il/news/article/sjhalz011ke	שר הביטחון כ"ץ: "חמאס הוכרע מבחינה ארגונית, ניצחנו את חיזבאללה" - ynet ידיעות אחרונות	אף על פי שהמלחמה בעזה ובלבנון נמשכת, תושבי הצפון לא שבו לבתיהם ו-101 החטופים בשבי חמאס, שר הביטחון החדש נשמע נחרץ בהעברת שרביט משרד החוץ. אזעקה בגליל דקות לאחר שכ"ץ אמר: "צריך לממש את פירות הניצחון על חיזבאללה". שר החוץ סער: המטרה בהאג - שלילת זכות ישראל להגנה עצמית	https://ynet-pic1.yit.co.il/picserver5/crop_images/2024/11/10/B1PNqXRWke/B1PNqXRWke_0_0_850_479_0_large.jpg	2024-11-10 11:56:35	ynet ידיעות אחרונות
il	https://www.kipa.co.il/%D7%97%D7%93%D7%A9%D7%95%D7%AA/%D7%AA%D7%97%D7%96%D7%99%D7%AA-%D7%9E%D7%96%D7%92-%D7%94%D7%90%D7%95%D7%95%D7%99%D7%A8/1192017-0/	תוציאו מטריות - הגשם חוזר: תחזית מזג אוויר - כיפה	None	None	2024-11-09 22:07:00	כיפה
il	https://www.jdn.co.il/news/2299312/	אמברגו אמריקני: מפלצת ההנדסה של צה”ל מעוכבת על פסי הייצור בארה”ב - JDN	None	https://www.jdn.co.il/wp-content/uploads/2024/11/תמונה-של-WhatsApp_-2024-11-10-בשעה-10.13.16_dbec15bd-1024x668.jpg	2024-11-10 08:30:09	JDN
il	https://www.mako.co.il/men-men_news/Article-dd9d6abbf451391026.htm	העליון הכריע: ראש ארגון הפשע יצחק אברג'יל יסיים את חייו בכלא - mako	None	None	2024-11-10 09:06:00	mako
il	https://www.ynet.co.il/news/article/hyz600xcwje	טראמפ שוקל למנות לשגרירה באו"ם את חברת הקונגרס שקטלה את ההפגנות נגד ישראל - ynet ידיעות אחרונות	אליס סטפניק זכורה כמי שניהלה ביד רמה את השימוע בבית הנבחרים לנשיאוֹת האוניברסיטאות שבקמפוסים שלהן נרשמו מפגני שנאה פרו-פלסטיניים, ונותרה המומה כשנשאלו אם קריאה לרצח עם נגד יהודים היא פשע שנאה והשיבו "זה תלוי בהקשר". היא מבקרת חריפה של האו"ם וקראה לבחון מחדש את המימון לו	https://ynet-pic1.yit.co.il/picserver5/crop_images/2024/01/18/Byt6w28ta/Byt6w28ta_0_0_3000_1689_0_large.jpg	2024-11-10 12:52:47	ynet ידיעות אחרונות
il	https://www.davar1.co.il/556666/	עדכונים שוטפים / צה״ל תקף בצור ובבעלבכ בלבנון; הרמטכ״ל בג׳באליה: ״כאלף מחבלים חוסלו, אלף נוספים נחקרים״ - דבר	400 ימים למלחמה: עשרות רקטות שוגרו לישראל מלבנון מהבוקר | דיווחים בלבנון על תקיפות בדרום לבנון וסמוך לגבול עם סוריה | פיקוד העורף פרסם הקלה בהנחיות ברמת הגולן ומרכז הגליל | דיווח: קטאר תפסיק לתווך במו״מ לעסקה ותסלק את מנהיגי חמאס משטחה | הרמטכ״ל הרצי הלוי ביקר בצפון הרצועה: ״צה״ל לא מתעייף, מתחזקים ככל שאנחנו נלחמים יותר״	https://static.davar1.co.il/www/uploads/2024/11/2024-11-09T142059Z_877516290_RC2O1BA8C73J_RTRMADP_3_ISRAEL-PALESTINIANS-LEBANON-AFTERMATH-.jpeg	2024-11-08 22:04:00	דבר
il	https://www.maariv.co.il/breaking-news/article-1146896	התמונה של הרמטכ"ל הרצי הלוי עם הקפה בג'באליה היממה את העזתים - מעריב און ליין	None	https://images.maariv.co.il/image/upload/943360	2024-11-10 11:26:00	מעריב און ליין
il	https://www.srugim.co.il/1058000-%D7%90%D7%97%D7%A8%D7%99-%D7%94%D7%9E%D7%A2%D7%91%D7%A8-%D7%9E%D7%A2%D7%A8%D7%95%D7%A5-14-%D7%A9%D7%99-%D7%92%D7%95%D7%9C%D7%93%D7%9F-%D7%91%D7%94%D7%A4%D7%92%D7%A0%D7%AA-%D7%9E%D7%98%D7%94-%D7%94	אחרי המעבר מערוץ 14: שי גולדן בהפגנת מטה החטופים - סרוגים	None	None	2024-11-09 19:21:23	סרוגים
il	https://www.ynet.co.il/news/article/rjn6ix011jl	נתניהו לקח אחריות למבצע הביפרים: "היו כאלה שהתנגדו" - ynet ידיעות אחרונות	ראש הממשלה תקף במרומז את גלנט בישיבת הממשלה הראשונה אחרי פיטוריו, מבלי להזכיר את שמו, ואמר כי היו בכירים שהתנגדו למבצע הביפרים ולחיסולו של חסן נסראללה: "היו מי שהתנגדו בקבינט, אני לא הסכמתי והלכתי עד הסוף"	https://ynet-pic1.yit.co.il/picserver5/crop_images/2024/10/07/r1W5m0rWkJx/r1W5m0rWkJx_0_116_1280_721_0_large.jpg	2024-11-10 13:08:37	ynet ידיעות אחרונות
il	https://www.ynet.co.il/news/article/rki9o11a11kl	פרשת המסמכים הסודיים: הוארך מעצרם של 4 החשודים - ובהם דובר רה"מ פלדשטיין - ynet ידיעות אחרונות	שב"כ והמשטרה ביקשו להשאיר חמישה ימים נוספים מאחורי סורג ובריח את החשודים במעורבות בהוצאת המסמכים מצה"ל והדלפתם לכלי תקשורת בינלאומיים. בית המשפט הסכים לבקשה. פרקליטו של קצין המודיעין במילואים שנעצר באילת: "מנסים לשבור את רוחו"	https://ynet-pic1.yit.co.il/picserver5/crop_images/2024/11/03/H1fALBSZyx/H1fALBSZyx_0_0_853_481_0_large.jpg	2024-11-10 13:12:49	ynet ידיעות אחרונות
il	https://www.inn.co.il/news/652867	אלה הסיבות שארה"ב דורשת מקטאר לגרש את הנהגת חמאס - ערוץ 7	None	None	2024-11-10 05:47:00	ערוץ 7
il	https://www.sport5.co.il/articles.aspx?FolderID=64&docID=488427	שוב בהולנד: "דרכונים נבדקו ליהודים אמש" - ספורט 5	None	None	2024-11-10 12:07:00	ספורט 5
il	https://www.haaretz.co.il/news/law/2024-11-10/ty-article-magazine/.premium/00000193-0588-d59a-a59f-8f8f0d5d0000	התכתבות בין בן גביר ליועציו חושפת כי אשתו ודורפמן יזמו את הדחת עמי אשד בשיא המחאה - הארץ	הארץ	https://img.haarets.co.il/bs/00000193-0588-d59a-a59f-8f8f0d5d0000/ab/28/6eb39dfb4674a3581499432f3c6a/ami-whatsapp-homepage.jpg?&width=1200&height=630&cmsprod	2024-11-10 13:32:00	הארץ
il	https://www.inn.co.il/news/652868	צחי ברוורמן מכחיש: דיווח מכפיש ושקרי - ערוץ 7	None	None	2024-11-10 05:51:00	ערוץ 7
il	https://www.mako.co.il/news-politics/2024_q4/Article-e31a9c476451391026.htm	"המשטרה הפקירה אותי מול פורעי הימין": חה"כ שהותקפה אמש בהפגנה בת"א משחזרת - mako	מטי צרפתי-הרכבי ממפלגת יש עתיד ובן זוגה הותקפו על ידי פעילי ימין קיצוני • "זו בריונות לשמה, אלו קבוצות שמגיעות במטרה להתעמת, להשפיל ולזרוע פחד והמשטרה לרוב צופה מהצד", מחתה חברת הכנסת	https://img.mako.co.il/2024/11/10/01mafginim1011_autoOrient_i.jpg	2024-11-10 10:02:00	mako
il	https://www.ynet.co.il/news/article/hyjph2azjg	ביממה האחרונה: עשרות מחבלים חוסלו בלבנון ובעזה - ynet ידיעות אחרונות		https://www.ynet.co.il/images/big_defual_image_1024_new.png	2024-11-10 04:58:41	ynet ידיעות אחרונות
il	https://www.globes.co.il/news/article.aspx?did=1001493577	ישראל שוקלת הפסקת אש בצפון כדי להימנע מהחלטת האו"ם - גלובס	None	None	2024-11-10 03:37:33	גלובס
il	https://www.calcalist.co.il/investing/article/sjmy1w0wyx	שיבוש בפעילות כרטיסי אשראי ובביט עקב תקלה ב-Hyp, שטוענת: מדובר במתקפת סייבר - כלכליסט	לקוחות מדווחים כבר שעות ארוכות כי אינם מצליחים לשלם באמצעות כרטיסי אשראי בחלק מהעסקים ברחבי הארץ. עוד דווח על שיבושים באפליקציית ביט. חברת הסליקה קרדיט גארד, ששייכת ל-Hyp וחלקה בשוק עומד על כ-10%: "פועלים על מנת להחזיר את השירותים במהירות האפשרית". גם באוגוסט דווח על תקלה ב-Hyp	https://pic1.calcalist.co.il/picserver3/crop_images/2023/02/19/r16eAi1Ri/r16eAi1Ri_239_0_757_426_0_large.jpg	2024-11-10 12:09:00	כלכליסט
il	https://www.bhol.co.il/news/1678034	מול רביב דרוקר: ביהמ"ש דן בבקשת השר בן גביר לאסור את שידור 'המקור' - בחדרי חרדים	בית המשפט דן בבקשת השר לביטחון לאומי איתמר בן גביר שלא לפרסם את התחקיר נגדו בתוכנית המקור ברשת 13. "כמו שבארצות הברית מנסים לפגוע בטראמפ, בישראל מנסים לפגוע בי", אמר השר בן גביר בפתח הדיון	https://storage.bhol.co.il/articles/753979_tumb_1200X627.jpg	2024-11-10 07:31:00	בחדרי חרדים
il	https://www.davar1.co.il/556721/	400 יום בשבי חמאס, רבבות הפגינו ברחבי הארץ: "כל מה שאנחנו מבקשים הוא שהמדינה תעמוד לצידנו" - דבר	אמהות החטופים פתחו את העצרת בכיכר בשתיקה על הבמה: "נגמרו לנו המילים" | חן ארד, אחיו של הנווט השבוי רון ארד: "כל דקה שחולפת מקרבת את ה-101 למצב בו הם יישארו כתמונה נצחית עליה נכה על חטא כל ימי חיינו"	https://static.davar1.co.il/www/uploads/2024/11/WhatsApp-Image-2024-11-09-at-20.17.29.jpeg	2024-11-10 03:31:00	דבר
il	https://www.mako.co.il/news-military/036814c74a0e1910/Article-7a98428a2f41391027.htm	N12 - לחימה בקבוצות קטנות, התכתבויות בדפים: טקטיקות הגרילה של... - mako	None	None	2024-11-10 08:14:00	mako
il	https://news.walla.co.il/item/3703439	לאחר 15 שנה בכלא: הוגשה בקשה למשפט חוזר במשפט הרצח בשועפט - וואלה! חדשות	גילויים חדשים מטילים ספק בהרשעתו של ג'מיל סרור שהורשע ברצח בשנת 2011. עד התביעה המרכזי הודה לראשונה שנעשה תיאום גרסאות בין העדים ונמסרה עדות שקר על מנת להפליל את סרור ברצח שלא ביצע. הסנגוריה הציבורית וקליניקת החפות הגישו בקשה למשפט חוזר: "לתקן את העוול"	https://images.wcdn.co.il/f_auto,q_auto,w_1200,t_54/3/7/9/7/3797030-46.jpg	2024-11-10 01:07:00	וואלה! חדשות
il	https://www.inn.co.il/news/652866	עימות מול ישראל: עד כמה רחוק ילך המנהיג העליון של איראן? - ערוץ 7	None	None	2024-11-10 05:32:00	ערוץ 7
il	https://www.bhol.co.il/news/1678022	ראש הסגל החדש של טראמפ: "אשת הקרח" שאוהבת לאפות ולצפות בציפורים - בחדרי חרדים	סוזי וויילס, ראש קמפיין הבחירות של טראמפ מונתה לראש הסגל. האישה הראשונה בהיסטוריה האמריקאית שמונתה לתפקיד. כאשר טראמפ הזכיר אותה בנאומו וקרא לה לעמוד לצדו על הדוכן היא עשתה זאת, ועדיין נראתה נבוכה למדי	https://storage.bhol.co.il/articles/653765_tumb_1200X627.jpeg	2024-11-10 06:07:00	בחדרי חרדים
il	https://www.mako.co.il/finances-news/Article-5140cb23de41391026.htm	העירייה נתנה מעל 400 קנסות על חניה באותו מקום. כך הגיב בית המשפט - mako	עיריית ת"א נתנה קנסות בסכום של מיליונים על חנייה אסורה - השופט קבע כי פעולת העירייה לא הולמת רשות מנהלית	None	2024-11-10 07:24:00	mako
il	https://www.news08.net/%D7%A2%D7%95%D7%91%D7%93-%D7%A8%D7%A9%D7%95%D7%AA-%D7%94%D7%90%D7%9B%D7%99%D7%A4%D7%94-%D7%A0%D7%A4%D7%A6%D7%A2-%D7%91%D7%90%D7%99%D7%A8%D7%95%D7%A2-%D7%99%D7%A8%D7%99-%D7%91%D7%92%D7%95%D7%90%D7%A8/?__cf_chl_rt_tk=TZcmcgtRsMROWMeAkeuvxN_ijk0M.meSEG.dCxCkFAo-1731247567-1.0.1.1-prFwpG_Khs5JqSqeKiBamB0NopEAR8BLGtYSZKofPYk	עובד רשות האכיפה נפצע באירוע ירי בג'ואריש - חדשות אפס שמונה	None	None	2024-11-10 05:59:59	חדשות אפס שמונה
il	https://www.ynet.co.il/news/article/r1erurt11jx	יו"ר פורום קו העימות: "שקט בצפון בחסות רוסיה? החתול ישמור על השמנת" - ynet ידיעות אחרונות		https://www.ynet.co.il/images/big_defual_image_1024_new.png	2024-11-10 06:47:18	ynet ידיעות אחרונות
il	https://www.mako.co.il/news-politics/2024_q4/Article-c459e3110051391027.htm	"לא משאירים בן אדם מדמם על הכביש": בנו של המפגין בן ה-64 שנדרס דורש צדק - mako	האירוע התרחש במהלך הפגנה שנערכה בשל פיטורי שר הביטחון גלנט • בעקבות התאונהכשהוא מורדם הועבר המפגין לטיפול נמרץ כשהוא מורדם ומונשם • הבן פנה ונהג הדורס ואמר: "אם יש לך טיפת מצפון - תעשה את הדבר הנכון"	https://img.mako.co.il/2024/11/10/drisa1011_autoOrient_i.jpg	2024-11-10 13:23:00	mako
il	https://www.mako.co.il/men-men_news/Article-a409e528d421391026.htm	״חשבנו שמדובר במחבלים״: האירוע שגרם לבהלה בפתח תקווה - mako	None	None	2024-11-09 19:16:00	mako
il	https://www.ice.co.il/social/news/article/1037421	לוסי איוב נפרדת מישראל: "לפלסטינים וישראלים מגיע יותר" - אייס	ההחלטה של מגישת 'רוקדים עם כוכבים' להמריא לחודשיים לטיוואן לצד בעלה, מגיעה בעיתוי מעניין, לאחר שבשבוע שעבר התבטאה איוב בנושאים פוליטיים רגישים, כולל פיטורי השר יואב גלנט וירי הרקטות מלבנון	https://img.ice.co.il/giflib/news/25ice30072024.jpg	2024-11-10 13:44:00	אייס
il	https://news.google.com/rss/articles/CBMiXkFVX3lxTE1VVzlNQnhlV1hpN3NJM0doSW40d09VZFZFY0cyME5rM1p1Rkt3UmJ2T0xVWElZLXJTMngzeVljNEszS1ZvRExwZUd1U1M1TEFyQnNWbVJGMHNyTjRXaGc?oc=5	הקומיקאי הישראלי המצליח מגזים בשידור חי: שלף את איבר מינו - אייס	במהלך מופע הסטנדאפ שלו שכלל אביזרים וחיקויים שונים של מפורסמים, ירון ברלד שהתארח בתוכניתו של הסטנדאפיסט אסף יצחקי, סיפק חיקוי של ארז טל והוריד את מכנסיו כדי לשלוף את איבר מינו עליו הניח משקפיים לטובת החיקוי	None	2024-11-09 16:20:00	אייס
il	https://www.sport5.co.il/articles.aspx?FolderID=274&docID=488369	סטפנוס דדאס: "מבין את עופר ינאי. אנחנו באותה סירה" - ספורט 5	None	None	2024-11-09 22:19:16	ספורט 5