country_code	url	title	description	image_url	publish_date	source
in	https://navbharattimes.indiatimes.com/metro/delhi/crime/delhi-kishangarh-revenge-of-slapping-firing-minor-murder-all-details/articleshow/114672922.cms	थप्पड़ मारने पर ऐसा गुस्सा... नाबालिग का चाकू से कर दिया मर्डर, दिल्ली में ये क्या हो रहा - NBT नवभारत टाइम्स (Navbharat Times)	Delhi Kishangarh News: दिल्ली के किशनगढ़ गांव में एक नाबालिग के थप्पड़ का बदला लेने के लिए पांच आरोपियों ने उसे चाकू मार कर हत्या कर दी और उसके दोस्त को गोली मारकर घायल कर दिया। पुलिस ने चार नाबालिग समेत पांच आरोपियों को गिरफ्तार किया।	https://static.langimg.com/photo/imgsize-132136,msid-114673247/navbharat-times.jpg	2024-10-28 03:00:00	NBT नवभारत टाइम्स (Navbharat Times)
in	https://www.abplive.com/news/india/amit-shah-slams-mamata-banerjee-india-alliance-on-bangladeshi-infiltration-in-west-bengal-integrated-check-post-passenger-terminal-2811741	रवीद्र संगीत की जगह बम धमाकों से गूंज रहा पश्चिम बंगाल- ममता सरकार पर अमित शाह - ABP न्यूज़	Amit shah: केंद्रीय गृह मंत्री ने घुसपैठ को लेकर पश्चिम बंगाल की मुख्यमंत्री ममता बनर्जी पर जमकर निशाना साधा. उन्होंने कहा कि बंगाल में 2026 में बीजेपी दो तिहाई बहुमत के साथ सरकार बनाएगी.	https://feeds.abplive.com/onecms/images/uploaded-images/2024/10/27/6a84db6f8d8d7aa0a1ca38361dfa9fea1730032246776708_original.jpg?impolicy=abp_cdn&imwidth=1200	2024-10-27 08:46:04	ABP न्यूज़
in	https://hindi.news18.com/news/world/middle-east-israel-attack-iran-nuclear-site-secretive-iranian-military-bases-aimed-by-idf-internationalnewstoday-8799373.html	Israel-Iran War: अमेरिका ने लाख मनाया... इजरायल ने बना ही दिया ईरान के न्‍यूक्लियर प्रोग्राम को निशाना! - News18 हिंदी	Israel-Iran War News: इजरायल ने हमास पर शनिवार को ड्रोन अटैक किए. बड़े पैमाने पर ईरान के सैन्‍य ठिकानों को निशाना बनाया गया. इसी बीच एक दावा यह भी किया जा रहा है कि ईरान के परमाणु ठिकाने को भी इस दौरान निशाना बनाया गया है. इन हमलों में ईरान के चार सैनिक मारे गए हैं. - israel attack iran nuclear site secretive iranian military bases aimed by idf internationalnewstoday	https://images.news18.com/ibnkhabar/uploads/2024/10/Israel-Attack-Iran-2024-10-a2d1cb76074aec3cd714adc940ccd758-16x9.jpg	2024-10-28 03:17:08	News18 हिंदी
in	https://www.amarujala.com/lucknow/lucknow-the-case-of-death-in-police-custody-reached-the-human-rights-commission-the-wife-kept-the-money-give-2024-10-27	लखनऊ: मानवाधिकार आयोग पहुंचा पुलिस हिरासत में मौत का मामला, पत्नी ने शव के ऊपर रखे विधायक के दिए पैसे - अमर उजाला	लखनऊ में पुलिस हिरासत में हुई मौत का मामला मानवाधिकार आयोग पहुंच गया है। उधर स्थानीय विधायक के समझाने पर परिजन अंतिम	https://staticimg.amarujala.com/assets/images/2024/10/27/patana-na-shava-para-rakha-vathhayaka-ka-thae-pasa_4ba360264cfe1fc27bfcbfb2d00771d3.jpeg?w=750&dpr=1.0	2024-10-27 17:31:13	अमर उजाला
in	https://ndtv.in/crime-news/murder-like-drishyam-movie-in-kanpur-love-with-gym-trainer-and-murder-know-full-story-6885826	कानपुर में दृश्यम फिल्म की तरह मर्डर, शादीशुदा महिला को जिम ट्रेनर से हुआ प्यार और फिर... - NDTV India	Kanpur Murder Case: कानपुर में ऐसे मर्डर का खुलासा हुआ है, जिसकी चर्चा पूरे देश में हो रही है. जिम के ट्रेनर ने एक महिला की हत्या की है...जानिए पूरी कहानी...	https://c.ndtvimg.com/2024-10/ifvh26g8_kanpur-murder_625x300_27_October_24.jpg?im=FaceCrop,algorithm=dnn,width=1200,height=738	2024-10-27 12:15:18	NDTV India
in	https://www.aajtak.in/visualstories/religion/dhanteras-2024-date-rahu-kaal-timing-shubh-muhurt-for-shopping-and-puja-vidhi-dhanvantari-kuber-laxmi-puja-muhurt-tvisu-182549-28-10-2024	धनतेरस पर राहु काल की छाया, शाम को इस अशुभ घड़ी में भूलकर भी न करें खरीदारी - Aaj Tak	Dhanteras 2024 Date: इस साल धनतेरस का शुभ पर्व 29 अक्टूबर को मनाया जाएगा. धनतेरस के दिन मूल्यवान और नई चीजों की खरीदारी करने से धनधान्य में वृद्धि होती है. लेकिन इस बार धनतेरस पर राहु काल भी रहेगा.	https://cf-img-a-in.tosshub.com/sites/visualstory/wp/2024/10/dhanteras-5.jpg?size=*:675	2024-10-28 05:19:39	Aaj Tak
in	https://navbharattimes.indiatimes.com/astro/rashifal/bolen-sitare/weekly-horoscope-28-october-to-3-november-2024-saptahik-rashifal-kark-singh-and-vrishchik-rashi-may-get-dhan-labh-maa-lakshmi-blessings-and-diwali-happiness-from-lakshmi-narayan-rajyog-and-mercury-transit/articleshow/114615453.cms	साप्ताहिक राशिफल, 28 अक्टूबर से 3 नवंबर 2024 : धनतेरस से सप्ताह शुरू, कर्क, सिंह, वृश्चिक समेत 6 राशि वालों को दिवाली वीक में मिलेगा महालक्ष्मी का आशीर्वाद - NBT नवभारत टाइम्स (Navbharat Times)	Weekly Horoscope, 28 October To 3 November 2024 : अक्टूबर के अंतिम सप्ताह बुध वृश्चिक राशि में गोचर करेंगे तो मंगल ग्रह भी पुष्य नक्षत्र में प्रवेश करेंगे। वहीं वृश्चिक राशि में बुध और शुक्र की युति से दिवाली के इस सप्ताह लक्ष्मी नारायण योग प्रभावी रहेगा। ग्रह और नक्षत्रों का प्रभाव देश दुनिया, अर्थव्यवस्था समेत मेष से मीन तक सभी 12 राशियों पर पड़ने वाला है। आइए जानते हैं अक्टूबर का अंतिम सप्ताह मेष से मीन तक सभी 12 राशियों के लिए कैसा रहने वाला है।	https://static.langimg.com/photo/imgsize-907037,msid-114615402/navbharat-times.jpg	2024-10-28 04:22:11	NBT नवभारत टाइम्स (Navbharat Times)
in	https://www.jagran.com/spiritual/religion-rama-ekadashi-2024-vrat-katha-ekadashi-ki-katha-in-hindi-23821666.html	Rama Ekadashi 2024: इस कथा को पढ़े बिना अधूरा रहता है रमा एकादशी का व्रत, पाठ मात्र से दूर होंगे सभी कष्ट - दैनिक जागरण (Dainik Jagran)	हिंदू धर्म में एकादशी व्रत का बेहद महत्व है। पंचांग के अनुसार इस बार यह व्रत 28 अक्टूबर को रखा जाएगा। ऐसी मान्यता है कि इस दिन व्रत करने और भगवान विष्णु की आराधना करने से साधक की सभी मनोकामनाओं की पूर्ति होती है। वहीं इस दिन व्रत का पूर्ण फल प्राप्त करने के लिए इसकी व्रत कथा  (Rama Ekadashi Vrat Katha) का पाठ जरूर करना चाहिए।	https://www.jagranimages.com/images/newimg/27102024/27_10_2024-ekadashi_katha_23821666_185025893.jpg	2024-10-28 03:15:00	दैनिक जागरण (Dainik Jagran)
in	https://hindi.news18.com/news/dharm/sugarcane-is-used-in-lakshmi-puja-on-diwali-how-to-use-it-during-the-puja-and-singnificance-local18-8799830.html	इस फल के बिना अधूरी है मां लक्ष्मी की पूजा! दिवाली पर बढ़ जाता है महत्व, साल भर खुशहाल रहता है परिवार - News18 हिंदी	धर्म विशेषज्ञ चंद्र प्रकाश ढांढण ने बताया कि हिंदू धर्मशास्त्र के अनुसार ऐसी मान्यता है कि महालक्ष्मी का एक रूप गजलक्ष्मी भी है और हाथी का गन्ना सबसे प्रिय फल होता है. इसलिए दीपावली के दिन गन्ने की पूजा की जाती है. और गन्ने को प्रसाद के रूप में ग्रहण करना चाहिए.	https://images.news18.com/ibnkhabar/uploads/2024/10/HYP_4761220_cropped_27102024_213207_img20241027wa0008_watermar_2-16x9.jpg	2024-10-28 05:47:33	News18 हिंदी
in	https://www.abplive.com/news/world/volodymyr-zelensky-louds-pm-modi-says-he-can-influence-end-of-russia-ukraine-war-2812033	'चुटकी में खत्म करा सकते हैं रूस-यूक्रेन युद्ध', जेलेंस्की ने की पीएम मोदी की तारीफ - ABP न्यूज़	Russia-Ukraine War: बीते हफ्ते PM मोदी ने 16वें ब्रिक्स सम्मेलन में रूसी राष्ट्रपति व्लादिमीर पुतिन के साथ द्विपक्षीय वार्ता में एक बार फिर से रूस-यूक्रेन युद्ध का जिक्र किया था.	https://feeds.abplive.com/onecms/images/uploaded-images/2024/08/22/680b39a157087d012c622e5f0fa616fd17242927716031021_original.jpg?impolicy=abp_cdn&imwidth=1200	2024-10-28 00:44:25	ABP न्यूज़
in	https://navbharattimes.indiatimes.com/state/jharkhand/ranchi/bjp-brahmastra-against-hemant-soren-candidate-not-yet-decided-for-barhait-seat-tundi-also-stuck/articleshow/114647479.cms	Jharkhand Chunav 2024: हेमंत सोरेन के खिलाफ BJP का 'ब्रह्मास्त्र'! NDA और इंडिया गठबंधन में अब भी 4 सीटों पर पेच - NBT नवभारत टाइम्स (Navbharat Times)	Jharkhand Assembly Election 2024: झारखंड में बीजेपी ने 68 सीटों पर उम्मीदवार उतारने का फैसला लिया है, जबकि कांग्रेस ने 28 उम्मीदवारों के नाम का ऐलान किया है। बरहेट सीट पर सीएम हेमंत सोरेन के खिलाफ उम्मीदवार तय नहीं हो पाया है। बीजेपी-आजसू टुंडी सीट पर विमर्श कर रही है।	https://static.langimg.com/photo/imgsize-62056,msid-114647739/navbharat-times.jpg	2024-10-27 05:59:52	NBT नवभारत टाइम्स (Navbharat Times)
in	https://hindi.news18.com/news/maharashtra/mumbai-maharashtra-chunav-devendra-fadnavis-says-bjp-can-not-win-alone-in-maharashtra-assembly-election-2024-8799237.html	Maharashtra Chunav: भाजपा अपने दम पर नहीं जीत सकती मगर... इलेक्शन से पहले यह क्या बोल गए देवेंद्र फडणवीस? - News18 हिंदी	Maharashtra Chunav: महाराष्ट्र विधानसभा चुनाव में भाजपा अपने दम पर सरकार नहीं बना सकती. खुद देवेंद्र फडणवीस ने यह बात कही है. उनका मानना है कि भाजपा सिंगल लार्जेस्ट पार्टी बनेगी, पर अकेले दम पर जीत नहीं सकती. - maharashtra chunav devendra fadnavis says bjp can not win alone in maharashtra assembly election 2024	https://images.news18.com/ibnkhabar/uploads/2024/10/Devendra-Fadnavis-1-2024-10-75fff9b07c24589f70eae95fd89ef26b-16x9.jpg	2024-10-28 00:17:16	News18 हिंदी
in	https://navbharattimes.indiatimes.com/state/telangana/hyderabad/hyderabad-techie-digital-arrest-for-24-hours-how-a-call-drop-ended-read-ordeal/articleshow/114675482.cms	30 घंटे तक होटल में डिजिटल अरेस्ट रहा, फिर एक कॉल ड्रॉप से यूं बचा हैदराबाद का इंजीनियर, पढ़ें पूरी कहानी - NBT नवभारत टाइम्स (Navbharat Times)	डिजिटल अरेस्ट कर रुपये ठगने के मामले लगातार बढ़ रहे हैं। इन मामलों को देखते हुए पीएम मोदी ने भी लोगों से अलर्ट रहने की अपील की। पीएम मोदी ने लोगों को सलाह दी कि वे कैसे इनसे बच सकते हैं। इसी बीच हैदराबाद में एक इंजीनियर को डिजिटल अरेस्ट करने का मामला सामने आया है।	https://static.langimg.com/photo/imgsize-1108117,msid-114675529/navbharat-times.jpg	2024-10-28 04:05:05	NBT नवभारत टाइम्स (Navbharat Times)
in	https://navbharattimes.indiatimes.com/india/census-in-india-start-for-next-year-then-clear-way-for-delimitation-of-lok-sabha-seats/articleshow/114675868.cms	देश में अगले साल से शुरू होगी जनगणना! लोकसभा सीटों के परिसीमन का साफ होगा रास्ता - NBT नवभारत टाइम्स (Navbharat Times)	देश में अगले साल से जनगणना शुरू हो सकती है। यह प्रक्रिया 2025 से 2026 तक चलेगी। 2026 में आंकड़े प्रकाशित होंगे। इसके बाद लोकसभा सीटों का परिसीमन होगा। परिसीमन प्रक्रिया 2028 तक पूरी हो सकती है। धर्म और वर्ग को ध्यान में रखा जाएगा। जाति जनगणना पर अभी फैसला नहीं हुआ है।	https://static.langimg.com/photo/imgsize-1911455,msid-114675801/navbharat-times.jpg	2024-10-28 04:14:14	NBT नवभारत टाइम्स (Navbharat Times)
in	https://hindi.news18.com/news/nation/ground-report-lawrence-bishnoi-village-dutarawali-in-fazilka-punjab-family-members-and-villages-says-he-is-hero-for-them-8799692.html	ग्राउंट रिपोर्ट: 'परदादा संत, पिता किसान, वैष्णो देवी जाने की बात कर छोड़ा घर और...' गांव वालों के लिए हीरो... - News18 हिंदी	ग्राउंड रिपोर्ट: गैंगस्टर लॉरेंस बिश्नोई एक प्रतिष्ठित परिवार से आता है. पिता किसान हैं और उनके पास 100 एकड़ जमीन है. वहीं परदादा संत थे. गांव वालों में इस परिवार और लॉरेंस की एक अलग छवि है. वे उसको अपना हीरो मानते हैं.  - ground report lawrence bishnoi village dutarawali in fazilka punjab family members and villages says he is hero for them	https://images.news18.com/ibnkhabar/uploads/2024/10/ground-report-2024-10-9672416b8a0a6a050e147913e72413e6-16x9.jpg	2024-10-28 04:33:52	News18 हिंदी
in	https://www.jagran.com/uttar-pradesh/chandauli-diwali-special-trains-2024-indian-railways-announces-special-trains-for-diwali-and-chhath-23822855.html	Indian Railway: दिवाली और छठ पर घर जाने वालों के लिए खुशखबरी! रेलवे ने चलाईं ये स्पेशल ट्रेनें - दैनिक जागरण (Dainik Jagran)	दिवाली और छठ के मौके पर यात्रियों की सुविधा के लिए भारतीय रेलवे ने कई स्पेशल ट्रेनों का ऐलान किया है। इनमें कोटा-दानापुर-कोटा पटना-न्यूजलपाईगुड़ी-पटना कटिहार-दौरम मधेपुरा-कटिहार और कटिहार-छपरा-कटिहार स्पेशल ट्रेन शामिल हैं। मुख्य जनसंपर्क अधिकारी सरस्वती चंद्र ने बताया कि चार जोड़ी स्पेशल ट्रेन का परिचालन किया जा रहा है। कोटा-दानापुर-कोटा स्पेशल ट्रेन में तृतीय वातानुकूलित श्रेणी के 19 कोच होंगे।	https://www.jagranimages.com/images/newimg/28102024/28_10_2024-indian_railway_4_23822855.jpg	2024-10-28 05:51:00	दैनिक जागरण (Dainik Jagran)
in	https://www.aajtak.in/us-page/story/us-presidential-election-2024-live-updates-kamala-harris-vs-donald-trump-swing-states-ntc-2082730-2024-10-27	US Presidential Election 2024 Live Updates: डोनाल्ड ट्रंप की न्यू यॉर्क में बड़ी रैली, पेन्सिल्वेनिया में होंगी कमला हैरिस - Aaj Tak	अमेरिका में राष्ट्रपति चुनाव निर्णायक मोड़ पर है. डेमोक्रेटिक उम्मीदवार कमला हैरिस और रिपब्लिकन उम्मीदवार डोनाल्ड ट्रम्प पूरी ताकत से प्रचार कर रहे हैं. दोनों ही उम्मीदवार स्विंग स्टेट्स में अपनी रैलियों के जरिए मतदाताओं तक पहुंचने की कोशिश कर रहे हैं, क्योंकि ये राज्य चुनावी परिणामों को प्रभावित कर सकते हैं.	https://akm-img-a-in.tosshub.com/aajtak/images/breaking_news/202410/671e8268e9207-trump-and-kamala-harris-271147763-16x9.jpg	2024-10-27 17:35:35	Aaj Tak
in	https://news.google.com/rss/articles/CBMi6AJBVV95cUxQZWdoUFhESGsxc2pUaXpNN0pLcEIzZXNYTmJJeFNyckNVQUY2T0FiMTctVFJVVW4xUGY2NzNBRG1YTHZsd0hocTNEOGstUk9LOWlDYVVDNUxqSTc3YWppT044YS1oMXNhSDFwa3ZXaVNWVlZNTjdvcnFSQ09HUk04X1ExNklSLXU4ZE5zRXUxdGtkYURVY1FlVmdacDBHX2QxTEh0LUJYVjZ3LW9ua05RX1hVbWlNaVh6U2VNc0RkeTM2OFlsUnpPQjZ3YUNxRktpN1BsRkNvVUh3VTBqREtRcXJTZGEtVFNsRnlWWmFzWlhpUndITWFGM3M0X1FJUW94OGVHX0g1TTdraXBrTTNPaUZDY0VDZUdSV2RFMU1HNjRJQ3lkZjRxRUZkY0ZKRXJWM0NEZERMTjNKc2lKZUdQWVc0S0sxbXkyVFhVNFBGWFNxZ0ZnN0tzVVR3Wk43c1VpeDNDUHo3Z03SAe4CQVVfeXFMTUI1Ulo3MmhpS3pZZ3BBeHBvZUZTUDZVQ1NCb0FKVnVwOGFXWXhkSzB1dFF1aUVLeXJGWUhKeGh2MklramN4ZFRrdmxMZXlUZU1aM19MYjg2c3RpOVl5d09WQUZVdUROMll1MFRodUEtMWxsUG1TNi1mVmNlQ0hNdDZUcnUtNUNPRjU0dzNrZGh1NHZXcFFkVEprVEtJMVNUMkt1aDR6SUl4cm9GdUZrcDJrU0FVUXVobDZhTzBfcFMzNWVGTG9kSDhCTlRwNDRscDlXZ1dDQmN3ZTFfY2lPRXpxeDFVVVdTbXJDdnUtenFuRm85cWV1UnQ5YXBWa09hZzFNdENweU5meHJjYlBLc2hPc0dXZlNjNUZqZDlyang1LWROaFdWQUt0QzZEWWpEVnZCeWphS3F2RG9WdHhWaF9qYU9kVHhFWGJXX0doZHpiWDZtMHVfOEZCYV9zV2dKd0pHbEhzVVIyeTQ4cVVn?oc=5	आज का अंक ज्योतिष 28 अक्टूबर 2024: मूलांक 9 वालों की किसी खास से होगी मुलाकात, जन्मतिथि से जानें आज कैसा रहेगा आपका दिन - NBT नवभारत टाइम्स (Navbharat Times)	None	None	2024-10-28 00:10:00	NBT नवभारत टाइम्स (Navbharat Times)
in	https://hindi.news18.com/news/nation/s-jaishankar-on-india-china-lac-deal-and-indian-army-patrolling-and-disengagement-in-depsang-and-demchok-8798934.html	LAC पर क्या भारत-चीन के बीच सुलझ गए सारे मसले, भारतीय जवान कब से करेंगे गश्त? एस जयशंकर ने सब बताया - News18 हिंदी	India China LAC: भारत और चीन के बीच लद्दाख में वास्तविक नियंत्रण रेखा (एलएसी) पर समझौते की खबर लगातार ही सुर्खियों में बनी हुई है. इस समझौते को लेकर एक सवाल यह उठ रहा है कि भारतीय सैनिक वहां पहले वाली जगहों पर कब से गश्त शुरू करेंगे. विदेश मंत्री एस जयशंकर ने रविवार को इस बाके में बड़ी जानकारी दी. - s jaishankar on india china lac deal and indian army patrolling and disengagement in depsang and demchok	https://images.news18.com/ibnkhabar/uploads/2024/10/Jaishankar-2024-10-854a855b5ba997365422aa1289624498-16x9.jpg	2024-10-27 12:18:59	News18 हिंदी
in	https://www.abplive.com/states/maharashtra/ajit-pawar-ncp-third-candiate-list-for-maharashtra-assembly-election-2024-2811672	महाराष्ट्र चुनाव के लिए अजित पवार की NCP ने जारी की तीसरी कैंडिडेट लिस्ट, इन सीटों - ABP न्यूज़	NCP Candidtates List: तीसरी लिस्ट में एनसीपी ने गेवराई से विजयसिंह पंडित को चुनावी मैदान में उतारा है. पारनेर से काशिनाथ दाते को एनीसीपी की ओर से टिकट दिया गया है. 	https://feeds.abplive.com/onecms/images/uploaded-images/2024/10/27/0d854936c83316b4dd258b44eab448031730012421467584_original.jpg?impolicy=abp_cdn&imwidth=1200	2024-10-27 06:59:21	ABP न्यूज़
