country_code	url	title	description	image_url	publish_date	source
in	https://hindi.moneycontrol.com/news/videos/markets/share-market-might-crash-if-a-correction-is-seen-at-this-level-what-should-investors-do-1932416.html	ये Level टूटा तो बर्बाद होगा शेयर बाजार! - मनी कंट्रोल	#editorstake | बाजार में अभी बेचने पर पैसा बन रहा है... बैंक निफ्टी अभी भी आउट परफॉर्म कर रहा है... निफ्टी के लिए क्या है अहम सपोर्ट? #anujsinghal से जानिए निफ्टी और निफ्टी बैंक के किन स्तरों पर आज रखें नजर?	https://images.moneycontrol.com/static-hindinews/2024/10/2410-SHARE-MARKET-CORRECTION-THUMB.jpg	2024-10-24 10:15:52	मनी कंट्रोल
in	https://hindi.news18.com/news/rajasthan/jaipur-jaipur-gold-silver-price-silver-rises-by-rs-1700-pure-gold-rises-rs-400-diwali-festive-season-local18-8791505.html	Jaipur Gold Silver Price: सोना और चमका, चांदी के भाव में भी रफ्तार, रिकॉर्ड ऊंचाई पर पहुंचे दाम, जानें आज क... - News18 हिंदी	Jaipur Gold Silver Price: सर्राफा व्यापारी ने बताया कि कोरोना महामारी की शुरुआत से लेकर अब तक सोने और चांदी के भावों में भारी तेजी देखी गई है. महामारी के दौर में सोने और चांदी को सुरक्षित निवेश विकल्प माना गया, जिससे उनकी कीमतों में लगातार वृद्धि हुई है. - jaipur gold silver price silver rises by rs 1700 pure gold rises rs 400 diwali festive season	https://images.news18.com/ibnkhabar/uploads/2024/10/HYP_4754126_cropped_24102024_071914_img20241024wa0000_watermar_1-16x9.jpg	2024-10-24 03:00:16	News18 हिंदी
in	https://hindi.cnbctv18.com/share-market/waaree-energies-ipo-listing-date-price-gmp-review-details-waree-energy-created-history-123254.htm	Waaree Energies IPO: जानिए किस भाव पर और कब होगी लिस्टिंग- टूटे सारे रिकॉर्ड- आज तक ऐसा नहीं हुआ - CNBCTV18 हिंदी	Waaree Energies IPO Listing: आईपीओ को लेकर भारतीय बाजारों में दीवानगी जारी है. कंपनी के आईपीओ अब तक के सबसे ज्यादा आवेदन मिले है. कंपनी के शेयर की लिस्टिंग 28 अक्टूबर 2024 की सुबह 10 बजे हो सकती है.	https://images.cnbctv18.com/hindicnbctv18/2024/01/IPO.jpg?im=FitAndFill,width=500,height=300	2024-10-24 13:51:20	CNBCTV18 हिंदी
in	https://navbharattimes.indiatimes.com/sports/cricket/cricket-news/sarfaraz-khan-convinced-rohit-sharma-to-take-drs-and-india-gets-will-young-wicket/articleshow/114534924.cms	IND vs NZ: पंत को कुछ पता ही नहीं चला, सरफराज खान की जिद्द पर रोहित ने लिया डीआरएस, भारत को मिल गया विकेट - NBT नवभारत टाइम्स (Navbharat Times)	India vs New Zealand: सरफराज खान की वजह से टीम इंडिया को न्यूजीलैंड के खिलाफ दूसरे टेस्ट में दूसरी सफलता मिली। कैच लेने के बाद विकेटकीपर ऋषभ पंत ने अपील ही नहीं की। लेकिन बल्लेबाज के पास फील्डिंग कर रहे सरफराज की जिद्द पर रोहित शर्मा ने डीआरएस लिया और भारत को विकेट मिल गया। 	https://static.langimg.com/photo/imgsize-93154,msid-114535446/navbharat-times.jpg	2024-10-24 06:38:11	NBT नवभारत टाइम्स (Navbharat Times)
in	https://www.abplive.com/states/maharashtra/congress-candidate-list-in-maharashtra-prithviraj-chavan-jyoti-gaikwad-vijay-namdevrao-wadettiwar-2810183	Maharashtra Election: 48 सीटों पर कांग्रेस की लिस्ट, पृथ्वीराज चव्हाण, नाना पटोले सहित इन नेताओं - ABP न्यूज़	Congress Candidate List In Maharashtra: एमवीएम में अभी तक के सीटों के समझौते के तहत कांग्रेस को 85 सीटें मिली हैं. इनमें से 48 सीटों पर पार्टी ने पहली लिस्ट जारी कर दी है.	https://feeds.abplive.com/onecms/images/uploaded-images/2024/10/24/fb432ca3645e12c59715f7e774637b801729786174563129_original.jpg?impolicy=abp_cdn&imwidth=1200	2024-10-24 15:54:18	ABP न्यूज़
in	https://www.aajtak.in/india/news/story/preparations-to-take-action-against-those-who-send-threatening-messages-to-flights-government-sought-data-from-meta-and-x-ntc-rpti-2080015-2024-10-24	फ्लाइट्स को धमकी भरे मैसेज भेजने वालों पर एक्शन की तैयारी, सरकार ने META और X से मांगा डेटा - Aaj Tak	गुरुवार को एक साथ एअर इंडिया के 20, इंडिगो के 20, विस्तारा के भी 20 और अकासा के 25 विमानों को की बम से उड़ाने की धमकियां मिलीं. आज की घटना से पहले, 170 से ज़्यादा फ्लाइट्स में बम की धमकियां मिली थीं, जिनमें से ज़्यादातर सोशल मीडिया प्लेटफ़ॉर्म से आई थीं. 	https://akm-img-a-in.tosshub.com/aajtak/images/story/202410/671a2df93e854-flight-bomb-threat-242227750-16x9.jpg	2024-10-24 11:25:30	Aaj Tak
in	https://www.indiatv.in/india/national/cyclone-dana-indian-railways-several-trains-cancelled-many-flights-shut-due-to-biju-patnaik-airport-closed-2024-10-24-1085549	चक्रवाती तूफान ‘दाना’ का रेल और फ्लाइट सेवाओं पर असर, कई ट्रेनें कैंसिल, देखें-पूरी लिस्ट - India TV Hindi	पश्चिम बंगाल और ओडिशा की कई ट्रेनों को कैंसिल कर दिया गया है। चक्रवाती तूफान दाना की वजह से यात्रियों की परेशानी बढ़ गई है। लोग रेलवे स्टेशन पर इंतजार करते देखे जा रहे हैं।	https://resize.indiatv.in/resize/newbucket/1200_-/2024/10/imd-10-1729737810.jpg	2024-10-24 02:38:01	India TV Hindi
in	https://www.bhaskar.com/national/news/terrorist-attack-on-army-vehicle-in-jammu-and-kashmir-5-injured-133857234.html	कश्मीर में सेना के वाहन पर आतंकी हमला: 3 जवान शहीद और एक पोर्टर की मौत, गुलमर्ग के नागिन इलाके में सर्च ऑपर... - Dainik Bhaskar	जम्मू-कश्मीर के बारामूला जिले के गुलमर्ग के नागिन इलाके में एलओसी के पास गुरुवार शाम 18 राष्ट्रीय राइफल्स के वाहन पर आतंकियों ने हमला किया। आतंकियों की गोलीबारी में 3 जवान शहीद हो गए। इसके अलावा एक पोर्टर की भी मौत हो गई। | जम्मू-कश्मीर के गुलमर्ग के बोटा पथरी के नागिन इलाके के पास गुरुवार शाम सेना के वाहन पर आतंकी हमला हुआ। इसमें कई जवानों के घायल होने की खबर सामने आई है। सुरक्षाबलों ने इलाके को घेर लिया है और आतंकियों की तलाश शुरू कर दीJammu Kashmir army vehicle terrorist attack gulmarg nagin	https://images.bhaskarassets.com/thumb/730x0/web2images/521/2024/10/24/comp-181_1729785945.gif	2024-10-24 14:37:16	Dainik Bhaskar
in	https://hindi.news18.com/news/nation/what-is-grazing-land-on-lac-ladakh-region-and-what-controversy-rajnath-singh-statement-on-india-china-disengagement-8793420.html	Explainer: एलएसी पर क्‍या है चरागाहों का सच, क्‍यों होता है विवाद? राजनाथ सिंह ने क‍िया ज‍िक्र - News18 हिंदी	लद्दाख में चीन के साथ ह‍िंंसक संघर्ष के बाद गांव वालों को अपने पारंपर‍िक चरागाह पर जाने से रोक द‍िया था. लेकिन अब चीन के साथ बनी सहमत‍ि के बाद ये लोग फ‍िर अपने पशु चराने उन इलाकों में जा सकेंगे. रक्षामंत्री राजनाथ सिंह ने इसके बारे में जानकारी दी है. - what is grazing land on lac ladakh region and what controversy rajnath singh statement on india china disengagement	https://images.news18.com/ibnkhabar/uploads/2024/10/india-china-relation-2024-10-e7ff31dd77fb290823af4dda6e3820de-16x9.jpg	2024-10-24 15:27:36	News18 हिंदी
in	https://www.abplive.com/web-stories/india/priyanka-gandhi-vadra-property-wayanad-by-election-kerala-2809923	प्रियंका गांधी के पास कितना सोना? - ABP न्यूज़	None	https://feeds.abplive.com/onecms/images/uploaded-images/2024/10/24/3e9e1ccb8fe66880325acb166863d1dd17297610466841123_original.jpg	2024-10-24 13:34:03	ABP न्यूज़
in	https://news.google.com/rss/articles/CBMixAJBVV95cUxNbUlzVkRpYklvZXZ1Wm43MHc2OEpwcVZrczVWcnZseU9rN2JwVUxWWVpTZnhVS0FIMFJWT2FxUmFIWDZDdlF4MUhpcGlnWmxlTGFtdk9FWk42VHNCZlBOY3UzMjkwMDYzN1JwMnVhanU3SkZYamUyU0x2YThEOXpuT3JqNzBVV2stdHU2VjFuX1ZJVGY2RGhWd0l0eXBsVkNpT2U4T2ozbG5KV0RmOWFmSm1WZGcxcFpEN0NMSXU0d3YxOHZrNno4cFdQUWdWcFp6ZV9jNU1UOHZwQ1lKelNTQ1R3RHBKd1BNZ1hJelZyUHVlQzBTY2JjZzJzNmhzYjM4ckNrY01YU2w5WGJkNkJ5LUNLRVRFMmVZS3lTVklLTVI4cnppWVd2azdvVkFaTElqajVDOXhJT0d4NkQ0Rm83czVfTXbSAcoCQVVfeXFMUGExN0V2U2thMkVrWFk0Q2lOaDZQa0pwNEFNUEloSWR3WVZ3aGRJLXpsb1lBOG5NU01sSWNSX1JNRzQxeVd6Wk9jelhJOU9JQzBvU1hBME9SQlRhTHNlVHVMOVpONE9GQmJFWC1KbVR4S01MNDJYTjkxektiZnlKdzJucm5wY3ZET1hoZEZLaVZsV1FjNEFpaVJXandEY0tmZXQxSHlsYmh0cFozb1g0ZGhXNDNWaHAzb3RWcGtBdFczUHFOa2tCLTMzVG9CMXpiNjlKYlR2MW53WGNSX0p1Y08zTnN1YTlYVHpFVVRLMEpoek5iVjY2bXZkZHQ2NnlKVzZxd1lETHBMdjlBeGxqVTgxMXJOdkZjN0lmRVhGMUVRMnRDeEM3N0pIaUNfeUxXa1VYZ0tOWlcwMW5QdWxmMm91TjFMcHp6SWNn?oc=5	कनाडा ने वॉन्टेड लिस्ट से अचानक हटाया इस कुख्यात गैंगस्टर का नाम, भारत से है कनेक्शन - Aaj Tak	एक इस हत्याकांड के बाद गोल्डी कनाडा भाग गया. इसके बाद वह वहीं से पंजाब में अलग-अलग वारदातों को अंजाम देने के लिए साजिश रचता रहा है. गोल्डी की 5 अलग-अलग तस्वीरें पंजाब पुलिस के डोजियर में हैं, जिन्हें देखने से पता चलता है की हालात के साथ वो अपना हुलिया बदलता रहा है.	https://akm-img-a-in.tosshub.com/aajtak/images/story/202410/671a6876ada1e-goldy-barar-243201128-16x9.jpg	2024-10-24 15:37:58	Aaj Tak
in	https://navbharattimes.indiatimes.com/world/rest-of-europe/brics-summit-2024-expert-says-india-holds-best-geopolitical-position-globally/articleshow/114536311.cms	रूस, चीन और ईरान बनाम अमेरिका... ब्रिक्स समिट में भारत ने साधा ऐसा कूटनीतिक संतुलन अमेरिकी एक्सपर्ट हुए मुरीद, जमकर तारीफ - NBT नवभारत टाइम्स (Navbharat Times)	BRICS Summit India: रूस के कजान में हुए ब्रिक्स शिखर सम्मेलन ने दुनियाभर का ध्यान खींचा है। मेजबान रूसी  राष्ट्रपति व्लादिमीर पुतिन, चीनी प्रेसीडेंट शी जिनपिंग, भारत के पीएम नरेंद्र मोदी और ईरान के राष्ट्रपति मसूद पेजेश्कियान समेत तमाम बड़े नेताओं के आने से इस समिट ने एक्सपर्ट का भी ध्यान खींचा है।	https://static.langimg.com/photo/imgsize-100278,msid-114535952/navbharat-times.jpg	2024-10-24 06:55:46	NBT नवभारत टाइम्स (Navbharat Times)
in	https://www.abplive.com/states/up-uk/yogi-adityanath-government-gift-bonus-to-16-lakh-employee-in-up-2809483	यूपी के 16 लाख कर्मचारियों को योगी सरकार का तोहफा, बोनस देने का आदेश जारी - ABP न्यूज़	UP News: प्रदेश के 16 लाख कर्मचारियों को यूपी सरकार की तरफ से दिवाली पर तोहफा मिला है. इस संबंध में शासन आदेश बुधवार को जारी कर दिया गया है.	https://feeds.abplive.com/onecms/images/uploaded-images/2024/10/20/9f5f2e7559211aa4558bb8f6cbae32c31729415505381651_original.jpg?impolicy=abp_cdn&imwidth=1200	2024-10-23 13:47:48	ABP न्यूज़
in	https://www.amarujala.com/uttar-pradesh/agra/akhilesh-yadav-jija-anujesh-yadav-bluntly-in-this-fight-there-is-no-uncle-no-nephew-sp-v-s-bjp-war-2024-10-24	UP ByPoll: अखिलेश यादव के जीजा अनुजेश यादव की दो टूक, इस लड़ाई में फूफा, न कोई भतीजा...सपा v/s भाजपा की जंग - अमर उजाला	भाजपा से टिकट की घोषणा होने के बाद अनुजेश यादव मैनपुरी में कार्यालय पर पहुंचे। यहां उन्होंने मीडिया के सवालों से जवाब	https://staticimg.amarujala.com/assets/images/2024/10/24/taja-paratapa-akhalsha-yathava-anajasha_dd0ccc924d4d2cfb3fc7081997520cee.jpeg?w=750&dpr=1.0	2024-10-24 14:13:00	अमर उजाला
in	https://www.aajtak.in/elections/assembly-chunav/story/maharashtra-assembly-elections-2024-mahim-seat-uddhav-thackeray-shiv-sena-ubt-amit-thackeray-mns-raj-thackeray-ntc-bikt-dskc-2079886-2024-10-24	महाराष्ट्र चुनाव में उद्धव ठाकरे ने तोड़ दी परिवार की रवायत, राज ठाकरे ने दिखाया था बड़ा दिल - Aaj Tak	उद्धव ठाकरे की पार्टी शिवसेना यूबीटी ने 65 उम्मीदवारों की लिस्ट जारी की है. इस पहली लिस्ट में ही उद्धव की पार्टी ने ठाकरे परिवार की रवायत तोड़ दी है. ऐसा तब है जब उनके चचेरे भाई राज ठाकरे ने पिछले चुनाव में बड़ा दिल दिखाया था.	https://akm-img-a-in.tosshub.com/aajtak/images/story/202410/671a1dc5dd6f9-20241024-241320649-16x9.jpg	2024-10-24 09:55:15	Aaj Tak
in	https://ndtv.in/faith/ahoi-ashtami-2024-ahoi-ashtami-puja-vidhi-and-shubh-muhurt-6855656	Ahoi Ashtami 2024: आज है अहोई अष्टमी, इस विधि से करें अहोई माता की पूजा संपन्न - NDTV India	Ahoi Ashtami Puja: मान्यतानुसार अहोई अष्टमी का व्रत रखने पर संतान की उम्र लंबी होती है. हर साल करवाचौथ के चार दिन बाद अहोई अष्टमी का व्रत रखा जाता है.	https://c.ndtvimg.com/2020-11/fh08rca_ahoi-ashtami-2020_625x300_07_November_20.jpg?im=FeatureCrop,algorithm=dnn,width=1200,height=738	2024-10-24 01:36:00	NDTV India
in	https://www.abplive.com/news/india/jammu-kashmir-terrorist-attack-people-from-other-states-are-again-being-targeted-a-laborer-from-up-was-fired-in-batgund-tral-2809636	Terrorist Attack: अब घाटी में यूपी के शख्स को मारी गोली, जम्मू कश्मीर में एक और गैर कश्मीरी - ABP न्यूज़	Terrorist Attack in Kashmir: इस हमले से पहले आतंकियों ने 20 अक्टूबर को गांदरबल में हमला करके 7 लोगों को मौत के घाट उतार दिया था. इससे पहले शोपियां में एक गैर स्थानीय व्यक्ति को निशाना बनाया था.	https://feeds.abplive.com/onecms/images/uploaded-images/2024/10/24/5c56ba70c886ab9367392f02f7be4e261729743569920858_original.jpg?impolicy=abp_cdn&imwidth=1200	2024-10-24 03:43:02	ABP न्यूज़
in	https://www.amarujala.com/photo-gallery/astrology/predictions/aaj-ka-rashifal-24-october-know-today-horoscope-predictions-for-aries-taurus-virgo-leo-in-hindi-2024-10-23	Aaj Ka Rashifal: मेष, सिंह और मीन राशि वालों को व्यापार में मिलेगा धन लाभ, पढ़ें दैनिक राशिफल - अमर उजाला	जानें सभी राशियों का आज का दैनिक राशिफल? आज के राशिफल में आपके लिए नौकरी, व्यापार, लेन-देन, परिवार और मित्रों के साथ संबंध,सेहत	https://staticimg.amarujala.com/assets/images/2024/10/23/24-october-ka-rashifal_0255856b6e6a70f5aba328b146545249.jpeg?w=750&dpr=1.0	2024-10-24 02:05:00	अमर उजाला
in	https://www.aajtak.in/uttar-pradesh/story/up-by-election-after-bjp-mayawati-also-declared-her-candidates-on-eight-assembly-seats-bsp-candidates-list-lclam-dskc-2079967-2024-10-24	यूपी उपचुनाव: BJP के बाद मायावती ने भी घोषित किए 8 सीटों पर अपने कैंडिडेट, जानें किसे कहां से मिला टिकट - Aaj Tak	UP Bypolls: मायावती की पार्टी ने भी उत्तर प्रदेश की नौ विधानसभा सीटों में से आठ के लिए अपने उम्मीदवारों की घोषणा कर दी है. इन सीटों पर 13 नवंबर को वोट डाले जाएंगे. जबकि, वोटों की गिनती 23 नवंबर को होगी. 	https://akm-img-a-in.tosshub.com/aajtak/images/story/202410/671a25596e313-mayawati--bsp--one-nation-one-election--ek-desh-ek-chunav--up-news--uttar-pradesh-news--up-news-in-h-124214204-16x9.jpg	2024-10-24 10:46:27	Aaj Tak
in	https://navbharattimes.indiatimes.com/india/sheikh-hasina-came-india-left-bangladesh-but-hungama-continues-know-latest-update/articleshow/114545080.cms	भारत तो आ गईं शेख हसीना लेकिन बांग्लादेश में अब भी नहीं थम रहा बवाल, जानिए अपडेट - NBT नवभारत टाइम्स (Navbharat Times)	Sheikh Hasina Latest Update: बांग्लादेश में हिंसक प्रदर्शन के बाद पूर्व प्रधानमंत्री शेख हसीना ने अपना देश छोड़ दिया था। ढाका छोड़कर वो भारत आ गई थीं। भले ही उन्हें अपना देश छोड़े काफी समय हो गया है लेकिन हंगामा थम नहीं रहा। एक बार फिर उन्हें लेकर ढाका में बवाल तेज हो गया है।	https://static.langimg.com/photo/imgsize-55126,msid-114548848/navbharat-times.jpg	2024-10-24 11:50:16	NBT नवभारत टाइम्स (Navbharat Times)
in	https://hindi.news18.com/news/rajasthan/jaipur-rajasthan-upchunav-congress-released-candidates-list-amil-ola-from-jhunjhunu-and-aryan-khan-from-ramgarh-candidates-8791436.html	Rajasthan Upchunav : कांग्रेस ने आधी रात को जारी की प्रत्याशियों की सूची, चौंकाने वाले नाम आए सामने - News18 हिंदी	Rajasthan Upchunav : राजस्थान कांग्रेस ने सात सीटों पर होने वाले उपचुनाव के लिए अपने सातों प्रत्याशियों का ऐलान कर दिया है. बुधवार आधी रात को जारी की गई सूची के अनुसार झुंझुनूं से सांसद बृजेन्द्र ओला के बेटे अमित ओला और रामगढ़ से दिवंगत विधायक जुबेर खान के बेटे आर्यन खान को चुनाव मैदान में उतारा गया है. - rajasthan upchunav congress released candidates list amil ola from jhunjhunu and aryan khan from ramgarh candidates	https://images.news18.com/ibnkhabar/uploads/2024/10/Rajasthan-Upchunav-2024-10-2adc63ad293dcbaa2ffcbf6bca408fe0-16x9.jpg	2024-10-24 01:12:50	News18 हिंदी
