country_code	url	title	description	image_url	publish_date	source
in	https://navbharattimes.indiatimes.com/metro/delhi/crime/delhi-rohini-crpf-school-blast-update-suspected-things-captured-in-cctv-7-key-points-full-details/articleshow/114447039.cms	दिल्ली स्कूल ब्लास्ट: सीसीटीवी में दिखी संदिग्ध गतिविधि, जांच से जुड़ी 7 बड़ी बातें जान लीजिए - NBT नवभारत टाइम्स (Navbharat Times)	दिल्ली के रोहिणी में सीआरपीएफ स्कूल के पास हुए ब्लास्ट की जांच में खालिस्तानी ऐंगल सामने आया है। दिल्ली पुलिस ने घटनास्थल के आसपास के सारे CCTV DVR कब्जे में ले लिए हैं। टेलीग्राम चैनल जस्टिस लीग इंडिया पर धमकी भरा संदेश मिल चुका है। जांच एजेंसियां विभिन्न पहलुओं की गहन जांच कर रही हैं।	https://static.langimg.com/photo/imgsize-116454,msid-114447001/navbharat-times.jpg	2024-10-22 04:03:53	NBT नवभारत टाइम्स (Navbharat Times)
in	https://www.abplive.com/states/haryana/lawrence-bishnoi-threatened-by-bhim-sena-chief-satpal-tanwar-after-threats-to-salman-khan-ann-2808903	अब भीम सेना ने लॉरेंस बिश्नोई को दी चुनौती, 'गृहमंत्री इजाजत दें तो 2 घंटे के अंदर...' - ABP न्यूज़	Lawrence Bishnoi News: भीम सेना के अध्यक्ष नवाब सतपाल तंवर ने लॉरेंस बिश्नोई को मारने की धमकी दी है. तंवर ने कहा कि अगर गृह मंत्री अनुमति दें तो वे 2 घंटे 4 मिनट में बिश्नोई को खत्म कर देंगे.	https://feeds.abplive.com/onecms/images/uploaded-images/2024/10/23/063ad31494d07bfcc16e00a2017d307d1729646099105584_original.jpg?impolicy=abp_cdn&imwidth=1200	2024-10-23 01:17:22	ABP न्यूज़
in	https://hindi.news18.com/news/world/middle-east-israel-iran-war-news-anti-ballistic-missile-system-arman-can-identify-destroy-targets-coming-from-israel-8787788.html	Israel-Iran War: डेविड स्लिंग और आयरन डोम तो खूब हुआ...अब नेतन्याहू की उम्मीदों पर पानी फेरेगा ईरान का 'अरम... - News18 हिंदी	Israel-Iran war: ईरान पर कभी भी मिसाइलों की बरसात हो सकती है. इजरायल का बदला लेने का प्लान पूरी तरह से तैयार है. हालांकि, संभावित खतरों को देखते हुए ईरान ने अपना एंटी मिसाइल डिफेंस सिस्टम अरमान को एक्टिव कर दिया है.  - israel iran war news anti ballistic missile system arman can identify destroy targets coming from israel	https://images.news18.com/ibnkhabar/uploads/2024/10/Iran-Arman-2024-10-cd3d46bd105bb1046ba2ed6e3847a331-16x9.jpg	2024-10-22 08:17:14	News18 हिंदी
in	https://hindi.news18.com/news/dharm/rama-ekadashi-2024-try-these-simple-and-useful-astro-tips-for-money-and-marriage-problems-8786187.html	Rama Ekadashi 2024 Upay: रमा एकादशी पर लक्ष्मी-नारायण की पूजा के साथ करें ये उपाय, बढ़ेगा धन, जल्दी होगी शा... - News18 हिंदी	Rama Ekadashi 2024 Upay : कार्तिक माह को एक धार्मिक और पवित्र माह के रूप में देखा जाता है और इस महीने में आने वाली रमा एकादशी के दिन लक्ष्मी-नारायण की पूजा विधि विधान से की जाती है.	https://images.news18.com/ibnkhabar/uploads/2024/10/Rama-Ekadashi-2024-2024-10-f2af04df7ff56413f513cc40d463ff3e-16x9.jpg	2024-10-22 02:09:31	News18 हिंदी
in	https://www.amarujala.com/photo-gallery/uttar-pradesh/agra/akhilesh-yadav-nephew-tej-pratap-has-2-5-kg-gold-property-worth-10-25-crores-his-wife-is-also-a-millionaire-2024-10-22	UP: अखिलेश यादव के भतीजे तेजप्रताप के पास है ढाई किलो सोना... 10.25 करोड़ की है संपत्ति; पत्नी भी हैं करोड़पति - अमर उजाला	जनता के बीच सादगी पसंद नजर आने वाले पूर्व सांसद और करहल सीट से प्रत्याशी तेजप्रताप यादव असल जिंदगी में आभूषणों के शौकीन	https://staticimg.amarujala.com/assets/images/2024/10/22/tej-pratap_22e7c1cdc2ade61efc6a523087481c8e.jpeg?w=750&dpr=1.0	2024-10-22 06:42:32	अमर उजाला
in	https://www.abplive.com/states/bihar/bihar-cm-nitish-cabinet-important-meeting-25-agendas-were-approved-ann-2808561	Bihar News: नीतीश कैबिनेट की अहम बैठक खत्म, 25 एजेंडों पर लगी मुहर, होमगार्ड जवानों के - ABP न्यूज़	Bihar Cabinet Decision: मुख्यमंत्री नीतीश कुमार ने आज कैबिनेट की अहम बैठक बुलाई थी. मुख्य सचिवालय स्थित कैबिनेट कक्ष में हुई बैठक में कई बड़े फैसले लिए गए.	https://feeds.abplive.com/onecms/images/uploaded-images/2024/10/22/cf8debbc3f8364c0ac3bbe683b402aec17295899675611008_original.jpg?impolicy=abp_cdn&imwidth=1200	2024-10-22 12:26:55	ABP न्यूज़
in	https://hindi.news18.com/news/rajasthan/jaipur-weapons-pistol-used-to-murder-baba-siddiqui-smuggled-into-india-through-rajasthan-border-8788429.html	बाबा सिद्दीकी को मारने वाली पिस्‍टल किस रास्‍ते से आई... पुलिस को ऐसे टेंशन दे रहे लॉरेंस बिश्‍नोई के गुर्ग... - News18 हिंदी	Rajasthan News : जांच को गुमराह करने और देरी करने के लिए आरोपी पुराने हथकंडे अपना रहे हैं. लॉरेंस के चेले पुलिस को लगातार चकमा दे रहे हैं. गोलमोल जवाब दे रहे हैं. - weapons pistol used to murder baba siddiqui smuggled into india through rajasthan border	https://images.news18.com/ibnkhabar/uploads/2024/10/weapons-pistol-used-to-murder-baba-siddiqui-smuggled-into-India-through-Rajasthan-border-2024-10-e643dcd21906e63c25c190164afa041e-16x9.jpg	2024-10-22 10:20:00	News18 हिंदी