country_code	url	title	description	image_url	publish_date	source
in	https://hindi.news18.com/news/dharm/utpanna-ekadashi-2024-vrat-katha-story-of-margashirsha-krishna-ekadashi-vrat-muhurat-parana-samay-8847053.html	Ekadashi Vrat Katha: 26 नवंबर को है उत्पन्ना एकादशी, पूजा समय पढ़ें दैत्य मुर की कथा, जानें मुहूर्त और पारण... - News18 हिंदी	Ekadashi Vrat Katha: इस साल उत्पन्ना एकादशी का व्रत 26 नवंबर दिन मंगलवार को रखा जाएगा. वैदिक पंचांग के अनुसार, मार्गशीर्ष या अगहन माह के कृष्ण पक्ष की एकादशी तिथि को उत्पन्ना एकादशी कहते हैं. पुरी के ज्योतिषाचार्य डॉ. गणेश मिश्र से जानते हैं उत्पन्ना एकादशी व्रत कथा, मुहूर्त और पारण समय के बारे में.   - utpanna ekadashi 2024 vrat katha story of margashirsha krishna ekadashi vrat muhurat parana samay	https://images.news18.com/ibnkhabar/uploads/2024/11/Utpanna-Ekadashi-2024-Vrat-Katha-2024-11-066ecf6ae18debe215b2d0b32ca0b078-16x9.jpg	2024-11-25 00:46:03	News18 हिंदी
in	https://navbharattimes.indiatimes.com/astro/rashifal/bolen-sitare/aaj-ka-rashifal-26-november-2024-horoscope-today-vakri-budh-creating-budhaditya-yog-lucky-for-vrishabha-tula-and-kumbh-rashi/articleshow/115661524.cms	आज का राशिफल 26 नवंबर 2024: वक्री बुध बना रहे बुधादित्य योग, वृषभ, तुला, कुंभ सहित कई राशियों को मिलेगा लाभ, जानें अपना आज का भविष्यफल - NBT नवभारत टाइम्स (Navbharat Times)	आज 26 नवंबर दिन मंगलवार को चंद्रमा का गोचर कन्या राशि में हस्त नक्षत्र से होगा। और चंद्रमा पर गुरु की पंचम शुभ दृष्टि बनी रहेगी, लेकिन आज बुध वृश्चिक राशि में चाल परिवर्तन करके वक्री भी होने जा रहे हैं। ऐसे में आज का दिन कई राशियों के लिए मिश्रित परिणाम देने वाला रहेगा। लेकिन वृषभ, तुला और कुंभ राशि के लिए दिन लाभदायक रहेगा। जानें अपना आज का राशिफल विस्तार पूर्वक।	https://static.langimg.com/photo/imgsize-104022,msid-115661928/navbharat-times.jpg	2024-11-25 23:07:00	NBT नवभारत टाइम्स (Navbharat Times)
in	https://www.aajtak.in/education/news/story/schools-in-delhi-ncr-may-reopen-as-the-supreme-court-allows-the-caqm-to-consider-allowing-offline-schools-rpti-2106249-2024-11-25	Air Pollution: क्या दिल्ली में खुलेंगे स्कूल? सुप्रीम कोर्ट ने CAQM पर छोड़ा फैसला - Aaj Tak	राजधानी की हवाओं में घुले प्रदूषण के जहर को ध्यान में रखते हुए बच्चों के लिए स्कूलों को बंद करके उनकी ऑनलाइन कक्षाएं शुरू करने को कहा गया था. लेक‍िन, सोमवार को सुप्रीम कोर्ट ने कहा है कि यह सीएक्यूएम तय करे क‍ि स्कूल ऑफलाइन खोलने हैं या हाइब्र‍िड मोड में ही कक्षाएं लगाई जा सकती हैं. 	https://akm-img-a-in.tosshub.com/aajtak/images/story/202411/6744531599207-delhi-air-pollution-14122476-16x9.jpeg	2024-11-25 10:37:11	Aaj Tak
in	https://hindi.news18.com/news/business/economy-india-slams-cop-29-climate-finance-by-calling-it-optical-illusion-chandani-raina-8857728.html	अमेरिका, चीन जैसे देशों ने दिया धोखा, तो भारत ने रगड़ दिया, मुंह पर सुनाई खरी-खरी - News18 हिंदी	COP29 में जलवायु निधि पर असहमति उभरी.  विकासशील देशों के लिए $300 अरब वार्षिक फाइनेंस के लक्ष्य को भारत ने "दृष्टि भ्रम" बताते हुए खारिज कर दिया और कम से कम $1 ट्रिलियन की मांग की. भारत ने विकसित देशों पर जिम्मेदारी से बचने का आरोप लगाया. - india slams cop 29 climate finance by calling it optical illusion chandani raina	https://images.news18.com/ibnkhabar/uploads/2024/11/COP-29-2024-11-107351015dd16aed85bd3e2898687d79-16x9.jpg	2024-11-25 09:43:39	News18 हिंदी
in	https://www.zeebiz.com/hindi/personal-finance/income-tax/pan-2-0-new-updates-digital-security-e-pan-features-192623	PAN 2.0 को कैबिनेट की मंजूरी: क्या बेकार हो गया आपका मौजूदा पैन कार्ड? जानिए इससे जुड़े सभी सवालों का जवाब - Zee Business हिंदी	PAN 2.0 new updates: यह नया सिस्टम मौजूदा पैन कार्ड सिस्टम को डिजिटल रूप से अपग्रेड करेगा और टैक्स सिस्टम को ज्यादा पारदर्शी और किफायती बनाएगा. कैबिनेट ने 1,435 करोड़ रुपए की PAN 2.0 पहल को मंजूरी दी है, जिससे यह सुनिश्चित होगा कि आपका मौजूदा पैन वैध बना रहेगा.	https://cdn.zeebiz.com/hindi/sites/default/files/styles/zeebiz_850x478/public/2024/11/26/201512-pan-20.png	2024-11-25 18:41:00	Zee Business हिंदी
in	https://www.prabhatkhabar.com/national/constitution-day-opposition-demands-rahul	Constitution Day: विपक्ष की ओर से राहुल गांधी संबोधन की मांग - प्रभात खबर - Prabhat Khabar	Constitution Day: इंडिया गठबंधन के नेताओं ने लोकसभा अध्यक्ष ओम बिरला को पत्र लिखकर इस कार्यक्रम में विपक्ष के नेता के तौर पर राहुल गांधी के संबोधन की मांग.	https://www.prabhatkhabar.com/wp-content/uploads/2024/11/rahul-gandhi-press-conference.jpg	2024-11-25 12:17:22	प्रभात खबर - Prabhat Khabar
in	https://hindi.news18.com/news/business/latest-mukhyamantri-ladki-bahin-yojana-benefit-increase-from-1500-to-rs-2100-how-to-allocate-fund-8858009.html	क्‍या सरकार और बढ़ाएगी मुख्यमंत्री लड़की बहिन योजना की राशि! कहां से आएगा इसके लिए पैसा, क्‍या हैं विकल्‍प - News18 हिंदी	Mukhyamantri Ladki Bahin Yojana : महाराष्‍ट्र में भाजपा की अगुवाई वाले महायुति गंठबंधन की जीत में सबसे बड़ी भूमिका निभाने वाली योजना अब सरकार के सामने एक चुनौती बन गई है. मुख्‍यमंत्री लड़की बहिन योजना के लिए सरकार ने पहले 35 हजार करोड़ का आवंटन किया था, लेकिन इसकी राशि बढ़ाने का वादा पूरा करने के लिए और फंड की जरूरत है. आखिर यह फंड कहां से आएगा, इस पर बाजार विश्‍लेषकों ने कुछ विकल्‍प सुझाए हैं. - mukhyamantri ladki bahin yojana benefit increase from 1500 to rs 2100 how to allocate fund	https://images.news18.com/ibnkhabar/uploads/2024/11/ladki-bahin-2024-11-68a755505ce4621b6616afabf5e4466a-16x9.jpg	2024-11-25 09:12:38	News18 हिंदी
in	https://www.bbc.com/hindi/articles/c1mlv0rgx47o	क्या महाराष्ट्र में शरद पवार का 'करिश्मा' ख़त्म हो गया है? - BBC News हिंदी	महाराष्ट्र चुनाव के नतीजों में शरद पवार को 86 में से सिर्फ 10 सीटें ही मिलीं. अब सियासी गलियारों में उनके भविष्य पर सवाल उठ रहे हैं. 	https://ichef.bbci.co.uk/news/1024/branded_hindi/b1e1/live/47a10c40-aa7f-11ef-8da9-03674e01ec99.jpg	2024-11-25 06:08:31	BBC News हिंदी
in	https://www.aajtak.in/sports/cricket/story/aus-vs-ind-1st-test-2024-perth-highlights-india-biggest-test-wins-against-australia-in-australia-by-295-runs-break-1977-records-jasprit-bumrah-yashasvi-jaiswal-virat-kohli-tspo-dskc-2106103-2024-11-25	AUS Vs IND 1st Test 2024 Perth Highlights: पर्थ टेस्ट में बुमराह एंड कंपनी ने गाड़ा त‍िरंगा, दर्ज की ऑस्ट्रेल‍िया में सबसे बड़ी जीत, 47 साल पुराना रिकॉर्ड ध्वस्त - Aaj Tak	Biggest win in Australia, AUS Vs IND 1st Test 2024: भारतीय क्रिकेट टीम ने पर्थ टेस्ट में जसप्रीत बुमराह के नेतृत्व में ऑस्ट्रेल‍ियाई सरजमीं पर सबसे बड़ी जीत दर्ज की है. रनों के ल‍िहाज से मिली इस महाव‍िजय ने 1977 के रिकॉर्ड को चकनाचूर कर दिया है. वहीं ऑप्टस स्टेडियम में यह ऑस्ट्रेल‍िया की पहली हार रही. 
	https://akm-img-a-in.tosshub.com/aajtak/images/story/202411/67442eb960b5a-team-india-biggest-win-in-australia-250051723-16x9.jpg	2024-11-25 08:01:46	Aaj Tak
in	https://hindi.news18.com/news/entertainment/bollywood-abhishek-bachchan-emotional-comment-on-wife-aishwarya-rai-amid-divorce-rumors-says-mai-lucky-hun-8858675.html	तलाक की अफवाहों के बीच अभिषेक बच्चन हुए इमोशनल, ऐश्वर्या राय पर तोड़ी चुप्पी- 'मैं जानता हूं कि...' - News18 हिंदी	Aishwarya Abhishek Bachchan: ऐश्वर्या राय कहीं भी जाती हैं, अपनी बेटी आराध्या बच्चन का खास ख्याल रखती हैं. एक्ट्रेस की नंद श्वेता बच्चन ने भी स्वीकार किया था कि वे एक बेहतरीन मां हैं. अभिषेक बच्चन जब बेटी आराध्या बच्चन के बर्थडे में नहीं दिखे, तो उन्हें काफी आलोचना झेलनी पड़ी. तलाक की अफवाहों के बीच अभिषेक बच्चन ने अब ऐश्वर्या राय पर चुप्पी तोड़ी है और उनका आभार जताते हुए कहा कि वे जब फिल्मों की शूटिंग में बिजी होते हैं, तब ऐश्वर्या राय घर पर मौजूद रहती हैं. उन्होंने बेटी आराध्या का ख्याल रखने के लिए ऐश्वर्या राय का शुक्रिया अदा किया और तलाक की अफवाहों का खंडन किया. - abhishek bachchan emotional comment on wife aishwarya rai amid divorce rumors says mai lucky hun	https://images.news18.com/ibnkhabar/uploads/2024/11/aishwarya-Abhishek-Bachchan-2024-11-e64dec5169de02d9de5f53f50a3ffd12-16x9.jpg	2024-11-25 16:59:40	News18 हिंदी
in	https://www.indiatv.in/sports/cricket/arjun-tendulkar-sold-to-mumbai-indians-in-ipl-2025-mega-indian-on-base-price-only-30-lakh-2024-11-25-1093403	अर्जुन तेंदुलकर पहले अनसोल्ड फिर सोल्ड, इस टीम ने आखिरकार कितने करोड़ में खरीदा - India TV Hindi	अर्जुन तेंदुलकर पहले राउंड में अनसोल्ड चले गए थे। इससे सभी लोग ताज्जुब में थे। लेकिन इसके बाद बाजी पलटी और दूसरे राउंड में फिर से उनका नाम पुकारा गया और वे टीम में शामिल हो गए। 	https://resize.indiatv.in/resize/newbucket/1200_-/2024/11/arjun-tendulkar-pti-1732554604.jpg	2024-11-25 17:11:23	India TV Hindi