country_code	url	title	description	image_url	publish_date	source
in	https://www.abplive.com/states/maharashtra/sanjay-raut-questions-pm-narendra-modi-ek-rahoge-to-safe-rahoge-slogan-amid-maharashtra-election-2819565	'एक रहोगे तो सेफ रहोगे', पीएम मोदी के नारे पर संजय राउत का तीखा सवाल- 'किसको सेफ कर रहे?' - ABP न्यूज़	Maharashtra Election 2024: शिवसेना-यूबीटी के सांसद संजय राउत ने बीजेपी के 'एक रहोगे तो सेफ रहोगे' बयान पर पीएम नरेंद्र मोदी पर जमकर हमला बोला और कहा कि बीजेपी के रहने से हम अनसेफ हो जाते हैं.	https://feeds.abplive.com/onecms/images/uploaded-images/2024/11/09/c1a2691d317928d8ecf4202029372d901731131414875490_original.jpg?impolicy=abp_cdn&imwidth=1200	2024-11-09 06:18:21	ABP न्यूज़
in	https://www.aajtak.in/crime/news/story/notorious-gangster-lawrence-bishnoi-aid-deepak-boxer-extortion-call-empire-gym-owner-delhi-police-opnm2-dskc-2092650-2024-11-09	Delhi में जिम मालिक से मांगी गई 2 करोड़ की रंगदारी, इस कुख्यात गैंगस्टर के नाम से आई कॉल - Aaj Tak	दिल्ली के नांगलोई में स्थित एम्पायर जिम के मालिक से दो करोड़ रुपए की रंगदारी मांगी गई है. कुख्यात गैंगस्टर लॉरेंस बिश्नोई के खास गुर्गे दीपक बॉक्सर के नाम से आई इंटरनेशनल कॉल में कहा गया कि यदि जान बचानी है, तो जिम मालिक को उन्हें दो करोड़ रुपए देने होंगे.	https://akm-img-a-in.tosshub.com/aajtak/images/story/202411/672f7876b737f-notorious-gangster-lawrence-bishnoi-095753419-16x9.jpg	2024-11-09 15:05:25	Aaj Tak
in	https://hindi.news18.com/news/maharashtra/mumbai-shivsena-ubt-uddhav-thackeray-exclusive-interview-cm-face-in-mva-and-eknath-shinde-s-allegations-8823100.html	Exclusive: मुख्यमंत्री पद का चेहरा कौन? उद्धव ठाकरे ने दिया जवाब, शिंदे के आरोप पर भी बोले - News18 हिंदी	Mahrashtra Chunav: महायुति की ओर से फिलहाल यह आरोप लगाया जा रहा है कि MVA के कार्यकाल में विकास कार्यों में देरी हुई. इन आरोपों पर उद्धव ठाकरे ने जवाब दिया है. उन्होंने न्यूज 18 लोकमत को इंटरव्यू दिया. - shivsena ubt uddhav thackeray exclusive interview cm face in mva and eknath shinde s allegations	https://images.news18.com/ibnkhabar/uploads/2024/11/shivsena-ubt-uddhav-thackeray-exclusive-interview-cm-face-in-mva-and-eknath-shinde-s-allegations-2024-11-5d771b95edce883142098da16e22532b-16x9.jpg	2024-11-09 09:19:14	News18 हिंदी
in	https://navbharattimes.indiatimes.com/world/america/will-us-exit-nato-after-trump-becomes-president-member-countries-are-afraid/articleshow/115119477.cms	नाटो से बाहर आएगा ट्रंप का अमेरिका? जानें क्यों डरा हुआ है हथियार दिखाकर रूस को धमकाने वाला यूरोप - NBT नवभारत टाइम्स (Navbharat Times)	अमेरिकी चुनाव में डोनाल्ड ट्रंप की जीत के बाद नाटो देशों में बेचैनी फैली हुई है। सदस्य देशों को आशंका है कि ट्रंप के कार्यकाल में अमेरिका नाटो से बाहर हो सकता है। ट्रंप ने अपने पिछले कार्यकाल में कई मुद्दों पर नाटो सदस्य देशों को चेतावनी भी दी थी। उन्होंने सभी सदस्य देशों को रक्षा खर्च बढ़ाने को लेकर चेतावनी भी दी है।	https://static.langimg.com/photo/imgsize-47594,msid-115119542/navbharat-times.jpg	2024-11-09 15:19:12	NBT नवभारत टाइम्स (Navbharat Times)
in	https://hindi.news18.com/news/world/middle-east-qatar-warn-hamas-gaza-ceasefire-israeli-hostage-deal-benjamin-netanyahu-west-asia-conflict-8824231.html	कतर का एक फैसला और गहरा गया गाजा-इजरायल का संकट! हमास का छूटा पसीना, नेतन्याहू की भी उड़ गई नींद - News18 हिंदी	Israel Gaza War: इजरायल ने कहा है कि वह जब तक गाजा में हमास का पूरी तरह से सफाया नहीं कर देता, वहां अपने हमले जारी रखेगा. गाजा में इजरायली हमले में अब तक करीब 45000 लोगों की मौत हो चुकी है, जिनमें बड़ी संख्या में बच्चे और महिलाएं भी शामिल हैं. - qatar warn hamas gaza ceasefire israeli hostage deal benjamin netanyahu west asia conflict	https://images.news18.com/ibnkhabar/uploads/2024/11/Israel-Hamas-War-2024-11-f98ce25a26c4d1050fdeefbff203eaec-16x9.jpg	2024-11-09 15:55:10	News18 हिंदी
in	https://www.aajtak.in/elections/assembly-chunav/story/maharashtra-vidhan-sabha-chunav-cm-yogi-bantenge-to-katenge-rohit-pawar-sanjay-raut-uddhav-thackeray-ntc-dskc-2092258-2024-11-09	'मोदी-शाह की तस्वीर हार की गारंटी...', बंटेगे तो कटेंगे नारे पर उद्धव का पलटवार - Aaj Tak	उद्धव ठाकरे, (UBT प्रमुख) ने प्रधानमंत्री नरेंद्र मोदी और अमित शाह पर निशाना साधते हुए कहा कि आज महाराष्ट्र में जहां भी जाएं, लगभग सभी राजनीतिक दलों के पोस्टरों पर बाला साहेब ठाकरे की तस्वीर दिखती है, लेकिन शायद बीजेपी के पोस्टरों पर नरेंद्र मोदी या अमित शाह की तस्वीर नहीं दिखेगी.	https://akm-img-a-in.tosshub.com/aajtak/images/story/202411/672ef0ea527d6-uddhav-thakeray-225001377-16x9.jpg	2024-11-09 05:28:34	Aaj Tak
in	https://hindi.news18.com/news/dharm/tulsi-vivah-2024-date-12-november-why-did-lord-vishnu-marry-tulsi-tulsi-shaligram-know-reasons-and-tulsi-vivah-katha-in-hindi-8823411.html	Tulsi Vivah 2024: श्रीहरि ने क्यों किया था तुलसी से विवाह? वृंदा से भगवान विष्णु का क्या है संबंध, पढ़ें पौ... - News18 हिंदी	Tulsi Vivah 2024: इस बार तुलसी विवाह 12 नवंबर 2024 दिन मंगलवार को है. यह शुभ दिन भगवान विष्णु और देवी तुलसी के मिलन का प्रतीक है. इस दिन तुलसी जी का विवाह कराया जाता है. हम सभी जानते हैं कि भगवान विष्णु मां लक्ष्मी के पति हैं, लेकिन फिर ऐसा क्या हुआ कि श्रीहरि विष्णु को तुलसी से विवाह करना पड़ा? आइए पढ़तें हैं इससे जुड़ी कथा- - tulsi vivah 2024 date 12 november why did lord vishnu marry tulsi tulsi shaligram know reasons and tulsi vivah katha in hindi	https://images.news18.com/ibnkhabar/uploads/2024/11/tulsi-vivah-2024-11-f328cd3aa51a712a398f19d4c09015cf-16x9.jpg	2024-11-09 07:13:02	News18 हिंदी
in	https://navbharattimes.indiatimes.com/astro/religion-rituals/festivals-and-fasts/akshaya-navami-2024-ke-upay-remedies-for-akshay-punya-dhan-labh-health-and-career-growth/articleshow/115107202.cms	Akshay Navami Upay : सेहत के साथ अक्षय धन संपत्ति का लाभ चाहिए तो अक्षय नवमी पर कर लीजिए ये 5 काम - NBT नवभारत टाइम्स (Navbharat Times)	Akshaya Navami 2024 Upay : 10 नवंबर दिन रविवार को देशभर में अक्षय नवमी का पर्व मनाया जाएगा। इस दिन किए गए जप-तप और दान पुण्य के कार्यों से अक्षय फल की प्राप्ति होती है। ज्योतिष शास्त्र में बताया गया है कि अगर अक्षय नवमी के दिन ये 5 कार्य कर लिए जाएं तो जीवन में कभी किसी चीज की कमी नहीं होती और धन धान्य में वृद्धि होती है।	https://static.langimg.com/photo/imgsize-911469,msid-115107160/navbharat-times.jpg	2024-11-10 02:23:47	NBT नवभारत टाइम्स (Navbharat Times)
in	https://www.bhaskar.com/national/news/congress-president-kharge-on-yogi-batenge-to-katenge-133935327.html	खड़गे बोले- योगी के मुंह में राम बगल में छुरी: PM मोदी को एक होकर सेफ होना है तो मनुस्मृति को जलाना होगा - Dainik Bhaskar	महाराष्ट्र विधानसभा चुनाव के प्रचार के लिए शनिवार को कांग्रेस अध्यक्ष मल्लिकार्जुन खड़गे नागपुर पहुंचे। उन्होंने भाजपा के 'बटेंगे तो कटेंगे' नारे का जवाब देते हुए कहा- योगी के मुंह में राम है और बगल में छुरी है। योगी साधु की कपड़े में आते हैं और फिर बोलते हैं कि बटेंगे तो कटेंगे। बांटने वाले भी वो ही हैं और काटने वाले भी वो ही हैं। | Congress President Kharge on Yogi Batenge to Katenge महाराष्ट्र विधानसभा चुनाव के प्रचार के लिए शनिवार को नागुपर पहुंचे। उन्होंने उत्तर प्रदेश के CM योगी आदित्याथ के बटेंगे तो कटेंगे वाले नारे का जवाब देते हुए कहा कि योगी के मुंह में राम है और बगल में छुरी है। खड़गे ने कहा कि	https://images.bhaskarassets.com/thumb/730x0/web2images/521/2024/11/10/kharge_1731189384.gif	2024-11-09 21:57:11	Dainik Bhaskar
in	https://navbharattimes.indiatimes.com/astro/rashifal/bolen-sitare/aaj-ka-rashifal-10-november-2024-horoscope-today-veshi-yoga-creating-by-sun-is-lucky-for-mithun-kanya-and-kumbh-rashi/articleshow/115108149.cms	आज का राशिफल 10 नवंबर 2024 : मेष, सिंह, धनु राशि को मिलेगा सूर्य कृपा का लाभ, जानें अपना आज का भविष्यफल - NBT नवभारत टाइम्स (Navbharat Times)	Horoscope Today 10 November 2024 : आज 10 नवंबर रविवार को चंद्रमा का गोचर दिन रात कुंभ राशि में होने जा रहा है। इस गोचर के दौरान चंद्रमा आज धनिष्ठा उपरांत शतभिषा नक्षत्र से संचार करेंगे। चंद्रमा के इस गोचर से आज का दिन मेष, सिंह और धनु राशि के जातकों के लिए लाभदायक रहेगा। आज सूर्य से द्वितीय भाव में बुध के गोचर से वेशी योग भी बनेगा जिससे कई राशियों को फायदा मिलेगा। जानें अपना आज का राशिफल विस्तार पूर्वक।	https://static.langimg.com/photo/imgsize-168270,msid-115108521/navbharat-times.jpg	2024-11-09 23:04:00	NBT नवभारत टाइम्स (Navbharat Times)
in	https://www.abplive.com/photo-gallery/news/india-imd-weather-forecast-winter-will-start-in-delhi-up-bihar-from-15-november-heavy-rain-in-tamil-nadu-kerala-2819513	ठंड के लिए कब तक करना होगा इंतजार? मौसम विभाग ने बताया दिल्ली-NCR समेत उत्तर भारत - ABP न्यूज़	इस बीच मौसम विभाग ने दिल्ली में प्रदूषण को लेकर अलर्ट जारी किया है. वहीं कई राज्यों में बारिश को लेकर येलो अलर्ट भी जारी किया है.	https://feeds.abplive.com/onecms/images/uploaded-images/2024/11/09/7ffa36e11300111f73159c6ad07ba9441731128078324708_original.jpg?impolicy=abp_cdn&imwidth=1200	2024-11-09 04:56:48	ABP न्यूज़
in	https://www.bbc.com/hindi/live/c14l77v20jxt	दिल्ली में ‘बहुत ख़राब’ श्रेणी में पहुंचा एक्यूआई, पाकिस्तान में भी हवा का हाल बेहाल - BBC News हिंदी	रविवार की सुबह दिल्ली में हवा की सेहत शनिवार के मुक़ाबले बेहद कम अच्छी रही.	https://ichef.bbci.co.uk/ace/standard/480/cpsprodpb/ebf7/live/540444f0-9f0a-11ef-8538-e1655f5a8342.jpg	2024-11-10 00:56:51	BBC News हिंदी
in	https://hindi.news18.com/news/maharashtra/mumbai-maharashtra-chunav-rss-reinforces-bjp-cm-yogi-batenge-toh-katenge-slogan-in-silent-voter-outreach-8823101.html	महाराष्ट्र में RSS की गुपचुप फिल्डिंग, हरियाणा वाली चाल से BJP का बनेगा काम! 'बटेंगे तो कटेंगे' पर क्यों जो... - News18 हिंदी	Maharashtra Chunav: महाराष्ट्र विधानसभा चुनाव में भाजपा की जीत की स्क्रिप्ट लिखने में आरएसएस जुट गया है. आरएसएस वही काम करेगा, जैसा हरियाणा में उसने किया. आरएसएस ने भाजपा की जीत सुनिश्चित करवाने के लिए सीएम योगी के बटेंगे तो कटेंगे को जोर-शोर से फैला रहा है.  - maharashtra chunav rss reinforces bjp cm yogi batenge toh katenge slogan in silent voter outreach	https://images.news18.com/ibnkhabar/uploads/2024/11/Maharashtra-News-10-2024-11-0dc991854857a0502dd1bb180525108d-16x9.jpg	2024-11-09 05:05:45	News18 हिंदी
in	https://navbharattimes.indiatimes.com/world/other-countries/canada-hindu-temple-attack-police-arrested-khalistani-radical-inderjeet-gosal-and-released/articleshow/115131232.cms	ट्रूडो का खालिस्तान प्रेम! कनाडा में हिंदू मंदिर पर हमला करने वाले कट्टरपंथी को पुलिस ने किया गिरफ्तार, तुरंत रिहा - NBT नवभारत टाइम्स (Navbharat Times)	कनाडा में हिंदू मंदिर पर हमले के मामले में पुलिस ने खालिस्तानी कट्टरपंथी इंद्रजीत गोसाल को गिरफ्तार किया है। लेकिन पुलिस ने गिरफ्तारी के कुछ देर बाद ही उसे छोड़ भी दिया। ब्रैम्पटन के हिंदू सभा मंदिर में खालिस्तानियों ने 3 नवम्बर को घुसकर हमला किया था और भक्तों से मारपीट की थी।	https://static.langimg.com/photo/imgsize-97728,msid-115131350/navbharat-times.jpg	2024-11-10 01:38:35	NBT नवभारत टाइम्स (Navbharat Times)
in	https://www.abplive.com/lifestyle/religion/dev-diwali-2024-on-15-november-why-dev-deepawali-festival-celebrated-on-kartik-purnima-2818746	Dev Diwali 2024: कार्तिक पूर्णिमा पर ही क्यों मनाते हैं देव दिवाली - ABP न्यूज़	Dev Diwali 2024: धार्मिक मान्यता के अनुसार कार्तिक पूर्णिमा (Kartik Purnima) के दिन भगवान शिव (Lord Shiva) ने त्रिपुरासुर राक्षस का वध किया था. इसलिए इस तिथि पर देवी-देवता खुश होकर दीप जलाते हैं.	https://feeds.abplive.com/onecms/images/uploaded-images/2024/11/08/4fb556592926d1b746efcab1eb04e3b11731079686779466_original.jpg?impolicy=abp_cdn&imwidth=1200	2024-11-08 04:35:17	ABP न्यूज़
in	https://news.google.com/rss/articles/CBMijwJBVV95cUxQREJRRXB1elEtdThfOHRYNDNJRmhfZ3JSMlRpNE95RTE4Q1lKTy1wMDNsdVE2MDlmWWxUTzgxMFpsZlA2a0MzaW4tN3lySWRWVmJPNmljNEVhREQzUXpFZDhYLXluWWZnNUxRNTZEZ2hjUzgzOFJ2ck51UnVPRkh4WHRVN1l3WmIzVFlicnRnd2RwMVlQR3hJT0xpQTRMMFlPYW94TGJOdWl5UktEdkJCUmN3Y3NPRmhjSGNQbmVRLWVIa2JkMmt0X3ZpMWphZzZVNC1VS3NCM3BUZEVkblpDYkdKRHR6UktUVm5WWlFXQU95RkJMX0lFYWZSaDF0VWRuQWJZbkZKZDRCZHU5YWs00gGUAkFVX3lxTE5zQXQzWXVIeW5fb0J3VHI1TWtIUDdmZzdhT011LTMxZHNrYXJUTm4xTVhCcHJtODZ6VFJ5d05NVkIwcl9GSTBRblh2bXA2M3FieFFBZTZCTDlSMVBpZHk0MjFjcDJDX0ZMMzVwZmxWY1lNcWlEQzF6MmRkQXpOdTRvQzZEUlFjOXJ4cmZhc3JVR1B0YzFjNURmYWFUTG5MLTQ1YmEwUl9tQTluZk1MQ2ZxQy1IcXEyT0JRdHNkT2szY1ctOTJZb1I2Y1NpZmw3eFdkcVBxeHBEVFl1R2pPdTFCY3lQOFFaX0FxNXRZMVRQQXJSRkQwSk0tWElGdHVBb0VwZGRjdjJqbTBFMzY0M0poLWhqMA?oc=5	SC On Bulldozer Justice: किसी अधिकारी को नहीं है बेरोकटोक मकान गिराने की इजाज़त, बुलडोजर से डरा - ABP न्यूज़	Supreme Court On Bulldozer Justice: सुप्रीम कोर्ट ने अपने फैसले में बुलडोजर जस्टिस की कठोर आलोचना करते हुए कहा है कि मकान गिराने का डर दिखा कर लोगों की आवाज़ को नहीं दबाया जा सकता.	None	2024-11-09 18:03:26	ABP न्यूज़
in	https://www.bhaskar.com/bhaskar-khaas/bhaskar-explainer/news/aligarh-muslim-university-amu-minority-status-case-explained-133930404.html	भास्कर एक्सप्लेनर- AMU को मुस्लिमों की यूनिवर्सिटी का टैग: क्या SC-ST को आरक्षण नहीं मिलेगा; आगे क्या, 8 सव... - Dainik Bhaskar	एक अल्पसंख्यक संस्थान होने के लिए इसे सिर्फ अल्पसंख्यकों द्वारा स्थापित किया जाना जरूरी है। ये जरूरी नहीं है कि इसे अल्पसंख्यक लोग चलाएं। | ‘एक अल्पसंख्यक संस्थान होने के लिए इसे सिर्फ अल्पसंख्यकों द्वारा स्थापित किया जाना जरूरी है। ये जरूरी नहीं है कि इसे अल्पसंख्यक लोग चलाएं। अल्पसंख्यक संस्थान धर्मनिरपेक्ष शिक्षा पर जोर दें और इसके लिए यूनिवर्सिटी के प्रशासन में अल्पसंख्यक सदस्यों की जरूरत नहीं है।’ अलीगढ़Aligarh (AMU) Muslim University Article 30 Controversy Explained;  AMU को अल्पसंख्यक यूनिवर्सिटी का दर्जा मिलने का रास्ता साफ हो गया है, फैसले से AMU के छात्रों पर क्या असर पड़ेगा, भास्कर एक्सप्लेनर में ऐसे 8 जरूरी सवालों के जवाब जानेंगे…	https://images.bhaskarassets.com/thumb/730x0/web2images/521/2024/11/08/comp-1-1_1731071667.gif	2024-11-08 23:37:12	Dainik Bhaskar
in	https://ndtv.in/world-news/canada-pm-justin-trudeau-donald-trump-canada-and-us-relationship-6978233	खालिस्तानियों पर ट्रूडो ने रातोंरात बदल डाली भाषा ? क्या ट्रंप हैं वजह - NDTV India	मीडिया रिपोर्ट्स के अनुसार कनाडा के पीएम ट्रूडो ने ये बात दिवाली इवेंट के दौरान कही है.ट्रूडो ने उस दौरान कहा ये भी कहा कि कनाडा में खालिस्तान के कई समर्थक हैं लेकिन वो अकेले सिर्फ सिख समुदाय को प्रतिनिधित्व नहीं करते हैं.	https://c.ndtvimg.com/2023-09/56ika37o_justin-trudeau-afp_625x300_29_September_23.jpg?im=FeatureCrop,algorithm=dnn,width=1200,height=738	2024-11-09 05:34:25	NDTV India
in	https://hindi.news18.com/news/himachal-pradesh/shimla-cid-samosa-controversy-bjp-raised-questions-on-sukhu-government-took-out-samosa-march-local18-8823826.html	हिमाचल CID या समोसा जांच एजेंसी? भाजपा ने उठाए सुक्खू सरकार पर सवाल, शिमला में निकाला 'समोसा मार्च' - News18 हिंदी	Himachal CID Samosa Controversy: हिमाचल प्रदेश में समोसा गायब होने की सीआईडी जांच का मामला तूल पकड़ता जा रहा है. शिमला में भारतीय जनता युवा मोर्चा की ओर से समोसा मार्च निकालकर इसका विरोध किया गया. जानें भाजपा कार्यकर्ता क्या बोले... - cid samosa controversy bjp raised questions on sukhu government took out samosa march	https://images.news18.com/ibnkhabar/uploads/2024/11/Himachal-CID-Samosa-Controversy-2024-11-aba7fa001fca4346624e305e6d3f5ee4-16x9.jpg	2024-11-09 10:36:31	News18 हिंदी
