country_code	url	title	description	image_url	publish_date	source
in	https://news.google.com/rss/articles/CBMi0AFBVV95cUxPUm9iN3lTdWU2VXNUZVl2STVNVUFIOUxZNEtMMmJ6NHdjcWR6a0drNlhtMlVDa1hPeVkxNExqb3dBZmw5ZGhYa1lBZXhXVDYycjZuMFpVb0RhQnl6OFVaQ0JoU1hnZEtURjhJanJkeXA5UndSV0VSUzkzWFRrUm9Kc0lxb25lUjVBQ3kyaUFRcnhzRDVhNHBoMHBKMi0zUXNPMGVZMjFOYWRoSVlINUV1SkY5dU1OdnhucUNVd01PczVnYnhYUlViRW9aTHUtR1ZF0gHWAUFVX3lxTE9NaHhaZnJySFlmMm1oc3pzYjM1Z3NmaVQ2M0hnYUFDWmlvaDNaQklsVFZFS1VYQWFBMHUxUmpaYThRaDNZa0RDVG5OWjdydjcxSDJIa0NKdFdWOGZuOG9zR1hjcGZ0Ymx0US0tSF85TVVVc2M4Umh6VkRqY015dGNmY0Y2M1FnRl9tWVJ5ZTZDYThGMEVqNnkzeHFHMTF4WEFwZ2IxOGRaMHM1UHFmaTJWbnoyWkQ2R2c3Sk9UVkYxU1V0ODVEM1IwSEpiM1NDVzc5WGpRY2c?oc=5	लॉरेंस बिश्नोई और सलमान खान विवाद के बीच हो गया बड़ा खुलासा, अब क्या होगा? - Aaj Tak	महाराष्ट्र के पूर्व मंत्री और अजित पवार वाली एनसीपी के दिग्गज नेता बाबा सिद्दीकी की 12 अक्तूबर को देर रात गोली मारकर हत्या कर दी गई थी. अब इस मामले की गुत्थी सुलझाने की कोशिश हो रही है. ऐसे में कई चौंकाने वाले खुलासे हो रहे हैं. आरोपियों को लेकर एक और नया दावा किया जा रहा. मुंबई क्राइम ब्रांच का कहना है कि बाबा सिद्दीकी की हत्या करने से पहले शूटर लॉरेंस बिश्नोई के भाई अनमोल बिश्नोई के संपर्क में थे. इतना ही नहीं इन तीन आरोपियों ने अनमोल से स्नैपचेट के जरिए बात की थी.	None	2024-10-23 14:29:02	Aaj Tak
in	https://www.abplive.com/astro/aquarius-horoscope-today-23-october-aaj-ka-kumbh-rashifal-kumbh-rashi-walo-ka-aaj-ka-din-kaisa-rhega-2808569	Aquarius Horoscope Today 23 October: कुंभ राशि वालों की आज ग्रहकों के साथ बहस हो सकती है, पढ़ें राशिफल - ABP न्यूज़	Aaj Ka Kumbh Rashifal in Hindi: कुंभ राशि वालों के लिए 23 अक्टूबर 2324, बुधवार का दिन विशेष है. ग्रहों की चाल का आपके जीवन क्या असर होगा, जानें आज का कुंभ राशिफल.	https://feeds.abplive.com/onecms/images/uploaded-images/2024/10/22/5f933a76f3ff9dd1334cd56e55eb1f081729588750732660_original.jpg?impolicy=abp_cdn&imwidth=1200	2024-10-22 23:40:00	ABP न्यूज़
in	https://navbharattimes.indiatimes.com/astro/rashifal/bolen-sitare/libra-horoscope-today-24-october-2024-aaj-ka-tula-rashifal/articleshow/114505780.cms	आज का तुला राशि का राशिफल 24 अक्टूबर 2024 : आज किसी सुखद समाचार से खुश रहेगा मन, पुराने मित्र से होगी मुलाकात - NBT नवभारत टाइम्स (Navbharat Times)	Aaj ka Tula Rashifal : तुला राशि के जातकों के लिए आज का दिन मिलाजुला परिणाम दिलाएगा। लेकिन, आज संतान से कोई ऐसा समाचार सुनने को मिल सकता है जिसे सुनकर आपका मन बहुत प्रसन्न होगा। आज का दिन तुला राशिवालों के लिए कैसा रहेगा। विस्तार से पढ़ें आज का तुला राशिफल।	https://static.langimg.com/photo/imgsize-919430,msid-114505851/navbharat-times.jpg	2024-10-23 23:30:00	NBT नवभारत टाइम्स (Navbharat Times)
in	https://www.jagran.com/cricket/match-report-india-women-beat-new-zealand-women-in-1st-odi-match-23821293.html	IND W vs NZ W: भारत ने टी20 वर्ल्ड चैंपियन न्यूजीलैंड को रौंदा, पहले वनडे मैच में 59 रन से दी करारी शिकस्त - दैनिक जागरण (Dainik Jagran)	भारतीय महिला टीम ने गुरुवार को अहमदाबाद में न्यूजीलैंड के खिलाफ पहले वनडे मैच में 59 रन की बड़ी जीत दर्ज की। स्टार स्पिनर दीप्ति शर्मा और राधा यादव की शानदार गेंदबाजी की बदौलत भारत ने 227 रन के कम स्कोर का बचाव करते हुए तीन मैच की वनडे सीरीज में 1-0 की बढ़त हासिल कर ली। लक्ष्य का पीछा करते हुए न्यूजीलैंड 168 रन बनाकर ढेर हो गई। 	https://www.jagranimages.com/images/newimg/24102024/24_10_2024-ind_w_vs_nz_w_odi_23821293.jpg	2024-10-24 15:46:00	दैनिक जागरण (Dainik Jagran)
in	https://ndtv.in/cricket/ind-vs-nz-2nd-test-washington-sundar-magic-ball-returns-after-1325-rachin-ravindra-stands-bold-video-hindi-6864880	IND vs NZ 2nd Test: वाशिंगटन सुंदर ने 1325 बाद वापसी करते हुए फेंकी 'जादुई गेंद', हक्का बक्का रह गया बल्लेबाज, Video - NDTV India	India vs New Zealand 2nd Test, Washington Sundar: वाशिंगटन सुंदर ने 1325 दिन बार भारतीय टेस्ट टीम में वापसी करते हुए अपने टेस्ट करियर का सर्वश्रेष्ठ प्रदर्शन किया और भारत को पहले दिन मैच पर कंट्रोल दिलाया. सुंदर ने पुणे में हो रहे सीरीज के पहले मैच के पहले दिन 59 रन देते हुए 7 विकेट हासिल किए, जिससे न्यूजीलैंड की पहली पारी 259 पर सिमट गई.	https://c.ndtvimg.com/2024-10/qnl497go_washington-sundar_625x300_24_October_24.png	2024-10-24 13:41:48	NDTV India
in	https://www.abplive.com/sports/cricket/ind-vs-nz-2nd-test-rishabh-pant-wrong-advice-washington-sundar-pune-2810103	IND vs NZ: ऋषभ पंत की गलत सलाह ने सुंदर को फंसाया, चौका पड़ा तो देखें कैसे झाड़ा पल्ला - ABP न्यूज़	IND vs NZ 2nd Test Pune: ऋषभ पंत ने अजाज पटेल की बैटिंग के दौरान वाशिंगटन सुंदर को एक सलाह दी थी. उनकी यह सलाह सुंदर को भारी पड़ गई.	https://feeds.abplive.com/onecms/images/uploaded-images/2024/10/24/4922586a4fcd5faf9ee6d55dd0dc7bed1729773510835344_original.jpg?impolicy=abp_cdn&imwidth=1200	2024-10-24 12:40:37	ABP न्यूज़
in	https://www.abplive.com/states/rajasthan/lawrence-bishnoi-encounter-price-kshatriya-karni-sena-raj-shekhawat-beaten-after-announcement-of-reward-know-truth-2809625	लॉरेंस बिश्नोई के एनकाउंटर की मांग करने वाले क्षत्रिय करणी सेना के राज शेखावत - ABP न्यूज़	Lawrence Bishnoi: राज शेखावत ने लॉरेंस बिश्नोई का एनकाउंटर करने वाले पुलिसकर्मी को इनाम देने की घोषणा की है. अब दावा किया जा रहा है कि इस बयान के बाद राज शेखावत के साथ मारपीट की गई.	https://feeds.abplive.com/onecms/images/uploaded-images/2024/10/24/af6f6375c0f6581c4da17333b20139dd1729740124950489_original.png?impolicy=abp_cdn&imwidth=1200	2024-10-24 03:59:57	ABP न्यूज़