country_code	url	title	description	image_url	publish_date	source
in	https://www.abplive.com/news/india/shankaracharya-swami-avimukteshwarananda-on-the-issue-of-ban-on-muslims-in-maha-kumbh-said-already-40-kilometers-in-mecca-ann-2820017	‘मक्का में 40 किलोमीटर पहले ही..’, महाकुंभ में मुसलमानों के बैन की बात पर बोले शंकराचार्य - ABP न्यूज़	Muslims Ban On Maha Kumbh: शंकराचार्य स्वामी अविमुक्तेश्वरानंद ने कहा कि जब मुसलमानों के तीर्थस्थल पर हिंदू बैन हैं तो हिंदुओं के तीर्थस्थल पर मुसलमानों का क्या काम?	https://feeds.abplive.com/onecms/images/uploaded-images/2024/09/23/a5f3fb48cab8b204b6a76765792566241727113697754426_original.jpg?impolicy=abp_cdn&imwidth=1200	2024-11-09 18:51:52	ABP न्यूज़
in	https://www.aajtak.in/uttar-pradesh/story/akhilesh-yadav-celebrated-khazanchi-eight-birthday-he-celebrates-it-every-year-it-has-connection-with-demonetization-ntc-rptc-2092468-2024-11-09	अखिलेश यादव ने मनाया खजांची का 8वां बर्थडे, हर साल करते हैं सेलिब्रेट, नोटबंदी से है कनेक्शन - Aaj Tak	समाजवादी पार्टी के अध्यक्ष अखिलेश यादव ने 8 साल के बच्चे खजांची का जन्मदिन सेलिब्रेट किया. इसके साथ ही उन्होंने नोटबंदी को लेकर बीजेपी पर निशाना साधा. अखिलेश ने X पर पोस्ट किया कि नोटबंदी का असर स्लो पॉइजन जैसा हुआ. पिछले 8 साल में इसने किसान, मज़दूर, मध्यम वर्ग, नौकरीपेशा, पेशेवर लोग और छोटे दुकानदार-व्यापारी, रेहड़ी-पटरी-फेरीवालें सबको अपना शिकार बनाया है.	https://akm-img-a-in.tosshub.com/aajtak/images/story/202411/672f3d71841d1-akhilesh-yadav-celebrated-khazanchi-eight-birthday-094603951-16x9.png	2024-11-09 10:49:09	Aaj Tak
in	https://www.aajtak.in/india/delhi/story/cm-atishi-says-delhi-govt-okays-proposal-10000-civil-defence-volunteers-to-return-for-anti-pollution-work-ntc-dskc-2092463-2024-11-09	काम पर लौटेंगे दिल्ली के 10 हजार बस मार्शल... एंटी-पॉल्यूशन ड्राइव में होगी तैनाती, प्रस्ताव मंजूर - Aaj Tak	मुख्यमंत्री आतिशी ने कहा कि सोमवार से सिविल डिफेंस वालंटियर्स को कॉल आउट नोटिस जारी किए जाएंगे और फिर वे मंगलवार और बुधवार को संबंधित जिला मजिस्ट्रेट कार्यालय में अपना पंजीकरण शुरू करा सकते हैं.	https://akm-img-a-in.tosshub.com/aajtak/images/story/202411/672f3b2baa5a3-delhi-cm-atishi-093621830-16x9.png	2024-11-09 10:39:51	Aaj Tak
in	https://news.google.com/rss/articles/CBMiW0FVX3lxTE03VGVqemdUZVRTcm8wWkc3NmtXOHcxajljQVF3OTJZcklVSnR2T1VySkhmcFdaRVh6T3lSX29BMjI1TWxjQk9JNmNmeHNBVTllWkExMzEzTVNwQjDSAWBBVV95cUxNNzVCdGsyRi1SSDcwS1liY29jVnZGdGhCVkR6Wm9yb1YwS0R3TENQM0RkSHU3OGc4SUlwOXhvU2c3NlBHVHdpZzNzZ2VOVHhZZ3hYSWVTVWloT1ZZR2RyY24?oc=5	झारखंड चुनाव में यूसीसी के नाम पर क्या ध्रुवीकरण की राजनीति हो रही है? - BBC News हिंदी	केंद्रीय गृह मंत्री अमित शाह ने कहा है कि बीजेपी झारखंड में यूसीसी लागू करेगी. इसके जवाब में मुख्यमंत्री हेमंत सोरेन ने कहा है कि यहां न यूसीसी लागू होगा और न एनआरसी. अब इस पर बहस छिड़ गई है.	None	2024-11-09 01:46:12	BBC News हिंदी
in	https://zeenews.india.com/hindi/sports/cricket/pakistan-will-boycott-champions-trophy-if-india-will-not-come-rashid-latif-big-statement/2507606	IND vs PAK: भारत नहीं आया तो..., पूर्व कप्तान ने टीम इंडिया को दे डाली धमकी, चैंपियंस ट्रॉफी में मचेगा बव... - Zee News Hindi	भारतीय टीम अगले साल होने वाले चैंपियंस ट्रॉफी टूर्नामेंट के लिए पाकिस्तान का दौरा करेगी या नहीं, इस पर BCCI की तरफ से कोई आधिकारिक बयान नहीं आया है. इस बीच पाकिस्तान के पूर्व कप्तान ने बड़ा बयान दे दिया है.	https://hindi.cdn.zeenews.com/hindi/sites/default/files/2024/11/09/3395312-ind-vs-pak.png?im=FitAndFill=(600,315)	2024-11-09 14:56:54	Zee News Hindi
in	https://www.bhaskar.com/bhaskar-khaas/upbypolls/news/by-election-on-karhal-seat-of-mainpuri-tej-pratap-singh-yadav-vs-anujesh-yadav-133930429.html	अखिलेश के पूरे परिवार को पैर छूने पड़ रहे हैं-अनुजेश: करहल में BJP का गोत्र तीर चला तो तेज प्रताप का नुकसान ... - Dainik Bhaskar	प्रत्याशी या परिवार का कोई मतलब नहीं है। सपा ने करहल में जो काम करवाए हैं, वो दिखाई दे रहे हैं। भाजपा ने यहां लोगों पर फर्जी मुकदमे दर्ज कराए हैं।- तेज प्रताप यादव, सपा प्रत्याशी | up politics- मैनपुरी की करहल सीट इस समय हॉट सीट बनी हुई है। यहां पर सपा से तेजप्रताप सिंह यादव तो भाजपा से अनुजेश प्रताप सिंह यादव मैदान में हैं। दोनों आपस में रिश्तेदार हैं, लेकिन इस समय इसके बीच में सियासी दुश्मनी है। भाजपा अनुजेश के	https://images.bhaskarassets.com/thumb/730x0/web2images/521/2024/11/08/comp-111-1_1731073870.gif	2024-11-09 00:12:46	Dainik Bhaskar
in	https://www.tractorjunction.com/sarkari-yojana-news/the-18th-installment-of-ladli-behna-yojana-is-coming-on-this-date/	इंतजार खत्म, इस तारीख को आ रही है लाड़ली बहना योजना की 18वीं किस्त - Tractor Junction	मुख्यमंत्री लाड़ली बहना योजना के तहत राज्य की महिलाओं को हर माह 1250 रुपए की आर्थिक सहायता मिलती है। राज्य सरकार 9 नवंबर 2024 को लाड़ली बहना योजना की 18वीं किस्त जारी करने जा रही है। इसके तहत करीब 1.29 करोड़ महिलाओं को किस्त की राशि जारी की जाएगी।	https://assets.tractorjunction.com/tractor-junction/assets/images/images/news/sarkari-yojana-1731061861.webp	2024-11-08 10:31:01	Tractor Junction
in	https://www.aajtak.in/uttar-pradesh/story/bulldozer-ran-on-illegal-complex-in-kaiserbagh-lucknow-construction-going-without-getting-map-approved-ntc-rptc-2092734-2024-11-09	लखनऊ के कैसरबाग में अवैध कॉम्प्लेक्स पर चला बुलडोजर, नक्शा पास कराए बिना हुआ था निर्माण - Aaj Tak	जमीन के मालिक से भी जालसाजी कर कब्जा किया गया था. इतना ही नहीं, शॉपिंग कॉम्प्लेक्स का ना तो नक्शा पास था और ना ही बिजली का कनेक्शन वैध था. इसके बाद भी धड़ल्ले से कॉम्प्लेक्स का निर्माण किया जा रहा था. 	https://akm-img-a-in.tosshub.com/aajtak/images/story/202411/672fa8ee62366-lucknow-bulldozer-action-092440731-16x9.png	2024-11-09 18:26:22	Aaj Tak
in	https://www.bhaskar.com/local/haryana/news/haryana-hcs-officer-sexual-harassment-case-sdm-kulbhushan-bansal-dalit-massage-video-viral-133931585.html	हरियाणा में यौन शोषण केस में SDM गिरफ्तार: मसाज के लिए बुलाए व्यक्ति से गनपॉइंट पर गलत काम कराया; सरकार सस्... - Dainik Bhaskar	हरियाणा में HCS अधिकारी कुलभूषण बंसल को पुलिस ने शनिवार (9 नवंबर) को हिसार से गिरफ्तार कर लिया। पुलिस ने सिविल अस्पताल में बंसल का मेडिकल कराया है। इसके बाद उसे कोर्ट में पेश किया गया। जहां से उसे एक दिन के रिमांड पर पुलिस को सौंप दिया गया। | हरियाणा के दलित समाज के एक व्यक्ति के साथ यौन शोषण का आरोपी HCS अफसर को पुलिस ने गिरफ्तार कर लिया है। इससे पहले पुलिस ने केस दर्ज कर मामले की जांच शुरू कर दी थी।	https://images.bhaskarassets.com/thumb/730x0/web2images/521/2024/11/09/ezgif-5-19ad9f3449_1731148245.gif	2024-11-09 08:47:36	Dainik Bhaskar
in	https://navbharattimes.indiatimes.com/state/bihar/begusarai/begusarai-rail-accident-at-barauni-junction-railway-worker-crushed-to-death-while-opening-coupling/articleshow/115108975.cms	बेगूसराय बरौनी जंक्शन रेल हादसा: कपलिंग खोलते समय रेलकर्मी की मौत, जांच के आदेश - NBT नवभारत टाइम्स (Navbharat Times)	बेगूसराय के बरौनी जंक्शन पर शनिवार सुबह एक रेलकर्मी की इंजन और बोगी के बीच दबकर मौत हो गई। बताया जा रहा है कि इंजन बदलने के दौरान कपलिंग खोलते समय यह दुर्घटना हुई। मृतक की पहचान समस्तीपुर निवासी अमर कुमार राउत के रूप में हुई है। घटना के बाद आक्रोशित रेलवे यूनियन ने लापरवाही का आरोप लगाया है।	https://static.langimg.com/photo/imgsize-63694,msid-115109330/navbharat-times.jpg	2024-11-09 08:15:58	NBT नवभारत टाइम्स (Navbharat Times)