country_code	url	title	description	image_url	publish_date	source
in	https://www.aajtak.in/india/news/story/cyclone-dana-impacted-36-lakh-people-in-odisha-no-human-casualty-so-far-says-minister-lclk-dskc-2082513-2024-10-27	ओडिशा में चक्रवात 'दाना' से 36 लाख लोग प्रभावित, 14 जिलों में बाढ़ का कहर, बेघर हुए लोग - Aaj Tak	ओडिशा में आए दाना तूफान से भारी बर्बादी हुई है. राज्य के आपदा प्रबंधन मंत्री सुरेश पुजारी ने बताया कि दाना तूफान ने 14 जिलों में तबाही मचा दी है, जिससे कुल 35.95 लाख लोग प्रभावित हुए हैं. चक्रवात और बाढ़ के कारण लगभग 5,840 घर पूरी तरह या आंशिक रूप से क्षतिग्रस्त हुए हैं. सुरक्षित निकाले गए लोगों को 1,178 राहत केंद्रों में आश्रय दिया गया है, जहां उन्हें भोजन और अन्य आवश्यक सामग्री उपलब्ध कराई जा रही है.	https://akm-img-a-in.tosshub.com/aajtak/images/story/202410/671e2223bdf83-navy-helping-people-in-odisha-272101234-16x9.jpg	2024-10-27 11:29:12	Aaj Tak
in	https://www.abplive.com/lifestyle/religion/aquarius-weekly-horoscope-27-october-to-2-november-2024-kumbh-saptahik-rashifal-in-hindi-2811556	Aquarius Weekly Horoscope 2024: कुंभ राशि के लिए परेशानी लेकर आया है वीक, पढ़िए साप्ताहिक राशिफल - ABP न्यूज़	Aquarius Weekly Horoscope 2024 (27 October to 2 November): कुंभ राशि के लिए यह नया सप्ताह कैसा रहेगा. ज्योतिषाचार्य से जानें 27 अक्टूबर- 2 नवंबर 2024 तक कुंभ का साप्ताहिक राशिफल (Saptahik Rashifal).	https://feeds.abplive.com/onecms/images/uploaded-images/2024/10/27/6152ed7b3125c3dc367384dc3e5bd1721730002042313466_original.jpg?impolicy=abp_cdn&imwidth=1200	2024-10-27 04:20:00	ABP न्यूज़
in	https://www.abplive.com/lifestyle/religion/aaj-ka-panchang-27-october-2024-today-muhurat-yoga-rahu-kaal-time-grah-nakshatra-2811392	Aaj Ka Panchang: आज 27 अक्टूबर का मुहूर्त, राहुकाल और अन्य महत्वपूर्ण जानकारी जानें - ABP न्यूज़	Aaj Ka Panchang: 27 अक्टूबर 2024 को आज कार्तिक माह की कृष्ण पक्ष की एकादशी तिथि और रविवार है. इस दिन सूर्य और विष्णु जी की पूजा होती है. आज का पंचांग, मुहूर्त, राहुकाल (Rahu Kaal).	https://feeds.abplive.com/onecms/images/uploaded-images/2024/07/09/07808755adc8b414b1a97d779114ffd61720464477925499_original.jpg?impolicy=abp_cdn&imwidth=1200	2024-10-26 23:04:56	ABP न्यूज़
in	https://www.aajtak.in/religion/rashiphal/story/libra-daily-horoscope-27-october-2024-aaj-ka-tula-rashifal-in-hindi-sunday-tlifdg-dskc-2082071-2024-10-27	आज 27 अक्टूबर 2024 का तुला राशिफल (Libra Horoscope): रविवार के दिन तुला वाले रहेंगे प्रभावित, कारोबार में प्रभावी रहेंगे - Aaj Tak	Tula Rashifal 27 october 2024: वाणिज्यिक मामलों में सफलता पाएंगे. आर्थिक विषयों में गति आएगी. मित्र मददगार रहेंगे. प्रतिस्पर्धा से रखेंगे. कार्यक्षेत्र में अनुकूलता रहेगी. वरिष्ठ वर्ग सहयोगी रहेगा. पेशेवर लोगों का भरोसा जीतेंगे. लाभ के महत्वपूर्ण अवसरों को भुनाएंगे. कार्य विस्तार के प्रयास बढ़ाएंगे.	https://akm-img-a-in.tosshub.com/aajtak/images/story/202410/671d0d9ff1ea1-20240703-035844576-16x9.jpg	2024-10-26 23:30:12	Aaj Tak
in	https://www.abplive.com/states/rajasthan/lawrence-bishnoi-encounter-news-kshatriya-karni-sena-raj-sekhawat-give-cash-to-prisoner-who-kills-lawrence-bishnoi-sabarmati-jail-2812043	लॉरेंस बिश्नोई पर फिर से क्षत्रिय करणी सेना के राज शेखावत का बड़ा ऐलान, 'साबरमती - ABP न्यूज़	Lawrence Bishnoi Encounter Reward: गैंगस्टर लॉरेंस बिश्नोई का एनकाउंटर करने पर इनाम देने की घोषणा करने वाले क्षत्रिय करणी सेना के प्रमुख राज शेखावत ने एक बार फिर बड़ा ऐलान किया है.	https://feeds.abplive.com/onecms/images/uploaded-images/2024/10/28/1d69cb3e2f94dbf8f70d51515897c2e31730079051661489_original.jpg?impolicy=abp_cdn&imwidth=1200	2024-10-28 01:57:51	ABP न्यूज़
in	https://www.bbc.com/hindi/articles/czxrrp1q4l0o	अभिनेता से राजनेता बने विजय की पार्टी टीवीके की पहली जनसभा, पेरियार और द्रविड़ राष्ट्रवाद पर क्या बोले? - BBC News हिंदी	विजय ने अपनी पार्टी तमिलगा वेत्री कड़गम की जनसभा में कहा कि उनकी पार्टी की विचारधारा धर्मनिरपेक्ष और सामाजिक न्याय के सिद्धांत पर टिकी है. उन्होंने ये भी बताया कि किस पार्टी को वो वैचारिक स्तर पर दुश्मन मानते हैं.	https://ichef.bbci.co.uk/news/1024/branded_hindi/b0b4/live/4faf6ad0-9477-11ef-b2a3-6f95c4744c6c.jpg	2024-10-27 15:11:21	BBC News हिंदी
in	https://www.amarujala.com/uttar-pradesh/agra/up-by-election-2024-karhal-assembly-seat-anujesh-yadav-mulayam-singh-yadav-news-in-hindi-2024-10-27	UP: करहल के रण में मुलायम और लालू प्रसाद के दामाद... अखिलेश यादव ने स्वीकार की रिश्तेदारी; उलझ गए पूरे समीकरण - अमर उजाला	मैनपुरी की करहल विधानसभा सीट पर उप चुनाव हो रहा है। इस विधानसभा सीट का नाम जितना सुलझा हुआ है, यहां के सियासी समीकरण	https://staticimg.amarujala.com/assets/images/2024/10/27/up-by-election-2024_3277a0f5edc75ccf0da0ffa515c00f7f.jpeg?w=750&dpr=1.0	2024-10-27 07:00:11	अमर उजाला