country_code	url	title	description	image_url	publish_date	source
in	https://www.abplive.com/states/rajasthan/jodhpur-anita-chaudhary-murder-case-accused-gulamuddin-arrested-from-mumbai-ann-2819435	मुंबई से पकड़ा गया अनीता चौधरी हत्याकांड का मुख्य आरोपी गुलामुद्दीन, नेपाल भागने - ABP न्यूज़	Anita Chaudhary Murder Case: जोधपुर में अनीता चौधरी की हत्या के मामले में मुख्य आरोपी गुलामुद्दीन फारूकी को मुंबई में गिरफ्तार कर लिया गया है. पुलिस ने 500 से CCTV फुटेज की जांच के बाद उसे पकड़ा.	https://feeds.abplive.com/onecms/images/uploaded-images/2024/11/09/d04ddb4b1f88ba7bdb5789f7986c947f1731115423787584_original.jpg?impolicy=abp_cdn&imwidth=1200	2024-11-09 01:25:59	ABP न्यूज़
in	https://www.amarujala.com/photo-gallery/uttar-pradesh/varanasi/varanasi-gupta-family-murder-police-got-the-location-of-vicky-important-information-obtained-after-going-1370-2024-11-09	Varanasi Gupta Family Murder: मिल गई पुलिस को कातिल विक्की की लोकेशन! 1370 KM दूर जाकर हाथ लगी अहम जानकारी - अमर उजाला	यूपी के वाराणसी में बीते मंगलवार पांच नवंबर को एक ही परिवार के पांच लोगों की हत्या के मामले में पुलिस के हाथ अब भी खाली	https://staticimg.amarujala.com/assets/images/2024/11/09/varanaesa-hatayakada-ma-naya-khalsa_1d524be711c71c0acd82c6be623061df.jpeg?w=750&dpr=1.0	2024-11-09 12:11:00	अमर उजाला
in	https://www.bbc.com/hindi/articles/c20g3ejx165o	डोनाल्ड ट्रंप को मारने की साज़िश से जुड़े अमेरिका के आरोपों पर ईरान ने दिया ये जवाब - BBC News हिंदी	अमेरिकी न्याय मंत्रालय ने ट्रंप की हत्या की साज़िश के आरोप में फरहाद शकेरी नाम के एक व्यक्ति पर आरोप तय किए हैं. अमेरिका का कहना है कि ईरान ने शकेरी को ट्रंप को मारने की योजना बनाने का काम दिया था.	https://ichef.bbci.co.uk/news/1024/branded_hindi/1e7e/live/3c0781f0-9e97-11ef-b137-45ec85b08292.jpg	2024-11-09 13:13:47	BBC News हिंदी
in	https://www.aajtak.in/programmes/shwetpatra/video/up-bypolls-2024-batenge-to-katenge-poster-war-yogi-adityanath-akhilesh-yadav-bjp-sp-2092732-2024-11-10	यूपी उपचुनाव में 'स्लोगन वॉर' से गर्माई देश की सियासत, देखें श्वेतपत्र - Aaj Tak	नवंबर के महीने में दो राज्यों के चुनाव और 15 राज्यों की 25 सीटों पर उप चुनाव हैं. लेकिन सबसे ज्यादा चर्चा पर यूपी की नौ सीटों पर उपचुनाव की है. इस बार यूपी से निकले 'बटेंगे तो कटेंगे' के नारे ने देश में राजनीति की उस पिच को तैयार कर दिया है जहां पक्ष या विपक्ष बैटिंग सबको करनी पड़ रही है. देखें 'श्वेतपत्र'. 	https://akm-img-a-in.tosshub.com/aajtak/images/video/202411/672fb2e297066-up-bypolls-2024-090709267-16x9.png	2024-11-09 19:10:24	Aaj Tak
in	https://navbharattimes.indiatimes.com/astro/religion-rituals/panchang/aaj-ka-panchang-9-november-2024-today-panchang-saturday-kartik-mass-gopaashtami-know-today-puja-shubh-muhurat-and-rahukal-timing/articleshow/115093835.cms	Aaj Ka Panchang, 9 November 2024 : आज कार्तिक शुक्ल गोपाष्टमी, जानें शुभ मुहूर्त और राहुकाल का समय - NBT नवभारत टाइम्स (Navbharat Times)	Today Panchang | Kartik Mass Gopaashtami Tithi | Gopashtami : आज कार्तिक मास की शुक्ल पक्ष की अष्टमी तिथि है। साथ ही आज  श्रवण नक्षत्र पूर्वाह्न 11 बजकर 48 मिनट तक उपरांत घनिष्ठा नक्षत्र का आरंभ। आइए जानते हैं आज का शुभ मुहीर्त और राहुकाल का समय।	https://static.langimg.com/photo/imgsize-82916,msid-115093832/navbharat-times.jpg	2024-11-08 22:30:00	NBT नवभारत टाइम्स (Navbharat Times)
in	https://www.abplive.com/news/world/canada-is-on-high-alert-after-donald-trump-win-us-presidential-election-biggest-deportation-program-in-us-2819710	ट्रंप की जीत के बाद कनाडा में क्यों घोषित हो गया 'हाई अलर्ट'? सामने आई बड़ी वजह - ABP न्यूज़	Donald Trump on Illegal Immigrants : डोनाल्ड ट्रंप हमेशा से अवैध अप्रवासियों को लेकर मुखर रहे हैं. इस बार चुनावी रैली में उन्होंने अमेरिकी इतिहास का सबसे बड़ा डिपोर्टेशन प्रोग्राम चलाने का वादा किया.	https://feeds.abplive.com/onecms/images/uploaded-images/2024/11/09/f06ed2407ec39d3988fe8719477254a117311428578331126_original.jpg?impolicy=abp_cdn&imwidth=1200	2024-11-09 09:05:00	ABP न्यूज़
in	https://hindi.news18.com/news/nation/is-chief-justice-dy-chandrachud-increasing-challenge-for-new-cji-questions-started-arising-with-retirement-8823886.html	नए सीजेआई की चुनौती बढ़ाकर जा रहे जस्टिस चंद्रचूड़? रिटायरमेंट के साथ ही उठने लगे सवाल - News18 हिंदी	जस्टिस चंद्रचूड़ की विदाई से ऐन पहले न्यायपालिका की स्वतंत्रता पर नई बहस छिड़ गई है. चंद्रचूड़ ने  जब  सीजेआई  का  पद संभाला था, तब भी न्‍यायपालिका पर साख का संकट गहरा था. उन्‍होंने अपनी कार्यशैली और 'मीडिया फ्रेंडली' रवैये से काफी हद तक इस चुनौती का सामन किया. उन्‍होंने इस मोर्चे पर जो भी कामयाबी पाई, लगता है उनके जाते-जाते मामला घूम कर वहीं आ गया है. ऐसे में सिर्फ छह महीने के कार्यकाल में जस्टिस खन्‍ना इस चुनौती से कितना निपट पाएंगे, यह देखने वाली बात होगी. - is chief justice dy chandrachud increasing challenge for new cji questions started arising with retirement	https://images.news18.com/ibnkhabar/uploads/2024/11/CJI-Chandrachud-3-2024-11-a57be676a54ce551295b5a62af4c72dc-16x9.jpg	2024-11-09 11:33:31	News18 हिंदी
in	https://navbharattimes.indiatimes.com/world/rest-of-europe/russia-ready-to-listen-to-trump-peace-proposal-on-ukraine-says-minister-close-to-putin/articleshow/115119861.cms	ट्रंप के जीतते ही नरम पड़ा रूस, पुतिन के मंत्री ने दिया बड़ा बयान, क्या दुश्मनी अब दोस्ती में बदलेगी? - NBT नवभारत टाइम्स (Navbharat Times)	अमेरिका में डोनाल्ड ट्रंप के राष्ट्रपति चुने जाने के बाद रूस के सुर नरम पड़ते नजर आ रहे हैं। पहले रूसी राष्ट्रपति व्लादिमीर पुतिन ने ट्रंप को चुनाव में जीत की बधाई दी और उनकी तारीफ में कसीदे पढ़े हैं। इसके बाद अब रूसी उप प्रधानमंत्री ने कहा है कि पुतिन यूक्रेन युद्ध पर ट्रंप के प्रस्ताव को सुनने के लिए तैयार हैं।	https://static.langimg.com/photo/imgsize-53786,msid-115120025/navbharat-times.jpg	2024-11-09 15:30:47	NBT नवभारत टाइम्स (Navbharat Times)
in	https://www.aajtak.in/programmes/mumbai-metro/video/maharashtra-assembly-elections-2024-maha-vikas-aghadi-vs-maha-yukti-war-narendra-modi-rally-in-dhule-ajit-pawar-yogi-adityanath-2092144-2024-11-09	महाराष्ट्र में MVA Vs MHA की जुबानी जंग हुई तेज, देखें मुंबई मेट्रो - Aaj Tak	महाराष्ट्र में विधानसभा चुनाव 2024 के लिए 20 नवंबर को मतदान होने वाले हैं. उससे पहले महाविकास अघाड़ी और महायुति में जुबानी जंग तेज हो गई है. धुले में शुक्रवार को एक रैली को संबोधित करते हुए विपक्ष पर जमकर निशाना साधा है. वहीं, सीएम योगी आदित्यनाथ के नारे से महायुति बटी दिख रही है. देखें वीडियो.
	https://akm-img-a-in.tosshub.com/aajtak/images/video/202411/672ebaac9d5fb-maharashtra-assembly-elections-2024-092806986-16x9.png	2024-11-09 01:28:34	Aaj Tak
in	https://www.amarujala.com/india-news/maharashtra-election-2024-amit-shah-said-sharad-pawar-four-generation-cannot-take-back-article-370-2024-11-08	Article 370: 'शरद पवार साहब, आपकी चार पीढ़ियां भी अनुच्छेद 370 को वापस नहीं ला सकतीं', अमित शाह की चेतावनी - अमर उजाला	Maharashtra Vidhan Sabha Chunav 2024: शाह ने कहा कि 'ये अघाड़ी वाले न देश को सुरक्षित कर सकते हैं, न देश का सम्मान बढ़ा सकते हैं। अगर ये काम करना	https://staticimg.amarujala.com/assets/images/2024/05/13/amit-shah_ac0ee0c11a16e5d3fe37144073e696ef.jpeg?w=750&dpr=1.0	2024-11-08 08:38:00	अमर उजाला
in	https://ndtv.in/india/pm-modi-remember-shri-ratan-tata-legacy-compassion-innovation-6978064	मुझे याद है, जब आपके लिए...PM मोदी ने रतन टाटा को कुछ इस तरह से किया याद - NDTV India	दिग्गज उद्योगपति रतन टाटा के निधन को एक महीना हो गया है. प्रधानमंत्री मोदी ने रतन टाटा को आज याद करते हुए एक ब्लॉग लिखा. जिसमें उन्होंने कहा कि रतन टाटा जी ने हमेशा बेहतरीन क्वालिटी के प्रॉडक्ट...बेहतरीन क्वालिटी की सर्विस पर जोर दिया और भारतीय उद्यमों को ग्लोबल बेंचमार्क स्थापित करने का रास्ता दिखाया.	https://c.ndtvimg.com/2024-11/k3mtjpp8_pm-modi-_625x300_09_November_24.jpg?im=FeatureCrop,algorithm=dnn,width=1200,height=738	2024-11-09 05:05:22	NDTV India
in	https://www.bhaskar.com/db-original/news/maharashtra-baramati-election-2024-ajit-pawar-vs-yugendra-pawar-ncp-133930403.html	शरद साहेब या अजित दादा, बारामती के वोटर कन्फ्यूज: घरों में ही बंट गए वोट, लोग बोले- दोनों को नाराज नहीं कर ... - Dainik Bhaskar	‘मेरे पति अजित पवार को वोट करते हैं और मैं शरद पवार को वोट देती हूं। हमारे घर में ही वोट बंट गए हैं। एक वोट दादा को, दूसरा वोट साहेब को, हमें किसी को नाराज नहीं करना है।’ | Maharashtra Baramati Assembly Election2024; Follow Ajit Pawar NCP VS Sharad Pawar (NCP) Candidate Yugendra Pawar, Vidhan Sabha Chunav Ground Report, Latest News Analysis On Dainik Bhaskar (दैनिक भास्कर)	https://images.bhaskarassets.com/thumb/730x0/web2images/521/2024/11/08/gr-cover-08nov_1731079883.gif	2024-11-08 23:36:58	Dainik Bhaskar
in	https://www.aajtak.in/india/jammu-kashmir/story/jammu-and-kashmir-encounter-in-sopore-security-forces-one-terrorist-killed-ntc-rpti-2092687-2024-11-09	जम्मू-कश्मीर के सोपोर में सुरक्षाबलों और आतंकियों के बीच मुठभेड़, एक दहशतगर्द ढेर - Aaj Tak	जम्मू-कश्मीर के सोपोर में सुरक्षाबलों और आतंकियों के बीच मुठभेड़ हो गई. इसमें सुरक्षाबलों ने एक दहशतगर्द को मार गिराया है. कश्मीर जोन पुलिस ने कहा कि बारामुला के सोपोर इलाके में आतंकवादियों की मौजूदगी के बारे में एक विशेष इनपुट मिला था, इस पर एक्शन लिया गया. पुलिस और सुरक्षा बलों द्वारा एक संयुक्त आतंकवाद विरोधी अभियान शुरू किया गया. 	https://akm-img-a-in.tosshub.com/aajtak/images/story/202411/672f891c6c433-jammu-kashmir-sopore-encounter-090854941-16x9.jpeg	2024-11-09 16:06:23	Aaj Tak
in	https://www.abplive.com/news/india/income-tax-raids-on-jharkhand-cm-hemant-soren-s-deputy-secretary-sunil-srivastava-2819457	झारखंड चुनाव से पहले आयकर विभाग का एक्शन! CM हेमंत सोरेन के निजी सलाहकार के घर छापेमारी - ABP न्यूज़	Hemant Soren: झारखंड विधानसभा चुनाव से पहले आयकर विभाग ने CM हेमंत सोरेन के निजी सलाहकार सुनील श्रीवास्तव और उनसे जुड़े लोगों के खिलाफ बड़ी कार्रवाई की है.	https://feeds.abplive.com/onecms/images/uploaded-images/2024/11/09/b7ea5d5082fe8d6ade4b8e7588f2dbe91731121568216425_original.png?impolicy=abp_cdn&imwidth=1200	2024-11-09 02:53:29	ABP न्यूज़
in	https://navbharattimes.indiatimes.com/astro/rashifal/bolen-sitare/scorpio-horoscope-today-9-november-2024-aaj-ka-vrischik-rashifal/articleshow/115086559.cms	आज का वृश्चिक राशि का राशिफल 9 नवंबर 2024 : अपने गुस्से पर रखें कंट्रोल, संपत्ति विवाद होगा समाप्त - NBT नवभारत टाइम्स (Navbharat Times)	Aaj Ka Vrischik Rashifal : वृश्चिक राशि के लोगों के लिए आज का दिन सामान्य रहने वाला है। आज आपको अपने क्रोध पर बहुत ही नियंत्रण रखना होगा। आज आपके कारण घर परिवार के लोगों को कुछ परेशानियों का सामना करना पड़ सकता है। आइए जानते हैं आज का दिन करियर, परिवार और आपके स्वास्थ्य के मामले में कैसा रहेगा।	https://static.langimg.com/photo/imgsize-1171555,msid-115086642/navbharat-times.jpg	2024-11-08 23:20:00	NBT नवभारत टाइम्स (Navbharat Times)
in	https://www.aajtak.in/world/video/pakistan-bomb-blast-at-quetta-railway-station-20-dead-30-injured-peshawar-explosion-2092276-2024-11-09	पाकिस्तान: क्वेटा के रेलवे स्टेशन पर बम धमाका, 20 लोगों की मौत 30 जख्मी - Aaj Tak	पाकिस्तान के क्वेटा में रेलवे स्टेशन के अंदर जोरदार धमाका हुआ है जिसमें 20 लोगों की मौत हो गई है जबकि 30 से ज्यादा लोग घायल बताए जा रहे हैं. शुरुआती रिपोर्ट के अनुसार, स्टेशन पर भीड़ को देखते हुए मृतकों की संख्या बढ़ने का अनुमान है. क्वेटा के एसएसपी ने कहा है कि यह आत्मघाती हमले जैसा लग रहा है. देखें वीडियो.
	https://akm-img-a-in.tosshub.com/aajtak/images/video/202411/672efa0e845d0-pakistan-bomb-blast-at-quetta-railway-station-095832435-16x9.png	2024-11-09 05:59:06	Aaj Tak
in	https://www.aajtak.in/uttar-pradesh/story/up-women-commission-proposal-male-tailors-will-not-take-measurements-of-womens-clothes-ladies-gym-trainer-lclam-rpti-2091521-2024-11-08	यूपी में ना पुरुष टेलर ले सकेंगे महिलाओं के कपड़ों की माप, ना मेल ट्रेनर जिम में दे पाएंगे ट्रेनिंग, महिला आयोग का प्रस्ताव - Aaj Tak	उत्तर प्रदेश राज्य महिला आयोग ने महिलाओं को 	https://akm-img-a-in.tosshub.com/aajtak/images/story/202411/672dc4b0d89ac-20241108-085835400-16x9.jpg	2024-11-08 07:45:37	Aaj Tak
in	https://www.aajtak.in/visualstories/religion/weekly-rashifal-11-november-to-17-november-lucky-zodiac-get-money-and-success-this-week-dev-uthani-ekadashi-2024-tvisu-185496-09-11-2024	देवउठनी एकादशी पर पलटेंगे इन 5 राशियों के दिन, लाभ ही लाभ - Aaj Tak	weekly rashifal 2024: ये नया सप्ताह 11 नवंबर से लेकर 17 नवंबर तक रहने वाला है. ज्योतिष गणना के अनुसार, नया सप्ताह पांच राशियों के लिए बहुत ही शुभ रहने वाला है. आइए इन लकी राशियों के बारे में जानते हैं	https://cf-img-a-in.tosshub.com/sites/visualstory/wp/2024/11/lord-vishnu_5.jpg?size=*:675	2024-11-09 13:50:11	Aaj Tak
in	https://www.aajtak.in/world/story/trudeau-government-ends-sds-in-canada-indian-students-will-be-most-affected-students-used-to-get-visa-in-20-days-now-it-will-take-8-weeks-ntc-dskc-2092720-2024-11-09	छात्रों को 20 दिन में मिल जाता था वीजा, अब 8 हफ्ते लगेंगे... कनाडा में SDS खत्म, भारतीय स्टूडेंट्स पर पड़ेगा सबसे ज्यादा असर! - Aaj Tak	कनाडा ने इंटरनेशनल स्टूडेंट्स के लिए फास्ट ट्रैक स्टडी वीज़ा प्रोग्राम यानी स्टूडेंट डायरेक्ट स्ट्रीम (SDS) को खत्म कर दिया है. कनाडा के एक पोर्टल ने बताया कि कनाडा में अध्ययन करने के इच्छुक भावी छात्रों के लिए साल 2024 एक उथल-पुथल भरा वर्ष रहा है, क्योंकि प्रत्येक वर्ष कनाडा में एंट्री लेने वाले अंतर्राष्ट्रीय छात्रों की संख्या में कटौती की जा रही है. 	https://akm-img-a-in.tosshub.com/aajtak/images/story/202411/672fa1399bfa1-trudeau-government-095147740-16x9.png	2024-11-09 17:52:32	Aaj Tak
in	https://navbharattimes.indiatimes.com/astro/rashifal/numerology-prediction/numerology-horoscope-9-november-2024-numerology-7-people-should-face-all-challenges-with-courage-today-know-your-numerology-prediction-according-to-your-birthdate/articleshow/115093066.cms	आज का अंक ज्योतिष 9 नवंबर 2024: मूलांक 7 वाले साहस के साथ आगे बढ़ें, सफलता चूमेगी कदम, जानें आज कैसा रहेगा आपका दिन - NBT नवभारत टाइम्स (Navbharat Times)	Numerology Prediction 9 november 2024: आज 9 नवंबर को शनिवार का दिन है। शनिवार का दिन शनिदेव को समर्पित होता है। शनिदेव को प्रसन्न करने के लिए शनि चालीसा का पाठ करें। अंक ज्योतिष की गणना के अनुसार आज जिन लोगों का जन्मदिन उनका मूलांक 9 होगा। आइए, विस्तार से जानते हैं आज मूलांक 1 से मूलांक 9 वालों का दिन कैसा रहेगा।	https://static.langimg.com/photo/imgsize-2722198,msid-113195475/navbharat-times.jpg	2024-11-09 01:05:00	NBT नवभारत टाइम्स (Navbharat Times)
in	https://www.abplive.com/states/maharashtra/maharashtra-assembly-election-2024-devendra-fadnavis-targeted-akbaruddin-owaisi-in-chhatrapati-sambhaji-nagar-2819998	'सुनलो ओवैसी, किसी का बाप भी...', संभाजी नगर का जिक्र कर क्या बोल गए देवेंद्र फडणवीस - ABP न्यूज़	Maharashtra Election 2024: उपमुख्यमंत्री देवेंद्र फडणवीस ने अकबरुद्दीन के बयान का पलटवार किया. साथ ही ये भी कहा कि छत्रपति संभाजीनगर कल भगवा था, आज भगवा है और 23 तारीख को भगवा होगा.	https://feeds.abplive.com/onecms/images/uploaded-images/2024/11/09/aa5a5cea2c0d968936f839080882e1391731174770048304_original.jpg?impolicy=abp_cdn&imwidth=1200	2024-11-09 17:53:37	ABP न्यूज़
