country_code	url	title	description	image_url	publish_date	source
in	https://navbharattimes.indiatimes.com/india/weather-today-forecast-23-october-2024-aaj-ka-mausam-winter-temperature-cyclone-dana-heavy-rainfall-alert-update/articleshow/114475331.cms	आज का मौसम 23 अक्टूबर 2024: दिल्ली में गर्मी का अहसास कब तक? देश के इन हिस्सों में साइक्लोन और भारी बारिश की चेतावनी, पढ़िए वेदर अपडेट - NBT नवभारत टाइम्स (Navbharat Times)	Weather Today, मौसम न्यूज 23 अक्टूबर 2024: दिल्ली-एनसीआर में अब भी गर्मी का असर है, लेकिन अक्टूबर के अंत तक सुबह-शाम थोड़ी ठंडक रहेगी। उधर चक्रवाती तूफान दाना 24 अक्टूबर को उत्तरी ओडिशा और पश्चिम बंगाल के तटों पर पहुंच सकता है, जिससे भारी बारिश और तेज हवाएं चलने की संभावना है। आईएमडी ने रेड और ऑरेंज अलर्ट जारी किया है।	https://static.langimg.com/photo/imgsize-47288,msid-114475445/navbharat-times.jpg	2024-10-23 00:30:00	NBT नवभारत टाइम्स (Navbharat Times)
in	https://www.aajtak.in/madhya-pradesh/video/what-did-faizan-say-after-saying-bharat-mata-ki-jai-21-times-in-bhopal-watch-video-2077930-2024-10-22	भारत व‍िरोधी नारे लगाने वाले फैजान को अब गलती का एहसास, देखें VIDEO - Aaj Tak	राजधानी में पाकिस्तान के समर्थन में नारे लगाने के आरोपी फैजान को अनोखी सजा मिली है. उसे हर महीने दो बार थाने में भारत माता की जय के नारे लगाने और तिरंगे को सलामी देने का आदेश दिया गया है.  सलामी देने के बाद आजतक से बात करते हुए फैसल ने कहा कि रील बनाते समय उसने यह सब नशे में बोल दिया था. उसे अपनी गलती का अहसास है और आगे से वो ऐसा नहीं करेगा. देखिए VIDEO	https://akm-img-a-in.tosshub.com/aajtak/images/video/202410/67179adea8d32-salute-tricolour-21-times-223012223-16x9.png	2024-10-22 12:30:56	Aaj Tak
in	https://hindi.news18.com/news/astro/daily-horoscope-aaj-ka-rashifal-23-october-2024-horoscope-today-budhwar-mesh-to-meen-rashi-wednesday-12-zodiac-sign-prediction-8788103.html	Aaj Ka Rashifal: नई संभावनाओं से भरा है दिन, 3 राशिवालों का आर्थिक पक्ष मजबूत होगा, नए प्रोजेक्ट के लिए समय... - News18 हिंदी	Aaj Ka Rashifal 23 october 2024: आज 23 अक्टूबर बुधवार का दिन मिथुन राशि वालों के लिए नई संभावनाओं से भरा रहेगा. यह समय खुद को अभिव्यक्त करने और अपने विचारों को सामने लाने का है. 3 राशि के जातकों की आर्थिक स्थिति मजबूत रहेगी. नया काम करने के लिए समय अनुकूल है. आइए जानते हैं आज का राशिफल. - aaj ka rashifal 23 october 2024 horoscope today budhwar mesh to meen rashi wednesday 12 zodiac sign prediction	https://images.news18.com/ibnkhabar/uploads/2024/10/aaj-ka-rashifal-23-october-2024-2024-10-7b06cd58509f9ece5f301a66751dfd6d-16x9.jpg	2024-10-23 00:13:56	News18 हिंदी
in	https://ndtv.in/india/waqf-board-jpc-meeting-uproar-jpc-chairman-jagdambika-pal-told-how-ruckus-happened-6849323	बोतल तोड़ी, गालियां दी... : वक्फ पर JPC के चेयरमैन से सुनिए कैसे बैठक में हुआ हंगामा - NDTV India	जेपीसी के चेयरमैन और भाजपा सांसद जगदंबिका पाल (Jagdambika Pal) ने जेपीसी बैठक के दौरान हंगामे के शुरू होने और तृणमूल सांसद कल्‍याण बनर्जी के आपा खो देने की पूरी घटना के बारे में बताया है.	https://c.ndtvimg.com/2024-10/sm50h4ag_jagdambika-pal_625x300_22_October_24.jpg?im=FitAndFill,algorithm=dnn,width=1200,height=738	2024-10-22 15:23:11	NDTV India
in	https://www.abplive.com/states/maharashtra/raj-thackeray-son-amit-thackeray-will-contest-from-mahim-seat-maharashtra-election-2024-2808851	महाराष्ट्र विधानसभा चुनाव: राज ठाकरे के बेटे अमित ठाकरे माहिम सीट से लड़ेंगे चुनाव - ABP न्यूज़	Maharashtra Election 2024: महाराष्ट्र विधानसभा चुनाव के मद्देनजर राज ठाकरे (Raj Thackeray) की पार्टी MNS ने दूसरी लिस्ट में 45 उम्मीदवारों के नामों की घोषणा की है.	https://feeds.abplive.com/onecms/images/uploaded-images/2024/10/22/3521a046d345dc04e3248ce477a0c34e1729614907372129_original.jpg?impolicy=abp_cdn&imwidth=1200	2024-10-22 16:35:44	ABP न्यूज़
in	https://www.prabhatkhabar.com/state/jharkhand/ranchi/jharkhand-elections-2024-louis-marandi-made-serious-allegations-against-bjp-responsible-for-leaving-party	हेमंत सोरेन को हराने वाली लुईस मरांडी ने BJP पर लगाए गंभीर आरोप, इस नेता को पार्टी छोड़ने के लिए ठहराया जिम्मेदार - प्रभात खबर - Prabhat Khabar	2014 के विधानसभा चुनाव में हेमंत सोरेन को मात देने वाली दुमका की पूर्व विधायक लुईस मरांडी ने बीजेपी से इस्तीफा दे दिया है. उन्होंने अपने त्यागपत्र में बीजेपी में गुटबाजी का आरोप लगाया.	https://www.prabhatkhabar.com/wp-content/uploads/2024/10/louis-marandi.jpg	2024-10-22 02:08:26	प्रभात खबर - Prabhat Khabar
in	https://navbharattimes.indiatimes.com/astro/religion-rituals/panchang/aaj-ka-panchang-22-october-2024-today-panchang-tuesday-kartik-maas-panchmi-tithi-know-today-puja-shubh-muhurat-and-rahukal-timing/articleshow/114435662.cms	Aaj Ka Panchang, 22 October 2024 : आज कार्तिक कृष्ण षष्ठी तिथि, जानें शुभ मुहूर्त और राहुकाल का समय - NBT नवभारत टाइम्स (Navbharat Times)	Today Panchang | Kartik maas 2024, sashthi tithi 22 October 2024 : आज  कार्तिक मास की कृष्ण पक्ष की षष्ठी तिथि है। आज षष्ठी तिथि अर्धरात्रोत्तर 01 बजकर 30 मिनट तक उपरांत सप्तमी तिथि का आरंभ होगा। आइए जानते हैं आज शुभ मुहूर्त और राहुकाल का समय कब से कब तक रहेगा।	https://static.langimg.com/photo/imgsize-82916,msid-114435720/navbharat-times.jpg	2024-10-21 22:30:00	NBT नवभारत टाइम्स (Navbharat Times)
in	https://www.jansatta.com/national/jammu-kashmir-assembly-national-conference-omar-abdullah-deputy-cm-bjp/3643786/	उमर अब्दुल्ला ने BJP के लिए छोड़ा विधानसभा में डिप्टी स्पीकर का पद, क्या दोस्ती का हाथ बढ़ा रहे मुख्यमंत्री? - Jansatta	None	https://www.jansatta.com/wp-content/uploads/2024/10/Omar-Abdullah-JK.jpg	2024-10-22 10:06:23	Jansatta
in	https://navbharattimes.indiatimes.com/astro/rashifal/bolen-sitare/scorpio-horoscope-today-22-october-2024-aaj-ka-vrischik-rashifal/articleshow/114426549.cms	आज का वृश्चिक राशि का राशिफल 22 अक्टूबर 2024 : दिन थोड़ा मुश्किल भरा रहेगा, गलती करने से बचें - NBT नवभारत टाइम्स (Navbharat Times)	Aaj Ka Vrischik Rashifal : वृश्चिक राशि के लोगों के लिए आज का दिन थोड़ा सामान्य से निम्न रहने वाला है। आज आपके व्यवसाय में काफी छोटी सी गलती से बड़ा नुकसान होने की संभावना है। दूसरों की बातों से खुद को परेशान न करें। विस्तार से पढ़ें आज का वृश्चिक राशिफल...	https://static.langimg.com/photo/imgsize-908346,msid-114426646/navbharat-times.jpg	2024-10-21 23:35:00	NBT नवभारत टाइम्स (Navbharat Times)
in	https://www.jagran.com/punjab/chandigarh-punjab-bypolls-bjp-announces-candidates-for-three-seats-23819971.html	पंजाब उपचुनाव के लिए बीजेपी ने जारी की प्रत्याशियों की लिस्ट; चार में से तीन सीटों पर उतारे उम्मीदवार - दैनिक जागरण (Dainik Jagran)	पंजाब की चार विधानसभा सीटों पर होने वाले उपचुनाव के लिए भारतीय जनता पार्टी ने अपने उम्मीदवारों का एलान कर दिया है। भाजपा ने डेरा बाबा नानक से सरदार रविकरण कहलों गिद्देरबाहा से सरदार मनप्रीत बादल और बरनाला से सरदार केवल सिंह ढिल्लों को टिकट दिया है। आम आदमी पार्टी ने पहले ही अपने उम्मीदवारों का एलान कर दिया था।	https://www.jagranimages.com/images/newimg/22102024/22_10_2024-bjp_candidates_in_punjab_bypolls_23819971_17440637.jpg	2024-10-22 10:56:00	दैनिक जागरण (Dainik Jagran)
in	https://www.aajtak.in/religion/rashiphal/story/sagittarius-daily-horoscope-22-october-2024-aaj-ka-dhanu-rashifal-in-hindi-tuesday-tlifdr-dskc-2076994-2024-10-22	आज 22 अक्टूबर 2024 का धनु राशिफल (Sagittarius Horoscope): जानिए कैसा रहेगा धनु राशि वालों का दिन, क्या कहते हैं सितारे - Aaj Tak	sagittarius daily horoscope 22 october 2024:  घर परिवार में उचित स्थान बनाए रखेंगे. आत्मविश्वास से आगे बढ़ेंगे. लक्ष्य पर फोकस बनाए रखेंगे. अवरोधों को सहजता से पार करने का भाव रहेगा. कार्य विस्तार के अवसर रहेंगे. महत्वपूर्ण चर्चा में शामिल रहेंगे. सहयोग का भाव बना रहेगा. नेतृत्च को बढ़ावा मिलेगा. लाभ के मामले संवरेंगे. लेनदेन में प्रभावी रहेंगे. निसंकोच आगे बढ़ेंगे. साझीदारी का प्रयास बनाए रखेंगे. स्थायित्व पर जोर रहेगा. आर्थिक पक्ष को बल मिलेगा. विभिन्न कार्यां में गति रखेंगे. साख सम्मान में वृद्धि होगी.	https://akm-img-a-in.tosshub.com/aajtak/images/story/202410/671650c83f813-dhanu-rashifal-252122135-16x9.jpg	2024-10-21 23:30:29	Aaj Tak
in	https://navbharattimes.indiatimes.com/world/rest-of-europe/brics-summit-2024-russia-putin-connecting-india-pm-modi-and-china-xi-jinping-in-kazan/articleshow/114484528.cms	मोदी और जिनपिंग के बीच दोस्त की तरह नजर आए पुतिन, ब्रिक्स समिट की ये तस्वीर भारत-चीन रिश्तों पर बहुत कुछ कहती है - NBT नवभारत टाइम्स (Navbharat Times)	प्रधानमंत्री नरेंद्र मोदी मंगलवार को रूस के कजान में ब्रिक्स नेताओं के आयोजित डिनर में शामिल हुए, जहां रूसी राष्ट्रपति व्लादिमीर पुतिन ने प्रधानमंत्री मोदी का स्वागत किया। कार्यक्रम के दौरान रूस के राष्ट्रपति हमेशा भारतीय प्रधानमंत्री के साथ नजर आए, तो उन्होंने अपने साथ चीनी राष्ट्रपति को भी लिया हुआ था।	https://static.langimg.com/photo/imgsize-57826,msid-114484959/navbharat-times.jpg	2024-10-23 01:50:49	NBT नवभारत टाइम्स (Navbharat Times)
in	https://www.jagran.com/news/national-bengaluru-weather-news-heavy-rains-in-bengaluru-disrupt-life-23820199.html	बेंगलुरु में भारी बारिश से हाहाकार; आज स्कूलों में छुट्टी, निर्माणाधीन इमारत ढही, तीन लोगों के शव मिले - दैनिक जागरण (Dainik Jagran)	बेंगलुरु में भारी बारिश से बाढ़ जैसे हालात पैदा हो गए हैं। वहीं एक निर्माणाधीन इमारत ढह गई। मलबे में कई लोगों के दबे होने की आशंका है। अभी तक 14 लोगों को बचाया गया है। वहीं तीन लोग लापता हैं। मौसम विभाग के मुताबिक भारी बारिश का दौर जारी रहेगा। तमिलनाडु में भी भारी बारिश का अलर्ट जारी किया गया है। 	https://www.jagranimages.com/images/newimg/23102024/23_10_2024-bengaluru_news_23820199.jpg	2024-10-22 21:04:00	दैनिक जागरण (Dainik Jagran)
in	https://www.indiatv.in/india/national/indian-railways-cancels-more-than-150-trains-ahead-of-cyclone-dana-landfall-2024-10-22-1085236	चक्रवाती तूफान 'दाना' के चलते 150 से अधिक ट्रेनें कैंसिल, देखें पूरी लिस्ट; जानें रेलवे ने क्या कहा - India TV Hindi	चक्रवाती तूफान दाना की आशंका के चलते रेलवे ने 150 ट्रेनों को कैंसिल कर दिया है। रेलवे ने कहा है कि इस दौरान इमरजेंसी कंट्रोल रूम भी स्थापित किए जाएंगे। 
	https://resize.indiatv.in/resize/newbucket/1200_-/2024/10/untitled-52-1729620609.jpg	2024-10-22 18:19:12	India TV Hindi
in	https://www.abplive.com/news/world/india-canada-row-canadian-deputy-foreign-minister-david-morrison-provided-intelligence-information-about-india-to-american-2808901	India-Canada Row: कनाडा की एक और काली करतूत! ट्रूडो के अधिकारियों ने अमेरिकी अखबार को बताई - ABP न्यूज़	India-Canada: कनाडाई पुलिस Royal Canadian Mounted Police (RCMP) ने भारत के एजेंटों के खिलाफ देश में मर्डर करने और जबरन पैसा ऐंठने और हिंसक कामों में शामिल होने को लेकर गंभीर आरोप लगाया था.	https://feeds.abplive.com/onecms/images/uploaded-images/2024/10/23/2ba524db486e892d814ff7ba2ac903aa17296463453201115_original.png?impolicy=abp_cdn&imwidth=1200	2024-10-23 01:29:59	ABP न्यूज़
in	https://navbharattimes.indiatimes.com/metro/delhi/other-news/delhi-air-quality-in-bed-condition-anand-vihar-aqi-crosses-400-turning-into-a-gas-chamber-pollution/articleshow/114485662.cms	Delhi Pollution: दिवाली से पहले बिगड़ी दिल्ली का हवा, प्रदूषण से गैस चैंबर बनती राजधानी में AQI 400 के पार - NBT नवभारत टाइम्स (Navbharat Times)	दिल्ली धीरे-धीरे गैस चैंबर बनती जा रही है। दिवाली में अभी भी 8 दिन बाकी हैं, लेकिन दिल्ली के अधिकांश इलाके पहले से ही प्रदूषण की चादर से ढके हुए हैं। आज सुबह, शहर के कई हिस्सों में हवा की गुणवत्ता बहुत खराब रही। दिल्ली के अधिकांश क्षेत्रों में AQI (एयर क्वालिटी इंडेक्स) 350 से ऊपर पहुंच गया है, जो स्वास्थ्य के लिए बहुत खराब है। 	https://static.langimg.com/photo/imgsize-36826,msid-114485732/navbharat-times.jpg	2024-10-23 02:48:46	NBT नवभारत टाइम्स (Navbharat Times)
in	https://www.aajtak.in/uttar-pradesh/story/talk-of-rahul-gandhi-and-akhilesh-yadav-deadlock-resolved-samajwadi-party-will-leave-phulpur-seat-for-congress-ntc-rpti-2078318-2024-10-23	राहुल गांधी और अखिलेश के बीच गुफ्तगू और बन गई बात... फूलपुर सीट देने को कैसे राजी हुई सपा? - Aaj Tak	यूपी उपचुनाव में समाजवादी पार्टी पहले ही कांग्रेस के लिए गाजियाबाद और खैर विधानसभा सीट छोड़ चुकी है और इसका औपचारिक ऐलान भी कर चुकी है. हालांकि, दो सीटें दिए जाने पर कांग्रेस असंतुष्ट नजर आ रही थी. 	https://akm-img-a-in.tosshub.com/aajtak/images/story/202410/6718651441b5d-rahul-gandhi-and-akhilesh-yadav-235302434-16x9.jpg	2024-10-23 02:54:39	Aaj Tak
in	https://news.google.com/rss/articles/CBMi6gFBVV95cUxPNE1Nb080cTU5R0NEVGxadE5BdDhGSklkRFVDZHBtN2VaUzJXYU1RcUMtb3RZcy05TTk3QjdNNi1tWWpXVFdxTTMxTlliQmxWTXMwaEtFSFAzemVBdml6eTN0dUNBNWFJcGtWcDFRRllSaS01ZGlPOWxiXzhpNWR4aFlOYjRPallMNGtSSU1FM1NwTUs4OURGdVd3ZlFlR2tqUFRFcklsOEhaWWpJX21MRklEZy12WE9NSFRhU2VjV3Y1WDVYbjlKbk1RSDk3aUk0clRNaHIyU2RnWGlRQmNsb2tNLUh2ZmpTSXfSAe8BQVVfeXFMT1p1MzRiRi01cHVnT3BrQTJLQ0RQZDB5TjVienNncXYtOVNWMDVMQThVcDJDdnFvcE4wcklJbHJxMUlFUXBHbVNzd3pQVEk0WHBieWNraTY3OEdza19ZMzFyQUhUSDhZY1FrNXFLRUViT0dzTGVDY0FGM3drNkwtQ1M5amJwUjd3aHdrdFVOV1hZLVctV0JlRWg2SmF1ODFkbWphOGx1RC1TU0JvMDlVR1ZVTjFYY3VqRzVtR2NmZmNOTWZIYlBRd3V2UDlLeVlQNTJ4OExOZHdEZkY1dWozS0p5aGkxV2Y5Q3NuRnJvRzA?oc=5	Jharkhand Election 2024: आरजेडी ने की छह उम्मीदवारों की घोषणा, जेल से चुनाव लड़ेंगे सुभाष यादव - प्रभात खबर - Prabhat Khabar	Jharkhand Election 2024: आरजेडी नेता तेजस्वी यादव ने कहा कि सीटों के बंटवारे पर आम सहमति बन गई है.	https://www.prabhatkhabar.com/wp-content/uploads/2024/09/rjd-jharkhand.jpg	2024-10-22 16:08:54	प्रभात खबर - Prabhat Khabar
in	https://www.jagran.com/news/national-brics-summit-2024-being-held-in-kazan-of-russia-is-very-special-in-many-ways-23820206.html	BRICS के सहारे पुतिन ने चली ऐसी चाल, अमेरिका हो जाएगा बेहाल; आज शी जिनपिंग से मिलेंगे पीएम मोदी - दैनिक जागरण (Dainik Jagran)	रूस के कजान में ब्रिक्स सम्मेलन के दूसरे दिन प्रधानमंत्री नरेंद्र मोदी चीन के राष्ट्रपति शी चिनफिंग से मिलेंगे। आज ही ब्रिक्स सम्मलेन का घोषणा पत्र जारी होगा। इस पर दुनियाभर की निगाहें। करीब 40 देशों ने ब्रिक्स की सदस्यता लेने का प्रस्ताव दिया है। वहीं ब्रिक्स देश अपना पेमेंट सिस्टम बनाने पर विचार कर रहे हैं। रूस में हो रहा यह अब तक का सबसे बड़ा ब्रिक्स सम्मेलन है।	https://www.jagranimages.com/images/newimg/23102024/23_10_2024-brics_summit_2024_23820206.jpg	2024-10-23 02:42:00	दैनिक जागरण (Dainik Jagran)
in	https://hindi.news18.com/news/astro/aaj-ka-ank-jyotish-23-october-2024-numerology-horoscope-budhwar-mulank-1-to-number-9-predictions-on-daily-basis-8788197.html	Ank Jyotish 23 October 2024: आज प्रॉपर्टी की डील होगी फाइनल, काम का मिलेगा पुरस्कार, लेकिन बॉस से विवाद! जा... - News18 हिंदी	Ank Jyotish 23 October 2024: आज 23 अक्टूबर बुधवार के दिन मूलांक 1 वालों की प्रॉपर्टी खरीदने की डील फाइनल हो सकती है. मूलांक 4 वालों के विचार किसी को गहराई से प्रभावित करेंगे, आपको अपने प्रयासों के लिए अच्छा पुरस्कार मिलेगा. वहीं अंक 9 वालों का बॉस के साथ मतभेद हो सकता है. अंक ज्योतिष से जानते हैं आज का भविष्यफल. - aaj ka ank jyotish 23 october 2024 numerology horoscope budhwar mulank 1 to number 9 predictions on daily basis	https://images.news18.com/ibnkhabar/uploads/2024/10/aaj-ka-ank-jyotish-23-october-2024-2024-10-10d902b14e68035f39ecc454058cf76e-16x9.jpg	2024-10-22 18:31:43	News18 हिंदी
