country_code	url	title	description	image_url	publish_date	source
in	https://www.hindustantimes.com/india-news/maharashtra-polls-shiv-sena-announces-20-candidates-in-new-list-milind-deora-and-sanjay-nirupam-among-faces-101730044448535.html	Maharashtra polls: Eknath Shinde's Sena names Milind Deora as candidate against Aaditya Thackeray - Hindustan Times	A former Union minister who served in the Manmohan Singh-led UPA government, Milind Deora quit Congress and joined the Shiv Sena in January this year	https://www.hindustantimes.com/ht-img/img/2024/10/27/1600x900/Milind_Deora_and_Aaditya_Thackeray_1730049323711_1730049324025.jpg	2024-10-27 15:59:05	Hindustan Times
in	https://www.bhaskar.com/national/news/indigo-vistara-akasa-air-flights-bomb-threat-update-133872177.html	रविवार को 50 फ्लाइट्स में बम की धमकी: इंडिगो की 18, विस्तारा की 17 और अकासा की 15 फ्लाइट्स; 14 दिनों में 35... - Dainik Bhaskar	तीन इंडियन एयरलाइंस की 50 फ्लाइट्स को रविवार को बम से उड़ाने की धमकी मिली है। इनमें इंडिगो की 18, विस्तारा की 17 और अकासा की 15 फ्लाइट्स शामिल हैं। | IndiGo Vistara Akasa Flights Bomb Threats Case Update; Follow Mumbai Hyderabad Lucknow Pune IndiGo, Vistara and Air India Latest News and Updates On Dainik Bhaskar (दैनिक भास्कर). तीन भारतीय विमानों की कुल 50 फ्लाइट्स को रविवार को बम की धमकी मिली है। इनमें इंडिगो की 18, विस्तारा की 17 और अकासा की 15 फ्लाइट्स शामिल हैं।	https://images.bhaskarassets.com/thumb/730x0/web2images/521/2024/10/27/k-901729955172_1730027739.jpg	2024-10-27 11:20:07	Dainik Bhaskar
in	https://www.aajtak.in/india/gujarat/story/people-are-standing-in-line-since-night-for-morning-train-condition-of-udhna-station-of-surat-ntc-rptc-2082438-2024-10-27	गुजरात: सुबह की ट्रेन के लिए रात से ही लाइन में लग रहे लोग, भीड़ से सूरत के उधना स्टेशन का हाल बुरा - Aaj Tak	सूरत से उत्तर प्रदेश, बिहार, मध्य प्रदेश और झारखंड जाने वाले यात्रियों की लंबी-लंबी लाइनें लगी हैं. उधना स्टेशन के बाहर सड़क पर यात्रियों की करीब एक किलोमीटर लंबी लाइन देखी जा रही है. आजतक ने जब इनसे बातचीत की तो पता चला कि ये लोग सुबह ट्रेन में चढ़ने के लिए देर रात से ही लाइन में लग गए थे.	https://akm-img-a-in.tosshub.com/aajtak/images/story/202410/671e06478c25b-surat-272209829-16x9.jpg	2024-10-27 09:24:47	Aaj Tak
in	https://www.aajtak.in/religion/news/story/diwali-2024-date-31-october-or-1-november-when-diwali-will-be-celebrate-kab-hai-diwali-laxmi-puja-shubh-muhurt-tlifdu-dskc-2072000-2024-10-27	Diwali 2024 Date: 31 अक्टूबर या 1 नवंबर आखिर कब है दिवाली? हो गया सही तारीख का ऐलान - Aaj Tak	Kab Hai Diwali: इस साल दीपावली के दिन-तारीख को लेकर बड़ा कन्फ्यूजन है. कोई 31 अक्टूबर तो 1 नवंबर को दिवाली का पर्व बता रहा है. आइए आपको दीपावली की सही तारीख बताते हैं.	https://akm-img-a-in.tosshub.com/aajtak/images/story/202410/670eb2adefc2b-diwali-2024-152127967-16x9.jpg	2024-10-27 11:57:23	Aaj Tak
in	https://ndtv.in/uttar-pradesh-news/up-byelection-2024-akhilesh-yadav-bjp-yogi-adityanath-uttar-pradesh-bypolls-2024-6882774	अखिलेश यादव की काट में BJP का 'बंटेंगे तो कटेंगे' का नारा क्या बदल देगा चुनावी समीकरण? यहां समझिए - NDTV India	उत्तर प्रदेश के उपचुनाव में इस बार सत्ता पक्ष और विपक्ष ने पूरी ताकत झोंक दी है. बीजेपी और सपा के लिए ये चुनाव सिर्फ चुनाव नहीं बल्कि जनता के सामने एक संदेश देने का माध्यम भी है. कहा जा रहा है इस चुनाव का असर अन्य राज्य के चुनावों पर भी पड़ सकता है.	https://c.ndtvimg.com/2024-10/ch2mkupg_up_625x300_27_October_24.jpg?im=FitAndFill,algorithm=dnn,width=1200,height=738	2024-10-27 01:32:24	NDTV India
in	https://www.amarujala.com/astrology/predictions/saptahik-makar-rashifal-28-october-to-3-november-2024-weekly-capricorn-horoscope-in-hindi-2024-10-27	Capricorn Weekly Horoscope (28 October to 3 November): जानें कैसा रहेगा मकर राशि के लिए यह सप्ताह - अमर उजाला	Saptahik Makar Rashifal:प्रेम संबंध की दृष्टि से यह सप्ताह आपके लिए शुभ रहने वाला है। प्रेम संबंध को विवाह में बदलने के प्रयास सफल	https://staticimg.amarujala.com/assets/images/2024/04/14/weekly-rashifal_c403d14cc52abc7985bba2b6c403de1a.jpeg?w=750&dpr=1.0	2024-10-27 06:40:45	अमर उजाला
in	https://navbharattimes.indiatimes.com/state/bihar/patna/bihar-salary-scam-tejashwi-yadav-handed-legal-notice-to-nitish-kumar-mlc-neeraj-kumar/articleshow/114647537.cms	Bihar Salary Scam: बिहार में सैलरी घोटाला क्या है? तेजस्वी ने नीतीश के MLC को थमाया 12 करोड़ 10 लाख का नोटिस - NBT नवभारत टाइम्स (Navbharat Times)	Bihar Salary Scam: बिहार के पूर्व उपमुख्यमंत्री तेजस्वी यादव ने JDU नेता नीरज कुमार को मानहानि का नोटिस भेजा है। तेजस्वी ने अपने वकील के जरिए नीरज कुमार पर 12 करोड़ 10 लाख रुपए का मानहानि का दावा ठोका है। नीरज कुमार ने तेजस्वी पर वेतन घोटाले का आरोप लगाया था, जिसे तेजस्वी ने झूठा और बेबुनियाद बताया है।	https://static.langimg.com/photo/imgsize-53958,msid-114647593/navbharat-times.jpg	2024-10-27 05:53:45	NBT नवभारत टाइम्स (Navbharat Times)
in	https://www.abplive.com/news/india/prime-minister-modi-warns-against-digital-arrest-scam-says-no-government-agency-demands-money-over-calls-2811790	बच के रहना रे बाबा! 'डिजिटल अरेस्ट' पर PM नरेंद्र मोदी ने भी देश को किया आगाह, बताया - ABP न्यूज़	Prime Minister Modi on Digital Arrest Scam: प्रधानमंत्री मोदी ने नागरिकों से आग्रह किया कि अगर किसी को इस तरह का कॉल आता है तो वे घबराएं नहीं.	https://feeds.abplive.com/onecms/images/uploaded-images/2024/10/27/574f6745ab59e711cfd48a40540819b21730024878144843_original.jpg?impolicy=abp_cdn&imwidth=1200	2024-10-27 10:48:00	ABP न्यूज़
in	https://ndtv.in/india/delhi-son-and-father-beat-up-policeman-bullet-6889108	बाइक में लगा था तेज आवाज वाला साइलेंसर, SHO ने रोका तो बाप-बेटे ने मारा मुक्का - NDTV India	आसिफ और उसके पिता रियाज़ुद्दीन ने एसएचओ को पकड़कर उसके साथ मारपीट शुरू कर दी. इस दौरान आसिफ ने एसएचओ की आंख के पास मुक्का मार दिया. एसएचओ को इलाज के लिए अस्पताल में भर्ती करना पड़ा.	https://c.ndtvimg.com/2024-10/9gj7jo6o_bike_625x300_28_October_24.jpg?im=FitAndFill,algorithm=dnn,width=1200,height=738	2024-10-28 01:50:24	NDTV India
in	https://hindi.news18.com/news/delhi-ncr/free-electricity-bill-scheme-close-aam-aadmi-party-supremo-arvind-kjriwal-claim-bjp-retaliate-8799174.html	'...तो फिर बंद हो जाएगी फ्री बिजली स्‍कीम', अरविंद केजरीवाल के दावे से दिल्‍ली में उबाल, पानी बिल पर बड़ा व... - News18 हिंदी	'...तो फिर बंद हो जाएगी फ्री बिजली स्‍कीम', अरविंद केजरीवाल के दावे से दिल्‍ली में उबाल, पानी बिल पर बड़ा वादा - free electricity bill scheme close aam aadmi party supremo arvind kjriwal claim bjp retaliate	https://images.news18.com/ibnkhabar/uploads/2024/10/arvind-kejriwal-pc1-2024-10-def48ae3ffda7841685fc1d3ad842ae4-16x9.jpg	2024-10-27 17:31:30	News18 हिंदी
in	https://hindi.news18.com/news/maharashtra/mumbai-maharashtra-chunav-eknath-shinde-shiv-sena-fields-mp-milind-deora-against-uddav-thackeray-son-aaditya-on-worli-assembly-seat-8799164.html	महाराष्ट्र चुनाव: उद्धव ठाकरे के बेटे आदित्य के साथ एकनाथ शिंदे ने कर दिया खेल, वर्ली में दिलचस्प हुआ मुकाब... - News18 हिंदी	Maharashtra Election News: एकनाथ शिंदे ने पूर्व मुख्यमंत्री उद्धव ठाकरे के बेटे और वर्ली से शिवसेना (यूबीटी) उम्मीदवार आदित्य ठाकरे के खिलाफ मिलिंद देवड़ा को उम्मीदवार बनाया है. शिंदे के इस ऐलान से वर्ली में मुकाबला काफी रोमांचक हो जाएगा. - maharashtra chunav eknath shinde shiv sena fields mp milind deora against uddav thackeray son aaditya on worli assembly seat	https://images.news18.com/ibnkhabar/uploads/2024/10/Shinde-Uddhav-2024-10-579768003fa722635cc13513cf976862-16x9.jpg	2024-10-27 17:09:54	News18 हिंदी
in	https://hindi.news18.com/news/bihar/patna-bihar-politics-analysis-muslim-voters-mohammad-shahabuddin-hina-shahab-osama-lalu-yadav-rjd-tejashwi-yadav-nitish-kumar-prashant-kishor-8799402.html	बिहार के मुसलमान हॉट केक, नीतीश कुमार ने RJD का समीकरण बिगाड़ा तो PK ने उड़ा दी नींद, अब रिवाइवल प्लान पर ल... - News18 हिंदी	बिहार में राजनीतिक दलों के बीच मुस्लिम जमात को अपने साथ जोड़ने की होड़ लगी हुई है. लालू यादव मुस्लिम-यादव (M-Y) समीकरण बना कर 15 साल तक बिहार की सत्ता पर काबिज रहे. नीतीश ने नरेंद्र मोदी का विरोध कर मुसलमानों को आरजेडी से अलग किया. जन सुराज के प्रशांत किशोर तो मुसलमानों को आबादी के हिसाब से विधानसभा में हिस्सेदारी की बात ही करते हैं. घबराहट में आरजेडी बिछड़े मुस्लिम लीडरान को जोड़ने की योजना पर काम कर रहा है - bihar politics analysis muslim voters mohammad shahabuddin hina shahab osama lalu yadav rjd tejashwi yadav nitish kumar prashant kishor	https://images.news18.com/ibnkhabar/uploads/2024/10/Bihar-Politics-musalman-2024-10-cd7f9e4631eafa8628d76c6106bcc925-16x9.jpg	2024-10-28 01:43:38	News18 हिंदी
in	https://ndtv.in/india/air-quality-in-delhi-in-very-poor-category-due-to-slow-wind-speed-6888022	AQI 376, 366, 362... घुल रहा जहर, घुट रहा दम, सुबह-सुबह दिल्ली की हवा का हाल देखिए - NDTV India	दिल्ली से सटे शहरों ग्रेटर नोएडा, गाजियाबाद और नोएडा में भी एयर क्वालिटी इंडेक्स लगातार खराब होता जा रहा है.	https://c.ndtvimg.com/2024-10/ecsfvkeg_delhi_625x300_28_October_24.jpg?im=FitAndFill,algorithm=dnn,width=1200,height=738	2024-10-27 19:36:32	NDTV India
in	https://hindi.news18.com/news/nation/maharashtra-congress-candidate-list-14-candidates-in-4th-list-for-maharashtra-elections-candidates-change-on-2-seats-8799170.html	Maharashtra Congress Candidate List: कांग्रेस ने जारी की 14 उम्मीदवारों की नई लिस्ट, जानें कौन कहां से, 2 स... - News18 हिंदी	Congress Candidate List: संभाजीनगर पूर्व सीट से कांग्रेस ने अपना उम्मीदवार बदल दिया. पार्टी ने अब लाहूश शेवाले के नाम का ऐलान किया है, जबकि पहले इस सीट से मधुकर देशमुख चुनाव लड़ रहे थे. - maharashtra congress candidate list 14 candidates in 4th list for maharashtra elections candidates change on 2 seats	https://images.news18.com/ibnkhabar/uploads/2024/10/Nana-Patole-2024-10-56b2418b7997de274c7271259eb31fe7-16x9.jpg	2024-10-27 17:21:48	News18 हिंदी
in	https://www.abplive.com/astro/tarot-card-weekly-horoscope-28-oct-to-03-nov-2024-aries-to-pisces-saptahik-rashifal-2811720	Tarot Card Weekly Horoscope: दिवाली का नया सप्ताह कैसा रहेगा, एस्ट्रोलॉजर से जानें टैरो कार्ड वीकली - ABP न्यूज़	Tarot Card Predictions 28 Oct-03 Nov 2024: नया वीक सभी 12 राशियों के लिए कैसे रहेगा. यहां जानें अपने राशि के अनुसार अपना साप्ताहिक टैरो कार्ड राशिफल.	https://feeds.abplive.com/onecms/images/uploaded-images/2024/10/27/6fd385936fad532113b5e4deeac6c7a01730017869457660_original.jpg?impolicy=abp_cdn&imwidth=1200	2024-10-27 09:30:00	ABP न्यूज़
in	https://www.aajtak.in/uttar-pradesh/video/shivpal-yadav-strong-counter-to-yogi-statement-ytvd-2082649-2024-10-27	योगी के 'बंटोगे तो कटोगे' बयान पर शिवपाल का पलटवार, देखें - Aaj Tak	सपा नेता शिवपाल यादव ने मुख्यमंत्री योगी आदित्यनाथ के 'बंटोगे तो कटोगे' बयान पर तीखा पलटवार किया है. उन्होंने कहा कि पीडीए, जो एकीकृत है, ना तो बंटेगा और ना ही कटेगा. शिवपाल यादव के अनुसार, जो भी ऐसी बातें करेगा, वह अंततः खुद ही नुकसान उठाएगा.	https://akm-img-a-in.tosshub.com/aajtak/images/video/202410/shivpalsretorttoyogi-s0-original-sixteen-to-nine.jpg	2024-10-27 15:23:56	Aaj Tak
in	https://www.aajtak.in/defence-news/story/c-295-tactical-military-transport-aircraft-specifications-dskc-2082860-2024-10-28	C-295 एयरक्राफ्ट की जानिए खासियत जिसे स्पेन की कंपनी टाटा के साथ मिलकर इंडिया में बनाने जा रही - Aaj Tak	PM Narendra Modi और स्पेन के प्रधानमंत्री पेड्रो सांचेज गुजरात के वड़ोदरा में टाटा एयरक्राफ्ट कॉम्प्लेक्स का उद्घाटन करने वाले हैं. इस कॉम्प्लेक्स में भारतीय मिलिट्री के लिए C-295 विमान बनेगा. इसमें एयरबस और टाटा एंडवांस सिस्टम्स लिमिटेड की भागीदारी है. आइए जानते हैं इस विमान की ताकत और अन्य क्षमताएं...	https://akm-img-a-in.tosshub.com/aajtak/images/story/202410/671f0ea360ba3-c-295-tactical-military-transport-aircraft-281004775-16x9.jpg	2024-10-28 04:17:03	Aaj Tak
in	https://navbharattimes.indiatimes.com/state/karnataka/bengaluru/woman-killed-husband-to-seize-rs-8-crore-assets-karnataka-police-held-with-two-accomplices/articleshow/114675426.cms	8 करोड़ की लालच में पति को मार डाला, शव जलाने के लिए 840 KM यात्रा, कर्नाटक पुलिस का खुलासा दिल दहला देगा - NBT नवभारत टाइम्स (Navbharat Times)	Woman Kills Husband News: तेलंगाना के एक बिजनेसमैन की हत्या की गुत्थी कर्नाटक पुलिस ने सुलझा ली है। बिजनेसमैन की दूसरी पत्नी निहारिका और दो सहयोगियों को गिरफ्तार किया गया है। निहारिका ने संपत्ति के लिए अपने पति को मार डाला और शव को 840 किलोमीटर दूर कोडागु में जलाया। 	https://static.langimg.com/photo/imgsize-63620,msid-114676740/navbharat-times.jpg	2024-10-28 04:49:45	NBT नवभारत टाइम्स (Navbharat Times)
in	https://www.aajtak.in/trending/story/abhinav-arora-reacts-to-viral-video-of-being-reprimanded-by-swami-rambhadracharya-tstf-dskc-2082831-2024-10-28	रामभद्राचार्य की फटकार पर बोले अभिनव अरोड़ा -'ऐसी छोटी बातों को देश का मुद्दा न बनाएं' - Aaj Tak	कंटेंट क्रिएटर अभिनव अरोड़ा का एक वीडियो इन दिनों चर्चा में है. इस वीडियो में उन्हें मंच पर स्वामी रामभद्राचार्य से डांट पड़ते देखा गया. इस वीडियो में स्वामी जी अभिनव को मंच से उतरने का निर्देश देते हुए कहते हैं-आप पहले नीचे जाओ. अब इस वायरल वीडियो पर अभिनव अरोड़ा का रिएक्शन आया है.	https://akm-img-a-in.tosshub.com/aajtak/images/story/202410/671f0573be95f-abhinav-arora-reacts-to-viral-video-of-being-reprimanded-by-swami-rambhadracharya-283054142-16x9.jpg	2024-10-28 03:34:18	Aaj Tak
in	https://www.bbc.com/hindi/live/czj77x731kgt	कमला हैरिस के प्रचार अभियान का ट्रंप पर निशाना, ट्रंप की रैली में शामिल हुए एलन मस्क - BBC News हिंदी	अमेरिकी राष्ट्रपति चुनावों के प्रचार अभियान में डेमोक्रेटिक पार्टी की उम्मीदवार कमला हैरिस ने फ़िलाडेल्फ़िया में एक रैली को संबोधित किया.	https://ichef.bbci.co.uk/ace/standard/480/cpsprodpb/3710/live/84563230-94ce-11ef-8e6d-e3e64e16c628.jpg	2024-10-28 00:54:37	BBC News हिंदी
in	https://www.aajtak.in/elections/assembly-chunav/story/jharkhand-assembly-election-bjp-leader-sita-soren-breaks-down-over-congress-minister-derogatory-remarks-ntc-dskc-2082767-2024-10-28	'मेरे पति जिंदा नहीं इसलिए...', कांग्रेस नेता के विवादित बयान पर भावुक हुईं सीता सोरेन - Aaj Tak	सीता सोरेन जामताड़ा सीट से चुनाव लड़ रही हैं. उन्होंने नामांकन पत्र दाखिल करने के एक दिन पहले प्रेस को संबोधित किया. इसी सीट पर इरफान अंसारी कांग्रेस से उम्मीदवार हैं. उन्होंने शनिवार को सीता सोरेन के खिलाफ टिप्पणी की थी.	https://akm-img-a-in.tosshub.com/aajtak/images/story/202410/671e963f7bbf3-sita-soren-273625926-16x9.png	2024-10-27 19:36:36	Aaj Tak
in	https://www.bbc.com/hindi/articles/c8ekk9kg7rjo	कनाडा में ख़ालिस्तान आंदोलन: कितना मज़बूत और सियासत पर कितना असर-ग्राउंड रिपोर्ट - BBC News हिंदी	भारत और कनाडा के बीच राजनयिक विवाद के बाद कनाडा में जिस कथित खालिस्तान समर्थक आंदोलन की चर्चा हो रही है, उसके बारे में वहाँ के सिख क्या बता रहे हैं. कनाडा से बीबीसी की ख़ास रिपोर्ट	https://ichef.bbci.co.uk/news/1024/branded_hindi/7b1e/live/86de0840-944f-11ef-9064-97e49a1c8fa3.jpg	2024-10-28 01:52:49	BBC News हिंदी
in	https://hindi.news18.com/news/nation/bandra-terminus-stampede-raises-big-question-of-immigrants-struggle-and-brain-drain-in-country-8798741.html	बांद्रा टर्मिनस हादसा: आखिर देश का हाल ऐसा क्‍यों है कि 'देस' जाने के लिए धक्‍के खाने पड़ते हैं - News18 हिंदी	1990 के दशक में जब उदारीकरण तेज हुआ तब शहरों में बाहर से लोगों का आना भी बढ़ा. इसकी वजह शहर में काम के अवसर बढ़ना था. साथ ही, शहरों में होने वाले विकास कार्यों के चलते भी लोगों की जरूरत बढ़ी और बेहतर जिंदगी की चाह लिए शहर आने वाले लोगों की संख्‍या बढ़ने लगी. लेकिन, इतने सालों बाद भी विकास की धुरी बड़े शहर ही बने हुए हैं. - bandra terminus stampede raises big question of immigrants struggle and brain drain in country	https://images.news18.com/ibnkhabar/uploads/2024/10/Bandra-Stampede-2024-10-7e494228a5f4d126a9eb83ce6e92fcaa-16x9.jpg	2024-10-27 10:13:42	News18 हिंदी
