country_code	url	title	description	image_url	publish_date	source
in	https://www.abplive.com/elections/jharkhand-assembly-elections-2024-hemant-soren-wins-but-bjp-vote-share-will-definitely-haunt-jmm-for-next-5-years-2830316	Jharkhand Assembly Elections: झारखंड में भले ही CM बन जाएं हेमंत सोरेन, लेकिन अगले 5 साल तक डराता रहेगा - ABP न्यूज़	झारखंड चुनाव में इंडिया गठबंधन की जेएमएम का वोट शेयर 23.43 फीसदी रहा, कांग्रेस का 15.57 फीसदी, आरजेडी का 3.44 फीसदी और भाकपा (माले) का 1.89 फीसदी. वहीं अकेले भाजपा का सीट शेयर 33.17 फीसदी रहा.	https://feeds.abplive.com/onecms/images/uploaded-images/2024/11/25/10d6ad599dcfac59e891dd66c22c944617325318212271021_original.jpg?impolicy=abp_cdn&imwidth=1200	2024-11-25 10:59:47	ABP न्यूज़
in	https://hindi.news18.com/news/uttar-pradesh/lucknow-cm-yogi-adityanath-amazing-victory-up-upchunav-bjp-set-target-of-2027-assembly-election-sp-akhilesh-yadav-politics-pdi-formula-8857663.html	CM योगी ने वो कमाल किया जो 31 साल में न हुआ, 2027 का टारगेट भी सेट, BJP ने दर्द देकर अखिलेश यादव की ली चुटक... - News18 हिंदी	CM Yogi adityanath , CM Yogi plan , akhilesh yadav , why akhilesh yadav fail , akhilesh yadav on upchunav results , akhilesh yadav on kundarki seat , up upchunav , up by election 2024 result , up news , सीएम योगी आदित्यनाथ ,  अखिलेश यादव , बीजेपी , समाजवादी पार्टी , कुंदरकी सीट , 31 साल बाद सीएम योगी ने रचा इतिहास	https://images.news18.com/ibnkhabar/uploads/2024/11/CM-YOGI-ADITYANATH-5-2024-11-ddcd8cfd2b804b3ce01ee97bab843627-16x9.jpg	2024-11-25 09:07:23	News18 हिंदी
in	https://www.techlusive.in/hi/photo-gallery/48mp-camera-128gb-ram-512gb-storage-iphone-15-discount-flipkart-black-friday-sale-price-in-india-specs-1533970/	48MP कैमरा, 128GB स्टोरेज और 512GB स्टोरेज वाला iPhone 15 एक बार फिर हुआ सस्ता, Flipkart Black Friday Sale की - Techlusive	48MP camera 128GB RAM 512GB storage iPhone 15 Discount Flipkart Black Friday Sale Price in India specs, iPhone 15 Discount	https://st1.techlusive.in/wp-content/uploads/2024/11/iPhone-15-1.jpg	2024-11-25 12:12:00	Techlusive
in	https://www.aajtak.in/business/utility/story/adani-group-4-companies-stocks-worst-performance-last-one-year-share-52-week-low-tuta-dskc-2106451-2024-11-25	अडानी के इन 4 शेयरों का सबसे बुरा हाल, कोई 50% गिरा... कोई 60% से ज्यादा! - Aaj Tak	Adani Group Stocks Performance: अब अमेरिकी जांच एजेंसी के उठाए सवाल के बाद अडानी ग्रुप (Adani Group) को भारी नुकसान हुआ है. खुद गौतम अडानी (Gautam Adani) की नेटवर्थ काफी घट गई है, फिलहाल उनकी नेटवर्थ घटकर 70 बिलियन डॉलर के करीब पहुंच गई है.	https://akm-img-a-in.tosshub.com/aajtak/images/story/202411/67447dc26e63e-adani-group-stocks-performance-253804948-16x9.jpg	2024-11-25 13:39:32	Aaj Tak
in	https://www.aajtak.in/business/news/story/adani-group-faces-setback-as-totalenergies-pauses-new-investments-amid-corruption-allegations-ntc-rptc-2106268-2024-11-25	अडानी ग्रुप को लगा एक और झटका, फ्रांस की इस दिग्गज कंपनी ने नए इन्वेस्टमेंट पर लगाई रोक - Aaj Tak	अडानी ग्रुप के अधिकारियों पर लगे आरोपों का खुलासा अमेरिकी अधिकारियों द्वारा एक सार्वजनिक अभियोग के माध्यम से किया गया था. हालांकि, ये आरोप अडानी ग्रुप की किसी  कंपनी या उसकी सब्सिडियरी (सहायक कंपनी) के बजाय व्यक्तिगत अधिकारियों पर लगे हैं.	https://akm-img-a-in.tosshub.com/aajtak/images/story/202411/6744571288788-adani-group-chairman-gautam-adani-25530083-16x9.png	2024-11-25 10:57:02	Aaj Tak
in	https://hindi.news18.com/news/career/education-dusu-election-result-2024-delhi-university-students-union-president-vice-president-abvp-vs-nsui-8856295.html	DUSU Election Result 2024 : डूसू चुनाव रिजल्ट में NSUI ने मारी बाजी, रौनक खत्री बने अध्यक्ष - News18 हिंदी	DUSU Election Result 2024 LIVE: दिल्ली यूनिवर्सिटी छात्र संघ चुनाव 2024 की मतगणना पूरी हो गई. इस चुनाव में एनएसयूआई ने परचम लहराया है. एनएसयूआई के रौनक खत्री ने अध्यक्ष और लोकेश ने संयुक्त सचिव पद पर शानदार जीत हासिल की है.  - dusu election result 2024 delhi university students union president vice president abvp vs nsui	https://images.news18.com/ibnkhabar/uploads/2024/11/DUSU-Election-Result-2024-2024-11-f7a68eee98cd34d804e6a264b77896ab-16x9.jpg	2024-11-25 03:09:50	News18 हिंदी
in	https://ndtv.in/india/how-bjp-win-on-maharashtra-muslim-populated-seats-answer-is-here-7102840	मुस्लिम प्रभाव वाली 38 सीटें भी क्यों हारे उद्धव ठाकरे, शरद पवार और कांग्रेस? वजह चौंका देगी - NDTV India	Maharashtra Election Result: महाराष्ट्र में उद्धव ठाकरे ये मानकर चल रहे थे कि उनकी पार्टी सत्ता में आ रहे हैं. कांग्रेस का भी लगभग यही हाल था. हालांकि, महाराष्ट्र मुस्लिम सीटों तक पर इन्हें हार का मुंह देखना पड़ा...	https://c.ndtvimg.com/2024-11/0e843gm_uddhav-sharad-pawar-rahul-gandhi_625x300_25_November_24.jpg?im=FeatureCrop,algorithm=dnn,width=1200,height=738	2024-11-25 12:45:46	NDTV India
in	https://www.aajtak.in/entertainment/bollywood-news/story/sanjay-dutt-joined-hindu-ekta-yatra-with-baba-bageshwar-dhirendra-shastri-tmova-rptc-2106390-2024-11-25	बाबा बागेश्वर से मिलकर बोले संजय दत्त, 'महाराज फिल्मों में आ जायें तो सबका डिब्बा गोल हो जाएगा' - Aaj Tak	संजय दत्त ने आजतक से बातचीत भी की और बताया कि वो हिंदू एकता यात्रा का हिस्सा बनकर कितना गर्व महसूस कर रहे हैं. एक्टर ने कहा कि ये यात्रा बहुत बड़ी जागरुकता लाने वाली है, और महाराज बहुत ही अच्छा काम कर रहे हैं. 	https://akm-img-a-in.tosshub.com/aajtak/images/story/202411/67447260c954a-sanjay-dutt--baba-bageshwar-150646870-16x9.jpg	2024-11-25 13:47:39	Aaj Tak
in	https://www.aajtak.in/lifestyle/news/story/navjot-singh-sidhu-clarified-on-the-claim-that-neem-turmeric-can-cure-cancer-said-whatever-we-did-we-did-on-the-advice-of-the-doctor-tlifp-dskc-2106335-2024-11-25	नीम-हल्दी से कैंसर ठीक होने वाले दावे पर सिद्धू ने दी सफाई... कहा- हमने जो किया वो डॉक्टर की सलाह पर किया - Aaj Tak	कांग्रेस नेता और पूर्व क्रिकेटर नवजोत सिंह सिद्धू ने अपनी पत्नी का नीम और हल्दी से कैंसर ठीक होने वाले दावे पर सफाई पेश की है. सिद्धू ने ट्विटर पर एक वीडियो जारी किया जिसमें उन्होंने अपने बयान का बचाव किया और कहा कि हमने जो कुछ भी किया है वो डॉक्टरों की सलाह से ही किया है.	https://akm-img-a-in.tosshub.com/aajtak/images/story/202411/674468c738bdc-20241125-250833412-16x9.jpg	2024-11-25 12:40:33	Aaj Tak
in	https://hindi.news18.com/news/nation/nana-patole-does-he-a-bjp-man-in-congress-why-this-question-arises-after-maharashtra-assembly-election-result-8857170.html	महाराष्ट्र में BJP के 'आदमी' ने कराई कांग्रेस की दुर्गति, चंद महीनों में राहुल गांधी के घर में बना ली पैठ, ... - News18 हिंदी	Maharashtra Chunav Result Analysis: महाराष्ट्र में कांग्रेस की बुरी हार का क्या कारण है? इसका कोई सीधा जवाब नहीं है. लेकिन, पार्टी के भीतर एक तबका जिस सवाल की ओर इशारा कर रहा है उसे खारिज नहीं किया जा सकता है. - nana patole does he a bjp man in congress why this question arises after maharashtra assembly election result	https://images.news18.com/ibnkhabar/uploads/2024/11/nana-patole-2024-11-ac67baf48c117411a2c5c39c6827af4d-16x9.jpg	2024-11-25 05:09:43	News18 हिंदी
in	https://zeenews.india.com/hindi/sports/cricket/all-10-teams-squad-after-ipl-2025-mega-auction-chennai-super-kings-royal-challengers-begaluru-gt-lsg/2531192	IPL Auction 2025: मुंबई से लेकर गुजरात तक.. मेगा ऑक्शन के बाद ऐसा है सभी 10 टीमों का स्क्वाड, देखें लिस्ट - Zee News Hindi	All Teams Squads IPL Auction 2025: आईपीएल 2025 का मेगा ऑक्शन वीकेंड पर रोमांच का तड़का लगाकर खत्म हो चुका है. आगामी सीजन के लिए सभी टीमों ने अपनी-अपनी कमर कस ली है. अब सबसे पॉवरफुल और सबसे कमजोर टीम के चर्चे भी तेज हो चुके हैं. आईए मेगा ऑक्शन के बाद देखते हैं सभी 10 टीमों के फुल स्क्वाड्स का हाल.  	https://hindi.cdn.zeenews.com/hindi/sites/default/files/2024/11/25/3444876-ipl-2025-auction.png?im=FitAndFill=(600,315)	2024-11-25 17:21:33	Zee News Hindi
in	https://navbharattimes.indiatimes.com/astro/rashifal/bolen-sitare/scorpio-weekly-horoscope-prediction-for-25-november-to-1-december-2024-vrishchik-saptahik-rashifal/articleshow/115648146.cms	वृश्चिक साप्ताहिक राशिफल, 25 नवंबर से 1 दिसंबर 2024 : भौतिक सुख साधनों की प्राप्ति होगी, सेहत का रखें ध्यान - NBT नवभारत टाइम्स (Navbharat Times)	Scorpio horoscope 25 November to 1 December :वृश्चिक राशि के लिए यह सप्ताह बहुत ही महत्वपूर्ण रहने वाला है। इनकी राशि पर इस सप्ताह बृहस्पति, शनि और राहु की पूर्ण दृष्टि रहने से बाहुबल प्रचुर रहेगा। अचल संपत्ति और भौतिक सुख का संयोग प्रबल रहेगा। सहयोगियों से सामंजस्य बना रहेगा और सहयोग पाएंगे। प्रतिष्ठा को पंख लगेंगे। व्यापारी वर्ग को विशेष लाभ प्राप्त होगा। कारोबारी संबंध विकसित होंगे। जानें इस हफ्ते का वृश्चिक राशि का साप्ताहिक राशिफल।	https://static.langimg.com/photo/imgsize-1171555,msid-115648130/navbharat-times.jpg	2024-11-25 06:32:53	NBT नवभारत टाइम्स (Navbharat Times)
in	https://navbharattimes.indiatimes.com/astro/rashifal/bolen-sitare/aaj-ka-rashifal-25-november-2024-horoscope-today-budhaditya-yog-is-beneficial-for-vrishabh-tula-and-meen-rashi/articleshow/115595340.cms	आज का राशिफल, 25 नवंबर 2024 : वृषभ, तुला और मीन राशि वालों को मिल रहा बुधादित्य योग का फायदा, जानें अपना आज का भविष्यफल - NBT नवभारत टाइम्स (Navbharat Times)	Horoscope Today, 25 November : आज का राशिफल 25 नवंबर दिन सोमवार को चंद्रमा कन्या राशि पर संचार करेंगे। साथ ही चंद्रमा इस गोचर के दौरान उत्तराफाल्गुनी नक्षत्र उपरांत हस्त नक्षत्र में संचार करेंगे। ग्रह-नक्षत्र के प्रभाव से आज का दिन वृषभ, तुला, मीन समेत कई राशियों को अत्यंत फलदायी रहने वाला है। वहीं मेष, वृश्चिक, कुंभ समेत कई राशियों को उतार-चढ़ाव का सामना करना पड़ सकता है। जानें ग्रह नक्षत्रों की गणना से अपना आज का राशिफल विस्तार पूर्वक।	https://static.langimg.com/photo/imgsize-653238,msid-115595331/navbharat-times.jpg	2024-11-24 22:58:00	NBT नवभारत टाइम्स (Navbharat Times)
in	https://www.abplive.com/sports/ipl/ipl-2025-mega-auction-shreyas-iyer-likely-new-captain-punjab-kings-rishabh-pant-lucknow-super-giants-2830265	IPL 2025 Mega Auction: पंजाब किंग्स और लखनऊ को मिल गया है नया कप्तान? जानें किसे मिलने वाली है - ABP न्यूज़	IPL 2025 Mega Auction: ऋषभ पंत को लखनऊ सुपर जायंट्स ने खरीदा है. जबकि श्रेयस अय्यर को पंजाब किंग्स ने खरीदा है. ये दोनों ही खिलाड़ी अपनी टीमों के कप्तान बन सकते हैं.	https://feeds.abplive.com/onecms/images/uploaded-images/2024/11/25/061c427dc52a47f46da4fb89d3b8071d1732527336410344_original.jpg?impolicy=abp_cdn&imwidth=1200	2024-11-25 10:02:30	ABP न्यूज़
in	https://hindi.cnbctv18.com/photos/personal-finance/gold-price-today-slipped-from-highest-level-in-3-weeks-see-how-much-price-became-125932.htm	Gold Price Today: तीन हफ्ते के उच्चतम स्तर से फिसला सोना, देखिए कितनी हुई कीमत - CNBCTV18 हिंदी	Gold Price Today: 25 नवंबर को गोल्ड और सिल्वर दोनों सस्ते हो गए हैं. जानिए कि इनकी लेटेस्ट कीमत कहां तक पहुंची.	https://images.cnbctv18.com/hindicnbctv18/2023/10/gold-1-copy.jpg?im=FitAndFill,width=500,height=300	2024-11-25 07:04:41	CNBCTV18 हिंदी
in	https://hindi.news18.com/news/rajasthan/udaipur-huge-controversy-over-vishvaraj-coronation-ceremony-in-vehicles-entered-udaipur-city-palace-police-lathi-charge-arvind-singh-mewar-know-reason-8858482.html	उदयपुर में सिटी पैलेस के बाहर देर रात पथराव, मेवाड़ राजघराने में विवाद, माहौल तनावपूर्ण - News18 हिंदी	Udaipur Royal family Controversy: उदयपुर के सिटी पैलेस के बाहर पथराव हुआ.मेवाड़ राजघराने में संपत्ति को लेकर विवाद गहराता जा रहा है. पुलिस ने सिटी पैलेस मुख्य द्वार पर नोटिस चस्पा कर दिया है.  धूणी दर्शन वाले क्षेत्र को अधिग्रहित करने का नोटिस बताया जा रहा है. प्रशासन अधिग्रहण कर विश्वराज सिंह को धूणी दर्शन करवा सकता है. सिटी पैलेस के बाहर माहौल बेहद तनावपूर्ण है....उदयपुर राजपरिवार में राजतिलक की रस्म पर बवाल, सिटी पैलेस में घुसी गाड़ियां, पुलिस ने संभाला मोर्चा - huge controversy over vishvaraj coronation ceremony in vehicles entered udaipur city palace police lathi charge arvind singh mewar know reason	https://images.news18.com/ibnkhabar/uploads/2024/11/udaipur-news-2024-11-e62503d7a331dbe9f2774c8ec3009374-16x9.jpg	2024-11-25 13:21:14	News18 हिंदी
in	https://www.aajtak.in/india/maharashtra/story/why-eknath-shinde-should-become-the-cm-of-maharashtra-again-shiv-sena-come-with-these-six-reasons-ntc-rptc-2106339-2024-11-25	एकनाथ शिंदे दोबारा क्यों बनने चाहिए महाराष्ट्र के CM, शिवसेना ने गिनाए ये 6 बड़े कारण! - Aaj Tak	एकनाथ शिंदे को फिर से शिवसेना विधायक दल का नेता चुना. शिवसेना विधायकों ने मांग की कि एकनाथ शिंदे को फिर से महाराष्ट्र का मुख्यमंत्री बनाया जाए. उन्हें फिर से मुख्यमंत्री क्यों बनाया जाना चाहिए, इस पर शिवसेना के शीर्ष सूत्रों ने 6 बड़े कारण भी गिनाए.	https://akm-img-a-in.tosshub.com/aajtak/images/story/202411/67446bd7487f7-eknath-shinde-252137791-16x9.png	2024-11-25 12:08:51	Aaj Tak
in	https://www.abplive.com/sports/ipl/ipl-2025-mega-auction-anshul-kamboj-sold-to-chennai-super-kings-uncapped-player-csk-2830409	IPL 2025 Mega Auction: श्रेयस अय्यर को चिढ़ाने वाले खिलाड़ी को CSK ने खरीदा, बेस प्राइस से 11 गुना - ABP न्यूज़	Anshul Kamboj CSK: मुंबई इंडियंस के एक्स प्लेयर को चेन्नई सुपर किंग्स ने खरीद लिया है. अंशुल कंबोज आईपीएल 2025 मेगा ऑक्शन में 3.40 करोड़ रुपए में बिके हैं.	https://feeds.abplive.com/onecms/images/uploaded-images/2024/11/25/541e08905d26130d9ed1a0c90ffe126f1732538017507344_original.jpg?impolicy=abp_cdn&imwidth=1200	2024-11-25 12:45:20	ABP न्यूज़
in	https://zeenews.india.com/hindi/sports/cricket/who-is-vaibhav-suryavanshi-13-year-old-csk-player-who-got-crores-in-ipl-auction-2025-ranji-coach-manish-ojha/2531114	Vaibhav Suryavanshi: 4 साल की उम्र में क्रिकेट का बुखार.. पिता ने घर के पीछे बना दिया ग्राउंड, फिल्मी है वै... - Zee News Hindi	Vaibhav Suryavanshi Career Story: वैभव सूर्यवंशी, एक ऐसा नाम जिसने आईपीएल 2025 के मेगा ऑक्शन में खलबली मचा डाली है. महज 13 साल की उम्र में सूर्यवंशी करोड़पति बन गए और उनके बारे में जानने के लिए फैंस बेताब नजर आए. युवाओं की लीग आईपीएल में सूर्यवंशी, धोनी की टीम की तरफ से चमकने को तैयार हैं.   	https://hindi.cdn.zeenews.com/hindi/sites/default/files/2024/11/25/3444713-priyansh-arya.png?im=FitAndFill=(600,315)	2024-11-25 16:09:40	Zee News Hindi
in	https://www.indiatv.in/sports/cricket/mumbai-indians-by-deepak-chahar-csk-player-for-more-than-9-crore-ipl-2025-mega-auction-2024-11-25-1093333	मुंबई इंडियंस ने बेहद सस्ते भाव में खरीदा CSK का प्लेयर, जसप्रीत बुमराह को मिला नया बॉलिंग पार्टनर - India TV Hindi	मुंबई इंडियंस की टीम ने आईपीएल 2025 मेगा ऑक्शन में चेन्नई सुपर किंग्स के एक घातक गेंदबाज को 9.75 करोड़ रुपए में खरीद लिया है। ये खिलाड़ी 50 से ज्यादा IPL विकेट ले चुका है। 	https://resize.indiatv.in/resize/newbucket/1200_-/2024/11/indian-team-2-1732536021.jpg	2024-11-25 12:00:56	India TV Hindi
in	https://www.aajtak.in/opinion-analysis-/story/maharashtra-election-result-2024-what-risks-bjp-making-devendra-fadnavis-cm-opns2-dskc-2106364-2024-11-25	देवेंद्र फडणवीस को महाराष्ट्र सीएम बनाकर बीजेपी किन खतरों से खेलने जा रही है? । Opinion - Aaj Tak	महाराष्ट्र में अजित पवार का देवेंद्र फडणवीस को मुख्यमंत्री पद के लिए समर्थन देने के बाद समझा जा रहा है कि भारतीय जनता पार्टी कभी भी देवेंद्र फडणवीस के नाम का ऐलान कर सकती है. पर बीजेपी के लिए यह फैसला कई मुश्किलें लेकर आने वाला है.	https://akm-img-a-in.tosshub.com/aajtak/images/story/202411/67446dd24fd48-devendra-fadnavis--eknath-shinde-and-ajit-pawar-252959967-16x9.jpg	2024-11-25 12:48:28	Aaj Tak
in	https://www.abplive.com/states/up-uk/sambhal-violence-update-up-police-arrest-shahi-jama-masjid-president-zafar-ali-ann-2830310	संभल हिंसा के मामले शाही जामा मस्जिद के सदर गिरफ्तार, पुलिस बोली- 'इनका रोल है गड़बड़' - ABP न्यूज़	Sambhal Violence News: संभल में कल हुई हिंसा के बाद आज स्थितिय नियंत्रण में है. यहां पर इंटरनेट बंद कर दिया गया और स्कूलों में भी छुट्टी घोषित की गई है. पुलिस ने अब तक 2750 लोगों पर FIR दर्ज किया है.	https://feeds.abplive.com/onecms/images/uploaded-images/2024/11/25/db51dee8839d0262ecec2f6708ce6cb01732531466695651_original.jpg?impolicy=abp_cdn&imwidth=1200	2024-11-25 12:08:10	ABP न्यूज़
