country_code	url	title	description	image_url	publish_date	source
in	https://www.abplive.com/elections/jharkhand-assembly-election-2024-congress-released-first-list-of-21-candidates-dr-ajay-rai-one-muslim-dr-irfan-ansari-given-ticket-2808214	Jharkhand Election 2024: कांग्रेस की 21 उम्मीदवारों वाली लिस्ट में कितने मुसलमान? किन नामों ने - ABP न्यूज़	Congress List: कांग्रेस ने अपनी पहली लिस्ट में अधिकतर मौजूदा विधायकों को फिर से मौका दिया है. हालांकि पार्टी अभी धनबाद, बोकारो और पाकुड़ विधानसभा सीट पर नाम तय नहीं कर पाई है. इन पर पेच फंसा हुआहै.	https://feeds.abplive.com/onecms/images/uploaded-images/2024/10/22/c96cb71eca9bc15120f6862df5a2cae11729560640812858_original.jpg?impolicy=abp_cdn&imwidth=1200	2024-10-22 01:31:58	ABP न्यूज़
in	https://navbharattimes.indiatimes.com/state/punjab-and-haryana/chandigarh/haryana-stubble-burning-nayab-saini-government-suspended-24-officers-at-once-know-the-reason/articleshow/114456465.cms	हरियाणा की नायब सैनी सरकार का बड़ा ऐक्शन, एक साथ 24 अफसरों को किया सस्पेंड, जानें वजह - NBT नवभारत टाइम्स (Navbharat Times)	हरियाणा में नायब सैनी सरकार ने बड़ी कार्रवाई की है। सरकार ने कृषि विभाग के 24 अफसरों को एक साथ सस्पेंड कर दिया है। पराली जलाने के मामलों में यह कार्रवाई की गई है।	https://static.langimg.com/photo/imgsize-56946,msid-114456608/navbharat-times.jpg	2024-10-22 08:37:56	NBT नवभारत टाइम्स (Navbharat Times)
in	https://www.aajtak.in/india/news/story/indigo-blast-threat-in-10-planes-of-indigo-airlines-passengers-had-to-be-dropped-at-some-places-and-flights-were-diverted-at-some-places-ntc-rpti-2077558-2024-10-22	अब 30 विमानों को उड़ाने की धमकी... सिक्योरिटी चेक के लिए उतारे गए पैसेंजर, फ्लाइट भी हुईं डायवर्ट - Aaj Tak	एयरलाइन ने सुरक्षा प्रक्रियाओं का पालन करते हुए संबंधित अधिकारियों के साथ समन्वय किया और यात्रियों को हुई असुविधा के लिए खेद व्यक्त किया है. बता दें कि, मंगलुरु से मुंबई जा रही उड़ान 6E 164 को सिक्योरिटी अलर्ट मिला था, जिसके बाद सभी यात्रियों को सुरक्षित उतार लिया गया.	https://akm-img-a-in.tosshub.com/aajtak/images/story/202410/671750b658df7-indigo-issues-press-statement-after-delhi-bound-flight-receives-security-related-alert-20281182-16x9.jpg	2024-10-22 07:15:06	Aaj Tak
in	https://www.tv9hindi.com/india/supreme-court-reserved-the-decision-on-up-madarsa-act-pleas-against-allahabad-hc-judgement-yogi-government-2902731.html	मदरसा एक्ट मामले में सुप्रीम कोर्ट में फैसला सुरक्षित, CJI बोले- 700 साल के इतिहास को बर्बाद नहीं कर... - TV9 Bharatvarsh	सुप्रीम कोर्ट में उत्तर प्रदेश मदरसा एक्ट मामलेको लेकर सुनवाई हुई . इस दौरान सभी पक्षों की दलीलें सुनने के बाद कोर्ट ने अपना फैसला सुरक्षित रख लिया है. यूपी सरकार ने अपना पक्ष रखते हुए कहा कि मदरसा एक्ट के केवल उन प्रावधानों की समीक्षा होनी चाहिए जो मौलिक अधिकारों के खिलाफ हैं, एक्ट को पूरी तरह खारिज करना सही नहीं है.	https://images.tv9hindi.com/wp-content/uploads/2024/09/madarsa-1.jpg	2024-10-22 11:37:43	TV9 Bharatvarsh
in	https://www.abplive.com/states/punjab/gurmeet-ram-rahim-singh-sacrilege-cases-punjab-cm-bhagwant-mann-approved-the-prosecution-of-dera-sacha-sauda-head-2808350	गुरमीत राम रहीम की बढ़ी मुश्किलें, पंजाब के सीएम भगवंत मान ने केस को लेकर लिया - ABP न्यूज़	Gurmeet Ram Rahim Singh: डेरा सच्चा सौदा प्रमुख गुरमीत राम रहीम इस समय जेल से बाहर है. 2 अक्टूबर को उसे बीस दिनों की पैरोल दी गई थी. जेल से रिहा होने के बाद राम रहीम यूपी के बरनावा आश्रम में है.	https://feeds.abplive.com/onecms/images/uploaded-images/2024/10/22/1bcea5a3e293b51a0d09fe9b1b9485e91729574915498124_original.jpg?impolicy=abp_cdn&imwidth=1200	2024-10-22 05:36:53	ABP न्यूज़
in	https://www.bhaskar.com/db-original/news/kolkata-rape-murder-case-mamata-banerjee-vs-doctor-strike-rg-kar-hospital-133844040.html	कोलकाता रेप-मर्डर, डॉक्टर बोले- CBI-कोर्ट केस को खींच रहे: बस तारीखें मिल रहीं; हम क्यों प्रोटेस्ट कर रहे, ... - Dainik Bhaskar	None	None	2024-10-21 23:34:58	Dainik Bhaskar
in	https://hindi.news18.com/news/bihar/gaya-belaganj-upchunav-2024-people-marriages-are-breaking-no-road-has-come-to-this-village-since-independence-local18-8786770.html	Belaganj Upchunav 2024: 'लोगों की टूट रही शादियां', आजादी से अब तक इस गांव में नहीं आई सड़क, जनता में आक्रो... - News18 हिंदी	Bihar Upchunav: जनता की समस्या जानने लोकल 18 की टीम बेल्हाड़ी पंचायत के डढ़मा गांव पहुंची. यहां के लोगों का मुख्य मुद्दा विकास है. आजादी से लेकर अब तक यहां सड़क नहीं बनी है. 	https://images.news18.com/ibnkhabar/uploads/2024/10/HYP_4749614_cropped_21102024_210907_img_20241020_150442_waterm_2-16x9.jpg	2024-10-22 01:03:30	News18 हिंदी
in	https://www.indiatv.in/maharashtra/shalimar-express-derailed-in-nagpur-many-coaches-affected-rescue-operation-continues-2024-10-22-1085137	नागपुर में शालीमार एक्सप्रेस हुई डिरेल, कई डिब्बे पटरी से उतरे; बचाव कार्य जारी - India TV Hindi	नागपुर में शालीमार एक्सप्रेस ट्रेन पटरी से अचानक उतर गई। ये हादसा इतवारी रेलवे स्टेशन के पास हुआ। 	https://resize.indiatv.in/resize/newbucket/1200_-/2024/10/untitled-45-1729594816.jpg	2024-10-22 10:36:56	India TV Hindi
in	https://www.jansatta.com/religion/dhanteras-2024-mangal-and-moon-will-make-mahalaxmi-rajyog-positive-impact-these-zodiac-sign/3643160/	2 दिन बाद चंद्रमा और मंगल की युति से बनेगा महालक्ष्मी राजयोग, इन राशियों का शुरू होगा गोल्डन टाइम, हर क्षेत्र में सफलता के योग - Jansatta	None	https://www.jansatta.com/wp-content/uploads/2024/10/mahalaxmi-rajyog-in-kundli-2024.jpg	2024-10-22 06:33:06	Jansatta
in	https://www.aajtak.in/short-videos/video/india-vs-new-zealand-test-series-second-match-in-pune-all-eyes-on-virat-kohli-2077475-2024-10-22	Ind vs Nz: पुणे में फिर दहाड़ेंगे विराट कोहली, गजब के हैं आंकड़े - Aaj Tak	भारत और न्यूजीलैंड के बीच तीन मैचों की टेस्ट सीरीज का दूसरा मुकाबला 24 अक्टूबर से पुणे में खेला जाएगा. भारत को बेंगलुरु टेस्ट में 8 विकेट से हार झेलनी पड़ी थी. अब उसकी कोशिश धांसू कमबैक करने पर होगी. पुणे टेस्ट में टीम इंडिया के स्टार बल्लेबाज विराट कोहली पर फैन्स की निगाहें होंगी, जो बड़ी पारी खेलना चाहेंगे.	https://akm-img-a-in.tosshub.com/aajtak/images/video/202410/6717442384cb7-virat-pune-222013818-16x9.jpg	2024-10-22 06:20:29	Aaj Tak
in	https://www.amarujala.com/photo-gallery/astrology/predictions/aaj-ka-rashifal-23-october-know-today-horoscope-predictions-for-aries-taurus-virgo-leo-in-hindi-2024-10-22	23 October Ka Rashifal: वृषभ, सिंह और धनु राशि वालों को कार्यों में मिलेगी सफलता, पढ़ें दैनिक राशिफल - अमर उजाला	जानें सभी राशियों का आज का दैनिक राशिफल? आज के राशिफल में आपके लिए नौकरी, व्यापार, लेन-देन, परिवार और मित्रों के साथ संबंध,सेहत	https://staticimg.amarujala.com/assets/images/2024/10/22/daily-rashifal_384796bc7fe163a1113f217d0a6894ff.jpeg?w=750&dpr=1.0	2024-10-22 11:12:02	अमर उजाला
in	https://www.abplive.com/states/maharashtra/eknath-shinde-seat-kopri-pachpakhadi-shiv-sena-candidate-list-maharashtra-assembly-election-2024-2808880	महाराष्ट्र चुनाव: शिवसेना ने 45 सीटों पर जारी की लिस्ट, कोपरी पाचपाखाडी से लड़ेंगे - ABP न्यूज़	Shiv Sena Candidate List in Maharashtra: महाराष्ट्र में विधानसभा चुनाव के मद्देनजर मुख्यमंत्री एकनाथ शिंदे की पार्टी शिवसेना ने मंगलवार (22 अक्टूबर) को 45 प्रत्याशियों की लिस्ट जारी की है.	https://feeds.abplive.com/onecms/images/uploaded-images/2024/10/22/f6dbc87721c5e33e159695e1d2e2fa821729621265236957_original.jpg?impolicy=abp_cdn&imwidth=1200	2024-10-22 19:01:31	ABP न्यूज़
in	https://hindi.news18.com/news/bihar/vaishali-ganderbal-terror-attack-bihar-labour-fahim-died-in-terror-attack-ground-report-local18-8789065.html	Ganderbal Terror Attack: 5 नवंबर को घर में बजने वाली थी शहनाई, फहीम की मौत के बाद परिवार में मचा कोहराम, बे... - News18 हिंदी	Ganderbal Terror Attack: जम्मू-कश्मीर के गांदरबल में आंतकी हमले में मारे गए  बिहार के तीन लोगों में से एक  वैशाली जिले के रहने वाले फहीम नसीर भी शामिल थे. ये कश्मीर में मजदूरी कर परिवार का भरण-पोषण करते थे. फहीम बेटी को आईएएस बनाना चाहते थे, लेकिन उनका यह सपना अधूरा रह गया. बेटी ने पढ़ाई के लिए सरकार से मदद मांगी है.	https://images.news18.com/ibnkhabar/uploads/2024/10/HYP_4751315_cropped_22102024_172555_screenshot_2024_1022_17191_1-16x9.jpg	2024-10-22 15:51:36	News18 हिंदी
in	https://hindi.news18.com/news/dharm/diwali-2024-upay-cowrie-trick-money-will-rain-whole-year-know-from-deoghar-acharya-local18-8789005.html	Diwali Upay: कमाई के बावजूद नहीं टिक रहा धन? दिवाली पर करें कौड़ी वाला टोटका, साल भर बरसेगा पैसा! - News18 हिंदी	Diwali 2024 Remedy: दिवाली पर लक्ष्मी-गणेश पूजन के अलावा तंत्र पूजा भी होती है. साथ ही कई लोग इस दिन टोटके भी करते हैं. ऐसा ही एक टोटका देवघर के ज्योतिषाचार्य ने भी बताया है, जो धन की प्राप्ति कराने में कारगर माना जाता है. जानिए..	https://images.news18.com/ibnkhabar/uploads/2024/10/HYP_4751609_cropped_22102024_192834_20241022_192557_watermark__1-16x9.jpg	2024-10-22 16:01:27	News18 हिंदी
in	https://hindi.news18.com/news/career/education-diwali-2024-holidays-in-school-and-office-sarkari-chutti-october-2024-festivals-list-8788078.html	Diwali 2024 Holidays: इस दिन मनाई जाएगी दिवाली, कंफर्म हो गई डेट, अब जानिए कब मिलेगी सरकारी छुट्टी - News18 हिंदी	Diwali 2024 Holidays: इस साल दिवाली की डेट को लेकर गजब कंफ्यूजन है. जहां पहले सब 1 नवंबर को दिवाली मनाने का प्लान बना रहे थे, वहीं अब इसकी डेट 31 अक्टूबर हो गई है. दिवाली के अवसर पर स्कूल और बैंक से लेकर कई ऑफिस भी बंद रहते हैं. जानिए दिवाली 2024 पर सरकारी छुट्टी कब मिलेगी. - diwali 2024 holidays in school and office sarkari chutti october 2024 festivals list	https://images.news18.com/ibnkhabar/uploads/2024/10/Diwali-2024-Holidays-2024-10-684a307e1b0c3dfe4a595aa3ee6f7434-16x9.jpg	2024-10-22 09:10:38	News18 हिंदी
in	https://www.amarujala.com/photo-gallery/astrology/numerology/numerology-prediction-23-october-2024-ank-jyotish-in-hindi-2024-10-22	23 October Ka Ank Jyotish: जानें बुधवार का आपका लकी नंबर और शुभ रंग कौन सा होगा - अमर उजाला	अंक ज्योतिष में अंकों के माध्यम द्वारा गणित के नियमों का व्यवहारिक उपयोग करके मनुष्य के विभिन्न पक्षों, उसकी विचारधारा,	https://staticimg.amarujala.com/assets/images/2024/10/22/23-akatabra-ka-aka-jayatashha_f32fc1da621ecc0472c70d3b3f17d2d3.jpeg?w=750&dpr=1.0	2024-10-22 11:26:10	अमर उजाला
in	https://www.abplive.com/states/up-uk/up-cm-yogi-adityanath-issued-new-guidelines-of-encounter-and-videography-of-shootout-site-2808323	यूपी में एनकाउंटर की नई पॉलिसी, अब पुलिस को करना होगा ये काम, योगी सरकार का सख्त - ABP न्यूज़	UP Encounter Guidelines: यूपी में एनकाउंटर को लेकर जारी नई गाइडलाइंस के तहत अगर पुलिस एनकाउंटर में कोई अपराधी घायल होता है या किसी की मौत हो जाती है तो शूटआउट साइट की वीडियोग्राफी करानी होगी. 	https://feeds.abplive.com/onecms/images/uploaded-images/2024/10/06/f0f720868be9b8e25783ecab7e6b69ce1728223394806487_original.jpg?impolicy=abp_cdn&imwidth=1200	2024-10-22 05:19:45	ABP न्यूज़
in	https://www.aajtak.in/elections/assembly-chunav/story/maharashtra-assembly-election-seat-sharing-finalize-in-mva-congress-ncpsp-and-shiv-sena-ubt-seat-rpti-2078013-2024-10-22	महाराष्ट्र में 'बड़ा भाई' बनेगी कांग्रेस, शरद गुट को उद्धव से भी कम सीटें... MVA में सीट शेयरिंग पर बनी बात! - Aaj Tak	महाराष्ट्र विधानसभा चुनाव के लिए महायुति (बीजेपी, शिवसेना, एनसीपी का गठबंधन) के बाद अब महा विकास अघाड़ी में शामिल दलों के बीच भी सीट बंटवारे पर आम सहमति बन गई है. 	https://akm-img-a-in.tosshub.com/aajtak/images/story/202410/6717ab8aa0e88-seat-sharing-finalize-in-maha-vikas-aghadi-for-maharashtra-polls-224125324-16x9.png	2024-10-22 13:43:41	Aaj Tak
in	https://navbharattimes.indiatimes.com/state/uttar-pradesh/bahraich/supreme-court-on-bahraich-violence-if-they-want-to-take-risk-of-flouting-our-order-its-their-choice/articleshow/114485600.cms	'अगर वे रिस्क लेना चाहते हैं तो उनकी मर्जी...', जब बहराइच केस पर सुप्रीम कोर्ट ने यूपी सरकार पर की टिप्पणी - NBT नवभारत टाइम्स (Navbharat Times)	Supreme Court on Bahraich Violence: सुप्रीम कोर्ट ने बहराइच हिंसा पर बड़ी टिप्पणी की है। बहराइच में बुलडोजर एक्शन पर रोक लगाई गई है। सुप्रीम कोर्ट ने मंगलवार को यूपी सरकार को बहराइच हिंसा के आरोपी और कुछ अन्य लोगों के घरों पर बुधवार को होने वाली सुनवाई तक तोड़फोड़ की कार्रवाई नहीं करने को कहा है।	https://static.langimg.com/photo/imgsize-53736,msid-114485600/navbharat-times.jpg	2024-10-23 02:36:28	NBT नवभारत टाइम्स (Navbharat Times)
in	https://www.aajtak.in/india/delhi/story/uproar-during-diwali-program-in-jamia-university-know-details-ntc-rpti-2078203-2024-10-22	जामिया यूनिवर्सिटी में दिवाली कार्यक्रम के दौरान हंगामा, माहौल बिगाड़ने की कोशिश - Aaj Tak	दिल्ली स्थित जामिया यूनिवर्सिटी में मंगलवार को दिवाली प्रोग्राम के दौरान जमकर हंगामा हुआ. आरोप है कि प्रोग्राम के दौरान कुछ लोगों ने रंगोली और दीयों के साथ छेड़छाड़ की जिसके बाद बवाल शुरू हो गया.	https://akm-img-a-in.tosshub.com/aajtak/images/story/202410/6717e0eced26d-jamia-222910284-16x9.jpg	2024-10-22 17:29:41	Aaj Tak
in	https://www.bhaskar.com/db-original/news/lawrence-bishnoi-gang-funding-source-thailand-canada-133849740.html	ड्रग्स, हथियार, फिरौती की कमाई से चल रहा लॉरेंस गैंग: थाईलैंड में कंट्रोल रूम, दिल्ली पुलिस के सामने लॉरेंस... - Dainik Bhaskar	‘गैंग का खर्च चलाने के लिए मुझे पैसों की जरूरत थी। मैंने जेल से ही रंगदारी मांगनी शुरू की। जो पैसे नहीं देता, उस पर गोलियां चलवा देता था। मैं चाहता था कि चंडीगढ़, पंजाब, राजस्थान, हरियाणा में मेरी गैंग की दहशत हो।’ | Lawrence Bishnoi Gang Operations And Funding Details Explained (Delhi Police Special Cell Report) क्यों जोधपुर कोर्ट में लॉरेंस बिश्नोई ने सलमान खान को धमकाया। लॉरेंस जेल में बंद है लेकिन उसकी गैंग का क्राइम कंट्रोल रूम थाइलैंड और कनाडा से कैसे चल रहा है।	https://images.bhaskarassets.com/thumb/730x0/web2images/521/2024/10/22/gr-cover-22-oct-1_1729613525.gif	2024-10-22 23:40:11	Dainik Bhaskar
in	https://www.aajtak.in/uttar-pradesh/story/rss-chief-mohan-bhagwat-and-cm-yogi-meeting-in-mathura-dattatreya-hosabale-lclr-dskc-2078299-2024-10-23	मथुरा में मोहन भागवत और सीएम योगी के बीच अहम मुलाकात, ढाई घंटे तक संघ नेताओं से हुई बातचीत - Aaj Tak	सीएम योगी ने मथुरा में आरएसएस चीफ मोहन भागवत से अहम मुलाकात की. इस दौरान कई राष्ट्रीय मुद्दों पर भी चर्चाएं हुईं. सीएम आरएसएस के  महासचिव दत्तात्रेय होसबोले से भी करीब ढाई घंटे तक मुलाकात की. 	https://akm-img-a-in.tosshub.com/aajtak/images/story/202410/67185a2f8d976-cm-yogi--mohan-bhagwat-230633871-16x9.png	2024-10-23 02:09:02	Aaj Tak
in	https://www.amarujala.com/photo-gallery/astrology/predictions/dhanteras-2024-shubh-yog-on-dhanteras-these-zodiac-signs-will-be-lucky-2024-10-22	Dhanteras 2024: धनतेरस पर बनेगा दुर्लभ योग, इन राशि वालों की चमक सकती है किस्मत - अमर उजाला	इस साल 29 अक्तूबर को धनतेरस है और इस दिन त्रिग्रही योग, त्रिपुष्कर योग, इंद्र योग, वैधृति योग और उत्तरा फाल्गुनी नक्षत्र	https://staticimg.amarujala.com/assets/images/2024/10/01/dhanteras-2024_8d07a2c81e91f49bccde5de2871c1352.jpeg?w=750&dpr=1.0	2024-10-22 08:57:52	अमर उजाला
