country_code	url	title	description	image_url	publish_date	source
in	https://www.abplive.com/news/world/justin-trudeau-new-announcement-big-shock-for-india-know-everything-2809654	जस्टिन ट्रूडो ने ले लिया बड़ा फैसला, कनाडा PM की घोषणा से भारतीयों के लिए बड़ा संकट, - ABP न्यूज़	India-Canada Relations: कनाडा के प्रधानमंत्री जस्टिन ट्रूडो के इस फैसले से अप्रवासी भारतीय कामगारों पर काम करने को लेकर बड़ा संकट आने वाले हैं.	https://feeds.abplive.com/onecms/images/uploaded-images/2024/10/18/7b308b8ccd572fdb78f2a31d9835ce121729224219643708_original.jpg?impolicy=abp_cdn&imwidth=1200	2024-10-24 04:18:37	ABP न्यूज़
in	https://www.aajtak.in/india/news/story/bengaluru-flyover-jam-commuters-abandon-vehicles-walk-home-video-ntc-rpti-2079667-2024-10-24	फ्लाइओवर पर इतना जाम... कारें सड़क पर छोड़कर पैदल भागे लोग, देखें VIDEO - Aaj Tak	बेंगलुरु में बारिश की वजह से भयावह ट्रैफिक जाम का वीडियो सोशल मीडिया पर वायरल हो रहा है, जिसमें लोगों को अपने वाहन सड़क पर छोड़कर पैदल घर जाते देखा जा सकता है. बेंगलुरु को तमिलनाडु से जोड़ने वाले रास्ते पर भयंकर जाम लगा.	https://akm-img-a-in.tosshub.com/aajtak/images/story/202410/6719edbbbbc66-20241024-244822151-16x9.jpg	2024-10-24 06:51:10	Aaj Tak
in	https://www.amarujala.com/photo-gallery/delhi-ncr/noida/ghaziabad-property-dealer-murder-dead-body-placed-inside-car-and-set-on-fire-in-dadri-greater-noida-see-photos-2024-10-24	प्रॉपर्टी डीलर का कत्ल: कुत्ते के पट्टे से गला दबाया... फिर लाश लेकर चार घंटे तक घूमे; इसलिए दोस्त बने दुश्मन - अमर उजाला	ग्रेटर नोएडा के दादरी में दोस्तों ने ही गाजियाबाद के प्रॉपर्टी डीलर संजय यादव की हत्या की साजिश रची।	https://staticimg.amarujala.com/assets/images/2024/10/24/ghaziabad-property-dealer-murder_2e2a7c3f8904002b463c84fd7b068e53.jpeg?w=750&dpr=1.0	2024-10-24 06:28:00	अमर उजाला
in	https://www.indiatv.in/jharkhand/jharkhand-assembly-election-big-loss-for-jmm-congress-rjd-india-alliance-left-announced-to-fight-alone-2024-10-24-1085678	झारखंड चुनाव: INDI अलायंस को लगा बड़ा झटका, इस पार्टी ने किया अकेले चुनाव लड़ने का ऐलान - India TV Hindi	झारखंड चुनाव: INDI अलायंस को लगा बड़ा झटका, इस पार्टी ने किया अकेले चुनाव लड़ने का ऐलान	https://resize.indiatv.in/resize/newbucket/1200_-/2024/10/jharkhand-assembly-election-1729765266.jpg	2024-10-24 10:22:04	India TV Hindi
in	https://www.aajtak.in/uttar-pradesh/story/up-bypolls-prayagraj-phulpur-seat-become-matter-of-prestige-all-parties-claim-edge-lclr-strc-2079856-2024-10-24	उपचुनाव में नाक का सवाल बनी फूलपुर सीट, सभी पार्टियां कर रहीं जीत का दावा - Aaj Tak	प्रयागराज की फूलपुर सीट पर सपा-बसपा के बाद अब बीजेपी ने भी अपना प्रत्याशी उतार दिया है. सपा प्रत्याशी मुज्जतबा सिद्दीकी ने ने अपना नामांकन बुधवार को कर दिया था, बीएसपी कैंडिडेट ने गुरुवार को कर दिया, जबकि बीजेपी कैंडिडेट कल यानी शुक्रवार को पर्चा भरेंगे.	https://akm-img-a-in.tosshub.com/aajtak/images/story/202410/671a1367e7a0f-akhilesh-yadav-yogi-adityanath-242906190-16x9.jpg	2024-10-24 09:30:10	Aaj Tak
in	https://www.aajtak.in/crime/big-crime/story/notorious-gangster-lawrence-bishnoi-gujarat-sabarmati-jail-high-security-mobile-phone-video-call-crpc-268-police-crime-pvzs-dskc-2079824-2024-10-24	10 में से 9 कमरे खाली, न कोई मिलने आया, न वो बाहर गया... साबरमती जेल का वो हिस्सा जहां बंद है लॉरेंस बिश्नोई - Aaj Tak	पूरे देश में मौजूद कुल 1319 जेलों में से अगर किसी एक जेल पर सबकी निगाहें हैं, तो वो यही जेल है. कहने को गुजरात की कुल 16 जेलों में से ये एक सेंट्रल जेल है. लेकिन अहमदाबाद में मौजूद यही वो साबरमती सेंट्रल जेल है, जो इस वक़्त हाल के वक़्त में पुलिस और मीडिया के बनाए सबसे गैंगस्टर लॉरेंस बिश्नोई का पता है.	https://akm-img-a-in.tosshub.com/aajtak/images/story/202410/671a0db76b8c5-lawrence-bishnoi-240449729-16x9.jpg	2024-10-24 09:12:15	Aaj Tak
in	https://hindi.news18.com/news/astro/astro-tips-diwali-2024-gift-ideas-as-per-astrology-do-not-gift-these-items-to-anyone-on-deepawali-8791048.html	Diwali Gifts 2024: दिवाली पर भूलकर भी न दें ये 5 गिफ्ट, आप भी हो जाएंगे कंगाल, पड़ेगा बुरा प्रभाव! - News18 हिंदी	Diwali Gifts 2024: दिवाली पर अपने दोस्‍तों और परिजनों को गिफ्ट देने की परंपरा काफी समय से चली आ रही है. मगर कई बार हमें पता नहीं होता कि उपहार में क्‍या देना चाहिए और क्‍या नहीं. कुछ ऐसी चीजें भी होती हैं, जिनको देने से आपके धन में वृद्धि की जगह आर्थिक तंगी पांव पसार लेती है. आइए जानते हैं क्‍या हैं ये चीजें. - diwali 2024 gift ideas as per astrology do not gift these items to anyone on deepawali	https://images.news18.com/ibnkhabar/uploads/2024/10/diwali-gift-2024-10-02f7fd16f02d064a1a500bbfd1b72a27-16x9.jpg	2024-10-24 08:43:02	News18 हिंदी
in	https://www.bhaskar.com/entertainment/bollywood/news/salman-khan-lawrence-bishnoi-threat-case-jamshedpur-sabjiwala-133855577.html	सलमान खान को धमकी देने वाला गिरफ्तार: 5 करोड़ की फिरौती मांगने के बाद माफी मांगी थी; झारखंड के जमशेदपुर में ... - Dainik Bhaskar	सलमान खान को धमकाते हुए 5 करोड़ रुपए की डिमांड करने वाले शेख हुसैन शेख मौसिन (24) को गिरफ्तार कर लिया गया है। | Salman Khan Lawrence Bishnoi Death Threat Case Update; Jamshedpur Vegetable Seller Hussain Shaikh Arrested. सलमान खान को धमकाते हुए 5 करोड़ रुपए की डिमांड करने वाले शेख हुसैन शेख मौसिन (24) को गिरफ्तार कर लिया गया है	https://images.bhaskarassets.com/thumb/730x0/web2images/521/2024/10/24/gifs22_1729745740.gif	2024-10-24 04:55:51	Dainik Bhaskar
in	https://zeenews.india.com/hindi/india/up-uttarakhand/lucknow/up-weather-update-24-oct-2024-light-rain-expected-western-up-cyclone-dana-effects-in-state-mausam-will-change/2485692	यूपी में चक्रवाती तूफान ‘दाना’ का खतरा, सोनभद्र-वाराणसी समेत इन जिलों में गरज-चमक के साथ होगी बारिश - Zee News Hindi	Cyclone dana effect in UP: उत्तर प्रदेश में चक्रवाती तूफान ‘दाना’ का असर दिखाई देगा.इस दौरान धूल भरी आंधी भी चल सकती है. इस तूफान का असर यूपी के पूर्वी हिस्सों के जिलों में दिखाई देगा. आगामी दिनों में धुंध रहने की संभावना है.	https://hindi.cdn.zeenews.com/hindi/sites/default/files/2024/10/24/3350877-dana.jpg?im=FitAndFill=(600,315)	2024-10-24 00:58:20	Zee News Hindi
in	https://www.amarujala.com/photo-gallery/lucknow/bahraich-violence-government-could-not-file-reply-demolition-action-stopped-for-now-2024-10-24	Bahraich Violence: घरों पर बुलडोजर चलाने के मामले में नया अपडेट, अभी नहीं गिराए जाएंगे मकान; कोर्ट इसलिए नाराज - अमर उजाला	बहराइच हिंसा से जुड़े मामले की सुनवाई के दौरान बुधवार को सरकार के जवाब न दाखिल करने पर इलाहाबाद उच्च न्यायालय की लखनऊ	https://staticimg.amarujala.com/assets/images/2024/10/24/bahraich-violence_e74ef92574984f2dca178e3193c1c135.jpeg?w=750&dpr=1.0	2024-10-24 05:06:00	अमर उजाला
in	https://www.indiatv.in/world/europe/turkey-hits-terror-targets-in-iraq-and-syria-after-terrorist-attack-on-defence-firm-2024-10-24-1085579	आतंकी हमले के बाद तुर्किये ने लिया इजरायल जैसा बदला, 2 इस्लामिक देशों पर किया हवाई हमला - India TV Hindi	तुर्किये ने सीरिया और इराक में हवाई हमले किए हैं। हवाई हमले तुर्किये में हुए आतंकी हमले की बाद किए गए हैं। तुर्किये के राष्ट्रपति रजब तैय्यब एर्दोआन ने कहा है आतंकी हमले के दोषियों को बख्शा नहीं जाएगा।	https://resize.indiatv.in/resize/newbucket/1200_-/2024/10/turkry-1729746734.jpg	2024-10-24 05:13:59	India TV Hindi
in	https://hindi.news18.com/news/nation/ncp-ajit-pawar-abhishek-manu-singhvi-supreme-court-sharad-pawar-maharashtra-assembly-election-8792911.html	अभिषेक मनु सिंघवी दे रहे थे दलील पर दलील, सुप्रीम कोर्ट ने नहीं मानी कोई बात, शरद पवार को दे दिया बड़ा झटका... - News18 हिंदी	Sharad Pawar Setback from Supreme Court: सुप्रीम कोर्ट से वरिष्ठ नेता और एनसीपी के शरद पवार गुट को आज एक बड़ा झटका लगा है. सुप्रीम कोर्ट ने कहा कि एनसीपी का अजीत पवार गुट इस विधानसभा चुनाव में घड़ी चुनाव निशान का इस्तेमाल कर सकता है.  - ncp ajit pawar abhishek manu singhvi supreme court sharad pawar maharashtra assembly election	https://images.news18.com/ibnkhabar/uploads/2024/10/NCP-Ajit-Pawar-Abhishek-Manu-Singhvi-Supreme-Court-Sharad-Pawar-Maharashtra-assembly-election-2024-10-fdbff43f84150015426f97c07af7c065-16x9.jpg	2024-10-24 10:25:00	News18 हिंदी
in	https://www.aajtak.in/india/news/story/indian-ambassador-sanjay-verma-who-returned-from-canada-says-khalistani-supporters-are-everywhere-from-the-canadian-parliament-to-army-ntc-dskc-2080345-2024-10-24	'कनाडाई संसद से लेकर सेना में भी खालिस्तानी समर्थक', बोले कनाडा से लौटे भारतीय राजदूत - Aaj Tak	राजदूत संजय वर्मा ने कहा कि कनाडा के कई सांसद ऐसे हैं, जिन्होंने भारत की संप्रभुता के खिलाफ सार्वजनिक रूप से अपनी राय व्यक्त की है. हालांकि मुझे उम्मीद थी कि वे विभाजनकारी बयानबाजी का समर्थन करने के बजाय क्षेत्रीय अखंडता के महत्व को बनाए रखेंगे.	https://akm-img-a-in.tosshub.com/aajtak/images/story/202410/671a697dd317a-indian-ambassador-sanjay-verma-243624406-16x9.png	2024-10-24 15:37:05	Aaj Tak
in	https://www.tv9hindi.com/india/ncp-sharad-pawar-released-the-first-list-of-candidates-for-maharashtra-election-2906831.html	NCP शरद पवार गुट ने जारी की 45 उम्मीदवारों की पहली लिस्ट, बारामती से भतीजे अजित के खिलाफ युगेंद्र को... - TV9 Bharatvarsh	महाराष्ट्र एनसीपी प्रेसीडेंट जयंत पाटिल ने पत्रकार वार्ता में उम्मीदवारों की सूची का ऐलान किया. सूची में 45 नाम हैं. सबसे खास बात ये है कि इस सूची में बारामती सीट से युगेंद्र पवार को उतारने का ऐलान किया गया है. ये वही सीट है, जिससे अजित पवार विधायक हैं.	https://images.tv9hindi.com/wp-content/uploads/2024/10/sharad-pawar-66.webp	2024-10-24 13:13:52	TV9 Bharatvarsh
in	https://www.aajtak.in/uttar-pradesh/story/up-by-election-bjp-plays-obc-bet-in-response-to-akhilesh-yadav-pda-card-ntc-rptc-2080166-2024-10-24	यूपी उपचुनाव: अखिलेश के PDA कार्ड के जवाब में बीजेपी ने चला OBC दांव - Aaj Tak	समाजवादी पार्टी ने इन उपचुनाव में एक बार फिर एग्रेसिव पीडीए कार्ड खेलते हुए सबसे ज्यादा 9 में से चार सीटों फूलपुर, कुंदरकी, सीसामाउ और मीरापुर पर मुस्लिम प्रत्याशियों को उतारा है, दो सीटों पर दलित और 3 सीटों पर ओबीसी उम्मीदवारों पर दांव लगाया है. जबकि भाजपा-आरएलडी गठबंधन ने 9 में से 6 सीटें दलित और पिछड़ों को दी हैं, जबकि तीन सीटों पर ब्राह्मण और ठाकुर चेहरों को टिकट दिया है.	https://akm-img-a-in.tosshub.com/aajtak/images/story/202410/671a43d28bbea-up-assembly-by-election-2024-analysis-245540851-16x9.jpg	2024-10-24 13:02:11	Aaj Tak
in	https://zeenews.india.com/hindi/photos/5-zodiac-signs-will-receive-wealth-on-dhanteras-and-every-bit-of-life-fulfilled-with-happiness/2486618	धनतेरस पर किन राशियों पर बरसेगा धन, अभी से झोला रख लें तैयार, सारे महरूमियां हो जाएंगी दूर - Zee News Hindi	Dhanteras 2024 Lucky Zodiac Signs Rashifal : धनतेरस का दिन बहुत खास होता है. यह दिन धनकुबेर और मां लक्ष्‍मी को प्रसन्‍न करके कृपा पाने का सुनहरा मौका होता है. इस साल 29 अक्‍टूबर को धनतेरस पर 5 राशियों पर धनकुबेर और मां लक्ष्‍मी की ऐसी कृपा होने वाली है कि उनकी जीवन भर की तंगी दूर हो जाएगी. उन्‍हें खूब धन लाभ होगा. दरअसल धनतेरस पर बन रहा लक्ष्‍मी नारायण योग इन जातकों को खूब धन-दौलत देगा.	https://hindi.cdn.zeenews.com/hindi/sites/default/files/2024/10/24/3352586-dhanteras-rashifal.jpg?im=FitAndFill=(600,315)	2024-10-24 10:47:56	Zee News Hindi
in	https://www.abplive.com/states/bihar/bihar-jan-suraaj-candidate-of-belagnj-mohammad-amjad-has-cases-against-under-ipc-sections-he-is-high-school-pass-ann-2810144	Bihar News: तेजस्वी यादव को नवीं फेल बताने वाले PK के उम्मीदवार कितने हैं पढ़ें, जन सुराज - ABP न्यूज़	Jan Suraaj: जन सुराज की ओर से मो. अमजद ने बेलागंज से अपना नामांकन दाखिल किया है. इसको लेकर प्रशांत किशोर ने सफाई भी दी है और कहा है कि उम्मीदवार बदलना उनकी चुनावी रणनीति का एक हिस्सा भर है.	https://feeds.abplive.com/onecms/images/uploaded-images/2024/10/07/f4f400732b01bcc263d9cd54ce36d5981728290168012169_original.jpg?impolicy=abp_cdn&imwidth=1200	2024-10-24 14:45:26	ABP न्यूज़
in	https://www.abplive.com/states/maharashtra/maharashtra-election-2024-ncp-ajit-pawars-leader-sameer-bhujbal-resigns-2810090	चुनाव से पहले अजित पवार को झटका, NCP मुंबई के अध्यक्ष ने दिया इस्तीफा, निर्दलीय लड़ेंगे - ABP न्यूज़	Maharashtra Election 2024: महाराष्ट्र विधानसभा चुनाव को लेकर जैसे-जैसे पार्टियों में उम्मीदवारों के नाम फाइनल हो रहे हैं, नाराजगी भी सामने आ रही है. NCP के मुंबई अध्यक्ष ने पार्टी से इस्तीफा दे दिया.	https://feeds.abplive.com/onecms/images/uploaded-images/2024/10/24/1c475ff477f6f4e55f6b6407448847501729773391901957_original.jpg?impolicy=abp_cdn&imwidth=1200	2024-10-24 12:44:24	ABP न्यूज़
in	https://hindi.news18.com/news/bihar/patna-pm-modi-and-cm-nitish-kumar-chemistry-will-be-changed-bihar-and-rjd-tejashwi-yadav-mindset-in-future-politics-8793315.html	नीतीश कुमार पर पीएम मोदी यूं ही नहीं हैं मेहरबान... तेजस्वी यादव देख लें, बिहार में नया अध्याय लिखने की हो ... - News18 हिंदी	यूपी की तरह बिहार में भी अब नई-नई योजनाओं की झड़ी लग गई है. 22 सितंबर को सीएम नीतीश कुमार जिस मांग को लेकर पीएम मोदी को खत लिखते हैं, उसे केंद्र सरकार 24 अक्टूबर को कैबिनेट मीटिंग में पास कर देती है. क्या नीतीश कुमार और पीएम मोदी मिलकर बिहार की नई कहानी लिख रहे हैं? - pm modi and cm nitish kumar chemistry will be changed bihar and rjd tejashwi yadav mindset in future politics	https://images.news18.com/ibnkhabar/uploads/2024/10/WHILE-RAHUL-ATTEMPTS-TO-UNITE-BHARAT-10-2024-10-b951f29206cf90caa11a6ab32f95403f-16x9.jpg	2024-10-24 14:02:38	News18 हिंदी
in	https://ndtv.in/world-news/israel-gaza-iran-war-bloody-mural-showing-israeli-hostages-up-in-iran-after-yahya-sinwar-killing-6861375	Israel Gaza Iran War: याह्या सिनवार की अंतिम इच्छा पूरी करने के लिए ईरान में लगे 'खूनी पोस्टर', इजरायल में खौफ - NDTV India	ईरान की राजधानी तेहरान के फिलिस्तीन चौराहे पर एक पोस्टर लगाया गया है. इस पोस्टर में कथित तौर पर इजरायल के बंधकों की तस्वीरों को दिखाया गया है. दावा किया जा रहा है कि ये वही 7 अक्तूबर को पकड़े गए बंधक हैं. इस पोस्टर में कहा गया है कि किसी भी बंधक को जिंदा नहीं छोड़ा जाएगा. यह बात इजरायली भाषा हिब्रू में लिखी गई है. सबसे बड़ी बात यह है कि  इस पोस्टर में सभी चेहरों पर खून के धब्बे या कहें छींटे डाले गए हैं.	https://c.ndtvimg.com/2024-10/qqag0bd_benjamin-netanyahu-iran-supreme-leader-ayatollah-khamenei-reuters_625x300_02_October_24.jpeg?im=FaceCrop,algorithm=dnn,width=1200,height=738	2024-10-24 06:13:37	NDTV India
in	https://www.amarujala.com/delhi-ncr/ghaziabad/up-bypolls-who-is-bjp-candidate-sanjeev-sharma-from-ghaziabad-seat-with-profile-2024-10-24	UP Bypolls: कौन हैं गाजियाबाद से BJP प्रत्याशी संजीव शर्मा, 2007 में छोड़ी थी सपा...पार्टी ने इसलिए दिया तोहफा - अमर उजाला	Ghaziabad BJP Candidate Profile: भारतीय जनता पार्टी ने उत्तर प्रदेश में आगामी उप चुनाव के लिए गाजियाबाद से संजीव शर्मा को टिकट दिया है।	https://staticimg.amarujala.com/assets/images/2024/10/24/kana-ha-gajayabtha-sa-bhajapa-paratayasha-sajava-sharama_233025713af164c75d5021af090c9c3d.jpeg?w=750&dpr=1.0	2024-10-24 07:58:29	अमर उजाला
in	https://navbharattimes.indiatimes.com/astro/religion-rituals/panchang/aaj-ka-panchang-24-october-2024-today-panchang-thursday-ahoi-ashtami-vrat-know-today-puja-shubh-muhurat-and-rahukal-timing/articleshow/114509165.cms	Aaj Ka Panchang, 24 October 2024 : आज अहोई अष्टमी व्रत, जानें पूजा के लिए शुभ मुहूर्त का समय - NBT नवभारत टाइम्स (Navbharat Times)	Today Panchang | Kartik maas 2024, Ahoi Ashtami Vrat 2024 :  आज अहोई अष्टमी का व्रत है। साथ ही आज पुष्य नक्षत्र प्रातः सूर्योदय से लेकर अगले दिन प्रातः 07 बजकर 40 मिनट तक उपरांत आश्लेषा नक्षत्र का आरंभ। जानें पूजा का शुभ मुहूर्त और राहुकाल का समय।	https://static.langimg.com/photo/imgsize-82916,msid-114509239/navbharat-times.jpg	2024-10-23 22:30:00	NBT नवभारत टाइम्स (Navbharat Times)
