country_code	url	title	description	image_url	publish_date	source
jp	https://www.sankei.com/article/20241031-KOB5VB7MBBMSVN4AUWPPEZG4O4/	自民旧安倍派、雌伏の時 衆院選で3分の1に激減、石破首相への反感くすぶるも展望開けず - 産経ニュース	27日投開票の衆院選の結果、自民党の最大派閥だった旧安倍派の衆院での勢力が選挙前と比べ約3分の1に激減し、次世代の幹部候補も次々と落選した。派閥パーティー収入…	https://www.sankei.com/resizer/dhRVr59lsZstp72Ew9zwBWTEZyI=/1200x630/smart/filters:quality(50)/cloudfront-ap-northeast-1.images.arcpublishing.com/sankei/IQHT57P2UFHSTLHTOR5JZO4YTQ.jpg	2024-10-31 10:54:52	産経ニュース
jp	https://www.sankei.com/article/20241101-3WZGI537NJMZ3EGZOIRUMXKO6U/	＜主張＞大谷最高の1年 その笑顔に幸福を味わう 社説 - 産経ニュース	　今季の大谷翔平を振り返るとき、満面の笑みしか浮かばない。	https://www.sankei.com/resizer/SZrIxNZ6ArjnI2NdNfpia4oYlY8=/1200x630/filters:focal(3065x2404:3075x2414):quality(50)/cloudfront-ap-northeast-1.images.arcpublishing.com/sankei/QCAEIMWG2BJXTM3KDSNOK25I6M.jpg	2024-10-31 20:00:04	産経ニュース
jp	https://www3.nhk.or.jp/news/html/20241101/k10014625461000.html	“フリーランスが安心して働ける環境を” 新たな法律施行 - nhk.or.jp	【NHK】フリーランスで働く人を保護する法律が11月1日に施行され、フリーランスに業務を委託した企業などの事業者に対して、報酬の減…	https://www3.nhk.or.jp/news/html/20241101/K10014625461_2410311857_1031222743_01_02.jpg	2024-10-31 19:36:06	nhk.or.jp
jp	https://www.yomiuri.co.jp/politics/20241031-OYT1T50218/	山口氏再登板に期待も…公明の後継選び本格化、斉藤・岡本氏ら取りざたされるも衆目一致せず - 読売新聞オンライン	【読売新聞】　公明党の石井代表が３１日に辞意を表明し、党内では１１月９日の新代表選出に向けた調整が本格化した。次期代表には、斉藤鉄夫国土交通相（７２）や岡本三成政調会長（５９）が取り沙汰されるものの、党内の衆目が一致しているとは言え	https://www.yomiuri.co.jp/media/2024/10/20241031-OYT1I50206-1.jpg?type=ogp	2024-10-31 22:31:21	読売新聞オンライン
jp	https://www.jiji.com/jc/article?k=2024103101356&g=pol	萩生田氏ら「党所属」扱いせず 自民、批判懸念で異例対応：時事ドットコム - 時事通信ニュース	自民党執行部は３１日、萩生田光一元政調会長と平沢勝栄元復興相を「党所属国会議員」の扱いとしないよう党内に指示した。派閥裏金問題に関わった両氏は衆院選で公認を得られず、無所属で当選。しかし、自民の衆院会派に同日入ったため、ルール上は「党所属国会議員」となるはずだった。	https://www.jiji.com/news2/kiji_photos/202410/20241031ds79_o.jpg	2024-10-31 11:43:00	時事通信ニュース
jp	https://www.bloomberg.co.jp/news/articles/2024-10-31/SM7POOT1UM0W00	事件当時は野村証に勤務、広島強殺未遂容疑の29歳男性－共同 - ブルームバーグ	強盗殺人未遂と現住建造物等放火の疑いで逮捕された29歳の男性が事件当時野村証券の社員だったと、共同通信が捜査関係者への取材を基に31日報じた。	https://assets.bwbx.io/images/users/iqjWHBFdfxIU/iCa2lHQRAWq0/v1/-1x-1.jpg	2024-10-31 10:13:26	ブルームバーグ
jp	https://news.golfdigest.co.jp/news/lpga/article/174045/1/	「7勝したとは聞いてたけど…」元世界ランク1位も竹田麗央に驚いた - ゴルフダイジェスト・オンライン	◇日米女子ツアー共催◇TOTOジャパンクラシック 初日（31日）◇瀬田GC 北コース (滋賀)◇6616yd（パー72）◇晴れ（観衆2759人） 来季の米ツアー出場権を争う12月の最終予選会（アラバマ州マグノリアグローブGC）にエントリーした竹田麗央は、7月「エビアン選手権」でメジャー初優勝を飾った古江彩佳、メジャー2勝のコ・ジンヨン（韓国）の後塵を拝す初日	https://i.gimg.jp/cmsimg/369399.jpg	2024-10-31 22:16:26	ゴルフダイジェスト・オンライン
jp	https://www.nikkei.com/article/DGXZQOGN31EF10R31C24A0000000/	幻のトランプ・トレード 悲観論は行き過ぎ注意 - 日本経済新聞	10月31日のニューヨーク市場で円の対ドル相場は1ドル=152円台を中心とする取引が続いた。円相場は10月に入ってからするすると下がり始め、この1カ月で10円近く円安・ドル高が進んだ。米大統領選でハリス副大統領の支持率が伸び悩み、トランプ前大統領が追い上げた時期と重なるため、市場ではトランプ勝利を織り込んだ「トランプ・トレード」との解説も聞かれる。トランプ氏が優勢だと、なぜ円安・ドル高になるの	https://article-image-ix.nikkei.com/https%3A%2F%2Fimgix-proxy.n8s.jp%2FDSXZQO5563834031102024000000-1.jpg?crop=focalpoint&fit=crop&fp-x=0.6&fp-y=0.19&h=630&w=1200&s=62f96c330cb47e126583de447d83f0f6	2024-10-31 19:31:04	日本経済新聞
jp	https://news.google.com/rss/articles/CCAiC1pScEpSMlByUHlZmAEB?oc=5	【台風21号】沖縄は影響残る 先島諸島を中心に暴風雨に警戒（1日３時現在） - ウェザーニュース	None	None	2024-10-31 21:21:23	ウェザーニュース
jp	https://www.yomiuri.co.jp/national/20241031-OYT1T50051/	子供２人を殺そうとした母親「間違いありません」…浴槽に沈めた長女は死亡、首絞めた長男は意識不明 - 読売新聞オンライン	【読売新聞】　神奈川県警港北署は３０日、横浜市港北区大曽根、無職上重愛容疑者（４３）を殺人未遂の疑いで現行犯逮捕した。 発表によると、上重容疑者は同日午後８時頃、自宅で小学５年の長男（１１）の首を絞め、長女の楓ちゃん（５）を浴槽内に	None	2024-10-31 01:33:00	読売新聞オンライン
jp	https://jp.reuters.com/world/security/3VV6Z46J7BJ45P5KA4EWGN6CAQ-2024-10-31/	イスラエル北部で5人死亡、レバノン南部では医療従事者6人犠牲に - ロイター (Reuters Japan)	レバノンの親イラン武装組織ヒズボラによる攻撃で、イスラエル北部メトゥラでイスラエル人１人と外国人労働者４人が死亡した。イスラエルＴＶが３１日報じた。	https://www.reuters.com/resizer/v2/BSFE7O44KZJFTL7JWJ5CYG3TDI.jpg?auth=634cab5c5e7dbad3a9e6aa591a6eeade7ff46e45a15411d8cef06bf7f95ab1f2&height=1005&width=1920&quality=80&smart=true	2024-10-31 15:35:34	ロイター (Reuters Japan)
jp	https://jp.reuters.com/opinion/forex-forum/3IOZO5CPNZJQLDJFVN2VHXLIQI-2024-10-31/	日銀、政策金利の据え置き決定：識者はこうみる - ロイター (Reuters Japan)	日銀は３０―３１日に開いた金融政策決定会合で、政策金利である無担保コール翌日物金利を０．２５％で据え置くことを決定した。実質金利が極めて低い水準にあることを踏まえ、経済・物価見通しが実現していけば「政策金利を引き上げ、金融緩和の度合いを調整していく」と改めて示す一方で、米国を始めとする海外経済の今後の展開や市場動向を「十分注視」し、経済・物価の見通しやリスク、見通し実現の確度に及ぼす影響を見極めていく必要があるとした。	https://www.reuters.com/resizer/v2/EF5MUUMS4ZNQND3FG5SFK5PGHY.jpg?auth=ef1d9e29c9da3bb69cd12f4665bab6f1e6b6dd8f09c9f9dfe857e1ab6c32ab09&height=1005&width=1920&quality=80&smart=true	2024-10-31 08:46:34	ロイター (Reuters Japan)
jp	https://www.bloomberg.co.jp/news/articles/2024-10-31/SM5704T0AFB400	超長期債に吹く三つの逆風－財政拡張と円安リスク、利上げ待ちの生保 - ブルームバーグ	財政、金融政策に敏感に反応する超長期債が逆風にさらされている。予想される新政権の下での財政拡張懸念、日本銀行の利上げ観測、生命保険会社の様子見姿勢と３方向から吹き、金利上昇圧力が強まっている。	https://assets.bwbx.io/images/users/iqjWHBFdfxIU/ihs7i32cmvaQ/v0/1200x800.jpg	2024-10-31 23:10:00	ブルームバーグ
jp	https://www.yomiuri.co.jp/world/20241101-OYT1T50030/	北朝鮮兵、ウクライナ軍と数日中に交戦の可能性…米国務長官「正当な軍事目標になる」と警告 - 読売新聞オンライン	【読売新聞】　【ワシントン＝淵上隆悠】米国のブリンケン国務長官は１０月３１日、ロシアに派遣された北朝鮮兵が、今後数日以内にウクライナ軍との戦闘に投入される可能性があるとの認識を示した。北朝鮮兵による戦闘行為やロシア軍への支援活動が確	None	2024-11-01 00:22:00	読売新聞オンライン
jp	https://jp.reuters.com/world/security/U5GW7N7OGFPBXB3Y2AKLDDI4CI-2024-10-31/	日米韓、北朝鮮のＩＣＢＭ発射を強く非難 独は対立激化の自制訴え - ロイター (Reuters Japan)	日米韓の３カ国は３１日、共同声明を発表し、北朝鮮による大陸間弾道弾ミサイル（ＩＣＢＭ）発射を強く非難した。	https://www.reuters.com/resizer/v2/DAKAIANU7VIO3BUT65S2DKEMQA.jpg?auth=f8b5e7ed771ffa76a9cfe86a463aa0b31d76f9492caade03b6a4de7a410d015a&height=1005&width=1920&quality=80&smart=true	2024-10-31 18:05:57	ロイター (Reuters Japan)
jp	https://jbpress.ismedia.jp/articles/-/84122	与党に極大な貸しを作り、野党にも賛同できる…国民民主党「自公連立入り拒否」の打ち手がなぜうまいと言えるか？ - JBpress	　第50回衆議院議員総選挙が終わった。　結果は既知のとおりだが、投票率は2014年、2017年に次いで戦後3番目に低い53.85%。2012年の第2次安倍政権以後繰り返されてきた低投(1/7)	https://jbpress.ismcdn.jp/mwimgs/f/b/1200mw/img_fb97834f6ff4c258197286a662dd73ff801879.jpg	2024-10-31 21:00:00	JBpress
jp	https://www3.nhk.or.jp/news/html/20241101/k10014625911000.html	ホテルで手首縛られた女性が死亡 殺人か 千葉 市原 - nhk.or.jp	【NHK】消防や捜査関係者によりますと、1日午前7時半ごろ、千葉県市原市のホテルで50代くらいの女性が倒れていると従業員から消防に…	https://www3.nhk.or.jp/news/html/20241101/K10014625911_2411011009_1101102536_01_02.jpg	2024-11-01 01:06:19	nhk.or.jp
jp	https://tenki.jp/forecaster/deskpart/2024/11/01/31200.html	1日 台風や前線の影響で九州～四国に雨雲 強雨エリア拡大へ 2日は広く大雨に警戒 - tenki.jp	今日1日、台風21号が台湾海峡を北上し、前線が東シナ海から日本の南に停滞しています。午前9時、沖縄や九州、中国、四国に雨雲がかかっています。土砂降りの雨となった所もあります。このあと強雨エリアが拡大するでしょう。明日2日は九州から関東で警報級の大雨となる恐れがあります。	https://storage.tenki.jp/storage/static-images/forecaster_diary/image/3/31/312/31200/main/20241101091332/large.jpg	2024-11-01 00:32:34	tenki.jp
jp	https://mainichi.jp/articles/20241031/k00/00m/030/055000c	トランプ氏がごみ収集作業員に バイデン氏の失言に乗じてジョーク - 毎日新聞	　米大統領選の共和党候補、トランプ前大統領は30日、中西部ウィスコンシン州で、作業員の装いで、ごみ収集車を模したトラックに乗るパフォーマンスを見せた。民主党のバイデン大統領がトランプ氏の支持者を「ごみ」と発言して批判を浴びているのに乗じて、「私のごみ収集車はどうだい」とジョークを飛ばした。	https://cdn.mainichi.jp/vol1/2024/10/31/20241031k0000m030057000p/0c10.jpg?1	2024-10-31 01:22:45	毎日新聞
jp	https://www3.nhk.or.jp/news/html/20241031/k10014625011000.html	不登校の小中学生 過去最多34万人余に 11年連続で増加 文科省 - nhk.or.jp	【NHK】不登校の状態にある小中学生は昨年度、34万人余りにのぼり、11年連続で増加して過去最多となったことが文部科学省の調査でわ…	https://www3.nhk.or.jp/news/html/20241031/K10014625011_2410311611_1031162421_01_02.jpg	2024-10-31 09:05:34	nhk.or.jp
jp	https://www.sankei.com/article/20241031-IBIA4A7MSBNFDEDQX57YA65NFQ/	共産党の車が電車と衝突 東京・板橋の踏切、けが人なし 東武東上線が一時運転見合わせ - 産経ニュース	31日午後6時ごろ、東京都板橋区赤塚の東武東上線の踏切で、川越市発池袋行き準急電車と軽乗用車が衝突した。東京消防庁や東武鉄道によると、けが人の情報はない。日本…	https://www.sankei.com/resizer/Ntz8Kwfo0QOgC8LhT6ZelPPZcSg=/1200x630/smart/filters:quality(50)/cloudfront-ap-northeast-1.images.arcpublishing.com/sankei/WU75BAAFFZLHFNOCZR5Y72K7P4.jpg	2024-10-31 11:34:58	産経ニュース
jp	https://www.asahi.com/articles/ASSB01PK8SB0PUTB00CM.html	最低賃金1割増、徳島ショックの現場で 企業側「政治のおもちゃだ」 - 朝日新聞デジタル	None	None	2024-10-31 21:00:00	朝日新聞デジタル
jp	https://www.nikkei.com/article/DGXZQOUE233SY0T21C24A0000000/	自転車「ながら運転」・酒気帯びに罰則 改正法1日施行 - 日本経済新聞	自転車走行中の携帯電話使用（ながら運転）や酒気帯び運転に罰則を盛り込んだ改正道路交通法が1日、施行された。若い世代を中心にスマートフォンのながら運転が絡む事故が増えており、罰則強化により抑止を図る。自転車の交通違反には2026年から反則金制度も適用される。ルールが大きく変わり、周知が課題になる。「11月から酒気帯び運転やながら運転の罰則が強化されます。ながらスマホはやってしまいがちですので注意	https://article-image-ix.nikkei.com/https%3A%2F%2Fimgix-proxy.n8s.jp%2FDSXZQO5557618031102024000000-2.jpg?crop=focalpoint&fit=crop&fp-x=0.11&fp-y=0.08&h=630&w=1200&s=3e480b912cc1c526ada8eb7e77acd161	2024-10-31 20:00:00	日本経済新聞
jp	https://www.cnn.co.jp/world/35225615.html	まるで海とつながった内海 衛星画像が見せつけるスペイン大規模洪水の爪痕 - CNN.co.jp	スペインを襲った記録的な豪雨による洪水で、東部沿岸部の陸地が膨大な量の水に覆われ、宇宙から見ると海とつながった内海のように見えている。	https://www.cnn.co.jp/storage/2024/11/01/10fd296845b7adead79f6104908f5819/t/1100/618/d/valencia-flood-lc9-20241030-20241008-sbs-ml-v2.jpg	2024-11-01 00:34:00	CNN.co.jp
jp	https://www.bloomberg.co.jp/news/articles/2024-10-31/SHFDNIDWLU6800	円が対ドルで１％上昇、植田総裁発言受け－151円台後半 - ブルームバーグ	31日のニューヨーク外国為替市場で円相場は対ドルで１％上昇。日本銀行の植田和男総裁が金融政策の見極めに必要な時間や利上げのタイミングには予断を持っていないと発言したことなどを受けて、円買い・ドル売りが強まっている。	https://assets.bwbx.io/images/users/iqjWHBFdfxIU/iPx.qlNbO0E0/v0/1200x800.jpg	2024-10-31 18:52:00	ブルームバーグ
jp	https://news.google.com/rss/articles/CBMib0FVX3lxTE9JeVlKVkxZdm1NVDJfM1A3YVgxOUZWTHl4OW44WjkxY0ZNQ2I3dXZxTENHTVJ0RmNNT2ZRXzQ1TlczbDdpU0JyMDN0d3cyTS1nNWp1S1hTek56cmNlcU1INGltVnotYnllcGFEbmdtOA?oc=5	米 インテル 約2兆5000億円の最終赤字 半導体めぐる競争で - nhk.or.jp	【NHK】アメリカの半導体メーカー、インテルはことし9月までの3か月間の決算を発表し、日本円でおよそ2兆5000億円の最終赤字とな…	https://www3.nhk.or.jp/news/html/20241101/K10014625881_2411010846_1101085312_01_02.jpg	2024-10-31 23:53:34	nhk.or.jp
jp	https://bunshun.jp/articles/-/74553	【10月31日（木）18時～ YouTube生放送】橋本環奈（25）壮絶パワハラの実態、逆ギレ石破 衝撃のオフレコ放言録、ジャニーズが“NHKスクープ証言者”を提訴など…話題の記事を紹介します - 文春オンライン	None	None	2024-10-30 22:00:00	文春オンライン
jp	https://hochi.news/articles/20241031-OHT1T51281.html	【わたしの宝物】モラハラ夫が１８０度激変！ネット複雑「地獄」「あなたの子じゃない！」「胸が痛い」 - スポーツ報知	　女優・松本若菜が主演のフジテレビ系ドラマ「わたしの宝物」（木曜・後１０時）第３話が３１日に放送された。	https://hochi.news/images/2024/10/31/20241031-OHT1I51411-L.jpg	2024-10-31 14:15:00	スポーツ報知
jp	https://www.sankei.com/article/20241031-ARVDATZPQRN2XILYUGKFA5PL3U/	「被害者のカードで現金引き出した」容疑者数人が供述 北海道・江別の大学生暴行死 - 産経ニュース	北海道江別市で大学生長谷知哉さん（20）が集団暴行され死亡した傷害致死事件で、逮捕された容疑者の数人が「被害者のキャッシュカードで現金を引き出した」との趣旨の…	https://www.sankei.com/resizer/k2oeDLOhCFePmQvJEmIX3cRzhgU=/1200x630/filters:focal(1871x1508:1881x1518):quality(50)/cloudfront-ap-northeast-1.images.arcpublishing.com/sankei/EQL5HWON2VM73CCCYSLCE5BJ6Y.jpg	2024-10-31 10:36:23	産経ニュース
jp	https://news.google.com/rss/articles/CBMibEFVX3lxTFBFcW1ZaXVPa1lZenExbzlWcTQ3eXVJenlFaml6djdSbWpkaW1aU3d2cjJ5UmxvSlhpSmRCMXRPNm4zQTF3c0NCNW02djNVU1hxXzR1WWsydjkxZEZnOW9ubW9uV3YyaVlrT1ZwZw?oc=5	維新、有権者の「拒否度」が上昇 関西学院大・善教氏 - 日本経済新聞	与党が大敗した今回の衆院選について、有権者は何を考えどのように行動したのか。関西学院大の善教将大教授に聞いた。立憲民主党の比例票の推移をみるとそれほど伸びていない。躍進の要因は小選挙区で競り勝ったことだ。自民党には入れたくないが、候補者の中で有力と思う候補に投票しようとする有権者の戦略的投票が立民の小選挙区での勝利につながった。自民は「政治とカネ」を巡る問題が指摘され徐々に支持を減らしていっ	https://article-image-ix.nikkei.com/https%3A%2F%2Fimgix-proxy.n8s.jp%2FDSXZQO5556748030102024000000-2.jpg?bg=FFFFFF&fill=blur&fit=fill&h=630&w=1200&s=a144c14f2c6f1b603a6c5aa6d6d17562	2024-10-31 10:30:00	日本経済新聞
jp	https://www.bloomberg.co.jp/news/articles/2024-11-01/SM8T81T0G1KW00	国民民主が立民・公明ときょう幹事長会談、与野党問わず政策協議へ - ブルームバーグ	国民民主党は１日、立憲民主党と公明党と相次いで幹事長・国対委員長会談を行う。国民は与野党問わず案件ごとに政策協議をする方針を示しており、調整を本格化する。	https://assets.bwbx.io/images/users/iqjWHBFdfxIU/itO56loX6XP0/v0/1200x800.jpg	2024-11-01 01:10:26	ブルームバーグ
jp	https://www.jiji.com/jc/article?k=2024103101322&g=pol	石破政権１カ月、強まる逆風 退陣否定、いばらの道 - 時事通信ニュース	石破茂首相は１１月１日で就任１カ月を迎えた。就任直後に踏み切った衆院解散・総選挙は裏目に出て与党過半数割れの惨敗を喫した。退陣を否定し政策実現に意欲を示すものの、派閥裏金事件の逆風は収まらない。いばらの道が続くのは確実だ。	https://www.jiji.com/news2/kiji_photos/202410/20241031atI3S_o.jpg	2024-10-31 22:03:00	時事通信ニュース
jp	https://www.sankei.com/article/20241101-AI4L3SMUFRIW7JFK3AT5U7OMGM/	犯行グループ、近くの公園に集合し徒歩で現場に移動か 東京・三鷹の強盗未遂 - 産経ニュース	東京都三鷹市の住宅に複数の男が押し入った事件で、強盗未遂などの疑いで逮捕された京都市の大学4年、佐円昌紀（さえん・まさき）容疑者（23）が、別の男らと現場近く…	https://www.sankei.com/resizer/PaKN1SXCek1XakdfFckhL9DFexA=/1200x630/smart/filters:quality(50)/cloudfront-ap-northeast-1.images.arcpublishing.com/sankei/25RR54T3OFNHJHUPWEMQOKRTWA.jpg	2024-10-31 23:58:04	産経ニュース
jp	https://www.kobe-np.co.jp/news/society/202410/0018291000.shtml	兵庫県知事選が告示、史上最多7人の立候補者が確定 11月17日投開票|社会 - 神戸新聞NEXT	　前兵庫県知事の失職に伴う知事選（１１月１７日投開票）が３１日告示され、午後５時、立候補の届け出が締め切られた。前職１人、新人６人の計７人の立候補が確定した。７人が立候補するのは過去最多。	https://i.kobe-np.co.jp/news/society/202410/img/a_18291001.jpg	2024-10-31 08:10:00	神戸新聞NEXT
jp	https://jp.reuters.com/world/us/6UI52CBJDJIGRMD6YN5FT6IZAY-2024-10-31/	イスラエル軍、ガザ全域で攻撃継続 46人死亡 病院も被害 - ロイター (Reuters Japan)	イスラエル軍は３１日、パレスチナ自地区ガザ全域を攻撃し、北部を中心にパレスチナ人少なくとも４６人が死亡した。ガザ保健当局によると、北部ベイトラヒヤにある病院も攻撃を受け、職員が軽度の火傷を負ったほか、医療物資が焼失し、手術が中断される事態となった。	https://www.reuters.com/resizer/v2/O33IC35Q5ZJHTIRSN24OUKJTHM.jpg?auth=fe5aa000c08c7eee2271c7d2d91cc91dd7ebf0106217f524ad242e6c7ec664c2&height=1005&width=1920&quality=80&smart=true	2024-10-31 23:48:52	ロイター (Reuters Japan)
jp	https://news.google.com/rss/articles/CCAiC3ZoTFdsLW45VUVFmAEB?oc=5	【大雨情報】天気下り坂で西日本は激しい雨のおそれ - ウェザーニュース	None	None	2024-10-31 22:43:28	ウェザーニュース
jp	https://jp.reuters.com/world/us/QHH6EL6YKBIYFIW5C4VDF37M44-2024-10-31/	イスラエル、イランのどこにでも到達可能 核兵器開発阻止が優先課題＝首相 - ロイター (Reuters Japan)	イスラエルのネタニヤフ首相は３１日、必要に応じイスラエルはイラン国内のどこにでも到達することが可能と言明した。	https://www.reuters.com/resizer/v2/XRJXFWYMKVMOJELCY2KPTH27GE.jpg?auth=060d1e40dd3b1ba804359f627d12c6a4d523405c821dc3a7c353cd2bd09dee10&height=1005&width=1920&quality=80&smart=true	2024-10-31 16:28:23	ロイター (Reuters Japan)
jp	https://www.yomiuri.co.jp/world/20241101-OYT1T50039/	ドジャースのワールドシリーズ制覇でファンが暴徒化、窃盗容疑などで１２人逮捕…バス放火も - 読売新聞オンライン	【読売新聞】　【ロサンゼルス＝後藤香代】米ロサンゼルス市警は１０月３１日、大リーグ・ドジャースがワールドシリーズ（ＷＳ）制覇を決めた３０日夜に興奮したファンが暴徒化し、商業施設での窃盗容疑などで計１２人を逮捕したと発表した。バスへの	None	2024-11-01 01:44:00	読売新聞オンライン
jp	https://mainichi.jp/articles/20241031/k00/00m/010/212000c	国民・玉木氏 自民への協力は「年収103万円の壁見直しが条件」 - 毎日新聞	　国民民主党の玉木雄一郎代表は31日、自民党と合意した政策協議について「（所得税の）基礎控除の引き上げは必要だ。それを全くやらないのであれば協力できない。予算も通らないだろう」と述べ、年収が103万円を超えると所得税が発生する「年収103万円の壁」の見直しが、協力の条件になるとの考えを示した。金額は	https://cdn.mainichi.jp/vol1/2024/10/30/20241030ddm003010165000p/0c10.jpg?2	2024-10-31 07:34:37	毎日新聞
jp	https://www.chunichi.co.jp/article/980207	DeNA小池コーチ「あれ以来ですか…」日本Sで“ビジター5連勝” フェンス激突の13年前逃した宝物がすくそこに - 中日新聞	◇渋谷真コラム・龍の背に乗って　日本シリーズ特別編◇31日　SMBC日本シリーズ2024第5戦　ソフトバンク0―7DeNA（みずほペイ...	https://static.chunichi.co.jp/image/article/size1/1/4/8/d/148d669fbbe55b018a9c075d19e42aa8_1.jpg	2024-11-01 01:49:23	中日新聞
jp	https://www.nikkei.com/article/DGXZQOFL0109A0R01C24A1000000/	日経平均株価、米ハイテク株安が重荷（先読み株式相場） - 日本経済新聞	1日の東京株式市場で日経平均株価は続落か。前日の米ハイテク株安を受け、東京市場でも半導体関連を含む幅広い銘柄に売りが先行するだろう。日銀が段階的な利上げを検討する姿勢を示し、外国為替市場で円相場が対ドルで上昇していることも株式相場の重荷となる。日経平均は前日終値（3万9081円）から1000円程度安い3万8100円前後が下値めどになる。　10月31日の米株式市場でダウ工業株30種平均は3日続	https://article-image-ix.nikkei.com/https%3A%2F%2Fimgix-proxy.n8s.jp%2FDSXZQO5563926001112024000000-1.jpg?crop=focalpoint&fit=crop&h=630&w=1200&s=fb14e06c00800de1ad06b219a00eb57b	2024-10-31 23:00:00	日本経済新聞
