country_code	url	title	description	image_url	publish_date	source
jp	https://www.jiji.com/jc/article?k=2024111800851&g=pol	「トランプ会談」仕切り直し 自信暗転、石破首相に痛手：時事ドットコム - 時事通信ニュース	石破茂首相は２１日までの南米訪問に合わせたトランプ次期米大統領との会談を断念した。日本側は米側も前向きだと自信をのぞかせていたが、米国内法などを理由に断られる形となった。首相は来年１月２０日の就任式後の会談を目指して仕切り直しを図るが、調整が円滑に進むかは見通せない。	https://www.jiji.com/news2/kiji_photos/202411/20241118at61S_ogp.jpg	2024-11-18 22:03:00	時事通信ニュース
jp	https://www.bloomberg.co.jp/news/articles/2024-11-19/SN670CT0G1KW00	バイデン氏はどこに消えた、Ｇ20集合写真で姿見えず－団結欠如象徴か - ブルームバーグ	ブラジルのリオデジャネイロの名所シュガーローフ・マウンテンの素晴らしい眺めを背景に、輝く太陽と澄み切った青空の下、主要20カ国・地域（Ｇ20）の首脳らは「家族写真」の撮影のために一堂に会した。ただ一つだけ問題があった。バイデン米大統領の姿が見当たらないのだ。	https://assets.bwbx.io/images/users/iqjWHBFdfxIU/i7m9N65PjKMs/v0/1200x800.jpg	2024-11-19 04:46:48	ブルームバーグ
jp	https://jp.reuters.com/markets/japan/funds/EBZAU74QJ5MJPPIDTZGERTIS2Q-2024-11-19/	日経平均は反発、一時300円超高 買い一巡後は小動き - ロイター (Reuters Japan)	None	None	2024-11-19 09:11:15	ロイター (Reuters Japan)
jp	https://www.rakuteneagles.jp/news/detail/202400705999.html	加治屋 蓮選手の入団記者会見を行いました - 東北楽天ゴールデンイーグルス	None	https://www.rakuteneagles.jp/media/sites/3/news/2024/11/img_202400705999_01.jpg	2024-11-19 08:19:17	東北楽天ゴールデンイーグルス
jp	https://www.yomiuri.co.jp/national/20241119-OYT1T50142/	斎藤元彦知事「心ない誹謗中傷は県民の心を傷つける」…ＳＮＳ対策条例の制定検討明らかに - 読売新聞オンライン	【読売新聞】　兵庫県知事選で再選を果たした斎藤元彦知事は１９日、県庁に登庁し、就任記者会見に臨んだ。選挙戦でのＳＮＳの活用に触れ、 誹謗 （ ひぼう ） 中傷を防ぐための条例の制定を検討する考えを明らかにした。 １７日投開票の知事選	https://www.yomiuri.co.jp/media/2024/11/20241119-OYT1I50134-1.jpg?type=ogp	2024-11-19 13:23:00	読売新聞オンライン
jp	https://www3.nhk.or.jp/news/html/20241119/k10014643021000.html	新米の相対取引価格 10月の平均は前年同月比57％高 過去最高に - nhk.or.jp	【NHK】ことしの新米の先月の相対取引価格は、すべての銘柄の平均で去年の同じ月と比べて57％上昇し、2か月連続で過去最高を更新しま…	https://www3.nhk.or.jp/news/html/20241119/K10014643021_2411191614_1119161818_01_02.jpg	2024-11-19 09:20:10	nhk.or.jp
jp	https://news.ntv.co.jp/category/culture/a0daabd335a34caf901e286f3deb3e71	岡田将生＆高畑充希「親友のように過ごしてきた私達ですが、これからは夫婦に」連名で結婚発表 - 日テレNEWS	俳優の岡田将生さん（35）と高畑充希さん（32）が19日、それぞれのSNSを更新し、結婚することを発表しました。岡田さんと高畑さんは、それぞれのインスタグラムで「この度、岡田将生と高畑充希は結婚する運びとなりました」と連名で発表。「お互い10代の頃にこのお仕事を始め、数え切れない程の素敵な方々や作品との出会い、そしてなによりみなさまの応援に支えられ、ここまで来ることができました。親友のように過ごしてきた私達ですが、これからは夫婦となります」と報告しました。続けて、「労わりあい、鼓舞し合いながら作品の中で皆さまによりよい姿をお見せ出来るよう、より一層精進していく所存ですので、どうか温かく見守っていただけると幸いです」と思いをつづりました。岡田さんは、所属事務所のプロフィルによると1989年8月15日生まれ、東京都出身。2006年にデビューしました。2007年に公開された映画『天然コケッコー』で、東京から転校してきた、主人公の同級生役を演じ、みずみずしい存在感と演技が注目され、近年も、ドラマ『ゆとりですがなにか』の主演や、米アカデミー賞・国際長編映画賞にも輝いた映画『ドライブ・マイ・カー』に出演するなど、活躍を続けています。高畑さんは、所属事務所のプロフィルによると1991年12月14日生まれ、大阪府出身。2005年、13歳のときに山口百恵さんのトリビュート・ミュージカル『プレイバック part2～屋上の天使』にオーディションで主役に抜てき。その後も高い歌唱力を生かし、ミュージカル『ピーターパン』や『コーヒープリンス1号店』などに次々と出演。また、第43回日本アカデミー賞では『こんな夜更けにバナナかよ　愛しき実話』で優秀助演女優賞に輝きました。岡田さんと高畑さんは、2024年配信のドラマ『1122　いいふうふ』で初共演。今回、結婚することになりました。	https://news.ntv.co.jp/gimage/n24/articles/34c0f3c6468043b28179a4f2740f7538/938b76c7-76bd-49bc-a432-369e4d5712be.jpg?w=1200	2024-11-19 13:15:00	日テレNEWS
jp	https://www.jiji.com/jc/article?k=2024111900250&g=int	移民送還に国家非常事態宣言へ トランプ氏、軍動員も―米 - 時事通信ニュース	【ワシントン時事】トランプ次期米大統領は１８日、来年１月の就任後、最優先課題に位置付ける不法移民の大規模送還計画を実行に移すため、国家非常事態宣言を発令し、軍隊を動員する考えを示した。ＳＮＳへの投稿で明らかにした。	https://www.jiji.com/news2/kiji_photos/202411/20241119at04S_o.jpg	2024-11-18 23:16:00	時事通信ニュース
jp	https://www.nikkei.com/article/DGXZQOFL1906U0Z11C24A1000000/	外為10時 円相場、154円台前半に上げ拡大 実需の買い観測で - 日本経済新聞	19日午前の東京外国為替市場で、円相場は上げ幅を広げている。10時時点は1ドル=154円38〜40銭と前日17時時点と比べて18銭の円高・ドル安だった。10時すぎには一時154円08銭近辺まで上昇した。10時前の中値決済に向けて「ドルが余剰気味」（国内銀行の為替担当者）との声が聞かれた。輸出企業など国内実需筋の円買い・ドル売り観測が相場を押し上げた。前週に一時4.50%をつけた米長期金利は1	https://www.nikkei.com/.resources/k-components/rectangle.rev-d54ea30.png	2024-11-19 01:24:05	日本経済新聞
jp	https://www3.nhk.or.jp/news/html/20241119/k10014643351000.html	自民 政治改革本部 “政策活動費廃止の方向 党の改革案に” - nhk.or.jp	【NHK】政治資金規正法の再改正をめぐり、自民党の政治改革本部の幹部が会合を開き、政策活動費は廃止する方向を、党の政治改革案に盛り…	https://www3.nhk.or.jp/news/html/20241119/K10014643351_2411191949_1119195021_01_02.jpg	2024-11-19 11:20:18	nhk.or.jp
jp	https://www.yomiuri.co.jp/sports/wbc/20241119-OYT1T50068/	台湾に活躍の場を移した日本人チアダンサー、プレミア１２の華に…日台交流促進願い応援 - 読売新聞オンライン	【読売新聞】　【台北＝片岡航希】野球の国際大会「ラグザス　プレミア１２」で２次ラウンド進出を決めた日本代表「侍ジャパン」。全勝で突破した台湾での１次ラウンドでは、日台交流促進の願いを胸に活躍の場を台湾に移した日本人チアダンサーが選手	None	2024-11-19 04:47:00	読売新聞オンライン
jp	https://www.sankei.com/article/20241119-4A6DITD5PFEZBGXNNH352VCJEA/	「屈辱」「暗黒期」 育成の場のはずが早期敗退で非難殺到 プレミア12・韓国野球代表 - 産経ニュース	野球の国際大会「プレミア12」で日本代表が1次リーグB組を全勝で突破し、順調に連覇に歩を進めている。一方、同組で早々に敗退が決まったのが韓国だ。過去2大会はい…	https://www.sankei.com/resizer/BeptFS0nO51grjOoH3iNZizdvfU=/1200x630/filters:focal(2230x850:2240x860):quality(50)/cloudfront-ap-northeast-1.images.arcpublishing.com/sankei/DKBSACFM2ROHZDSEAKNOEMYPCQ.jpg	2024-11-19 09:20:06	産経ニュース
jp	https://tospo-keiba.jp/breaking_news/51900	【ジャパンＣ】オーギュストロダンのエイダン・オブライエン調教師をまりえ記者が直撃 最後のレースに日本を選んだ理由 - 東スポ競馬	今年も「伝説のレース」となるのか。今週末に迫ったＧⅠジャパンカップ（２４日＝東京芝２４００メートル）は、全世界が注目するレースとなるのは間違いない。近年では日本馬が１８連勝中と、２００５年のアルカセットを	https://tospo-keiba.jp/images/article/thumbnail/20241119/131730/外面オーギュストロダン・サムネイル.jpg	2024-11-19 08:30:05	東スポ競馬
jp	https://jp.reuters.com/world/china/CXL6HPHLONKILHXH273Q5PM4II-2024-11-19/	中国の小学校前で児童らに車突入、多数負傷の報道 湖南省 - ロイター (Reuters Japan)	中国中部の湖南省にある小学校前で１９日朝、車が児童や歩行者に突っ込み、多数が負傷したと国営メディアが報じた。警察は、３９歳の男を逮捕したと明らかにしたが、事件を調査中としており、詳しいことは分かっていない。中国では、子どもが犠牲になる無差別な襲撃が相次いでおり、不安が広がっている。	https://www.reuters.com/resizer/v2/4QRY6LYJ2FPBVPSKYHNCTG4F6I.jpg?auth=9fbe2fcad3d6ecdc469b104ad1f4dffe0f02ca641fb179e01e9db62ec8e7b0d6&height=1005&width=1920&quality=80&smart=true	2024-11-19 19:19:53	ロイター (Reuters Japan)
jp	https://www.chunichi.co.jp/article/988458	豊橋の新アリーナ「建設中止なら補助金5500万円返還を」大村知事、解除手続き指示で - 中日新聞	愛知県豊橋市の多目的屋内施設（新アリーナ）建設計画を巡り、長坂尚登新市長が整備運営契約の解除手続きを指示したことを受け、大村秀章知事は...	https://static.chunichi.co.jp/image/article/size1/8/9/f/2/89f23de01d80ea34b77a68e65e1ae5ea_1.jpg	2024-11-19 10:27:20	中日新聞
jp	https://www3.nhk.or.jp/news/html/20241119/k10014643621000.html	“ウクライナ軍がATACMSでロシア西部を攻撃” ロシア国防省 - nhk.or.jp	【NHK】ロシア国防省は、ウクライナ軍がアメリカのバイデン政権からロシア領内への攻撃に使う許可を得たとされる、射程の長いミサイルA…	https://www3.nhk.or.jp/news/html/20241119/K10014643621_2411192139_1119215004_01_02.jpg	2024-11-19 18:01:26	nhk.or.jp
jp	https://www.sankei.com/article/20241119-7CUPMJBEZRKSNMLKGDP6ZDV6BU/	103万円の壁見直しに地方反発 国民民主・玉木代表「地域が元気になり税収増」 - 産経ニュース	国民民主党が主張する年収が103万円を超えると所得税が発生する「103万円の壁」の見直しを巡って、地方自治体が反発している。国民民主としては非課税枠の拡大によ…	https://www.sankei.com/resizer/WTClBQ4DmgeFYDm9DUEmZpyua5Q=/1200x630/filters:focal(2357x853:2367x863):quality(50)/cloudfront-ap-northeast-1.images.arcpublishing.com/sankei/3EKCRLPCEJLFVMYX2XFDTZMIIU.jpg	2024-11-19 10:29:06	産経ニュース
jp	https://www.sankei.com/article/20241119-VM3AWRHX5JEN5DZJL473RQKNRA/	「スマホいじっている時間じゃない。日の丸背負って歩いて」APECの首相に 中山泰秀氏 - 産経ニュース	外国首脳に座ったまま握手、会議前にスマートフォン操作、首脳勢ぞろいの記念撮影に欠席─。ペルーで開かれたアジア太平洋経済協力会議（APEC）での石破茂首相の行動…	https://www.sankei.com/resizer/t68hy4VH4fooq1d-r4YtbSPhYVU=/1200x630/smart/filters:quality(50)/cloudfront-ap-northeast-1.images.arcpublishing.com/sankei/D42YZI7QXRFZZKSE5H4P7B6INY.jpg	2024-11-19 06:23:26	産経ニュース
jp	https://www.sankei.com/article/20241119-3XSHGR5KEZN7NPWFRFNVXXOEYA/	「大阪維新の会」代表選で吉村氏が再選 新人・中野氏下す 国政代表と両立を目指す - 産経ニュース	地域政党「大阪維新の会」は19日、任期満了に伴う代表選を実施した。現職の吉村洋文大阪府知事と新人の中野宏基大阪府豊中市議が立候補し、吉村氏が再選した。吉村氏は…	https://www.sankei.com/resizer/mQ2M4snLLAJTPj1RNxQk1iXE-TU=/1200x630/smart/filters:quality(50)/cloudfront-ap-northeast-1.images.arcpublishing.com/sankei/RMDSHHL2PJIK7GLGB35JPJKWOU.jpg	2024-11-19 11:08:33	産経ニュース
jp	https://www.jiji.com/jc/article?k=2024111901034&g=pol	中国、８月の領空侵犯認める 「気流妨害で不可抗力」：時事ドットコム - 時事通信ニュース	外務、防衛両省は１９日、中国軍機による８月の長崎県男女群島沖での領空侵犯について、中国政府から「気流の妨害に遭い、不可抗力で短時間領空に入った」との説明を受けたことを明らかにした。中国側は「あくまで技術的な問題」と主張し、再発防止に努める考えを強調。日本政府は「今後の活動を注視していく」としている。	https://www.jiji.com/news2/kiji_photos/202411/20241119ds78_o.jpg	2024-11-19 11:51:00	時事通信ニュース
jp	https://jp.reuters.com/markets/japan/funds/C6SK7Z7CMJKUZM22Q225XFUZOE-2024-11-19/	トランプ氏、商務長官にラトニック氏起用 関税・暗号資産支持派 - ロイター (Reuters Japan)	トランプ次期米大統領は、商務長官に米金融サービス企業キャンター・フィッツジェラルドのハワード・ラトニック最高経営責任者（ＣＥＯ）を起用すると発表した。	None	2024-11-19 21:02:42	ロイター (Reuters Japan)
jp	https://www.yomiuri.co.jp/economy/20241119-OYT1T50110/	ソニーが買収視野に協議、ＫＡＤＯＫＡＷＡ株がストップ高…ゲームやアニメのコンテンツ充実 - 読売新聞オンライン	None	None	2024-11-19 11:27:00	読売新聞オンライン
jp	https://www3.nhk.or.jp/news/html/20241119/k10014643461000.html	日本バスケットボール協会 八村塁の発言受け真意確認へ - nhk.or.jp	【NHK】バスケットボール男子の日本代表として2大会連続でオリンピックに出場し、NBA＝アメリカプロバスケットボールでプレーする八…	https://www3.nhk.or.jp/news/html/20241119/K10014643461_2411192143_1119214445_01_02.jpg	2024-11-19 13:02:34	nhk.or.jp
jp	https://topics.smt.docomo.ne.jp/article/hochi/sports/hochi-20241119-OHT1T51151	大の里の現在地、腰が浮くと引き出しに何もない……元大関・琴風の目 - ｄメニューニュース	◆大相撲九州場所１０日目（１９日・福岡国際センター）
            　新大関・大の里が痛恨の３敗目を喫し…	https://img.topics.smt.news.goo.ne.jp/picture/hochi/m_hochi-20241119-OHT1T51151.jpg	2024-11-19 21:41:20	ｄメニューニュース
jp	https://www.soccer-king.jp/news/world/asia/20241119/1956471.html	最下位インドネシアがサウジ撃破で3位浮上！ 日本代表と勝点10差で暫定2位～5位の4チームが並ぶ大混戦 - SOCCER KING	　FIFAワールドカップ26アジア最終予選・グループC第6節が19日に行われ、インドネシア代表とサウジアラビア代表が『ゲロラ・ブン・カルノ・スタジアム／インドネ···	https://www.soccer-king.jp/wp-content/uploads/2024/11/GettyImages-2157126706.jpg	2024-11-19 14:08:09	SOCCER KING
jp	https://newsdig.tbs.co.jp/articles/-/1563155	イチロー氏「データでがんじがらめにされて感性が消えていくのが現代の野球」母校・愛工大名電に電撃訪問で“イチ流”指導 - TBS NEWS DIG Powered by JNN	イチローさん（51、マリナーズ会長付特別補佐兼インストラクター）が18日、母校である愛工大名電高校を訪れた。「想像以上にレベルが低い」母校へ厳しい印象を語ったイチローさん。データ野球が主流となってきてい…	https://newsdig.ismcdn.jp/mwimgs/3/c/1200w/img_3cc12b279745f7423d82cd8f4dc3f56e98693.jpg	2024-11-19 07:00:00	TBS NEWS DIG Powered by JNN
jp	https://www.yomiuri.co.jp/national/20241119-OYT1T50075/	「僕は今、死んでも宇宙のエネルギーと一体になれる」…谷川俊太郎さん９２歳で死去 - 読売新聞オンライン	None	None	2024-11-19 04:38:00	読売新聞オンライン
jp	https://www.bloomberg.co.jp/news/articles/2024-11-19/SN5RAPDWLU6800	農林中金、今期純損失が従来予想を上回る公算、外債処理で２兆円に拡大も - ブルームバーグ	農林中央金庫の奥和登理事長は今期（2025年３月期）純損失が従来予想の１兆5000億円程度を上回り、最大２兆円規模に拡大する可能性があるとの見通しを示した。収益性の低い外国債券の売却を加速し、将来の収益拡大を目指すためとしている。	https://assets.bwbx.io/images/users/iqjWHBFdfxIU/iWP54R1uZQoY/v0/1200x800.jpg	2024-11-19 07:06:40	ブルームバーグ
jp	https://mainichi.jp/articles/20241119/k00/00m/040/127000c	孤独の現場から：ゴミ屋敷で育った虐待サバイバー 教育機会奪われ、読み書きできず - 毎日新聞	　関東地方の私鉄駅から車で15分の住宅街にあるその一戸建ては、外壁や電線、庭に置かれた自転車と、敷地内にあるあらゆるものがツタの葉などの植物にのみ込まれていた。 　周囲には腐食したゴムの臭いが漂う。	https://cdn.mainichi.jp/vol1/2024/11/19/20241119k0000m040152000p/0c10.jpg?1	2024-11-19 21:00:00	毎日新聞
jp	https://weathernews.jp/s/topics/202411/200015/	今日20日(水)の天気予報 関東は雨で真冬のような寒さ 日本海側は天気回復 - ウェザーニュース	今日20日(水)は冬型の気圧配置が緩み、日本海側の天気は回復するところが多くなります。一方、伊豆諸島付近に低気圧が発生し、関東では曇りや雨の一日です。気温が上がらず、昼間でも真冬のような寒さとなります。	https://smtgvs.weathernews.jp/s/topics/img/202411/202411200015_top_img_A.png?1732048098	2024-11-19 20:28:00	ウェザーニュース
jp	https://www.yomiuri.co.jp/national/20241120-OYT1T50022/	北海道の大学生暴行死、交際相手「私は手を出していない」「暴行されるのを見て笑い声を上げたりあおったりしていた」 - 読売新聞オンライン	【読売新聞】　北海道江別市の文京台南町公園で大学生長谷知哉さん（２０）（千歳市）が集団暴行を受けて死亡した事件で、道警は１９日、傷害致死容疑で逮捕・送検された容疑者６人のうち、江別市のアルバイト従業員の少年（１７）と札幌市白石区の高	None	2024-11-19 22:06:00	読売新聞オンライン
jp	https://news.google.com/rss/articles/CBMiekFVX3lxTE90d2ZQbXJheWlhMVJqay1rbkhWUExmS1Nrbk9mVzg3R3dBY0ZfVlA2a0VjWlFqSUlaN01XS1lEN0RSYVA3LTA5cTdjVWRyTVYzQTlzZXk2cDladmhNNGtONnZkTGtTOUtLTG80RGN0eE4tMmVnZ3AxeVdB?oc=5	日英伊、戦闘機開発の他国への拡大を協議 一段の協力強化も確認 - ロイター (Reuters Japan)	None	None	2024-11-19 22:40:56	ロイター (Reuters Japan)
jp	https://tenki.jp/forecaster/y_nakagawa/2024/11/20/31449.html	20日 東京都心は最高気温8℃予想で真冬並み 関東は昼間も冬コート必須の寒さ(気象予報士 中川 裕美子 2024年11月20日) - tenki.jp	今日20日(水)の関東地方は昼間も気温がほとんど上がらず、寒さがさらに厳しくなります。予想最高気温は10℃前後で、東京都心は8℃と真冬並み。南部を中心に雲に覆われ、冷たい雨が降ったりやんだりしますので、ダウンコートやマフラー、手袋など、真冬と同じ装いでお出かけください。	https://storage.tenki.jp/storage/static-images/forecaster_diary/image/3/31/314/31449/ogp/20241120061628/large.jpg	2024-11-19 21:43:24	tenki.jp
jp	https://mainichi.jp/articles/20241119/k00/00m/030/279000c	プーチン氏、核ドクトリン改定に署名 非核保有国にも核反撃検討 - 毎日新聞	　ロシアのプーチン大統領は19日、「核抑止力の国家政策指針」（核ドクトリン）を改定する大統領令に署名した。非核保有国によるロシア領内への侵略であっても「核保有国の支援があれば共同攻撃とみなす」とし、核兵器での反撃を検討する内容が新たに盛り込まれた。米国がウクライナに供与した長射程ミサイルで露領内を攻	https://cdn.mainichi.jp/vol1/2024/11/19/20241119k0000m030256000p/0c10.jpg?1	2024-11-19 11:43:10	毎日新聞
jp	https://www.fnn.jp/articles/-/789668	「正義のように戻ってくるのが不思議」「立花さんの演説を肯定も否定もしなかった」兵庫県職員 百条委委員への中傷も 斎藤知事の県政運営どうなる - FNNプライムオンライン	再選を果たし、19日、県庁に初めて登庁した斎藤知事。 支援者から拍手で出迎えられた。一方で、再び共に働くことになった県職員が、斎藤知事再選へのそれぞれの思いを関西テレビの取材に明かした。19日、午前10時、兵庫県庁に集まった人々。そこに現れたのは、斎藤元彦知事。 5秒間、深々おじきをして、県民らと会話した。集まった人：兵庫県の職員のみなさん、こんなやつに負けんなよ。応援しとうからな。集まった人：頑張ってくださいね、大変でしたね。そして、選挙管理委員会から当選証書を受け取り、その後の就任式では……	https://fnn.ismcdn.jp/mwimgs/0/0/600/img_00bc0ba7679ad88833d077007ddb2bf3126130.jpg	2024-11-19 11:00:00	FNNプライムオンライン
jp	https://www3.nhk.or.jp/news/html/20241120/k10014643521000.html	石破首相 APEC首脳会議やG20サミットを終え記者会見 - nhk.or.jp	【NHK】APECの首脳会議やG20サミットに出席した石破総理大臣は、一連の日程を終えたあと訪問先のブラジルで記者会見しました。中…	https://www3.nhk.or.jp/news/html/20241120/K10014643521_2411200558_1120060425_01_02.jpg	2024-11-19 21:49:02	nhk.or.jp
jp	https://news.ntv.co.jp/category/society/9d1eb2ef20704fd88895f24d2f4d6652	「JPドラゴン」幹部ら3人逮捕 「ルフィグループ」とつながりか - 日テレNEWS	フィリピンを拠点とする日本人らの犯罪グループ、「JPドラゴン」の幹部ら3人が強制送還され、逮捕されました。幹部の男は、広域強盗事件の「ルフィグループ」とつながりがあるとみられています。	https://news.ntv.co.jp/gimage/n24/articles/f0dff4019aeb4794a48fff075068734b/20241119-171240-158-ch03-06-f5dd37e8-1.jpg?w=1200	2024-11-19 08:23:00	日テレNEWS
jp	https://www3.nhk.or.jp/news/html/20241119/k10014643401000.html	ガザ地区 支援物資輸送するトラック約100台襲撃される - nhk.or.jp	【NHK】ガザ地区などで支援活動にあたるUNRWA＝国連パレスチナ難民救済事業機関のラザリーニ事務局長は、現地で支援物資を輸送する…	https://www3.nhk.or.jp/news/html/20241119/K10014643401_2411192016_1119212726_01_02.jpg	2024-11-19 12:27:46	nhk.or.jp
jp	https://www.asahi.com/articles/ASSCM3K0HSCMUTNB00MM.html	埼玉栄の高2死亡事故 「痛恨の極み」 学校側、ずさん管理認め謝罪 [埼玉県] - 朝日新聞デジタル	None	None	2024-11-19 21:30:00	朝日新聞デジタル
jp	https://www3.nhk.or.jp/news/html/20241120/k10014643601000.html	北朝鮮兵は「10万人に増える可能性ある」 ゼレンスキー大統領 - nhk.or.jp	【NHK】ウクライナのゼレンスキー大統領は、ロシア西部に配置されている北朝鮮軍の兵士について「10万人に増える可能性がある」と述べ…	https://www3.nhk.or.jp/news/html/20241120/K10014643601_2411200425_1120045656_01_02.jpg	2024-11-19 21:51:12	nhk.or.jp
jp	https://news.google.com/rss/articles/CBMiY0FVX3lxTE9oZHR2V2J1V0FneTlPLTd1SDd6LUh1aGw4akZ3V0VvQjNVUVhlaHRvOWFGXzZ1R0MzTDhwMC1PWGtFMy1HeXFiMHFnNXhibkJjX0JiZFZKaVdsWU5JNFlfdHJ2c9IBc0FVX3lxTFB0YXZyeldkaEpGY2FSeGN4dkxJdEs0dW1vYm1WdzIwWEs5R0Zybl9IRVJXZnRDT3lnR2hZeTIxa2VIWFBwLV96b1pzRDJFdGNPSm1HdXJMTk9Fd3VXRThjNXVoaG80Qmk1cHpGUklpYUhnTEU?oc=5	国歌妨害、レーザー攻撃、乱入、ピッチ縮小…だけじゃない。日本ではあり得ない？ 中国のスタジアムで目にしたまさかの光景【現地発】 - サッカーダイジェストWeb	None	None	2024-11-19 21:52:00	サッカーダイジェストWeb
