country_code	url	title	description	image_url	publish_date	source
jp	https://www.fashionsnap.com/article/2024-10-31/shibuya-halloween-2024/	渋谷ハロウィン当日、路上飲酒禁止条例施行も街中は混雑 - FASHIONSNAP.COM	10月31日の今日、ハロウィンを迎えた渋谷の街では、多くの来街者によって駅前を中心ににぎわいを見せている。昨年、渋谷区は「渋谷はハロウィーンイベントの会場ではありません」といったスローガンとともにハロウィン目的での来街を自粛するよう要請。	https://fashionsnap-assets.com/asset/format=auto,width=1280,height=670,gravity=center/article/images/2024/10/shibuya-halloween-2024-2-010-71181f7d-f4fa-45dd-acf9-1b0b2cd0cd13.jpg	2024-10-31 10:34:07	FASHIONSNAP.COM
jp	https://www.nikkei.com/article/DGXZQOUC302TL0Q4A031C2000000/	エネチェンジ追い込んだ100人監査、あずさが抱いた疑念 - 日本経済新聞	ENECHANGE（エネチェンジ）を担当するあずさ監査法人はエネ社経営陣の「不正」を疑い、外部調査委員会の設置を求めるなど追及を徹底した。結果としてエネ社の関連費用は膨れ上がり、連結売上高40億円ほどの会社を追い込んだ。ビジネスINSIDEビジネスに関する重要ニュースの裏側を追ったルポルタージュをお届けします。あずさはまず会計処理の過程を検証する調査委の設置をエネ社に要請した。4人の委員と21	https://article-image-ix.nikkei.com/https%3A%2F%2Fimgix-proxy.n8s.jp%2FDSXZQO5559286031102024000000-1.png?crop=focalpoint&fit=crop&h=630&w=1200&s=89cf461b57e5cce40dbcb2397dc42535	2024-10-31 17:00:00	日本経済新聞
jp	https://www3.nhk.or.jp/news/html/20241101/k10014625871000.html	NY市場 ナスダック株価指数 2.7％超の大幅な下落 - nhk.or.jp	【NHK】10月31日のニューヨーク株式市場では、大手IT企業の今後の業績の伸びに対する懸念から売り注文が広がり、ハイテク関連銘柄…	https://www3.nhk.or.jp/news/html/20241101/K10014625871_2411010709_1101070946_01_02.jpg	2024-10-31 22:09:44	nhk.or.jp
jp	https://news.google.com/rss/articles/CBMiUkFVX3lxTFBaUnhNZmtMZ2MwREN0RkN0V2FuQjdPMlM2akZUU1BiVS1tM2k0dThMYnlCZ21qb2Vncm9lUDFOb2Nubks2LUlMNzJJZDNJa09HbmfSAWRBVV95cUxNRlJINzlwS0dVMHFGeVg4T1Y1cGZNRkJNY2daeVFkUWozc3pFa3lzRzVzTzEyQWhxcE0wYl9uYTdpNWhwVlA0ZG9tbmRtajVWZjdwaFNDZDE1VzkyeklXRmFmci1q?oc=5	「全日本大学駅伝」“伝説”のランナーが率いる皇學館大 地元・伊勢のゴールへ駆け抜ける - メ～テレニュース	None	None	2024-10-31 08:28:00	メ～テレニュース
jp	https://www.tokyo-np.co.jp/article/363829	東京電力・勝俣恒久元会長死去に福島の被災者「責任ないと言い続けたこと、許せない」 原発事故時の最高責任者 - 東京新聞	東京電力（現・東京電力ホールディングス）で社長、会長を歴任した勝俣恒久（かつまた・つねひさ）さんが10月21日に死去した。東電ホールデ...	https://static.tokyo-np.co.jp/image/article/size1/a/5/2/9/a5299508727ce80d09b00c94320381c2_1.jpg	2024-10-31 21:00:00	東京新聞
jp	https://www.nikkei.com/article/DGXZQOFL0110V0R01C24A1000000/	京成電鉄株5%高 イオンと相互出資好感、株式分割も発表 - 日本経済新聞	（9時40分、プライム、コード9009）京成が大幅に6日続伸している。前日比211円（5.28%）高の4203円まで上昇した。10月31日、イオン（8267）と資本提携すると発表した。同日、12月31日時点の株式1株を3株に分割することも発表しており、好感した買いを集めている。京成とイオンの両社が相互に出資する。イオンが第三者割当増資で150億円分にあたる0.46%の同社株式を京成に割り当て	https://article-image-ix.nikkei.com/https%3A%2F%2Fimgix-proxy.n8s.jp%2FDSXZQO5564372001112024000000-1.jpg?crop=focalpoint&fit=crop&h=630&w=1200&s=2239901291fa4876d3cb4e779fbbd454	2024-11-01 01:12:12	日本経済新聞
jp	https://www.bloomberg.co.jp/news/articles/2024-10-31/SM8MPPDWX2PS00	アップル、７－９月売上高は市場予想と同水準－大中華圏は依然低調 - ブルームバーグ	米アップルが10月31日に発表した７－９月（第４四半期）決算では、中国での売上高が市場予想を下回った。10－12月（第１四半期）総売上高について慎重な見通しも示し、収入の伸びや競争が激化する中国市場での販売不振に新たな懸念が浮上した。	https://assets.bwbx.io/images/users/iqjWHBFdfxIU/itDCWAaDx0q0/v1/1200x800.jpg	2024-10-31 21:07:00	ブルームバーグ
jp	https://mainichi.jp/articles/20241031/k00/00m/050/002000c	日本シリーズ取材パス没収 有識者が見る「大谷頼み」に漂う危うさ - 毎日新聞	　プロ野球の日本シリーズを巡り、主催する日本野球機構（NPB）が第1、2戦（10月26、27日）のフジテレビの取材パスを没収したことが議論を呼んでいる。専門家は、テレビ業界の「大谷翔平選手頼み」の危うさを指摘する。	https://cdn.mainichi.jp/vol1/2024/10/31/20241031k0000m050009000p/0c10.jpg?1	2024-10-30 20:30:00	毎日新聞
jp	https://www.bloomberg.co.jp/news/articles/2024-10-31/SM8O9UT0G1KW00	円は対ドルで152円ちょうど付近、日銀会合後の円買いの流れが下支え - ブルームバーグ	１日の東京外国為替市場で円相場は１ドル＝152円台前半に小幅反落。日本銀行の植田和男総裁の発言を受けた早期利上げ観測で買いが先行した後、売りに転じた。日本時間夜発表の米雇用統計や来週の米大統領選挙を前にした持ち高調整の動きとの指摘が出ている。	https://assets.bwbx.io/images/users/iqjWHBFdfxIU/i2f7NHqhxFHA/v0/1200x1823.jpg	2024-10-31 22:34:00	ブルームバーグ