country_code	url	title	description	image_url	publish_date	source
jp	https://www.jiji.com/jc/article?k=2024111000241&g=int	米大統領選、世論調査は正確だった？ 「接戦」予測もトランプ氏早々勝利 - 時事通信ニュース	【ワシントン時事】１１月５日投開票の米大統領選で、米国の主要な世論調査は、トランプ前大統領とハリス副大統領の支持率が拮抗（きっこう）していたことから「接戦」を予測していた。だが、ふたを開けてみると、トランプ氏が早々と選挙人の過半数（２７０人）を獲得して勝利。世論調査はどの程度、正確だったのだろうか。	https://www.jiji.com/news2/kiji_photos/202411/20241110at13S_o.jpg	2024-11-10 22:00:00	時事通信ニュース
jp	https://www.tokyo-np.co.jp/article/366161	荒川区長選で滝口学氏が当選、自公の推薦候補ら破る 20年ぶりに新区長が誕生 - 東京新聞	東京都荒川区長選は10日投票、11日開票され、無所属新人で元都議の滝口学氏（54）が、いずれも無所属新人で元区議の町田高氏（50）＝自...	https://static.tokyo-np.co.jp/image/article/size1/e/4/e/f/e4ef1e2d664a3e07abb72a97803eabfb_1.jpg	2024-11-11 02:15:14	東京新聞
jp	https://www.bbc.com/japanese/articles/cpqd1zg74vyo	ロシアとウクライナが互いに大規模ドローン攻撃、モスクワも標的に - BBC.com	ロシアとウクライナは9日から10日にかけて、双方の領土に対し、開戦以来最大規模のドローン（無人機）攻撃を実施した。	https://ichef.bbci.co.uk/news/1024/branded_japanese/c1fb/live/d54f3af0-9fd3-11ef-8538-e1655f5a8342.jpg	2024-11-11 03:26:22	BBC.com
jp	https://weathernews.jp/s/topics/202411/110185/	3つの台風が相次いでフィリピン方面へ 4つ目の台風発生の可能性も - ウェザーニュース	【台風情報】11月11日(月)15時現在、台風22号(インシン)が南シナ海、強い台風23号(トラジー)がルソン島、台風24号(マンニィ)がトラック諸島近海をそれぞれ西寄りに進んでいます。さらにフィリピンの東には熱帯低気圧があり、今後発達して新たな台風となる予想です。	https://smtgvs.weathernews.jp/s/topics/img/202411/202411110185_top_img_A.png?1731310840	2024-11-11 08:22:00	ウェザーニュース
jp	https://www.bloomberg.co.jp/news/articles/2024-11-11/SMREMAT1UM0W00	暗号資産業界が支援の候補者、現時点で全勝－米選挙で影響力増す - ブルームバーグ	暗号資産（仮想通貨）業界は2024年の米選挙戦で約１億3500万ドル（約207億円）を投じ、民主党員と共和党員、現職と挑戦者、本命と大穴などさまざまな候補者50人余りを支援した。	https://assets.bwbx.io/images/users/iqjWHBFdfxIU/iKcpxrR8MSR0/v0/1200x800.jpg	2024-11-11 06:15:49	ブルームバーグ
jp	https://www.as-web.jp/super-formula/1150898	2024年のスーパーフォーミュラに計20万9600人が来場。前年比127％増で過去最高を記録 - オートスポーツweb	　11月11日、全日本スーパーフォーミュラ選手権を開催する日本レースプロモーション（JRP）は、2024年のスーパーフォーミュラにシーズンを通して20万9600人が来場したことを発表した。これは2013年のシリーズ発足以来、過去最高記録となる。	https://cdn-image.as-web.jp/2024/11/11193159/asimg_MK3_1982_696731dd1e9df8e.jpg	2024-11-11 10:37:00	オートスポーツweb
jp	https://news.ksb.co.jp/article/15503009	瀬戸大橋の列車立ち往生でJR西日本岡山支社長が陳謝 応援派遣や乗客対応の遅れに「反省点」 - KSB瀬戸内海放送	　10日、瀬戸大橋でJRの列車が立ち往生し、半日にわたり運転を見合わせた問題を受けて、JR西日本岡山支社の林支社長が11日の定例会見で陳謝しました。　林支社長はJR西日本側からも応援スタッフを派遣したことや、乗客に水や軽食を提供したことな…	None	2024-11-11 09:12:00	KSB瀬戸内海放送
jp	https://tospo-keiba.jp/breaking_news/51569	【マイルＣＳ展望】初距離ブレイディヴェーグ＆外国馬チャリン参戦で大混戦 創設４１年目で初の事態も… - 東スポ競馬	ニホンピロウイナー、オグリキャップ、タイキシャトル、ダイワメジャーと歴史的な名馬が歴代勝ち馬に名を連ねるマイルＣＳ。それらの中には、スプリンタータイプや中距離型も	https://tospo-keiba.jp/images/article/thumbnail/20241111/134349/マイルＣＳ展望.jpg	2024-11-11 08:04:00	東スポ競馬
jp	https://www3.nhk.or.jp/news/html/20241111/k10014635461000.html	「ひまわり9号」トラブル半日余りで復旧 センサー温度上昇原因 - nhk.or.jp	【NHK】気象衛星「ひまわり9号」の画像の一部が、ウェブサイトなどで正常に表示できなくなるトラブルは、発生から半日余りたった午後6…	https://www3.nhk.or.jp/news/html/20241111/K10014635461_2411112149_1111220156_01_02.jpg	2024-11-11 13:03:01	nhk.or.jp
jp	https://jp.reuters.com/world/us/QM3TAZTOA5LGJEKGFUJCJTVHBA-2024-11-11/	ガザ地区で11人死亡、イスラエル軍戦車が中部難民キャンプに侵入 - ロイター (Reuters Japan)	イスラエル軍は１１日、パレスチナ自治区ガザ中部にあるヌセイラト難民キャンプの西側に戦車を展開し、新たな侵攻を開始した。パレスチナの医療関係者は、イスラエル軍の攻撃により１０日夜から少なくとも１１人が死亡したと明らかにした。	https://www.reuters.com/resizer/v2/P7KW4W2Y4FJ47BWAMA3LOU2QYY.jpg?auth=55a029edd189d08e3a442f532a6763790f4030b0ca4a221766617d0961367624&height=1005&width=1920&quality=80&smart=true	2024-11-11 11:55:19	ロイター (Reuters Japan)
jp	https://www.sankei.com/article/20241111-47PQYEWH2FL7ZNWDOQWNOHC2BM/?outputType=theme_uspe	トランプ氏、戦争悪化させないようプーチン氏に忠告 7日に電話会談 米紙報道 - 産経ニュース	【ワシントン＝坂本一之、本間英士】米紙ワシントン・ポスト（電子版）は10日、トランプ次期大統領がロシアのプーチン大統領と7日に電話会談し、ロシアが侵略を続ける…	https://www.sankei.com/resizer/2e2CI3Kx5Gu860A-kIjRbMehaak=/1200x630/smart/filters:quality(50)/cloudfront-ap-northeast-1.images.arcpublishing.com/sankei/NKVSNLETI5BDFP4FIER3U37H7Q.jpg	2024-11-10 22:51:44	産経ニュース
jp	https://mainichi.jp/articles/20241111/k00/00m/010/255000c	国民・玉木代表、続投の見通し 党内で「けじめ」意見も 不倫報道 - 毎日新聞	　国民民主党の玉木雄一郎代表は11日、知人女性と不倫していたとする週刊誌報道に関し、国会内で記者会見し「おおむね事実だ」と認めて謝罪した。自らの進退について「仲間の意見を聞く」としたが、その後の両院議員総会で代表辞任を求める意見は出ず、続投する見通しとなった。衆参両院で同日行われた首相指名選挙でも、	https://cdn.mainichi.jp/vol1/2024/11/11/20241111k0000m010256000p/0c10.jpg?1	2024-11-11 11:35:55	毎日新聞
jp	https://jp.reuters.com/world/us/3ME7KPXPLRJ27I4VC7EJMXPDAA-2024-11-11/	トランプ氏となるべく早く直接会談する機会もちたい＝石破首相 - ロイター (Reuters Japan)	第２次石破内閣を発足した石破茂首相は１１日夜の記者会見で、日米関係の強化に向け米国のトランプ次期大統領と「なるべく早いタイミングで直接会談する機会をもちたい」と述べた。大統領選中のトランプ氏の発言を詳細に分析し、日米両国の国益に資する提案をしていきたいとも語った。	https://www.reuters.com/resizer/v2/TUETAOVASFPZTLYBOQ6CDOGRQY.jpg?auth=e43c085895911811eba44a00f6cf426c4ab107c7c003b57f3e6f1b28e5dda7a3&height=1005&width=1920&quality=80&smart=true	2024-11-11 13:31:40	ロイター (Reuters Japan)
jp	https://mainichi.jp/articles/20241110/k00/00m/010/177000c	自民、不記載額返還求め寄付検討 裏金議員に「けじめ」要求 - 毎日新聞	　自民党は政治資金パーティー裏金事件を巡る「けじめ」として、政治資金収支報告書への不記載があった「裏金議員」に対し不記載額の返金を求め、党が国庫などに不記載相当額を寄付する検討に入った。複数の政権幹部が10日明らかにした。	https://cdn.mainichi.jp/vol1/2024/05/14/20240514k0000m010127000p/0c10.jpg?1	2024-11-10 11:24:20	毎日新聞
jp	https://jp.reuters.com/markets/commodities/GOLNJJGJN5LJDMIIV7GZHN3HI4-2024-11-11/	ＣＯＰ２９開幕、トランプ氏勝利が関心事 「間違いなくリスク」 - ロイター (Reuters Japan)	アゼルバイジャンの首都バクーで１１日、第２９回国連気候変動枠組み条約締約国会議（ＣＯＰ２９）が２週間の日程で開幕する。米大統領選で気候変動否定論者のトランプ氏が勝利したことに各国の関心が集まっている。	https://www.reuters.com/resizer/v2/43362FA7XBJFBLSGIHP4SHHNNE.jpg?auth=5c6cdc974e2938f88684ae03ba33c6a880c93140ae7fd5e159fb2db5c8311738&height=1005&width=1920&quality=80&smart=true	2024-11-11 07:19:00	ロイター (Reuters Japan)
jp	https://www3.nhk.or.jp/news/html/20241111/k10014635361000.html	衆議院 正副議長と参議院議長が就任会見 - nhk.or.jp	【NHK】11日の衆議院本会議で選出され、引き続き務めることになった額賀衆議院議長は記者会見で、先の衆議院選挙で与野党の勢力が変わ…	https://www3.nhk.or.jp/news/html/20241111/K10014635361_2411111954_1111202329_01_02.jpg	2024-11-11 11:24:56	nhk.or.jp
jp	https://tenki.jp/forecaster/keiko_mochizuki/2024/11/11/31336.html	11日月曜 予想最高気温 東京は1週間ぶり20℃以上 名古屋は最も遅い「夏日」か(気象予報士 望月 圭子 2024年11月11日) - tenki.jp	11日月曜の最高気温は、東京では1週間ぶりに20℃以上、名古屋では統計開始以来最も遅い「夏日」になりそうです。北海道の釧路では、すでに11月中旬としては、9年ぶりに15℃以上となっていますが、夜は朝よりグッと冷えますので、気温の変化に注意が必要です。全国的に、昼間は、晩秋らしくない気温が続きます。服装選びにお気をつけください。	https://storage.tenki.jp/storage/static-images/forecaster_diary/image/3/31/313/31336/main/20241111111936/large.jpg	2024-11-11 03:03:05	tenki.jp
jp	https://web.gekisaka.jp/news/japan/detail/?418816-418816-fl	深夜のジャカルタ空港で取材殺到した長友佑都「ハリウッドスターになった気分」 - ゲキサカ	　日本代表のDF長友佑都(FC東京)がジャカルタ入りした11日の練習後、報道陣の取材に応じ、インドネシアのサッカー人気を驚きまじりに語った。　長友にとってインドネシアでのアウェーゲームは「初めて」。東南ア...	https://f.image.geki.jp/data/image/news/2560/419000/418816/news_418816_1.jpg?time=20241111221603	2024-11-11 13:16:00	ゲキサカ
jp	https://www3.nhk.or.jp/news/html/20241111/k10014635501000.html	中国 広東省 車が大勢の人はねる 運転していた62歳の男を拘束 - nhk.or.jp	【NHK】中国の警察当局によりますと、南部・広東省珠海にある運動施設で、現地時間の11日夜8時前、車が大勢の人を次々とはねたという…	https://www3.nhk.or.jp/news/html/20241111/K10014635501_2411112310_1111235511_01_02.jpg	2024-11-11 14:55:09	nhk.or.jp
jp	https://www3.nhk.or.jp/news/html/20241111/k10014635311000.html	鹿児島市 車が歩道に突っ込み5人搬送 1人死亡 - nhk.or.jp	【NHK】11日夕方、鹿児島市の県道で乗用車が道路脇の歩道に突っ込み、複数の歩行者が巻き込まれた事故で、警察によりますと、現場から…	https://www3.nhk.or.jp/news/html/20241111/K10014635311_2411111846_1111184852_01_02.jpg	2024-11-11 12:52:30	nhk.or.jp
jp	https://news.golfdigest.co.jp/news/jgto/article/174410/1/	「ごまかし」に限界を感じた20代 石川遼が“ほぼ直ドラ”で証明した進化 - ゴルフダイジェスト・オンライン	◇国内男子◇三井住友VISA太平洋マスターズ 最終日（10日）◇太平洋クラブ御殿場コース（静岡）◇7262yd（パー70）◇曇り（観衆8549人） 優勝争いの最終日、石川遼は朝の練習場で “直ドラ”を何球も打っていた。ティショットの落としどころがタイトな6、9番で使うショットの調整だ。「直ドラって“当て感”が良くないと難しい。ここで必要な直ドラを使えるくらい	https://i.gimg.jp/cmsimg/371281.jpg	2024-11-11 08:30:00	ゴルフダイジェスト・オンライン
jp	https://mainichi.jp/articles/20241111/k00/00m/010/293000c	吉村洋文氏が日本維新の会代表選に出馬へ 意向固める - 毎日新聞	　日本維新の会の代表選（17日告示、12月1日投開票）に、吉村洋文共同代表（49）＝大阪府知事＝が立候補する意向を固めたことが11日、党関係者への取材で明らかになった。吉村氏は一部議員から出馬要請を受けていた。	https://cdn.mainichi.jp/vol1/2024/11/11/20241111k0000m010302000p/0c10.jpg?1	2024-11-11 15:41:50	毎日新聞
jp	https://jp.reuters.com/world/taiwan/UL3NTPB2VRK65IZYFC4BD2F6JM-2024-11-11/	ヒズボラのポケベル一斉爆発、台湾企業の関与なし＝検察 - ロイター (Reuters Japan)	台湾検察当局は１１日、レバノンのイスラム教シーア派組織ヒズボラの戦闘員が保有していたポケベルが９月に一斉爆発し多数の死傷者が出た事件について、台湾の市民や企業は一切関与していなかったとの最終捜査結果を発表した。	https://www.reuters.com/resizer/v2/QQNJVJDNMRKKNGZBOBQ7B5UV4Q.jpg?auth=2392b9211da985ed08f58ab5e3024f0afb72c28c4dcabca73fae6a9f501309ca&height=1005&width=1920&quality=80&smart=true	2024-11-11 09:46:36	ロイター (Reuters Japan)
jp	https://www.sankei.com/article/20241111-VDBUJKFS4FNJHLDWB3YWBKJBSY/	ドンファン元妻が法廷で不満あらわ 「アンフェア」「この国のマスコミどうかしてる」 紀州のドンファン公判 被告人質問詳報 - 産経ニュース	「紀州のドン・ファン」と呼ばれた和歌山県田辺市の資産家、野崎幸助さん＝当時（77）＝に致死量の覚醒剤を飲ませて殺害したとして殺人罪などに問われた元妻、須藤早貴…	https://www.sankei.com/resizer/oAUB6M-FDBipQ79LAuZPFtr7S9E=/1200x630/filters:focal(890x405:900x415):quality(50)/cloudfront-ap-northeast-1.images.arcpublishing.com/sankei/7Z4HI3II25LV7LXP2PN4KQVPCY.jpg	2024-11-11 12:10:00	産経ニュース
jp	https://www.yomiuri.co.jp/national/20241111-OYT1T50181/	「エンジンルームから火災、至急救助を」…木製の掃海艇「うくしま」燃料に引火し沈没か - 読売新聞オンライン	None	None	2024-11-11 13:30:00	読売新聞オンライン
jp	https://www.itmedia.co.jp/news/articles/2411/11/news132.html	これが闇バイト募集の手口──犯罪コミュニティーの“誘い方”、NTTコムが実際の文面付きで注意喚起 - ITmedia NEWS	犯罪者のコミュニティーは、どんな誘い方で特殊詐欺や“闇バイト”のメンバーを集めているのか──NTTコミュニケーションズが自社の技術ブログで公開した、こんな記事がはてなブックマークなどで注目を浴びている。	https://image.itmedia.co.jp/news/articles/2411/11/cover_news132.jpg	2024-11-11 05:22:00	ITmedia NEWS
jp	https://www.okinawatimes.co.jp/articles/-/1469383	玉城デニー知事「通常生活に早く戻れるようしっかり取り組みたい」 大雨で沖縄北部が甚大な被害 副知事が現地視察へ - 沖縄タイムス	　沖縄本島北部地方で降り続いた大雨により甚大な被害が出ていることを受けて、玉城デニー知事は１１日、「通常の生活に早く戻れるようわれわれもしっかり取り組みたい」と述べた。県庁で記者の質問に答えた。　同日の午前に県庁内で会議を開き、災害の状況を共有する。その後、池田竹州副知事が現地を視察する。	https://oki.ismcdn.jp/mwimgs/c/d/1200wm/img_cd4b8956d2330ded33247f56e0265828138141.jpg	2024-11-11 00:51:00	沖縄タイムス
jp	https://www3.nhk.or.jp/news/html/20241111/k10014635161000.html	教員の処遇改善どうなる？文部科学省と財務省の方針なぜ違う？ - nhk.or.jp	【NHK】深刻な教員不足が叫ばれるなか、処遇の改善に向けて出された文部科学省と財務省の方針。2つの方針はどう違い、現場の先生たちは…	https://www3.nhk.or.jp/news/html/20241111/K10014635161_2411111821_1111182447_01_02.jpg	2024-11-11 10:07:45	nhk.or.jp
jp	https://www.jiji.com/jc/article?k=2024111100181&g=int	ロ・北朝鮮兵、数日中に攻勢か クルスク奪還で５万人集結―米紙 - 時事通信ニュース	【ニューヨーク時事】米紙ニューヨーク・タイムズ（電子版）は１０日、ロシアが西部クルスク州で大規模攻勢に出るために、北朝鮮兵を含む５万人の兵士を集結させたと報じた。作戦は数日中に始まる可能性があるという。ウクライナと米国の当局者の話として伝えた。	https://www.jiji.com/news2/kiji_photos/202411/20241111ds46_o.jpg	2024-11-10 23:06:00	時事通信ニュース
jp	https://www.yomiuri.co.jp/sports/soccer/ws/20241111-OYT1T50166/	ＭＦ鎌田大地、人種差別行為を受ける…タックルで退場となったホームのフラム戦 - 読売新聞オンライン	【読売新聞】　イングランド・プレミアリーグ、クリスタルパレスは１０日、所属する日本代表ＭＦ鎌田大地が９日のホームでのフラム戦で人種差別行為を受けたとの報告があったと発表した。 犯人が特定された場合はできる限り厳しい対応を取るという。	https://www.yomiuri.co.jp/media/2024/11/20241111-OYT1I50130-1.jpg?type=ogp	2024-11-11 10:53:00	読売新聞オンライン
jp	https://news.golfdigest.co.jp/news/winnersbag/jlpga/article/174426/1/	「ミスが少なくなるパター」でパット数1位 山内日菜子の優勝ギア - ゴルフダイジェスト・オンライン	◇国内女子◇伊藤園レディスゴルフトーナメント 最終日（10日）◇グレートアイランドC (千葉)◇6769yd（パー72）◇曇り（観衆4151人） 1打差4位から出た山内日菜子が5バーディ「67」でプレーし、通算14アンダーで今季初優勝を挙げた。 クラブはジュニア時代から愛用するテーラーメイドでそろえる。9月「ゴルフ5レディス」からは父・克則さんのアドバイスを	https://i.gimg.jp/cmsimg/371387.jpg	2024-11-11 07:02:57	ゴルフダイジェスト・オンライン
jp	https://www3.nhk.or.jp/news/html/20241112/k10014635581000.html	「石破首相 かぜ気味だが健康状態に問題ない」林官房長官 - nhk.or.jp	【NHK】林官房長官は、石破総理大臣が衆議院本会議でしばらく目を閉じてうつむく様子が見られたことについて、かぜ気味でかぜ薬を服用し…	https://www3.nhk.or.jp/news/html/20241112/K10014635581_2411120121_1112014334_01_02.jpg	2024-11-11 16:44:37	nhk.or.jp
jp	https://mainichi.jp/articles/20241111/k00/00m/040/273000c	大阪・マンションで女性を刺殺容疑 元夫を逮捕 事件後に入院 - 毎日新聞	　大阪市東住吉区湯里6のマンションで10日夜、女性が男性に刺殺された事件で、大阪府警は11日、女性の元夫の橋野忠司容疑者（51）＝大阪府松原市＝を殺人容疑で逮捕した。容疑者は現場から逃走していたが、事件後に大量の薬を服用したとみられ、病院に搬送されていたことが判明。回復を待って事情を聴いていた。	https://cdn.mainichi.jp/vol1/2020/03/08/20200308k0000m040076000p/0c10.jpg?3	2024-11-11 12:47:49	毎日新聞
jp	https://jp.reuters.com/world/us/5NSQ723Q45PODOCV6ABGQZ7HCI-2024-11-11/	トランプ氏、移民税関捜査局の元幹部を「国境管理責任者」に任命へ - ロイター (Reuters Japan)	トランプ次期米大統領は１０日、トム・ホーマン元移民・税関捜査局（ＩＣＥ）局長代行を新政権の「国境管理責任者」に起用する考えを示した。	https://www.reuters.com/resizer/v2/GAURXUP3DFMOFKXIXIJSFTXPWE.jpg?auth=3c51e408f3a4e2322d7d0144d557de58be099707519dca71243ba02115d4a13c&height=1005&width=1920&quality=80&smart=true	2024-11-11 05:26:00	ロイター (Reuters Japan)
jp	https://news.google.com/rss/articles/CCAiCzVvb04wXzhkaWswmAEB?oc=5	季節外れの暖かさ 夏日予想の日も - ウェザーニュース	None	None	2024-11-11 10:38:03	ウェザーニュース
jp	https://www.kobe-np.co.jp/news/society/202411/0018329763.shtml	兵庫県知事選、期日前投票33万人超 前回の1.5倍 過去最多7人立候補で関心高まったか|社会 - 神戸新聞NEXT	　兵庫県選挙管理委員会は１１日、県知事選（１７日投開票）の告示翌日から１０日間（１～１０日）の期日前投票者数が３３万３６９４人だったと発表した。選挙人名簿登録者数に占める割合は７・４０％。２０２１年の前回選の同期間で投票した人数は２２万８４３２人（４・９６％）で、１・５倍に増えた。過去最多の７人が立候補した知事選で関心が高まったとみられる。	https://i.kobe-np.co.jp/news/society/202411/img/a_18329764.jpg	2024-11-11 08:25:00	神戸新聞NEXT
jp	https://www.sankei.com/article/20241111-EXV7EHXG6VAKLG4POZFN2FPFFE/	＜速報＞第2次石破内閣の顔ぶれ 国交相に中野洋昌氏、法務に鈴木馨祐氏、農水に江藤拓氏 - 産経ニュース	石破茂首相は11日、内閣改造で斉藤鉄夫国土交通相の後任に、公明党の中野洋昌元経済産業政務官の起用を決めた。また、衆院選で落選した牧原秀樹法相と小里泰弘農水相の…	https://www.sankei.com/resizer/oft9vM6UwuS15u9KUnq50xgY0UQ=/1200x630/filters:focal(2582x651:2592x661):quality(50)/cloudfront-ap-northeast-1.images.arcpublishing.com/sankei/HBM4YPQJVBLRZABEUDZZIPATH4.jpg	2024-11-11 08:58:37	産経ニュース
jp	https://www3.nhk.or.jp/news/html/20241111/k10014634881000.html	初当選議員らが初登院 午前2時から開門待つ人も 議員20人の声 - nhk.or.jp	【NHK】先の衆議院選挙を受けた第215特別国会が11月11日に召集され、国会議事堂には朝の開門と同時に、初めて当選した議員らが、…	https://www3.nhk.or.jp/news/html/20241111/K10014634881_2411111246_1111125709_01_02.jpg	2024-11-11 05:56:12	nhk.or.jp
jp	https://www.jiji.com/jc/article?k=2024111100836&g=int	尹大統領、ゴルフ練習開始 トランプ氏と信頼構築へ―韓国 - 時事通信ニュース	【ソウル時事】「大のゴルフ好き」として知られるトランプ次期米大統領との信頼構築に向け、韓国の尹錫悦大統領が最近、ゴルフの練習を始めた。大統領府関係者が１１日明らかにした。韓国メディアによると、尹氏がクラブを握るのは２０１６年以来で約８年ぶり。周辺からトランプ氏との「ゴルフ外交」の準備をするよう助言を受けた。	https://www.jiji.com/news2/kiji_photos/202411/20241111at60S_o.jpg	2024-11-11 08:09:00	時事通信ニュース
jp	https://www.nikkei.com/article/DGXZQOUA115JH0R11C24A1000000/	半導体・AI支援に10兆円、ラピダス念頭 石破首相が表明 - 日本経済新聞	石破茂首相は11日夜の記者会見で、2030年度に向け、半導体や人工知能（AI）分野に複数年度で10兆円以上の公的支援をする方針を明らかにした。11月にまとめる経済対策に盛り込む。次世代半導体の量産を目指すラピダスなどを念頭に置く。石破首相は「今後10年間で50兆円を超える官民投資を引き出すための新たな支援フレームを策定する」と表明した。補助金のほか、政府機関を通じた出資や民間の金融機関からの融	https://article-image-ix.nikkei.com/https%3A%2F%2Fimgix-proxy.n8s.jp%2FDSXZQO5606280011112024000000-1.jpg?crop=focalpoint&fit=crop&h=630&w=1200&s=562baeb89d641666744fdf15398a74f3	2024-11-11 14:17:00	日本経済新聞
jp	https://news.google.com/rss/articles/CBMidkFVX3lxTE9pTTUteHhEd2VjaGFLWkotcVRuUnVEcGxDQzdkOHNNMU1hWV9OSkhReHFKcDRfU2ZLeUxaSlppWjBPcWl5WGxJbEF6ZmhfVmFSSngxa3l2RUZDVjZxOVUxRmxDUXpJT1Z0Tm9LMlpfQ0VJSUlPVEE?oc=5	トランプ政策の持続的な恩恵受ける銘柄見極めへ－混迷深まる業種も - ブルームバーグ	米大統領選におけるトランプ氏の圧倒的な勝利を受けて当初はリスクオンムードが広がり、米国株は急上昇したが、投資家にとってはこれからが正念場となる。	https://assets.bwbx.io/images/users/iqjWHBFdfxIU/iU4M88dIHYJ4/v1/1200x800.jpg	2024-11-10 23:37:00	ブルームバーグ
