country_code	url	title	description	image_url	publish_date	source
kr	https://www.hani.co.kr/arti/society/environment/1166238.html	겨울 시작되는 ‘입동’…일교차 15도 내외로 커 - 한겨레	겨울의 시작을 알리는 입동인 7일 목요일 전국은 대체로 맑을 것으로 보이나 강원 영동과 경상권 동해안은 대체로 흐릴 예정이다. 낮과 밤의 기온 차가 내륙을 중심으로 15도 내외로 클 예정이다. 이날 기상청은 “아침 기온은 전국 대부분 지역에서 5도 내외, 중부 내륙과	https://flexible.img.hani.co.kr/flexible/normal/970/582/imgdb/child/2024/1107/53_17309385498084_1617303556008091.jpg	2024-11-06 23:38:00	한겨레
kr	https://news.google.com/rss/articles/CCAiC2RPa1ZId1RFYWFzmAEB?oc=5	술주정 같은 윤석열 기자회견 지켜본 용혜인 반응....“탄핵합시다” - 팩트TV NEWS	None	None	2024-11-07 06:34:50	팩트TV NEWS
kr	https://www.hani.co.kr/arti/society/labor/1166354.html	양대노총·5개 야당, ‘노란봉투법’ 재추진…핵심 입법과제 발표 - 한겨레	양대노총과 5개 야당 의원들이 모여 이른바 ‘노란봉투법’을 포함해 핵심입법과제를 내놓고 연내 입법을 추진키로 했다. 양경수 민주노총 위원장과 김동명 한국노총 위원장을 비롯해 더불어민주당 등 5개 야당 의원 13명은 7일 국회 소통관에서 기자회견을 열어 올해 정기국회에서	https://flexible.img.hani.co.kr/flexible/normal/498/332/imgdb/original/2024/1107/20241107503476.jpg	2024-11-07 07:41:00	한겨레
kr	https://www.khan.co.kr/politics/politics-general/article/202411070600035	‘딥페이크’ 성인 피해 때도 위장수사 가능 - 경향신문	‘딥페이크’ 성범죄에 대한 위장수사 범위가 아동·청소년 피해자에서 성인 피해자로 확대된다. 텔레그램 등 국내외 플랫폼 사업자들도 딥페이크 성범죄 영상물 유통을 방치하면 과징금을 내야 한다. 국무조정실은 6일 정부서울청사에서 이 같은 내용 등을 담아 딥페이크 성범죄 대응 강화 방안을 발표했다. 정부는 딥페이크 성범죄 근절을 위해 강력하고 실효적인 처벌,...	https://img.khan.co.kr/news/2024/11/07/l_2024110701000184100016021.jpg	2024-11-06 21:00:00	경향신문
kr	https://news.google.com/rss/articles/CCAiC2lXVnp6RENQT1FNmAEB?oc=5	[현장영상] 충격 CCTV…중3이 76세 때려 결국 사망 / 채널A - 채널A News	None	None	2024-11-07 06:45:28	채널A News
kr	http://www.whosaeng.com/156361	최광훈 “비대면 약 배달 저지” - 후생신보	【후생신보】 6일 예비후보 등록을 마친 최광훈 예비후보는 7일 첫 유세지역으로 강남구를 방문해 비대면 약배달 저지 의지를 명확히 했다.   강남구	https://f.xza.co.kr/https://www.whosaeng.com/data/whosaeng_com/mainimages/202411/115003_2024110749596052.jpg	2024-11-07 02:49:00	후생신보
kr	https://www.khan.co.kr/national/national-general/article/202411071028001	상급병원 구조전환 사업에 13곳 추가 선정··· 전체 47곳 중 31곳 참여 - 경향신문	상급종합병원을 중증 환자 진료 중심으로 재편하는 정부의 구조전환 지원 대상으로 의료기관 13곳이 추가됐다. 총 선정 기관은 31곳으로 전체 상급종합병원의 65% 가량이 참여하게 됐다. 7일 박민수 보건복지부 2차관은 중앙재난안전대책본부(중대본) 회의에서 상급종합병원 구조전환 지원사업 3차 선정평가 결과를 공개했다. 이 사업은 상급종합병원이 본래 취지에...	https://img.khan.co.kr/news/2024/11/07/news-p.v1.20241107.88271583816046abb4b54f4bcf74a4b4_P1.jpg	2024-11-07 01:28:00	경향신문
kr	https://www.hani.co.kr/arti/area/capital/1166247.html	음주 뺑소니 대학생에 ‘출근길 참변’…사망사고 낸 뒤 “집에서 마셔” - 한겨레	새벽녁 음주운전 뺑소니 사고를 낸 뒤 증거 인멸까지 시도한 20대 대학생이 구속됐다. 전기 자전거를 타고 사업장으로 출근하던 30대 피해자는 해당 음주 차량에 치어 숨졌다. 경기 성남수정경찰서는 특정범죄가중처벌법상 도주치사 등 혐의로 ㄱ(21)씨를 구속했다고 7일 밝혔	https://flexible.img.hani.co.kr/flexible/normal/658/394/imgdb/original/2024/1107/20241107500545.jpg	2024-11-07 02:24:00	한겨레
kr	https://imnews.imbc.com/replay/2024/nwdesk/article/6654044_36515.html	돌아온 '동맹 경시' 트럼프 외교‥바이든 따르던 한국 외교는 어디로? - MBC 뉴스	 트럼프 2기 행정부 출범을 앞두고 우리 정부의 대외기조에도 변화가 불가피하다는 지적이 나옵니다. 당장 우크라이나 전쟁과 관련한 대응부터 시험대에 오를 것으로 보입니다....	https://image.imnews.imbc.com/replay/2024/nwdesk/article/__icsFiles/afieldfile/2024/11/07/desk_20241107_203328_1_17_Large_u.jpg	2024-11-07 11:34:53	MBC 뉴스
kr	https://www.mk.co.kr/news/society/11162156	안샀는데 ‘[국제발신] 결제금액 530,300원’ 문자…전 국민에 28억번 보냈다 - 매일경제	경찰, 문자 발송 업체 6곳 적발 일당 20명 검거…3곳 대표 구속 1인당 피싱문자 50번씩 수신한 셈 건당 14~20원씩 수익 챙겨	https://pimg.mk.co.kr/news/cms/202411/07/news-p.v1.20241107.d948c4b2f52a4a6c8682d80d8b787216_R.png	2024-11-07 05:37:01	매일경제
kr	https://www.medipana.com/article/view.php?news_idx=333559	[한미 Q&A] "외부 투자로 빠른 글로벌화, 상속세 해결 필요" - 메디파나 뉴스	[메디파나뉴스 = 이정수 기자] 한미사이언스가 발표한 '중장기 성장 전략'이 외부 투자 유치를 통한 글로벌화와 기업 가치 제고, 오너가 상속세 해결 등으로 이어질 전망이다. 한미사이언스는 7일 여의도 글래드 호텔에서 중장기 성장 전략 발표와 관련한 기자회견을 열고 질의…	https://www.medipana.com/upload/data/photo_direct/202411/20241107205519_0E55A.jpg	2024-11-07 11:33:00	메디파나 뉴스
kr	https://imnews.imbc.com/news/2024/politics/article/6653883_36431.html	윤 대통령 "북한 관여 따라 우크라 방어무기 지원 우선 고려" - MBC 뉴스	윤석열 대통령은 우크라이나 무기 지원 가능성에 대해 "북한군의 관여 정도에 따라 무기 지원도 배제하지 않을 것"이라며, "하게 된다면 방어 무기부터 지원할 것"이라고 밝혔습니다. ...	https://image.imnews.imbc.com/news/2024/politics/article/__icsFiles/afieldfile/2024/11/07/joo241107_17.jpg	2024-11-07 02:47:58	MBC 뉴스
kr	https://news.google.com/rss/articles/CCAiC0E5WlpQaDFOYXRNmAEB?oc=5	[핫라인] 이재명, 2차 장외집회 참여 독려··· 한동훈, "李 죄질 나빠... 재판 생중계해야" - 뉴스TVCHOSUN	None	None	2024-11-07 06:15:02	뉴스TVCHOSUN
kr	https://imnews.imbc.com/news/2024/society/article/6653616_36438.html	검찰, 송영길 징역 9년 구형‥"무슨 증거가 있나" 반발 - MBC 뉴스	검찰이 더불어민주당 전당대회 돈봉투 살포 의혹에 개입한 혐의를 받는 소나무당 송영길 대표에게 징역 9년을 선고해달라고 재판부에 요청했습니다. 송 대표는 민주당 전당대회에 출마했던 ...	https://image.imnews.imbc.com/news/2024/society/article/__icsFiles/afieldfile/2024/11/06/joo241106_vo9.jpg	2024-11-06 08:29:38	MBC 뉴스
kr	https://www.chosun.com/national/court_law/2024/11/06/QKCNLVBVOJEV5KCB7NWWWCFPXI/	13시간 조사 마친 강혜경 “세비 9000만원 전달 혐의, 인정했다” - 조선일보	13시간 조사 마친 강혜경 세비 9000만원 전달 혐의, 인정했다 6일 조사 마친 뒤 입장 밝혀	https://www.chosun.com/resizer/v2/DKULGQITJJJ37EODTCKZQURUOA.JPG?auth=a0b4b6395e928cf7583f29000f01ef72c747909b6321e7f0c69e1963ab491f9b&width=1200&height=630&smart=true	2024-11-06 14:25:28	조선일보
kr	https://www.voakorea.com/a/7855095.html	[지구촌 오늘] 카멀라 해리스 선거 패배 승복...미 연방 법무부, 트럼프 당선인 형사 기소 종료 검토 중 - VOA Korea	None	None	2024-11-07 14:12:35	VOA Korea
kr	https://www.donga.com/news/Inter/article/all/20241107/130380839/2	“두려운 시대로 복귀”…해리스 지지했던 美 스타들 실망 - 동아일보	미국 대선에서 도널드 트럼프 전 대통령의 당선이 확정되자, 민주당 후보인 카멀라 해리스 부통령을 지지해온 유명 팝스타들이 실망감을 드러냈다. 해리스 부통령에 대한 지지를 공개적으…	https://dimg.donga.com/wps/NEWS/IMAGE/2024/11/07/130380833.3.png	2024-11-07 02:35:00	동아일보
kr	https://www.yonhapnewstv.co.kr/news/MYH20241106017500032	유죄 평결·암살 시도 뚫고…'트럼피즘' 화려한 부활 - 연합뉴스TV	유죄 평결&middot;암살 시도 뚫고&hellip;'트럼피즘' 화려한 부활<br>
[뉴스리뷰]<br>
<br>
[앵커]<br>
<br>
도널드 트럼프 대통령 당선인은 재	https://d2k5miyk6y5zf0.cloudfront.net/article/MYH/20241106/MYH20241106017500032.jpg	2024-11-06 12:10:12	연합뉴스TV
kr	https://www.hani.co.kr/arti/international/international_general/1166293.html	돌아온 트럼프, 중국에 거친 압박 카드…미·중 관계 격랑 예고 - 한겨레	‘미국을 다시 위대하게 만들자’는 구호를 내걸고 새 대통령에 당선된 도널드 트럼프 전 대통령은 전략 경쟁 중인 중국에 대해 거친 압박을 공약했다. 4년간 와신상담한 트럼프 전 대통령을 다시 대면하게 된 중국은 말을 아낀 채 전열을 정비하는 모양새다. 트럼프 전 대통령은	https://flexible.img.hani.co.kr/flexible/normal/808/538/imgdb/original/2024/1107/20241107501732.jpg	2024-11-07 11:16:00	한겨레
kr	https://imnews.imbc.com/replay/2024/nwdesk/article/6654034_36515.html	국정 지지율 또 19% 최저치 경신‥"지지율 올리는 '꼼수' 모른다" - MBC 뉴스	 4개 여론조사기관이 실시한 여론조사에서 윤석열 대통령에 대한 국정 지지율이 19%로, 해당 조사 역대 최저치를 기록했습니다. 사실상 국정 동력이 마비된 상황인데요. 윤...	https://image.imnews.imbc.com/replay/2024/nwdesk/article/__icsFiles/afieldfile/2024/11/07/desk_20241107_201633_1_11_Large.jpg	2024-11-07 11:17:42	MBC 뉴스
kr	https://www.khan.co.kr/world/america/article/202411070913001	[트럼프 2기] 미국 역사상 첫 ‘중범죄 대통령’···“트럼프, 모든 재판서 해방될 것” - 경향신문	트럼프 전 미국 대통령이 6일(현지시간) 재집권에 성공하면서 그는 ‘형사재판에서 유죄를 인정 받은 첫 미국 대통령’이란 역사를 새로 쓰게 됐다. 미국의 역대 전현직 대통령 가운데 처음으로 4차례 기소됐던 그는 재집권으로 자신을 둘러싼 사법 리스크를 모두 털어낼 것으로 보인다. 트럼프 당선인은 2020년 대선 패배를 뒤집기 위해 압력을 행사한 혐의를 받...	https://img.khan.co.kr/news/2024/11/07/news-p.v1.20241107.4a4276cd68994be9bbd40413166884a8_P1.jpg	2024-11-07 00:13:00	경향신문
kr	http://www.hitnews.co.kr/news/articleView.html?idxno=58873	리가켐바이오, 국제 ADC 어워드서 ADC 플랫폼 부문 '최고상' - 히트뉴스	리가켐바이오사이언스(대표 김용주, 리가켐바이오)는 미국 샌디에이고에서 진행된 제11회 국제 항체약물접합체(ADC) 어워드에서 '최고 ADC 플랫폼 기술(Best ADC Platform Technology)' 부문 최고상인 위너(WINNER)에 선정됐다고 7일 밝혔다.리가켐바이오는 2018년부터 해당 부문에서 6회 연속 수상하는 최초의 기록을 달성했으며, 2021년과 2023년에 이어 3회 연속 최고상에 선정됐다.이번 ADC 어워드의 최고 ADC 플랫폼 기술 부문에는 리가켐바이오의 '콘쥬올(ConjuAll)'을 비롯해 다이이찌산쿄(D	https://cdn.hitnews.co.kr/news/thumbnail/202411/58873_79659_5646_v150.jpg	2024-11-07 05:04:02	히트뉴스
kr	https://www.ytn.co.kr/_ln/0115_202411070533368738	'조폭' 출신(?), 전과 17범...5·18 부상자회장의 민낯 - YTN	YTN은 어제(6일) 공법단체 5·18 부상자회 조규연 회장의 허위 학력과 5·18 당시 행적을 둘러싼 의혹을 보도해드렸습니다.폭력조직 연루 의혹까지 제기된 조 회장은 확인된...	https://image.ytn.co.kr/general/jpg/2024/1107/202411070533368738_t.jpg	2024-11-06 20:33:00	YTN
kr	https://www.chosun.com/international/international_general/2024/11/07/SLVOPG3ZMBBTHNAATWDFQHO3NI/	﻿‘은둔의 영부인’ 멜라니아, 트럼프와 함께 백악관으로 돌아갈까? - 조선일보	﻿은둔의 영부인 멜라니아, 트럼프와 함께 백악관으로 돌아갈까	https://www.chosun.com/resizer/v2/PEQNBT6ZVRJURIBDCSEBXSQKSM.JPG?auth=f51c886f782aef4bd4b9ce0d4b04498a53bfcb86537e1b561cccf056d703e47c&width=1200&height=630&smart=true	2024-11-06 22:39:00	조선일보
kr	https://www.donga.com/news/Politics/article/all/20241107/130383163/1	친한 “안 하느니만 못한 회견” 野 “아무 말 대잔치” - 동아일보	“기대에 못 미친, 안하느니만 못한 회견이었다”국민의힘 지도부 핵심 관계자는 윤석열 대통령의 7일 대국민 담화 및 기자회견 뒤 윤 대통령과 김건희 여사 공천 개입 의혹에 대한 해…	https://dimg.donga.com/wps/NEWS/IMAGE/2024/11/07/130382736.1.jpg	2024-11-07 08:16:00	동아일보
kr	https://www.hani.co.kr/arti/society/society_general/1166318.html	시민단체, 윤 부부 경찰 고발…“공천 개입, 당선 무효 마땅 범죄” - 한겨레	시민단체가 윤석열 대통령 부부의 국민의힘 공천 개입 의혹과 관련해 윤 대통령과 김건희 여사, 김영선 전 의원 등을 경찰에 고발했다. 이미 윤 대통령 부부는 공직선거법 위반 혐의로 검찰 고발된 바 있는데, 이번 시민단체들은 검찰을 믿을 수 없어 경찰 고발을 택했다고 밝혔	https://flexible.img.hani.co.kr/flexible/normal/640/430/imgdb/original/2024/1107/20241107502490.jpg	2024-11-07 05:45:00	한겨레
kr	https://www.donga.com/news/Opinion/article/all/20241107/130386536/2	[사설]표류하는 ‘4대 개혁’에 대한 안일한 인식 - 동아일보	윤석열 대통령은 7일 대국민 담화에서 “의료 연금 노동 교육 개혁은 민생과 직결된 과제이고 우리의 미래를 지키는 일”이라며 개혁 완수의 의지를 재확인했다. 하지만 4대 개혁의 잘…	None	2024-11-07 14:27:00	동아일보
kr	https://www.hani.co.kr/arti/area/gangwon/1166384.html	여성 군무원 살해·주검훼손 장교, 신상공개 결정에 ‘이의 신청’ - 한겨레	경찰이 같은 부대에서 근무하던 여성 군무원을 살해한 뒤 주검을 훼손하고 북한강에 유기한 현역 군 장교에 대해 신상공개를 결정했다. 하지만 피의자 ㄱ(38)씨가 이의신청을 하면서 즉시 공개에는 제동이 걸렸다. 강원경찰청은 7일 “피의자의 신상정보 공개를 의결한 신상정보공	https://flexible.img.hani.co.kr/flexible/normal/640/426/imgdb/original/2024/1107/20241107503743.jpg	2024-11-07 13:10:00	한겨레
kr	https://news.google.com/rss/articles/CBMiaEFVX3lxTE1ZNy1zUzZxZjUtZnlKdEZRbmE4UERvM1JMRnc0Q3RmVWdvY3d4cFdXakttREVfRlVSX2JDcXFfS2hmWE1GRGpITERDcXBCYXp0Njh5WVFMdU1IU28zUjVnYkh3SFBQWUZr?oc=5	아직 젊어서 안심? 2030 당뇨병관리 ‘낙제점’ - 헬스경향	당뇨병의 발병연령이 낮아지고 있지만 2030 청년당뇨병환자의 인지율과 치료율은 노년층에 비해 매우 낮은 것으로 나타났다. 특히 당뇨병 치료율은 34.6%에 불과해 청년층 당뇨병 인식 개선을 위한 적극적인 노력이 필요할 것으로 보인다.대한당뇨병학회는 ‘국내 노인당뇨병과 청년당뇨병 현황’을 분석한 결과 이같은 점을 확인했다고 밝혔다.이번 분석은 2019~2022년 국가 건강검진을 받은 19세 이상 성인을 대상으로 진행됐다. 이 중 19~39세 청년당뇨병환자는 약 30만명이었다.분석결과 청년당뇨병환자 약 30만명 중 당뇨병인지율(의사로부	None	2024-11-07 11:52:43	헬스경향
kr	https://www.hani.co.kr/arti/politics/politics_general/1166367.html	윤, 외신기자 한국어 질문에 “말귀 못 알아듣겠다”…“무례” 비판 - 한겨레	7일 용산 대통령실에서 열린 대국민 담화·기자회견에서 서투르나마 한국말로 질문을 했다가 윤석열 대통령으로부터 “말귀를 못 알아듣겠다”는 말을 들은 외신 기자 쪽이 “(질문을) 열심히 준비했다”며 아쉬움을 드러냈다. 미국의 북한 전문매체 엔케이(NK) 뉴스 김정민 기자는	https://flexible.img.hani.co.kr/flexible/normal/758/425/imgdb/original/2024/1107/20241107503625.jpg	2024-11-07 13:09:00	한겨레
kr	https://www.pharmnews.com/news/articleView.html?idxno=253309	[경기] 한일권 “경기도형 약사 참여 통합돌봄 모델 만들겠다” - 팜뉴스	경기도약사회장 출마를 밝힌 한일권 후보는 지난 5일 경기도 시흥시 회원약국을 방문했다. 시흥시는 경기도에서 선도적으로 방문약료 시범사업을 시작한 곳이다. 초고령화사회 만성질환자의 증가로 지역사회 돌봄과 의약품안전사용에 대한 요구가 증가하고 있다.약사회의 노력으로 ‘의료.요양 등 지역 돌봄의 통합지원에 관한법률’이 통과되어 약사가 약국을 넘어 지역사회 곳곳에서 약물관리 서비스를 할 수 있는 법적 기반이 마련되었다. 또한 지역약국 약사에게는 “통합약물관리 전문약사”라는 전문약사제도 시행이 눈앞에 다가오고 있다.그동안 경기도약사회는 가장	https://cdn.pharmnews.com/news/thumbnail/202411/253309_131351_392_v150.jpg	2024-11-06 04:39:44	팜뉴스
kr	https://www.khan.co.kr/local/Daejeon/article/202411071319001	충남대 교수들도 시국선언 “대통령 즉각 하야해야” - 경향신문	충남대 교수들이 7일 ‘윤석열 대통령 하야’를 요구하는 시국선언문을 발표했다. 대통령 퇴진을 요구하는 대학 교수들의 시국선언이 전국으로 확대되는 분위기다. 충남대 교수 80명은 이날 시국선언을 통해 “역대 최악의 대통령 지지율이 증명하듯 윤석열 정권은 내치, 외치의 국정운영 모든 측면에서 낙제점을 받았다”며 “우리는 무도·무능하며, 반민주적·반인권적·...	https://img.khan.co.kr/news/2024/11/07/news-p.v1.20241107.a2dc0492356b4b029ce4634b2cd4c650_P1.png	2024-11-07 04:19:00	경향신문
kr	https://www.voakorea.com/a/7855181.html	‘쿠르스크 배치 북한군’ 추정 새 영상 공개 - VOA Korea	러시아 남서부 쿠르스크주에 북한군 1만여 명이 배치됐다고 미국 정부가 밝힌 가운데, 이들의 모습으로 추정되는 새로운 영상이 나왔습니다.	https://gdb.voanews.com/34566d5a-d906-48c6-8fd3-a430e6f1e08b_cx0_cy6_cw0_w1200_r1.jpg	2024-11-07 09:19:06	VOA Korea
kr	https://imnews.imbc.com/news/2024/politics/article/6653797_36431.html	윤 대통령 담화 앞두고 이재명 주말 집회 참여 독려 - MBC 뉴스	윤석열 대통령이 오늘 담화에서 김건희 여사 문제에 대해 입장을 밝힐 예정인 가운데, 더불어민주당 이재명 대표는 김 여사 특검을 요구하는 주말 집회 참여를 독려했습니다. 이 대표는 ...	https://image.imnews.imbc.com/news/2024/politics/article/__icsFiles/afieldfile/2024/11/07/jsh241107_27.jpg	2024-11-07 00:22:35	MBC 뉴스
kr	https://www.hani.co.kr/arti/international/america/1166308.html	트럼프, 10주간 참모진 밑그림 그린다…“충성도 중점 평가” - 한겨레	도널드 트럼프 전 미국 대통령의 대선 승리로, 그의 백악관 복귀 길을 함께 할 핵심 참모진이 누구로 채워질지에 관심이 쏠리고 있다. 월스트리트저널은 6일(현지시각) 트럼프와 정권 인수팀을 총괄하는 하워드 루트닉이 고위급 후보자들의 명단을 작성하고 있으며 취임식(2025	https://flexible.img.hani.co.kr/flexible/normal/640/426/imgdb/original/2024/1107/20241107502187.jpg	2024-11-07 11:09:00	한겨레
kr	https://news.google.com/rss/articles/CBMif0FVX3lxTE5qcWZHRE5ISkl4WkFRSnZjOGg0bkpDUlZiT0RobFFCd0k1cTUwZzlQYURsbV9rVUhVdzlFc21NaW44ZjJod2RRRlZtdDc4aDJIZk5WRHhBUXVDUTR0SjU5SkhGOUF1V2l1a0FSTnJTelN0R0hrNWtEb0s5Q2d4blU?oc=5	미국 대선 결과에 따른 세제 변화 및 국내기업에 미치는 영향 : 삼일회계법인 - PwC	None	None	2024-11-07 13:52:18	PwC
kr	https://www.voakorea.com/a/7854908.html	트럼프 당선인-윤석열 대통령 “좋은 협력 기대”…이른 시일 내 회동 합의 - VOA Korea	None	None	2024-11-07 11:19:24	VOA Korea
kr	https://imnews.imbc.com/news/2024/society/article/6653792_36438.html	'강남역 역주행' 무면허 20대 검찰 구속 송치‥"죄송합니다" - MBC 뉴스	서울 강남에서 차량 7대를 들이받은 20대 무면허 운전자가 사고 닷새 만에 구속 상태로 검찰에 넘겨졌습니다. 서울 강남경찰서는 특정범죄 가중처벌법상 도주치상, 도로교통법상 무면허운...	https://image.imnews.imbc.com/news/2024/society/article/__icsFiles/afieldfile/2024/11/07/joo241107_4.jpg	2024-11-07 00:14:01	MBC 뉴스
kr	https://www.chosun.com/international/international_general/2024/11/07/56ZU7VFAKZDNZGXFLJ2IVGFBFY/	1500㎞ 떨어진 러 해군기지에 ‘펑’... 우크라, 드론으로 첫 공격 - 조선일보	1500㎞ 떨어진 러 해군기지에 펑... 우크라, 드론으로 첫 공격	https://www.chosun.com/resizer/v2/UBBEFMBHMRAJLOXIUKUUOFMZKQ.gif?auth=88488aa3226009dedf53c6feb55953c56612d3bc567eb54205c9029bc0e78966&width=786&height=412&smart=true	2024-11-07 07:31:00	조선일보
kr	https://news.google.com/rss/articles/CBMiakFVX3lxTE9mQXBLYW4xbWowTjM3UDl6d2JDV2tBcEFDVlp0Ny1jYW9LaVlCRzZBOXQtZll5eFVYRHM3UW93YlBucE1UVURmU3lHTEhvc2RXajhfd2tOdF9fVjljeXhCSnFRWmxnZlBmSFE?oc=5	윤, 국회연설 불참 이유로 “대통령 망신주기, 정치를 죽여” 야당 탓 - 한겨레	None	None	2024-11-07 14:39:00	한겨레
kr	https://news.google.com/rss/articles/CBMifkFVX3lxTE9lOEhvVUo3WlRJd2M3VDBQcVJDbkVfZEFqeXhuczNjazgwVXFETVRhc2MzdDZQM0NwTnJtSWJ4QXhrNjVrVGdHeHVTblotM0NDSUNVT0drQkxJYzE4ZmhPdjk2VWFvZFd0dHZwaGd0emVvR1VpZ3ZNZVFkYzZJZw?oc=5	드레스 입은 신부, 성난 ‘등근육’ 화제…“부부싸움 못 하겠다” - 이데일리	최근 중국의 한 결혼식에서 등근육을 뽐내는 신부의 사진이 화제를 모으고 있다.지난 5일(현지 시각) 베트남 매체 ‘docnhanh’는 “웨딩 드레스를 입은 신부의 선명한 등근육이 누리꾼들의 눈길을 사로잡았다”고 보도했다.사진=docnhanh공개된 사진에는 등이 파인 ...	https://image.edaily.co.kr/images/Photo/files/NP/S/2024/11/PS24110701308.jpg	2024-11-07 03:58:12	이데일리
kr	https://news.google.com/rss/articles/CBMid0FVX3lxTFBIdlBOclMtVDZkR0k3QXJnQi1DR2hFaHJ5ajg0SzJDck1YWUs0bGJsZ1FWQVExbC14TDJSVEZGSnRxYXM4d0hnSjItdW5RMy1VLVppdm5ETTdyRVpBMmp4UmRvV3BhcGsyTG4tOHpOZUdfcEJ3N29J0gF3QVVfeXFMT2NDVkxjNzZNc2lqNGhtQjNUcHM2aDhMQVI4Y1VBMi11Q2hUZW5BckpUNVRhckZyUmZ2TGNxOWJSUlJNSDgwbV8zZEpRY3YzZDlVM05iZUcxdnc3MzJFWEZzR0lUT0laLW5kMUt3a3g0QlN6bWhmcUk?oc=5	[단독] 검찰, '용인 아파트 전단지 사건' 혐의없음 처분‥"증거 불충분" - MBC 뉴스	None	None	2024-11-07 09:10:34	MBC 뉴스
kr	https://news.google.com/rss/articles/CBMikAFBVV95cUxOa0ZQSXgtdi1EQ25VYldWU1dILWV6b25UTXJtUEhOaG12b2FTd0hzNWxJVGtBaEJ6cFJUWnEzY3hVVWxETk0yaFoyaFlscWg0OXpGaUtjWmVocmtEeVY5MDdocmNuZzhDS3FCRmdqUXdzQjN6d1BGVldZRXVLcGhheWZLM3YyLTlGV0tIeENaV3XSAaQBQVVfeXFMTUJ0cHlaYktLMGFON3N2dFZyZG1GX0RHcUt0RzloZWI2emgzazhmdDlpNFJ2M0Qxem5rRVh6VWdva01kM0FUQ2dYeG5SMlNQR0l5bjhlU21LdHpKWjRpNUx6UklqRG8tUHdtMUlWLWJDM09HalQ2UzhmdEd0UjQ4bUozak1FemE4ZHJyLWJMblZqX1hFUjZlNHJYMFZTU1RDWHNmSzA?oc=5	“트럼프, 재선하면 태권도복 입고 연설 약속” 막내아들과 한국 깜짝인연 - 조선일보	None	None	2024-11-07 01:24:00	조선일보
kr	https://news.google.com/rss/articles/CBMieEFVX3lxTFB0YWVFQWc5RHhkUk90eHlaekhLaHFsdUpMaHlOSnlyQkdOb3h2bXFLN29FbDA3RkVEWENXQ1lsNUdMLUJUSlBURXdzT0d1SEwydEczalJoQzRCWGVvbFMyZi1rRDFtSDFNckpyZk15UUExQWZJRWd6TdIBeEFVX3lxTE1vMmxWUndQbng5YmFpREMxRGlnOE9KSnh1TVJ1MUdKMkdxem1pVVN6ODJfTFZuSTBLWTZ5b1E5eWdBVk00aGJyUjVlVlo1S2p5SWZXSVNtSXl1bUxSVjZ3S2NIdjg4b08yXzlLY2dSUW51cTRBa3F4TQ?oc=5	트럼프 발벗고 돕더니‥하룻밤 만에 20조 번 머스크 - MBC 뉴스	None	None	2024-11-07 11:40:21	MBC 뉴스
kr	https://news.google.com/rss/articles/CBMiUkFVX3lxTE9aZENBZUd4Uzhpcm5ZTFREWmZGamVfNmVKSnFsR3pYMFc4M0RENGtkLU1pcVhKaGVQREpKeWhZdnBRbGJnWENkbHAzS0huXzRobkE?oc=5	“불장 제대로 섰다”…트럼프 백악관 컴백에 천장까지 뚫은 이것 - 매일경제	美 SEC 규제완화 기대감에 비트코인 테마주·알트코인 쑥 ‘머스크 후광’ 도지코인도 주목  업비트 거래대금 4배나 급증 두나무·빗썸도 주가 ‘콧노래’	None	2024-11-07 10:24:38	매일경제
kr	https://news.google.com/rss/articles/CBMingFBVV95cUxPbUlvNEdPQjY3YTRRTjNLYTVybVU5cHJMeFFqMVV4dXRwT2MycTRKdmd5RzF3LVNGdEtpV1hZVnRxR1liNy1meUVGQ1J4SEJqWnhvOE9tSldRVEZ2V0l0QUtzMC1RS2Y5SElMUW9kXzd5ODNkLXVadmJZY3pZX05xbVd4V0d5SkR3UnFJZEhzUkEwQk82MGtvSURpNHF0UdIBsgFBVV95cUxOOWxyOVdzZy03Z1V6UFl4OVQ5akRNbGNvY3Vsd0lHb09USk5nQTlaVnEzcGYteHdEV1l2dE9TT1ZxWl84N191emt5WmkxbXhnbkc3eHlqM1NiOHdEdFBEYk83UmhwMjhJVkhDcDUwN21sTUJITVNWRFZIeTZ1RTNRNTZGRkZZZHlGSmFENU56QWJ5N0dhcnZMRktnT1FvR2lQZGpDVS1HSFdwRlEwTGYyWHJn?oc=5	﻿서울서 태어난 ‘순자씨’, 美 연방 하원의원 3선 성공 - 조선일보	None	None	2024-11-07 04:20:57	조선일보
