country_code	url	title	description	image_url	publish_date	source
kr	http://www.docdocdoc.co.kr/news/articleView.html?idxno=3022342	개원가 학술대회 참석자 절반이 전공의…“이대로면 계속 악화” - 청년의사	의대 증원 사태가 길어지면서 개원가 학술대회를 찾는 사직 전공의들이 늘고 있다. 임상 술기를 배우기 위해서다. 대한신경외과의사회 추계학술대회에는 참석자 절반이 사직 전공의들이었다.신경외과의사회는 27일 서울 광진구 세종대 광개토관 컨벤션홀에서 제38차 추계 학술대회를 개최했다. 이날 학술대회 참석자 500여명 중 250여명이 사직 전공의였다. 신경외과의사회는 사전 등록한 전공의만 240명으로, 예년보다 2배 이상이었다며 “이례적”이라고 했다.신경외과의사회 차원에서 수련을 중단한 전공의들에게 ‘배움의 기회’를 주기 위해 신경 쓰기도	https://cdn.docdocdoc.co.kr/news/thumbnail/202410/3022342_3024980_510_v150.jpg	2024-10-27 21:04:54	청년의사
kr	https://www.hani.co.kr/arti/politics/politics_general/1164736.html	‘우크라에 군 참관단’ 파문…여 “국회 동의 불필요” 야 “전쟁놀이냐” - 한겨레	정부가 북한군 러시아 파병이 구체화되면 우크라이나 현지에 참관단을 보낼 뜻을 내비치자 야당은 “전쟁놀이라도 하는 것이냐”고 반발했다. 정부는 참관단 같은 ‘개별 단위 파병’은 국회의 동의가 필요 없다는 입장이다. 더불어민주당은 러시아 파병 북한군의 철군을 요구하는 결의	https://flexible.img.hani.co.kr/flexible/normal/640/416/imgdb/original/2024/1028/20241028503453.jpg	2024-10-28 15:47:00	한겨레
kr	https://news.google.com/rss/articles/CCAiC2dRTkVXWmpyQndvmAEB?oc=5	[현장영상] "대기업 직장인들도 적으로 돌리나" 천하람, 국감서 이 말 꺼낸 이유 / JTBC News - JTBC News	None	None	2024-10-28 05:56:44	JTBC News
kr	https://www.ytn.co.kr/_ln/0101_202410281121463169	윤 대통령, '행정관 집단행동' 움직임에 "절제와 품격을 가지고 움직일 필요 있어" - YTN	윤석열 대통령이 최근 대통령실 일부 행정관들이 국민의힘 한동훈 대표에 반발해 집단적으로 목소리를 내려고 한 것과 관련해, 절제와 품격을 갖춰 움직일 필요가 있다며 ...	https://www.ytn.co.kr/img/comm/ytn_sns_default.jpg	2024-10-28 02:21:00	YTN
kr	https://www.dailymedi.com/news/news_view.php?wr_id=917884	동아쏘시오홀딩스·HK이노엔 'A→A+ 등급' - 데일리메디	﻿﻿﻿동아쏘시오홀딩스와 HK이노엔이 한국ESG기준원(KCGS)의 2024년 ESG 평가에서 종합 A+등급을 받았다. 제약·바이오 기업 중 A+등급을 받은 곳은 두 곳 뿐이다.반면 광동제약, 제일약품은 지난해 C등급, 동성제약은 D등급을 받았지만 올해도 개선에 실패했다.한국ESG기준원은 25일 2024년 ESG 평가 결과를 공개했다.한국ESG기준원은 국내 대표 ESG 평가기관으로 매년 국내 상장회사를 대상으로 환경ㆍ사회ㆍ지배구조 부문의 지속가능경영 수준을 평가해 ESG 등급을 발표하고 있다.ESG 등급은 S(탁월)부터 A+(매우 우수…	https://www.dailymedi.com/data/news_cont/2410/d20241028_3660030767_tWUC0lo2_a49ea7cc01f418b23d8d18e630bb1ac89a6861f7.jpg	2024-10-28 20:13:00	데일리메디
kr	https://www.hani.co.kr/arti/society/environment/1164765.html	아침 최저 8도, 낮엔 최고 23도 따뜻한 가을…제주 가끔 비 - 한겨레	29일 낮 최고기온이 23도까지 올라 온화한 가을 날씨가 이어지는 가운데 제주도를 중심으로 비가 예보됐다. 기상청은 이날 전국이 대체로 흐린 가운데 평년(최저 2∼12도, 최고 16∼20도)보다 기온이 높은 날씨가 이어질 것으로 전망했다. 아침 최저기온은 8∼16도,	https://flexible.img.hani.co.kr/flexible/normal/970/596/imgdb/original/2024/1029/20241029500216.jpg	2024-10-28 23:20:00	한겨레
kr	https://www.donga.com/news/Economy/article/all/20241029/130313909/2	30조 세수 펑크 때우려… ‘외환 방파제’ 또 허문다 - 동아일보	2년 연속 세수 펑크가 확실시되자 정부가 ‘외환 방파제’를 허물고 청약통장 가입자들이 낸 돈까지 끌어와 빈 곳간을 메우기로 했다. 지방정부에 나눠 주는 돈 역시 삭감하고 예정된 …	https://dimg.donga.com/wps/NEWS/IMAGE/2024/10/29/130309632.13.jpg	2024-10-28 18:00:00	동아일보
kr	https://www.khan.co.kr/politics/politics-general/article/202410290818001	총선백서 본 장예찬 “살모사 시간 끝나면 책임 묻겠다” 한동훈에 공세 - 경향신문	장예찬 전 국민의힘 최고위원은 지난 28일 공개된 국민의힘 총선백서에 “공관위는 공천 당시 두 후보를 긍정적으로 평가했다”고 한 구절을 두고 “배은망덕한 살모사의 시간이 끝나...	https://img.khan.co.kr/news/2024/10/29/news-p.v1.20240421.72f1859ae1554f669beb93dda9c77091_P1.jpg	2024-10-28 23:18:00	경향신문
kr	https://www.voakorea.com/a/7841985.html	이란 방공망, 이스라엘의 족집게 타격에 ‘무용지물’...‘핵개발’ 우려 - VOA Korea	None	None	2024-10-28 15:58:09	VOA Korea
kr	https://www.hani.co.kr/arti/society/health/1164785.html	국민 48% “내년도 의대 증원 유지해야”…39% “철회해야” - 한겨레	국민 10명 중 6명은 의대 증원에 찬성하고, 약 절반은 내년도 의대 정원 증원(1509명)을 정해진 대로 추진해야 한다고 생각하는 것으로 조사됐다. 대한뇌전증센터학회는 지난 18∼21일 리얼미터를 통해 전국 2000명을 설문해 이런 결과가 나타났다고 29일 밝혔다.	https://flexible.img.hani.co.kr/flexible/normal/640/399/imgdb/original/2024/1029/20241029500974.jpg	2024-10-29 01:42:00	한겨레
kr	https://www.donga.com/news/Opinion/article/all/20241028/130312730/2	[사설]비자금 파문-민생 실패로 12년 만에 막내린 日 자민당 독주 - 동아일보	이시바 시게루 일본 총리가 이끄는 집권 자민당이 27일 치러진 중의원(하원) 선거에서 참패했다. 2012년 이후 4차례 선거에서 모두 단독 과반 의석을 차지했지만, 이번엔 연립정…	https://dimg.donga.com/wps/NEWS/IMAGE/2024/10/28/130313676.1.jpg	2024-10-28 14:30:00	동아일보
kr	https://imnews.imbc.com/replay/2024/nwtoday/article/6650379_36523.html	[와글와글] 소녀상에 '쪽' 민폐 유튜버‥'퍽' 행인에 폭행당해 - MBC 뉴스	평화의 소녀상에 뽀뽀하고 편의점에서 난동을 부리는 등 한국에서 민폐 행동을 일삼아 논란이 된 미국인 유튜버 소식, 지난주 전해드렸는데요. 이 유튜버가 행인에게 폭행당하는 일이 벌어...	https://image.imnews.imbc.com/replay/2024/nwtoday/article/__icsFiles/afieldfile/2024/10/28/today_20241028_063714_2_5_Large.jpg	2024-10-27 21:37:45	MBC 뉴스
kr	https://imnews.imbc.com/news/2024/society/article/6650867_36438.html	술 취한 후배 검사 추행한 여검사‥법무부 징계 결과 봤더니 - MBC 뉴스	회식 중에 후배 남성 검사를 추행한 여성 검사가 정직 처분을 받았습니다. 관보에 따르면 법무부는 '술에 취해 부적절한 신체 접촉을 했다'는 혐의로 부산지검 소속 A 검사에게 지난 ...	https://image.imnews.imbc.com/news/2024/society/article/__icsFiles/afieldfile/2024/10/29/joo241029_vo1.jpg	2024-10-29 02:39:30	MBC 뉴스
kr	https://www.chosun.com/national/national_general/2024/10/29/RMHAFBWBQBAFXMBXKS24IZ3VDY/	“테슬라 뺨치는 투자”… 함평 ‘황금박쥐상’ 몸값 10배 상승 눈앞 - 조선일보	테슬라 뺨치는 투자 함평 황금박쥐상 몸값 10배 상승 눈앞	https://www.chosun.com/resizer/v2/QYNINNXOHVPJDNJO5A327AYAU4.jpg?auth=ca47e6fdb14b2584654bdc5df836738acc1a94bdf5788193423db865303c1838&width=1200&height=630&smart=true	2024-10-28 15:54:00	조선일보
kr	https://www.hankookilbo.com/News/Read/A2024102816330003972	"저 집 수상해, 캐리어가 들락날락~"… '문다혜 사례'로 본 불법 공유숙박 실태는 - 한국일보	28일 오후 3시 서울 마포구의 한 빌라촌. 조용하던 동네 곳곳에서 여행가방(캐리어) 바퀴가 아스팔트를 긁는  '드르륵 돌돌돌' 소음이 들렸다	https://newsimg-hams.hankookilbo.com/2024/10/28/1dde8a61-2896-4e53-9958-5b79ba7d7407.jpg	2024-10-28 19:30:00	한국일보
kr	https://news.google.com/rss/articles/CBMidEFVX3lxTFBycUdFTHpsQ252Ull1MjRhekVqX0VXbGJoRzhvcUtVaWNMd041YlNhSzMzbElNd0V1MVQ1c1RsSC1adzQ5Z0EydnpRc244VWFVclRBaF92Y1JxMmNaM2hfTXVGWVlfUTRLd2lETFFkLTFtWWk1?oc=5	이태원 2주기, 이재명 “성역 없는 진상 규명” 한동훈 “제도 정비를” - 한겨레	이태원 참사 2주기를 맞은 29일 정치권에서도 애도의 목소리가 쏟아졌다. 이재명 더불어민주당 대표는 “성역 없는 진상 규명에 앞장서겠다”고 했고, 한동훈 국민의힘 대표는 “참사가 재발하지 않도록 법과 제도를 정비해야 한다”고 밝혔다. 이 대표는 이날 페이스북에 올린 글	None	2024-10-29 03:37:00	한겨레
kr	https://www.yna.co.kr/view/AKR20241029092500001	국정원 "러 파병 북한군 고위급 장성 등 일부 전선 이동 가능성" - 연합뉴스	(서울=연합뉴스) 홍지인 김철선 기자 = 국가정보원은 29일 러시아에 파병된 북한군 중 고위급 장성 등을 포함한 일부 병력이 전선으로 이동했을 ...	https://img9.yna.co.kr/etc/inner/KR/2024/10/29/AKR20241029092500001_01_i_P4.jpg	2024-10-29 04:44:07	연합뉴스
kr	https://www.khan.co.kr/politics/politics-general/article/202410290600021	[단독]명태균 “윤 총장 전화, 궁금해해”···대선 경선 때도 보고 정황 - 경향신문	윤석열 대통령 부부 공천개입 의혹 핵심인물인 명태균씨가 2021년 9월 여론조사 보고서를 독촉하며 “윤 총장 전화했는데 궁금해하더라”라고 말한 사실이 28일 확인됐다. ‘윤 총장’은 검찰총장이었던 윤석열 대통령을 말한 것으로 보인다. 명씨가 국민의힘의 대선 경선 기간에도 미공표 여론조사와 관련해 윤 대통령을 언급한 사실이 드러난 것은 처음이다. 명씨가...	https://img.khan.co.kr/news/2024/10/29/news-p.v1.20241026.06e8fb0bce45467eb65a3a119348aeb8_P1.jpg	2024-10-28 21:00:00	경향신문
kr	https://www.hani.co.kr/arti/international/america/1164752.html	미 국방부 “북한군 1만명 러시아 파병…미 무기 사용 제한 안 해” - 한겨레	북한군 병력 약 1만명이 러시아로 파병됐다고 미국 국방부가 밝혔다. 사브리나 싱 미국 국방부 부대변인은 28일 브리핑에서 “우리는 북한이 병사 약 1만명을 훈련을 받게 하려고 러시아 동부로 보냈다고 본다”며 “이는 아마도 앞으로 몇 주 동안 우크라이나 근처의 러시아군을	https://flexible.img.hani.co.kr/flexible/normal/750/450/imgdb/original/2024/1025/20241025502550.jpg	2024-10-28 23:41:00	한겨레
kr	https://www.hani.co.kr/arti/politics/politics_general/1164739.html	[단독] 공천 8일 전 명태균 “김 여사님 선물…알려지면 뒤집어져” - 한겨레	‘김건희 여사 공천 개입 의혹’의 핵심 인물인 명태균씨가 2022년 6월 경남 창원의창 국회의원 보궐선거 국민의힘 공천 발표를 약 일주일 앞두고 “여사가 ‘김영선 (공천) 걱정하지 마라. 자기 선물’이라고 했다”고 말한 사실이 확인됐다. 김영선 전 의원 공천과 관련해	https://flexible.img.hani.co.kr/flexible/normal/757/504/imgdb/original/2024/1028/20241028503475.jpg	2024-10-29 03:41:00	한겨레
kr	https://www.donga.com/news/Politics/article/all/20241029/130316167/1	南은 우크라, 北은 러시아로…한반도서 옮겨간 남북 외교전 - 동아일보	북한군 파병 사태 대응을 위한 정부대표단이 우크라이나에 들어가 전황과 북한군 이동 현황을 파악할 예정이다. 북한의 최선희 외무상은 전날 긴급하게 러시아로 향했다. 북한군의 러시아…	https://dimg.donga.com/wps/NEWS/IMAGE/2024/10/29/130316656.1.jpg	2024-10-29 02:37:00	동아일보
kr	http://www.docdocdoc.co.kr/news/articleView.html?idxno=3022399	윤석열 대통령 “의료개혁 시급…전공의 의존 관행 뿌리 뽑아야” - 청년의사	의대 증원 사태가 8개월 넘게 이어지고 있지만 윤석열 대통령은 의료개혁을 "시급한 과제"로 꼽으며 추진 의지를 재확인했다. 특히 상급종합병원 구조 전환 필요성을 강조했으며 올해 안에 실손보험 개선안을 마련하라고 소관 부처에 지시했다. 윤 대통령은 29일 국무회의 모두발언에서 “사회 전반의 구조개혁 없이는 민생도 없고 국가의 미래도 없다. 남은 두 달 정부는 무엇보다 4대 개혁에 집중해야 한다”며 “가장 시급한 과제는 의료개혁”이라고 말했다.윤 대통령은 “다가오는 겨울철에 대비해 환자 진료에 차질이 없도록 의료체계를 빈틈없이 유지해야	https://cdn.docdocdoc.co.kr/news/thumbnail/202410/3022399_3025041_2635_v150.jpg	2024-10-29 03:35:15	청년의사
kr	https://www.khan.co.kr/politics/politics-general/article/202410291130001	나경원·오세훈 등 중진들 “윤 대통령이 결자해지 하라” 공개 요구 - 경향신문	김기현, 나경원, 오세훈 등 국민의힘 소속 중진들이 최근 제기되는 대통령실 관련 각종 의혹에 대해 “윤석열 대통령이 결자해지하라”며 요구하고 나섰다. 김 의원 등은 29일 오전 서울시내 한 식당에서 조찬모임을 갖고 입장문을 발표했다. 이날 모임에는 권영세·김기현·나경원 의원, 박형준 부산시장, 오세훈 서울시장 등 5명이 참석했다. 입장문에서 이들은 “...	https://img.khan.co.kr/news/2024/10/29/news-p.v1.20241029.3af8ee77aba24b6e84b10ad639febaed_P1.jpg	2024-10-29 02:30:00	경향신문
kr	https://news.google.com/rss/articles/CBMid0FVX3lxTE9pU2lBWnlfNVZpd2U3Ykswenc0VEZ0d0YxZ2t6WkhGdFNTLVNqaW5DN1hNUkN0NEJsM2pWVUlZazZPMmdFLTFCT0dVZ213QUJpV3NQSDdZM1M3S25KRDFuY1h1TVBJV25ZNG1UbHAzVm9IVk9IcXZ30gF3QVVfeXFMT1UwUDRMS0NyNjdJQWNnZHNwRGdiMWtWOHpETmxOcGExNTdHLVE0SjlaZklZQjhaenpUT0VoZGRid2ZpQ1VQM0M3RUtnSU9iUXJTUkJ2dzdRRWdCZEZoQ2NSZk9hQnVnbk9rano5MTdCTHlBNGhhUFE?oc=5	"이 새벽에 드라마 찍는다고!" 잠 못자 '격분' 벽돌 던졌다가‥ - MBC 뉴스	지난해 4월 서울 종로구에 사는 40대 남성 A 씨는 새벽 시간까지 잠들지 못한 채 격분했습니다. 집 앞 골목길에서 드라마 촬영이 새벽 3시 반까지 진행됐기 때문입니다. 잠을 자려...	None	2024-10-29 03:07:31	MBC 뉴스
kr	https://news.google.com/rss/articles/CBMiW0FVX3lxTE9mQ0ZUODRiRThEb19mTGJadlBkS3BhM1VtTTlibkNBVEpIX3NPdUsweWN6MWpsNVF5TXVodnN2X1Bpd21LM2J4aS1pWnhvSk82YjdQYjlDbzZBNzjSAV5BVV95cUxNNGk4d1lad2s1elU5TEpMR25rc1Bab1VWZnFSUW1jRWtKNHVlWFRJaVBtQ1g3SjBUMFh3SENvbmRBZmJyeEVNWDZTaV9WakZJeHJTcU9MeFI2U25vRHpR?oc=5	교육부 '의대생 휴학승인 검토'에 여야의정 협의체 탄력받나 - 연합뉴스	(서울=연합뉴스) 권지현 기자 = 교육부가 의료계 요구인 '조건 없는 의대생 자율 휴학' 승인을 전향적으로 검토하기로 하면서 의정 갈등 해소 방...	None	2024-10-29 03:24:20	연합뉴스
kr	https://www.chosun.com/national/welfare-medical/2024/10/28/3XQTF2YKZBB2PCTM644PK4WCCA/	뇌졸중 환자 35%가 당뇨병... 외국보다 비율 높아 - 조선일보	뇌졸중 환자 35%가 당뇨병... 외국보다 비율 높아	https://www.chosun.com/resizer/v2/KLY2VVUZTVD53AAX6S3X3TE2HI.jpg?auth=c87e8613794fdd6740526fd972ab58c8f42ef6d6a80a5ffd422e6b61b1d97fc1&width=1200&height=630&smart=true	2024-10-28 13:06:00	조선일보
kr	https://www.khan.co.kr/national/health-welfare/article/202410291157001	임현택 의협 회장 탄핵 위기…불신임·비대위 설치 투표 - 경향신문	임현택 대한의사협회(의협) 회장에 대한 불신임(탄핵) 안건 상정 여부와 비상대책위원회 설치 투표가 추진된다. 의료계에 따르면 의협 대의원회 운영위원회는 29일 16개 시도 의사회 회장 등이 참석한 가운데 오후 7시 임시 회의를 열고 임현택 회장 불신임, 비대위 설치 등 안건 상정을 의결한다. 이날 안건 상정이 의결되면 대의원회는 다음달 10일 임시대의...	https://img.khan.co.kr/news/2024/10/29/news-p.v1.20241029.a1289e58d6224082b8917928a5e0e5c9_P1.jpeg	2024-10-29 02:57:00	경향신문
kr	https://news.google.com/rss/articles/CBMiakFVX3lxTE5ack1tbGhGdGk0bGFnLU0tc2ZRdmNLYnRueFBGWGJ2dnl1MENjckJCbkZ2ZnZzRHR0S0tOV3BFQlU4VmNTZGF4Qi1aUDJ3ZEpIaU9Pb2hEc1oySElXQ2JZM3BFMXJhLVlNYnc?oc=5	성큼 다가온 첨생법 개정… '닮은 꼴' 일본·대만의 재생의료 데이터 관리 - 히트뉴스	None	None	2024-10-28 21:07:00	히트뉴스
kr	https://news.google.com/rss/articles/CBMiW0FVX3lxTE9aOVkwSG9SZ2hqOFB1amtUeGhxWXFCMXlCMmpTTms4c3ZGTjdoMTVkZG9fUGt3YWQwYjlMTVVIb1BmR3JWMjZYdWd3MGZWak11a2VGYWhodUtrSW_SAV5BVV95cUxORXFtVHU3T1dEWlI1a1FudkZqSkttQkxYUkpDamdIVEZ4Qm52T0xNLUVBMEpkWnFQWWd3V0drOVZCT1hXZDU0VUZybWlvWGowSUpyYzBTOGhVMGlibk9n?oc=5	전북돌봄노조 "전국 최저인 아동센터 종사자 호봉 개선하라" - 연합뉴스	None	None	2024-10-29 02:25:37	연합뉴스
kr	https://m.dailypharm.com/newsView.html?ID=316808	위고비 인기에 비대면 플랫폼 역풍...의약계 "전면허용 중단" - 데일리팜	None	None	2024-10-29 03:00:59	데일리팜
kr	https://www.yonhapnewstv.co.kr/news/MYH20241029008800641	[센터웨더] 11월 코앞인데 태풍이?…'콩레이' 예상 경로는 - 연합뉴스TV	[센터웨더] 11월 코앞인데 태풍이?…'콩레이' 예상 경로는
<출연 : 전세영 연합뉴스TV 기상캐스터>

오늘은 전국이 대체로 흐린 가운데 낮에는 선선한 가을 날씨가 이어지겠습니다	https://d2k5miyk6y5zf0.cloudfront.net/article/MYH/20241029/MYH20241029008800641.jpg	2024-10-29 03:55:13	연합뉴스TV
kr	https://news.google.com/rss/articles/CBMib0FVX3lxTE9sV05LLUQxV2ozLVNSN0dSV1UtaVVaSGFobk1mbFRvVDJsSFhTOWtZbjZtaHZnX1JwdWNfNGhnRnJqQjMxUUF6UmxPNXpyRXhCb0kwMzhiVEZMV2x0ckQtREZVVzhfbnZnblZ3ZHJhRQ?oc=5	‘뒷심’ 트럼프 승리 전망 상승…“해리스에 여전히 기회” 반론도 - 한겨레	“이미 누구 책임이 더 큰지를 놓고 손가락질이 시작됐다.” 미국 인터넷 매체 액시오스는 지난 25일 민주당 안팎의 분위기를 이렇게 전했다. 29일(현지시각)로 대선이 일주일 앞으로 다가오는 가운데 여러 여론조사에서 도널드 트럼프 전 대통령의 선전이 거듭 확인되자 패배	https://flexible.img.hani.co.kr/flexible/normal/808/596/imgdb/original/2024/1029/7417301549250703.jpg	2024-10-28 22:36:00	한겨레
kr	https://www.chosun.com/politics/diplomacy-defense/2024/10/29/ZYBUAL76URHHFGWLAQTWBIBTAM/	[단독] 북한군 전선 조기 투입… “1만1000명 이미 쿠르스크 집결” - 조선일보	단독 북한군 전선 조기 투입 1만1000명 이미 쿠르스크 집결 예상보다 빨리 최전방에 배치	https://www.chosun.com/resizer/v2/SKLMGB7UVLKMBZ7ETCGWFPHY7M.jpg?auth=6e7c7bd5291e99b493688c6609d0a8aa7c6a95ce387c1136da25b31cc52a08db&width=796&height=417&smart=true	2024-10-28 20:06:26	조선일보
kr	https://www.doctorsnews.co.kr/news/articleView.html?idxno=157029	"류마티스 질환은 필수의료 지원 정책에서 소외됐다" - doctorsnews	"류마티스 질환은 영구 장애나 사망까지 이를 수 있는 데도 필수의료 지원 정책에서 소외돼 있습니다."대한류마티스학회는 25일 프레스센터에서 의료정책 심포지엄을 열고 류마티스질환의 현황과 직면한 문제점, 개선 방안 등을 논의했다.류마티스 질환은 대부분 만성적인 희귀&middot;중증난치 질환으로 치료시기를 놓치면 영구 장애나 사망까지 이를 수 있지만, 최근 정부가 추진하는 필수의료 지원 정책에서 류마티스 질환을 간과하고 있다는 지적이다. 먼저 윤종현 의료정책이사는 희귀&middot;중증난치질환으로서 류마티스질환이 갖는 특징과 사회에	http://www.doctorsnews.co.kr/news/photo/202410/157029_125934_2128.jpg	2024-10-28 08:36:05	doctorsnews
kr	https://www.khan.co.kr/national/incident/article/202410291051011	처·자식까지 데리고 간 필리핀 가족여행, ‘30만명분’ 마약 밀수 루트였다 - 경향신문	아내와 자녀를 동반한 해외 가족여행으로 위장해 필로폰 등 마약류를 국내로 밀수한 일당이 경찰에 붙잡혔다. 서울 강남경찰서는 지난 18일 필리핀에서 마약류를 구입해 국내로 들여온 A씨(33)를 마약류관리법 위반 등의 혐의로 긴급체포해 구속했다고 29일 밝혔다. 경찰은 또 A씨가 밀수한 마약을 유통한 B씨(45), 판매·운반책 C씨(21)·D씨(29)를 ...	https://img.khan.co.kr/news/2024/10/29/news-p.v1.20241029.8d2fbd735dc74daca072c79cf3a5c89f_P1.jpeg	2024-10-29 01:51:00	경향신문
kr	https://news.google.com/rss/articles/CBMiWkFVX3lxTE5ucmM5b1dhdWlDbGtkTi1xNzFKUElMS05xUXRaY2FYdGlnYVBUYmxFbHBWd3A2UExwVVllellRdVFodGc4Zk9rdzZVOVZpWjE5bXoxZE5sTUFDd9IBXkFVX3lxTE4xZ09fc3VSSllKeTY2bUpZV1JKRnFMeklPdmNvUU1EV25hZ2dQV0FCOHlsajVyRG1HcnBkMjVzd3d6WVJOaVJaR1FhRFJ3cjR1Mm8wNUtXRlhzQ0lXTHc?oc=5	“김밥 1만줄 준비했는데”…인구 13만 김천에 10만명이 밀려들었다 - 파이낸셜뉴스	None	None	2024-10-28 04:53:19	파이낸셜뉴스
kr	https://news.google.com/rss/articles/CCAiC042bnJtX0E3anowmAEB?oc=5	"민간 화물차로 북한군 수송 중"…우크라, 감청 내용 공개 / SBS 8뉴스 - SBS 뉴스	None	None	2024-10-28 11:08:45	SBS 뉴스
kr	https://news.google.com/rss/articles/CBMiekFVX3lxTE5iSXVpdDdjUFo1UlQwOTl6N3hzQkpqTlNWV1V0Y3c5bTJLN0I1Rzg0SWZWTTl3R1ZjSFB2UDlFT1B1d09GT3pGemtSRFpLTDBzbkI2d0s2MDB6a05HWUlwby1Ua2JpeVRoTXVNTUhfWU5qTHhKNk41RkJ30gF6QVVfeXFMTkdUcURjZU1jMTdhbVc2NHgzeGN5TzA3aXFMS1J3ZGFCOXd3WFdkZGRuS18wVFJpUDMtakhtUjlIYkp3MzJ4Uk5MREk3TDdTUzFHRG4zTV9ma0VmT3lDY0UwNlJ5ME5EWENFaDRkV1J1RGxVb2I5ODhpMnc?oc=5	[와글와글 플러스] "명품 '리폼 제품'도 상표권 침해" - MBC 뉴스	이른바 '명품' 상표의 제품을 수선해 다시 만든 '리폼 제품'이 상표권을 침해했다는 법원 판단이 나왔습니다. 1심에 이어, 특허법원도 동일한 판결을 내린 건데요. 수선업자 A 씨는...	https://image.imnews.imbc.com/replay/2024/nwtoday/article/__icsFiles/afieldfile/2024/10/29/today_20241029_072710_2_30_Large.jpg	2024-10-28 22:28:03	MBC 뉴스
kr	https://www.donga.com/news/Society/article/all/20241029/130313826/2	“어르신들 말 걸어 운동 못해”… 헬스장-카페 ‘노실버존’ 논란 - 동아일보	“어르신들이 말 걸어서 불편합니다. 헬스장 못 다니겠어요.” 이달 18일 서울 강동구의 한 헬스장에 ‘고령자들과 같은 공간에서 운동하는 것이 불편하다’는 민원이 접수됐다. 이후 …	https://dimg.donga.com/wps/NEWS/IMAGE/2024/10/29/130314175.1.jpg	2024-10-28 18:00:00	동아일보
kr	https://news.google.com/rss/articles/CBMieEFVX3lxTFByREFRaVA0OGZlclhhc1J3UEVqSnl4WkticnBWdmdSLThwV0V4cG1POWgxVVN1QXhULXQxNzdhOU1YSHk3Snl0VTlfd2JZZy0ya0RsNE8weTJGTVJQWG5nYk9pNVZVWmR1cWoxU25UbHV3R2xOYTc5VNIBeEFVX3lxTE1oUy1EOFYxZnhZbjZzM253cTZvbVlZS2QxbDQ1QTREc2M4c05taGRHS3ZBYm0wYzFzUko0eWstcTN5bUJ6ZjZIVlV1aEoxdlR6aHA5YklmY0JrMmhNWUVfTHFZX3NuX0o1OXJLOC12X0F0MGJRa081VA?oc=5	김상훈 "용산, 김 여사 활동 자제 고민‥사과 포함될 수도" - MBC 뉴스	국민의힘 김상훈 정책위 의장이 "이른바 '김건희 여사 리스크'에 대해 대통령실에서 사과에 대해 고민하고 있을 것"이라고 말했습니다. 김 의장은 오늘 YTN라디오 '뉴스파이팅, 배승...	None	2024-10-29 02:12:02	MBC 뉴스
kr	https://www.khan.co.kr/people/people-general/article/202410290553001	정몽규, 이 말 기다렸나...방한 FIFA 회장 “축구협회 문제 없다” 두둔 - 경향신문	잔니 인판티노 국제축구연맹(FIFA) 회장(54)이 7년 만에 방한했다. 국내에서 처음 개최되는 아시아축구연맹(AFC) 연례 시상식 참석차 28일 입국한 인판티노 회장은 이날 서울 신문로 축구회관에 위치한 대한축구협회를 첫 행선지로 선택했다. 인판티노 회장은 이날 정몽규 대한축구협회장을 비롯해 내년 FIFA 클럽 월드컵에 참가하는 울산 HD의 김광국 ...	https://img.khan.co.kr/news/2024/10/29/news-p.v1.20241028.f8f4ca5184684af3b8c6f58d34cddb32_P1.png	2024-10-28 20:53:00	경향신문
kr	https://news.google.com/rss/articles/CBMickFVX3lxTFBZVmhaMFZ6MDdhaTlrcnFmNVdUUUFoZ21xbGhhZFB0REd5VEx2SmZZTUZ0WjRpNk1fZlFhV3A2c3dLZUU3cG5aWk10Z0VBQWs1TTJxakJ6MEZ4Y1dsaEptVEZRVFdNd2YxMWJPT09sUG44QQ?oc=5	로제 ‘아파트’ 빌보드 ‘핫 100’ 8위…지구에서 지금 가장 핫한 곡 - 한겨레	None	None	2024-10-29 01:56:00	한겨레
