country_code	url	title	description	image_url	publish_date	source
kr	https://www.khan.co.kr/national/national-general/article/202410261022001	불법 촬영에 여자 화장실까지 숨어든 20대··· 2심에서 형량 늘어 - 경향신문	불법 촬영 범죄로 두 차례나 선처를 받고도 또다시 지하철 등에서 여성들을 촬영한 20대가 항소심에서 늘어난 형량을 선고받았다. 춘천지법 형사1부(심현근 부장판사)는 성폭력처벌...	https://img.khan.co.kr/news/2024/10/26/news-p.v1.20241026.9449043612454db59b37dde914c44948_P1.jpg	2024-10-26 01:22:00	경향신문
kr	https://www.news1.kr/society/environment/5580129	21호 태풍 콩레이 조만간 기차탈선 위력 성장…한반도 영향은 - 뉴스1	사실 앞에 겸손한 민영 종합 뉴스통신사	https://i3n.news1.kr/system/photos/2024/10/25/6949794/high.jpg	2024-10-25 08:24:29	뉴스1
kr	https://www.hani.co.kr/arti/international/america/1164425.html	NYT 마지막 조사서 해리스-트럼프 48% 동률…“해리스엔 불리” - 한겨레	투표일을 열하루 앞둔 미국 대선이 초박빙 양상을 이어가고 있다. 미국 민주당 대선후보 카멀라 해리스 부통령과 공화당 후보 도널드 트럼프 전 대통령은 뉴욕타임스와 시에나 대학이 25일(현지시각) 공동조사해 공개한 여론조사에서 48% 대 48%로 동률을 기록했다. 이달 초	https://flexible.img.hani.co.kr/flexible/normal/642/428/imgdb/original/2024/1026/20241026500283.jpg	2024-10-26 08:55:00	한겨레
kr	https://www.bbc.com/korean/articles/c24530l8yl2o	'영주권 대폭 축소' 나선 캐나다... '이민 천국'이 돌아선 이유는? - BBC.com	한때 '이민 천국'이라 불리던 캐나다가 최근 영주권 수용 인원을 21% 줄이는 등 역대 가장 강력한 이민 축소 계획을 발표했다	https://ichef.bbci.co.uk/news/1024/branded_korean/ccc6/live/129f8bb0-9374-11ef-8e6d-e3e64e16c628.jpg	2024-10-26 08:36:43	BBC.com
kr	https://news.ikbc.co.kr/article/view/kbc202410260010	덕유산 자락 70년 수령 등 천종산삼 10뿌리 발견 - KBC광주방송	덕유산 자락에서 최고 70년 수령의 천종산삼이 발견돼 화제입니다.  한국전통심마니협회는 최근 60대 약초꾼 A씨가 경남 함양군 덕유산 자락에서 천종	https://www.ikbc.co.kr/data/kbc/image/2024/10/26/kbc202410260011.jpg	2024-10-26 00:52:01	KBC광주방송
kr	https://www.khan.co.kr/politics/assembly/article/202410261909001	윤석열 탄핵선언문 읽은 조국혁신당 “본격 장외 투쟁” - 경향신문	조국 조국혁신당 대표가 26일 “윤석열 대통령 탄핵을 추진하겠다”고 밝혔다. 연합뉴스에 따르면 조 대표는 이날 서울 대검찰청 앞에서 혁신당이 개최한 ‘검찰 해체, 윤석열 탄핵...	https://img.khan.co.kr/news/2024/10/26/news-p.v1.20241018.d000b82eddb54062b7f7e7e792ccd065_P1.jpeg	2024-10-26 10:09:00	경향신문
kr	https://www.chosun.com/sports/sports_general/2024/10/25/H6SXSAX4PJHCBFIYOD5ZCZOYXY/	황선우, 경영 월드컵 자유형 100m 은메달로 자신감 회복 - 조선일보	황선우, 경영 월드컵 자유형 100m 은메달로 자신감 회복	https://www.chosun.com/resizer/v2/P5BY4COYQRPFFFYI2UWKCQCHNM.JPG?auth=4593cf86192ac9df5efab6fac7871f192190cc79419ff1937c258a42907e5513&width=1200&height=630&smart=true	2024-10-25 13:00:25	조선일보
kr	https://news.google.com/rss/articles/CCAiCzRNUThvY2FKWkNRmAEB?oc=5	美 대선에 갈라진 별들…디카프리오 vs 멜깁슨 / 채널A / 뉴스A - 채널A News	None	None	2024-10-26 11:15:31	채널A News
kr	https://news.google.com/rss/articles/CCAiCzNBXzdnaHdiZ1BvmAEB?oc=5	"한동훈에 동병상련 느끼나" 이준석 답한 '두 글자'는.. [뉴스.zip/MBC뉴스] - MBCNEWS	None	None	2024-10-26 07:27:58	MBCNEWS
kr	https://www.hani.co.kr/arti/society/society_general/1164443.html	‘연결된 우리는 강하다’…보랏빛 물든 이태원 2주기 추모광장 - 한겨레	‘작지만 많은 마음들이 이태원참사를 기억하고 있어요. 멀리 떨어져 있어도 같은 마음으로 울고 슬퍼하고 있어요. 우리는 모두 연결되어 있어요’ 10·29 이태원참사 2주기를 사흘 앞둔 26일, 서울 중구 서울광장에 마련된 ‘애도와 기억의 메시지 벽’에 포스트잇이 하나둘씩	https://flexible.img.hani.co.kr/flexible/normal/674/349/imgdb/original/2024/1026/20241026500584.jpg	2024-10-26 12:55:00	한겨레
kr	https://www.hankyung.com/article/2024102610127	"7년간 왕래하던 이웃이었는데"…중3 주먹에 70대 노인 사망 - 한국경제	"7년간 왕래하던 이웃이었는데"…중3 주먹에 70대 노인 사망, 지난 25일 JTBC 사건반장 보도	https://img.hankyung.com/photo/202410/01.38441385.1.jpg	2024-10-26 11:11:30	한국경제
kr	https://www.kmib.co.kr/article/view.asp?arcid=0020660048	불법숙박·갭투자·탈세까지…‘음주운전’ 문다혜 파장 계속 - 국민일보	문재인 전 대통령의 딸 다혜씨를 둘러싼 의혹이 계속해 제기되고 있다. 지난 18일 음주운전으로 경찰 조사를 받은 데 이어 불법 숙박으로 조사를 받게 됐다. 태	https://image.kmib.co.kr/online_image/2024/1026/2024102521035834386_1729857838_0020660048.jpg	2024-10-25 15:02:00	국민일보
kr	https://www.chosun.com/international/mideast-africa-latin/2024/10/26/5ENY3YT67JFPLB2UNSCBLVTTKY/	“이스라엘, 이란에 보복 직전 제3자 통해 ‘반격 말라’ 경고 보냈다” - 조선일보	반격말라 경고 뒤 4시간 절제된 타격...이스라엘, 확전 피하려 했다 WP 이란에 피해 최소 핑계 제공  방공·레이더 시스템 등 20곳 파괴    美대선 후 추가 보복 길은 터 놓아   	https://www.chosun.com/resizer/v2/4Z4YM2OUJZIPRLL7L27L3EOXZA.jpg?auth=f9db8095e9eb65ab59b177f41c7e7a4e2f256cd03b577ce152d01d66754f9fe6&width=1200&height=630&smart=true	2024-10-26 14:07:00	조선일보
kr	https://imnews.imbc.com/replay/2024/nwdesk/article/6650134_36515.html	[단독] 검찰, 말맞추기용 메모 확보‥2억 4천만 원은 어디로? - MBC 뉴스	 김건희 여사 공천개입 의혹의 핵심인물인 명태균 씨와 관련해, 여론조사 불법 조달 의혹 등을 수사하고 있는 검찰이, 관련자들이 말맞추기용으로 작성했다는 메모를 확보했습니...	https://image.imnews.imbc.com/replay/2024/nwdesk/article/__icsFiles/afieldfile/2024/10/26/desk_20241026_200716_1_4_Large.jpg	2024-10-26 11:07:57	MBC 뉴스
kr	https://www.donga.com/news/Society/article/all/20241025/130296252/2	“포만감 오래 지속” 위고비… 편법 처방-불법 해외 직구 논란도 - 동아일보	《비만치료제 ‘위고비’ 열풍, 괜찮을까국내 출시된 비만 치료제 ‘위고비’가 큰 인기를 끌면서 비대면 진료를 통해 편법 처방을 받거나 불법 해외 직구를 하는 이들도 나타나고 있다.…	https://dimg.donga.com/wps/NEWS/IMAGE/2024/10/25/130297976.1.jpg	2024-10-25 16:40:00	동아일보
kr	https://www.yna.co.kr/view/AKR20241026046000001	특별감찰관·북한인권재단 뭐길래…8년째 여의도 핑퐁게임 - 연합뉴스	(서울=연합뉴스) 류미나 박경준 안채원 기자 = 국민의힘 한동훈 대표가 드라이브를 거는 특별감찰관, 그리고 친윤(친윤석열)계가 반대 명분으로 내...	https://r.yna.co.kr/global/home/v01/img/yonhapnews_logo_1200x800_kr01.jpg?v=20230824_1025	2024-10-26 20:10:00	연합뉴스
kr	https://imnews.imbc.com/replay/2024/nwdesk/article/6650133_36515.html	"반대 급부로 핵, ICBM 기술 이전" 북도 사실상 파병 인정 - MBC 뉴스	 한미일 안보실장이 워싱턴에서 급하게 회동해 북한군의 러시아 파병 문제를 논의했습니다. 북한도 가정법을 사용해 파병을 사실상 인정한 와중에 북한이 파병 대가로 핵과 대륙...	https://image.imnews.imbc.com/replay/2024/nwdesk/article/__icsFiles/afieldfile/2024/10/26/desk_20241026_200435_1_3_Large.jpg	2024-10-26 11:05:10	MBC 뉴스
kr	https://www.hani.co.kr/arti/politics/assembly/1164433.html	한동훈, 박정희 추도식 참석…“도전정신 이어받아 변화·쇄신” - 한겨레	한동훈 국민의힘 대표가 “박정희 전 대통령의 도전정신과 애국심을 이어받아 국민의힘도 변화, 쇄신하겠다”고 말했다. 한 대표는 26일 오전 서울 동작구 국립서울현충원에서 열린 박정희 전 대통령 45주기 추도식에서 이렇게 말했다. 민족중흥회 주관으로 열린 이날 추도식에는	https://flexible.img.hani.co.kr/flexible/normal/970/552/imgdb/original/2024/1026/1317299232267847.jpg	2024-10-26 11:46:00	한겨레
kr	https://www.chosun.com/national/national_general/2024/10/26/UTK3NOE5ORHJLLM56SSMOLNLYY/	내일 광화문·여의도 대규모 집회…“대중교통 당부” - 조선일보	내일 광화문·여의도 대규모 집회대중교통 당부 	https://www.chosun.com/resizer/v2/PFKHED7OZFAKZO3PEHSLVJXCYE.jpg?auth=96213f088030bc425184cdddc4503d694f982c010bee470b86cb151fe44dcbc5&width=1200&height=630&smart=true	2024-10-26 01:10:20	조선일보
kr	https://www.chosun.com/national/incident/2024/10/26/ATALL2C2LVCWVEPTPKZZN5K36I/	아들에 폭행당한 90대 노모… “밥 챙겨줘야” 처벌불원 호소 - 조선일보	아들에 폭행당한 90대 노모 밥 챙겨줘야 처벌불원 호소 	https://www.chosun.com/resizer/v2/KXFAOMPGOZFIHGAO5RN7Q2JVFE.png?auth=912f6161247cc5ee76a53820860da08c74834cdabfe36bbf6e795690b011458d&width=1200&height=630&focal=932,553	2024-10-26 12:50:00	조선일보
kr	https://www.chosun.com/economy/industry-company/2024/10/25/3HALQSDRKBAPBEEWVTT6FEG35I/	폴란드 대통령, 한화 방산 사업장 방문...”깊은 인상받아” - 조선일보	폴란드 대통령, 한화 방산 사업장 방문...깊은 인상받아	https://www.chosun.com/resizer/v2/KJSXN6YDVRGJRB7AJE37ZCYTSM.png?auth=05f60bd5c524857b58f33610b4e91840139e78a2d14dc8a66f31a15f56c3a249&width=1200&height=630&smart=true	2024-10-25 07:38:55	조선일보
kr	https://news.google.com/rss/articles/CCAiC1RabUlTdVV6Z25jmAEB?oc=5	전 세계 사로잡은 "아~파트 아파트"…빌보드도 노린다 / SBS 8뉴스 - SBS 뉴스	None	None	2024-10-26 11:32:57	SBS 뉴스
kr	https://www.donga.com/news/Politics/article/all/20241026/130298007/2	이준석 “金여사, 지방선거 공천 개입 맞다” - 동아일보	개혁신당 이준석 의원이 “2022년 6월 지방선거 공천 때 김건희 여사가 개입한 것은 맞다”고 발언한 사실이 알려지면서 파장이 일고 있다. 이 의원은 당시 국민의힘 대표였다. 국…	None	2024-10-25 16:40:00	동아일보
kr	https://www.yna.co.kr/view/AKR20241026051100071	"北김정은 군부측근 김영복, 러 입국…파병부대 총괄지휘" - 연합뉴스	(워싱턴=연합뉴스) 조준형 특파원 = 김정은 북한 국무위원장의 군부 측근 중 한 명인 김영복 조선인민군 총참모부 부총참모장이 러시아로 최근 파견...	https://img2.yna.co.kr/etc/inner/KR/2024/10/26/AKR20241026051100071_02_i_P4.jpg	2024-10-26 15:05:34	연합뉴스
kr	https://www.hani.co.kr/arti/politics/assembly/1164435.html	박단, 이재명 만나서도 ‘요지부동’…협의체 참여 거부한 듯 - 한겨레	이재명 더불어민주당 대표와 박단 대한전공의협의회 비상대책위원장이 26일 만나 2025년 의대 정원과 관련해 논의했으나, 박 위원장은 여야 간에 구성되는 의정 협의체에 참여를 거부한 것으로 보인다. 이날 두 사람은 서울 한 곳에서 비공개로 만나 의-정 갈등과 관련해 이야	https://flexible.img.hani.co.kr/flexible/normal/970/646/imgdb/original/2024/1001/20241001502203.jpg	2024-10-26 12:53:00	한겨레
kr	https://m.dongascience.com/news.php?idx=68126	의협 회장, 비방글에 합의금 1억 요구…"일부러 요구한 것" - 동아사이언스	  지난 9월 22일 국회에서 임현택 대한의사협회 회장이이재명 더불어민주당 대표 등과 간담회를 하기 위해 이동하고 있다. 연합뉴스 제공.    임현택 대한의사협회 회장이 자신을 비방하는 글을 올린 의협 회원에 대한 고소 취하 ...	https://image.dongascience.com/Photo/2024/10/17298320231446.jpg	2024-10-25 04:54:59	동아사이언스
kr	https://www.ohmynews.com/NWS_Web/View/at_pg.aspx?CNTN_CD=A0003073834	윤 대통령 긍정 20%...TK도 30% 벽 무너졌다 - 오마이뉴스	다시 20% 턱걸이였다.  갤럽 윤석열 대통령의 국정 지지도가 또 최저치를 기록했다. 2024년 10월 4주차 여론조사에서 6주 만에 또 찍은 20% 턱걸이다. 여권의 전통적인 지지층인 대구·경북 지역에서마저 긍정평가 30%선이 무너졌다. 반대로 부정 평가는 역시 6주 만에 최고치 70%를 다시 기록했다.  부정평가 사유 1위로 ...	https://ojsfile.ohmynews.com/CRI_T_IMG/2024/1025/A0003073834_T.jpg	2024-10-25 03:36:00	오마이뉴스
kr	https://www.mediatoday.co.kr/news/articleView.html?idxno=321802	11월, 부산을 보라 - 미디어오늘	20세기 초 어느 날, 미국 석유왕 록펠러가 정유공장을 둘러보다가 한쪽에서 뭔가 태우는 걸 발견했다. “뭘 태우는 거지?” 물었고, 직원이 에틸렌이라고 대답했다. 그러자 록펠러는 “아무것도 낭비하지 마라. 어떻게든 사용처를 찾아내라”고 지시했다. 출처가 명확하지 않지만, 환경운동사에서 정설처럼 회자되는 이야기. 석유화학 산업의 기원을 요약하는 동시에, 탄화수소의 마지막까지 쥐어짜 이익을 내려는 자본의 탐욕을 예시하는 장면이다. 록펠러의 바람대로 1933년 폴리에틸렌을 발견했고, 이것이 오늘날 플라스틱 문명의 시금석이 됐다. 그로부터 약 90여 년이 흐른 뒤, 미 캘리포니아 주는 2024년 9월 세계 최대 석유기업 엑손모빌을 고발했다. 엑손모빌의 전신이 바로 록펠러의 스탠다드 오일이다. 수십 년에 걸쳐 기만적 캠페인을 벌였다는 것이 소송의 골자다. 원유 판매는 물론 플라스틱 포장재를 대량생산한 엑손모빌이 소비자들에게 재활용을 재촉하면서 ‘환경과 대중을 위협하는 사기적 관행’을 지속해왔다는 것이다.	https://cdn.mediatoday.co.kr/news/thumbnail/202410/321802_454994_1917_v150.jpg	2024-10-25 23:54:00	미디어오늘
kr	https://imnews.imbc.com/news/2024/politics/article/6649994_36431.html	이상민 "대통령 관저 공사 무자격 업체들, 행정처분·고발조치" - MBC 뉴스	이상민 행정안전부 장관이 대통령 관저 공사에 참여한 무자격 업체에 대해 행정처분을 요청하고, 수사기관에 고발조치도 했다고 밝혔습니다. 이 장관은 오늘 국회 행정안전위원회 종합국정감...	https://image.imnews.imbc.com/news/2024/politics/article/__icsFiles/afieldfile/2024/10/25/s241026_0005.jpg	2024-10-25 14:46:49	MBC 뉴스
kr	https://www.chosun.com/national/education/2024/10/26/XA3TWEH4JFEIVALF3Y7VUGK7BA/	의대 교수 99% “정부의 의대생 휴학 불허는 대학 자율성 침해” - 조선일보	의대 교수 99% 정부의 의대생 휴학 불허는 대학 자율성 침해	https://www.chosun.com/resizer/v2/6ZG7YXUUEVEATHIL6STZ4MG5EA.jpg?auth=98c676cfb75991ca7c1019e1babd4e73d599ba9f244fef62ca8df85cad552fd3&width=1200&height=630&smart=true	2024-10-26 08:39:58	조선일보
kr	https://sports.khan.co.kr/article/202410261359003	‘성매매 논란’ 최민환, 결국 무대 뒤 숨는다…국내외 망신 - 스포츠경향	밴드 전성기, FT아일랜드가 멤버의 사생활 논란으로 인해 재도약의 기회를 놓쳤다. FT아일랜드 멤버 최민환(31)이 성매매 의혹에 휩싸인 가운데, 방송에 이어 무대에서도 모습을 감춘다. 26일 그랜드 민트 페스티벌(GMF) 측은 “FT아일랜드의 공연은 소속사와 논의한 바 멤버 최민환을 세션 연주자로 대체하여 준비한 무대를 진행할 예정이며, 추가적인 사...	https://images.khan.co.kr/article/2024/10/26/news-p.v1.20241026.cfa44fab4e244a59877a8ee44c2e3525_P1.png	2024-10-26 04:59:00	스포츠경향
kr	https://www.hani.co.kr/arti/politics/bluehouse/1164432.html	대통령실, ‘관저 내 김건희 호화시설’ 의혹에 “사실 아냐…강한 유감” - 한겨레	대통령실이 26일 서울 용산 한남동의 대통령 관저에 호화시설이 있다는 의혹에 대해 사실이 아니라고 부인했다. 대통령실은 이날 언론 공지를 통해 “야당 의원의 주장에 근거해 일부 언론에 보도된 대통령 관저 내부에 호화시설이 있다는 기사는 전혀 사실이 아니다”고 밝혔다.	https://flexible.img.hani.co.kr/flexible/normal/496/283/imgdb/original/2024/1008/20241008502826.jpg	2024-10-26 11:46:00	한겨레
kr	https://imnews.imbc.com/replay/2024/nwtoday/article/6650183_36523.html	"파병 북한군은 'K-대대'‥30명당 통역 1명" - MBC 뉴스	 우크라이나 정부가 빠르면 오늘부터 북한군이 전투 지역에 투입될 것으로 예상한 가운데 이를 뒷받침하는 증거도 잇따르고 있습니다. 러시아 군이 북한군을 K-대대라고 부르며...	https://image.imnews.imbc.com/replay/2024/nwtoday/article/__icsFiles/afieldfile/2024/10/27/today_20241027_070114_1_1_Large_1.jpg	2024-10-26 22:01:37	MBC 뉴스
kr	https://www.hani.co.kr/arti/politics/politics_general/1164441.html	김건희-명태균 ‘영적 대화’...“주술이 국정에 개입됐느냐 밝혀야” [공덕포차] - 한겨레	  김건희 여사와 명태균씨를 둘러싼 의혹이 주술에 의한 국정 운영 의혹으로 번지고 있습니다. 김 여사가 명씨의 꿈 이야기를 듣고 외교 일정에 반영했다는 의혹인데요. 명씨도 “꿈 이야기를 나눈 건 사실”이라고 말했었죠. 우리의 박카스 박성태 사람과	https://flexible.img.hani.co.kr/flexible/normal/970/546/imgdb/original/2024/1025/20241025503025.jpg	2024-10-26 12:06:00	한겨레
kr	https://news.kbs.co.kr/news/pc/view/view.do?ncd=8091171	‘대선 D-10’ 트럼프 또 북한 언급 “김정은보다 더 큰 문제는…” - KBS뉴스	도널드 트럼프 미국 전 대통령이 대선을 열흘 앞두고 또다시 북한 김정은 국무위원장을 언급하며 “그보다 ...	http://news.kbs.co.kr/data/news/2024/10/26/20241026_ln1I2d.jpg	2024-10-26 12:48:00	KBS뉴스
kr	https://imnews.imbc.com/replay/2024/nwtoday/article/6650186_36523.html	서울 용산서 2층짜리 다세대주택 벽체 붕괴 - MBC 뉴스	어제저녁 6시 15분쯤 서울 용산구에 있는 한 2층짜리 다세대주택 건물 벽체가 무너지는 사고가 발생했습니다. 해당 건물에는 아무도 살고 있지 않아, 다친 사람은 없었습니다. 현장을...	https://image.imnews.imbc.com/replay/2024/nwtoday/article/__icsFiles/afieldfile/2024/10/27/today_20241027_070444_1_4_Large_1.jpg	2024-10-26 22:05:01	MBC 뉴스
kr	https://news.google.com/rss/articles/CBMiggFBVV95cUxNRHQ4WG1DVVZheGI1NllnLXYxeVVuSEJGbWpVMkRwajBlMkYwSlltWHpMZ3VfWk1hcU5hR09VZ05FOTNzYTZHLTlVM1VxTmRUd0F3RjUtRzBYbzFiSERja1dvUFJMY2ZKQmZoZlRqb1JtQ21VMjNNVFRlaER0VkFEYml30gGWAUFVX3lxTE9UZk5YYTJWa3ppNzBiUlhTeTN4b2c4a05fWkMyN2VPcU5jcmtacll5UG16cXp3VVNnOHRSbWJ5bXE1QW10VmxqVzdianBHZF9kR2VOZnRWV2M3Ym9ZZVdFZC1hak5GM2czZ3ZzV3hiLWpjZXdqUmR4aWM2M1B1alZ3WEx2RTc2ZzJwVHRfMVQ4Z3NJdUZRUQ?oc=5	[강천석 칼럼] 대통령 부부와 특별감찰관의 짧고 기막힌 역사 - 조선일보	강천석 칼럼 대통령 부부와 특별감찰관의 짧고 기막힌 역사 尹 대통령, 문재인 5년 버티고 기다렸던 대통령 맞나 김 여사 매섭게 지적해 달라던 의원 이제 보니 親尹	https://www.chosun.com/resizer/v2/UP25ZI3WNVEQ7KWMW4S2ICHWZY.png?auth=49c888a405cbb99306e5d7401b46e19eb7bbf58606a8e94c45a908687a485da1&width=1200&height=630&focal=654,314	2024-10-25 15:20:00	조선일보
kr	https://news.ikbc.co.kr/article/view/kbc202410270003	"더 온다"…러 훈련소 북한군 또 동영상 포착 - KBC광주방송	러시아에 파병된 북한군의 모습을 보여주는 영상과 위성사진 등 정황이 속속 포착되고 있습니다.  25일(현지시간) 미 일간 워싱턴포스트(WP)에 따르면 	https://www.ikbc.co.kr/data/kbc/image/2024/10/27/kbc202410270005.jpg	2024-10-26 21:53:41	KBC광주방송
kr	https://www.chosun.com/national/national_general/2024/10/27/5FJHEN5KOFCUFICUMRG7O7RQV4/	﻿실종됐다던 아들, 백골로 집에서 발견…70대 아버지 무죄 왜? - 조선일보	﻿실종됐다던 아들, 백골로 집에서 발견70대 아버지 무죄 왜	https://www.chosun.com/resizer/v2/JQRZRVMA25FIBDKXTNJUPLCOLY.jpg?auth=3a667314858be5c646ad4a19ca351823f92c3378fa7887d0e59adba7e4f8815a&width=364&height=191&smart=true	2024-10-26 23:01:00	조선일보
kr	https://news.google.com/rss/articles/CBMiWkFVX3lxTE1ZUWsycVZ0RTRzTFpsY2s2NTFjV0tOaXR1YU16V01nUTlCcGtTZ3pzUVBkeEJvdE1GYXF2V0hPTlB6Vmh5M3RTd3NuZXN2b2tRTEpfalp6Q25PUdIBVEFVX3lxTFBGT3p1bEVPdnNuS1p2ZHM2bnVWTDk5VGUtaEczNmpvOXlneG5seVpjNjlHZFhXMms4YUdxTEt1SDJfakdFTXNQenRiMWY5eDR4NjVyZA?oc=5	"고통 상상초월, 안 당해보면 몰라"…故 김수미도 못 피한 임금체불 - 한국경제	"고통 상상초월, 안 당해보면 몰라"…故 김수미도 못 피한 임금체불, 체불액 올해 사상첫 2조원 돌파 전망 반복&middot;악성 체불에도 솜방망이 처벌 반의사불벌죄..."방귀 뀐 놈이 성내" "상습&middot;악덕 사업주엔 제재 강화해야"	https://img.hankyung.com/photo/202410/ZK.38435757.1.jpg	2024-10-25 22:26:37	한국경제
kr	https://www.hankyung.com/article/2024102609167	"웃으면서, 춤추면서 보내줘"…김수미 과거 발언 재조명 - 한국경제	"웃으면서, 춤추면서 보내줘"…김수미 과거 발언 재조명, 생전 김수미가 바랐던 장례식 2018년 '집사부일체' 방송 발언 재조명 "영정 사진 봤을 때 웃을 수 있었으면"	https://img.hankyung.com/photo/202410/ZN.38427838.1.jpg	2024-10-26 08:09:27	한국경제
kr	https://www.ohmynews.com/NWS_Web/View/at_pg.aspx?CNTN_CD=A0003073713	한기호·신원식 문자에 야권 "전쟁 사주""악마" - 오마이뉴스	군인 출신 집권여당 국회의원과 대통령실 안보실장 간 텔레그램 대화 내용에 야권이 발칵 뒤집혔다.  한기호 : "우크라이나와 협조가 된다면 북괴군 부대를 폭격, 미사일 타격을 가해서 피해가 발생하도록 하고 이 피해를 북한에 심리전으로 써먹었으면 좋겠습니다."  신원식 : "넵. 잘 챙기겠습니다. 오늘 긴급 대책회의 ...	https://ojsfile.ohmynews.com/CRI_T_IMG/2024/1025/A0003073713_T.jpg	2024-10-25 01:58:00	오마이뉴스
kr	https://www.mk.co.kr/news/business/11151099	“삼성전자요? 안 갈래요”…취준생, 가장 입사하고 싶은 곳은 ‘이곳’ - 매일경제	올해 하반기 취업준비생들이 자기소개서를 가장 많이 작성한 기업은 현대차로 나타났다. 한화에어로스페이스·기아·HD현대 등도 지난해 보다 채 공고 조회수 및 자소서 작성 인원이 눈에 띄게 늘었다. 반면 삼성전자는 10위권 밖으로 밀려났다. 26일 취업플랫폼 ‘자소설닷컴’에서 지난 8월 26일부터 10월 20일까지 올 하반기 대졸 신입사원 공개채용을 진행한 기업	https://pimg.mk.co.kr/news/cms/202410/26/news-p.v1.20241026.ed55815aae8c455f877497824aee9e52_R.jpg	2024-10-26 07:21:20	매일경제
kr	https://www.hani.co.kr/arti/politics/assembly/1164431.html	민주 “김건희 시세차익 23억 부정한 대통령실…뻔뻔한 거짓말” - 한겨레	더불어민주당은 26일 김건희 여사가 도이치모터스 주가 조작으로 23억원의 시세차익을 얻었다는 주장은 사실이 아니라고 한 대통령실에 “뻔뻔한 거짓말이 도를 넘는다”고 비판했다. 강유정 원내대변인은 이날 서면 브리핑에서 “김 여사가 도이치모터스 주가조작에 가담해 23억원의	https://flexible.img.hani.co.kr/flexible/normal/722/433/imgdb/child/2024/1026/53_17299215906312_20241026500346.jpg	2024-10-26 08:53:00	한겨레
kr	https://news.google.com/rss/articles/CBMifkFVX3lxTE55Vl92NzRyUEdCTTF1eDJiRHBxT3hSdEo5S0tMN1F3Y19oN0Rac3RaLVhkUmVlZjJyOTZfUnZCZEtnRjhPeHFMdUJwNWg1akJlZUlqOXFQRVFFdmtubUU3NVhTNHN3X3JLeGNFS1I0YW9uTlFUUVJqcTJHQ1h3dw?oc=5	'김태군 만루포' KIA, 한국시리즈 우승 1승 남았다 - 오마이스타	KIA가 4차전에서 완승을 거두며 한국시리즈 우승까지 1승만 남겨두게 됐다.  이범호 감독이 이끄는 KIA 타이거즈는 26일 대구 삼성 라이온즈파크에서 열린 2024 신한은행 SOL KBO리그 삼성 라이온즈와의 한국시리즈 4차전에서 홈런 2방을 포함해 장단 13안타를 터트리며 9-2로 승리했다.  원정 2연전에서 1승1패를 기록하며...	https://ojsfile.ohmynews.com/CRI_T_IMG/2024/1026/A0003074075_T.jpg	2024-10-26 08:33:00	오마이스타
kr	https://imnews.imbc.com/news/2024/society/article/6650056_36438.html	영장심사 뒤 수갑차고 호송‥법원 "전광훈에 국가 배상해야" - MBC 뉴스	구속영장 실질심사를 받은 뒤 유치장으로 호송하는 과정에서 경찰이 전광훈 사랑제일교회 목사에게 수갑을 채운 것을 두고 신체 자유에 대한 과도한 침해로 국가가 배상해야 한다는 법원 판...	https://image.imnews.imbc.com/news/2024/society/article/__icsFiles/afieldfile/2024/10/26/jsh241026_16.jpg	2024-10-26 01:32:30	MBC 뉴스
