country_code	url	title	description	image_url	publish_date	source
kr	https://news.google.com/rss/articles/CCAiC0M4dG93Snk0SkE4mAEB?oc=5	아파트 복도서 흉기 난동…전 연인 살해 · 어머니 중상 (자막뉴스) / SBS - SBS 뉴스	None	None	2024-11-09 05:48:43	SBS 뉴스
kr	https://news.google.com/rss/articles/CCAiCzg0cmpLQTczb3JJmAEB?oc=5	"벌면 뭐해!" 사라진 금투세 ..'코리아 디스카운트' 해소된다고? / SBS / 모아보는 뉴스 - SBS 뉴스	None	None	2024-11-09 05:30:02	SBS 뉴스
kr	https://www.mk.co.kr/news/society/11163924	남양주서 불법좌회전 차량이 오토바이 충돌…20·30대 남녀 사망 - 매일경제	신호 위반 좌회전 차량이 반대편 도로에서 직진하는 오토바이를 들이받아 2명이 숨지는 사고가 발생했다. 9일 경기 남양주남부경찰서에 따르며녀 이날 교통사고처리 특례법 위반(치사) 혐의로 20대 남성 A씨가 입건돼 조사를 받고 있다. A씨는 이날 오전 1시 30분쯤 남양주시 와부읍 팔당리 하팔당삼거리에서 승용차를 몰고 좌회전하던 중 반대편 도로에서 직진하는 오	https://pimg.mk.co.kr/news/cms/202411/09/news-p.v1.20241109.09c23310de654853b9872c71660eb961_R.jpg	2024-11-09 05:43:13	매일경제
kr	https://news.mt.co.kr/mtview.php?no=2024110917060487912	"소년범 출신 출연? 이미지 세탁이냐"…백종원 새 예능 '논란' - 머니투데이	백종원 더본코리아 대표가 멘토로 참여하는 예능프로 '백종원의 레미제라블'(이하 레미제라블)에 소년범 출신 멘티가 출연한 것이 범죄자의 이미지 세탁이라는 논란에 휘말렸다. ENA '레미제라블'은 지난 7일 유튜브 등 채널을 통해 2차 티저를 공개했다. '레미제라블'은 백 대표와 4명의 담임 셰프가 100일간 멘티 20명에게 장사 비법 등을 전수하는 취지의 ...	https://thumb.mt.co.kr/21/2024/11/2024110917060487912_1.jpg	2024-11-09 08:18:14	머니투데이
kr	https://news.kbs.co.kr/news/pc/view/view.do?ncd=8101939	‘북한 전투식량은 개고기’ 이거 믿어도 될까?…SNS는 또 다른 ‘전장’ [뒷北뉴스] - KBS뉴스	최근 휴대전화가 시도때도 없이 알림음을 쏟아냅니다. 북한군이 러시아에 파병됐다는 소식을 접한 이후 우...	http://news.kbs.co.kr/data/fckeditor/new/image/2024/11/08/302301730947157101.jpg	2024-11-08 22:01:00	KBS뉴스
kr	https://www.hani.co.kr/arti/politics/assembly/1166623.html	한동훈 “윤 규탄 집회, 이재명 위한 ‘판사 겁박’ 무력 시위” - 한겨레	9일 서울 도심에서 시민사회단체들과 야권이 윤석열 대통령을 규탄하고 ‘김건희 특검법’ 수용을 촉구하는 집회를 연 가운데, 한동훈 국민의힘 대표는 이를 “이재명 대표를 위한 판사 겁박 무력시위”라고 말했다. 한 대표는 이날 자신의 페이스북에 “이재명 대표 범죄혐의에 대한	https://flexible.img.hani.co.kr/flexible/normal/640/427/imgdb/original/2024/1109/20241109500307.jpg	2024-11-09 05:59:00	한겨레
kr	https://www.segye.com/newsView/20241109500446	'발열·오한·근육통' 감기 아니었네… 일주일만에 459명 당한 '이 병' 확산 - 세계일보	진드기 유충에 물려 발생하는 ‘쯔쯔가무시증’ 환자가 최근 3주 사이 약 8배 급증했다. 털진드기 유충의 활동이 이 시기 왕성해지는 만큼, 11월 한 달여 간 야외활동 시 예방수칙 준수가 당부된다. 8일 질병청에 따르면 지난달 중순부터 3주간 털진드기 밀도 지수가 3배 이상 높...	https://www.segye.com/content/image/2024/11/09/20241109500499.jpg	2024-11-08 20:27:57	세계일보
kr	https://www.chosun.com/international/international_general/2024/11/09/5E6VQOJRLBDYVK6PYN424CXFXE/	“담배 만져본 적도 없다”… 폐암 4기 시한부 판정 받은 50대 女, 원인은? - 조선일보	담배 만져본 적도 없다 폐암 4기 시한부 판정 받은 50대 女, 원인은	https://www.chosun.com/resizer/v2/5MZ2HLG37FEDTK4FXZEX46MZ5Y.JPG?auth=35a28328cfbd79ed2a424d5217b2891aa1ccd786a1c33e1977da288a5788438c&width=1200&height=630&smart=true	2024-11-09 04:58:43	조선일보
kr	https://www.hani.co.kr/arti/area/yeongnam/1166617.html	명태균 “대통령 부부와 나눈 가십이 뭐 중요하냐? 정치자금법만 조사하라” - 한겨레	윤석열 대통령 부부의 국회의원 선거 공천 개입 의혹 사건의 핵심인물인 명태균(54)씨가 정치자금법 위반 혐의에 대해서만 조사받겠다는 태도를 보이고 있다. 윤석열 대통령 부부에게까지 수사 범위가 확대되는 것을 막으려는 의도로 보인다. 명태균씨는 9일 창원지검에 출석해 오	https://flexible.img.hani.co.kr/flexible/normal/970/671/imgdb/original/2024/1109/20241109500522.jpg	2024-11-09 13:58:00	한겨레
kr	https://www.donga.com/news/It/article/all/20241108/130389751/1	‘꿀잠’ 자야 건강 …숙면 위해 가장 중요한 한 가지는 바로 ‘이것’ - 동아일보	‘잠이 보약’이라는 격언은 괜히 생긴 게 아니다. 잠을 잘 자야 신체와 정신건강을 유지할 수 있다.수면 장애가 비만, 당뇨병, 심장질환 위험 증가는 물론 노년기 인지·기억력 저하…	https://dimg.donga.com/wps/NEWS/IMAGE/2024/11/08/130389730.1.jpg	2024-11-08 06:09:00	동아일보
kr	https://www.hani.co.kr/arti/society/society_general/1166625.html	청년들도 총궐기 “2년 반 만에 20년 망가져…윤석열 퇴진하라” - 한겨레	‘국정농단 아웃’, ‘전쟁위기 아웃’, ‘혐오와 차별 아웃’…‘윤석열 아웃!’ 청년단체들이 모인 ‘윤석열OUT청년학생공동행동’은 9일 오후 2시 서울 청계광장에서 ‘퇴진총궐기 청년학생대회 레드카드 퍼레이드’를 열었다. 집회에 모인 청년 300여명(주최 쪽 추산)은 각자	https://flexible.img.hani.co.kr/flexible/normal/800/472/imgdb/original/2024/1109/20241109500331.jpg	2024-11-09 08:21:00	한겨레
kr	https://www.hankyung.com/article/2024110908037	'소녀상 희롱' 유튜버 소말리…이번엔 "누가 쫓아와" 112 신고 - 한국경제	'소녀상 희롱' 유튜버 소말리…이번엔 "누가 쫓아와" 112 신고, 경찰 출동해 안전조치&hellip;소말리 피해 없어	https://img.hankyung.com/photo/202411/01.38593737.1.jpg	2024-11-08 23:31:26	한국경제
kr	https://www.hani.co.kr/arti/society/society_general/1166499.html	검 특활·특경비 전액 삭감…법무부 검찰과장 항의성 사의 - 한겨레	검찰 예산을 담당하는 법무부 검찰과장이 국회 법제사법위원회 예산·결산기금심사소위위원회에서 내년도 검찰 특수활동비·특정업무경비 예산을 전액 삭감하자 항의 표시로 사표를 제출했다. 한겨레가 법무부 등을 8일 취재한 결과 임세진 법무부 검찰과장은 전날 국회 법사위 예결소위에	https://flexible.img.hani.co.kr/flexible/normal/800/462/imgdb/original/2024/1108/20241108501241.jpg	2024-11-08 05:50:00	한겨레
kr	https://imnews.imbc.com/news/2024/society/article/6654555_36438.html	오늘 '부산 불꽃축제' 100만 인파 예상‥행안부, 안전 관리 점검 - MBC 뉴스	이상민 행정안전부 장관이 오늘(9일)과 내일 양일간 부산 광안리 해수욕장 일원에서 열리는 '부산 불꽃축제' 안전 관리 대책을 살피고, 영도구 지방 소멸 대응 현장을 방문합니다. 올...	https://image.imnews.imbc.com/news/2024/society/article/__icsFiles/afieldfile/2024/11/09/J241109_12_1.jpg	2024-11-09 08:58:57	MBC 뉴스
kr	https://www.chosun.com/international/us/2024/11/08/JVJ34Z6O5RBODHP6WVGUJIEOZY/	“시진핑도 내가 미친놈인 걸 안다”... 트럼프, 中의 대만 침공시 시나리오는 - 조선일보	시진핑도 내가 미친놈인 걸 안다... 트럼프, 中의 대만 침공시 시나리오는 대선 3주전 WSJ 논설위원들과 인터뷰  관세 200%까지 인상, 中에 재앙될 것  재임 시절 푸틴엔 우크라 침공 순간    크렘린 궁 위 돔 지붕들 뜯겨 나갈 것   	https://www.chosun.com/resizer/v2/UGWCP5ZDU2734DKZO5GIDRBU3Y.png?auth=97fb4399086e4a28d23cc6ddf80103d6072d64e62cb8b84321915bca9997c463&width=601&height=315&smart=true	2024-11-08 08:20:00	조선일보
kr	https://www.donga.com/news/Society/article/all/20241109/130393804/1	[단독]펜스 밀고 경찰 폭행 …‘尹 퇴진’ 참가자 10명 현행범 체포 - 동아일보	9일 오후 전국민주노동조합총연맹(민노총), 전국민중행동 등으로 구성된 윤석열정권퇴진운동본부(퇴진운동본부)가 서울 중구 시청역, 숭례문 일대에서 연 ‘전태일열사정신계승 전국노동자대…	https://dimg.donga.com/wps/NEWS/IMAGE/2024/11/09/130393875.1.jpg	2024-11-09 08:59:00	동아일보
kr	https://news.google.com/rss/articles/CCAiC2tPOXpsaXpaaThBmAEB?oc=5	"더 줄 무기가 없다"...할 만큼 했다는 폴란드, 우크라 요구 거절 [지금이뉴스] / YTN - YTN	None	None	2024-11-08 23:00:26	YTN
kr	https://www.ohmynews.com/NWS_Web/View/at_pg.aspx?CNTN_CD=A0003078293	아슬아슬한 유동규 "보는 게 힘드니 이재명씨 가려달라" - 오마이뉴스	"재판에 앞서 이재명씨를 보는 게 힘드니까 가려주시면 좋겠다."  8일 열린 이재명 더불어민주당 대표의 '대장동·위례신도시·성남FC·백현동 의혹' 재판(서울중앙지법 형사합의33부)에 증인으로 출석한 유동규 전 성남도시개발공사 기획본부장이 공판 시작과 동시에 재판부를 향해 한 요구사항이다. 이 대표는 유 전 본부...	https://ojsfile.ohmynews.com/CRI_T_IMG/2024/1108/A0003078293_T.jpg	2024-11-08 09:01:00	오마이뉴스
kr	https://www.dailymedi.com/news/news_view.php?wr_id=918317	상급종합병원 구조전환…병상 '3000개 이상' 감축 - 데일리메디	﻿﻿﻿﻿﻿﻿전체 47개 상급종합병원 중 65%인 31곳이 구조전환에 참여하게 된 가운데 이들이 줄인 일반병상은 총 2500개에 달한다.남은 16곳 상급종합병원 중 시범사업 참여 입장을 가진 곳이 다수인데다 참여 기관 한 곳당 평균 79병상을 줄인만큼 최종 감축되는 일반병상은 3000개를 넘어설 전망이다.의료기관 별로는 서울아산병원이 가장 큰 규모인 336병상을, 세브란스병원이 290병상으로 뒤를 이었다. 반면 원광대병원(29병상), 원주세브란스병원(31병상)은 감축 폭이 가장 적었다.8일 보건복지부에 따르면 상급종합병원 구조전환 지…	https://www.dailymedi.com/data/news_cont/2411/d20241108_3717289581_1RPVl5kb_841fef28cf1bef8e5de3be61125114ac0e2529d9.jpg	2024-11-09 09:40:00	데일리메디
kr	https://www.mk.co.kr/news/politics/11163808	대통령 지지율 17%에…용산 “치열하게 변화 노력” - 매일경제	갤럽 조사서 역대 최저치 경신  “金여사, 이달 순방 동행안해” 2부속실 규모 靑때 3분의 1 강훈 “관광公 사장 지원 철회”  대통령실 “진인사대천명” 尹, 10일 긴급 경제·안보 회의	https://pimg.mk.co.kr/news/cms/202411/09/news-p.v1.20241107.4ffe884c32b8460e904fa02594b09d48_R.jpeg	2024-11-08 21:58:23	매일경제
kr	https://www.hani.co.kr/arti/area/jeju/1166616.html	금성호, 고등어 너무 많이 잡았나…해경 “평소보다 3∼5배 추정” - 한겨레	지난 8일 오전 제주 비양도 해상에서 침몰한 부산 선적 대형 선망어선 135 금성호(129t)가 사고 당시 평소보다 3∼5배 많은 양의 고등어를 잡았던 것으로 추정된다. 해경은 과도한 어획량으로 인해 어선이 기울어져 침몰했을 가능성을 열어두고 수사하고 있다. 김대철 제	https://flexible.img.hani.co.kr/flexible/normal/970/599/imgdb/original/2024/1109/20241109500246.jpg	2024-11-09 03:35:00	한겨레
kr	https://www.chosun.com/national/national_general/2024/11/08/PLFGGO3PCFAO7MRXF76MZVJCWQ/	“신고 취소해달라”... ‘화천 토막 살인’ 軍장교, 피해자인척 경찰과 전화 - 조선일보	신고 취소해달라... 화천 토막 살인 軍장교, 피해자인척 경찰과 전화	https://www.chosun.com/resizer/v2/U7OACRR5OVHO5DOVDJF5X3UZOU.jpg?auth=5cad50dd70a9116da19a8416facf29feab634205d423b095086bbdd1382fe282&width=709&height=372&smart=true	2024-11-08 07:33:21	조선일보
kr	https://imnews.imbc.com/replay/2024/nwtoday/article/6654465_36523.html	"청와대 들어가면 죽는다"‥명태균 말 듣고 이전? - MBC 뉴스	 명태균 씨의 통화녹음이 추가로 나왔습니다. 명 씨 자신이 김건희 여사에게 청와대 이전을 조언했다고 과시하는 내용인데요. 이 녹음파일을 공개한 더불어민주당은 "무리한 대...	https://image.imnews.imbc.com/replay/2024/nwtoday/article/__icsFiles/afieldfile/2024/11/09/today_20241109_070800_1_4_Large.jpg	2024-11-08 22:08:34	MBC 뉴스
kr	https://www.donga.com/news/amp/all/20241108/130392782/1	대낮 강남서 ‘7중 추돌’ 무면허 운전자 혈액서 신경안정제…‘약물 운전’ 추가 - 동아일보	서울 강남 일대에서 7중 추돌 사고를 일으킨 20대 무면허 운전자의 혈액에서 신경안정제 성분이 검출됐다. 사고 뒤 경찰에 “신경안정제를 복용했다”는 운전자의 진술과 일치하는 결과가 나온 것이다. 경찰은 특정범죄가중처벌법상 위험운전치상 혐의를 추가 적용한다는 방침이…	https://dimg1.donga.com/wps/NEWS/IMAGE/2024/11/08/130392796.2.jpg	2024-11-08 10:51:00	동아일보
kr	https://sports.khan.co.kr/article/202411090145003	‘박군♥’ 한영 “이제 각자의 길로” 익살 - 스포츠경향	가수 한영이 배우자 박군과의 일상을 익살스럽게 전했다. 8일 한영은 SMS에 “간만에 쉬는 날 아침 겸 점심, 외식하고 커피 마시고 이제 각자의 길로”라는 글과 함께 박군 사진을 올렸다. 사진 속 박군은 아우터에 모자를 쓰고 휴대전화를 응시하고 있는 모습이다. 두 사람이 함께 여유로운 시간을 보낸 후 각자 스케줄을 소화하는 일정에 대해 이모티콘까지 첨...	https://images.khan.co.kr/article/2024/11/09/news-p.v1.20241109.e4db02ce89af4dbfbc47337cd2971b81_P1.jpg	2024-11-08 16:45:00	스포츠경향
kr	https://www.chosun.com/national/court_law/2024/11/08/MVAC6MWQX5GVNB2VD52OVTDEBM/	‘서울대 200만원 절도’ 노숙인, 알고 보니 12년간 사망자 신세… 檢 기소유예 - 조선일보	서울대 200만원 절도 노숙인, 알고 보니 12년간 사망자 신세 檢 기소유예 사연 접한 피해자 10명 모두 처벌불원의사 밝혀 노숙인 다시는 과오 저지르지 않는 게 보답 애써준 사람 바르게 산다는 자부심 드리고파	https://www.chosun.com/resizer/v2/LT5AG526I623RZADZI6G4SKVPA.jpg?auth=082310f53de7fd8d345a427b1e11bc818d55cb76e4c986fe2f28fb6722e96947&width=1200&height=630&smart=true	2024-11-08 09:30:58	조선일보
kr	https://www.hani.co.kr/arti/politics/defense/1166618.html	합참 “북, 이틀째 해주·개성 일대서 전파 교란…선박·민항기 장애” - 한겨레	북한이 어제(8일)와 오늘 해주와 개성 일대에서 “위치정보시스템(GPS) 전파 교란 도발을 감행”하고 있다고 합동참모본부가 9일 밝혔다. 이날 합참은 보도자료를 내어 8∼9일 북한의 전파 교란으로 “우리 선박 수척과 민항기 수십 대가 운항 등에 일부 장애를 겪고 있다”	https://flexible.img.hani.co.kr/flexible/normal/970/646/imgdb/original/2024/1109/20241109500263.jpg	2024-11-09 03:52:00	한겨레
kr	https://zdnet.co.kr/view/?no=20241108133927	TSMC, 다음주부터 중국에 7나노 이하 칩 출하 중단 - ZD넷 코리아	대만 파운드리 업체 TSMC가 오는 11일부터 중국에 7나노미터 이하 공정 칩 출하를 중단한다.지난달 TSMC가 7나노 공정으로 제작한 칩이 고객사를 통해 우회적으로 중국 화웨이 제품에 사용된 사실이 확인되면서 파장이 일어난 바 있다. 시장조사업체 테크인사이트가 화웨이의 첨단 AI...	https://image.zdnet.co.kr/2024/10/25/f3f95fd607945d1836d877d99aadccda.jpg	2024-11-09 01:11:51	ZD넷 코리아
kr	https://www.hankyung.com/article/202411101412h	'쿵' 폭발음에 불기둥까지 "지진 난 줄"…포항제철소서 큰 불, 초기 진화 - 한국경제	'쿵' 폭발음에 불기둥까지 "지진 난 줄"…포항제철소서 큰 불, 초기 진화, 불난 3파이넥스공장 가동 차질&hellip;포스코 "피해 조사" 반복되는 포항제철 화재&hellip;포스코 '안전관리 미흡' 논란	https://img.hankyung.com/photo/202411/01.38599200.1.jpg	2024-11-09 23:21:48	한국경제
kr	https://imnews.imbc.com/replay/2024/nwtoday/article/6654623_36523.html	"김건희 특검법 수용"‥"판사 겁박 무력시위" - MBC 뉴스	 더불어민주당 등 야당들이 어제 서울 도심에서 대규모 집회를 열고 김건희 여사 특검법 수용을 촉구했습니다. 노동계와 시민사회도 정부의 실정을 비판하며 윤석열 대통령 퇴진...	https://image.imnews.imbc.com/replay/2024/nwtoday/article/__icsFiles/afieldfile/2024/11/10/today_20241110_070659_1_4_Large.jpg	2024-11-09 22:07:33	MBC 뉴스
kr	https://news.google.com/rss/articles/CBMic0FVX3lxTE4xTDlNNnNnbV84Q2VOTGVEUGRucWp3LWMwNW5pWlBFYmNSQUZNcFh0azNjSFNMbmRxS0RqWnVyREEwd3lDR1ZLTHN1d0tpVjUtMl9xaHNoOGl6Q2ZyMmVOZFhwZTFINW5JMWh3QlBWV054UEXSAXZBVV95cUxNc0NIUjBMR3Rsd1VvcXhBNFV1R05TRW9tQi1XSFB0LS1Ka2lyQ0paMWtoaHdmX2lfUnMtbUFXWmZCSVdWVm9VZW5iTnhpSWNMbTlfeXJaNlFXNkp3VmNpVDBmSHkzdlVqcDQybU9IWHROZzJkSDJR?oc=5	윤석열 대통령은 남은 임기 절반 채울 수 있을까 - 경향신문	None	None	2024-11-09 00:00:00	경향신문
kr	https://news.ikbc.co.kr/article/view/kbc202411090024	민주 "尹기자회견 변명 가득..尹-明 관계, 더 조사해야" - KBC광주방송	더불어민주당이 윤석열 대통령이 공천개입 의혹의 핵심인물인 명태균 씨와의 관련성을 부인한 것과 관련해 	https://www.ikbc.co.kr/data/kbc/image/2024/11/09/kbc202411090034.jpg	2024-11-09 08:49:46	KBC광주방송
kr	https://www.chosun.com/national/weekend/2024/11/09/UHKMOPW6FZA23PI24QWFWG7PSU/	美 대선의 노스트라다무스, 그때는 맞고 지금은 틀린 이유 - 조선일보	美 대선의 노스트라다무스, 그때는 맞고 지금은 틀린 이유 아무튼, 주말 美 대선 트럼프 승리 선거 예측의 세계	https://www.chosun.com/resizer/v2/J67K6CGH55PR5F6DNHOG4KAS4Y.jpg?auth=9e82fa53b0a313ad0946f08f548b89cc73abd8e8f016615a9b8cf421aee7aaa5&width=1200&height=630&smart=true	2024-11-08 15:50:19	조선일보
kr	https://www.hani.co.kr/arti/society/society_general/1166630.html	겨울 온 줄 알았죠?…내일 낮 20도 안팎 가을 날씨 - 한겨레	일요일인 내일 낮 기온은 20도 내외로 온화한 날씨가 예상된다. 다만 일교차가 크고, 전남과 제주도 일부 지역에는 비가 내리는 곳도 있겠다. 기상청은 10일 아침 최저기온은 6∼15도, 낮 최고기온은 16∼21도로 예보했다. 주요 지역 아침 최저기온은 서울 10도, 인	https://flexible.img.hani.co.kr/flexible/normal/800/593/imgdb/original/2024/1109/20241109500428.jpg	2024-11-09 13:15:00	한겨레
kr	https://www.khan.co.kr/economy/economy-general/article/202411091109001	“머스크가 최대 수혜자?”…트럼프 당선에 테슬라 시총 1조 달러 돌파 - 경향신문	도널드 트럼프 전 대통령이 미 대선에서 당선되면서 미국 전기차 제조업체 테슬라의 주가가 8일(현지시간) 사흘째 급등, 시가총액이 1조 달러를 돌파했다. 8일 뉴욕증시에서 테슬라 주가는 전 거래일보다 24.31달러(8.19%) 오른 321.22달러에 마감했다. 이날 장중 한때 주가는 328.71달러(10.71%)까지 올라 52주 신고가를 기록하기도 했다...	https://img.khan.co.kr/news/2024/11/09/news-p.v1.20241109.fd10d9b76efa4a1395361b203c3f14eb_P1.jpg	2024-11-09 02:09:00	경향신문
kr	https://www.hankookilbo.com/News/Read/A2024110910350003283	시민 2명 찌른 광교 사슴, 나흘 만에 생포... "주인 없으면 입양" - 한국일보	경기 수원시에서 시민 2명을 뿔로 공격한 사슴이 출몰 나흘 만에 포획됐다. 9일 수원시에 따르면, 전문구조단은 이날 오전 9시쯤 장안구 하광교	https://newsimg-hams.hankookilbo.com/2024/11/09/1350fd52-dad8-40b0-bb1c-a0ddb496f9dd.png	2024-11-09 01:56:45	한국일보
kr	https://www.dailian.co.kr/news/view/1427194	"유부남 동료가 성폭행…" 꽃뱀 취급에 피해女, 회의 중 투신했다 - 데일리안	성폭력 피해자가 징계 위원회에서 모욕적인 발언을 듣는 등 '2차 가해'를 당해 창문으로 투신하는 사건이 발생했다.8일 JTBC '사건반장'에 따르면 지난 8월 국방과학연구소 직원인 A씨는 동료 직원인 12살 연상의 유부남 B씨와 함께 출장길에 올랐다.출장 중 B씨는 A씨의 숙소에 침입해 "이렇게 된 김에 그냥 한번 같이 자자"라며 성폭행을 시도했다.A씨의 	http://cdnimage.dailian.co.kr/news/202411/news_1731157794_1427194_m_1.jpeg	2024-11-09 13:10:00	데일리안
kr	https://news.google.com/rss/articles/CCAiC2JvcTJVWVNmRlFBmAEB?oc=5	"지지율 15%, 정권유지 힘들어"...임기단축 '개헌' 가능성은? [Y녹취록] / YTN - YTN	None	None	2024-11-09 06:53:29	YTN
kr	https://www.hankyung.com/article/2024110800807	"가족 아니었다"…폼페이 화석에 숨겨진 '대반전' - 한국경제	"가족 아니었다"…폼페이 화석에 숨겨진 '대반전', 고정삼 기자, 국제	https://img.hankyung.com/photo/202411/01.38589834.1.jpg	2024-11-08 07:51:39	한국경제
kr	https://imnews.imbc.com/replay/2024/nwdesk/article/6654578_36515.html	"트럼프, 파리협정 탈퇴할 듯"‥지구촌 기후위기 대응 '비상' - MBC 뉴스	 트럼프 당선인은 취임 즉시 지구온난화를 막기 위한 국제협약인, '파리협정'을 또 탈퇴할 것으로 보입니다. 지구 전체의 기후위기 대응도 타격을 피할 수 없게 됐습니다. ...	https://image.imnews.imbc.com/replay/2024/nwdesk/article/__icsFiles/afieldfile/2024/11/09/desk_20241109_201736_1_8_Large.jpg	2024-11-09 11:18:26	MBC 뉴스
kr	https://www.hani.co.kr/arti/international/america/1166586.html	“비혼·비연애·비섹스·비출산”…한국 ‘4비 운동’ 배우는 반트럼프 여성들 - 한겨레	미국 대선이 도널드 트럼프 당선자의 승리로 마무리되면서 많은 미국 젊은 층이 한국 여성주의의 ‘4비’ 운동에 관심을 돌리고 있다고 워싱턴 포스트가 7일(현지시각) 보도했다. 이런 현상은 트럼프 당선자가 아무렇지 않게 성적인 모욕을 하고 대법원의 임신중지권 불인정 판결에	https://flexible.img.hani.co.kr/flexible/normal/721/476/imgdb/original/2024/1108/20241108502787.jpg	2024-11-09 13:14:00	한겨레
kr	https://www.hankyung.com/article/202411088582g	"日 가느니 中 간다"…무비자 정책에 항공사 '들썩' [차은지의 에어톡] - 한국경제	"日 가느니 中 간다"…무비자 정책에 항공사 '들썩' [차은지의 에어톡], 이달 8일부터 내년 말까지 중국 여행 시 비자 필요 無 더딘 수요 회복으로 운임 할인 계속된 중국 노선 무비자 정책으로 여행 수요 반등 기대감&uarr;	https://img.hankyung.com/photo/202411/ZA.38576524.1.jpg	2024-11-09 22:19:37	한국경제
kr	https://mydaily.co.kr/page/view/2024110920535085008	김광수 대표 "`미스트롯`에 월세 보증금 6억 투자…몇백억 벌었다" [가보자고](MD리뷰) - 마이데일리	MBN '가보자GO 시즌3'/MBN '가보자GO 시즌3' 방...	https://mydaily.co.kr/photos/2024/11/09/2024110922120763453_l.jpg	2024-11-09 13:30:00	마이데일리
kr	https://news.google.com/rss/articles/CBMiekFVX3lxTE9YQUJkaWd3RmhacmdRdk1kVDhmSXlxeGt6RWY2VVFkemVSNUozeUFNLUF0Y1BtYXJQZ3hiaEFLYWppSnlxbDdjUkJ1T1NObGZ2Y2RGSC1CS3B6M2J4RWUyOWJndU5WdHdvY2pjSjQ3TEM5eG9RRHJiRDFB0gF6QVVfeXFMTm52dDlJQVlCZ1FqQkpmbS1hRmhpckY2ZTJBYTh5czBYV2J6TV8yMGNJeEwxTGdmSnMtVGl5WEtyT1k2VndsWVlKTkZHTVUtYnBwMWtvcjZ0NlFzcV82eEVxRnpvNmJheE55SzF2Ri11cTFWUTU1WXhjR0E?oc=5	'충돌' 피하는 한동훈‥여당 내 '3자 특검' 고개 - MBC 뉴스	 윤석열 대통령의 대국민 담화 하루 만에 한동훈 국민의힘 대표가 "중요한 것은 실천"이라는 입장을 내놨습니다. 기자회견에 대한 비판을 자제하면서 윤석열 대통령과 정면충돌...	https://image.imnews.imbc.com/replay/2024/nwtoday/article/__icsFiles/afieldfile/2024/11/09/today_20241109_071007_1_5_Large.jpg	2024-11-08 22:10:47	MBC 뉴스
kr	https://news.ikbc.co.kr/article/view/kbc202411090015	"병원 가도 소용없으니 죽였다" 후배 살해 후 성매매하러 간 60대 남성 - KBC광주방송	동네 후배를 살해한 뒤 성매매를 하러 간 60대 남성이 징역 13년형을 선고받았습니다.  서울고법 춘천재판부 제1형사부는 지난 6일 살인 혐의로 기소된 6	https://www.ikbc.co.kr/data/kbc/image/2024/11/09/kbc202411090017.jpg	2024-11-09 05:17:42	KBC광주방송
kr	https://news.google.com/rss/articles/CBMiYEFVX3lxTE9Lb1FWcS1yTFF4QzB4di1KV3FXUXJUS3ZVdk1vZ2wza0lqS1dGTDhxN2NkeFM2NXVPMGVBTnl3VzJTd29waVczNkt3YzZEUDhXQjNPNGlPTDFyWF84NjFCag?oc=5	한석규, 집주인 아들 입 연다…밝혀지는 `송민아 살인사건` 전말 [이친자] - 마이데일리	MBC 금토드라마 '이토록 친밀한 배신자'/MBC 금토드라마...	None	2024-11-09 12:50:00	마이데일리
