country_code	url	title	description	image_url	publish_date	source
kr	https://www.khan.co.kr/world/world-general/article/202411021431001	미국 핼러윈 축제 총격에 사상자 속출···독일에선 폭동 일어나 - 경향신문	세계 곳곳에서 핼러윈 축제 동안 사건사고가 속출했다. 미국 플로리다주 올랜도에서 1일(현지시간) 열린 핼러윈 거리 축제에서 총격이 벌어져 2명이 숨지고 7명이 다쳤다. AP통신에 따르면 이날 새벽 1시 올랜도의 술집과 식당가에서 총격이 벌어졌다. 코스튬을 입은 수천 명의 인파가 거리를 메운 상황에서 총격이 발생해 사상자가 속출했고, 총소리에 놀란 사람...	https://img.khan.co.kr/news/2024/11/02/news-p.v1.20241102.5a6da24fb5b2499cab1cb134ed4ff7bb_P1.jpg	2024-11-02 05:31:00	경향신문
kr	https://news.google.com/rss/articles/CCAiC25ldkFkZWJWRklRmAEB?oc=5	러시아 국민들, 눈물의 자급자족...푸틴, 고개 숙였지만 '처참' [지금이뉴스] / YTN - YTN	None	None	2024-11-02 08:30:28	YTN
kr	https://www.hani.co.kr/arti/society/environment/1165511.html	11월 첫 일요일 최고 23도까지…늦은 밤부터 비 예보 - 한겨레	3일 한낮 최고기온이 23도까지 올라가는 포근한 가을 날씨가 이어질 것으로 보인다. 기상청은 이날 낮 기온이 전국 대부분 지역에서 20도 이상으로 올라 포근한 날씨가 이어질 것으로 전망했다. 아침 최저기온은 6∼15도, 낮 최고기온은 19∼23도로 예보됐다. 주요 지역	https://flexible.img.hani.co.kr/flexible/normal/970/646/imgdb/original/2024/1103/20241103500155.jpg	2024-11-03 00:09:00	한겨레
kr	https://www.munhwa.com/news/view.html?no=20241102MW072459938237	히식스 베이스 조용남 별세…“록그룹 1세대·록 저변 확대”(종합) - 문화일보	1960~70년대 인기를 누린 그룹사운드 ‘히파이브(He5)’와 ‘히식스(He6)’에 몸 담았던 베이시스트 조용남이 별세했다. 향년 77.1일 박성서 대중음악 평론가와 대중음악계에 따르면, 조용남은 이날 0시40분께 지병으로 눈을 감았다..	https://image.munhwa.com/gen_news/202411/20241102MW072459938237_b.jpg	2024-11-01 22:24:00	문화일보
kr	https://www.hani.co.kr/arti/society/environment/1165480.html	‘콩레이’ 덮친 제주…101년 만에 11월 최다 강수량 기록 - 한겨레	2일 전국이 대체로 흐리고 수도권을 제외한 곳곳에 비가 내리겠다. 제21호 태풍 ‘콩레이’ 영향으로 기록적인 가을 폭우가 내린 제주도는 오후까지 비가 내리겠다. 전날부터 이날 오전 6시까지 제주지방기상청 지점에는 238.4㎜의 비가 내려 1923년 이 지점 기상관측을	https://flexible.img.hani.co.kr/flexible/normal/970/703/imgdb/original/2024/1102/20241102500117.jpg	2024-11-02 07:55:00	한겨레
kr	https://www.sportivomedia.net/news/articleView.html?idxno=13563	미 유튜버 '조니 소말리'의 소녀상 모독에 한국인 공분…SNS 신고마저 거절 - 스포르티보 미디어 (Sportivo MEDIA)	미국 유튜버 조니 소말리가 최근 유튜브 및 소셜미디어에 한국 소녀상에 입맞춤을 하는 사진을 게시하며 한국 내에서 큰 논란을 일으켰으며, 소셜미디어인 인스타그램에 소녀상에 이상한 행동을 하는 사진에 대한 게시물 삭제 신고가 되지 않는 것에 논란이 되고 있다. 조니 소말리는 이전에도 여러 차례 한국 사회와 문화를 경시하는 발언과 행동을 일삼아 한국인들의 공분을 샀으며, 이번에는 한국 역사와 아픔을 상징하는 소녀상을 모독하는 행위로 도를 넘었다는 비판을 받고 있으며, 이것을 인스타그램으로 신고를 했지만, 거절을 당하는 황당한 사건이 생겼	https://cdn.sportivomedia.net/news/thumbnail/202411/13563_14312_3517_v150.jpg	2024-11-02 11:37:08	스포르티보 미디어 (Sportivo MEDIA)
kr	https://www.hani.co.kr/arti/international/europe/1165469.html	스페인 홍수 사망자 200명 넘어…약탈 범죄도 일어나 - 한겨레	스페인 동부 발렌시아 남부 여러 마을을 휩쓸고 지나간 홍수로 사망한 이의 숫자가 200명을 넘어섰다. 에이피(AP)통신은 스페인 정부가 이번 홍수로 최소 205명이 사망했고, 이중 202명이 발렌시아에서 사망했다고 밝혔다. 아에프페(AFP)통신은 이웃 지역인 카스티야	https://flexible.img.hani.co.kr/flexible/normal/970/646/imgdb/original/2024/1101/20241101502849.jpg	2024-11-01 13:25:00	한겨레
kr	https://news.google.com/rss/articles/CCAiC0huaUNPZ3RHdWVBmAEB?oc=5	‘475m 세계 최장 라면 레스토랑’…구미 라면축제 개막 / KBS 2024.11.02. - KBS News	None	None	2024-11-02 01:03:03	KBS News
kr	https://www.chosun.com/international/china/2024/11/10/BOVYSXDTX5D5NGQWEMQYTQYMEA/	전력난에 대정전 4번, TSMC 공장 미국행… ‘탈원전 8년’ 대만의 3중고 - 조선일보	전력난에 대정전 4번, TSMC 공장 미국행 탈원전 8년 대만의 3중고 최유식의 온차이나    탈원전 이후 4차례 대정전, 올 2분기도 43.3% 급증   원전 재개 모색하지만 집권당 내 이견, 전문 인력 부족 등 난제 겹겹	https://www.chosun.com/resizer/v2/QF5KS3B7QRD3TPQYLLP6XMGGHM.jpg?auth=ea232afe0a60dc0fcb396bd08b0112171db9d0719d547c6255c18f190261c8f1&width=800&height=420&smart=true	2024-11-02 21:18:29	조선일보
kr	https://www.hankyung.com/article/2024110367287	6억 '람보르기니' 들이받은 아반떼…대체 얼마 물어줘야 [영상+] - 한국경제	"어떡해"…'람보르기니' 들이받은 아반떼, 얼마 물어줘야 [영상+], 이송렬 기자, 사회	https://img.hankyung.com/photo/202411/01.38525166.1.gif	2024-11-03 04:42:41	한국경제
kr	https://sports.donga.com/ent/article/all/20241103/130347297/1	조세호, 하객들 재산 차별 했나…주우재 “결혼식장 밖에 앉아” (놀뭐)[TV종합] - 스포츠동아	‘놀면 뭐하니?’ 유재석이 ‘급식대가’표 김장김치와 수육에 감탄을 쏟아냈다.11월 2일 방송된 MBC ‘놀면 뭐하니?’(연출 김진용 이주원 왕종석 소인지 방성수/작가 노민선)는 …	https://dimg.donga.com/wps/SPORTS/IMAGE/2024/10/16/130227345.1.jpg	2024-11-02 23:57:00	스포츠동아
kr	https://www.chosun.com/international/us/2024/11/03/KGFGZNQGQVFOFP4LMXO4A3MZZQ/	SNL ‘깜짝’ 등장 해리스 “‘상대방(트럼프)’은 못하는 일 할 수 있어” - 조선일보	SNL 깜짝 등장 해리스 상대방트럼프은 못하는 일 할 수 있어 예고없이 깜짝 등장...부동층 표심 공략 의도   자신 모습으로 분장한 배우에게 덕담, 트럼프 겨냥한 발언도	https://www.chosun.com/resizer/v2/NKGCX7AWOBIUZPXV3PP75QF5UA.jpg?auth=55ae9ef25360121d921e130b859c084918755b0b4c88e59868056a38f031ec81&width=1200&height=630&smart=true	2024-11-03 04:31:58	조선일보
kr	https://www.hankyung.com/article/2024110147517	"국민이 판단"…尹 탄핵에 선 긋는 민주당, 속내는 [이슬기의 정치 번역기] - 한국경제	"국민이 판단"…尹 탄핵에 선 긋는 민주당, 속내는 [이슬기의 정치 번역기], 때론 이해 힘든 정치인의 언행을 국민의 언어로 尹 육성 녹취록까지&hellip;국정 지지율 10%대 민주당, 그런데도 '탄핵' 언급은 자제 "역풍 피하면서 탄탄한 탄핵 빌드업"	https://img.hankyung.com/photo/202411/ZA.38279483.1.jpg	2024-11-01 23:49:01	한국경제
kr	https://www.donga.com/news/Society/article/all/20241102/130346547/1	강남역 8중 추돌, 역주행에 무면허… “신경안정제 복용” - 동아일보	주말 서울 강남역 한복판에서 8중 추돌 사고가 발생했다.2일 서울 강남경찰서와 소방당국 등에 따르면 오후 1시 42분쯤 서울 강남구 테헤란로 국기원입구 방향에서 강남역 방향 1~…	https://dimg.donga.com/wps/NEWS/IMAGE/2024/11/03/130347604.1.jpg	2024-11-02 05:29:00	동아일보
kr	https://www.hani.co.kr/arti/politics/diplomacy/1165544.html	중국, 한국에 공들이나…파격적인 ‘무비자 입국’ 첫 허용 - 한겨레	중국이 오는 8일부터 한국인에게 무비자 입국을 허용한다고 지난 1일 발표했다. 한·중 수교 이후 한국인에 대한 중국 방문 비자 면제가 이뤄진 건 이번이 처음이다. 중국이 이런 ‘파격적인’ 조치를 통해 한국에 어떤 신호를 보낸 것인지에 관심이 쏠리고 있다. 중국 외교부는	https://flexible.img.hani.co.kr/flexible/normal/421/253/imgdb/child/2024/1103/53_17306151206921_5717306150760734.jpg	2024-11-03 06:43:00	한겨레
kr	https://isplus.com/article/view/isp202411030007	김다예, 딸 전복이 신생아 촬영 접종 우려 발언 논란 되자 결국… - 일간스포츠	방송인 박수홍의 아내 김다예가 딸 전복이 신생아 촬영 후 벌어진 접종 논란에 대해 사과했다. 김다예는 2일 자신의 SNS에 일부 커뮤니티 회원들을 향해...	https://isplus.com/data/isp/image/2024/11/03/isp20241103000008.png	2024-11-02 22:36:00	일간스포츠
kr	https://www.hankookilbo.com/News/Read/A2024110221190001906	양정원, 사기 혐의 해명 "속상하고 마음 무거워" - 한국일보	필라테스 강사 출신 배우 양정원이 사기 및 가맹사업법 위반 혐의로 고소를 당했다는 보도와 관련해 해명에 나섰다. 2일 양정원은 자신의 SNS에	https://newsimg-hams.hankookilbo.com/2024/11/02/e960117b-4e70-40ef-ae07-0d968898a7b8.png	2024-11-02 12:51:40	한국일보
kr	https://news.ikbc.co.kr/article/view/kbc202411030001	광양서 빨래 널던 40대 여성, 추락해 사망 - KBC광주방송	아파트 16층에서 빨래를 널던 40대 여성이 추락해 숨졌습니다.  2일 광양소방서에 따르면 이날 오전 9시 13분쯤 전남 광양의 한 아파트 앞 화단에 사람이 	https://www.ikbc.co.kr/data/kbc/image/2024/11/03/kbc202411030002.png	2024-11-02 21:21:49	KBC광주방송
kr	https://imnews.imbc.com/replay/2024/nwdesk/article/6652310_36515.html	장외 나선 야권 "국민 맞선 대통령 최후는 비참"‥"이재명 방탄집회" - MBC 뉴스	 더불어민주당이 주말인 오늘 서울 도심에서 대규모 장외집회를 열고 '김건희 여사 특검법'을 수용하라며 윤석열 대통령을 향한 총공세에 나섰습니다. 박근혜 전 대통령 탄핵으...	https://image.imnews.imbc.com/replay/2024/nwdesk/article/__icsFiles/afieldfile/2024/11/02/desk_20241102_200152_1_1_Large.jpg	2024-11-02 11:02:25	MBC 뉴스
kr	https://www.chosun.com/international/us/2024/11/03/RNWFOZH6ONGILJCHY72ZDANFDQ/	해리스 “한국, 이미 상당한 방위비 분담… 트럼프는 동맹 폄하” - 조선일보	해리스 한국, 이미 상당한 방위비 분담 트럼프는 동맹 폄하 한국계 유권자에 지지 호소 재미 한인 용기와 성취 존경해	https://www.chosun.com/resizer/v2/UYIEWM7UNJLYPM3YPMMBUJIQWU.jpg?auth=41aab23fc2e4a8b5eac127f4b527300c7edaf21a752d8b2dee7168adbd0fd55d&width=1200&height=630&smart=true	2024-11-02 21:55:00	조선일보
kr	https://www.hani.co.kr/arti/politics/politics_general/1165466.html	윤석열판 ‘태블릿PC’ 나왔다, 검찰로 틀어막을 수 있겠나 [논썰] - 한겨레	  (한겨레 ‘오늘의 스페셜’ 연재 구독하기) https://www.hani.co.kr/arti/subscribe-recommend 안녕하세요. 논썰의 이재성입니다. 드디어 트리거가 당겨졌습니다. 윤석열 대통령이 공천에 개입한 육성을 더불어민주당이	https://flexible.img.hani.co.kr/flexible/normal/970/546/imgdb/original/2024/1101/20241101502779.jpg	2024-11-02 12:30:00	한겨레
kr	https://www.donga.com/news/Inter/article/all/20241103/130347190/1	푸틴 측근 “우크라 나토 가입시키면 ‘3차대전’…美, 전쟁서 손 떼라” - 동아일보	블라디미르 푸틴 러시아 대통령 측근인 드미트리 메드베데프 러시아 안보회의 부의장은 미국이 우크라이나 전쟁에 지속적으로 관여할 시 3차 세계대전으로 이어질 수 있다고 경고했다.특히…	https://dimg.donga.com/wps/NEWS/IMAGE/2024/11/03/130347191.1.jpg	2024-11-02 22:27:00	동아일보
kr	https://www.nocutnews.co.kr/news/6237870	집권 3년차 尹 지지율 20%선 붕괴 왜…'비상등' 켜진 용산 - 노컷뉴스	윤석열 대통령의 지지율이 취임 후 처음으로 10%대로 떨어졌다는 여론조사 결과가 나오면서 국정 동력 확보에 대한 위기감이 더욱 고조되고 있다. 특히 보수 텃밭이자 핵심 지지층인 대구·경북(TK) 지지율 마저 무너..	https://file2.nocutnews.co.kr/newsroom/image/2024/11/03/202411030014230284_0.jpg	2024-11-02 22:00:00	노컷뉴스
kr	https://imnews.imbc.com/news/2024/society/article/6652439_36438.html	"아줌마, 아줌마!" 하더니 '헉'‥'묻지마 공격'에 기절했는데 - MBC 뉴스	지난 2022년 8월 21일 자정이 지난 시각, 전북 전주시 덕진구 인후동의 한 골목길. 30대 남성 A씨가 길을 걷던 40대 여성 뒤를 따라오더니 "아줌마, 아줌마"라며 불러 세...	https://image.imnews.imbc.com/news/2024/society/article/__icsFiles/afieldfile/2024/11/03/DC20241103_2.jpg	2024-11-03 06:51:45	MBC 뉴스
kr	https://www.mk.co.kr/news/business/11157691	회사도 직원도 “이러다 다 죽어”…‘무노동 무임금’ 1명당 ‘500만원 손해’ 일으킨 파업 - 매일경제	“이러다 다 죽어” 넷플릭스 오리지널 한국 드라마 ‘오징어게임’에 나오는 대사다. 드라마뿐 아니라 현실에서도 통용될 수 있는 말이다. 현대트랜시스 파업에서도 “이러다 회사도 직원도 다 죽어”라는 말이 나올 수 있다는 우려가 나오고 있다. 현대트랜시스 노조는 작년 영업이익의 2배에 달하는 성과급을 요구하며 한달 가까이 파업을 강행하고 있다. 현대트랜시스의 최	https://pimg.mk.co.kr/news/cms/202411/02/news-p.v1.20241102.c77219c23b3b41a5b81025eb919df9d9_R.jpg	2024-11-03 00:00:00	매일경제
kr	https://news.google.com/rss/articles/CCAiCzVqNF9xRjl0eFljmAEB?oc=5	정체 드러낸 '분양의 여왕' "제보자들 믿지 마"라며.. [뉴스.zip/MBC뉴스] - MBCNEWS	None	None	2024-11-03 06:24:14	MBCNEWS
kr	https://www.chosun.com/sports/baseball/2024/11/02/QZMFXB6VJJC63LUYWRTDCSCELE/	한국, 쿠바와 평가전 13대3 완승… 2연전 싹쓸이 - 조선일보	한국, 쿠바와 평가전 13대3 완승 2연전 싹쓸이	https://www.chosun.com/resizer/v2/GMOZ6LHIEZLEZAVMT5HNPZZQQM.jpg?auth=48d311fe71e1230b29354fde7ee107ae1b91b0a3ad0e845637cd9f5e37cdd1bd&width=1200&height=630&smart=true	2024-11-02 08:52:00	조선일보
kr	https://www.hankookilbo.com/News/Read/A2024110213020005778	"아버지 시신 냉동고에 숨겨... 그럴 이유 있었다" 40대 1년 만에 자수 - 한국일보	70대 아버지 시신을 1년 간 집안 냉동고에 보관하고, 사망 신고도 하지 않은 40대 아들이 경찰에 자수했다.  2일 경기 이천경찰서는 "사체	https://newsimg-hams.hankookilbo.com/2024/11/02/0d7884e3-63c2-4520-9e52-3b2adae54190.jpg	2024-11-02 04:10:37	한국일보
kr	https://www.hani.co.kr/arti/politics/defense/1165556.html	한·미·일, 미 전략폭격기 ‘B-1B’ 포함 공중훈련…북 ICBM 대응 - 한겨레	북한의 대륙간탄도미사일(ICBM) ‘화성-19형’ 시험발사(10월31일)에 맞서 한·미·일이 미 전략폭격기 ‘비(B)-1비(B)’가 참여한 공중훈련을 실시했다. 미국 전략폭격기의 한반도 전개는 올 들어 4번째, 한·미·일 공중훈련은 올 들어 2번째다. 합동참모본부(합참	https://flexible.img.hani.co.kr/flexible/normal/640/360/imgdb/original/2024/1103/20241103501412.jpg	2024-11-03 07:47:00	한겨레
kr	https://www.mk.co.kr/news/world/11157942	우크라 “북한군 60㎜ 박격포·야간투시경 무장…7000명 집결” - 매일경제	러시아에 파병된 북한군 중 7000여명이 지난달 말 우크라이나 국경에 배치됐으며 무장을 마쳤다는 주장이 나왔다. 2일(현지 시각) 우크라이나 군은 러시아에 파병된 북한군 중 7000여명이 지난달 말 우크라이나 국경에 배치됐으며, 60mm 박격포와 피닉스 대전차유도미사일(ATGM), 야간투시경 등으로 무장했다고 주장했다. 우크라이나 국방정보국(DIU)은 이날	https://pimg.mk.co.kr/news/cms/202411/03/news-p.v1.20241103.f0f57669952e419b8feb9ea20a9f6323_R.jpg	2024-11-03 07:25:30	매일경제
kr	https://www.hani.co.kr/arti/opinion/column/1165555.html	“전쟁이 온다” [신영전 칼럼] - 한겨레	 신영전 | 한양대 의대 교수 전 군이 비상대기 상태다. 병사들의 휴가도 제한되고 있다. 파주, 김포, 연천 지역은 ‘위험구역’으로 지정되어 안보 관광도 중단되었다. 미국 국방부는 러시아 파병 북한군을 공격 대상으로 간주할 것이라 밝혔다. 러시아-우크라이나에	https://flexible.img.hani.co.kr/flexible/normal/640/427/imgdb/original/2024/1103/20241103501402.jpg	2024-11-03 07:09:00	한겨레
kr	https://news.google.com/rss/articles/CBMieEFVX3lxTE1Xd014NS1JQmdTaTlWWW1yUjl0TFpadjU0NmtXNTVkNjVaUVd1amt6M1BNcXVmZ1dTQldjalVwTk83WUpteFZ1Y2FEV1dCUDM2WW9GWFk0cUlmUGtUTE90c2hNajhWcExRV245WGJReVg4aTZRbklXZtIBeEFVX3lxTE5TQmQyYmZlNHRJdGdUZHlJTVNlOXozZ21rcm93US14RmczYXN4a3E2Z2FZZEJwS3hlQ2tHcTNBVDBVUnU1SXd1U056SW5VMGZZeENobldXMFhTQnZ0QzdFY0R6NGRTLWlua1VUbVg3bl9Jbm83cDRZRw?oc=5	"김 여사 때문에 나라 블랙홀‥순방은 가면서 국회 안 오나" - MBC 뉴스	윤석열 대통령이 내일 국회에서 2025년도 예산안 시정연설에 불참하기로 하자, 유승민 전 국민의힘 의원이 "야당이 돌 던져도 맞을 각오로 국회에 와야 한다"고 촉구했습니다. 유 전...	https://image.imnews.imbc.com/news/2024/politics/article/__icsFiles/afieldfile/2024/11/03/DC20241103_1.jpg	2024-11-03 05:25:30	MBC 뉴스
kr	https://www.yonhapnewstv.co.kr/news/MYH20241103009000032	트럼프로 기우나 싶더니…미 대선 경합주, 다시 초박빙 대결 - 연합뉴스TV	트럼프로 기우나 싶더니…미 대선 경합주, 다시 초박빙 대결

[앵커]

도널드 트럼프 전 대통령 쪽으로 유리하게 흘러가는 듯했던 미국 대선의 판도가 선거일이 가까워지면서 다시 초접	https://d2k5miyk6y5zf0.cloudfront.net/article/MYH/20241103/MYH20241103009000032.jpg	2024-11-03 08:23:50	연합뉴스TV
kr	https://news.google.com/rss/articles/CBMibkFVX3lxTE0yMkY4djcxLUdLNWgwNGRWalJTNXJ1TG83Zk04N0JxU2h3VW5zVm10cmc2Y3l0dHhsc0ZiQ25LQkdVT1RVUW9QeEFmVkV4WmowakF5MnpQWGxLWG9fakpsX0ZQX29mNlZHUUhWeEpR?oc=5	젤렌스키 “북한군 선제타격” 언급…장거리 무기 지원 촉구 - 한겨레	볼로디미르 젤렌스키 우크라이나 대통령이 우크라이나군이 러시아 파병 북한군을 선제 공격하는 방안도 있다며 서방에 장거리 무기 지원을 촉구했다. 드미트리 메드베데프 러시아 전 대통령은 미국이 우크라이나 분쟁에 기름을 끼얹으면 제3차 세계대전을 겪게 될 것이라고 위협하는 등	https://flexible.img.hani.co.kr/flexible/normal/970/582/imgdb/child/2024/1103/53_17306099192535_20241030503161.jpg	2024-11-03 07:49:00	한겨레
kr	https://www.hani.co.kr/arti/politics/assembly/1165518.html	안철수 “김건희 특감만으론 이미 늦어…윤, 대국민 사과해야” - 한겨레	안철수 국민의힘 의원은 3일 윤석열 대통령을 향해 “지지율 폭락의 대위기를 탈출하고 국정을 정상화하기 위해서는 대통령이 국민께 사과해야 한다”고 촉구했다. 안 의원은 특히 “김건희 여사 리스크를 매듭짓지 않고 국정을 정상화한다는 것은 사실상 힘들어졌다”며 ‘김건희 특검	https://flexible.img.hani.co.kr/flexible/normal/600/418/imgdb/original/2024/1103/20241103500584.jpg	2024-11-03 02:41:00	한겨레
kr	https://www.mk.co.kr/news/society/11157813	‘명태균 의혹’ 김영선 전 의원, 공천 의혹에 대해 꺼낸 말이… - 매일경제	김건희 여사의 ‘공천 개입 의혹’, 또 명태균씨와 ‘돈 거래 의혹’의 핵심 관계자인 김영선 전 국민의힘 의원이 검찰에 출석했다. 김 전 의원은 3일 오전 9시 38분께 검찰 조사를 받고자 창원지검 청사에 출석했다. 그는 청사에 들어가기 전 이번 의혹에 관한 입장을 밝히며 “지난 대선 당시 발생한 여론조사 비용 문제는 저도 언론 보도를 보고 알았다”고 말했다	https://pimg.mk.co.kr/news/cms/202411/03/news-p.v1.20241103.277e8dcb4e0a4b4fac532b43bd72f9b2_R.jpg	2024-11-03 02:16:44	매일경제
kr	https://www.mk.co.kr/news/society/11157663	북한강에서 발견된 ‘토막 시신’의 정체…경찰, 잠수부 동원해 수색중 - 매일경제	강원 화천군 북한강에서 2일 시신의 일부가 발견됐다. 현재로서는 토막 시신인지, 북측에서 유실된 시신인지 확인이 어려운 상황으로 알려졌다. 화천경찰서 등에 따르면 이날 오후 2시 46분께 화천읍 화천체육관 앞 북한강에서 다리로 추정되는 시신 일부가 수면 위로 떠올랐다. 주민 등의 신고를 받은 경찰은 잠수부 등을 투입해 시신 일부가 떠오른 주변의 물속을 수색	https://pimg.mk.co.kr/news/cms/202411/02/news-p.v1.20241102.7fb603e3bb32475d9cff7bcb0b55c837_R.jpeg	2024-11-02 11:11:05	매일경제
kr	https://www.mk.co.kr/news/society/11157677	1144회 로또 1등 ‘3, 4, 12, 15, 26, 34’…18명 대박, 당첨금 14.8억 - 매일경제	2일 진행된 제1144회 동행복권 로또 추첨에서 1등 당첨번호는 ‘3, 4, 12, 15, 26, 34’로 결정됐다. 6개 번호를 모두 맞힌 1등 당첨자는 총 18명이다. 각각 14억8934만7375원을 받게 된다. 1등 배출점은 자동 14곳, 반자동 1곳, 수동 3곳이다. 5개 번호와 보너스 번호 ‘6’을 맞힌 2등은 94명이다. 당첨금은 각각 4753만	https://pimg.mk.co.kr/news/cms/202411/02/news-p.v1.20241102.1fe21af297cb470499752ba515536d6a_R.png	2024-11-02 12:29:17	매일경제
kr	https://www.chosun.com/national/national_general/2024/11/03/YQWDJOP7IVB5ZJCHNITWJY2TPQ/	“숙명여대가 아니라 숙면여대”…조회수 폭발한 ASMR 교수님 - 조선일보	숙명여대가 아니라 숙면여대조회수 폭발한 ASMR 교수님	https://www.chosun.com/resizer/v2/E7UMKROTJFDFHFO4FRGICSGF6E.png?auth=90e4b725bf198d85621e5a4293497de84fba8c23941f972c09a2c303753afdfe&width=440&height=231&smart=true	2024-11-03 05:07:35	조선일보
kr	https://zdnet.co.kr/view/?no=20241103091520	의대 교수들 "정부, 대학 학사 운영·입시 전형서 손 떼라" - ZD넷 코리아	전국의과대학교수협의회(이하 전의교협)가 대통령실을 향해 학칙 왜곡 중단을, 교육부에는 대학의 학사 운영 자율성을 보장할 것을 촉구했다.3일 관련업계에 따르면 전의교협은 지난달 29일 대통령실 고위 관계자가 학칙상 2025학년도 1학기에는 의대생들이 의무적으로 복귀해야 한다고 발언한 것과 관...	https://image.zdnet.co.kr/2024/09/05/ae92d09714de6b88e981cbd27076a829.jpg	2024-11-03 00:15:20	ZD넷 코리아
kr	https://news.google.com/rss/articles/CBMiWkFVX3lxTE1YalpMU3ctYnV6T0VnQU5qZHd0bFhPbm1IeWdqRDExNnJEZlFIdkQwem9teHBXdFQyOEs3eHFxU21fNFdWRWh1aGdPRHpxZkpwNFBZUDFqMk1mUdIBVEFVX3lxTE5sMG9TQlBkUlpvYnhwNEQxdGg5V0lDb0tpVVNENmg3YW91WjRKMmJ0UllyZGdXWHlXekRsRG9ESnBWTmFkdVBWdE5QdnpaclhJWmRCcw?oc=5	장윤정 '120억' 펜트하우스 샀다더니…두 달 만에 '깜짝' [집코노미-핫!부동산] - 한국경제	None	None	2024-11-03 00:10:16	한국경제
kr	https://www.mk.co.kr/news/realestate/11157845	“김태희·비, 부동산 투자 이렇게 잘했다고” …강남빌딩 3년만에 얼마 올랐나 보니 - 매일경제	배우 김태희와 가수 비(본명 정지훈) 부부가 2021년 920억원에 매입한 서울 서초구 강남대로변 빌딩 가치가 3년 만에 최소 500억원 이상 올랐다는 추산이 나왔다. 3일 뉴스1에 따르면 비·김태희 부부는 2021년 서초동 강남대로변에 위치한 대지면적 147평, 연면적 881평, 지하 2층~지상 8층 규모의 상업용 건물을 920억원에 매입했다. 해당 건물	https://pimg.mk.co.kr/news/cms/202411/03/news-p.v1.20231208.4101279ecf7a4d6080186be5461de887_R.png	2024-11-03 05:07:05	매일경제
kr	https://www.daejonilbo.com/news/articleView.html?idxno=2164085	"내년 10월 10일 쉬고 싶어요"…국민 절반 이상 바란다 - 대전일보	국민 절반 이상이 내년 10월 10일이 임시 또는 대체공휴일로 지정되길 바란다는 설문조사 결과가 나왔다. 이날이 휴무가 되면, 최대 10일의 연휴를 누릴 수 있어서다.2일 SK커뮤니케이션즈의 시사 투표 서비스 네이트Q가 진행한 설문조사에 따르면 응답자 2602명 중 57%는 내년 10월 10일이 임시공휴일 또는 대체공휴일로 지정되길 원한다고 답했다.응답자 중 18%는 최대 4일의 연휴를 즐길 수 있는 내년 12월 26일이 임시공휴일 또는 대체공휴일로 지정되길 바란다고 답했다. 공휴일 지정 시 연휴가 최대 6일이 되는 내년 1월 31	https://cdn.daejonilbo.com/news/photo/202411/2164085_591267_4749.jpg	2024-11-02 05:47:00	대전일보
