country_code	url	title	description	image_url	publish_date	source
kr	https://news.google.com/rss/articles/CCAiCzg0R2U0Q3ZrbEZJmAEB?oc=5	분명 잘 주차해놨는데 "견인합니다"…CCTV 찍힌 두 남자 '황당' / SBS 8뉴스 - SBS 뉴스	None	None	2024-10-14 12:00:07	SBS 뉴스
kr	https://news.google.com/rss/articles/CCAiC18xNTUzOF9mOS1nmAEB?oc=5	'블랙리스트' 차관 실화냐? 뼈저린 반성도 모자랄 판에.. [뉴스.zip/MBC뉴스] - MBCNEWS	None	None	2024-10-15 00:54:46	MBCNEWS
kr	https://www.pressian.com/pages/articles/2024101418012987000	이스라엘, 가자 북부서 '굶겨 죽이기' 극단 작전 시동? - 프레시안	이스라엘군이 최근 가자지구 북부에 대한 공세를 재개한 가운데 이 지역을 완전 봉쇄해 무장 세력을 굶겨 항복을 받아 내려는 이른바 "장군 계획(Generals’ Plan)"이 ...	https://cdn.pressian.com/_resources/10/2024/10/14/2024101418062135448_l.jpg	2024-10-14 09:01:29	프레시안
kr	https://news.google.com/rss/articles/CCAiC0tjWFJDQ0F2SFZjmAEB?oc=5	"정권 끝났어. 김건희 카톡 봐라" 정권선봉대 감사원 초토화시킨 서영교 - 팩트TV NEWS	None	None	2024-10-15 04:00:14	팩트TV NEWS
kr	https://www.hani.co.kr/arti/society/environment/1162547.html	전국 흐리고 오후 곳곳에 가을비…낮 기온은 최고 25도까지 - 한겨레	화요일인 15일은 전국이 대체로 흐리고 오후까지 전국 대부분 지역에 비가 내리는 곳이 있을 것으로 보인다. 이날 기상청은 수도권에는 오전 6시부터 오후 12시까지, 강원 중·남부와 충청권, 남부지방과 제주도에는 오후 12시부터 저녁 6까지 가끔 비가 내릴 것으로 예보했	https://flexible.img.hani.co.kr/flexible/normal/700/466/imgdb/original/2024/1015/20241015500248.jpg	2024-10-14 23:22:00	한겨레
kr	https://www.pressian.com/pages/articles/2024101421141150118	野 "박민, 사장 계속하면 KBS 없어져"…與 "방문진의 MBC 자화자찬, 역겹다" - 프레시안	여야 의원들이 국회 과학기술정보방송통신위원회 국정감사에서 각각 문화방송(MBC)과 한국방송(KBS)를 향해 공세를 펼쳤다. 야당 의원들은 KBS 박민 사장에게 '광복절 기미가...	https://cdn.pressian.com/_resources/10/2024/10/15/2024101421125626142_l.jpg	2024-10-14 12:14:11	프레시안
kr	https://news.google.com/rss/articles/CCAiC1laLVZSX2JGUWk4mAEB?oc=5	[핫라인] "기생” 발언 양문석 4일 만에 사과했지만... 신영희 명창 "글 보고 더 화가 나" - 뉴스TVCHOSUN	None	None	2024-10-15 06:10:14	뉴스TVCHOSUN
kr	https://www.mk.co.kr/news/politics/11140346	尹 “불법공매도 전수점검...개인 기관 기울어진 운동장 해소” - 매일경제	공매도 규제 자본시장법 공포...내년3월 시행 “불법공매도 전수점검... 기울어진 운동장 해소 WGBI 편입, 건전재정 등 정부 정책  올바른 방향임을 국제적으로 공인받은 것”	https://pimg.mk.co.kr/news/cms/202410/15/rcv.YNA.20241015.PYH2024101504580001300_R.jpg	2024-10-15 01:33:07	매일경제
kr	https://www.hani.co.kr/arti/area/area_general/1162626.html	야당 의원들 “윤석열·김건희·오세훈, 왜 명태균에 아무런 조치 안 하나” - 한겨레	자신과의 관계에 선을 긋는 오세훈 시장을 향해 “망신당하지 말고 그만하라”고 직격탄을 날린 명태균씨에 대해 오 시장이 고발장을 써놨다고 밝힌 가운데 국회에서 “이제까지 윤석열·김건희·오세훈 중 어느 누구도 그에게 (고발 등) 조치를 취하지 않는 것이 굉장히 이상하다”는	https://flexible.img.hani.co.kr/flexible/normal/766/408/imgdb/original/2024/1015/20241015502172.jpg	2024-10-15 06:02:00	한겨레
kr	https://www.chosun.com/national/national_general/2024/10/15/KPABY6QKGNGIJNCE2MDXGVVC3M/	조민이 10년 전 받은 서울대 장학금 800만원, 아직 회수 안 돼 - 조선일보	조민이 10년 전 받은 서울대 장학금 800만원, 아직 회수 안 돼	https://www.chosun.com/resizer/v2/OQHDFACHS5TX7GCDQJYPZOGC4I.jpg?auth=21c9fc79c231cf9b9893f81d2dd81442c990fe1433a6b7024add27ada3392b71&width=1161&height=609&smart=true	2024-10-15 06:21:19	조선일보
kr	https://news.google.com/rss/articles/CCAiC0JzX01JWUMwcHMwmAEB?oc=5	터전 옮긴 '갈비 사자'…딸 이름은 '구름이' / SBS - SBS 뉴스	None	None	2024-10-14 22:41:52	SBS 뉴스
kr	https://www.hani.co.kr/arti/international/america/1162644.html	“트럼프 측근들, 재집권하면 우호적으로 한국 대하겠다 밝혀” - 한겨레	도널드 트럼프 전 대통령의 측근들이 그가 재집권하면 상대국을 합리적이고 우호적으로 대할 것이라는 입장을 한국대사관 등에 전달했다고 언론인 밥 우드워드가 신간에서 밝혔다. 15일 발간된 전 워싱턴포스트 기자 우드워드의 책 ‘전쟁’을 보면, 트럼프 전 대통령 측근들은 워싱	https://flexible.img.hani.co.kr/flexible/normal/596/900/imgdb/original/2024/1015/9017289755196003.jpg	2024-10-15 07:11:00	한겨레
kr	https://www.hankyung.com/article/2024101552667	영주권만 받고 '먹튀'…중국인들 만행에 제주도 '발칵' - 한국경제	영주권만 받고 '먹튀'…중국인들 만행에 제주도 '발칵', 투자이민 80%가 '제주 투자 중국인' 野 전현희 "투자 국&middot;지역 분산 필요" "먹튀 사례도&hellip;제도 개선 요구할 것"	https://img.hankyung.com/photo/202410/01.38310889.1.jpg	2024-10-15 01:22:45	한국경제
kr	https://www.chosun.com/national/incident/2024/10/14/JVYD4F7CYJBPRNDL3YD3JFSN7E/	7년 전 성폭행 미제사건, 범인은 여고 행정실 직원이었다 - 조선일보	7년 전 성폭행 미제사건, 범인은 여고 행정실 직원이었다	https://www.chosun.com/resizer/v2/KKPU66JR2ZACLDQI47NNRQYETM.jpg?auth=e53576f30c6739955bf433b86ab8da59d9536dd2ed2632cc9f8f4ecc4276b3d8&width=400&height=210&smart=true	2024-10-14 12:36:00	조선일보
kr	https://imnews.imbc.com/replay/2024/nw1200/article/6646310_36486.html	'재보선 D-1' 여, 부산 총력전‥야 "정권 심판" - MBC 뉴스	 재보궐 선거를 하루 앞두고 여당인 국민의힘 지도부는 오늘 야당과 접전을 벌이고 있는 부산을 여섯 번째 방문해 막판 표심을 다집니다. 더불어민주당과 조국혁신당 등 야당은...	https://image.imnews.imbc.com/replay/2024/nw1200/article/__icsFiles/afieldfile/2024/10/15/noon_20241015_120504_1_1_Large.jpg	2024-10-15 03:05:39	MBC 뉴스
kr	https://www.chosun.com/politics/assembly/2024/10/15/42HZYI3FGJGRNL4ZCCSCPXS3OQ/	“말하지 않아도 팬들은 알아” 뉴진스 하니 등장에 국회 들썩 - 조선일보	뉴진스 하니 국감 나오자... 최민희, 맨 앞줄서 직관 인증샷 현직 아이돌 첫 출석에 여의도 비상 경호	https://www.chosun.com/resizer/v2/56V4WYG6Z5BAFIREKUVWOH677E.png?auth=048583af755aafbd069918de9eec29b976881d0462e45308113678f00b8bea11&width=764&height=401&smart=true	2024-10-15 05:29:47	조선일보
kr	https://www.hani.co.kr/arti/politics/politics_general/1162648.html	김여정, ‘평양 무인기’ 관련 “한국 군부깡패가 주범이라는 명백한 증거 확보” - 한겨레	북한이 ‘평양 무인기 전단 살포’와 관련해 “한국 군부깡패들이 주범이라는 명백한 증거를 확보했다”고 주장했다. 김여정 중앙위원회 부부장은 15일 조선중앙통신을 통해 발표한 짧은 담화문에서 “우리는 한국군부깡패들이 조선민주주의인민공화국의 수도상공을 침범하는 적대적 주권침	https://flexible.img.hani.co.kr/flexible/normal/640/427/imgdb/original/2024/1015/20241015502702.jpg	2024-10-15 07:07:00	한겨레
kr	https://www.chosun.com/national/national_general/2024/10/15/NED2DG7FENHMRPAZTQFTZJATLU/	서울대 총장 “의대 휴학 승인 결정 존중…사전 협의 없었다” - 조선일보	서울대 총장 의대 휴학 승인 결정 존중사전 협의 없었다	https://www.chosun.com/resizer/v2/RFFH44RQ642YAPBRH5RGBK6ZIY.jpg?auth=6b5b40f2fd768ad9871b161e46badea01910a552803b8c863218d54e50fa2be3&width=1200&height=630&smart=true	2024-10-15 05:48:45	조선일보
kr	https://www.khan.co.kr/national/national-general/article/202410140600121	[쓰레기 오비추어리③]그날 ‘007 작전’ 속에 새 옷들이 소각됐다 - 경향신문	지난 7일 지방의 한 컨테이너 건물. 철문 앞에 3.5t 탑차가 끼익 소리를 내며 멈춰 섰다. 탑차에는 한 업체에서 파쇄를 의뢰한 ‘보안 물품’이 가득했다. 컨테이너의 문이 ...	https://img.khan.co.kr/news/2024/10/14/news-p.v1.20241009.e691f843a00a4f01a0b3a93ab86a6a61_P1.png	2024-10-13 21:00:00	경향신문
kr	https://www.hani.co.kr/arti/politics/politics_general/1162536.html	김건희 ‘작은 엄마’로 부른다는 ‘한남동 라인’ 7명은 누구? - 한겨레	대통령실 ‘김건희 라인’의 실체를 두고 여권 내부의 논란이 한층 가열되고 있다. 한동훈 국민의힘 대표가 직접 인적 쇄신을 요구하며 이 문제를 수면 위로 끌어올린 탓에, 논란은 쉽사리 사그라들지 않을 전망이다. 14일 한 대표와 원조 ‘윤핵관’(윤석열 대통령 핵심 관계자	https://flexible.img.hani.co.kr/flexible/normal/808/485/imgdb/child/2024/1015/53_17289469004337_20241010503205.jpg	2024-10-15 03:04:00	한겨레
kr	https://www.mk.co.kr/news/world/11140241	[인터뷰 일문일답] 노벨경제학상 수상자 제임스 로빈슨 시카고대 교수 - 매일경제	한국 창의성 폭발...매우 ‘포용적인 사회’ 삼성·현대 아닌 K팝·드라마·영화가 주도 南北 경제적 격차 앞으로 계속 확대될 것 韓 대기업 집중·저출산·고령화 문제 직면 北개인가문 독재...결국 정권붕괴 할 것 국가발전 과정서 정치적 문제가 관건 한국, 결국 독일처럼 남북 통일 할 것 韓 과거 60년 도전 극복했듯 미래도 극복 韓 문제들 외부인 못풀어...스..	https://pimg.mk.co.kr/news/cms/202410/15/news-p.v1.20241015.fa07684d8b784c8ea65e2b0a2d52db09_R.jpg	2024-10-14 23:46:35	매일경제
kr	https://www.hankyung.com/article/202410154985i	美 대선 도박 시장, 트럼프에 베팅…트럼프미디어·비트코인 뛰었다 - 한국경제	美 대선 도박 시장, 트럼프에 베팅…트럼프미디어·비트코인 뛰었다, 美 베팅 사이트서 트럼프 당선 가능성 높아져 폴리마켓 "트럼프 55%, 해리스 44.4%" 트럼프미디어 18% 뛰어&hellip;최저치보다 150% 반등 비트코인 5% 상승, 6만5000달러선 회복	https://img.hankyung.com/photo/202410/01.38310691.1.jpg	2024-10-15 01:13:25	한국경제
kr	https://www.pressian.com/pages/articles/2024101416152569540	김건희-주가조작 '주포' 통화 공개…"내가 팔아주겠다" 하자 김건희 "알겠다" - 프레시안	도이치모터스 주가 조작 '1차 주포' 이모 씨와 김건희 전 코바나컨텐츠 대표가 주식 매도를 두고 직접 통화를 했다는 사실이 드러났다. 14일 JTBC 보도에 따르면 검찰은 지...	https://cdn.pressian.com/_resources/10/2024/10/15/2024101008594801298_l.jpg	2024-10-15 01:02:58	프레시안
kr	https://imnews.imbc.com/replay/2024/nwtoday/article/6646186_36523.html	"6명으로도 탄핵 심리 가능"‥'결정'은 불가능 - MBC 뉴스	 이진숙 방송통신위원장이 헌법재판관 정족수 부족으로 자신의 탄핵 심판이 정지되는 것은 부당하다며 낸 가처분 신청이 받아들여졌습니다. 이로써 헌법재판관 세 명이 퇴임한 뒤...	https://image.imnews.imbc.com/replay/2024/nwtoday/article/__icsFiles/afieldfile/2024/10/15/today_20241015_061523_1_8_Large.jpg	2024-10-14 21:16:07	MBC 뉴스
kr	https://www.hankyung.com/article/202410155227i	"스타벅스 '텀블러' 반값에 샀다고 좋아했는데…" 날벼락 - 한국경제	"스타벅스 '텀블러' 반값에 샀다고 좋아했는데…" 날벼락, 이해성 기자, 사회	https://img.hankyung.com/photo/202410/02.28786495.1.jpg	2024-10-15 00:54:04	한국경제
kr	https://www.chosun.com/national/national_general/2024/10/15/WPGE5QJPCFDJZDGHQAYVKHIYVM/	“보쌈시켰더니 비곗덩어리만”... 환불 대신 1점 리뷰 남긴 사연 - 조선일보	보쌈시켰더니 비곗덩어리만... 환불 대신 1점 리뷰 남긴 사연	https://www.chosun.com/resizer/v2/IP5D7WYLJBEAZOJAUKVPO6TNZU.jpg?auth=57be27ffd3853f5e768997bb9a8eb90b9b98fd3a3ef2b133292a89bfb53785ae&width=800&height=420&smart=true	2024-10-15 07:34:00	조선일보
kr	https://www.hani.co.kr/arti/society/society_general/1162673.html	‘의료계 블랙리스트’ 유포 전공의 구속 기소 - 한겨레	 검찰이 정부의 의대 증원에 항의하는 집단행동에 참여하지 않았다는 이유로 의사 및 의대생 정보가 담긴 이른바 ‘의료계 블랙리스트’를 유포한 전공의를 구속 상태로 재판에 넘겼다. 서울중앙지검 공공수사3부(부장 김태훈)는 사직한 전공의 ㄱ씨를 의료계 블랙리스트	https://flexible.img.hani.co.kr/flexible/normal/593/385/imgdb/original/2024/1015/20241015502991.jpg	2024-10-15 07:50:00	한겨레
kr	https://news.google.com/rss/articles/CCAiC0ZCeHhoUjJ6S2JJmAEB?oc=5	[현장영상] "그만 좀 하라고" "싫어"…박정훈 발언에 국회 난리난 상황 / JTBC News - JTBC News	None	None	2024-10-15 03:40:00	JTBC News
kr	https://news.google.com/rss/articles/CCAiC3FvejZDTHp0NUJzmAEB?oc=5	"72세까지 계약직 풀타임"…'파이어족' 희망 싹 사라진 이유, 왜? / SBS / 친절한 경제 - SBS 뉴스	None	None	2024-10-15 01:35:41	SBS 뉴스
kr	https://www.hani.co.kr/arti/international/international_general/1162581.html	[영상] ‘병력 부족’ 우크라 강제 징집…공연장서 끌려나가며 절규 - 한겨레	러시아와 전쟁 중인 우크라이나 모병관들이 수도 키이우의 번화가를 급습해 청년들을 강제 징집하고 있다고 외신이 보도했다. 13일(현지시각) 영국 일간 텔레그래프는 11일 우크라이나 인기 밴드 ‘오케안 엘지’의 공연이 열린 키이우 실내경기장 밖에서 콘서트 관람객으로 보이는	https://flexible.img.hani.co.kr/flexible/normal/783/937/imgdb/original/2024/1015/20241015501319.jpg	2024-10-15 04:59:00	한겨레
kr	https://www.seoul.co.kr/news/politics/2024/10/14/20241014500175	민주, 금투세 당론 ‘국감 이후’ 무게 왜…개미들 李블로그에 댓글 폭탄 - 서울신문	더불어민주당이 내년 1월 시행 예정인 금융투자소득세(금투세) 도입에 대한 당론 결정과 결정 시기를 지도부에 위임한 가운데 이재명 대표의 침묵이 길어지고 있다. 지난 4일 의원총회로부터 열흘이 흘렀지만 이 대표는 여전히 고심 중인 것으로 알려졌다. 당내에선 당론은 ‘유예’, 결정시기는 ‘...	https://www.seoul.co.kr/img/upload/2024/10/14/SSC_20241014155430.jpg	2024-10-14 06:54:31	서울신문
kr	https://www.hani.co.kr/arti/politics/politics_general/1162726.html	김정은 국방회의 주재 뒤 폭파…‘무인기’ 대응 빈말 아니란 시위 - 한겨레	김정은 조선노동당 총비서 겸 국무위원장이 ‘국방·안전 분야 협의회’를 주재했다는 15일 노동신문 보도는 김 총비서가 ‘평양 무인기’ 사태 대응의 전면에 나섰음을 뜻한다. 김 총비서의 회의 주재 뒤 북쪽의 첫 대남 적대행위가 경의선·동해선 남북 연결도로의 군사분계선 이북	https://flexible.img.hani.co.kr/flexible/normal/600/338/imgdb/original/2024/1015/5517289714449626.gif	2024-10-15 10:37:00	한겨레
kr	https://www.khan.co.kr/politics/politics-general/article/202410151119011	김건희 “우리 오빠 용서해 줘, 무식하면 원래 그래, 지가 뭘 안다고”···명태균 카톡 공개 - 경향신문	윤석열 대통령 부부 공천 개입 의혹의 핵심 인물인 명태균씨가 15일 김건희 여사와 주고받은 내용이라며 사회관계망서비스(SNS) 메시지를 공개했다. 김 여사는 이 메시지에서 “...	https://img.khan.co.kr/news/2024/10/15/news-p.v1.20241015.4763e6aecf3b47de93a6b57ae9754b84_P1.jpg	2024-10-15 02:19:00	경향신문
kr	https://www.hani.co.kr/arti/area/capital/1162678.html	“군인들이 총 들고 돌아다녀”…남북 대치에 접경지 주민들 ‘절규’ - 한겨레	“오는 길에 군인들이 총을 들고 있더라. 상황이 심각하다는 이야기다. 언제 어디에 뭐가 떨어질지 모른다는 불안감에 하루하루 살고 있다.” 경기 파주시 문산읍 진동면에서 농사를 짓는 전환식씨의 목소리가 떨렸다. 15일 오전 10시30분 파주시 아동동 파주시청 앞에서 평화	https://flexible.img.hani.co.kr/flexible/normal/970/582/imgdb/child/2024/1015/53_17289790945459_961728979060472.jpg	2024-10-15 08:00:00	한겨레
kr	https://news.google.com/rss/articles/CBMieEFVX3lxTFBheDFQV1ZkY0MzNlR6Tm9uVnpOY3pLbWl1V0p3ak5pWV9ZcVB1dlVHYkNpSGw0QlhMY2xzR00tdTVNWURCT3BVN05zWnhtaXowSGFNMEt6Q0g4dlloQ0hTZnBBdTc0aXNJRHQ5T1EzVlJTNWF5QlJlcNIBeEFVX3lxTE45Y3BIa1NjNFhZVm0zZ1o0WHZ6X2o3NDNfcWczRHhvbGVwdlgtNDhaZGVSdjE2M2x2MzdFaG5iNmlBeGc4RGNUS3dCVVNIcEkwY3R1dUhrTTl1bVhBWWpucVAwNTA3RjZLakxwLUZoNEhEUWF1c2hpSA?oc=5	한 달 만에 민생토론회 제주서 재개‥윤 대통령 "제주, 한 단계 도약시키겠다" - MBC 뉴스	윤석열 대통령이 지난달 광주에 이어 한 달 만에 민생토론회를 제주도에서 재개하며 제주 관광 인프라 발전을 위해 정부가 힘쓰겠다고 밝혔습니다. 윤 대통령은 제주에서 열린 29번째 민...	https://image.imnews.imbc.com/news/2024/politics/article/__icsFiles/afieldfile/2024/10/15/h2024101520.jpg	2024-10-15 07:05:12	MBC 뉴스
kr	https://news.google.com/rss/articles/CBMihwFBVV95cUxPWTloZUhPTEJVVVFRMmxsUlZVcmwyQXRXQUVQZEpPQnRhS0gxNWlBWmpoSTE5QWtpTjBOeWtjUnN1c2lkSjdrMjhJaGFaUjlFZktJa3pQcm5mS05Id05LcTFxTVI2UFFmWTNwdXdYemg4UkxQWEhrNHBBbkk2UzFXUEstaFRhR3PSAZsBQVVfeXFMT3ZpM0xUUnhsazQwQmJEM0x0RVhmaFpyZFJ2S0JqTC1OTG14R2VfQjFZTGJ1WEozVzhsUjZneS14OE96WEhVbkk4ZWZEeVpJMHNQd3pJdnR1ci1RS2JSUUZ6b0xOYVVtQ3RMQzRfLXA3bVVsRmtwQ0l2dW5xUzJhUnd3M1lKYWxaNHlGb1dyd3BqS0wzbWJXVy0wUEE?oc=5	검찰, 백원우 前 민정비서관 압수수색… 文 전 사위 특혜채용 의혹 - 조선일보	검찰, 백원우 前 민정비서관 압수수색 文 전 사위 특혜채용 의혹	https://www.chosun.com/resizer/v2/RNLDW74HOJJJJCXLUGJEBRKPAY.jpg?auth=b903ca115717bf5d350e9dcaa80bd65f545ce2d63994c4d93e969104c799eab8&width=1200&height=630&smart=true	2024-10-15 08:47:00	조선일보
kr	https://m.yonhapnewstv.co.kr/news/MYH20241015005600032	이스라엘군, 레바논 북부 첫 공습…아이언돔에 ′허점′ - 연합뉴스TV	이스라엘군, 레바논 북부 첫 공습…아이언돔에 '허점'

[앵커]

이스라엘군이 레바논 북부 마을을 공습해 최소 18명 이상이 사망한 것으로 알려졌습니다.

이스라엘이 레바논 북부를	https://d2k5miyk6y5zf0.cloudfront.net/article/MYH/20241015/MYH20241015005600032.jpg	2024-10-15 01:47:50	연합뉴스TV
kr	https://www.ytn.co.kr/_ln/0103_202410150857092137	"한강, 노벨상 상금 전액 독도에 기부?"...황당한 가짜뉴스 기승 - YTN	한강 작가가 노벨문학상 상금을 전액 기부한다는 가짜뉴스가 소셜미디어(SNS)에서 확산하고 있다.14일 노벨상 수상 소식이 알려진 이후 "한강 작가가 노벨상 상금을 전액 ...	https://image.ytn.co.kr/general/jpg/2024/1015/202410150857092137_t.jpg	2024-10-14 23:57:00	YTN
kr	https://imnews.imbc.com/news/2024/politics/article/6646537_36431.html	감사원장 "관저 감사 협조 잘돼‥21그램 추천자 누군지 키포인트 아냐" - MBC 뉴스	최재해 감사원장은 대통령 관저 이전 감사 당시 디지털 포렌식을 한 건도 진행하지 않은 이유에 대해 "자료 협조가 충실히 잘 돼 필요성을 느끼지 못했다"고 답변했습니다. 오늘 국회 ...	https://image.imnews.imbc.com/news/2024/politics/article/__icsFiles/afieldfile/2024/10/15/h2024101529.jpg	2024-10-15 09:43:11	MBC 뉴스
kr	https://news.google.com/rss/articles/CBMikAFBVV95cUxPS2dNWmdIbmUzNlZTdld0MmFJSXRuMWtEMUY2VERhTGdNQ3NDWV9lcjRJWDRJQVdYWTZSMm1WYVhGV0dsQTc4ZjRkdTZWU1RZeUpWRnQtWkFlMEE0S1o0YVlPU1YwclJuT19FQTNURi1xZ0lxRDFKU3p3M01NT2JsRTlaVy1PMDdqdFNLMW8xZzXSAaQBQVVfeXFMTjdmZ0g5RWtlY0o5Q0ZMQUVfdVRyZXpXZ3NiQmQ3empMMzQ0cWxrZGR5dXE2ZDk4emJ5dUNwN3RZYTV2REpxWXdReVVKUVlVQTJXLUpHd3I4ck95S3NXNWFGMzZPeWVPbGtxWXRrLXNDWThESzJPSWdxR0hadlhaMk1TTmxaWjFDazFWSFVaaTloQWtqMl8wNjJnMVJpZkRVdkVpTDQ?oc=5	“귀찮아서”…용변 후 비누로 손씻는 사람 10명 중 3명 - 조선일보	귀찮아서용변 후 비누로 손씻는 사람 10명 중 3명	https://www.chosun.com/resizer/v2/YMMSUTR65SEUBHMMV4Z2K3DYVI.jpg?auth=ec7e801853d71c6b7f555a3d66b33dc8711d0caf83506277fe5e7e822f9412f4&width=720&height=378&smart=true	2024-10-15 05:47:34	조선일보
kr	https://www.khan.co.kr/national/labor/article/202410151750001	노동자 죽어서 불려나온 한화오션 사장, 뉴진스 하니와 ‘셀카’ 논란 - 경향신문	15일 국회 환경노동위원회의 고용노동부 소속기관 국정감사에 증인으로 출석한 정인섭 한화오션 거제사업장 사장이 걸그룹 뉴진스 멤버 하니가 나오도록 사진을 찍는 모습이 포착됐다....	https://img.khan.co.kr/news/2024/10/15/news-p.v1.20241015.a00759c07812471297ee54d9c3c2ec04_P1.png	2024-10-15 08:50:00	경향신문
kr	https://imnews.imbc.com/news/2024/society/article/6646342_36438.html	"사직서 처리 지연으로 손해"‥국립대 전공의 57명, 병원에 손배소송 제기 - MBC 뉴스	사직 전공의들이 병원의 사직서 처리 지연으로 손해가 발생했다며 자신이 수련했던 국립대병원에 손해배상 소송을 제기했습니다. 국회 교육위원회 소속 더불어민주당 백승아 의원이 국립대병원...	https://image.imnews.imbc.com/news/2024/society/article/__icsFiles/afieldfile/2024/10/15/DY241015_31.jpg	2024-10-15 04:47:48	MBC 뉴스
kr	https://www.hani.co.kr/arti/politics/politics_general/1162653.html	[속보] 윤 대통령, 연세대 논술 유출 논란에 “책임자 철저히 문책” - 한겨레	윤석열 대통령이 15일 최근 불거진 일부 대학의 부실한 수시모집 시험관리와 관련해 책임자 문책 등 엄정 조처를 주문했다. 윤 대통령은 이날 용산 대통령실에서 주재한 국무회의 마무리 발언에서 일부 대학의 시험 관리 부실과 관련해 이주호 사회부총리 겸 교육부 장관에게 경위	https://flexible.img.hani.co.kr/flexible/normal/640/427/imgdb/original/2024/1015/20241015502744.jpg	2024-10-15 07:15:00	한겨레
kr	https://www.mediatoday.co.kr/news/articleView.html?idxno=321529	‘김건희 황제관람’ 국감 불출석 KTV 최재혁·조대익 동행명령 발부 - 미디어오늘	국회 문화체육관광위원회가 15일 국정감사에 불출석한 최재혁·조대익 증인에 대해 동행명령장을 발부했다. 국회 증인은 부득이한 사유를 입증해야 국감에 출석하지 않을 수 있는데 이날 두 증인의 불출석 사유가 받아들여지지 않았다. 조대익 KTV PD의 경우 기관증인으로 의원들의 오전 주 질의 전, 최재혁 전 KTV 방송기획관(대통령실 홍보기획비서관)의 경우 오후 2시 전까지 출석하지 않을 경우 동행명령을 발부하기로 의결했다. 국회증언감정법(국회에서의 증언·감정 등에 관한 법률)에 따르면 동행명령을 거부하거나 고의로 명령장 수령을 회피하는	https://cdn.mediatoday.co.kr/news/thumbnail/202410/321529_454434_2950_v150.jpg	2024-10-15 03:11:15	미디어오늘
kr	https://news.google.com/rss/articles/CCAiC1FobElOZ1hmcmlrmAEB?oc=5	[자막뉴스] 교각 '쿵' 하더니 옆으로 '쾅'! 신호대기 차량들 '날벼락' (2024.10.15/MBC뉴스) - MBCNEWS	None	None	2024-10-15 08:39:44	MBCNEWS
kr	https://www.chosun.com/national/regional/2024/10/15/3TNJLC2Y7NEWXDJPXBU5PSOWEA/	‘이재명 선거캠프 활동’ 경기도 산하기관 前 간부 동해안서 숨져 - 조선일보	이재명 선거캠프 활동 경기도 산하기관 前 간부 동해안서 숨져 지방선거 李 캠프 SNS 팀장 맡아 민주당 대선 경선 이낙연 후보 비방 주도 	https://www.chosun.com/resizer/v2/DZ67HNEZLFFYXGUCLD5SZLQ5LU.jpg?auth=d1d8835812f04d8ed8e6a1dc7671682394b12b089bf839326e0585792b864571&width=700&height=367&smart=true	2024-10-15 02:15:42	조선일보
kr	https://www.chosun.com/national/national_general/2024/10/15/OXCEM7SYMBEF5IVODNGVRQ6RFM/	“잡아먹으려고”... 축 늘어진 개, 아스팔트 위로 질질 끌고 간 노인 - 조선일보	잡아먹으려고... 축 늘어진 개, 아스팔트 위로 질질 끌고 간 노인	https://www.chosun.com/resizer/v2/WHWWZHC4WBF7DJKBFU3JP624XY.png?auth=27e07b0de6b98f4cb5f23c667922bb0ebe0f9809971bd6be7c84fd9cb0a81e22&width=1200&height=630&smart=true	2024-10-15 01:19:45	조선일보
