country_code	url	title	description	image_url	publish_date	source
lb	https://www.alhurra.com/arabic-and-international/2024/10/29/%D8%A5%D8%B1%D8%B3%D9%84%D8%A7%D9%86-%D9%84%D9%80%D8%A7%D9%84%D8%AD%D8%B1%D8%A9-%D8%AD%D8%B2%D8%A8-%D8%A7%D9%84%D9%84%D9%87-%D9%85%D9%88%D8%A7%D9%81%D9%82-%D8%AA%D8%B7%D8%A8%D9%8A%D9%82-%D8%A7%D9%84%D9%82%D8%B1%D8%A7%D8%B1-1701	إرسلان لـ"الحرة": حزب الله موافق على تطبيق القرار 1701 - الحرة	None		2024-10-28 23:24:14	الحرة
lb	https://www.almayadeen.net/news/politics/%D8%AD%D8%B2%D8%A8-%D8%A7%D9%84%D9%84%D9%87-%D9%8A%D9%82%D8%B5%D9%81--%D8%B3%D8%AA%D9%8A%D9%84%D8%A7-%D9%85%D8%A7%D8%B1%D9%8A%D8%B3--%D8%A8%D8%B5%D9%88%D8%A7%D8%B1%D9%8A%D8%AE-%D9%86%D9%88%D8%B9%D9%8A%D8%A9---%D9%88%D9%8A%D8%AC%D8%AF%D8%AF-%D8%A7%D8%B3%D8%AA%D9%87%D8%AF%D8%A7%D9%81-%D8%AA%D8%AC	حزب الله يقصف "ستيلا ماريس" بصواريخ نوعية.. ويستهدف تجمعات الاحتلال جنوبي الخيام - Al Mayadeen الميادين	حزب الله ينفّذ عدة عمليات ضدّ الاحتلال، بينها استهداف "ستيلا ماريس" وقاعدة "ميرون" وتجمّعات قوات الاحتلال جنوبي الخيام وفي عدة مستوطنات، ويعلن تنفيذه كميناً ضدّ جنود وآليات، في أثناء تقدّمهم نحو تل نحاس عند أطراف كفركلا.	https://alpha-ar-media.almayadeen.net/media/image/2024/10/28/c33ea704-1801-4cf8-a350-23fcd3c2514a.png?v=3&width=1000	2024-10-28 18:05:08	Al Mayadeen الميادين
lb	https://www.mtv.com.lb/News/%D9%85%D9%80%D9%80%D8%AD%D9%80%D9%80%D9%84%D9%80%D9%80%D9%8A%D9%80%D9%80%D8%A7%D8%AA/1508963/%D9%85%D9%81%D8%A7%D9%88%D8%B6%D8%A7%D8%AA-%D9%88%D9%82%D9%81-%D8%A5%D8%B7%D9%84%D8%A7%D9%82-%D8%A7%D9%84%D9%86%D8%A7%D8%B1-%D9%84%D9%85-%D8%AA%D8%AA%D9%88%D9%82%D9%81----%D9%88%D9%85%D9%88%D9%81%D8%AF-%D9%82%D8%B7%D8%B1%D9%8A-%D9%81%D9%8A-%D9%84%D8%A8%D9%86%D8%A7%D9%86	مفاوضات وقف إطلاق النار لم تتوقف... وموفد قطري في لبنان - MTV Lebanon News	جاء في "اللواء":استمر الكلام الاميركي والبريطاني والفرنسي عن استمرار الجهود والمساعي لتحقيق وقف اطلاق النار في غزة وتوازيا في لبنان، وتمخضت لاتصالات عن اقتراح مصري لهدنة قصيرة في غزة. فيما أبدت مصادر دبلوماسية تتابع اللقاءات الدولية من ن...	https://imagescdn.mtv.com.lb/articles/479499519551.jpg?width=533&quality=90	2024-10-29 04:28:43	MTV Lebanon News
lb	https://www.skynewsarabia.com/middle-east/1750980-%D8%B5%D9%88%D8%B1-%D9%81%D8%B6%D8%A7%D9%8A%D9%94%D9%8A%D8%A9-%D8%AD%D9%85%D9%84%D8%A9-%D8%A7%D9%95%D8%B3%D8%B1%D8%A7%D9%8A%D9%94%D9%8A%D9%84-%D8%AD%D9%88%D9%84%D8%AA-%D8%A8%D9%84%D8%AF%D8%A7%D8%AA-%D9%84%D8%A8%D9%86%D8%A7%D9%86%D9%8A%D8%A9-%D9%84%D8%A7%D9%94%D8%B7%D9%84%D8%A7%D9%84-%D9%88%D8%B1%D9%83%D8%A7%D9%85	صور فضائية.. حملة إسرائيل حولت بلدات لبنانية لأطلال وركام - Sky News Arabia سكاي نيوز عربية	أظهرت صور بالأقمار الاصطناعية قدمتها شركة (بلانت لابس) لرويترز أن الحملة العسكرية الإسرائيلية في جنوب لبنان أدت إلى دمار كبير في أكثر من 12 بلدة وقرية حدودية حتى تحول العديد منها إلى مجموعات من الحفر الرمادية.	https://www.skynewsarabia.com/images/v1/2024/10/28/1750975/1200/630/1-1750975.JPG	2024-10-28 15:53:57	Sky News Arabia سكاي نيوز عربية
lb	https://www.nna-leb.gov.lb/ar/%D8%B3%D9%8A%D8%A7%D8%B3%D8%A9/733986/%D8%A7%D9%84%D8%AC%D9%85%D9%87%D9%88%D8%B1%D9%8A%D8%A9-%D8%B3%D8%B9%D9%8A-%D8%A3%D9%85%D9%8A%D8%B1%D9%83%D9%8A-%D9%84%D9%88%D9%82%D9%81-%D8%A7%D9%84%D9%86%D8%A7%D8%B1-%D8%B3%D8%B1%D9%8A%D8%B9%D8%A7-%D9%88%D8%AA%D9%86%D8%A7%D9%82%D8%B6-%D9%81%D9%8A-%D8%A7%D9%84	الجمهورية: سعي أميركي لوقف النار سريعاً.. وتناقض في المواقف الإسرائيلية - nna-leb.gov.lb	None	None	2024-10-28 04:18:01	nna-leb.gov.lb
lb	https://news.google.com/rss/articles/CCAiC3lEaks0MURwU04wmAEB?oc=5	الهدوء الحذر يسيطر على ضاحية بيروت الجنوبية منذ يومين بعد غارات عنيفة - AlHadath الحدث	None	None	2024-10-29 02:51:08	AlHadath الحدث
lb	https://www.qna.org.qa/ar-QA/News-Area/News/2024-10/28/0106-%D8%B1%D8%A6%D9%8A%D8%B3-%D8%AD%D9%83%D9%88%D9%85%D8%A9-%D8%AA%D8%B5%D8%B1%D9%8A%D9%81-%D8%A7%D9%84%D8%A3%D8%B9%D9%85%D8%A7%D9%84-%D8%A7%D9%84%D9%84%D8%A8%D9%86%D8%A7%D9%86%D9%8A%D8%A9-%D9%8A%D8%A8%D8%AD%D8%AB-%D9%85%D8%B9-%D9%88%D8%B2%D9%8A%D8%B1-%D8%A7%D9%84%D8%AF%D9%81%D8%A7%D8%B9-%D8%A7%D9%84%D8%A8%D8%B1%D9%8A%D8%B7%D8%A7%D9%86%D9%8A-%D8%AA%D8%B7%D9%88%D8%B1%D8%A7%D8%AA-%D8%A7%D9%84%D8%A3%D9%88%D8%B6%D8%A7%D8%B9-%D9%81%D9%8A-%D9%84%D8%A8%D9%86%D8%A7%D9%86	رئيس حكومة تصريف الأعمال اللبنانية يبحث مع وزير الدفاع البريطاني تطورات الأوضاع في لبنان - QNA	لندن في 28 أكتوبر /قنا/ بحث نجيب ميقاتي رئيس حكومة تصريف الأعمال اللبنانية، اليوم، مع جون هيلي وزير الدفاع البريطاني تطورات الأوضاع في لبنان.    	None	2024-10-28 18:01:15	QNA
lb	https://www.mtv.com.lb/News/%D9%85%D9%80%D9%80%D8%AD%D9%80%D9%80%D9%84%D9%80%D9%80%D9%8A%D9%80%D9%80%D8%A7%D8%AA/1508567/%D8%A8%D8%A7%D9%84%D9%81%D9%8A%D8%AF%D9%8A%D9%88--%D8%B5%D8%A7%D8%B1%D9%88%D8%AE-%D8%B9%D9%84%D9%89-%D8%A7%D9%88%D8%AA%D9%88%D8%B3%D8%AA%D8%B1%D8%A7%D8%AF-%D8%B9%D8%A7%D8%B1%D9%8A%D8%A7---%D8%A7%D9%84%D9%83%D8%AD%D8%A7%D9%84%D8%A9	بالفيديو: صاروخ على اوتوستراد عاريا - الكحالة - MTV Lebanon News	أطلقت مسيّرة إسرائيلية صاروخا قرب سيّارتين على اوتوستراد عاريا - الكحالة.وتتابعون الفيديو مرفقا.&nbsp;&nbsp;	https://imagescdn.mtv.com.lb/articles/928369708879.jpg?width=533&quality=90	2024-10-28 09:38:44	MTV Lebanon News
lb	https://www.lebanondebate.com/news/671083	هجوم ليلي عنيف.. غارات إسرائيلية تهز بلدة جنوبية بصواريخ ارتجاجية - LebanonDebate	None	None	2024-10-28 22:48:05	LebanonDebate
lb	https://www.aljazeera.net/ebusiness/2024/10/28/%D8%A7%D9%84%D9%86%D9%81%D8%B7-%D9%8A%D9%87%D9%88%D9%8A-5-%D8%A8%D8%B9%D8%AF-%D8%AA%D9%82%D9%84%D9%8A%D9%84-%D8%A5%D9%8A%D8%B1%D8%A7%D9%86-%D9%85%D9%86-%D8%B4%D8%A3%D9%86	النفط يهوي 5% بعد تقليل إيران من شأن الضربات الإسرائيلية - الجزيرة نت	هبطت أسعار النفط بنحو 5% اليوم الاثنين بعد أن تجنبت الضربة التي وجهتها إسرائيل لإيران مطلع الأسبوع المنشآت النفطية والنووية في طهران ولم تتسبب في تعطيل إمدادات الطاقة، مما خفف التوتر الجيوسياسي.	None	2024-10-28 10:04:46	الجزيرة نت