country_code	url	title	description	image_url	publish_date	source
lb	https://news.google.com/rss/articles/CCAiC2U2RUdPc005ZHpBmAEB?oc=5	وابل صواريخ من حزب الله تجاه الجليل الأعلى.. وحديث في إسرائيل عن إمكانية إنهاء الحرب في لبنان - AlHadath الحدث	None	None	2024-10-26 15:19:18	AlHadath الحدث
lb	https://news.google.com/rss/articles/CCAiCzNmVkhnbFBvcUxnmAEB?oc=5	معارك ضـ ـارية على الخطوط الأمامية في جنوب لبنان - AL Jadeed News	None	None	2024-10-26 17:41:00	AL Jadeed News
lb	https://www.alquds.co.uk/%D9%84%D8%A8%D9%86%D8%A7%D9%86-%D9%87%D9%84-%D9%8A%D9%85%D9%83%D9%86-%D8%AA%D8%B7%D8%A8%D9%8A%D9%82-%D8%A7%D9%84%D9%80-1701-%D9%88%D8%A5%D8%A8%D9%82%D8%A7%D8%A1-%D8%A7%D9%84%D8%B3%D9%84%D8%A7%D8%AD/	لبنان: هل يمكن تطبيق الـ 1701 وإبقاء السلاح شمال الليطاني؟ - القدس العربي	بيروت ـ «القدس العربي»: يترقّب البعض في لبنان ما إذا كان المبعوث الرئاسي الأمريكي آموس هوكشتاين سيعود مجدداً إلى لبنان حاملاً أجوبة إيجابية على موافقة إسرائيل على الطرح اللبناني الرسمي لجهة وقف إطلاق النار تمهيداً لإطلاق مفاوضات حول تطبيق كامل للقرار1701 لأن عدم عودة هوكشتاين تحمل مؤشرات سلبية على أن وقف إطلاق النار ليس قريباً […]	https://www.alquds.co.uk/wp-content/uploads/2024/10/sad-2.jpg	2024-10-26 19:05:56	القدس العربي
lb	https://www.alhurra.com/lebanon/2024/10/27/%D8%A7%D9%84%D8%AA%D8%B5%D8%B9%D9%8A%D8%AF-%D8%A8%D9%8A%D9%86-%D8%A5%D8%B3%D8%B1%D8%A7%D8%A6%D9%8A%D9%84-%D9%88%D8%A5%D9%8A%D8%B1%D8%A7%D9%86-%D8%B3%D9%8A%D8%A4%D8%AB%D8%B1-%D8%AC%D8%A8%D9%87%D8%A9-%D9%84%D8%A8%D9%86%D8%A7%D9%86%D8%9F	التصعيد بين إسرائيل وإيران.. كيف سيؤثر على جبهة لبنان؟ - الحرة	None	https://media.voltron.alhurra.com/Drupal/01live-106/2024-09/000_36HC7QC.jpg	2024-10-26 22:41:11	الحرة
lb	https://news.google.com/rss/articles/CCAiC1dLU1lSLWl3S3JvmAEB?oc=5	وكالة الأنباء السورية: العدو الإسرائيلي شن هجوما جويا من الجولان المحتل ولبنان - AlJazeera Arabic قناة الجزيرة	None	None	2024-10-26 02:05:59	AlJazeera Arabic قناة الجزيرة
lb	https://www.bbc.com/arabic/articles/c4g2276ey9eo	حزب الله وإسرائيل: غارات إسرائيلية على الضاحية الجنوبية لبيروت ومناطق أخرى في لبنان، وحزب الله يحذر سكان شمال إسرائيل - BBC.com	الجيش الإسرائيلي يشن غارات على الضاحية الجنوبية لبيروت بعد تحذير لسكان منطقتي الحدث وبرج البراجنة، وحزب الله يطلب من سكان 25 منطقة شمالي إسرائيل الإخلاء الفوري، قائلاً إنها تحولت إلى مكان انتشار واستقرار القوات العسكرية التي تهاجم لبنان.	https://ichef.bbci.co.uk/news/1024/branded_arabic/50dd/live/c7d73a60-93f0-11ef-89ae-5575c76d98e6.jpg	2024-10-27 01:18:12	BBC.com
lb	http://arabic.china.org.cn/txt/2024-10/27/content_117509583.htm	ثلاثة قتلى جراء غارة إسرائيلية على معبر حدودي بين سوريا ولبنان - شبكة الصين	None	http://images.china.cn/images1/ch/2022ChinaIdex/img/shareF2023.png	2024-10-26 21:02:55	شبكة الصين
lb	https://www.almodon.com/economy/2024/10/26/%D9%82%D8%B1%D8%A7%D8%B1-%D8%A7%D9%84%D9%84%D8%A7%D8%A6%D8%AD%D8%A9-%D8%A7%D9%84%D8%B1%D9%85%D8%A7%D8%AF%D9%8A%D8%A9-%D9%87%D8%A4%D9%84%D8%A7%D8%A1-%D9%8A%D8%AA%D8%AD%D9%85%D9%84%D9%88%D9%86-%D8%A7%D9%84%D9%85%D8%B3%D8%A4%D9%88%D9%84%D9%8A%D8%A9	قرار "اللائحة الرماديّة": هؤلاء يتحمّلون المسؤوليّة! - Al Modon	None	https://www.almodon.com/File/GetImageCustom/1437e197-403a-411c-bee4-a494ac55653a/1200/630	2024-10-26 21:04:07	Al Modon
lb	https://www.aljazeera.net/politics/2024/10/26/%D9%87%D9%83%D8%B0%D8%A7-%D9%8A%D9%82%D9%8A%D9%85-%D8%AE%D8%A8%D8%B1%D8%A7%D8%A1-%D8%B1%D9%88%D8%B3-%D8%A7%D9%84%D8%B6%D8%B1%D8%A8%D8%A9	هكذا يقيّم خبراء روس الضربة الإسرائيلية لطهران ودور موسكو فيها - الجزيرة نت	يرى خبراء روس أن رد إسرائيل الأحدث على طهران لم يتناسب مع حجم الضربة الإيرانية لها من حيث الحجم والتأثير والقدرة على تثبيت قواعد اشتباك جديدة. ولم يستبعدوا أن تكون روسيا حذرت إيران من طبيعة الهجوم.	None	2024-10-26 19:20:54	الجزيرة نت
lb	https://news.google.com/rss/articles/CCAiC0lsdFNFOTdfd2VzmAEB?oc=5	"اليونيفيل" تتحدى إسرائيل: "لن نتزحزح من مواقعنا في جنوب لبنان" - AlHadath الحدث	None	None	2024-10-26 18:40:32	AlHadath الحدث
lb	https://www.aljazeera.net/misc/2024/10/26/%D9%81%D9%84%D8%B3%D8%B7%D9%8A%D9%86%D9%8A%D9%88%D9%86-%D9%8A%D9%86%D8%B9%D9%88%D9%86-%D8%B9%D8%A7%D8%A6%D9%84%D8%A7%D8%AA-%D8%A8%D8%A3%D9%83%D9%85%D9%84%D9%87%D8%A7-%D8%B1%D9%81%D8%B6%D8%AA	فلسطينيون ينعون عائلات بأكملها رفضت النزوح من شمال غزة - الجزيرة نت	تداول رواد المنصات الرقمية، أمس الجمعة، أسماء عائلات مُسحت بالكامل من السجل المدني بعد أن قصفت الطائرات الحربية الإسرائيلية 13 منزلا على الأقل في منطقة “بلوك 7”.	https://www.aljazeera.net/wp-content/uploads/2024/10/00-1-1729969391.jpg?resize=1920%2C1280&quality=80	2024-10-26 20:01:16	الجزيرة نت
lb	https://www.mtv.com.lb/News/%D9%85%D9%80%D9%80%D8%AD%D9%80%D9%80%D9%84%D9%80%D9%80%D9%8A%D9%80%D9%80%D8%A7%D8%AA/1507735/%D8%AA%D8%B4%D9%8A%D9%8A%D8%B9-%D8%A7%D9%84%D8%B1%D8%A7%D8%A6%D8%AF-%D8%A7%D9%84%D8%B4%D9%87%D9%8A%D8%AF-%D9%85%D8%AD%D9%85%D8%AF-%D9%81%D8%B1%D8%AD%D8%A7%D8%AA-%D9%81%D9%8A-%D8%B1%D8%B4%D8%B9%D9%8A%D9%86	تشييع الرائد الشهيد محمد فرحات في رشعين - MTV Lebanon News	أقيمت مراسم تشييع الرائد الشهيد محمد فرحات، في بلدة رشعين في قضاء زغرتا، بحضور حشد من الأمنيين، عائلة الشهيد، وأهالي البلدة والجوار.وكان جثمان الشهيد فرحات، قد وصل من المستشفى العسكري المركزي إلى باحة كنيسة مار مارون في رشعين قضاء زغرتا،...	https://imagescdn.mtv.com.lb/articles/479911737929.jpg?width=533&quality=90	2024-10-26 12:51:19	MTV Lebanon News
lb	https://www.lbcgroup.tv/news/newspapers/809858/%D9%88%D8%B2%D9%8A%D8%B1-%D9%84%D8%A8%D9%86%D8%A7%D9%86%D9%8A-%D9%84%D9%80%D8%A7%D9%84%D8%A3%D9%86%D8%A8%D8%A7%D8%A1-%D8%A7%D9%84%D9%83%D9%88%D9%8A%D8%AA%D9%8A%D8%A9-%D8%A7%D9%84%D8%AF%D8%B9%D9%85-%D8%A7%D9%84%D8%B9%D8%B1%D8%A8%D9%8A-%D9%8A%D8%B3%D9%87%D9%85-%D9%81%D9%8A-%D8%AE%D9%84%D9%82-%D8%AD%D8%A7%D9%84%D8%A9-%D9%85%D9%86-%D8%A7%D9%84%D8%A7%D8%B3%D8%AA%D9%82/ar	وزير لبناني لـ"الأنباء" الكويتية: الدعم العربي يسهم في خلق حالة من الاستقرار النسبي - LBCI Lebanon	None	https://www.lbcgroup.tv/uploadImages/DocumentImages/Doc-T-809858-638656037964727936.JPG	2024-10-27 05:17:00	LBCI Lebanon
lb	https://news.google.com/rss/articles/CBMiogRBVV95cUxNWTQ3WVlqS2lHNUJjOVBTNVJ2TFZqZnhlMVp3WjdYVHhtN0hhMmhURGNSMmJQQjdrNDJhaUNWRWRoMDc1OGNQcGMyUHQ3YW1ybm02S01JcnNIb1FMYXFKZDF3SGZ0MllhZmRwblA5bkRqVTF6OG1adTdaUFY4THdzc0N1Z2JFV0YwMXJtOHpOd2lKUUc5WGtVbE1aaDNmQXBRMkU0TWh1T3dkUk1KS0p0Smd6aXZlR2UtVlI2a1ZFdXczcks2dTVsOGxzdDNHV0pqQ18tTjFVNUdnaXpCbG1VRUpzRVY0YWQtZUYzcTZJOExXdFJUdUlZZTBoM3BzM1plQndkbEVOTWFPNk9zd3FtMFFERjVVaWZQUnpRUGJLX1VZX2tNTlJqejhFQ1g2dzViVHNucUxMNG44QWFmN2pvcVVsSXlKZmxHZjhiVXNkQmZWbE5tTm1aOF8tWFpfYS1SSFBVeHNFNldpZXNwR0RYNjBrVEFaSjNUU0NVM3dHc2Q3TGVwRThxdmFFN3JTR0ppSlBGUjRPT2k4U0M5dW9HTXRaSllEa0NZWkFvc29yZ05jckxsa0tZUExNUkIwVmZuTDVTRG1jdWFLVmN6bnBKYWVLNXhVRV9ldFN2TzFHTUFCdFB3RmNjcW1OZ2xQaTNRSXUwaWJqb3VURFRMdWV3NmxIaGFra3cxMm9wUjhaUUd2czZlQzR0OUMwQ01fbWJHUXc?oc=5	الجيش الإسرائيلي يخلف قتلى ودماراً واسعاً في «كمال عدوان» - Alkhaleej Newspaper صحيفة الخليج 	None	None	2024-10-26 21:39:42	Alkhaleej Newspaper صحيفة الخليج 
lb	https://www.almayadeen.net/latestnews/2024/10/27/%D9%84%D8%A8%D9%86%D8%A7%D9%86--%D8%BA%D8%A7%D8%B1%D8%A9-%D8%A5%D8%B3%D8%B1%D8%A7%D8%A6%D9%8A%D9%84%D9%8A%D8%A9-%D8%B9%D9%84%D9%89-%D8%A8%D9%84%D8%AF%D8%A9-%D8%A8%D9%8A%D8%AA-%D8%B5%D9%84%D9%8A%D8%A8%D9%8A-%D9%81%D9%8A-%D9%82%D8%B6%D8%A7%D8%A1-%D8%A8%D8%B9%D9%84%D8%A8%D9%83-%D8%B4%D8%B1%D9%82%D9%8A	لبنان: غارة إسرائيلية على بلدة بيت صليبي في قضاء بعلبك شرقي لبنان - Al Mayadeen الميادين			2024-10-27 05:13:21	Al Mayadeen الميادين
lb	https://www.lebanon24.com/news/lebanon/1268931/%D9%85%D9%81%D8%A7%D8%AC%D8%A3%D8%A9-%D8%A5%D8%B3%D8%B1%D8%A7%D8%A6%D9%8A%D9%84%D9%8A%D8%A9-%D8%B9%D9%86-%D8%AD%D8%B2%D8%A8-%D8%A7%D9%84%D9%84%D9%87-%D9%87%D9%83%D8%B0%D8%A7-%D8%A7%D8%B3%D8%AA%D8%B9%D8%A7%D8%AF-%D8%B9%D8%A7%D9%81%D9%8A%D8%AA%D9%87	مفاجأة إسرائيلية عن "حزب الله".. هكذا استعاد "عافيته"! - Lebanon24	None	https://www.lebanon24.com/uploadImages/DocumentImages/Doc-P-1268931-638655770843168526.jpg	2024-10-26 19:05:38	Lebanon24
lb	https://www.saidaonline.com/295424	بعد استشهاد صفي الدين.. من يكون الأمين العام الجديد لـ"حزب الله"؟! - صيدا أون لاين	 ثلاثة أسابيع من الأخذ والردّ والجدل، وبعد ساعات على إعلان الجيش الإسرائيلي اغتياله رسميًا، نعى "حزب الله" في بيان رئيس مجلسه التنفيذي السيد هاشم صفي الدين الذي "ارتحل إلى ربه مع خيرة من إخوانه المجاهدين"، واصفًا إياه بـ"القائد الكبير والشهيد العظيم على طريق القدس"، وهي الطريق نفسها التي سبقه إليها الأمين	https://www.saidaonline.com/UploadCache/libfiles/24/6/1200x630o/363.jpg	2024-10-26 07:51:53	صيدا أون لاين
lb	https://www.mtv.com.lb/news/%D9%85%D9%80%D9%80%D8%AD%D9%80%D9%80%D9%84%D9%80%D9%80%D9%8A%D9%80%D9%80%D8%A7%D8%AA/1507495/%D9%85%D8%A7-%D9%87%D9%8A-%D8%A7%D9%84%D8%A3%D8%B3%D8%A8%D8%A7%D8%A8-%D8%A7%D9%84%D8%AA%D9%8A-%D8%AA%D9%85%D9%86%D8%B9-%D9%88%D9%82%D9%81-%D8%A5%D8%B7%D9%84%D8%A7%D9%82-%D8%A7%D9%84%D9%86%D8%A7%D8%B1-	ما هي الأسباب التي تمنع وقف إطلاق النار؟ - MTV Lebanon News	جاء في جريدة "الأنباء" الالكترونية:بالتزامن، وفي إطار الجهود والمساعي التي يبذلها رئيس حكومة تصريف الاعمال نجيب ميقاتي لوقف العدوان على لبنان. كان لافتاً اللقاء الذي جمعه مع وزير الخارجية الأميركي أنتوني بلينكن، يوم أمس، في لندن. حيق شدد...	https://imagescdn.mtv.com.lb/articles/768510946702.jpg?width=533&quality=90	2024-10-26 03:35:38	MTV Lebanon News
lb	https://menafn.com/arabic/1108821012/%D8%B1%D9%8A%D9%94%D9%8A%D8%B3%D8%A9-%D8%A7%D9%84%D8%B5%D9%84%D9%8A%D8%A8-%D8%A7%D9%84%D8%A7%D9%94%D8%AD%D9%85%D8%B1-%D8%A7%D8%AD%D8%AA%D8%B1%D8%A7%D9%85-%D8%A7%D9%84%D9%82%D8%A7%D9%86%D9%88%D9%86-%D8%A7%D9%84%D8%A7%D9%95%D9%86%D8%B3%D8%A7%D9%86%D9%8A-%D8%B6%D8%B1%D9%88%D8%B1%D8%A9-%D9%85%D9%84%D8%AD%D8%A9-%D8%AC%D8%AF%D8%A7	رئيسة الصليب الأحمر: احترام القانون الإنساني ((ضرورة ملحة جدا)) - MENAFN Arabic	 
  
  
  
   
 
الأحد ٢٧ أكتوبر ٢٠٢٤ - 02:00
   
  <p> <strong> جنيف‭ - (‬أ‭ ‬ف‭ ‬ب‭): ‬إزاء‭ ‬تزايد‭ ‬النزاعات‭ ‬المسلحة‭ ‬في‭ ‬العالم،‭ ‬نددت‭ 	https://menafn.com/updates/pr/2024-10/26/AAK_3a416image_story.jpg	2024-10-26 23:16:57	MENAFN Arabic
lb	https://www.mtv.com.lb/News/%D9%85%D9%80%D9%80%D8%AD%D9%80%D9%80%D9%84%D9%80%D9%80%D9%8A%D9%80%D9%80%D8%A7%D8%AA/1507891/-%D8%AD%D8%B2%D8%A8-%D8%A7%D9%84%D9%84%D9%87---%D8%A7%D8%B3%D8%AA%D9%87%D8%AF%D9%81%D9%86%D8%A7-%D8%AA%D8%AC%D9%85%D8%B9%D8%A7--%D9%84-%D9%82%D9%88%D8%A7%D8%AA-%D8%A7%D9%84%D8%B9%D8%AF%D9%88-%D9%81%D9%8A-%D9%85%D8%B3%D8%AA%D8%B9%D9%85%D8%B1%D8%A9-%D8%AD%D8%AA%D8%B3%D9%88%D8%B1	"حزب الله": استهدفنا تجمعاً لِقوات العدو في مستعمرة حتسور - MTV Lebanon News	أصدر "حزب الله" بيانا جاء فيه: "دعماً لشعبنا الفلسطيني الصامد في قطاع غزة وإسناداً لمقاومته الباسلة &zwnj;&rlm;&zwnj;&rlm;&zwnj;والشريفة، ودفاعًا عن لبنان &rlm;وشعبه، استهدف مجاهدو المقاومة الإسلامية عند الساعة 7:30 من مساء يوم السبت 26-...	https://imagescdn.mtv.com.lb/articles/677299264311.jpg?width=533&quality=90	2024-10-26 17:46:28	MTV Lebanon News
lb	https://aawsat.com/%D8%B4%D8%A4%D9%88%D9%86-%D8%A5%D9%82%D9%84%D9%8A%D9%85%D9%8A%D8%A9/5075205-%D8%A3%D9%88%D8%B3%D8%AA%D9%86-%D9%8A%D8%AD%D8%B0%D8%B1-%D8%B7%D9%87%D8%B1%D8%A7%D9%86-%D9%85%D9%86-%D8%A7%D9%84%D8%B1%D8%AF-%D8%B9%D9%84%D9%89-%D8%A7%D9%84%D8%B6%D8%B1%D8%A8%D8%A7%D8%AA-%D8%A7%D9%84%D8%A5%D8%B3%D8%B1%D8%A7%D8%A6%D9%8A%D9%84%D9%8A%D8%A9	أوستن يحذر طهران من الرد على الضربات الإسرائيلية - صحيفة الشرق الأوسط	 حذر وزير الدفاع الأميركي لويد أوستن، طهران من الرد على الضربات الإسرائيلية التي استهدفت مواقع عسكرية في إيران.	https://static.srpcdigital.com/styles/1200x600/public/2024-10/831906.jpeg	2024-10-26 23:18:09	صحيفة الشرق الأوسط
lb	https://www.almayadeen.net/news/politics/%D8%AD%D8%B2%D8%A8-%D8%A7%D9%84%D9%84%D9%87-%D9%8A%D9%82%D8%B5%D9%81-%D9%82%D8%A7%D8%B9%D8%AF%D8%AA%D9%8A--%D8%A7%D9%84%D9%86%D8%A7%D8%B9%D9%88%D8%B1%D8%A9--%D9%88-%D8%A5%D9%8A%D9%8A%D9%84%D9%8A%D8%AA--%D9%88%D9%85%D8%B3%D8%AA%D9%88%D8%B7%D9%86%D8%A7%D8%AA-%D9%88%D9%85%D9%88%D8%A7%D9%82%D8%B9-%D9%81	حزب الله يقصف قاعدتي "الناعورة" و"إييليت" ومستوطنات ومواقع في شمالي فلسطين المحتلة - Al Mayadeen الميادين	حزب الله ينفّذ عدة عمليات، بينها استهداف قاعدة "الناعورة" بالمسيّرات الانقضاضية وقاعدة "إييليت" بصواريخ نوعية، في إطار سلسلة عمليات "خيبر".	https://alpha-ar-media.almayadeen.net/media/image/2024/10/26/116cc8a0-73db-46a5-bbf1-ce676723c2bc.png?v=3&width=1000	2024-10-26 21:12:52	Al Mayadeen الميادين
lb	https://www.aljazeera.net/news/2024/10/25/%D8%B9%D8%A7%D8%AC%D9%84-%D9%87%D9%8A%D8%A6%D8%A9-%D8%A7%D9%84%D8%A8%D8%AB-%D8%A7%D9%84%D8%A5%D8%B3%D8%B1%D8%A7%D8%A6%D9%8A%D9%84%D9%8A%D8%A9-%D8%B9%D9%86-%D9%85%D8%B3%D8%A4%D9%88%D9%84%D9%8A%D9%86-2	مسؤولون إسرائيليون: العملية البرية بجنوب لبنان في مراحلها النهائية - الجزيرة نت	نقلت هيئة البث الإسرائيلية عن مسؤولين كبار في المؤسسة الأمنية قولهم إن العملية البرية بجنوب لبنان في مراحلها النهائية.	None	2024-10-25 20:35:59	الجزيرة نت
lb	https://arabic.cnn.com/middle-east/video/2024/10/27/v164412-lebanon-explosions-over-beirut-on-sunday-morning	أضاء السماء.. فيديو يظهر لحظة انفجار ضخم في بيروت بعد غارة إسرائيلية - CNN Arabic	في الوقت الذي تواصل فيه إسرائيل شن هجماتها في لبنان، أظهر مقطع فيديو لحظة وقوع انفجارات ضخمة في العاصمة بيروت، الأحد، حيث أضاءت الانفجارات سماء المدينة.	https://cnn-arabic-images.cnn.io/cloudinary/image/upload/w_1920,h_1008,c_fill,q_auto,g_center/t_cnnarabic_watermark_logo_v5/cnnarabic/2024/10/27/images/281246.jpg	2024-10-27 05:55:54	CNN Arabic
lb	https://www.aljadeed.tv/news/%D8%B9%D8%B1%D8%A8%D9%8A%D8%A7%D8%AA/511544/%D8%A3%D9%87%D8%A7%D9%84%D9%8A-%D8%A7%D9%84%D8%A3%D8%B3%D8%B1%D9%89-%D8%A7%D9%84%D8%A5%D8%B3%D8%B1%D8%A7%D8%A6%D9%8A%D9%84%D9%8A%D9%8A%D9%86-%D8%A8%D8%BA%D8%B2%D8%A9-%D9%86%D8%AA%D9%86%D9%8A%D8%A7%D9%87%D9%88-%D9%8A%D9%85%D8%A7%D8%B7%D9%84-%D9%88%D9%84%D8%A7-%D9%8A%D8%B1%D9%8A%D8%AF-%D8%A7%D9%84%D8%AA%D9%81%D8%A7%D9%88%D8%B6	أهالي الأسرى الإسرائيليين بغزة: نتنياهو يماطل ولا يريد التفاوض - قناة الجديد	قالت عائلات الأسرى الإسرائيليين لدى المقاومة الفلسطينية في غزة، إن رئيس الوزراء بنيامين نتنياهو، يواصل المماطلة، ولا نية لديه لإنجاز صفقة تبادل أسرى. 	https://www.aljadeed.tv/uploadImages/DocumentImages/Doc-P-511544-638655813828195731.JPG	2024-10-26 16:15:00	قناة الجديد
lb	https://www.lbcgroup.tv/news/newspapers/809861/%D8%A5%D8%B3%D8%B1%D8%A7%D8%A6%D9%8A%D9%84-%D8%AA%D8%B4%D8%AA%D8%B1%D8%B7-%D9%88%D9%82%D9%81-%D8%A7%D9%84%D9%86%D8%A7%D8%B1-%D9%81%D9%8A-%D8%BA%D8%B2%D8%A9-%D9%88%D9%84%D8%A8%D9%86%D8%A7%D9%86-%D9%85%D8%B9%D8%A7%D9%8B-%D8%A7%D9%84%D8%A3%D9%86%D8%A8%D8%A7%D8%A1-%D8%A7%D9%84%D9%83%D9%88%D9%8A%D8%AA%D9%8A%D8%A9/ar	إسرائيل تشترط وقف النار في غزة ولبنان معاً (الأنباء الكويتية) - LBCI Lebanon	None	https://www.lbcgroup.tv/uploadImages/DocumentImages/Doc-T-809861-638656043437296637.jpg	2024-10-27 05:35:00	LBCI Lebanon
lb	https://www.aljazeera.net/news/2024/10/27/%D8%B1%D9%88%D9%8A%D8%AA%D8%B1%D8%B2-%D8%A5%D8%B3%D8%B1%D8%A7%D8%A6%D9%8A%D9%84-%D9%82%D8%B5%D9%81%D8%AA-%D9%85%D9%86%D8%B4%D8%A2%D8%AA-%D8%AE%D9%84%D8%B7-%D9%88%D9%82%D9%88%D8%AF	رويترز: إسرائيل قصفت منشآت خلط وقود صواريخ في إيران - الجزيرة نت	كشفت صور التقطتها أقمار صناعية تجارية أن الضربات الجوية الإسرائيلية أصابت مباني خلال هجوم  السبت، استخدمتها إيران لخلط الوقود الصلب للصواريخ الباليستية، وفقا لتقييمين منفصلين أجراهما باحثان أميركيان.	https://www.aljazeera.net/wp-content/uploads/2024/10/hgtnksdf-1729919967.jpg?resize=1920%2C1280&quality=80	2024-10-27 01:41:21	الجزيرة نت
lb	https://www.elnashra.com/news/show/1693003/%D8%B9%D8%B1%D8%A7%D9%82%D8%AC%D9%8A-%D8%AF%D8%B9%D8%A7-%D9%84%D8%B9%D9%82%D8%AF-%D8%AC%D9%84%D8%B3%D8%A9-%D8%B9%D8%A7%D8%AC%D9%84%D8%A9-%D9%84%D9%85%D8%AC%D9%84%D8%B3-%D8%A7%D9%84%D8%A3%D9%85%D9%86-%D8%A5%D9%8A%D8%B1%D8%A7%D9%86-%D8%AA%D8%AD%D8%AA%D9%81%D8%B8	عراقجي دعا لعقد جلسة عاجلة لمجلس الأمن: إيران تحتفظ بحقها في الرد على الهجوم الصهيوني - Elnashra.com	أشار وزیر الخارجيّة الإيرانيّة &#8203;عباس عراقجي&#8203;، في رسالة وجّهها إلى كلّ من الأمين العام للأمم المتحدة ورئیس مجلس الأمن الدولي، إلى أنّ هذه الرّسالة مو	https://files.elnashra.com/elnashra/imagine/pictures_fb/3865702_1730007011.png	2024-10-27 04:50:17	Elnashra.com
lb	https://news.google.com/rss/articles/CBMisgRBVV95cUxQVXlDYV9Nc1RLRVNlQVJkQzdFbG45Z2FaNjJGd3BLTXFCWGN1c3FValZiclBFM2FpZW8xS0NDblFKWUtST3pZUWFLbmQ2QnVKbElrREZjTTdJNlA5MFRRQUZsV0gwODExTHY1akVtaW1yVnVmekVYRG5pWGtqUzJsTmJTelcyYlZGSXBEeTRCXzJyVG92bU5OX2RKQXhaYVZ3eVVkX1lBU0VrMWNLZHJoZTd5LVQ4SENyQzRLNGtmcVlqb1kxbkVSTF9jdDBfaDdHYlhyREtuSW4tOExETmxaVUVpUHpxS1N6OUpOQjNteGNlWWE0eTVLbWRjNXBIMEQxaVloSEVDeEhiWE9EZS1CbmVwc0l3b0thaUJNRW5ROTR2S3dzNnFsUERJbktOVGdLRWdnS1Q2TEh2VWNwdnRoRWdBNVAyNml1R2NicWZZaWlnU1d1a2tCbGk5SGV4U0kzek5uYmM4Y0owd2g5WFAzWGZkaS12Q212OW5PSm5ORjBCX2lETldJU1JhSkdBTHlEemxNWlNYVTFBY0w5djR3M2NnNl9hRFdaUDJLcTI3N01DY3hlcGRJMnpjTHV6RVl5Zjk3V05uNmxKekRaWUZGUTZwc2NyNXRRaDZoaGRJbjVOd3Azal95amVKcVZ0ZU9DWGFCOC1NWkh0OWJ4TmlqLVg4WndxWTZMNGxGdTFrMHBLcm0tTVI4eWlfaWF0dFB4M3hoYXdRWFJnRm1oLXRBMEVR?oc=5	مراسل الجديد: غارة إسرائيلية استهدفت بلدة عدشيت في قضاء النبطية - قناة الجديد	None	https://www.aljadeed.tv/uploadImages/DocumentImages/Default-Document-Picture.jpg	2024-10-27 00:03:00	قناة الجديد
lb	https://www.mc-doualiya.com/%D8%A7%D9%84%D8%B4%D8%B1%D9%82-%D8%A7%D9%84%D8%A3%D9%88%D8%B3%D8%B7/20241027-%D8%A7%D9%84%D8%AC%D9%8A%D8%B4-%D8%A7%D9%84%D8%A5%D8%B3%D8%B1%D8%A7%D8%A6%D9%8A%D9%84%D9%8A-%D9%8A%D9%82%D8%B5%D9%81-%D9%85%D9%86%D8%B4%D8%A3%D8%A9-%D8%A7%D8%B3%D8%AA%D8%B1%D8%A7%D8%AA%D9%8A%D8%AC%D9%8A%D8%A9-%D9%84%D8%AD%D8%B2%D8%A8-%D8%A7%D9%84%D9%84%D9%87-%D9%88%D8%A7%D9%86%D9%81%D8%AC%D8%A7%D8%B1%D8%A7%D8%AA-%D8%B9%D9%86%D9%8A%D9%81%D8%A9-%D9%81%D9%8A-%D9%83%D9%81%D8%B1%D9%83%D9%84%D8%A7-%D9%88%D8%A7%D9%84%D8%B9%D8%AF%D9%8A%D8%B3%D8%A9	الجيش الإسرائيلي يقصف منشأة استراتيجية لحزب الله... وانفجارات عنيفة في كفركلا والعديسة - MCD / مونت كارلو الدولية	 أعلن الجيش الإسرائيلي أنّه كشف ودمّر منشأة استراتيجية تحت أرضيّة لحزب الله في جنوب لبنان، وذلك من خلال 400 طن من المتفجرات، في وقت سمعت أصوات انفجارات عنيفة جدًّا في بلدتي كفركلا والعديسة الحدوديّتين أثناء…	https://s.mc-doualiya.com/media/display/aca6f8e6-942e-11ef-9d2b-005056bfb2b6/w:1280/p:16x9/South%20Lebanon-14.jpg	2024-10-27 06:44:35	MCD / مونت كارلو الدولية
lb	https://www.almodon.com/media/2024/10/26/%D9%84%D8%A8%D9%86%D8%A7%D9%86-%D8%B5%D8%AD%D8%A7%D9%81%D9%8A%D9%88%D9%86-%D8%AA%D8%AD%D8%AA-%D8%A7%D9%84%D8%B5%D8%AF%D9%85%D8%A9-%D8%A8%D8%B9%D8%AF-%D8%A7%D8%B3%D8%AA%D9%87%D8%AF%D8%A7%D9%81-%D8%A7%D9%84%D8%AC%D9%8A%D8%B4-%D8%A7%D9%84%D8%A5%D8%B3%D8%B1%D8%A7%D8%A6%D9%8A%D9%84%D9%8A-%D9%84%D9%87%D9%85	لبنان: صحافيون تحت الصدمة بعد استهداف الجيش الإسرائيلي لهم - Al Modon	None	https://www.almodon.com/File/GetImageCustom/9061f838-b055-4c6e-ba54-642471577675/1200/630	2024-10-26 09:29:06	Al Modon
lb	https://www.aljazeera.net/news/2024/10/27/%D8%B1%D9%88%D8%B3%D9%8A%D8%A7-%D8%AA%D8%B9%D9%84%D9%86-%D8%A5%D8%B3%D9%82%D8%A7%D8%B7-30-%D9%85%D8%B3%D9%8A%D8%B1%D8%A9	روسيا تعلن إسقاط 51 مسيّرة أوكرانية - الجزيرة نت	أعلنت وزارة الدفاع الروسية أن دفاعاتها الجوية تمكنت من تدمير أو اعتراض 51 طائرة مسيّرة أوكرانية على الأقل خلال الليل.	None	2024-10-27 07:23:18	الجزيرة نت
lb	https://news.google.com/rss/articles/CCAiCy1qREhxVkVKT2wwmAEB?oc=5	هوكشتاين يزور إسرائيل اليوم لبحث وقف إطلاق النار في لبنان - AlHadath الحدث	None	None	2024-10-27 03:23:16	AlHadath الحدث
lb	https://arabi21.com/story/1636116/%D8%AD%D8%B2%D8%A8-%D8%A7%D9%84%D9%84%D9%87-%D9%8A%D9%88%D8%A7%D8%B5%D9%84-%D8%AA%D9%83%D8%A8%D9%8A%D8%AF-%D8%AC%D9%8A%D8%B4-%D8%A7%D9%84%D8%A7%D8%AD%D8%AA%D9%84%D8%A7%D9%84-%D8%A7%D9%84%D8%AE%D8%B3%D8%A7%D8%A6%D8%B1-%D9%85%D9%82%D8%AA%D9%84-%D8%B6%D8%A7%D8%A8%D8%B7%D9%8A%D9%86-%D9%88%D8%AC%D9%86%D8%AF%D9%8A	حزب الله يواصل تكبيد جيش الاحتلال الخسائر.. مقتل ضابطين وجندي - عربي21	كشفت وسائل إعلام وحسابات عبرية، عن أسماء قتلى من جيش الاحتلال، سقطوا في المعارك جنوب لبنان، بنيران حزب الله، متخطين الإعلان الرسمي للجيش..
	https://i.arabi21.com/arabi21/1200x630/112023162633958728339.jpg	2024-10-27 04:16:00	عربي21
lb	https://www.lbcgroup.tv/news/lebanon/809769/%D8%AA%D9%82%D8%B1%D9%8A%D8%B1-%D9%84%D8%AC%D9%86%D8%A9-%D8%A7%D9%84%D8%B7%D9%88%D8%A7%D8%B1%D8%A6-%D8%B9%D9%86-%D8%A7%D9%84%D8%A7%D8%B9%D8%AA%D8%AF%D8%A7%D8%A1%D8%A7%D8%AA-%D8%A7%D9%84%D8%A5%D8%B3%D8%B1%D8%A7%D8%A6%D9%8A%D9%84%D9%8A%D8%A9-%D8%B9%D9%84%D9%89-%D9%84%D8%A8%D9%86%D8%A7%D9%86-11161-%D8%A7%D8%B9%D8%AA%D8%AF%D8%A7%D8%A1-%D9%85%D9%86/ar	تقرير لجنة الطوارئ عن الاعتداءات الإسرائيلية على لبنان: 11161 اعتداء منذ بداية العدوان - LBCI Lebanon	None	https://www.lbcgroup.tv/uploadImages/DocumentImages/Doc-T-809769-638655551150954726.jpeg	2024-10-26 15:55:00	LBCI Lebanon
lb	https://www.aljazeera.net/news/2024/10/27/120-%D8%BA%D8%A7%D8%B1%D8%A9-%D8%A5%D8%B3%D8%B1%D8%A7%D8%A6%D9%8A%D9%84%D9%8A%D8%A9-%D8%B9%D9%84%D9%89-%D9%84%D8%A8%D9%86%D8%A7%D9%86-%D9%88%D8%AD%D8%B2%D8%A8-%D8%A7%D9%84%D9%84%D9%87	120 غارة إسرائيلية على لبنان وحزب الله يقصف مصنعا عسكريا - الجزيرة نت	أعلن الجيش الإسرائيلي تنفيذ 120 غارة على مواقع مختلفة في لبنان خلال الـ24 ساعة الماضية، في حين شن حزب الله غارات على شمال إسرائيل، استهدفت إحداها مصنعا عسكريا.	https://www.aljazeera.net/wp-content/uploads/2024/10/36023430-1730012967.jpg?resize=1920%2C1440	2024-10-27 07:50:22	الجزيرة نت
