country_code	url	title	description	image_url	publish_date	source
lb	https://www.aljazeera.net/news/2024/11/9/%D8%AA%D8%B1%D8%A7%D9%85%D8%A8-%D9%8A%D8%B3%D8%AA%D8%B9%D8%AF-%D9%84%D9%84%D8%A7%D9%86%D8%B3%D8%AD%D8%A7%D8%A8-%D9%85%D9%86-%D8%A7%D8%AA%D9%81%D8%A7%D9%82%D9%8A%D8%A9-%D8%AF%D9%88%D9%84%D9%8A%D8%A9	ترامب يستعد للانسحاب من اتفاقية دولية مهمة - الجزيرة نت	قالت صحيفة نيويورك تايمز إن الفريق الانتقالي للرئيس الأميركي المنتخب دونالد ترامب يجهز للانسحاب من اتفاقية دولية مهمة وللسماح بمزيد من أعمال التنقيب والتعدين في بلاده.	None	2024-11-09 10:20:23	الجزيرة نت
lb	https://news.google.com/rss/articles/CCAiC1dqOUxHRFV1ZDZjmAEB?oc=5	إطلاق خمسين صاروخا من لبنان باتجاه عكا وخليج حيفا والجليل في شمال إسرائيل - AlJazeera Arabic قناة الجزيرة	None	None	2024-11-09 15:00:36	AlJazeera Arabic قناة الجزيرة
lb	https://news.google.com/rss/articles/CCAiCzRVdHZiWDVjbllnmAEB?oc=5	غارات إسرائيلية تستهدف مبان سكنية في الضاحية الجنوبية لبيروت - AlJazeera Arabic قناة الجزيرة	None	None	2024-11-09 18:45:00	AlJazeera Arabic قناة الجزيرة
lb	https://www.aljazeera.net/news/2024/11/9/%D8%A7%D9%84%D8%AF%D9%88%D9%8A%D8%B1%D9%8A-%D8%AD%D8%AF%D9%8A%D8%AB-%D8%A5%D8%B3%D8%B1%D8%A7%D8%A6%D9%8A%D9%84-%D8%B9%D9%86-%D9%82%D8%B1%D8%A8-%D9%88%D9%82%D9%81-%D8%A7%D9%84%D8%AD%D8%B1%D8%A8	الدويري: حديث إسرائيل عن قرب وقف الحرب في لبنان لا يعني تحقيق أهدافها - الجزيرة نت	قال الخبير العسكري اللواء فايز الدويري إن حديث إسرائيل عن قرب انتهاء العملية العسكرية في لبنان لا يعني أنها تمكنت من دفع حزب الله إلى ما وراء نهر الليطاني ولا أنها خلقت منطقة عازلة على الحدود.	https://www.aljazeera.net/wp-content/uploads/2024/11/image-1731184410.jpg?resize=1920%2C1080&quality=80	2024-11-09 20:35:16	الجزيرة نت
lb	https://aawsat.com/%D8%A7%D9%84%D8%B9%D8%A7%D9%84%D9%85/%D8%A3%D9%88%D8%B1%D9%88%D8%A8%D8%A7/5079850-%D8%B1%D9%88%D8%B3%D9%8A%D8%A7-%D9%84%D8%A7-%D8%AA%D8%B1%D9%89-%D8%B3%D8%A8%D8%A8%D8%A7%D9%8B-%D9%84%D8%A7%D8%B3%D8%AA%D8%A6%D9%86%D8%A7%D9%81-%D9%85%D8%AD%D8%A7%D8%AF%D8%AB%D8%A7%D8%AA-%D8%A7%D9%84%D8%AD%D8%AF-%D9%85%D9%86-%D8%A7%D9%84%D8%AA%D8%B3%D9%84%D8%AD-%D9%85%D8%B9-%D8%A3%D9%85%D9%8A%D8%B1%D9%83%D8%A7	روسيا «لا ترى سبباً» لاستئناف محادثات الحد من التسلح مع أميركا - صحيفة الشرق الأوسط	نقلت وكالة «إنترفاكس» عن نائب وزير الخارجية الروسي قوله، السبت، إن وزارة الخارجية لا ترى أي سبب يدفعها للحديث عن استئناف الحوار بشأن الحد من التسلح مع أميركا.	https://static.srpcdigital.com/styles/1200x600/public/2024-11/847105.jpeg	2024-11-09 10:45:00	صحيفة الشرق الأوسط
lb	https://www.sawtbeirut.com/lebanon-news/%D8%AA%D9%81%D8%A7%D8%B5%D9%8A%D9%84-%D9%88%D8%B9%D9%88%D8%AF-%D8%AA%D8%B1%D8%A7%D9%85%D8%A8-%D9%84%D9%80-%D8%A7%D9%84%D9%84%D8%A8%D9%86%D8%A7%D9%86%D9%8A%D9%8A%D9%86-%D9%88%D8%A7%D9%84%D8%B9%D8%B1/	تفاصيل وعود ترامب لـ اللبنانيين والعرب في أميركا.. ماذا تضمنت الرسالة؟ - صوت بيروت إنترناشونال	طلب عباس، الذي خاض محادثات مع مستشار ترمب ونسيبه من أصل لبنانيّ مسعد بولس، أن يدعم الرئيس مطالب الجاليتين اللبنانية والعربية في ميشيغان، لوقف الحرب. وقال	https://www.sawtbeirut.com/wp-content/uploads/2024/11/80-800x549.jpg	2024-11-09 05:36:23	صوت بيروت إنترناشونال
lb	https://news.google.com/rss/articles/CCAiC1RlTl9kcmpwNWpvmAEB?oc=5	"دولة صديقة".. خيوط جديدة حول خطف قبطان "البترون" - AlHadath الحدث	None	None	2024-11-09 20:23:19	AlHadath الحدث
lb	https://www.skynewsarabia.com/middle-east/1753862-%D8%A7%D9%95%D9%8A%D8%B1%D8%A7%D9%86-%D8%A7%D8%B3%D8%AA%D9%85%D8%B1%D8%A7%D8%B1-%D8%AD%D8%B1%D8%A8-%D8%BA%D8%B2%D8%A9-%D9%88%D9%84%D8%A8%D9%86%D8%A7%D9%86-%D9%8A%D9%87%D8%AF%D8%AF-%D9%85%D9%86%D8%A7%D8%B7%D9%82-%D8%AE%D8%A7%D8%B1%D8%AC-%D8%A7%D9%84%D8%B4%D8%B1%D9%82-%D8%A7%D9%84%D8%A7%D9%94%D9%88%D8%B3%D8%B7	إيران: استمرار حرب غزة ولبنان يهدد مناطق خارج الشرق الأوسط - Sky News Arabia سكاي نيوز عربية	حذر وزير الخارجية الإيراني عباس عراقجي، السبت، من خطر "انتشار" الحرب في قطاع غزة ولبنان إلى خارج الشرق الأوسط.	https://www.skynewsarabia.com/images/v1/2024/11/09/1753861/1200/630/1-1753861.jpg	2024-11-09 10:56:55	Sky News Arabia سكاي نيوز عربية
lb	https://news.google.com/rss/articles/CCAiC2Q0cnZPQzBDN2ZrmAEB?oc=5	أوضاع إنسانية صعبة للنازحين في لبنان - Al Jazeera Mubasher قناة الجزيرة مباشر	None	None	2024-11-09 21:17:41	Al Jazeera Mubasher قناة الجزيرة مباشر
lb	https://www.mc-doualiya.com/%D8%A7%D9%84%D8%A3%D8%AE%D8%A8%D8%A7%D8%B1%D8%A7%D9%84%D9%85%D8%B3%D8%AA%D9%85%D8%B1%D8%A9/20241109-%D8%AF%D8%A8%D9%84%D9%8A%D9%88-%D8%AA%D9%8A-%D8%A7%D9%8A%D9%87-%D8%A7%D9%84%D8%AE%D8%AA%D8%A7%D9%85%D9%8A%D8%A9-%D8%BA%D9%88%D9%81-%D8%AA%D8%AD%D8%B1%D8%B2-%D9%84%D9%82%D8%A8%D9%87%D8%A7-%D8%A7%D9%84%D8%A3%D9%88%D9%84-%D8%A8%D9%81%D9%88%D8%B2%D9%87%D8%A7-%D8%B9%D9%84%D9%89-%D8%AA%D8%B4%D9%8A%D9%86%D9%88%D9%8A%D9%86	"دبليو تي ايه" الختامية: غوف تحرز لقبها الأول بفوزها على تشينوين - MCD / مونت كارلو الدولية	أحرزت الاميركية كوكو غوف المصنّفة ثالثة عالميا لقبها الاول في بطولة الماسترز "دبليو تي ايه" الختامية في كرة المضرب بفوزها في نهائي مثير على الصينية جنغ تشينوين السابعة 3-6 و6-4 و7-6 (7-2) الاحد في الرياض.	https://s.mc-doualiya.com/media/display/f0fc59d6-9ed4-11ef-9f90-005056bf30b7/w:1280/p:16x9/d0c209acf016d5b460a1505f9bed7278e6f716fd.jpg	2024-11-09 20:00:14	MCD / مونت كارلو الدولية
lb	https://www.aljadeed.tv/news/%D8%B9%D8%B1%D8%A8%D9%8A%D8%A7%D8%AA/513518/%D8%A8%D8%B3%D8%A8%D8%A8-%D8%B5%D9%8A%D8%A7%D9%86%D8%AA%D9%87-%D8%A7%D9%84%D8%B9%D8%A7%D9%84%D9%8A%D8%A9-%D9%87%D8%A2%D8%B1%D8%AA%D8%B3-%D8%AA%D8%B1%D8%A7%D9%85%D8%A8-%D8%B3%D9%8A%D8%B2%D9%8A%D8%AD-%D9%86%D8%AA%D9%86%D9%8A%D8%A7%D9%87%D9%88	بسبب "صيانته العالية".. هآرتس: ترامب سيزيح نتنياهو - قناة الجديد	قال كاتب إسرائيلي إن الرئيس الأميركي المنتخب دونالد ترامب لن يهدر أي فرصة في محاولة إزاحة بنيامين نتنياهو الذي يحتاج إلى صيانة عالية، وذلك رغم صداقة جمعتهما سابقا. 	https://www.aljadeed.tv/uploadImages/DocumentImages/Doc-P-513518-638666832530813774.JPG	2024-11-08 10:16:00	قناة الجديد
lb	https://news.google.com/rss/articles/CCAiCzYwem9lSVdJMWhrmAEB?oc=5	حزب الله يستهدف تجمعًا للجيش الإسرائيلي بسرب من المُسيرات شرقي مارون الراس - Alghad TV - قناة الغد	None	None	2024-11-09 18:19:58	Alghad TV - قناة الغد
lb	https://news.google.com/rss/articles/CBMiugRBVV95cUxPOWR2bnVIa2lXVVN4dXNaUTJmRjJ3akxtNjl5bkNBNGRKMG1jcDgxLUR6QXFDNjNJTFZwcFR6bVZ5WkUxSWlZVUo5OFcyYllFanhZd1VNejhGR0o5TEhpRVA5SnFhbGNleF93RVVKU3UzT1FvUkpuZG5kTFViVDBUU0RnbnZQcDZTQUZfaGJXcEVFazUwSEwydjZUaXZnZTFiTDFWQzVtRl9KWWJ2WGdHS0k3TUtKR0hSMFpQWnQ1cWE3MFNIdzc3R0JBdnptLW1Ma0NEQktBV3FPWFk4SHBwanFxcTVnck1TXzJGLXB4SEFJMU9veXcyZE9mLWJ3TUVuSWd4RzFfVzF1NVVnTTBEUGcyaXZROUpqWFkyLVRpM2gwUFRwYVpOdm5IRFZRYUNoeEFBWkhnaDRZNTVSMkJBUElFMDJ5UW9pTDhUZUx1Q2RXWmN2TDlOWHlvRk9wTVlpclRPQ0xEdmtzemJsZmhyTDFWUGtVZklyT09XZi10dXFWb0dBY284dkpCNEFkd2tINEM5Sjk0dUlIeVViWldULUJWSk5MQmswZVFvNFpFNnVGSlg0UG44bk5QZ2YtTXlydF8xMWdyWEhlNERNWFgzQjRkUFpZc2JUZV9lcl96NWZMVHpfblZQdThzcVZra3o1RnhjN2NWdmNtYlN2ZmxnWXdlUlNhVk1JNjhlUFVBekp3aE1BVF9Edk9LZEpKckZyRDBkdEhwa1B1NkY4OEh3TzNJMHE2cG45Y0E?oc=5	"حزب الله" يسقط مسيرة ويقصف مصنعا بتل أبيب و4 قواعد إسرائيلية (محصلة) - Anadolu Agency | العربية	None	None	2024-11-09 22:22:19	Anadolu Agency | العربية
lb	https://www.aljazeera.net/news/2024/11/9/%D8%B9%D8%A7%D8%AC%D9%84-%D8%B1%D9%88%D9%8A%D8%AA%D8%B1%D8%B2-%D8%B9%D9%86-%D9%85%D8%B5%D8%AF%D8%B1-%D9%85%D8%B7%D9%84%D8%B9-%D9%82%D8%B7%D8%B1-%D8%AA%D9%86%D8%B3%D8%AD%D8%A8-%D9%85%D9%86	قطر تنفي الانسحاب من ملف الوساطة بغزة وغلق مكتب حماس بالدوحة - الجزيرة نت	أكدت وزارة الخارجية القطرية أن التقارير المتداولة عن انسحاب قطر من ملف الوساطة في غزة “ليست دقيقة”، وأشارت إلى أنها أخطرت الأطراف أنها ستستأنف جهودها مع الشركاء عند توفر الجدية اللازمة لإنهاء الحرب.	https://www.aljazeera.net/wp-content/uploads/2023/11/Pic-4557-1701117429.jpg?resize=1920%2C1080&quality=80	2024-11-09 19:07:30	الجزيرة نت
lb	https://www.lebanon24.com/news/lebanon/1275820/%D8%A7%D9%84%D8%B7%D8%A7%D8%A6%D8%B1%D8%A9-%D8%A7%D9%84%D9%8021-%D9%84%D9%84%D9%85%D8%B3%D8%A7%D8%B9%D8%AF%D8%A7%D8%AA-%D9%85%D9%86-%D9%85%D8%B1%D9%83%D8%B2-%D8%A7%D9%84%D9%85%D9%84%D9%83-%D8%B3%D9%84%D9%85%D8%A7%D9%86-%D8%AA%D8%B5%D9%84-%D8%A5%D9%84%D9%89-%D8%A7%D9%84%D9%85%D8%B7%D8%A7%D8%B1	الطائرة الـ21 للمساعدات من مركز الملك سلمان تصل إلى المطار - Lebanon24	None	https://www.lebanon24.com/uploadImages/DocumentImages/Doc-P-1275820-638667714735611804.jpg	2024-11-09 15:54:01	Lebanon24
lb	https://news.google.com/rss/articles/CCAiC0dha3luOHNkYUJRmAEB?oc=5	مولدات الكهرباء قنابل موقوتة بين منازل اللبنانيين - AlArabiya العربية	None	None	2024-11-09 20:09:41	AlArabiya العربية
lb	https://news.google.com/rss/articles/CCAiCzlPNFp4LThSelBFmAEB?oc=5	لبنانيون: حكومة بايدن لن تصل لحل في الحرب - AlHadath الحدث	None	None	2024-11-09 16:51:55	AlHadath الحدث
lb	https://www.sawtbeirut.com/world-news/13-%D8%B4%D9%87%D8%B1-%D9%85%D9%86-%D8%A7%D9%84%D8%A5%D8%A8%D8%A7%D8%AF%D8%A9-%D8%B4%D9%87%D8%AF%D8%A7%D8%A1-%D9%81%D9%84%D8%B3%D8%B7%D9%8A%D9%86%D9%8A%D9%8A%D9%86-%D8%A8%D9%82%D8%B5%D9%81-%D8%A5/	13 شهر من الإبادة.. شهداء فلسطينيين بقصف إسرائيلي لخيمة بغزة - صوت بيروت إنترناشونال	استشهد 4 فلسطينيين وأصيب آخرون، اليوم السبت، في قصف إسرائيلي استهدف خيمة تؤوي نازحين في بلدة عبسان الكبيرة، شرق مدينة خان يونس جنوبي قطاع غزة، الذي يشهد	https://www.sawtbeirut.com/wp-content/uploads/2024/10/3-15-800x549.jpg	2024-11-09 19:35:49	صوت بيروت إنترناشونال
lb	https://arabic.cnn.com/middle-east/article/2024/11/10/at-least-20-people-killed-israeli-strikes-eastern-lebanon-health-ministry	الصحة اللبنانية: 20 قتيلاً جراء غارات إسرائيلية على شرقي لبنان - CNN Arabic	قالت وزارة الصحة اللبنانية إن الغارات الإسرائيلية على شرقي لبنان، السبت، أسفرت عن مقتل 20 شخصًا على الأقل.	https://cnn-arabic-images.cnn.io/cloudinary/image/upload/x_0,y_0,w_7773,h_4372,c_crop/w_1920,h_1008,c_fill,q_auto,g_center/t_cnnarabic_watermark_logo_v5/cnnarabic/2024/11/10/images/282507.jpg	2024-11-09 21:20:37	CNN Arabic
lb	https://www.elnashra.com/news/show/1695595/%D8%A5%D9%8A%D9%83%D9%88%D9%86%D9%88%D9%85%D9%8A%D8%B3%D8%AA-%D9%8A%D9%88%D9%82%D9%81-%D8%AA%D8%B1%D8%A7%D9%85%D8%A8-%D8%AD%D8%B1%D9%88%D8%A8-%D8%A7%D9%84%D8%B4%D8%B1%D9%82-%D8%A7%D9%84%D8%A3%D9%88%D8%B3%D8%B7-%D9%88%D8%A3%D9%8A-%D8%AF%D9%88%D8%B1-%D9%84%D8%B5	إيكونوميست: هل يوقف ترامب حروب الشرق الأوسط وأي دور لصهره اللبناني؟ - Elnashra.com	سألت مجلة &ldquo;إيكونوميست&rdquo; البريطانية في افتتاحية لها، حول ما إذا كان الرئيس الأميركي المنتخب دونالد ترامب، سيَفي بتعهده خلال حملته الانتخابية بوقف الحر	https://files.elnashra.com/elnashra/imagine/pictures_fb/4043424_1731158488.jpg	2024-11-09 13:21:45	Elnashra.com
lb	https://aawsat.com/%D8%A7%D9%84%D8%B9%D8%A7%D9%84%D9%85-%D8%A7%D9%84%D8%B9%D8%B1%D8%A8%D9%8A/%D8%A7%D9%84%D9%85%D8%B4%D8%B1%D9%82-%D8%A7%D9%84%D8%B9%D8%B1%D8%A8%D9%8A/5080039-%D8%A7%D9%84%D8%AC%D9%8A%D8%B4-%D8%A7%D9%84%D8%A5%D8%B3%D8%B1%D8%A7%D8%A6%D9%8A%D9%84%D9%8A-%D8%AD%D8%B1%D9%82-%D8%AC%D9%86%D9%88%D8%AF%D9%86%D8%A7-%D8%A7%D9%84%D8%B9%D9%84%D9%85-%D8%A7%D9%84%D9%84%D8%A8%D9%86%D8%A7%D9%86%D9%8A-%D8%B9%D9%85%D9%84-%D9%85%D8%AE%D8%A7%D9%84%D9%81-%D9%84%D9%84%D8%AA%D8%B9%D9%84%D9%8A%D9%85%D8%A7%D8%AA	الجيش الإسرائيلي: حرق جنودنا العلم اللبناني عمل مخالف للتعليمات - صحيفة الشرق الأوسط	أدان الجيش الإسرائيلي حرق جنوده لعلم لبنان وقال إنه عمل مخالف للتعليمات.	https://static.srpcdigital.com/styles/1200x600/public/2024-11/847963_0.jpeg	2024-11-09 22:14:00	صحيفة الشرق الأوسط
lb	https://www.aljadeed.tv/news/%D9%85%D8%AD%D9%84%D9%8A%D8%A7%D8%AA/513703/%D8%AD%D8%B2%D8%A8-%D8%A7%D9%84%D9%84%D9%87-%D8%A5%D8%B3%D8%AA%D9%87%D8%AF%D9%81%D9%86%D8%A7-%D8%AA%D8%AC%D9%85%D8%B9%D8%A7%D9%8B-%D9%84%D9%82%D9%88%D8%A7%D8%AA-%D8%AC%D9%8A%D8%B4-%D8%A7%D9%84%D8%B9%D8%AF%D9%88-%D9%82%D8%B1%D8%A8-%D8%A8%D9%88%D8%A7%D8%A8%D8%A9-%D8%AD%D8%B3%D9%86-%D9%81%D9%8A-%D9%85%D8%AD%D9%8A%D8%B7-%D8%A8%D9%84%D8%AF%D8%A9-%D8%B4%D8%B9	حزب الله: إستهدفنا تجمعاً لقوات جيش العدو قرب بوابة حسن في محيط بلدة شعبا بصلية صاروخية - قناة الجديد	None	https://www.aljadeed.tv/uploadImages/DocumentImages/Default-Document-Picture.jpg	2024-11-09 15:34:00	قناة الجديد
lb	https://www.i24news.tv/ar/%D8%A3%D8%AE%D8%A8%D8%A7%D8%B1/%D8%A7%D9%84%D8%AD%D8%B1%D8%A8-%D9%81%D9%8A-%D8%A5%D8%B3%D8%B1%D8%A7%D8%A6%D9%8A%D9%84/artc-68d97588	التغطية متواصلة⭕الجيش الإسرائيلي يعثر على نظام صاروخي متنقل يحتوي على 24 صاروخا جاهزا للإطلاق في جنوب لبنان - i24NEWS in Arabic	تقرير: غارة إسرائيلية تستهدف بلدة سحمر في البقاع الغربي وسط لبنان 	None	2024-11-09 13:35:09	i24NEWS in Arabic
lb	https://aawsat.com/%D8%A7%D9%84%D8%B9%D8%A7%D9%84%D9%85/%D8%A3%D9%88%D8%B1%D9%88%D8%A8%D8%A7/5080028-%D9%88%D9%82%D8%A7%D8%A6%D8%B9-%D8%B3%D8%A8%D9%82%D8%AA-%D8%A7%D9%84%D8%A7%D8%B9%D8%AA%D8%AF%D8%A7%D8%A1-%D8%B9%D9%84%D9%89-%D9%85%D8%B4%D8%AC%D8%B9%D9%8A-%D9%83%D8%B1%D8%A9-%D9%82%D8%AF%D9%85-%D8%A5%D8%B3%D8%B1%D8%A7%D8%A6%D9%8A%D9%84%D9%8A%D9%8A%D9%86-%D9%81%D9%8A-%D8%A3%D9%85%D8%B3%D8%AA%D8%B1%D8%AF%D8%A7%D9%85	وقائع سبقت الاعتداء على مشجعي كرة قدم إسرائيليين في أمستردام - صحيفة الشرق الأوسط	قالت رئيسة بلدية أمستردام فمكه هالسما إن مشجعي فريق مكابي تل أبيب الإسرائيلي لكرة القدم تعرضوا للضرب على أيدي مجموعات إجرامية في الساعات الأولى من صباح الجمعة.	https://static.srpcdigital.com/styles/1200x600/public/2024-11/847940.jpeg	2024-11-09 20:35:00	صحيفة الشرق الأوسط
lb	https://www.almodon.com/politics/2024/11/10/%D8%A5%D9%8A%D8%B1%D8%A7%D9%86-%D8%AA%D8%B1%D8%A7%D8%B3%D9%84-%D8%AA%D8%B1%D8%A7%D9%85%D8%A8-%D8%A8%D8%A7%D9%84%D8%B9%D9%82%D9%84%D8%A7%D9%86%D9%8A%D8%A9-%D8%A3%D9%8A%D8%B9%D8%B1%D9%82%D9%84-%D9%86%D8%AA%D9%86%D9%8A%D8%A7%D9%87%D9%88-%D8%B5%D9%8A%D8%BA%D8%A9-%D9%87%D9%88%D9%83%D8%B4%D8%AA%D8%A7%D9%8A%D9%86-%D8%A7%D9%84%D9%85%D9%86%D9%82%D8%AD%D8%A9	إيران تراسل ترامب بالعقلانية.. أيعرقل نتنياهو صيغة هوكشتاين المنقّحة؟ - Al Modon	None	https://www.almodon.com/File/GetImageCustom/48abeace-5f51-4b14-8ce7-8436e294ef8e/1200/630	2024-11-10 00:42:54	Al Modon
lb	https://news.google.com/rss/articles/CCAiC2dQQXVyc3NPZFVVmAEB?oc=5	ضمن "عمليات خيبر"نيران حزب الله تصل إلى مصنعا عسكريا في تل أبيب.. قراءة العميد حسن جوني - Alghad TV - قناة الغد	None	None	2024-11-09 22:06:20	Alghad TV - قناة الغد
lb	https://www.aletihad.ae/news/%D8%B9%D8%B1%D8%A8%D9%8A-%D9%88%D8%AF%D9%88%D9%84%D9%8A/4528426/-%D9%8A%D9%88%D9%86%D9%8A%D9%81%D9%8A%D9%84---%D8%AA%D8%AF%D9%85%D9%8A%D8%B1-%D8%A5%D8%B3%D8%B1%D8%A7%D8%A6%D9%8A%D9%84-%D9%84%D9%85%D9%85%D8%AA%D9%84%D9%83%D8%A7%D8%AA%D9%86%D8%A7-%D8%A7%D9%86%D8%AA%D9%87%D8%A7%D9%83-%D9%84%D9%84%D9%82%D8%A7%D9%86%D9%88%D9%86-%D8%A7%D9%84%D8%AF%D9%88%D9%84%D9%8A	«يونيفيل»: تدمير إسرائيل لممتلكاتنا انتهاك للقانون الدولي - مركز الاتحاد للأخبار	أعلنت قوة الأمم المتحدة المؤقتة في لبنان «يونيفيل»، أمس، أن التدمير المتعمد والمباشر من الجيش الإسرائيلي لممتلكات قوة حفظ السلام «انتهاك صارخ» للقانون الدولي. وتتمركز قوات يونيفيل التي قوامها 10 آلاف جندي في جنوب لبنان لمراقبة أعمال القتال على طول الخط الأ	https://media.alittihad.ae/store/archive/image/2024/11/9/cd163219-cd3f-412e-96f6-0dcb3244e1c6.jpg?width=600	2024-11-09 21:09:29	مركز الاتحاد للأخبار
lb	https://aawsat.com/%D8%A7%D9%84%D8%B9%D8%A7%D9%84%D9%85-%D8%A7%D9%84%D8%B9%D8%B1%D8%A8%D9%8A/%D8%A7%D9%84%D9%85%D8%B4%D8%B1%D9%82-%D8%A7%D9%84%D8%B9%D8%B1%D8%A8%D9%8A/5079950-%D9%84%D8%A8%D9%86%D8%A7%D9%86-%D8%A8%D9%8A%D9%86-%D8%A7%D9%84%D8%AD%D9%84-%D8%A7%D9%84%D8%AF%D8%A8%D9%84%D9%88%D9%85%D8%A7%D8%B3%D9%8A-%D9%84%D9%88%D9%82%D9%81-%D8%A7%D9%84%D9%86%D8%A7%D8%B1-%D9%88%D8%AA%D8%B5%D8%A7%D8%B9%D8%AF-%D8%A7%D9%84%D9%85%D9%88%D8%A7%D8%AC%D9%87%D8%A9-%D8%A7%D9%84%D9%85%D9%81%D8%AA%D9%88%D8%AD%D8%A9	لبنان بين الحل الدبلوماسي لوقف النار وتصاعد المواجهة المفتوحة - صحيفة الشرق الأوسط	يتأرجح المشهد السياسي والعسكري في لبنان بين تمادي تل أبيب في حربها التدميرية، والترويج لمعاودة الوسيط الأميركي آموس هوكستين تحركه.	https://static.srpcdigital.com/styles/1200x600/public/2024-11/847338.jpeg	2024-11-09 15:57:00	صحيفة الشرق الأوسط
lb	https://www.mc-doualiya.com/%D8%A7%D9%84%D8%A3%D8%AE%D8%A8%D8%A7%D8%B1%D8%A7%D9%84%D9%85%D8%B3%D8%AA%D9%85%D8%B1%D8%A9/20241109-%D8%A8%D8%A7%D9%8A%D8%AF%D9%86-%D9%8A%D8%B3%D8%AA%D9%82%D8%A8%D9%84-%D8%AE%D9%84%D9%8A%D9%81%D8%AA%D9%87-%D8%AA%D8%B1%D8%A7%D9%85%D8%A8-%D8%A7%D9%84%D8%A3%D8%B1%D8%A8%D8%B9%D8%A7%D8%A1-%D9%81%D9%8A-%D8%A7%D9%84%D8%A8%D9%8A%D8%AA-%D8%A7%D9%84%D8%A3%D8%A8%D9%8A%D8%B6-%D9%82%D8%A8%D9%84-%D8%A7%D9%84%D8%B9%D9%88%D8%AF%D8%A9-%D8%A7%D9%84%D8%AA%D8%A7%D8%B1%D9%8A%D8%AE%D9%8A%D8%A9-%D9%84%D9%84%D8%A3%D8%AE%D9%8A%D8%B1	بايدن يستقبل خليفته ترامب الأربعاء في البيت الأبيض قبل العودة التاريخية للأخير - MCD / مونت كارلو الدولية	يعتزم جو بايدن استقبال خليفته دونالد ترامب في البيت الأبيض الأربعاء، بعد تعهد الرئيس الأميركي بانتقال سلمي ومنظم للسلطة إلى الرئيس الجمهوري المنتخب الذي خسر أمامه الانتخابات الرئاسية قبل أربع سنوات. 	https://s.mc-doualiya.com/media/display/4ecec66a-9ed1-11ef-b272-005056a90284/w:1280/p:16x9/6dba00d10670727634617cee0f5793596e3a1de4.jpg	2024-11-09 19:32:08	MCD / مونت كارلو الدولية
lb	https://www.swissinfo.ch/ara/%D9%88%D8%B2%D9%8A%D8%B1-%D8%AE%D8%A7%D8%B1%D8%AC%D9%8A%D8%A9-%D8%A5%D9%8A%D8%B1%D8%A7%D9%86-%D9%8A%D9%86%D9%81%D9%8A-%D8%AA%D8%AF%D8%A8%D9%8A%D8%B1-%D8%B7%D9%87%D8%B1%D8%A7%D9%86-%D9%85%D8%A4%D8%A7%D9%85%D8%B1%D8%A9-%D9%84%D8%A7%D8%BA%D8%AA%D9%8A%D8%A7%D9%84-%D8%AA%D8%B1%D8%A7%D9%85%D8%A8/88061882	وزير خارجية إيران ينفي تدبير طهران مؤامرة لاغتيال ترامب - SWI swissinfo.ch سويسرا بالعربي	دبي (رويترز) -   نفى وزير الخارجية الإيراني عباس عراقجي اتهامات الولايات المتحدة بوجود صلة بين طهران ومؤامرة مزعومة لقتل الرئيس المنتخب دونالد ترامب، ودعا يوم السبت إلى بناء الثقة بين البلدين الخصمين.	https://www.swissinfo.ch/content/wp-content/uploads/sites/13/2024/11/3a48a61d24bd86ce8f9574f650db1680-88061857.jpg?ver=13b011e8&fit=1200,800	2024-11-09 18:07:36	SWI swissinfo.ch سويسرا بالعربي
lb	https://www.nna-leb.gov.lb/ar/%D8%B3%D9%8A%D8%A7%D8%B3%D8%A9/737179/%D8%A7%D9%84%D8%A8%D9%86%D8%A7%D8%A1-%D8%A7%D9%84%D8%AA%D8%AD%D9%82%D9%8A%D9%82%D8%A7%D8%AA-%D8%AA%D8%B5%D9%84-%D8%A7%D9%84%D9%89-%D8%B1%D8%A6%D9%8A%D8%B3-%D8%A7%D9%84%D8%AD%D9%83%D9%88%D9%85%D8%A9-%D9%87%D9%84-%D8%A8%D8%AF%D8%A3-%D8%A7%D9%84%D8%B9%D8%AF	البناء: التحقيقات تصل الى رئيس الحكومة: هل بدأ العد التنازلي لبقاء نتنياهو في الحكم؟ - nna-leb.gov.lb	None	None	2024-11-09 04:26:36	nna-leb.gov.lb
lb	https://www.eremnews.com/news/arab-world/fyj7tnt	خاص- "أسرار" انقطاع علاقة الجيش اللبناني مع "حزب الله" - إرم نيوز	العقيد في الجيش اللبناني جميل أبو حمدان يقول إن   الاتصال بين الحزب والجيش اتقطع بعد اشتعال جبهة الجنوب.	https://cdn.eremnews.io/media/0e288375-1c5b-4e53-bf40-1a43f383b344	2024-11-09 05:55:34	إرم نيوز
lb	https://aawsat.com/%D8%A7%D9%84%D8%B9%D8%A7%D9%84%D9%85-%D8%A7%D9%84%D8%B9%D8%B1%D8%A8%D9%8A/%D8%A7%D9%84%D9%85%D8%B4%D8%B1%D9%82-%D8%A7%D9%84%D8%B9%D8%B1%D8%A8%D9%8A/5079928-17-%D9%82%D8%AA%D9%8A%D9%84%D8%A7%D9%8B-%D8%A8%D9%8A%D9%86%D9%87%D9%85-%D8%B7%D9%81%D9%84%D8%AA%D8%A7%D9%86-%D9%81%D9%8A-%D8%BA%D8%A7%D8%B1%D8%A7%D8%AA-%D8%A5%D8%B3%D8%B1%D8%A7%D8%A6%D9%8A%D9%84%D9%8A%D8%A9-%D8%B9%D9%84%D9%89-%D8%B5%D9%88%D8%B1-%D8%AC%D9%86%D9%88%D8%A8-%D9%84%D8%A8%D9%86%D8%A7%D9%86	17 قتيلاً بينهم طفلتان في غارات إسرائيلية على صور جنوب لبنان - صحيفة الشرق الأوسط	قُتل 7 أشخاص في غارات إسرائيلية على مدينة صور، جنوب لبنان، وفق حصيلة جديدة أوردتها وزارة الصحة اللبنانية، السبت، غداة الغارات التي استهدفت مباني سكنية.	https://static.srpcdigital.com/styles/1200x600/public/2024-11/847390.jpeg	2024-11-09 19:07:30	صحيفة الشرق الأوسط
lb	https://www.arab48.com/%D8%A3%D8%AE%D8%A8%D8%A7%D8%B1-%D8%B9%D8%B1%D8%A8%D9%8A%D8%A9-%D9%88%D8%AF%D9%88%D9%84%D9%8A%D8%A9/%D8%A3%D8%AE%D8%A8%D8%A7%D8%B1-%D8%B3%D9%88%D8%B1%D9%8A%D8%A9/2024/11/09/%D8%AA%D8%AC%D8%AF%D8%AF-%D8%A7%D9%84%D9%82%D8%B5%D9%81-%D8%A7%D9%84%D8%A5%D8%B3%D8%B1%D8%A7%D8%A6%D9%8A%D9%84%D9%8A-%D8%B9%D9%84%D9%89-%D8%B3%D9%88%D8%B1%D9%8A%D8%A9-5-%D9%82%D8%AA%D9%84%D9%89-%D9%81%D9%8A-%D8%A7%D9%84%D8%BA%D8%A7%D8%B1%D8%A7%D8%AA-%D8%B9%D9%84%D9%89-%D8%A5%D8%AF%D9%84%D8%A8-%D9%88%D8%AD%D9%84%D8%A8	تجدد القصف الإسرائيلي على سورية: 5 قتلى في الغارات على إدلب وحلب - عرب 48	مساء السبت، أفاد المرصد السوري لحقوق الإنسان بأن "ضربتين إسرائيليتين" استهدفتا موقع رادار لجيش النظام في شمال السويداء بجنوب البلاد، من دون أن يدلي بمعلومات اضافية.	https://data.arab48.com/data/news/2024/11/09/facebook_waterMark/20241109105002.png	2024-11-09 20:49:00	عرب 48
lb	https://www.mtv.com.lb/News/%D9%85%D8%A8%D8%A7%D8%B4%D8%B1/1514606/%D8%BA%D8%A7%D8%B1%D8%A9-%D8%A5%D8%B3%D8%B1%D8%A7%D8%A6%D9%8A%D9%84%D9%8A%D8%A9-%D8%AB%D8%A7%D9%86%D9%8A%D8%A9-%D8%AA%D8%B3%D8%AA%D9%87%D8%AF%D9%81-%D8%A8%D9%84%D8%AF%D8%A9-%D9%85%D8%B4%D8%BA%D8%B1%D8%A9-%D9%81%D9%8A-%D8%A7%D9%84%D8%A8%D9%82%D8%A7%D8%B9-%D8%A7%D9%84%D8%BA%D8%B1%D8%A8%D9%8A	غارة إسرائيلية ثانية تستهدف بلدة مشغرة في البقاع الغربي - MTV Lebanon News	غارة إسرائيلية تستهدف بلدة مشغرة في البقاع الغربي	https://imagescdn.mtv.com.lb/articles/811641810884.jpg?width=533&quality=90	2024-11-09 21:36:29	MTV Lebanon News
