country_code	url	title	description	image_url	publish_date	source
lb	https://news.google.com/rss/articles/CCAiC0xFNThqbEUxSXpFmAEB?oc=5	إسرائيل تعلن مهاجمة 120 هدفا لحزب الله في لبنان - AlHadath الحدث	None	None	2024-10-27 07:55:18	AlHadath الحدث
lb	https://www.elnashra.com/news/show/1692997/%D9%85%D9%82%D8%AA%D9%84-%D9%81%D9%84%D8%B3%D8%B7%D9%8A%D9%86%D9%8A%D9%8A%D9%86%C2%A0%D9%88%D8%A5%D8%B5%D8%A7%D8%A8%D8%A9-%D8%A2%D8%AE%D8%B1%D9%8A%D9%86-%D8%A8%D9%82%D8%B5%D9%81-%D8%A5%D8%B3%D8%B1%D8%A7%D8%A6%D9%8A%D9%84%D9%8A-%D9%84%D9%85%D9%86%D8%B2%D9%84-%D8%A8%D9%8A	مقتل أكثر من 35 فلسطينيًا بقصف إسرائيلي لمربّع سكني في بيت لاهيا شمال غزة - Elnashra.com	أفادت مصادر لـوكالة الأنباء والمعلومات الفلسطينيّة- وفا، بـاستشهاد 10 مواطنين وإصابة آخرين بجروح، بالإضافة إلى عدد من المفقودين، جرّاء قصف إسرائيلي على منزل لعا	https://files.elnashra.com/elnashra/imagine/pictures_fb/7764504_1730003679.jpg	2024-10-27 03:50:10	Elnashra.com
lb	https://www.aljazeera.net/politics/2024/10/27/%D8%A7%D9%84%D8%B5%D9%82%D9%8A%D8%B9-%D9%8A%D8%B7%D8%B1%D9%82-%D8%A3%D8%A8%D9%88%D8%A7%D8%A8-%D9%85%D8%B1%D8%A7%D9%83%D8%B2-%D8%A7%D9%84%D9%86%D8%A7%D8%B2%D8%AD%D9%8A%D9%86-%D9%81%D9%8A	الصقيع يطرق أبواب مراكز النازحين في البقاع دون تجهيزات شتوية - الجزيرة نت	يعيش النازحون اللبنانيون في مركز إيواء بالبقاع أوضاعا صعبة جدا فاقمها فصل الشتاء الذي استقبلوه دون مستلزمات ضرورية من ألبسة وسخانات وأغطية لمقاومة برودة المنطقة الشديدة نظرا لموقعها الجغرافي المرتفع.	https://www.aljazeera.net/wp-content/uploads/2024/10/004-1729955868.jpeg?resize=1920%2C1280&quality=80	2024-10-27 06:40:44	الجزيرة نت
lb	https://arabic.cnn.com/world/video/2024/10/27/v164410-north-korean-troops-in-ukraine	فيديو يظهر جنودا من كوريا الشمالية في روسيا.. هل يستعدون لدخول أوكرانيا؟ - CNN Arabic	قال البيت الأبيض هذا الأسبوع إن ما لا يقل عن 3000 جندي كوري شمالي وصلوا إلى شرق روسيا هذا الشهر.
	https://cnn-arabic-images.cnn.io/cloudinary/image/upload/w_1920,h_1008,c_fill,q_auto,g_center/t_cnnarabic_watermark_logo_v5/cnnarabic/2024/10/27/images/281243.jpg	2024-10-27 05:03:13	CNN Arabic
lb	https://www.swissinfo.ch/ara/%D8%AD%D8%B2%D8%A8-%D8%A7%D9%84%D9%84%D9%87%3A-%D8%A7%D8%B3%D8%AA%D9%87%D8%AF%D9%81%D9%86%D8%A7-%D9%82%D8%A7%D8%B9%D8%AF%D8%A9-%D8%AC%D9%88%D9%8A%D8%A9-%D8%A5%D8%B3%D8%B1%D8%A7%D8%A6%D9%8A%D9%84%D9%8A%D8%A9-%D8%A8%D9%85%D8%B3%D9%8A%D8%B1%D8%A7%D8%AA/87817741	حزب الله: استهدفنا قاعدة جوية إسرائيلية بمسيرات - SWI swissinfo.ch سويسرا بالعربي	(رويترز) -   قالت جماعة حزب الله اللبنانية يوم السبت إنها شنت هجوما بطائرات مسيرة على قاعدة تل نوف الجوية الإسرائيلية جنوبي تل أبيب، كما استهدفت بوابل من الصواريخ قاعدة للمخابرات بمدينة صفد في شمال إسرائيل.	https://www.swissinfo.ch/content/wp-content/uploads/sites/13/2024/10/d32af41a93ce908c6a1aeeab3c1d2d00-87819303.jpg?ver=cdfa56f5&fit=1200,800	2024-10-26 11:59:20	SWI swissinfo.ch سويسرا بالعربي
lb	https://news.google.com/rss/articles/CCAiC3FBTVd2dVhvanZ3mAEB?oc=5	كيف تعامل الداخل الإسرائيلي مع إنذار حزب الله بإخلاء 25 مستوطنة في الشمال؟ - AlJazeera Arabic قناة الجزيرة	None	None	2024-10-27 03:20:00	AlJazeera Arabic قناة الجزيرة
lb	https://www.nna-leb.gov.lb/ar/%D8%A3%D9%85%D9%86-%D9%88%D9%82%D8%B6%D8%A7%D8%A1/733635/%D8%BA%D8%A7%D8%B1%D8%A9-%D8%B9%D9%84%D9%89-%D8%A3%D8%B7%D8%B1%D8%A7%D9%81-%D8%A8%D8%AF%D9%8A%D8%A7%D8%B3-%D9%88%D8%AE%D8%B1%D9%82-%D8%AC%D8%AF%D8%A7%D8%B1-%D8%A7%D9%84%D8%B5%D9%88%D8%AA-%D9%81%D9%8A-%D8%B5%D9%88%D8%B1?__cf_chl_rt_tk=Goe4gNziE5Nq91tKa7U8fgXIUttc_IdKdM.1B7_dZj8-1730016356-1.0.1.1-ffAQNGVcMN3TjGEt8LzxZYileIp09eKrrJBwvH.CmQw	غارة على أطراف بدياس وخرق جدار الصوت في صور - nna-leb.gov.lb	None	None	2024-10-26 11:53:49	nna-leb.gov.lb
lb	https://news.google.com/rss/articles/CCAiC05HMFZSNk85M3JFmAEB?oc=5	أستاذ قانون دولي: مصلحة لبنان العليا تتطلب انتخاب رئيس جديد للجمهورية - AlHadath الحدث	None	None	2024-10-27 04:35:03	AlHadath الحدث
lb	https://news.google.com/rss/articles/CCAiC3J0TklpMTJGLUV3mAEB?oc=5	"ثلث شعب لبنان".. وزير المهجرين اللبناني: أعداد النازحين في البلاد زاد عن مليون ونصف - Al Jazeera Mubasher قناة الجزيرة مباشر	None	None	2024-10-26 23:13:36	Al Jazeera Mubasher قناة الجزيرة مباشر
lb	https://www.annahar.com/arab-world/arabian-levant/164506/%D8%B9%D8%AF%D8%A7%D8%AF-%D8%A7%D9%84%D8%B6%D8%AD%D8%A7%D9%8A%D8%A7-%D9%8A%D8%B1%D8%AA%D9%81%D8%B9-%D9%81%D9%8A-%D8%BA%D8%B2%D8%A9-%D9%88%D8%A7%D9%84%D9%88%D8%B6%D8%B9-%D9%83%D8%A7%D8%B1%D8%AB%D9%8A-%D9%81%D9%8A-%D8%B4%D9%85%D8%A7%D9%84-%D8%A7%D9%84%D9%82%D8%B7%D8%A7%D8%B9	عدّاد الضحايا يرتفع في غزة... والوضع "كارثي" في شمال القطاع - النهار	None	None	2024-10-26 11:47:00	النهار
lb	https://www.alquds.co.uk/%D8%A5%D8%B3%D8%B1%D8%A7%D8%A6%D9%8A%D9%84-%D8%AD%D8%B2%D8%A8-%D8%A7%D9%84%D9%84%D9%87-%D8%A3%D8%B7%D9%84%D9%82-%D9%86%D8%AD%D9%88-80-%D8%B5%D8%A7%D8%B1%D9%88%D8%AE%D8%A7-%D8%A7%D9%84%D8%B3%D8%A8/	إسرائيل: حزب الله أطلق نحو 80 صاروخا السبت - القدس العربي	أعلن الجيش الإسرائيلي السبت أن حزب الله اللبناني أطلق نحو 80 صاروخا على الدولة العبرية، بعد ساعات من شنها ضربات “دقيقة وموجهة” على إيران. وجاء في بيان عسكري “حتى الساعة 15:00 (12:00 تغ) عبر نحو 80 مقذوفا أطلقتها منظمة حزب الله الإرهابية من لبنان إلى إسرائيل اليوم”. وقال حزب الله اللبناني اليوم السبت إنه شن […]	https://www.alquds.co.uk/wp-content/uploads/2024/10/rocket-hit-sderot-home-1.jpg	2024-10-26 13:52:07	القدس العربي
lb	https://www.aljadeed.tv/news/%D8%B9%D8%B1%D8%A8%D9%8A%D8%A7%D8%AA/511389/%D9%8A%D8%AF%D9%8A%D8%B9%D9%88%D8%AA-%D8%A3%D8%AD%D8%B1%D9%88%D9%86%D9%88%D8%AA-%D8%AD%D8%B2%D8%A8-%D8%A7%D9%84%D9%84%D9%87-%D9%8A%D9%86%D9%81%D8%B0-%D8%AE%D8%B7%D8%A9-%D8%AF%D9%81%D8%A7%D8%B9%D9%8A%D8%A9-%D8%AA%D8%AD%D8%AF%D8%AB-%D8%B9%D9%86%D9%87%D8%A7-%D9%86%D8%B5%D8%B1-%D8%A7%D9%84%D9%84%D9%87	"يديعوت أحرونوت": حزب الله ينفذ خطة دفاعية تحدث عنها نصر الله - قناة الجديد	أكدت صحيفة يديعوت أحرونوت الإسرائيلية أنّ حزب الله ينفذ خطّة دفاعية في الحرب ضد الجيش الاسرائيلي ولاسيما عند الحدود، مشيرةً إلى أنّها الخطة نفسها التي تحدّث عنها الأمين العام للحزب السيد حسن نصر الله.	https://www.aljadeed.tv/uploadImages/DocumentImages/Doc-P-511389-638655177455166159.jpg	2024-10-26 05:38:37	قناة الجديد
lb	https://www.alarabiya.net/arab-and-world/2024/10/27/%D8%AA%D8%AC%D8%AF%D8%AF-%D8%A7%D9%84%D8%BA%D8%A7%D8%B1%D8%A7%D8%AA-%D8%B9%D9%84%D9%89-%D8%A7%D9%84%D8%B6%D8%A7%D8%AD%D9%8A%D8%A9-%D9%88%D9%85%D8%B7%D8%A7%D9%84%D8%A8%D8%A7%D8%AA-%D8%A7%D8%AE%D9%84%D8%A7%D8%A1-%D9%85%D8%AA%D8%A8%D8%A7%D8%AF%D9%84%D8%A9-%D8%A8%D9%8A%D9%86-%D8%A7%D8%B3%D8%B1%D8%A7%D8%A6%D9%8A%D9%84-%D9%88%D8%AD%D8%B2%D8%A8-%D8%A7%D9%84%D9%84%D9%87?__cf_chl_rt_tk=SfwPoQG.6rM0krT29VHyrR7szilwotywteu3y5Zk7r8-1730016392-1.0.1.1-RJUG0Dpuzj9Ebzd8VwbKE0c20vjWvf_ENA7yF3USr6U	غارات إسرائيلية على الضاحية.. وحزب الله يعلن استهداف شركة للصناعات العسكرية بعكا - العربية	None	None	2024-10-27 07:18:45	العربية
lb	https://news.google.com/rss/articles/CBMiaEFVX3lxTE9ERF9PRkRCUlI2czFEUUxfc1h4ZE16SVRBSzh6VlpZQlh1UFFIbmUxc0ZhSDJacnBWd1hyZVdReDBmVzhkRmhqVkJKM01CVVlScnc0SzJucVpnb2d5c1Z2TER6SWRPTFJs0gFuQVVfeXFMTW82NGxsTDh2ZVpORzJBdzRmNEpadGFkd1VobUVWaE1Md3NpQlpUTlhxV1pHeXFPQzdNTU1fZDJ2eVlEckN3cVIzT1lyVTdadE5tX3JmUmVXWFR5bXRaOGxiNjhXb29fSVIwMGNOY1E?oc=5	كيف ردت إسرائيل على استهداف منزل نتنياهو - imlebanon.org	None	None	2024-10-26 18:35:58	imlebanon.org