country_code	url	title	description	image_url	publish_date	source
lb	https://www.aljazeera.net/news/2024/11/10/%D8%A5%D8%B3%D8%B1%D8%A7%D8%A6%D9%8A%D9%84-%D8%AA%D8%AF%D8%B1%D8%B3-%D8%A5%D9%85%D9%83%D8%A7%D9%86%D9%8A%D8%A9-%D9%88%D9%82%D9%81-%D8%A5%D8%B7%D9%84%D8%A7%D9%82-%D8%A7%D9%84%D9%86%D8%A7%D8%B1-2	إسرائيل تدرس إمكانية وقف إطلاق النار بجبهة لبنان - الجزيرة نت	قالت القناة الـ12 الإسرائيلية إن إسرائيل تدرس إمكانية وقف إطلاق النار بالجبهة الشمالية مع لبنان لتجنب أي قرار من مجلس الأمن الدولي ضدها.	None	2024-11-09 22:38:22	الجزيرة نت
lb	https://www.lebanondebate.com/news/672609	بين وعود ترامب والواقع الميداني... التاريخ سيعيد نفسه عاجلًا أم آجلًا! - LebanonDebate	None	None	2024-11-09 11:41:12	LebanonDebate
lb	https://www.alarabiya.net/politics/2024/11/09/%D8%A7%D9%84%D8%AD%D9%83%D9%88%D9%85%D8%A9-%D8%A7%D9%84%D8%A7%D8%B3%D8%B1%D8%A7%D8%A6%D9%8A%D9%84%D9%8A%D8%A9-%D8%A8%D8%B9%D8%AF-%D8%A7%D9%84%D8%AA%D8%B9%D8%AF%D9%8A%D9%84%D8%A7%D8%AA-%D8%A7%D9%84%D9%88%D8%B2%D8%A7%D8%B1%D9%8A%D8%A9-%D9%88%D9%81%D9%88%D8%B2-%D8%AA%D8%B1%D8%A7%D9%85%D8%A8?__cf_chl_rt_tk=VEmothnFwQyy_xp.ckt9bfWJoiSocR3V8Ipt2SMvtfM-1731211546-1.0.1.1-dg9h58Xn9B_XkW5..Qa5TfSKv_lOYxUqTn4dw5MC78A	الحكومة الإسرائيلية بعد التعديلات الوزارية وفوز ترامب - العربية	None	None	2024-11-09 18:22:00	العربية
lb	https://www.alahednews.com.lb/article.php?id=76171&cid=126	400 يوم على العدوان.. الاحتلال يواصل استهداف مراكز الإيواء في قطاع غزة المحاصر - alahednews	&nbsp;المزيد من الشهداء والجرحى&nbsp;	https://www.alahednews.com.lb/uploaded/essaysimages/small/lvl220241109083958530.jpg	2024-11-09 06:40:50	alahednews
lb	https://www.annahar.com/international/Iran/169236/%D9%88%D8%B2%D9%8A%D8%B1-%D8%AE%D8%A7%D8%B1%D8%AC%D9%8A%D8%A9-%D8%A5%D9%8A%D8%B1%D8%A7%D9%86-%D9%8A%D9%86%D9%81%D9%8A-%D8%AA%D8%AF%D8%A8%D9%8A%D8%B1-%D8%B7%D9%87%D8%B1%D8%A7%D9%86-%D9%85%D8%A4%D8%A7%D9%85%D8%B1%D8%A9-%D9%84%D8%A7%D8%BA%D8%AA%D9%8A%D8%A7%D9%84-%D8%AA%D8%B1%D8%A7%D9%85%D8%A8	وزير خارجية إيران ينفي تدبير طهران مؤامرة لاغتيال ترامب - النهار	None	None	2024-11-09 16:46:00	النهار
lb	https://www.aljazeera.net/politics/2024/11/9/%D9%86%D9%8A%D9%88%D9%8A%D9%88%D8%B1%D9%83-%D8%AA%D8%A7%D9%8A%D9%85%D8%B2-%D9%87%D9%86%D8%A7%D9%83-%D8%B3%D8%A8%D8%A8-%D9%88%D8%B1%D8%A7%D8%A1-%D8%A7%D8%B3%D8%AA%D9%85%D8%B1%D8%A7%D8%B1	نيويورك تايمز: هناك سبب وراء استمرار فوز ترامب ومن يحذو حذوه - الجزيرة نت	قال بن رودس نائب مستشار الأمن القومي في عهد الرئيس باراك أوباما بمقال رأي بنيويورك تايمز إن استمرار نجاح القادة الشعبويين مثل ترامب يعود لمقدرتهم على استغلال “انهيار الديمقراطية الليبرالية الغربية”.	https://www.aljazeera.net/wp-content/uploads/2024/11/%D9%81%D9%82653746-1731152013.jpg?resize=1920%2C1440	2024-11-09 14:27:32	الجزيرة نت
lb	https://www.mtv.com.lb/News/%D9%85%D9%80%D9%80%D8%AD%D9%80%D9%80%D9%84%D9%80%D9%80%D9%8A%D9%80%D9%80%D8%A7%D8%AA/1514568/%D8%A8%D8%A7%D9%84%D9%81%D9%8A%D8%AF%D9%8A%D9%88--%D8%A7%D9%84%D9%80mtv-%D8%AA-%D8%B9%D8%A7%D9%8A%D9%86-%D8%A3%D9%88%D8%B6%D8%A7%D8%B9-%D8%A7%D9%84%D9%86%D8%A7%D8%B2%D8%AD%D9%8A%D9%86-%D9%81%D9%8A-%D8%B9%D9%83-%D8%A7%D8%B1	بالفيديو: mtv تُعاين أوضاع النازحين في عكّار - MTV Lebanon News	mtv تعاين أوضاع النازحين في شدرا والقبيات وتزور غرفة إدارة كوارث في محافظة عكّار، ودعوات لتأمين الكهرباء والمازوت قبل حلول فصل الشتاء.التفاصيل في الفيديو المرفق.	https://imagescdn.mtv.com.lb/articles/402819260525.jpg?width=533&quality=90	2024-11-09 18:47:07	MTV Lebanon News
lb	https://www.nna-leb.gov.lb/ar/%D9%85%D8%AA%D9%81%D8%B1%D9%82%D8%A7%D8%AA/737310/%D8%AC%D9%85%D8%B9%D9%8A%D8%A9-%D8%A5%D9%86%D9%85%D8%A7%D8%A1-%D8%B7%D8%B1%D8%A7%D8%A8%D9%84%D8%B3-%D9%88%D8%A7%D9%84%D9%85%D9%8A%D9%86%D8%A7%D8%A1-%D8%AA%D8%B4%D9%8A%D8%AF-%D8%A8%D8%AF%D9%88%D8%B1-%D9%85%D9%8A%D9%82%D8%A7%D8%AA%D9%8A-%D8%B9%D9%84%D9%89-%D8%A7?__cf_chl_rt_tk=pCzj2eUzm3ARrJXP6sZ7gvj.Ova65_oY526s_v7bs4M-1731211605-1.0.1.1-5V609PzjMnTW8KbeVZHolKRphiqHMN7ljelJYVlGFCE	جمعية "إنماء طرابلس والميناء" تشيد بدور ميقاتي على الساحتين العربية والداخلية - nna-leb.gov.lb	None	None	2024-11-09 15:04:13	nna-leb.gov.lb
lb	https://www.aljazeera.net/news/2024/11/9/%D9%85%D9%83%D8%AA%D8%A8-%D9%86%D8%AA%D9%86%D9%8A%D8%A7%D9%87%D9%88-%D9%8A%D9%88%D8%A7%D8%AC%D9%87-5-%D9%82%D8%B6%D8%A7%D9%8A%D8%A7-%D8%A8%D8%B9%D8%B6%D9%87%D8%A7-%D9%82%D9%8A%D8%AF	مكتب نتنياهو يواجه 5 قضايا بعضها قيد التحقيق - الجزيرة نت	كشفت صحيفة إسرائيلية أن مكتب رئيس الوزراء الإسرائيلي بنيامين نتنياهو يواجه قضية جديدة تتعلق بطلبه إيقاف تسجيل الجيش لاجتماعات “مجلس الحرب”، بعد الكشف عن قضايا أخرى يواجهها بعضها قيد التحقيق.	None	2024-11-09 13:59:32	الجزيرة نت
lb	https://news.google.com/rss/articles/CBMi1wRBVV95cUxOQWxHRk10aHBocFhlUHA5QnBDRUlrNUNWSmFOYXU0dVAzeXVMbW1zZGNmOEN0bHpTR1FRaWdrMzIwNjFjdzJWbDRMc09WWFN3WHk2MzFkYWxzcmxCS3VSQzItVzc0bXdyS0xBcTh3ME9jckFrSzdCQTdTR2xuVXEwcjVwWXc5bFdVeThjdnJJUW9SSzNVWnVBdmtwZ3AwckRENHBndjNfWG1LdGlTNVFCRmMzWi1VR19vOWlBTnVtYVhRRzR2OGFCdEN5Ry1hXzV2dXBHRkNMcm5CRHE1VVpLdVZiQVpDbV9zbFZkVGhrMnpTY2lZdTZzdGFSQXpDdGdkZWFGSWZEMTQwVUVrR3BlcXpiMi1UeDdqcTNXa0c2eHVONFJtUmlYVzExeU1xbFRndkYtYnM4WUdnNE43UWZ4cGE1eWxydlVEQmRvZFVxZzBEdllfRmhLNE9SRnVLQk9mZHBTVDVnNUREX09HYm5MSkZEczJ6VGc5Yy0xekJyWVh3MWtSWVVXUW4temp4T2xoZG1iOGk5QlJneTZsWE91RnhsMVZqUkIzMUpBbEg5aElNUzZNbFItcjI1LVBYd3VZa2FyRFBuNnYxV0pmYXVBcXhKb0RwdndvTktnaWdCZnNvVG9FTVIzbDhmX1ZTTWVxOENYQUZROUxOVjNLS1pPRGdnUFFCLXZBeEdxZW1RMlg2bGhTX2ptX1BFbkIyVFh5R29xNFRoZnhweWl3SEgzR1h3NU1ZbThya1paNFZCTWtRcGNtSEc4V2hHRjVPbmRjSC1yRjdiRQ?oc=5	حزب الله: إستهدفنا تجمعاً لقوات جيش العدو قرب بوابة حسن في محيط بلدة شعبا بصلية صاروخية - قناة الجديد	None	https://www.aljadeed.tv/uploadImages/DocumentImages/Default-Document-Picture.jpg	2024-11-09 15:34:00	قناة الجديد
lb	https://news.google.com/rss/articles/CCAiC0cwZ0VJOE4tX3FjmAEB?oc=5	إسرائيل تعترض مسيرات أطلقت من جنوب لبنان - AlHadath الحدث	None	None	2024-11-09 07:29:48	AlHadath الحدث
lb	https://www.almayadeen.net/latestnews/2024/11/9/%D9%84%D8%A8%D9%86%D8%A7%D9%86--%D9%85%D8%B1%D8%A7%D8%B3%D9%84-%D8%A7%D9%84%D9%85%D9%8A%D8%A7%D8%AF%D9%8A%D9%86--%D9%87%D8%AF%D9%88%D8%A1-%D8%AD%D8%B0%D8%B1-%D9%8A%D8%B3%D9%8A%D8%B7%D8%B1-%D8%B9%D9%84%D9%89-%D8%A7%D9%84%D8%B6%D8%A7%D8%AD%D9%8A%D8%A9-%D8%A7%D9%84%D8%AC%D9%86%D9%88%D8%A8%D9%8A%D8%A9-%D9%84?__cf_chl_rt_tk=sJZW1NcI3uRNhIuGVwIgcU3_nGuopI6D4.8TEmSpUyw-1731211644-1.0.1.1-EtPdnAmUQwpxWUOqP9cP4Y1FDusIW59OWcLzHuO7xao	لبنان: مراسل الميادين: هدوء حذر يسيطر على الضاحية الجنوبية لبيروت وسط تحليق مستمر للطيران المسير - Al Mayadeen الميادين	None	None	2024-11-09 21:46:00	Al Mayadeen الميادين
lb	https://www.vaticannews.va/ar/pope/news/2024-11/papa-educazione.html	خطاب البابا فرنسيس إلى المشاركين في ندوة عالمية حول التربية - Vatican News	استقبل البابا فرنسيس صباح اليوم السبت في الفاتيكان المشاركين في الندوة العالمية للجامعات حول موضوع "خدمة التعليم والميثاق التربوي العالمي"، ووجه لهم ...	https://www.vaticannews.va/content/dam/vaticannews/agenzie/images/srv/2024/11/09/2024-11-09-partecipanti-al-simposio-universitario--service-learn/1731145967819.jpg/_jcr_content/renditions/cq5dam.thumbnail.cropped.1500.844.jpeg	2024-11-09 12:07:37	Vatican News