country_code	url	title	description	image_url	publish_date	source
lb	https://www.aljazeera.net/news/2024/11/9/%D8%AA%D8%B1%D8%A7%D9%85%D8%A8-%D9%8A%D8%B3%D8%AA%D8%B9%D8%AF-%D9%84%D9%84%D8%A7%D9%86%D8%B3%D8%AD%D8%A7%D8%A8-%D9%85%D9%86-%D8%A7%D8%AA%D9%81%D8%A7%D9%82%D9%8A%D8%A9-%D8%AF%D9%88%D9%84%D9%8A%D8%A9	ترامب يستعد للانسحاب من اتفاقية دولية مهمة - الجزيرة نت	قالت صحيفة نيويورك تايمز إن الفريق الانتقالي للرئيس الأميركي المنتخب دونالد ترامب يجهز للانسحاب من اتفاقية دولية مهمة وللسماح بمزيد من أعمال التنقيب والتعدين في بلاده.	None	2024-11-09 10:20:23	الجزيرة نت
lb	https://news.google.com/rss/articles/CCAiC1dqOUxHRFV1ZDZjmAEB?oc=5	إطلاق خمسين صاروخا من لبنان باتجاه عكا وخليج حيفا والجليل في شمال إسرائيل - AlJazeera Arabic قناة الجزيرة	None	None	2024-11-09 15:00:36	AlJazeera Arabic قناة الجزيرة
lb	https://news.google.com/rss/articles/CCAiCzRVdHZiWDVjbllnmAEB?oc=5	غارات إسرائيلية تستهدف مبان سكنية في الضاحية الجنوبية لبيروت - AlJazeera Arabic قناة الجزيرة	None	None	2024-11-09 18:45:00	AlJazeera Arabic قناة الجزيرة
lb	https://www.aljazeera.net/news/2024/11/9/%D8%A7%D9%84%D8%AF%D9%88%D9%8A%D8%B1%D9%8A-%D8%AD%D8%AF%D9%8A%D8%AB-%D8%A5%D8%B3%D8%B1%D8%A7%D8%A6%D9%8A%D9%84-%D8%B9%D9%86-%D9%82%D8%B1%D8%A8-%D9%88%D9%82%D9%81-%D8%A7%D9%84%D8%AD%D8%B1%D8%A8	الدويري: حديث إسرائيل عن قرب وقف الحرب في لبنان لا يعني تحقيق أهدافها - الجزيرة نت	قال الخبير العسكري اللواء فايز الدويري إن حديث إسرائيل عن قرب انتهاء العملية العسكرية في لبنان لا يعني أنها تمكنت من دفع حزب الله إلى ما وراء نهر الليطاني ولا أنها خلقت منطقة عازلة على الحدود.	https://www.aljazeera.net/wp-content/uploads/2024/11/image-1731184410.jpg?resize=1920%2C1080&quality=80	2024-11-09 20:35:16	الجزيرة نت
lb	https://aawsat.com/%D8%A7%D9%84%D8%B9%D8%A7%D9%84%D9%85/%D8%A3%D9%88%D8%B1%D9%88%D8%A8%D8%A7/5079850-%D8%B1%D9%88%D8%B3%D9%8A%D8%A7-%D9%84%D8%A7-%D8%AA%D8%B1%D9%89-%D8%B3%D8%A8%D8%A8%D8%A7%D9%8B-%D9%84%D8%A7%D8%B3%D8%AA%D8%A6%D9%86%D8%A7%D9%81-%D9%85%D8%AD%D8%A7%D8%AF%D8%AB%D8%A7%D8%AA-%D8%A7%D9%84%D8%AD%D8%AF-%D9%85%D9%86-%D8%A7%D9%84%D8%AA%D8%B3%D9%84%D8%AD-%D9%85%D8%B9-%D8%A3%D9%85%D9%8A%D8%B1%D9%83%D8%A7	روسيا «لا ترى سبباً» لاستئناف محادثات الحد من التسلح مع أميركا - صحيفة الشرق الأوسط	نقلت وكالة «إنترفاكس» عن نائب وزير الخارجية الروسي قوله، السبت، إن وزارة الخارجية لا ترى أي سبب يدفعها للحديث عن استئناف الحوار بشأن الحد من التسلح مع أميركا.	https://static.srpcdigital.com/styles/1200x600/public/2024-11/847105.jpeg	2024-11-09 10:45:00	صحيفة الشرق الأوسط
lb	https://news.google.com/rss/articles/CCAiC1RlTl9kcmpwNWpvmAEB?oc=5	"دولة صديقة".. خيوط جديدة حول خطف قبطان "البترون" - AlHadath الحدث	None	None	2024-11-09 20:23:19	AlHadath الحدث
lb	https://www.skynewsarabia.com/middle-east/1753862-%D8%A7%D9%95%D9%8A%D8%B1%D8%A7%D9%86-%D8%A7%D8%B3%D8%AA%D9%85%D8%B1%D8%A7%D8%B1-%D8%AD%D8%B1%D8%A8-%D8%BA%D8%B2%D8%A9-%D9%88%D9%84%D8%A8%D9%86%D8%A7%D9%86-%D9%8A%D9%87%D8%AF%D8%AF-%D9%85%D9%86%D8%A7%D8%B7%D9%82-%D8%AE%D8%A7%D8%B1%D8%AC-%D8%A7%D9%84%D8%B4%D8%B1%D9%82-%D8%A7%D9%84%D8%A7%D9%94%D9%88%D8%B3%D8%B7	إيران: استمرار حرب غزة ولبنان يهدد مناطق خارج الشرق الأوسط - Sky News Arabia سكاي نيوز عربية	حذر وزير الخارجية الإيراني عباس عراقجي، السبت، من خطر "انتشار" الحرب في قطاع غزة ولبنان إلى خارج الشرق الأوسط.	https://www.skynewsarabia.com/images/v1/2024/11/09/1753861/1200/630/1-1753861.jpg	2024-11-09 10:56:55	Sky News Arabia سكاي نيوز عربية
lb	https://news.google.com/rss/articles/CCAiC2Q0cnZPQzBDN2ZrmAEB?oc=5	أوضاع إنسانية صعبة للنازحين في لبنان - Al Jazeera Mubasher قناة الجزيرة مباشر	None	None	2024-11-09 21:17:41	Al Jazeera Mubasher قناة الجزيرة مباشر
lb	https://www.mc-doualiya.com/%D8%A7%D9%84%D8%A3%D8%AE%D8%A8%D8%A7%D8%B1%D8%A7%D9%84%D9%85%D8%B3%D8%AA%D9%85%D8%B1%D8%A9/20241109-%D8%AF%D8%A8%D9%84%D9%8A%D9%88-%D8%AA%D9%8A-%D8%A7%D9%8A%D9%87-%D8%A7%D9%84%D8%AE%D8%AA%D8%A7%D9%85%D9%8A%D8%A9-%D8%BA%D9%88%D9%81-%D8%AA%D8%AD%D8%B1%D8%B2-%D9%84%D9%82%D8%A8%D9%87%D8%A7-%D8%A7%D9%84%D8%A3%D9%88%D9%84-%D8%A8%D9%81%D9%88%D8%B2%D9%87%D8%A7-%D8%B9%D9%84%D9%89-%D8%AA%D8%B4%D9%8A%D9%86%D9%88%D9%8A%D9%86	"دبليو تي ايه" الختامية: غوف تحرز لقبها الأول بفوزها على تشينوين - MCD / مونت كارلو الدولية	أحرزت الاميركية كوكو غوف المصنّفة ثالثة عالميا لقبها الاول في بطولة الماسترز "دبليو تي ايه" الختامية في كرة المضرب بفوزها في نهائي مثير على الصينية جنغ تشينوين السابعة 3-6 و6-4 و7-6 (7-2) الاحد في الرياض.	https://s.mc-doualiya.com/media/display/f0fc59d6-9ed4-11ef-9f90-005056bf30b7/w:1280/p:16x9/d0c209acf016d5b460a1505f9bed7278e6f716fd.jpg	2024-11-09 20:00:14	MCD / مونت كارلو الدولية
lb	https://news.google.com/rss/articles/CCAiCzYwem9lSVdJMWhrmAEB?oc=5	حزب الله يستهدف تجمعًا للجيش الإسرائيلي بسرب من المُسيرات شرقي مارون الراس - Alghad TV - قناة الغد	None	None	2024-11-09 18:19:58	Alghad TV - قناة الغد
lb	https://www.lebanon24.com/news/lebanon/1275820/%D8%A7%D9%84%D8%B7%D8%A7%D8%A6%D8%B1%D8%A9-%D8%A7%D9%84%D9%8021-%D9%84%D9%84%D9%85%D8%B3%D8%A7%D8%B9%D8%AF%D8%A7%D8%AA-%D9%85%D9%86-%D9%85%D8%B1%D9%83%D8%B2-%D8%A7%D9%84%D9%85%D9%84%D9%83-%D8%B3%D9%84%D9%85%D8%A7%D9%86-%D8%AA%D8%B5%D9%84-%D8%A5%D9%84%D9%89-%D8%A7%D9%84%D9%85%D8%B7%D8%A7%D8%B1	الطائرة الـ21 للمساعدات من مركز الملك سلمان تصل إلى المطار - Lebanon24	None	https://www.lebanon24.com/uploadImages/DocumentImages/Doc-P-1275820-638667714735611804.jpg	2024-11-09 15:54:01	Lebanon24
lb	https://news.google.com/rss/articles/CCAiCzlPNFp4LThSelBFmAEB?oc=5	لبنانيون: حكومة بايدن لن تصل لحل في الحرب - AlHadath الحدث	None	None	2024-11-09 16:51:55	AlHadath الحدث
lb	https://www.sawtbeirut.com/world-news/13-%D8%B4%D9%87%D8%B1-%D9%85%D9%86-%D8%A7%D9%84%D8%A5%D8%A8%D8%A7%D8%AF%D8%A9-%D8%B4%D9%87%D8%AF%D8%A7%D8%A1-%D9%81%D9%84%D8%B3%D8%B7%D9%8A%D9%86%D9%8A%D9%8A%D9%86-%D8%A8%D9%82%D8%B5%D9%81-%D8%A5/	13 شهر من الإبادة.. شهداء فلسطينيين بقصف إسرائيلي لخيمة بغزة - صوت بيروت إنترناشونال	استشهد 4 فلسطينيين وأصيب آخرون، اليوم السبت، في قصف إسرائيلي استهدف خيمة تؤوي نازحين في بلدة عبسان الكبيرة، شرق مدينة خان يونس جنوبي قطاع غزة، الذي يشهد	https://www.sawtbeirut.com/wp-content/uploads/2024/10/3-15-800x549.jpg	2024-11-09 19:35:49	صوت بيروت إنترناشونال
lb	https://arabic.cnn.com/middle-east/article/2024/11/10/at-least-20-people-killed-israeli-strikes-eastern-lebanon-health-ministry	الصحة اللبنانية: 20 قتيلاً جراء غارات إسرائيلية على شرقي لبنان - CNN Arabic	قالت وزارة الصحة اللبنانية إن الغارات الإسرائيلية على شرقي لبنان، السبت، أسفرت عن مقتل 20 شخصًا على الأقل.	https://cnn-arabic-images.cnn.io/cloudinary/image/upload/x_0,y_0,w_7773,h_4372,c_crop/w_1920,h_1008,c_fill,q_auto,g_center/t_cnnarabic_watermark_logo_v5/cnnarabic/2024/11/10/images/282507.jpg	2024-11-09 21:20:37	CNN Arabic
lb	https://www.elnashra.com/news/show/1695595/%D8%A5%D9%8A%D9%83%D9%88%D9%86%D9%88%D9%85%D9%8A%D8%B3%D8%AA-%D9%8A%D9%88%D9%82%D9%81-%D8%AA%D8%B1%D8%A7%D9%85%D8%A8-%D8%AD%D8%B1%D9%88%D8%A8-%D8%A7%D9%84%D8%B4%D8%B1%D9%82-%D8%A7%D9%84%D8%A3%D9%88%D8%B3%D8%B7-%D9%88%D8%A3%D9%8A-%D8%AF%D9%88%D8%B1-%D9%84%D8%B5	إيكونوميست: هل يوقف ترامب حروب الشرق الأوسط وأي دور لصهره اللبناني؟ - Elnashra.com	سألت مجلة &ldquo;إيكونوميست&rdquo; البريطانية في افتتاحية لها، حول ما إذا كان الرئيس الأميركي المنتخب دونالد ترامب، سيَفي بتعهده خلال حملته الانتخابية بوقف الحر	https://files.elnashra.com/elnashra/imagine/pictures_fb/4043424_1731158488.jpg	2024-11-09 13:21:45	Elnashra.com
lb	https://aawsat.com/%D8%A7%D9%84%D8%B9%D8%A7%D9%84%D9%85-%D8%A7%D9%84%D8%B9%D8%B1%D8%A8%D9%8A/%D8%A7%D9%84%D9%85%D8%B4%D8%B1%D9%82-%D8%A7%D9%84%D8%B9%D8%B1%D8%A8%D9%8A/5080039-%D8%A7%D9%84%D8%AC%D9%8A%D8%B4-%D8%A7%D9%84%D8%A5%D8%B3%D8%B1%D8%A7%D8%A6%D9%8A%D9%84%D9%8A-%D8%AD%D8%B1%D9%82-%D8%AC%D9%86%D9%88%D8%AF%D9%86%D8%A7-%D8%A7%D9%84%D8%B9%D9%84%D9%85-%D8%A7%D9%84%D9%84%D8%A8%D9%86%D8%A7%D9%86%D9%8A-%D8%B9%D9%85%D9%84-%D9%85%D8%AE%D8%A7%D9%84%D9%81-%D9%84%D9%84%D8%AA%D8%B9%D9%84%D9%8A%D9%85%D8%A7%D8%AA	الجيش الإسرائيلي: حرق جنودنا العلم اللبناني عمل مخالف للتعليمات - صحيفة الشرق الأوسط	أدان الجيش الإسرائيلي حرق جنوده لعلم لبنان وقال إنه عمل مخالف للتعليمات.	https://static.srpcdigital.com/styles/1200x600/public/2024-11/847963_0.jpeg	2024-11-09 22:14:00	صحيفة الشرق الأوسط
lb	https://www.i24news.tv/ar/%D8%A3%D8%AE%D8%A8%D8%A7%D8%B1/%D8%A7%D9%84%D8%AD%D8%B1%D8%A8-%D9%81%D9%8A-%D8%A5%D8%B3%D8%B1%D8%A7%D8%A6%D9%8A%D9%84/artc-68d97588	التغطية متواصلة⭕الجيش الإسرائيلي يعثر على نظام صاروخي متنقل يحتوي على 24 صاروخا جاهزا للإطلاق في جنوب لبنان - i24NEWS in Arabic	تقرير: غارة إسرائيلية تستهدف بلدة سحمر في البقاع الغربي وسط لبنان 	None	2024-11-09 13:35:09	i24NEWS in Arabic
lb	https://www.almodon.com/politics/2024/11/10/%D8%A5%D9%8A%D8%B1%D8%A7%D9%86-%D8%AA%D8%B1%D8%A7%D8%B3%D9%84-%D8%AA%D8%B1%D8%A7%D9%85%D8%A8-%D8%A8%D8%A7%D9%84%D8%B9%D9%82%D9%84%D8%A7%D9%86%D9%8A%D8%A9-%D8%A3%D9%8A%D8%B9%D8%B1%D9%82%D9%84-%D9%86%D8%AA%D9%86%D9%8A%D8%A7%D9%87%D9%88-%D8%B5%D9%8A%D8%BA%D8%A9-%D9%87%D9%88%D9%83%D8%B4%D8%AA%D8%A7%D9%8A%D9%86-%D8%A7%D9%84%D9%85%D9%86%D9%82%D8%AD%D8%A9	إيران تراسل ترامب بالعقلانية.. أيعرقل نتنياهو صيغة هوكشتاين المنقّحة؟ - Al Modon	None	https://www.almodon.com/File/GetImageCustom/48abeace-5f51-4b14-8ce7-8436e294ef8e/1200/630	2024-11-10 00:42:54	Al Modon
lb	https://news.google.com/rss/articles/CCAiC2dQQXVyc3NPZFVVmAEB?oc=5	ضمن "عمليات خيبر"نيران حزب الله تصل إلى مصنعا عسكريا في تل أبيب.. قراءة العميد حسن جوني - Alghad TV - قناة الغد	None	None	2024-11-09 22:06:20	Alghad TV - قناة الغد
lb	https://www.aletihad.ae/news/%D8%B9%D8%B1%D8%A8%D9%8A-%D9%88%D8%AF%D9%88%D9%84%D9%8A/4528426/-%D9%8A%D9%88%D9%86%D9%8A%D9%81%D9%8A%D9%84---%D8%AA%D8%AF%D9%85%D9%8A%D8%B1-%D8%A5%D8%B3%D8%B1%D8%A7%D8%A6%D9%8A%D9%84-%D9%84%D9%85%D9%85%D8%AA%D9%84%D9%83%D8%A7%D8%AA%D9%86%D8%A7-%D8%A7%D9%86%D8%AA%D9%87%D8%A7%D9%83-%D9%84%D9%84%D9%82%D8%A7%D9%86%D9%88%D9%86-%D8%A7%D9%84%D8%AF%D9%88%D9%84%D9%8A	«يونيفيل»: تدمير إسرائيل لممتلكاتنا انتهاك للقانون الدولي - مركز الاتحاد للأخبار	أعلنت قوة الأمم المتحدة المؤقتة في لبنان «يونيفيل»، أمس، أن التدمير المتعمد والمباشر من الجيش الإسرائيلي لممتلكات قوة حفظ السلام «انتهاك صارخ» للقانون الدولي. وتتمركز قوات يونيفيل التي قوامها 10 آلاف جندي في جنوب لبنان لمراقبة أعمال القتال على طول الخط الأ	https://media.alittihad.ae/store/archive/image/2024/11/9/cd163219-cd3f-412e-96f6-0dcb3244e1c6.jpg?width=600	2024-11-09 21:09:29	مركز الاتحاد للأخبار
lb	https://www.mc-doualiya.com/%D8%A7%D9%84%D8%A3%D8%AE%D8%A8%D8%A7%D8%B1%D8%A7%D9%84%D9%85%D8%B3%D8%AA%D9%85%D8%B1%D8%A9/20241109-%D8%A8%D8%A7%D9%8A%D8%AF%D9%86-%D9%8A%D8%B3%D8%AA%D9%82%D8%A8%D9%84-%D8%AE%D9%84%D9%8A%D9%81%D8%AA%D9%87-%D8%AA%D8%B1%D8%A7%D9%85%D8%A8-%D8%A7%D9%84%D8%A3%D8%B1%D8%A8%D8%B9%D8%A7%D8%A1-%D9%81%D9%8A-%D8%A7%D9%84%D8%A8%D9%8A%D8%AA-%D8%A7%D9%84%D8%A3%D8%A8%D9%8A%D8%B6-%D9%82%D8%A8%D9%84-%D8%A7%D9%84%D8%B9%D9%88%D8%AF%D8%A9-%D8%A7%D9%84%D8%AA%D8%A7%D8%B1%D9%8A%D8%AE%D9%8A%D8%A9-%D9%84%D9%84%D8%A3%D8%AE%D9%8A%D8%B1	بايدن يستقبل خليفته ترامب الأربعاء في البيت الأبيض قبل العودة التاريخية للأخير - MCD / مونت كارلو الدولية	يعتزم جو بايدن استقبال خليفته دونالد ترامب في البيت الأبيض الأربعاء، بعد تعهد الرئيس الأميركي بانتقال سلمي ومنظم للسلطة إلى الرئيس الجمهوري المنتخب الذي خسر أمامه الانتخابات الرئاسية قبل أربع سنوات. 	https://s.mc-doualiya.com/media/display/4ecec66a-9ed1-11ef-b272-005056a90284/w:1280/p:16x9/6dba00d10670727634617cee0f5793596e3a1de4.jpg	2024-11-09 19:32:08	MCD / مونت كارلو الدولية
lb	https://aawsat.com/%D8%A7%D9%84%D8%B9%D8%A7%D9%84%D9%85-%D8%A7%D9%84%D8%B9%D8%B1%D8%A8%D9%8A/%D8%A7%D9%84%D9%85%D8%B4%D8%B1%D9%82-%D8%A7%D9%84%D8%B9%D8%B1%D8%A8%D9%8A/5079985-%D8%A7%D9%84%D8%AC%D9%8A%D8%B4-%D8%A7%D9%84%D8%A5%D8%B3%D8%B1%D8%A7%D8%A6%D9%8A%D9%84%D9%8A-%D9%8A%D8%AE%D9%81%D9%81-%D8%A5%D8%B1%D8%B4%D8%A7%D8%AF%D8%A7%D8%AA-%D8%A7%D9%84%D8%B3%D9%84%D8%A7%D9%85%D8%A9-%D9%84%D8%B3%D9%83%D8%A7%D9%86-%D8%A7%D9%84%D8%B4%D9%85%D8%A7%D9%84	الجيش الإسرائيلي يخفف إرشادات السلامة لسكان الشمال - صحيفة الشرق الأوسط	قال الجيش الإسرائيلي، اليوم السبت، إنه خفف إرشادات السلامة لسكان شمال إسرائيل من «نشاط جزئي» إلى «نشاط كامل»، مضيفاً أن التجمعات قد تصل الآن إلى ألفي شخص.	https://static.srpcdigital.com/styles/1200x600/public/2024-11/847774_0.jpeg	2024-11-09 23:04:42	صحيفة الشرق الأوسط
lb	https://www.trtarabi.com/now/%D8%B0%D9%83%D8%B1%D9%89-%D9%85%D8%B1%D9%88%D8%B1-400-%D9%8A%D9%88%D9%85-%D8%A2%D9%84%D8%A7%D9%81-%D9%8A%D8%AA%D8%B8%D8%A7%D9%87%D8%B1%D9%88%D9%86-%D9%81%D9%8A-%D8%AA%D9%84-%D8%A3%D8%A8%D9%8A%D8%A8-%D9%88%D8%A7%D9%84%D9%82%D8%AF%D8%B3-%D9%85%D8%B7%D8%A7%D9%84%D8%A8%D9%8A%D9%86-%D8%A8%D8%B5%D9%81%D9%82%D8%A9-%D8%AA%D8%A8%D8%A7%D8%AF%D9%84-18230451	"ذكرى مرور 400 يوم".. آلاف يتظاهرون في تل أبيب والقدس مطالبين بصفقة تبادل - TRT Arabi	None	None	2024-11-10 01:25:15	TRT Arabi
lb	https://www.lbcgroup.tv/news/lebanon/814273/%D8%A8%D8%B9%D8%AF-%D8%AA%D9%82%D8%AF%D9%85-%D8%A5%D8%B3%D8%B1%D8%A7%D8%A6%D9%8A%D9%84-%D8%A8%D8%B4%D9%83%D9%88%D9%89-%D9%84%D9%84%D9%8A%D9%88%D9%86%D8%B3%D9%83%D9%88-%D9%87%D8%B0%D8%A7-%D9%85%D8%A7-%D9%82%D8%A7%D9%84%D9%87-%D9%88%D8%B2%D9%8A%D8%B1-%D8%A7%D9%84%D8%AB%D9%82%D8%A7%D9%81%D8%A9-%D9%84%D9%84%D9%80lbci/ar	بعد تقدم إسرائيل بشكوى لليونسكو... هذا ما قاله وزير الثقافة للـLBCI - LBCI Lebanon	None	https://www.lbcgroup.tv/uploadImages/DocumentImages/Doc-T-814273-638667599396447726.png	2024-11-09 13:08:00	LBCI Lebanon
lb	https://www.swissinfo.ch/ara/%D8%A7%D9%84%D8%AC%D9%8A%D8%B4%3A-%D8%A7%D9%86%D8%B7%D9%84%D8%A7%D9%82-%D8%B5%D9%81%D8%A7%D8%B1%D8%A7%D8%AA-%D8%A7%D9%84%D8%A5%D9%86%D8%B0%D8%A7%D8%B1-%D8%A8%D9%88%D8%B3%D8%B7-%D8%A5%D8%B3%D8%B1%D8%A7%D8%A6%D9%8A%D9%84-%D8%A8%D8%B9%D8%AF-%D8%AA%D8%B3%D9%84%D9%84-%D8%B7%D8%A7%D8%A6%D8%B1%D8%A9-%D9%85%D8%B9%D8%A7%D8%AF%D9%8A%D8%A9/88059556	الجيش: انطلاق صفارات الإنذار بوسط إسرائيل بعد تسلل طائرة معادية - SWI swissinfo.ch سويسرا بالعربي	القاهرة (رويترز) -   قال الجيش الإسرائيلي إن صفارات الإنذار دوت يوم السبت في وسط إسرائيل بعد تسلل طائرة معادية، مضيفا أن تفاصيل الواقعة قيد المراجعة حاليا.	https://www.swissinfo.ch/ara/wp-content/uploads/swissinfo-theme/swi-fallback-featured-image.jpg	2024-11-09 13:08:08	SWI swissinfo.ch سويسرا بالعربي
lb	https://www.lebanondebate.com/news/672570	تشكيلة إدارة ترامب الجديدة: أسماء مرشحة لتولي أبرز المناصب - LebanonDebate	None	None	2024-11-09 06:30:22	LebanonDebate
lb	https://www.aljadeed.tv/news/%D8%B9%D8%B1%D8%A8%D9%8A%D8%A7%D8%AA/513688/%D8%A7%D9%84%D9%85%D9%82%D8%A7%D9%88%D9%85%D8%A9-%D8%A7%D9%84%D8%A5%D8%B3%D9%84%D8%A7%D9%85%D9%8A%D8%A9-%D9%81%D9%8A-%D8%A7%D9%84%D8%B9%D8%B1%D8%A7%D9%82-%D9%87%D8%A7%D8%AC%D9%85%D9%86%D8%A7-%D8%A8%D8%B7%D8%A7%D8%A6%D8%B1%D8%A7%D8%AA-%D9%85%D8%B3%D9%8A%D8%B1%D8%A9-%D9%87%D8%AF%D9%81%D8%A7%D9%8B-%D8%B9%D8%B3%D9%83%D8%B1%D9%8A%D8%A7%D9%8B-%D8%AC%D9%86%D9%88%D8%A8%D9%8A	المقاومة الإسلامية في العراق: هاجمنا بطائرات مسيرة هدفاً عسكرياً جنوبي فلسطين المحتلة - قناة الجديد	None	https://www.aljadeed.tv/uploadImages/DocumentImages/Default-Document-Picture.jpg	2024-11-09 14:08:00	قناة الجديد
lb	https://news.google.com/rss/articles/CBMi-ANBVV95cUxOUmtXSGZtbW5ScXNWUzREM0JiRDNzWUp2WTR2MS1qcjJuTXIwemRHV2E1bVJnald2cUNjcTNsSGlFTTB6YVNxR01sRHpSeVVsUjhaWkZ1aWttUG9HM1BKcnpsMlpmckdJOFNJOElBeThjM2htWklDUURNSkhpNE9JOTlRNU16MW9tUENiY1l1cHJzQ01vVXYzWnhsS0VaOXRIOU1vMmhqTV9BS2JSbm1rb0lHaGpBTWVxUnNrZHRjbWFQd0hMbUZmaTFoSkxmR0U0bWFvbXcxRTRUQWFsSWFPUVVCOFlsRmF1WXdEOUdaWlM2LUZCSHlGM3oxRl9wOTJhVUZQbGF0YkpOb0FzVnl3cHh6Ukg4VXhqdERXLUZZdHRwb2ZTdDVRWTdNZUdYemNOOURlOGR4TXlTSFdtaDV0ZW8tb1FDQXlCeVU0dmtCbUZMN0VDeGpIUlJBTV82Ym9raEpTdDB1VVk4UVBNazJ5S1d5S3VDMm5tMG9XdEptUUJybVVrWGwwTW12Ni1yTDVQdDZpdWRxdU8zUFpyOGxnejZnSFI3alE0bUJ1ekFscGRaOGFfMDBnRXM2Q2RMNzZNVEktLWprQWZmZ2g5dEVpNmhVc0FnSlZMR0VOSGZFUmpDWEtNeDQ1ejhPVGtMTnBDNUFWeFRXbTg?oc=5	غارة إسرائيلية ثانية تستهدف بلدة مشغرة في البقاع الغربي - MTV Lebanon News	None	None	2024-11-09 21:36:29	MTV Lebanon News
lb	https://news.google.com/rss/articles/CBMi3ANBVV95cUxPMnJ2LXBSUl9yWEczTGdpV3hXRTk1b3FYenBrc1JOQ1lKbktqWG00a2VYTTFXT040dWxCLV9lMm5JVTBIcHlsY05jOU9BT1kzZThEYkRVTl9LTWRnTVgta00wMlg1YXNfdHgzMmZuSGhkUnVnMlpZTlJrX2V6TFh3N3RmOU9LX25DbEtmX2NNdkJEemp0bHNWMUNXeVNNUDZMSjlSd0xvVXpDS25JaVBaR2NLbG50SUhwdFhmZnduQjd3SGJEcjdJSWtKbGJkU1ZYYUZ3R19wMjdPS3Y1T1JDZEg4Xzd1cHNIcUh2Q1JibXR5bFhPbjJGcThsZ0tRclRIM0I0TWRhbnliZkI0NWEyR0FKcTA0b2FpaWROcTU2V0hJeldvNWU0SlM0Z3A2MVowUlI5UkFEbmhiSGpibWtheWNmWmdqQ2ZZaGEydmNNNEVySktkZ2t6dmt6OS1tREtncTBTNlVfUEFQWWtNdklIZE51NTc4QkIxd0hfbWtsMWZFR2FuMFhKVk4zOG84WjA1eDRkMmZaSkxWVE82UHlqVnowY3pTeFVzQ0hKRkxOOWJOdE9sQ05uWFM5aDJ1ODlUenRReGpwX0JpZDJNbmZRWHhQNmtVMXFuWkRLSA?oc=5	إسرائيل تلاحق «حزب الله» في سوريا - صحيفة الشرق الأوسط	None	None	2024-11-10 01:54:13	صحيفة الشرق الأوسط
lb	https://www.eremnews.com/news/arab-world/08qn603	غارات إسرائيلية ليلية على شرق وجنوب لبنان (فيديو) - إرم نيوز	مقاتلات إسرائيلية شنت غارات ليلية على معاقل حزب الله في لبنان، مستهدفة معبر "جرماش قلد السبع" قرب الحدود السورية.	https://cdn.eremnews.io/media/679aa4c3-2bcc-4b09-81d9-13c7f85f46c7	2024-11-09 22:59:32	إرم نيوز
lb	https://www.aa.com.tr/ar/%D8%A5%D8%B3%D8%B1%D8%A7%D8%A6%D9%8A%D9%84/%D8%AD%D8%B2%D8%A8-%D8%A7%D9%84%D9%84%D9%87-%D9%8A%D8%B3%D9%82%D8%B7-%D9%85%D8%B3%D9%8A%D8%B1%D8%A9-%D9%88%D9%8A%D9%82%D8%B5%D9%81-%D9%85%D8%B5%D9%86%D8%B9%D8%A7-%D8%A8%D8%AA%D9%84-%D8%A3%D8%A8%D9%8A%D8%A8-%D9%884-%D9%82%D9%88%D8%A7%D8%B9%D8%AF-%D8%A5%D8%B3%D8%B1%D8%A7%D8%A6%D9%8A%D9%84%D9%8A%D8%A9-%D9%85%D8%AD%D8%B5%D9%84%D8%A9/3389553	"حزب الله" يسقط مسيرة ويقصف مصنعا بتل أبيب و4 قواعد إسرائيلية (محصلة) - Anadolu Agency | العربية	None	None	2024-11-09 22:22:19	Anadolu Agency | العربية
lb	https://www.elnashra.com/news/show/1695665/%D8%A7%D9%84%D9%85%D9%81%D9%88%D8%B6-%D8%A7%D9%84%D8%B9%D8%A7%D9%85-%D9%84%D9%84%D8%A3%D9%88%D9%86%D8%B1%D9%88%D8%A7-%D8%A5%D8%B3%D8%B1%D8%A7%D8%A6%D9%8A%D9%84-%D8%A7%D8%B3%D8%AA%D8%AE%D8%AF%D9%85%D8%AA-%D8%A7%D9%84%D8%AC%D9%88%D8%B9-%D9%83%D8%B3%D9%84%D8%A7%D8%AD-	المفوض العام للأونروا: إسرائيل استخدمت الجوع كسلاح ومن المحتمل حدوث مجاعة في شمال غزة - Elnashra.com	أشار المفوض العام للأونروا فيليب لازاريني، الى أن أهل غزة محرومون من الأساسيات بما في ذلك الطعام اللازم للبقاء على قيد الحياة، لافتاً الى أن إسرائيل استخدمت الج	https://files.elnashra.com/elnashra/imagine/pictures_fb/6269544_1731185902.jpg	2024-11-09 20:54:46	Elnashra.com
lb	https://news.google.com/rss/articles/CCAiC3B6ck9VdVpGV1R3mAEB?oc=5	هجمات إسرائيلية مستمرة على مدينة بعلبك ومواقعها التاريخية - AlJazeera Arabic قناة الجزيرة	None	None	2024-11-09 12:15:04	AlJazeera Arabic قناة الجزيرة
lb	https://news.google.com/rss/articles/CBMixwRBVV95cUxPYUM3QlVlY2pidDNZQzJYR3NrR3E1d3dJVnQzcGFzZ0d1VGk4eC1vOEs0dlZSMEg3LVRkVEJqazRGLWFyTVFGdjc2SlhySm00NWZPTTR3TjdtUFk4TDNJeVRwbEludUxfakY2XzdJOHZFc2xxcmxfYnMyc240YUJOTTdtcHg4WjFUQndGbTdRZlZHTkhERG50TVJ6Z0xDaGNIWFNVajhPdGFxZUJkN3NlYXhQV2s5Z3hzSURjTFp1bDA5dmU1YjlRNnJWYWRtN05PVzRMc3NMVGxwUWtqeHVJSmlCdXJfZVhNYTNWZ3l5c0Q1amdybDBmeUdJUUFzdGYwYjJoVG1XUDI5b1NRQmpWQXpwZzh4SkMzYkRyNXhxaC0zV0hDeEtUU2YxNm5JbkZhVktYaEd0bVk1SlNIYnFHSWZ0OTh2Wk92eDhZMWhjUmRQazBmZll3Y2RjQ2FyWGo0bUs4YW1ndXdGNFA5RU9XT3c3Q0pybzg5WjF4STR2TUM3ZTNqbnJVaUdzaGRnTFFyRGFWRmJHQVFYM1UyMlhYMVEwVE9lTnhteWxMdS1UOHZ6ZEFqRW9RaWNQckNxNjZOTVczWGFURE1QLXpfUEVHM0dmc3JqVmRWNjZ2MnRLX0hXeEhXTjFTYVFQb3dNVGE0Y1JYS3JGRGdTc2NNNVhTdXc2VlJFc1NMMk9PN2FodHVuNmI3cGFjMlZWanNIc3l1WFlBZWhuZVVQU2hxNmJPWWNtQ2lla2NzZkdJQ0drVF9ES284N1pj?oc=5	وقائع سبقت الاعتداء على مشجعي كرة قدم إسرائيليين في أمستردام - صحيفة الشرق الأوسط	قالت رئيسة بلدية أمستردام فمكه هالسما إن مشجعي فريق مكابي تل أبيب الإسرائيلي لكرة القدم تعرضوا للضرب على أيدي مجموعات إجرامية في الساعات الأولى من صباح الجمعة.	https://static.srpcdigital.com/styles/1200x600/public/2024-11/847940.jpeg	2024-11-09 20:35:00	صحيفة الشرق الأوسط
lb	https://www.swissinfo.ch/ara/%D9%82%D8%B7%D8%B1-%D8%AA%D8%A4%D9%83%D8%AF-%D8%AA%D8%B9%D9%84%D9%8A%D9%82-%D9%88%D8%B3%D8%A7%D8%B7%D8%AA%D9%87%D8%A7-%D8%A8%D9%8A%D9%86-%D8%A5%D8%B3%D8%B1%D8%A7%D8%A6%D9%8A%D9%84-%D9%88%D8%AD%D9%85%D8%A7%D8%B3/88061556	قطر تؤكد تعليق وساطتها بين إسرائيل وحماس - SWI swissinfo.ch سويسرا بالعربي	علّقت قطر الوساطة التي كانت تؤدّيها من أجل التوصل إلى اتفاق لوقف النار في غزة والإفراج عن الرهائن، وذلك إلى حين "توافر الجدّية اللازمة" في المفاوضات بين إسرائيل وحماس، وفق ما أعلنت الخارجية القطرية السبت.	https://www.swissinfo.ch/content/wp-content/uploads/sites/13/2024/11/9594799b0f10d3594d59dfe0c50233dd-88061531.jpg?ver=68126f9a&fit=946,630	2024-11-10 01:19:55	SWI swissinfo.ch سويسرا بالعربي
lb	https://news.google.com/rss/articles/CCAiC0JJOXBqMnVDMXBnmAEB?oc=5	دمار هائل في مدينة النبطية جنوب لبنان جراء غارة إسرائيلية - AlHadath الحدث	None	None	2024-11-10 03:15:51	AlHadath الحدث
lb	https://aawsat.com/%D8%A7%D9%84%D8%B9%D8%A7%D9%84%D9%85-%D8%A7%D9%84%D8%B9%D8%B1%D8%A8%D9%8A/%D8%A7%D9%84%D9%85%D8%B4%D8%B1%D9%82-%D8%A7%D9%84%D8%B9%D8%B1%D8%A8%D9%8A/5079816-%D8%AD%D8%B1%D9%8A%D9%82-%D9%87%D8%A7%D8%A6%D9%84-%D9%8A%D9%84%D8%AA%D9%87%D9%85-%D8%B9%D8%B4%D8%B1%D8%A7%D8%AA-%D8%A7%D9%84%D8%B3%D9%8A%D8%A7%D8%B1%D8%A7%D8%AA-%D8%A8%D9%85%D9%86%D8%B7%D9%82%D8%A9-%D8%A7%D9%84%D8%AD%D9%85%D8%B1%D8%A7-%D9%81%D9%8A-%D8%A8%D9%8A%D8%B1%D9%88%D8%AA-%D9%81%D9%8A%D8%AF%D9%8A%D9%88	حريق هائل يلتهم عشرات السيارات بمنطقة الحمرا في بيروت (فيديو) - صحيفة الشرق الأوسط	اندلع حريق كبير في مولّد كهرباء في موقف للسيارات في شارع الحمرا بالعاصمة اللبنانية بيروت.	https://static.srpcdigital.com/styles/1200x600/public/2024-11/847068.jpeg	2024-11-09 19:40:44	صحيفة الشرق الأوسط
