country_code	url	title	description	image_url	publish_date	source
lb	https://www.aljazeera.net/news/2024/10/28/%D9%85%D8%AC%D9%84%D8%B3-%D8%A7%D9%84%D8%A3%D9%85%D9%86-%D9%8A%D8%A8%D8%AD%D8%AB-%D8%A7%D9%84%D9%87%D8%AC%D9%88%D9%85-%D8%A7%D9%84%D8%A5%D8%B3%D8%B1%D8%A7%D8%A6%D9%8A%D9%84%D9%8A-%D8%B9%D9%84%D9%89	مجلس الأمن يبحث الهجوم الإسرائيلي على إيران - الجزيرة نت	بدأ اجتماع مجلس الأمن الدولي  لبحث تداعيات القصف الجوي الإسرائيلي على إيران، بعد أن قدمت طهران طلبا رسميا لعقد اجتماع طارئ، مدعومة من الجزائر والصين وروسيا.	None	2024-10-28 20:41:21	الجزيرة نت
lb	https://www.skynewsarabia.com/middle-east/1751026-%D9%87%D8%A7%D9%84%D9%8A%D9%81%D9%8A-%D9%86%D9%81%D9%82-%D9%84%D8%AD%D8%B2%D8%A8-%D8%A7%D9%84%D9%84%D9%87-%D8%A8%D8%A7%D9%95%D9%85%D9%83%D8%A7%D9%86%D9%87%D9%85-%D8%B4%D9%86-%D9%87%D8%AC%D9%88%D9%85-%D8%A7%D9%95%D8%B3%D8%B1%D8%A7%D9%8A%D9%94%D9%8A%D9%84	هاليفي من نفق لحزب الله: كان بإمكانهم شن هجوم على إسرائيل - Sky News Arabia سكاي نيوز عربية	نشر الجيش الإسرائيلي، الاثنين، مقطع فيديو لرئيس الأركان هرتسي هاليفي من أحد المخابئ التي ذكر أنها تابعة لحزب الله في جنوب لبنان.	https://www.skynewsarabia.com/images/v1/2024/10/28/1751025/1200/630/1-1751025.JPG	2024-10-28 19:08:39	Sky News Arabia سكاي نيوز عربية
lb	https://www.lebanondebate.com/news/670982	"أزمة تخلق فرصًا"... من محنة النزوح إلى إنتعاش الأسواق! - LebanonDebate	None	None	2024-10-28 11:01:38	LebanonDebate
lb	https://www.skynewsarabia.com/middle-east/1750762-%D8%A7%D9%86%D9%81%D8%AC%D8%A7%D8%B1-%D9%8A%D9%87%D8%B2-%D8%A7%D9%94%D9%83%D8%A8%D8%B1-%D9%82%D9%88%D8%A7%D8%B9%D8%AF-%D8%A7%D9%84%D8%AA%D8%AD%D8%A7%D9%84%D9%81-%D8%A7%D9%84%D8%AF%D9%88%D9%84%D9%8A-%D8%B3%D9%88%D8%B1%D9%8A%D8%A7	انفجار يهز أكبر قواعد "التحالف الدولي" في سوريا - Sky News Arabia سكاي نيوز عربية	أفاد المرصد السوري لحقوق الإنسان، مساء الجمعة، بدوّي انفجار عنيف في محيط حقل العمر النفطي، شرق دير الزور.	https://www.skynewsarabia.com/images/v1/2024/10/28/1750761/1200/630/1-1750761.jpg	2024-10-28 01:18:25	Sky News Arabia سكاي نيوز عربية
lb	https://www.alaraby.com/news/%D8%AD%D8%B1%D8%B6-%D8%B9%D9%84%D9%89-%D8%A7%D9%84%D9%82%D8%AA%D9%84-%D9%81%D9%8A-%D8%AC%D9%86%D9%88%D8%A8-%D9%84%D8%A8%D9%86%D8%A7%D9%86-%D8%AD%D8%A7%D8%AE%D8%A7%D9%85-%D8%A5%D8%B3%D8%B1%D8%A7%D8%A6%D9%8A%D9%84%D9%8A-%D9%8A%D8%B9%D9%88%D8%AF-%D8%AC%D8%AB%D8%A9-%D8%A5%D9%84%D9%89-%D8%AA%D9%84-%D8%A3%D8%A8%D9%8A%D8%A8	حرض على القتل في جنوب لبنان.. حاخام إسرائيلي يعود جثة إلى تل أبيب | التلفزيون العربي - التلفزيون العربي	دخل الحاخام غولدبرغ مع كتيبته إلى الأراضي اللبنانية وظهر في لقاء على قناة إسرائيلية قبل أن يلقى حتفه بالرصاص في مواجهات مع أفراد من حزب الله.	https://www.alaraby.com/sites/default/files/styles/social_large/public/2024-10/2024-10-28%20200448%2B%2B.jpg?h=981802ea&itok=qDcF5ova	2024-10-28 18:26:54	التلفزيون العربي
lb	https://www.annahar.com/articles/annahar-writers/165011/%D9%87%D9%88%D9%83%D8%B4%D8%AA%D8%A7%D9%8A%D9%86-%D8%A7%D9%84%D8%AA%D8%B2%D8%A7%D9%85-%D9%84%D8%A8%D9%86%D8%A7%D9%86-%D9%88%D8%A5%D8%B3%D8%B1%D8%A7%D8%A6%D9%8A%D9%84-%D8%A8%D8%A7%D9%84%D9%801701-%D8%BA%D9%8A%D8%B1-%D9%83%D8%A7%D9%81	هوكشتاين: "التزام لبنان وإسرائيل بالـ1701 غير كافٍ"! - النهار	None	None	2024-10-28 11:20:00	النهار
lb	https://www.lebanondebate.com/news/670979	قطاع هام يعاني من تحديات "معقدة"... "كارثة" بانتظار اللبنانيين؟! - LebanonDebate	None	None	2024-10-28 10:49:55	LebanonDebate
lb	https://news.google.com/rss/articles/CCAiCzhRMHFhRkY2eGJzmAEB?oc=5	الاتحاد الأوروبي للحدث: استراتيجيتنا لمنع تهجير اللبنانيين إلى أوروبا واضحة - AlHadath الحدث	None	None	2024-10-28 11:53:40	AlHadath الحدث
lb	https://www.annahar.com/international/Israeli-Issues/164909/%D8%A5%D9%82%D8%A7%D9%84%D8%A9-%D8%BA%D8%A7%D9%84%D8%A7%D9%86%D8%AA-%D8%A5%D9%84%D9%89-%D8%A7%D9%84%D9%88%D8%A7%D8%AC%D9%87%D8%A9-%D9%85%D8%AC%D8%AF%D8%AF%D8%A7-%D9%88%D8%B1%D8%B3%D8%A7%D9%84%D8%A9-%D8%AA%D8%B4%D8%B9%D9%84-%D8%A7%D9%84%D8%AE%D9%84%D8%A7%D9%81-%D9%85%D8%AC%D8%AF%D8%AF%D8%A7	إقالة غالانت إلى الواجهة... ورسالة تجدّد الخلاف مع نتنياهو - النهار	تابع آخر الأخبار والتحليلات الشاملة والموثوقة في الشرق الأوسط مع جريدة النهار. اطّلع على آخر الأحداث السياسية والاقتصادية والثقافية والرياضية وغيرها. تابع مقالات كتّابنا المميزين واستمتع بتجربة قراءة فريدة ومتميزة.	https://www.annahar.com/Assets/ContentPhotos/Photos/gallant 4_072657.jpeg?width=1416&height=805&mode=crop&scale=both	2024-10-28 05:27:00	النهار
lb	https://www.lebanondebate.com/news/671022	توضيحٌ من بلدية الدكوانة بشأن أكياس الرمل! - LebanonDebate	None	None	2024-10-28 15:21:38	LebanonDebate
lb	https://www.aljadeed.tv/watch/72043/%D8%AA%D9%81%D8%AC%D9%8A%D8%B1%D8%A7%D8%AA-%D8%A5%D8%B3%D8%B1%D8%A7%D8%A6%D9%8A%D9%84-%D9%81%D9%8A-%D8%AC%D9%86%D9%88%D8%A8-%D9%84%D8%A8%D9%86%D8%A7%D9%86-%D9%82%D8%AF-%D8%AA%D8%AD%D8%B1%D9%83-%D8%A7%D9%84%D8%B2%D9%84%D8%A7%D8%B2%D9%84	تفجيرات إسرائيل في جنوب لبنان قد تحرك الزلازل - قناة الجديد	.تفجيرات إسرائيل في جنوب لبنان قد تحرك الزلازل	https://www.aljadeed.tv/uploadImages/ProgramsImages/Episodes-Picture-72043-638657382140910580.jpg	2024-10-28 18:57:53	قناة الجديد
lb	https://news.google.com/rss/articles/CCAiC01VWl9fZE5vMElzmAEB?oc=5	حزب الله: استهدفنا بصاروخ موجه دبابة ميركافا إسرائيلية في الحمامص جنوب بلدة الخيام - AlJazeera Arabic قناة الجزيرة	None	None	2024-10-29 00:15:02	AlJazeera Arabic قناة الجزيرة
lb	https://www.alhurra.com/lebanon/2024/10/28/%D9%84%D8%A8%D9%86%D8%A7%D9%86-%D8%BA%D8%A7%D8%B1%D8%A7%D8%AA-%D8%A5%D8%B3%D8%B1%D8%A7%D8%A6%D9%8A%D9%84%D9%8A%D8%A9-%D9%85%D8%AA%D9%88%D8%A7%D8%B5%D9%84%D8%A9-%D9%88%D9%82%D8%AA%D9%84%D9%89-%D9%81%D9%8A-%D8%B5%D9%88%D8%B1-%D9%88%D8%A7%D9%84%D9%86%D8%A8%D8%B7%D9%8A%D8%A9-%D9%88%D8%B5%D9%8A%D8%AF%D8%A7	لبنان.. غارات إسرائيلية متواصلة وقتلى في صور والنبطية وصيدا - الحرة	None	https://media.voltron.alhurra.com/Drupal/01live-106/2024-10/2024-10-27T153310Z_1584347370_RC23TAAQWU2J_RTRMADP_3_ISRAEL-PALESTINIANS-LEBANON-AFTERMATH.JPG	2024-10-28 06:54:57	الحرة
lb	https://www.mtv.com.lb/news/%D9%85%D9%80%D9%80%D8%AD%D9%80%D9%80%D9%84%D9%80%D9%80%D9%8A%D9%80%D9%80%D8%A7%D8%AA/1508755/%D9%85%D8%A7-%D9%87%D9%8A--%D9%88%D8%AD%D8%AF%D8%A9-%D8%B9%D8%B2%D9%8A%D8%B2--%D9%81%D9%8A--%D8%A7%D9%84%D8%AD%D8%B2%D8%A8--	ما هي "وحدة عزيز" في "الحزب"؟ - MTV Lebanon News	زعم الجيش الإسرائيليّ أنّ صور هي منطقة عمل مهمّة لـ"حزب الله"، وتحديداً لـ"وحدة عزيز"، وذلك بعد غارات عنيفة ومدمّرة شنّها الطّيران الحربيّ الإسرائيليّ على المنطقة، مُدّعياً أنّه استهدف مستودعات أسلحة وصواريخ مضادة للدّروع ومبانٍ عسكرية و...	https://imagescdn.mtv.com.lb/articles/595352821162.jpg?width=533&quality=90	2024-10-28 15:19:06	MTV Lebanon News
lb	https://www.aljadeed.tv/news/%D9%85%D8%AD%D9%84%D9%8A%D8%A7%D8%AA/511801/%D8%A7%D9%84%D9%85%D9%82%D8%A7%D9%88%D9%85%D8%A9-%D8%A7%D9%84%D8%A5%D8%B3%D9%84%D8%A7%D9%85%D9%8A%D8%A9-%D9%86%D8%B5%D8%A8%D8%AA-%D9%83%D9%85%D9%8A%D9%86%D8%A7%D9%8B-%D9%85%D8%AD%D9%83%D9%85%D8%A7%D9%8B-%D9%84%D8%AC%D9%86%D9%88%D8%AF-%D8%A7%D9%84%D8%B9%D8%AF%D9%88-%D8%A7%D9%84%D8%A5%D8%B3%D8%B1%D8%A7%D8%A6%D9%8A%D9%84%D9%8A	​ المقاومة الإسلامية نصبت كميناً محكماً لجنود العدو الإسرائيلي - قناة الجديد	أصدرت المقاومة الإسلامية، بياناً، جاء فيه: 	https://www.aljadeed.tv/uploadImages/DocumentImages/Doc-P-511801-638657210416145397.jpg	2024-10-28 08:01:00	قناة الجديد
lb	https://news.google.com/rss/articles/CCAiC0FWYUN6YnB0djNNmAEB?oc=5	الغارات الإسرائيلية على المعابر السورية تحرم النازحين من لبنان آخر خيارات البحث عن الأمان - AlArabiya العربية	None	None	2024-10-28 18:18:49	AlArabiya العربية
lb	https://news.google.com/rss/articles/CCAiC2VUWGFURFg0aXA4mAEB?oc=5	هل ينجح نتنياهو في إنشاء منطقة عازلة بجنوب لبنان؟ | #التاسعة - سكاي نيوز عربية	None	None	2024-10-28 20:30:02	سكاي نيوز عربية
lb	https://www.almodon.com/arabworld/2024/10/28/%D8%A7%D9%84%D8%A8%D9%86%D8%AA%D8%A7%D8%BA%D9%88%D9%86-%D9%83%D9%88%D8%B1%D9%8A%D8%A7-%D8%A7%D9%84%D8%B4%D9%85%D8%A7%D9%84%D9%8A%D8%A9-%D8%A3%D8%B1%D8%B3%D9%84%D8%AA-10-%D8%A2%D9%84%D8%A7%D9%81-%D8%AC%D9%86%D8%AF%D9%8A-%D9%84%D8%B1%D9%88%D8%B3%D9%8A%D8%A7	البنتاغون: كوريا الشمالية أرسلت 10 آلاف جندي لروسيا - Al Modon	None	https://www.almodon.com/File/GetImageCustom/9ca80dd7-3696-4002-a314-66915070587a/1200/630	2024-10-28 17:08:11	Al Modon
lb	https://www.al-akhbar.com/World/386979/%D8%A3%D9%88%D8%B1%D9%88%D8%A8%D8%A7-%D8%AA%D8%AA%D9%88%D8%AC-%D8%B3-%D9%85%D9%86-%D8%B9%D9%88%D8%AF%D8%A9-%D8%AA%D8%B1%D8%A7%D9%85%D8%A8-%D9%85%D8%B8%D9%84-%D8%AA%D9%86%D8%A7-%D8%A7%D9%84%D8%A3%D9%85%D9%86%D9%8A%D8%A9-%D9%85%D8%AB%D9%82%D9%88%D8%A8	أوروبا تتوجّس من عودة ترامب: «مظلّتنا» الأمنية مثقوبة - جريدة الأخبار	لندن | ثمّة شبح يحوم في أجواء عواصم الاتحاد الأوروبي هذه الأيّام: شبح عهد ثانٍ للرئيس الأميركي السابق، دونالد ترامب؛ إذ إنه مع فقدان حملة نائبة الرئيس الحالي ومرشحة الحزب الديموقراطي، كامالا هاريس، قوة الدفع التي وضعتها لأسابيع على قدم المساواة مع ترامب في استطلاعات الرأي، بدأ مسؤولو الاتحاد الأوروبي في بروكسل اتصالات مع مختلف العواصم عبر القارة، فيما يعقدون اجتماعات شبه يومية، للبحث في نتائج انتقال محتمل لمفاتيح البيت الأبيض إلى مرشح الحزب الجمهوري. وعلى رغم أن مسألة عودة ترامب مطروحة منذ بعض الوقت، إلا أن الهواجس تضخّمت بعدما أفاد أحدث استطلاع لنوايا الناخبين الأميركيين، هذا الأسبوع، بأن ترامب تجاوز منافسته الديموقراطية، باعتباره المرشّح الذي يثق به الأميركيون أكثر من غيره، ولا سيما في ملف الاقتصاد. ويشارك في المشاورات الأوروبية التي يقودها موظفو مكتب رئيسة المفوضية، أورسولا فون دير لايين، سفراء الدول الأعضاء المعتمدون لدى بروكسل، فضلاً عن مستشارين ومجموعات غير رسمية من عدة دول مركزية في الاتحاد. ويسعى هؤلاء لوضع سيناريوات مختلفة لِما يمكن أن تكون عليه سياسة إدارة أميركي	https://al-akhbar.com/Images/quotes-open-red.png	2024-10-28 23:10:30	جريدة الأخبار
lb	https://www.aljazeera.net/news/2024/10/28/%D8%B9%D8%A7%D8%AC%D9%84-%D9%86%D8%AA%D9%86%D9%8A%D8%A7%D9%87%D9%88-%D9%86%D8%B1%D9%8A%D8%AF-%D8%AA%D8%AF%D9%81%D9%8A%D8%B9-%D8%A5%D9%8A%D8%B1%D8%A7%D9%86-%D8%A7%D9%84%D8%AB%D9%85%D9%86	نتنياهو: العرب أرادوا تدميرنا لكننا طبعنا مع 6 دول عربية - الجزيرة نت	قال رئيس الوزراء الإسرائيلي بنيامين نتنياهو إن إيران تسعى لتطوير قنابل نووية هدفها تدمير إسرائيل وتمتلك صواريخ عابرة للقارات، وإن هدفهم هو جعلها تدفع الثمن مع منعها من التحول إلى دولة نووية.	None	2024-10-28 19:42:45	الجزيرة نت
lb	https://news.google.com/rss/articles/CCAiC2xNSlNsS2FmQjRJmAEB?oc=5	الجيش الإسرائيلي يقصف مدينة صور وحزب الله يقصف قاعدة بحرية قرب حيفا - i24NEWS Arabic	None	None	2024-10-28 20:48:48	i24NEWS Arabic
lb	https://www.lbcgroup.tv/news/world/810421/%D9%88%D8%B2%D9%8A%D8%B1-%D8%A7%D9%84%D8%AF%D9%81%D8%A7%D8%B9-%D8%A7%D9%84%D8%A5%D8%B3%D8%B1%D8%A7%D8%A6%D9%8A%D9%84%D9%8A-%D8%A5%D9%8A%D8%B1%D8%A7%D9%86-%D9%81%D9%8A-%D9%88%D8%B6%D8%B9-%D8%B6%D8%B9%D9%8A%D9%81-%D8%A8%D8%B9%D8%AF-%D9%87%D8%AC%D9%88%D9%85-%D9%8A%D9%88%D9%85-%D8%A7%D9%84%D8%B3%D8%A8%D8%AA/ar	وزير الدفاع الإسرائيلي: إيران في وضع ضعيف بعد هجوم يوم السبت - LBCI Lebanon	None	https://www.lbcgroup.tv/uploadImages/DocumentImages/Doc-T-810421-638657314510154600.jpg	2024-10-28 16:56:00	LBCI Lebanon
lb	https://www.swissinfo.ch/ara/%D9%88%D8%B2%D8%A7%D8%B1%D8%A9-%D8%A7%D9%84%D8%B5%D8%AD%D8%A9-%D8%A7%D9%84%D9%84%D8%A8%D9%86%D8%A7%D9%86%D9%8A%D8%A9%3A-2710-%D9%82%D8%AA%D9%84%D9%89-%D8%AC%D8%B1%D8%A7%D8%A1-%D8%A7%D9%84%D8%BA%D8%A7%D8%B1%D8%A7%D8%AA-%D8%A7%D9%84%D8%A5%D8%B3%D8%B1%D8%A7%D8%A6%D9%8A%D9%84%D9%8A%D8%A9-%D9%85%D9%86%D8%B0-%D8%A3%D9%83%D8%AA%D9%88%D8%A8%D8%B1-2023/87858160	وزارة الصحة اللبنانية: 2710 قتلى جراء الغارات الإسرائيلية منذ أكتوبر 2023 - SWI swissinfo.ch سويسرا بالعربي	بيروت (رويترز) -   ذكرت وزارة الصحة اللبنانية يوم الاثنين أن حصيلة الهجمات الإسرائيلية على لبنان بلغت 2710 قتلى و12592 مصابا منذ أكتوبر تشرين الأول 2023.	https://www.swissinfo.ch/content/wp-content/uploads/sites/13/2024/10/7fa96a693379e22055d632cf2d2db4f0-87858128.jpg?ver=6202b25c&fit=1200,724	2024-10-28 17:11:55	SWI swissinfo.ch سويسرا بالعربي
lb	https://news.google.com/rss/articles/CCAiC1pDSmw3VTkxWXRZmAEB?oc=5	كاميرا الجزيرة ترصد آثار الدمار في بلدة شمسطار بالبقاع - AlJazeera Arabic قناة الجزيرة	None	None	2024-10-28 12:00:41	AlJazeera Arabic قناة الجزيرة
lb	https://www.almodon.com/media/2024/10/28/%D9%84%D8%A8%D9%86%D8%A7%D9%86-%D9%8A%D8%B4%D9%83%D9%88-%D8%A7%D9%84%D8%A7%D8%B9%D8%AA%D8%AF%D8%A7%D8%A1%D8%A7%D8%AA-%D8%B9%D9%84%D9%89-%D8%A7%D9%84%D8%B5%D8%AD%D8%A7%D9%81%D9%8A%D9%8A%D9%86-%D8%A7%D9%84%D9%89-%D9%85%D8%AC%D9%84%D8%B3-%D8%A7%D9%84%D8%A3%D9%85%D9%86	لبنان يشكو الاعتداءات على الصحافيين إلى مجلس الأمن - Al Modon	None	https://www.almodon.com/File/GetImageCustom/30084d83-8876-452c-983b-cfc3916c7aaa/1200/630	2024-10-28 11:45:21	Al Modon
lb	https://www.lebanondebate.com/news/671075	غارة إسرائيلية أمام منزل نبيه بري! - LebanonDebate	None	None	2024-10-28 20:47:59	LebanonDebate
lb	https://www.lebanondebate.com/news/671054	حساب خامنئي بالعبرية يُغلق بعد يوم على افتتاحه… إليكم السبب! - LebanonDebate	None	None	2024-10-28 18:31:17	LebanonDebate
lb	https://news.google.com/rss/articles/CCAiC1FGY1g4YkgyMWZVmAEB?oc=5	غارات إسرائيلية تخلف دمارا في البنى التحتية لبعلبك اللبنانية - AlJazeera Arabic قناة الجزيرة	None	None	2024-10-29 04:15:02	AlJazeera Arabic قناة الجزيرة
lb	https://aawsat.com/%D8%A7%D9%84%D8%B9%D8%A7%D9%84%D9%85/%D8%A7%D9%84%D9%88%D9%84%D8%A7%D9%8A%D8%A7%D8%AA-%D8%A7%D9%84%D9%85%D8%AA%D8%AD%D8%AF%D8%A9%E2%80%8B/5075819-%D8%A7%D9%84%D8%AE%D8%A7%D8%B1%D8%AC%D9%8A%D8%A9-%D8%A7%D9%84%D8%A3%D9%85%D9%8A%D8%B1%D9%83%D9%8A%D8%A9-%D9%86%D8%B4%D8%B9%D8%B1-%D8%A8%D9%82%D9%84%D9%82-%D8%A8%D8%A7%D9%84%D8%BA-%D8%A5%D8%B2%D8%A7%D8%A1-%D8%AA%D8%B4%D8%B1%D9%8A%D8%B9-%D8%A5%D8%B3%D8%B1%D8%A7%D8%A6%D9%8A%D9%84%D9%8A-%D9%85%D9%82%D8%AA%D8%B1%D8%AD-%D9%84%D8%AD%D8%B8%D8%B1	الخارجية الأميركية: نشعر بقلق بالغ إزاء تشريع إسرائيلي مقترح لحظر «الأونروا» - صحيفة الشرق الأوسط	قال المتحدث باسم وزارة الخارجية الأميركية، ماثيو ميلر، إن الولايات المتحدة أوضحت لإسرائيل أنها تشعر بقلق عميق إزاء التشريع الإسرائيلي الذي قد يحظر «الأونروا».	https://static.srpcdigital.com/styles/1200x600/public/2024-10/833909.jpeg	2024-10-28 22:32:45	صحيفة الشرق الأوسط
lb	https://www.elnashra.com/news/show/1693358/%D8%A3%D9%83%D8%B3%D9%8A%D9%88%D8%B3-%D9%85%D8%AF%D9%8A%D8%B1-%D8%A7%D9%84%D8%B3%D9%8A-%D8%A5%D9%8A%D9%87-%D9%86%D8%A7%D9%82%D8%B4-%D8%B5%D9%8A%D8%BA%D8%A9-%D8%AC%D8%AF%D9%8A%D8%AF%D8%A9-%D9%84%D9%88%D9%82%D9%81-%D8%A5%D8%B7%D9%84%D8%A7%D9%82-%D8%A7%D9%84	أكسيوس: مدير السي آي إيه ناقش في الدوحة صيغة تتضمن وقفا لإطلاق النار لمدة 28 يوما في غزة - Elnashra.com	كشف موقع أكسيوس، أن مدير السي آي إيه وليام بيرنز ناقش صيغة جديدة لوقف إطلاق النار بغزة وتبادل للأسرى مع نظرائه الإسرائيليين والقطريين في العاصمة القطرية الدوحة.	https://files.elnashra.com/elnashra/imagine/pictures_fb/9706607_1730174072.jpg	2024-10-29 03:37:10	Elnashra.com
lb	https://www.aljazeera.net/news/2024/10/29/%D8%A5%D8%B9%D9%84%D8%A7%D9%85-%D8%A5%D8%B3%D8%B1%D8%A7%D8%A6%D9%8A%D9%84%D9%8A-%D8%AA%D9%84-%D8%A3%D8%A8%D9%8A%D8%A8-%D8%AA%D8%B3%D8%B9%D9%89-%D9%84%D8%B9%D9%82%D8%AF-%D8%B5%D9%81%D9%82%D8%A9	إعلام إسرائيلي: تل أبيب تسعى لعقد صفقة مع لبنان بشروط - الجزيرة نت	قالت القناة 12 الإسرائيلية إن تل أبيب تسعى لإبرام صفقة مع لبنان مقابل إجراءات لمنع إعادة تسلح حزب الله، وسط محادثات أميركية إسرائيلية لخفض التصعيد بالمنطقة.	None	2024-10-29 04:51:05	الجزيرة نت
lb	https://www.lebanondebate.com/news/671063	"خبراء إيرانيون يشرفون على المعارك في لبنان... وحزب الله تمكّن من إعادة التموضع"! - LebanonDebate	None	None	2024-10-28 19:33:43	LebanonDebate
lb	https://news.google.com/rss/articles/CBMipgFBVV95cUxQNzFELWpiSzRIdnRtQjFWc0Y4SUNQSTh6VHNtanRHWHJKZVhTSVI1b2RiWVdCRzZ2bGE3blNHdnQ4ZDBZa1ZVelhLZVJJbGk4a3liSkhsSm41UldONGRNZE5NS2IzZ05UaDB3NGNRNklneWE4M2pzODM5UjlLWDA3cDNVSkJmejA1S1ZvZ2xRZzBQT2pJbHNnNTY0VS14blY1VE9mQ1V3?oc=5	مباشر. سجال بين نتنياهو وزعيم معارضته وحصار خانق لغزة والمشافي تناشد لتدخل عاجل وحزب الله يقصف أكثر من هدف - Euronews	في اليوم الـ388 من الحرب الإسرائيلية على قطاع غزة، استمر القصف على القطاع المحاصر منذ 3 أسابيع، وشهد الكنيست سجالا بين زعيم المعارضة يائير لابيد وبين نتنياهو الذي تبجح بأنه يدافع عن العالم أجمع ضد إيران و"أذرعها" في المنطقة، بينما ترى المعارضة أن حكومة نتنياهو الحالية هي أسوأ حكومة منذ قيام إسرائيل.	https://static.euronews.com/articles/stories/08/81/74/92/1200x675_cmsv2_4a288812-9781-52aa-87af-e7281fbfde8a-8817492.jpg	2024-10-28 16:27:29	Euronews
lb	https://www.nna-leb.gov.lb/ar/justice-law/734297/%D8%BA%D8%A7%D8%B1%D8%A7%D8%AA-%D8%B9%D9%86%D9%8A%D9%81%D8%A9-%D9%88%D9%85%D8%AA%D8%AA%D8%A7%D9%84%D9%8A%D8%A9-%D8%B9%D9%84%D9%89-%D8%A8%D9%84%D8%AF%D8%A9-%D8%A7%D9%84%D8%AE%D9%8A%D8%A7%D9%85-%D8%A8%D8%A7%D9%84%D8%AA%D8%B2%D8%A7%D9%85%D9%86-%D9%85%D8%B9-%D9%82?__cf_chl_rt_tk=iz4HCA.KEX5ApGX3w6atWAtMZgpbITiHTf.DUrXc..o-1730178325-1.0.1.1-1IfW4d8hQ0QKWBPHs5xGeHWBe4zfRyDVyBojHDxYzJQ	غارات عنيفة ومتتالية على بلدة الخيام بالتزامن مع قصف مدفعي مركز - nna-leb.gov.lb	None	None	2024-10-28 20:27:14	nna-leb.gov.lb
lb	https://www.imlebanon.org/2024/10/28/biden54332/	بايدن: الحرب يجب أن تنتهي - imlebanon.org	أشار الرئيس الأميركي جو بايدن، بعيد إدلائه على نحو مبكر بصوته في الانتخابات الرئاسية الأميركية، إلى "اننا بحاجة لوقف إطلاق النار في غزة، وهذه الحرب يجب أن تنتهي	https://imcdn.org/uploads/2024/09/Biden.jpg	2024-10-28 17:55:18	imlebanon.org
lb	https://www.almayadeen.net/latestnews/2024/10/28/%D9%88%D8%B3%D8%A7%D8%A6%D9%84-%D8%A5%D8%B9%D9%84%D8%A7%D9%85-%D8%A5%D8%B3%D8%B1%D8%A7%D8%A6%D9%8A%D9%84%D9%8A%D8%A9--%D8%B5%D9%81%D8%A7%D8%B1%D8%A7%D8%AA-%D8%A7%D9%84%D8%A5%D9%86%D8%B0%D8%A7%D8%B1-%D8%AA%D8%AF%D9%88%D9%8A-%D9%81%D9%8A--%D8%B1%D9%88%D8%B4-%D8%A8%D9%8A%D9%86%D8%A7--%D9%88%D9%85%D8%AD	وسائل إعلام إسرائيلية: صفارات الإنذار تدوي في "روش بينا" ومحيطها شرقي صفد - Al Mayadeen الميادين			2024-10-28 21:46:00	Al Mayadeen الميادين
lb	https://www.elnashra.com/news/show/1693282/%D8%A3%D8%B3%D9%88%D8%B4%D9%8A%D8%AA%D8%AF-%D8%A8%D8%B1%D8%B3-%D9%85%D8%B3%D8%A4%D9%88%D9%84-%D8%A5%D8%B3%D8%B1%D8%A7%D8%A6%D9%8A%D9%84%D9%8A-%D9%86%D8%AA%D8%A7%D9%86%D9%8A%D8%A7%D9%87%D9%88-%D8%A3%D8%B9%D8%B1%D8%A8-%D8%AD%D9%85%D8%A7%D8%B3%D9%87-%D9%84%D9%84%D8%A7	أسوشيتد برس عن مسؤول إسرائيلي: نتانياهو أعرب عن حماسه للاقتراح المصري بشأن غزة في اجتماعه مع حزب "الليكود" - Elnashra.com	اشارت وكالة أسوشيتد برس نقلا عن مسؤول إسرائيلي، الى ان رئيس الوزراء الاسرائيلي بنيامين نتانياهو أعرب عن حماسه للاقتراح المصري بشأن غزة في اجتماعه مع حزب الليكود	https://files.elnashra.com/elnashra/imagine/pictures_fb/1761082_1715785762.jpg	2024-10-28 15:48:34	Elnashra.com
lb	https://aawsat.com/%D8%B4%D8%A4%D9%88%D9%86-%D8%A5%D9%82%D9%84%D9%8A%D9%85%D9%8A%D8%A9/5075820-%D8%A7%D9%84%D9%83%D9%86%D9%8A%D8%B3%D8%AA-%D8%A7%D9%84%D8%A5%D8%B3%D8%B1%D8%A7%D8%A6%D9%8A%D9%84%D9%8A-%D9%8A%D8%AD%D8%B8%D8%B1-%D8%A3%D9%86%D8%B4%D8%B7%D8%A9-%D8%A7%D9%84%D8%A3%D9%88%D9%86%D8%B1%D9%88%D8%A7%C2%A0%D9%81%D9%8A-%D8%AE%D8%B7%D9%88%D8%A9-%D8%AA%D8%AB%D9%8A%D8%B1-%D8%A7%D8%AD%D8%AA%D8%AC%D8%A7%D8%AC%D8%A7%D9%8B-%D8%AF%D9%88%D9%84%D9%8A%D8%A7%D9%8B	الكنيست الإسرائيلي يحظر أنشطة «الأونروا» في خطوة تثير احتجاجاً دولياً - صحيفة الشرق الأوسط	حظر البرلمان الإسرائيلي، الاثنين، رسميا أنشطة وكالة غوث وتشغيل اللاجئين الفلسطينيين في إسرائيل، رغم معارضة أميركا والأمم المتحدة، في خطوة تُشكّل سابقة تاريخيّة.	https://static.srpcdigital.com/styles/1200x600/public/2024-10/833915.jpeg	2024-10-29 04:07:30	صحيفة الشرق الأوسط
lb	https://www.aljazeera.net/news/2024/10/28/%D8%BA%D9%88%D8%AA%D9%8A%D8%B1%D9%8A%D8%B4-%D9%8A%D8%B9%D8%A8%D8%B1-%D8%B9%D9%86-%D8%B5%D8%AF%D9%85%D8%AA%D9%87-%D9%85%D9%86-%D9%85%D8%B3%D8%AA%D9%88%D9%8A%D8%A7%D8%AA-%D8%A7%D9%84%D9%82%D8%AA%D9%84	غوتيريش يعبر عن صدمته من مستويات القتل والدمار بشمال غزة - الجزيرة نت	أعرب الأمين العام للأمم المتحدة أنطونيو غوتيريش عن شعوره “بالصدمة لمستويات القتل والإصابات والدمار الهائلة” في شمال قطاع غزة.	https://www.aljazeera.net/wp-content/uploads/2023/10/32398165-1698258226.jpg?resize=1742%2C1080	2024-10-28 07:13:23	الجزيرة نت
lb	https://www.skynewsarabia.com/middle-east/1750934-%D8%A7%D9%94%D8%B3%D8%A8%D8%A7%D8%A8-%D8%A7%D8%B1%D8%AA%D9%81%D8%A7%D8%B9-%D8%AE%D8%B3%D8%A7%D9%8A%D9%94%D8%B1-%D8%A7%D9%84%D8%AC%D9%8A%D8%B4-%D8%A7%D9%84%D8%A7%D9%95%D8%B3%D8%B1%D8%A7%D9%8A%D9%94%D9%8A%D9%84%D9%8A-%D8%AC%D9%86%D9%88%D8%A8-%D9%84%D8%A8%D9%86%D8%A7%D9%86%D8%9F	ما أسباب ارتفاع خسائر الجيش الإسرائيلي في جنوب لبنان؟ - Sky News Arabia سكاي نيوز عربية	يسجل الجيش الإسرائيلي خسائر في صفوف جنوده على جبهة لبنان، الأمر الذي أثار التكهنات حيال استراتيجية القتال التي يعتمدها في هذه الجبهة والتكتيكات التي يعتمدها حزب الله في معركته البرية في الجنوب.	https://www.skynewsarabia.com/images/v1/2024/10/28/1750945/1200/630/1-1750945.jpg	2024-10-28 14:36:25	Sky News Arabia سكاي نيوز عربية
