country_code	url	title	description	image_url	publish_date	source
pl	https://wiadomosci.onet.pl/swiat/wyniki-wyborow-w-usa-dixville-notch-zaglosowala/5s5ynjg	Ta wieś w USA zagłosowała jako pierwsza. Wyniki ogłoszono natychmiast - Wiadomości - Onet	Licząca sześcioro mieszkańców wioska Dixville Notch w stanie New Hampshire, zgodnie z tradycją, rozpoczęła i zakończyła głosowanie w wyborach prezydenckich jako pierwsza w kraju. Wynikiem głosowania był remis 3-3.	https://ocdn.eu/pulscms-transforms/1/xmTk9kpTURBXy83NjFmYmY3Y2FjZDQxMTIxYmVhYWQ1OWUzNDY2ZjgzOS5qcGeTlQMAzF7NB9DNBGWTCaYyZWNhNjQGkwXNBLDNAnbeAAGhMAE/glosowanie-w-dixville-notch.jpg	2024-11-05 05:57:14	Wiadomości - Onet
pl	https://wiadomosci.onet.pl/warszawa/brawurowy-napad-w-centrum-warszawy-sprawcy-wyniesli-milion-zlotych/zp4jcn1	Kradzież w mieszkaniu w Warszawie. Sprawcy w przebraniach wynieśli milion złotych - Wiadomości - Onet	Brawurowy napad w centrum Warszawy. Kilku sprawców przebranych za policjantów, strażnika granicznego i dostawcę jedzenia wtargnęło do jednego z mieszkań niedaleko Pałacu Kultury i Nauki, skuli kajdankami trzy przebywające tam Ukrainki i ukradli im około 1 mln zł. Pieniądze miały pochodzić ze sprzedaży mieszkania. Policja potwierdza Onetowi, że prowadzi śledztwo w tej sprawie.	https://ocdn.eu/pulscms-transforms/1/r2wk9kpTURBXy83NGRiODUyNDcwNjA4YzQ1NTE4ZWI2MjVlNzk0MDNhMy5wbmeTlQMAAM0HgM0EOJMJpjRhNjVjOAaTBc0EsM0Cdt4AAaEwAQ/kradziez-w-mieszkaniu-w-warszawie-fot-screen-facebookcomreporterwawa.jpg	2024-11-05 16:28:06	Wiadomości - Onet
pl	https://businessinsider.com.pl/wiadomosci/wstrzas-w-izraelu-dymisja-kluczowego-polityka/hngjzs4	Wstrząs w Izraelu. Dymisja kluczowego polityka - Business Insider Polska	Premier Izraela Binjamin Netanjahu podjął decyzję o odwołaniu ministra obrony Yoava Gallanta. W oświadczeniu wydanym przez biuro premiera, Netanjahu wskazał na "znaczące różnice" między nim a Galla...	https://ocdn.eu/pulscms-transforms/1/5sQk9kpTURBXy9lNjViMTBlZjU0ZTIyYTc2ODYyNTk3NjI1ZjNlYjk1Yi5qcGeSlQMAJ80FAM0C0JMFzQSwzQJ23gABoTAB	2024-11-05 18:19:15	Business Insider Polska
pl	https://www.rp.pl/film/art41402281-byla-dyrektorka-pisf-wycofuje-rezygnacje-ze-stanowiska-bylam-zastraszana	Była dyrektorka PISF wycofuje rezygnację ze stanowiska: „Byłam zastraszana” - Rzeczpospolita	Karolina Rozwód oświadczyła, że „bezprawną groźbą” została zmuszona do ustąpienia ze stanowiska dyrektorki Polskiego Instytutu Sztuki Filmowej.	https://i.gremicdn.pl/image/free/eee2b39b9dc26eabfed27179e3129761/?t=crop:5568:3453:nowe:0:129,resize:fill:2000:1250&ctx=preview	2024-11-05 17:19:00	Rzeczpospolita
pl	https://businessinsider.com.pl/wiadomosci/to-zmiana-ktora-ulatwi-zycie-lekarze-z-nowymi-uprawnieniami/mzlerh6	"To zmiana, która ułatwi życie". Lekarze z nowymi uprawnieniami - Business Insider Polska	Rząd otwiera drogę do łatwiejszego dostępu do leków. Wszyscy lekarze będą mogli przepisywać bezpłatne medykamenty dla najmłodszych i seniorów. Wcześniej nie było to oczywiste.	https://ocdn.eu/pulscms-transforms/1/0ECk9kpTURBXy85NDU4ODNiZGFkMzgyYWM1YjAwMjkzMzU0MWNkY2QwYS5qcGeSlQMAPs0H0M0EZZMFzQSwzQJ23gABoTAB	2024-11-05 16:48:00	Business Insider Polska
pl	https://www.polsatnews.pl/wiadomosc/2024-11-05/od-miliardera-po-prezydenta-kim-jest-donald-trump-sylwetka-kandydata-republikanow/	Szokuje i wprowadza chaos. Zmienił oblicze polityki - polsatnews.pl	Donald Trump to miliarder i celebryta, który zmienił oblicze amerykańskiej polityki. Jego prezydentura w latach 2017-2021 naznaczona była chaosem i skandalami. W tegorocznej kampanii sam przedstawia się kandydat ludzi zapomnianych, walczący o odebranie USA lewicowym elitom. Od wyniku wyborów zależy, czy wróci do polityki, czy zapisze się w historii jako oskarżony o liczne przestępstwa.	https://ipla.pluscdn.pl/dituel/cp/tw/twkmhqtjn73gyzi3vbd97wm29tanq8iy.jpg	2024-11-05 18:43:00	polsatnews.pl
pl	https://www.onet.pl/informacje/onetwiadomosci/wybory-prezydenckie-w-usa-stany-zaangazowaly-gwardie-narodowa/dvnsyg4,79cfc278	Gwardia Narodowa zmobilizowana na wybory. Chodzi o 15 stanów - Onet	Ponad 250 pracowników Gwardii Narodowej zapewnia wsparcie w dniu wyborów w 15 stanach — poinformował rzecznik formacji w rozmowie z CNN we wtorek.	https://ocdn.eu/pulscms-transforms/1/2MFk9kpTURBXy81YjFiMTk3OTI3YWVlMTQzNmE2ZjVhOTM3YjllMTdhMC5qcGeSlQMAzJPNEnfNCmKTBc0EsM0CdN4AA6EwAaExAaEzww	2024-11-05 21:09:30	Onet
pl	https://dorzeczy.pl/opinie/652294/ziobro-publikuje-wiadomosc-do-czlonkow-komisji-sledczej.html	Ziobro publikuje wiadomość do członków komisji śledczej - Do Rzeczy	Posłowie z nieistniejącej komisji ds. Pegasusa już nie będą mogli udawać, że nie wiedzieli o nielegalności swoich działań – wskazał Zbigniew Ziobro.	https://img.dorzeczy.pl/img/ziobro-publikuje-wiadomosc-do-czlonkow-komisji-sledczej/d0/1d/5758b3bedbc787bcac8ec84760b6.webp	2024-11-05 16:24:00	Do Rzeczy
pl	https://www.pap.pl/aktualnosci/ukrainskie-wojsko-starlo-sie-z-zolnierzami-z-korei-pln-prezydent-zelenski-nowa-karta	Ukraińskie wojsko starło się z żołnierzami z Korei Płn. Prezydent Zełenski: to nowa karta destabilizacji świata - PAP	None	None	2024-11-05 19:12:00	PAP
pl	https://wydarzenia.interia.pl/kraj/news-areszt-tymczasowy-dla-pawla-s-jest-decyzja-sadu,nId,7849670	Areszt tymczasowy dla Pawła S.? Jest decyzja sądu - Interia Wydarzenia	Kliknij i zobacz więcej.	https://i.iplsc.com/-/000K1GBU198D5OXO-C461-F4.jpg	2024-11-05 12:31:00	Interia Wydarzenia
pl	https://businessinsider.com.pl/wiadomosci/legion-ukrainski-szkolenia-na-poligonach-w-polsce/xn80h41	Ukraiński mundur, polski sprzęt. Do Legionu Ukraińskiego w Polsce zgłosiło się już ponad 500 osób - Business Insider Polska	Ponad 500 osób zgłosiło się do formowanego w Polsce Legionu Ukraińskiego; do końca bieżącego roku rozpoczną one szkolenia na jednym z polskich poligonów, jak poinformowała we wtorek ukraińska państ...	https://ocdn.eu/pulscms-transforms/1/JZfk9kpTURBXy84NTRjNWMxNzIxN2MwNGUwOWQyNWI3NDM1ZTMyMDc3Ny5qcGeSlQMAzKrNFWDNDAeTBc0EsM0Cdt4AAaEwAQ	2024-11-05 15:00:16	Business Insider Polska
pl	https://trojmiasto.wyborcza.pl/trojmiasto/7,35612,31440730,psia-grypa-w-policji-na-masowa-skale-w-niektorych-jednostkach.html	"Psia grypa" w policji na masową skalę. "W niektórych jednostkach zostali tylko naczelnicy i komendanci" - Wyborcza - Trójmiasto	None	None	2024-11-05 13:40:00	Wyborcza - Trójmiasto
pl	https://www.onet.pl/informacje/onetwiadomosci/polak-od-30-lat-mieszka-w-usa-mowi-na-kogo-zaglosowal/4w3w7m9,79cfc278	Polak od 30 lat mieszka w USA. Mówi, na kogo zagłosował - Onet	Wybory w USA nabierają rozpędu, trwa głosowanie za oceanem. O stanowisko prezydenta walczy republikanin Donald Trump i demokratka Kamala Harris. Sondaże nie dają jednoznacznej odpowiedzi, ale najnowsze badania wydają się optymistyczne dla obecnej wiceprezydentki USA. Korespondent Onetu w USA Piotr Markiewicz pytał Polaków głosujących w Nowym Jorku, na kogo zdecydowali się oddać swój głos i dlaczego.	https://ocdn.eu/pulscms-transforms/1/3c0k9kpTURBXy9mNWM3ZjZhMDkwM2ExYjg4YzZlNjdmYTMwMWRiNmZjMC5qcGeSlQMAAM0HgM0EOJMFzQSwzQJ03gADoTABoTEBoTPD	2024-11-05 21:31:00	Onet
pl	https://sport.interia.pl/iga-swiatek/news-wta-reaguje-dwie-godziny-po-meczu-swiatek-gauff-zapadla-osta,nId,7850187	WTA reaguje, dwie godziny po meczu Świątek - Gauff. Zapadła ostateczna decyzja - Interia Sport	None	None	2024-11-05 19:09:00	Interia Sport
pl	https://sport.tvp.pl/83329310/reprezentacja-polski-michal-probierz-znow-namieszal-znamy-powolanych-na-listopadowe-zgrupowanie	Reprezentacja Polski. Michał Probierz znów namieszał. Znamy powołanych na listopadowe zgrupowanie - TVP SPORT	Oficjalna strona TVP Sport. Lider oglądalności wśród kanałów sportowych w Polsce. Transmisje online, program TV, wideo, wyniki, relacje z najważniejszych sportowych wydarzeń.	https://s1.tvp.pl/images2/a/5/1/uid_a5189137ed454c49aee43085126001a4_width_1280_play_0_pos_0_gs_0_height_720_michal-probierz-fot-getty-images.jpg	2024-11-05 16:00:00	TVP SPORT
pl	https://wiadomosci.onet.pl/swiat/wybory-w-usa-pensylwania-jest-najwazniejsza-zdobycza-tlumy-do-lokali/6vfzy82	Wybory w USA. Ten stan jest "nagrodą". Do lokali ustawiają się tłumy - Wiadomości - Onet	Wybory w USA były poprzedzone intensywną kampanią wyborczą. Koncentrowała się ona w dużej mierze na siedmiu stanach — to one w praktyce zadecydują o zwycięzcy wyborów prezydenckich. Jednym z nich jest Pensylwania, w której odnotowywane jest ogromne zainteresowanie głosowaniem.	https://ocdn.eu/pulscms-transforms/1/APGk9kuTURBXy9hYzNiZjEyNi1hZjc3LTRkMmEtOWIwNC1jMTk1ZjdjZTM2OTkuanBlZ5OVAwDNAgXNE2vNCu2TCaY3MjQxNzgGkwXNBLDNAnbeAAGhMAE/wybory-w-usa-przed-lokalami-w-pensylwanii-ustawily-sie-dlugie-kolejki.jpg	2024-11-05 16:22:36	Wiadomości - Onet
pl	https://przegladsportowy.onet.pl/pilka-nozna/liga-mistrzow/szok-kleska-realu-madryt-w-hicie-ligi-mistrzow-a-sensacji-bylo-wiecej/2vh8k94	Szok! Klęska Realu Madryt w hicie Ligi Mistrzów! A sensacji było więcej - Przegląd Sportowy Onet	Sensacyjne rozstrzygnięcia przyniósł nam wtorek z Ligą Mistrzów. Real Madryt zaliczył drugą bolesną porażkę, po niedawnym El Clasico z Barceloną. Tym razem Królewscy przegrali 1:3 z AC Milan, a w wielu momentach piłkarze gospodarzy nie wyglądali na zainteresowanych zwycięstwem. Jeszcze większą niespodzianką jest porażka Manchesteru City z portugalskim Sportingiem i to aż 1:4. Erling Haaland nie wykorzystał rzutu karnego. Zobacz nagrania z bramek i tabelę Ligi Mistrzów.	https://ocdn.eu/sport-images-transforms/1/gMLk9lBaHR0cHM6Ly9vY2RuLmV1L3B1bHNjbXMvTURBXy85NmY2ODY5ZmVkMTVmNjljNjFiODNmMzdkYTdjODFlZC5wbmeTlQPMWMyVzQSnzQKekwXNBLDNAnSTCaZkNDFkOGMG3gACoTABoTEB	2024-11-05 22:00:15	Przegląd Sportowy Onet
pl	https://www.sport.pl/pilka/7,65039,31440040,tak-trener-zaglebia-skomentowal-to-co-zrobil-magiera-jasniej.html	Tak trener Zagłębia skomentował to, co zrobił Magiera. Jaśniej się nie da - Sport.pl	Poniedziałkowy wieczór był wyjątkowym dniem dla całego piłkarskiego Dolnego Śląska. W derbach regionu Zagłębie Lubin podejmowało Śląsk Wrocław i nie pozostawiło rywalom żadnych złudzeń. Wygrana 3:0 mogła być odbierana jako najniższy wymiar kary. Po zakończonym gwizdku kamery uchwyciły zachowanie Jacka Magiery, który nie podał ręki Marcinowi Włodarskiemu. Trener Zagłębia na konferencji zdradził kulisy zdarzenia.	https://bi.im-g.pl/im/71/fb/1d/z31440241IER,Jacek-Magiera-i-Marcin-Wlodarski.jpg	2024-11-05 12:20:00	Sport.pl
pl	https://plejada.pl/newsy/zaskakujaca-metamorfoza-corki-tomasza-karolaka-zobaczcie-jak-sie-zmienila-galeria/dh8e7s8	Lena Karolak zaskoczyła na premierze "Listów do M". Szokująca przemiana - Plejada.pl	None	None	2024-11-05 12:31:01	Plejada.pl
pl	https://businessinsider.com.pl/gielda/wiadomosci/wybory-w-usa-kasa-ucieka-z-bitcoinowych-funduszy/jgfls0c	Rekordowy odpływ pieniędzy z kryptowalutowych funduszy na ostatniej wyborczej prostej - Business Insider Polska	Amerykańskie fundusze inwestycyjne typu ETF skoncentrowane wokół bitcoina, czyli najpopularniejszej kryptowaluty świata, odnotowują rekordowe odpływy pieniędzy. W ten sposób rynek przygotowuje się ...	https://ocdn.eu/pulscms-transforms/1/i-0k9kpTURBXy9jNzhlNDEwNmU5N2UxODQyMzk0NzRkMzg4MjAzMzYzNC5qcGeSlQMpAM0HX80EJZMFzQSwzQJ23gABoTAB	2024-11-05 14:03:26	Business Insider Polska
pl	https://tvn24.pl/biznes/z-kraju/koniec-kioskow-ruchu-orlen-tlumaczy-st8166102	Koniec kiosków Ruchu. Komunikat - TVN24	Kioski Ruchu do likwidacji. Obecnie ajenci otrzymują wypowiedzenia umów - podał Orlen, który jest właścicielem spółki. Niektórzy decydują się na odkupienie kiosku i prowadzenie działalności "we własnym zakresie". 	https://tvn24.pl/biznes/najnowsze/cdn-zdjecie-2729989-kiosk-ruchu-ph4551486/alternates/LANDSCAPE_1280	2024-11-05 10:44:09	TVN24
pl	https://wiadomosci.onet.pl/swiat/wybory-w-usa-budza-niepokoj-w-niemczech-nikt-nie-chce-sobie-tego-wyobrazic/b3my8d4	Wybory w USA budzą niepokój w Niemczech. "Nikt nie chce sobie tego wyobrazić" - Wiadomości - Onet	Partie niemieckiej koalicji rządowej — SPD, Zieloni i FDP — walczą o wyjście z poważnego kryzysu. Spotkanie liderów w środę może dotyczyć dalszego jej istnienia. Dziennik "Sueddeutsche Zeitung" zauważył, że koalicja musi się utrzymać, jeśli wybory w USA wygra Donald Trump. "Nikt nie chce sobie wyobrazić, co podwójny kryzys w USA i Niemczech może wywołać w słabej reszcie Zachodu" — czytamy.	https://ocdn.eu/pulscms-transforms/1/6oak9kuTURBXy9lOGI1NGIwMC1lMzQxLTQwODktYWE4OS01NTg5YjU4NDA2YmEuanBlZ5OVAwDNAnPNF3DNDS-TCaYzZWVmOTIGkwXNBLDNAnbeAAGhMAE/wyborcy-oddaja-glos-w-nowojorskim-kosciele.jpg	2024-11-05 22:45:06	Wiadomości - Onet
pl	https://www.wysokieobcasy.pl/wysokie-obcasy/7,163229,31439927,poruszajaca-koncowka-kampanii-kamali-harris-lady-gaga-ten.html?disableRedirects=true	Kamala Harris zakończyła kampanię z plejadą gwiazd. Lady Gaga: Ten kraj na was liczy - WysokieObcasy.pl	None	None	2024-11-05 13:23:02	WysokieObcasy.pl
pl	https://wydarzenia.interia.pl/kraj/news-sikorski-mowil-o-wolyniu-jest-prosba-do-strony-ukrainskiej,nId,7849999	Rozmowy z Ukrainą ws. Wołynia. Sikorski zabrał głos - Interia Wydarzenia	Kliknij i zobacz więcej.	https://i.iplsc.com/-/000K1J5C9GFU1JLF-C461-F4.jpg	2024-11-05 17:31:17	Interia Wydarzenia
pl	https://www.sport.pl/pilka/7,65041,31442019,to-byl-wieczor-sensacji-oto-tabela-ligi-mistrzow-po-wtorkowych.html	To był wieczór sensacji! Oto tabela Ligi Mistrzów po wtorkowych meczach - Sport.pl	None	None	2024-11-05 22:07:00	Sport.pl
pl	https://wiadomosci.wp.pl/andrzej-duda-napisal-list-bezpardonowy-atak-7089449147874048a	Duda w obronie TK. "Bezpardonowy atak" - WP Wiadomości	"Obecnie jesteśmy świadkami niebywałego, bezpardonowego ataku na Trybunał Konstytucyjny rodzącego bezpośrednie zagrożen…	None	2024-11-05 16:12:28	WP Wiadomości
pl	https://weszlo.com/2024/11/05/wojciech-szczesny-debiut-barcelona-hansi-flick/	Flick rozwiał wątpliwości w sprawie debiutu Szczęsnego - Weszło	None	None	2024-11-05 19:08:00	Weszło
pl	https://businessinsider.com.pl/finanse/rpp-obraduje-nad-stopami-procentowymi-ekspert-wskazuje-termin-pierwszej-obnizki/zcnnbtz	RPP obraduje nad stopami procentowymi. Ekspert wskazuje termin pierwszej obniżki - Business Insider Polska	Rada Polityki Pieniężnej zebrała się we wtorek 5 listopada na przedostatnie w tym roku posiedzenie. Rynek nie spodziewa się zmiany poziomu stóp procentowych, ale coraz częstsze są głosy wskazujące ...	https://ocdn.eu/pulscms-transforms/1/jdgk9kpTURBXy8xYjYzYmYyMTRjNWE5MTJlMDEzMzIyMGQ3MWRjYTY0Yy5qcGeSlQMAzKHNFEDNC2WTBc0EsM0Cdt4AAaEwAQ	2024-11-05 12:55:35	Business Insider Polska
pl	https://businessinsider.com.pl/gielda/wiadomosci/orlen-ujawnia-czesc-wynikow-miliardy-spisane-na-straty/yx4437j	Orlen spisuje na straty kolejne miliardy złotych. Ważna inwestycja nigdy się nie zwróci - Business Insider Polska	Orlen w ramach przeglądu majątku zdecydował się spisać na straty księgowo około 3,5 mld zł. Zarząd wskazuje na trwałą utratę wartości aktywów Grupy Orlen Lietuva oraz aktywów wytwórczych w segmenci...	https://ocdn.eu/pulscms-transforms/1/dz_k9kpTURBXy8wOWMzMWU4NTg3MzM1NzRjZjA1OTgyN2VhN2FmZWI3Yi5qcGeSlQPMXs0BPs0HEc0D-pMFzQSwzQJ23gABoTAB	2024-11-05 10:09:53	Business Insider Polska
pl	https://wydarzenia.interia.pl/raport-wybory-prezydenckie-usa-2024/na-zywo-wyniki-wyborow-w-usa-trump-czy-harris-najnowsze-informacje-r,nzId,6440	Wyniki wyborów w USA. Trump czy Harris? Najnowsze informacje [RELACJA] - Interia Wydarzenia	None	None	2024-11-06 00:37:39	Interia Wydarzenia
pl	https://businessinsider.com.pl/wiadomosci/rafal-trzaskowski-odslania-karty-ws-wyborow-na-prezydenta-nie-odpuszcze/hs4llw0	Rafał Trzaskowski odsłania karty w sprawie wyborów na prezydenta. "Nie odpuszczę" - Business Insider Polska	Rafał Trzaskowski zadeklarował gotowość do startu w wyborach prezydenckich: "Nie odpuszczę" - zapewnił podczas spotkania z mieszkańcami Aleksandrowa Łódzkiego.	https://ocdn.eu/pulscms-transforms/1/vGCk9kpTURBXy85OTFhNTJiYTA1MTYxZWMxMjM1MzI5ZWYxNGZiNWVlYS5qcGeSlQMAzLvNF3DNDS-TBc0EsM0Cdt4AAaEwAQ	2024-11-05 19:09:06	Business Insider Polska
pl	https://news.google.com/rss/articles/CBMirgFBVV95cUxPVXBhSW1wMHdhWXExRU1NMFcyemZ2WDJWbXNOSFNvQmpTcVVvcGRmbFNPLUhESXg5a0RfU29VSm1FdE81cmIyVk9NSmpPZGswTk4zRmVlSmt2RkFRbjNkSGJMUFZPWlVNX1pNbi12QmpMNm9YTm84V0NfWTZJd2ZXNmJBZnBKdnhMM0tOOFpJNjFjSjh4WVR5LTBvT0JLWHNRMzhSYm1wUm0zQlVfdXc?oc=5	Wybory w USA. Donald Trump oczekuje na wyniki wyborów. Gdzie? - polsatnews.pl	Donald Trump oddał głos na Florydzie. Choć republikanie mają tam większe poparcie, ta część stanu, gdzie głosował, należy do demokratów. Kandydat na prezydenta na pierwsze wyniki będzie oczekiwał w swojej rezydencji w Palm Beach.	None	2024-11-05 20:10:00	polsatnews.pl
pl	https://news.google.com/rss/articles/CBMitwFBVV95cUxQMXBXSllBT0NsUTQxRzBKbkYxemMwTnQwMHhQUDRNaGRLUkppc0c1TkU5aVByZktLX1h5VDl1XzVfUHRNSE16cnJLUHBZLVctcjNVMGQteTNzWlFFdnR0YUxGRE8taHZGNEhSMVQzaVloem1WSHBWUGZ6b3pGT2g0LWxvTVB6UHlwZ3pzWi1jWkN3SWRINmJLamNjcGlCcUxFWFRrV2xpcHBOU3hES0xsWjdxb2RQUE0?oc=5	Polski dziennikarz żyje w Barcelonie. Mówi o strachu mieszkańców - Fakt.pl	Hiszpanię nawiedziły tragiczne w skutkach powodzie. Walencja znalazła się w krytycznej sytuacji, ale wielka woda doszła także m.in. do Barcelony. Dziennikarz Piotr Grabarczyk, który od czterech lat...	None	2024-11-05 17:22:37	Fakt.pl
pl	https://www.polsatnews.pl/wiadomosc/2024-11-05/prof-jacek-czaputowicz-w-gosciu-wydarzen/	Amerykańskie wybory a sytuacja Ukrainy. "Trump jest promykiem nadziei" - polsatnews.pl	- Nieobliczalność Donalda Trumpa może być promykiem nadziei dla Ukraińców - ocenił były szef MSZ, prof. Jacek Czaputowicz w programie Gość Wydarzeń. Dodał, że republikanin może podjąć decyzję o atakowaniu obiektów na terenie Rosji, a to zmieni wojnę.	https://ipla.pluscdn.pl/dituel/cp/63/637aqa3vrs2gc5trp5x9k1s4s5qaoufp.jpg	2024-11-05 18:06:00	polsatnews.pl
pl	https://wiadomosci.wp.pl/akcja-policji-na-kapitolu-smierdzial-paliwem-7089496717507296a	Akcja policji na Kapitolu. "Śmierdział paliwem" - WP Wiadomości	Akcja policji na Kapitolu. Jak przekazano, zatrzymano mężczyznę, który "śmierdział paliwem" i miał z sobą pochodnię ora…	None	2024-11-05 19:17:21	WP Wiadomości
pl	https://wiadomosci.onet.pl/pogoda/zolte-alerty-niemal-w-calej-polsce-widocznosc-spadnie-ponizej-200-m/7mgh6m9	Niemal cała Polska w żółtych alertach. Widzialność spadnie poniżej 200 m - Wiadomości - Onet	Zapowiadają się trudne godziny dla kierowców. Instytut Meteorologii i Gospodarki Wodnej wydał na nadchodzącą noc ostrzeżenie pierwszego stopnia przed gęstą mgłą, która obejmie niemal cały kraj. W wielu miejscach widoczność może spaść poniżej 200 m. Mglisto zapowiadają się też kolejne dni.	https://ocdn.eu/pulscms-transforms/1/IVrk9kpTURBXy8xZDg3NzE1YmNmZWY0NGZjM2Y2NDVlNzIxNjg3MWE5OS5wbmeTlQMAzK_NFfDNDFeTCaY1ODc3ZDUGkwXNBLDNAnbeAAGhMAE/niemal-cala-polska-w-zoltych-alertach-widocznosc-spadnie-ponizej-200-m-screen-ximgw.jpg	2024-11-05 14:45:15	Wiadomości - Onet
pl	https://wiadomosci.onet.pl/kraj/kiedy-pis-wskaze-kandydata-na-prezydenta-czekaja-na-wyniki/ts50drd	Kiedy PiS wskaże kandydata na prezydenta? Czekają na wyniki - Wiadomości - Onet	15 listopada do centrali Prawa i Sprawiedliwości mają spłynąć wyniki badań dotyczących potencjalnych kandydatów ugrupowania na prezydenta — poinformował w rozmowie z PAP polityk z władz partii. Pierwotnie planowano, że ogłoszenie kandydata nastąpi 11 listopada lub w okolicy tej daty. Teraz jednak wiadomo, że tak się nie stanie.	None	2024-11-05 10:53:35	Wiadomości - Onet
pl	https://news.google.com/rss/articles/CBMiswFBVV95cUxNTVZBQXM0ckwwRk4xY2F0Z0k4akVUMFBQejdqaEZjR0lWNGZ1SEVFMm81YjZtYTljSDczekNNMUlRdTVNWFh1S1ZZTVhBNV9rc2twX3hoLUdBcFVMclVwLUFiWDRjdnJXYTl6OWpnazkzTmVFbVFtQUxqUHI0QlpUTVh4V2pxVmp2REdDMmZfNW9yVnRGd3FlVmZwWFZiQW9wbE5qMVNMZXRJM1dYaGFwUDJIbw?oc=5	Ostatnie godziny głosowania w Pensylwanii. Donald Trump pisze o "oszustwie" - Wiadomości - Onet	None	None	2024-11-05 21:55:05	Wiadomości - Onet
pl	https://tvn24.pl/olsztyn/szczytno-brutalny-atak-ksiedza-na-plebanii-nowe-informacje-st8165717	"Zadał proboszczowi kilka ciosów toporkiem w głowę". 27-latek z zarzutem usiłowania zabójstwa - TVN24	72-letni ksiądz prałat Lech Lachowicz ze Szczytna, który został brutalnie zaatakowany w minioną niedzielę na plebanii, jest w stanie krytycznym. Zatrzymany 27-latek usłyszał zarzut usiłowania zabójstwa. "Zadał on proboszczowi kilka uderzeń metalowym toporkiem w głowę. Zamierzonego celu nie osiągnął z uwagi na szybkie udzielenie pomocy" - opisano w zarzucie. Jak przekazał rzecznik Prokuratury Okręgowej w Olsztynie Daniel Brodowski, 27-latek przyznał się, że napadł księdza w celach rabunkowych.	https://tvn24.pl/najnowsze/cdn-zdjecie-9452181-27-latek-z-zarzutem-usilowania-zabojstwa-przyznal-sie-ze-napadl-ksiedza-w-celach-rabunkowych-ph8167123/alternates/LANDSCAPE_1280	2024-11-05 15:56:15	TVN24
pl	https://www.tvp.info/83328059/czy-karty-wyborcze-w-kentucky-maja-kropke-w-okienku-przy-kamali-harris-komisja-wyborcza-zaprzecza-fakenews	„Karta z kropką” dowodem na fałszerstwo wyborcze? Sprawdzamy - TVP Info	Dowód na fałszerstwo wyborcze w Stanach Zjednoczonych? W mediach społecznościowych krąży zdjęcie karty wyborczej. W okienku przy nazwisku Kamali Harris widać kropkę. Przyjrzeliśmy się tej...	https://s4.tvp.pl/images2/4/c/e/uid_4cee7eb2754a42a6a0a81460b9a54480_width_1280_play_0_pos_0_gs_0_height_720_kolejka-do-glosowania-w-lexington-w-stanie-kentucky-tasha-poullardlexington-herald-leadertribune-news-service-via-getty-x.jpg	2024-11-05 14:45:00	TVP Info
pl	https://www.polsatnews.pl/wiadomosc/2024-11-05/swiadczenie-wzrosnie-o-100-procent-rzad-zdecydowal/	Fundusz alimentacyjny. Rząd zmienił kwotę świadczenia - polsatnews.pl	Rada Ministrów przyjęła nowelizację ustawy o pomocy osobom uprawnionym do alimentów. Oznacza to podniesienie kwoty świadczenia z funduszu alimentacyjnego z 500 do 1000 zł miesięcznie. Wypłata ma nastąpić z wyrównaniem od 1 października 2024 roku. Projekt ustawy był jednym ze 100 konkretów na pierwsze 100 dni rządów.	https://ipla.pluscdn.pl/dituel/cp/qo/qok181jqc9pzf7mq1moiq43o9ghyr2yc.png	2024-11-05 16:18:00	polsatnews.pl
pl	https://news.google.com/rss/articles/CBMi1gFBVV95cUxPVFNWUVczMERvUlFZdVB1cHlONUc4aG5uT1VhN0hvVmhBVzFzZFJGM2szY0tqVFRnbjRpLVRNc01UdnYxSGxjd1M4R0JPMXFKNFBVYURUYjFTdDFxSUc0NVBFeHVhLXRfa0FQNXlVQXdpQVhJQnJ0VkNvaTNaeUFELWkwdHl1NWlCTzZDR0ViV0VzaXdscGVFN1lIdTV4RlhmTHZTSEhhXzNtUGcyZEd6SUtMY1AwTW55d19STWJRQ2VZZTRwT1EyVXZuN2l1TkdsVE8tMzJR?oc=5	Rzecznik Kremla o wyborach w Mołdawii: nie były ani uczciwe, ani demokratyczne - Onet	None	None	2024-11-05 09:50:00	Onet
pl	https://businessinsider.com.pl/wiadomosci/kaczynski-potrzebne-znaczne-srodki-finansowe-dla-pis/pnr1ydp	Kaczyński apeluje o wsparcie finansowe dla PiS. "Prośba do wszystkich obywateli" - Business Insider Polska	Prezes PiS Jarosław Kaczyński zaapelował ponownie o wsparcie finansowe dla jego partii. "Nie oczekujemy jakichś ogromnych wpłat, nam chodzi o to, żeby było ich po prostu dużo, żeby wielu polskich o...	https://ocdn.eu/pulscms-transforms/1/ZaUk9kpTURBXy8wY2VhM2ExY2YzZWUwMWE0NmNlOGE2YTdhNTIxNzdjYi5qcGeSlQMAzIvNB9DNBGWTBc0EsM0Cdt4AAaEwAQ	2024-11-05 13:08:31	Business Insider Polska
pl	https://news.google.com/rss/articles/CBMizAFBVV95cUxQN3NRMkVpQktfTnkyczVvbGlnQlF2dWZMazNoZGZmUGNTdDFHeTNnaGVfUmhxRTdpR2twMzdIZkV4YXpPNE1aT2RXWHFkNm9IVUxsMjFickJRXzdOa0JyLTZyelUtNDZtSkh6UTdrNC00djRWVFNETG0xSjBlcFVadkVTeUgxTmdKYmxtU2cyUVE2ZGNoN2dJTGJmR2ZXc3cyNnFsLUxmalVBZlB6dEJ5UTRtaE9NQWdIUUlpaEYwazV0aHFnMHdYYkhSU2I?oc=5	Policja na tropie "wyznawców" trendu na TikToku. Wkładali żyletki w cukierki - Onet	None	None	2024-11-05 13:06:00	Onet
pl	https://www.tvp.info/83326443/wybory-w-usa-2024-donald-trump-kamala-trump-korupcja-polityczna-elona-muska-pac-america-sad-w-pensylwanii-podjal-decyzje	Korupcja polityczna Muska? Sąd podjął decyzję - TVP Info	Sędzia ze stanu Pensylwania zezwolił fundacji America PAC Elona Muska na kontynuowanie loterii dla wyborców z tzw. stanów wahających się (swing states). Popierający Donalda Trumpa...	https://s1.tvp.pl/images2/a/3/5/uid_a3576aea1a654874b6d59e566c76c10e_width_1280_play_0_pos_0_gs_0_height_720_elon-musk-rozdaje-pieniadze-zwolennikom-donalda-trumpa-fot-samuel-corumgetty-images.jpg	2024-11-05 08:42:00	TVP Info
pl	https://businessinsider.com.pl/wiadomosci/tajemnicze-pozary-paczek-to-rosyjskie-testy-wymierzone-w-usa/5e5ll96	Tajemnicze pożary paczek także w Polsce były rosyjskimi "testami". Celem były USA - Business Insider Polska	Seria pożarów paczek wymierzonych w firmy kurierskie w Polsce, Niemczech i Wielkiej Brytanii miała na celu sabotowanie lotów do USA i Kanady. Tak twierdzą polscy prokuratorzy. Podobnego zdania są ś...	https://ocdn.eu/pulscms-transforms/1/9vvk9kqTURBXy81YzZhMGZlMGYxOGViMmE3MTNjYzk5YTU3MTUyNTllNi5qcGVnkpUDADTNA-jNAjOTBc0EsM0Cdt4AAaEwAQ	2024-11-05 14:47:22	Business Insider Polska
pl	https://www.rp.pl/wybory-w-usa/art41400181-co-powinien-zrobic-donald-trump-jesli-przegra-z-kamala-harris-nigel-farage-odpowiedzial	Co powinien zrobić Donald Trump, jeśli przegra z Kamalą Harris? Nigel Farage odpowiedział - Rzeczpospolita	None	None	2024-11-05 10:43:38	Rzeczpospolita
pl	https://wiadomosci.wp.pl/burza-wokol-min-wieczorka-leszek-miller-knajackie-metody-7089385163639520a	Burza wokół min. Wieczorka. Leszek Miller: "Knajackie metody" - WP Wiadomości	"’Zniszczę cię’ to typowe słownictwo Czarzastego przejęte przez pojętnego ucznia" - tak były premier Leszek Miller kome…	None	2024-11-05 11:54:43	WP Wiadomości
