country_code	url	title	description	image_url	publish_date	source
pl	https://www.meczyki.pl/newsy/koszykowka/show-sochana-w-nba-kapitalne-zawody-i-szarpaniana-z-rywalem-wideo/254189	Show Sochana w NBA! Kapitalne zawody i szarpaniana z rywalem [WIDEO] - Meczyki.pl	Jeremy Sochan bawi się na parkietach NBA. W ostatnim meczu San Antonio Spurs Polak zaprezentował wszystkie rzeczy, za które liga amerykańska jest kochana na całym świecie.
San Antonio Spurs zmierzyło się z Minnesotą Timberwolves na własnym obiekcie. Gospodarze wygrali 113:103. Duży wpływ na ich sukces miał Jeremy Sochan.
Reprezentant Polski zdoby...	https://pliki.meczyki.pl/amp32/535/67271c265e74b.jpg	2024-11-03 06:46:12	Meczyki.pl
pl	https://powrotroberta.pl/2024/11/kwalifikacje-formuly-1-na-interlagos-relacja-live.html	Kwalifikacje Formuły 1 na Interlagos [Relacja live] - Powrót Roberta	Po ogromnym zamieszaniu w sobotę, dziś liczymy na bezproblemowy przebieg wszystkich sesji na Interlagos. Zapraszam na relację live!	https://powrotroberta.pl/wp-content/uploads/2024/11/SI202411020416-scaled-e1730627315639.jpg	2024-11-03 09:55:23	Powrót Roberta
pl	https://sport.interia.pl/primera-division/news-zwrot-akcji-ws-wojciecha-szczesnego-debiutu-nie-bedzie-przyj,nId,7848528	Zwrot akcji ws. Wojciecha Szczęsnego. Debiutu nie będzie? "Przyjechał tylko do pomocy" - Interia Sport	Kliknij i zobacz więcej.	https://i.iplsc.com/-/000JOHMIFEQKK66C-C461-F4.jpg	2024-11-03 10:54:00	Interia Sport
pl	https://kobieta.onet.pl/wiadomosci/lawina-krytyki-po-najnowszym-odcinku-nasz-nowy-dom-patologia/9yxnvw3	Lawina krytyki po najnowszym odcinku "Nasz nowy dom". "Patologia" - Onet Kobieta	W ostatnim odcinku "Nasz nowy dom" widzowie poznali rodzinę z Wielkopolski. Jednak — zamiast zachwytów nad metamorfozą domu w Wielkopolsce — widzowie wprost wyrazili swoje niezadowolenie. Bohaterom zarzucono "lenistwo". "Paranoja" — komentuje jeden z internautów i nie kryje oburzenia.	https://cdn.kobieta.onet.pl/1/jTxk9lBaHR0cHM6Ly9vY2RuLmV1L3B1bHNjbXMvTURBXy85OWQ2MzQxN2MxYWY1ZTA3NjU4Nzc1OWRkZWZjM2M4Yy5wbmeSlQMAAM0HgM0EOJMFzQSwzQJ23gACoTAHoTEE	2024-11-03 12:51:55	Onet Kobieta