country_code	url	title	description	image_url	publish_date	source
pl	https://defence24.pl/wojna-na-ukrainie-raport-specjalny-defence24/miedwiediew-rosja-uzyje-broni-jadrowej-jesli-poczuje-sie-zagrozona	Miedwiediew: Rosja użyje broni jądrowej, jeśli poczuje się zagrożona - Defence24.pl	„USA mylą się, sądząc, że Moskwa nie użyje broni jądrowej&#8221; – oświadczył były prezydent i premier Rosji Dmitrij Miedwiediew. Jego wypowiedź przytoczył Reuters, powołując się na rosyjskie media.	https://cdn.defence24.pl/2022/03/28/1920x1080px/hT6Z8ixOeXp4hXY9W3CWCMf6PsCU4qCnxvxu3mUd.vjfx.jpg	2024-11-02 13:17:04	Defence24.pl
pl	https://wiadomosci.onet.pl/trojmiasto/alert-imgw-niebezpieczna-pogoda-przez-cala-niedziele-w-dwoch-regionach/t4t9r92	Alert IMGW. Niebezpieczna pogoda przez całą niedzielę w dwóch regionach - Wiadomości - Onet	Instytut Meteorologii i Gospodarki Wodnej wydał ostrzeżenie I stopnia przed silnym wiatrem dla woj. pomorskiego i części woj. zachodniopomorskiego. Prognozowany jest wiatr w porywach do 80 km na godz. Ostrzeżenie obowiązuje do niedzieli.	https://ocdn.eu/pulscms-transforms/1/Mt6k9kpTURBXy9jNzM5OGZmMmVjZmE2Nzg1MjRjMTliZTAyYTYxN2JiNy5qcGeTlQMDzFXNGJnNDdmTCaZkOWQxYWYGkwXNBLDNAnbeAAGhMAE/alert-imgw-niebezpieczna-pogoda-przez-cala-niedziele-w-dwoch-regionach.jpg	2024-11-02 20:58:28	Wiadomości - Onet
pl	https://wiadomosci.onet.pl/kraj/awantura-w-studiu-prowadzacy-trzykrotnie-przerwal-politykowi-pis/4gnre87	Awantura w studiu. Prowadzący trzykrotnie przerwał politykowi PiS. "Czy pan to czytał? To jest proste pytanie!" - Wiadomości - Onet	"Macierewicz. Prokuratura. Zdrada" — tymi słowami premier Donald Tusk zapowiadał wnioski płynące z raportu o wpływach rosyjskich w Polsce. — To jest publicystyka. To są wrzuty populistyczne ze strony pana Donalda Tuska. Pan Antoni Macierewicz to jest wielki, polski patriota. Widocznie Donald Tusk nie znalazł czasu, żeby sobie poczytać życiorys Antoniego Macierewicza i rzuca tego rodzaju zdania, które rozgrzewają debatę publiczną — stwierdził w programie "7. Dzień Tygodnia w Radiu Zet" poseł PiS Michał Wójcik. W pewnym momencie wypowiedź politykowi PiS przerwał prowadzący program Andrzej Stankiewicz.	https://ocdn.eu/pulscms-transforms/1/ZDek9kpTURBXy8yZDA2OGUyMmJiN2UyODYyZjE1ZmNjZmM3MWFjMDE1NC5wbmeTlQM-AM0DbM0B7ZMJpjA5NTAyOAaTBc0EsM0Cdt4AAaEwAQ/7-dzien-tygodnia-w-radiu-zet.jpg	2024-11-03 09:15:14	Wiadomości - Onet
pl	https://www.rp.pl/komentarze/art41388751-artur-bartkiewicz-miedzy-przemyslawem-czarnkiem-a-karolem-nawrockim-na-czym-polega-prezydencki-dylemat-pis	Wybory prezydenckie. Z jakim ryzykiem dla PiS wiąże się Karol Nawrocki, a z jakim Przemysław Czarnek? - Rzeczpospolita	PiS odwleka wybór kandydata na prezydenta, bo tak naprawdę nie ma dobrego wyboru, a każda decyzja będzie wiązać się z pewnym ryzykiem, które będzie trzeba podją	None	2024-11-02 11:06:16	Rzeczpospolita
pl	https://www.fakt.pl/wydarzenia/rodzina-drzy-o-los-beaty-klimek-jest-powaznie-chora/v4bcnh9	Beata Klimek cierpi na groźną chorobę. Czy ma ona wpływ na jej zaginięcie? - Fakt.pl	Beata Klimek wyszła na przystanek odprowadzić swoje dzieci na szkolny autobus i zniknęła. Nowe światło na sprawę rzucają ustalenia "Faktu". Z naszych informacji wynika, że zaginiona kobieta cierpia...	https://ocdn.eu/pulscms-transforms/1/dTVk9kuTURBXy9jMzQ0NDkyMy1mYjJmLTQzN2EtODdiNi1kZGJiMzI3N2IwMjcuanBlZ5KVAwAAzQeAzQQ4kwXNBLDNAnbeAAGhMAE	2024-11-03 05:30:00	Fakt.pl
pl	https://www.polsatnews.pl/wiadomosc/2024-11-03/masowe-kontrole-policji-mundurowi-podsumowali-akcje-na-drogach/	Masowe kontrole policji. Mundurowi podsumowali akcje na drogach - polsatnews.pl	Ponad 14 tys. interwencji, 245 zatrzymanych kierowców pod wpływem - to bilans kontroli policji w Zaduszki. Funkcjonariusze przekonują, że te statystyki są lepsze w porównaniu z zeszły rokiem - na drogach zginęło o wiele mniej osób, zmalała także liczba osób prowadzących pojazdy na podwójnym gazie.	https://ipla.pluscdn.pl/dituel/cp/9h/9hj6zgc8b7by23mbtma4e4dab982owux.jpg	2024-11-03 09:47:00	polsatnews.pl
pl	https://wiadomosci.wp.pl/w-nocy-padl-rekord-zimna-mamy-prognoze-co-dalej-7088637231147776a	W nocy padł już sezonowy rekord zimna. Mamy prognozę, co dalej - WP Wiadomości	Za nami najzimniejsza noc w tym sezonie. Mróz był jeszcze większy niż zakładały prognozy, miejscami temperatura spadła do nawet -12 stopni Celsjusza. Co czeka nas w następnych godzinach? IMGW informuje	https://v.wpimg.pl/NDAyNGFlYSUgGzh0aRdsMGNDbC4vTmJmNFt0ZWkjYXVzSX4_cF9-aycQIiI0CT4rbx48MjYNOTRvCSJoJxwnazdIYSMvHz4oIABhIisOKyBuHCxwcQ4qJSdUeX8kCWNweUl8an9fKHRsSiwlJVh-dnUYK3clTjM	2024-11-03 09:08:29	WP Wiadomości
pl	https://tvn24.pl/swiat/chaos-w-boliwii-napastnicy-przejeli-bron-wzieli-ponad-200-zolnierzy-na-zakladnikow-st8163314	Chaos w Boliwii. Napastnicy przejęli broń, wzięli ponad 200 żołnierzy na zakładników - TVN24	Napastnicy, którzy zaatakowali trzy jednostki wojskowe w Boliwii, wzięli w charakterze zakładników ponad 200 żołnierzy, przejęli broń i amunicję - ogłosiło MSZ w La Paz. Prezydent Luis Arce oskarżył o atak grupy związane z jego rywalem politycznym, byłym szefem państwa Evo Moralesem. Ten zaś ogłosił rozpoczęcie protestu głodowego do czasu rozpoczęcia rozmów między rządem a napastnikami. 	https://tvn24.pl/najnowsze/cdn-zdjecie-1594967-boliwijskie-sily-bezpieczenstwa-pracuja-nad-usunieciem-blokad-drogowych-ustawionych-ph8163324/alternates/LANDSCAPE_1280	2024-11-03 07:05:08	TVN24
pl	https://przegladsportowy.onet.pl/pilka-nozna/ekstraklasa/rakow-czestochowa-pobil-absolutny-rekord-ekstraklasy-po-40-latach/f58j494	Padł fenomenalny rekord w Ekstraklasie. Czekaliśmy aż 40 lat! - Przegląd Sportowy Onet	O ile gra ofensywna Rakowa Częstochowa w wielu meczach tegorocznego sezonu może pozostawiać wiele do życzenia, o tyle w obronie podopieczni Marka Papszuna spisują się wybornie. Do tego stopnia, że pobili właśnie rekord Ekstraklasy, który 40 lat temu wyśrubowali zawodnicy Górnika Zabrze. A to nie koniec.	https://ocdn.eu/sport-images-transforms/1/fwUk9lBaHR0cHM6Ly9vY2RuLmV1L3B1bHNjbXMvTURBXy84NDQ1MTFhNzRjMzhjNGY3MDc5NDgxZjY0YTc5YmNhZi5wbmeTlQPMRMx7zQTPzQK0kwXNBLDNAnSTCaZkNDFkOGMG3gACoTABoTEB	2024-11-03 06:48:27	Przegląd Sportowy Onet
pl	https://businessinsider.com.pl/wiadomosci/rosyjska-armia-zwieksza-sile-atakow-iranskich-dronow-shahed/1st8nf4	Rosjanie używają w Ukrainie śmiercionośnej broni. Powoduje niszczycielskie eksplozje - Business Insider Polska	Rosyjska armia wyposaża irańskie drony Shahed w głowice termobaryczne, by zwiększyć siłę ataków, jak podał w sobotę amerykański "Newsweek", powołując się na ekspertyzę zespołu naukowców z Kijowa. B...	https://ocdn.eu/pulscms-transforms/1/wGsk9kpTURBXy8zZjhjYzBiMzdiZDRhZGMwY2QyZWEzNjhhYjJjN2I0YS5qcGeSlQMAzHvNDzzNCJKTBc0EsM0Cdt4AAaEwAQ	2024-11-03 10:48:32	Business Insider Polska
pl	https://wiadomosci.wp.pl/mikolaj-dorozala-nie-przyszedlem-do-ministerstwa-by-zlikwidowac-myslistwo-7087631837838080a	Mikołaj Dorożała: Nie przyszedłem do ministerstwa, by zlikwidować myślistwo - WP Wiadomości	- Myśliwi sami widzą, jaki jest ich wizerunek, jak społeczeństwo zaczyna na nich źle reagować - mówi w rozmowie z WP wi…	None	2024-11-03 05:44:05	WP Wiadomości
pl	https://przegladsportowy.onet.pl/alpinizm/dramat-w-himalajach-potwierdzaja-najgorsze-mozliwe-wiesci/hrb6fcn	Dramat w Himalajach. Potwierdzają najgorsze możliwe wieści - Przegląd Sportowy Onet	Wielka czesko-słowacka eskapada na wschodnią ścianę Langtang Lirung (7227 m) w Nepalu przerodziła się w istny dramat. Podczas schodzenia ze szczytu w szczelinę wpadł Ondrej Huserka, a rozpaczliwy apel w mediach społecznościowych wystosowali jego najbliżsi, powołując się na akcję ratunkową z udziałem Polaków. Niestety, tragiczne wieści o śmierci 34-latka potwierdziły słowackie media.	https://ocdn.eu/sport-images-transforms/1/6C_k9lBaHR0cHM6Ly9vY2RuLmV1L3B1bHNjbXMvTURBXy8wMWFjNTI4Nzg2NzE0OTI1OWYyNjlkOTdhODA4MWY5Ni5wbmeTlQMAAM0HgM0EOJMFzQSwzQJ0kwmmZDQxZDhjBt4AAqEwAaExAQ	2024-11-03 10:48:19	Przegląd Sportowy Onet
pl	https://www.tvp.info/83294856/slupsk-wypadek-w-centrum-miasta-pijany-20-latek-za-kierownica-wjechal-w-ludzi	Tragedia w Słupsku. Pijany 20-latek wjechał w grupę pieszych - TVP Info	Tragiczny wypadek w Słupsku. W centrum miasta pijany 20-latek wjechał w grupę przechodniów.  Jedna osoba nie żyje, pięć zostało rannych – informuje Radio Gdańsk.	https://s6.tvp.pl/images2/6/c/b/uid_6cbf3f0661e544e3b098d195d9c5a098_width_1079_play_0_pos_0_gs_0_height_720_tragiczny-wypadek-w-centrum-slupska-zdj-ilustracyjne-fot-shutterstock-.jpg	2024-11-03 06:38:00	TVP Info
pl	https://www.pomponik.pl/plotki/news-wpadka-ze-smiechem-prezenterki-tvn24-jest-decyzja-krrit,nId,7848583	Wpadka ze śmiechem prezenterki TVN24. Jest decyzja KRRiT - Pomponik.pl	Anna Seremak, prezenterka TVN24, znalazła się w centrum uwagi po tym, jak nie mogła powstrzymać śmiechu, opowiadając o incydencie w Bartoszycach, w którym	https://i.iplsc.com/-/000J5D3RLK2JLE6P-C461-F4.jpg	2024-11-03 12:00:18	Pomponik.pl
pl	https://dorzeczy.pl/opinie/651553/tyszka-ostro-reaguje-na-slowa-zelenskiego-pluja-nam-w-twarz.html	Tyszka ostro reaguje na słowa Zełenskiego: Plują nam w twarz - Do Rzeczy	Stanisław Tyszka skomentował wypowiedź Wołodymyra Zełenskiego. – Zachowuje się bezczelnie wobec Polski – ocenił europoseł Konfederacji.	https://img.dorzeczy.pl/img/tyszka-ostro-reaguje-na-slowa-zelenskiego-pluja-nam-w-twarz/e0/7a/7742c64146d6f34efeb3f705d570.webp	2024-11-03 11:05:00	Do Rzeczy
pl	https://legia.net/news/legia-warszawa-widzew-lodz-podtrzymac-passe-i-zblizyc-sie-do-lidera/97087	Legia Warszawa – Widzew Łódź: Podtrzymać passę i zbliżyć się do lidera - Legia.Net	Legia Warszawa ma szansę na piąte zwycięstwo z rzędu i zbliżenie się do lidera. Stołeczna drużyna zmierzy się u siebie z Widzewem Łódź, z którym przegrała ostatni mecz. Klasyk 14. kolejki Ekstraklasy już w niedzielę, 3 listopada (godz. 20:15). Transmisja w CANAL+ SPORT 3, CANAL+ ONLINE i CANAL+ 4K, my zapraszamy do śledzenia naszej relacji tekstowej na żywo.	https://legia.net/uploads/base/1/6/1693761022_jsk_6176.jpg	2024-11-03 06:10:00	Legia.Net
pl	https://wiadomosci.wp.pl/16-latek-postrzelony-przez-policjantow-szokujace-okolicznosci-7088692741966560a	16-latek postrzelony przez policjantów. Szokujące okoliczności - WP Wiadomości	Policja podaje szczegóły nocnego postrzelenia 16-latka przez policjantów z Bartoszyc. Doszło do tego podczas interwencj…	None	2024-11-03 12:47:01	WP Wiadomości
pl	https://dorzeczy.pl/opinie/651550/trzaskowski-atakuje-sikorskiego-otoczenie-wyczulo-zagrozenie.html	Trzaskowski atakuje Sikorskiego? "Otoczenie wyczuło zagrożenie" - Do Rzeczy	Kto będzie kandydatem Platformy Obywatelskiej na prezydenta? Media opisują kulisy "bratobójczej walki" i "wojny w partii".	https://img.dorzeczy.pl/img/trzaskowski-atakuje-sikorskiego-otoczenie-wyczulo-zagrozenie/e4/61/68b9aeb492dd1c0974fe9fcdf04b.webp	2024-11-03 10:08:00	Do Rzeczy
pl	https://www.fakt.pl/polityka/zaskakujacy-widok-za-plecami-trumpa-zobaczylismy-polskiego-polityka/v5gele2	Zaskakujący widok za plecami Trumpa. Zobaczyliśmy polskiego polityka - Fakt.pl	Kto zostanie prezydentem Stanów Zjednoczonych? Odpowiedź na to pytanie poznamy dopiero za kilka dni. Donald Trump i Kamala Harris nie ustają w walce o głosy. Kandydat Republikanów może liczyć na ws...	https://ocdn.eu/pulscms-transforms/1/IOLk9kuTURBXy83NDcyODgxMS0wNDJiLTQyNzAtOWUxMC05NmE1MTc4OWEwMjYuanBlZ5KVA80BTSrNCBfNBI6TBc0EsM0Cdt4AAaEwAQ	2024-11-03 07:34:03	Fakt.pl
pl	https://www.polsatsport.pl/wiadomosc/2024-11-03/tragiczna-smierc-pilkarza-na-dworcu-kolejowym-dzien-wczesniej-obchodzil-21-urodziny/	Tragiczna śmierć piłkarza na dworcu kolejowym. Dzień wcześniej obchodził 21. urodziny - polsatsport.pl	Tragedia w Serbii, gdzie w Nowym Sadzie na dworcu kolejowym zawalił się betonowy dach, w efekcie czego śmierć poniosło 14 osób, a ponad 30 zostało rannych. Wśród ofiar znalazł się 21-letni piłkarz FK Potisje, Milos Milosavljević oraz jego rok młodsza dziewczyna.	https://ipla.pluscdn.pl/dituel/cp/eh/ehs2jumk9wp8362yfvd48f1uzt2acnec.jpg	2024-11-03 09:09:00	polsatsport.pl
pl	https://tvn24.pl/swiat/wybory-prezydenckie-w-moldawii-w-niedziele-druga-tura-st8163312	Zwolenniczka integracji z Unią kontra rosyjski "koń trojański". Mołdawia wybiera - TVN24	W niedzielę w Mołdawii odbywa się druga tura wyborów prezydenckich. O najwyższy urząd walczą urzędująca prezydent Maia Sandu, zwolenniczka integracji z UE oraz były prokurator generalny Alexandr Stoianoglo, wspierany przez partię socjalistów. - Wierzę, że obywatele dokonają dobrego wyboru dla kraju – oświadczyła Sandu, oddając głos. Ostrzegła przed złodziejami, którzy "chcą kupić kraj", nawiązując do ingerencji Rosji w proces wyborczy.	https://tvn24.pl/najnowsze/cdn-zdjecie-9197008-maia-sandu-w-lokalu-wyborczym-w-kiszyniowie-ph8163758/alternates/LANDSCAPE_1280	2024-11-03 06:10:00	TVN24
pl	https://www.rybnik.com.pl/wiadomosci,ostre-przedmioty-w-halloweenowych-cukierkach-pilny-apel-slaskiej-policji,wia5-3266-60353.html	Ostre przedmioty w halloweenowych cukierkach! Pilny apel śląskiej policji - rybnik.com.pl	Ogólnopolskie media alarmują, że w kilku miastach odnotowano przypadki umieszczania ostrych przedmiotów w halloweenowych cukierkach. Stanowią zagrożenie dla zdrowia i życia dzieci. Najbliżej nas taki 	https://www.rybnik.com.pl/htimg/display/og/?relativePath=news/60353/cukierek-ostry-przedmiot_672678f40fd429_96458250.jpg	2024-11-02 19:17:27	rybnik.com.pl
pl	https://wiadomosci.wp.pl/chcial-zalozyc-sie-z-petru-o-prezydenta-nerwowa-reakcja-polityka-7088660746488576a	Chciał założyć się z Petru o prezydenta. Nerwowa reakcja polityka - WP Wiadomości	Łukasz Schreiber zaproponował zakład Ryszardowi Petru. - Załóżmy się, że każdy kandydat na prezydenta Prawa i Sprawiedl…	None	2024-11-03 10:40:34	WP Wiadomości
pl	https://kultura.onet.pl/telewizja/aktualnosci/awantura-w-programie-krzysztofa-ibisza-polegli-w-pytaniu-o-bulke/bj7vc30	Awantura w programie Krzysztofa Ibisza. Polegli w pytaniu o bułkę - Onet	Kultowe show "Awantura o kasę" z niezmiennym Krzysztofem Ibiszem na czele powróciło do łask widzów Polsatu, wywołując niemałe emocje wśród publiczności. Program, który w latach 2002-2005 gromadził przed ekranami rzesze fanów, w swojej nowej odsłonie już od pierwszych odcinków stał się tematem gorących dyskusji.	https://ocdn.eu/pulscms-transforms/1/Hj8k9kpTURBXy9lOTBmODYwOWI2OGJhZjc0NGI5ODZhYjQwYWUxMmU2Mi5wbmeTlQMABM0GKM0DdpMJpmQxYWI4YQaTBc0EsM0Cdt4AAaEwAQ/krzysztof-ibisz-w-programie-awantura-o-kase.jpg	2024-11-03 10:15:45	Onet
pl	https://tvn24.pl/tvnwarszawa/srodmiescie/warszawa-rajd-antoniego-macierewicza-po-warszawie-polityk-odniosl-sie-do-sprawy-st8163726	Antoni Macierewicz tłumaczy się z "rajdu" po Warszawie. "Samochód wtedy stał" - TVN24	None	None	2024-11-03 11:47:00	TVN24
pl	https://www.polsatnews.pl/wiadomosc/2024-11-03/hiszpanie-wsciekli-na-wladze-po-powodzi-krol-filip-vi-musial-uciekac/	Król Hiszpanii musiał uciekać. Tłum wściekły po powodzi - polsatnews.pl	Król Hiszpanii przyjechał do Walencji, na tereny dotknięte powodzią. Jego wizyta przebiegła dramatycznie: w stronę monarchy rzucano błoto, kamienie, padły też serie wyzwisk. Interweniowała policja, jednak ostatecznie monarcha i tak musiał opuścić miasto. Z wieloma gorzkimi słowami spotkał się również hiszpański premier.	https://ipla.pluscdn.pl/dituel/cp/ez/ezv3o2w4whn92434fd6fs7ne7cjjfzhd.jpg	2024-11-03 14:21:00	polsatnews.pl
pl	https://news.google.com/rss/articles/CBMiuwFBVV95cUxOZWsyR1JrOFlRYlJQcnVJYW5tMThwV0RVZmotTDQwZzBGeHpXc3p6Q2ZNZjZ4ZzZHcjdYZ2ZTQWVHZUJ3V0JramJod0V0Y2E3Sy1IQ0pxZUhXVHBGajZ4VllZRHZ1SlRWeEQyNjRCVVk0c2ppcHJ0UmtSVlJ0MDFLcldXOWtCN01DbEFWM2Z1ZTk2ajZOcGJIcVVaelFzWVVMb01meWowTXVzaVJwQV9XNDIxR2RIVVRQSERF?oc=5	Sensacyjny sondaż z "republikańskiego bastionu". Jest reakcja sztabu Donalda Trumpa - Wiadomości - Onet	None	None	2024-11-03 10:28:20	Wiadomości - Onet
pl	https://www.onet.pl/informacje/onetwiadomosci/akcja-ratunkowa-w-slowackich-tatrach-nie-zyje-polski-turysta/nmrg5xy,79cfc278	Akcja ratunkowa w Tatrach. Nie żyje mężczyzna - Onet	Grupa polskich turystów, bez niezbędnego sprzętu do wspinaczki wysokogórskiej, była prowadzona przez jednego członka grupy na Gerlach na Słowacji. Gdy przewodnik spadł w przepaść, reszta grupy utknęła na końcu drogi Tatarki — informuje słowackie Górskie Pogotowie Ratunkowe.	https://ocdn.eu/pulscms-transforms/1/c_Fk9kpTURBXy8yZGQ3NWMyZTNlNjU5OTgzZmExYmVkODg1MzY1YmFlYS5qcGeSlQMAzLvNF3DNDS-TBc0EsM0CdN4AA6EwAaExAaEzww	2024-11-03 14:00:00	Onet
pl	https://www.polsatnews.pl/wiadomosc/2024-11-03/nocny-atak-w-kijowie-drony-trafily-w-akademik-i-infrastrukture-energetyczna/	Alarm zawył dwa razy. Niespokojna noc w stolicy Ukrainy - polsatnews.pl	Rosjanie zaatakowali nocą Kijów. W kierunku ukraińskiej stolicy wycelowali drony, które doprowadziły do uszkodzenia szeregu budynków, dróg oraz sieci energetycznej. Mieszkańcy zmuszeni byli spędzić większość w nocy w schronach, ponieważ alarm przeciwlotniczy rozbrzmiewał dwukrotnie, obowiązując blisko sześć godzin.	https://ipla.pluscdn.pl/dituel/cp/ho/hocs8fm17ckzfbajdah3ovjmwq69f5ig.jpg	2024-11-03 09:15:00	polsatnews.pl
pl	https://wiadomosci.wp.pl/wojna-zastepcza-koreanczykow-seul-odpowie-kim-dzong-unowi-i-putinowi-7087554643843840a	Seul wchodzi do gry. Na horyzoncie starcie w Ukrainie - WP Wiadomości	Seul zapowiedział podjęcie "etapowych działań przeciwko Korei Północnej i Rosji w związku z pogłębiającą się współpracą wojskową". Dotychczas południowi Koreańczycy nie dostarczali broni Ukrainie. To się	https://v.wpimg.pl/MjNjMDliYgsvCDt3QxJvHmxQby0FS2FIO0h3ZkNYf1p-EmIiBQUoGCsaImoLGzgaLx09ahwFYgs-A2IyXUYpAz0aISUVRigHLA8paw1YfwgsC3kiQVh-XStHeXRcW2BSKlosaVpYflh9CX19Dl4sU2wX	2024-11-03 09:25:09	WP Wiadomości
pl	https://www.onet.pl/informacje/onetwiadomosci/niepokojacy-sondaz-obawy-o-bezpieczenstwo-polski-po-zwyciestwie-donalda-trumpa/ckxrbxx,79cfc278	Niepokojący sondaż. Obawy o bezpieczeństwo Polski po zwycięstwie Donalda Trumpa - Onet	Z najnowszego sondażu SW Research dla "Rzeczpospolitej" wynika, że ponad 43 proc. Polaków obawia się negatywnego wpływu ewentualnego zwycięstwa Donalda Trumpa w wyborach prezydenckich w USA na bezpieczeństwo naszego kraju. To głównie osoby starsze, które wyrażają największe zaniepokojenie.	https://ocdn.eu/pulscms-transforms/1/Juak9kpTURBXy8xMDE4N2MwNGFlOTQyYjQ3NThlNDYzOTdmMTEyNzExMS5qcGeSlQMAe80PZc0IqJMFzQSwzQJ03gADoTABoTEBoTPD	2024-11-03 09:50:35	Onet
pl	https://tvn24.pl/wybory-prezydenckie-2024-w-usa/aktor-harrison-ford-poparl-kamale-harris-st8163476	"Nazywam się Harrison Ford. Mam jeden głos i zamierzam go wykorzystać" - TVN24	None	None	2024-11-03 10:19:17	TVN24
pl	https://www.sport.pl/tenis/7,64987,31435189,zenujace-obrazki-podczas-meczu-swiatek-wta-to-idioci.html	Żenujące obrazki podczas meczu Świątek. "WTA to idioci" - Sport.pl	None	None	2024-11-03 13:53:00	Sport.pl
pl	https://dorzeczy.pl/opinie/651472/usa-ostrzegaja-iran-nie-bedziemy-w-stanie-powstrzymac-izraela.html	USA ostrzegają Iran: Nie będziemy w stanie powstrzymać Izraela - Do Rzeczy	Administracja prezydenta USA Joe Bidena skierowała do władz w Teheranie ostrzeżenie przed potencjalnym kolejnym atakiem na Izrael.	https://img.dorzeczy.pl/img/usa-ostrzegaja-iran-nie-bedziemy-w-stanie-powstrzymac-izraela/78/40/d5c1279fe8043874a0730c57788a.webp	2024-11-03 07:25:00	Do Rzeczy
pl	https://tvn24.pl/tvnwarszawa/ochota/warszawa-studenci-bylego-collegium-humanum-skladaja-pozew-zbiorowy-st8146705	Studenci byłego Collegium Humanum złożyli pozew zbiorowy przeciwko uczelni - TVN24	Czekają na wpisy ocen, obrony, wymieniają się pismami z uczelnią. Nie wiedzą, które semestry mają zaliczone. Sytuacja studentów byłego Collegium Humanum (dzisiaj Uczelnia Biznesu i Nauk Stosowanych Varsovia) wciąż jest niepewna, choć zaczął się już nowy rok akademicki. Część zdecydowała się na pozew zbiorowy. "Poważne wątpliwości" ma też Rzecznik Praw Obywatelskich, który zapewnia, że na bieżąco monitoruje sytuację.	https://tvn24.pl/najnowsze/cdn-zdjecie-6165148-collegium-humanum-ph8082424/alternates/LANDSCAPE_1280	2024-11-03 08:25:25	TVN24
pl	https://kultura.onet.pl/telewizja/aktualnosci/burza-w-sieci-po-rozmowie-z-zona-piotra-szczesnego-na-antenie-tvp/89z4zgy	Burza w sieci po rozmowie z żoną Piotra Szczęsnego na antenie TVP - Onet	None	None	2024-11-03 06:55:45	Onet
pl	https://wiadomosci.wp.pl/smierc-zolnierza-wot-sprawe-bada-prokuratura-7088596217498368a	Kolejny żołnierz WOT nie żyje. Głos z prokuratury - WP Wiadomości	Prokuratura w Olsztynie bada okoliczności śmierci podporucznika Łukasza Z. Ciało żołnierza Wojsk Obrony Terytorialnej znaleziono w rzece Pasłęka w Braniewie w woj. warmińsko-mazurskim.	https://v.wpimg.pl/ZDQwMzY3dSUwFTtJdkh4MHNNbxMwEXZmJFV3WHYCaHRhD2IcMF8_NjQHIlQ-QS80MAA9VClfdSUhHmIMaBw-LSIHIRsgHD8pMxIpVW1Rbyc1Q3UbdAI4czJaeRhtAHd9M0V1VzxRPCBlR35MbgZoIHMK	2024-11-03 05:18:44	WP Wiadomości
pl	https://www.fakt.pl/pieniadze/wazne-zmiany-dla-pacjentow-bedzie-duzo-latwiej-o-bezplatny-lek-w-aptece/8wm059k	Wielka zmiana w darmowych lekach. Miliony w kieszeniach pacjentów. Czekali na to od lat - Fakt.pl	Rząd szykuje rewolucję w programie darmowych leków, które dziś przysługują pacjentom w wieku do 18. roku życia i powyżej 65. roku życia. Jeśli wejdzie w życie, o receptę na bezpłatny lek będzie zna...	https://ocdn.eu/pulscms-transforms/1/jxkk9kuTURBXy80YTZlYmIxMy1mMGEyLTQxZWEtYmYzYi01NmJiZWEwMGI0ZjkuanBlZ5KVAwACzQeAzQQ4kwXNBLDNAnbeAAGhMAE	2024-11-03 07:00:00	Fakt.pl
pl	https://tvn24.pl/trojmiasto/kartuzy-pozar-urzedu-skarbowego-straty-szacowane-na-2-miliony-zlotych-st8163371	Nocny pożar urzędu skarbowego. Straty szacowane na 2 miliony złotych - TVN24	Do poważnego pożaru doszło nad ranem w Urzędzie Skarbowym w Kartuzach (woj. pomorskie). Podczas działań gaśniczych wypadkowi uległ jeden ze strażaków. Został zabrany do szpitala. 	None	2024-11-03 08:51:55	TVN24
pl	https://dorzeczy.pl/opinie/651406/blaszczak-o-tusku-jeszcze-mocniejszy-zwrot-w-kierunku-niemiec.html	Błaszczak o Tusku: Jeszcze mocniejszy zwrot w kierunku Niemiec - Do Rzeczy	Donald Tusk odniósł się do wyborów w Stanach Zjednoczonych. Pojawiły się głosy, że premier chce osłabić sojusz Polski z USA.	https://img.dorzeczy.pl/img/blaszczak-o-tusku-jeszcze-mocniejszy-zwrot-w-kierunku-niemiec/5f/78/bdb60431d8372c983c168873b7f3.webp	2024-11-02 19:15:00	Do Rzeczy
pl	https://news.google.com/rss/articles/CBMitgFBVV95cUxPejVKU0p6NC1tdVMxMnI1X3F3QTRsS04xcnlIRnpuZ3BpT0ZFc3cxeFkyN2lNUTRXcWFUanFJTFdrdXBTTEN2aTFmb0xRb3NNVmhrQ0xGRTM0T1JiVkd4aFZtUDRMYThDb0gzMG5HZzFmMnpxeDIxdzZlNlN0bGNDU1hUUVBTM0tTWUVyZ294N0czZ0NPTnBkblZaS2tMXzBOaEFUUlRrTUh0UFhBYXdmVWtnMm5RZw?oc=5	29 dzieci może zostać skazanych na śmierć w Nigerii - Wiadomości - Onet	None	None	2024-11-02 20:21:47	Wiadomości - Onet
pl	https://przegladsportowy.onet.pl/pilka-nozna/ekstraklasa/gornik-zabrze-jagiellonia-bialystok-na-zywo-wynik-i-relacja-live/0qxb4tj	Ekstraklasa: Górnik Zabrze - Jagiellonia Białystok [RELACJA NA ŻYWO] - Przegląd Sportowy Onet	Górnik Zabrze - Jagiellonia Białystok to mecz czternastej kolejki PKO Ekstraklasy. Mistrzowie Polski stają przed szansą wykorzystania wczorajszego potknięcia liderującego Lecha Poznań i zrównania się z nim punktami. Zadanie nie będzie jednak proste, bo Trójkolorowi złapali dobry rytm i chcą dziś odnieść trzecie zwycięstwo z rzędu. Co przyniesie nam ta rywalizacja? Zapraszamy na relację z pojedynku Górnik Zabrze - Jagiellonia Białystok. Początek w niedzielę, 3 listopada o godz. 14.45.	https://ocdn.eu/sport-images-transforms/1/E3pk9lGaHR0cHM6Ly9vY2RuLmV1L3B1bHNjbXMvTURBXy8wNWQzYjZiNC1hODA0LTQ4YTUtOTNlYy1hMGU3MjZjYTc0OTcuanBlZ5OVA80D7czJzQSJzQKNkwXNBLDNAnSTCaZkNDFkOGMG3gACoTABoTEB	2024-11-03 13:28:00	Przegląd Sportowy Onet
pl	https://sport.interia.pl/robert-lewandowski/news-goraco-przed-derbami-barcelony-bedzie-protest-ucierpi-tez-le,nId,7848587	Gorąco przed derbami Barcelony. Na tej decyzji ucierpi też Robert Lewandowski - Interia Sport	Kliknij i zobacz więcej.	https://i.iplsc.com/-/000IAAM7YBL4PBHF-C461-F4.jpg	2024-11-03 12:29:12	Interia Sport
pl	https://www.pomponik.pl/plotki/news-polska-gwiazda-ubrala-juz-choinke-chciala-to-zrobic-juz-w-li,nId,7848551	Polska gwiazda ubrała już choinkę. Chciała to zrobić już w... lipcu - Pomponik.pl	Magda Mielcarz od wielu lat na stałe mieszka w Stanach Zjednoczonych, a w Polsce bywa jedynie gościnnie, kiedy chce odwiedzić rodzinę lub bierze udział w	https://i.iplsc.com/-/000K0Z3F0XOL1AE5-C461-F4.jpg	2024-11-03 09:52:42	Pomponik.pl
pl	https://www.sport.pl/pilka/7,65039,31435128,pierwszy-taki-przypadek-w-tym-sezonie-mistrzowie-remisow.html	Pierwszy taki przypadek w tym sezonie. "Mistrzowie remisów" nie zawiedli - Sport.pl	None	None	2024-11-03 13:11:00	Sport.pl
pl	https://news.google.com/rss/articles/CBMipgFBVV95cUxQUDh2OTBvM3AxbVQ3UnFSMHVaTk9PVENLRDMtWk5OLXFQNFo4bWFoS2NUSjhlZ05Jc2NGaTZFSFN0bWIwSG56clZaVnBOYlZEbVNQRTZITmloWkZMc19tcWJGd2laem9vN3I3M1B0T2pNdHhTc3B3VE1ELWs1TVpMUVFONng1NkRRUUpGN1V6ai1nY2VXWVNJaFgwNGp0Y0ZTY0xwaV9n?oc=5	Tajemniczy statek w chińskim porcie. "Nietypowy kształt i rozmiar" - Wiadomości - Onet	None	None	2024-11-02 20:55:00	Wiadomości - Onet
