country_code	url	title	description	image_url	publish_date	source
pl	https://www.money.pl/gospodarka/zacznie-sie-w-styczniu-trump-nie-wycofuje-sie-ze-swojej-szokujacej-obietnicy-7091503715384288a.html	Zacznie się w styczniu? Trump nie wycofuje się ze swojej szokującej obietnicy - Money.pl	Według samego Donalda Trumpa Amerykanie dali mu "bezprecedensowy i potężny mandat", by zrealizował to, co zapowiadał w kampanii. Jedna z takich "obietnic" - masowe deportacje - wstrząsnęła częścią społeczeństwa. Eksperci ostrzegają, że jej spełnienie będzie potężnym ciosem w amerykańską gospodarkę.  	https://v.wpimg.pl/NjNiNzNiYQsvCzhJYRJsHmxTbBMnS2JIO0t0WGFYfFp-EX5VKAAiDzwMPhVgDjwfPgg5CmAZIkUvGSdVOFhhDicaPhYvEGEPIwsrHmFRd1t5CHlCL0R5WXwKY04tX3xHL1p7GGMILV97WnhJLF59CC1LMw	2024-11-11 13:42:36	Money.pl
pl	https://sport.interia.pl/iga-swiatek/news-ujawnia-prawde-o-relacjach-swiatek-i-nowego-trenera-widac-to,nId,7853384	Ujawnia prawdę o relacjach Świątek i nowego trenera. "Widać to gołym okiem" - Interia Sport	Kliknij i zobacz więcej.	None	2024-11-11 09:13:54	Interia Sport
pl	https://www.money.pl/gospodarka/kaprysny-trump-wyslal-grozne-sygnaly-w-kierunku-fed-przyspieszyloby-upadek-dolara-opinia-7091473945082816a.html	Groźne sygnały w kierunku Fed. Ten ruch Trumpa wywołałby prawdziwy wstrząs [OPINIA] - Money.pl	Donald Trump chciałby mieć większy wpływ na decyzje amerykańskiego banku centralnego. Prezydent-elekt przed wyborami wysyłał sygnał, że chciałby pozbyć się Jerome'a Powella, szefa Fed, którego sam wyznaczył. Gdyby to zrobił, to by się rynkom bardzo nie spodobało - pisze dla money.pl Piotr Kuczyński. 	https://v.wpimg.pl/ZGQyYmY0dSYwGy9edkt4M3NDewQwEnZlJFtjT3YBaHdhAWlCP1k2IiMcKQJ3VygyIRguHXdANmgwCTBCLwF1IzgKKQE4SXUiPBs8CXZRPCZnSjtcaB1ofzdLdFk9Bz9qaEhrXnQEOXRhSj0Ja1I8c2hbJA	2024-11-11 10:29:11	Money.pl
pl	https://wyborcza.pl/7,75398,31446402,fabryka-hejtu-na-sedziow-co-maja-sledczy-na-lukasza-piebiaka.html	Fabryka hejtu na sędziów. Co mają śledczy na Łukasza Piebiaka - Gazeta Wyborcza	None	None	2024-11-10 14:46:14	Gazeta Wyborcza
pl	https://wiadomosci.wp.pl/kolega-ministra-wieczorka-dostal-zlecenie-obsluguje-podlegla-mu-siec-badawcza-7090150835346144a	Kolega ministra Wieczorka dostał zlecenie. Obsługuje podległą mu sieć badawczą - WP Wiadomości	Centrum Łukasiewicz zatrudniło prawnika do prowadzenia części spraw sądowych. Wybór padł na adwokata Krzysztofa Czeszejko-Sochackiego. Jest on członkiem lewicowego stowarzyszenia "Ordynacka", a szefem stowarzyszenia	https://v.wpimg.pl/YTE4YjgxdjUkVi9ZSAN7IGcOewMOWnV2MBZjSEhJa2R1THYMDhQ8JiBENkQACiwkJEMpRBcUdjU1XXYcVlc9PTZENQseVzw5J1E9RQMaamRxVWlbSk9rMnAZbV1WHXRtIVZuR19IPTV0DDtSVhw8ZmdJ	2024-11-11 06:11:16	WP Wiadomości