country_code	url	title	description	image_url	publish_date	source
pl	https://dorzeczy.pl/kraj/656092/kosiniak-kamysz-psl-jest-przeciwko-brylka-a-rzad.html	Kosiniak-Kamysz: PSL jest przeciwko. Bryłka: A rząd? - Do Rzeczy	PSL kategorycznie się umowie Unii z Mercosur – podkreśla Władysław Kosiniak-Kamysz. Anna Bryłka pyta, jakie jest stanowisko rządu.	https://img.dorzeczy.pl/img/kosiniak-kamysz-psl-jest-przeciwko-brylka-a-rzad/51/82/4019448fb9ab60d919f098e83513.webp	2024-11-14 19:55:00	Do Rzeczy
pl	https://businessinsider.com.pl/wiadomosci/olaf-scholz-kladzie-glowe-pod-polityczny-topor-tak-wygladaja-sondaze/0esn1bd	Olaf Scholz kładzie głowę pod polityczny topór. Tak wyglądają sondaże - Business Insider Polska	Olaf Scholz położy głowę pod polityczny topór. Najpierw 16 grudnia Bundestag zagłosuje nad wotum zaufania dla jego gabinetu, co otworzy drogę do rozpisania na 23 lutego 2025 r. nowych wyborów. Sond...	https://ocdn.eu/pulscms-transforms/1/CKbk9kpTURBXy80MWE1NTc3MzZlZWMyYzIxYmE5MTNkYjk4NjRjZjhhMi5qcGeSlQMAAM0HgM0EOJMFzQSwzQJ23gABoTAB	2024-11-14 05:32:52	Business Insider Polska
pl	https://www.polsatnews.pl/wiadomosc/2024-11-14/ukrainski-general-o-krytycznej-sytuacji-na-froncie-zrzucil-wine-na-sojusznikow/	Ukraiński generał o "krytycznej" sytuacji na froncie. Zrzucił winę na sojuszników - polsatnews.pl	- Sytuację oceniam jako trudną, zaostrzającą się. W niektórych kierunkach krytyczną jak, np. w regionie kurachowskim i kupiańskim - twierdzi generał Ihor Romanenko. Ukraiński wojskowy jest przekonany, że rosyjskie sukcesy na froncie to przede wszystkim konsekwencja złych decyzji sojuszników, którzy nie wsparli wystarczająco Sił Zbrojnych Ukrainy.	https://ipla.pluscdn.pl/dituel/cp/22/223b9qw35g762wgyzrzf1nbsica2m4vq.jpg	2024-11-14 16:10:00	polsatnews.pl
pl	https://www.polsatnews.pl/wiadomosc/2024-11-15/kontrowersyjny-wybor-trumpa-denialista-szczepionkowy-sekretarzem-zdrowia/	Donalda Trump ogłosił kolejną nominację. Robert F. Kennedy Jr na czele departamentu - polsatnews.pl	Donald Trump poinformował, że sekretarzem Departamentu i Opieki Społecznej zostanie Robert F. Kennedy Jr. Prawnik, który wcześniej chciał zostać nowym lokatorem Białego Domu, nie uznaje szczepionek i jest entuzjastą teorii spiskowych.	https://ipla.pluscdn.pl/dituel/cp/ke/ke46db7xfkpj5d6mhd19jsxtoerf378g.jpg	2024-11-15 06:52:00	polsatnews.pl
pl	https://businessinsider.com.pl/wiadomosci/wiceminister-rolnictwa-informuje-o-wycofaniu-srodkow-do-deratyzacji-ze-sprzedazy/kl8wgjy	Środki do deratyzacji wycofane z OLX i Allegro. Wiceminister rolnictwa potwierdza - Business Insider Polska	Wiceminister rolnictwa Michał Kołodziejczak poinformował, że platforma OLX i Allegro zgodziły się wycofać ze sprzedaży internetowej środki do deratyzacji. Wcześniej resort zawiadomił prokuraturę o ...	https://ocdn.eu/pulscms-transforms/1/swOk9kpTURBXy9lM2ZkMWNjODVjN2U4MzIyMjc0MTJiNmVkY2ZjYWYxYy5qcGeSlQMAPs0H0M0EZZMFzQSwzQJ23gABoTAB	2024-11-14 17:12:44	Business Insider Polska
pl	https://www.onet.pl/informacje/onetlubuskie/brutalne-zabojstwo-kobiety-w-lubsku-zatrzymano-podejrzanego/z7l20x8,79cfc278	Brutalne zabójstwo kobiety w Lubsku. Zatrzymano podejrzanego - Onet	Funkcjonariusze policji zatrzymali mężczyznę podejrzanego o brutalne zabójstwo kobiety w Lubsku (woj. lubuskie) — wynika z ustaleń RMF FM. W środę 13 listopada pracownica lokalnego salonu gier została znaleziona martwa na ulicy. Na jej ciele ujawniono liczne rany kłute.	https://ocdn.eu/pulscms-transforms/1/qaMk9kpTURBXy80MmNlZmFmZjExZTQyNzIwYWI2NGMyOWIxOTY1OTRlNi5qcGeSlQMAzKrNFWDNDAeTBc0EsM0CdN4AA6EwAaExAaEzww	2024-11-15 10:16:00	Onet
pl	https://www.onet.pl/informacje/onetwiadomosci/karetka-pogotowia-dachowala-kolo-radomia-pojawilo-sie-nagranie-z-wypadku/ytjnfyj,79cfc278	Karetka pogotowia dachowała koło Radomia. Pojawiło się nagranie z wypadku - Onet	Pod Radomiem doszło do zdarzenia karetki pogotowia z samochodem osobowym. W wyniku wypadku kierowca ambulansu trafił do szpitala, z kolei drugi ratownik zmarł. Prokuratura bada okoliczności zdarzenia oraz czy w momencie wypadku karetka była pojazdem uprzywilejowanym. Miejski Reporter zamieścił nagranie ze zdarzenia.	https://ocdn.eu/pulscms-transforms/1/FmYk9kpTURBXy8wMDMwYWMzYmRlMjkxYTRmYTQyZjYwZjY3OTRhMzYzNi5wbmeSlQMAAM0HgM0EOJMFzQSwzQJ03gADoTABoTEBoTPD	2024-11-15 07:42:25	Onet
pl	https://www.money.pl/gospodarka/wolna-wigilia-w-tym-roku-apel-organizacji-biznesowych-do-premiera-tuska-zlamanie-zobowiazania-7092836381518816a.html	Wolna Wigilia w tym roku? Apel organizacji biznesowych do premiera Tuska. "Złamanie zobowiązania" - Money.pl	Na trzeciej stronie piątkowej "Rzeczpospolitej" Konfederacja Lewiatan oraz Polska Organizacja Handlu i Dystrybucji (POHiD) zamieściły apel do premiera Donalda Tuska ws. poselskiego projektu ustawy o ustanowieniu wolnej Wigilii jeszcze w tym roku. Przypominają o zobowiązaniu rządu ws. konsultacji.	https://v.wpimg.pl/ZmQ2OTA3dQwwUDlnbkh4GXMIbT0oEXZPJBB1dm4CaF1hSn97J1o2CCNXPztvVCgYIVM4JG9DNkIwQiZ7NwJ1CThBPzggSnUIPFAqMG5VY1RpUCxiJx5iWjcFYmBwAGxAaQB2NmxWblQzCikwdwpqWmEQMg	2024-11-15 06:23:50	Money.pl
pl	https://businessinsider.com.pl/gospodarka/elon-musk-spotkal-sie-z-przedstawicielem-iranu/dtsyhpd	Elon Musk spotkał się ambasadorem Iranu Amirem Saeidem Irawanim - Business Insider Polska	Elon Musk spotkał się z ambasadorem Iranu przy ONZ Amirem Saeidem Irawanim — informuje dziennik "New York Times", powołując się na irańskich urzędników. Rozmowy, które trwały nieco ponad godzinę, d...	https://ocdn.eu/pulscms-transforms/1/-Obk9kpTURBXy8yOTg3OGVhOWQ4MTAyMGQwMjA3MTVjMDMyNTU2NWYyNy5qcGeSlQMAzGXNHVHNEIOTBc0EsM0Cdt4AAaEwAQ	2024-11-15 08:56:17	Business Insider Polska
pl	https://businessinsider.com.pl/gospodarka/dobre-prognozy-od-komisji-europejskiej-polska-gospodarka-przyspiesza/yhgx6j4	Dobre prognozy od Komisji Europejskiej. Polska gospodarka przyśpiesza - Business Insider Polska	Komisja Europejska podwyższyła w piątek prognozy wzrostu PKB dla Polski. W 2024 r. ma to być 3 proc., a w 2025 r. — 3,6 proc. To dużo wyżej niż w poprzedniej, wiosennej prognozie.	https://ocdn.eu/pulscms-transforms/1/uwlk9kpTURBXy83ZDhhZDhhZmQ2NDMxODczZjI1N2E2ZDliMzc0NDRkNS5qcGeSlQMDAM0YOs0No5MFzQSwzQJ23gABoTAB	2024-11-15 09:57:02	Business Insider Polska
pl	https://www.rp.pl/polityka/art41454921-tusk-szykuje-europe-na-trumpa-planuje-reorganizacje-ue	Tusk szykuje Europę na Trumpa. Planuje reorganizację UE - Rzeczpospolita	Pomysł spotkania szefów dyplomacji Polski, Francji i Niemiec we wtorek w Warszawie miałby być wstępem do reorganizacji Unii w czasie polskiego przewodnictwa – d	https://i.gremicdn.pl/image/free/cfae335d9d37db76f0264b84a2ea2a40/?t=crop:2000:1240:nowe:0:46,resize:fill:2000:1250&ctx=preview	2024-11-15 10:19:00	Rzeczpospolita
pl	https://wiadomosci.wp.pl/smierc-polskiego-zolnierza-na-granicy-jest-nowy-trop-ws-potencjalnego-zabojcy-7092615739153344a	Migrant zabił na granicy żołnierza RP. Gdzie jest zabójca? - WP Wiadomości	Cudzoziemiec rozpoznany jako potencjalny zabójca sierż. Mateusza Sitka, pełniącego służbę na granicy z Białorusią, jest…	None	2024-11-15 13:00:50	WP Wiadomości
pl	https://www.rp.pl/polityka/art41454291-sondaz-kto-kandydatem-pis-na-prezydenta-wyborcy-tej-partii-maja-faworyta	Sondaż: Kto kandydatem PiS na prezydenta? Wyborcy tej partii mają faworyta - Rzeczpospolita	Prawo i Sprawiedliwość jeszcze nie ogłosiło swojego kandydata w wyborach prezydenckich. Sondaż Instytutu Badań Pollster wskazał, kogo w tej roli najchętniej wid	https://i.gremicdn.pl/image/free/3a5422395462a1a0717ffd5879195ca1/?t=crop:4836:2999:nowe:0:252.32858990944,resize:fill:2000:1250&ctx=preview	2024-11-15 07:00:27	Rzeczpospolita
pl	https://wiadomosci.wp.pl/nie-ma-wyroku-ws-ewy-tylman-sad-wznowil-przewod-sadowy-7092868136885216a	Śmierć Ewy Tylman. Nieoczekiwana decyzja sądu - WP Wiadomości	Sąd Okręgowy w Poznaniu zdecydował w piątek wznowić przewód sądowy dotyczący Adama Z., oskarżonego w związku ze śmierci…	None	2024-11-15 12:27:38	WP Wiadomości
pl	https://businessinsider.com.pl/gospodarka/donald-trump-wojna-rosji-z-ukraina-musi-sie-zakonczyc/q4q7dew	Co dalej z Ukrainą? Donald Trump wzywa do zakończenia konfliktu - Business Insider Polska	Prezydent elekt Donald Trump zabrał się do realizacji przedwyborczych obietnic. Szybkie zakończenie wojny w Ukrainie jest jedną z nich. Warto tutaj przypomnieć, że podczas kampanii wyborczej Trump ...	https://ocdn.eu/pulscms-transforms/1/Fxvk9kpTURBXy9iYTlkY2RhOWMyZjE0NjMxYTA5YmZkOGZiNWQ5NWZhNS5qcGeSlQMAAM0XcM0NMJMFzQSwzQJ23gABoTAB	2024-11-15 09:33:19	Business Insider Polska
pl	https://businessinsider.com.pl/wiadomosci/donald-trump-kompletuje-ludzi-padlo-kolejne-nazwisko/g57fmcj	Donald Trump kompletuje ludzi. Padło kolejne nazwisko - Business Insider Polska	Prezydent-elekt Donald Trump poinformował Doug Burgum, gubernator Dakoty Północnej, zostanie szefem Departamentu Zasobów Wewnętrznych, który nadzoruje m.in. politykę środowiskową, parki narodowe or...	https://ocdn.eu/pulscms-transforms/1/tJ1k9kpTURBXy83NzBhMzlhZTc0NTBjYWIxZjJkMWFiMWFjZDk5ZmQxMC5qcGeSlQMAzH_NEADNCQCTBc0EsM0Cdt4AAaEwAQ	2024-11-15 05:31:19	Business Insider Polska
pl	https://www.rp.pl/biznes/art41454451-kolejny-duzy-kontrakt-dla-polskiej-zbrojeniowki-co-kupuje-wojsko-polskie	Co tym razem? MON podpisuje kolejny kontrakt na uzbrojenie warte prawie 100 mln zł. - Rzeczpospolita	13 zestawów bezzałogowców obserwacyjnych FlyEye za prawie 100 mln zł - to najnowsza umowa na zakup polskiego uzbrojenia, którą podpisze resort obrony. Przez ost	https://i.gremicdn.pl/image/free/596ebd95aad5dfa1b24fb1e311298a88/?t=crop:2303:1428:nowe:0:139,resize:fill:2000:1250&ctx=preview	2024-11-15 08:19:35	Rzeczpospolita
pl	https://www.polsatnews.pl/wiadomosc/2024-11-15/latwiej-bedzie-zostac-policjantem-zmiany-w-tescie-sprawnosciowym/	Nowy policjant już nie taki sprawny. Zmiany w rekrutacji - polsatnews.pl	MSWiA reaguje na braki kadrowe w policji. Resort przygotował rozporządzenie zmieniające warunki wstąpienia do tej formacji. Ma stać się to o wiele łatwiejsze. Pomysł wywołuje kontrowersje. - Nie powinniśmy obniżać standardów jakości - mówi Andrzej Szary z NSZZ Policjantów.	https://ipla.pluscdn.pl/dituel/cp/vp/vpiqtkf56jf46f31w2gwvxzamfvz9557.jpg	2024-11-15 08:46:00	polsatnews.pl
pl	https://www.pap.pl/aktualnosci/kontrowersyjny-sklad-nowego-gabinetu-trumpa-zaskakuje-republikanow	Kontrowersyjny skład nowego gabinetu Trumpa zaskakuje Republikanów - PAP	None	None	2024-11-14 14:31:00	PAP
pl	https://www.polsatnews.pl/wiadomosc/2024-11-14/ewakuacja-tysiecy-mieszkancow-lublina-alert-rcb-apel-prezydenta-miasta/	Ewakuacja tysięcy mieszkańców Lublina. Alert RCB, apel prezydenta miasta - polsatnews.pl	W Lublinie w najbliższy piątek dojdzie do ewakuacji na kilku ulicach, w związku z czym mieszkańcy dostali alerty RCB i szczegółową instrukcję postępowania. Cała sytuacja ma związek ze znalezieniem niewybuchu.	https://ipla.pluscdn.pl/dituel/cp/rv/rvudvkm45tp9b3r7zcp7buqc739k25yb.jpg	2024-11-14 19:43:00	polsatnews.pl
pl	https://www.rmf24.pl/fakty/swiat/news-z-powodu-smogu-w-miescie-zamknieto-wszystkie-szkoly-podstawo,nId,7856074	Z powodu smogu w mieście zamknięto wszystkie szkoły podstawowe - RMF 24	None	None	2024-11-14 20:14:00	RMF 24
pl	https://www.gov.pl/web/arimr/wsparcie-kleskowe--nabory-koncza-sie-15-listopada-pieniadze-z-tytulu-strat-spowodowanych-powodzia-trafiaja-na-konta-rolnikow	Wsparcie klęskowe – nabory kończą się 15 listopada, pieniądze z tytułu strat spowodowanych powodzią trafiają na konta rolników - Gov.pl		https://www.gov.pl/photo/format/56e82ae3-6c66-4f12-9198-816f9271f1e8/resolution/1328x560	2024-11-14 12:47:27	Gov.pl
pl	https://wiadomosci.wp.pl/dzialo-sie-w-nocy-korea-bedzie-masowo-produkowac-drony-kamikadze-7092819581909952a	Działo się w nocy. Korea będzie "masowo" produkować drony kamikadze - WP Wiadomości	Wydarzyło się, gdy spałeś. Oto, co odnotowały światowe agencje w nocy z czwartku na piątek	None	2024-11-15 12:17:30	WP Wiadomości
pl	https://wiadomosci.wp.pl/lawrow-bolesnie-odczul-sankcje-nikt-nie-chce-tankowac-jego-samolotu-7092831489604576a	Ławrow w końcu odczuł sankcje. Ma problemy z lataniem - WP Wiadomości	Minister spraw zagranicznych Rosji Siergiej Ławrow skarży się na trudności z konserwacją samolotów. Z powodu sankcji "z…	None	2024-11-15 13:00:56	WP Wiadomości
pl	https://businessinsider.com.pl/wiadomosci/ojciec-rydzyk-wyprawi-huczne-urodziny-kwota-za-wynajem-sali-robi-wrazenie/zgwc9ph	Ojciec Rydzyk wyprawi huczne urodziny. Kwota za wynajem sali robi wrażenie - Business Insider Polska	Tradycją jest, że co roku, ojciec Tadeusz Rydzyk organizuje huczne urodziny Radia Maryja w Hali Widowiskowo-Sportowej w Toruniu. Nie inaczej będzie tym razem. 7 grudnia odbędzie się impreza z okazj...	https://ocdn.eu/pulscms-transforms/1/YNBk9kpTURBXy82OTY0ZjYwYWZjZGNjZTAzZmM0NGNkMjI0NjFhMmNkZS5qcGeSlQMAzGfNDOTNB0CTBc0EsM0Cdt4AAaEwAQ	2024-11-14 18:07:10	Business Insider Polska
pl	https://wiadomosci.onet.pl/warszawa/tak-wyglada-areszt-na-bialolece-do-ktorego-trafil-lukasz-zak-530-pobudka/2zsjqly	Tak wygląda areszt na Białołęce, do którego trafił Łukasz Żak. "5.30 pobudka" - Wiadomości - Onet	None	None	2024-11-15 12:39:37	Wiadomości - Onet
pl	https://wiadomosci.wp.pl/sutryk-odpowiada-nie-wreczylem-zadnej-lapowki-7092823021648832a	Sutryk odpowiada: nie wręczyłem żadnej łapówki. "Absurdalne" - WP Wiadomości	- Nie wręczyłem żadnej łapówki - oświadczył prezydent Wrocławia Jacek Sutryk, po trwających przez kilkanaście godzin cz…	None	2024-11-15 13:53:06	WP Wiadomości
pl	https://www.polsatnews.pl/wiadomosc/2024-11-15/sikorski-z-poparciem-z-niespodziewanej-strony-nowe-sondaze-przedwyborcze/	Wybory 2025. Radosław Sikorski z niespodziewanym poparciem. Nowe sondaże - polsatnews.pl	Radosław Sikorski może cieszyć się większym poparciem konserwatywnych wyborców KO - wynika z jednego z najnowszych sondaży. Z kolei inne badanie wskazuje, kogo Polacy widzieliby jako kandydata PiS w wyborach prezydenckich.	https://ipla.pluscdn.pl/dituel/cp/q6/q6hcj1nm6vmgenrh8jmpw4a35bd3nndn.png	2024-11-15 09:45:00	polsatnews.pl
pl	https://businessinsider.com.pl/wiadomosci/rzad-chce-zaostrzyc-przepisy-ruchu-drogowego-na-stole-dozywotnia-utrata-prawa-jazdy/5jkzqlb	Rząd chce zaostrzyć przepisy ruchu drogowego. Na stole dożywotnia utrata prawa jazdy - Business Insider Polska	Rząd idzie na wojnę z kierowcami, którzy prowadzą mimo zakazu lub pod wpływem alkoholu. Minister sprawiedliwości zapowiedział ułatwienie drogi do odbierania praw jazdy i przepadku samochodów.	https://ocdn.eu/pulscms-transforms/1/E-Mk9kpTURBXy9iMWFjOWUwMTljZGRhMmY5ODllOTVhMjMyNjczOGYxMy5qcGeSlQMAzLLNFlDNDI2TBc0EsM0Cdt4AAaEwAQ	2024-11-15 08:49:30	Business Insider Polska
pl	https://wiadomosci.onet.pl/kraj/zbigniew-ziobro-przeszedl-kolejna-operacje-sa-nowe-doniesienia/1bwx87t	Zbigniew Ziobro przeszedł kolejną operację. Zabieg odbył się za granicą - Wiadomości - Onet	None	None	2024-11-15 12:58:56	Wiadomości - Onet
pl	https://www.pap.pl/aktualnosci/holownia-zwyciestwo-kandydata-tuska-oznacza-wygrana-pis-w-2027-r	Hołownia: zwycięstwo "kandydata Tuska" oznacza wygraną PiS w 2027 r. - PAP	None	None	2024-11-15 08:07:00	PAP
pl	https://wiadomosci.onet.pl/warszawa/rosjanie-przemaszeruja-przez-warszawe-chca-wyrazic-swoj-sprzeciw/hnppjlt	Rosjanie przemaszerują przez Warszawę. Chcą wyrazić swój sprzeciw - Wiadomości - Onet	Żądają wycofania wojsk rosyjskich z Ukrainy, chcą postawienia Putina przed sądem i uwolnienia wszystkich więźniów politycznych. Mieszkający w Polsce Rosjanie organizują w najbliższą niedzielę przemarsz w Warszawie. To akcja solidarnościowa z ogólnoświatowym protestem planowanym przez byłych więźniów politycznych, w tym Julię Nawalną, wdowę po liderze rosyjskiej opozycji.	https://ocdn.eu/pulscms-transforms/1/ADrk9kpTURBXy9hZmE5Y2JmNWMwYjA0YTkxMDQ0NmNiYjAzNTljZWI0Ni5qcGeTlQMAzQEFzRGUzQnkkwmmMTJiMTAxBpMFzQSwzQJ23gABoTAB/tak-bylo-podczas-protestu-przeciwko-wladimirowi-putinowi-17-marca-br-w-berlinie.jpg	2024-11-15 13:10:14	Wiadomości - Onet
pl	https://www.money.pl/gospodarka/rzad-ma-plan-na-skladke-dal-juz-znac-sejmowi-7092896521735136a.html	Rząd ma plan na składkę. Dał już znać Sejmowi - Money.pl	Do Sejmu trafiło pismo z rządu zapowiadające, że wkrótce wpłynie autopoprawka do ustawy o składce zdrowotnej. Rząd ma przyjąć korektę we wtorek, a Sejm ma zająć się ustawą o składce w przyszłym tygodniu. Planowana jest m.in. obniżka składki minimalnej, na której skorzysta około milion przedsiębiorców.	https://v.wpimg.pl/ZTBlMGFhdTUjDjt0aRN4IGBWby4vSnZ2N053ZWlZaGRyFH1oIAE2MTAJPShoDyghMg06N2gYNnsjHCRoMFl1MCsfPSsnEXUxLw4oI2lRaGR1XS9ydUU-bXoKYHN3CT55IFh6JmsLPDIjCih3I1g7NXVOMA	2024-11-15 10:30:16	Money.pl
pl	https://wiadomosci.wp.pl/ponad-6000-zl-co-miesiac-prezydent-podpisal-ustawe-7092842744142784a	Ponad 6 tys. zł co miesiąc. Prezydent podpisał ustawę - WP Wiadomości	Prezydent Andrzej Duda podpisał ustawę ustanawiającą nowe zasady przyznawania świadczenia honorowego dla osób, które uk…	None	2024-11-15 13:51:26	WP Wiadomości
pl	https://wydarzenia.interia.pl/kraj/news-prawica-wychodzi-na-prowadzenie-nowy-sondaz-przelomem-dla-pi,nId,7856108	Prawica wychodzi na prowadzenie. Nowy sondaż przełomem dla PiS - Interia Wydarzenia	Kliknij i zobacz więcej.	https://i.iplsc.com/-/000K45WOX1BF92JI-C461-F4.jpg	2024-11-14 21:57:45	Interia Wydarzenia
pl	https://www.rp.pl/polityka/art41454021-wspolpracownicy-donalda-trumpa-u-rafala-trzaskowskiego-o-czym-rozmawiali	Współpracownicy Donalda Trumpa u Rafała Trzaskowskiego. O czym rozmawiali? - Rzeczpospolita	Prezydent Warszawy Rafał Trzaskowski rozmawiał o wsparciu dla Ukrainy z byłym sekretarzem ds. armii USA Ryanem D. McCarthym oraz emerytowanym generałem Jamesem 	https://i.gremicdn.pl/image/free/c9a80771247fea5105ceaf5a6a4151d0/?t=crop:5424:3364:nowe:0:126,resize:fill:2000:1250&ctx=preview	2024-11-14 21:29:09	Rzeczpospolita
pl	https://www.onet.pl/informacje/onetwiadomosci/rosyjskie-bombowce-leca-nad-ukraine-kijow-ostrzega/9cpz7q3,79cfc278	Rosyjskie bombowce lecą nad Ukrainę. Kijów ostrzega - Onet	Osiem rosyjskich bombowców strategicznych wystartowało nad ranem z lotniska Olenia w obwodzie murmańskim — poinformowały ukraińskie siły powietrzne.	https://ocdn.eu/pulscms-transforms/1/ZGEk9kpTURBXy81ZGM3NWJlYWY1MzFjN2VmOTE1ZGI5MDc1OWQxYzkxMS5qcGeSlQMAVM0Pns0Iy5MFzQSwzQJ03gADoTABoTEBoTPD	2024-11-15 07:03:00	Onet
pl	https://tech.wp.pl/rosjanie-robia-cos-dziwnego-ekspert-ocenil-co-to-znaczy,7092915866074080a	Rosjanie robią coś dziwnego. Ekspert ocenił, co to znaczy - tech.wp.pl	W ostatnim czasie Federacja Rosyjska systematycznie wykonuje loty bombowcami bez wystrzeliwania rakiet nad Ukrainą. Cyt…	None	2024-11-15 13:20:31	tech.wp.pl
pl	https://www.polsatsport.pl/wiadomosc/2024-11-15/puchar-billie-jean-king-iga-swiatek-paula-badosa-relacja-live-i-wynik-na-zywo/	Puchar Billie Jean King: Iga Świątek - Paula Badosa. Relacja live i wynik na żywo - polsatsport.pl	W piątek, a nie jak pierwotnie planowano w środę, polskie tenisistki zmierzą się z Hiszpankami i zainaugurują występ w turnieju finałowym Billie Jean King Cup w Maladze. To trzeci z rzędu występ biało-czerwonych w tej imprezie, jednak pierwszy z udziałem Igi Świątek. Relacja live i wynik na żywo meczu Iga Świątek - Paula Badosa na Polsatsport.pl.	https://ipla.pluscdn.pl/dituel/cp/rr/rr82wqtfdor978wbb6dnwh6saq2nuh41.jpg	2024-11-15 09:09:00	polsatsport.pl
pl	https://businessinsider.com.pl/wiadomosci/jak-wybor-donalda-trumpa-wplynie-na-bezpieczenstwo-polski-sondaz/pyrxk5e	Jak wybór Donalda Trumpa wpłynie na bezpieczeństwo Polski? [SONDAŻ] - Business Insider Polska	Ponowny wybór Donalda Trumpa na prezydenta USA raczej nie sprawił, że Polacy poczuli się bezpieczniej — wynika z sondażu przeprowadzonego przez IBRiS na zlecenie dziennika "Rzeczpospolita".	https://ocdn.eu/pulscms-transforms/1/C6Ak9kpTURBXy83YmEwYjEyNDVkZjU0NTI0MzM2NTkzZjZhMDM5ZTk4My5qcGeSlQMAzLXNFnvNDKiTBc0EsM0Cdt4AAaEwAQ	2024-11-14 06:20:14	Business Insider Polska
pl	https://www.tokfm.pl/Tokfm/7,103085,31462172,rosjanie-boja-sie-bazy-w-redzikowie-reaguja-nerwowo-na-zapas.html	Nerwy Putina ws. bazy w Redzikowie. Gen. Pacek wyjaśnia. "Boją się" - TOKFM.pl	None	None	2024-11-14 09:38:00	TOKFM.pl
pl	https://www.money.pl/gospodarka/nieobecnosc-w-szkole-men-szykuje-rewolucyjne-zmiany-7092867335830464a.html	Nieobecność w szkole. MEN szykuje rewolucyjną zmianę - Money.pl	Już nie wystarczy 50 proc. obecności na zajęciach, by uczeń mógł zaliczyć przedmiot. Ministerstwo Edukacji Narodowej, kierowane przez Barbarę Nowacką, przygotowuje nowe przepisy dotyczące frekwencji w szkole. Z informacji "Rzeczpospolitej" wynika, że zmiana może być rewolucyjna.	https://v.wpimg.pl/NDI1NzgzYSUoUzhJSAFsMGsLbBMOWGJmPBN0WEhLfHR5SX5VARMiITtUPhVJHTwxOVA5CkkKImsoQSdVEUthICBCPhYGA2EhJFMrHkgbLyYoVXcYBFd8InoEY04FSnppKwctHEpKeHB_BnpIUk12dygTMw	2024-11-15 08:16:00	Money.pl
pl	https://www.onet.pl/informacje/onetwiadomosci/afera-w-funduszu-sprawiedliwosci-jest-wniosek-o-areszt-dla-grzegorza-w/jm2lwh6,79cfc278	Afera w Funduszu Sprawiedliwości. Jest wniosek o areszt dla Grzegorza W. Prokuratura potwierdza - Onet	Prokurator skierował do sądu wniosek o tymczasowe aresztowanie Grzegorza W. To jest kontynuacja tego wątku szczecińskiego, który prowadziliśmy pod koniec października i o którym szeroko informowaliśmy — poinformował podczas konferencji prasowej prokurator Piotr Nowak. Zarzuty dla Grzegorza W. są pokłosiem afery w Funduszu Sprawiedliwości.	https://ocdn.eu/pulscms-transforms/1/Wggk9kpTURBXy83Mjk0MzYzZjU3NjAyMDBkZGQ5MzhjNDlkOTU2ZTk4Yi5qcGeSlQMAzIHNEADNCQCTBc0EsM0CdN4AA6EwAaExAaEzww	2024-11-15 11:22:00	Onet
pl	https://businessinsider.com.pl/gospodarka/inflacja-najwyzsza-od-grudnia-potwierdzily-sie-zle-prognozy/kdgzs75	Inflacja najwyższa od grudnia. Potwierdziły się złe prognozy - Business Insider Polska	Według najnowszego odczytu GUS inflacja w październiku wzrosła do 5 proc. rok do roku przy 6,6 proc. wzrostu rok temu w analogicznym miesiącu. Ostatni raz tak duży roczny wzrost cen miał miejsce w ...	https://ocdn.eu/pulscms-transforms/1/8QPk9kpTURBXy80YmZmMTUyNzg4YTQwZDM0OWZiODllZjI3YWJmYWM0Mi5qcGeSlQMAzOnNFpnNDLaTBc0EsM0Cdt4AAaEwAQ	2024-11-15 09:02:51	Business Insider Polska
pl	https://www.polsatsport.pl/wiadomosc/2024-11-14/liga-narodow-portugalia-polska-kiedy-mecz-o-ktorej-godzinie/	Liga Narodów: Portugalia - Polska. Kiedy mecz? O której godzinie? - polsatsport.pl	Trzy zwycięstwa, pięć remisów i sześć porażek to bilans meczów piłkarskiej reprezentacji Polski z Portugalią. Bramki: 14-21 na niekorzyść Biało-Czerwonych. Mistrz Europy z 2016 roku będzie rywalem drużyny trenera Michała Probierza w spotkaniu Ligi Narodów w Porto. Kiedy mecz Portugalia - Polska? O której godzinie? Sprawdź poniżej.	https://ipla.pluscdn.pl/dituel/cp/dg/dgch33fuqk24aix8gkm2bado1g7vr3du.JPG	2024-11-15 07:44:00	polsatsport.pl
pl	https://plejada.pl/newsy/pracowala-przed-laty-z-monika-olejnik-teraz-komentuje-wielka-wpadke-gwiazdy-tvn24/mp9w3pj	Pracowała przed laty z Moniką Olejnik. Teraz zabrała głos o wielkiej "wpadce" gwiazdy TVN24 - Plejada.pl	None	None	2024-11-14 15:06:49	Plejada.pl
pl	https://news.google.com/rss/articles/CBMi4gFBVV95cUxOc0w0OWpSRDFXeFJqQll3dUlkdkROSG9OM25kbVM0LWFuRjE1cWZjSGQ2RmdpOEZSRUJqNzNWby1yTlR6emNfbF9zeDU3R1AzN3VCTk1yTkdyVGo2Nl9NZjQ3MTVuenBfTUJZQlVYTDJ5a0lxQTczaVROdGJlZmY5UVZLTE01dGZmMm1LbDRpclk2N1lyX1ptUUhZOFR0ZmlMclBsWERTS2Y5WjhTbF9yYTYzX1Z3cW42clFBSlRCZmJSY2YwTzZSY3Bzdm8xZk8xVklzNmFmT2JrRGNjOTktSVhR?oc=5	Zaskakująca decyzja prokuratury w sprawie śmierci Jolanty Brzeskiej. Śledczy komentują - Onet	Prokuratura Regionalna w Gdańsku umorzyła śledztwo w sprawie śmierci Jolanty Brzeskiej w marcu 2011 r. w Parku Kultury Powsin w Warszawie. — Zdajemy sobie sprawę, że logika wskazuje na to, że mogło to być zabójstwo. Jednakże zgromadzony materiał nie potwierdził, ani nie wykluczył żadnej z głównych przyjętych wersji tego zdarzenia — powiedział prokurator regionalny.	https://ocdn.eu/pulscms-transforms/1/eSQk9kpTURBXy8xNTE4OGNmZjBiZTI2YjhkMjk4ZGZlZjBjMThlZGZkOC5qcGeSlQMAzKHNFB3NC1CTBc0EsM0CdN4AA6EwAaExAaEzww	2024-11-14 10:17:00	Onet
pl	https://www.sport.pl/pilka/7,65037,31462776,reprezentacja-polski-ma-problem-tak-chodzi-o-lewandowskiego.html	Burza wokół Lewandowskiego w kadrze. Tak wygląda prawda - Sport.pl	None	None	2024-11-15 06:24:25	Sport.pl
pl	https://www.money.pl/gospodarka/ochlodzenie-na-rynku-najmu-mieszkan-widac-odplyw-uchodzcow-z-ukrainy-7092870154394560a.html	Ochłodzenie na rynku najmu mieszkań. Widać odpływ uchodźców z Ukrainy - Money.pl	Sytuacja na rynku najmu mieszkań wraca do normalności - informuje piątkowy "Puls Biznesu". Gazeta pisze, że uspokoił się zarówno popyt, jak i podaż, a właściciele są bardziej otwarci na negocjacje cen. Na początku 2025 r. analitycy spodziewają się odbicia	https://v.wpimg.pl/YmE5Mjg2dgwkVztZSEl7GWcPbwMOEHVPMBd3SEgDa111TX1FAVs1CDdQPQVJVSsYNVQ6GklCNUIkRSRFEQN2CSxGPQYGS3YIKFcoDkhUal52VH1aUh87DCFTYF4DAmtAfAR0UkoKaFsgBC8LXgBhW3QXMA	2024-11-15 08:29:09	Money.pl
pl	https://www.o2.pl/informacje/musze-sie-przyznac-tiktoker-pokazal-nagranie-z-warszawy-7092593740336096a	"Muszę się przyznać". Tiktoker pokazał nagranie z Warszawy - o2	Tiktoker "Crawly" w ostatnich dniach zorganizował kontrowersyjną akcję z niszczeniem dwóch samochodów, dodatkowo zaatakował przechodnia gaśnicą i hałasował w metrze. Wszystko w grupie nieletnich zachwyconych...	https://v.wpimg.pl/ODkxYWVlYCUKGi9keRdtMElCez4_TmNmHlpjdXldeXRbAGhnYFpgIgIUPCUzHCBqDAosJzcbP2obFHY2JgVgMlpXPT4lHCMlElc8OjQJK2sPSj1vZFQtckZNaWNhQXt3XUh0bm9ceWkOG2gyZFR2dQodPDZ0EQ	2024-11-14 13:38:16	o2