country_code	url	title	description	image_url	publish_date	source
pl	https://wyborcza.pl/7,75399,31429427,niezle-wiesci-dla-harris-z-nowych-sondazy-i-poparcie-od-schwarzenegerra.html	"Cztery kolejne lata tego g...a". Schwarzenegger nie ma wątpliwości, kogo poprzeć w wyborach prezydenckich - Gazeta Wyborcza	None	None	2024-10-31 05:34:53	Gazeta Wyborcza
pl	https://sport.tvp.pl/83253151/widzew-lodz-z-awansem-w-pucharze-polski-lechia-zielona-gora-mogla-sprawic-niespodzianke	Widzew Łódź z awansem w Pucharze Polski. Lechia Zielona Góra mogła sprawić niespodziankę - TVP SPORT	Skrót z meczu 1/16 finału Pucharu Polski pomiędzy Lechią Zielona Góra (Betclic 3 Liga) a Widzewem Łódź (PKO BP Ekstraklasa).	https://s6.tvp.pl/images2/6/9/7/uid_69708253b471406d8149ca8aa4dd8504_width_1280_play_0_pos_0_gs_0_height_720_lechia-widzew-fot-pap.jpg	2024-10-31 14:54:00	TVP SPORT
pl	https://przegladsportowy.onet.pl/pilka-nozna/liga-mistrzow/a-jednak-to-wtedy-wojciech-szczesny-ma-zadebiutowac-w-barcelonie/vedtcm9	A jednak! To wtedy Wojciech Szczęsny ma zadebiutować w Barcelonie - Przegląd Sportowy Onet	Przełom w Barcelonie! Wojciech Szczęsny ma w końcu zadebiutować w drużynie 27-krotnych mistrzów Hiszpanii — donosi "El Nacional". Polak ma wreszcie zmienić Inakego Penę w bramce FC Barcelona i zadebiutować w arcyważnym meczu swojego nowego klubu — już 6 listopada w starciu z Crveną zvezdą w Lidze Mistrzów. Ten mecz będzie kluczowy dla samego Szczęsnego, jeśli chce przekonać do siebie Hansiego Flicka. Hiszpanie jednak już mówią o tym, że Barca nie chce przedłużyć umowy z Polakiem. Oto szczegóły.	https://ocdn.eu/sport-images-transforms/1/zhRk9lBaHR0cHM6Ly9vY2RuLmV1L3B1bHNjbXMvTURBXy8xN2FkOGU1M2IxZjE0NTk5MjcxNjlkMGJmZDE3NWViOS5qcGeTlQPNB5fNARLNBvLNA-qTBc0EsM0CdJMJpmQ0MWQ4YwbeAAKhMAGhMQE	2024-10-31 16:05:14	Przegląd Sportowy Onet
pl	https://tvn24.pl/polska/wybory-prezydenckie-2025-jacek-sasin-byly-wicepremier-i-minister-aktywow-panstwowych-o-potencjalnych-kandydatach-pis-u-st8161433	Grupa kandydatów "zawęziła się". Sasin mówi, kogo zabrakło - TVN24	- W tej chwili w naszej partii jest już niezbyt wielu potencjalnych kandydatów na prezydenta, ta grupa się zawęziła, to jest mniej niż pięć osób - powiedział w "Kropce nad i" w TVN24 Jacek Sasin z PiS, były wicepremier i były minister aktywów państwowych. Potwierdził, że w tym gronie nie ma Mateusza Morawieckiego. Dodał, że decyzja w sprawie kandydata może być ogłoszona w listopadzie.	https://tvn24.pl/najnowsze/cdn-zdjecie-5206795-jacek-sasin-ph8161454/alternates/LANDSCAPE_1280	2024-10-31 19:38:10	TVN24
pl	https://businessinsider.com.pl/wiadomosci/izraelski-wywiad-iran-przygotowuje-atak-na-izrael-z-iraku/k1cewxs	Iran zaatakuje Izrael z terytorium sąsiadującego państwa. Tak twierdzi amerykański portal - Business Insider Polska	Według izraelskiego wywiadu Iran przygotowuje się w nadchodzących dniach do ataku na Izrael z terytorium Iraku, prawdopodobnie jeszcze przed wyborami prezydenckimi w USA, jak podał w czwartek porta...	https://ocdn.eu/pulscms-transforms/1/zNrk9kpTURBXy83YmQ0NTRhNDM0NjY0MDdlYmFmZDNiNjUwNzdiMGQzMS5qcGeSlQMAzK7NFfDNDFiTBc0EsM0Cdt4AAaEwAQ	2024-10-31 19:33:55	Business Insider Polska
pl	https://www.money.pl/gospodarka/leczenie-resortowego-kaca-czyli-co-dalej-z-kredytem-na-start-7087632974695136a.html	Leczenie resortowego kaca, czyli co dalej z "Kredytem na start" - Money.pl	Wizerunkowy restart programu, odłożenie go na kolejny rok lub całkowita rezygnacja z pomysłu - to scenariusze, które aktualnie są na tapecie po dymisji wiceministra rozwoju odpowiedzialnego za budzący kontrowersje program dopłat do kredytów mieszkaniowych. Do tego dochodzą koalicyjne przepychanki, bo Lewica i Polska 2050 są zadeklarowanymi wrogami programu.	https://v.wpimg.pl/Y2IzOTZhdlMoGDlndRN7RmtAbT0zSnUQPFh1dnVZawJ5An97PAE1VzsfPzt0DytHORs4JHQYNR0oCiZ7LFl2ViAJPzg7EXZXJBgqMHVYaQJ4SCxkaEU7AipNYmBpXz0fKE98ZXddYQF7Siw2aVFvU39YMg	2024-10-31 14:33:01	Money.pl
pl	https://wiadomosci.onet.pl/kraj/klotnia-w-kropce-nad-i-prosze-pana-za-chwile-pan-opusci-program/8rvv4s0	Awantura w "Kropce nad i". "Proszę pana, za chwilę pan opuści program" - Wiadomości - Onet	None	None	2024-10-31 19:47:46	Wiadomości - Onet
pl	https://www.polsatnews.pl/wiadomosc/2024-10-31/tak-zle-nie-bylo-od-lat-rosnie-liczba-ognisk-wscieklizny/	Tak źle nie było od lat. Rośnie liczba ognisk wścieklizny - polsatnews.pl	Rośnie liczba ognisk wścieklizny - poinformowały władze województwa lubelskiego. Choć przypadki te pojawiają się także w innych regionach Polski, 10 na 12 obszarów zarażenia występuje właśnie na wschodzie kraju. Wojewoda Krzysztof Komorski wyznaczył obszary zagrożenia. Rzeczniczka Wojewódzkiego Inspektoratu Weterynarii przekazała, że takiej sytuacji nie było od lat.	https://ipla.pluscdn.pl/dituel/cp/ms/mstsrx6aeipphc3y5brpbjdkj33wf9gc.jpg	2024-10-31 18:01:00	polsatnews.pl
pl	https://www.polsatnews.pl/wiadomosc/2024-10-31/co-z-nagrodami-z-loterii-buddy-jest-oswiadczenie-dla-zwyciezcow/	Co z nagrodami z loterii "Buddy"? "Nie ma możliwości" - polsatnews.pl	Dzień przed zatrzymaniem przez CBŚP, Kamil L., youtuber o pseudonimie Budda przeprowadził livestreama, podczas którego jego widzowie wygrywali luksusowe samochody, dom oraz pieniądze. Głos w sprawie przekazania nagród zabrało wydawnictwo Influi, które wydało e-booki będące losami na loterię.	https://ipla.pluscdn.pl/dituel/cp/zg/zgkcowxnc3a464e29bqucopfadvmfr4b.jpg	2024-10-31 19:28:00	polsatnews.pl
pl	https://wiadomosci.onet.pl/pogoda/cyklon-martyna-coraz-blizej-polski-nadciaga-wichura-mamy-prognoze-pogoda/538295q	Cyklon Martyna coraz bliżej Polski. Nadciąga wichura. Mamy prognozę [POGODA] - Wiadomości - Onet	None	None	2024-10-31 18:01:24	Wiadomości - Onet
pl	https://wiadomosci.wp.pl/pis-z-dystansem-do-macierewicza-poslowie-udaja-ze-go-bronia-7087654051158752a	PiS z dystansem do Macierewicza. Posłowie udają, że go bronią - WP Wiadomości	PiS niechętnie broni Antoniego Macierewicza. Posłowie robią to w mediach, bo muszą. Wielu z nich wie, że dawny szef pod…	None	2024-10-31 15:40:46	WP Wiadomości
pl	https://www.rp.pl/wybory-w-usa/art41384401-dr-hab-wlodzimierz-batog-szala-przechylila-sie-na-korzysc-donalda-trumpa-amerykanie-chca-zmian	Wybory prezydenckie w USA. Kto jest bliżej wygranej? Opinia eksperta - Rzeczpospolita	Oczekiwanie na zmiany w Stanach Zjednoczonych jest tak duże, że wydaje się, iż wyborcom nie zależy już na tym, kto je przeprowadzi. Oni chcą, żeby coś drgnęło, 	https://i.gremicdn.pl/image/free/8048b8bd93ae9fc4d044cfc235ebd239/?t=crop:3235:2006:nowe:0:9,resize:fill:2000:1250&ctx=preview	2024-10-31 13:19:00	Rzeczpospolita
pl	https://www.polsatnews.pl/wiadomosc/2024-10-31/bedzie-wniosek-o-wotum-nieufnosci-dla-minister-sytuacja-jest-skrajnie-krytyczna/	Będzie wniosek o wotum nieufności dla minister. "Sytuacja jest dramatyczna" - polsatnews.pl	- Nie mamy tutaj innego instrumentu niż tylko zażądać zmiany ministra zdrowia, a takie żądanie jest w naszej sytuacji prawnej po prostu niczym innym jak wnioskiem o wotum nieufności dla pani minister Izabeli Leszczyny i my takie wotum złożymy na najbliższym posiedzeniu Sejmu - zapowiedział Jarosław Kaczyński.	https://ipla.pluscdn.pl/dituel/cp/7r/7rctf95no5mos1wjgx1b7e2zbzw42fta.jpg	2024-10-31 12:02:00	polsatnews.pl
pl	https://www.money.pl/gospodarka/nowelizacja-budzetu-przedsiebiorca-bije-na-alarm-wychodzenie-z-deficytu-nawet-7-lat-7087670455053056a.html	Nowelizacja budżetu. Przedsiębiorca bije na alarm. "Wychodzenie z deficytu nawet 7 lat" - Money.pl	Rząd przedstawił projekt nowelizacji budżetu na 2024 r. Deficyt budżetowy wzrośnie do 240,3 miliarda zł. Janusz Jankowiak z JJ Consulting wskazuje na dwa scenariusze: zaostrzenie ścieżki dostosowań fiskalnych w 2025 roku lub wydłużenie okresu wychodzenia z procedury nadmiernego deficytu z 4 do 7 lat.	https://v.wpimg.pl/ZmExZWQ4dQwkGixkfk94GWdCeD44FnZPMFpgdX4FaF11AGp4N102CDcdKjh_UygYNRktJ39ENkIkCDN4JwV1CSwLKjswTXUIKBo_M35WPgx2SGtgMxltWXIZd2NgBTlAfU9sbnwAPgl0Tjw2YFE-VXxaJw	2024-10-31 15:31:12	Money.pl
pl	https://sport.interia.pl/siatkowka/news-szly-po-swoje-a-potem-zapasc-polskie-siatkarki-podniosly-sie,nId,7847732	Szły po swoje, a potem trzęsienie ziemi. Zapaść polskich siatkarek w hicie - Interia Sport	Kliknij i zobacz więcej.	https://i.iplsc.com/-/000K0R6P5P4I8K69-C461-F4.jpg	2024-10-31 19:10:18	Interia Sport
pl	https://tvn24.pl/polska/ruszyly-prace-w-ramach-tarczy-wschod-tusk-pierwsze-roboty-przy-granicy-z-rosja-st8161525	Ruszyły prace w ramach Tarczy Wschód. "Pierwsze roboty przy granicy z Rosją" - TVN24	Premier Donald Tusk poinformował na platformie X, że ruszyły prace przy budowie Tarczy Wschód. Do wpisu dołączył zdjęcie przedstawiające - jak wynika z opisu - "pierwsze roboty przy granicy z Rosją".	None	2024-10-31 21:24:50	TVN24
pl	https://wiadomosci.onet.pl/kraj/sprawa-skory-jak-panstwo-probowalo-zrobic-z-roberta-j-potwora/vn3esep	Pióro bażanta i ślady na duszy. Sprawa "Skóry". Jak państwo próbowało zrobić z Roberta J. potwora - Wiadomości - Onet	None	None	2024-10-31 16:22:00	Wiadomości - Onet
pl	https://wiadomosci.onet.pl/swiat/awaria-w-elektrowni-jadrowej-w-zaporozu-agencja-energii-atomowej-reaguje/e3gcgz7	Awaria w elektrowni jądrowej w Zaporożu. Agencja Energii Atomowej reaguje - Wiadomości - Onet	W elektrowni jądrowej Zaporoże w Ukrainie trwają prace naprawcze w jednym z reaktorów po wykryciu wycieku wody. Międzynarodowa Agencja Energii Atomowej (MAEA) zapewnia, że nie ma bezpośredniego zagrożenia dla bezpieczeństwa jądrowego. Dyrektor generalny MAEA Rafael Grossi zwrócił jednak uwagę na jedno z największych zagrożeń dla elektrowni jądrowych w Ukrainie w czasie wojny.	https://ocdn.eu/pulscms-transforms/1/UM3k9kpTURBXy85MTJjNTM5YjllYmVhNTkwMzcyOTIwOWYyYWFhNmE1Yy5qcGeTlQMAzQJCzRWszQwzkwmmZWI4ODRjBpMFzQSwzQJ23gABoTAB/elektrownia-zaporoze.jpg	2024-10-31 22:05:06	Wiadomości - Onet
pl	https://www.onet.pl/informacje/onetwiadomosci/zbigniew-ziobro-pokazal-wezwanie-taka-kartka-bylaby-nawet-zabawna/9j2kzyz,79cfc278	Zbigniew Ziobro pokazał pismo, jakie otrzymał. "Ta kartka byłaby nawet zabawna..." - Onet	Były minister sprawiedliwości i prokurator generalny Zbigniew Ziobro zamieścił w mediach społecznościowych zdjęcie wezwania na komisję śledczą do spraw Pegasusa. Nie omieszkał  przy tym skomentować całej sytuacji w ostrych słowach. "Posłowie podszywający się pod nieistniejącą komisję poniosą za to odpowiedzialność karną" — podkreślił.	https://ocdn.eu/pulscms-transforms/1/V6vk9kpTURBXy80ZDEwZjg4NmE1MzgxN2I2NmRhZGMzZDk2ZjAzNzM2Mi5qcGeSlQMAAM0GQM0DhJMFzQSwzQJ03gADoTABoTEBoTPD	2024-10-31 18:30:00	Onet
pl	https://wiadomosci.wp.pl/jest-areszt-dla-dwoch-podejrzanych-w-sprawie-funduszu-sprawiedliwosci-7087593724775168a	Sąd "uwzględnił w całości". Areszt dla podejrzanych ws. FS - WP Wiadomości	"Sąd Rejonowy dla Warszawy-Mokotowa w Warszawie uwzględnił dziś w całości wniosek prokuratora i zastosował wobec podejr…	None	2024-10-31 10:14:09	WP Wiadomości
pl	https://spidersweb.pl/2024/10/searchgot-chatgpt-openai-google-wyszukiwarka-sztuczna-inteligencja.html	Oto najpotężniejsza wyszukiwarka na rynku. Spełnił się koszmar Google - Spider's Web	Oto najpotężniejsza wyszukiwarka na rynku. Spełnił się koszmar Google	https://ocs-pl.oktawave.com/v1/AUTH_2887234e-384a-4873-8bc5-405211db13a2/spidersweb/2024/09/searchgpt-pierwsi-testerzy.jpg	2024-10-31 19:25:17	Spider's Web
pl	https://sport.interia.pl/iga-swiatek/news-ostrzezenie-dla-igi-swiatek-podczas-wta-finals-to-nie-sa-per,nId,7847706	Ostrzeżenie dla Igi Świątek podczas WTA Finals. "To nie są perfekcyjne warunki" - Interia Sport	Kliknij i zobacz więcej.	None	2024-10-31 16:46:42	Interia Sport
pl	https://wiadomosci.onet.pl/politico/nie-ma-znaczenia-kto-wygra-w-usa-europa-juz-przegrala/0tb6xpy	Nie ma znaczenia, czy wygra Donald Trump, czy Kamala Harris. Europa już przegrała [OPINIA] - Wiadomości - Onet	Wizja powrotu Donalda Trumpa do Białego Domu niepokoi wielu europejskich polityków. Tak naprawdę mają oni jednak większy powód do zmartwień. Zamiast zastanawiać się, kto zostanie kolejnym prezydentem USA, powinni pomyśleć, jak poradzą sobie sami na arenie międzynarodowej. Niewygodna prawda jest bowiem taka, że amerykańskie zainteresowanie Starym Kontynentem od 30 lat słabnie na rzecz Azji — i nie zmieni tego ani Donald Trump, ani Kamala Harris. Jeśli Europa nic z tym nie zrobi, spotka ją duży wstrząs.	https://ocdn.eu/pulscms-transforms/1/L1pk9kpTURBXy80ZDFhNTE2Y2YwNWRmZmVlM2E4ZTU1MTQ5MDE0MjM1Ni5qcGeTlQMAzKDNFALNC0GTCaY3MmMwN2IGkwXNBLDNAnbeAAGhMAE/prezydent-usa-joe-biden-i-premier-japonii-fumio-kishida-w-waszyngtonie-10-kwietnia-2024-r.jpg	2024-10-31 17:57:24	Wiadomości - Onet
pl	https://tvn24.pl/swiat/po-skradzionych-wyborach-nie-bedzie-odmrozenia-dla-gruzji-st8159634	Po "skradzionych wyborach" nie będzie odmrożenia dla Gruzji - TVN24	Komisja Europejska zawiesiła proces akcesyjny z Gruzją i nie wznowi go, jeśli kraj nie zacznie przestrzegać wartości Unii Europejskiej. Jednym z warunków stawianych Tbilisi jest wyjaśnienie nieprawidłowości podczas ubiegłotygodniowych wyborów parlamentarnych. W odpowiedzi na ich wyniki Gruzini wyszli na ulice w proteście przeciwko - jak to określono - "skradzionym wyborom". Gruzińska opozycja jest przekonana, że za zwycięstwem Gruzińskiego Marzenia stoi Moskwa.	https://tvn24.pl/najnowsze/cdn-zdjecie-3030434-komisja-europejska-twierdzi-ze-gruzja-zeszla-z-drogi-do-unii-europejskiej-ph8159633/alternates/LANDSCAPE_1280	2024-10-31 07:09:09	TVN24
pl	https://www.chillizet.pl/kultura/jakie-znaczenie-ma-dzien-wszystkich-swietych-wyjasnia-ksiadz	Ks. Łukasz Wiśniewski: "Nasi zmarli bliscy potrzebują modlitwy, a nie drogich zniczy" - Chillizet	Pierwsze listopadowe dni są czasem wspomnień o naszych zmarłych bliskich. W tym czasie cmentarze przeżywają oblężenie, a groby uginają się pod ciężarem zniczy. Ksiądz Łukasz Wiśniewski MIC ze Zgromadzenia Księży Marianów przypomina, jakie jest prawdziwe znaczenie Dnia Wszystkich Świętych i Dnia Zadusznego.	https://gfx.chillizet.pl/var/g3-chillizet-2/storage/images/kultura/jakie-znaczenie-ma-dzien-wszystkich-swietych-wyjasnia-ksiadz/22104916-1-pol-PL/Ks.-Lukasz-Wisniewski-Nasi-zmarli-bliscy-potrzebuja-modlitwy-a-nie-drogich-zniczy_full-hd.jpg	2024-10-31 15:08:16	Chillizet
pl	https://businessinsider.com.pl/wiadomosci/ile-zarabiaja-lekarze-powyzej-100-tys-zl-miesiecznie-zarabia-moze-250/s1vy3v7	Ile zarabiają lekarze? "Powyżej 100 tys. zł miesięcznie zarabia może 250" - Business Insider Polska	Minister zdrowia wskazała na zarobki lekarzy sięgające nawet blisko 300 tys. zł miesięcznie, a środowisko lekarskie odpowiada. Według prezesa Naczelnej Izby Lekarskiej, na stawki powyżej 100 tys. z...	https://ocdn.eu/pulscms-transforms/1/gNEk9kpTURBXy9jNTlkM2IwNTNmYTk1YTliMTA1MzMxZDc1MzBlZmM5Zi5qcGeSlQMAO80H0M0EZZMFzQSwzQJ23gABoTAB	2024-10-31 07:57:30	Business Insider Polska
pl	https://dorzeczy.pl/kraj/650701/czarnek-kandydatem-pis-na-prezydenta-kaczynski-odpowiada.html	Czarnek kandydatem PiS na prezydenta? Kaczyński odpowiada - Do Rzeczy	Czy Przemysław Czarnek ma szansę zostać kandydatem Prawa i Sprawiedliwości na prezydenta? O to zapytany został w czwartek lider tej partii Jarosław Kaczyński.	https://img.dorzeczy.pl/img/czarnek-kandydatem-pis-na-prezydenta-kaczynski-odpowiada/a3/8f/c1a00bffb277d6cbd651eb2bee43.webp	2024-10-31 13:19:00	Do Rzeczy
pl	https://wydarzenia.interia.pl/kraj/news-zandberg-ma-oferte-dla-tuska-jestem-gotow-wejsc-do-rzadu-w-k,nId,7847896	Zandberg ma ofertę dla Tuska. "Jestem gotów wejść do rządu w każdej chwili" - Interia Wydarzenia	Kliknij i zobacz więcej.	None	2024-10-31 18:36:28	Interia Wydarzenia
pl	https://www.polsatnews.pl/wiadomosc/2024-10-31/niebezpieczna-sytuacja-na-dworcu-w-berlinie-jest-polski-watek/	Niebezpieczna sytuacja na dworcu w Berlinie. Jest polski wątek - polsatnews.pl	Niebezpieczna sytuacja na dworcu kolejowym w Berlinie. Znaleziono tam torbę z materiałami wybuchowymi. W sprawie pojawił się również polski wątek.	https://ipla.pluscdn.pl/dituel/cp/2e/2etrj53cnvf7ry5c14njoi84xc6ohgrw.jpg	2024-10-31 13:56:00	polsatnews.pl
pl	https://www.money.pl/gospodarka/takich-danych-w-rosji-nie-bylo-od-25-lat-oto-skutki-wojny-putina-7087716768246528a.html	Takich danych w Rosji nie było od 25 lat. Oto skutki wojny Putina - Money.pl	Obroty handlowe pomiędzy Rosją a Unią Europejską wyniosły w czerwcu 4,9 mld euro, czyli najmniej od września 1999 r. - informował w sierpniu "Kommiersant". W październiku Eurostat podał, że od napaści Rosji na Ukrainę wartość importu z Rosji do krajów UE spadła aż o 87 proc.	https://v.wpimg.pl/NGU2NzkwYSY0UDhJRAxsM3cIbBMCVWJlIBB0WERGfHdlSn5VDR4iIidXPhVFEDwyJVM5CkUHImg0QidVHUZhIzxBPhYKDmEiOFArHkROLSZjVnsYClp3dDBXY05TQC9qbAZ3TkYTeSJtC3ofXUB3d2QQMw	2024-10-31 19:07:09	Money.pl
pl	https://wiadomosci.onet.pl/kraj/zmarli-w-2024-r-ich-smierc-nas-poruszyla-zdjecia/2gyccv7	Oni odeszli w 2024 r. Zapisali się w zbiorowej pamięci - Wiadomości - Onet	None	None	2024-10-31 18:00:17	Wiadomości - Onet
pl	https://www.fakt.pl/pieniadze/nowe-1600-plus-dla-wybranych-mozna-juz-korzystac-z-wakacji-skladkowych/bh7nx3y	Nowe 1600 plus dla wybranych. Rusza już 1 listopada - Fakt.pl	Pracujący na własny rachunek od 1 listopada mogą korzystać z wakacji składkowych. Reforma, która ma przynieść ulgę pracującym na swoim, kryje w sobie pułapki. Kto skorzysta z wakacji, owszem, z czę...	https://ocdn.eu/pulscms-transforms/1/wnfk9kuTURBXy8yMTllODgxMS1lZjBjLTQ2ZDYtYWRmNS1lY2JjMjgwMGIyNWMuanBlZ5KVAwEAzQn9zQWfkwXNBLDNAnbeAAGhMAE	2024-10-31 12:20:00	Fakt.pl
pl	https://www.onet.pl/informacje/onetwiadomosci/donald-tusk-komentuje-sprawe-pawla-szopy-wbil-szpile-mateuszowi-morawieckiemu/j5mdxwc,79cfc278	Donald Tusk komentuje sprawę Pawła Szopy. Wbił szpilę Mateuszowi Morawieckiemu - Onet	Paweł Szopa usłyszał w czwartek zarzuty m.in. działania w zorganizowanej grupie przestępczej oraz prania brudnych pieniędzy. Ma to związek ze zleceniami, jakie jego firma Red is Bad, otrzymywała od Rządowej Agencji Rezerw Strategicznych za czasów, gdy premierem był Mateusz Morawiecki. Donald Tusk na portalu X skomentował aferę i ocenił, że poseł PiS zaczyna rozumieć, co znaczy nazwa firmy Pawła Szopy.	https://ocdn.eu/pulscms-transforms/1/wakk9kpTURBXy8xZWQ1MjIxNTQyOGNkYzYyODVlN2IwZGU5OWZiZDRiYi5qcGeSlQMAAM0GKM0DdpMFzQSwzQJ03gADoTABoTEBoTPD	2024-10-31 16:57:00	Onet
pl	https://news.google.com/rss/articles/CBMirAFBVV95cUxNc25YVmNOZmJibXREVFJ3Njc1WXJvRTFfZnUySjZ0WllCQ0g3ZFpfTFN3LWtDb19VODdkWkpUUGVnbFNzdTR5R3FPTTRteGlSUEY0V0M4OTVkMFhyS1l2dTdJSlJ6RGtpaGcwWVdkLVhsNkJkZ0YtNU9nLXdhYnlQVkZFMGRnc1RObVdIbXBzdmFGc1lJRUp1RUUyWEQtbEU3OXVhRy0xRkpaVkx0?oc=5	Dramatyczne doniesienia z Walencji. Gwałtowny wzrost liczby ofiar - polsatnews.pl	None	None	2024-10-31 15:45:00	polsatnews.pl
pl	https://www.fakt.pl/wydarzenia/kogo-zaatakowali-ukraincy-to-nie-byli-komandosi-z-korei-nowe-fakty/6nl3ejn	Kogo zaatakowali Ukraińcy? To nie byli komandosi z Korei. Nowe fakty - Fakt.pl	Rosjanie wykorzystają nowo przybyłe wojska z Korei Północnej do natarcia na kierunku donieckim. Zapowiedział to Andriej Kowalenko, szef ukraińskiego Centrum Przeciwdziałania Dezinformacji w czwarte...	https://ocdn.eu/pulscms-transforms/1/mxdk9kuTURBXy83YjY4MDFlZC0xYjhmLTQ3MGQtOWEzNi00ODQ1MWFiNmVlM2UuanBlZ5KVA80BpsxPzQQ5zQJgkwXNBLDNAnbeAAGhMAE	2024-10-31 20:30:51	Fakt.pl
pl	https://dorzeczy.pl/kraj/650845/ukraina-krytykuje-polske-sikorski-odpowiada-zelenskiemu.html	Ukraina krytykuje Polskę. Sikorski odpowiada Zełenskiemu - Do Rzeczy	Zrobiliśmy więcej, niż jakikolwiek inny kraj – oświadczył szef MSZ Radosław Sikorski, odpowiadając na krytykę prezydenta Ukrainy Wołodymyra Zełenskiego pod adresem Polski.	https://img.dorzeczy.pl/img/ukraina-krytykuje-polske-sikorski-odpowiada-zelenskiemu/6f/cd/0f67bf6451470db17bfc68c0e8af.webp	2024-10-31 18:57:00	Do Rzeczy
pl	https://www.polsatnews.pl/wiadomosc/2024-10-31/program-lepsza-polska-wigilia-wolna-od-pracy/	"Reprezentujecie korporacje". Emocje w studiu ws. wolnej Wigilii - polsatnews.pl	Czy Wigilia powinna być wolna od pracy? Głosy w tej sprawie są podzielone. Podobnie było w studiu Polsat News. - Nie stanie się nic wielkiego, jeżeli będziemy mieli w Polsce wolny dzień 24 grudnia - powiedziała Paulina Matysiak. Innego zdania był Ryszard Petru, który jest przeciwny tworzeniu dodatkowego dnia wolnego od pracy. - Nie stać nas na dodatkowy dzień wolny - powiedział.	https://ipla.pluscdn.pl/dituel/cp/az/az47mzn8ca3yaj72db8hdg7k4t3x1y33.jpg	2024-10-31 20:03:00	polsatnews.pl
pl	https://www.polsatnews.pl/wiadomosc/2024-10-31/zaklocenia-sygnalu-na-morzu-baltyckim-finlandia-wskazuje-na-rosje/	Zakłócenia sygnału na Morzu Bałtyckim. Finlandia wskazuje na Rosję - polsatnews.pl	Fińska Straż Przybrzeżna od kwietnia obserwuje zakłócenia w systemach nawigacji, przez które statki gubią się na Morzu Bałtyckim. Władze podejrzewają, że za wszystkim stoi Rosja, która w ten sposób chce uniknąć sankcji nałożonych na sprzedaż ropy.	https://ipla.pluscdn.pl/dituel/cp/i4/i43bqs89fubngopusmzcgqpkt9q297c5.jpg	2024-10-31 19:24:00	polsatnews.pl
pl	https://tvn24.pl/polska/grzegorz-braun-adam-bodnar-przekazal-szefowej-parlamentu-europejskigo-robercie-metsoli-wniosek-ws-immunitetu-st8161110	Wniosek o uchylenie immunitetu Grzegorza Brauna u przewodniczącej Parlamentu Europejskiego - TVN24	Adam Bodnar, minister sprawiedliwości i prokurator generalny, przekazał do przewodniczącej Parlamentu Europejskiego Roberty Metsoli wniosek o uchylenie immunitetu europosła Konfederacji Grzegorza Brauna. Poinformowała o tym jego rzeczniczka Anna Adamiak. Braun podejrzany jest łącznie o popełnienie siedmiu przestępstw.	https://tvn24.pl/najnowsze/cdn-zdjecie-757147-grzegorz-braun-w-europarlamencie-ph8147771/alternates/LANDSCAPE_1280	2024-10-31 15:27:50	TVN24
pl	https://www.onet.pl/informacje/onetwiadomosci/rosjanie-posuwaja-sie-do-przodu-na-donbasie-zajeli-trzy-miejscowosci/1cly61t,79cfc278	Rosja kontroluje kolejne tereny. Niepokojące informacje z obwodu donieckiego - Onet	Siły rosyjskie zajmują kolejne tereny w obwodzie donieckim na wschodzie Ukrainy. Jak informuje ukraiński projekt DeepState, prowadzący mapę działań wojennych, Rosjanie przesunęli się w głąb okupowanych terytoriów.	https://ocdn.eu/pulscms-transforms/1/2vXk9kpTURBXy9kNjQxZjdiNTllYmZhYzY2YmYwYjVhNDI3MzZjNDk2Zi5qcGeSlQMAe80PYM0IppMFzQSwzQJ03gADoTABoTEBoTPD	2024-10-31 10:35:00	Onet
pl	https://www.polsatnews.pl/wiadomosc/2024-10-31/trump-zaskoczyl-wsiadl-do-smieciarki-i-mowil-o-portorykanczykach/	Z samolotu prosto do śmieciarki. "Jak wam się podoba?" - polsatnews.pl	- Kocham Portoryko i Portorykańczyków, a oni mnie. Żaden prezydent nie zrobił dla Portoryko więcej niż ja - mówił Donald Trump siedząc w śmieciarce. Nawiązał do afery, która wybuchła po występie komika na jego wiecu. Artysta stwierdził, że Portoryko jest wyspą śmieci, co z kolei spotkało się z ostrą reakcję Joe Bidena.	https://ipla.pluscdn.pl/dituel/cp/ie/ie63c1aghmxh1idv6qhgniyej4sdvw18.jpg	2024-10-31 11:39:00	polsatnews.pl
pl	https://businessinsider.com.pl/wiadomosci/kamala-harris-opowiada-sie-za-ukraina-i-polska/0g20pjs	"Stanę po stronie Polski". Kamala Harris z przekazem dla Polonii - Business Insider Polska	"Będę stała po stronie naszych sojuszników, w tym Polski, by przeciwstawiać się agresorom i będę pracować nad tym, by Ukraina zwyciężyła" — napisała wiceprezydentka USA Kamala Harris w liście do pr...	https://ocdn.eu/pulscms-transforms/1/pdWk9kpTURBXy8yZWQ2N2Q3MTE1MDg4OWU4NmE5MDZiYzAyZWEzMWU3Mi5qcGeSlQMAAM0H0M0EZZMFzQSwzQJ23gABoTAB	2024-10-30 16:38:42	Business Insider Polska
pl	https://www.polsatnews.pl/wiadomosc/2024-10-30/antoni-macierewicz-odpowiada-na-zarzuty-donald-tusk-broni-rosyjskiej-agentury/	Antoni Macierewicz odpowiada na zarzuty. "Donald Tusk broni rosyjskiej agentury" - polsatnews.pl	- Przecież to jest absurd, co generał Stróżyk mówi. On to mówi to w kategoriach propagandowych. Zobaczymy, co zostanie przekazane do prokuratury i wtedy będę chętnie odpowiadał - stwierdził Antoni Macierewicz, odnosząc się do rekomendacji komisji ds. rosyjskich wpływów złożenia zawiadomienia do prokuratury przeciwko byłemu szefowi MON.	https://ipla.pluscdn.pl/dituel/cp/cc/ccg2ud2tx7q9sjjmtd6jtzfjw2qrees6.jpg	2024-10-30 17:59:00	polsatnews.pl
pl	https://www.onet.pl/informacje/onetwiadomosci/spiecie-dziennikarza-z-jaroslawem-kaczynskim-skierowalbym-pana-do-moskwy/hff2q2x,79cfc278	Spięcie dziennikarza z Jarosławem Kaczyńskim. "Skierowałbym pana do Moskwy" - Onet	Jarosław Kaczyński w czasie konferencji, odbywającej się w siedzibie Prawa i Sprawiedliwości, odniósł się do sprawy raportu dotyczącej prac podkomisji smoleńskiej. — Mam w tej sprawie pogląd całkowicie wyrobiony — mówił, odpowiadając na pytanie, czy czuje się oszukany przez Antoniego Macierewicza. — To był zamach, kto go dokładnie zorganizował, to jest kwestia do wyjaśnienia — dodał. Doszło również do spięcia z dziennikarzem pytającym o katastrofę smoleńską. Radomir Wit z TVN24 został nazwany "protuskowym".	https://ocdn.eu/pulscms-transforms/1/kI3k9kpTURBXy8zYTZlYjExMjIwYTkyNGY5NWQ0MDJhNDNmNTIxMThjMS5qcGeSlQMAzLTNFoDNDKiTBc0EsM0CdN4AA6EwAaExAaEzww	2024-10-31 12:20:31	Onet
