country_code	url	title	description	image_url	publish_date	source
pl	https://www.pap.pl/aktualnosci/marsz-niepodleglosci-przejdzie-ulicami-stolicy-trasa-przemarszu	Marsz Niepodległości przejdzie ulicami stolicy [TRASA PRZEMARSZU] - PAP	None	None	2024-11-11 07:19:00	PAP
pl	https://businessinsider.com.pl/wiadomosci/donald-trump-dzwonil-do-andrzeja-dudy-polski-prezydent-zdradza-o-czym-rozmawiali/kcl8q0f	Donald Trump dzwonił do Andrzeja Dudy. Polski prezydent zdradza, o czym rozmawiali - Business Insider Polska	Wczesnym wieczorem polskiego czasu prezydent Andrzej Duda rozmawiał telefonicznie z Donaldem Trumpem, prezydentem-elektem USA. Głowa polskiego państwa ujawnia, czego dotyczyła konwersacja.	https://ocdn.eu/pulscms-transforms/1/FbUk9kpTURBXy9hYWQ2MzAzMjEzZDg0ZWNiNDJmMDA5MGJiNjBlZDAzNS5qcGeSlQMAPs0H0M0EZZMFzQSwzQJ23gABoTAB	2024-11-11 19:03:19	Business Insider Polska
pl	https://www.prezydent.pl/aktualnosci/ordery-i-odznaczenia/odznaczenia-panstwowe-z-okazji-narodowego-swieta-niepodleglosci,93857	Odznaczenia państwowe z okazji Narodowego Święta Niepodległości - Prezydent.pl	None	None	2024-11-11 08:24:51	Prezydent.pl
pl	https://www.money.pl/pieniadze/trudny-poniedzialek-dla-zlotego-polska-waluta-mocno-sie-oslabila-7091592128642016a.html	Trudny poniedziałek dla złotego. Polska waluta mocno się osłabiła - Money.pl	W trakcie poniedziałkowej sesji na rynku walutowym złoty mocno tracił do głównych walut: dolara amerykańskiego, euro, franka szwajcarskiego i funta brytyjskiego. Jedną z przyczyn gorszych notowań naszej waluty może być dzień wolny od pracy ze względu na święto narodowe.	https://v.wpimg.pl/YmY0ZmE5dgw4Uixeak57GXsKeAQsF3VPLBJgT2oEa11pSGpCI1w1CCtVKgJrUisYKVEtHWtFNUI4QDNCMwR2CTBDKgEkTHYINFI_CWoHYVtpAmsIdxhrD20Ed1kmAm9AOFRpVGgEag5rATgLcVM4VDsSJw	2024-11-11 18:30:37	Money.pl
pl	https://kielce.naszemiasto.pl/swieto-niepodleglosci-2024-w-kielcach-defilada-apel-pamieci/ar/c1-9832623	Święto Niepodległości 2024 w Kielcach. Defilada, apel pamięci, piękne uroczystości patriotyczne na Placu Wolności - Kielce NaszeMiasto.pl	None	None	2024-11-11 12:36:28	Kielce NaszeMiasto.pl
pl	https://www.sport.pl/pilka/7,65039,31456485,boniek-az-wybuchl-dostalo-sie-marciniakowi-to-jest-nie-do.html	Boniek aż wybuchł. Dostało się Marciniakowi. "To jest nie do pomyślenia" - Sport.pl	None	None	2024-11-11 21:12:00	Sport.pl
pl	https://dorzeczy.pl/kraj/654802/zolnierze-uczcili-swieto-niepodleglosci-sa-zdjecia.html	Żołnierze uczcili Święto Niepodległości. Są zdjęcia - Do Rzeczy	Żołnierze przy granicy polsko-białoruskiej uczcili Święto Niepodległości. Szef MON Władysław Kosiniak-Kamysz pokazał wyjątkowe zdjęcia.	https://img.dorzeczy.pl/img/zolnierze-uczcili-swieto-niepodleglosci-sa-zdjecia/57/56/f6356a591aa3c1116f43670cffda.jpeg	2024-11-11 21:35:00	Do Rzeczy
pl	https://www.rmf24.pl/regiony/krakow/news-viii-ogolnopolskie-spiewanie-bialo-czerwonych-przebojow-z-rm,nId,7853363	VIII Ogólnopolskie Śpiewanie Biało-Czerwonych Przebojów z RMF FM [ZAPIS RELACJI] - RMF 24	None	None	2024-11-11 08:59:00	RMF 24
pl	https://www.polsatnews.pl/wiadomosc/2024-11-11/zolnierze-z-innych-krajow-na-wojne-w-ukrainie-ke-wyjasnia/	Nowa strategia w wojnie? Bruksela stanowczo ws. doniesień - polsatnews.pl	- Nie podjęto decyzji o wysłaniu wojsk UE do Ukrainy - powiedział rzecznik KE Peter Stano. W ten sposób zareagował na medialne doniesienia, mówiące o tym, że Unia Europejska zamierza rozmieścić żołnierzy w Ukrainie. W ostatnich dniach pojawiają się informacje, że prezydent elekt USA Donald Trump może wezwać wojska europejskie i brytyjskie do ustanowienia strefy buforowej między Rosją a Ukrainą.	https://ipla.pluscdn.pl/dituel/cp/3s/3s9yzkpumt83u31cj17s973eo9c8qvcm.jpg	2024-11-11 18:31:00	polsatnews.pl
pl	https://tvn24.pl/polska/jaroslaw-kaczynski-i-kilkudziesieciu-politykow-pis-na-marszu-niepodleglosci-w-warszawie-st8175099	Jarosław Kaczyński i kilkudziesięciu polityków PiS dołączyło do marszu w Warszawie - TVN24	Jarosław Kaczyński, Ryszard Terlecki, Przemysław Czarnek, Karol Nawrocki, Maciej Wąsik, Mariusz Kamiński, Daniel Obajtek, Barbara Nowak - to część polityków Prawa i Sprawiedliwości, którzy wzięli udział w Marszu Niepodległości organizowanym przez narodowców. Prezes PiS ostatni raz w marszu wziął udział w 2018 roku. 	https://tvn24.pl/najnowsze/cdn-zdjecie-7617234-jaroslaw-kaczynski-na-marszu-niepodleglosci-ph8175129/alternates/LANDSCAPE_1280	2024-11-11 18:08:00	TVN24
pl	https://www.policja.pl/pol/aktualnosci/252797,Nominacje-generalskie-w-Palacu-Prezydenckim.html	Nominacje generalskie w Pałacu Prezydenckim - Policja.pl	W przeddzień Narodowego Święta Niepodległości, 10 listopada 2024 r. o godz. 19.00 w Pałacu Prezydenckim odbyła się uroczystość wręczenia nominacji generalskich funkcjonariuszom Policji, Państwowej Straży Pożarnej i żołnierzom Wojska Polskiego.	https://www.policja.pl/dokumenty/zalaczniki/1/oryginal/1-438453.jpg	2024-11-10 23:36:54	Policja.pl
pl	https://businessinsider.com.pl/wiadomosci/sprzeczne-doniesienia-w-sprawie-rozmowy-putina-z-trumpem/nztez1f	Rosja zaprzecza. Sprzeczne doniesienia w sprawie rozmowy Putina z Trumpem - Business Insider Polska	Kreml zaprzeczył doniesieniom, jakoby Władimir Putin rozmawiał z prezydentem elektem USA Donaldem Trumpem po jego zwycięstwie w wyborach w zeszłym tygodniu.	https://ocdn.eu/pulscms-transforms/1/f5ik9kpTURBXy8xOGI1ZmRjNzVjMDYzODM3YTlhNzRhYTA4OTM1MzYxNi5qcGeSlQMAzK3NExnNCr6TBc0EsM0Cdt4AAaEwAQ	2024-11-11 12:41:43	Business Insider Polska
pl	https://www.plotek.pl/plotek/7,111485,31456448,widzowie-masakruja-koncert-tvp-z-okazji-swieta-niepodleglosci.html	Widzowie masakrują koncert TVP z okazji Święta Niepodległości. "Nędza i smutactwo" - Plotek.pl	None	None	2024-11-11 20:57:00	Plotek.pl
pl	https://www.polsatnews.pl/wiadomosc/2024-11-11/11-listopada-zapamietam-na-zawsze-grozna-kolizja-z-udzialem-polityka-ko/	"11 listopada zapamiętam na zawsze". Groźna kolizja z udziałem polityka KO - polsatnews.pl	Kochani, 11 listopada zapamiętam na zawsze - to był mój pierwszy tak poważny wypadek - napisał Piotr Kandyba, dodając zdjęcie rozbitego samochodu. Poseł Koalicji Obywatelskiej był uczestnikiem kolizji drogowej do jakiej doszło w Piasecznie.	https://ipla.pluscdn.pl/dituel/cp/67/67f95dvs8b25i64gwtfdt85uhnnom1m6.jpg	2024-11-11 21:30:00	polsatnews.pl
pl	https://www.rp.pl/opinie-polityczno-spoleczne/art41432381-przemyslaw-prekiel-rafal-trzaskowski-albo-nikt-czy-po-w-wyborach-prezydenckich-czeka-chichot-historii	Czy Rafał Trzaskowski powtórzy błąd Bronisława Komorowskiego? - Rzeczpospolita	Jeśli zaplecze Rafała Trzaskowskiego zlekceważy kandydata PiS i już po wygranych prawyborach w KO uwierzy, że wybory prezydenckie są w zasadzie rozstrzygnięte, 	https://i.gremicdn.pl/image/free/a445c34b9588ffaddef0709e0612e477/?t=crop:6000:3721:nowe:0:279,resize:fill:2000:1250&ctx=preview	2024-11-11 18:52:00	Rzeczpospolita
pl	https://www.polsatnews.pl/wiadomosc/2024-11-11/otwarcie-bazy-antyrakietowej-w-polsce-kapitalne-znaczenie-w-odstraszaniu/	Nowa baza rakietowa w Polsce. Generał wskazał na "kapitalne odstraszanie" - polsatnews.pl	- Baza ma kapitalne znaczenie w odstraszaniu, w czymś co jest najważniejsze dzisiaj - twierdzi Bogusław Pacek komentując otwarcie bazy antyrakietowej w Redzikowie. Emerytowany generał, w programie Gość Wydarzeń, podkreślił, że jest przekonany, że tego typu inwestycja to ważny krok w rozbudowywaniu globalnego bezpieczeństwa.	https://ipla.pluscdn.pl/dituel/cp/32/32kqiywy3p14uobbvqvxpnnak9j63erh.jpg	2024-11-11 21:14:00	polsatnews.pl
pl	https://www.tokfm.pl/Tokfm/7,103086,31448482,wybor-trumpa-to-ostatni-akord-ale-nie-tylko-ue-stoi-przed.html	Wybór Trumpa to "ostatni akord". Nie tylko UE stoi przed wyzwaniem. "Nie może się okazać miękiszonem" - TOK FM	None	None	2024-11-11 18:44:00	TOK FM
pl	https://www.goal.pl/ekstraklasa/slask-wroclaw-jacek-magiera-zostanie-zwolniony-kto-nowym-trenerem/	Śląsk już szuka następcy Jacka Magiery. Wiadomo, o jaki rynek chodzi! - Goal.pl	Śląsk Wrocław w najbliższym czasie najprawdopodobniej pożegna się z Jackiem Magierą. Klub już rozgląda się za nowym szkoleniowcem.	https://www.goal.pl/wp-content/uploads/2024/11/jacek-magiera-1.jpg	2024-11-11 17:14:00	Goal.pl
pl	https://dorzeczy.pl/opinie/654778/chlodne-przyjecie-holowni-obelgi-rechot-buczenie.html	Chłodne przyjęcie Hołowni. "Obelgi, rechot, buczenie" - Do Rzeczy	– Myśleli, że podjeżdża Andrzej Duda, ale kiedy zobaczyli, że z samochodu wychodzę ja – zaczęło się wycie – relacjonował marszałek Sejmu.	https://img.dorzeczy.pl/img/chlodne-przyjecie-holowni-obelgi-rechot-buczenie/78/ca/2418ba3f2481b4daxxc708b5c8a3.webp	2024-11-11 20:06:00	Do Rzeczy
pl	https://kobieta.onet.pl/wiadomosci/molestowanie-seksualne-na-camino-de-santiago-powszechnym-zjawiskiem/ly6rpnv	Molestowanie seksualne na trasie Camino de Santiago. Kobiety boją się o swoje życie - Onet Kobieta	Kobiety samotnie pokonujące Camino de Santiago opowiedziały o molestowaniu seksualnym, jakiego doświadczyły na trasie pielgrzymki. Do ataków dochodziło na bezludnych obszarach wiejskich. "The Guardian" dotarł do relacji dziewięciu kobiet. Jednak o atakach na pielgrzymujące kobiety, które kończyły się nawet ich śmiercią, media donosiły już wcześniej.	https://cdn.kobieta.onet.pl/1/u8jk9lBaHR0cHM6Ly9vY2RuLmV1L3B1bHNjbXMvTURBXy81NDFhZmY1OGM3OWQzY2QwYzhmNGM3ZTc5M2I3OTkzYS5qcGeSlQMAbM0NiM0HnJMFzQSwzQJ23gACoTAHoTEE	2024-11-11 17:12:00	Onet Kobieta
pl	https://tvn24.pl/rzeszow/rzeszow-swieto-niepodleglosci-balon-z-bialo-czerwona-flaga-wypuszczony-nad-miastem-st8174165	Balon z biało-czerwoną flagą nad Rzeszowem - TVN24	None	None	2024-11-11 09:25:02	TVN24
pl	https://www.pap.pl/aktualnosci/obchody-swieta-niepodleglosci-policja-podaje-liczbe-interwencji	Obchody Święta Niepodległości. Policja podaje liczbę interwencji - PAP	None	None	2024-11-11 21:15:00	PAP
pl	https://wiadomosci.onet.pl/kraj/tak-rezim-aleksandra-lukaszenki-sledzi-opozycje-agenci-mieli-w-polsce-specjalne/55p6nby	Tak reżim Aleksandra Łukaszenki śledzi opozycję. Agenci mieli w Polsce specjalne zadanie - Wiadomości - Onet	None	None	2024-11-12 04:29:47	Wiadomości - Onet
pl	https://wiadomosci.onet.pl/warszawa/makabryczny-wypadek-pod-radomiem-nie-zyje-nastolatek-sa-ranni/ywyl4s3	Makabryczny wypadek pod Radomiem. Nie żyje nastolatek z Bułgarii - Wiadomości - Onet	W niedzielę po godz. 22 w Skaryszewie (woj. mazowieckie) doszło do wypadku, w którym życie stracił 15-letni obywatel Bułgarii, poinformowała Ochotnicza Straż Pożarna. 17-letni kierowca audi bez prawa jazdy, jadąc z nadmierną prędkością, stracił kontrolę nad pojazdem i uderzył w betonowe ogrodzenie — podał portal Echo Dnia.	https://ocdn.eu/pulscms-transforms/1/a-kk9kpTURBXy8zYTkyYmI0Y2Y0MTNhYzkyOGM0Mzc5MWJkNzExNjQyZC5qcGeTlQMAPs0H0M0EZZMJpjY4YmQ1OQaTBc0EsM0Cdt4AAaEwAQ/wypadek-w-skaryszewie.jpg	2024-11-11 22:07:26	Wiadomości - Onet
pl	https://wiadomosci.onet.pl/swiat/uciekinierzy-z-korei-pln-przekazali-materialy-ukraincom-wsrod-nich-nagrania/l65hyvm	Uciekinierzy z Korei Płn. przekazali materiały Ukraińcom. Wśród nich nagrania - Wiadomości - Onet	Grupa byłych żołnierzy z Korei Północnej, która zdołała uciec i znaleźć azyl w Korei Południowej, przekazała Ukrainie materiały propagandowe mające na celu skłonienie północnokoreańskich żołnierzy walczących u boku Rosji do dezercji. Jak donosi "Korea Times", Korpus Propagandy Dezerterów dostarczył ukraińskim siłom oraz ambasadzie w Seulu ulotki i nagrania audio zawierające instrukcje dla żołnierzy z Pjongjangu.	https://ocdn.eu/pulscms-transforms/1/lZPk9kpTURBXy9iYWZkNzgzOWU3MGU3MjZmZmJiOWQzZjNhMTdmMmYzYy5qcGeTlQMAzIzNEXrNCdSTCaY4NzJmOTAGkwXNBLDNAnbeAAGhMAE/kim-dzong-un.jpg	2024-11-11 20:21:48	Wiadomości - Onet
pl	https://wiadomosci.onet.pl/pogoda/zimowa-pogoda-ze-sniegiem-nadejdzie-w-nocy-wiemy-gdzie-zrobi-sie-bialo/h5ztgvd	Śnieg nadejdzie pod osłoną nocy. Wiemy, gdzie krajobrazy mogą się zabielić [POGODA] - Wiadomości - Onet	Dziś w ciągu dnia w pogodzie niewiele się zmieni. W dalszym ciągu dominować mają niskie chmury i mgły, w których temperatura tylko nieznacznie przekroczy 0 st. C. W nocy spodziewane są opady śniegu. Nie będą one co prawda duże, ale gdzieniegdzie na wschodzie i południu krajobrazy staną się białe. Na drogach zrobi się bardzo ślisko.	https://ocdn.eu/pulscms-transforms/1/SNHk9kpTURBXy9kNGU1N2UxMjgxZmY4ZDc3MzAwYTBmYjBlNTY0YTIwMy5wbmeTlQMAzGTND__NCP-TCaYyODQ4YjkGkwXNBLDNAnbeAAGhMAE/snieg-i-marznacy-deszcz-pojawia-sie-podrygi-zimy-screen-onet-pogoda.jpg	2024-11-12 04:03:00	Wiadomości - Onet
pl	https://www.onet.pl/informacje/onetwiadomosci/deportacje-ulaskawienia-i-zemsta-plan-donalda-trumpa-na-pierwszy-dzien-prezydentury/knwy90z,79cfc278	Deportacje, ułaskawienia i zemsta. Plan Donalda Trumpa na pierwszy dzień prezydentury - Onet	— Nie będę dyktatorem — poza pierwszym dniem — mówił prezydent elekt Donald Trump podczas kampanii wyborczej, podkreślając, że będzie miał dużo do zrobienia. Jak wskazuje Asociated Press, wśród pierwszych działań, które ma zamiar podjąć, są m.in. rozpoczęcie masowych deportacji migrantów i ułaskawienie osób aresztowanych za udział w zamieszkach w Kapitolu 6 stycznia 2021 r.	https://ocdn.eu/pulscms-transforms/1/93gk9kpTURBXy80MmMxMGNiNjVlMDY2OGI1Zjg5MjYwNzgwMjAzNjU1Ny5qcGeSlQMAP80H0M0EZZMFzQSwzQJ03gADoTABoTEBoTPD	2024-11-11 10:29:28	Onet
pl	https://businessinsider.com.pl/wiadomosci/zmiany-dla-kierowcow-limit-predkosci-w-gore-ale-bedzie-tez-zaostrzenie-przepisow/ejmnj0b	Ważne zmiany dla kierowców. Limit prędkości w górę, ale będzie też zaostrzenie przepisów - Business Insider Polska	Ministerstwo Infrastruktury szykuje podniesienie dopuszczalnej prędkości dla ciągników. Inne proponowane zmiany to utrata prawa jazdy za znaczne przekroczenie prędkości poza obszarem zabudowanym i ...	https://ocdn.eu/pulscms-transforms/1/gY4k9kpTURBXy8zNDlhZTc2MDNmMmRmNGUzOTVhN2M4ZGUwYzE5ZWI5Mi5qcGeSlQMAzKvNFWDNDAaTBc0EsM0Cdt4AAaEwAQ	2024-11-11 13:27:03	Business Insider Polska
pl	https://polskieradio24.pl/artykul/3445296,maja-plan-do-tego-chca-namowic-bidena-przed-odejsciem-putin-sie-wscieknie	Mają plan, do tego chcą namówić Bidena przed odejściem. Putin się wścieknie? - PolskieRadio24.pl	Premier Wielkiej Brytanii Keir Starmer i prezydent Francji Emmanuel Macron mają pomysł na powstrzymanie Donalda Trumpa przed ograniczeniem wsparcia dla Ukrainy. Chcą przekonać Bidena do tego, by dał Kijowowi zezwolenie na uderzenia w głąb Rosji rakietami Storm Shadow.	https://static.prsa.pl/images/412927a8-1052-4dde-96a1-d30216570cf0.jpg	2024-11-11 08:24:00	PolskieRadio24.pl
pl	https://www.infor.pl/prawo/pomoc-spoleczna/niepelnosprawni/6771071,renta-socjalna-kwota-wniosek-nowy-dodatek-dopelniajacy-jakie-zmian.html	Renta socjalna: kwota, wniosek, nowy dodatek dopełniający. Jakie zmiany w 2025 r.? - INFOR.pl	None	None	2024-11-11 12:24:00	INFOR.pl
pl	https://wiadomosci.onet.pl/kraj/stanowcze-slowa-gen-kukuly-to-czy-wybuchnie-wojna-zalezy-od-nas/yzh0ttb	Gen. Wiesław Kukuła: to, czy i kiedy wybuchnie wojna, w pewnym sensie zależy od nas - Wiadomości - Onet	None	None	2024-11-12 04:51:37	Wiadomości - Onet
pl	https://wiadomosci.onet.pl/swiat/wielkie-protesty-w-belgradzie-chca-dymisji-rzadu-i-prezydenta/qxwrfdn	"To nie był wypadek". Wielkie protesty w Belgradzie. Chcą dymisji rządu i prezydenta - Wiadomości - Onet	Tysiące demonstrantów zgromadziły się w poniedziałek wieczorem w Belgradzie przed siedzibą rządu Serbii. Żądali jego dymisji po śmierci 14 osób w katastrofie budowlanej na dworcu kolejowym w Nowym Sadzie. — Teraz albo nigdy, absolutna władza to absolutna odpowiedzialność — powiedzieli Polskiej Agencji Prasowej uczestnicy protestu.	https://ocdn.eu/pulscms-transforms/1/iBCk9kuTURBXy9kOTk3MWFjMS00NDQxLTRhY2YtYjI2My0xOTFjMzBiZWVlMTkuanBlZ5OVAwDMa80Nqs0HspMJpjdkYTRjNwaTBc0EsM0Cdt4AAaEwAQ/serbia-tysiace-demonstrantow-zadalo-dymisji-rzadu-po-tragedii-w-nowym-sadzie.jpg	2024-11-12 05:47:37	Wiadomości - Onet
pl	https://wiadomosci.onet.pl/swiat/spektakularny-wynik-lidera-wegierskiej-opozycji-viktor-orban-ma-powody-do-obaw/gsd5q9g	"Spektakularny" wynik lidera węgierskiej opozycji. Viktor Orban ma powody do obaw - Wiadomości - Onet	Lider węgierskiej opozycji cieszy się większą popularnością niż aktualny premier — wynika z najnowszego sondażu opinii publicznej, przeprowadzonego przez instytut Median. Peter Magyar może pochwalić się poparciem 51 proc. ankietowanych, zaś Viktor Orban jedynie 40 proc.	https://ocdn.eu/pulscms-transforms/1/hJWk9kpTURBXy9kYzZkZWI2NDdiY2FmYWYyNDRhMGE4MmQ1MGI4ZmZiZS5qcGeTlQMAzHbNDtHNCFWTCaY1ZjljODIGkwXNBLDNAnbeAAGhMAE/premier-wegier-viktor-orban.jpg	2024-11-12 05:47:16	Wiadomości - Onet
pl	https://news.google.com/rss/articles/CBMiuwFBVV95cUxPcDJwSjhYbHVnVTRSNjZ1d3hjVF9mckhMUGVudXpoOXhaTjhGZnd2bmZGaTZ3ZHRSZ1htWDQ2bjVZQXMxY3hNOXNzMjlsa2E1TzJpRUNFM0V6cXRpaWd0MzVmcWRKS3oxWjdYem9QZE1QTmUwalFsUzVtaU1PSklROGtlSkpMTXBteER4NWRsNGN3MlVtcGF3YkRYRk03QWIxMTdPVXdWU1BvQ3dMMlIzb1ItYUI3VDRYX0NN?oc=5	Ujawniamy: Nowa prezes kluczowej firmy zbrojeniowej i polityk na celowniku CBA - Wiadomości - Onet	None	None	2024-11-12 04:40:00	Wiadomości - Onet
pl	https://www.rp.pl/dyplomacja/art41433051-nieoficjalnie-donald-trump-wybral-szefa-dyplomacji-usa-to-senator-ktory-polemizowal-z-donaldem-tuskiem	Jest kandydat na sekretarza stanu USA u Trumpa. To polityk, który na X starł się z Tuskiem - Rzeczpospolita	Źródła, na które powołuje się Reuters podają, że Donald Trump podjął decyzję w sprawie tego, kto zostanie sekretarzem stanu w jego administracji.	https://i.gremicdn.pl/image/free/ff3c70c4a5f5fa17a2dba86c7e2f9d64/donald-trump-i-marco-rubio?t=crop:3840:2381:nowe:0:89,resize:fill:2000:1250&ctx=preview	2024-11-12 03:59:12	Rzeczpospolita
pl	https://tvn24.pl/polska/ostrzelany-samolot-marsz-w-warszawie-rozmowa-dudy-z-trumpem-st8175358	Ostrzelany samolot, marsz w Warszawie, rozmowa Dudy z Trumpem - TVN24	None	None	2024-11-12 04:19:28	TVN24
pl	https://dziennikbaltycki.pl/106-rocznica-odzyskania-przez-polske-niepodleglosci-tak-swietowalo-pomorze/ar/c1-18934513?__cf_chl_rt_tk=b.u2942z80pRwtLZnMG1P7lnS4ox_SryuydDCH2yPSE-1731395276-1.0.1.1-9CfuMJvHo8UAi8GR8iG5q2CQ4NMFgNthgZdJx56oPd8	106. rocznica odzyskania przez Polskę niepodległości. Tak świętowało Pomorze - Dziennik Bałtycki	None	None	2024-11-11 16:44:00	Dziennik Bałtycki
pl	https://www.pap.pl/aktualnosci/dramatyczne-sceny-w-krakowie-mezczyzna-podpalil-sie-przed-kuria	Dramatyczne sceny w Krakowie. Mężczyzna podpalił się przed kurią - PAP	None	None	2024-11-11 06:51:00	PAP
pl	https://www.onet.pl/turystyka/onetpodroze/tragedia-w-portugalii-polak-utopil-sie-podczas-kapieli-w-atlantyku/ej4gr0j,07640b54	Tragedia w Portugalii. Nie żyje Polak - Onet	Do tragedii doszło w poniedziałek w pobliżu plaży Pedrogao, w dystrykcie Leiria, na środkowym zachodzie Portugalii. 50-letni obywatel Polski utopił się w Oceanie Atlantyckim. Po trwających ponad godzinę bezskutecznych poszukiwaniach mężczyzny jego ciało zostało wyrzucone na brzeg przez fale.	https://ocdn.eu/pulscms-transforms/1/C8Hk9kpTURBXy9lMDhmNzBkYTBkNjdmZTVmYjEwZWI5MWU2ZmMyMjA4Mi5qcGeSlQPNBk7NA8DNDS_NB2uTBc0EsM0CdN4AA6EwAaExAaEzww	2024-11-12 05:15:00	Onet
pl	https://tvn24.pl/swiat/w-tym-regionie-rosja-lada-dzien-moze-zintensyfikowac-ofensywe-st8175359	Rzecznik wojskowy: Rosja "lada dzień" może zintensyfikować ofensywę na południu Ukrainy - TVN24	993 dni temu rozpoczęła się rosyjska inwazja na Ukrainę. Rosja jest gotowa w najbliższej przyszłości zintensyfikować ataki w obwodzie zaporoskim na południu Ukrainy, gdzie w ostatnich miesiącach walki były mniej intensywne - powiedział rzecznik Sił Obrony tej części kraju Władysław Wołoszyn. Oto co wydarzyło się w Ukrainie i wokół niej w ciągu ostatniej doby.	https://tvn24.pl/najnowsze/cdn-zdjecie-3191591-miasto-zaporoze-uszkodzenia-po-rosyjskim-ataku-z-1-pazdziernika-2024-roku-ph8166211/alternates/LANDSCAPE_1280	2024-11-12 05:15:11	TVN24
pl	https://www.polsatnews.pl/wiadomosc/2024-11-11/piotr-glinski-w-programie-gosc-wydarzen-pis-byly-minister-kultury/	"Rozmijają się z rzeczywistością". Gliński o słowach Tuska - polsatnews.pl	- Ważne w polityce są działania, nie słowa - powiedział Piotr Gliński z PiS, oceniając wpis Donalda Tuska. Premier przekazał, że Polska (...) zjednoczona wokół sprawy suwerenności i bezpieczeństwa to nasze wspólne zadanie. - Tusk jest znany z tego, że jego słowa się często rozmijają z rzeczywistością - dodał.	https://ipla.pluscdn.pl/dituel/cp/hn/hn64undsoiuje1cagcpsqjd3rhg3r1pi.png	2024-11-11 18:40:00	polsatnews.pl
pl	https://dziennikbaltycki.pl/22-parada-niepodleglosci-2024-patriotyczny-przemarsz-ulicami-gdanska/ar/c1-18934201?__cf_chl_rt_tk=dCU9L0KswT9FHT1HOCKGoWYm42G8n4P7XJmXoG3h1mc-1731395325-1.0.1.1-zIxtVCPXF6veYE2lXMTvjognjpWYNhtEoByFQ.LsQQA	22. Parada Niepodległości 2024: Patriotyczny przemarsz ulicami Gdańska - Dziennik Bałtycki	None	None	2024-11-11 13:44:00	Dziennik Bałtycki
pl	https://i.pl/smog-w-pakistanie-jest-tak-gesty-ze-widac-go-z-kosmosu-norma-przekroczona-ponad-sto-razy/ar/c1p2-26977913	To nie mgła, to smog! Widać go nawet z kosmosu - Portal i.pl	None	None	2024-11-11 18:30:00	Portal i.pl
pl	https://kobieta.onet.pl/wiadomosci/koszmar-psow-galgo-i-podenco-polka-opowiada-jak-wyglada-zycie-w-hiszpanskiej-wsi/ec1r0j8	Polka nie zniosła okrucieństwa hiszpańskiej wsi. "Oni tam patrzeć na nas nie mogli" - Onet Kobieta	— Zamieszkaliśmy w małej wsi w okolicach Toledo, Val de Santo Domingo, na nasze nieszczęście. Tam odkryliśmy, co się dzieje z psami. Wytrzymaliśmy cztery lata i cztery miesiące. Miał być raj, a zamienił się w koszmar – opowiada pani Jolanta, Polka, która na własne oczy widziała, jak traktowane są galgo i podenco na hiszpańskiej prowincji. — Chciałam mieszkać w miejscu, gdzie psy są kochane. Jak to mówią, co z oczu, to z serca. Ale ja wiem, że one tam cierpią. Bardzo cierpią — podkreśla.	https://cdn.kobieta.onet.pl/1/nALk9lBaHR0cHM6Ly9vY2RuLmV1L3B1bHNjbXMvTURBXy8zMzFkMWYzNzYzNGFiNWMwOGZiMGIyNjg0ZWI1YjM2MS5wbmeSlQMADc0D6M0CM5MFzQSwzQJ23gACoTAHoTEE	2024-11-12 04:44:00	Onet Kobieta
pl	https://tvn24.pl/ciekawostki/swieto-niepodleglosci-rogal-swietomarcinski-w-bbc-gwiazda-legendarny-i-niesamowity-st8174215	"Gwiazda", "legendarny", "niesamowity". BBC o polskim przysmaku na 11 listopada - TVN24	None	None	2024-11-11 10:42:55	TVN24
pl	https://dorzeczy.pl/kraj/654679/policjanci-mieli-zabezpieczac-marsz-uratowali-niemowle.html	Policjanci mieli zabezpieczać marsz, uratowali niemowlę - Do Rzeczy	Funkcjonariusze z Bielska–Białej przyjechali do Warszawy, by pełnić służbę przy manifestacji. Musieli jednak podjąć akcję resuscytacji rocznego dziecka.	https://img.dorzeczy.pl/img/policjanci-mieli-zabezpieczac-marsz-uratowali-niemowle/f5/72/4ba964f8e07527e6fa66869f7985.webp	2024-11-11 16:58:00	Do Rzeczy
pl	https://news.google.com/rss/articles/CBMirAFBVV95cUxPYXYybXFtTFotTTh3X0MxZ1VvQmFEamJVY1pqQTlqM1d6Wml5VkUtdENDaElESzBMQmNWdXVtQzAxRWtETVhEVThfSjNUMlFNaERyMF9jazhmck9Ma0tSNjZ3ckU0S1FjeFI0Y2NBYlNoUmR3MUZkNS00ZWczUjg1dFh5b1ZYR1JuNnlkWEhqcHFjZWFYVHFCWE5CczBPNDN5cW9mQXBUdzRuVXJE?oc=5	Michał Probierz zabrał głos ws. braku Roberta Lewandowskiego - polsatsport.pl	Trener reprezentacji Polski Michał Probierz zapewnił przed meczami z Portugalią i Szkocją w Lidze Narodów, że jego piłkarze postarają się jak najlepiej zaprezentować pod nieobecność kontuzjowanego Roberta Lewandowskiego. "Zrobimy wszystko, żeby go zastąpić" - zapowiedział.	https://ipla.pluscdn.pl/dituel/cp/t5/t5hjkzkf7t8f9ve11va3ygotb6p9gq4p.jpg	2024-11-11 16:45:00	polsatsport.pl
pl	https://sport.interia.pl/iga-swiatek/news-jeszcze-nie-czas-na-rewanz-ze-swiatek-wielkie-oslabienie-prz,nId,7853478	Kluczowe wieści dla Świątek i spółki. Liderka rywalek odpuszcza finały w Maladze - Interia Sport	Kliknij i zobacz więcej.	https://i.iplsc.com/-/000K2LDR60HELR21-C461-F4.jpg	2024-11-11 16:19:25	Interia Sport
pl	https://www.sport.pl/pilka/7,65082,31456136,lewandowski-na-ustach-calej-hiszpanii-barcelona-oczekuje-wyjasnien.html	Lewandowski na ustach całej Hiszpanii. "Barcelona oczekuje wyjaśnień" - Sport.pl	None	None	2024-11-12 05:35:00	Sport.pl
pl	https://news.google.com/rss/articles/CBMiywFBVV95cUxOdkVIeURpYy1OQnhRMF9GZU54bUVwZUFiQmFMdDZ6bWRZSE5neUdpajlmSWVLQi0ySlFPTjZvZm5YNl91LUI1S2prRFgzak1MU0FyNVBzaFhwNUpiTlhuclNjdERMSW5KUVlSXzBFbVhvN01XblI0enVIZkZfelBZcE56elMzd3gwN0dUNjVERHNWZndacWVXNkl6NnJRUUQ5amR5SG8xdXd1S0VkeEI4R21YTEdzcHpvSVRTZzBPbWlkRGRIekNleElhNA?oc=5	Polska drużyna w amp futbolu wraca z mistrzostw świata z medalem - WysokieObcasy.pl	None	None	2024-11-11 12:22:00	WysokieObcasy.pl