country_code	url	title	description	image_url	publish_date	source
pl	https://businessinsider.com.pl/wiadomosci/trwa-atak-na-moldawska-demokracje-oligarcha-i-rosja-zaangazowani-w-korupcje/eexzvy5	Dziesiątki milionów na kupowanie głosów. Mołdawska policja ujawniła szczegóły procesu - Business Insider Polska	Mołdawska policja ujawniła, że we wrześniu i październiku do kraju nielegalnie trafiło 39 mln dolarów, przeznaczonych na przekupstwa wyborcze. To ma być jedynie część kwoty, którą zbiegły oligarcha...	https://ocdn.eu/pulscms-transforms/1/nVak9kpTURBXy8wODU2YWE4ZTQwMDQwOWVhMmVmYjNlYmU1MWIzYTIyOC5qcGeSlQMAzILNB9DNBGWTBc0EsM0Cdt4AAaEwAQ	2024-10-24 13:56:42	Business Insider Polska
pl	https://businessinsider.com.pl/gospodarka/dobry-zwiastun-dla-polski-swiatelko-w-tunelu-dla-niemieckiej-gospodarki/e0xcbbb	Dobry zwiastun dla Polski. Z Niemiec przyszły pierwsze nieśmiałe sygnały - Business Insider Polska	Spadek eksportu do Niemiec mocno uderzył ostatnio w polską gospodarkę. Wszystko przez narastający kryzys u naszego zachodniego sąsiada. Ale pojawił się pozytywny zwiastun. Opinie menadżerów 800 rep...	https://ocdn.eu/pulscms-transforms/1/d47k9kpTURBXy8wODU2Mjc1ZGQ5OTQyYzA3OGM3NDc3Yjg0MWQ3ZWY2MC5wbmeSlQMAzMHNBUbNAsKTBc0EsM0Cdt4AAaEwAQ	2024-10-24 10:30:58	Business Insider Polska
pl	https://www.money.pl/gospodarka/3-tys-zl-mandatu-dla-kierowcow-ruszyla-akcja-aby-go-uniknac-7085141642119776a.html	3 tys. zł mandatu dla kierowców. Ruszyła akcja, aby go uniknąć - Money.pl	Ruszyła 9. edycja kampanii "Twoje Światła - Nasze Bezpieczeństwo". W jej ramach kierowcy mogą sprawdzić stan i ustawienie świateł na wybranych stacjach kontroli pojazdów. Policja apeluje o udział, bo w przypadku niewłaściwego stanu technicznego samochodu grozi wysoki mandat.	https://v.wpimg.pl/YjVmMDc4dgs3Dzt3TE97HnRXby0KFnVII093ZkwFa1pmFX1rBV01DyQIPStNUysfJgw6NE1ENUU3HSRrFQV2Dj8ePSgCTXYPOw8oIEwGP14zWi90BhloC2ZeYHBRDD9HNF8pfE4EP1lhDi9xBQRuUjdPMA	2024-10-24 12:40:43	Money.pl
pl	https://infosecurity24.pl/sluzby-mundurowe/policja/mundurowa-mieszkaniowka-to-sprawa-z-ktora-trzeba-sie-zmierzyc	Mundurowa mieszkaniówka, "to sprawa, z którą trzeba się zmierzyć" - InfoSecurity24.pl	W moim przekonaniu pensje w Policji powinny być wyższe. Natomiast nie tylko kwestia wynagrodzeń jest istotna. Policjanci zwracają uwagę na żołnierzy, którzy otrzymują wysoki dodatek mieszkaniowy. To jest sprawa, z którą musimy się absolutnie zmierzyć – zapowiedział minister spraw wewnętrznych i administracji Tomasz Siemoniak. Jak dodał, tą kwestią zajmie się ministerialno-związkowa grupa robocza, która w piątek rozpoczyna pracę.	https://cdn.defence24.pl/2024/08/19/1920x1080px/mfkd52rmiuuzfwr1l5phyms482ohhblhzmpm932x.sqyo.jpg	2024-10-24 08:42:38	InfoSecurity24.pl
pl	https://www.fcbarca.com/121760-gol-lewandowskiego-nie-powinien-znalezc-sie-na-tablicy-wynikow.html	„Gol Lewandowskiego nie powinien znaleźć się na tablicy wyników” - FCBarca.com	None	None	2024-10-24 19:15:55	FCBarca.com
pl	https://www.bankier.pl/wiadomosc/Pierwsza-zielona-Zabka-od-debiutu-a-WIG20-znowu-pod-woda-Czwartek-na-GPW-8834260.html	Pierwsza zielona Żabka od debiutu, a WIG20 znowu pod wodą. Czwartek na GPW - Bankier.pl	Czwartek na GPW był pierwszym dniem od debiutu Grupy Żabka, w którym akcje spółki odnotowały wzrost. Wśród największych warszawskiej giełdy, najlepiej radziły sobie w czwartek akcje Budimexu, a bardzo mocna przecena spadła na walory Grupy Kęty, która przedstawiła wyniki za III kwartał.	https://galeria.bankier.pl/p/4/a/396c06610e9ca1-948-568-112-0-1834-1100.jpg	2024-10-24 15:20:00	Bankier.pl
pl	https://wiadomosci.wp.pl/niekandydat-nawrocki-szef-ipn-trzaskowski-nie-jest-politykiem-nadajacym-sie-na-prezydenta-polski-7085175952673440a	"Niekandydat Nawrocki". Szef IPN: Trzaskowski nie jest politykiem nadającym się na prezydenta Polski - WP Wiadomości	- Gdybym dostał propozycję ubiegania się o urząd prezydenta RP, to nie mógłbym powiedzieć "nie". I to nie jest kwestia moich ambicji, tylko odpowiedzialności za Polskę - mówi Karol Nawrocki. Szef IPN, wymieniany	https://v.wpimg.pl/OGU3NzZmYCY0UThJdRZtM3cJbBMzT2NlIBF0WHUiYHZnA34CbF5_aDNaIh8oCD8oe1Q8DyoMODd7QyJVOx0maCMCYR4zHj8rNEphHzcPKiN6Un1PPgx3cGUeL09sW2JzMAV7V2NceXB4BXhNb1UqcGIFKB87TzI	2024-10-25 04:10:59	WP Wiadomości
pl	https://businessinsider.com.pl/wiadomosci/do-wyborow-w-usa-12-dni-oto-najnowsze-sondaze/dsywv3c	Do wyborów w USA 12 dni. Jeden kandydat zyskuje przewagę - Business Insider Polska	Zaledwie 12 dni dzieli Amerykanów od wyborów prezydenckich, a najświeższe badania opinii publicznej nie wskazują jednoznacznie, kto wygra. Większe szanse wydaje się mieć Donald Trump, ale wyniki za...	https://ocdn.eu/pulscms-transforms/1/I4hk9kpTURBXy9lN2ZmNmU2OTg4NGQ4ZTM0M2JiMWEyODIwNWZhZDZmMi5qcGeSlQMAPs0H0M0EZZMFzQSwzQJ23gABoTAB	2024-10-25 05:14:59	Business Insider Polska
pl	https://wiadomosci.onet.pl/pogoda/polska-utonela-we-mgle-widzialnosc-spadla-niemal-do-zera-mapy/vhw6rn1	Niebezpieczne zjawisko w Polsce. IMGW bije na alarm - Wiadomości - Onet	Poranek w wielu regionach Polski przynosi bardzo mglistą pogodę. Miejscami widzialność została ograniczona poniżej 100 m, a warunki na drogach stały się trudne. Co więcej, mgły lokalnie będą się jeszcze utrzymywać przez kilka godzin, a najbliższej nocy znów wrócą do wielu regionów i ponownie mogą być gęste. IMGW zapowiada wydanie żółtych alertów przed niebezpieczną aurą.	None	2024-10-24 05:01:09	Wiadomości - Onet
pl	https://www.money.pl/gielda/historyczny-dzien-dla-muska-akcje-tesli-wystrzelily-7085238280866400a.html	Historyczny dzień dla Muska. Oto co się dzieje z akcjami Tesli - Money.pl	W czwartek akcje Tesli poszły w górę o 20 procent w reakcji na zaskakująco dobre wyniki finansowe spółki. Takiego skoku wartości na giełdzie firma nie miała od 11 lat.	https://v.wpimg.pl/MzhlNzg2YhsJDjhJSElvDkpWbBMOEGFYHU50WEgDf0pYFH5VAVshHxoJPhVJVT8PGA05CklCIVUJHCdVEQNiHgEfPhYGS2IfBQ4rHkhQdUgOWnkeVh9-S1EIY05RAHVXUAgvHEpTdEhQDn1CAgV1TFxOMw	2024-10-24 19:06:59	Money.pl
pl	https://www.polsatnews.pl/wiadomosc/2024-10-24/szef-onz-polecial-na-szczyt-putina-nawalna-nie-kryla-oburzenia/	Szef ONZ poleciał na szczyt Putina. Julia Nawalna: ściska rękę zbrodniarzowi - polsatnews.pl	Mamy już trzeci rok wojny, a sekretarz generalny Narodów Zjednoczonych ściska dłoń mordercy - napisała w serwisie X (dawniej Twitter) Julia Nawalna. Żona zmarłego rosyjskiego opozycjonisty dołączyła zdjęcie, na którym widać Władmira Putina podczas szczytu BRICS w Kazaniu. Obecność Antonio Gutteresa na tym forum skrytykował także Kijów.	https://ipla.pluscdn.pl/dituel/cp/24/24kdwow6z5i2r99a8on419p8gc5r1uhb.jpg	2024-10-24 20:45:00	polsatnews.pl
pl	https://businessinsider.com.pl/wiadomosci/raport-komisji-macierewicza-redagowala-jego-zona-kim-jest-hanna-natora/3ntrhqb	Raport komisji Macierewicza redagowała jego żona. Kim jest Hanna Natora - Business Insider Polska	Jak wynika z audytu zespołu, który badał byłą podkomisję smoleńską, żona jej przewodniczącego Antoniego Macierewicza razem z koleżanką zajmowała się ostateczną edycją raportu. Kim jest Hanna Natora...	https://ocdn.eu/pulscms-transforms/1/rLUk9kpTURBXy9jN2Y5OTkyYjZmNGQ2NzAzNDZkNzEzZjA2YWQ4ZWFjZi5qcGeSlQMAzPrNB9DNBGWTBc0EsM0Cdt4AAaEwAQ	2024-10-24 18:36:40	Business Insider Polska
pl	https://www.rp.pl/polityka/art41345551-waza-sie-losy-prawyborow-w-pis-jeszcze-dzis-moze-zapasc-decyzja-w-siedzibie-partii	Ważą się losy prawyborów w PiS. Jeszcze dziś może zapaść decyzja w siedzibie partii - Rzeczpospolita	W ciągu najbliższych godzin może zapaść decyzja o organizacji wewnętrznych prawyborów w ramach PiS – wynika z naszych informacji. Jeśli tak się stanie, to niema	https://i.gremicdn.pl/image/free/d42879097316fabe88d81bd1f041da90/?t=crop:4304:2669:nowe:0:97,resize:fill:2000:1250&ctx=preview	2024-10-24 17:36:13	Rzeczpospolita
pl	https://www.money.pl/gospodarka/dodatkowe-oplaty-dla-tysiecy-rodzicow-co-na-to-men-7085404947757728a.html	Dodatkowe opłaty dla tysięcy rodziców. Co na to MEN? - Money.pl	None	None	2024-10-25 06:26:00	Money.pl
pl	https://www.fakt.pl/wydarzenia/polska/trojmiasto/karambol-kolo-gdanska-obronca-mateusza-m-zabiera-glos/dbtpn9n	Karambol koło Gdańska. Obrońca Mateusza M. zabiera głos - Fakt.pl	— Mateusz M. stawia się codziennie na dozór policji. Czekają go badania psychologiczne i psychiatryczne. Ale w tej chwili, bezpośrednio po zdarzeniu, on się do takich badań nie nadaje. On też musi ...	https://ocdn.eu/pulscms-transforms/1/Fmtk9kpTURBXy8yODM3OWVjNjRjMGYyNGVmYmVhZGJhNTI5ZDBhNDIzYi5wbmeSlQMANs0F3M0DTJMFzQSwzQJ23gABoTAB	2024-10-24 15:22:00	Fakt.pl
pl	https://news.google.com/rss/articles/CBMitgFBVV95cUxNN25fRkxhbDdmS2lQMWxUZ1pkTjlpUzhfM1dOYUxHcDNqSHphNTZldWhacl9vU2xiQUJSbVY2NzV6QVNNTWZwYzVjazQ1eUdVQ3NhOWd0aXBWdjVaczZyODc2eGJDa3F0R3JCZmk5N3hkYllfclFpblNaU1RhOUQ3VEN1Z0JpZVRTM1l6NkFKUXpXVFFDN2FIaHpLMk85MDB1aFJHNnhtbUlQMGhHall0TzFrX0tidw?oc=5	Wojciech Szczęsny brutalnie szczery. Zderzył się ze ścianą. "To naprawdę boli" - Interia Sport	None	None	2024-10-25 06:17:00	Interia Sport
pl	https://www.sport.pl/pilka/7,65042,31413840,co-za-kasa-tyle-legia-zarobila-w-tym-roku-w-lidze-konferencji.html	Co za kasa! Tyle Legia zarobiła w tym roku w Lidze Konferencji - Sport.pl	Legia Warszawa wygrała 3:0 z TSC Backa Topola w drugiej kolejce fazy ligowej Ligi Konferencji. To oznacza, że zespół Goncalo Feio ma komplet punktów na tym etapie rywalizacji, jest na dobrej drodze do awansu do fazy pucharowej, ale też są to dodatkowe pieniądze do klubowej kasy. Na oficjalnej stronie UEFA dowiadujemy się, ile Legia zarobiła za zwycięstwo na wyjeździe w Serbii. Łącznie w tym sezonie Legia zebrała pokaźną sumę.	None	2024-10-25 05:03:00	Sport.pl
pl	https://wiadomosci.onet.pl/kraj/wplacono-kaucje-za-ks-olszewskiego-liczymy-ze-dzis-opusci-areszt/7kjx0cs	Wpłacono kaucję za ks. Olszewskiego. "Liczymy, że dziś opuści areszt" - Wiadomości - Onet	None	None	2024-10-25 07:17:36	Wiadomości - Onet
pl	https://www.bankier.pl/wiadomosc/Bedzie-kolejny-dzien-wolny-od-pracy-Ministerstwo-Pracy-szykuje-juz-ustawe-8834566.html	Będzie kolejny dzień wolny od pracy. Ministerstwo Pracy szykuje już ustawę - Bankier.pl	Niewykluczone, że już tegoroczna Wigilia Bożego Narodzenia będzie dniem wolnym od pracy. Złożenie projektu ustawy wprowadzającej wolny dzień - zapowiedziała w piątek rano ministra rodziny, pracy i polityki społecznej Agnieszka Dziemianowicz–Bąk.	https://galeria.bankier.pl/p/9/9/1c08247e0989f7-948-568-7-67-2992-1795.jpg	2024-10-25 06:45:00	Bankier.pl
pl	https://businessinsider.com.pl/wiadomosci/rosyjska-dywersja-przekracza-kolejne-granice-rosnie-ryzyko-katastrofy-lotniczej/nsmm9f3	Rosyjska dywersja przekracza kolejne granice. Rośnie ryzyko katastrofy lotniczej - Business Insider Polska	Polska Agencja Bezpieczeństwa Wewnętrznego oraz Prokuratura Krajowa prowadzą intensywne śledztwo w sprawie serii pożarów, które mogą być wynikiem rosyjskiej dywersji. Jak ujawnia "Gazeta Wyborcza",...	https://ocdn.eu/pulscms-transforms/1/tbek9kpTURBXy85MjczMDNjNTk2MzI1ZDYwYTQ4ZWE1ZWZhOTI1ZTFjZC5qcGeSlQMAzMHNGGDNDbeTBc0EsM0Cdt4AAaEwAQ	2024-10-25 06:31:54	Business Insider Polska
pl	https://tvn24.pl/swiat/regularne-rozmowy-z-putinem-media-o-sekrecie-muska-st8150769	Regularne rozmowy z Putinem. Media o "sekrecie" Muska - TVN24	None	None	2024-10-25 06:44:15	TVN24
pl	https://wiadomosci.onet.pl/kraj/szymon-holownia-komentuje-rozlam-w-partii-razem-zdecydujcie-sie-gdzie-chcecie-byc/kdkrrxs	Szymon Hołownia komentuje rozłam w partii Razem. "Zdecydujcie się, gdzie chcecie być" - Wiadomości - Onet	None	None	2024-10-24 15:01:44	Wiadomości - Onet
pl	https://www.pap.pl/aktualnosci/zolnierze-z-korei-pln-sa-juz-w-obwodzie-kurskim-wywiad-wojskowy-ukrainy-ujawnia	Żołnierze z Korei Płn. są już w obwodzie kurskim? Wywiad wojskowy Ukrainy ujawnia - PAP	None	None	2024-10-24 18:27:00	PAP
pl	https://tvn24.pl/katowice/slaskie-wicemarszalek-bartlomiej-sabat-z-po-uslyszal-zarzuty-korupcyjne-st8150863	Śląskie. Wicemarszałek Bartłomiej Sabat z PO usłyszał zarzuty korupcyjne - TVN24	- Dwa zarzuty dotyczą przyjęcia korzyści majątkowej i uzależniania wykonania czynności służbowych od uzyskania takich korzyści – poinformowała w piątek Prokuratura Krajowa. Podejrzany to Bartłomiej Sabat, polityk z PO.	https://tvn24.pl/najnowsze/cdn-zdjecie-6965333-bartlomiej-sabat-ph8150067/alternates/LANDSCAPE_1280	2024-10-25 06:49:33	TVN24
pl	https://wiadomosci.onet.pl/tylko-w-onecie/zmiana-czasu-spedza-sen-z-powiek-polacy-nie-maja-watpliwosci-co-powinien-zrobic-tusk/ynsz95c	Zmiana czasu spędza sen z powiek. Co powinien zrobić Donald Tusk? Polacy nie mają wątpliwości [SONDAŻ] - Wiadomości - Onet	None	None	2024-10-25 03:10:00	Wiadomości - Onet
pl	https://www.money.pl/gospodarka/skladka-zdrowotna-w-dol-oto-kto-najbardziej-ma-skorzystac-7085397174143648a.html	Składka zdrowotna w dół? Oto kto najbardziej ma skorzystać - Money.pl	Przed wyborami prezydenckimi Sejm ma przegłosować projekt o obniżce składki zdrowotnej - informuje  serwis wyborcza.biz. Według niego na tych przepisach mają skorzystać wszyscy samozatrudnieni i przedsiębiorcy z przychodami do 12 tys. zł. 	https://v.wpimg.pl/ZTUzOGUxdTU0GDl0egN4IHdAbS48WnZ2IFh1ZXpJaGRlAn9oMxE2MScfPyh7HyghJRs4N3sINns0CiZoI0l1MDwJPys0AXUxOBgqI3oeb2w3GX9_YVVqZjAeYnNiTGl5bUl_f3gabzc2QipyZkA_ZWJYMg	2024-10-25 05:43:58	Money.pl
pl	https://dorzeczy.pl/kraj/648137/dmitrij-miediewiew-atakuje-polske-poprzez-mema-z-bobrem.html	Dmitrij Miediewiew atakuje Polskę... poprzez mema z bobrem - Do Rzeczy	Dmitrij Miedwiediew krytykuje decyzję Polski o zamknięciu konsulatu Rosji w Poznaniu. Przywołał słynnego mema z bobrem.	https://img.dorzeczy.pl/img/bobr-kua-komiczny-wpis-miedwiediewa/24/5f/9e8eaa47eb574835e4f38f6dde99.webp	2024-10-24 15:05:00	Do Rzeczy
pl	https://www.polsatnews.pl/wiadomosc/2024-10-25/nie-zyje-legendarna-polska-aktorka-jadwiga-baranska-miala-89-lat/	Nie żyje legendarna polska aktorka. Jadwiga Barańska miała 89 lat - polsatnews.pl	Nie żyje Jadwiga Barańska, legendarna polska aktorka zmarła w wieku 89 lat. Artystka zasłynęła rolą w kultowym filmie Noce i Dnie, gdzie zagrała Barbarę. O jej śmierci poinformował jej mąż, reżyser Jerzy Antczak.	https://ipla.pluscdn.pl/dituel/cp/56/563n4t9ojcn4tabtow3yr4dw6oh54ivn.jpg	2024-10-25 05:35:00	polsatnews.pl
pl	https://www.pap.pl/aktualnosci/nad-palacem-prezydenckim-w-seulu-wybuchl-balon-prezydent-duda-przebywa-tam-z-wizyta	Nad pałacem prezydenckim w Seulu wybuchł balon. Prezydent Duda przebywa tam z wizytą [WIDEO] - PAP	None	None	2024-10-24 08:37:00	PAP
pl	https://www.polsatnews.pl/wiadomosc/2024-10-25/putin-twierdzi-ze-ukraina-wycofala-sie-z-pokojowych-negocjacji-pilka-jest-po-ich-stronie/	Putin otrzymał "tajną propozycję". "Piłka jest po ich stronie" - polsatnews.pl	Turcja miała przekazać Rosji ukraińskie stanowisko ws. negocjacji - powiedział Władimir Putin po obradach szczytu BRICS. Według niego Kijów proponował dyskusje na temat pokoju, z których wycofał się już następnego dnia. Na konferencji rosyjski przywódca odniósł się także po raz pierwszy do doniesień o żołnierzach Korei Północnej w Ukrainie. - Zobaczymy, jak ten proces będzie się rozwijał - mówił.	https://ipla.pluscdn.pl/dituel/cp/bz/bz1uq21ihjoq8d3e9mdihkvedn5vkfu7.jpg	2024-10-25 05:11:00	polsatnews.pl
pl	https://i.pl/wojna-na-ukrainie-najgorszy-tydzien-od-roku-rosjanie-zagrazaja-kilka-waznym-miastom/ar/c1p2-26918955	Najgorszy tydzień od roku. Siedem sukcesów Rosjan - Portal i.pl	None	None	2024-10-24 16:39:51	Portal i.pl
pl	https://www.onet.pl/turystyka/onetpodroze/algieria-turystce-ze-szwajcarii-poderznieto-gardlo-w-kawiarni-na-oczach-wszystkich/fk0zemz,07640b54	Algieria: turystce ze Szwajcarii poderżnięto gardło w kawiarni na oczach wszystkich - Onet	Wstrząsające doniesienia napłynęły z południowo-wschodniej Algierii, gdzie szwajcarska turystka padła ofiarą brutalnego ataku. Incydent miał miejsce 11 października w popularnym pustynnym ośrodku turystycznym, Djanet, kiedy to kobieta została zaatakowana nożem w miejscowej kawiarni. Pomimo szybkiego przewiezienia do szpitala, turystka zmarła w wyniku odniesionych ran.	https://ocdn.eu/pulscms-transforms/1/0gkk9kpTURBXy8xMjU5NjY2ZmZlNjM5NzMyOGIwZmU3ZWM3M2MyYmJmNS5qcGeSlQMAAM0QAM0JAJMFzQSwzQJ03gADoTABoTEBoTPD	2024-10-25 06:07:00	Onet
pl	https://www.sport.pl/pilka/7,65042,31413877,feio-wciaz-nienasycony-oto-co-powiedzial-po-wygranej-legii.html	Feio narzeka. Oto co powiedział po wygranej Legii w Lidze Konferencji - Sport.pl	None	None	2024-10-25 06:26:00	Sport.pl
pl	https://news.google.com/rss/articles/CBMisAFBVV95cUxQZ1BoamhWdDRMYTVLMFRyVUVtMWZLQWJrSGhZWUplM2RUS3lteTc5NVVndmxLcm51Mi12MUkxRlZqVmNWck9OVGVMTUZrUEpkdFBnaUNBUjl5NTNhSDd2b1dFR1hhZHhsOGlicmlEQWFfRFVPdVdRaTZ2eHVxMjlPVldRdHR2WHptZ1Z3UmdqU0hnZTJDamtReHpneVYyc1U3bDNpMm1xU0NsYkNEOTdHYg?oc=5	Ofiara wypadku Łukasza Żaka o tragedii. "Dzieci wiedzą, że ich tatuś nie żyje" - Onet	None	None	2024-10-24 18:24:00	Onet
pl	https://wydarzenia.interia.pl/kraj/news-psl-reaguje-na-slowa-kard-nycza-musimy-zdazyc-przed-wyborami,nId,7843078	"Przestańmy się oszukiwać". PSL odpowiada na słowa kard. Nycza - Interia Wydarzenia	Kliknij i zobacz więcej.	https://i.iplsc.com/-/000JZIADBOHELS7L-C461-F4.jpg	2024-10-25 05:30:00	Interia Wydarzenia
pl	https://news.google.com/rss/articles/CBMixAFBVV95cUxNNlE1RTdyVGtkMDNLTmlPVnFBWkpoVmRCbEJEYzYwS3dpR0l2T0EwWktNWHBLWk44OGU5QjRabE1HejlhZndGWGZhVjZXLVVpWUozeUtQeDN3U1loQXFsNVZfUk9oQVlCdTZIVWd1c29qVlZ2Y29WRDBlZnhmaVNBRjQzTE92cjFjaW1GWUlGMlpyZHltOWhpQ2ZCZkd4ME9oMHIxMnYzMFliVTBrMU9tam5qZ0xUWVMybGxGUlc2REN2OE9F?oc=5	Pojawiła się wiadomość Buddy z aresztu. Ma tylko jedną prośbę - Przegląd Sportowy Onet	— Dostałem wiadomość prosto od Kamila i "Grażynki", żeby na temat ich sprawy więcej medialnie nie rozmawiać — mówi influencer "Kamil z Ameryki", który od samego początku mocno zaangażował się w sprawę zatrzymanego youtubera. Na potwierdzenie swoich słów pokazał wiadomość, którą miał dostać od Buddy. Ujawnia również, co dalej z potencjalnym zaangażowaniem w sprawę znanego adwokata Romana Giertycha. Szykuje się zwrot!	None	2024-10-24 18:15:31	Przegląd Sportowy Onet
pl	https://www.sport.pl/pilka/7,65042,31413881,bum-bum-bum-polska-jedyna-w-europie-wielki-wyczyn-legii.html	Bum, bum, bum! Polska jedyna w Europie. Wielki wyczyn Legii i Jagiellonii - Sport.pl	None	None	2024-10-25 06:16:00	Sport.pl
pl	https://wydarzenia.interia.pl/zagranica/news-z-powodu-donalda-tuska-zaskakujace-slowa-prezydenta-serbii,nId,7842611	"Z powodu Donalda Tuska". Zaskakujące słowa prezydenta Serbii - Interia Wydarzenia	Kliknij i zobacz więcej.	https://i.iplsc.com/-/000JZF60W4U1JOS0-C461-F4.jpg	2024-10-24 12:24:32	Interia Wydarzenia
pl	https://news.google.com/rss/articles/CBMivAFBVV95cUxNa3Mya1JnTFNkUlNnNVcwWXRONlJyX2tIY3JtWW9EdDJmWUw0NGxxOW9yUVdMc3VQVmJmdzI1YXFxRC1NYV9MNl82M0R4LXFRcUFrTUlxSlZ6c3BLTEViRXVBQmRxMkdxYl9BT21LRE5kZFhaTmY1c04yZERHUFRlT21ic2NOWmg2ZzZUYTZPY0JfMVItdDNRSDRrd21yVzlkaTh5MzBTWDF0U19sUHk0VVl3eVY5enkxMFpRYw?oc=5	Kolejne dymisje dla synów Zygmunta Solorza. Wyszły ponad medialne imperium - Business Insider Polska	None	None	2024-10-25 07:28:03	Business Insider Polska
pl	https://news.google.com/rss/articles/CBMiqAFBVV95cUxPeExldXZnclFPVjBsMHdzMGFDclFkTzZMNDFSV090eEtzd09oRERheUhZYnBfNjZrbnpwTmE1aGtWSTFhaVE1OTYzM3FMS1hXcExfSzgxMHAwV3dFV0NXMEI5d18tMXNZNFNUQ1VETzVfcXM4anIzLXc3d2hyT3ZFNFVkREVCYVZuY24tcnFiaGM5SnVwMnE4U0RGaEtRVTE1MzdZZ0I4WXo?oc=5	Sensacyjny sukces Polski na mundialu. Jest reakcja FIFA - Przegląd Sportowy Onet	None	None	2024-10-24 12:03:54	Przegląd Sportowy Onet
pl	https://www.money.pl/gospodarka/drony-skontrolowaly-fotowoltaike-tak-oszukuja-polacy-7085390292671136a.html	Drony skontrolowały fotowoltaikę. Tak oszukują Polacy - Money.pl	Tauron zakończył kontrole mikroinstalacji i magazynów energii przyłączonych do swojej sieci. Po raz pierwszy wykorzystał do tego drony. Od nieprawidłowości w fotowoltaice aż się roi. Spółka ujawnia, jak oszukują Polacy i bije na alarm.	https://v.wpimg.pl/NTg0MGMyYTUGUjt0YgJsIEUKby4kW2J2EhJ3ZWJIfGRXSH1oKxAiMRVVPShjHjwhF1E6N2MJInsGQCRoO0hhMA5DPSssAGExClIoI2Iaf2YEUnVxdFR9ZlQIYHN4Syx5Xgh-JWBILDFWAnh_eUktZgISMA	2024-10-25 05:07:00	Money.pl
pl	https://sport.tvp.pl/83124665/zlote-kolce-2024-rozdane-bukowiecka-i-nowicki-lekkoatletami-roku-w-polsce	Złote Kolce rozdane. Poznaliśmy lekkoatletów roku w Polsce! - TVP SPORT	Oficjalna strona TVP Sport. Lider oglądalności wśród kanałów sportowych w Polsce. Transmisje online, program TV, wideo, wyniki, relacje z najważniejszych sportowych wydarzeń.	https://s5.tvp.pl/images2/5/f/1/uid_5f16893db9f746fbb555b5b8e80969eb_width_1280_play_0_pos_0_gs_0_height_720_wojciech-nowicki-i-natalia-bukowiecka-fot-pap-getty.jpg	2024-10-24 17:40:00	TVP SPORT
pl	https://serwisy.gazetaprawna.pl/emerytury-i-renty/artykuly/9645037,waloryzacja-emerytur-2025-kwoty-netto-i-brutto-ile-trafi-na-konto-seniorow-oto-wyliczenia-tabela.html	Waloryzacja emerytur 2025. Tyle seniorzy dostaną na rękę. Tabela od 1780 zł do 10 000 zł [BRUTTO+NETTO] - Serwisy GazetaPrawna.pl	None	None	2024-10-25 05:12:05	Serwisy GazetaPrawna.pl
pl	https://www.money.pl/gospodarka/huta-liberty-czestochowa-zbankrutowala-jest-decyzja-sadu-7085110023187040a.html	Huta Liberty Częstochowa zbankrutowała. Jest decyzja sądu - Money.pl	Liberty Częstochowa, huta znana z produkcji blach dla kluczowych sektorów gospodarki, ogłosiła ostateczne bankructwo. Po odrzuceniu zażalenia na wcześniejszą decyzję sądu syndyk ma nadzieję na znalezienie nowych inwestorów i zabezpieczenie wynagrodzeń dla pracowników - podaje "Puls Biznesu". 	https://v.wpimg.pl/M2M2NDcyYlMsUDh3TAJvRm8IbC0KW2EQOBB0ZkxIfwJ9Sn5rBRAhVz9XPitNHj9HPVM5NE0JIR0sQidrFUhiViRBPigCAGJXIFArIEwbdQEoUXx1UVR4AylUY3AGTS8fLwcvc05AegUsBn0nVU16ACkQMw	2024-10-24 09:58:23	Money.pl
pl	https://wiadomosci.onet.pl/kraj/ogromna-strata-orlenu-na-ruchu-i-polska-press-koncern-podal-kwote/8l2fy9q	Ogromna strata Orlenu na Ruchu i Polska Press. Koncern podał kwotę - Wiadomości - Onet	None	None	2024-10-25 07:26:28	Wiadomości - Onet
pl	https://www.sport.pl/tenis/7,64987,31407734,w-czechach-glosno-o-swiatek-i-jej-nowym-trenerze-dochodzi.html	W Czechach głośno o Świątek i jej nowym trenerze. "Dochodzi do starcia..." - Sport.pl	None	None	2024-10-25 05:39:00	Sport.pl