country_code	url	title	description	image_url	publish_date	source
pl	https://www.polsatnews.pl/wiadomosc/2024-11-03/masowe-kontrole-policji-mundurowi-podsumowali-akcje-na-drogach/	Masowe kontrole policji. Mundurowi podsumowali akcje na drogach - polsatnews.pl	Ponad 14 tys. interwencji, 245 zatrzymanych kierowców pod wpływem - to bilans kontroli policji w Zaduszki. Funkcjonariusze przekonują, że te statystyki są lepsze w porównaniu z zeszły rokiem - na drogach zginęło o wiele mniej osób, zmalała także liczba osób prowadzących pojazdy na podwójnym gazie.	https://ipla.pluscdn.pl/dituel/cp/9h/9hj6zgc8b7by23mbtma4e4dab982owux.jpg	2024-11-03 09:47:00	polsatnews.pl
pl	https://wiadomosci.wp.pl/w-nocy-padl-rekord-zimna-mamy-prognoze-co-dalej-7088637231147776a	W nocy padł już sezonowy rekord zimna. Mamy prognozę, co dalej - WP Wiadomości	Za nami najzimniejsza noc w tym sezonie. Mróz był jeszcze większy niż zakładały prognozy, miejscami temperatura spadła do nawet -12 stopni Celsjusza. Co czeka nas w następnych godzinach? IMGW informuje	https://v.wpimg.pl/NDAyNGFlYSUgGzh0aRdsMGNDbC4vTmJmNFt0ZWkjYXVzSX4_cF9-aycQIiI0CT4rbx48MjYNOTRvCSJoJxwnazdIYSMvHz4oIABhIisOKyBuHCxwcQ4qJSdUeX8kCWNweUl8an9fKHRsSiwlJVh-dnUYK3clTjM	2024-11-03 09:08:29	WP Wiadomości
pl	https://www.pomponik.pl/plotki/news-wpadka-ze-smiechem-prezenterki-tvn24-jest-decyzja-krrit,nId,7848583	Wpadka ze śmiechem prezenterki TVN24. Jest decyzja KRRiT - Pomponik.pl	Anna Seremak, prezenterka TVN24, znalazła się w centrum uwagi po tym, jak nie mogła powstrzymać śmiechu, opowiadając o incydencie w Bartoszycach, w którym	https://i.iplsc.com/-/000J5D3RLK2JLE6P-C461-F4.jpg	2024-11-03 12:00:18	Pomponik.pl
pl	https://www.polsatnews.pl/wiadomosc/2024-11-03/hiszpanie-wsciekli-na-wladze-po-powodzi-krol-filip-vi-musial-uciekac/	Król Hiszpanii musiał uciekać. Tłum wściekły po powodzi - polsatnews.pl	Król Hiszpanii przyjechał do Walencji, na tereny dotknięte powodzią. Jego wizyta przebiegła dramatycznie: w stronę monarchy rzucano błoto, kamienie, padły też serie wyzwisk. Interweniowała policja, jednak ostatecznie monarcha i tak musiał opuścić miasto. Z wieloma gorzkimi słowami spotkał się również hiszpański premier.	https://ipla.pluscdn.pl/dituel/cp/ez/ezv3o2w4whn92434fd6fs7ne7cjjfzhd.jpg	2024-11-03 14:21:00	polsatnews.pl
pl	https://wydarzenia.interia.pl/zagranica/news-miedwiediew-wskazal-na-trumpa-bedzie-jak-kennedy,nId,7848585	Miedwiediew nie gryzł się w język. "Skończy jak Kennedy" - Interia Wydarzenia	Kliknij i zobacz więcej.	https://i.iplsc.com/-/000K1025A6X8BVK5-C461-F4.jpg	2024-11-03 14:20:01	Interia Wydarzenia
pl	https://wiadomosci.onet.pl/warszawa/studenci-bylego-collegium-humanum-maja-dosc-wystosowali-pozew-zbiorowy/5cz4wdl	Czarne chmury nad dawnym Collegium Humanum. Studenci wystosowali pozew zbiorowy - Wiadomości - Onet	W obliczu niepewnej sytuacji Uczelni Biznesu i Nauk Stosowanych Varsovia, dawniej znanej jako Collegium Humanum, grupa studentów zdecydowała się na pozew zbiorowy przeciwko władzom uczelni. Jak donosi TVN Warszawa, na sytuację zareagował również Rzecznik Praw Obywatelskich, który zapewnia o ścisłym monitorowaniu sprawy.	https://ocdn.eu/pulscms-transforms/1/q21k9kpTURBXy8yZDI5ODNiY2EyOTcyMGRjYzNmMWIxNzU4OTViMjU5MS5qcGeTlQMAzFvNB9DNBGWTCaY1YmYyNTQGkwXNBLDNAnbeAAGhMAE/dawna-uczelnia-collegium-humanum.jpg	2024-11-03 15:51:57	Wiadomości - Onet
pl	https://www.polsatsport.pl/wiadomosc/2024-11-03/tragiczna-smierc-pilkarza-na-dworcu-kolejowym-dzien-wczesniej-obchodzil-21-urodziny/	Tragiczna śmierć piłkarza na dworcu kolejowym. Dzień wcześniej obchodził 21. urodziny - polsatsport.pl	Tragedia w Serbii, gdzie w Nowym Sadzie na dworcu kolejowym zawalił się betonowy dach, w efekcie czego śmierć poniosło 14 osób, a ponad 30 zostało rannych. Wśród ofiar znalazł się 21-letni piłkarz FK Potisje, Milos Milosavljević oraz jego rok młodsza dziewczyna.	https://ipla.pluscdn.pl/dituel/cp/eh/ehs2jumk9wp8362yfvd48f1uzt2acnec.jpg	2024-11-03 09:09:00	polsatsport.pl
pl	https://www.polsatnews.pl/wiadomosc/2024-11-03/papiez-zabral-glos-ws-powodzi-walencji-na-miejscu-jest-krol-hiszpanii/	Papież zabrał głos ws. powodzi Walencji. Na miejscu jest król Hiszpanii - polsatnews.pl	- Modlę się za Walencję i mieszkańców innych regionów Hiszpanii - mówił papież podczas niedzielnej mszy w Watykanie. Franciszek zaapelował, aby inni wierni włączyli się w duchowne wsparcie, dla regionu dotkniętego powodzią. Wiadomo, że w Walencji zginęło ponad 210 osób, a liczba ofiar może wrosnąć. Głowa Kościoła katolickiego zwróciła również uwagę na włoską konstytucję i zapis dotyczący wojny.	https://ipla.pluscdn.pl/dituel/cp/bd/bdnq7w1db4kpz2551wg4gzytaodfdby9.jpg	2024-11-03 13:06:00	polsatnews.pl
pl	https://businessinsider.com.pl/wiadomosci/sekretarz-ds-gospodarki-ostrzega-przed-skutkami-brexitu/h32sreb	Skutki Brexitu jeszcze przed Wielką Brytanią. Ważna polityczka nie pozostawia złudzeń - Business Insider Polska	"Najgorsze skutki brexitu dopiero nadejdą" — ostrzegła sekretarz ds. gospodarki w brytyjskim ministerstwie skarbu Tulip Siddiq, której ocenę przytacza w niedzielę dziennik "Independent". Według nie...	https://ocdn.eu/pulscms-transforms/1/QFYk9kpTURBXy83N2JlN2QwZTg4ZmJhMjBkMWRiNTI4NTllNDllN2RhNy5qcGeSlQMAPs0H0M0EZZMFzQSwzQJ23gABoTAB	2024-11-03 15:37:00	Business Insider Polska
pl	https://www.polsat.pl/news/2024-11-03/nasz-nowy-dom-odcinek-332-przed-i-po-zobacz-zdjecia/	„Nasz nowy dom” - odcinek 332: Przed i po. Zobacz zdjęcia! - Polsat	Oto efekty remontu we wsi Ostrołęka, gdzie mieszka rodzin pana Michała i pani Karoliny. Projekt przygotowała Marta Kołdej, a prace budowlane prowadził Wiesław Nowobilski ze swoją ekipą. Jedną z kluczowych rzeczy było stworzenie łazienki i instalacji kanalizacyjnej. Zakres prac był bardzo szeroki. Nasz nowy dom w czwartek o godz. 20:10 w Polsacie.	https://ipla.pluscdn.pl/dituel/cp/63/6353x82pjnz4vd1j4t853ngc61w51z1h.jpg	2024-11-03 09:43:32	Polsat
pl	https://www.rmf24.pl/raporty/raport-wojna-z-rosja/news-google-omylkowo-ujawnilo-pozycje-wojsk-ukrainskich,nId,7848641	Google omyłkowo ujawniło pozycje wojsk ukraińskich - RMF 24	None	None	2024-11-03 15:11:43	RMF 24
pl	https://wiadomosci.onet.pl/pogoda/silny-wiatr-uderzy-w-polske-imgw-wydal-ostrzezenia-dla-trzech-wojewodztw/kv5mthz	IMGW ostrzega przed silnym wiatrem. Zagrożone trzy województwa - Wiadomości - Onet	Instytut Meteorologii i Gospodarki Wodnej wydał na niedzielę ostrzeżenia pierwszego stopnia przed silnym wiatrem. Alerty dotyczą trzech województw na północy Polski, gdzie wichura może osiągnąć 80 km na godz. Sprawdź, w których regionach pogoda będzie stanowiła największe zagrożenie.	https://ocdn.eu/pulscms-transforms/1/XXTk9kpTURBXy9kNWM3MDU1NjBkOGIzYzVlMDVhNjU5ZTFkNmM0ZGYyYy5wbmeTlQMAzHnNDzDNCIuTCaZiMGE3MTcGkwXNBLDNAnbeAAGhMAE/imgw-ostrzega-przed-silnym-wiatrem-na-polnocy-zrobi-sie-groznie-screen-ximgw.jpg	2024-11-03 11:23:56	Wiadomości - Onet
pl	https://wiadomosci.onet.pl/swiat/harrison-ford-uderza-w-donalda-trumpa-napuszczal-nas-na-siebie/455hnzg	"Indiana Jones" poparł Kamalę Harris. Ostro skrytykował też Donalda Trumpa - Wiadomości - Onet	Aktor Harrison Ford dołączył do grona znanych postaci z branży rozrywkowej, w tym m.in. Taylor Swift i Beyoncé, popierając Kamalę Harris w wyścigu o fotel prezydencki. W ostrych słowach skrytykował również Donalda Trumpa oraz jego administrację.	https://ocdn.eu/pulscms-transforms/1/LHkk9kpTURBXy9jZDBjMDk5M2JmMTBmMDEwNDM0NTViZTViNGJhMGM3NC5qcGeTlQMAzQFMzRcSzQz6kwmmNTRhNWEwBpMFzQSwzQJ23gABoTAB/harrison-ford.jpg	2024-11-03 12:40:39	Wiadomości - Onet
pl	https://wiadomosci.onet.pl/kraj/szokujace-co-dzieci-znalazly-w-cukierkach-burmistrz-wyznaczyl-nagrode-za-ujecie/se3fz9k	Szokujące, co dzieci znalazły w cukierkach. Burmistrz wyznaczył nagrodę za ujęcie sprawcy - Wiadomości - Onet	None	None	2024-11-02 18:57:40	Wiadomości - Onet
pl	https://www.sport.pl/pilka/7,65039,31435460,wykorzystali-wpadke-lidera-ekstraklasy-cztery-minuty-zdecydowaly.html	Wykorzystali wpadkę lidera ekstraklasy. Cztery minuty zdecydowały - Sport.pl	None	None	2024-11-03 16:45:00	Sport.pl
pl	https://tvn24.pl/olsztyn/karwica-mazurska-warminsko-mazurskie-samochod-wjechal-pod-pociag-zginelo-piec-osob-st8163836	Karwica Mazurska, warmińsko-mazurskie. Samochód wjechał pod pociąg, zginęło pięć osób - TVN24	Samochód osobowy, którym podróżowało pięć osób, wjechał pod pociąg na niestrzeżonym przejeździe kolejowym we wsi Karwica Mazurska (województwo warmińsko-mazurskie) - przekazał rzecznik prasowy komendanta wojewódzkiego policji w Olsztynie aspirant Tomasz Markowski. Wszyscy podróżujący autem - dwoje dorosłych i troje dzieci - zginęli na miejscu. 	None	2024-11-03 16:35:09	TVN24
pl	https://www.tokfm.pl/Tokfm/7,103086,31435047,szokujace-zachowanie-donalda-trumpa-czegos-takiego-sobie-nie.html	Szokujące zachowanie Donalda Trumpa. "Czegoś takiego sobie nie przypominam" - TOK FM	None	None	2024-11-03 13:48:00	TOK FM
pl	https://tvn24.pl/olsztyn/bisztynek-16-latek-postrzelony-przez-policje-ruszyl-na-funkcjonariuszy-z-siekiera-st8163728	Bisztynek. 16-latek postrzelony przez policję. Ruszył na funkcjonariuszy z siekierą - TVN24	Agresywny 16-latek, który ruszył na policjantów z siekierą, został przez nich postrzelony. Wcześniej nastolatek podpalił samochód i zdemolował mieszkanie oraz podwórko.	https://tvn24.pl/tvnwarszawa/najnowsze/cdn-zdjecie-5011205-policjanci-zatrzymali-49-latka-zdjecie-ilustracyjne-ph8160164/alternates/LANDSCAPE_1280	2024-11-03 13:13:48	TVN24
pl	https://www.money.pl/gospodarka/polka-z-pensylwanii-nastroje-sa-gorsze-niz-ich-realna-sytuacja-7087662047800064a.html	Polka z Pensylwanii: "Nastroje są gorsze niż ich realna sytuacja" - Money.pl	5 listopada w USA odbędą się wybory prezydenckie. Ich wynik jest trudny do przewidzenia, a o wszystkim mogą zadecydować głosy w tradycyjnie niezdecydowanych stanach, m.in. Pensylwanii, gdzie Polonia stanowi spory odsetek mieszkańców. - W moim odczuciu nastroje Amerykanów są gorsze niż ich realna sytuacja - mówi nam tam mieszkająca Polka.	https://v.wpimg.pl/MjFiYTRjYgsnCy9nfRFvHmRTez07SGFIM0tjdn1bf1p2EWl7NAMhDzQMKTt8DT8fNgguJHwaIUUnGTB7JFtiDi8aKTgzE2IPKws8MH0OLgglWT02YUcsCHVcdGBkWi5HfgtpMX9YfggnUWtlMAt5CSJLJA	2024-11-03 06:02:34	Money.pl
pl	https://wiadomosci.onet.pl/swiat/rosja-rozmiescila-7000-zolnierzy-z-korei-polnocnej-na-granicy-z-ukraina/lkexrhw	Ukraiński wywiad: 7000 gotowych do walki żołnierzy Korei Północnej na granicy z Ukrainą. Jest lista broni, którą mieli otrzymać od Rosjan - Wiadomości - Onet	Według ukraińskiego wywiadu wojskowego (GUR) w ostatnim tygodniu października Rosja rozmieściła na granicy z Ukrainą ponad 7000 wojskowych z Korei Północnej. Żołnierze Kim Dzong Una zostali tam przetransportowani przy pomocy co najmniej 28 wojskowych samolotów. Według tego samego źródła Rosja dostarczyła północnokoreańskim żołnierzom moździerze 60 mm, karabiny AK-12, karabiny maszynowe RPK/PKM, karabiny SVD/SVF, ATGM Phoenix i RPG-7.	https://ocdn.eu/pulscms-transforms/1/kwBk9kpTURBXy8xMzViOTI1NDkxYmM3YTRhZmI3YjVkZDFkMGZjNjI0Ni5qcGeTlQMAC80TiM0K_JMJpjI3ZTFlYgaTBc0EsM0Cdt4AAaEwAQ/relacja-telewizyjna-pokazujaca-przywodce-korei-polnocnej-kim-dzong-un-w-otoczeniu-polnocnokoreanskich-zolnierzy-podczas-jego-wizyty-w-bazie-wojskowej-w-zachodnim-rejonie-kraju-korea-polnocna-7-marca-2024-r-zdjecie-ilustracyjne.jpg	2024-11-03 13:12:06	Wiadomości - Onet
pl	https://www.pap.pl/aktualnosci/jak-zwyciestwo-trumpa-wplynie-na-bezpieczenstwo-polski-sondaz	Jak zwycięstwo Trumpa wpłynie na bezpieczeństwo Polski? Sondaż - PAP	None	None	2024-11-03 12:00:00	PAP
pl	https://www.wroclaw.pl/dla-mieszkanca/nie-przegapcie-kosmiczny-pociag-starlinkow-bedzie-mozna-zobaczyc-dzisiaj-0311-tylko-przez-kilka-minut	Nie przegapcie! Kosmiczny pociąg Starlinków będzie można zobaczyć dzisiaj (03.11.) tylko przez kilka minut! - Wrocław.pl	- Wieczorny przelot satelitów Starlink G10-13 przykuwa uwagę nie tylko miłośników astronomii, ale po prostu wszystkich którzy wczesnym wieczorem znajdują się pod rozgwieżdżonym niebem. Kosmiczny "pociąg", składający się z 23 jasnych satelitów o błękitnej barwie, będzie widoczny też dziś! - informuje Karol Wójcicki, popularyzator astronomii na swoim Facebooku "Z głową w gwiazdach". 	https://www.wroclaw.pl/cdn-cgi/image/w=1200,h=630,fit=crop,f=jpeg/beta2/files/news/676037/main/starlink8.jpg	2024-11-03 14:50:43	Wrocław.pl
pl	https://wiadomosci.onet.pl/kraj/tajemnicze-zaginiecie-beaty-klimek-byly-oficer-cbs-o-jednej-z-hipotez-to-nielogiczne/3xqflpk	Tajemnicze zaginięcie Beaty Klimek. Były oficer CBŚ o jednej z hipotez. "To wręcz nielogiczne" - Wiadomości - Onet	— Jest taka zasada, że najważniejsze są pierwsze godziny od zaginięcia. Dlatego tak ważne jest, żeby policja od razu przyjęła zgłoszenie, a nie mówiła, że musi minąć 24, albo nawet 48 godzin. To na pewno niestandardowa sytuacja, że kobieta z trójką dzieci na utrzymaniu znika i nikt nie wie, co się z nią dzieje — mówi w rozmowie z Onetem pułkownik Maciej Karczyński, były funkcjonariusz policji oraz były rzecznik ABW. Ekspert wskazuje dwie główne hipotezy: jedną z nich jest ewentualny konflikt rodzinny.	https://ocdn.eu/pulscms-transforms/1/H2Zk9kpTURBXy8yNGM3ZjQ1ZWU5OTM3MzFkODgzZmFkZWRiMzZiMjEzYi5qcGeTlQMAAM0EsM0Co5MJpjI3MDgzNAaTBc0EsM0Cdt4AAaEwAQ/zaginiona-beata-klimek.jpg	2024-11-03 18:31:00	Wiadomości - Onet
pl	https://www.rp.pl/wybory-w-usa/art41389651-pensylwania-niespodziewany-punkt-ciezkosci-ameryki	Jeden amerykański stan może przesądzić o losie USA, Europy i Azji - Rzeczpospolita	Rzeczywiście, wszystko zdaje się popierać tę lansowaną – i na pierwszy rzut oka aż nieprawdopodobną – tezę, że o wyniku amerykańskich wyborów zdecyduje ostatecz	https://i.gremicdn.pl/image/free/bbcb2607d0b4f9289bad3dde2a85c1ed/efektowny-mural-z-wiceprezydentka-kamala-harris-na-glownej-ulicy-dzielnicy-kulturalnej-cultural-district-pittsburgha?t=crop:3420:2121:nowe:0:222,resize:fill:2000:1250&ctx=preview	2024-11-03 16:25:00	Rzeczpospolita
pl	https://www.onet.pl/informacje/onetwiadomosci/wybory-w-usa-w-nocy-wpadl-najbardziej-sensacyjny-sondaz-tych-wyborow-bardzo-dobra/f9d20kq,d18cb688	Wybory w USA. W nocy wpadł najbardziej sensacyjny sondaż tych wyborów. Bardzo dobra grupa badawcza... - Onet	Wybory w USA. W nocy wpadł najbardziej sensacyjny sondaż tych wyborów. Bardzo dobra grupa badawcza - Selzer, która mega dokładnie przewidywała wyniki ostatnich 10 wyborów w stanie Iowa, pokazała, jaka jest teraz tam sytuacja. A to bardzo ważny prognostyk.	https://ocdn.eu/pulscms-transforms/1/S1Ek9kpTURBXy85ZjBlODRhMTcxNDgxZTk0MDAzZGMyZmEzZmQxOTJmMS5qcGeRkwXNBLDNAnTeAAOhMAGhMQGhM8M	2024-11-03 14:29:50	Onet
pl	https://warszawa.wyborcza.pl/warszawa/7,54420,31435198,doniesienie-do-prokuratury-na-antoniego-macierewicza-za-jazde.html	Doniesienie do prokuratury na Macierewicza za szaloną jazdę z wyprzedzaniem na pasach. Poseł PiS broni się Tuskiem - Wyborcza - Warszawa	None	None	2024-11-03 16:07:00	Wyborcza - Warszawa
pl	https://wiadomosci.onet.pl/swiat/wybory-w-moldawii-doradca-mai-sandu-alarmuje-o-masowej-ingerencji-rosji/x0te3mg	"Masowa ingerencja Rosjan" w wybory w Mołdawii. Doradca Mai Sandu alarmuje - Wiadomości - Onet	None	None	2024-11-03 14:49:02	Wiadomości - Onet
pl	https://www.onet.pl/informacje/onetwarszawa/pozar-restauracji-w-centrum-warszawy-ewakuacja-kilkudziesieciu-osob/zhd706r,79cfc278	Pożar restauracji w centrum Warszawy. Ewakuacja kilkudziesięciu osób - Onet	W restauracji przy ulicy Poznańskiej 37 w centrum Warszawy doszło w niedzielę do pożaru. Ewakuowano około 50 osób. Nikomu nic się nie stało. W trakcie akcji gaśniczej strażacy wynieśli na zewnątrz 10 butli z gazem.	https://ocdn.eu/pulscms-transforms/1/H92k9kpTURBXy80ZmYzMmYzNTM1MzU4ZDA1N2QyNDA4YWQ4ODQzMmZhNi5qcGeSlQPNAYxIzRAkzQkTkwXNBLDNAnTeAAOhMAGhMQGhM8M	2024-11-03 19:22:00	Onet
pl	https://www.polsatnews.pl/wiadomosc/2024-11-03/piorun-uderzyl-w-kosciol-w-ugandzie-zginelo-14-osob/	Tragedia podczas mszy. Nie żyje 14 osób, w tym nieletni - polsatnews.pl	Co najmniej 14 osób nie żyje, a ponad 30 jest rannych po uderzeniu pioruna w kościele w Ugandzie. Do tragedii doszło, kiedy wierni z obozu dla uchodźców w Palabek zgromadzili się na modlitwie. Wielu z ofiar to nieletni.	https://ipla.pluscdn.pl/dituel/cp/yg/ygs5yfjb84j3fn5uebt4kjum5fnw8dyd.jpg	2024-11-03 17:21:00	polsatnews.pl
pl	https://www.polsatnews.pl/wiadomosc/2024-11-03/polityk-pis-na-wiecu-donalda-trumpa-europosla-uchwycily-kamery/	Polityk PiS tuż za Donaldem Trumpem. "Jesteśmy w Salem" - polsatnews.pl	Europoseł PiS Dominik Tarczyński wziął udział w wiecu Donalda Trumpa w Salem w Stanach Zjednoczonych. Polityk chwalił się swoją obecnością na wydarzeniu w mediach społecznościowych. Tarczyńskiego uchwyciły kamery. Polityk znalazł się również na zdjęciach opublikowanych przez samego Trumpa.	https://ipla.pluscdn.pl/dituel/cp/ai/aidbwafh5qf6phc8zbbt2wqkas2prqjp.jpg	2024-11-03 13:55:00	polsatnews.pl
pl	https://oko.press/trzaskowski-albo-psikus-kogo-wystawi-tusk	Trzaskowski albo psikus. Kogo wystawi Tusk w wyborach? - OKO.press	Radosław Sikorski już dwa razy próbował zostać kandydatem Platformy Obywatelskiej na prezydenta (w 2010 i 2020 roku) i dwa razy mu się nie udało. Próbuje ponownie. Czy przegra po raz trzeci?	https://cdn.oko.press/cdn-cgi/image/width=1200,quality=75/https://cdn.oko.press/2024/11/MNIE241016_014.jpg	2024-11-03 17:12:40	OKO.press
pl	https://wyborcza.pl/7,75398,31435294,tworca-red-is-bad-nie-bedzie-swiadkiem-koronnym.html	Twórca Red is Bad nie będzie świadkiem koronnym. "W grze jest jednak art. 60" - Gazeta Wyborcza	None	None	2024-11-03 15:03:17	Gazeta Wyborcza
pl	https://tvn24.pl/szczecin/koszalin-pieciomiesieczne-dziecko-z-podejrzeniem-pobicia-trafilo-do-szpitala-rodzice-z-zarzutami-st8162975	Posiniaczony niemowlak trafił do szpitala. Rodzice usłyszeli zarzuty - TVN24	Pięciomiesięczny niemowlak trafił do szpitala z podejrzeniem pobicia. Rodzice dziecka zostali zatrzymani, oboje byli pijani. W niedzielę zostali doprowadzeni do prokuratury i usłyszeli zarzuty.	https://tvn24.pl/najnowsze/cdn-zdjecie-8215233-03-1430-bartkowiak-0003-ph8163756/alternates/LANDSCAPE_1280	2024-11-03 15:42:48	TVN24
pl	https://sport.interia.pl/iga-swiatek/news-rywalka-juz-miala-ige-swiatek-a-tu-nastapil-nagly-zwrot-wta-,nId,7848666	Rywalka już "miała" Igę Świątek, a tu nastąpił nagły zwrot. WTA pod wrażeniem - Interia Sport	None	None	2024-11-03 17:40:39	Interia Sport
pl	https://news.google.com/rss/articles/CBMinAFBVV95cUxPMXpTclowYVBoYWVBQlJ3QWhpZWNUcjVaM0lQbW5HRVhFbDhqUUE2TjI4UmI2SFJ6YnBGWEwyaUhrejkxMk14RkRSdGQyeF9PMngyWFhDbWk3NTVQTkpDc0FZWWNVUERRZWJna3pFNS1DOE9FaEMzYWNQd2taRHZEUDV5dlc4RE1jaG5BdUYyN0NZejBOcDZjUlIxdk8?oc=5	Polscy turyści utknęli na Gerlachu. Zginęła jedna osoba - TVN24	W słowackich Tatrach doszło w sobotę do śmiertelnego wypadku. Turyści z Polski próbowali zdobyć Gerlach tak zwaną Drogą Tatarki, ale - jak przekazali słowaccy ratownicy - nie posiadali odpowiedniego sprzętu i utknęli na szczycie. W niedzielę ratownicy przetransportowali ciało Polaka, który zginął prowadząc grupę na najwyższy szczyt w Tatrach.	None	2024-11-03 16:12:38	TVN24
pl	https://wiadomosci.wp.pl/nocny-wypadek-w-slupsku-kierowca-wjechal-w-szesc-osob-jedna-nie-zyje-7088601725610752a	Całkowicie pijany wjechał w kilka osób. Dramat w Słupsku - WP Wiadomości	Do tragicznego wypadku doszło w nocy z soboty na niedzielę w Słupsku (woj. pomorskie) - podaje TVN24. 20-latek stracił panowanie nad prowadzonym autem i potrącił sześć osób idących chodnikiem. Nie żyje	https://v.wpimg.pl/M2VjOTE5YlM3CDlnak5vRnRQbT0sF2EQI0h1dmoEfwJmEmAyLFkoQDMaIHoiRzhCNx0_ejVZYlMmA2AidBopWyUaIzU8GihfNA8re3ADdFdjU3dnaFYuVGFHezF9V2AKYAl3eXYMLAEzCXZlfAIrAnQX	2024-11-03 05:41:23	WP Wiadomości
pl	https://noizz.pl/spoleczenstwo/czarnek-na-prezydenta-nowy-sondaz-pokazuje-czy-polityk-mialby-szanse/1fz6rq6	Czarnek na prezydenta? Nowy sondaż pokazuje, czy polityk miałby szanse - Noizz	Polacy wyrazili swoje zdanie	https://ocdn.eu/pulscms-transforms/1/Pjlk9kpTURBXy9lZGIxZmFkMTEzNTFmZDU0NzM0NTY2NzA0ZTIxOGQ3Ny5qcGeSlQMAAM0Hds0EMpMFzQSwzQJ23gACoTABoTEA	2024-11-02 12:28:05	Noizz
pl	https://niezalezna.pl/polityka/od-tego-czasu-donald-tusk-przesladuje-mnie-nieustannie-macierewicz-o-nagonce-ze-strony-szefa-rzadu/530285	„Od tego czasu Donald Tusk prześladuje mnie nieustannie”. Macierewicz o nagonce ze strony szefa rządu - Niezalezna.PL	- Dla pana Donalda Tuska, który jest silnym zwolennikiem Niemiec i Rosji, i moim zdaniem zależny w dużej mierze od obu tych państw, moje działanie antykomunisty	https://files.niezalezna.tech/images/upload/2024/11/03/n_9e6f81f614d377e5819558828ac0497e1dd7d459285201b38ce4b42f1d370060_c.jpg?r=1200,600	2024-11-03 12:40:56	Niezalezna.PL
pl	https://dorzeczy.pl/opinie/651553/tyszka-ostro-reaguje-na-slowa-zelenskiego-pluja-nam-w-twarz.html	Tyszka ostro reaguje na słowa Zełenskiego: Plują nam w twarz - Do Rzeczy	Stanisław Tyszka skomentował wypowiedź Wołodymyra Zełenskiego. – Zachowuje się bezczelnie wobec Polski – ocenił europoseł Konfederacji.	https://img.dorzeczy.pl/img/tyszka-ostro-reaguje-na-slowa-zelenskiego-pluja-nam-w-twarz/e0/7a/7742c64146d6f34efeb3f705d570.webp	2024-11-03 11:05:00	Do Rzeczy
pl	https://wiadomosci.onet.pl/kraj/mariusz-blaszczak-wzywa-do-dymisji-rzadu-po-wygranej-donalda-trumpa/cy1tbbx	Mariusz Błaszczak wychwala Donalda Trumpa. "Po jego wygranej, Tusk powinien podać się do dymisji" - Wiadomości - Onet	Zdaniem szefa klubu PiS, byłego wiceministra obrony narodowej Mariusza Błaszczaka, po zwycięstwie wyborczym Donalda Trumpa do dymisji powinien podać się nie tylko premier, ale cały rząd. Błaszczak na antenie Polsat News stwierdził, że wygrana Trumpa jest w interesie Polski.	None	2024-11-03 19:19:55	Wiadomości - Onet
pl	https://www.sport.pl/pilka/14,65039,31435684.html	Wielki hit ekstraklasy: Legia - Widzew [WYNIK, NA ŻYWO] Piłka nożna - Sport.pl	None	None	2024-11-03 18:53:00	Sport.pl
pl	https://wiadomosci.onet.pl/swiat/stany-zjednoczone-ostrzegaja-iran-harris-przed-trumpem-podsumowanie-nocy/j2e3phy	Stany Zjednoczone ostrzegają Iran. Harris przed Trumpem. Podsumowanie nocy - Wiadomości - Onet	Administracja Joego Bidena ostrzega irańskie władze przed dokonaniem kolejnego ataku na Izrael. Z kolei sondaż Ann Selzer i "Des Moines Register" wskazuje, że Kamala Harris wygrywa z Donaldem Trumpem w stanie Iowa. Noc z soboty na niedzielę była niebezpieczna w Ukrainie — Rosja zaatakowała Kijów za pomocą dronów. To najważniejsze wydarzenia minionej nocy.	https://ocdn.eu/pulscms-transforms/1/_whk9kpTURBXy8xYmRlYjBlZjA0YTA5ZjUwZDQxMDg5YTIzNTY5N2ExYi5qcGeTlQMAzHDNDhDNB-mTCaYwYmFhMmIGkwXNBLDNAnbeAAGhMAE/kamala-harris.jpg	2024-11-03 04:58:29	Wiadomości - Onet
pl	https://wiadomosci.wp.pl/chcial-zalozyc-sie-z-petru-o-prezydenta-nerwowa-reakcja-polityka-7088660746488576a	Chciał założyć się z Petru o prezydenta. Nerwowa reakcja polityka - WP Wiadomości	Łukasz Schreiber zaproponował zakład Ryszardowi Petru. - Załóżmy się, że każdy kandydat na prezydenta Prawa i Sprawiedliwości wyprzedzi o co najmniej dwie długości Szymona Hołownię - zaproponował poseł	https://v.wpimg.pl/MzliMGQwYhsNCzt0fgxvDk5Tby44VWFYGUt3ZX5Gf0pcEWIhOBsoCAkZImk2BTgKDR49aSEbYhscAGIxYFgpEx8ZISYoWCgXDgwpaGcUdEoOWnp_fEEsG1hEeXZjQWBDXFsvamFELElVC30jYRUsTU4U	2024-11-03 10:40:34	WP Wiadomości
pl	https://news.google.com/rss/articles/CBMiuwFBVV95cUxPU0RrSDBqR2huSFg4bzRWMUhxbFMtcE9CTVdUdUdYUGF4T1VDbnR6MVlMR2I4cFFtblMwbW54ekFaVzdXbnJ0VDY1dHJ1Rk82R3lqdzh5Yk9DbUxpWW9JbEZFeDNuNzlpWjVrbHhBV2c5UThCM2JXbTZJWDd1emVzeU9ZZDF3a3I5UjZxbTRmS2dHLVhrbXhGTVNOc3l6a1JFRmFPVkFHMWJGSFlMSm9rbGtpaHUyakZDUThV?oc=5	Grad goli w derbach Barcelony. Wyjątkowy triumf Roberta Lewandowskiego - Interia Sport	Kliknij i zobacz więcej.	https://i.iplsc.com/-/000K117M5YHI41RU-C461-F4.jpg	2024-11-03 17:14:45	Interia Sport
pl	https://www.sport.pl/tenis/7,64987,31435452,demolka-w-pojedynku-rywalek-swiatek-w-wta-finals-76-minut-i.html	Demolka w pojedynku rywalek Świątek w WTA Finals. 76 minut i po meczu Tenis - Sport.pl	Wyjątkowo jednostronne było drugie niedzielne starcie w grupie pomarańczowej w WTA Finals. Zarówno Coco Gauff jak i Jessica Pegula długo nie mogły znaleźć odpowiedniego rytmu na szybkiej nawierzchni w Rijadzie, ale zdecydowanie lepiej radziła sobie z tym młodsza z Amerykanek. Potrzebowała raptem 76 minut, aby pokonać swoją rywalką, której dyspozycje dobitnie ocenił Dawid Celt.	https://bi.im-g.pl/im/38/fa/1d/z31435576IER,TENNIS-WTAFINALS-.jpg	2024-11-03 17:05:19	Sport.pl
pl	https://wiadomosci.onet.pl/trojmiasto/niebezpieczna-noc-na-pomorzu-urzad-skarbowy-stanal-w-plomieniach/nfg85ce	Niebezpieczna noc na Pomorzu. Urząd Skarbowy stanął w płomieniach - Wiadomości - Onet	W dramatycznych okolicznościach, w nocy z soboty na niedzielę, doszło do pożaru Urzędu Skarbowego w Kartuzach. Jak podaje rzecznik prasowy kartuskiej straży pożarnej, kpt. Mateusz Pielowski, ogień, który wybuchł przy garażu obiektu, szybko objął konstrukcję dachową, elewację oraz poddasze głównego budynku. Wskazał również kwotę, na którą oszacowano straty.	None	2024-11-03 10:10:51	Wiadomości - Onet
pl	https://www.meczyki.pl/newsy/pilka-nozna/wjechal-z-pilka-do-wlasnej-bramki-tak-sie-traci-w-ekstraklasie-wideo/254215	Wjechał z piłką do własnej bramki! Tak się traci w Ekstraklasie [WIDEO] - Meczyki.pl	Radomiak Radom zremisował z Piastem Gliwice 1:1 (1:0) na własnym boisku. Obie bramki w niedzielnym spotkaniu były "wyjątkowej" urody.
