country_code	url	title	description	image_url	publish_date	source
pl	https://defence24.pl/wojna-na-ukrainie-raport-specjalny-defence24/nato-potwierdza-zolnierze-z-korei-polnocnej-sa-pod-kurskiem	Rutte: żołnierze z Korei Północnej są pod Kurskiem. Straty Rosji rosną - Defence24.pl	Mark Rutte oficjalnie potwierdził, że żołnierze z Korei Północnej zostali rozmieszczeni w obwodzie kurskim.	https://cdn.defence24.pl/2024/06/20/1920x1080px/UA8iOgqcLD8gea5Xb1xKx2tLcQb1BVDSSlU9OcW0.pa4z.jpg	2024-10-28 11:23:27	Defence24.pl
pl	https://www.fakt.pl/hobby/turystyka/jakie-zagrozenia-czyhaja-na-cmentarzu-nie-tylko-kieszonkowcy-i-zlodzieje/2576g64	Koniecznie zrób to po powrocie z cmentarza. Chodzi o bezpieczeństwo - Fakt.pl	Za chwilę Wszystkich Świętych, dlatego coraz częściej odwiedzamy groby i przygotowujemy się do listopadowych uroczystości. W tych dniach myślimy przede wszystkim o bliskich nam zmarłych, warto jedn...	https://ocdn.eu/pulscms-transforms/1/3x4k9kuTURBXy83ZTg4MzUzYS1iM2IxLTQ0NzktYjZjMy0xN2I3OGZmNWI0MDguanBlZ5KVAwMAzQn7zQWekwXNBLDNAnbeAAGhMAE	2024-10-28 12:24:01	Fakt.pl
pl	https://wydarzenia.interia.pl/kraj/news-aleksander-kwasniewski-o-partii-razem-trzeba-powiedziec-troc,nId,7844575	Aleksander Kwaśniewski: O partii Razem trzeba powiedzieć trochę prawdy - Interia Wydarzenia	Kliknij i zobacz więcej.	https://i.iplsc.com/-/000JZYODXIQ8VR9X-C461-F4.jpg	2024-10-28 17:30:00	Interia Wydarzenia
pl	https://wiadomosci.wp.pl/rosyjscy-dyplomaci-opuszczaja-polske-jest-termin-zamkniecia-konsulatu-7086525193960128a	Rosyjscy dyplomaci opuszczają Polskę. Jest termin zamknięcia konsulatu - WP Wiadomości	Ambasador Rosji w rozmowie z RIA Novosti poinformował, że władze polskie podały termin zamknięcia Konsulatu Generalnego…	None	2024-10-28 09:49:20	WP Wiadomości
pl	https://weszlo.com/2024/10/28/wisla-plock-zamyka-trybuny-dla-kibicow-oswiadczenie-klubu/	Wisła Płock zamknęła część trybun dla kibiców. Jaka będzie decyzja władz ligi? - Weszło	Wisła Płock zamyka część trybun do końca roku po skandalu, jaki miał miejsce podczas niedzielnego meczu z udziałem jej kibiców.	https://static.weszlo.com/cdn-cgi/image/quality=65,format=auto/2024/10/wisla-plock-race-scaled.jpg	2024-10-28 13:01:00	Weszło
pl	https://dorzeczy.pl/ekonomia/649411/rosyjska-gospodarka-notuje-najszybszy-wzrost-od-ostatniej-dekady.html	Rosyjska gospodarka notuje najszybszy wzrost od ostatniej dekady - Do Rzeczy	Rosyjska gospodarka poradziła sobie z zachodnimi sankcjami i obecnie notuje silny wzrost.	https://img.dorzeczy.pl/img/rosyjska-gospodarka-notuje-najszybszy-wzrost-od-ostatniej-dekady/65/98/df4a6429ec04bd97ce9d102f0d2f.webp	2024-10-28 17:15:00	Do Rzeczy
pl	https://businessinsider.com.pl/biznes/ulga-od-skladek-zus-ruszaja-wnioski/914q8y5	Ulga od składek ZUS. Ruszają wnioski - Business Insider Polska	W listopadzie mikroprzedsiębiorcy oraz komornicy sądowi będą mieli możliwość ubiegania się o zwolnienie z obowiązku opłacania składek na ubezpieczenia społeczne za wybrany miesiąc. To nowa forma ws...	https://ocdn.eu/pulscms-transforms/1/PYDk9kpTURBXy81ZTk4MjBiZWZiNDVhNWRjOTIyY2QwYTEwODY0YzE1OS5qcGeSlQMAP80H0M0EZZMFzQSwzQJ23gABoTAB	2024-10-28 09:29:11	Business Insider Polska
pl	https://www.money.pl/gospodarka/rynek-ropy-notuje-znaczaca-zmiane-po-weekendowym-ataku-izraela-7086516639521472a.html	Rynek ropy reaguje na atak na Iran. Mocne spadki. Co się dzieje? - Money.pl	Ceny ropy naftowej zanotowały w poniedziałek rano wyraźne spadki na światowych giełdach. Inwestorzy dość zaskakująco zareagowali na sobotni atak Izraela na Iran, który okazał się mniej destrukcyjny, niż przewidywano. Ropa naftowa amerykańska WTI oraz europejska Brent straciły na wartości ponad 7 proc.	https://v.wpimg.pl/NDhjN2U3YSUJCDgBekhsMEpQbFs8EWJmHUh0EHoCfHRYEn4dM1oiIRoPPl17VDwxGAs5QntDImsJGicdIwJhIAEZPl40SmEhBQgrVnpXLSVaWyoDZB52clAPYwZiC3xpCQ57BHgBfXNfCXoKNgQrc1lIMw	2024-10-28 09:20:27	Money.pl
pl	https://www.polsatnews.pl/wiadomosc/2024-10-28/zwrot-w-pogodzie-w-najblizszych-dniach-w-prognozach-deszcz-i-snieg/	Nowa prognoza na Wszystkich Świętych. Kiedy spodziewać się śniegu? - polsatnews.pl	Najbliższe dni przyniosą istotną zmianę pogody - informuje IMGW. Do końca października powinno być ciepło, ale także pochmurnie i deszczowo. 1 listopada również warto mieć ze sobą parasol, a także przygotować się na silny wiatr. Kolejne dni przyniosą ze sobą ochłodzenie, a nawet opady śniegu.	https://ipla.pluscdn.pl/dituel/cp/e8/e8da1o45f9zr2vnhhd8x8umdspmmhzfr.jpg	2024-10-28 16:48:00	polsatnews.pl
pl	https://www.money.pl/gospodarka/urzedy-odchodza-od-papieru-minister-podal-date-7086505521511104a.html	Urzędy odchodzą od papieru. Minister podał datę - Money.pl	Do 2035 roku chcemy wyjść z papieru, co oznacza, że wszystkie usługi w administracji, jakie oferuje państwo, będą online - zapowiedział wicepremier, minister cyfryzacji Krzysztof Gawkowski na antenie radiowej Jedynki.	https://v.wpimg.pl/ODljOTE2YCUNCDlnakltME5QbT0sEGNmGUh1dmoDfXRcEn97I1sjIR4PPztrVT0xHAs4JGtCI2sNGiZ7MwNgIAUZPzgkS2AhAQgqMGpRenYIXS41dx94d1VeYmAkV3lpVQ97YmgKK3JbWHdtJgt-cglIMg	2024-10-28 08:45:29	Money.pl
pl	https://www.onet.pl/informacje/onetwarszawa/15-roczne-dziecko-wypadlo-z-okna-jest-w-krytycznym-stanie/h8yzmtw,79cfc278	1,5-roczne dziecko wypadło z okna. Jest w krytycznym stanie - Onet	1,5-roczne dziecko wypadło z okna na chodnik przy ul. Działdowskiej na warszawskiej Woli. Do dramatycznego zdarzenia doszło w poniedziałek. Dziecko trafiło do szpitala w stanie krytycznym.	https://ocdn.eu/pulscms-transforms/1/JuYk9kpTURBXy81ZjNjMjAxNzRlODUxZjk3OGM1MzBkMmQ4ZGIwM2E3YS5qcGeSlQMAzLPNFn3NDKmTBc0EsM0CdN4AA6EwAaExAaEzww	2024-10-28 16:10:00	Onet
pl	https://www.polsatnews.pl/wiadomosc/2024-10-28/strzelanina-w-austrii-trwa-oblawa-za-groznym-napastnikiem/	Strzelanina w Austrii. Trwa obława za groźnym napastnikiem - polsatnews.pl	Co najmniej dwie osoby zginęły w strzelaninie w Austrii. Jedną z ofiar jest burmistrz gminy Kirchberg, druga to lokalny myśliwy. Trwa obława za napastnikiem. Służby ostrzegają, że może mieć on broń i jest wyjątkowo niebezpieczny. Austriackie media podają, że w czasie ucieczki napastnik zabił trzecią osobę, jednak policja jeszcze nie potwierdziła tych informacji.	https://ipla.pluscdn.pl/dituel/cp/ae/aeb2f86zts5rgw6j49stiaseh5rh7b54.png	2024-10-28 11:26:00	polsatnews.pl
pl	https://www.money.pl/gospodarka/kurs-dolara-najwyzszy-od-czerwca-przekroczyl-kluczowa-granice-7086520496011936a.html	Kurs dolara najwyższy od czerwca. Przekroczył kluczową granicę - Money.pl	Amerykańska waluta umacnia się względem złotego. W poniedziałek 28 października kurs dolara przekroczył poziom 4 zł po raz pierwszy od czterech miesięcy. Na początku sesji trzeba było za niego zapłacić 4,02 zł. Sytuację komentują eksperci.	https://v.wpimg.pl/YTdhNDVkdjUFCjh3eRB7IEZSbC0_SXV2EUp0Znlaa2RUEH5rMAI1MRYNPit4DCshFAk5NHgbNXsFGCdrIFp2MA0bPig3EnYxCQorIHkJPWJVDnonZEZpZVcKY3BkDzx5XFx6d3tYPzAFWy9zN19sMFVKMw	2024-10-28 09:32:38	Money.pl
pl	https://www.pap.pl/aktualnosci/usa-juz-glosuja-joe-biden-oddal-glos-na-kamale-harris	USA już głosują. Joe Biden oddał głos na Kamalę Harris - PAP	None	None	2024-10-28 18:43:00	PAP
pl	https://www.rp.pl/spoleczenstwo/art41359711-pozyczki-dla-rodzicow-i-handel-skarpetkami-na-co-wydawal-pieniadze-ksiadz-michal-olszewski	Pożyczki dla rodziców i handel skarpetkami. Na co wydawał pieniądze ksiądz Michał Olszewski - Rzeczpospolita	None	None	2024-10-28 06:32:00	Rzeczpospolita
pl	https://www.onet.pl/informacje/onetwiadomosci/radoslaw-sikorski-odpowiada-marii-zacharowej-to-calkowicie-nieakceptowalne/xvnpqhb,79cfc278	Radosław Sikorski odpowiada Marii Zacharowej. "To nieakceptowalne" - Onet	To Gruzja i Unia Europejska będą decydować o wzajemnym partnerstwie, a nie rzeczniczka rosyjskiego MSZ — stwierdził szef polskiej dyplomacji Radosław Sikorski, który składa wizytę w Holandii.	https://ocdn.eu/pulscms-transforms/1/aCSk9kpTURBXy9mZjM4MTg3M2UxZjZkZjVkYWVmYWI0MmUxMjhlYzY1ZS5qcGeSlQMAzQEAzSAAzRIAkwXNBLDNAnTeAAOhMAGhMQGhM8M	2024-10-28 16:41:00	Onet
pl	https://wiadomosci.gazeta.pl/wiadomosci/7,114883,31419904,zazalenie-na-areszt-dla-buddy-jest-decyzja-sadu.html	Zażalenie na areszt dla Buddy. Jest decyzja sądu. "Okres stosowania aresztu uległ zmianie" - wiadomosci.gazeta.pl	None	None	2024-10-28 14:36:45	wiadomosci.gazeta.pl
pl	https://dorzeczy.pl/opinie/649468/awpl-zchr-przypieczetowala-swoje-zwyciestwo-na-wilenszczyznie.html	AWPL-ZChR przypieczętowała swoje zwycięstwo na Wileńszczyźnie - Do Rzeczy	Dr Bogusław Rogalski | Minęła druga tura wyborów parlamentarnych na Litwie w okręgach jednomandatowych. Wyniki wyborcze jak puzzle ułożone zostały na powyborczym stole, a mandaty poselskie przydzielone we wszystkich okręgach.	https://img.dorzeczy.pl/img/awpl-zchr-przypieczetowala-swoje-zwyciestwo-na-wilenszczyznie/cd/e4/4e0b788917aa0d238a021f913c98.webp	2024-10-28 20:34:00	Do Rzeczy
pl	https://businessinsider.com.pl/nieruchomosci/muzeum-sztuki-nowoczesnej-w-warszawie-ile-kosztowalo/wzcqm3r	Ile kosztowało Muzeum Sztuki Nowoczesnej w Warszawie? - Business Insider Polska	Muzeum Sztuki Nowoczesnej w Warszawie oficjalnie otworzyło swoje drzwi dla publiczności. Jego utrzymanie będzie kosztowne — pochłonie około 20 mln zł rocznie. Skąd miasto weźmie na to pieniądze?	https://ocdn.eu/pulscms-transforms/1/dkCk9kpTURBXy81NjBiMDRlYjk3ZjU3ZWJlYzk5ZTc5MWUxMWNmM2U4ZC5qcGeSlQMAzE_NB9DNBGWTBc0EsM0Cdt4AAaEwAQ	2024-10-28 14:55:29	Business Insider Polska
pl	https://www.rp.pl/przestepczosc/art41362221-pawel-sz-chcial-wrocic-bo-nie-chcial-byc-scigany-jak-najgrozniejszy-przestepca	Paweł Sz. chciał wrócić, bo nie chciał być ścigany jak najgroźniejszy przestępca - Rzeczpospolita	Paweł Sz., twórca marki Red is Bad, jeszcze w tym tygodniu może być deportowany do Polski. Trafi do aresztu na 30 dni.	https://i.gremicdn.pl/image/free/fead582af7905022f4d47c8fdae75aa0/?t=crop:2000:1240:nowe:0:47,resize:fill:2000:1250&ctx=preview	2024-10-28 19:01:25	Rzeczpospolita
pl	https://dorzeczy.pl/ekonomia/649054/dziemianowicz-bak-zlozyla-jasna-deklaracje-chodzi-o-800-plus.html	Dziemianowicz-Bąk złożyła jasną deklarację. Chodzi o 800 plus - Do Rzeczy	Minister rodziny, pracy i polityki społecznej Agnieszka Dziemianowicz-Bąk odpowiedziała na pojawiające się w ostatnim czasie spekulacje na temat ograniczenia 800 plus.	https://img.dorzeczy.pl/img/koniec-z-800-plus-jasna-deklaracja-minister/f2/1c/f56exx288647d0f630f660c090cf.webp	2024-10-28 09:00:00	Do Rzeczy
pl	https://wiadomosci.wp.pl/spor-o-wolna-wigilie-czarzasty-zaskoczyl-u-olejnik-7086662932122304a	Spór o wolną Wigilię. Czarzasty zaskoczył u Olejnik - WP Wiadomości	Trwa dyskusja nad pomysłem Lewicy ws. wolnej Wigilii. Anna Maria Żukowska ostro odpowiada Ryszardowi Petru. Tymczasem Włodzimierz Czarzasty zaskakuje wyznaniem, co robią tego dnia mężczyźni w pracy.	https://v.wpimg.pl/YjYwYWFkdgs4FS9kaRB7HntNez4vSXVILFVjdWlaa1ppD3YxLwc8GDwHNnkhGSwaOAApeTYHdgspHnYhd0Q9AyoHNTY_RDwHOxI9eHcKP11oTjhka1tpCGhabWcgD3RSaEQ4encIOwhvRzg2Il06X3sK	2024-10-28 20:35:58	WP Wiadomości
pl	https://www.polsatnews.pl/wiadomosc/2024-10-28/nowa-szansa-na-pokoj-zelenski-ujawnia-potencjalne-miejsce-rozmow/	Zełenski wskazał kraj. Prezydent Ukrainy chce szczytu pokojowego - polsatnews.pl	Premier Indii Narendra Modi może wpłynąć na zakończenie naszej wojny z Rosją, a drugi szczyt pokojowy może odbyć się w każdej szanowanej stolicy świata, w tym w Nowym Delhi - powiedział Wołodymyr Zełenski w wywiadzie z The Times of India.	https://ipla.pluscdn.pl/dituel/cp/6t/6tjyfepzo1gefy14eywzksjcjfxuh5bz.jpg	2024-10-28 13:04:00	polsatnews.pl
pl	https://warszawa.wyborcza.pl/warszawa/7,54420,31418105,otwarcie-linii-tramwajowej-do-wilanowa-bez-zmian-tras-autobusow.html	Otwarcie linii tramwajowej do Wilanowa już we wtorek. Bez zmian tras autobusów - Wyborcza - Warszawa	None	None	2024-10-28 04:56:00	Wyborcza - Warszawa
pl	https://wiadomosci.onet.pl/kraj/donald-trump-ma-plan-zakonczenia-wojny-znamy-szczegoly/kvjqy21	Donald Trump ma plan zakończenia wojny. Znamy szczegóły - Wiadomości - Onet	Pokojowa propozycja kandydata USA na prezydenta opiera się na kilku kluczowych punktach. Wśród nich znalazło się m.in. zamrożenie konfliktu, które ma umożliwić m.in. skuteczna presja ekonomiczna na rosyjskiego prezydenta — podaje portal RBC Ukraina. Nie wszystkie założenia planu spodobają się stronie ukraińskiej.	https://ocdn.eu/pulscms-transforms/1/XxZk9kuTURBXy8zOWMyNWIwNS1iMzkzLTQ2MTUtYmFiZC05MGVmYjk0M2FhZTYuanBlZ5OVAwDMV80XcM0NMJMJpjgyYzU0NQaTBc0EsM0Cdt4AAaEwAQ/donald-trump.jpg	2024-10-28 20:50:55	Wiadomości - Onet
pl	https://legionisci.com/news/98019_Plusy-i-minusy-po-meczu-z-GKS-em.html	Plusy i minusy po meczu z GKS-em - Legionisci.com	None	None	2024-10-28 18:35:41	Legionisci.com
pl	https://kultura.onet.pl/muzyka/wiadomosci/nieznane-dzielo-fryderyka-chopina-ekspert-zwraca-uwage-na-cechy-nietypowe/e4lx0wm	Nieznane dzieło Fryderyka Chopina. Dyrektor Instytutu Chopina zwraca uwagę na "cechy nietypowe" - Onet	None	None	2024-10-28 13:46:44	Onet
pl	https://news.google.com/rss/articles/CBMinwFBVV95cUxNWkpyUjVwaUN3OHVRdzZ6LTBtSW42X2JLcE80MTg0MDhxN1A4U3FqZVR3UVFvV2VVemw4WDEzdTBQR29OS0ppNmk2ZVpyRUFPV0NoUk41RHRGVzVWSDNBV1A2ckRrYzR6cjY3NlRfdldaZkhNUEVYQkJsWlRjaWlFMHZ2MlpiZGhzalRPRUpIRjIyQzBWQlgzVGFsejNURlU?oc=5	Nieprawidłowości w wyborach w Gruzji. Zdecydowana deklaracja USA - Wiadomości - Onet	None	None	2024-10-28 20:10:55	Wiadomości - Onet
pl	https://news.google.com/rss/articles/CBMivgFBVV95cUxOTk1LQlRHNFlVaF83TmwtQXJMU1FTY09KTG5KUV9SVG90M0dNNWZCbUNXbEtJTGlGOFlLWDRaWG9MMnB6VE12U1c2OVRaN1ZQZjZRRU9yaHNKN2NXaHIyd2NYVE9RRzBHZTZST1JCQVJHanFZZ0ZReUU5TEhmbEdGRzFKU3YydWt0TTFVcGt2NnJGTU5yTnpoeXBxTG1iQ0s4T21tenRfb2xnd0F1Y2hhZ3Brbm5HWTNEY0s1MzVR?oc=5	"Potrzebny jest twardy prezydent". Kolejny kandydat ogłasza start w wyborach - polsatnews.pl	Marek Jakubiak zadeklarował, że wystartuje w wyborach prezydenckich. Jestem gotów wziąć odpowiedzialność za losy Polski - przekonywał poseł Wolnych Republikanów.	https://ipla.pluscdn.pl/dituel/cp/vc/vcvzmkqmfmq1dz87ez48b86jux7niy26.jpg	2024-10-28 20:05:00	polsatnews.pl
pl	https://dorzeczy.pl/opinie/649450/wybory-prezydenckie-zukowska-moja-partia-podjela-juz-decyzje.html	Wybory prezydenckie. Żukowska: Moja partia podjęła już decyzję - Do Rzeczy	Jak przekazała Anna Maria Żukowska, kandydat lewicy na prezydenta zostanie zaprezentowany na przełomie roku.	https://img.dorzeczy.pl/img/zukowska-moja-partia-podjela-juz-decyzje/34/f5/93f1b2433e7e7b0127aaeab2151e.webp	2024-10-28 19:23:00	Do Rzeczy
pl	https://wiadomosci.onet.pl/kraj/reforma-trybunalu-konstytucyjnego-w-rekach-tk-znamy-termin-rozprawy/d7ymfwt	Reforma Trybunału Konstytucyjnego w rękach TK. Znamy termin rozprawy - Wiadomości - Onet	None	None	2024-10-28 18:18:54	Wiadomości - Onet
pl	https://www.se.pl/trojmiasto/zdroje-trzy-osoby-zginely-w-zderzeniu-z-tirem-wiemy-kim-byly-ofiary-zaloba-w-gdansku-aa-XfvF-6DQa-esBQ.html	Nie miały szans w zderzeniu z tirem! Wiemy, kim były ofiary makabry na DK20 - Super Express	None	None	2024-10-28 15:11:00	Super Express
pl	https://wyborcza.pl/7,75398,31421623,kto-w-drugiej-turze-pokonalby-kandydata-pis-znamy-wyniki-wewnetrznych.html	Kto w drugiej turze pokonałby kandydata PiS? Znamy wyniki wewnętrznych badań KO - Gazeta Wyborcza	None	None	2024-10-28 16:54:00	Gazeta Wyborcza
pl	https://wiadomosci.onet.pl/swiat/atak-izraela-na-iran-uderzyl-tez-w-putina-rosja-pozbawiona-poteznej-broni/3x2j3pw	Atak odwetowy Izraela na Iran uderzył także w Putina. Kreml został właśnie pozbawiony potężnego atutu - Wiadomości - Onet	None	None	2024-10-28 13:30:21	Wiadomości - Onet
pl	https://www.sport.pl/pilka/7,64946,31422440,tak-vinicius-skomentowal-wyniki-zlotej-pilki-ponad-14-5-mln.html	Tak Vinicius skomentował wyniki Złotej Piłki. Ponad 14,5 mln wyświetleń - Sport.pl	None	None	2024-10-28 22:55:00	Sport.pl
pl	https://wydarzenia.interia.pl/felietony/news-prawo-i-piesc,nId,7844635	Ta fatamorgana była sensem polityki i PiS-u [OPINIA] - Interia Wydarzenia	Kliknij i zobacz więcej.	https://i.iplsc.com/-/000JZWJNMD111295-C461-F4.jpg	2024-10-28 10:27:20	Interia Wydarzenia
pl	https://dorzeczy.pl/kraj/649345/janusz-palikot-zostaje-w-areszcie-sad-zdecydowal.html	Janusz Palikot zostaje w areszcie. Sąd zdecydował - Do Rzeczy	Janusz Palikot pozostanie w areszcie bez możliwości zwolnienia za kaucją - zdecydował Sąd Okręgowy we Wrocławiu, który przychylił się do zażalenia prokuratury.	https://img.dorzeczy.pl/img/sad-zdecydowal-w-sprawie-aresztu-dla-palikota/4a/84/6f52c51e6d1f03bc6b5c5d477f37.webp	2024-10-28 14:24:00	Do Rzeczy
pl	https://www.polsatnews.pl/wiadomosc/2024-10-28/wybory-prezydenckie-w-usa-kamala-harris-wysuwa-sie-na-prowadzenie/	Harris prowadzi w sondażach. Kobiety dają jej przewagę - polsatnews.pl	Kamala Harris wysuwa się na prowadzenie w ogólnokrajowych sondażach w USA. Do tej pory kandydaci mieli niemal identyczne poparcie. Na reprezentantkę demokratów chętniej głosują kobiety, z kolei Donald Trump cieszy się uznaniem wśród mężczyzn. To jednak nie wszystkie wnioski, jakie płyną z szeroko prowadzonych badań na kilka dni przed wyborami w USA.	https://ipla.pluscdn.pl/dituel/cp/y5/y5p77vacmwmaciw1k2u6psx48t6wb86z.png	2024-10-28 08:23:00	polsatnews.pl
pl	https://businessinsider.com.pl/praca/czy-sztuczna-inteligencja-moze-zastapic-dziennikarzy/m6r540j	"Kontynuacja projektu jest bezcelowa". Jak Radio Kraków wpadło w pułapkę technofeudalizmu - Business Insider Polska	Zastąpili ludzi botami AI, a kiedy wybuchła afera, nazwali to "eksperymentem badawczo-medialnym". W związku z falą krytyki, jaka przetoczyła się przez media, "badanie" zakończono po niecałym tygodn...	https://ocdn.eu/pulscms-transforms/1/XTnk9kpTURBXy9mNzI3Y2FlYzNhMGY3ZGU1MTkyYzhmZWU0NWQ4MjFjYi5qcGeSlQMAzOjNHLzNEC6TBc0EsM0Cdt4AAaEwAQ	2024-10-28 11:28:53	Business Insider Polska
pl	https://www.pap.pl/aktualnosci/pis-przesuwa-termin-ogloszenia-nazwiska-kandydata-na-prezydenta-byly-premier-wyjasnia	PiS przesuwa termin ogłoszenia nazwiska kandydata na prezydenta. Były premier wyjaśnia dlaczego - PAP	None	None	2024-10-28 11:59:00	PAP
pl	https://businessinsider.com.pl/prawo/podatki/paczka-papierosow-po-27-zl-wiceminister-podal-plany-rzadu/dtvynhr	Paczka papierosów po 27 zł. Wiceminister podał plany rządu - Business Insider Polska	W 2027 r. paczka papierosów będzie kosztować 26-27 zł — powiedział wiceminister finansów Jarosław Neneman podczas obrad senackiej komisji, która omawiała nowelizację ustawy o akcyzie, podnoszącą op...	https://ocdn.eu/pulscms-transforms/1/tVRk9kpTURBXy85ZjQxZGYxYTc5NTEyY2I2YTA0ZTlhNDU2NTI3ZjcyYS5qcGeSlQMAzKPNFEDNC2STBc0EsM0Cdt4AAaEwAQ	2024-10-28 20:41:58	Business Insider Polska
pl	https://tvn24.pl/biznes/z-kraju/sluzby-w-siedzibie-cinkciarza-dzialania-na-zlecenie-prokuratury-st8155291	Służby w siedzibie Cinkciarza. "Działania na zlecenie prokuratury" - TVN24	Funkcjonariusze Centralnego Biura Śledczego Policji weszli w poniedziałek do siedziby polskiego fintechu Cinkciarz.pl w Zielonej Górze. Przedstawiciele spółki w odpowiedzi na pytania redakcji biznesowej tvn24.pl podkreślają, że prowadzone przez służby "działania są standardowymi czynnościami wynikającymi z toku prowadzonego postępowania w sprawie (a nie przeciwko)".	https://tvn24.pl/najnowsze/cdn-zdjecie-3983123-cbsp-ph8155310/alternates/LANDSCAPE_1280	2024-10-28 16:27:33	TVN24
pl	https://www.money.pl/gospodarka/ida-zmiany-przepisow-ws-zwolnien-lekarskich-prawniczka-zabiera-glos-7086604643871424a.html	Idą zmiany przepisów ws. zwolnień lekarskich. Prawniczka zabiera głos - Money.pl	Ministerstwo Rodziny, Pracy i Polityki Społecznej opracowało projekt ustawy, który zakłada m.in. nowe zasady kontroli zwolnień. - Proponowana treść nie wniesie w zasadzie nic nowego do prawniczej codzienności. Będą spory - ocenia w rozmowie z money.pl radca prawny Katarzyna Klemba.	https://v.wpimg.pl/NzIyNmRmYRsoGzhefRZsDmtDbAQ7T2JYPFt0T31cfEp5AX5CNAQiHzscPgJ8CjwPORg5HXwdIlUoCSdCJFxhHiAKPgEzFGEfJBsrCX1YfU0sTyxdMEAtQ3pLY1llWC1XK0ooVH9dLxh5G3lfYFsqHHlbMw	2024-10-28 19:18:37	Money.pl
pl	https://www.widzewtomy.net/pierwsze-tak-mocne-slowa-mysliwca-mamy-zachwianie-tozsamosci/	Pierwsze tak mocne słowa Myśliwca: „Mamy zachwianie tożsamości” - WidzewToMy	None	None	2024-10-28 20:37:00	WidzewToMy
pl	https://www.pap.pl/aktualnosci/volkswagen-zamierza-zamknac-trzy-fabryki-i-zwolnic-tysiace-pracownikow	Volkswagen zamierza zamknąć trzy fabryki i zwolnić tysiące pracowników - PAP	None	None	2024-10-28 16:25:00	PAP
pl	https://www.sport.pl/pilka/7,65082,31421963,laporta-i-perez-przylapani-sami-zobaczcie-co-zrobili-po-el.html	Laporta i Perez przyłapani. Sami zobaczcie, co zrobili po El Clasico - Sport.pl	None	None	2024-10-28 17:52:00	Sport.pl
pl	https://www.o2.pl/informacje/co-dalej-z-sebastianem-m-jest-ruch-msz-w-polowie-listopada-7086675736324768a	Co dalej z Sebastianem M.? Jest ruch MSZ. "W połowie listopada" - o2	Minister spraw zagranicznych Radosław Sikorski planuje w połowie listopada wizytę w Zjednoczonych Emiratach Arabskich, podczas której zamierza poruszyć sprawę Sebastiana M., podejrzanego o spowodowanie...	https://v.wpimg.pl/ZWYxZWI4dTY4GixkZk94I3tCeD4gFnZ1LFpgdWYFaGdpAGxgeRs8PjUdKDI5W3QwKw0qNj5EdCc1VzsnIBssZnYcMyQ5WDsudh03NSxQdWA9TjlmeQQ5em8cOGVkAGw0OlU7YXkEd2dqGz8xeFE4b2BObHU0	2024-10-28 20:03:00	o2
pl	https://www.polsatsport.pl/wiadomosc/2024-10-28/manchester-united-wybral-nowego-trenera-w-tle-wielkie-pieniadze/	Manchester United wybrał nowego trenera! W tle wielkie pieniądze - polsatsport.pl	Erik ten Hag w poniedziałek został zwolniony z funkcji trenera Manchesteru United. Wygląda na to, że szefowie Czerwonych Diabłów wybrali nowego szkoleniowca.	https://ipla.pluscdn.pl/dituel/cp/xn/xnbwxj41v6nwz9325ijqtehk6iemybm1.jpg	2024-10-28 18:20:00	polsatsport.pl
pl	https://www.fakt.pl/wydarzenia/swiat/usa-zamknela-swojego-partnera-w-walizce-mezczyzna-zmarl/619cz7j	Mówiła, że jej partner udusił się w walizce podczas zabawy w chowanego. Sąd nie dał wiary... - Fakt.pl	Winna. Taki werdykt usłyszała w piątek (25 października) 47-letnia Sarah Boone z Florydy oskarżona o zabójstwo swojego partnera. Kobieta starała się przekonać śledczych, że jej ukochany udusił się ...	https://ocdn.eu/pulscms-transforms/1/l2Zk9kuTURBXy8zZDI0YTI1MC1jNzc4LTRmM2YtOTE3MC00MzFiYmY2OThmMjUuanBlZ5KVAwAAzQeAzQQ4kwXNBLDNAnbeAAGhMAE	2024-10-28 14:55:00	Fakt.pl