country_code	url	title	description	image_url	publish_date	source
pl	https://www.polsatnews.pl/wiadomosc/2024-11-10/pogoda-imm/	Gęsta mgła i przymrozki. IMGW wydał ostrzeżenie - polsatnews.pl	Wydano ostrzeżenia pierwszego stopnia przed gęstą mgłą. Alert dotyczy południowowschodniej części Polski i krańców zachodniego regionu. W niektórych regionach pojawią się przymrozki, które spowodują trudne warunki na drodze. Podobnego stanu doświadczyli kierowcy z okolic Białki Tatrzańskiej. Droga Krajowa 49 w rejonie jest zablokowana przez 11 uszkodzonych aut.	https://ipla.pluscdn.pl/dituel/cp/en/en7bvtunbz3a39xk1gs7aqwh271z4ura.jpg	2024-11-10 12:44:00	polsatnews.pl
pl	https://www.money.pl/gospodarka/olbrzymi-gazowy-spichlerz-przy-granicy-ukraina-spoglada-na-polske-7089384382307040a.html	Olbrzymi "gazowy spichlerz" przy granicy. Ukraina spogląda na Polskę - Money.pl	Prezydent Ukrainy Wołodymyr Zełenski ma żal do Polski, że nie objęła ochroną powietrzną znajdujących przy granicy z Polską magazynów gazu. To największy w Europie kompleks mogący pomieścić 17 mld m sześc. gazu i kluczowy węzeł. W promieniu zaledwie 100 km znajdują się polskie magazyny i sieć gazowa.	https://v.wpimg.pl/YjhkYmMzdgsJCS9eYgF7HkpRewQkWHVIHUljT2JLa1pYE2lCKxM1DxoOKQJjHSsfGAouHWMKNUUJGzBCO0t2DgEYKQEsA3YPBQk8CWJIOlIMUmlbKFdpDFFbdFl6GThHCl07CWBOPFkOXjtVKRg6WVlJJA	2024-11-11 06:10:33	Money.pl
pl	https://tvn24.pl/swiat/przygotowania-do-wielkiej-kontrofensywy-rozmowa-trump-putin-trzesienie-ziemi-na-kubie-st8174097	Przygotowania do "wielkiej kontrofensywy", rozmowa Trump-Putin, trzęsienie ziemi na Kubie - TVN24	Rosja zgromadziła 50 tysięcy żołnierzy do kontrofensywy, której celem jest odbicie rosyjskich terenów zajętych przez Ukraińców w obwodzie kurskim. Prezydent elekt Donald Trump rozmawiał z Władimirem Putinem. Duży pożar wybuchł w Poznaniu tuż przed meczem Lecha z Legią. Z okazji obchodów Święta Niepodległości w poniedziałek ulicami Warszawy przejdzie marsz pod hasłem "Wielkiej Polski, moc to my". Oto sześć rzeczy, które warto wiedzieć w poniedziałek 11 listopada.	https://tvn24.pl/najnowsze/cdn-zdjecie-9184346-rosyjscy-zolnierze-w-obwodzie-kurskim-ph8173829/alternates/LANDSCAPE_1280	2024-11-11 04:36:00	TVN24
pl	https://wiadomosci.onet.pl/kraj/jacek-siewiera-o-wizycie-andrzeja-dudy-w-usa-nie-widzialem-walizek/05qw574	Jacek Siewiera o wizycie Andrzeja Dudy w USA. "Nie widziałem walizek" - Wiadomości - Onet	W piątek 8 listopada pojawiła się informacja o możliwej wizycie prezydenta Andrzeja Dudy w USA. — Prezydenckich walizek nie widziałem, bo ich nie było. Była rezerwacja lotu...Nawet nie rezerwacja. Było sprawdzenie gotowości, czy w ogóle są możliwości lotu — ujawnił na antenie Polsat News szef BBN Jacek Siewiera.	https://ocdn.eu/pulscms-transforms/1/v6Ok9kpTURBXy81YmY2YTI1ZjYzNjdlMGU2ZjQ4NzgwY2RmOGU1N2M1Yy5qcGeTlQMAzKPNFGPNC3eTCaZkZjRmNTUGkwXNBLDNAnbeAAGhMAE/jacek-siewiera.jpg	2024-11-11 07:32:10	Wiadomości - Onet
pl	https://www.polsatnews.pl/wiadomosc/2024-11-11/niemcy-glosowanie-nad-wotum-mozliwe-jeszcze-w-tym-roku-kanclerz-zabral-glos/	Głosowanie nad wotum możliwe jeszcze w tym roku. Kanclerz Niemiec zabrał głos - polsatnews.pl	- Zwołanie wotum zaufania jeszcze przed Bożym Narodzeniem nie jest dla mnie żadnym problemem - stwierdził kanclerz Niemiec Olaf Scholz. Jednocześnie dodał, że nie jest przywiązany do swojego stanowiska. Wcześniej polityk mówił, że głosowanie zostało zaplanowane w połowie stycznia. Po tym, jak rozpadła się koalicja rządowa Niemiec, prezydent kraju ogłosił gotowość do wcześniejszych wyborów.	https://ipla.pluscdn.pl/dituel/cp/3e/3e2xx7kevdba3e4qba88nvkcjv6j48yf.jpg	2024-11-11 06:49:00	polsatnews.pl
pl	https://businessinsider.com.pl/wiadomosci/kolejny-rosyjski-atak-na-ukraine-alarm-przeciwlotniczy-w-calym-kraju/vdz4mnv	Kolejny rosyjski atak na Ukrainę. Alarm przeciwlotniczy w całym kraju - Business Insider Polska	W poniedziałek nad ranem rosyjskie lotnictwo przeprowadziło atak na Ukrainę. W Kijowie słychać było wybuchy, ale alarm ogłoszono także w innych regionach.	https://ocdn.eu/pulscms-transforms/1/sLik9kpTURBXy9mZmY4MDk4ODU2YjY5ZDhiMmM0NjQwNmNmMTQwMTcxOC5qcGeSlQMAP80H0M0EZZMFzQSwzQJ23gABoTAB	2024-11-11 09:04:34	Business Insider Polska
pl	https://natemat.pl/576311,kaczynski-po-miesiecznicy	Stroboskopy i piszczałki. Pomysłowość fanów Kaczyńskiego jest imponująca - naTemat.pl	Jarosław Kaczyński zorganizował wczoraj całą serię imprez dla swoich zwolenników. Była msza, społeczne obchody Święta Niepodległości, marsz pamięci, miesięcznica i tradycyjne zamieszki pod pomnikiem ofiar katastrofy smoleńskiej. Tam fani prezesa PiS zaprezentowali cały arsenał nowych środków na zakłócaczy miesięcznicy. Mieli ze sobą stroboskopy i przeraźliwie piszczące piszczałki.	https://m.natemat.pl/b01e4417d0a6590d40ec5998cd1687d3,1200,0,0,0.jpg	2024-11-11 06:48:36	naTemat.pl
pl	https://businessinsider.com.pl/wiadomosci/z-bialego-domu-do-sadu-najwyzszego-media-o-przyszlosci-kamali-harris/f790ltn	Zamiast Białego Domu Sąd Najwyższy? Media o przyszłości Kamali Harris - Business Insider Polska	Wiceprezydent Kamala Harris może być potencjalną kandydatką do Sądu Najwyższego USA — spekuluje CNN. Jeśli 70-letnia sędzia Sonia Sotomayor przejdzie na emeryturę, Joe Biden będzie mógł nominować n...	https://ocdn.eu/pulscms-transforms/1/B5zk9kpTURBXy9hMjQ1OWNmNTU5OTM5YWUwYzdmMjBmYWJlNDFmYzc1NS5qcGeSlQMAzKbNB9DNBGWTBc0EsM0Cdt4AAaEwAQ	2024-11-10 16:43:29	Business Insider Polska
pl	https://sport.interia.pl/tenis/news-sabalenka-zabrala-glos-po-porazce-w-rijadzie-ukochany-od-raz,nId,7853306	Sabalenka zabrała głos po porażce w Rijadzie. Ukochany od razu zareagował - Interia Sport	Kliknij i zobacz więcej.	https://i.iplsc.com/-/000K2I3WIGO4G2VB-C461-F4.jpg	2024-11-11 05:00:00	Interia Sport
pl	https://dorzeczy.pl/opinie/654406/wojna-na-ukrainie-scholz-chce-rozmawiac-z-putinem.html	Wojna na Ukrainie. Scholz chce rozmawiać z Putinem - Do Rzeczy	– Planuję porozmawiać we właściwym czasie z prezydentem Rosji – przekazał kanclerz Niemiec Olaf Scholz.	https://img.dorzeczy.pl/img/wojna-na-ukrainie-scholz-chce-rozmawiac-z-putinem/66/95/a844a54ab091a15be317668c213d.webp	2024-11-11 08:54:00	Do Rzeczy
pl	https://tvn24.pl/ciekawostki/swieto-niepodleglosci-rogal-swietomarcinski-w-bbc-gwiazda-legendarny-i-niesamowity-st8174215	"Gwiazda", "legendarny", "niesamowity". BBC o polskim przysmaku na 11 listopada - TVN24	Mieszkańcy Poznania celebrują dziś nie tylko Święto Niepodległości, ale też imieniny ulicy Święty Marcin. O przysmaku związanym z dniem patrona jednej z głównych poznańskich ulic - rogalu świętomarcińskim - przypomniało z tej okazji brytyjskie BBC, nazywając go "legendarnym" i "niesamowitym". 	https://tvn24.pl/najnowsze/cdn-zdjecie-2985020-obchody-imienin-ulicy-swiety-marcin-w-poznaniu-11-11-2023-ph8174410/alternates/LANDSCAPE_1280	2024-11-11 10:42:55	TVN24
pl	https://tvn24.pl/rzeszow/rzeszow-swieto-niepodleglosci-balon-z-bialo-czerwona-flaga-wypuszczony-nad-miastem-st8174165	Balon z biało-czerwoną flagą nad Rzeszowem - TVN24	Balon stratosferyczny wzniósł w poniedziałek rano biało-czerwoną flagę nad Rzeszów. Tak miasto świętuje 106. rocznicę odzyskania przez Polskę niepodległości. Dziesięciometrowa flaga powiewa na wysokości 50 metrów i będzie można ją oglądać do zmierzchu.	https://tvn24.pl/najnowsze/cdn-zdjecie-1546916-balon-wzniosl-bialo-czerwona-flage-nad-miasto-ph8174311/alternates/LANDSCAPE_1280	2024-11-11 09:25:02	TVN24
pl	https://www.sport.pl/pilka/7,65037,31454462,zapadla-kluczowa-decyzja-ws-reprezentacji-polski-sekretarz.html	Zapadła kluczowa decyzja ws. reprezentacji Polski. Sekretarz PZPN ujawnia - Sport.pl	None	None	2024-11-11 10:12:00	Sport.pl
pl	https://dorzeczy.pl/kraj/654427/krakow-mezczyzna-podpalil-sie-pod-budynkiem-kurii-malopolskiej.html	Kraków: Mężczyzna podpalił się pod budynkiem kurii małopolskiej - Do Rzeczy	Do dramatycznych wydarzeń doszło w poniedziałek rano w Krakowie. Pod budynkiem Kurii Archidiecezji Krakowskiej podpalił się mężczyzna.	https://img.dorzeczy.pl/img/krakow-mezczyzna-podpalil-sie-pod-budynkiem-kurii-malopolskiej/6a/75/7fce85c917ca50d1b70bcebeda6a.webp	2024-11-11 10:58:00	Do Rzeczy
pl	https://www.money.pl/gospodarka/rolnicy-beda-mogli-jezdzic-szybciej-rzad-planuje-zmiane-prawa-7091458117536736a.html	Maksymalna prędkość ciągników do zmiany. Rząd zauważył problem - Money.pl	Ministerstwo Infrastruktury dostrzegło problem, na który zwracali uwagę rolnicy i odpowiada na ich apele. Planuje zwiększyć dopuszczalną prędkość ciągników poruszających się po drogach publicznych. Resort przekonuje, że można wykonać ten krok, bo ciągniki są wyposażone w nowoczesne systemy bezpieczeństwa.	https://v.wpimg.pl/OWU0NjM4YDY0UjhZYk9tI3cKbAMkFmN1IBJ0SGIFfWdlSH5FK10jMidVPgVjUz0iJVE5GmNEI3g0QCdFOwVgMzxDPgYsTWAyOFIrDmINK2dnCHxfdBkrNGQHY14oBH16N1QvWWAEeGBjUncPeQJ8b2cSMw	2024-11-11 08:35:57	Money.pl
pl	https://dorzeczy.pl/opinie/654469/zle-wiesci-dla-ukrainy-eksperci-nie-maja-zadnych-zludzen.html	Złe wieści dla Ukrainy. Eksperci nie mają żadnych złudzeń - Do Rzeczy	Zdaniem wielu ekspertów, obecnie Ukraina znajduje się w jednym z najtrudniejszych momentów od rozpoczęcia rosyjskiej inwazji w lutym 2022 roku.	https://img.dorzeczy.pl/img/zle-wiesci-dla-ukrainy-eksperci-nie-maja-zludzen/c9/3d/2b7cf97f736357361f6805b243d7.webp	2024-11-11 12:21:00	Do Rzeczy
pl	https://www.tokfm.pl/Tokfm/7,103087,31453075,tusk-sobie-na-to-nie-pozwoli-dlaczego-na-ostatniej-prostej.html	Kto wygra prawybory w KO? "Tematy szyte wprost pod niego" - TOK FM	None	None	2024-11-10 16:04:00	TOK FM
pl	https://businessinsider.com.pl/wiadomosci/baza-w-redzikowie-znamy-date-otwarcia-waznego-ogniwa-tarczy-antyrakietowej/zk97ffz	Baza w Redzikowie. Znamy datę otwarcia ważnego ogniwa tarczy antyrakietowej - Business Insider Polska	Szef Biura Bezpieczeństwa Narodowego Jacek Siewiera poinformował w poniedziałek, że w środę, 13 listopada, nastąpi oficjalne otwarcie bazy antyrakietowej w Redzikowie (woj. pomorskie). Resort obron...	https://ocdn.eu/pulscms-transforms/1/T1gk9kpTURBXy84ZmY4Zjk4NDdmYmM0YTY3MmI1NDVhMDBkZjkxNmFmOC5qcGeSlQMRAM0Goc0Du5MFzQSwzQJ23gABoTAB	2024-11-11 09:24:52	Business Insider Polska
pl	https://www.fakt.pl/polityka/nerwowo-po-przemowieniu-kaczynskiego-przeciwnicy-protestuja/b2z9xeb	Szokujące sceny po przemówieniu Kaczyńskiego. Użyli stroboskopu i piszczałki - Fakt.pl	Jarosław Kaczyński wziął udział w uroczystościach przed pomnikiem Józefa Piłsudskiego. Podczas przemówienia prezesa PiS przeciwnicy partii obkleili pomnik smoleński kartkami z hasłami sprzeciwu. "O...	https://ocdn.eu/pulscms-transforms/1/a0ok9kuTURBXy85ZDc3NjUyNy0xODg2LTRjYWEtYjI0OS01ZWY3OTIyZTRjODkuanBlZ5KVAwAAzQn8zQWfkwXNBLDNAnbeAAGhMAE	2024-11-10 20:57:00	Fakt.pl
pl	https://www.polsat.pl/news/2024-11-10/taniec-z-gwiazdami-final-15-edycji-17-listopada-a-w-nim/	„Taniec z Gwiazdami” 2024: Finał 15. edycji z trzema parami. Kto ma szansę na Kryształową Kulę? - Polsat	None	None	2024-11-10 21:00:17	Polsat
pl	https://www.sport.pl/pilka/7,65037,31454389,polska-z-historycznym-medalem-mistrzostw-swiata-brawo-brawo.html	Polska z historycznym medalem mistrzostw świata! Brawo, brawo - Sport.pl	None	None	2024-11-11 08:24:00	Sport.pl
pl	https://www.polsatnews.pl/wiadomosc/2024-11-10/michal-szczerba-w-programie-gosc-wydarzen-transmisja-od-godz-1915/	Niedyspozycja premiera na 11 listopada. Europoseł KO tłumaczy - polsatnews.pl	- Donald Tusk czuje się dobrze. Wszystko wskazuje na to, że w środę wraca do wykonywania swoich obowiązków - mówił w Gościu Wydarzeń Michał Szczerba. Eurodeputowany Koalicji Obywatelskiej, odpowiadając na pytanie, dlaczego premier zdecydował się na zabieg na dzień przed Świętem Niepodległości, odparł, że taka data była optymalna.	https://ipla.pluscdn.pl/dituel/cp/u4/u41xvchh6n64sxe28wa4i54dhfn9um31.jpg	2024-11-10 18:50:00	polsatnews.pl
pl	https://wiadomosci.onet.pl/warszawa/warszawska-policja-zatrzymala-kilkadziesiat-osob-przed-marszem-niepodleglosci/3crjsx9	Policja zatrzymała kilkadziesiąt osób przed Marszem Niepodległości. Narkotyki, kastety, pałki teleskopowe - Wiadomości - Onet	Komenda Stołeczna Policji przekazała, że tylko do południa, "jeszcze przed rozpoczęciem Marszu Niepodległości" warszawscy funkcjonariusze zatrzymali 36 osób. "Do jednostek Policji doprowadzono osoby posiadające niebezpieczne przedmioty między innymi noże, pałki teleskopowe i kastet" — dodają policjanci na portalu X.	https://ocdn.eu/pulscms-transforms/1/xB5k9kpTURBXy85NmU0ZjU5YWIyOGVmZDNmYzkwYWNiN2YyMzBlYmIzOS5qcGeTlQPNBU7NBB3NElLNCk6TCaY5Y2JkOTAGkwXNBLDNAnbeAAGhMAE/uczestnicy-marszu-niepodleglosci-zbieraja-sie-na-rondzie-dmowskiego-w-warszawie.jpg	2024-11-11 12:58:39	Wiadomości - Onet
pl	https://www.prezydent.pl/aktualnosci/wydarzenia/obchody-narodowego-swieta-niepodleglosci,93768?__cf_chl_rt_tk=5SnAXXWaTIRk_3RcsOuutOUhAueLAZb0SiopuXyqEyc-1731337468-1.0.1.1-w5fLE.XGq522Am266ebl0xkWfLzCc5oW1i.YL6EurRM	Obchody Narodowego Święta Niepodległości \ Aktualności - Prezydent.pl	None	None	2024-11-11 12:00:32	Prezydent.pl
pl	https://www.polsatnews.pl/wiadomosc/2024-11-11/kaczynski-pojawi-sie-na-marszu-niepodleglosci-mamy-jedna-intencje/	Jarosław Kaczyński pojawi się na Marszu Niepodległości. "Mamy jedną intencję" - polsatnews.pl	- To co dziś dzieje się w Polsce zagraża polskiemu państwu, narodowi, rodzinie, społeczeństwu - wymieniał Jarosław Kaczyński. Prezes PiS przez Marszem Niepodległości zapowiedział, że wraz z innymi politykami ugrupowania weźmie udział zgromadzeniu. - Mamy jedną intencję. Chcemy, by obóz patriotyczny był zjednoczony, także w przedsięwzięciach politycznych - mówił.	https://ipla.pluscdn.pl/dituel/cp/tc/tce5c8zum71rcbhkj84xmk4xnd9k3zr7.jpg	2024-11-11 13:17:00	polsatnews.pl
pl	https://businessinsider.com.pl/wiadomosci/sprzeczne-doniesienia-w-sprawie-rozmowy-putina-z-trumpem/nztez1f	Rosja zaprzecza. Sprzeczne doniesienia w sprawie rozmowy Putina z Trumpem - Business Insider Polska	Kreml zaprzeczył doniesieniom, jakoby Władimir Putin rozmawiał z prezydentem elektem USA Donaldem Trumpem po jego zwycięstwie w wyborach w zeszłym tygodniu.	https://ocdn.eu/pulscms-transforms/1/f5ik9kpTURBXy8xOGI1ZmRjNzVjMDYzODM3YTlhNzRhYTA4OTM1MzYxNi5qcGeSlQMAzK3NExnNCr6TBc0EsM0Cdt4AAaEwAQ	2024-11-11 12:41:43	Business Insider Polska
pl	https://niezalezna.pl/polska/ten-moment-swietujemy-do-dzis-jako-symbol-odzyskania-niepodleglosci-polska-po-123-latach-wrocila-na-mapy/530852	Ten moment świętujemy do dziś jako symbol odzyskania niepodległości. Polska po 123 latach wróciła na mapy - Niezalezna.PL	11 listopada 1918 r. Rada Regencyjna 	https://files.niezalezna.tech/images/upload/2024/11/11/n_afd873305b9f21cedebe67a3aa26746e82cb7c90938c3301854e6a6f5febdb11_c.jpg?r=1200,600	2024-11-11 06:16:00	Niezalezna.PL
pl	https://tvn24.pl/biznes/dla-pracownika/rewolucja-w-medycynie-pracy-kazdy-to-bedzie-musial-miec-zrobione-st8171121	Rewolucja w medycynie pracy. "Każdy to będzie musiał mieć zrobione" - TVN24	Ministerstwo Zdrowia szykuje zmiany w zakresie medycyny pracy. W pakiecie będą dodatkowe badania - zapowiedział wiceminister zdrowia Wojciech Konieczny. - Inwestycja w zdrowie pracowników ma szczególne znaczenie - komentuje Renata Górna, ekspertka Ogólnopolskiego Porozumienia Związków Zawodowych. 	https://tvn24.pl/biznes/najnowsze/cdn-zdjecie-1998300-ulica-tlum-ludzie-przechodnie-shutterstock-555163252-ph7654421/alternates/LANDSCAPE_1280	2024-11-11 10:23:55	TVN24
pl	https://www.rp.pl/polityka/art41429241-sondaz-ktory-polityk-lewicy-mialby-najwieksze-szanse-w-wyborach-prezydenckich	Polityk lewicy z szansą w wyborach prezydenckich? Wygrywa polityk, który miał w wyborach 2,22 proc. - Rzeczpospolita	None	None	2024-11-11 07:01:38	Rzeczpospolita
pl	https://www.prezydent.pl/aktualnosci/ordery-i-odznaczenia/odznaczenia-panstwowe-z-okazji-narodowego-swieta-niepodleglosci,93857	Odznaczenia państwowe z okazji Narodowego Święta Niepodległości - Prezydent.pl	None	None	2024-11-11 08:24:51	Prezydent.pl
pl	https://wiadomosci.onet.pl/politico/druga-kadencja-donalda-trumpa-bedzie-zupelnie-inna-moze-byc-nowym-reaganem/n1zbthe	Druga kadencja Donalda Trumpa będzie zupełnie inna. Może być nowym Reaganem - Wiadomości - Onet	Gdy wyszła na jaw skala zwycięstwa Donalda Trumpa, ucichły narzekania na polaryzację i dysfunkcyjność amerykańskiej sceny politycznej. Republikanin otrzymał od wyborców niepodważalny mandat. Ma szansę go wykorzystać, by prowadzić odważną politykę i zapisać się w historii jako przywódca na miarę Ronalda Reagana. Musi jednak dokonać mądrych decyzji, zwłaszcza w trzech kluczowych aspektach, które wyznaczą kierunek jego prezydentury.	https://ocdn.eu/pulscms-transforms/1/Cb_k9kpTURBXy85MjNjMzc5MzlhMDYyMzBhMmQyNWMxYjc3NmM0YTYzZC5qcGeTlQMAzLvNFcDNDD2TCaY3M2ZkMTEGkwXNBLDNAnbeAAGhMAE/prezydent-donald-trump-na-placu-krasinskich-w-warszawie-6-lipca-2017-r.jpg	2024-11-11 06:58:41	Wiadomości - Onet
pl	https://wiadomosci.onet.pl/pogoda/pogoda-pierwszy-snieg-juz-za-kilka-dni-znamy-regiony-gdzie-zrobi-sie-bialo/9pm2tx1	Pogoda przybliży nas do zimy. Pierwszy śnieg na nizinach jeszcze w tym tygodniu - Wiadomości - Onet	Pogoda w tym tygodniu nieco bardziej zbliży nas do zimy. Wiele wskazuje na to, że przed nami pierwsze w tym sezonie opady śniegu na nizinach. Co prawda będą one bardzo słabe, ale gdzieniegdzie mogą utworzyć śladową pokrywę śnieżną. Ponadto nie zabraknie marznących opadów, co spowoduje, że drogi staną się bardzo śliskie.	https://ocdn.eu/pulscms-transforms/1/2mqk9kpTURBXy9iM2M3ZmRiZDg5MzJmYjU5NmEyNWU2OTY2MGM5MmQ3ZC5wbmeTlQMAzKvNFWDNDAaTCaZiMWQwZDkGkwXNBLDNAnbeAAGhMAE/pogoda-w-kolejnych-dniach-pokaze-zimowe-oblicze-spadnie-pierwszy-snieg-screen-meteologixcom.jpg	2024-11-11 07:44:30	Wiadomości - Onet
pl	https://www.polsatnews.pl/wiadomosc/2024-11-11/zelenski-zlozyl-zyczenia-polsce-walczymy-ramie-w-ramie/	Zełenski złożył życzenia Polsce. "Walczymy ramię w ramię" - polsatnews.pl	Wszystkiego najlepszego z okazji Dnia Niepodległości, Polsko, nasz dobry sąsiedzie i przyjacielu - napisał w mediach społecznościowych prezydent Ukrainy. Wołodymyr Zełenski podkreślił, że ramię w ramię walczymy o wspólną wolność. Jesteśmy wdzięczni za wsparcie Polski dla Ukrainy - dodał.	https://ipla.pluscdn.pl/dituel/cp/3w/3w1rqfqm382ihgstnnj2qamw8nuzt82u.jpg	2024-11-11 12:28:00	polsatnews.pl
pl	https://news.google.com/rss/articles/CBMiswFBVV95cUxQcFF3QzF2UXhhZUtYT3k5bWdNNmtTNTNrZ1RHYVRVUmtGMnRTYlhFejAteURSV0lmU0dHRkhFOTF1S1FIbnpiUU1lTU16MGZhM2dNVHoxYTFrYnY4UGotR0hNQXBuNGllUUk3UXRUaGZfNHczRnJsWF9FakxfVXlJOW4ydElkMTJlOHdFMmRnd25ZQ2JDYnZhWEx2ZHVXVnJFd2ZpcHVHOEpjNFVwLXlnVDMwRQ?oc=5	VIII Ogólnopolskie Śpiewanie Biało-Czerwonych Przebojów z RMF FM [RELACJA] - RMF 24	None	None	2024-11-11 08:59:00	RMF 24
pl	https://polskieradio24.pl/artykul/3445296,maja-plan-do-tego-chca-namowic-bidena-przed-odejsciem-putin-sie-wscieknie	Mają plan, do tego chcą namówić Bidena przed odejściem. Putin się wścieknie? - PolskieRadio24.pl	Premier Wielkiej Brytanii Keir Starmer i prezydent Francji Emmanuel Macron mają pomysł na powstrzymanie Donalda Trumpa przed ograniczeniem wsparcia dla Ukrainy. Chcą przekonać Bidena do tego, by dał Kijowowi zezwolenie na uderzenia w głąb Rosji rakietami Storm Shadow.	https://static.prsa.pl/images/412927a8-1052-4dde-96a1-d30216570cf0.jpg	2024-11-11 08:24:00	PolskieRadio24.pl
pl	https://news.google.com/rss/articles/CBMisAFBVV95cUxOT3FDQmQ5cm5IWTJSQ1Vud0FoUUxwQUtNSzUyMlpvYlBCT0JXdmt1UWJHUHJpWFRWTkdSM05WS3BLcjlCVXZBMTNEWGxqUThuNmpPdElzWm0zSnFwNk5VQlNmYUVIM0lKM1FKeFNfTUg4QXE2bHZhRzFOWHdmNV9WR3JYcGtvMTM2ZTJGSzczdnFRSHAzZTVLXy1yS1JXbE5IZE9SQTkyaXhVS2tZNHBCLQ?oc=5	Alarm w całej Ukrainie. W Kijowie słychać wybuchy - Onet	None	None	2024-11-11 06:22:00	Onet
pl	https://www.polsatnews.pl/wiadomosc/2024-11-10/prezydent-wreczyl-awanse-generalskie-wymowne-slowa/	Prezydent wręczył awanse. Wymowne słowa do generałów - polsatnews.pl	Prezydent Andrzej Duda - w przeddzień Święta Niepodległości - wręczył nominacje generalskie i admiralskie dwunastu oficerom Wojska Polskiego, a także awanse generalskie trzem oficerom Państwowej Straży Pożarnej oraz trzem oficerom policji. - Łatwo jest służyć bezpieczeństwu państwu, które generalnie w żaden sposób nie wygląda na zagrożone - przyznał, podkreślając, że te czasy minęły.	https://ipla.pluscdn.pl/dituel/cp/ni/ni5xf4ds1aqmn8yrhtwjqshafevf5pmg.jpg	2024-11-10 20:23:00	polsatnews.pl
pl	https://defence24.pl/wojna-na-ukrainie-raport-specjalny-defence24/atak-ukrainskich-dronow-na-moskwe	Atak ukraińskich dronów na Moskwę - Defence24.pl	W niedzielę rano Ukraina przeprowadziła największy do tej pory atak dronów na Moskwę, używając co najmniej 25 bezzałogowych jednostek. Incydent spowodował tymczasowe zamknięcie dwóch głównych moskiewskich lotnisk, Domodiedowo i Żukowskij. Według mera Moskwy, Siergieja Sobianina, wszystkie drony zostały zniszczone przed dotarciem do miasta.	https://cdn.defence24.pl/2024/10/17/1920x1080px/HtNrZob5FU8lssZ0kzoZupqsGHFnOPw5avPeBYdL.s8xs.jpg	2024-11-10 18:24:50	Defence24.pl
pl	https://transfery.info/aktualnosci/czyli-jednak-oficjalnie-nowy-komunikat-w-sprawie-pozaru-pociagow-przed-meczem-lech-poznan-legia-warszawa/227860	Czyli jednak? OFICJALNIE: Nowy komunikat w sprawie pożaru pociągów przed meczem Lech Poznań - Legia Warszawa - Transfery.info	Wielkopolska policja opublikowała nowy komunikat dotyczący sytuacji z pociągiem, którym na mecz z Lechem Poznań w Ekstraklasie podróżowali kibice Legii Warszawa. Nie zostało wykluczone to, że do pożaru przyczyniły się race.	https://transfery.info/img/photos/102377/1500xauto/pociag-legii.jpg	2024-11-10 22:33:44	Transfery.info
pl	https://przegladsportowy.onet.pl/pilka-nozna/reprezentacja-polski/ruch-michala-probierza-podjal-decyzje-w-zwiazku-z-kontuzja-roberta-lewandowskiego/4mfsd4t	Ruch Michała Probierza. Podjął decyzję w związku z kontuzją Roberta Lewandowskiego - Przegląd Sportowy Onet	Robert Lewandowski nie zagra w najbliższych meczach reprezentacji Polski. Polski napastnik doznał kontuzji w ostatnim meczu ligowym Barcelony z Realem Sociedad (0:1). Portal Meczyki.pl poinformował, że Michał Probierz podjął już decyzję — nie dowoła do kadry dodatkowego napastnika. Do dyspozycji będzie miał trzech snajperów.	https://ocdn.eu/sport-images-transforms/1/x24k9lBaHR0cHM6Ly9vY2RuLmV1L3B1bHNjbXMvTURBXy85NGExM2Q2ZWJiZDc5YzFiZjcyOWE2NDIzOGY1OTU5OS5qcGeTlQPNAXjMac0JtM0FdpMFzQSwzQJ0kwmmZDQxZDhjBt4AAqEwAaExAQ	2024-11-11 11:31:03	Przegląd Sportowy Onet
pl	https://sport.interia.pl/robert-lewandowski/news-skandal-sedziowski-w-meczu-fc-barcelona-robert-lewandowski-p,nId,7853360	Skandal z Lewandowskim w meczu Barcelony. A już zgłaszali problemy. Niebywałe sceny - Interia Sport	Kliknij i zobacz więcej.	https://i.iplsc.com/-/000K2JDRGEO7YBL3-C461-F4.jpg	2024-11-11 08:00:00	Interia Sport
pl	https://www.fakt.pl/wydarzenia/alarmujaca-plaga-myszy-na-wsi-trzy-tragiczne-zatrucia/7df7y4s	Plaga myszy na wsiach. Ludzie sięgają po śmiercionośne trutki. Nie żyje już dwójka dzieci - Fakt.pl	W ciągu zaledwie dwóch miesięcy doszło do trzech głośnych zatruć dzieci środkiem zwalczającym gryzonie. Najpierw zmarła trzylatka z Wielkopolski, a kilka dni później dwulatek z Lubelskiego. Policja...	https://ocdn.eu/pulscms-transforms/1/5ssk9kuTURBXy8wMzk4NzZiMi1mYTlkLTRmZmItOGI3Yy1kYzY1NjRjMzdiYTMuanBlZ5KVAwAAzQTszQLFkwXNBLDNAnbeAAGhMAE	2024-11-11 12:19:09	Fakt.pl
pl	https://news.google.com/rss/articles/CBMiwgFBVV95cUxQV0d2WTl1SjZnNXNKTlJHeU1tOVdHLUExSXNId0pNVV9YSVY3Zms2RnQxOEYzd2lfSk5XUEJMd3R0QlF5d2FuUlZURFVESzBhSnZNTkJzVEZ4U2tuTGJBbDA3b0V5MHlhdnRXNGtEbW4tTFFoOTJsd1gwRG1HNEl1Y2ZmamN3aXhMd3p6SzVsWml0aWhxRVpITUQ5bVc1WllRRFp1UzV5WEluWVM0eVVJaFJqdnNZQlhYX1pNUlA0ZkQyQQ?oc=5	Deportacje, ułaskawienia i zemsta. Plan Donalda Trumpa na pierwszy dzień prezydentury - Wiadomości - Onet	None	None	2024-11-11 10:29:28	Wiadomości - Onet
pl	https://gol24.pl/kulisy-meczu-lech-legia-goncalo-feio-przewidywal-ze-kibice-kolejorza-beda-smutni-jak-zawsze-jak-co-roku/ar/c2-18933403?__cf_chl_rt_tk=Y7lZIJOMEQ7det0FBfyglhRsE7Er3XBc8PoYq7DCmAo-1731337627-1.0.1.1-MsZZaMGshR.EPmTASt5by2mQpkMgcWd0npBxFdnkkLw	Kulisy meczu Lech - Legia. Goncalo Feio przewidywał, że kibice Kolejorza będą "smutni jak zawsze, jak co roku" - Gol24	None	None	2024-11-10 19:45:00	Gol24
pl	https://www.polsatsport.pl/wiadomosc/2024-11-11/rywalka-juz-czeka-na-swiatek-ma-po-swojej-stronie-wielki-atut-padla-deklaracja/	Rywalka już czeka na Świątek, ma po swojej stronie wielki atut. Padła deklaracja - polsatsport.pl	Paula Badosa, najwyżej notowana tenisistka w drużynie Hiszpanii w turnieju Billie Jean King Cup oceniła, że mecz z Igą Świątek w Maladze będzie bardzo trudny. - Będę miała za sobą publiczność, więc dam z siebie wszystko - powiedziała.	https://ipla.pluscdn.pl/dituel/cp/jb/jbo7v13dgoca63n3wogkez8h9rk3kzmw.jpg	2024-11-11 08:52:00	polsatsport.pl
