country_code	url	title	description	image_url	publish_date	source
pl	https://dorzeczy.pl/kraj/650596/przyczyna-smierci-elzbiety-zajacowny-jest-sledztwo.html	Przyczyna śmierci Elżbiety Zającówny. Jest śledztwo - Do Rzeczy	Prokuratura Okręgowa w Warszawie wszczęła śledztwo po śmierci Elżbiety Zającówny. Postępowanie prowadzone jest pod kątem "nieumyślnego spowodowania śmierci".	https://img.dorzeczy.pl/img/przyczyna-smierci-elzbiety-zajacowny-jest-sledztwo/ac/c2/73c6857a2e5b5d26eeedde68df96.webp	2024-10-31 10:28:00	Do Rzeczy
pl	https://wiadomosci.onet.pl/kraj/robert-mazurek-odchodzi-z-rmf-fm-zasiedzialem-sie/g0mw3eb	Robert Mazurek odchodzi z RMF FM. "Zasiedziałem się" - Wiadomości - Onet	"Z końcem 2024 roku kończę współpracę z RMF. Rozstajemy się w zgodzie i sympatii" — poinformował Robert Mazurek. Dziennikarz pozostaje związany z Kanałem Zero. Rozgłośnia przekazała już, kto zostanie nowym gospodarzem "Porannej rozmowy w RMF FM".	https://ocdn.eu/pulscms-transforms/1/pTok9kpTURBXy8xMWI3NmIzNDBkOGVlOTA0NjI3MjU3NjgxNWZiYWE5Zi5qcGeTlQMAzFbNB9DNBGWTCaY5MTEwZmYGkwXNBLDNAnbeAAGhMAE/robert-mazurek.jpg	2024-10-31 15:24:26	Wiadomości - Onet
pl	https://www.sport.pl/pilka/7,65039,31432427,bylo-po-18-30-sceny-na-a8-policja-ujawnia-co-naprawde-sie.html	Było po 18:30, sceny na A8. Policja ujawnia, co naprawdę się wydarzyło - Sport.pl	None	None	2024-10-31 20:56:00	Sport.pl
pl	https://transfery.info/aktualnosci/zagadka-wyjasniona-wiadomo-z-kim-starli-sie-kibice-legii-warszawa-na-autostradzie-wideo/227025	Zagadka wyjaśniona. Wiadomo, z kim starli się kibice Legii Warszawa na autostradzie [WIDEO] - Transfery.info	Kibice Legii Warszawa licznie zjawili się na stadionie Miedzi Legnica przy okazji meczu 1/16 finału Pucharu Polski. Doping zaczęli od przyśpiewki skierowanej do sympatyków zupełnie innego klubu, a mianowicie Widzewa Łódź.	https://transfery.info/img/photos/102057/1500xauto/legia-warszawa.jpg	2024-10-31 20:11:41	Transfery.info
pl	https://businessinsider.com.pl/gospodarka/niebezpiecznie-wysoki-plaskowyz-ekonomisci-komentuja-inflacje/44ek5h5	"Niebezpiecznie wysoki płaskowyż". Ekonomiści komentują inflację - Business Insider Polska	Inflacja wzrosła w październiku do 5 proc. Ekonomiści wskazują, że wysoki jest odczyt inflacji bazowej, szczególnie uważnie obserwowanego wskaźnika przez Radę Polityki Pieniężnej w kontekście poten...	https://ocdn.eu/pulscms-transforms/1/7ruk9kpTURBXy82OWFmZWY0Njk2ZDBkMDgxZGRkMTEyOWM1ZTUxNTQ0YS5qcGeSlQMAzOLND8DNCNyTBc0EsM0Cdt4AAaEwAQ	2024-10-31 12:25:15	Business Insider Polska
pl	https://www.farmer.pl/finanse/przybywa-pieniedzy-na-rolnictwo-4-0-w-ramach-kpo-to-juz-ponad-1-134-mld-zl,153337.html	Przybywa pieniędzy na rolnictwo 4.0. w ramach KPO. To już ponad 1,134 mld zł - Farmer.pl	Inwestycji na rolnictwo 4.0. nie będziemy już liczyć w milionach złotych a w miliardach. Pula na nabór wniosków, który w zeszłym roku zakończył się już po 3 dniach, choć zwiększony w tym roku, to teraz otrzyma potężny zastrzyk gotówki. Pula środków z 492 mln zł zwiększy się do ponad 1,134 mld zł.	https://pliki2.farmer.pl/i/19/84/76/198476_r2_940.jpg	2024-10-31 14:03:00	Farmer.pl