country_code	url	title	description	image_url	publish_date	source
Pierwsza część niedzielnego meczu była wyrównana. Żadna ze stron nie miała wyraźnej przewagi. Niemniej swoją szansę w 24. minucie zmarnował Czerwiński, gdy jego uderzenie odbił bramkarz gospodarzy.
Później jednak w...	https://pliki.meczyki.pl/file/535622/important.jpg	2024-11-03 13:09:58	Meczyki.pl
pl	https://www.polsatnews.pl/wiadomosc/2024-11-03/mariusz-blaszczak-w-programie-gosc-wydarzen-ogladaj-od-godz-1910/	"Gość Wydarzeń": Mariusz Błaszczak, szef klubu PiS. Transmisja na żywo od 19:10 - polsatnews.pl	- Mnie niepokoi, że obecna władza, Donald Tusk i jego ekipa, postawili na Kamalę Harris. A więc Donald Tusk, po wygranej Donalda Trumpa, powinien podać się do dymisji - ocenił w programie Gość Wydarzeń szef klubu PiS Mariusz Błaszczak. Uściślił później, iż rezygnację ze stanowisk w przypadku triumfu republikanina powinni złożyć wszyscy członkowie polskiego rządu.	https://ipla.pluscdn.pl/dituel/cp/75/75b5nkydto9476bd8fmf3y2i76ps5pf4.jpg	2024-11-03 16:03:00	polsatnews.pl
pl	https://www.pomponik.pl/plotki/news-kasia-tusk-pochwalila-sie-kuchnia-marmur-na-scianach-to-dopi,nId,7848696	Kasia Tusk pochwaliła się kuchnią. Marmur na ścianach to dopiero początek - Pomponik.pl	Kasia Tusk uwielbia modę, dekorowanie wnętrz, a także chwalenie się swoim życiem w mediach społecznościowych. Niedawno blogerka pokazała swoją luksusową	https://i.iplsc.com/-/000K11J3R7Q5GUVX-C461-F4.jpg	2024-11-03 18:18:31	Pomponik.pl
pl	https://natemat.pl/575324,awantura-o-kase-pytanie-o-bulke-jaka-jest-odpowiedz	"Awantura o kasę": pytanie o bułkę pokonało mistrzów. Jaka jest odpowiedź? - naTemat.pl	Dziewiąty odcinek "Awantury o kasę" wywołał wielkie emocje. I to dość niespodziewane, bo z powodu... pytania o bułkę z szynką. Mistrzowie polegli i stracili 25 tysięcy złotych, internauci drwią. Ale jak właściwie rozwiązać to matematyczne zadanie?	https://m.natemat.pl/d40977309caef2000c307be2cddad671,1200,0,0,0.png	2024-11-03 09:09:09	naTemat.pl