country_code	url	title	description	image_url	publish_date	source
pl	https://dorzeczy.pl/kraj/656803/szymon-holownia-pogrzebal-trzecia-droge.html	Szymon Hołownia pogrzebał Trzecią Drogę? - Do Rzeczy	Start Szymona Hołowni w wyborach prezydenckich może doprowadzić do przewidywanego od miesięcy rozpadu Trzeciej Drogi.	https://img.dorzeczy.pl/img/szymon-holownia-pogrzebal-trzecia-droge/2a/f4/39f8371dd9aa6df0d1a6b0736346.webp	2024-11-16 14:26:00	Do Rzeczy
pl	https://polskieradio24.pl/artykul/3447162,8-st-C-i-najsilniejsza-sniezyca-Pokazali-mape-pogodowa-zacznie-sie-po-weekendzie	-8 st. C. i "najsilniejsza śnieżyca". Pokazali mapę pogodową: zacznie się po weekendzie - PolskieRadio24.pl	Pogoda diametralnie zmieni się już w najbliższym tygodniu. Z prognoz meteorologicznych wynika, że najprawdopodobniej do Polski naciągną opady śniegu. Na termometrach nawet -8 stopni Celsjusza. Gotowi na początek zimy?	https://static.prsa.pl/images/7bfb41e3-b031-46af-9e24-6517356c833d.jpg	2024-11-16 08:19:00	PolskieRadio24.pl
pl	https://www.polsatsport.pl/wiadomosc/2024-11-16/oto-potencjalni-rywale-polakow-w-barazach-mozliwe-starcie-z-gigantem/	Oto potencjalni rywale Polaków w barażach. Możliwe starcie z gigantem! - polsatsport.pl	Reprezentacja Polski już w poniedziałek 18 listopada zagra ostatni mecz w tegorocznej edycji Ligi Narodów. Rywalem podopiecznych Michała Probierza będzie Szkocja. Stawką konfrontacji na PGE Narodowym w Warszawie będzie trzecie miejsce i uniknięcie bezpośredniego spadku do niższej dywizji.	https://ipla.pluscdn.pl/dituel/cp/ix/ixqq7f333no9s2hvjfpe54oejwkz1nfe.jpg	2024-11-16 11:21:00	polsatsport.pl
pl	https://dorzeczy.pl/ekonomia/656890/austria-odcieta-od-gazu-z-rosji-narkoman-na-rosyjskim-rurociagu.html	Austria odcięta od gazu z Rosji. "Narkoman na rosyjskim rurociągu" - Do Rzeczy	Od godziny szóstej rano w sobotę Rosja wstrzymała przesył gazu do Austrii. Wcześniej Międzynarodowa Izba Handlowa przyznała rację austriackiemu OMV w sporze z Gazpromem.	https://img.dorzeczy.pl/img/rosja-odcina-gaz-austrii-putin-wlasnie-sie-zemscil/6c/b9/562ea01173d63e423c3ccd497967.webp	2024-11-16 17:12:00	Do Rzeczy
pl	https://wiadomosci.onet.pl/swiat/prezydent-ukrainy-chce-zakonczenia-wojny-podal-warunek-negocjacji/2qxskvp	Prezydent Ukrainy chce zakończenia wojny. Zwraca uwagę na rolę dyplomacji - Wiadomości - Onet	None	None	2024-11-16 11:24:29	Wiadomości - Onet
pl	https://natemat.pl/576944,byly-rektor-collegium-humanum-opuscil-areszt-tyle-musial-zaplacic	Były rektor Collegium Humanum opuścił areszt. Taką kaucję wpłacił - naTemat.pl	Były rektor Collegium Humanum, Paweł C., opuścił areszt tymczasowy. Prokuratura zgodziła się na uchylenie środka zapobiegawczego, pod warunkiem wpłacenia ogromnej kaucji. Podejrzany usłyszał ponad 100 zarzutów i wrócił do domu.	https://m.natemat.pl/a29a30cb1c8875628868f1b04dd3a8e4,1200,0,0,0.jpg	2024-11-16 16:06:27	naTemat.pl
pl	https://motoryzacja.interia.pl/porady/eksploatacja/news-jedz-dzis-na-stacje-kontroli-pojazdow-diagnosta-nie-wezmie-a,nId,7856580	Jedź dziś na stację kontroli pojazdów. Diagnosta nie weźmie ani grosza - Interia Motoryzacja	None	None	2024-11-16 09:45:00	Interia Motoryzacja
pl	https://www.tokfm.pl/Tokfm/7,103085,31469357,baza-w-redzikowie-jak-amerykanski-okret-wyjety-z-wody-musimy.html	Baza w Redzikowie jak "amerykański okręt wyjęty z wody"? "Musimy to uszczelniać" - TOKFM.pl	None	None	2024-11-16 11:09:00	TOKFM.pl
pl	https://businessinsider.com.pl/wiadomosci/korea-polnocna-dostarcza-bron-rosji-ukraincy-traca-terytorium/4clbg8d	Systemy rakietowe z Korei Północnej trafiły do Kurska. Rosja wypycha ukraińskie siły - Business Insider Polska	Według ukraińskiego wywiadu Korea Północna dostarczyła Rosji systemy rakietowe i artyleryjskie dalekiego zasięgu. Część uzbrojenia została przeniesiona do Kurska na cele militarnego ataku. Te ciężk...	https://ocdn.eu/pulscms-transforms/1/VCAk9kpTURBXy82MGE4Y2Q1ZWE1YTM2NjM0NWQ3ZmNlMTg0OTg3ZjVlOC5qcGeSlQMAzNDNB9DNBGWTBc0EsM0Cdt4AAaEwAQ	2024-11-16 13:48:10	Business Insider Polska
pl	https://www.rp.pl/konflikty-zbrojne/art41458871-welt-tajna-klauzula-w-planie-zwyciestwa-zelenskiego-ma-przekonac-trumpa	"Welt": Tajna klauzula w Planie Zwycięstwa Zełenskiego? Ma przekonać Trumpa - Rzeczpospolita	W Planie Zwycięstwa, który prezydent Ukrainy przekazał sojusznikom, zawarta jest tajna klauzula, ukrywana dotąd przed opinią publiczną. Ma "przeciągnąć" Trumpa 	https://i.gremicdn.pl/image/free/bfce06d2fc4bec805a2c14a18f3de112/?t=crop:3840:2381:nowe:0:89,resize:fill:2000:1250&ctx=preview	2024-11-16 22:00:00	Rzeczpospolita
pl	https://wiadomosci.wp.pl/ankieta-tuska-na-polmetku-trzaskowski-w-tarapatach-7093446644607936a	Ankieta Tuska na półmetku. Trzaskowski w tarapatach - WP Wiadomości	W sobotę Donald Tusk opublikował ankietę, w której internauci mogą zagłosować, kogo widzieliby w roli kandydata KO w pr…	None	2024-11-17 03:47:01	WP Wiadomości
pl	https://polskieradio24.pl/artykul/3447222,wichura-dotarla-juz-do-polski-imgw-alarmuje-po-niej-zaatakuje-potezna-zima	Wichura dotarła już do Polski: IMGW alarmuje. Po niej zaatakuje potężna zima - PolskieRadio24.pl	Zapomnijmy o polskiej złotej jesieni. Pogoda w najbliższych dniach da się we znaki. W weekend IMGW ostrzega przed silnym wiatrem. Wydano alerty dla kilku województw. To nie koniec złych wiadomości - do Polski nadciąga zima.	https://static.prsa.pl/images/fe57c893-8713-4183-bf1b-0d8c62e75e0f.jpg	2024-11-16 12:11:00	PolskieRadio24.pl
pl	https://www.polsatnews.pl/wiadomosc/2024-11-16/czeka-nas-rewolucja-w-prawie-drogowym-nie-wywolywalbym-psychozy-strachu/	Co z bezpieczeństwem na polskich drogach? Ekspert o "psychozie strachu" - polsatnews.pl	- Ja bym nie wywoływał psychozy strachu, bo znakomita większość z nas to są ludzie, których nie musimy się obawiać - stwierdził Marek Konkolewski, ekspert ds. bezpieczeństwa ruchu drogowego. Stwierdził, że czarną scenerię na polskich drogach tworzy bardzo wąska grupa. Zdaniem eksperta liczba wypadków na drogach jest niższa niż przed laty, a zmiana prawa jeszcze poprawi bezpieczeństwo.	https://ipla.pluscdn.pl/dituel/cp/2e/2e6emmgz88w7tjjig6gyfudz9h2dkfkk.png	2024-11-16 12:03:00	polsatnews.pl
pl	https://www.onet.pl/informacje/onetwiadomosci/syn-wlasciciela-restauracji-przetrzymywal-pracownikow-akcja-sluzb-trwala-kilka-godzin/h6r3qp2,79cfc278	Mężczyzna w restauracji pod Paryżem wziął pracowników za zakładników. Akcja służb trwała kilka godzin - Onet	Syn właściciela restauracji w miejscowości Issy-les-Moulineaux pod Paryżem wziął czterech pracowników za zakładników. Według relacji francuskich mediów, po kilkugodzinnej akcji, zostali oni uwolnieni. Napastnik z kolei został aresztowany i przejdzie badania psychiatryczne.	https://ocdn.eu/pulscms-transforms/1/Zgxk9kpTURBXy80M2ZmYTQwN2ViM2M2Zjc3MWExZGQxOTc0Yjg1N2RhOC5qcGeSlQMAAM0IAM0EgJMFzQSwzQJ03gADoTABoTEBoTPD	2024-11-16 13:46:00	Onet
pl	https://sport.interia.pl/boks/news-mateusz-masternak-zwycieski-we-wroclawiu-morderczy-boj-polak,nId,7857402	Mateusz Masternak zwycięski we Wrocławiu! Morderczy bój Polaka - Interia Sport	Kliknij i zobacz więcej.	https://i.iplsc.com/-/0009EJBSRFSP7VRA-C461-F4.jpg	2024-11-16 22:03:15	Interia Sport
pl	https://lovekrakow.pl/aktualnosci/czy-ceny-biletow-wzrosna-prezydent-bedziemy-mieli-dwa-wyjscia_59090.html	Czy ceny biletów wzrosną? Prezydent: „Będziemy mieli dwa wyjścia” - LoveKraków.pl	Przedstawiony projekt budżetu zakłada wpływy z biletów na komunikację miejską bez podwyżki cen. Prezydent Aleksander Miszalski daje jednak do zrozumienia, że w perspektywie czasu bez zmian się nie obejdzie. Projekt budżetu przedstawiony został w piątek. Teraz sprawą zajmą się radni miejscy,...	https://lovekrakow.pl/images/news/59090/1200x630/7277890beb9021c65daefc46efbcec4244529973.jpg	2024-11-16 08:16:00	LoveKraków.pl
pl	https://businessinsider.com.pl/polityka/bogdan-klich-odchodzi-z-parlamentu-nowa-rola-w-usa/twb700f	Senator złożył mandat. Pokieruje polską ambasadą w Stanach Zjednoczonych - Business Insider Polska	Po 23 latach w parlamencie Bogdan Klich powiedział "stop". Jego nowym miejscem pracy będą Stany Zjednoczone i tamtejsza ambasada. "Mam wielką nadzieję, że ocean nas nie rozdzieli" — napisał.	https://ocdn.eu/pulscms-transforms/1/0bbk9kpTURBXy8yYWVjMTEwZGQ5MTljNDYxMzAyMGIxZWI1YmUxZGM2OC5qcGeSlQMAJM0H0M0EZZMFzQSwzQJ23gABoTAB	2024-11-16 14:32:10	Business Insider Polska
pl	https://www.rp.pl/komentarze/art41458431-jerzy-haszczynski-czy-tusk-powinien-sie-cieszyc-z-telefonu-scholza-do-putina	Jerzy Haszczyński: Czy Tusk powinien się cieszyć z telefonu Scholza do Putina - Rzeczpospolita	Co zostaje z izolacji Putina, zbrodniarza wojennego, gdy kanclerz Niemiec Olaf Scholz, szef rządu najważniejszego kraju Unii Europejskiej, dzwoni do niego, by w	https://i.gremicdn.pl/image/free/aa783924337fa899e696068495858ab2/kanclerz-niemiec-olaf-scholz-oraz-premier-donad-tusk?t=crop:4470:2772:nowe:0:101,resize:fill:2000:1250&ctx=preview	2024-11-16 12:02:45	Rzeczpospolita
pl	https://www.fakt.pl/pieniadze/oszczedzanie/minister-finansow-sie-wygadal-w-2025-r-odczuja-to-miliony-polakow/7tx896z	Obniżenie składki zdrowotnej. Kiedy i na jakich zasadach? Minister się wygadał - Fakt.pl	Miliony przedsiębiorców czekają na obiecane zmiany w składkach zdrowotnych, a dokładniej na ich obniżenie. Minister finansów ujawnił wreszcie, ile będą musieli płacić w najbliższych latach. Andrzej...	https://ocdn.eu/pulscms-transforms/1/GDVk9kuTURBXy9jNGZjNDdiNy03YmM1LTRjZTQtOTlhYy1jMjQwMDZlNzU3M2EuanBlZ5KVAwAAzQeAzQQ4kwXNBLDNAnbeAAGhMAE	2024-11-16 15:00:00	Fakt.pl
pl	https://www.wysokieobcasy.pl/wysokie-obcasy/7,157211,31466525,hit-zbedny-ale-dajacy-rozrywke-i-polski-serial-wazny-dobry.html?disableRedirects=true	Hit zbędny, ale dający rozrywkę, i polski serial - ważny, dobry i potrzebny. Polecamy na weekend - WysokieObcasy.pl	None	None	2024-11-16 04:58:00	WysokieObcasy.pl
pl	https://wiadomosci.wp.pl/sikorski-ma-dworek-w-chobielinie-co-mysla-o-nim-sasiedzi-7093378465426400a	Sikorski ma dworek w Chobielinie. Co myślą o nim sąsiedzi? - WP Wiadomości	Radosław Sikorski i Anne Applebaum posiadają dworek w Chobielinie. Co sądzą o nich sąsiedzi? Mieszkańcy chwalą ich za u…	None	2024-11-17 04:04:00	WP Wiadomości
pl	https://dorzeczy.pl/kraj/656902/olsztyn-radoslaw-sikorski-wyprosil-media-ze-swojego-spotkania.html	Olsztyn: Radosław Sikorski wyprosił media ze swojego spotkania - Do Rzeczy	Szef MSZ, ubiegający się o nominację prezydencką KO Radosław Sikorski, wyprosił media ze swojego spotkania z mieszkańcami Olsztyna.	https://img.dorzeczy.pl/img/olsztyn-radoslaw-sikorski-wyprosil-media-ze-swojego-spotkania/f8/6e/4e415c07495d6646b9f0f6c9ef80.webp	2024-11-16 17:29:00	Do Rzeczy
pl	https://wiadomosci.wp.pl/musk-wysmial-zelenskiego-niesamowite-poczucie-humoru-7093465082301408a	Musk wyśmiał Zełenskiego. "Niesamowite poczucie humoru" - WP Wiadomości	Nie milkną spekulacje na temat polityki, jak otoczenie Donalda Trumpa wkrótce będzie prowadzić wobec Ukrainy. Tymczasem…	None	2024-11-17 05:03:23	WP Wiadomości
pl	https://www.onet.pl/informacje/fakt/ludzie-mysla-ze-moja-zona-nie-zyje-ale-ona-daje-slady-swojego-istnienia-23/0522t4h,7fa8ac5e	— Ludzie myślą, że moja żona nie żyje. Ale ona daje ślady swojego istnienia. 23 października była aktywna... - Onet	— Ludzie myślą, że moja żona nie żyje. Ale ona daje ślady swojego istnienia. 23 października była aktywna na TikToku. Teraz — 7 i 8 listopada, znowu była aktywna na TikToku. To co? Ktoś na jej konto wchodzi? I policja o tym wie. Ludzie myślą, że to ja wchodzę na jej konto. A to nieprawda, bo ja nawet nie wiedziałem, że ona ma konto na TikToku — przekonuje w rozmowie z "Faktem" Jan Klimek.	https://ocdn.eu/pulscms-transforms/1/iFck9kqTURBXy9iYzYwN2NiYzgzZmEwNDgwOWJkYzdjYWU0NTlmMmVkMC5qcGVnkZMFzQSwzQJ03gADoTABoTEBoTPD	2024-11-16 08:21:57	Onet
pl	https://przegladsportowy.onet.pl/plywanie/otylia-jedrzejczak-wskazana-pod-oslona-nocy-dostala-najtrudniejsza-misje/x31sq8g	Otylia Jędrzejczak wskazana pod osłoną nocy. Dostała najtrudniejszą misję - Przegląd Sportowy Onet	A więc jednak Otylia Jędrzejczak! Mistrzyni olimpijska z 2004 r. przekonała delegatów (co nie było takie oczywiste) i w nocy z soboty na niedzielę minimalnie pokonała Pawła Słomińskiego w walce o fotel prezesa Polskiego Związku Pływackiego. Teraz przed Oti najtrudniejsze możliwe zadanie – musi znaleźć sposób na zjednoczenie środowiska, które chyba jeszcze nigdy nie było aż tak podzielone. Podczas drugiej kadencji Jędrzejczak nie może już popełnić tych samych błędów, co w ostatnich trzech latach. Do dużych zmian na pewno dojdzie. I to bardzo szybko. Oto jak przebiegały wybory za zamkniętymi drzwiami i co z nich wynika.	https://ocdn.eu/sport-images-transforms/1/7ewk9lBaHR0cHM6Ly9vY2RuLmV1L3B1bHNjbXMvTURBXy8wYjI1NmY3NDZmMjJkMmRjMmJmMzBhMTcwMDE1MWU5ZC5qcGeTlQPNAYHNAR3NDxvNCICTBc0EsM0CdJMJpmQ0MWQ4YwbeAAKhMAGhMQE	2024-11-17 05:00:00	Przegląd Sportowy Onet
pl	https://www.sport.pl/pilka/7,64946,31470109,sa-najnowsze-wiesci-ws-dramatu-na-meczu-holandia-wegry-romano.html	Są najnowsze wieści ws. dramatu w meczu Holandia - Węgry. Romano ujawnia - Sport.pl	None	None	2024-11-16 22:17:00	Sport.pl
pl	https://www.wysokieobcasy.pl/wysokie-obcasy/7,157211,31469600,kolejna-rezyserka-wycofuje-glosny-film-z-camerimage-nie-powinnismy.html	Kolejna reżyserka wycofuje głośny film z Camerimage. "Nie powinniśmy dłużej tolerować takich zachowań" - WysokieObcasy.pl	None	None	2024-11-16 13:12:47	WysokieObcasy.pl
pl	https://businessinsider.com.pl/wiadomosci/michal-kolodziejczak-o-nowych-oplatach-nie-mam-najmniejszej-empatii-do-sklepow/w2mgknc	Michał Kołodziejczak: nie mam najmniejszej empatii do sklepów. "Niech nie wydziwiają" - Business Insider Polska	Spleśniałe produkty, które dotychczas były klasyfikowane jako odpad, będą uznawane za żywność. To jedna ze zmian szykowanych przez rząd, w efekcie czego sklepy więcej zapłacą za marnowanie żywności...	https://ocdn.eu/pulscms-transforms/1/q9fk9kpTURBXy84MjNiZTBjNmQ2OWIxZTU0MDFjZGYxNTA4NTc3NzM4OS5qcGeSlQMAFc0H0M0EZZMFzQSwzQJ23gABoTAB	2024-11-16 19:45:44	Business Insider Polska
pl	https://www.polsatnews.pl/wiadomosc/2024-11-17/zmasowany-atak-rosjan-na-ukraine-polska-poderwala-mysliwce/	Nocny komunikat wojska. Poderwano myśliwce - polsatnews.pl	Wojsko Polskie poinformowało w niedzielę nad ranem, że w związku ze zmasowanym atakiem Rosjan na zachodnią Ukrainę, poderwane zostały polskie i sojusznicze myśliwce. Podjęte kroki mają na celu zapewnienie bezpieczeństwa na terenach graniczących z zagrożonymi obszarami - przekazano w komunikacie.	https://ipla.pluscdn.pl/dituel/cp/7g/7ggwvboouh3uid82zm25z6rki76e1ctv.jpg	2024-11-17 06:06:00	polsatnews.pl
pl	https://wroclaw.wyborcza.pl/wroclaw/7,35771,31468031,wyjasniamy-na-czym-polegaja-zarzuty-ktore-dostal-prezydent.html	Afera Collegium Humanum. Wyjaśniamy, na czym polegają zarzuty, które dostał prezydent Wrocławia Jacek Sutryk - Wyborcza - Wrocław	None	None	2024-11-16 05:05:00	Wyborcza - Wrocław
pl	https://www.polsatnews.pl/wiadomosc/2024-11-16/rafal-trzaskowski-w-krakowie-incydent-podczas-wystapienia/	Incydent na wiecu Trzaskowskiego. "Bez nerwów, już uciekacie?" - polsatnews.pl	- Spokojnie, bez nerwów, już uciekacie? Poczekajcie, chcieliście zadać jakieś pytanie - mówił Rafał Trzaskowski do grupy ludzi, która nieoczekiwanie weszła na jego spotkanie w Nowej Hucie. Niedługo później członkowie partii Nowa Nadzieja w mediach społecznościowych opublikowali zdjęcie, podpisane - Takim transparentem przywitaliśmy Trzaskowskiego.	https://ipla.pluscdn.pl/dituel/cp/c8/c8bdfu6yec4p9xn2emei13pd3y9h2eio.jpg	2024-11-16 15:00:00	polsatnews.pl
pl	https://sport.interia.pl/iga-swiatek/news-ponura-przenosnia-igi-swiatek-po-wielkim-sukcesie-polski-cal,nId,7857462	Świątek zażartowała, że za 20 minut będzie martwa. A Dawid Celt postarzał się o 20 lat - Interia Sport	Kliknij i zobacz więcej.	https://i.iplsc.com/-/000K4H6N4UVX2F0Q-C461-F4.jpg	2024-11-17 05:39:07	Interia Sport
pl	https://wiadomosci.wp.pl/dzialo-sie-w-nocy-rosyjskie-okrety-u-brzegow-ue-7093529726282688a	Działo się w nocy. Rosyjskie okręty u brzegów UE - WP Wiadomości	Wydarzyło się, gdy spałeś. Oto, co odnotowały światowe agencje w nocy z soboty na niedzielę.	None	2024-11-17 06:29:23	WP Wiadomości
pl	https://wiadomosci.onet.pl/warszawa/tak-wygladal-transport-lukasza-zaka-na-nagraniu-slychac-26-latka/kwsphhc	Policja pokazała, jak wyglądał transport Łukasza Żaka. "Weź pan się zawijaj z tą kamerą" [WIDEO] - Wiadomości - Onet	None	None	2024-11-16 18:36:39	Wiadomości - Onet
pl	https://businessinsider.com.pl/polityka/mateusz-morawiecki-z-najwiekszym-poparciem-pis-ma-dylemat-sondaz/1cvz7yv	Kto kandydatem PiS na prezydenta? Wyborcy wskazali swojego faworyta [SONDAŻ] - Business Insider Polska	W perspektywie zbliżających się wyborów prezydenckich w 2025 r. elektorat Prawa i Sprawiedliwości wyraźnie opowiedział się za kandydaturą Mateusza Morawieckiego. Z najnowszego sondażu przeprowadzon...	https://ocdn.eu/pulscms-transforms/1/mSZk9kpTURBXy8zNWE0OWExMTBmODdmMDY3OTI0MzI2OWI0N2RhMGI4MC5qcGeSlQMAzFjNB9DNBGWTBc0EsM0Cdt4AAaEwAQ	2024-11-16 20:21:15	Business Insider Polska
pl	https://defence24.pl/wojna-na-ukrainie-raport-specjalny-defence24/japonia-i-ukraina-zwieraja-szyki-korea-polnocna-tematem-rozmow	Japonia i Ukraina zwierają szyki. Korea Północna tematem rozmów - Defence24.pl	Tokio i Kijów pogłębią dialog w dziedzinie bezpieczeństwa w związku z „niezwykle niepokojącym” udziałem wojsk Korei Północnej w wojnie Rosji przeciwko Ukrainie – powiedział w sobotę w Kijowie szef MSZ Japonii Takeshi Iwaya.	https://cdn.defence24.pl/2024/11/16/1920x1080px/zb1C9xJOe8QDOOMaAtNuZRZvLx3A4rDouQaUORVw.tfin.jpg	2024-11-16 23:45:50	Defence24.pl
pl	https://www.polsatnews.pl/wiadomosc/2024-11-16/atak-nozownika-w-szkole-w-chinach-osiem-osob-zginelo-kilkanascie-zostalo-rannych/	Nie zdał egzaminu, zaatakował nożem. Osiem osób nie żyje, jest wielu rannych - polsatnews.pl	Osiem osób nie żyje, a 17 zostało rannych - to bilans ataku nożownika w szkole zawodowej w chińskim mieści Wuxi. Według doniesień mediów powodem ataku miał być niezdany egzamin i zbyt niskie wynagrodzenie za staż. W ostatnim czasie w Chinach doszło do serii ataków, których celem byli przypadkowi ludzie.	https://ipla.pluscdn.pl/dituel/cp/5p/5pmcjyz73tkmogjasjb5edknm5ni7my9.jpg	2024-11-16 20:18:00	polsatnews.pl
pl	https://www.rmf.fm/rozrywka/show-biznes/news,72597,znamy-zwyciezce-eurowizji-junior-2024-na-ktorym-miejscu-polska.html	Znamy zwycięzcę Eurowizji Junior 2024! Na którym miejscu Polska? - RMF FM	None	None	2024-11-16 18:00:00	RMF FM
pl	https://www.lublin112.pl/w-calym-kraju-zawyly-karetki-pogotowia-ratownicy-oddali-hold-swojemu-koledze-ktory-zginal-w-wypadku-foto-wideo/	W całym kraju zawyły karetki pogotowia. Ratownicy oddali hołd swojemu koledze, który zginął w wypadku (foto, wideo) - lublin112.pl	Ratownicy medyczni z całego kraju pożegnali kolegę, który zginął w wypadku karetki pogotowia ratunkowego. W południe w pojazdach uruchomiono sygnały. 	https://www.lublin112.pl/wp-content/uploads/2024/11/130j4-1280x843.jpg	2024-11-16 16:15:56	lublin112.pl
pl	https://news.google.com/rss/articles/CBMiqwFBVV95cUxOQTVmdDIyWGlZMUY2SUxHMHg3SVZtaC1fOTRmSGZpMGcxMXZUcllJbFA0NGZaY3QzZmJpWW41ZkMwUkJJWGp2SldnQVcwdHV1WGJ1SVdHQjNSXzVKRUc3RlRvNzRBRnlCU0ZQMGY3NUFVUUd4cHc2RzRoOGpxOTdVNElXamxNWEVxLTdmcFFzTUxhaGFwUkE5M1hLeUF4UjlPdlJ3T1I5UFZJVzjSAaoBQVVfeXFMUEF3VDZ5cENpMDNUaWNnY1lRREc5X1RqSFFCSXRReWtVVWN0RnhfNDI3RldGZFFvTXNla1RZWG5HQlo2WFdUQjVGQWxGUlZZRmRFM2pmc3dXYkZxWWZ1OUh6UHB6THR3eHJDRnA0SFJhMjRIU3d3dmFKUmRrbFhiaXFfSTlGZVFsbXI0bzdISzg5X0lIeVYtd3NVbEI2SWtVMFluNGdqcFc4Nmc?oc=5	Jedno zdjęcie wystarczyło. Oto reakcja Kamila Glika na mecz z Portugalią - Sport.pl	None	None	2024-11-16 15:09:00	Sport.pl
pl	https://www.polsatsport.pl/wiadomosc/2024-11-16/ksw-100-online-relacja-live-i-wyniki-na-zywo-mamed-bartosinski-wrzosek/	Wyniki gali KSW 100. Kto wygrał walki? Mamed - Bartosiński wynik - polsatsport.pl	Mamed Khalidov pokonał przez poddanie Adriana Bartosińskiego w walce wieczoru gali KSW 100. Swoje walki wygrali m.in. Phil De Fries, Arkadiusz Wrzosek, Rafał Haratyk, Robert Ruchała, Piotr Kuberski i Andrzej Grzebyk. Sprawdźcie komplet wyników.	https://ipla.pluscdn.pl/dituel/cp/oj/ojddjzfo59qfhyzrfd7b36fim78xmtom.jpg	2024-11-16 22:38:00	polsatsport.pl
pl	https://sport.tvp.pl/83523297/taras-romanczuk-nie-zagra-ze-szkocja-fala-kontuzji-w-reprezentacji-polski	Taras Romanczuk nie zagra ze Szkocją. Fala kontuzji w reprezentacji Polski - TVP SPORT	Oficjalna strona TVP Sport. Lider oglądalności wśród kanałów sportowych w Polsce. Transmisje online, program TV, wideo, wyniki, relacje z najważniejszych sportowych wydarzeń.	https://s8.tvp.pl/images2/8/8/3/uid_88348613e34d499b96093315f2e78c3f_width_1280_play_0_pos_0_gs_0_height_720_taras-romanczuk-fot-pap.jpg	2024-11-16 20:42:00	TVP SPORT
pl	https://www.sport.pl/pilka/7,65037,31469994,reprezentacja-polski-na-dnie-europy-dramat-to-malo-powiedziane.html	Reprezentacja Polski na dnie Europy. Dramat to mało powiedziane - Sport.pl	None	None	2024-11-17 05:21:00	Sport.pl
pl	https://sport.interia.pl/boks/news-mike-tyson-i-jake-paul-zawieszeni-zaraz-po-walce-takie-sa-pr,nId,7857427	Mike Tyson i Jake Paul zawieszeni zaraz po walce. Takie są przepisy - Interia Sport	Kliknij i zobacz więcej.	https://i.iplsc.com/-/000K4GD012BCU8K8-C461-F4.jpg	2024-11-17 05:20:00	Interia Sport
pl	https://businessinsider.com.pl/gospodarka/ceny-codziennych-zakupow-rosna-szybciej-od-inflacji-gus-raport/3tge3q9	Ceny codziennych zakupów rosną szybciej od inflacji GUS. Raport - Business Insider Polska	W październiku br. codzienne zakupy, takie jak żywność i napoje zdrożały średnio o 5,4 proc. rdr, czyli bardziej zauważalnie niż miesiąc wcześniej, gdy było to 4,9 proc. — wynika z raportu UCE Rese...	https://ocdn.eu/pulscms-transforms/1/ThYk9kpTURBXy9lOGQ1MzVlY2I5N2Y5ZTc5MDU0ZTllY2VkMGE5Yzk0Yi5qcGeSlQMEAM0cuM0QKJMFzQSwzQJ23gABoTAB	2024-11-16 06:40:02	Business Insider Polska
pl	https://www.money.pl/gospodarka/banka-na-rynku-mieszkan-moga-sie-pojawic-jednocyfrowe-spadki-7092941001079744a.html	Bańka na rynku mieszkań? "Mogą się pojawić jednocyfrowe spadki" - Money.pl	Na rynku mieszkaniowym w Polsce nie ma bańki cenowej, lecz chwilowa flauta, która nie potrwa długo - twierdzą eksperci, z którymi rozmawiał Money.pl. Aby pozyskać klienta, deweloperzy muszą się postarać - głównie oferują upusty, a nieliczni obniżają cenniki wyjściowe.	https://v.wpimg.pl/OTBhODljYDUjCjl3QxFtIGBSbS0FSGN2N0p1ZkNbfWRyEH9rCgMjMTANPytCDT0hMgk4NEIaI3sjGCZrGltgMCsbPygNE2AxLwoqIENadmV7Xn9yD0crZXRYYnAJDCt5e15_dUFeeTJ3XHZ0DVJ2N3RKMg	2024-11-17 05:36:04	Money.pl
pl	https://www.pudelek.pl/monika-olejnik-zostawia-swoje-bwm-za-350-tysiecy-na-srodku-ulicy-i-pedzi-w-futerku-do-ksiegarni-7093326728756160g	Monika Olejnik parkuje na zakazie - Pudelek	None	None	2024-11-16 16:30:00	Pudelek
pl	https://przegladsportowy.onet.pl/tenis/idze-swiatek-puszczaly-nerwy-i-te-gesty-do-darii-abramowicz/4qwwjlt	Idze Świątek puszczały nerwy. I te gesty do Darii Abramowicz! - Przegląd Sportowy Onet	Wojna nerwów w meczu Igi Świątek z Lindą Noskovą w ramach ćwierćfinału Billie Jean King Cup. Polska tenisistka toczyła bardzo wyrównany bój z 19-latką. Kapitan Dawid Celt nawet nie próbował odzywać się podczas przerw, by nie zdekoncentrować podopiecznej. Natomiast Daria Abramowicz pokrzykiwała z boksu, co spotkało się z sugestywną reakcją Igi.	https://ocdn.eu/sport-images-transforms/1/UdOk9lBaHR0cHM6Ly9vY2RuLmV1L3B1bHNjbXMvTURBXy9hMjdjYzM4OGE3N2JiYmI4NTUzNTY4NjhiZjk2MmM1ZC5wbmeTlQMAAM0HgM0EOJMFzQSwzQJ0kwmmZDQxZDhjBt4AAqEwAaExAQ	2024-11-16 22:16:02	Przegląd Sportowy Onet
pl	https://www.onet.pl/styl-zycia/kbpl-2/sprawdz-w-piwnicy-za-ten-dokument-z-prl-u-mozesz-dostac-nawet-27-tys/swxns5w,0666d3f1	Sprawdź w piwnicy! Za ten dokument z PRL-u możesz dostać nawet 27 tys. - Onet	O PRL-u myślimy teraz często z dużą dozą nostalgii. Nawet wieczny niedobór i konieczność wyczekiwania latami na samochód czy mieszkanie wspominamy z melancholijnym uśmieszkiem. Podobnie jak kartki na żywność oraz książeczki oszczędnościowe na mieszkanie czy samochód. Sprawdź, czy w domu masz książeczkę na Fiata 126p! Teraz jest naprawdę sporo warta!	https://ocdn.eu/pulscms-transforms/1/p7fk9kpTURBXy8zNTQ0OGY1NDBlNTQ1ZTA3NjgxOGM5YTQ3NjBmZDA5My5qcGeSlQMCzQHUzQ3VzQfIkwXNBLDNAnTeAAOhMAGhMQGhM8M	2024-11-16 14:22:20	Onet