country_code	url	title	description	image_url	publish_date	source
pl	https://businessinsider.com.pl/wiadomosci/pas-rdzy-prawdopodobnie-rozstrzygnie-wybory-w-usa/10s10qx	"Pas rdzy" prawdopodobnie rozstrzygnie wybory w USA - Business Insider Polska	Wiele wskazuje na to, że o zwycięstwie w wyborach prezydenckich w USA zadecyduje "pas rdzy". To zwyczajowe określenie terenów na północnym wschodzie Stanów Zjednoczonych, w tym m.in. stanów Pennsyl...	https://ocdn.eu/pulscms-transforms/1/NY4k9kpTURBXy9jZjQ1OGFlZGQ1MGY1OTdlN2Q0ZDRhOTFmMTQ4NGRjYy5qcGeSlQMAFs0H0M0EZZMFzQSwzQJ23gABoTAB	2024-11-02 06:47:54	Business Insider Polska
pl	https://dorzeczy.pl/kraj/651223/kancelaria-prezydenta-planuje-remont-belwederu-za-100-mln-zl.html	Kancelaria Prezydenta planuje remont Belwederu za 100 mln zł - Do Rzeczy	W przyszłym roku planowane są prace m.in. w Pałacu Prezydenckim, ma ruszyć także remont w Belwederze, którego koszt szacowany jest na 100 mln zł – wynika z doniesień prasowych.	https://img.dorzeczy.pl/img/kancelaria-prezydenta-planuje-remont-belwederu-za-100-mln-zl/0b/2f/da037043bac051293f6bfb13cdc2.webp	2024-11-02 09:53:00	Do Rzeczy
pl	https://gostyn24.pl/pl/19_wiadomosci-z-regionu/588_gostyn/73541_tysiace-ludzi-na-gostynskim-cmentarzu-to-uslyszaly-tlumy-stojace-nad-grobami.html	Tysiące ludzi na gostyńskim cmentarzu. To usłyszały tłumy stojące nad grobami bliskich - Gostyn24	1 listopada, w dniu Wszystkich Świętych, na cmentarzu w Gostyniu – największej nekropolii w powiecie gostyńskim – zgromadziły się tłumy wiernych  Mieszkańcy w ciszy i zadumie odwiedzali groby bliskich, zapalając znicze i przynosząc kwiaty, by oddać hołd tym, którzy odeszli 	https://gostyn24.pl/pl/news_foto/2024/1101/s.1200x630/348108.jpg	2024-11-01 14:43:31	Gostyn24
pl	https://www.onet.pl/informacje/onetkielce/strzaly-kolo-cmentarza-w-stopnicy-policjanci-postrzelili-agresora/01n3tm3,79cfc278	Strzały koło cmentarza w Stopnicy. Policjanci spacyfikowali agresywnego rowerzystę - Onet	Policjanci postrzelili agresywnego mężczyznę koło cmentarza w Świętokrzyskiem. Napastnik nie chciał zatrzymać się do kontroli trzeźwości i był agresywny wobec policjantów — ustaliła stacja RMF FM. W zdarzeniu ranna została także policjantka.	https://ocdn.eu/pulscms-transforms/1/DrZk9kpTURBXy9iZmQ1OTgyMzRhOGQ2NGY0MmMxZDk2M2U1ZDZlMzkxNC5qcGeSlQMAAM0GQM0DhJMFzQSwzQJ03gADoTABoTEBoTPD	2024-11-01 13:10:00	Onet
pl	https://www.rp.pl/komentarze/art41388751-artur-bartkiewicz-miedzy-przemyslawem-czarnkiem-a-karolem-nawrockim-na-czym-polega-prezydencki-dylemat-pis	Wybory prezydenckie. Z jakim ryzykiem dla PiS wiąże się Karol Nawrocki, a z jakim Przemysław Czarnek? - Rzeczpospolita	PiS odwleka wybór kandydata na prezydenta, bo tak naprawdę nie ma dobrego wyboru, a każda decyzja będzie wiązać się z pewnym ryzykiem, które będzie trzeba podją	None	2024-11-02 11:06:16	Rzeczpospolita
pl	https://www.pudelek.pl/rafal-grabias-pokazal-nagrobek-gabriela-seweryna-na-pomniku-wygrawerowany-jest-wyjatkowy-napis-7088102315514624a	Rafał Grabias pokazał nagrobek Gabriela Seweryna. Na pomniku wygrawerowany jest wyjątkowy napis - Pudelek	None	None	2024-11-01 21:33:28	Pudelek
pl	https://www.money.pl/gospodarka/recepty-na-bezplatne-leki-rzad-szykuje-spora-zmiane-7088336339303168a.html	Recepty na bezpłatne leki. Rząd szykuje sporą zmianę - Money.pl	Rząd we wtorek zajmie się projektem dotyczącym zmian w wystawianiu recept na bezpłatne, refundowane leki. Po wprowadzeniu nowych przepisów większa liczba lekarzy ma móc wypisywać takie recepty. 	https://v.wpimg.pl/NjY4MDliYQs4Vjt3QxJsHnsOby0FS2JILBZ3ZkNYfFppTH1rCgAiDytRPStCDjwfKVU6NEIZIkU4RCRrGlhhDjBHPSgNEGEPNFYoIENcfg89DXl8CkQoWWBQYHAPDShHOAF8IUFffQtrVXtyVFl3CGEWMA	2024-11-02 12:45:46	Money.pl
pl	https://businessinsider.com.pl/wiadomosci/wybory-prezydenckie-w-usa-premier-tusk-zabral-glos/gvlhe2z	Wybory prezydenckie w USA. Premier Tusk zabrał głos - Business Insider Polska	"Niektórzy twierdzą, że przyszłość Europy zależy od amerykańskich wyborów, podczas gdy w pierwszej kolejności zależy od nas" - napisał premier Donald Tusk na platformie X w kontekście amerykańskich...	https://ocdn.eu/pulscms-transforms/1/nTAk9kpTURBXy80NTFiMGEwNTcwODRjY2JhOTc0NDE4MDkxMjQ4OWIxZC5qcGeSlQMAPs0H0M0EZZMFzQSwzQJ23gABoTAB	2024-11-02 14:13:33	Business Insider Polska
pl	https://www.polsatnews.pl/wiadomosc/2024-11-01/potezne-wichury-w-polsce-strazacy-wyjezdzali-kilkadziesiat-razy/	Potężne wichury w Polsce. Strażacy wyjeżdżali kilkadziesiąt razy - polsatnews.pl	Strażacy w woj. warmińsko-mazurskim od rana jeżdżą do usuwania skutków wichur w regionie. Odnotowali około 50 tego typu zdarzeń - poinformował dyżurny straży pożarnej.	https://ipla.pluscdn.pl/dituel/cp/5m/5mzeitwy4fctiwy9r43j4fv7t3xc3a2n.jpg	2024-11-01 20:03:00	polsatnews.pl
pl	https://www.fakt.pl/pieniadze/wigilia-bez-pracy-i-handlu-ale-zabiora-dzien-z-majowki-ministra-stanowcza/ww4jfv4	Wolna Wigilia kosztem majówki? Ministra stawia sprawę jasno - Fakt.pl	Lewica chce, aby już Wigilia 2024 była dniem wolnym od pracy, a co za tym idzie bez handlu. Pojawiły się głosy o tym, że w zamian za wolny 24 grudnia Polacy będą musieli "oddać" inne święto np. maj...	https://ocdn.eu/pulscms-transforms/1/-Pmk9kuTURBXy80ODJmMWY3YS01NzVlLTQ4ZDItYTI5Yi1iNTFiYjVlMDBiOWEuanBlZ5KVAwDNAcrNEFPNCTCTBc0EsM0Cdt4AAaEwAQ	2024-11-02 11:27:28	Fakt.pl
pl	https://www.onet.pl/kultura/onetkultura/artysci-i-dziennikarze-kwestuja-juz-po-raz-50-kto-pojawil-sie-na-powazkach/46r6xh5,681c1dfa	Artyści i dziennikarze kwestują już po raz 50. Kto pojawił się na Starych Powązkach? - Onet	Warszawskie Stare Powązki w pierwszych dniach listopada stają się miejscem spotkań wyjątkowych osobistości. Znane twarze ze świata kultury, mediów, polityki i rozrywki przechadzają się po alejkach cmentarza z puszkami w ramach akcji Społecznego Komitetu Opieki nad Starymi Powązkami im. Jerzego Waldorffa. To już 50 lat tej szlachetnej tradycji, która nieprzerwanie jednoczy środowisko artystyczne wokół pamięci zabytkowych nagrobków.	https://ocdn.eu/pulscms-transforms/1/0WBk9kpTURBXy80MmQyNjhiYjk3YWZjNWVlODgyYTkzYWY2MDg0MDFlMS5qcGeSlQMAzJLNB9DNBGWTBc0EsM0CdN4AA6EwAaExAaEzww	2024-11-01 15:57:00	Onet
pl	https://wiadomosci.onet.pl/kraj/fronty-wojny-co-ustalila-komisja-gen-strozyka-decyzja-macierewicza-wprawila/nve1qnk	Fronty Wojny. Co ustaliła komisja gen. Stróżyka? "Decyzja Antoniego Macierewicza wprawiła sojuszników w osłupienie" - Wiadomości - Onet	None	None	2024-11-02 16:06:32	Wiadomości - Onet
pl	https://www.polsatnews.pl/wiadomosc/2024-11-02/grozny-wypadek-w-warszawie-zderzenie-na-nowej-trasie-tramwajowej/	Groźny wypadek w Warszawie. Zderzenie na nowej trasie tramwajowej - polsatnews.pl	Zderzenie samochodu osobowego z tramwajem w Warszawie. Do wypadku doszło na oddanym zaledwie kilka dni temu nowym odcinku trasy tramwajowej w stronę Wilanowa. Na szczęście nikomu nic poważnego się nie stało. Kierowcy i pasażerowie komunikacji miejskiej muszą liczyć się z utrudnieniami.	https://ipla.pluscdn.pl/dituel/cp/a1/a1utjka9ia44koxxt88yw1ydzfxcz5bi.jpg	2024-11-02 12:13:00	polsatnews.pl
pl	https://www.rp.pl/wybory-w-usa/art41388971-diabelski-plan-muska-w-razie-wygranej-trumpa	Diabelski plan Muska w razie wygranej Trumpa - Rzeczpospolita	Jeśli Donald Trump ponownie zdobędzie Biały Dom, chce powierzyć właścicielowi Tesli i X zadanie „odchudzenia” budżetu federalnego. To będzie katastrofa.	https://i.gremicdn.pl/image/free/1a8693811ff1bd24af7f937ef3eebd14/?t=crop:4432:2749:nowe:0:106,resize:fill:2000:1250&ctx=preview	2024-11-02 15:44:47	Rzeczpospolita
pl	https://www.sport.pl/pilka/7,65039,31434397,karny-w-doliczonym-czasie-zdecydowal-wielkie-emocje-w-meczu.html	Karny w doliczonym czasie zdecydował. Wielkie emocje w meczu Rakowa ze Stalą - Sport.pl	None	None	2024-11-02 15:57:00	Sport.pl
pl	https://wydarzenia.interia.pl/raport-wybory-prezydenckie-usa-2024/news-przetasowania-w-kluczowych-stanach-publikuja-najnowsze-sonda,nId,7848266	Najnowsze sondaże z USA. Buduje przewagę tuż przed ostatecznym starciem - Interia Wydarzenia	Kliknij i zobacz więcej.	https://i.iplsc.com/-/000K0W3LIYD0T6GO-C461-F4.jpg	2024-11-02 11:49:15	Interia Wydarzenia
pl	https://wiadomosci.gazeta.pl/wiadomosci/7,114883,31434133,kolejne-niebezpieczne-przedmioty-w-cukierkach-na-halloween.html	Kolejne niebezpieczne przedmioty w cukierkach na Halloween. Igły, szpilki i gwoździe - wiadomosci.gazeta.pl	None	None	2024-11-02 12:48:00	wiadomosci.gazeta.pl
pl	https://defence24.pl/wojna-na-ukrainie-raport-specjalny-defence24/miedwiediew-rosja-uzyje-broni-jadrowej-jesli-poczuje-sie-zagrozona	Miedwiediew: Rosja użyje broni jądrowej, jeśli poczuje się zagrożona - Defence24.pl	„USA mylą się, sądząc, że Moskwa nie użyje broni jądrowej&#8221; – oświadczył były prezydent i premier Rosji Dmitrij Miedwiediew. Jego wypowiedź przytoczył Reuters, powołując się na rosyjskie media.	https://cdn.defence24.pl/2022/03/28/1920x1080px/hT6Z8ixOeXp4hXY9W3CWCMf6PsCU4qCnxvxu3mUd.vjfx.jpg	2024-11-02 13:17:04	Defence24.pl
pl	https://www.tvp.info/83285295/nastolatkowie-z-czech-jechali-na-dachu-metra-w-wiedniu-przed-stacja-uderzyli-glowami-w-betonowa-konstrukcje	Bezmyślna przejażdżka na dachu metra. Nastolatkowie walczą o życie - TVP Info	Chcieli nakręcić film na media społecznościowe, teraz walczą o życie w szpitalu. Dwóch nastolatków z Czech uprawiało tak zwany „train surfing” w wiedeńskim metrze....	https://s3.tvp.pl/images2/c/0/6/uid_c0648ba2b5514dcda21caab05ca66983_width_1280_play_0_pos_0_gs_0_height_720_tragiczny-final-zabawy-w-wiedenskim-metrze-fot-xcom.jpg	2024-11-02 13:53:00	TVP Info
pl	https://www.polsatnews.pl/wiadomosc/2024-11-02/koniec-oblawy-po-strzelaninie-w-austrii-roland-drexler-nie-zyje/	Tragiczny finał strzelaniny w Austrii. Koniec obławy za sprawcą - polsatnews.pl	Austriacka policja zakończyła w sobotę poszukiwania Rolanda Drexlera. Funkcjonariusze odnaleźli ciało 56-letniego mężczyzny, za którym obława trwała w związku z niedawną strzelaniną. Zginęły w niej dwie osoby, które wcześniej informowały o przestępczej działalności Drexlera. Urządzał on bowiem nielegalne polowania.	https://ipla.pluscdn.pl/dituel/cp/c3/c3i9q77fopnfcod4ta63g4j295d3pr51.jpg	2024-11-02 16:48:00	polsatnews.pl
pl	https://dorzeczy.pl/swiat/651289/iran-zagrozil-izraelowi-i-usa-miazdzaca-odpowiedzia.html	Groźby wobec Izraela i USA. "Miażdżąca odpowiedź" - Do Rzeczy	Najwyższy przywódca polityczny i duchowy Iranu Ali Chamenei zagroził Izraelowi i USA. Zapowiedział "miażdżącą odpowiedź" na izraelskie ataki.	https://img.dorzeczy.pl/img/grozby-wobec-izraela-i-usa-miazdzaca-odpowiedz/b0/52/f41146057d7fc5781a95760324ea.webp	2024-11-02 13:38:00	Do Rzeczy
pl	https://tvn24.pl/swiat/ukraina-trwa-rosyjska-ofensywa-jedna-z-najpotezniejszych-st8163061	Ukraina. Trwa rosyjska ofensywa. "Jedna z najpotężniejszych" - TVN24	Siły Zbrojne Ukrainy powstrzymują jedną z najpotężniejszych rosyjskich ofensyw od początku inwazji zbrojnej - przekazał w sobotę ich naczelny dowódca Ołeksandr Syrski. Według ukraińskiego projektu DeepState, monitorującego sytuację na froncie, od początku sierpnia tego roku do 1 listopada, wojska rosyjskie zajęły 1146 kilometrów kwadratowych terytorium Ukrainy. 	None	2024-11-02 17:30:41	TVN24
pl	https://dorzeczy.pl/obserwator-mediow/651295/ukrainskie-media-cytuja-slowa-sikorskiego-o-kredycie-na-bron.html	Ukraińskie media cytują słowa Sikorskiego o kredycie na broń - Do Rzeczy	Minister spraw zagranicznych Polski sugeruje Ukrainie zakup polskiej broni na kredyt – pisze Ukraińska Prawda, odnotowując słowa Radosława Sikorskiego.	https://img.dorzeczy.pl/img/ukrainskie-media-cytuja-slowa-sikorskiego-o-kredycie-na-bron/1a/16/8b1d89xx5f8c3b62347396f2085a.webp	2024-11-02 13:55:00	Do Rzeczy
pl	https://wiadomosci.onet.pl/swiat/strzelanina-i-masowa-bijatyka-we-francji-nie-zyje-15-latek/cg3gwkm	Francja boi się "meksykanizacji". Nie żyje 15-latek ranny w strzelaninie - Wiadomości - Onet	None	None	2024-11-02 15:09:24	Wiadomości - Onet
pl	https://tvn24.pl/biznes/pieniadze/gigantyczny-rachunek-za-prad-katastrofa-st8147844	Gigantyczny rachunek za prąd. "Katastrofa" - TVN24	Nie zgadzamy się z takimi rozliczeniami. To jest państwo w państwie - mówi w rozmowie z biznesową redakcją tvn24.pl pan Tomasz z Zielonej Góry. Dostał fakturę za prąd na ponad 20 tysięcy złotych i wysokie prognozy na kolejne miesiące. - Ktoś zmienił taryfę - stwierdza. Enea zapowiada korektę rozliczeń.	https://tvn24.pl/biznes/najnowsze/cdn-zdjecie-9099120-rachunki-za-prad-ph8149368/alternates/LANDSCAPE_1280	2024-11-02 10:34:11	TVN24
pl	https://www.wtp.waw.pl/utrudnienia/2024/11/02/relacja-z-funkcjonowania-komunikacji-miejskiej-na-cmentarze-2-listopada/	Zakończona: Relacja z funkcjonowania komunikacji miejskiej na cmentarze – 2 listopada - Warszawski Transport Publiczny	None	None	2024-11-02 12:45:00	Warszawski Transport Publiczny
pl	https://www.onet.pl/turystyka/onetpodroze/zaczal-sie-wysyp-lasy-panstwowe-ostrzegaja-i-apeluja/h5knhzq,07640b54	Wyrzucają dynie do lasu. Bardzo poważne konsekwencje - Onet	Lasy Państwowe apelują, by nie wyrzucać dyń do lasu. Jak podkreślają leśnicy, dynie nie są naturalnym gatunkiem dla środowiska leśnego. Dlatego takie działania mogą nieść poważne konsekwencje nie tylko dla zwierząt, ale również dla ludzi.	https://ocdn.eu/pulscms-transforms/1/Eapk9kpTURBXy9hOWVmYjFiNTY1NTM5MjlhODNjMzQ3YjU2MWU4NDBjMi5wbmeSlQMAAM0EsM0Co5MFzQSwzQJ03gADoTABoTEBoTPD	2024-11-02 08:43:00	Onet
pl	https://wiadomosci.onet.pl/swiat/tragiczne-skutki-zawalenia-dachu-na-dworcu-w-serbii-jest-nagranie/qfhpgfm	Tragedia na dworcu w Serbii. W sieci pojawiły się nagrania z momentu katastrofy - Wiadomości - Onet	Część dachu dworca kolejowego zawaliła się w piątek po południu w położonym na północy Serbii Nowym Sadzie. Wskutek tragedii zginęło 14 osób — oświadczył szef serbskiego MSW. W mediach społecznościowych pojawiły się nagrania oraz zdjęcia z momentu tragedii.	https://ocdn.eu/pulscms-transforms/1/a2Gk9kpTURBXy8zMTBhYTg4YTBlNzk2ZDg2NzE0MDIyZTNiZmY4MjE0My5wbmeTlQMBAM0FVc0DAJMJpmY3ZmRhNgaTBc0EsM0Cdt4AAaEwAQ/zawalony-dach-dworca-w-serbii.jpg	2024-11-02 08:53:50	Wiadomości - Onet
pl	https://www.pomponik.pl/plotki/news-syn-kaminskiego-wspomina-jego-ostatnie-chwile-przerazajace,nId,7848292	Syn Kamińskiego wspomina jego ostatnie chwile. "Przerażające" - Pomponik.pl	Emilian Kamiński zmarł niecałe dwa lata temu. Jego syn Kajetan w poruszającym wywiadzie opowiedział o ostatnich dniach spędzonych z ojcem. Pomimo ciężkiej	https://i.iplsc.com/-/000K0W79E4CF6I3X-C461-F4.jpg	2024-11-02 11:55:31	Pomponik.pl
pl	https://www.o2.pl/informacje/karygodny-wybryk-w-poznaniu-smiertelne-zagrozenie-7088329807485664a	Karygodny wybryk w Poznaniu. Śmiertelne zagrożenie - o2	Na poznańskich Ratajach już jakiś czas temu zaostrzono ochronę płazów. Właśnie tam w dwóch stawach żyją traszki, które mają do użytku dużo zieleni i specjalnie wybudowane kryjówki. Niestety, ktoś postanowił...	https://v.wpimg.pl/MTRkOGFiYjUzCTl0aRJvIHBRbS4vS2F2J0l1ZWlYdGZiE2AhLwUoJjcbIGkhGzgkMxw_aTYFYjUiAmAxd0YpPSEbIyY_Rig5MA4raH9feWNlWCxxa1B7ZmBGe3J0UGBtal8sanJcKGVmD3cmJFB5ZnAW	2024-11-02 12:53:01	o2
pl	https://www.rp.pl/polityka/art41388581-antoni-macierewicz-moze-stracic-prawo-jazdy-wszczeto-czynnosci-wyjasniajace	Antoni Macierewicz może stracić prawo jazdy? "Wszczęto czynności wyjaśniające" - Rzeczpospolita	W mediach społecznościowych Komenda Stołecznej Policji poinformowała, że Wydział Ruchu Drogowego wszczął czynności wyjaśniające po medialnych doniesieniach o wy	None	2024-11-02 07:55:09	Rzeczpospolita
pl	https://news.google.com/rss/articles/CBMivwFBVV95cUxNN0tyT3BYa08wVjN6d1M2OUJvcGtOcU5EVG51OGlBWTA2cU1lYnE1ZU11S25sbjcwSjJua1ljRWN0SzB0M0M1SXJ4RnhXS0pBRkxEcF9EaWhZcTN6VWNqa1hzWDFEYWxISTNQV3U3Ty1PR0N6QzBrMEw5VWZ1MDJEdFZ0enloakkxODlLSVlkei1NS0JnTGF3MHV6SGFTbzBxUm53Y3hfVEVwX2Z5Mm9ZVkdPczZPQW5PT1FOOTFCMA?oc=5	Zaginięcie Beaty Klimek. Pojawiła się nowa hipoteza. "Coś zupełnie nienaturalnego" - Wiadomości - Onet	None	None	2024-11-02 19:35:46	Wiadomości - Onet
pl	https://news.google.com/rss/articles/CBMimAFBVV95cUxPUXE3U1hUN0hqM242b20tTVpYbEVZRlZhNXNCMjdNUHhlN1F3SkduMWtZS0d1WGFtWUpuUUZVOExIRTJxc3NlSVNaT29mTFVXSWV6cld6QVIzUUllcGdaQWV2ZjdrVF9oeWp4aDlRYmpWa3NvekZaZkFBMlhZeDRscUd4cTY4d0plajU2aWI5VkFGOTF3MklINw?oc=5	Jarosław Kaczyński na Powązkach. Nagrał go Ralph Kaminski na TikToku - naTemat.pl	None	None	2024-11-02 10:54:54	naTemat.pl
pl	https://dorzeczy.pl/sondaz/651361/polska-powinna-brac-udzial-w-spotkaniach-dot-zakonczenia-wojny.html	Polska powinna brać udział w spotkaniach dot. zakończenia wojny? - Do Rzeczy	Polska powinna brać udział w spotkaniach krajów Zachodu oraz Ukrainy dotyczących zakończenia wojny? Znamy wyniki nowego sondażu.	https://img.dorzeczy.pl/img/rozmowy-ws-zakonczenia-wojny-na-ukrainie-polacy-sa-zgodni/70/4b/ba26c067261ed63364b89c41891c.webp	2024-11-02 18:16:00	Do Rzeczy
pl	https://businessinsider.com.pl/wiadomosci/przestancie-sie-przygladac-i-zacznijcie-w-koncu-dzialac-zelenski-w-temacie-korei/s3dmkwt	"Przestańcie się przyglądać i zacznijcie w końcu działać". Zełenski w temacie Korei Północnej - Business Insider Polska	Prezydent Ukrainy Wołodymyr Zełenski wezwał sojuszników Ukrainy, aby przestali "się przyglądać" i podjęli działania w celu przeciwdziałania obecności północnokoreańskich żołnierzy w Rosji, zanim za...	https://ocdn.eu/pulscms-transforms/1/oFik9kpTURBXy9lMjhkNTdhNjA5MjMzZDQyN2I1ZjMwOTZhMWIxODBjNC5qcGeSlQMAEc0Gxs0Dz5MFzQSwzQJ23gABoTAB	2024-11-02 17:26:11	Business Insider Polska
pl	https://www.pap.pl/aktualnosci/lukaszenka-rosja-nie-zaatakuje-polski-z-terytorium-bialorusi-kompletne-glupstwo	Łukaszenka: Rosja nie zaatakuje Polski z terytorium Białorusi. "To kompletne głupstwo" - PAP	None	None	2024-11-02 14:10:00	PAP
pl	https://wiadomosci.onet.pl/swiat/garaze-zamienily-sie-w-trumny-wscieklosc-powodzian-w-hiszpanii/6g6786e	"Garaże zamieniły się w trumny". Wściekłość powodzian w Hiszpanii - Wiadomości - Onet	Dramat, wściekłość, rozczarowanie — to uczucia towarzyszące mieszkańcom Hiszpanii, w których uderzyła niszczycielska powódź. W rozmowie z Interią opowiadają, że ostrzeżenia dostawali, "gdy mieli wody po szyję", i obarczają lokalne władze winą za rosnący bilans ofiar. Ludzie ginęli, gdy próbowali wyprowadzać auta z podziemnych garaży.	https://ocdn.eu/pulscms-transforms/1/Y2Yk9kpTURBXy8yNDQ4NTM4NTMzMDVlNmFlMTM5MWFiOTFkNzk1NDg4NS5qcGeTlQMAzKvNFWDNDAaTCaY3ODU4MDkGkwXNBLDNAnbeAAGhMAE/skutki-powodzi-w-miescie-paiprota-w-prowincji-walencja.jpg	2024-11-02 15:05:52	Wiadomości - Onet
pl	https://www.polsatnews.pl/wiadomosc/2024-11-02/zwrot-w-pogodzie-mozliwe-przymrozki-w-calej-polsce/	Arktyczne powietrze w Polsce. Pojawią się przymrozki - polsatnews.pl	Do Polski zaczyna docierać arktyczne powietrze z północnego zachodu. Przyniesie ono ochłodzenie, o czym ostrzegają synoptycy. W nocy z soboty na niedzielę w całym kraju mogą wystąpić przymrozki. To nie koniec mniej przyjemnych zaskoczeń w pogodzie. Nadchodzące godziny i dni mogą okazać się bardzo wietrzne.	https://ipla.pluscdn.pl/dituel/cp/mn/mnvve2rkbjgfb7u1b2n1mrov235uiv9k.jpg	2024-11-02 14:23:00	polsatnews.pl
pl	https://wiadomosci.onet.pl/swiat/incydent-z-udzialem-anny-marii-anders-interweniowal-burmistrz/zbgl6gl	Poważny wypadek Anny Marii Anders podczas uroczystości na Monte Cassino. Trafiła do szpitala - Wiadomości - Onet	Piątkowe uroczystości na polskim cmentarzu wojskowym na Monte Cassino zakończyły się niefortunnym wypadkiem. Była ambasador Polski we Włoszech Anna Maria Anders, córka generała Władysława Andersa, doznała poważnej kontuzji — informuje "Il Messagerro". O tym, jak doszło do upadku, Anders poinformowała na portalu X.	None	2024-11-02 04:40:57	Wiadomości - Onet
pl	https://wiadomosci.onet.pl/kraj/sikorski-spotka-sie-z-lawrowem-ekspert-zwraca-uwage-na-inny-scenariusz/myvgsnb	Radosław Sikorski spotka się z Siergiejem Ławrowem? Ekspert zwraca uwagę na inny scenariusz - Wiadomości - Onet	Siergiej Ławrow jako prominentny funkcjonariusz zbrodniczego reżimu, łamiącego prawo międzynarodowe w sposób ostentacyjny, nie powinien być wpuszczony na spotkanie OBWE. To jest element traktowania serio prawa międzynarodowego. To tak, jakby w trakcie II wojny światowej zapraszać Joachima Ribbentropa na salony — ocenia politolog dr Witold Sokała, odnosząc się do możliwej wizyty szefa rosyjskiego MSZ na Malcie podczas grudniowego szczytu. Ekspert kreśli także niepokojący scenariusz dotyczący możliwej agresji Rosji na państwa Zachodu. Kluczową rolę miałyby odegrać w tym przypadku Chiny.	https://ocdn.eu/pulscms-transforms/1/jL3k9kpTURBXy8wZDQ3YmU1YjM3YWI0M2IwMzFlM2RmYjNmNzYyZTUwYS5qcGeTlQMAzKPNB9DNBGWTCaZlYjM5ZDIGkwXNBLDNAnbeAAGhMAE/wladimir-putin-i-siergiej-lawrow.jpg	2024-11-02 17:03:48	Wiadomości - Onet
pl	https://www.tvp.info/83271776/mariampol-rowerzysta-zaatakowal-policjantke-nozem-i-mlotkiem-na-cmentarzu	Na cmentarzu zaatakował policjantkę nożem i młotkiem - TVP Info	Niebezpieczna sytuacja na cmentarzu w miejscowości Mariampol (woj. świętokrzyskie). Po tym, jak służby zatrzymały rowerzystę do kontroli, agresywny mężczyzna zaatakował policjantkę nożem i...	https://s9.tvp.pl/images2/9/7/9/uid_97968350e98a4bef98cb32aff32ae7e6_width_1280_play_0_pos_0_gs_0_height_720_dramat-na-cmentarzu-w-mariampolu-fot-papdarek-delmanowicz-zdjecie-ilustracyjne.jpg	2024-11-01 12:40:00	TVP Info
pl	https://wiadomosci.onet.pl/kraj/odwolani-adwokaci-pawla-szopy-zabieraja-glos-nie-dostalem-nawet-kserokopii/wzj00g5	Odwołani adwokaci Pawła Szopy zabierają głos. "Nie dostałem nawet kserokopii" - Wiadomości - Onet	"O mojej relacji z klientem wiemy tylko ja i on" — oświadczył w piątek w mediach społecznościowych mecenas Bartosz Lewandowski, komentując swoje odwołanie z funkcji adwokata Pawła Szopy. Wcześniej pod jego adresem padły zarzuty, że "nie działał w interesie" swojego klienta. Do sprawy odniósł się także drugi z odwołanych obrońców, mecenas Krzysztof Wąsowski. Obecnie jedynym adwokatem założyciela marki Red is Bad w sprawie dotyczącej nieprawidłowości w Rządowej Agencji Rezerw Strategicznych pozostaje Jacek Dubois.	https://ocdn.eu/pulscms-transforms/1/pink9kpTURBXy83MGI2MDQyZTNlZWNjYmUxMTIyNDg5YWJiYTFlNmYxZC5qcGeTlQMAAM0GQM0DhJMJpjdhMDY2NgaTBc0EsM0Cdt4AAaEwAQ/byli-adwokaci-pawla-szopy-bartosz-lewandowski-i-krzysztof-wasowski-zabrali-glos-na-temat-decyzji-swojego-klienta.jpg	2024-11-01 19:44:38	Wiadomości - Onet
pl	https://wiadomosci.wp.pl/szokujace-zachowanie-kierowcow-na-a4-strazacy-musieli-isc-pieszo-7088389019048672a	Szokujące zachowanie kierowców na A4. Strażacy musieli iść pieszo - WP Wiadomości	"Fakt" opisuje szokujące okoliczności karambolu, do jakiego doszło na autostradzie A4 pod Krakowem. Strażacy byli zmuszeni porzucić swój pojazd i biec pieszo, instruując ludzi, jak powinni reagować, aby	https://v.wpimg.pl/YjgwMzYxdgsGFTtJdgN7HkVNbxMwWnVIElV3WHZJa1pXD2IcMBQ8GAIHIlQ-CiwaBgA9VCkUdgsXHmIMaFc9AxQHIRsgVzwHBRIpVT1POlJURy8bdE0_XlZaeR5tHnQLBUF8VzhPbwhfR35MaEFvCEUK	2024-11-02 16:15:49	WP Wiadomości
pl	https://www.onet.pl/informacje/onetwiadomosci/nowe-regulacje-ministerstwa-zdrowia-chodzi-min-o-medyczna-marihuane/gymmsdq,79cfc278	Nadchodzą duże zmiany w e-receptach. Obejmą szereg substancji - Onet	W odpowiedzi na niepokojący wzrost nadużywania substancji odurzających i psychotropowych, Ministerstwo Zdrowia wprowadza nowe regulacje. Zgodnie z zaktualizowanym rozporządzeniem, recepty na tego rodzaju środki będą mogły być przepisywane wyłącznie po bezpośrednim kontakcie z lekarzem, eliminując możliwość korzystania z telemedycyny w tym zakresie — informuje "Rzeczpospolita".	https://ocdn.eu/pulscms-transforms/1/p75k9kpTURBXy82YmJlMDgxY2UyMTgyMjM0ZTdkMjc3YmI5ZjE4Y2EwMS5qcGeSlQMAH80D6M0CM5MFzQSwzQJ03gADoTABoTEBoTPD	2024-11-02 15:00:48	Onet
pl	https://www.wysokieobcasy.pl/wysokie-obcasy/7,163229,31434123,jennifer-lopez-wsparla-kamale-harris-czy-trafi-do-latynosek.html?disableRedirects=true	Jennifer Lopez wsparła Kamalę Harris. Czy wpłynie na głosy Latynosek i Latynosów? - WysokieObcasy.pl	None	None	2024-11-02 14:39:08	WysokieObcasy.pl
pl	https://gazetawroclawska.pl/pozar-we-wroclawiu-kleby-czarnego-dymu-na-krzykami-interweniowali-strazacy/ar/c1-18916355	Pożar we Wrocławiu. Kłęby czarnego dymu na Krzykami. Interweniowali strażacy - Gazeta Wrocławska	None	None	2024-11-02 12:37:00	Gazeta Wrocławska
pl	https://www.rmf24.pl/regiony/lublin/news-powazny-wypadek-w-lubelskiem-cztery-osoby-poszkodowane,nId,7848290	Poważny wypadek w Lubelskiem. Cztery osoby poszkodowane - RMF 24	None	None	2024-11-02 12:00:00	RMF 24
pl	https://dorzeczy.pl/swiat/651307/kemi-badenoch-zostala-nowa-liderka-partii-konserwatywnej.html	Kemi Badenoch została nową liderką Partii Konserwatywnej - Do Rzeczy	Kemi Badenoch, była szefowa ministerstwa biznesu i handlu, została nową liderką Partii Konserwatywnej w Wielkiej Brytanii.	https://img.dorzeczy.pl/img/kemi-badenoch-zostala-nowa-liderka-partii-konserwatywnej/c2/5c/9049074d7d5e5f519e1387e35490.webp	2024-11-02 15:53:00	Do Rzeczy
pl	https://news.google.com/rss/articles/CBMisgFBVV95cUxNQXpWMFFpalR4c1BEcTRIQ3laSHExOG9lUkFUYmR0WE1ZRUhfNFo5ZTdjUlFnUlpnX29GcGFKdXNKczUtb2s0cHd2MGdrWmxFZTI3S2p5cVVQTjdTdWZRajZydHZXVE9DSHZlb1dSVFAtQndJQU4zNWdyU3hBTjhwc0lnTnFkVHRhZm9mWmFkVXJUblBWSWp1S2xnQzY5RjB4eHN2UFJlRTJIblk3cl95bjJ3?oc=5	Posiniaczony niemowlak trafił do szpitala. W domu krzyk, płacz i wyzwiska - TVN24	None	None	2024-11-02 15:43:45	TVN24
