country_code	url	title	description	image_url	publish_date	source
ru	https://www.interfax.ru/russia/988082	Минобороны РФ сообщило о бомбардировке позиций ВСУ в Курской области - Интерфакс	Российский фронтовой бомбардировщик Су-34 нанес удар по позициям вооруженных сил Украины (ВСУ) в Курской области, сообщили в Министерстве обороны РФ в среду.	https://www.interfax.ru/aspimg/988082.png	2024-10-23 02:24:00	Интерфакс
ru	https://news.google.com/rss/articles/CCAiC0ZreXM3YzdZakRBmAEB?oc=5	Это полный ПРОВАЛ! ВСУ покрошили армию РФ. Путин отдал новый приказ по Курску. В Кремле шок - УНІАН	None	None	2024-10-23 08:00:19	УНІАН
ru	https://news.ru/russia/putin-vstretilsya-s-premer-ministrom-odnoj-strany-na-sammite-briks/	Путин встретился с премьер-министром одной страны на саммите БРИКС - NEWS.ru	Президент РФ Владимир Путин и премьер-министр Эфиопии Абий Ахмед провели двустороннюю встречу. Она стала заключительным мероприятием второго дня саммита БРИКС.	https://static.news.ru/photo/a32258d0-917a-11ef-be7a-02420a0000c9_760.jpg	2024-10-23 20:13:40	NEWS.ru
ru	https://www.pravda.com.ua/rus/news/2024/10/23/7481084/	Российские войска вошли в Селидово в Донецкой области – аналитик BILD - Украинская правда	Военный аналитик немецкого издания Bild Юлиан Рёпке сообщил, что российские войска вошли в город Селидово Донецкой области.	https://img.pravda.com/images/doc/7/4/7481084_fb_image_rus_2024_10_23_23_02_46.jpg	2024-10-23 19:22:39	Украинская правда
ru	https://www.bfm.ru/news/560580	Эрдоган: Москва и Анкара устраняют проблемы в двусторонних расчетах - BFM.RU	None	None	2024-10-23 17:05:03	BFM.RU
ru	https://www.fontanka.ru/2024/10/24/74247821/	В Москве ввели мораторий на строительство апартаментов - 24 октября 2024 - Фонтанка.Ру	None	None	2024-10-23 22:18:00	Фонтанка.Ру
ru	https://news.google.com/rss/articles/CCAiC19QNnI0QkxUcV9jmAEB?oc=5	Курское проклятие РФ! Новые беда у армии Путина. Тайный пункт с КНДР, новый план Зеленского | НАКИ - УНІАН	None	None	2024-10-24 04:00:28	УНІАН
ru	https://www.bfm.ru/news/560544	МВФ назвал Россию четвертой экономикой мира по паритету покупательной способности - BFM.RU	None	None	2024-10-23 08:09:34	BFM.RU
ru	https://www.fontanka.ru/2024/10/24/74248145/	Вода в Неве снова прибывает - Фонтанка.Ру	None	None	2024-10-24 05:09:00	Фонтанка.Ру
ru	https://www.interfax.ru/world/988327	Как минимум один человек погиб и-за ударов Израиля по пригородам Бейрута - Интерфакс	Пятеро ранено, включая ребенка	https://www.interfax.ru/aspimg/988327.jpg	2024-10-24 00:04:00	Интерфакс
ru	https://www.fontanka.ru/2024/10/24/74248370/	Пограничная охрана Финляндии полностью прекращает работу двух КПП на границе с Россией - Фонтанка.Ру	None	None	2024-10-24 06:30:00	Фонтанка.Ру
ru	https://www.fontanka.ru/2024/10/24/74248085/	В смеси для блинов, которые ели отравившиеся камчатские дети, нашли сальмонеллу - Фонтанка.Ру	None	None	2024-10-24 04:43:00	Фонтанка.Ру
ru	https://meduza.io/news/2024/10/24/politico-protiv-priema-ukrainy-v-nato-vystupayut-sem-stran	Politico: против приема Украины в НАТО выступают семь стран - Meduza	Против немедленного приглашения Украины в НАТО выступают семь стран альянса, пишет Politico со ссылкой на четырех неназванных чиновников и дипломатов. 	https://meduza.io/imgly/share/1729753113/news/2024/10/24/politico-protiv-priema-ukrainy-v-nato-vystupayut-sem-stran	2024-10-24 06:58:00	Meduza
ru	https://bcs-express.ru/novosti-i-analitika/prognozy-i-kommentarii-rynok-spolzaet-dokuda-i-dokole	Прогнозы и комментарии. Рынок сползает — докуда и доколе - БКС Экспресс	Индекс МосБиржи по итогам вечерки потерял 1,5% и обновил 5-недельные минимумы. Техническая поддержка теперь ниже, а пик распродаж бумаг может прийтись на пятницу	https://cdn.bcs-express.ru/article-head/17042.jpg	2024-10-24 04:47:30	БКС Экспресс
ru	https://news.google.com/rss/articles/CBMiUEFVX3lxTFBCZ3hlT3JlclVOQlBiQjgtU0NSb1J4YXVzekFVY3BJdEN5RjUwVEZncm5pTmNFOHdzNjI4R3BfUndxOFV0bHV4RkRkMTZqcVpq?oc=5	Семь маршрутов наземного транспорта изменятся с 26 октября / Новости города / Сайт Москвы - Официальный сайт Мэра Москвы	None	None	2024-10-23 08:02:01	Официальный сайт Мэра Москвы
ru	https://www.fontanka.ru/2024/10/23/74247737/	США предоставят Киеву кредит на $20 млрд за счет процентов от российских активов - 23 октября 2024 - Фонтанка.Ру	None	None	2024-10-23 19:27:00	Фонтанка.Ру
ru	https://news.google.com/rss/articles/CBMiU0FVX3lxTE1BV1lTUUpZM2tmRjNRRUp2M3FFeXVsUGs3Qk5kdUN0eHExOVR5UjJHckg4aU5jN3Axd3Jpc2Faai1ZbWVPRGRsNXVZSGNDWFR5VHlB?oc=5	Собянин принял решение о комплексном развитии 4 участков на востоке и юге Москвы - Официальный сайт Мэра Москвы	None	None	2024-10-24 04:01:03	Официальный сайт Мэра Москвы
ru	https://www.vedomosti.ru/society/articles/2024/10/24/1070611-kak-iskali-vinovatih-v-povishenii-tarifov-zhku	Как министры и депутаты искали виноватых в повышении тарифов на ЖКУ - Ведомости	Во время правительственного часа в Госдуме обсудили подготовку к отопительному сезону	https://sharing.vedomosti.ru/1729721766/vedomosti.ru/society/articles/2024/10/24/1070611-kak-iskali-vinovatih-v-povishenii-tarifov-zhku.jpg	2024-10-23 21:56:20	Ведомости
ru	https://ysia.ru/paromnuyu-perepravu-yakutsk-nizhnij-bestyah-zakroyut-ranshe-obychnogo-sroka/	Паромную переправу Якутск — Нижний Бестях закроют раньше ... - ЯСИА	Скоро начнет работу паромная переправа с ледокольным сопровождением по маршруту Жатай – Техтюр	https://ysia.ru/wp-content/uploads/2024/10/SKR-3408.jpg	2024-10-23 11:01:31	ЯСИА
ru	https://tsn.ua/ru/politika/si-czinpin-na-sammite-v-rossii-sdelal-zayavlenie-o-voyne-2685606.html	Си Цзиньпин на саммите в России сделал заявление о войне - ТСН	Лидер Китая Си Цзиньпин в очередной раз высказался о войне России в Украине — читайте новости 1+1 (ТСН.ua).	https://img.tsn.ua/cached/927/tsn-d7721072f5f1787fa1f16a6df613a75f/thumbs/1200x630/0c/b6/11c371fb2b0c1a18335f84c6578eb60c.jpeg	2024-10-23 12:26:00	ТСН
ru	https://www.interfax.ru/moscow/988380	Суд заменил реальный срок на условный для экс-замглавы Минпросвещения Раковой - Интерфакс	Московский городской суд заменил на условное наказание в пять лет колонии, назначенное бывшему замминистра просвещения РФ Марине Раковой за мошенничество, сообщили "Интерфаксу" в суде.	https://www.interfax.ru/aspimg/988380.jpg	2024-10-24 09:16:00	Интерфакс
ru	https://www.vedomosti.ru/politics/news/2024/10/24/1070655-ratifitsirovala-dogovor	ГД ратифицировала договор о всеобъемлющем стратегическом партнерстве РФ и КНДР - Ведомости	Он был заключен в рамках визита Владимира Путина в Северную Корею	https://sharing.vedomosti.ru/1729757851/vedomosti.ru/politics/news/2024/10/24/1070655-ratifitsirovala-dogovor.jpg	2024-10-24 07:48:46	Ведомости
ru	https://forbes.kz/articles/s-kem-vstrechalsya-tokaev-na-sammite-briks-v-rossii-22b606	С кем встречался Токаев на саммите БРИКС в России - Forbes Казахстан	Мероприятие стартовало в Казани 23 октября	https://img.forbes.kz/forbes-photobank/media/2024-10-24/05a0eec2-4b39-4b06-bff4-913ad767648b.jpeg	2024-10-24 04:32:30	Forbes Казахстан
ru	https://www.bfm.ru/news/560611	ФАБ-3000 уничтожила 50 операторов дронов ВСУ в Курахове - BFM.RU	None	None	2024-10-24 09:42:52	BFM.RU
ru	https://news.google.com/rss/articles/CCAiC196aUh2VWJVSHdvmAEB?oc=5	Нападение КНДР: орда Кима прет! Ответка Сеула: у ВСУ новый союзник. Адские прилеты в РФ / Важное - УНІАН	None	None	2024-10-22 20:00:25	УНІАН
ru	https://www.t24.su/tsenam-na-avtomobili-v-rossii-grozit-rezkiy-rost-k-novomu-godu/	Ценам на автомобили в России грозит резкий рост к Новому году - http://www.t24.su/	Тайшет24	https://www.t24.su/wp-content/uploads/2024/10/2024-02-26_12-27-14-1.jpg	2024-10-24 02:19:05	http://www.t24.su/
ru	https://www.vedomosti.ru/society/news/2024/10/24/1070647-fas-viyavila-dorozhnii-kartel	ФАС выявила дорожный картель на 14,9 млрд рублей при реализации нацпроекта - Ведомости	Федеральная антимонопольная служба (ФАС) России возбудила дело о нарушении антимонопольного законодательства после выявления дорожного картеля в Воронежской и Тамбовской областях на 14,9 млрд руб.	https://sharing.vedomosti.ru/1729757770/vedomosti.ru/society/news/2024/10/24/1070647-fas-viyavila-dorozhnii-kartel.jpg	2024-10-24 07:35:27	Ведомости
ru	https://nversia.ru/news/saratovcy-obsuzhdayut-cenniki-na-slivochnoe-maslo-i-federalnye-novosti-o-sokraschenii-ego-otgruzok-v-magaziny/	Саратовцы обсуждают ценники на сливочное масло и федеральные новости о сокращении его отгрузок в магазины - ИА Версия, Саратов	Жители Саратова в социальных сетях обсуждают рост цен на сливочное масло и федеральные новости о том, что некоторые компании предупредили о сокращении отгрузок данной продукции. Дискуссия развернулась на фоне статьи «Совсем скисли» в газете «Ведомости», опубликованной вчера, 22 октября.	https://nversia.ru/imgs/share/1729681016_801573135.jpg	2024-10-23 11:19:00	ИА Версия, Саратов
ru	https://www.forbes.ru/biznes/523672-kovarnyj-sosed-kak-kitaj-lisaet-rossijskih-stalevarov-pribyli-i-rynkov-sbyta	Коварный сосед: как Китай лишает российских сталеваров прибыли и рынков сбыта - Forbes Russia	Производство стали в России, как и во многих других странах, продолжило снижение. В крупнейших промышленных государствах спрос сокращается в строительстве и автопроме — основных потребляющих сталь отраслях. В то же время в условиях снижения внутренне	https://cdn.forbes.ru/forbes-static/shareimages/523672.jpg?v=1729754229	2024-10-24 03:00:00	Forbes Russia
ru	https://news.google.com/rss/articles/CBMiTkFVX3lxTFAzSTV0cWlFRGdnR2hhWm5qU2FnQ0ZfMVlxTmxyYlVoTzhQb1dSTDI5UTNoSUVPUDYyYXV2cXBNRnVhWFZlSkhJMTZoeXZBZ9IBSkFVX3lxTE5taWNYM290dC1PSVgzYWtUdG1Za3dFQnpFbDU4THpHQi1fY2syeEpLN1MwczY4S2RSZTc5WjRtVGhIQ1k3cnN2X1RB?oc=5	В правоохранительных органах сообщили о задержании замминистра энергетики Мочальникова - Интерфакс	Чиновник проходит по делу о мошенничестве во время ликвидации угольных шахт в РФ	https://www.interfax.ru/aspimg/988410.jpg	2024-10-24 11:09:00	Интерфакс
ru	https://www.rbc.ua/ukr/news/putin-robit-stavku-shcho-viyska-kndr-vidvoyuyut-1729756079.html	Путин делает ставку, что войска КНДР отвоюют Курскую область, - FT - РБК-Украина	Подробнее читайте на сайте	https://www.rbc.ua/static/img/_/g/_gettyimages_1243010962_06b474840340e60b9125d1f491d2de06_1300x820.jpg	2024-10-24 07:47:59	РБК-Украина
ru	https://ura.news/news/1052834043	Эрдоган принял решение остаться в России - URA.RU	Читайте на URA.RU	https://s.ura.news/images/news/upload/smm/2024/10/24/facebook_145e6237dbf3a8b34611fa6c71cad10a.jpg	2024-10-24 08:00:00	URA.RU
ru	https://www.vedomosti.ru/politics/articles/2024/10/24/1070663-chto-skazal	Что сказал Путин и лидеры зарубежных стран на заседании «БРИКС плюс/аутрич» - Ведомости	В мероприятии приняли участие представители 40 государств Европы, Азии, Африки и Латинской Америки	https://sharing.vedomosti.ru/1729768509/vedomosti.ru/politics/articles/2024/10/24/1070663-chto-skazal.jpg	2024-10-24 08:33:25	Ведомости
ru	https://www.bfm.ru/news/560560	Pay, Clear и Bridge: БРИКС ищет замену глобальной финансовой системе - BFM.RU	None	None	2024-10-23 19:34:37	BFM.RU
ru	https://exclusive.kz/arinovu-ukazali-na-situacziyu-v-go-ministr-privel-primer-kontnastupleniya-ukrainy-v-rossii/	Аринову указали на ситуацию в ГО – министр привел пример контнаступления Украины в России - Exclusive.kz	None	None	2024-10-24 10:21:31	Exclusive.kz
ru	https://www.rbc.ua/ukr/news/rosiya-vnochi-zapustila-proti-ukrayini-bilshe-1729664579.html	Россия ночью запустила против Украины более 80 дронов: сколько сбила ПВО - РБК-Украина	Подробнее читайте на сайте	https://www.rbc.ua/static/img/3/_/3_430a1e75946f7bd81eb2d6113d5d8cfa_1300x820.jpg	2024-10-23 06:22:59	РБК-Украина
ru	https://news.google.com/rss/articles/CBMimwFBVV95cUxNNHBPVk9SRXo2aHlKQkxKUkhIV3RCMW9xeTZCOHVZTC1WNzZoMFlPMnBHNG1ITzB6d3JVWWdvRU1SSUFaSnBmRjJPcmNac2NrcEJYY0JNcWZTdXM5LWFmVUhoQUU2d19HWjcwZmlxU0VscDdfVkpJR2RMZnBzcGNoRnRtaURVVEJrb05sN3FjX3dncm5uNlltY2hyZ9IBngFBVV95cUxQbUZqTHNnUFptTzhwYTE1VllvcjhfazdkVUhOdEwzMmU2RngxaVkyUXV2cGFUSWtZLTJlUmhRREpJTnAwZ20wczdmdmo3NENSVER3SldpVkpIZnl0M1FOcXdhc29mMms5SmJWSWhoQ1VrZDN3cC1HTWJaSVBzMVRwOUtnaGpDQ1hZNEdEZnZDczktZ3kwZEdyY2E4YU5ldw?oc=5	Путин и Си встретились в Казани "на полях" саммита БРИКС - Радио Свобода 	None	None	2024-10-22 16:41:06	Радио Свобода 
ru	https://topcor.ru/52843-vks-rf-zabrosali-bombami-punkt-razmeschenija-operatorov-bpla-vsu-v-kurahovo.html	ВКС РФ забросали бомбами пункт размещения операторов БПЛА ВСУ в Курахово - Репортёр	Российские военные продолжают наступательную операцию на Донбассе. За последние дни штурмовым подразделениям ВС РФ удалось сломить сопротивление боевиков киевского режима сразу в нескольких населенных пунктах, которые в Киеве до недавнего времени называли ключевыми. Одной из самых горячих точек в	https://topcor.ru/uploads/posts/2024-10/3fbc4b114f_dron.webp	2024-10-24 06:45:42	Репортёр
ru	https://primamedia.ru/news/1878285/	Популярные продукты заметно подорожали в магазинах - последняя статистика - PrimaMedia	По данным Росстата, с 15 по 21 октября сливочное масло прибавило в цене 1,6%. Также за этот период наблюдаются подорожания других молочных продуктов: сметана увеличилась в цене на 0,9%, молоко и куриные яйца &mdash; на 0,7%, а сыры — на 0,6%, сообщает ИА PrimaMedia.	https://primamediamts.servicecdn.ru/f/main/4791/4790253.jpg?4b7c1c559a836925ae5e74615f9eb996	2024-10-24 09:45:18	PrimaMedia
ru	https://news.google.com/rss/articles/CBMi0AFBVV95cUxQWmJyVFV3VWlZZUJ1aEtoeWtDSzB5WHh3VVUyc0xPNWZDMGU5QkladUZYWEFaWGJmTGlSRUx4azM3WXF3bGx4MDl5U0JHNmJVZndXRFJJMkloaEJqSlZJWjZmbjRIV3lZVFl0Zlo0M2VyQjgwUURlTTNOWnQ1RDlQY1RjRXV1RVNfekVlVm93a0Y3eU1yV2lHS1RSVW00bmJnenFVSTNSR3pManB0WXZkdFNXcEp6R3JvcjJLVkY0dnEzbHQ4RzFSR0tKZmVpcTRv?oc=5	Из разработчиков ядра операционной системы Linux исключили 11 программистов, связанных с Россией - Meduza	11 программистов, связанных с Россией, исключили из списка разработчиков, отвечающих за стабильность ядра операционной системы Linux. Соответствующие изменения 18 октября внес один из главных разработчиков Linux Грег Кроа-Хартман, сообщил профильный проект Phoronix, обнаруживший изменения в ночь на 23 октября.	None	2024-10-24 07:31:00	Meduza
ru	https://www.interfax.ru/world/988318	Космический корабль Crew Dragon с космонавтом "Роскосмоса" отстыковался от МКС - Интерфакс	Американский космический корабль Crew Dragon-8 компании SpaceX с экипажем из трех астронавтов и космонавта "Роскосмоса" Александра Гребенкина в четверг по московскому времени отстыковался от Международной космической станции (МКС) для возвращения на Землю, сообщило NASA.	https://www.interfax.ru/aspimg/988318.png	2024-10-23 21:10:00	Интерфакс
ru	https://72.ru/text/realty/2024/10/24/74246489/	Крупнейший банк страны резко поднял ставки по ипотеке. Что это меняет? - Новости Тюмени – 72.ru	Разбираемся, к чему такая мера, если базовые программы и без того недосягаемы	https://72.ru/html-to-img/image?hash=lGlLhCUl7DpFNon5f-xL-Q&ts=1729761030&url=https%3A%2F%2F72.ru%2Fog-image%2Farticle-id5913624%2F&width=1200	2024-10-24 06:00:00	Новости Тюмени – 72.ru
ru	https://www.newsvl.ru/vlad/2024/10/24/227368/	С сегодняшнего дня во Владивостоке начнут массово подключать жилые дома к отоплению - Новости Владивостока и Приморского края	Новости Владивостока: С 24 октября в жилые дома Владивостока начнёт поступать тепло. Сам отопительный сезон стартовал ещё неделю назад, но в первую очередь подключали больницы, школы и детсады. Повезло и некоторым жилым домам, но массово начнут подключать многоэтажки только сейчас. Если в вашем доме батареи уже потеплели, рассказать об этом теперь можно при помощи сервиса «Отключения воды и света» на VL.ru – на страницах домов появилась кнопка «Сообщите, что дали отопление».	https://static.vl.ru/news/1729732475562_default	2024-10-24 01:14:00	Новости Владивостока и Приморского края
ru	https://m.business-gazeta.ru/news/652077	Минниханов с чак-чаком встретил Пашиняна в Казани: «Положить обратно?» – «Нет, можно доесть!» - БИЗНЕС Online	None		2024-10-24 04:31:00	БИЗНЕС Online
ru	https://vc.ru/money/1608660-day974	День 974: расходы госорганов на закупку VPN в 2024 году выросли на - vc.ru	None	https://api.vc.ru/v2.1/cover/fb/c/1608660/1729771560/cover.jpg	2024-10-24 05:26:49	vc.ru
ru	https://www.interfax.ru/business/988233	Оба аукциона Минфина по размещению нового госдолга признаны несостоявшимися - Интерфакс	Оба первичных аукциона по размещению нового госдолга 23 октября признаны Минфином несостоявшимися; это произошло впервые с 15 мая.	https://www.interfax.ru/aspimg/988233.png	2024-10-23 13:52:00	Интерфакс
ru	https://www.forbes.ru/biznes/523623-neskromnaa-roskos-kto-i-pocemu-skupaet-elitnye-novostrojki-moskvy	Нескромная роскошь: кто и почему скупает элитные новостройки Москвы - Forbes Russia	Пока рынок массового жилья в Москве пытается адаптироваться к жизни без льготной ипотеки и демонстрирует снижение продаж более 50% год к году, в высокобюджетном сегменте спрос, объем предложения и цены штампуют рекорды. Кто покупает все эти роскошные	https://cdn.forbes.ru/forbes-static/shareimages/523623.jpg?v=1729665444	2024-10-23 04:00:00	Forbes Russia
ru	https://meduza.io/feature/2024/10/23/storonniki-evrointegratsii-v-moldove-pobedili-no-s-perevesom-menee-chem-v-odin-protsent	Сторонники евроинтеграции в Молдове победили — но с перевесом менее чем в один процент - Meduza	На выборах президента Молдовы, прошедших 20 октября, ни один из кандидатов не преодолел барьер в 50% голосов. Для действующего президента Майи Санду, набравшей 43,45%, результаты оказались крайне неожиданными — соцопросы показывали, что второй тур вряд ли состоится. Еще более удивительной стала победа сторонников евроинтеграции с перевесом меньше, чем в один процент — в медиа уже называют ее «пирровой» для прозападных политиков. Журналист Владимир Соловьев в статье для проекта Carnegie Politika объясняет, почему нынешние результаты политической борьбы не должны шокировать. «Медуза» с любезного разрешения коллег публикует этот материал полностью.	https://meduza.io/imgly/share/1729695687/feature/2024/10/23/storonniki-evrointegratsii-v-moldove-pobedili-no-s-perevesom-menee-chem-v-odin-protsent	2024-10-23 14:02:00	Meduza
