country_code	url	title	description	image_url	publish_date	source
ru	https://pfc-cska.com/novosti/vse-novosti/novosti-osnovy/marko-nikolich--2/	Марко Николич: В обороне мы играем плотно и четко, а над атакой надо еще много работать - ПФК ЦСКА	None	None	2024-10-26 15:36:49	ПФК ЦСКА
ru	https://www.rbc.ua/ukr/news/udar-rf-energoob-ektah-sumskiy-oblasti-ova-1730009458.html	Удар РФ по энергообъектам в Сумской области: в ОВА рассказали подробности - РБК-Украина	Подробнее читайте на сайте	https://www.rbc.ua/static/img/i/m/imgonline_com_ua_resize_kzmrwwmqxjzrf4_1dd036d9ea361ffc7a28785c8c2d0f16_1300x820.jpg	2024-10-27 06:13:58	РБК-Украина
ru	https://tagilcity.ru/news/2024-10-26/proschalsya-ves-gorod-v-chelyabinskom-korkino-pohoronili-ubituyu-tsyganom-taksistku-5231813	Прощался весь город: в челябинском Коркино похоронили убитую цыганом таксистку - TagilCity.ru	В субботу, 26 октября, в городе Коркино похоронили зарезанную цыганскими подростками таксистку. На отпевание и церемонию прощания собрался почти весь город. Новости Нижнего Тагила и Свердловской области - TagilCity	https://tagilcity.ru/attachments/0d95b500477d66b1512924cfa42ffcfd78f844a6/store/crop/0/120/1280/720/1920/0/0/4dfe31adfe12e9037af08ae4fef54b2abec64bb8da7b23aa78ce547f2223/1729930568533.webp	2024-10-26 08:35:30	TagilCity.ru
ru	https://news.google.com/rss/articles/CCAiC2lBcDV0M2NGVGdjmAEB?oc=5	Армия Кима вляпалась. В строй вернули Т-34: армия РФ дошла до ручки! Путина надули в Казани /НАКИ - УНІАН	None	None	2024-10-27 06:30:15	УНІАН
ru	https://www.rbc.ua/ukr/news/dobu-rf-vtratila-ponad-1400-soldativ-i-100-1730008468.html	За сутки РФ потеряла более 1400 солдат и 100 единиц автомобильной техники, - Генштаб - РБК-Украина	Подробнее читайте на сайте	https://www.rbc.ua/static/img/_/v/_vii__skovi_foto__vitalii___nosach_rbk_ukrai__na_8737_28166d8175c415735f59a24c03e11f98_1300x820.jpg	2024-10-27 05:57:00	РБК-Украина
ru	https://www.interfax.ru/world/988834	Израиль нанес удар по зданию школы в городе Газа - Интерфакс	Израильские ВВС нанесли удар по зданию школы в городе Газа, мотивировав его тем, что, по данным разведки, там располагался командный пункт движения ХАМАС, сообщила пресс-служба Армии обороны Израиля (ЦАХАЛ).	https://www.interfax.ru/aspimg/988834.png	2024-10-27 00:10:00	Интерфакс
ru	https://sportmail.ru/article/betting/63386881/	Битва претендентов на титул: анонс матча «Зенит» — «Локомотив» - Спорт Mail.ru	Семак проверит амбиции «железнодорожников».	https://resizer.mail.ru/p/f658845e-535c-5379-9f14-7c5c2478ebd2/op:15/logo:bottom:sport.png/AQAGwxWBC4AOsV06uwBjJUL1Too9fHQTZTxXVzAjZizQfwoIqkkl25RJmu50cXzPrFfCEUydCa3J81x0KBOCN5qnX4U.jpg	2024-10-27 08:31:09	Спорт Mail.ru
ru	https://www.rbc.ua/ukr/news/noviy-rekord-zelenskiy-rozpoviv-skilki-aviaudariv-1730026243.html	Новый "рекорд". Зеленский рассказал, сколько авиаударов нанесла РФ по Украине за 7 дней - РБК-Украина	Подробнее читайте на сайте	https://www.rbc.ua/static/img/_/g/_gettyimages_2177157514_24cbcfc8ea4235203b7f943ca002a5b4_1300x820.jpg	2024-10-27 10:59:43	РБК-Украина
ru	https://fighttime.ru/news/item/36179-maks-khollovej-sdelal-zayavlenie-posle-porazheniya-ot-ilii-topurii.html	Макс Холловэй сделал заявление после поражения от Илии Топурии - FightTime	None	None	2024-10-27 03:49:43	FightTime
ru	https://ura.news/news/1052835504	Освобождение Селидова сделало положение ВСУ в ДНР критичным: карта СВО на 27 октября - URA.RU	Читайте на URA.RU	https://s.ura.news/images/news/figures/191/338/a4836c94-3293-49bd-a445-c2f5ae5963f2/sut0lb/L-1200.1.9.jpg	2024-10-27 06:55:00	URA.RU
ru	https://sport24.ru/figureskating/live-695648-1tvru-figurnoye-kataniye-proizvolnaya-programma-gran-pri-rossii-v-magnitogorske-smotret-onlayn-pryamaya-translyatsiya-gran-pri-rossii-po-figurnomu-kataniyu-raspisaniye-zhenshchiny-muzhchiny-frolova-kondratyuk-semenenko	Русские фигуристы сражаются за первые медали сезона. Чемпионы России близки к фиаско. Гран-при Live - Sport24.ru - новости спорта онлайн в России и мире	1тв.ру фигурное катание произвольная программа Гран при России в Магнитогорске смотреть онлайн, прямая трансляция, Гран при России по фигурному катанию расписание женщины, мужчины, Фролова, Кондратюк, Семененко - онлайн, трансляция, live - Sport24	https://cdn-m.sport24.ru/m/c5f4/3092/7d3a/43ee/a3df/6f61/1237/b178/1200_10000_max.jpeg	2024-10-27 10:35:00	Sport24.ru - новости спорта онлайн в России и мире
ru	https://www.f1news.ru/interview/sainz-junior/177933.shtml	Карлос Сайнс: Мне нечего терять! - Формула 1 на F1News.Ru	С девятой попытки Карлос Сайнс завоевал поул в Мехико и очень доволен результатом…	https://cdn.f1ne.ws/userfiles/sainz-junior/177933.jpg	2024-10-27 15:05:00	Формула 1 на F1News.Ru
ru	https://news.google.com/rss/articles/CBMingFBVV95cUxOenhQc2JiaTFkV0pobFNWY3J2bVlyc09xQ1habkpLWHNndlhRdnktTjNzVGg3VVVmd2dtNkljVjNaUlZRd3laUnJTQWwwT1BYV1V3LVBSQW8tN3RsZEhsRDRidDVqLWRzX2ZfY0VLNHRsSlRQME1xcl9ZbjBrakxRaHRMaF9IUEhjMkN0Vlg2c3ZuR2NDX09iM3ExXzlzZw?oc=5	Досрочно закончился поединок Хамзата Чимаева с топовым бойцом UFC - Sports.kz	None	None	2024-10-26 20:12:56	Sports.kz
ru	https://meduza.io/news/2024/10/27/v-prigorode-tel-aviva-gruzovik-v-ehal-v-avtobusnuyu-ostanovku-postradali-desyatki-chelovek	В Тель-Авиве грузовик въехал в автобусную остановку. Пострадали десятки человек, один погиб - Meduza	В Тель-Авиве грузовик въехал в автобусную остановку, на которой стояли люди, сообщает The Times of Israel.	https://meduza.io/imgly/share/1730043904/news/2024/10/27/v-prigorode-tel-aviva-gruzovik-v-ehal-v-avtobusnuyu-ostanovku-postradali-desyatki-chelovek	2024-10-27 08:54:00	Meduza
ru	https://www.bfm.ru/news/560819	Женщина погибла при падении на пути на «зеленой» ветке метро в Москве - BFM.RU	None	None	2024-10-27 12:22:12	BFM.RU
ru	https://primamedia.ru/news/1879749/	ЦБ поднял ключевую ставку до исторического рекорда – к чему готовиться россиянам - PrimaMedia	None	None	2024-10-26 09:13:25	PrimaMedia
ru	https://football24.ru/online/232049-pari-nizhnij-novgorod-spartak-smotret-onlajn-prjamaja-transljacija-27-oktjabrja-2024.html	Пари Нижний Новгород - Спартак: смотреть онлайн, прямая трансляция 27 октября 2024 - Футбол 24	Смотреть онлайн «Пари Нижний Новгород» - «Спартак М» на «Футбол 24». Прямой эфир пройдёт на телеканале «Матч Премьер», трансляция матча начнется 27 октября 2024, в 14:15 (МСК). Состав, статистика, результат (счёт) матча. &lt;iframe	None	2024-10-27 10:14:57	Футбол 24
ru	https://www.rbc.ua/ukr/news/ermak-nazvav-umovu-pochatku-peregovoriv-rosieyu-1730040954.html	У Зеленского назвали условие для начала переговоров с Россией - РБК-Украина	Подробнее читайте на сайте	https://www.rbc.ua/static/img/_/e/_ermak_foto___vitalii___nosach_rbk_ukrai__na_53_f23c480c1c76ac083ec7a6603a660827_1300x820.jpg	2024-10-27 15:16:18	РБК-Украина
ru	https://www.eurointegration.com.ua/rus/news/2024/10/27/7197140/	Генсек НАТО выступит с заявлением о войсках КНДР в России - Европейская правда	None	None	2024-10-27 16:59:16	Европейская правда
ru	https://www.fontanka.ru/2024/10/27/74263169/	«Противнику нанесли огневое поражение». В Брянской области вооруженные люди попытались пересечь границу - Фонтанка.Ру	None	None	2024-10-27 15:51:00	Фонтанка.Ру
ru	https://pogoda.mail.ru/news/63386184/	В Москве с 30 октября возможен мокрый снег - Погода Mail.ru	Мокрый снег, небольшие дожди прогнозируются в Москве со среды, однако снежный покров в результате этого сформирован не будет. Об этом рассказал ТАСС научный руководитель Гидрометцентра России Роман Вильфанд.	https://resizer.mail.ru/p/322dcf53-8e5b-58dd-817e-648bcf85ea85/op:15/logo:bottom:weather.png/AQAGCDGlh-ohooUDBqSWdUlivV_48xh9-_DzRSjBlfUeIwJ0cmB66WQp1WI5v3sr2pnlWt-dMRC9gOguds0Ow8gnwMw.jpg	2024-10-27 07:17:39	Погода Mail.ru
ru	https://www.fontanka.ru/2024/10/27/74263208/	За 10 лет ни одной аварии. Что известно о водителе автобуса, устроившего массовое ДТП на Восстания - Фонтанка.Ру	None	None	2024-10-27 16:57:00	Фонтанка.Ру
ru	https://theins.ru/politika/275574	Извращенные силы России: как российские военные убивают мирных украинцев, россиян и друг друга - The Insider	Российские военные в начале октября расстреляли сразу девять сдавшихся в плен украинцев в Курской области. Это лишь один из множества примеров захлестнувшей ВС РФ эпидемии убийств, не связанных с ведением непосредственно боевых действий. Жертвами становятся как украинские военные, так и гражданское население и даже сослуживцы. Впервые информация о массовых убийствах, совершаемых российскими военными, появилась еще весной 2022 года — тогда жертвами стали мирные жители Киевской, Черниговской и Сумской областей. Однако новая волна может оказаться еще масштабнее. Тяжкие преступления совершаются участниками «СВО» и «на гражданке» в России — в первую очередь речь идет о заключенных из бывшей ЧВК Вагнера и отрядов «Шторм Z», чей срок службы уже истек. The Insider изучил известные случаи и обратился к специалистам, которые объяснили, почему российские военные убивают мирных жителей все чаще. 	https://theins.ru/storage/post/275574/screen20241026-1-11ehxtg.png?1730052319	2024-10-26 10:20:04	The Insider
ru	https://www.unian.net/world/alyans-rossii-kndr-irana-i-kitaya-priblizhaet-koshmarnyy-scenariy-wp-12801120.html	Альянс России, КНДР, Ирана и Китая приближает кошмарный сценарий, - WP - УНИАН	Давно прошли те времена, когда Россия, Китай, Иран и Северная Корея представляли собой изолированные, разрозненные угрозы интересам Запада.	https://images.unian.net/photos/2024_10/thumb_files/620_324_1730042511-2163.jpg?1	2024-10-27 15:35:00	УНИАН
ru	https://www.dw.com/ru/v-g7-resili-kak-obespecit-kievu-kredit-s-ispolzovaniem-dohodov-ot-aktivov-rf/a-70605612	В G7 решили, как обеспечить Киеву кредит с активов РФ - DW НА РУССКОМ	Украина может уже до конца года получить часть кредита на 50 млрд долларов, обеспеченного доходами от активов РФ.	https://static.dw.com/image/70544280_6.jpg	2024-10-26 02:07:06	DW НА РУССКОМ
ru	https://www.interfax.ru/world/988889	Нетаньяху заявил, что удары по Ирану достигли поставленных целей - Интерфакс	Глава израильского правительства Биньямин Нетаньяху заявил в воскресенье, что удары Армии обороны Израиля (ЦАХАЛ) по Ирану достигли целей.	https://www.interfax.ru/aspimg/988889.png	2024-10-27 15:23:00	Интерфакс
ru	https://www.rbc.ua/ukr/news/rosiyski-viyska-atakuvali-ukrayinu-80-dronami-1730016141.html	Российские войска атаковали Украину 80 дронами с трех направлений. Сколько сбила ПВО - РБК-Украина	Подробнее читайте на сайте	https://www.rbc.ua/static/img/d/s/dscf5265_1_ee628dd828c0552694f71f8e49e9ebb3_1300x820.jpg	2024-10-27 08:02:21	РБК-Украина
ru	https://news.google.com/rss/articles/CBMiR0FVX3lxTE1JNlc0R1UxOHBIZ2l4am55VExpYUNiXzJETmhfbFpvUVRMaXBRbEIyZlhuVEZEQ1ZnWFgwR0o1U0trcnRzOHFV0gFMQVVfeXFMTmRfejQ5cmdBQ0ZTTG0zc1FIZFNUZjEwQ2JZelNNaXVaSi1EX2l2RVBxNTh4UDZrMmFOZDJ4eG1vOTZCbUd2dEtmd2hJZA?oc=5	ПВО сбили 51 беспилотник ВСУ над Россией - URA.RU	Читайте на URA.RU	https://s.ura.news/images/news/figures/40/92/aff3afcd-89a7-450e-9f82-77dbe69854ea/nuhjjn/L-1200.1.9.jpg	2024-10-27 05:17:00	URA.RU
ru	https://nv.ua/world/countries/udary-vglub-rossii-putin-ozvuchil-novye-ugrozy-zapadu-50461717.html	Разрешение на удары вглубь РФ. Путин озвучил новые угрозы Западу - NV	Российский диктатор Владимир Путин заявил, что Министерство обороны страны-агрессора предложит «различные варианты ответов» в случае, если Украина получит от союзников разрешение на удары западным оружием вглубь РФ. 	https://static.nv.ua/shared/system/Article/posters/002/976/896/original/aeb0a6302124fe1a008e795970d863e4.jpg?q=85&stamp=20241027162604	2024-10-27 14:34:00	NV
ru	https://news.ru/russia/situaciya-v-kurskoj-oblasti-vecherom-27-oktyabrya-razbrosannye-tela-poteri/	Ситуация в Курской области вечером 27 октября: разбросанные тела, потери - NEWS.ru	Расчеты ЗРПК «Панцирь-С» круглосуточно контролируют воздушное пространство в Курской области. Какие еще новости о ситуации в регионе известны вечером 27 октября?	https://static.news.ru/photo/c2791446-9475-11ef-ab3f-02420a0000c9_760.jpg	2024-10-27 16:13:47	NEWS.ru
ru	https://ura.news/news/1052835327	Путин подписал закон, усложняющий иностранцам получение гражданства РФ - URA.RU	Читайте на URA.RU	https://s.ura.news/images/news/upload/smm/2024/10/26/facebook_47f4262260b4b685a62a2fc362d5a7dd.jpg	2024-10-26 13:13:00	URA.RU
ru	https://www.vedomosti.ru/politics/articles/2024/10/27/1071193-chto-proishodit-kurskoi-oblasti	Что происходит в Курской области на 83-й день боевых действий - Ведомости	Потери ВСУ превысили 27 000 человек, утверждает Минобороны	https://sharing.vedomosti.ru/1730033018/vedomosti.ru/politics/articles/2024/10/27/1071193-chto-proishodit-kurskoi-oblasti.jpg	2024-10-27 12:29:52	Ведомости
ru	https://news.google.com/rss/articles/CBMiU0FVX3lxTE1udjZDY3l0OUxKN2Vwcy1VYThpaEd3OXR5V090ODA3WEJNRW5hdmZkWnBQbUdlSlBwRnZNaEI2eWt6TGR5YUV5S0hsaEhrSmJZU3dv?oc=5	Сергей Собянин: В ТиНАО будут построены две значимые дороги / Новости города / Сайт Москвы - Официальный сайт Мэра Москвы	None	None	2024-10-27 12:23:00	Официальный сайт Мэра Москвы
ru	https://fighttime.ru/news/item/36184-israel-adesanya-otvetil-na-vyzov-shary-bulleta.html	Исраэль Адесанья ответил на вызов Шары Буллета - FightTime	Бывший чемпион UFC в среднем весе, Исраэль Адесанья, ответил непобежденному российскому средневесу Шарабутдину Магомедову, который бросил ему вызов после того, как на турнире UFC 308 в Абу-Даби записал на свой счет четвертую победу в сильнейшей лиге мира.	https://fighttime.ru/media/k2/items/cache/8a87a9c3b273e92b063a7b94c715a85c_M.jpg	2024-10-27 10:51:02	FightTime
ru	https://ura.news/news/1052835336	В России сохранят размер денежного довольствия для части пенсий - URA.RU	Читайте на URA.RU	https://s.ura.news/images/news/upload/smm/2024/10/26/facebook_44c3d2a37bb043052246253a2b2c3502.jpg	2024-10-26 14:14:00	URA.RU
ru	https://72.ru/text/job/2024/10/27/74262233/	«А у людей спросить забыли?»: тюменцы возмутились шестидневной рабочей неделей - Новости Тюмени – 72.ru	Люди раскритиковали решение депутатов об удлинении недели в конце октября	https://72.ru/html-to-img/image?hash=Lsms6ws3Lji6YztjlbA5_w&ts=1730016416&url=https%3A%2F%2F72.ru%2Fog-image%2Farticle-id5919411%2F&width=1200	2024-10-27 08:02:00	Новости Тюмени – 72.ru
ru	https://news.google.com/rss/articles/CBMitAFBVV95cUxPalhEODlvM2ZRZFBoV05MMGpUeHZvZFZFOXJqRllJa01qQ2tTMzZROVBVUF9qT0NPOHVNcUtraFFLclljM25yZDlLX0xURG5ncElkR3ZUU2lSOWhZYjZzcGs4dWlBelE0Y3k1ZW5hVm1GWFB4X2c3WTlHVGpoSmxnLUNyY1ZKXzZNMGhIM1RsYTJOeTYybFpNVWtVZ1UzMDJiTjhaaU9KZHNyNGtwSFNvcGc2OFnSAboBQVVfeXFMUGc3QUJBTmlITU1scjZ1TmdLRHRtcGNxZnVEUWpnY2lia2tZTXFJYVl1SnRjb1hQQlV5b3RlLUdQRUZqaUU5R1NkRTBrb2FkbDdOU3I5cXl5ZFF1NFBibjNKajdlb1M3LVlFU3RDWnZhSnhkVXc5anVmM2h5TDJYX1o4OVJrYkpzSFBuSkF4bG1rUnc2dTNDdUhVT0pubTdINi1ZWkhQRU1Xdkh6YUJSYldaNU9teExOdUJB?oc=5	Президент Грузии Саломе Зурабишвили отказалась признать итоги выборов в парламент - Meduza	Президент Грузии Саломе Зурабишвили на специальной пресс-конференции заявила, что не признает официальные результаты парламентских выборов. 	https://meduza.io/imgly/share/1730049881/news/2024/10/27/prezident-gruzii-salome-zurabishvili-otkazalas-priznat-itogi-vyborov-v-parlament	2024-10-27 17:24:00	Meduza
ru	https://www.fontanka.ru/2024/10/27/74263202/	На борту аварийного Ан-2 на Ставрополье находились 8 взрослых и ребенок - Фонтанка.Ру	None	None	2024-10-27 16:35:00	Фонтанка.Ру
ru	https://news.ru/regions/zhenshina-poluchila-raneniya-pri-atake-vsu-pod-belgorodom/	Женщина получила ранения при атаке ВСУ под Белгородом - NEWS.ru	Жительница села Варваровка Белгородской области получила травмы в результате атаки ВСУ, сообщил губернатор Вячеслав Гладков. Она была доставлена в областную клиническую больницу.	https://static.news.ru/photo/9aa3febc-940d-11ef-92d1-02420a0000c9_760.jpg	2024-10-27 02:44:52	NEWS.ru
ru	https://ura.news/news/1052835510	Семьи погибших при крушении вертолета в Кировской области получат по миллиону - URA.RU	Читайте на URA.RU	https://s.ura.news/images/news/figures/204/340/b8ffa2f8-f8d9-4ecd-aa2d-4f0b3fcdad54/ttgghy/L-1200.1.9.jpg	2024-10-27 07:14:00	URA.RU
ru	https://news.google.com/rss/articles/CBMiR0FVX3lxTE05bkROUmx5X2xDdEJJMVFOTHN3aDNfZjBvX0tpQTVKdE1Ub1BWcmJqajFmUUtGTGpFU1gwMmFTOHVoR19PVEFB?oc=5	Объявлен отбой красного и желтого уровней опасности - Gorod48	None	None	2024-10-27 15:45:00	Gorod48
ru	https://www.interfax.ru/russia/988900	С подконтрольной Киеву территории Донбасса эвакуировали американца, передававшего сведения о ВСУ - Интерфакс	Гражданин США, который предоставлял разведданные российским военным, эвакуирован с подконтрольной Киеву территории в Донбассе, сообщает штаб обороны Донецкой народной республики.	https://www.interfax.ru/aspimg/988900.png	2024-10-27 17:05:00	Интерфакс
ru	https://www.vedomosti.ru/society/news/2024/10/27/1071167-poryadke-vziskaniya-alimentov	Путин подписал закон о порядке взыскания алиментов после отмены приказа суда - Ведомости	Президент России Владимир Путин подписал закон, меняющий порядок взыскания алиментов после отмены приказа суда.	https://sharing.vedomosti.ru/1730016368/vedomosti.ru/society/news/2024/10/27/1071167-poryadke-vziskaniya-alimentov.jpg	2024-10-27 05:25:23	Ведомости
ru	https://ura.news/news/1052835554	Генсек ООН восхитился Казанским Кремлем - URA.RU	Читайте на URA.RU	https://s.ura.news/images/news/figures/313/633/83078a16-7c49-4cb3-b71f-064bf4f14b09/ngidap/L-1200.1.9.jpg	2024-10-27 10:45:00	URA.RU
ru	https://rtvi.com/news/zaderzhany-uzhe-pyatero-iz-shesti-sbezhavshih-iz-lipeczkoj-ik-2-zaklyuchennyh/	Задержаны уже пятеро из шести сбежавших из липецкой ИК-2 заключенных - RTVI	Задержаны уже пятеро из шести заключенных, сбежавших из липецкой ИК-2, поиски еще одного продолжаются. В УФСИН Липецкой области отмечали, что все сбежавшие — выходцы из Средней Азии. 	https://rtvi.com/wp-content/uploads/2024/10/397346-1.jpg?235013	2024-10-26 16:41:22	RTVI
ru	https://www.fontanka.ru/2024/10/27/74263277/	КХЛ оштрафовала «Спартак» и обвинила Ротенберга в дискредитации. А почему они на самом деле поругались - Фонтанка.Ру	None	None	2024-10-27 18:33:57	Фонтанка.Ру
ru	https://news.google.com/rss/articles/CBMiV0FVX3lxTE02SXVlUkpJMzVVX2w1NEZKN1VKcmxGN2w5QTM2ZnhjX1gzVU9MY1FlVEJWZE1uT1FKWld3VE1qcTdJWHZFS085Rmd3MHdBTnpia1pZQ0lyNA?oc=5	Как вырастут пенсии в 2025 году, какой должна быть справедливая индексация. Социальные новости недели - Банки.ру — финансовый маркетплейс	🔷 Рассказано,&nbsp;у кого и на сколько вырастут пенсии в 2025 году.	http://static4.banki.ru/ugc/fc/5e/a6/imageEigmPHfjoBeFFKNLaBNjaggG.jpg	2024-10-26 13:00:00	Банки.ру — финансовый маркетплейс
