country_code	url	title	description	image_url	publish_date	source
ru	https://72.ru/text/entertainment/2024/10/20/74231885/	Красивые открытки на День отца: 10 поздравлений в картинках любимым папам - Новости Тюмени – 72.ru	Делитесь ими с самыми дорогими мужчинами	https://72.ru/html-to-img/image?hash=XaNGGQ7DCwa2EzzGiDVPAQ&ts=1729322579&url=https%3A%2F%2F72.ru%2Fog-image%2Farticle-id5908130%2F&width=1200	2024-10-19 19:00:00	Новости Тюмени – 72.ru
ru	https://ura.news/news/1052832091	Asharq Al Awsat: ХАМАС пытается скрыть имя своего нового лидера - URA.RU	Читайте на URA.RU	https://s.ura.news/images/news/figures/332/514/c4b44dfb-ebb6-448c-9c4e-4bb89e4fd29c/dnxypw/L-1200.1.9.jpg	2024-10-20 12:50:00	URA.RU
ru	https://meduza.io/news/2024/10/20/ilon-mask-poobeschal-razygryvat-kazhdyy-den-do-vyborov-po-millionu-dollarov-za-podpis-pod-ego-petitsiey	Илон Маск пообещал разыгрывать каждый день до выборов по миллиону долларов за подпись под его петицией - Meduza	Миллиардер Илон Маск пообещал разыгрывать по одному миллиону долларов каждый день до президентских выборов среди избирателей в Пенсильвании, которые подпишут его петицию в защиту первой и второй поправок к Конституции США. Об этом он заявил на предвыборном мероприятии в штате Пенсильвания в поддержку республиканца Дональда Трампа, сообщает The Hill. 	https://meduza.io/imgly/share/1729423610/news/2024/10/20/ilon-mask-poobeschal-razygryvat-kazhdyy-den-do-vyborov-po-millionu-dollarov-za-podpis-pod-ego-petitsiey	2024-10-20 11:06:00	Meduza
ru	https://www.interfax.ru/world/987666	Лекорню заявил, что Франция не против вступления Украины в НАТО - Интерфакс	Вопрос вступления Украины в НАТО, включенный президентом Владимиром Зеленским в его "мирный план", зависит от будущей администрации США, при этом Франция не против таких устремлений Киева, заявил французский министр вооруженных сил Себастьян Лекорню.	https://www.interfax.ru/aspimg/987666.jpg	2024-10-20 15:26:00	Интерфакс
ru	https://rtvi.com/news/vuchich-soobshhil-chto-poobshhalsya-s-putinym-vpervye-za-25-goda-o-chem-oni-govorili/	Вучич сообщил, что пообщался с Путиным впервые за 2,5 года: о чем они говорили - RTVI	Президенты России и Сербии Владимир Путин и Александр Вучич пообщались впервые за почти 2,5 года, сообщил сербский лидер в видеообращении, опубликованном в социальных сетях. По его словам, состоявшийся телефонный разговор был посвящен 80-летию освобождения Белграда и дополнительным поставкам газа.	https://rtvi.com/wp-content/uploads/2024/10/395134-1.jpg?155843	2024-10-20 12:58:43	RTVI
ru	https://www.interfax.ru/world/987682	Израильские военные снесли смотровую башню ЮНИФИЛ в Ливане - Интерфакс	Бульдозер Армии обороны Израиля (ЦАХАЛ) снес смотровую башню и ограду по периметру объекта Временных сил ООН в Ливане (ЮНИФИЛ), сообщили в ЮНИФИЛ в воскресенье.	https://www.interfax.ru/aspimg/987682.png	2024-10-20 20:01:00	Интерфакс
ru	https://www.bfm.ru/news/560377	В дни саммита БРИКС в Казани вводится ряд ограничений - BFM.RU	None	None	2024-10-20 13:48:30	BFM.RU
ru	https://www.vedomosti.ru/business/articles/2024/10/21/1069846-aeroporti-predlagayut-razreshit-passazhiram-samostoyatelno-sdavat-bagazh	Аэропорты предлагают разрешить пассажирам самостоятельно сдавать багаж - Ведомости	Это упростит процесс оформления перевозочных документов для тех, кто регистрируется онлайн	https://sharing.vedomosti.ru/1729459214/vedomosti.ru/business/articles/2024/10/21/1069846-aeroporti-predlagayut-razreshit-passazhiram-samostoyatelno-sdavat-bagazh.jpg	2024-10-20 21:20:13	Ведомости
ru	https://news.google.com/rss/articles/CCAiC1E4NU9NNUhYOXE0mAEB?oc=5	Экстренно из-под Курска! Путинцы УНИЧТОЖИЛИ село. Армия РФ утюжит свои города. На болотах пекло - УНІАН	None	None	2024-10-20 16:00:21	УНІАН
ru	https://www.svoboda.org/a/rossiyskie-voyska-obstrelyali-krivoy-rog-raneny-17-chelovek/33165342.html	Российские войска обстреляли Кривой Рог, ранены 17 человек - Радио Свобода 	None	None	2024-10-20 05:48:22	Радио Свобода 
ru	https://pogoda.mail.ru/news/63294405/	До 14 градусов тепла ожидается в Москве 21 октября - Погода Mail.ru	Переменная облачность без осадков и до 14 градусов тепла ожидается в Москве и Подмосковье в понедельник, 21 октября. Об этом информирует Гидрометцентр России.	https://resizer.mail.ru/p/b911c96a-3050-5e82-8e6b-d4322c835fac/op:15/logo:bottom:weather.png/AQAGyiqmQrspVPMGp9CYHq0cwSgYcvY0n6RyDhDvv9zyVfGbwIMDKdQY2PU2JhhZG1rsPI1hN6jx-_Tu2mmFIJLvjuM.jpg	2024-10-21 04:10:52	Погода Mail.ru
ru	https://www.fontanka.ru/2024/10/21/74234744/	Ночные атаки: больше всего БПЛА сбито в Ростовской области, под Белгородом есть раненый - Фонтанка.Ру	None	None	2024-10-21 04:12:00	Фонтанка.Ру
ru	https://news.ru/near-east/v-izraile-soobshili-o-desyatkah-unichtozhennyh-bojcov-hezbolly-na-yuge-livana/	В Израиле сообщили о десятках уничтоженных бойцов «Хезболлы» на юге Ливана - NEWS.ru	Израильские военные нанесли серию ударов по целям на юге Ливана, в результате которых были уничтожены более 65 бойцов организации «Хезболла», а также различные объекты инфраструктуры движения.	https://static.news.ru/photo/93e9c180-8ea7-11ef-bfc1-02420a0000c9_760.jpg	2024-10-20 05:20:25	NEWS.ru
ru	https://bcs-express.ru/novosti-i-analitika/prognozy-i-kommentarii-piatnitsa-ponedel-nika-mudrenee	Прогнозы и комментарии. Пятница понедельника мудренее - БКС Экспресс	Индекс МосБиржи вяло сползает в боковике. Все решится в эту пятницу — ЦБ объявит новую ставку, а пока затишье	https://cdn.bcs-express.ru/article-head/17112.jpg	2024-10-21 04:27:24	БКС Экспресс
ru	https://www.forbes.ru/finansy/523461-bloomberg-predupredil-o-fiskal-noj-bombe-na-100-trln	Bloomberg предупредил о фискальной бомбе на $100 трлн - Forbes Russia	По прогнозам МВФ, уровень государственного долга в мире в этом году достигнет $100 трлн, прежде всего, за счет его увеличения в Китае и США, пишет Bloomberg. В 2024 году уровень долговой нагрузки в странах G7 в среднем составил 125,9%, подсчитало аге	https://cdn.forbes.ru/forbes-static/shareimages/523461.jpg?v=1729430035	2024-10-20 13:10:09	Forbes Russia
ru	https://www.pravda.com.ua/rus/news/2024/10/21/7480627/	КНДР против Украины: Южная Корея вызвала на ковер посла России - Украинская правда	Министерство иностранных дел Южной Кореи вызвало посла России в Сеуле Георгия Зиновьева в знак протеста против отправки северокорейских войск в страну для развертывания в Украине.	None	2024-10-21 06:44:23	Украинская правда
ru	https://news.google.com/rss/articles/CCAiC3lSUUptdFJVMjc0mAEB?oc=5	Лютые ВЗРЫВЫ по всей РФ. Кадыров напугал Кремль. Сырский на границе: Курск, берегись! Новости 24/7 - УНІАН	None	None	2024-10-20 19:00:28	УНІАН
ru	https://www.objectiv.tv/objectively/2024/10/20/rf-udarila-gibridom-aviabomby-i-rakety-harkov-posle-nochnogo-obstrela-video/	РФ ударила гибридом авиабомбы и ракеты: Харьков после ночного обстрела (видео) - МГ "Объектив"	По данным Харьковской областной прокуратуры, РФ обстреляла Харьков в 23:50. "Прилетело" в Новобаварском районе.	https://www.objectiv.tv/wp-content/uploads/2024/10/Znimok-ekrana-2024-10-20-o-07.40.09.png	2024-10-20 04:40:00	МГ "Объектив"
ru	https://www.interfax.ru/russia/987664	Спасательные работы завершены на месте взрыва газа в жилом доме в Кирсанове - Интерфакс	Спасатели завершили работы на месте обрушения части жилого дома после взрыва бытового газа с последующим пожаром в Кирсанове Тамбовской области, сообщило в воскресенье МЧС РФ.	https://www.interfax.ru/aspimg/987664.png	2024-10-20 14:43:00	Интерфакс
ru	https://pg21.ru/news/101309	Аэропорт соседнего Чувашии региона временно ограничил полеты ради безопасности - Pro Город Чебоксары	В аэропорту Казани ввели временные ограничения на работу. Это необходимо для обеспечения безопасности полетов, как сообщает Росавиация.	/userfiles/picfullsize/image-1729405722_1172.jpg	2024-10-20 06:33:42	Pro Город Чебоксары
ru	https://news.pn/ru/RussiaInvadedUkraine/316622	ВОЙНА РОССИИ ПРОТИВ УКРАИНЫ: На Сумщине в результате вражеского артобстрела погиб мужчина - Преступности.Нет	None	None	2024-10-20 05:08:00	Преступности.Нет
ru	https://ura.news/news/1052831968	BR: Зеленский был вынужден представлять «план победы» под давлением Запада - URA.RU	Читайте на URA.RU	https://s.ura.news/images/news/figures/384/414/680ac2bc-9cbb-4dfa-bf9e-92cda51a4966/qwlwun/L-1200.1.9.jpg	2024-10-20 01:17:00	URA.RU
ru	https://bloknot-krasnodar.ru/news/v-krasnodare-vystavili-trofeynuyu-tekhniku-nato-i--1785451	В Краснодаре выставили трофейную технику НАТО и ВСУ из зоны СВО: фоторепортаж - Блокнот Краснодар	None	None	2024-10-20 08:05:22	Блокнот Краснодар
ru	https://myslo.ru/news/tula/2024-10-20-v-kremle-nagradili-mnogodetnuyu-sem-yu-dolgopolovyh-iz-tul-skoj-oblasti	В Кремле наградили многодетную семью Долгополовых из Тульской области - Моя Слобода	18 октября в Кремлевском Дворце подвели итоги Всероссийского конкурса «Семья года».	https://cdn.myslo.ru/Content/ImageGenerator/86/bc/86bc7571-c60c-4554-ba9f-7fcddffb0fdd.png	2024-10-20 14:06:00	Моя Слобода
ru	https://www.svoboda.org/a/v-moldove-na-vyborah-prezidenta-lidiruet-mayya-sandu/33165714.html	В Молдове на выборах президента во второй тур вышли Санду и Стояногло - Радио Свобода 	Голоса на референдуме о евроинтеграции разделились пополам	https://gdb.rferl.org/85BD866D-4009-4F6D-83BA-107700040719.jpg	2024-10-21 05:45:53	Радио Свобода 
ru	https://news.google.com/rss/articles/CCAiC3ZGSS1KdzRMazJVmAEB?oc=5	Решение НАТО поразило всех! РФ послали с ее хотелками Украину уже ждут мощное пополнение Альянса - УНІАН	None	None	2024-10-21 05:00:37	УНІАН
ru	https://rtvi.com/news/tramp-zayavil-chto-ugrozhal-putinu-udarom-po-moskve/	Трамп заявил, что угрожал Путину ударом по Москве - RTVI	Трамп отметил, что «отлично ладил» с Путиным, несмотря на то, что он «другой человек».	https://rtvi.com/wp-content/uploads/2024/10/395215-1.jpg?074849	2024-10-21 04:17:45	RTVI
ru	https://www.rbc.ua/ukr/news/vtrati-rf-ukrayini-perevishchili-680-tisyach-1729487623.html	Потери РФ в Украине превысили 680 тысяч военных, - Генштаб - РБК-Украина	Подробнее читайте на сайте	https://www.rbc.ua/static/img/_/v/_viyskovi_herson_gettyimages_1242009732_bf9147411314f50c3f45be56ae07fad8_1300x820.jpg	2024-10-21 05:18:43	РБК-Украина
ru	https://ura.news/	Юлия Навальная* намерена стать президентом России - URA.RU	Читайте на URA.RU	https://s.ura.news/img/fbimage.jpg	2024-10-21 05:08:00	URA.RU
ru	https://news.google.com/rss/articles/CCAiCzZ4bE5od1NCczdNmAEB?oc=5	Сырский на фронте: Россия отгребает! Войска КНДР обречены. Путин петляет от ареста. Важное за 20.10 - УНІАН	None	None	2024-10-20 15:00:05	УНІАН
ru	https://meduza.io/feature/2024/10/20/vsya-strana-v-temnote-na-kube-sluchilsya-masshtabnyy-blekaut-kotoryy-ostavil-bez-elektrichestva-tselyy-ostrov-vot-kak-eto-vyglyadelo	Вся страна — в темноте: на Кубе случился масштабный блэкаут, который оставил без электричества целый остров. Вот как это выглядело - Meduza	18 октября на Кубе произошло полное отключение электроэнергии после аварии на крупнейшей теплоэлектростанции. Без электричества остались около 10 миллионов человек. Подача электроэнергии была частично восстановлена в субботу 19 октября, но снова прекратилась в ночь на воскресенье, пишет BBC News. Ситуацию усугубляет приближение урагана «Оскар». По прогнозам, ураган, скорость ветра при котором может достигать 140 км/ч, доберется до Кубы днем 20 октября. Он может привести к наводнениями и оползням в восточных районах страны. Президент Кубы Мигель Диас-Канель заявил, что власти «упорно работают над защитой людей и экономических ресурсов, учитывая неизбежное приближение урагана». Отключение электричества, как отмечала газета Diario de Cuba, обострило энергетический кризис — в последние две недели на Кубе постоянно отключали электричество на несколько часов в день. Премьер-министр Мануэль Марреро Крус в телеобращении заявил, что в сбоях виновата изношенная инфраструктура, нехватка топлива и растущий спрос на энергию. Как выглядит масштабный блэкаут на Кубе — в фотогалерее «Медузы».	https://meduza.io/imgly/share/1729446890/feature/2024/10/20/vsya-strana-v-temnote-na-kube-sluchilsya-masshtabnyy-blekaut-kotoryy-ostavil-bez-elektrichestva-tselyy-ostrov-vot-kak-eto-vyglyadelo	2024-10-20 13:40:00	Meduza
ru	https://www.interfax.ru/russia/987621	Кабмин направит более 6 млрд руб. на сохранение льготной ипотеки в сельской местности - Интерфакс	Более 6,8 млрд рублей будет направлено на сохранение программы льготной ипотеки в сельской местности, а также программы льготных кредитов на благоустройство домов.	https://www.interfax.ru/aspimg/987621.jpg	2024-10-20 07:17:00	Интерфакс
ru	https://www.vedomosti.ru/politics/articles/2024/10/21/1069865-gosduma-utochnyaet-poryadok-ogranicheniya-viezda-deputatov	Госдума вводит порядок ограничения выезда из страны депутатов с доступом - Ведомости	Если такой парламентарий не сдаст свой загранпаспорт в аппарат Госдумы, то документ могут аннулировать	https://sharing.vedomosti.ru/1729458837/vedomosti.ru/politics/articles/2024/10/21/1069865-gosduma-utochnyaet-poryadok-ogranicheniya-viezda-deputatov.jpg	2024-10-20 21:13:56	Ведомости
ru	https://news.google.com/rss/articles/CBMioAFBVV95cUxPUjlFeHNodWVicEpNdUFxRmx6bjZ5ZTlXUzE2NUxsaHM2UVJQNTZRMHc3Ym4tWC1TQWlnUk9tSXdNTHRZMWpXMDFvY2VrekNfMnh0Z29aX3c0Q3BJTnRqWFM0S3NBMlctUUJ6bVlNcVpITGp5OWlLZHNZLXNhZDg4S0VBd0c5WUEzM1JScE1zUGN2RUhjREhaREZvZ0xURmpT?oc=5	Банк России может обновить рекорд ключевой ставки уже в октябре - Forbes Russia	None	None	2024-10-20 21:00:00	Forbes Russia
ru	https://meduza.io/news/2024/10/21/glava-pentagona-lloyd-ostin-priehal-v-kiev-s-neob-yavlennym-vizitom	Глава Пентагона Ллойд Остин приехал в Киев с необъявленным визитом - Meduza	В Киев с необъявленным визитом приехал глава Пентагона Ллойд Остин, пишут The Wall Street Journal и CNN.	https://meduza.io/imgly/share/1729494853/news/2024/10/21/glava-pentagona-lloyd-ostin-priehal-v-kiev-s-neob-yavlennym-vizitom	2024-10-21 06:57:00	Meduza
ru	https://www.dialog.ua/war/303514_1729475726	​Несмотря на давление со стороны ВС РФ, у ВСУ есть успехи на Курщине: в ISW озвучили детали - Диалог.UA - Всегда два мнения	На фоне контрнаступления со стороны ВС РФ на Курщине украинские силы также имеют свои успехи на севере от Суджи.	https://www.dialog.ua/images/news/401e6091212d196747707b916bbb1f8d.jpg	2024-10-21 04:20:11	Диалог.UA - Всегда два мнения
ru	https://www.interfax.ru/world/987673	Израиль определился с ответом на ракетные удары Ирана - Интерфакс	Власти Израиля решили, как ответят на ракетный обстрел страны Ираном, осталось только выбрать время, сообщает The Times of Israel со ссылкой на информированные источники.	https://www.interfax.ru/aspimg/987673.png	2024-10-20 17:52:00	Интерфакс
ru	https://www.fontanka.ru/2024/10/20/74234495/	Президент Бразилии упал и ударился головой. На саммит БРИКС он не поедет - Фонтанка.Ру	None	None	2024-10-20 18:07:00	Фонтанка.Ру
ru	https://www.cybersport.ru/tags/other/roskomnadzor-oproverg-slukhi-o-blokirovke-twitch-v-rossii	Роскомнадзор опроверг слухи о блокировке Twitch в России - Cybersport.ru	Роскомнадзор не намерен ограничивать работу стримингового сервиса Twitch на территории России. Об этом представители пресс-службы ведомства сооб...	https://virtus-img.cdnvideo.ru/images/og-jpg/plain/a7/a754b542-3588-4f9a-a788-46add44e50ef.png	2024-10-21 08:08:00	Cybersport.ru
ru	https://www.unian.net/world/dmitriy-golenkov-v-rf-likvidirovali-pilota-prichastnogo-k-udaram-po-tc-v-kremenchuge-i-domu-v-dnepre-12793941.html	Причастен к атакам на дом в Днепре и ТЦ в Кременчуге: в РФ ликвидировали пилота - УНИАН	Труп Голенкова нашли в яблоневом саду села под Брянском.	https://images.unian.net/photos/2024_10/thumb_files/620_324_1729491294-2727.jpg?1	2024-10-21 06:16:00	УНИАН
ru	https://klops.ru/other/2024-10-21/306721-ryba-dorozhaet-s-opta-proizvoditeli-namereny-podnyat-tseny-na-moreprodukty-na-20	Рыба дорожает с опта: производители намерены поднять цены на морепродукты на 20% - КЛОПС - главный новостной сайт Калининграда	Основные причина — тайфун в Азии и засуха в Эквадоре	https://3.assets.klops.ru/media/W1siZiIsIjIwMjQvMTAvMjEvZThmM2MzZjMtZTQzOC00ODA0LWIyNmMtMmFiY2NmNzZhZmEzX2ZpbGUuanBlZyJdLFsicCIsInRodW1iIiwiMTIwMHg2MzArMCs2MSJdLFsicCIsInRodW1iIiwiMTIwMHg2MzAjIl0sWyJwIiwidGV4dCIsItCk0L7RgtC-OiDQkNC70LXQutGB0LDQvdC00YAg0J_QvtC00LPQvtGA0YfRg9C6IC8gwqvQmtC70L7Qv9GBwrsiXSxbInAiLCJlbmNvZGUiLCJqcGciLCItc3RyaXAgLWludGVybGFjZSBQbGFuZSJdXQ/file.jpg?sha=dd6b8e037a895bf1	2024-10-21 05:46:28	КЛОПС - главный новостной сайт Калининграда
ru	https://sportmail.ru/news/football/63294786/	Личка о пенальтистах «Динамо» после 4:0 с «Рубином»: «Думал, мяч заберет Чавес, но его взял Тюка. Потом я удивился, что второй пенальти пошел бить Артур» - Спорт Mail.ru	Тренер бело-голубых высказался после матча Мир РПЛ с «Рубином» (4:0).	https://resizer.mail.ru/p/ef8af009-d3ef-58c0-a2ac-8730478ccae4/op:15/logo:bottom:sport.png/AQAG7f7iPbd0-1BJdGG9JyJNaG_q8G6yz-r8_VFd3wshc0oioWXy-SMvra9m7rwuCzNwma7NfReR9Z7eOs_tJyvxeDM.jpg	2024-10-21 04:43:15	Спорт Mail.ru
ru	https://www.fontanka.ru/2024/10/21/74235245/	Прощай, бабье лето. Сначала в Петербург придёт циклон, а потом и похолодание - Фонтанка.Ру	None	None	2024-10-21 06:39:00	Фонтанка.Ру
ru	https://www.dw.com/ru/vojska-rf-atakovali-zaporoze-raneny-10-celovek/a-70543201	Войска РФ атаковали Запорожье: ранены 10 человек - DW НА РУССКОМ	В результате авиационного удара армии РФ по Запорожью пострадали как минимум 10 человек. Среди них - две девочки 9 и 13 лет, сообщили местные власти. 	https://static.dw.com/image/70470692_6.jpg	2024-10-20 09:44:36	DW НА РУССКОМ
ru	https://ura.news/news/1052832211	В «Ахмате» признали сложную обстановку в Курской области - URA.RU	Читайте на URA.RU	https://s.ura.news/images/news/upload/smm/2024/10/21/facebook_3fce4d54e4c8695fcca61ee38363b85e.jpg	2024-10-21 03:18:00	URA.RU
ru	https://www.interfax.ru/world/987676	Ураган "Оскар" добрался до Багамских островов - Интерфакс	Обрушившийся на Багамские острова ураган "Оскар" двигается в сторону Кубы, сообщает в воскресенье Associated Press.	https://www.interfax.ru/aspimg/987676.png	2024-10-20 18:16:00	Интерфакс
