country_code	url	title	description	image_url	publish_date	source
ru	https://news.google.com/rss/articles/CCAiC1N5eDRONlpRWTVVmAEB?oc=5	СДЕЛКА Трампа с Зеленским и Путиным! Вот что получит РФ. Обвал экономики: санкции, инфляция, нефть - УНІАН	None	None	2024-11-10 19:30:02	УНІАН
ru	https://xn--80ady2a0c.xn--p1ai/49779-mvd.html	Выксунских полицейских наградили к профессиональному празднику - Выкса.РФ	Лучших полицейских Выксы наградили медалями, почётными грамотами и благодарственными письмами ко Дню сотрудника органов внутренних дел. Этот праздник ежегодно отмечают 10 ноября. Коллег поздравили заместители начальника выксунского отдела МВД Сергей Крюков и Марина Голубева и председатель Совета	https://img.xn--80ady2a0c.xn--p1ai/uploads/posts/2024-11/dc5b7d8a64_pre.jpg	2024-11-11 06:57:58	Выкса.РФ
ru	https://1743.ru/news/75114-noch-na-12-noyabrya-dlya-severo-vostoka-orenburjya-stanet-samoy-holodnoy-na-etoy-nedele	Ночь на 12 ноября для северо-востока Оренбуржья станет самой холодной на этой неделе - 1743.ru	Ночь на 12 ноября для северо-востока Оренбуржья станет самой холодной на этой неделе	http://images.1743.ru/images/1743/2024/11_november/image_11112024195700_17313370209941.jpg	2024-11-11 14:26:00	1743.ru
ru	https://gordonua.com/news/military-actions/rossijane-stali-pritselno-atakovat-supermarkety-v-kharkove-bild--1724226.html	Россияне стали прицельно атаковать супермаркеты в Харькове – Bild - ГОРДОН	Вооруженные силы страны-агрессора РФ стали прицельно атаковать супермаркеты в Харькове. Об этом 11 ноября пишет...	https://gordonua.com/img/article/17242/26_big-v1731349565.jpg	2024-11-10 18:22:00	ГОРДОН
ru	https://www.fontanka.ru/2024/11/12/74323466/	Шесть человек погибли в Ростовской области во время пожара - Фонтанка.Ру	None	None	2024-11-12 04:36:00	Фонтанка.Ру
ru	https://atas.info/news/2024-11-11/zhiteley-novosibirska-predupredili-o-morozah-do-45-v-noyabre-pravda-ili-vymysel-5244887	Жителей Новосибирска предупредили о морозах до -45 в ноябре — правда или вымысел - Atas.info	В Новосибирской области пугают аномальными морозами: смотрим, что говорят погодные сервисы. Новости Новосибирска и области - Atas.info	https://atas.info/attachments/33473629b88e92875f0db664f8a6ca095a6e7477/store/crop/0/0/2560/1440/1920/0/0/4fb990a8f1b13d8cc4599db12d3d93cba7783bff518add118888b3aa948f/GN_p2lb_DKE.webp	2024-11-11 03:50:23	Atas.info
ru	https://eadaily.com/ru/news/2024/11/12/posledniy-kurs-rublya-k-dollaru-yuanyu-i-evro-na-12-noyabrya-ot-rossiyskogo-cb-rf	Последний курс рубля к доллару, юаню и евро на 12 ноября от российского ЦБ РФ - EADaily	EADaily, 12 ноября 2024. Согласно официальной информации на сайте Центробанка РФ (ЦБ РФ), сегодня, 12 ноября, курс доллара к рублю увеличился до 97,9550 руб. (+ 0,1215), евро же подешевел — до 104,8522 руб. (- 0,5988).	https://img3.eadaily.com/r650x400/o/aa6/e944b9f096466ccfc423b0f1e51fe.jpeg	2024-11-12 04:00:00	EADaily
ru	https://news.tpu.ru/news/o-profilaktike-sakharnogo-diabeta-rasskazhut-volontery-v-tpu/	О профилактике сахарного диабета расскажут волонтеры в ТПУ - Новости / Служба новостей ТПУ	В Томском политехническом университете в четверг, 14 ноября, пройдет акция, посвященная Всемирному дню борьбы с диабетом.	/upload/iblock/c7a/kb3k74t0lj5n04kogggc866zvur5d6ar.jpg	2024-11-11 10:27:34	Новости / Служба новостей ТПУ
ru	https://ura.news/news/1052841858	AP: Трамп начнет президентский срок с «диктаторских решений» - URA.RU	Читайте на URA.RU	https://s.ura.news/images/news/figures/261/808/1d341ff0-8893-45c7-9579-49cfd6a97cc4/r2rd4j/L-1200.1.9.jpg	2024-11-11 10:48:00	URA.RU
ru	https://ura.news/news/1052841748	Путин напомнил правительству о мерах поддержки многодетных семей - URA.RU	Читайте на URA.RU	https://s.ura.news/images/news/upload/smm/2024/11/11/facebook_83b678694b5a2a82149d29e6f27bb3fe.jpg	2024-11-11 07:52:00	URA.RU
ru	https://www.vedomosti.ru/business/news/2024/11/11/1074315-putin-poruchil	Путин поручил урегулировать цены на уголь на Дальнем Востоке - Ведомости	Президент также предложил повысить надежность генерирующего оборудования в ДФО	https://sharing.vedomosti.ru/1731340768/vedomosti.ru/business/news/2024/11/11/1074315-putin-poruchil.jpg	2024-11-11 15:38:11	Ведомости
ru	https://news.google.com/rss/articles/CCAiC1dVbHY5dFN1WHhRmAEB?oc=5	Срочно из Брянска! Огромный арсенал РФ - в ТРУХУ. У Путина ПРОБЛЕМЫ: бунт русских, рекордные потери - УНІАН	None	None	2024-11-11 08:00:22	УНІАН
ru	https://www.interfax.ru/business/991205	Биткойн обновляет рекорды и приближается к $90 тысячам - Интерфакс	Курс биткойна в понедельник впервые поднялся выше отметки $89 тыс.	https://www.interfax.ru/aspimg/991205.jpg	2024-11-12 05:47:00	Интерфакс
ru	https://www.interfax.ru/russia/990564	Экс-глава Коми Уйба назначен замначальника управления Минобороны России - Интерфакс	Бывший глава Коми Владимир Уйба назначен первым заместителем начальника главного военно-медицинского управления министерства обороны России, сообщили в четверг "Интерфаксу" в пресс-службе главы республики.	https://www.interfax.ru/aspimg/990564.png	2024-11-07 08:07:00	Интерфакс
ru	https://baigenews.kz/predstaviteli-irana-rossii-i-turtsii-vystupili-s-zayavleniem-posle-vstrechi-v-astane_300001364/	Представители Ирана, России и Турции выступили с заявлением после встречи в Астане - Новости Казахстана - Baigenews.kz	Опубликовано совместное заявление представителей Ирана, России и Турции по итогам 22-й Международной встречи по Сирии в "Астанинском формате", передаёт BaigeNews.kz....	https://baigenews.kz/storage/storage/news/2024/11/12/mainphoto/166737/800x420_zyddrrHLOtgEjIYTKcPxrKE9xqonDJ7FRuxcUedF.jpg	2024-11-12 11:02:57	Новости Казахстана - Baigenews.kz
ru	https://www.vedomosti.ru/finance/articles/2024/11/12/1074364-bank-rossii-ogranichit-vidachu-ipoteki	Банк России ограничит выдачу ипотеки на срок более 30 лет - Ведомости	С 1 июля 2025 года лимиты затронут также закредитованных заемщиков и ссуды с низким первоначальным взносом	https://sharing.vedomosti.ru/1731362249/vedomosti.ru/finance/articles/2024/11/12/1074364-bank-rossii-ogranichit-vidachu-ipoteki.jpg	2024-11-11 21:57:28	Ведомости
ru	https://www.rbc.ua/ukr/news/e-tehnologichni-rishennya-zelenskiy-zayaviv-1731333467.html	Есть технологические решения. Зеленский заявил о программе против российских КАБов - РБК-Украина	Подробнее читайте на сайте	https://www.rbc.ua/static/img/_/g/_gettyimages_1245138459_f31566fd4e4863c45be2fb986aba99d7_1300x820.jpg	2024-11-11 13:59:47	РБК-Украина
ru	https://www.rbc.ua/ukr/news/rosiya-zavdala-3-aviaudariv-zaporizhzhyu-1731295402.html	Россия нанесла 3 авиаудара по Запорожью: есть жертва и пострадавшие, среди которых дети - РБК-Украина	Подробнее читайте на сайте	https://www.rbc.ua/static/img/_/e/_ekrana_2024_11_11_v_05_18_59_157b418ebe8d8b52e4205e14c7925486_1300x820.jpg	2024-11-11 03:23:22	РБК-Украина
ru	https://meduza.io/news/2024/11/12/v-rossii-zapretili-propagandu-chayldfri	В России запретили «пропаганду чайлдфри» - Meduza	Депутаты Госдумы РФ приняли во втором и третьем чтении поправки, ограничивающие распространение информации, «пропагандирующей осознанный отказ от рождения детей», сообщила пресс-служба парламента 12 ноября.	https://meduza.io/imgly/share/1731412178/news/2024/11/12/v-rossii-zapretili-propagandu-chayldfri	2024-11-12 11:54:08	Meduza
ru	https://www.rbc.ua/ukr/news/vtrati-rf-dobu-sklali-mayzhe-2000-viyskovih-1731391848.html	Потери РФ за сутки составили почти 2000 военных, - Генштаб - РБК-Украина	Подробнее читайте на сайте	https://www.rbc.ua/static/img/_/v/_viyskovi_gepard_zima_gettyimages_1798361173_5198d0838a3be40431a0d48c141a7b2b_1300x820.jpg	2024-11-12 06:10:48	РБК-Украина
ru	https://www.svoboda.org/a/smi-tramp-nameren-nominirovatj-marko-rubio-na-post-gossekretarya/33198752.html	СМИ: Трамп намерен номинировать Марко Рубио на пост госсекретаря - Радио Свобода 	Рубио один из 15 сенаторов-республиканцев, проголосовавших против выделения Украине 95-миллиардного пакета помощи	None	2024-11-12 05:12:53	Радио Свобода 
ru	https://meduza.io/feature/2024/11/11/zhiteli-sudzhi-snova-poprosili-o-gumanitarnom-koridore-dlya-evakuatsii-svoih-blizkih-v-administratsii-prezidenta-rossii-otvetili-chto-vpervye-ob-etom-slyshat	Жители Суджи снова попросили о гуманитарном коридоре для эвакуации своих близких. В администрации президента России ответили, что впервые об этом слышат - Meduza	Родственники жителей города Суджа Курской области, который с августа находится под контролем ВСУ, направили новое, уже второе коллективное обращение к властям России и Украины с просьбой организовать гуманитарный коридор для эвакуации своих близких из зоны боевых действий, пишет «Новая газета».	https://meduza.io/imgly/share/1731317871/feature/2024/11/11/zhiteli-sudzhi-snova-poprosili-o-gumanitarnom-koridore-dlya-evakuatsii-svoih-blizkih-v-administratsii-prezidenta-rossii-otvetili-chto-vpervye-ob-etom-slyshat	2024-11-11 09:25:00	Meduza
ru	https://72.ru/text/economics/2024/11/12/74324252/	В Центробанке анонсировали снижение ключевой ставки: как изменится показатель и когда - Новости Тюмени – 72.ru	Обещали вернуться на уровень 2023 года	https://72.ru/html-to-img/image?hash=jDw3aCZ07-Cn2DutpMw-8g&ts=1731409459&url=https%3A%2F%2F72.ru%2Fog-image%2Farticle-id5942650%2F&width=1200	2024-11-12 08:38:54	Новости Тюмени – 72.ru
ru	https://newsbryansk.ru/fn_1573284.html	Бдительность жителей Брянщины помогла сбить 17 украинских БПЛА - Новости Брянска	Жители Брянской области активно используют приложение «Радар» от «Народного фронта». Приложение создано для сигнализации о беспилотниках, и надо признать,  уже принесло результаты. 	https://newsbryansk.ru/images/logo-sm.png	2024-11-11 09:36:25	Новости Брянска
ru	https://moe-online.ru/news/money/1206026	Выдача ипотечных кредитов в России рухнула сразу в 2,5 раза - МОЁ! Online Воронеж	Причина в отмене массовой льготной ипотеки, от которой зависел каждый третий построенный квадратный метр. Застройщики констатируют полную остановку продаж жилья по ряду позиций	https://moe-online.ru/media_new/1/9/8/5/0/2/2/material_1206026/original_photo-thumb_650.jpg	2024-11-11 11:01:00	МОЁ! Online Воронеж
ru	https://ura.news/news/1052842372	«У нас так всегда»: уволенный Богачев назвал себя «крайним» после отставки - URA.RU	Читайте на URA.RU	https://s.ura.news/images/news/figures/64/310/f27320c1-2b36-499a-9317-9455b6ac227d/a5vcbg/L-1200.1.9.jpg	2024-11-12 10:01:00	URA.RU
ru	https://journal.tinkoff.ru/news/chinovniki-reduction-digitalization/	Что известно о сокращении 10% госслужащих - Тинькофф Журнал	Сокращения пройдут в следующем году. Они должны помочь поднять зарплаты оставшимся сотрудникам	http://opis-cdn.tinkoffjournal.ru/mercury/2fb-chinovniki-reduction-digitalization.png	2024-11-11 16:55:52	Тинькофф Журнал
ru	https://72.ru/text/religion/2024/11/11/74322806/	Синичкин день: что обязательно сделать 12 ноября, чтобы быть богатым и счастливым, — народные приметы - Новости Тюмени – 72.ru	Рассказываем о поверьях и запретах на этот день 	https://72.ru/html-to-img/image?hash=sBo26uRPb5oXPwFAa8FNPQ&ts=1731335218&url=https%3A%2F%2F72.ru%2Fog-image%2Farticle-id5942065%2F&width=1200	2024-11-11 14:45:20	Новости Тюмени – 72.ru
ru	https://rtvi.com/news/massovye-zaderzhaniya-i-blokirovka-dorog-v-abhazii-proshli-massovye-besporyadki-iz-za-soglasheniya-s-rossiej/	Массовые задержания и блокировка дорог: Абхазию охватили беспорядки из-за соглашений с Россией - RTVI	В Абхазии после ареста оппозиционеров, выступающих против инвестиционного соглашения с Россией, начались массовые беспорядки. Протестующие перекрыли мосты, заблокировали главную трассу из республики к границе с Россией и попытались проникнуть внутрь здания Службы госбезопасности (СГБ). О том, что происходит в стране, — в материале RTVI.	https://rtvi.com/wp-content/uploads/2024/11/402376-1.jpg?143246	2024-11-12 10:06:31	RTVI
ru	https://www.interfax.ru/russia/991306	Прокуроры в РФ начали проверку по поводу повышения производителями цен на молоко - Интерфакс	Генпрокурор РФ Игорь Краснов поручил подчиненным проверить сведения о повышении производителями цен на молоко и принять меры в случае выявления нарушений в этой сфере, сообщило во вторник надзорное ведомство.	https://www.interfax.ru/aspimg/991306.jpg	2024-11-12 13:00:00	Интерфакс
ru	https://www.interfax.ru/russia/991215	ФСБ сообщила о предотвращении теракта у Балаклавской ТЭС - Интерфакс	Сотрудники ФСБ задержали жителя Севастополя по подозрению в намерении совершить теракт рядом с Балаклавской теплоэлектростанцией (ТЭС) по заданию украинской разведки, сообщили в Центре общественных связей (ЦОС) ФСБ.	https://www.interfax.ru/aspimg/991215.png	2024-11-12 06:46:00	Интерфакс
ru	https://eadaily.com/ru/news/2024/11/12/svedeniy-o-postradavshih-v-dtp-v-chzhuhae-rossiyanah-net-dipmissiya-rossii	Сведений о пострадавших в ДТП в Чжухае россиянах нет — дипмиссия России - EADaily	EADaily, 12 ноября 2024. Сведений о пострадавших гражданах России в результате наезда автомобиля на людей в городе Чжухай нет. Об этом агентству ТАСС заявили в генконсульстве России в Гуанчжоу.	https://img5.eadaily.com/r650x400/o/c40/7f88d0970e64b6a5d44c1c8699686.jpeg	2024-11-12 05:43:00	EADaily
ru	https://www.svoboda.org/a/ukrainskiy-bespilotnik-atakoval-neftebazu-v-starom-oskole/33198815.html	Украинский беспилотник атаковал нефтебазу в Старом Осколе - Радио Свобода 	None	None	2024-11-12 06:16:29	Радио Свобода 
ru	https://www.pravda.com.ua/rus/news/2024/11/12/7484068/	Россия снова выпустила по Украине более сотни дронов: ПВО сбила 46 БпЛА - Украинская правда	В ночь на вторник 12 ноября российский агрессор нанес ракетно-бомбовые удары и выпустил 110 беспилотников по Украине: 46 из них уничтожила ПВО, 60 были локационно потеряны, 2 улетели в Беларусь.	https://img.pravda.com/images/doc/7/4/7484068_fb_image_rus_2024_11_12_12_18_20.jpg	2024-11-12 09:26:00	Украинская правда
ru	https://www.uralskweek.kz/2024/11/11/obemy-zakupa-elektroenergii-u-rossii-rezko-vyrosli-posle-perevoda-vremeni-v-kazaxstane/	Объемы закупа электроэнергии у России резко выросли после перевода времени в Казахстане - Уральская неделя	None	None	2024-11-11 11:34:20	Уральская неделя
ru	https://meduza.io/news/2024/11/12/pediatra-nadezhdu-buyanovu-prigovorili-k-pyati-s-polovinoy-godam-kolonii	Педиатра Надежду Буянову приговорили к пяти с половиной годам колонии - Meduza	Тушинский районный суд Москвы приговорил педиатра Надежду Буянову к пяти с половиной годам лишения свободы по уголовному делу о «фейках» о российской армии, пишет «Медиазона».	https://meduza.io/imgly/share/1731414653/news/2024/11/12/pediatra-nadezhdu-buyanovu-prigovorili-k-pyati-s-polovinoy-godam-kolonii	2024-11-12 12:21:06	Meduza
ru	https://news.google.com/rss/articles/CBMiR0FVX3lxTFA3eG5FN3d2eWhWN2kzM093SWVkUTlqYjZ1Wm9tdlhtS2VGYjlrUEw3cTBXc0hKRHkxb21TOXV3YThZNlMzQXRB?oc=5	Оперативное совещание с вице-премьерами - Новости - Правительство России	None	None	2024-11-11 07:26:07	Новости - Правительство России
ru	https://www.pravda.com.ua/rus/news/2024/11/12/7484098/	Молдова выразила протест России из-за вмешательства в выборы и падения дронов - Украинская правда	None	None	2024-11-12 12:37:27	Украинская правда
ru	https://www.interfax.ru/russia/991207	Дума предложит правительству запретить брать в школы детей мигрантов без знания русского - Интерфакс	Госдума готовит проект постановления с предложениями правительству по решению проблем в сфере миграции, сообщил журналистам спикер палаты Вячеслав Володин.	https://www.interfax.ru/aspimg/991207.png	2024-11-12 06:04:00	Интерфакс
ru	https://ura.news/news/1052842302	Китайцы восхитились «Русскими витязями» на истребителях Су-57. Видео - URA.RU	Видео	https://s.ura.news/images/news/figures/463/762/225172d3-d780-40e1-af4f-9ec9b8b263c2/uklj_b/L-1200.1.9.jpg	2024-11-12 08:27:51	URA.RU
ru	https://eadaily.com/ru/news/2024/11/11/v-mid-indii-vyskazalis-o-perspektivah-torgovli-s-rossiey	В МИД Индии высказались о перспективах торговли с Россией - EADaily	EADaily, 11 ноября 2024. Глава МИД Индии Субраманьям Джайшанкар прокомментировал развитие российско-индийских торговых отношений. По мнению дипломата, о чем сегодня, 11 ноября, сообщает «РИА Новости», к 2030 году денежное выражение двусторонней торговли достигнет 100 млрд долларов.	https://img1.eadaily.com/r650x400/o/84b/ab68315a9a9493b93bf689e2407bb.jpeg	2024-11-11 09:08:00	EADaily
ru	https://news.google.com/rss/articles/CCAiC0JlbjlpdngxUWJBmAEB?oc=5	Путин ВЫВОДИТ войска или Taurus летят на Москву! России поставили УЛЬТИМАТУМ. В Кремле отреагировали - УНІАН	None	None	2024-11-12 11:30:06	УНІАН
ru	https://meduza.io/news/2024/11/12/poyavilos-video-vzryva-damby-kurahovskogo-vodohranilischa	Появилось видео взрыва дамбы Кураховского водохранилища - Meduza	«Телевизионная служба новостей» (ТСН) опубликовала 12 ноября видеозапись, на которой, как утверждается, показан момент взрыва Терновской дамбы на Кураховском водохранилище в Донецкой области.	https://meduza.io/imgly/share/1731416506/news/2024/11/12/poyavilos-video-vzryva-damby-kurahovskogo-vodohranilischa	2024-11-12 14:31:29	Meduza
ru	https://www.pravda.com.ua/rus/news/2024/11/11/7483891/	Зеленский отреагировал на удар РФ по родному городу: Агрессор опровергает свои заявления о дипломатии - Украинская правда	После очередного военного преступления России президент Владимир Зеленский отметил, что Украина нуждается в оружии для защиты от российского террора и крепкой поддержки мира.	None	2024-11-11 10:48:28	Украинская правда
ru	https://news.ru/world/uchastniki-cop29-v-baku-porazili-gostej-yarkimi-tradicionnymi-obrazami/	Участники COP29 в Баку поразили гостей яркими традиционными образами - NEWS.ru	Участники COP29 посетили мероприятие в Баку в национальных костюмах, демонстрирующих культурное разнообразие народов мира. В числе стран, оформивших наиболее яркие стенды, оказались Азербайджан, Малайзия и Индонезия. 	https://static.news.ru/photo/cdc3448a-a045-11ef-9b3d-02420a0000c9_760.jpg	2024-11-11 15:36:46	NEWS.ru
