country_code	url	title	description	image_url	publish_date	source
ru	https://novosti-n.org/news/RF-udaryla-po-Doneczkoj-oblasty-upravlyaemimy-avyabombamy-est-ranenie-304134	РФ ударила по Донецкой области управляемыми авиабомбами: есть раненые - Новости N	6 человек ранены в результате ударов врага по Константиновке Донецкой области	https://img.novosti-n.org/upload/news/875374.jpg	2024-11-21 07:50:29	Новости N
ru	https://www.fontanka.ru/2024/11/22/74366867/	Соседям досталось: в Карелии местами нет света, в Финляндии в ДТП из-за снежной бури погибли пять человек - Фонтанка.Ру	None	None	2024-11-22 12:21:00	Фонтанка.Ру
ru	https://bcs-express.ru/novosti-i-analitika/prognozy-i-kommentarii-rezkii-razvorot-rynka	Прогнозы и комментарии. Резкий разворот рынка - БКС Экспресс	Индекс МосБиржи со дна +3%. Разворот рынка акций совпал со скачком бенчмарка волатильности. Закрытие торговой недели станет показательным	https://cdn.bcs-express.ru/article-head/12837.jpg	2024-11-22 06:56:15	БКС Экспресс
ru	https://nversia.ru/news/sinoptiki-rasskazali-kogda-dozhd-i-silnyy-veter-uydut-iz-saratovskoy-oblasti/	Синоптики рассказали, когда дождь и сильный ветер уйдут из Саратовской области - ИА Версия, Саратов	Сегодня, 22 ноября, Саратовская область окажется во власти атмосферного фронта, который принесет значительные осадки и сильный ветер. Но выходные будут теплыми и без существенных осадков. Прогноз погоды на ближайшие трое суток ИА «Версия-Саратов» сообщили в областном гидрометцентре.	https://nversia.ru/imgs/share/1732253727_218732863.jpg	2024-11-22 05:35:00	ИА Версия, Саратов
ru	https://pogoda.mail.ru/news/63746305/	МЧС предупредило о мокром снеге и гололеде в Нижегородской области - Погода Mail.ru	Ожидается сильный ветер.	https://resizer.mail.ru/p/056ccb71-d9a4-5a8b-8169-4628190e3a51/op:15/logo:bottom:weather.png/AQAGuVwBd4tmxnzM_7gnYsC6aYtSSYqyW72COLh2I0GKdYRnKRifBiYiawdrV3P6WO3sHshDetNomVjI3z67jJqJ_hg.jpg	2024-11-21 13:58:01	Погода Mail.ru
ru	https://meduza.io/news/2024/11/22/v-yuzhnoy-koree-zayavili-chto-rossiya-peredala-kndr-sredstva-pvo-v-obmen-na-otpravku-soldat-na-voynu-s-ukrainoy	В Южной Корее заявили, что Россия передала КНДР средства ПВО в обмен на отправку солдат на войну с Украиной - Meduza	Советник по национальной безопасности Южной Кореи Шин Вон Сик заявил, что Россия передала КНДР зенитные ракеты и средства противовоздушной обороны в обмен на отправку северокорейских солдат на войну с Украиной. Об этом он сказал в эфире телеканала SBS, его слова приводит «Ренхап». 	https://meduza.io/imgly/share/1732272203/news/2024/11/22/v-yuzhnoy-koree-zayavili-chto-rossiya-peredala-kndr-sredstva-pvo-v-obmen-na-otpravku-soldat-na-voynu-s-ukrainoy	2024-11-22 16:54:17	Meduza
ru	https://www.interfax.ru/business/994033	Новак заявил, что запрет на экспорт бензина будет снят досрочно - Интерфакс	Россия намерена досрочно снять запрет на экспорт бензина в ближайшее время, сообщил журналистам вице-премьер Александр Новак.	https://www.interfax.ru/aspimg/994033.jpg	2024-11-22 11:09:00	Интерфакс
ru	https://www.pravda.com.ua/rus/news/2024/11/22/7485911/	Зеленский: Уже говорим с партнерами о системах ПВО, которые остановят новые риски из РФ - Украинская правда	Президент Украины Владимир Зеленский в связи с применением Россией новой ракеты, которую назвали “Орешник”, поручил министру обороны проводить встречи с партнерами по получению систем противовоздушной обороны, которые “способны защитить жизнь от новых рисков”.	https://img.pravda.com/images/doc/7/4/7485911_fb_image_rus_2024_11_22_20_06_41.jpg	2024-11-22 17:25:03	Украинская правда
ru	https://www.dw.com/ru/zasedanie-verhovnoj-rady-otmenili-izza-ugrozy-rossijskogo-udara/a-70854898	Заседание Верховной рады отменили из-за угрозы удара РФ - DW НА РУССКОМ	Депутатов Рады предупредили о возможном ракетном ударе России по зданию парламента. Их призвали ограничить присутствие в пределах правительственного квартала.	https://static.dw.com/image/70275204_6.jpg	2024-11-22 07:00:01	DW НА РУССКОМ
ru	https://www.pravda.com.ua/rus/news/2024/11/22/7485895/	Россия с ночи атакует Украину дронами: ПВО уничтожила 64 БпЛА из 114, четыре еще кружат - Украинская правда	None	None	2024-11-22 15:58:00	Украинская правда
ru	https://ura.news/news/1052846986	Бжания покинул Абхазию после того, как ушел в отставку - URA.RU	Читайте на URA.RU	https://s.ura.news/images/news/figures/761/614/0d00b693-5a3c-4f86-81ed-09bf82800f1e/iyyonc/L-1200.1.9.jpg	2024-11-22 14:40:32	URA.RU
ru	https://meduza.io/news/2024/11/22/patriarha-kirilla-filippa-kirkorova-ani-lorak-i-esche-bolee-30-chelovek-pervymi-lishili-gosudarstvennyh-nagrad-ukrainy	Патриарха Кирилла, Филиппа Киркорова, Ани Лорак и еще более 30 человек первыми лишили государственных наград Украины - Meduza	Президент Украины Владимир Зеленский своим указом бессрочно лишил государственных наград 34 человек — бывших украинских чиновников и депутатов, артистов, а также российских политических, религиозных и культурных деятелей. Об этом 22 ноября сообщила пресс-служба Зеленского.	https://meduza.io/imgly/share/1732286912/news/2024/11/22/patriarha-kirilla-filippa-kirkorova-ani-lorak-i-esche-bolee-30-chelovek-pervymi-lishili-gosudarstvennyh-nagrad-ukrainy	2024-11-22 09:50:00	Meduza
ru	https://pogoda.mail.ru/news/63757478/	В Крыму начался мощный трехдневный шторм. Фотогалерея - Погода Mail.ru	21 ноября на Крым обрушился сильный шторм: делимся подробностями и рассказываем, сколько может продлиться непогода. Показываем в фотогалерее, как сейчас обстоят дела на полуострове.	https://resizer.mail.ru/p/37b21776-8def-54f2-adbf-a2392e436a6d/op:15/logo:bottom:weather.png/AQAGhve1Rv0kxByxkZCmo_u5b_b1vdUp39OGvK39lOUMtcL4BoTUjO_efcrHADVrSGVYoUu3n7Kems1hu1RbnyPvr6w.jpg	2024-11-22 09:23:02	Погода Mail.ru
ru	https://www.bfm.ru/news/562549	Лавров: Зеленский испугался ответа Москвы - BFM.RU	None	None	2024-11-22 18:14:48	BFM.RU
ru	https://auto.ru/mag/article/mvd-nazvalo-datu-kogda-osago-stanet-neobyazatelnym-pri-registracii-mashiny/	МВД обнародовало новые правила регистрации машин с 2025 года - Журнал Авто.ру	None	None	2024-11-21 20:27:05	Журнал Авто.ру
ru	https://klops.ru/kaliningrad/2024-11-22/309237-litovtsy-protiv-moloka-neozhidannyy-sneg-i-grustnyy-novyy-god-5-sobytiy-nedeli-kotorye-obsuzhdali-v-kaliningrade	Литовцы против молока, неожиданный снег и грустный Новый год: 5 событий недели, которые обсуждали в Калининграде - КЛОПС - главный новостной сайт Калининграда	Обзор тем, не оставивших равнодушными читателей «Клопс»	https://assets3.klops.ru/media/W1siZiIsIjIwMjQvMTEvMjIvY2I1ZTM2NmEtOTBjMC00MGI5LWE3YWItMjlkZWVkMzNiOGMxX2ZpbGUuanBlZyJdLFsicCIsInRodW1iIiwiMTI4MHg2NzIrMCsyNCJdLFsicCIsInRodW1iIiwiMTIwMHg2MzAjIl0sWyJwIiwidGV4dCIsIiJdLFsicCIsImVuY29kZSIsImpwZyIsIi1zdHJpcCAtaW50ZXJsYWNlIFBsYW5lIl1d/file.jpg?sha=38d41ced2a165ce0	2024-11-22 15:59:16	КЛОПС - главный новостной сайт Калининграда
ru	https://www.interfax.ru/moscow/994053	Непогода вновь прогнозируется в Москве в субботу - Интерфакс	Интенсивные осадки в виде мокрого снега прогнозируются в Москве в субботу, порывы ветра будут достигать 15 м/с, на дорогах гололедица.	https://www.interfax.ru/aspimg/994053.jpg	2024-11-22 12:14:00	Интерфакс
ru	https://klops.ru/other/2024-11-22/309252-34-vzroslyh-i-12-detey-v-rossiyu-vernuli-vyvezennyh-na-ukrainu-zhiteley-kurskoy-oblasti	34 взрослых и 12 детей: в Россию вернули вывезенных на Украину жителей Курской области - КЛОПС - главный новостной сайт Калининграда	В зоне СВО пропало уже более 40 тысяч человек	https://assets3.klops.ru/media/W1siZiIsIjIwMjQvMTEvMjIvZDIyNmVjNGQtMjZlYy00ZmQ3LTg4NWItOGQ1NWQzMWQ5ODMwX2ZpbGUuanBlZyJdLFsicCIsInRodW1iIiwiMTIwMHg2MzArMCs3OCJdLFsicCIsInRodW1iIiwiMTIwMHg2MzAjIl0sWyJwIiwidGV4dCIsIiJdLFsicCIsImxvZ28iXSxbInAiLCJlbmNvZGUiLCJqcGciLCItc3RyaXAgLWludGVybGFjZSBQbGFuZSJdXQ/file.jpg?sha=b643c33b051fdf20	2024-11-22 16:58:04	КЛОПС - главный новостной сайт Калининграда
ru	https://www.vedomosti.ru/politics/articles/2024/11/22/1076832-zhenschinu-genprokurora-ssha	Дональд Трамп выдвинул женщину на должность генпрокурора США - Ведомости	Она займется чисткой американского минюста	https://sharing.vedomosti.ru/1732302091/vedomosti.ru/politics/articles/2024/11/22/1076832-zhenschinu-genprokurora-ssha.jpg	2024-11-22 18:30:29	Ведомости
ru	https://www.vzsar.ru/news/2024/11/22/so-specoperacii-ne-vernylis-jivymi-esche-chetyre-saratovca.html	Со спецоперации не вернулись живыми еще четыре саратовца - Взгляд-инфо	В ходе специальной военной операции погибли еще четыре жителя Саратовской области	https://www.vzsar.ru/i/news/social/267474_1732279394.jpg	2024-11-22 12:43:00	Взгляд-инфо
ru	https://72.ru/text/politics/2024/11/22/74365502/	Украина и Россия обменялись ударами баллистических ракет, а Зеленский придумал новый «план»: главное об СВО за неделю - Новости Тюмени – 72.ru	Вместе с эскалацией конфликта весь мир обсуждает начало переговоров между странами	https://72.ru/html-to-img/image?hash=-83ns2vwWFKbgvg3yF8LAQ&ts=1732288915&url=https%3A%2F%2F72.ru%2Fog-image%2Farticle-id5958135%2F&width=1200	2024-11-22 09:42:00	Новости Тюмени – 72.ru
ru	https://www.rbc.ua/ukr/news/rozvidka-britaniyi-viznachila-zmini-armiyi-1732218704.html	Разведка Британии оценила изменения в армии РФ за время полномасштабной войны - РБК-Украина	Подробнее читайте на сайте	https://www.rbc.ua/static/img/_/r/_rosiyski_viyskovi_gettyimages_1239355989_6c7f830070290f5064085cd509aab527_1300x820.jpg	2024-11-21 20:29:44	РБК-Украина
ru	https://www.netall.ru/society/news/1416905.html	Билеты в ДК и «Ведогонь» придется покупать по документам - Инфопортал Зеленограда	Мэрия вводит новые правила покупки билетов на культурные мероприятия на городских площадках. Ходить в театры и ДК придется с паспортом, водительскими правами или другим документом, а передать кому-то свои билеты не получится.	https://www.netall.ru/upload/iblock/956/9i9x1rztob6vd9qzyk7wjcop4jxftw0v_twit.png	2024-11-22 08:24:00	Инфопортал Зеленограда
ru	https://www.vedomosti.ru/politics/articles/2024/11/22/1076760-golubev-naznachen-senatorom	Экс-губернатор Ростовской области Голубев назначен сенатором - Ведомости	Он займет место Рукавишниковой, которая написала заявление о досрочном прекращении полномочий	https://sharing.vedomosti.ru/1732280637/vedomosti.ru/politics/articles/2024/11/22/1076760-golubev-naznachen-senatorom.jpg	2024-11-22 12:06:44	Ведомости
ru	https://www.rbc.ua/ukr/news/rf-zavdala-udari-zaporizhzhyu-ta-oblasti-1732310513.html	РФ нанесла удары по Запорожью и области: есть повреждения и разрушения - РБК-Украина	Подробнее читайте на сайте	https://www.rbc.ua/static/img/_/p/_pozhezhniki_ryatuvalniki_mistse_prilotu_gettyimages_1883952924_f7bdfcac204e6deabe71a8b4db2d5388_1300x820.jpg	2024-11-22 21:29:56	РБК-Украина
ru	https://www.eurointegration.com.ua/rus/news/2024/11/22/7199026/	Премьер Британии ответил московскому послу: Мы не в состоянии войны с Россией - Европейская правда	None	None	2024-11-22 15:52:08	Европейская правда
ru	https://kaztag.info/ru/news/kazakhstan-mezhdu-rossiey-i-ukrainoy-mneniya-ekonomista-deputata-i-eks-glavy-knb	Казахстан между Россией и Украиной – мнения экономиста, депутата и экс-главы КНБ - КазТАГ	None	None	2024-11-22 11:54:29	КазТАГ
ru	https://www.pravda.com.ua/rus/news/2024/11/22/7485825/	Китай после российского удара новой ракетой и угроз Путина призвал "всех" к сдержанности - Украинская правда	None	None	2024-11-22 11:09:32	Украинская правда
ru	https://www.interfax.ru/world/993944	Глава Минобороны ФРГ отказался бороться за пост канцлера, поддержал Шольца - Интерфакс	Глава Минобороны ФРГ Борис Писториус, член Социал-демократической партии Германии (СДПГ), в четверг заявил, что он не намерен выставлять свою кандидатуру на пост канцлера во время запланированных на февраль 2025 года выборов в стране, передает телеканал ZDF.	https://www.interfax.ru/aspimg/993944.png	2024-11-21 19:16:12	Интерфакс
ru	https://korrespondent.net/world/russia/4734401-kreml-otreahyroval-na-sanktsyy-ssha-protyv-hazprombanka	Кремль отреагировал на санкции США против Газпромбанка - Корреспондент	None	None	2024-11-22 17:15:00	Корреспондент
ru	https://www.forbes.ru/mneniya/525660-moral-no-diplomaticeskij-udar-cto-oznacaet-order-mus-na-arest-bin-amina-netan-ahu	Морально-дипломатический удар: что означает ордер МУС на арест Биньямина Нетаньяху - Forbes Russia	Ордер Международного уголовного суда (МУС) на арест премьер-министра Израиля Биньямина Нетаньяху стал серьезным дипломатическим ударом для еврейского государства, которое, как следует из текста ордера, перешло границы допустимой самообороны, считает 	https://cdn.forbes.ru/forbes-static/shareimages/525660.jpg?v=1732290848	2024-11-22 13:44:40	Forbes Russia
ru	https://www.interfax-russia.ru/kaleidoscope/den-materi-v-2024-godu-data-istoriya-i-tradicii-prazdnika-kak-pozdravit-samogo-rodnogo-cheloveka-top-10-idey	День матери в 2024 году: дата, история и традиции праздника. Как поздравить самого родного человека? Топ-10 идей - Интерфакс-Россия	Приближается 24 ноября — День матери. Рассказываем об истории, традициях праздника, а также о том, что подарить самому родному человеку.... читать далее на Interfax-Russia.ru	https://www.interfax-russia.ru/storage/media/2024/11/22/foto-10.webp	2024-11-22 11:53:00	Интерфакс-Россия
ru	https://www.fontanka.ru/2024/11/22/74368610/	«Сумасшедших в руководстве России нет»: Медведев — о применении ядерного оружия и «Орешника» - Фонтанка.Ру	None	None	2024-11-22 19:39:00	Фонтанка.Ру
ru	https://www.unian.net/war/kurskaya-oblast-uzhe-stoila-rossii-poteri-25-tysyach-soldat-smi-12828915.html	Курская операция ВСУ сорвала России планы наступления на Запорожье, - СМИ - УНИАН	С Запорожского направления было снято едва ли не самое боеспособное соединение российской армии, чтобы перебросить его под Курск.	https://images.unian.net/photos/2023_09/thumb_files/1000_545_1694587728-2069.jpg?1	2024-11-22 16:52:00	УНИАН
ru	https://www.unian.net/world/my-predali-ukrainu-makkol-nazval-glavnyy-kriteriy-dlya-peregovorov-12829071.html	"Мы предали Украину": Маккол назвал главное условие для сделки с Россией - УНИАН	Он считает, что переговоры будут очень сложными для обеих сторон.	https://images.unian.net/photos/2024_11/thumb_files/620_324_1732308517-5857.jpg?1	2024-11-22 21:00:00	УНИАН
ru	https://72.ru/text/gorod/2024/11/21/74362397/	Ночное небо Тюменской области озарила яркая вспышка. Что это? - Новости Тюмени – 72.ru	Летящий в небе объект увидели жители юга региона	https://72.ru/html-to-img/image?hash=eMJrOgLDbvBRNUj4N0zDMw&ts=1732251754&url=https%3A%2F%2F72.ru%2Fog-image%2Farticle-id5957024%2F&width=1200	2024-11-21 16:05:00	Новости Тюмени – 72.ru
ru	https://www.rbc.ua/ukr/news/putin-znovu-zrobiv-zayavu-raketu-oreshnik-1732296631.html	Путин снова сделал заявление о ракете "Орешник" - РБК-Украина	Подробнее читайте на сайте	https://www.rbc.ua/static/img/_/7/_7_putin_kremlin_ru_c9f54a4add18bb544a82fc680b2d85a2_1300x820.jpg	2024-11-22 17:31:18	РБК-Украина
ru	https://www.vedomosti.ru/society/articles/2024/11/22/1076798-minyust-obyavil-inoagentom-sheina	Минюст объявил иноагентом экс-депутата Госдумы Олега Шеина - Ведомости	В список также добавили бывшего активиста «Молодежного «Яблока» Вадима Ваганова	https://sharing.vedomosti.ru/1732301076/vedomosti.ru/society/articles/2024/11/22/1076798-minyust-obyavil-inoagentom-sheina.jpg	2024-11-22 14:07:51	Ведомости
ru	https://news.google.com/rss/articles/CBMiiwFBVV95cUxOZHdzTUhKb041MzJteGJLaTFwYkRvd09MbnNzSFhsbV9VVW1Cc2hPYUZrbjVIQV81dWE1blZYZm1Hd0F5Wmx6RF81NnlVM1h5QVQzWEw1bnBBSkFoTHZxZUpWNjhCRUs3QVdialpuVUFTTWNEUVNtRHlHX0R6cThaQ3NqS1BjM24tQU5F?oc=5	Курс рубля катится вниз на фоне «испытаний» «Орешника» - 22 ноября 2024 - я62.ру - Рязанский портал YA62.RU	None	None	2024-11-22 11:26:00	Рязанский портал YA62.RU
ru	https://news.google.com/rss/articles/CBMiTkFVX3lxTE1MZWRPaFdXZURndFJMdmZHd2pacWVValJVejdWWXZFZGZVMzk5OWlMQURlaER3dmtSWjlFSGUzdlM4aDR1Tk1wajBmbFp5Z9IBU0FVX3lxTE5TbjNZd1BFYnNxNmNTUl9pTDdxbGkyMWtxT3BUOENUWTFyODY4dm1ROFl1UE5QMVQzQ1pYWl95eC04M3NNNW93TGQtV3hEU2FBQTZV?oc=5	Метеорологи объяснили причины непогоды, ожидаемой в Краснодарском крае - Погода Mail.ru	в Краснодарском крае установится неустойчивая погода, связанная с влиянием циклона. Об этом сообщили в краевом гидрометцентре.	https://resizer.mail.ru/p/18731f4a-c9df-558c-9057-fb497adbcdef/op:15/logo:bottom:weather.png/AQAGJNDfm1frQUa3FtxXSvvvW5lu03Si0DvLGUcz1pSWtH5oUYIwp0gI4EqFHOS7890a7j2YyHct655BHeiy0OSpn4Q.jpg	2024-11-21 10:55:41	Погода Mail.ru
ru	https://meduza.io/news/2024/11/22/v-sumah-v-rezultate-udara-rossiyskimi-bespilotnikami-po-zhilomu-mikrorayonu-pogibli-dva-cheloveka-esche-bolee-10-raneny	В Сумах в результате удара российскими беспилотниками по жилому микрорайону погибли два человека, еще более 10 ранены - Meduza	В Сумах в результате удара российских войск по жилому микрорайону погибли два человека, еще 12 получили ранения, сообщили областная военная администрация и исполняющий обязанности главы города Артем Кобзарь.	https://meduza.io/imgly/share/1732253875/news/2024/11/22/v-sumah-v-rezultate-udara-rossiyskimi-bespilotnikami-po-zhilomu-mikrorayonu-pogibli-dva-cheloveka-esche-bolee-10-raneny	2024-11-22 05:37:00	Meduza
ru	https://vtomske.ru/news/207600-gosduma-prinyala-byudjet-rossii-s-rekordnymi-voennymi-rashodami	Госдума приняла бюджет России с рекордными военными расходами - vtomske.ru — Томск	Госдума 21 ноября приняла в третьем чтении закон о федеральном бюджете на 2025 год и на плановый период 2026 и 2027 годов. Главной статьей бюджета станут траты на оборонные нужды, которые в этом...	https://dn1.vtomske.ru/a/50/cb/50cb36ab936ef3a166b537aea20d9372_shc49de9cf.jpg	2024-11-21 14:56:00	vtomske.ru — Томск
ru	https://news.google.com/rss/articles/CBMirgFBVV95cUxQMGc4MGZleFpxZFVmX1FNTkRVRnZSaS1fNmFZaFlPQlI3anhmVzFGd2RtRERMU21LQ1BLRGtlYzhOQ1FwbnVnNUVpWTFRanc1QWdGclBkZkZLakdGaE1vTVYxZXdVMW12aXcwVEJIM3R2NVp2SjVLVmRYQ0lBTGhUMUtIVWhXZXItRUhiaEMzQ1BnbjJHTnZJNVd4Q0IwX1dZRXJ1ejRWWnNmRzg5cUE?oc=5	Дмитрий Медведев одобрил назначение Романа Бусаргина секретарем "ЕР" - Взгляд-инфо	Губернатора Саратовской области Романа Бусаргина согласовали на должность секретаря	https://www.vzsar.ru/i/news/social/267436_1732194060.jpg	2024-11-21 13:00:00	Взгляд-инфо
ru	https://news.google.com/rss/articles/CBMiUkFVX3lxTE13QVBxc0dXYjhaTUp5SWZ2NF9fcHZ1MERlYnBET0RHMXdEYmgwdVhFZ2x6Zk1yN2dkZkZ6ZjBYdFJaSWI5R2xmTGprZ2prSmIwZGc?oc=5	Минобороны назвало число сбитых над Брянщиной дронов ВСУ за утро пятницы - Новости Брянска	None	None	2024-11-22 06:27:42	Новости Брянска
ru	https://www.fontanka.ru/2024/11/22/74367686/	«Клюквы и русофобии нет»: каким получился «Сталкер 2» и что о нем говорят - Фонтанка.Ру	None	None	2024-11-22 13:53:00	Фонтанка.Ру
