country_code	url	title	description	image_url	publish_date	source
ru	https://ura.news/articles/1036290090	Полпред Жога собрал вече, отмечая первый месяц работы - URA.RU	Он решил стать связным между уральцами и фронтом. А еще показал новые лица в команде. Только на URA.RU	https://s.ura.news/images/news/upload/smm/2024/11/02/facebook_8fbe7f8ad1fcf30454be6bfda173d16b.jpg	2024-11-01 19:52:00	URA.RU
ru	https://news.pn/ru/RussiaInvadedUkraine/317203	ВОЙНА РОССИИ ПРОТИВ УКРАИНЫ: В Сумах шахед попал в многоэтажку - Преступности.Нет	None	None	2024-11-01 10:28:00	Преступности.Нет
ru	https://ru.euronews.com/my-europe/2024/11/02/kharkiv-air-strikes	Россия ударила по месту дислокации полицейских в Харькове - Euronews Русский	Российские войска нанесли удары по Харькову, Сумам и Киеву #EuropeNews	https://static.euronews.com/articles/stories/08/82/82/12/1200x675_cmsv2_7b9486bc-cae4-57e9-965c-9c0bfa80d871-8828212.jpg	2024-11-02 07:35:29	Euronews Русский
ru	https://www.rbc.ua/ukr/news/rosiyani-aktivno-atakuyut-troh-napryamkah-1730474095.html	Россияне активно атакуют на трех направлениях: какая ситуация на фронте - РБК-Украина	Подробнее читайте на сайте	https://www.rbc.ua/static/img/_/v/_viyskovi_osin_2023__gettyimages_1759728941__1__3fb5512bd286b4caac8ac12a0e4532fe_1300x820.jpg	2024-11-01 15:36:05	РБК-Украина
ru	https://newsorel.ru/fn_1569350.html	Погода разбушевалась не на штуку: как в Орловской области разбирались с последствиями урагана - Орловские новости	Минувшей ночью ураганный ветер сносил деревья в Орловской области. В результате упавшие стволы и ветви преграждали путь орловцам.	https://newsorel.ru/images/logo-sm.png	2024-11-02 06:30:00	Орловские новости
ru	https://www.newsvl.ru/vlad/2024/11/02/227560/	11-летнего Павла Хышова из Приморья наградили медалью в Совете Федерации за спасение провалившегося под лёд друга - Новости Владивостока и Приморского края	Новости Владивостока: В Совете Федерации в пятницу, 1 ноября, на церемонии, приуроченной ко Дню народного единства, наградили детей-героев за спасение людей и проявленное мужество. Одним из награждённых стал 11-летний Павел Хышов из Приморья, который спас провалившегося под лёд на Патрокле друга.	https://static.vl.ru/news/1730503313675_default	2024-11-01 23:21:00	Новости Владивостока и Приморского края
ru	https://www.interfax.ru/russia/989831	Кабмин РФ утвердил требования к майнерам и операторам майнинговой инфраструктуры - Интерфакс	Правительство РФ завершило подготовку нормативной правовой базы, устанавливающей регулирование в сфере майнинга цифровой валюты, сообщила пресс-служба кабмина.	https://www.interfax.ru/aspimg/989831.jpg	2024-11-01 15:08:00	Интерфакс
ru	https://ura.news/news/1052838257	Путин: большинство стран разделяет идеи Русского мира - URA.RU	Читайте на URA.RU	https://s.ura.news/images/news/figures/431/532/96e85eac-dbb2-46e6-b122-dab21b196d01/rk8oeg/L-1200.1.9.jpg	2024-11-02 07:51:00	URA.RU
ru	https://www.dw.com/ru/otpravka-vojsk-kndr-v-rf-zelenskij-kritikuet-zapad-za-passivnost/a-70667263	Отправка войск КНДР в РФ: Зеленский критикует Запад - DW НА РУССКОМ	Владимир Зеленский призвал страны Запада не наблюдать пассивно за отправкой северокорейских войск в Россию. По его словам, Украина могла бы ударить по лагерям военнослужащих КНДР в РФ, имей она дальнобойное оружие.	https://static.dw.com/image/70550103_6.jpg	2024-11-02 08:29:57	DW НА РУССКОМ
ru	https://news.google.com/rss/articles/CCAiC3RvdXowaWRVdFFVmAEB?oc=5	Корейцы вышли Путину боком! Неожиданный поворот в Курске: Россия посыпалась. Началась грызня - УНІАН	None	None	2024-11-02 09:01:01	УНІАН
ru	https://1743.ru/news/74895-na-prazdnik-v-orenburge-vklyuchat-tematicheskuyu-illyuminaciyu-na-televyshke	На праздник в Оренбурге включат тематическую иллюминацию на телевышке - 1743.ru	На праздник в Оренбурге включат тематическую иллюминацию на телевышке	http://images.1743.ru/images/1743/2024/11_november/image_02112024103941_17305259810223.jpg	2024-11-02 10:30:00	1743.ru
ru	https://www.fontanka.ru/2024/11/02/74288468/	Минобороны РФ отчиталось о сбитых беспилотниках в семи российских регионах - Фонтанка.Ру	None	None	2024-11-02 04:35:20	Фонтанка.Ру
ru	https://ura.news/articles/1036290092	За день Этнографический диктант написали более 530 тысяч человек - URA.RU	Проект направлен на привлечение внимания к истории, культуре и традициям народов России	https://s.ura.news/images/news/figures/261/662/e7016548-b5e4-443a-b59c-eb9c1654afa5/kyfepq/L-1200.1.9.jpg	2024-11-02 07:43:00	URA.RU
ru	https://www.golosameriki.com/a/two-injured-russian-drone-attack-kyiv/7848843.html	Россия атаковала Киев беспилотниками в течение нескольких часов - ГОЛОС АМЕРИКИ - VOA Russian	Все беспилотники были сбиты, обломки упали в разных районах города, ранив двух человек	None	2024-11-02 14:56:57	ГОЛОС АМЕРИКИ - VOA Russian
ru	https://www.rbc.ua/ukr/news/rosiya-atakue-kiyiv-dronami-pratsyue-ppo-1730579294.html	Россия атакует Киев дронами: работает ПВО - РБК-Украина	Подробнее читайте на сайте	https://www.rbc.ua/static/img/_/v/_viyskoviy_23_mm_sparena_ustanovka_zu_23_2_protipovitryana_oborona_ppo__vesna_2024_gettyimages_2147853328_e6f45b11375663a08eb79730372ed584_1300x820.jpg	2024-11-02 21:40:16	РБК-Украина
ru	https://72.ru/text/world/2024/11/02/74291978/	«Люди в ужасе»: россиянка рассказала, как живет Испания после разрушительного наводнения. Видео - Новости Тюмени – 72.ru	Там насчитывается более 200 погибших	https://72.ru/html-to-img/image?hash=ZOjWNkAQ3b-OMchgbEPnMQ&ts=1730558694&url=https%3A%2F%2F72.ru%2Fog-image%2Farticle-id5930513%2F&width=1200	2024-11-02 14:43:07	Новости Тюмени – 72.ru
ru	https://www.pravda.com.ua/rus/news/2024/11/2/7482592/	ISW: Солдаты, которых Северная Корея отправила на фронт, это недельная норма потерь России - Украинская правда	Северокорейские войска вряд ли смогут предложить России долгосрочное решение ее проблем с человеческими ресурсами.	https://img.pravda.com/images/doc/7/4/7482592_fb_image_rus_2024_11_02_08_16_05.jpg	2024-11-02 02:36:19	Украинская правда
ru	https://news.ru/moskva/shtormovoe-preduprezhdenie-obyavili-v-moskve/	Штормовое предупреждение объявили в Москве - NEWS.ru	В период с 12:00 до 21:00 2 ноября в Москве местами ожидается усиление северо-западного ветра с порывами до 15–18 м/с, сообщило столичное управление МЧС. В связи с этим по городу объявлено штормовое предупреждение.	https://static.news.ru/photo/a17bd8c8-9907-11ef-9467-02420a0000c9_760.jpg	2024-11-02 10:29:39	NEWS.ru
ru	https://matchtv.ru/football/rpl/matchtvnews_NI2128544_Futbolisty_Spartaka_obygrali_CSKA_v_moskovskom_derbi_s_trema_udalenijami	Футболисты «Спартака» обыграли ЦСКА в московском дерби с тремя удалениями - Матч ТВ	Московский «Спартак» победил столичный ЦСКА в матче 14‑го тура МИР Российской премьер‑лиги (РПЛ).	https://s-cdn.sportbox.ru/images/shares_matchtv/1200x630/article/2128544/f76e72679704961e1d903d8edfe4c2a6.jpg	2024-11-02 19:43:33	Матч ТВ
ru	https://www.unian.net/world/voyna-v-ukraine-kiev-i-moskva-vedut-nepublichnye-peregovory-dlya-obsuzhdeniya-vozmozhnyh-ustupok-12807858.html	Украина и РФ ведут непубличные переговоры для определения возможных уступок, - Die Zeit - УНИАН	О подобных переговорах никому не известно – именно по той причине, что непубличная дипломатия самая успешная, утверждает редактор издания.	https://images.unian.net/photos/2022_03/thumb_files/620_324_1648528725-8133.jpg?1	2024-11-02 21:49:00	УНИАН
ru	https://news.google.com/rss/articles/CCAiC3g1LU83UzFoQkIwmAEB?oc=5	ВСУ устроили ПЕКЛО солдатам РФ. Срочников кинули на погибель. С фронта только вперед ногами - Наки - УНІАН	None	None	2024-11-02 20:00:30	УНІАН
ru	https://klops.ru/other/2024-11-02/307824-v-rossiyu-nachali-postavlyat-slivochnoe-maslo-iz-arabskih-emiratov-i-turtsii	В Россию начали поставлять сливочное масло из Арабских Эмиратов и Турции - КЛОПС - главный новостной сайт Калининграда	Продукт из ОАЭ возят с середины октября	https://3.assets.klops.ru/media/W1siZiIsIjIwMjQvMTEvMDIvYTUyODMxYzQtNTk4OC00MWU1LThjOWQtZGI1MGZiZjc4MDMyX2ZpbGUuanBlZyJdLFsicCIsInRodW1iIiwiMTI4MHg2NzIrMCswIl0sWyJwIiwidGh1bWIiLCIxMjAweDYzMCMiXSxbInAiLCJ0ZXh0IiwiIl0sWyJwIiwiZW5jb2RlIiwianBnIiwiLXN0cmlwIC1pbnRlcmxhY2UgUGxhbmUiXV0/file.jpg?sha=97fb7cc32b16ac5c	2024-11-02 20:07:40	КЛОПС - главный новостной сайт Калининграда
ru	https://tsn.ua/ru/ato/rossiyskaya-armiya-ponesla-rekordnye-poteri-v-oktyabre-o-chem-eto-svidetelstvuet-kovalenko-2692761.html	Российская армия понесла рекордные потери в октябре: о чем это свидетельствует — Коваленко - ТСН	Усиление наступления российской оккупационной армии в октябре 2024 года привело к рекордному количеству потерь у врага за один месяц. Анализ Александра Коваленко читайте ᐅ новости 1+1	https://img.tsn.ua/cached/217/tsn-86026451a4bd5b82b0f7aa9436ae117b/thumbs/1200x630/fa/4d/5eb6a4ac11ffed574c3e89bd64b54dfa.jpeg	2024-11-02 18:00:09	ТСН
ru	https://ura.news/articles/1036290089	Медведев усилит финансирование целей из послания Путина - URA.RU	Какие правки в бюджет предложит партия власти	https://s.ura.news/images/news/figures/773/387/e87605a6-b0f6-46fd-9eb6-f1aa00823b45/8alxyd/L-1200.1.9.jpg	2024-11-01 17:29:00	URA.RU
ru	https://ura.news/news/1052838433	Путин защитит россиян от слежки и провокаций в мессенджерах - URA.RU	Читайте на URA.RU	https://s.ura.news/images/news/figures/636/197/e335d778-23c9-4562-8437-5369891eab3b/arcnvs/L-1200.1.9.jpg	2024-11-02 13:30:00	URA.RU
ru	https://pogoda.mail.ru/news/63477734/	Синоптик Шувалов: в Москве началось арктическое вторжение - Погода Mail.ru	Руководитель прогностического центра «Метео» Александр Шувалов в беседе с RT отметил рекордное количество осадков, выпавших за сутки.	https://resizer.mail.ru/p/8937ca07-c534-5b42-8c7a-21d67659cce6/op:15/logo:bottom:weather.png/AQAGyK2ZvWumGJxlP330eI1ZVn8lKQyD6WrJJh9OKujQg43fQSmrnw5LhWC639Y0loTfBVB6x_ijLsiwvxoWClwc0X8.jpg	2024-11-02 08:16:48	Погода Mail.ru
ru	https://www.dw.com/ru/syrskij-vsu-sderzivaut-odno-iz-mosnejsih-nastuplenij-rossii/a-70669251	Сырский: ВСУ сдерживают одно из мощнейших наступлений России - DW НА РУССКОМ	По словам главкома ВСУ, обстановка на линии фронта остается сложной, для отражения российской агрессии Украине необходимы дополнительные ресурсы.	https://static.dw.com/image/68212226_6.jpg	2024-11-02 19:30:25	DW НА РУССКОМ
ru	https://ura.news/news/1052838361	В каких городах России действует туристический налог. Инфографика - URA.RU	Инфографика	https://s.ura.news/images/news/upload/smm/2024/11/02/facebook_4d168680a557602a601c23bead4a8e4a.jpg	2024-11-02 15:00:00	URA.RU
ru	https://www.fontanka.ru/2024/11/01/74288165/	На Госуслугах заработал механизм регистрации владельцев каналов с 10 000 подписчиков - 1 ноября 2024 - Фонтанка.Ру	None	None	2024-11-01 20:33:00	Фонтанка.Ру
ru	https://news.google.com/rss/articles/CCAiC0J5NGg3ckl1M01ZmAEB?oc=5	Корейцы – это только начало: Китай готовит войска! Россию возьмут голыми руками / ФЕЙГИН - УНІАН	None	None	2024-11-02 07:00:05	УНІАН
ru	https://ura.news/news/1052838384	Картинки с Днем народного единства: лучшие поздравления для ваших близких - URA.RU	Читайте на URA.RU	https://s.ura.news/images/news/figures/228/567/4a793182-ef02-4e22-9182-791e36756aaf/xneddj/L-1200.1.9.jpg	2024-11-02 12:01:00	URA.RU
ru	https://www.moscowtimes.ru/2024/11/02/v-rossii-v-oktyabre-zafiksirovan-rekord-prodazhi-avtomobilei-a146698	В России в октябре зафиксирован рекорд продажи автомобилей - Русская служба The Moscow Times		https://static.moscowtimes.ru/image/og/06/146698__0606a2c84610e9624998bf1cc78f4a03.jpg	2024-11-02 13:49:32	Русская служба The Moscow Times
ru	https://www.fontanka.ru/2024/11/02/74292191/	WSJ: удар Израиля уничтожил стратегическую ПВО Тегерана и сделал Иран уязвимым - Фонтанка.Ру	None	None	2024-11-02 17:54:00	Фонтанка.Ру
ru	https://www.vedomosti.ru/finance/articles/2024/11/02/1072704-tsb-ostavil-spisok	ЦБ оставил список системно значимых банков без изменений - Ведомости	Ранее аналитики предполагали исключение из перечня Росбанка, «ФК Открытие» и Райффайзенбанка	https://sharing.vedomosti.ru/1730562772/vedomosti.ru/finance/articles/2024/11/02/1072704-tsb-ostavil-spisok.jpg	2024-11-02 14:04:18	Ведомости
ru	https://www.fontanka.ru/2024/11/02/74292266/	Ушедшая из ЦБ Ксения Юдаева избрана исполнительным директором МВФ - Фонтанка.Ру	None	None	2024-11-02 19:26:00	Фонтанка.Ру
ru	https://kubnews.ru/obshchestvo/2024/11/02/tsiklon-martina-nagryanet-v-krasnodarskiy-kray-chto-budet-s-pogodoy/	Циклон «Мартина» нагрянет в Краснодарский край. Что будет с погодой - Кубанские Новости	Североатлантический циклон «Мартина» окажет влияние на погоду на Кубани.	https://kubnews.ru/upload/resize_cache/iblock/4e0/1200_630_text_2/81s0vkhsp9dzxqprpmstseug120r8f7w.jpg.png	2024-11-02 05:55:00	Кубанские Новости
ru	https://www.interfax.ru/business/989944	Акционеры Росбанка и ТБанка приняли решение об объединении кредитных организаций - Интерфакс	Акционеры Росбанка и ТБанка (ранее – Тинькофф банк) приняли решение об объединении двух кредитных организаций, говорится в сообщениях банков.	https://www.interfax.ru/aspimg/989944.jpg	2024-11-02 13:26:00	Интерфакс
ru	https://pg21.ru/news/101796	Центр Чебоксар перекроют в понедельник для всего транспорта - Pro Город Чебоксары	В понедельник в Чебоксарах пройдет крестный ход. В связи с этим будет ограничено движение для всех видов транспорта в центре города. Соответствующее постановление подписал глава Чебоксар Владимир Доброхотов, как сообщают в пресс-службе органов власти.	/userfiles/picfullsize/image-1730529091_872.jpg	2024-11-02 06:33:41	Pro Город Чебоксары
ru	https://novosti.dn.ua/ru/news/383943-rf-obstrelyala-dnepr-na-meste-prileta-vspyhnul-pozhar	РФ обстреляла Днепр: на месте «прилета» вспыхнул пожар - НОВОСТИ.dn.ua	В пятницу, 1 ноября, российская армия атаковала Днепр. - 01 ноября 2024	https://novosti.dn.ua/upload/share/news/2024/11/01/cover_383943.png	2024-11-01 11:49:00	НОВОСТИ.dn.ua
ru	https://47news.ru/articles/259936/	Стало известно, как надолго задержится снег в Петербурге и Ленобласти - 47 новостей из Ленинградской области	Синоптик Александр Колесов спрогнозировал, какой будет следующая неделя.	https://i.47news.ru//titles/2024/11/20241102_f0l2qmga2prstg6j9bas.jpg	2024-11-02 12:04:00	47 новостей из Ленинградской области
ru	https://www.vedomosti.ru/politics/news/2024/11/02/1072709-zaharova-nazvala-performansom	Захарова назвала политическим перформансом заявление МИД Украины о военнопленных - Ведомости	По ее словам, РФ предлагала передать в рамках обменов 935 человек, но Киев забрал лишь 279	https://sharing.vedomosti.ru/1730562097/vedomosti.ru/politics/news/2024/11/02/1072709-zaharova-nazvala-performansom.jpg	2024-11-02 14:44:46	Ведомости
ru	https://www.interfax.ru/world/989953	Опрос показал преимущество Харрис перед Трампом в три процентных пункта - Интерфакс	Вице-президент США демократ Камала Харрис на три процентных пункта обгоняет по электоральному рейтингу экс-президента республиканца Дональда Трампа, пишет The Hill со ссылкой на опрос, проведенный социологической службой YouGov.	https://www.interfax.ru/aspimg/989953.png	2024-11-02 14:08:00	Интерфакс
ru	https://news.google.com/rss/articles/CBMiWEFVX3lxTE5sT1BHVDVUWHl5c2swdDZhYkFVVE01VFplQTI0WmVFT2NhMV9tYVhqSDZ6ODdZTzdEZVRvLTF5cnEyOTRsNTVDWXFaWDZUWTE1bjN0VmhnV3I?oc=5	«Ночь искусств», День народного единства и джазовый фестиваль: анонсы событий во Владивостоке на воскресенье и понедельник - Новости Владивостока и Приморского края	None	None	2024-11-02 06:05:00	Новости Владивостока и Приморского края
ru	https://ura.news/news/1052838289	Путин выразил соболезнования из-за трагедии в Сербии - URA.RU	Читайте на URA.RU	https://s.ura.news/images/news/upload/smm/2024/11/02/facebook_64423127588e059d1ed5b9edb9f4f2ac.jpg	2024-11-02 08:36:00	URA.RU
ru	https://meduza.io/news/2024/11/02/eltsin-tsentr-otmenil-lektsii-pisatelya-i-publitsista-aleksandra-arhangelskogo-posle-togo-kak-minyust-ob-yavil-ego-inoagentom	«Ельцин-центр» отменил лекции писателя и публициста Александра Архангельского. После того, как Минюст объявил его «иноагентом» - Meduza	«Ельцин-центр» в Екатеринбурге объявил, что отменил цикл лекций писателя и публициста Александра Архангельского, который планировали начать 7 ноября. Сообщение об этом появилось в соцсетях организации 2 ноября.	https://meduza.io/imgly/share/1730547134/news/2024/11/02/eltsin-tsentr-otmenil-lektsii-pisatelya-i-publitsista-aleksandra-arhangelskogo-posle-togo-kak-minyust-ob-yavil-ego-inoagentom	2024-11-02 11:20:00	Meduza
ru	https://www.vedomosti.ru/politics/articles/2024/11/02/1072661-chto-izvestno	Что известно о боях в Курской области на 2 ноября - Ведомости	ВС РФ отразили четыре контратаки, семь военных ВСУ сдались в плен	https://sharing.vedomosti.ru/1730550076/vedomosti.ru/politics/articles/2024/11/02/1072661-chto-izvestno.jpg	2024-11-02 11:56:46	Ведомости
ru	https://www.dw.com/ru/rossia-gotova-otmenit-posliny-na-vvoz-slivocnogo-masla-iz-druzestvennyh-stran/a-70668106	Россия готова отменить пошлины на ввоз сливочного масла - DW НА РУССКОМ	На фоне резкого подорожания сливочного масла Россия может временно отменить пошлины на его импорт из "дружественных" стран, пишут "Известия". Продукция из Беларуси и Кыргызстана уже не облагается налогом.	https://static.dw.com/image/56899587_6.jpg	2024-11-02 12:19:46	DW НА РУССКОМ
ru	https://rtvi.com/news/ssha-otpravlyayut-esminczy-istrebiteli-i-bombardirovshhiki-na-blizhnij-vostok/	США отправляют эсминцы, истребители и бомбардировщики на Ближний Восток - RTVI	В Минобороны пояснили, что такие демонстрируют гибкий характер глобальной оборонной позиции американской армии и способность США развертываться по всему миру в кратчайшие сроки для реагирования на меняющиеся угрозы национальной безопасности.	https://rtvi.com/wp-content/uploads/2024/11/399528-1.jpg?081248	2024-11-02 05:12:48	RTVI
ru	https://m.business-gazeta.ru/news/653124	В Татарстане главу компании заподозрили в неуплате налогов на 67 миллионов рублей - БИЗНЕС Online	None		2024-11-02 11:39:00	БИЗНЕС Online
ru	https://ktv-ray.ru/novost/zachem_banki_pylesosyat_dengi_rossiyan_chto_budet_s_vkladami_kogda_pridet_chernyy_den/152381/	Зачем банки «пылесосят» деньги россиян: что будет с вкладами, когда придет черный день - КТВ Луч, Сызрань	Величина денежных вкладов населения может достичь рекорда. 	https://ktv-ray.ru/pic/upld_34488.png	2024-11-01 17:29:00	КТВ Луч, Сызрань