country_code	url	title	description	image_url	publish_date	source
ru	https://news.google.com/rss/articles/CBMiU0FVX3lxTE1VbEhTcm1fbGJwQUJvT0FxaUl0TzBmZkxlNS00cG9yOEZ6XzVSazF0M25TU0VnQk5ha3dhTTVEWTBfRVlPemRMVy1qWnRrOHdmcF9V?oc=5	Собянин принял решение о комплексном развитии 6 участков в разных районах Москвы - Официальный сайт Мэра Москвы	None	None	2024-11-08 04:02:00	Официальный сайт Мэра Москвы
ru	https://news.google.com/rss/articles/CBMidEFVX3lxTE5peE1OVkNuVVBHbDFKbTJjc3NUQ0Jnb0dicUFvZS1va05hQnAzbnhWUTYtYlFHMDdkb0ZWM0ZWZEZKRUloUVhQX1E5c05Sc0xTajhXTFktS2ItUGpuWUVZa1NkelBuNW5LcEdvSUtSby1Lb2ps0gF_QVVfeXFMT0hZMFRSU1hpaUdaMXlfVFBVZGc1a1VWRWxKdDJwLTZnR2tRdGJ5VURuUlJWdFNvakphOG5kWTlpM0R5SWM2cjZoTnJxV0dweHJjRzZCQzk1MUo3LVhyTVpqLWo4eVJqRFE5a3V4bk41Q0l3cGxFQVZjY1NQNVJPVQ?oc=5	Ждём перемен: эйфория российских инвесторов после победы Трампа быстро погасла - Деловой Петербург	None	None	2024-11-08 04:48:00	Деловой Петербург
ru	https://www.dvnovosti.ru/khab/2024/11/08/174654/	ХМТ опубликовал проекты нового здания (ОПРОС) - Новости на DVhab.ru	None	None	2024-11-08 06:18:15	Новости на DVhab.ru
ru	https://news.google.com/rss/articles/CCAiC3l5U1JES2VlV09vmAEB?oc=5	У Путина КАТАСТРОФА! Наступление КНДР и РФ под Курском разгромили: потери шокируют. Трамп ликует - УНІАН	None	None	2024-11-08 12:01:18	УНІАН
ru	https://www.interfax.ru/business/990783	Новак отметил снижение инвестиционной активности в РФ на фоне высокой ставки ЦБ - Интерфакс	Высокая ключевая ставка уже приводит к некоторому замедлению инвестиционной активности в РФ, заявил вице-премьер Александр Новак, выступая в пятницу на Русском экономическом форуме в Челябинске.	https://www.interfax.ru/aspimg/990783.jpg	2024-11-08 09:54:00	Интерфакс
ru	https://www.t24.su/sotrudnikov-politsii-torzhestvenno-pozdravili-v-tayshete/	Сотрудников полиции торжественно поздравили в Тайшете - http://www.t24.su/	Тайшет24	https://www.t24.su/wp-content/uploads/2024/11/img_2658-1.jpg	2024-11-08 15:02:41	http://www.t24.su/
ru	https://news.ru/russia/ubirajtes-iz-rf-begite-vlasti-obyavili-migrantam-vojnu-na-vyzhivanie/	«Диаспоры, убирайтесь из РФ»: власти объявили мигрантам войну на выживание - NEWS.ru	Мигранты должны уважать законы и знать русский язык, чтобы рассчитывать на нормальные условия для проживания, заявил президент России Владимир Путин. Что еще сказал глава государства о будущем иностранных граждан в РФ?	https://static.news.ru/photo/41d8dd8e-9dbd-11ef-9e5d-02420a0000c9_760.jpg	2024-11-08 11:00:51	NEWS.ru
ru	https://www.svoboda.org/a/berlin-wall-then-and-now-photos-2024-cold-war-legacy/33194925.html	Где стояла стена. Разделенный Берлин на фотографиях тогда и сейчас - Радио Свобода 	None	None	2024-11-08 12:44:51	Радио Свобода 
ru	https://www.interfax.ru/business/990819	Новак назвал условие для возобновления экспорта Аи-92 - Интерфакс	Минэнерго скоро представит предложение о возможности отмены запрета на экспорт бензина, но только Аи-92 и при подтверждении затоваривания им отечественных НПЗ, сообщил журналистам вице-премьер Александр Новак.	https://www.interfax.ru/aspimg/990819.jpg	2024-11-08 12:37:00	Интерфакс
ru	https://news.google.com/rss/articles/CBMiakFVX3lxTFB2azA2X3BXcThZMm9jdlRreGJkeG41NGcwQ2EwQWpCVVJpT0Mya2xqMFZrR2ZnSzNiZEx3VjlYS3hmTDBlZnJjeXVodU16U0ZWWlM2R1JlVS04anBkMGFINWczbU0zUXVaR0HSAXRBVV95cUxOVkJGWDZTdUJ6enlTN1QzWDhlSWg2OEJDcTBFYUI3dkl3WFRhVUVDeXd4cDhfVzFyY1ZJUnEtcnJVMDhkT1hCNXlnb1R2OWMwcDN1c3EzWFJheUd2eThDb3FTRTlrVXgwRWlsZ3kzaFZOZ1puTg?oc=5	Ипотечный кризис нипочём: в Петербурге неожиданно выросли продажи новых квартир - Деловой Петербург	None	None	2024-11-08 05:06:00	Деловой Петербург
ru	https://tverigrad.ru/publication/chto-i-sledovalo-ozhidat-virus-koksaki-prishel-v-tverskuju-oblast/	Что и следовало ожидать: вирус Коксаки пришел в Тверскую область - Твериград	None	None	2024-11-08 06:27:49	Твериград
ru	https://74.ru/text/transport/2024/11/08/74310944/	В правительстве назвали сроки запуска производства электробусов в Челябинске - Новости Челябинска – 74.ru	Заявление сделали во время визита на завод «Синары» Александра Новака	https://74.ru/html-to-img/image?hash=2MilEmgQ6-KGpipGr3fEIA&ts=1731059501&url=https%3A%2F%2F74.ru%2Fog-image%2Farticle-id5937686%2F&width=1200	2024-11-08 09:26:00	Новости Челябинска – 74.ru
ru	https://sarnovosti.ru/news/v-spetsoperatsii-pogibli-shestero-saratovtsev/	В спецоперации погибли шестеро саратовцев - Регион64	None	None	2024-11-08 13:54:00	Регион64
ru	https://www.vzsar.ru/news/2024/11/08/dom-zatryassya-ataka-bpla-na-promzony-saratova-v-rasskazah-jiteley.html	"Дом затрясся!". Атака БПЛА на промзону Саратова в рассказах жителей - Взгляд-инфо	После сегодняшней атаки БПЛА жители дома в Заводском районе Саратова 	https://www.vzsar.ru/i/news/social/266997_1731055001.jpg	2024-11-08 08:39:00	Взгляд-инфо
ru	https://news.google.com/rss/articles/CBMiU0FVX3lxTE1vUlB6MVBEYlhNakRKLU53OENnN0tGX2J0OF9WQS1ReDFZLTJrSU5QMmlJSGxXLXlDZ3lyNmZ5Qm1rUFVNRXBSa0NLSzg0R0pRTmdR?oc=5	В Москве завершается создание трех важных транспортных объектов — Собянин - Официальный сайт Мэра Москвы	None	None	2024-11-08 13:36:01	Официальный сайт Мэра Москвы
ru	https://www.vzsar.ru/news/2024/11/08/gybernator-ostanovil-stroitelstvo-jk-v-saratove.html	Губернатор остановил строительство ЖК в Саратове - Взгляд-инфо	В Заводском районе Саратова принято решение о приостановке разрешения	https://www.vzsar.ru/i/news/social/266994_1731051733.jpg	2024-11-08 07:43:00	Взгляд-инфо
ru	https://news.google.com/rss/articles/CBMiU0FVX3lxTE0taWsxeWpYYmctWHFJMmx6aXBxaEdTMTlMRWQ4WnluTWRFb1hUM3RwV1RERXlHWlUweE0zVlpvTWY2cy0tSlFJb1pVVm9sWV8xUmRz?oc=5	Мэр Москвы открыл новое здание ОВД по Тверскому району / Новости города / Сайт Москвы - Официальный сайт Мэра Москвы	None	None	2024-11-08 10:12:00	Официальный сайт Мэра Москвы
ru	https://klops.ru/kaliningrad/2024-11-08/308221-dyatlova-rasskazala-kak-spetsialno-zavela-gubernatora-na-ulitsu-bez-trotuarov	Дятлова рассказала, как специально завела губернатора на улицу без тротуаров - КЛОПС - главный новостной сайт Калининграда	Пешеходных тропинок не было там исторически	https://3.assets.klops.ru/media/W1siZiIsIjIwMjQvMTEvMDgvMGU3M2RlMDMtMWIwNi00YTFkLThiYzEtZTBhZWUyNTZjNDg3X2ZpbGUuanBlZyJdLFsicCIsInRodW1iIiwiMTI4MHg2NzIrMCsyNSJdLFsicCIsInRodW1iIiwiMTIwMHg2MzAjIl0sWyJwIiwidGV4dCIsIiJdLFsicCIsImxvZ28iXSxbInAiLCJlbmNvZGUiLCJqcGciLCItc3RyaXAgLWludGVybGFjZSBQbGFuZSJdXQ/file.jpg?sha=99fdeadda0ff71da	2024-11-08 16:42:44	КЛОПС - главный новостной сайт Калининграда
ru	https://www.pravda.com.ua/rus/news/2024/11/8/7483478/	ISW: Влиянием на Трампа Путин хочет перезагрузить отношения РФ и США на своих условиях - Украинская правда	Аналитики Института изучения войны (ISW) указывают на то, что правитель России Владимир Путин хочет при президентстве Дональда Трампа перезагрузить российско-американские отношения на своих условиях.	https://img.pravda.com/images/doc/7/4/7483478_fb_image_rus_2024_11_08_08_16_32.jpg	2024-11-08 04:22:44	Украинская правда
ru	https://www.fontanka.ru/2024/11/08/74316143/	Axios: Илон Маск участвовал в телефонном разговоре Трампа с Зеленским - Фонтанка.Ру	None	None	2024-11-08 18:32:00	Фонтанка.Ру
ru	https://meduza.io/news/2024/11/07/voyska-rf-nanesli-massirovannyy-aviaudar-po-zaporozhyu-odin-chelovek-pogib-18-raneny-povrezhdeny-zhilye-doma-i-bolnitsa	Войска РФ нанесли массированный авиаудар по Запорожью. Четыре человека погибли, 40 ранены. Повреждены жилые дома и больница - Meduza	Российские военные нанесли пять авиационных ударов по Запорожью, сообщил глава администрации Запорожской области Иван Федоров. По его словам, войска РФ нанесли удар по городу ракетами и корректируемыми авиационными бомбами.	https://meduza.io/imgly/share/1731070113/news/2024/11/07/voyska-rf-nanesli-massirovannyy-aviaudar-po-zaporozhyu-odin-chelovek-pogib-18-raneny-povrezhdeny-zhilye-doma-i-bolnitsa	2024-11-07 15:12:00	Meduza
ru	https://eadaily.com/ru/news/2024/11/08/v-belom-dome-razocharovany-itogami-prezidentskih-vyborov-v-ssha	В Белом доме разочарованы итогами президентских выборов в США - EADaily	EADaily, 8 ноября 2024. Пресс-секретарь Белого дома Карин Жан-Пьер в среду признала, что администрация президента США Джо Байдена разочарована результатом выборов главы государства, где победил Дональд Трамп.	https://img4.eadaily.com/r650x400/o/b16/d7aae71a2312ee645ff7419eb33e5.jpeg	2024-11-08 00:30:00	EADaily
ru	https://www.bfm.ru/news/561592	Орбан: Европа не сможет финансировать Украину без США - BFM.RU	None	None	2024-11-08 10:39:45	BFM.RU
ru	https://www.dialog.ua/ukraine/304486_1731048786	Ночная атака РФ на Киев и область: есть раненые и разрушения – КВОА - Диалог.UA - Всегда два мнения	В результате ночной атаки на Киевщину пострадали четверо человек, повреждены дома и автомобили, вспыхнул пожар на заброшенной АЗС.
	https://www.dialog.ua/images/news/4736168a38d9c7ffbc8b6fe22d9fd4e6.jpg	2024-11-08 06:59:06	Диалог.UA - Всегда два мнения
ru	https://www.fontanka.ru/2024/11/08/74315834/	На Камчатке извергается вулкан Шивелуч. Кадры из космоса - Фонтанка.Ру	None	None	2024-11-08 17:27:00	Фонтанка.Ру
ru	https://www.unian.net/war/voyna-v-ukraine-rf-massirovanno-atakovala-odesskuyu-oblast-dronami-novosti-odessy-12813060.html	Россия атаковала Одесскую область дронами: есть пострадавшие, повреждена одна из старейших школ Одессы - УНИАН	Власти сообщают двух раненых людях.	https://images.unian.net/photos/2024_11/thumb_files/1000_545_1731022303-5158.jpeg?1	2024-11-07 23:47:00	УНИАН
ru	https://ura.news/news/1052840755	США дали послабления для некоторых банков России - URA.RU	Читайте на URA.RU	https://s.ura.news/images/news/upload/smm/2024/11/08/facebook_29856d852d7cf78d426039e9e0858b64.jpg	2024-11-08 07:57:00	URA.RU
ru	https://www.vedomosti.ru/society/articles/2024/11/08/1073892-minyust-obyavil-inoagentom	Минюст объявил иноагентами комика Дениса Чужого и издание «Говорит НеМосква» - Ведомости	В реестр также попал журналист Дмитрий Трещанин	https://sharing.vedomosti.ru/1731076415/vedomosti.ru/society/articles/2024/11/08/1073892-minyust-obyavil-inoagentom.jpg	2024-11-08 14:07:57	Ведомости
ru	https://rtvi.com/news/proigrala-bolshe-vseh-chto-zhdet-ukrainu-pri-trampe/	«Проиграла больше всех»: что ждет Украину при Трампе - RTVI	С возвращением Дональда Трампа на пост президента США наиболее важные изменения произойдут во внешней политике и в характере международного порядка, считает политолог и философ Фрэнсис Фукуяма.	https://rtvi.com/wp-content/uploads/2024/11/401502-1.jpg?174211	2024-11-08 13:10:35	RTVI
ru	https://myslo.ru/news/tula/2024-11-06-ipotechnyj-rynok-ruhnul-zhdat-li-snizheniya-stavok-i-cen-na-kvartiry-v-tule	Ипотечный рынок рухнул: ждать ли снижения ставок и цен на квартиры в Туле? - Моя Слобода	Что происходит на рынке жилищного кредитования – в аналитике Myslo.	https://cdn.myslo.ru/Content/ImageGenerator/04/42/0442889f-4eb9-40df-bc5a-60742f26dad8.png	2024-11-07 13:51:00	Моя Слобода
ru	https://news.google.com/rss/articles/CCAiCzFVN1BkTHppSGNzmAEB?oc=5	Наступление КНДР под Курском! ВСУ жахнули генерала РФ. Взорвали Каспийск. Ахинея Путина | Наки - УНІАН	None	None	2024-11-08 17:30:00	УНІАН
ru	https://www.rbc.ua/ukr/news/viyskovi-rf-ta-pivnichnoyi-koreyi-pishli-1731061335.html	Военные РФ и Северной Кореи пошли в наступление в Курской области. Forbes узнало детали - РБК-Украина	Подробнее читайте на сайте	https://www.rbc.ua/static/img/k/i/kirill_chubotin__ukrinformfuture_publishing_via__gettyimages_2166714953_ece5c52ab9618db97ecf8683244aa66e_1300x820.jpg	2024-11-08 10:35:15	РБК-Украина
ru	https://gordonua.com/news/military-actions/rf-nachala-massovo-ispolzovat-termobaricheskuju-boevuju-chast-v-shahed-dve-steny-mohut-ne-spasti-smi-1723936.html	РФ начала массово использовать термобарическую боевую часть в Shahed, "две стены" могут не... - ГОРДОН	Российские оккупанты начали массово использовать на дронах типа Shahed термобарическую боевую часть (ТБ БЧ-50 весом...	https://gordonua.com/img/article/17239/36_big-v1731021778.jpg	2024-11-07 23:22:00	ГОРДОН
ru	https://72.ru/text/world/2024/11/08/74310029/	Опять работать заставляют: россиян ждет последняя шестидневка в 2024 году - Новости Тюмени – 72.ru	После нее почти всей стране положен отпуск	https://72.ru/html-to-img/image?hash=k3mxprSS2ZCUKcdjZnp-jg&ts=1731069288&url=https%3A%2F%2F72.ru%2Fog-image%2Farticle-id5937343%2F&width=1200	2024-11-08 05:59:00	Новости Тюмени – 72.ru
ru	https://meduza.io/news/2024/11/07/tass-byvshiy-glava-komi-vladimir-uyba-poluchil-dolzhnost-v-minoborony	ТАСС: бывший глава Коми Владимир Уйба получил должность в Минобороны - Meduza	Глава Коми Владимир Уйба, объявивший о своей отставке 5 ноября, назначен первым заместителем начальника Главного военно-медицинского управления Минобороны России, пишет ТАСС со ссылкой на пресс-службу Уйбы.	https://meduza.io/imgly/share/1730965665/news/2024/11/07/tass-byvshiy-glava-komi-vladimir-uyba-poluchil-dolzhnost-v-minoborony	2024-11-07 07:47:00	Meduza
ru	https://meduza.io/feature/2024/11/07/posle-pobedy-trampa-na-vyborah-smi-po-vsemu-miru-vyshli-s-ego-foto-na-pervyh-polosah-vot-lish-nekotorye-iz-oblozhek-amerikanskih-gazet-i-zhurnalov	Возвращение Трампа в Белый дом — новость номер один для большинства изданий по всему миру. И повод для того, чтобы сделать красивую (или пугающую) обложку - Meduza	Дональд Трамп 5 ноября победил на выборах президента США. Он стал вторым за 120 лет президентом США, которому удастся вернуться в Белый дом, проиграв выборы после первого срока. Победа Трампа — главная новость для СМИ по всему миру и тем более для американской прессы. Вот лишь некоторые из обложек газет и журналов, выходящих в США. Глядя на них, кажется, можно догадаться о политических предпочтениях редакций.	https://meduza.io/imgly/share/1730998850/feature/2024/11/07/posle-pobedy-trampa-na-vyborah-smi-po-vsemu-miru-vyshli-s-ego-foto-na-pervyh-polosah-vot-lish-nekotorye-iz-oblozhek-amerikanskih-gazet-i-zhurnalov	2024-11-07 13:06:00	Meduza
ru	https://ura.news/news/1052840608	Границы Украины, военные учения с КНДР, единая валюта БРИКС: острые ответы Путина с форума «Валдай» - URA.RU	Читайте на URA.RU	https://s.ura.news/images/news/figures/566/758/b83ead71-f50d-4b48-8e34-e07eb6fea436/rgfgpk/L-1200.1.9.jpg	2024-11-07 23:40:00	URA.RU
ru	https://ura.news/news/1052840838	Новак: ключевая ставка ЦБ уже работает - URA.RU	Читайте на URA.RU	https://s.ura.news/images/news/figures/758/588/4ebffd46-06cf-48ce-9d27-d44f23a2b509/k3qxnm/L-1200.1.9.jpg	2024-11-08 10:11:00	URA.RU
ru	https://www.interfax.ru/world/990763	В Амстердаме произошло нападение на израильских футбольных фанатов - Интерфакс	Болельщики израильского футбольного клуба "Маккаби" подверглись нападению в Амстердаме в ночь на пятницу после матча с "Аяксом", который прошел в рамках 4-го тура общего раунда Лиги Европы.	https://www.interfax.ru/aspimg/990763.jpg	2024-11-08 07:38:00	Интерфакс
ru	https://news.google.com/rss/articles/CBMioAFBVV95cUxOdmx0VzF3RER3aXI4ZlNnazV3LUJKVGlndjJ5c2F1WlFOMG93ZV9xZFhwYndtVklIQlVDNFEtUVhWRW15ZXZTNU5VSlBQeGhPRjhFcFJaOG9sUnlDVVFDS0doNFoxQTRWZUJnVkpFVE53cWR5bmJ0eHF6bUFGQUVMcEVPRkFHVHlWVVlIcDFEUElqMWVwX2FCQ3BXUklwX1pY?oc=5	Власти и бизнес обсудили альтернативные способы снижения инфляции - Ведомости	В этом могут помочь расширение предложения и цифровой рубль, считают участники дискуссии	https://sharing.vedomosti.ru/1731091667/vedomosti.ru/economics/articles/2024/11/08/1073941-vlasti-biznes-obsudili-alternativnie.jpg	2024-11-08 18:34:35	Ведомости
ru	https://www.dp.ru/a/2024/11/08/stroitelstvo-vtoroj-ocheredi	Строительство второй очереди ШМСД в Петербурге начнётся до конца 2024 года - Деловой Петербург	Работы по строительству второго этапа Широтной магистрали скоростного движения (ШМСД) в Петербурге...	https://dpru.obs.ru-moscow-1.hc.sbercloud.ru/images/article/2024/11/08/72783cd3-eeb6-4183-b20e-872736b970f0.jpg	2024-11-08 15:13:00	Деловой Петербург
ru	https://www.dw.com/ru/zelenskij-otverg-peremirie-s-rossiej-bez-garantij-bezopasnosti/a-70731731	Зеленский отверг перемирие с РФ без гарантий безопасности - DW НА РУССКОМ	Президент Украины назвал абсурдом отказывать его стране во вступлении в НАТО и при этом требовать прекращения огня. При этом Зеленский выразил мнение, что Трамп действительно желает скорейшего мира в Украине. 	https://static.dw.com/image/70726124_6.jpg	2024-11-08 07:52:32	DW НА РУССКОМ
ru	https://news.google.com/rss/articles/CBMiREFVX3lxTE5yakN6cU1LUGRPUzMtQTVlQ0lXcjF3MzFWQWZEYjJ6NmhpNW9NalRtWU9DdjRYVE54OExCQkhfYTQtTE1t0gFKQVVfeXFMUDVjZ2hYclNWd08taXVwY2hvd285X2RoOXhneDN4d2VPOXJ1RUNteldnZmR3WkZDaVNSTGtGZU0tXzVmXzFqanVlQnc?oc=5	Маск назвал Шольца глупцом из-за распада правящей коалиции ФРГ - BFM.RU	None	None	2024-11-08 00:40:51	BFM.RU
ru	https://ktv-ray.ru/novost/obshaya_summa_-_45_mln_rubley_v_samarskoy_oblasti_sotni_lyudey_razom_podpisali_kontrakty_s_minoborony/152792/	Общая сумма - 4,5 млн рублей: в Самарской области сотни людей разом подписали контракты с Минобороны - КТВ Луч, Сызрань	Граждан, заключивших контракты с Минобороны, обеспечивают всем необходимым. 	https://ktv-ray.ru/pic/upld_34940.png	2024-11-08 15:30:07	КТВ Луч, Сызрань
ru	https://vtomske.ru/news/207421-pravitelstvo-utverdilo-novye-normy-potrebleniya-elektrichestva-plateji-za-svet-vyrastut	Правительство утвердило новые нормы потребления электричества. Платежи за свет вырастут? - vtomske.ru — Томск	Что случилось? Правительство России утвердило пороговые значения диапазонов дифференцированных тарифов на электроэнергию. Они начнут действовать с января 2025 года. Новые диапазоны значительно...	https://dn1.vtomske.ru/a/4f/f2/4ff23a56fc82f413c05362b679f81364_sh6face14d.jpg	2024-11-08 09:45:00	vtomske.ru — Томск
ru	https://news.google.com/rss/articles/CBMi4wFBVV95cUxONGwyVVZmanVtdVRzUXcxUWF2YmFYNktmR1RxSnQ1eVBaaTM4cGFzU2hRelBtWXVJMi1HX0NTNVpBcW45bkdiREZGSXVzNkF4VTRSX0llc0VEbkhod1l0QWhVaFY1aG9vUlFrQ0NvaldDTE5lXzU3ZEFyQ1dURTZTVTIyWUtIR2hVTXFESG0tNlBsMFk2alJYUzdib2RQOUdzZ0JNZjBoRlJ3dE1SZDhaMWI0TjVYdUVFUmpNVHViSm1wU2FGQzREbXFSeFJfeExmalZOc1o1U2pXTDhjNENrdkpNa9IB6AFBVV95cUxPQm9jY1RLeHVCdUlWMHZzWVotV0pRYXZWUHE1NGd3bWpuSDZ6ekxpZFJCZjNOZTNUeE5mbkM0QTJQU3Rpc05aT1FCYWNTQnRJR0xveUZsZkZON3Zwbm9RbHFEQXl0VVdCZ1ZUMF9EcnBmdW1CX3hTVUxmTnkzbXFtRkZsYml5YWxuaEVXak5aVnppcUN0RFhWbTBrOVBPWk14d2xUR2pYbGVJZFU0Z1RpNFNVVG5neFEwdnA5WkNiRkFvdHROYjl4Z0dRZnVSc2RrQ1FURU0wM3ZMNDZmSnowX3hGaGFiUWFp?oc=5	Кремль: готовность Путина обсуждать с Трампом завершение российско-украинской войны не означает изменение целей СВО - Meduza	Заявление Владимира Путина о готовности обсуждать с избранным президентом США Дональдом Трампом завершение российско-украинской войны не означает корректировки целей «специальной военной операции», заявил пресс-секретарь президента РФ Дмитрий Песков.	None	2024-11-08 10:57:00	Meduza
