country_code	url	title	description	image_url	publish_date	source
ru	https://www.fontanka.ru/2024/10/31/74277212/	«Произошел бы взрывной рост кредитования». Набиуллина объяснила, почему ЦБ рекордно повысил ключевую ставку - Фонтанка.Ру	None	None	2024-10-31 07:29:00	Фонтанка.Ру
ru	https://www.pravda.com.ua/rus/news/2024/10/31/7482187/	Российские войска атакуют беспилотниками: в нескольких областях воздушная тревога - Украинская правда	Вечером 30 октября российские войска запустили на территорию Украины ударные беспилотники.	https://img.pravda.com/images/doc/7/4/7482187_fb_image_rus_2024_10_31_05_28_44.jpg	2024-10-30 23:25:25	Украинская правда
ru	https://www.newsvl.ru/vlad/2024/10/31/227526/	Туристический налог во Владивостоке с июля по конец сентября будут платить и все приморцы - Новости Владивостока и Приморского края	Новости Владивостока: В четверг, 31 октября, депутаты Думы Владивостока утвердили новый туристический налог в размере 1%, но не менее 100 рублей в день, который опосредованно будут платить приезжие, а направлять в городскую казну – гостиницы и хостелы. Однако, в отличие от Камчатки, где налог касается только приезжих, в нашем городе правовой акт прописали так, что сбор будет действовать и для всех приморцев, и даже для жителей Владивостока. По крайней мере, пока.	https://static.vl.ru/news/1730350997256_default	2024-10-31 05:00:00	Новости Владивостока и Приморского края
ru	https://bcs-express.ru/novosti-i-analitika/prognozy-i-kommentarii-indeks-mosbirzhi-pritselivaetsia-k-minimumam	Прогнозы и комментарии. Индекс МосБиржи прицеливается к минимумам - БКС Экспресс	None	None	2024-10-31 06:26:29	БКС Экспресс
ru	https://gorod48.ru/news/1963246/	К камню-памятнику жертвам политических репрессий липчане с утра несут цветы - Gorod48	None	None	2024-10-30 11:04:38	Gorod48
ru	https://www.unian.net/war/poteri-rf-na-31-oktyabrya-2024-goda-skolko-rossiyan-zakopali-voiny-12804984.html	ВСУ "закопали" кучу россиян с техникой: Генштаб обновил потери врага - УНИАН	В частности, уничтожено 19 вражеских танков, 17 ББМ, 38 артсистем и 84 БПЛА.	https://images.unian.net/photos/2024_10/thumb_files/1000_545_1730356354-6133.jpg?1	2024-10-31 06:38:00	УНИАН
ru	https://sarnovosti.ru/news/saratovtsy-iz-za-vykhodnykh-v-noyabre-poluchat-posobiya-i-pensii-po-novomu-grafiku/	Саратовцы из-за выходных в ноябре получат пособия и пенсии по новому графику - Регион64	None	None	2024-10-31 13:31:00	Регион64
ru	https://www.bankfax.ru/povestka/159818/	Губернатор рассказал Владимиру Путину о развитии сел в Алтайском крае - ИА "Банкфакс"	30 октября глава Алтайского края Виктор Томенко выступил с докладом о развитии сельских территорий на совещании президента РФ Владимира...	https://www.bankfax.ru/files/preview/news/159818.jpg?t=1730369017	2024-10-31 06:45:00	ИА "Банкфакс"
ru	https://rtvi.com/news/patriarh-kirill-upomyanul-poklonskuyu-osuzhdaya-yazychestvo-i-hellouin/	Патриарх Кирилл упомянул Поклонскую, осуждая язычество и Хэллоуин - RTVI	Патриарх Московский и всея Руси Кирилл в ходе выступления на заседании бюро президиума Всемирного русского народного собора коснулся темы празднования Хэллоуина, который некоторые российские регионы переименовали в Велесову ночь. Патриарх обратил внимание на "весьма странное явление" - попытки возродить язычество, упомянув, при этом, бывшего депутата Госдумы и экс-прокурора Крыма Наталью Поклонскую. 	https://rtvi.com/wp-content/uploads/2024/10/399004-1.jpg?213925	2024-10-31 16:22:48	RTVI
ru	https://klops.ru/other/2024-10-31/307631-utrom-dengi-vecherom-stulya-ozon-s-1-noyabrya-uberyot-vozmozhnost-oplaty-pochti-vseh-tovarov-pri-poluchenii	Утром — деньги, вечером — стулья: Ozon с 1 ноября уберёт возможность оплаты почти всех товаров при получении - КЛОПС - главный новостной сайт Калининграда	Исключение сделают для одежды, обуви, аксессуаров и ювелирных изделий	https://3.assets.klops.ru/media/W1siZiIsIjIwMjQvMTAvMzEvZjgzMzQ3ZWMtNzU1NS00ZWM5LWEwMWEtNzczZDk5Mzk0YzQxX2ZpbGUuanBlZyJdLFsicCIsInRodW1iIiwiMTIwMHg2MzArMCsxMTUiXSxbInAiLCJ0aHVtYiIsIjEyMDB4NjMwIyJdLFsicCIsInRleHQiLCIiXSxbInAiLCJlbmNvZGUiLCJqcGciLCItc3RyaXAgLWludGVybGFjZSBQbGFuZSJdXQ/file.jpg?sha=bfe45a6d9f41b9e2	2024-10-31 17:35:11	КЛОПС - главный новостной сайт Калининграда
ru	https://ura.news/news/1052837497	Не только оборона: Силуанов раскрыл, на что правительство потратит 7 триллионов рублей - URA.RU	Читайте на URA.RU	https://s.ura.news/images/news/figures/454/686/429ff1b5-30ca-4268-bf80-672e47c1920a/exhyry/L-1200.1.9.jpg	2024-10-31 13:27:00	URA.RU
ru	https://www.svoboda.org/a/putin-razreshil-pytatj/33182107.html	Путин разрешил пытать - Радио Свобода 	None	None	2024-10-31 15:38:18	Радио Свобода 
ru	https://icmos.ru/news/besplatnye-parkovki-dlya-velokurerov-poyavilis-v-stolice	Бесплатные парковки для велокурьеров появились в столице - Информационный Центр Правительства Москвы	Информационный Центр Правительства Москвы	https://icmos-s3.aif.ru/entity/001/103/illustration_largeimage_588eb01f11323f0e0cd3fb12e561a3de.jpg	2024-10-31 15:04:56	Информационный Центр Правительства Москвы
ru	https://ura.news/news/1052837321	Сбер повышает ставки по вкладам - URA.RU	Читайте на URA.RU	https://s.ura.news/images/news/figures/267/560/531b7e9e-358b-4f86-bc36-e00cb553f3b5/tsojxf/L-1200.1.9.jpg	2024-10-31 08:33:00	URA.RU
ru	https://sarnovosti.ru/news/v-spetsoperatsii-pogibli-7-saratovskikh-voinov/	В спецоперации погибли 7 саратовских воинов - Регион64	None	None	2024-10-31 14:45:00	Регион64
ru	https://ura.news/news/1052837536	Кем заменят мигрантов в ЖКХ и на стройках России - URA.RU	Читайте на URA.RU	https://s.ura.news/images/news/figures/442/245/20f4604f-a156-4baa-8d58-ba304de55359/g_mxni/L-1200.1.9.jpg	2024-10-31 15:40:00	URA.RU
ru	https://meduza.io/news/2024/10/31/milliarder-roman-avdeev-prodal-vse-aktivy-v-rossii-v-tom-chisle-mkb-on-zavil-chto-hochet-sosredotochitsya-na-detyah-u-nego-23-rebenka	Миллиардер Роман Авдеев продал все активы в России, в том числе МКБ. Он завил, что хочет «сосредоточиться на детях» (у него 23 ребенка) - Meduza	Миллиардер Роман Авдеев продал все активы в России структурам своего бизнес-партнера Сергея Сударикова, сообщил бизнесмен в фейсбуке. На публикацию одним из первых обратило внимание издание «Агентство».	https://meduza.io/imgly/share/1730394795/news/2024/10/31/milliarder-roman-avdeev-prodal-vse-aktivy-v-rossii-v-tom-chisle-mkb-on-zavil-chto-hochet-sosredotochitsya-na-detyah-u-nego-23-rebenka	2024-10-31 17:13:00	Meduza
ru	https://www.rbc.ua/ukr/news/zelenskiy-pokazav-video-naslidkiv-ataki-rf-1730325676.html	Зеленский показал видео последствий атаки РФ на Харьков - РБК-Украина	Подробнее читайте на сайте	https://www.rbc.ua/static/img/u/n/untitled_c9ea35d561672acaec0183158259fa69_1300x820.jpg	2024-10-30 22:01:16	РБК-Украина
ru	https://www.vedomosti.ru/finance/news/2024/10/31/1072170-kseniya-yudaeva-pokidaet-post	Ксения Юдаева покидает пост советника председателя ЦБ - Ведомости	Эльвира Набиуллина подчеркнула ее вклад в сохранение финансовой стабильности РФ в кризисы	https://sharing.vedomosti.ru/1730388280/vedomosti.ru/finance/news/2024/10/31/1072170-kseniya-yudaeva-pokidaet-post.jpg	2024-10-31 11:20:40	Ведомости
ru	https://censor.net/ru/news/3517794/zelenskyyi_pro_kursku_oblast_ukrayina_nichogo_ne_okupovuvala_a_lyshe_zrobyla_bufernu_zonu	Зеленский о Курской области: Украина ничего не оккупировала, а только сделала буферную зону - Цензор.НЕТ	None	None	2024-10-31 17:31:00	Цензор.НЕТ
ru	https://www.fontanka.ru/2024/10/31/74272949/	«Медлить нельзя». Алтайский невролог — о причинах и профилактике инсульта - Фонтанка.Ру	None	None	2024-10-31 04:57:00	Фонтанка.Ру
ru	https://1tulatv.ru/novosti/222211-na-tulskuyu-oblast-obrushitsya-shtormovoy-ciklon-martina.html	На Тульскую область обрушится штормовой циклон «Мартина» - Первый Тульский	За сутки может выпасть до 50% нормы осадков ноября	https://1tulatv.ru/sites/default/files/pogo1202_3.jpg	2024-10-31 11:09:47	Первый Тульский
ru	https://www.interfax.ru/world/989658	Конституционный суд Молдавии утвердил итоги референдума о евроинтеграции - Интерфакс	Конституционный суд Молдавии утвердил в четверг результаты референдума о европейской интеграции страны.	https://www.interfax.ru/aspimg/989658.jpg	2024-10-31 15:43:00	Интерфакс
ru	https://magadanmedia.ru/news/1884121/	Новые стандарты компенсации ЖКХ для льготников - новые правила с ноября - MagadanMedia	С ноября вступят в силу обновленные стандарты компенсации расходов на жилищно-коммунальные услуги для льготников. Как сообщила доцент кафедры экономической политики и экономических измерений ГУУ Наталья Казанцева, изменения касаются порядка проверки претендентов на получение льгот.	https://primamediamts.servicecdn.ru/f/main/4807/4806363.jpg?2ec3a18d064d89c6d01f8f805062597f	2024-10-31 06:13:53	MagadanMedia
ru	https://www.vedomosti.ru/finance/articles/2024/10/31/1072046-porog-vhoda-v-premialnii-banking	Порог входа в премиальный банкинг за 10 лет почти не изменился - Ведомости	Сейчас он составляет в среднем 2,4 млн рублей, хотя с учетом инфляции должен превышать 4 млн	https://sharing.vedomosti.ru/1730323750/vedomosti.ru/finance/articles/2024/10/31/1072046-porog-vhoda-v-premialnii-banking.jpg	2024-10-30 21:29:09	Ведомости
ru	https://www.svoboda.org/a/zelenskiy-informatsiya-o-tomagavkah-byla-konfidentsialjnoy/33179762.html	Зеленский: информация о "Томагавках" была конфиденциальной - Радио Свобода 	None	None	2024-10-30 13:28:32	Радио Свобода 
ru	https://ura.news/news/1052837163	Минздрав поддержал идею по ограничению продажи алкоголя в регионах - URA.RU	Читайте на URA.RU	https://s.ura.news/images/news/upload/smm/2024/10/31/facebook_b1ec904bf49993130945d78abdbfb628.jpg	2024-10-31 04:00:00	URA.RU
ru	https://www.vedomosti.ru/politics/articles/2024/11/01/1072294-lavrov-vpervie-s-nachala-posetit-stranu-evrosoyuza	Лавров в декабре впервые с начала военной операции посетит страну Евросоюза - Ведомости	Он планирует принять участие во встрече министров ОБСЕ на Мальте	https://sharing.vedomosti.ru/1730412959/vedomosti.ru/politics/articles/2024/11/01/1072294-lavrov-vpervie-s-nachala-posetit-stranu-evrosoyuza.jpg	2024-10-31 22:15:58	Ведомости
ru	https://www.newsvl.ru/sport/2024/11/01/227536/	ХК «Адмирал» обыграл «Салават Юлаев» и взял реванш за поражение двухдневной давности - Новости Владивостока и Приморского края	Новости Владивостока: Хоккейный клуб «Адмирал» в повторном матче в Уфе уверенно одержал верх над «Салаватом Юлаевым» со счётом 4:2. Голами в составе приморской команды отметились Шэн, Гутик, Родуолд и Завгородний.	https://static.vl.ru/news/1730416246893_default	2024-10-31 23:10:00	Новости Владивостока и Приморского края
ru	https://www.forbes.ru/biznes/523819-rejting-uverennosti-rossijskih-zastrojsikov-2024	Рейтинг уверенности российских застройщиков — 2024 - Forbes Russia	Forbes публикует новый рейтинг уверенности российских застройщиков	https://cdn.forbes.ru/forbes-static/shareimages/523819.jpg?v=1730322005	2024-10-30 21:00:00	Forbes Russia
ru	https://meduza.io/feature/2024/10/31/eto-v-chest-kamaly-i-baydena-tramp-zabralsya-v-musorovoz	«Это в честь Камалы и Байдена» - Meduza	Кандидат в президенты США от Республиканской партии Дональд Трамп во время визита в город Грин-Бей, штат Висконсин, 30 октября забрался в кабину мусоровоза, чтобы пообщаться с журналистами, сообщает Associated Press.	https://meduza.io/imgly/share/1730374407/feature/2024/10/31/eto-v-chest-kamaly-i-baydena-tramp-zabralsya-v-musorovoz	2024-10-31 07:25:00	Meduza
ru	https://www.interfax.ru/world/989478	Власти Ливана надеются на прекращение огня между Израилем и "Хезболлой" в ближайшее время - Интерфакс	Исполняющий обязанности премьер-министра Ливана Наджиб Микати заявил, что "оптимистично настроен" в отношении прекращения огня между ливанским движением "Хезболла" и Израилем в течение ближайших часов или дней.	https://www.interfax.ru/aspimg/989478.jpg	2024-10-31 01:12:23	Интерфакс
ru	https://www.interfax.ru/world/989694	Пхеньян заявил, что днем ранее испытал новейшую ракету "Хвасон-19" - Интерфакс	Власти КНДР сообщили, что днем ранее провели успешное испытание новейшей межконтинентальной баллистической ракеты "Хвасон-19", сообщает в пятницу агентство "Ренхап".	https://www.interfax.ru/aspimg/989694.jpg	2024-10-31 22:23:00	Интерфакс
ru	https://v102.ru/news/136077.html	Андрей Бочаров прокомментировал перехват трех БПЛА - ИА "Высота 102"	Губернатор Волгоградской области прокомментировал перехват БПЛА над...	https://media.v102.ru/pictures/20241031082036.jpg	2024-10-31 05:26:48	ИА "Высота 102"
ru	https://meduza.io/feature/2024/10/31/navodnenie-v-ispanii-za-vosem-chasov-vypalo-stolko-osadkov-skolko-obychno-byvaet-za-god-fotografii	Наводнение в Испании. За восемь часов выпало столько осадков, сколько обычно бывает за год. Фотографии - Meduza	В автономном сообществе Валенсия на востоке Испании 30 октября произошло наводнение, вызванное сильными дождями. За восемь часов в регионе выпала годовая норма осадков. По последним данным, в результате одного из самых разрушительных наводнений погибли 95 человек, власти предполагают, что число погибших может вырасти. Из-за осадков в Валенсии перестали ходить поезда в Мадрид и Барселону, нарушено авиасообщение, не работают школы и основные социальные службы, многие жители остались без электричества. Поисково-спасательные работы продолжаются. В Испании объявлен трехдневный траур.	https://meduza.io/imgly/share/1730397457/feature/2024/10/31/navodnenie-v-ispanii-za-vosem-chasov-vypalo-stolko-osadkov-skolko-obychno-byvaet-za-god-fotografii	2024-10-31 11:44:00	Meduza
ru	https://ura.news/articles/1036290084	Ключевое звено «Единой России» ждет реформа - URA.RU	Причина — скорость реакции на запросы	https://s.ura.news/images/news/figures/496/793/90300f9c-53e0-43e1-a974-260228740d26/wvvoze/L-1200.1.9.jpg	2024-10-31 19:49:00	URA.RU
ru	https://news.google.com/rss/articles/CBMimgFBVV95cUxQaWdSUF9wZGFyNWVBZzJ5Y1pWTVl5LTkxR1NQMTJkQmtRNmtQeFhSY3BqY0NHa181cWtBOFU4VWRjTXExZmVIOXdYTDZYaldTWVFxTldtNkZLWFpIYzVYNDZNVmF6S01xblFFaUpxamhyaVpLOGloVk5nQ2JYQXNIWTFlTzlFQlV1dlhQd3FSOWRxZTBQcmxrUDF30gGfAUFVX3lxTFBWUnRyMS1tbVpwODUtNDhLNzJnZEhsUDJlOXpIZWZaNkVlZHdzSTRFZ2dJdHduLW5qb3N1M0U3ZXZVYndlMkFDdHBSWmcwd0s2SjhaaGFhTk84R250WG1VcHBPbEFrellwTUsxejZ1Wm1hR1V1MnpaRU4xb2NpMl9VYW9XX0VnMTdOSXZUVnU1TmozLVdfdTdWSHpIbjJJZw?oc=5	МЧС обратилось к жителям столичного региона с серьёзным предупреждением - Портал OKA.FM	None	None	2024-10-30 14:00:00	Портал OKA.FM
ru	https://news.google.com/rss/articles/CBMiTkFVX3lxTFBRdkVxWjhTaHRTNFRlTzVMbWI3SUl1WmJtSGJlY2pfTFliQVlCRGtHOHNqZmhjNnhPX25ZRHp1TTFmeDJROXY0LW90S0Q4Z9IBSkFVX3lxTFAxNWQzdEhNX2lLamt4UnFFbzc5bmpnQkRodWhBck1mYkVQM0pQb0RMRjZSM0VuWTFxMVJrQjB2QThXTGluY185a05n?oc=5	КС постановил считать неустановленными сроки давности по искам прокуроров о конфискации - Интерфакс	Речь идет об исках об изъятии имущества коррупционеров в пользу государства	https://www.interfax.ru/aspimg/989524.png	2024-10-31 07:51:00	Интерфакс
ru	https://karelinform.ru/news/2024-10-31/lyudi-pogibli-pri-vzryve-gaza-v-5-etazhnom-dome-5235854	Люди погибли при взрыве газа в 5-этажном доме — Новости Карелии и Петрозаводска - КарелИнформ	Произошла вспышка паров газовоздушной смеси, МЧС поделилось жуткими кадрами с места трагедии. Новости Карелии и Петрозаводска - КарелИнформ	https://karelinform.ru/attachments/08cacdf45222568a42d18cedea1f9ed9f1aac065/store/crop/0/-8/1920/1080/1920/0/0/ff7b000299ac0488867dc88f91f64bbd39ee927ae0cbc13eb746bb8b43b2/1730353753515.webp	2024-10-31 05:49:00	КарелИнформ
ru	https://ura.news/news/1052837126	Перерасчет пенсий, блокировка сообщений и реестр воинского учета: что ждет россиян с 1 ноября - URA.RU	Читайте на URA.RU	https://s.ura.news/images/news/upload/smm/2024/11/01/facebook_4e8f67232df869a56b398ba09a728b27.jpg	2024-10-31 00:05:00	URA.RU
ru	https://www.interfax.ru/russia/989521	Цены на аренду жилья в России обновили исторические максимумы - Интерфакс	Арендная ставка в Москве в среднем составила 111 тыс. рублей в месяц	https://www.interfax.ru/aspimg/989521.jpg	2024-10-31 07:53:00	Интерфакс
ru	https://rtvi.com/news/tri-ukrainskih-drona-atakovali-predpriyatiya-tek-bashkirii/	Три украинских дрона атаковали предприятия ТЭК Башкирии - RTVI	Промышленные предприятия топливно-энергетического комплекса (ТЭК) Башкортостана подверглись атаке трех украинских беспилотников, сообщил в своем телеграм-канале глава республики Радий Хабиров.	https://rtvi.com/wp-content/uploads/2024/11/399061-1.jpg?205857	2024-10-31 17:29:10	RTVI
ru	https://www.interfax.ru/russia/989646	В Белгородской области в результате атаки дрона погиб сельхозработник - Интерфакс	В Валуйском округе Белгородской области беспилотник ударил по работавшей в поле сельхозмашине, погиб сотрудник сельхозпредприятия, сообщил губернатор региона Вячеслав Гладков.	https://www.interfax.ru/aspimg/989646.png	2024-10-31 14:30:00	Интерфакс
ru	https://eadaily.com/ru/news/2024/10/31/sberbank-opublikoval-prognoz-inflyacii-po-itogam-2024-goda	Сбербанк опубликовал прогноз инфляции по итогам 2024 года - EADaily	«Сбер» также сохранил на прежнем уровне прогноз роста ВВП в стране — речь о 3,8%. 31 октября 2024. EADaily	https://img1.eadaily.com/r650x400/o/829/252c9c4649d02c2b14442cdfc0229.jpeg	2024-10-31 11:30:00	EADaily
ru	https://tsn.ua/ru/ukrayina/armiya-rf-atakovala-most-cherez-dnestrovskiy-liman-detali-2690937.html	Армия РФ атаковала мост через Днестровский лиман: детали - ТСН	В ночь на четверг, 31 октября, российские военные атаковали ракетами мост через Днестровский лиман в Заливе — читайте новости 1+1 (ТСН.ua).	https://img.tsn.ua/cached/689/tsn-86026451a4bd5b82b0f7aa9436ae117b/thumbs/1200x630/17/75/b395ab605c70a824d8d88abdb9eb7517.jpeg	2024-10-31 06:53:00	ТСН
ru	https://www.oka.fm/new/read/social/Ko-Dnyu-narodnogo-edinstva-v-Podmoskove-mogut-sformirovatsya/	Ко Дню народного единства в Подмосковье могут сформироваться сугробы такой высоты - Портал OKA.FM	Синоптики ошеломили население.	https://www.oka.fm/news2024/IMG_5699_1_-min.jpg	2024-10-31 09:15:00	Портал OKA.FM
ru	https://www.dw.com/ru/rost-cen-v-rossii-slivocnoe-maslo-eto-novaa-ikra/a-70643272	Рост цен в России: сливочное масло - это новая икра? - DW НА РУССКОМ	Сливочное масло в России подорожало с начала 2024 года на 23,4%. В городах РФ участились случаи воровства масла из магазинов. Карикатура DW - о новом символе богатства россиян.	https://static.dw.com/image/70644078_6.jpg	2024-10-30 16:41:40	DW НА РУССКОМ
