country_code	url	title	description	image_url	publish_date	source
ru	https://news.google.com/rss/articles/CBMiUEFVX3lxTE9oeXJXTk8tR1RNLWxITWRER0RPdC1OQXRPektuREJzWlR3bkpTTVRTcGZQVEhqUlJHVWZUQnFNajkzQ1Z5dlJVM2NFaVdwS0Uy?oc=5	Театральный перформанс и джаз на теплоходе: какую программу подготовили к акции «Ночь искусств» в Москве - Официальный сайт Мэра Москвы	None	None	2024-10-21 08:00:00	Официальный сайт Мэра Москвы
ru	https://www.fontanka.ru/2024/10/21/74238719/	В Петербурге отменили ночную разводку мостов - Фонтанка.Ру	None	None	2024-10-21 20:33:17	Фонтанка.Ру
ru	https://ura.news/news/1052832798	«Единая Россия» набирает полмиллиона волонтеров на празднование 80-летия Победы - URA.RU	Видео	https://s.ura.news/images/news/figures/438/732/3a15eae1-5ada-44a5-ad75-e56c2ee574e3/uszu6e/L-1200.1.9.jpg	2024-10-21 15:36:00	URA.RU
ru	https://www.t24.su/v-tayshetskom-promyshlenno-tehnologicheskom-tehnikume-sostoyalsya-den-otkrytyh-dverey/	В Тайшетском промышленно-технологическом техникуме состоялся день открытых дверей - http://www.t24.su/	Тайшет24	https://www.t24.su/wp-content/uploads/2024/10/0083125590-1.jpg	2024-10-21 11:11:26	http://www.t24.su/
ru	https://www.t24.su/gai-i-dvizhenie-pervyh-proveli-tantsevalnyy-fleshmob-v-tayshete/	ГАИ и «Движение Первых» провели танцевальный флешмоб в Тайшете - http://www.t24.su/	Тайшет24	https://www.t24.su/wp-content/uploads/2024/10/09-39-43-1.jpg	2024-10-22 03:10:52	http://www.t24.su/
ru	https://www.interfax.ru/world/987767	Президент ОАЭ обещает продолжать посредничество в обмене РФ и Украины пленными - Интерфакс	Объединённые Арабские Эмираты продолжат посреднические усилия по обмену пленными между Россией и Украиной, сообщил президент ОАЭ Мухаммед Бен Заид Аль Нахайян.	https://www.interfax.ru/aspimg/987767.png	2024-10-21 11:06:00	Интерфакс
ru	https://www.fontanka.ru/2024/10/22/74239013/	Минобороны сообщает об атаках БПЛА лишь в пяти регионах - Фонтанка.Ру	None	None	2024-10-22 04:48:12	Фонтанка.Ру
ru	https://news.google.com/rss/articles/CCAiC2FoOXVUbHF6MU5vmAEB?oc=5	Путин прощается с Приднестровьем! Кремль снова сломал зубы. Молдова послала Россию - УНІАН	None	None	2024-10-20 16:30:00	УНІАН
ru	https://ura.news/news/1052832369	На «Госуслугах» запустили отдельный сервис для многодетных семей - URA.RU	Читайте на URA.RU	https://s.ura.news/images/news/figures/514/449/d89621cf-a477-48b5-b5e3-7ec10b3f9fc3/vfj1pa/L-1200.1.9.jpg	2024-10-21 08:51:00	URA.RU
ru	https://www.interfax.ru/russia/987886	Сбербанк выпустил очередное приложение для смартфонов на iOS - Интерфакс	Сбербанк выпустил очередное приложение для смартфонов с операционной системой iOS.	https://www.interfax.ru/aspimg/987886.png	2024-10-22 06:29:00	Интерфакс
ru	https://www.fontanka.ru/2024/10/22/74239055/	RT: в сбитом в Судане самолёте был российский лётчик - Фонтанка.Ру	None	None	2024-10-22 05:02:00	Фонтанка.Ру
ru	https://news.google.com/rss/articles/CCAiC0pfQkVjdEliSFhBmAEB?oc=5	Ракетой США по центру Москвы! РФ трясет, бумеранг в Брянске: минус жирная цель. Соловьева коробит - УНІАН	None	None	2024-10-21 16:30:03	УНІАН
ru	https://www.rbc.ua/ukr/news/viyska-rf-sistematichno-strachuyut-viyskovopolonenih-1729568985.html	Войска РФ систематически казнят украинских военнопленных и применяют химоружие, - ISW - РБК-Украина	Подробнее читайте на сайте	https://www.rbc.ua/static/img/_/v/_viyskovi_gettyimages_1239355989_15f3cfcd800d824a10f0a0ead4f373c6_1300x820.jpg	2024-10-22 03:53:40	РБК-Украина
ru	https://www.rbc.ua/ukr/news/rosiya-vnochi-zapustila-ukrayini-desyatki-1729577857.html	Россия ночью запустила по Украине десятки дронов: сколько сбила ПВО - РБК-Украина	Подробнее читайте на сайте	https://www.rbc.ua/static/img/_/v/_viyskoviy_23_mm_sparena_ustanovka_zu_23_2_protipovitryana_oborona_ppo__vesna_2024_gettyimages_2147853328_923855f2f2168af6a422a0c703a6e4a0_1300x820.jpg	2024-10-22 06:17:37	РБК-Украина
ru	https://www.rbc.ua/ukr/news/rosiya-atakuvala-raketami-zaporizhzhya-e-1729572742.html	Россия атаковала ракетами Запорожье: есть погибшие и раненые - РБК-Украина	Подробнее читайте на сайте	https://www.rbc.ua/static/img/_/e/_ekrana_2024_10_22_v_07_48_19_9e9271f34d47fd42045a0c581a248ffe_1300x820.jpg	2024-10-22 04:53:21	РБК-Украина
ru	https://meduza.io/news/2024/10/22/sberbank-podnyal-stavki-po-ipoteke-pochti-do-25	Сбербанк поднял ставки по ипотеке почти до 25% - Meduza	С 22 октября «Сбер» поднял ставки по рыночным ипотечным программам сразу на 3 процентных пункта, пишет РБК. Таким образом, минимальная ставка по кредитам на строящееся жилье выросла до 24,9%, а на готовое — до 24,6%.	https://meduza.io/imgly/share/1729584541/news/2024/10/22/sberbank-podnyal-stavki-po-ipoteke-pochti-do-25	2024-10-22 08:09:00	Meduza
ru	https://www.rbc.ua/ukr/news/armiyu-pensiyi-k-ukrayina-vitratit-pershi-1729543065.html	Посол Британии рассказал, как Украина потратит почти 2,3 млрд фунтов от активов РФ - РБК-Украина	Подробнее читайте на сайте	https://www.rbc.ua/static/img/_/2/_25cfd7d30fd71144c17d4bdbefdcde29_1300x820.jpg	2024-10-22 06:46:00	РБК-Украина
ru	https://news.google.com/rss/articles/CCAiC0RjcWE1Y1F3SDJZmAEB?oc=5	Стерли в ПЕПЕЛ! HIMARS жахнул морпехов РФ. Путинцам врезали по зубам на Курщине - УНІАН	None	None	2024-10-22 07:30:04	УНІАН
ru	https://www.interfax.ru/russia/987927	Вертолет "Медицины катастроф" аварийно сел в лесу в Нижегородской области - Интерфакс	Один из пилотов получил травму в результате вынужденной жесткой посадки санитарного вертолета с пациентом в лесной зоне в Нижегородской области, сообщили во вторник в АО "Национальная служба санитарной авиации" (НССА, подконтрольно "Ростеху").	https://www.interfax.ru/aspimg/987927.png	2024-10-22 08:56:00	Интерфакс
ru	https://1tulatv.ru/novosti/221731-bespilotniki-atakovali-dva-spirtzavoda-v-tulskoy-oblasti.html	Беспилотники атаковали два спиртзавода в Тульской области - Первый Тульский	Об этом в своем телеграм-канале сообщил Губернатор Дмитрий Миляев	https://1tulatv.ru/sites/default/files/snimok_ekrana_2024-10-22_060317.jpg	2024-10-22 02:56:21	Первый Тульский
ru	https://www.interfax.ru/business/987937	Т-Банк разморозил средства клиентов на 3,5 млрд рублей - Интерфакс	Т-Банк разморозил часть средств клиентов по фондам в долларах и евро, объем разблокированных активов составил 3,5 млрд рублей, сообщил председатель правления банка Станислав Близнюк.	https://www.interfax.ru/aspimg/987937.jpg	2024-10-22 09:50:00	Интерфакс
ru	https://www.pravda.com.ua/rus/news/2024/10/22/7480808/	СМИ: G7 планирует сохранить российские активы замороженными и после войны - Украинская правда	Страны “Группы семи” планируют сохранить замороженные российские суверенные активы даже после окончания войны в Украине.	None	2024-10-22 09:41:23	Украинская правда
ru	https://www.vedomosti.ru/business/news/2024/10/22/1070120-novim-glavoi-rosnedr-naznachen-kazanov	Новым главой Роснедр назначен Олег Казанов - Ведомости	Евгений Петров освобожден от должности руководителя агентства по его просьбе	https://sharing.vedomosti.ru/1729585166/vedomosti.ru/business/news/2024/10/22/1070120-novim-glavoi-rosnedr-naznachen-kazanov.jpg	2024-10-22 07:29:40	Ведомости
ru	https://ulpravda.ru/rubrics/economics/v-rossii-predlagaiut-sokratit-kolichestvo-parkovok-okolo-zhilykh-domov	В России предлагают сократить количество парковок около жилых домов - Ульяновская правда	None	None	2024-10-22 07:30:00	Ульяновская правда
ru	https://www.evening-kazan.ru/obshhestvo/news/modernizaciyu-kazanskogo-samoleta-tu-214-zavershat-do-2026-goda	Модернизацию казанского самолета Ту-214 завершат до 2026 года - Вечерняя Казань	None	None	2024-10-22 04:54:00	Вечерняя Казань
ru	https://www.interfax.ru/world/987745	В Кремле слова Трампа об угрозе ударить по Москве отнесли к предвыборным заявлениям - Интерфакс	В Кремле, комментируя заявления экс-президента США Дональда Трампа о том, что он угрожал российскому президенту Владимиру Путину нанести удар по Москве, если Россия будет преследовать Украину, отметили, что в ходе избирательной кампании в США сейчас звучит много горячих и весьма эмоциональных высказываний.	https://www.interfax.ru/aspimg/987745.jpg	2024-10-21 09:00:00	Интерфакс
ru	https://meduza.io/news/2024/10/22/na-pozhiznenno-osuzhdennogo-raufa-arashukova-zaveli-delo-o-dache-vzyatki-sotrudniku-kolonii-chernyy-delfin	На пожизненно осужденного Рауфа Арашукова завели дело о даче взятки сотруднику колонии «Черный дельфин» - Meduza	На пожизненно осужденного сенатора Рауфа Арашукова завели уголовное дело о даче взятки (часть 5 статьи 291 УК) сотруднику Управления ФСИН по Оренбургской области, сообщил «Интерфакс» со ссылкой на Центр общественных связей ФСБ.	https://meduza.io/imgly/share/1729593945/news/2024/10/22/na-pozhiznenno-osuzhdennogo-raufa-arashukova-zaveli-delo-o-dache-vzyatki-sotrudniku-kolonii-chernyy-delfin	2024-10-22 10:45:00	Meduza
ru	https://www.forbes.ru/mneniya/523529-na-poroge-evropy-pocemu-prezidentskie-vybory-v-moldavii-pokazali-raskol-strany	На пороге Европы: почему президентские выборы в Молдавии показали раскол страны - Forbes Russia	Результаты первого тура президентских выборов и референдума о евроинтеграции продемонстрировали, что пока одни граждане Молдавии видят будущее с Европой, другие продолжают искать поддержки России, полагая, что «русский мир» ближе и понятнее. При этом	https://cdn.forbes.ru/forbes-static/shareimages/523529.jpg?v=1729580579	2024-10-22 04:00:00	Forbes Russia
ru	https://www.vedomosti.ru/politics/news/2024/10/22/1070128-putin-uzhe-pribil-v-kazan	Песков: Путин уже прибыл в Казань для участия в саммите БРИКС - Ведомости	На саммите ожидается присутствие 22 делегаций на высшем уровне	https://sharing.vedomosti.ru/1729585382/vedomosti.ru/politics/news/2024/10/22/1070128-putin-uzhe-pribil-v-kazan.jpg	2024-10-22 07:48:40	Ведомости
ru	https://news.google.com/rss/articles/CBMiZEFVX3lxTE1TeWZBaFo1YWVQQ2pBRFRIRW1TS21xOUlKbkFRbUZSdUFrN2pKQVFzTG5ld0VWRUJqS3RwX1FOcWlpeldkZ0xWeWNWT1kxOHg4ZHhRR3NTY2p0VU1Mb3Y3eEEzMk_SAXBBVV95cUxQa0xzMGRORVloZ3B6UHJtX25rMlNNdTdYZEpRLUkzX0gtVEl4LUN0c3ZhM2JsOUlzQllxaXZOb3NtVThQXzZpd3l4R0NYT0YxSkFGYXRKQjQ5MTF0OHBJaHNyUVFqZUQxWkVpR1JoRkhH?oc=5	В КНДР назвали "беспочвенными слухами" обвинения об отправке войск на помощь РФ - Украинская правда	В Северной Корее назвали “беспочвенными слухами” обвинения со стороны Южной Кореи и Украины в том, что она отправляет солдат воевать на стороне России в войне с Украиной.	None	2024-10-22 08:10:18	Украинская правда
ru	https://www.bfm.ru/news/560488	Российский истребитель сопроводил самолет Си Цзиньпина на пути к Казани - BFM.RU	None	None	2024-10-22 11:09:02	BFM.RU
ru	https://bcs-express.ru/novosti-i-analitika/prognozy-i-kommentarii-tema-zolota-raskryta	Прогнозы и комментарии. Тема золота раскрыта - БКС Экспресс	На фоне общей стагнации рынка перед заседанием ЦБ хедлайнером понедельника выступили акции золотодобытчика Полюса	https://cdn.bcs-express.ru/article-head/12323.jpg	2024-10-22 05:26:00	БКС Экспресс
ru	https://www.vzsar.ru/news/2024/10/22/na-svo-pogibli-esche-tri-saratovskih-boyca.html	На СВО погибли еще три саратовских бойца - Взгляд-инфо	В ходе специальной военной операции погибли еще трое жителей Саратовской области	https://www.vzsar.ru/i/news/social/266375_1729582843.jpg	2024-10-22 07:41:00	Взгляд-инфо
ru	https://www.pravda.com.ua/rus/news/2024/10/22/7480829/	Моди в России обнялся с Путиным и поговорил о мирном урегулировании войны в Украине - Украинская правда	Премьер-министр Индии Нарендра Моди приехал в российскую Казань на устроенный Кремлем саммит БРИКС, где во время встречи и объятий с правителем РФ Владимиром Путиным заявил, что Индия поддерживает мирное урегулирование войны против Украины и готова помочь в этом.	https://img.pravda.com/images/doc/7/4/7480829_fb_image_rus_2024_10_22_14_47_01.jpg	2024-10-22 11:14:48	Украинская правда
ru	https://news.google.com/rss/articles/CBMiXkFVX3lxTFB2Rm9ybW9FVzRkRFdKRjIzSk1tMmdMZnlVRDREWWhIR2Q2eVhUNzRXUUM2cHJqSE43Ukg3TDgzMDhwaEw0NXdWZmhmbkRkbXJTaTJDNEt1dzZBa1dDUVE?oc=5	Минпросвещения поднимает минимальные баллы по ЕГЭ: новые значения и что они меняют - Новости Тюмени – 72.ru	None	None	2024-10-22 05:53:30	Новости Тюмени – 72.ru
ru	https://24tv.ua/ru/rossija-snova-atakuet-shahedami-gde-sejchas-vrazheskie-drony-v-kakih-oblastjah-est-ugroza-udara_n2667932	Россия атаковала "Шахедами: взрывы раздались в трех областях - 24 Канал	None	None	2024-10-22 06:43:27	24 Канал
ru	https://meduza.io/news/2024/10/21/glava-pentagona-lloyd-ostin-priehal-v-kiev-s-neob-yavlennym-vizitom	Глава Пентагона Ллойд Остин приехал в Киев с необъявленным визитом - Meduza	В Киев с необъявленным визитом приехал глава Пентагона Ллойд Остин, пишут The Wall Street Journal и CNN.	https://meduza.io/imgly/share/1729494853/news/2024/10/21/glava-pentagona-lloyd-ostin-priehal-v-kiev-s-neob-yavlennym-vizitom	2024-10-21 06:57:00	Meduza
ru	https://www.epravda.com.ua/rus/news/2024/10/21/720842/	Россия повысит учетную ставку до уровня февраля 2022 года - опрос Reuters - Экономическая правда	None	None	2024-10-21 14:30:00	Экономическая правда
ru	https://www.vedomosti.ru/economics/news/2024/10/22/1070167-minfin-ozhidaet	Минфин ожидает роста дивидендов госкомпаний в 2025 году - Ведомости	Минфин РФ ожидает увеличения дивидендного потока от компаний с государственным участием в 2025 г. Об этом заявил замминистра финансов России Алексей Моисеев на конференции «Толк».	https://sharing.vedomosti.ru/1729590562/vedomosti.ru/economics/news/2024/10/22/1070167-minfin-ozhidaet.jpg	2024-10-22 09:27:56	Ведомости
ru	https://www.fontanka.ru/2024/10/22/74238749/	К концу года часть карт Visa Mastercard окажется с просроченным сертификатом безопасности в РФ - Фонтанка.Ру	None	None	2024-10-21 22:10:00	Фонтанка.Ру
ru	https://www.rbc.ua/ukr/news/rosiya-nastupae-kurskiy-oblasti-ta-donbasi-1729541309.html	Россия наступает в Курской области и на Донбассе. Есть ли риск обвала фронта для ВСУ - РБК-Украина	Подробнее читайте на сайте	https://www.rbc.ua/static/img/_/v/_vii__skovi_binokl_divitsya_chasiv_yar_osin_2024_gettyimages_2174650252_e96d7a9dbbf49781f7fe9f9a28774e4a_1300x820.jpg	2024-10-22 05:00:00	РБК-Украина
ru	https://www.t24.su/otkryta-prodazha-biletov-na-poezd-deda-moroza-dlya-zhiteley-taysheta/	Открыта продажа билетов на Поезд Деда Мороза для жителей Тайшета - http://www.t24.su/	Тайшет24	https://www.t24.su/wp-content/uploads/2024/10/20-27-27-1.jpg	2024-10-22 06:00:20	http://www.t24.su/
ru	https://www.bfm.ru/news/560486	Вооруженные силы РФ взяли село Новосадовое в ДНР - BFM.RU	None	None	2024-10-22 10:12:07	BFM.RU
ru	https://news.google.com/rss/articles/CBMiV0FVX3lxTFBfUkZwNFI0bDdYc0hzOUFGcnBFSWVNVGlwbWpDSkJnVlNlSGRxcTN0N25IZElnaHptTmxBV3VuWi1HUENhTV84ZDNoSnkxWElwNkxXcTlIcw?oc=5	За филе 4000 рублей: в Ярославле взлетели цены на рыбу. Где выгоднее покупать — обзор - Новости Ярославля – 76.ru	None	None	2024-10-22 05:11:00	Новости Ярославля – 76.ru
ru	https://podrobno.uz/cat/proisshestviya/v-tashkente-pogibla-rossiyskaya-zhurnalistka/	В Ташкенте погибла российская журналистка - Podrobno.uz - Новости Узбекистана		https://podrobno.uz/upload/iblock/e16/bgqt6yvv06ntxwl4kakxhia7uj2mimx4/4324234234.jpg	2024-10-22 11:04:00	Podrobno.uz - Новости Узбекистана
ru	https://www.mos.ru/news/item/145577073/	Поиск предков: в сервисе Главархива появились документы 1812 года / Новости города / Сайт Москвы - Официальный сайт Мэра Москвы	Они помогут горожанам больше узнать об истории своей семьи.	https://www.mos.ru/open-graph/v1/frontend/news/item/145577073/	2024-10-22 06:02:02	Официальный сайт Мэра Москвы
ru	https://7days.ru/news/eksperty-gidromettsentra-rasskazali-kogda-v-moskve-zakonchitsya-babe-leto.htm	Эксперты Гидрометцентра рассказали, когда в Москве закончится бабье лето - 7дней.ру	None	None	2024-10-21 14:47:36	7дней.ру
ru	https://magadanmedia.ru/news/1875559/	Россияне, которые вовремя оплачивают платежки за ЖКХ, попадают в черные списки - MagadanMedia	Россияне, вовремя оплачивающие услуги ЖКХ, рискуют оказаться в черных списках УК из-за долгов. Плательщикам объяснили, почему не нужно спешить оплачивать квитанции, как только получили платежки.	https://primamediamts.servicecdn.ru/f/main/4783/4782893.jpg?37cd4abdeb4f8d48fcae7e3957e3fda4	2024-10-21 22:24:43	MagadanMedia
ru	https://nv.ua/ukraine/events/boi-za-chasov-yar-okkupanty-prorvali-oboronu-goroda-bild-50460119.html	«Будут наступать на центр». Россияне прорвали оборону Часова Яра — Bild - NV	  Российским военным удалось прорвать оборону города Часов Яр в Донецкой области и, вероятно, они будут продвигаться в центр. 	https://static.nv.ua/shared/system/Article/posters/002/973/487/original/37eaa39586d789c28a1c3981352f6db3.jpg?q=85&stamp=20241021135440	2024-10-21 10:57:00	NV
ru	https://www.mos.ru/news/item/145518073/	На северо-востоке Москвы строят путепровод и подземный пешеходный переход - Официальный сайт Мэра Москвы	Проект, который планируют завершить в 2026 году, улучшит транспортную доступность трех районов Отрадное, Алтуфьевский, Бибирево, а также разгрузит прилегающую улично-дорожную сеть.	https://www.mos.ru/open-graph/v1/frontend/news/item/145518073/	2024-10-21 07:01:03	Официальный сайт Мэра Москвы