country_code	url	title	description	image_url	publish_date	source
ru	https://24tv.ua/ru/v-gur-ocenili-uroven-ugrozy-primenenija-rossiej-jadernogo-oruzhija_n2691813?__cf_chl_rt_tk=GHnuDcG4RCS0qwrgn.DnCrlRAn6MXvPJleuwmnqMMt4-1732331170-1.0.1.1-PqTpkWPPWB2odB.DUI4NSbQSnLsP9IoJi0l4_s2Wag4	В ГУР оценили уровень угрозы применения Россией ядерного оружия - 24 Канал	None	None	2024-11-22 12:36:00	24 Канал
ru	https://www.euro-football.ru/article/29/1005788320_dzyuba_nazval_igroka_rpl_kotoryiy_silnee_ronaldu_i_ibragimovicha	Дзюба назвал игрока РПЛ, который сильнее Роналду и Ибрагимовича - Евро-Футбол.Ру	Нападающий &laquo;Акрона&raquo; Артём Дзюба дал комментарий после пятничного крупного поражения от &laquo;Рубина&raquo; со счётом 0:3	https://static.euro-football.ru/images/gallery/6a8ce2a123eb3713bbec61322805afa614840834.jpg	2024-11-22 18:18:46	Евро-Футбол.Ру
ru	https://news.google.com/rss/articles/CBMimwFBVV95cUxNdkY1ZU41OUFyRUNqMWs4S2tjc0ROemZrcHhWb2pET2hrdFdxYkZkb09EYWJIazNoS0lPV2JGSU1OOGdEUHlPWEEycGxJNW42N3lndmMxLXJTVFhGTGEzU0NQS1BRZGRodnVKMUg4UUtFSUJ2eVNYeVVlV2pvS2xOa2tTT3BBWjg5c1hybF9aQjlub09xcU4zMHduUdIBkgFBVV95cUxOSlQtdTV5TXZjRll2bk5KcXJTM1ktNGZNQ0ptX2p0dFZvS2pHSWJ6RGdUVmxNQ2hHd1hqSGxCSVBwc1U0elRHM2hscHVhZG5qY05jb3RFNnlmanBlQ0tpSGh1ZkQ1emJ3b2lwbmp0d3lEV2I4dWw4ZmhwVTlLbGhNX25PVXRHd0tKbVJ1THBwWWJxQQ?oc=5	Россия атаковала Днепр: повреждена инфраструктура - Корреспондент	None	None	2024-11-22 11:43:00	Корреспондент
ru	https://meduza.io/news/2024/11/22/opros-russian-field-za-mirnoe-soglashenie-s-ukrainoy-vystupayut-79-rossiyan-eto-maksimum-s-nachala-voyny	Опрос Russian Field: за мирное соглашение с Украиной выступают 79% россиян. Это максимум с начала войны - Meduza	Число россиян, выступающих за мирные переговоры либо немедленное заключение мирного соглашения с Украиной, достигло максимума с начала полномасштабной войны, свидетельствуют результаты опроса исследовательской группы Russian Field. Исследование проводилось 7-12 ноября в виде телефонного опроса среди 1600 россиян.	https://meduza.io/imgly/share/1732308447/news/2024/11/22/opros-russian-field-za-mirnoe-soglashenie-s-ukrainoy-vystupayut-79-rossiyan-eto-maksimum-s-nachala-voyny	2024-11-22 20:47:00	Meduza
ru	https://news.google.com/rss/articles/CBMiTkFVX3lxTFByS3VGNVNzUS0xRFpsMXZZMWwtclhXOGlaWEVfSVNzZjZBTnFNcUpMRnk2cEVib1lkTk5TcktRRUxXNHhFdFY3X0R1OFQxZ9IBU0FVX3lxTE9fMXFicUpVR0Qta0JfeU1iRkVXVms0YW52U0xONXZxODNjTDN5Q05GTXI1NEtWb1NJME5QMkNzdGxidV9EVU1vQXpzLXN1WmVKLThV?oc=5	Россияне могут увеличить пенсию - MagadanMedia	Сенатор Ольга Епифанова рассказала, как россияне могут повысить свои пенсионные выплаты, воспользовавшись отсрочкой выхода на пенсию или покупкой дополнительных пенсионных баллов, сообщает ИА MagadanMedia.	https://primamediamts.servicecdn.ru/f/main/4859/4858277.jpg?5d8438d2663fbd80ab41bd9b6889ad01	2024-11-22 06:01:38	MagadanMedia