country_code	url	title	description	image_url	publish_date	source
ru	https://news.google.com/rss/articles/CBMiUEFVX3lxTE54MndGNGhaV0otTGthWFdGMU5GMU5Jdk5jOWlvYUFmMmVpSTZ0c0w1YS1peDRVQnA4NUhJaTRTN1h2VUNyVXd1ZGU2NHVMT1Ba?oc=5	Царица дома: московские археологи нашли 400-летние изразцы с кошками в коронах - Официальный сайт Мэра Москвы	None	None	2024-11-12 04:01:01	Официальный сайт Мэра Москвы
ru	https://www.pravda.com.ua/rus/news/2024/11/12/7484016/	КНДР ратифицировала договор о всеобъемлющем стратегическом партнерстве с Россией - Украинская правда	Северная Корея ратифицировала договор о всеобъемлющем стратегическом партнерстве с Россией, подписанный 19 июня в Пхеньяне.	None	2024-11-12 00:30:20	Украинская правда
ru	https://news.google.com/rss/articles/CBMiUEFVX3lxTE13VU13dU5sSmZtNGdLaGJhMUUydUFHb1loUHZCa05VckRjeUtyM3VrWlJldi1IU09PZjhraHRKWk1idDJTOGRrVURma0JYT0U1?oc=5	Редкие виды возвращаются в Москву: каких птиц заметили биологи в этом году / Новости города / Сайт Москвы - Официальный сайт Мэра Москвы	None	None	2024-11-11 04:01:00	Официальный сайт Мэра Москвы
ru	https://pogoda.mail.ru/news/63591828/	Плюсовые температуры сохранятся в Москве на этой неделе — синоптик - Погода Mail.ru	На предстоящей неделе в столице ожидаются мокрый снег и легкие заморозки по ночам. Об этом Агентству городских новостей «Москва» сообщил начальник отдела управления в кризисных ситуациях Росгидромета Анатолий Цыганков.	https://resizer.mail.ru/p/de24be7c-8e21-5586-bca4-bd73a1537dfc/op:15/logo:bottom:weather.png/AQAGfzw-jrRyHmSa6EbffGp_Vfi0j5sF4hkwjUA0wk8C-Q1Hs7R5uk22YwEvWre0xHdrNGRW3oHw47DV1qt4wqPB0vs.jpg	2024-11-11 07:46:42	Погода Mail.ru
ru	https://news.google.com/rss/articles/CBMiUEFVX3lxTE5lTnloQ05JU1hCRm1mOGNLRkp0cmdCUXN4Vm1sWm1lWmJncE5OTHhKb0xWbUljMXpIX3E3R2RDTDNsazI2WjVpNHNndEhzNEFK?oc=5	В ночь с 22 на 23 ноября москвичей приглашают на ночную прогулку в метро / Новости города / Сайт Москвы - Официальный сайт Мэра Москвы	None	None	2024-11-12 08:00:01	Официальный сайт Мэра Москвы