country_code	url	title	description	image_url	publish_date	source
tw	https://tw.stock.yahoo.com/news/5%E5%BC%B5%E5%8D%83%E8%90%AC%E7%99%BC%E7%A5%A8%E6%B2%92%E4%BA%BA%E9%A0%98%EF%BC%81%E6%9C%80%E7%88%BD%E5%8F%AA%E8%8A%B135%E5%85%83-%E8%B3%BC%E8%B2%B7%E5%9C%B0%E9%BB%9E%E3%80%81%E6%98%8E%E7%B4%B0%E4%B8%80%E6%AC%A1%E7%9C%8B-022958446.html	5張千萬發票沒人領！最爽只花35元 購買地點、明細一次看 - Yahoo奇摩股市	財政部表示，113年7-8月期特別獎（新台幣1000萬元）、特獎（200萬元）中獎發票與100萬元雲端發票獎，截至目前各有5張、4張、4張未領。未領的千萬大獎發票包含臺中市南屯區全家便利商店開出的35元發票，以及手搖飲白巷子WHITE ALLEY開出的135元發票。	https://media.zenfs.com/en/cna.com.tw/a7ef86e6b317023d6bbc2e6a47ef612b	2024-11-21 02:32:57	Yahoo奇摩股市
tw	https://news.tvbs.com.tw/life/2692796	LINE免費貼圖來了！「4實用爆款」限時載 這隱藏版永久用│TVBS新聞網 - TVBS	None	None	2024-11-20 12:07:00	TVBS
tw	https://tw.news.yahoo.com/%E5%90%BB%E5%A6%BB%E8%87%89%E9%A0%B0%E9%81%93%E5%88%A5-%E5%8F%B8%E6%A9%9F%E5%93%A1%E5%80%92%E5%88%97%E8%BB%8A%E9%A7%95%E9%A7%9B%E5%AE%A4%E7%8C%9D%E6%AD%BB-%E5%8F%B0%E9%90%B5-%E7%AC%A6%E5%90%88%E4%BC%91%E6%81%AF11%E5%B0%8F%E6%99%82%E8%A6%8F%E5%AE%9A-232900819.html	吻妻臉頰道別…司機員倒列車駕駛室猝死！台鐵：符合休息11小時規定 - Yahoo奇摩新聞	台鐵54歲林姓司機員昨天（20日）駕駛4021次區間車從花蓮和平站發車至新北樹林站；因未發車行駛，被人發現，倒在駕駛座上，沒有呼吸心跳，送醫搶救不治，疑心肌梗塞死亡。據悉，死者案發前當天，出門前才親妻子臉頰說再見，且健康檢查僅三酸甘油酯較高，未料傳出噩耗；對此，台鐵表示，司機符合休息11小時的規定。今天（21日）將由法醫相驗，釐清死因。	https://media.zenfs.com/ko/setn.com.tw/24d05f5e3478281379727c9146fca0e2	2024-11-20 23:29:00	Yahoo奇摩新聞
tw	https://tw.news.yahoo.com/%E7%8D%A8%E5%AE%B6-%E5%9C%8B%E9%81%93%E8%AD%A6%E5%A4%A9%E6%A9%8B%E4%B8%8A%E5%8F%96%E7%B7%A0%E6%8B%8D%E7%85%A7-%E9%81%AD%E6%89%A3%E7%89%8C%E7%94%B7%E5%A4%A9%E5%A4%A9%E5%8F%8D%E6%8B%8Dpo%E7%B6%B2-061600013.html	獨家／國道警天橋上取締拍照 遭扣牌男天天反拍PO網 - Yahoo奇摩新聞	駕駛人都不喜歡收到罰單，就有民眾天天按時前往國道三號175公里處的天橋上，將員警執行取締超速的模樣拍照上傳臉書社團，甚至揶揄說「一男一女員警是神鵰俠侶！」警方說，疑似是這位民眾違規被取締，導致吊扣牌照、丟了工作，所以有這舉動。雖然他沒有過激言論，不過底下網友留言就比較沒有理性，員警提醒這些網友，小心會有觸法疑慮。	https://media.zenfs.com/ko/setn.com.tw/6679804211c8b1ccec93e0250d3b7ad1	2024-11-21 06:22:36	Yahoo奇摩新聞
tw	https://www.cna.com.tw/news/acul/202411210062.aspx	臺灣漫遊錄獲美國國家圖書獎楊双子：我書寫是為了回答台灣人是什麼人| 文化 - 中央社即時新聞	作家楊双子的「臺灣漫遊錄」今天獲得「美國國家圖書獎」，她發表得獎感言說，一百年前台灣人對日本說「台灣是台灣人的台灣」，一百年後，台灣人對中國人說同樣一句話；這一百年來不變的是，「我們一直面對著身邊有強大而且具備侵略性的國家」。	https://imgcdn.cna.com.tw/www/webphotos/WebCover/800/20241121/1323x993_110616875587.jpg	2024-11-21 02:51:00	中央社即時新聞
tw	https://www.ctee.com.tw/news/20241121700066-439901	健保藥價四利多生技業狂歡- 日報 - 工商時報	健保署20日公布健保藥價修正條文，祭出上市新藥給予首發新藥優惠核價、首二張在國內製造學名藥或生物相似性藥證，比照原廠藥價格等四大藥價優惠改革重點。學名藥協會理事長陳誼芬認為，這是提供國內生技產業轉骨升級的關鍵契機，希望能盡快執行助力產業接軌國際。 健保署表示，此次藥物支付標準及藥價調整辦法部分條文修...	https://images.ctee.com.tw/newsphoto/2024-11-21/1024/A03AA3_PictureItem_Clipping_01_5.jpg	2024-11-20 19:00:00	工商時報
tw	https://udn.com/news/story/6809/8374171	前進2024 COP29／氣候變遷指標 我居全球倒數第8名 - 聯合新聞網	氣候變遷績效指標（CCPI）昨在第廿九屆氣候峰會（COP29）公布最新排名，台灣進步一名但仍居全球末段班，排名第六十名。	https://pgw.udn.com.tw/gw/photo.php?u=https://uc.udn.com.tw/photo/2024/11/20/realtime/30939276.jpg&s=Y&x=85&y=0&sw=3831&sh=2555&exp=3600	2024-11-20 16:33:44	聯合新聞網
tw	https://sports.ltn.com.tw/news/breakingnews/4870277	MLB》洋基老闆承諾簽回索托最優先！ 給他隊長與王牌都有的特權 - 自由時報	自由市場最大咖球星索托（Juan Soto）在先前與母隊洋基會面，洋基老闆史坦布瑞納（Hal Steinbrenner）在今天受訪時便提到雙方的會面是場「好的會面」，有不錯的對話。索托在今年球季轉戰洋基，更在合約年打出生涯年，季後賽的絕佳表現更為自己身價做出最好	https://img.ltn.com.tw/Upload/sports/page/800S/2024/11/21/phpJpzBoT.jpg	2024-11-20 23:35:00	自由時報
tw	https://tw.news.yahoo.com/%E5%8F%B0%E4%B8%AD%E5%B8%82%E8%A1%97%E9%A0%AD%E5%86%8D%E7%8F%BE-%E8%B2%AA%E9%A3%9F%E8%9B%87%E4%BA%BA%E9%BE%8D-%E4%B8%8A%E5%8D%83%E4%BA%BA%E7%98%8B%E6%90%B6%E7%89%A9%E8%AA%BF%E5%88%B8-%E9%9A%8A%E4%BC%8D%E7%9C%8B%E4%B8%8D%E5%88%B0%E7%9B%A1%E9%A0%AD-005600466.html	台中市街頭再現「貪食蛇人龍」！上千人瘋搶物調券…隊伍看不到盡頭 - Yahoo奇摩新聞	台中購物節活動發放第二波物調券，今日（21日）起至23日可在各地市場、夜市、商圈等108處領取物調券，共計發放35萬份，民眾可以100元現金換200元購物券，每人限領2份。而在霧峰公有零售市場領取處，一早時間還沒到，就湧現大批民眾來排隊，現場隊伍綿延好幾個路口，宛如貪食蛇般場景，相當驚人。	https://media.zenfs.com/ko/setn.com.tw/ab1fddb756f50f5905492a8349ae4ae8	2024-11-21 01:04:28	Yahoo奇摩新聞
tw	https://udn.com/news/story/7001/8371611	12強賽／日媒評價中華隊關鍵打者多 沒有放下警戒空間 - 聯合新聞網	世界12強棒球賽複賽將從明天在東京巨蛋展開，日本隊以地主之姿尋求二連霸，「報知體育」針對最後3支對手戰力分析，對中華隊的...	https://pgw.udn.com.tw/gw/photo.php?u=https://uc.udn.com.tw/photo/2024/11/19/0/30930141.jpg&s=Y&x=0&y=0&sw=1092&sh=728&exp=3600	2024-11-19 22:59:05	聯合新聞網
tw	https://www.ettoday.net/news/20241121/2859484.htm	開戰以來首度！ 俄發射洲際彈道飛彈攻擊烏克蘭 - ETtoday新聞雲	烏克蘭空軍表示，俄羅斯21日對烏克蘭發動攻擊，發射多枚飛彈，其中一枚是洲際彈道飛彈。這是俄烏戰爭開打以來，俄羅斯首度在戰爭期間使用威力如此強大的遠程飛彈。	https://cdn2.ettoday.net/images/7959/e7959499.jpg	2024-11-21 08:43:00	ETtoday新聞雲
tw	https://udn.com/news/story/7243/8373665	農地變工廠 次年起課地價稅 - 聯合新聞網	基隆市稅務局表示，農業用地原本免課地價稅，但如果農地變工廠，變更為非農業使用，就必須自次年起恢復課徵地價稅。	https://udn.com/static/img/UDN_BABY.png	2024-11-20 16:46:34	聯合新聞網
tw	https://news.tvbs.com.tw/world/2693020	烏對俄境內發射「暴風之影飛彈」！傳打擊俄軍指揮所 恐有北韓將領│TVBS新聞網 - TVBS	None	None	2024-11-20 23:47:00	TVBS
tw	https://news.tvbs.com.tw/sports/2693491	12強／中華隊7安比對手多卻遭委內瑞拉完封 曾豪駒：少適時一擊│TVBS新聞網 - TVBS	None	None	2024-11-21 06:13:00	TVBS
tw	https://tw.sports.yahoo.com/news/%E5%8F%B0%E7%81%A3%E5%A5%BD%E6%89%8B%E5%A4%96%E8%AA%9E%E8%83%BD%E5%8A%9B%E5%BC%B7-%E5%90%89%E5%8A%9B%E5%90%89%E6%92%88%E5%8F%97%E8%A8%AA-%E5%85%A8%E8%8B%B1%E6%96%87-%E8%AE%9A%E9%99%B3%E5%82%91%E6%86%B2-%E7%B5%A6%E9%9A%8A%E5%8F%8B%E5%80%91%E5%BE%88%E5%A4%A7%E6%94%AF%E6%8C%81-054100561.html	台灣好手外語能力強！吉力吉撈受訪「全英文」 讚陳傑憲：給隊友們很大支持 - Yahoo奇摩運動	[FTNN新聞網]記者陳宣穎/綜合報導中華隊在世界棒球12強預賽以4勝1敗晉級複賽，今（21）日在東京巨蛋對戰委內瑞拉，以0：2落敗。而預賽中與澳洲一戰，代打敲出...	https://media.zenfs.com/ko/ftnn_com_tw_939/da14f51ed2ce49658d03b8f5a6d68051	2024-11-21 06:04:32	Yahoo奇摩運動
tw	https://udn.com/news/story/10930/8372809	鷹式飛彈被要求無償援贈烏克蘭 下一項還要送什麼？ - 聯合新聞網	外媒報導，空軍去年除役的15組鷹式飛彈，被「無償援贈」給烏克蘭，這與原外傳由美國「購回」再轉支援烏國的說法不同。空軍未來...	https://pgw.udn.com.tw/gw/photo.php?u=https://uc.udn.com.tw/photo/2024/11/20/realtime/30939291.jpg&s=Y&x=0&y=0&sw=599&sh=399&exp=3600	2024-11-20 06:39:43	聯合新聞網
tw	https://www.mirrormedia.mg/story/20241121edi041	疾管署「土皇帝」音檔曝光 飆高音喊「神經病」！霸凌調查報告下週四出爐 - 鏡週刊	不只勞動部發生霸凌案，衛福部疾管署疑似也出現霸凌案件，有網友於15日在社群Threads爆料，稱疾管署有一名「土皇帝」，常對同仁大聲咆哮、摔公文，甚至還人身攻擊辱罵。今（21日）有段關於該名「土皇帝」的錄音檔，也在網上曝光流傳。	https://v3-statics.mirrormedia.mg/images/7f76239d-7c21-4090-a048-2a12036c8eb2-w1600.jpg	2024-11-21 10:03:37	鏡週刊
tw	https://udn.com/news/story/7315/8374664	2年沒交租也沒催 暖心房東想起上門找…女租客竟已成白骨 - 聯合新聞網	台北市萬華區雅江街一處出租套房，昨天傍晚發現51歲林姓女租客陳屍床上，死亡時間超過半年已成骨骸，警方勘驗，目前研判沒有外...	https://pgw.udn.com.tw/gw/photo.php?u=https://uc.udn.com.tw/photo/2024/11/21/realtime/30944448.jpg&s=Y&x=0&y=196&sw=2365&sh=1577&exp=3600	2024-11-21 02:39:51	聯合新聞網
tw	https://news.tvbs.com.tw/sports/2693410	12強／台人熱情應援中華隊 網嗨：活生生把東京巨蛋喊成主場 - TVBS	None	None	2024-11-21 04:53:00	TVBS
tw	https://sports.ltn.com.tw/news/breakingnews/4871260	12強直擊》東蛋美日大戰票房出爐 竟不敵台灣隊的大巨蛋 - 自由時報	世界12強今天晚場複賽上演被視為冠軍前哨戰的「日美大戰」，未料無論下層和上層的內野看台都有明顯的空位，最終票房僅開出25428人，比台北大巨蛋台灣主場平均票房還要低。今天是日本武士隊本屆12強首度在東京巨蛋亮相，雖然外野幾乎全滿，但內野的空位很明顯，跟去年3月經典賽差很多，去年東蛋只要有日本武士隊的	https://img.ltn.com.tw/Upload/sports/page/800S/2024/11/21/phpCVWKGG.jpg	2024-11-21 13:19:00	自由時報
tw	https://udn.com/news/story/124274/8374600	勞動部霸凌案 鍾小平按鈴告發謝宜容過失致死、調查小組瀆職 - 聯合新聞網	勞動部勞發署北分署吳姓公務員之死，勞動部淪為全民譏諷的「勞工地獄」，國民黨台北市議員鍾小平今早至台北地檢署按鈴告發謝宜容...	https://pgw.udn.com.tw/gw/photo.php?u=https://uc.udn.com.tw/photo/2024/11/21/realtime/30944373.jpg&s=Y&x=0&y=30&sw=4032&sh=2688&exp=3600	2024-11-21 02:20:47	聯合新聞網
tw	https://tw.news.yahoo.com/%E5%A4%A7%E9%99%B8%E5%86%B7%E6%B0%A3%E5%9C%98%E4%B8%8B%E5%91%A8%E4%BE%86%E8%A5%B2-%E5%8C%97%E9%83%A8%E5%86%8D%E8%BD%89%E5%86%B7%E5%B9%B3%E5%9C%B0%E4%BD%8E%E6%BA%AB%E6%8E%A214%E2%84%83-095323324.html	大陸冷氣團下周來襲 北部再轉冷平地低溫探14℃ - Yahoo奇摩新聞	中央氣象署表示，東北季風持續影響至23日（周六），24、25日（周日、下周一）北部高溫可回升至攝氏26度左右；但下波東北季風26日（下周二）南下，27、28日（下周三、下周四）可能增強為大陸冷氣團，北部平地再轉冷，低溫下探14度。	https://media.zenfs.com/zh-tw/cna.com.tw/9f07f4162dbe80b92bbd787af6ccfaca	2024-11-21 09:53:24	Yahoo奇摩新聞
tw	https://tw.sports.yahoo.com/news/%E6%BA%96%E5%82%99%E7%8B%A0%E9%9B%BB%E9%A6%99%E6%B8%AF-%E4%B8%AD%E8%8F%AF%E7%94%B7%E7%B1%83-%E5%A4%A2%E5%B9%BB%E9%9A%8A-%E7%A1%AC%E5%AF%A6%E5%8A%9B%E6%9C%89%E5%A4%9A%E5%BC%B7-%E9%81%8B%E5%BD%A9%E9%96%8B%E7%9B%A4-083237732.html	準備狠電香港！中華男籃「夢幻隊」硬實力有多強 運彩開盤一面倒 - Yahoo奇摩運動	亞洲盃資格賽第二階段賽事開打！中華男籃今（21）日晚間將在台北和平籃球館迎戰香港隊。本次比賽中華隊名單堪稱近年最強，陣容中匯集7名旅外球員及新歸化球員高柏鎧，甚至被外界譽為「夢幻隊」，球迷們高度期待能在主場拿下首勝。	https://s.yimg.com/ny/api/res/1.2/JwEVJAA8eZHI3_ronK06XA--/YXBwaWQ9aGlnaGxhbmRlcjt3PTEyMDA7aD03ODk7Y2Y9d2VicA--/https://media.zenfs.com/ko/gotv_ctitv_com_tw_678/6b5bd399bfa3d641c7a578a2018908d5	2024-11-21 08:32:37	Yahoo奇摩運動
tw	https://udn.com/news/story/7320/8371772	奇蹟生還！宜蘭古魯林道找手機登山客 失聯近3天存活 - 聯合新聞網	新北55歲鍾姓男子16日隨山友到宜蘭大同鄉寒溪村古魯林道爬山，17日上午找手機脫隊失聯，宜蘭縣消防局等搜救單位連續搜救3...	https://pgw.udn.com.tw/gw/photo.php?u=https://uc.udn.com.tw/photo/2024/11/20/realtime/30936883.jpg&s=Y&x=0&y=17&sw=960&sh=640&exp=3600	2024-11-20 01:29:08	聯合新聞網
tw	https://www.ctee.com.tw/news/20241120701160-430201	鴻準暴跌 這幾檔搭BBU閃紅燈 台股翻黑挫百點原因是「它」 - 工商時報	美股四大指數漲跌互見，市場靜待輝達財報，台股今（20）日開高走平，指標股台積電早盤最高達1,050元，讓大盤一度漲百點，不過權王盤中翻黑，電子權值股跟進走跌，僅鴻海、日月光投控、廣達守紅盤，塑膠和紡織等傳統股也震盪走低，加上台指期壓低結算，台股終場跌160.44點，收22,688.36點，成交量3,...	https://images.ctee.com.tw/newsphoto/2024-11-18/1024/A06AA6_PictureItem_Clipping_01_5.jpg	2024-11-20 06:21:00	工商時報
tw	https://udn.com/news/story/7323/8373061	新北男疑對施工粉塵過敏抑鬱輕生 星聚點喊冤：能做的都盡力了 - 聯合新聞網	新北板橋一名年約60歲男子不滿社區大樓拆除施工粉塵瀰漫，讓他全身過敏、失眠，也透過臉書控訴公權力不彰，忿忿不平到走絕路。...	None	2024-11-20 08:13:13	聯合新聞網
tw	https://www.businesstoday.com.tw/article/category/183016/post/202411200001/	中鋼今年獲利可望勝去年！但中國每年兩億噸鋼鐵待消化、東南亞又新增產量...新董座將如何應戰？ - 今周刊-在今天看見明天	儘管明年鋼市趨向樂觀，川普當選美國總統卻將為鋼鐵產業發展埋下變數。

眼看未來鋼市將受劇烈衝擊，台灣鋼鐵龍頭中鋼的轉型迫在眉睫。
	https://doqvf81n9htmm.cloudfront.net/data/crop_article/166707/72.jpg_600x450.jpg	2024-11-20 00:36:00	今周刊-在今天看見明天
tw	https://udn.com/news/story/124274/8373824	海科館長被控職場霸凌教育部調查中 員工：館長開會變溫和了 - 聯合新聞網	職場霸凌問題近日引發社會關注，勞動部勞動力發展署北分署吳姓公務員之死引發眾怒，上月也被控職場霸凌國立海洋科技博物館館長陳...	https://pgw.udn.com.tw/gw/photo.php?u=https://uc.udn.com.tw/photo/2024/11/20/realtime/30941893.jpg&s=Y&x=0&y=5&sw=853&sh=568&exp=3600	2024-11-20 13:15:31	聯合新聞網
tw	https://news.tvbs.com.tw/life/2692156	連鎖黑浮咖啡「欠薪倒店」！一排4間全關 業者回應了│TVBS新聞網 - TVBS	None	None	2024-11-20 05:38:00	TVBS
tw	https://tw.news.yahoo.com/5%E5%84%84%E9%AB%98%E4%B8%AD%E7%94%9F%E6%A1%88%E4%BA%8C%E5%AF%A9%E9%96%8B%E5%BA%AD-%E5%A4%8F%E7%94%B7%E9%99%A2%E5%A4%96%E5%A4%B1%E6%8E%A7%E6%89%AF%E6%8E%89%E6%B0%91%E7%9C%BE%E5%8F%A3%E7%BD%A9-050834379.html	5億高中生案二審開庭 夏男院外失控扯掉民眾口罩 - Yahoo奇摩新聞	（中央社記者趙麗妍台中21日電）賴姓男高三生案，一審依偽造文書將與賴男同婚的夏姓男子判1年6月；夏男今天二審出庭，在法院外情緒失控，狠瞪民眾揚言提告，更出手扯掉1名女子口罩，現場一度混亂。	https://s.yimg.com/cv/apiv2/social/images/yahoo_default_logo-1200x1200.png	2024-11-21 05:21:41	Yahoo奇摩新聞
tw	https://www.setn.com/News.aspx?NewsID=1567376	美國國會兵推中國犯台：美軍馳援前「台灣須靠自身兵力撐一個月」 - 房產	美國眾議院特別委員會今天與智庫模擬中國犯台兵推。與會學者評估，兩岸衝突開始後，解放軍將包圍台灣，使美國無法向台派遣部隊增援，到第4週才有可能進行海空馳援，台灣在這之前須靠自身兵力作戰。	https://attach.setn.com/newsimages/2024/11/21/4901695-PH.jpg	2024-11-21 03:30:54	房產
tw	https://tw.sports.yahoo.com/news/12%E5%BC%B7%E3%80%8B%E5%B0%8F%E5%9C%92%E6%B5%B7%E6%96%973%E6%94%AF%E9%95%B7%E6%89%93%E5%8C%85%E8%BE%A67%E5%88%86%E6%89%93%E9%BB%9E-%E6%97%A5%E6%9C%AC%E9%9A%8A9%E6%AF%941%E5%A4%A7%E5%8B%9D%E7%BE%8E%E5%9C%8B%E9%9A%8A-130954987.html	12強》小園海斗3支長打包辦7分打點 日本隊9比1大勝美國隊 - Yahoo奇摩運動	2024年第三屆世界12強棒球賽今（11月21日）複賽第二場賽事，晚間由日本隊主場迎戰美國隊， 分別是22歲的高橋宏斗對決44歲老將Rich Hill，兩隊先發投手不分軒輊，雙方前4局都沒能有太好的機會，不過5局後日本隊靠著小園海斗3支長打其中包含雙響砲貢獻7分打點，最終以9比1大勝美國隊，並將在明台灣時間晚上6點對決委內瑞拉。	https://s.yimg.com/ny/api/res/1.2/quIUz.uUpLxDls4VuufLOw--/YXBwaWQ9aGlnaGxhbmRlcjt3PTEyMDA7aD04MDA7Y2Y9d2VicA--/https://s.yimg.com/os/creatr-uploaded-images/2024-11/8c3b9250-a802-11ef-aef7-1a8845e28007	2024-11-21 13:09:54	Yahoo奇摩運動
tw	https://www.ctee.com.tw/news/20241121700258-439901	輝達財報樂觀明年散熱、BBU受關注- 日報 - 工商時報	輝達即將公布最新一季財報，前一日輝達股價率先上漲近5％，這是輝達納入道瓊指數後，首次公布財報，影響美股甚巨。專家認為，輝達財報亮眼，但要看華爾街埋不埋單，台股的「輝黃概念股」有機會重演上半年跟著輝達一起大漲的行情。 輝達8月公布財報，當季營收300.4億美元，年增122.4％，淨利率55.26％，年...	https://images.ctee.com.tw/newsphoto/2024-11-21/1024/A26AB2_PictureItem_Clipping_03_4.jpg	2024-11-20 19:00:00	工商時報
tw	https://sports.ltn.com.tw/news/breakingnews/4870863	路跑》「最強市民跑者」李智群最硬北竿馬拚連霸 化身大魔王1打4 - 自由時報	第九屆馬祖北竿硬地超級馬拉松將於明年3月21日及3月22日在馬祖北竿開跑，尋求衛冕的「最強市民跑者」李智群今先在「硬在壁山GO硬RUN 12.5KM極速接力挑戰表演賽」小試身手，最終以56分16秒擊敗由鄉長吳金平領銜四人接力隊的1小時18分37秒。	https://img.ltn.com.tw/Upload/sports/page/800S/2024/11/21/4870863_1.jpg	2024-11-21 07:18:00	自由時報
tw	https://www.ctee.com.tw/news/20241120700062-439901	GB200出貨在即台伺服器廠SC24秀新品- 日報 - 工商時報	採用輝達NVIDIA Grace CPU＋Blackwell GPU的GB200機櫃式AI伺服器，將於明年第一季起陸續放量出貨，多家台伺服器廠也於正於美國舉辦的SC24（Super computing 2024）中展出配置液冷的解決方案。近日來，包括廣達、鴻海、技嘉、華碩及和碩等台廠，皆相繼預告旗下...	https://images.ctee.com.tw/newsphoto/2024-11-20/1024/A03AA3_Table_Clipping_03_4.jpg	2024-11-19 19:00:00	工商時報
tw	https://udn.com/news/story/120911/8374772	放20年增值了嗎？大戶收藏2千張「光學電話卡」 驚人退費金額曝光 - 聯合新聞網	家裡還有早期未使用完的電話卡嗎？千萬別丟！台灣在1976年初引進的「卡式電話機」，必須使用「光學電話卡」才能撥號，是採在表面塗層刻痕記錄卡片餘額。近日有人將珍藏20年的電話話拿去退費，事件曝光引發熱議。	https://pgw.udn.com.tw/gw/photo.php?u=https://uc.udn.com.tw/photo/2024/11/21/0/30944757.jpg&s=Y&x=0&y=0&sw=968&sh=645&exp=3600	2024-11-21 03:37:01	聯合新聞網
tw	https://www.edh.tw/article/37019	前警政署長驟逝！最易忽略的「猝死前5症狀」肚子脹、手臂痠也中 - 早安健康	None	None	2024-11-21 07:38:30	早安健康
tw	https://tw.news.yahoo.com/%E5%B9%B4%E7%B5%82%E7%8D%8E%E9%87%91%E6%8E%80%E7%89%8C-%E4%BB%8A%E5%B9%B4%E4%BC%81%E6%A5%AD%E5%B9%B4%E7%B5%82%E7%8D%8E%E9%87%91%E5%B9%B3%E5%9D%871-12%E5%80%8B%E6%9C%88-%E9%80%99%E8%A1%8C%E6%A5%AD%E9%80%A313%E5%B9%B4%E7%A8%B1%E9%9C%B8-045434990.html	年終獎金掀牌！今年企業年終獎金平均1.12個月，這行業連13年稱霸 - Yahoo奇摩新聞	2024年千萬名勞工薪情如何？104人力銀行調查顯示，2024年整體年薪平均80.2萬元。半導體以平均103.5萬、8連...	https://s.yimg.com/ny/api/res/1.2/zn84D52uajtlWAGTYRAQtQ--/YXBwaWQ9aGlnaGxhbmRlcjt3PTEyMDA7aD04MDA7Y2Y9d2VicA--/https://media.zenfs.com/ko/udn.com/76f0e14c5b9513ebf5da54d48bca3b27	2024-11-21 04:57:57	Yahoo奇摩新聞
tw	https://www.storm.mg/article/5277530	不是公視？爆余天真正要的是這位子 他曝綠營絕情後果：這地方2026危險了 - 風傳媒	民進黨前立委余天日前接受專訪爆料，民進黨欠他太多，曾答應要給公視、華視董座或基金會職位，最後什麼都沒有，僅國策顧問一職，讓他感嘆政治很現實。對此，媒體人張禹宣在節目《57爆新聞》指出，余天真正想要卻沒拿到的不是公視董座，而是這個位子。張禹宣也直言，民進黨絕情的後果恐怕衝擊綠營20	https://image.cache.storm.mg/styles/smg-800x533-fp/s3/media/image/2024/01/05/20240105-074534_U18448_M922663_e4f7.jpeg?YEKuwrfwUrA2Zu2XxwIj_8uI8TKEvxP9&itok=h30lHe8D	2024-11-20 13:20:00	風傳媒
tw	https://www.ettoday.net/news/20241121/2859530.htm	謝宜容娘家醬油廠 Google地圖遭網改名「立意良善醬油」：1罐80 - ETtoday新聞雲	勞動部前分署長謝宜容被指涉霸凌下屬、導致吳姓職員輕生，而謝宜容事實上是雲林某老牌「龍X醬油」的後代，並經地方人士證實。消息曝光，大量網友湧入Google評論區留下1星負評，甚至惡搞店名和位置，留言開酸「刷1星是我目的良善」、「會通靈的醬油一罐80」。	https://cdn2.ettoday.net/images/7959/e7959569.jpg	2024-11-21 09:28:00	ETtoday新聞雲
tw	https://sports.ltn.com.tw/news/breakingnews/4871285	12強直擊》陳柏清明先發抗美！預賽獲日本投教好評 - 自由時報	世界12強台灣隊明天中午出戰美國隊，稍早宣布推派陳柏清先發，為台灣隊力拚複賽首勝。陳柏清在12強預賽對日本隊投3.1局失3分（2責失），雖然自評不理想，曾在台鋼雄鷹隊帶過他的日本隊投手教練吉見一起，賽後評價他的壓制力還不錯，「他真的是1名很認真的球員，而且又年輕，今後一定會更好。」	https://img.ltn.com.tw/Upload/sports/page/800S/2024/11/21/phpQDZtqj.jpg	2024-11-21 13:42:00	自由時報
tw	https://sports.ltn.com.tw/news/breakingnews/4870912	12強》大聯盟記者盛讚有MLB等級天賦！陳傑憲今猛打賞連日媒也關注 - 自由時報	台灣隊隊長陳傑憲在本屆12強預賽繳出超優異表現，讓大聯盟官網記者摩洛西也發文盛讚（Jon Paul Morosi），而台灣前進東京後，今在複賽首戰對決委內瑞拉，陳傑憲更上演3安猛打賞，也用表現親自印證自己的實力。台灣隊在預賽拿下4勝1敗佳績，以B組第2名之姿晉級複賽。身為隊長的	https://img.ltn.com.tw/Upload/sports/page/800S/2024/11/21/phpGiBjQw.jpg	2024-11-21 08:04:00	自由時報
tw	https://udn.com/news/story/6928/8376407	擬遭清大整併！中華大學明將召開校務發展重大說明會 - 聯合新聞網	國立清華大學2016年合併國立新竹教育大學，再傳出將整併私立中華大學，於該校設立「半導體學院」，持續擴充版圖。中華大學今召開...	https://pgw.udn.com.tw/gw/photo.php?u=https://uc.udn.com.tw/photo/2024/11/21/realtime/30948658.jpg&s=Y&x=0&y=6&sw=893&sh=594&exp=3600	2024-11-21 12:57:16	聯合新聞網
tw	https://tw.news.yahoo.com/%E5%92%96%E5%95%A1%E5%BB%B3%E4%B8%8D%E6%B6%88%E8%B2%BB%E6%89%BE%E6%8F%92%E5%BA%A7%E6%89%8B%E6%A9%9F%E5%85%85%E9%9B%BB-%E7%84%A1%E8%B3%B4%E5%A5%B3%E7%AB%8A%E9%9B%BB4-7%E5%85%83%E9%81%AD%E7%BD%B0%E9%87%912000-090928701.html	咖啡廳不消費找插座手機充電 無賴女竊電4.7元遭罰金2000 - Yahoo奇摩新聞	CNEWS匯流新聞網記者王昭濱／綜合報導 嘉義一名吳姓女子今年9月因手機沒電，結果至路易莎咖啡廳用插座充電，全程1小時但未消費，店員多次勸阻未果，無奈只能報警，警方到場後，吳女還強辯稱，「用的是台電的電，不是路易莎的電。」警方好氣又好笑，將她以現行犯逮捕，全案經嘉義地院審理，依竊取電能罪判罰她2000元，全案可上訴。 判決指出，今年9月間，吳女至嘉義市區路易...	https://media.zenfs.com/ko/cnews.com.tw/2e8e03cf58b2210ade654ce7427a241e	2024-11-21 09:09:28	Yahoo奇摩新聞
