country_code	url	title	description	image_url	publish_date	source
tw	https://www.ctee.com.tw/news/20241031700362-430702	美晶片股狂殺費半大跌3.3％ 這檔雪崩30％原因找到了- 國際 - 工商時報	美國經濟數據好壞參半，美股四大指數30日全面走跌，其中費城半導體指數淪重災區，重挫超過3％，超微財測不佳、美超微遭安永切割一度重挫逾30％，其餘包括高通、美光、輝達均同步大跌，台股ADR也重挫。 美股四大指數30全倒，道瓊指數下跌91.51點，或0.22%，收在42,141.54點。那斯達克指數下滑...	https://images.ctee.com.tw/newsphoto/2024-10-27/1024/A01AA1_PictureItem_Clipping_02_4.jpg	2024-10-31 00:01:00	工商時報
tw	https://tw.stock.yahoo.com/news/%E6%85%98%E8%BC%B8%E9%9F%93%E5%9C%8B%E5%90%8C%E6%A5%AD-%E4%B8%89%E6%98%9F%E6%99%B6%E7%89%87%E7%8D%B2%E5%88%A9%E6%85%98%E6%91%944%E6%88%90-%E9%99%B8%E8%A1%8C%E4%B9%8B-%E5%8D%83%E8%90%AC%E5%88%A5%E6%83%B9%E5%8F%B0%E7%A9%8D%E9%9B%BB-073009304.html	慘輸韓國同業！三星晶片獲利慘摔4成 陸行之：千萬別惹台積電 - Yahoo奇摩股市	三星公布第三季獲利，晶片業務營業利潤約3.86兆韓元、季減4成，低於市場預期，遭同業SK海力士、美光超車，知名半導體分析師陸行之在臉書分析原因，結論是不要惹到台積電。	https://s.yimg.com/cv/apiv2/social/images/yahoo_default_logo-1200x1200.png	2024-10-31 07:30:09	Yahoo奇摩股市
tw	https://tw.news.yahoo.com/%E9%A2%B1%E9%A2%A8%E5%A4%9C%E6%90%B6%E4%BF%AE%E7%90%86%E5%B1%8B%E9%A0%82%E9%90%B5%E7%9A%AE-%E4%B8%AD%E5%92%8C%E7%94%B7-5%E6%A8%93%E6%8E%89%E5%88%B01%E6%A8%93-%E8%BA%AB%E4%BA%A1-121322072.html	颱風夜搶修理屋頂鐵皮 中和男「5樓掉到1樓」身亡 - Yahoo奇摩新聞	[周刊王CTWANT] 據了解，死者生前向卿姓妻子表示自己要去5樓修理屋頂鐵皮，2人帶著28歲女兒一起上屋頂，陳男則攀爬到頂樓加蓋進行搶修，但疑似風勢過大，陳男不慎從5樓跌落。警消趕抵時發現陳男頭部破裂，使用自動體外去顫器（AED）檢測後確認其明顯死亡，警方則研判現場無打鬥痕跡，鑑識人...	https://media.zenfs.com/ko/ctwant_com_582/31892a487724f87ae4233a08d6d08b20	2024-10-31 13:17:17	Yahoo奇摩新聞
tw	https://tw.sports.yahoo.com/news/mlb-%E7%B4%90%E7%B4%84%E7%90%83%E8%BF%B7%E6%9A%B4%E5%8A%9B%E6%90%B6%E7%90%83-%E4%B8%8B%E5%A0%B4%E6%9B%9D%E5%85%89-%E6%B4%8B%E5%9F%BA%E7%B8%BD%E6%95%99%E7%B7%B4%E4%B9%9F%E9%96%8B%E7%BD%B5-004941325.html	MLB》紐約球迷暴力搶球「下場曝光」 洋基總教練也開罵 - Yahoo奇摩運動	洋基昨在世界大賽第四戰以11比4贏球，頂住聽牌壓力延長戰線，但兩名洋基球迷暴力搶球的爭議仍持續延燒，大聯盟官方與洋基宣布第五戰禁止兩人進場，洋基總教練布恩（Aaron Boone）也批評球迷的舉動，並認為這件事不應該發生。	https://s.yimg.com/cv/apiv2/social/images/yahoo_default_logo-1200x1200.png	2024-10-31 01:05:40	Yahoo奇摩運動
tw	https://tw.sports.yahoo.com/news/%E5%A5%87%E5%9F%BA%E5%A4%A7%E6%88%B0-%E7%94%B7%E4%B8%BB%E8%A7%92%E5%A4%B1%E8%89%B2-%E5%A4%A7%E8%B0%B7%E5%8A%A0%E8%B3%88%E5%90%894%E6%88%B0%E4%B8%96%E7%95%8C%E5%A4%A7%E8%B3%BD%E5%90%88%E8%A8%884%E5%AE%8911k-071519439.html	「奇基大戰」男主角失色！大谷加賈吉4戰世界大賽合計4安11K - Yahoo奇摩運動	體育中心／黃崇超報導世界大賽睽違43年，再度迎來道奇與洋基，大聯盟2支豪門球隊正面交鋒，不只票價翻倍暴漲，日籍二刀流大谷翔平與全壘打王「法官」賈吉（Aaron Judge）同場較勁，更是球迷關注焦點。不過「奇基大戰」2位男主角表現卻很低迷，系列賽4戰個別繳出15打數2安、打擊率1成33，而且沒有出現全壘打，合計吞下11次三振，打擊成績意外「平分秋色」。	https://media.zenfs.com/en/ftvn.com.tw/c7b3a6b2e1382a5eb1525e1eba0ae8f2	2024-10-30 07:15:19	Yahoo奇摩運動
tw	https://tw.news.yahoo.com/%E6%82%9A-%E6%90%AD%E9%AB%98%E9%90%B5%E6%89%8D%E5%9D%90%E4%B8%8B-%E5%B1%81%E8%82%A1-%E9%99%A3%E5%88%BA%E7%97%9B-%E7%94%B7%E9%81%AD%E9%87%9D%E6%89%8E%E5%9A%87%E5%A3%9E%E6%8E%9B%E6%80%A5%E8%A8%BA-055819361.html	悚！搭高鐵才坐下「屁股一陣刺痛」 男遭針扎嚇壞掛急診 - Yahoo奇摩新聞	搭高鐵驚魂！旅客追蹤身體半年？有民眾網路發文表示，昨天（10／30）搭乘高鐵時，才剛找好座位坐下，沒想到屁股傳出一陣刺痛，趕緊起身才發現座位上有一根銀色的針，他嚇壞趕緊通報站務人員，並且趕快去急診就醫。對此，高鐵也回應了。	https://media.zenfs.com/ko/taisounds_com_380/2494e64972721839d88c297da3642663	2024-10-31 06:21:59	Yahoo奇摩新聞
tw	https://www.ettoday.net/news/20241031/2846222.htm	快訊／中颱康芮掏空路基！高雄台20線驚見10公尺天坑 - ETtoday新聞雲	高雄市桃源區南橫公路台20線99K（復興里路段）31日出現10公尺長的天坑。警消獲報後，立刻到場拉起封鎖線封閉道路，確保用路人安全。

	https://cdn2.ettoday.net/images/7926/e7926338.jpg	2024-10-31 12:32:00	ETtoday新聞雲
tw	https://www.setn.com/News.aspx?NewsID=1556833	快訊／康芮颱風速度加快18:40雲林麥寮出海| 生活 - 三立新聞網 Setn.com	康芮颱風「直衝中央山脈」後減弱為中度颱風，7級暴風半徑從320公里縮小為280公里，且移動速度加快，氣象署指出，其中心已在18時40分從雲林麥寮出海。	https://attach.setn.com/newsimages/2024/10/31/4874751-PH.jpg	2024-10-31 11:15:00	三立新聞網 Setn.com
tw	https://money.udn.com/money/story/5621/8328256	房市急降溫 房仲：現在出門看屋都是這類人 - 經濟日報	中信房屋統計內部成交件數，10月全台交易量相較於上月減少約17%，較去年同期減少約21%。觀察六都的成交量數據變化，桃園...	https://pgw.udn.com.tw/gw/photo.php?u=https://uc.udn.com.tw/photo/2024/10/31/realtime/30816279.jpg&s=Y&x=0&y=0&sw=1476&sh=984&sl=W&fw=1050&exp=3600	2024-10-31 02:46:35	經濟日報
tw	https://www.edh.tw/article/36880	82歲石英逝世「演戲一輩子很幸運」多年前換肝續命，最後遺願盼身後事從簡 - 早安健康	None	None	2024-10-30 06:38:44	早安健康
tw	https://def.ltn.com.tw/article/breakingnews/4848329	增加服役誘因 國防部：刻正研議調增志願役勤務加給及戰鬥部隊加給 - 軍武	立法委員楊曜日前在立法院對行政院長提出施政質詢，針對澎湖駐軍人數丶離島官兵加給問題，建議國防部增加志願役加給，提升台灣青年從軍意願，充實國軍戰力。根據國防部在10月29日最新提交的說明內容指出，為持續提升志願役官士兵薪資待遇，國防部刻正研議調增志願役勤務加給及戰鬥部隊加給，將視國家財政裕度及可獲得國	https://img.ltn.com.tw/Upload/def/page/800/2024/10/31/phpaR0C9O.jpg	2024-10-31 07:28:00	軍武
tw	https://www.ctee.com.tw/news/20241031700125-439901	基辛格惹惱台積英特爾痛失折扣- 日報 - 工商時報	路透29日報導，基辛格（Pat Gelsinger）三年前接掌英特爾執行長時，冀望帶領這家美國晶片指標大廠重振雄風。然而，他一上任就犯下大錯。 四位知悉內情人士透露，英特爾原與晶圓代工巨擘台積電之間擁有相當不錯的交易。英特爾自行設計卻無法生產的晶片，會交由台積電製造，台積電也會給予英特爾極大的折扣。...	https://images.ctee.com.tw/newsphoto/2024-10-31/1024/A08AA8_PictureItem_Clipping_02_3.jpg	2024-10-30 19:00:00	工商時報
tw	https://newtalk.tw/news/view/2024-10-31/942570	不斷更新》連江縣及27地區15校放颱風假! 22縣市11/1停班停課一覽| 生活 - Newtalk新聞	康芮颱風今(31)日13時40分從台東成功登陸，受到地形破壞，目前已轉弱為中度颱風，預計今日深夜離台。中央氣象署下午4點公布最新風雨預測，預估明日中午前僅剩8縣市達停班停課標準。以下為各縣市停班、停課相關資訊一覽。基隆市明天照常上班、照常上課。台北市明天照常上班、照常上課。文化大學遠距上課。台北市私	https://s.newtalk.tw/album/news/926/6711c6064d3fa.jpg	2024-10-31 15:38:41	Newtalk新聞
tw	https://udn.com/news/story/7266/8330176	花蓮凌晨密集連4震 0:18規模5.5全台有感 1縣市國家級警報響 - 聯合新聞網	康芮颱風影響期間，花蓮今天凌晨0時許連續4起有感地震，從凌晨0時18分至50分，包括1起顯著有感地震、全台及澎湖縣有感，...	https://pgw.udn.com.tw/gw/photo.php?u=https://uc.udn.com.tw/photo/2024/11/01/realtime/30821337.png&s=Y&x=111&y=0&sw=1275&sh=851&exp=3600	2024-10-31 21:59:30	聯合新聞網
tw	https://www.chinatimes.com/realtimenews/20241031004440-260402	竹北24樓住戶肉身與康芮拔河人群搏命拉住陽台！現場超驚險- 社會 - 中時新聞網	None	https://images.chinatimes.com/newsphoto/2024-10-31/656/20241031004444.jpg	2024-10-31 10:59:37	中時新聞網
tw	https://tw.news.yahoo.com/%E7%9F%A5%E5%90%8D%E9%9B%BB%E5%BD%B1-%E6%88%B2%E5%8A%87%E5%B8%B8%E5%9C%A8%E9%80%99%E5%8F%96%E6%99%AF-%E5%8C%97%E5%B8%82%E6%96%B0%E7%94%9F%E5%92%8C%E5%B9%B3%E5%A4%A9%E6%A9%8B%E5%B0%87%E6%8B%86-%E5%B1%85%E6%B0%91%E8%81%AF%E7%BD%B2%E5%8F%8D%E5%B0%8D-222802468.html	知名電影、戲劇常在這取景！北市新生和平天橋將拆 居民聯署反對 - Yahoo奇摩新聞	[周刊王CTWANT] 新生和平人行天橋1982年竣工，外觀造型獨特，啟用後已有不少電影及MV前往取景拍攝，也是許多居民心中的城市記憶。根據台北市電影委員會介紹，新生和平天橋是北台灣最受歡迎的「MV拍攝橋」，也出現在許多經典電影、戲劇中，包括導演李安1994年作品《飲食男女》、導演楊德昌200...	https://media.zenfs.com/ko/ctwant_com_582/cc380b37a11720eccd4a9252ccf0188e	2024-10-31 22:28:02	Yahoo奇摩新聞
tw	https://tw.sports.yahoo.com/news/%E4%B8%AD%E8%81%B7%E6%9C%80%E6%96%B0%E8%87%AA%E7%94%B1%E7%90%83%E5%93%A1%E5%90%8D%E5%96%AE%E5%87%BA%E7%88%90-%E5%91%B3%E5%85%A8%E4%BC%8D%E9%90%B8%E7%8D%B2%E6%9C%AC%E5%9C%9F%E4%B8%8A%E5%A0%B4%E8%B3%87%E6%A0%BC%E4%B8%8D%E5%8F%97%E6%B4%8B%E5%B0%87%E8%A6%8F%E7%AF%84-083742860.html	中職最新自由球員名單出爐！味全伍鐸獲本土上場資格不受洋將規範 - Yahoo奇摩運動	體育中心／黃崇超報導隨著中信兄弟奪冠，中華職棒35年正式告終，聯盟今（30日）公布最新自由球員名單，包含中信奪冠功臣陳子豪以及許基宏、詹子賢都將擁有自由身，另外統一獅老將胡金龍與陳鏞基也都將再次取得自由球員資格；中職同時公告，味全龍洋投伍鐸（Bryan Woodall），符合聯盟規定取得本土上場資格，將不受外籍球員規範。	https://media.zenfs.com/ko/ftvn.com.tw/f6923947af7cf02c2ead6f0445751fc1	2024-10-30 08:37:42	Yahoo奇摩運動
tw	https://tw.news.yahoo.com/111%E9%A2%B1%E9%A2%A8%E5%81%87%E5%81%9C%E7%8F%AD%E5%81%9C%E8%AA%B2%E5%85%A8%E5%8F%B0%E6%9C%80%E6%96%B0%E9%80%9A%E7%9F%A5-%E5%8C%97%E5%8C%97%E5%9F%BA%E6%A1%83%E7%AD%8921%E7%B8%A3%E5%B8%82%E9%99%A4%E9%83%A8%E5%88%86%E8%A1%8C%E6%94%BF%E5%8D%80%E5%A4%96%E7%85%A7%E5%B8%B8%E4%B8%8A%E7%8F%AD%E4%B8%8A%E8%AA%B2-%E9%80%A3%E6%B1%9F%E7%B8%A3%E5%81%9C%E7%8F%AD%E5%81%9C%E8%AA%B2-043526742.html	11/1颱風假停班停課全台最新通知北北基桃等21縣市除部分行政區外照常上班上課連江縣停班停課 - Yahoo奇摩新聞	颱風康芮來襲，網友關心11/1周五是否會放颱風假（災防假），10月31日晚間全台各縣市陸續宣布停班停課資訊，連江縣公告11月1日停止上班、停止上課，北北基桃、台中、高雄等21縣市，除了部分行政區或特定學校停班停課之外，皆照常上班上課。若風雨達到《天然災害停止辦公及上課作業辦法》第四條規定，即可停止辦公及上課。按照行政院人事行政總處公告，Yahoo奇摩新聞在本篇新聞整理11月1日上班上課最新資訊，也請鎖定Yahoo颱風專題。	https://s.yimg.com/ny/api/res/1.2/XrJWAcxmkEUr0gn2kYZfrw--/YXBwaWQ9aGlnaGxhbmRlcjt3PTEyMDA7aD04ODE7Y2Y9d2VicA--/https://s.yimg.com/os/creatr-uploaded-images/2024-10/516338a0-97d5-11ef-9d67-435ced9bd8a8	2024-10-31 23:37:30	Yahoo奇摩新聞
tw	https://www.cna.com.tw/news/aopl/202411010013.aspx	布林肯：8千北韓軍抵俄烏邊境預期不久後將投入戰鬥| 國際 - 中央社即時新聞	美國國務卿布林肯表示，多達8000名北韓軍人已抵達毗鄰烏克蘭的俄羅斯邊境州庫斯克，並準備好在今後幾天內加入侵烏戰鬥。烏國總統澤倫斯基則批西方對北韓派兵援俄毫無回應。	https://imgcdn.cna.com.tw/www/webphotos/WebCover/800/20241101/800x600_456512026441.jpg	2024-10-31 20:56:00	中央社即時新聞
tw	https://www.chinatimes.com/realtimenews/20241031002885-260407	喊取消颱風假臉書被灌爆！ 陳揮文首發聲「 2張圖反擊了」 - 中時新聞網	None	https://images.chinatimes.com/newsphoto/2024-10-31/656/20241031002886.jpg	2024-10-31 06:40:19	中時新聞網
tw	https://tw.news.yahoo.com/%E6%84%B7%E6%A8%82%E9%A6%96%E5%BA%A6%E5%85%AC%E5%B8%83%E5%85%92%E5%AD%90-%E9%AB%98%E6%B8%85%E8%87%89%E8%9B%8B-%E7%85%A7-%E8%90%AC%E8%81%96%E7%AF%80%E7%A9%BF%E5%8D%97%E7%93%9C%E8%A3%9D-%E7%B6%B2%E7%8B%82%E8%AE%9A-170600445.html	愷樂首度公布兒子「高清臉蛋」照！萬聖節穿南瓜裝 網狂讚：太可愛了 - Yahoo奇摩新聞	女星愷樂（蝴蝶姐姐）2020年遭控介入羅志祥與周揚青感情後，4年多來在演藝圈銷聲匿跡，直到日前PO出寶寶超音波照證實結婚當媽，社群也悄悄重啟，不時分享育兒生活。31日颱風來襲又適逢萬聖節，愷樂也在IG分享兒子穿上萬聖節南瓜裝搭配南瓜蒂帽子的影片，裝扮十分可愛。引發許多網友狂讚：「太可愛了啦。」	https://media.zenfs.com/zh-tw/setn.com.tw/20a0ed946c382f74544591272a441067	2024-10-31 17:06:00	Yahoo奇摩新聞
tw	https://udn.com/news/story/7266/8330199	花蓮昨龍捲風吳德榮曝原因 康芮下午脫離陸地、下周一東北季風到 - 聯合新聞網	康芮颱風昨下午在台東縣成功鎮登陸，花蓮縣秀林鄉加灣地區昨天疑似出現龍捲風；中央氣象署預報中心依觀測資料判斷，不排除有龍捲...	https://pgw.udn.com.tw/gw/photo.php?u=https://uc.udn.com.tw/photo/2024/11/01/realtime/30821435.png&s=Y&x=90&y=0&sw=375&sh=251&exp=3600	2024-10-31 22:13:13	聯合新聞網
tw	https://tw.news.yahoo.com/%E5%8C%97%E5%B8%82%E5%96%8A%E5%8D%A1%E5%8A%89%E5%BE%B7%E8%8F%AF%E6%BC%94%E5%94%B1%E6%9C%83-%E4%BB%96%E6%8F%905%E7%90%86%E7%94%B1%E9%96%8B%E5%99%B4-%E7%99%BE%E8%B2%A8%E5%BD%B1%E5%9F%8Ektv%E6%80%8E%E5%85%8D%E5%81%9C%E6%A5%AD-230300677.html	北市喊卡劉德華演唱會 議員侯漢廷提5理由開噴：百貨影城KTV怎不要求？ - Yahoo奇摩新聞	雖然颱風「康芮」強襲，但劉德華昨（31）日在台北小巨蛋演唱會原訂照常舉行，但在開演前4小時主辦單位最後收到台北捷運公司指令，取消演出，並延到11月2日中午「補唱」。消息曝光後引發大票粉絲不滿，怒轟北捷。台北市議員侯漢廷也認為北市府不該要求演唱會停辦，更列舉5理由質問：「百貨公司、影城、錢櫃好樂迪呢？為何不要求？」	https://media.zenfs.com/ko/setn.com.tw/d9e30d4238dc75727287ca0c4dcccb5a	2024-10-31 23:09:59	Yahoo奇摩新聞
tw	https://tw.news.yahoo.com/%E7%9B%A7%E7%A7%80%E7%87%95%E6%80%92%E5%97%86%E7%92%B0%E5%A2%83%E9%83%A8-%E6%87%89%E9%99%8D%E6%A0%BC-201000409.html	盧秀燕怒嗆環境部 應降格 - Yahoo奇摩新聞	環境部環評大會日前在爭議聲中，通過「台中電廠第二期新建燃氣機組計畫」（中火二期）環評案，但環評結論未要求中火實際減排、減汙作為，令台中市府與環保團體極度不滿，台中市長盧秀燕10月31日重炮抨擊環境部說，「這個結果令人非常非常失望」，中部民眾無法接受，「環境部已成為汙染的放水者、保護者，應該降格」。	https://media.zenfs.com/zh-tw/chinatimes.com.tw/293d7cd7146762b97caf160d31383e1e	2024-10-31 20:10:00	Yahoo奇摩新聞
tw	https://www.ettoday.net/news/20241031/2846263.htm	星宇航空落地「跳一下」機翼險砸地！急拉升重飛影片曝 公司回應 - ETtoday新聞雲	颱風康芮31日下午登陸後，挾帶的狂風暴雨在全台造成災情，也導致多架航班受到影響。其中，星宇航空一架從日本沖繩飛回台灣的JX871班機，在桃園機場進行降落時遭遇強風，導致機身不斷搖晃，並在地面「彈跳」了一下後，機翼險些重砸地面，緊急拉升重飛，所幸在第二次降落後平安落地。為此，星宇航空也做出說明。	https://cdn2.ettoday.net/images/7926/e7926429.png	2024-10-31 14:44:00	ETtoday新聞雲
tw	https://tw.news.yahoo.com/%E9%A2%B1%E9%A2%A8%E5%BA%B7%E8%8A%AE%E9%A2%A8%E9%9B%A8%E5%9B%B0%E5%B1%B1%E4%B8%AD-%E5%A4%AA%E9%AD%AF%E9%96%A3%E5%9C%8B%E5%AE%B6%E5%85%AC%E5%9C%92%E5%A4%B1%E8%81%AF2%E5%90%8D%E6%8D%B7%E5%85%8B%E7%B1%8D%E9%81%8A%E5%AE%A2%E6%89%BE%E5%88%B0%E4%BA%86-081846816.html	颱風康芮風雨困山中 太魯閣國家公園失聯2名捷克籍遊客找到了 - Yahoo奇摩新聞	颱風康芮暴風圈籠罩全台，挾帶強風大雨並從台東成功鎮登陸。2名捷克籍遊客在太魯閣國家公園失聯，太管處通報警消協尋。中央災害應變中心今天表示，失聯的2名捷克籍遊客已在今天下午1時聯繫上，2人已撤退至岳王亭附近紮營。由於中橫公路封閉且風雨仍大，待天氣穩定後派人員前往救援。	https://media.zenfs.com/ko/cna.com.tw/b3b8146cd71186ac83b8453c92ad4bfd	2024-10-31 08:18:46	Yahoo奇摩新聞
tw	https://news.tvbs.com.tw/life/2669963	康芮襲台！全台逾51萬戶停電 台電：恐明晨才能全面搶修 - TVBS	None	None	2024-10-31 06:17:00	TVBS
tw	https://tw.news.yahoo.com/%E8%8F%AF%E8%88%AA3%E5%BA%A6%E9%99%8D%E8%90%BD%E5%A4%B1%E6%95%97-%E5%9C%B0%E5%8B%A4%E5%95%86%E5%8B%99%E8%89%99%E4%B8%8B%E8%B7%AA-%E6%97%85%E5%AE%A2%E9%82%84%E5%8E%9F%E7%8F%BE%E5%A0%B4%E7%B6%B2%E6%80%92%E5%97%86-%E5%93%AA%E4%BE%86%E7%9A%84%E5%B7%A8%E5%AC%B0-212500485.html	華航3度降落失敗「地勤商務艙下跪」 旅客還原現場網怒嗆：哪來的巨嬰 - Yahoo奇摩新聞	康芮颱風為台灣帶來狂風暴雨，多架航班也受到影響。其中華航CI782昨（31）日上午從越南胡志明市起飛前往台北，卻在桃機3度降落失敗改降高雄機場，就有乘客曬出地勤人員跪地向商務艙乘客道歉說明的照片，引起網友撻伐。	https://media.zenfs.com/zh-tw/setn.com.tw/8be17333f05583232e6859790352bc9c	2024-10-31 21:25:00	Yahoo奇摩新聞
tw	https://tw.news.yahoo.com/%E9%A2%B1%E9%A2%A8%E5%81%87%E4%B8%8D%E6%96%B7%E6%9B%B4%E6%96%B0-%E5%BA%B7%E8%8A%AE%E5%89%B5%E7%B4%80%E9%8C%84-%E5%A3%9F%E7%BD%A9%E5%85%A8%E5%8F%B0-11-1%E5%90%84%E5%9C%B0%E5%81%9C%E7%8F%AD%E8%AA%B2-092100839.html	南投增2校停班停課！全台11/1颱風假一覽 2校遠端上課 - Yahoo奇摩新聞	「康芮」颱風不僅是史上首個10月下旬登陸台灣的強颱，其威力更是驚人，且暴風圈大到壟罩全台，不少氣象專家皆提醒，尤其得注意「後半段的威力」。許多民眾相當關心明（1）日有沒有可能再放一天颱風假？由於颱風路徑和風雨狀況變化迅速，《三立新聞網》將持續整理全台各縣市停班停課最新通知。	https://media.zenfs.com/vi/setn.com.tw/ec0fae008e835c0cea04c450d5dfeb81	2024-10-31 14:58:00	Yahoo奇摩新聞
tw	https://news.tvbs.com.tw/sports/2670425	MLB／加盟道奇首年就登頂 大谷翔平嗨喊：再拿9座冠軍！ - TVBS	None	None	2024-10-31 08:02:00	TVBS
tw	https://sports.ltn.com.tw/news/breakingnews/4848893	中職》遭演唱會壓縮？大巨蛋只剩20場遭砍半 蔡其昌：相信蔣市長不願跳票 - 自由時報	明年大巨蛋比賽場次傳出遭腰斬，6隊合計只剩20場，讓各球團難以接受，中職會長蔡其昌也在社群上喊話，指出希望能在球賽與商演之間取得平衡。中職昨天召開領隊視訊會議，討論明年賽程安排和大巨蛋比賽場次，聯盟表示，根據遠雄的版本，明年只提供開幕戰2場與6個例行賽週末檔期，	https://img.ltn.com.tw/Upload/sports/page/800S/2024/11/01/phpJwK85Z.jpg	2024-11-01 00:45:00	自由時報
tw	https://tw.sports.yahoo.com/news/%E3%80%90nba%E5%B0%88%E6%AC%84%EF%BC%8F%E6%9D%8E%E4%BA%A6%E4%BC%B8%E3%80%91%E5%8B%87%E5%A3%AB%E8%84%AB%E8%83%8E%E6%8F%9B%E9%AA%A8%EF%BC%8C%E6%B2%92%E6%9C%89stephen-curry%E7%85%A7%E6%A8%A3%E8%B4%8F%E7%90%83-062210387.html	【NBA專欄／李亦伸】勇士脫胎換骨，沒有Stephen Curry照樣贏球 - Yahoo奇摩運動	勇士王牌Stephen Curry傷停兩場，沒關係，勇士靠著一群角色球員+聯盟第二防守效率一樣能贏球，二連勝鵜鶘。開季4勝1敗，今年勇士很不一樣...	https://s.yimg.com/ny/api/res/1.2/24qBSC1UV9KuuqacVkTauQ--/YXBwaWQ9aGlnaGxhbmRlcjt3PTEyMDA7aD04MDA7Y2Y9d2VicA--/https://s.yimg.com/os/creatr-uploaded-images/2024-10/6b3a5ea0-9750-11ef-b7bd-9d13ea6158fa	2024-10-31 06:24:05	Yahoo奇摩運動
tw	https://www.cna.com.tw/news/acn/202410310154.aspx	北京鼎泰豐熄燈民眾遺憾台灣家鄉味無法延續| 兩岸 - 中央社即時新聞	北京鼎泰豐將於今天全數熄燈，暫別華北市場。許多民眾聽聞鼎泰豐停業的消息感到不捨與震驚，這幾天特別前往用餐，民眾向記者說，儘管鼎泰豐不是台菜，但味道是台灣的家鄉味，遺憾無法在北京延續。	https://imgcdn.cna.com.tw/www/WebPhotos/1024/20241031/1468x768_wmky_0_C20241031000086.jpg	2024-10-31 05:17:00	中央社即時新聞
tw	https://tw.news.yahoo.com/%E5%8F%B0%E7%81%A3%E5%AD%97%E9%AB%94%E5%85%AC%E5%8F%B8%E6%8E%A8%E5%87%BA%E3%80%8C%E7%B2%BE%E9%9D%88%E6%96%87%E5%AD%97%E9%AB%94%E3%80%8D%EF%BC%81%E5%85%8D%E8%B2%BB%E4%B8%8B%E8%BC%89-%E5%8F%AA%E6%9C%89%E5%8F%B0%E7%81%A3%E4%BA%BA%E6%89%8D%E6%87%82%E7%9A%84%E5%8F%B2%E8%A9%A9%E6%B3%A8%E9%9F%B3%E5%AD%97%E5%9E%8B-051326772.html	台灣字體公司推出「精靈文字體」！免費下載 只有台灣人才懂的史詩注音字型 - Yahoo奇摩新聞	還記得 2021 年時，一款中國大陸網易旗下手遊《天諭》，出現了一個虛構精靈種族使用的「精靈語」，最後被台灣網友發現居然就是我們從小學習的「注音文」，讓不少台灣人自嘲：「原來我們是精靈」。而最近台灣設計師 Daphne，和曾推出金萱體的台灣公司 justfont 合作，推出了全新的精靈文字體，表示：「重新定義ㄅㄆㄇ！台灣人才懂的史詩注音字型」	https://s.yimg.com/os/creatr-uploaded-images/2024-10/52d4d700-9746-11ef-b59e-cbec8591c1b3	2024-10-31 05:25:09	Yahoo奇摩新聞
tw	https://www.cna.com.tw/news/acul/202410300197.aspx	胡婉玲出任中央社社長11/1正式上任| 文化 - 中央社即時新聞	中央通訊社今天召開董事會，通過胡婉玲出任中央社社長人事案。胡婉玲表示，希望領導中央社，持續作為權威資訊來源的中流砥柱。	https://imgcdn.cna.com.tw/www/webphotos/WebCover/800/20241030/1778x1333_043118445481.jpg	2024-10-30 06:22:00	中央社即時新聞
tw	https://news.google.com/rss/articles/CCAiC282bjY4bTU1bVFvmAEB?oc=5	【一刀未剪】粉紅泡泡大集錦「李正皓名草有主啦!」貴雅為"李馬戀"送上祝福! 王義川虧:周刊算爆料蠻準與王偊菁遭周刊塗黑│【焦點人物大現場】20241031│三立新聞台 - 三立LIVE新聞	None	None	2024-10-31 08:10:31	三立LIVE新聞
tw	https://www.cna.com.tw/news/ahel/202411015002.aspx	颱風過後北市千棵樹倒鐵皮掉落災損多 市民穿越障礙出門上班上課【圖輯】 - 中央社即時新聞	颱風康芮1日清晨轉輕颱並逐漸遠離，受強風暴雨影響，台北市累計接獲390件民生及基礎設施災情、318件建物毀損、307件廣告招牌欲墜或掉落等通報，且初估有超過2000株路樹倒塌。在正常上班上課情況下，市民如常出門通勤，但多處街道仍待復原。	https://imgcdn.cna.com.tw/www/webphotos/WebOg/600/20241101/1200x630_058951430863.jpg	2024-11-01 01:28:00	中央社即時新聞
tw	https://news.google.com/rss/articles/CBMiUEFVX3lxTFBmOUtfM2QxVEJiaFJJMUVCTHoycTFsUTVvNHFvTV8tZTlZZmtTRHVhcThyV2xteWh3VWFaQ293YllHWXpUQl9ycm1ZbjNESWxV0gFYQVVfeXFMT1ZWMWt2X1pNSTlIVTdYMDZ0M3hGODZzOU4zeTR5LXBvQ1VZQWZWeGY4cUtVdUUwQWVUZ3gxVC1rdGtCX3hPeF9KdXZZd0pxTjVmVUZEZ1E5Wg?oc=5	上班注意！台鐵汐止-南港今早「單線雙向行車」 北迴線、花東線搶修中 - 聯合新聞網	None	None	2024-10-31 22:54:13	聯合新聞網
tw	https://news.google.com/rss/articles/CBMiU0FVX3lxTE1RcWhCVTZ3MFI3Y3dHNUZCc0xuZEhmQ3RwUl96dlJJNDZ6UlpETkNXUVNLazBvYXhnX3ZxUXRyeWkwNlI5dDB1VjdjY2dleFBnNnJR0gFYQVVfeXFMTTdtcXJEbXpveUZ4eDZJaUxjcmpWS3I1RVdXa2pHVTdlRWNaVWY1MjZjSlEyUzZEcVdINDZ1QUVLN3JGeTk3YXJuUDBnQkU3NEJsYW9GYXJzeg?oc=5	康芮襲台3死200餘傷 逾74萬戶停電 - 聯合新聞網	None	None	2024-10-31 17:44:12	聯合新聞網
tw	https://tw.news.yahoo.com/%E9%80%99%E6%AC%A1%E5%BA%B7%E8%8A%AE%E9%A2%B1%E9%A2%A8%E4%BE%86%E8%A5%B2%E6%88%91%E6%9C%89-%E7%A7%98%E5%AF%86%E6%AD%A6%E5%99%A8-%E8%B3%B4%E6%B8%85%E5%BE%B7%E6%8F%AD%E9%9C%B2-%E4%BD%8E%E8%BB%8C%E9%81%93%E8%A1%9B%E6%98%9F-%E9%A6%96%E5%BA%A6%E5%85%A8%E9%9D%A2%E4%B8%8A%E5%A0%B4-053116282.html	這次康芮颱風來襲我有「秘密武器」！賴清德揭露「低軌道衛星」首度全面上場 - Yahoo奇摩新聞	[FTNN新聞網]記者陳弘志／台北報導賴清德總統今（31）日視察中央災害應變中心，指示中央與地方政府共同全力防災救災，他同時揭露這次康芮颱風來襲政府有「秘...	https://media.zenfs.com/ko/ftnn_com_tw_939/683884c356a4aeaa61bee614591cff48	2024-10-31 05:31:16	Yahoo奇摩新聞
