country_code	url	title	description	image_url	publish_date	source
tw	https://sports.ltn.com.tw/news/breakingnews/4867976	MLB》傳道奇將與索托方見面 有可能12月就決定最終落腳處？ - 自由時報	洋基強打索托（Juan Soto）是今年季後自由市場最大咖的球員之一，吸引多隊爭奪戰。根據大聯盟官網記者費森德（Mark Feinsand），道奇最快將在美國時間本週二將與索托、知名經紀人波拉斯（Scott Boras）見面。	https://img.ltn.com.tw/Upload/sports/page/800S/2024/11/19/phpmHxv6I.jpg	2024-11-19 03:48:00	自由時報
tw	https://www.businesstoday.com.tw/article/category/183008/post/202411200064/	長榮、陽明、萬海…航運股好威，疫情期間進場水手們全解套，這檔法人喊到265元能衝到年底？ - 今周刊-在今天看見明天	今周刊編按：2024美國總統當選人川普明年1月上任後可能加徵關稅，進口商加快拉貨步伐，貨櫃3雄包括長榮(2603)、陽明海運(2609)、萬海(2615)股價近日來同步上漲。

長榮股價在周三(11/20)一度刷出241.5元新天價，陽明漲逾半根、最高報79.8元漲逾6%，萬海也飆出99.7元，貨櫃三雄集體往上衝。不過後續長榮後繼無力，終場下跌2.5元，收233.5元。	https://doqvf81n9htmm.cloudfront.net/data/crop_article/166770/128.jpg_1140x855.jpg_600x450.jpg	2024-11-20 07:15:00	今周刊-在今天看見明天
tw	https://news.tvbs.com.tw/life/2691813	12強優惠／星巴克買一送一！珍奶也買一送一 賀中華隊前進東京 - TVBS	None	None	2024-11-20 01:39:00	TVBS
tw	https://news.tvbs.com.tw/life/2691759	薄瓜瓜娶台醫院千金！信義區「奢華婚前趴」突喊卡 原因全曝光│TVBS新聞網 - TVBS	None	None	2024-11-20 00:03:00	TVBS
tw	https://tw.news.yahoo.com/%E5%89%8D%E8%AD%A6%E6%94%BF%E7%BD%B2%E9%95%B7%E5%BC%B5%E5%9B%9B%E8%89%AF%E9%80%9D%E4%B8%96%E4%BA%AB%E5%A3%BD83%E6%AD%B2-%E7%95%B6%E5%B9%B4%E5%9B%A0319%E6%A7%8D%E6%93%8A%E6%A1%88%E8%BE%AD%E8%81%B7%E6%88%90%E4%BB%BB%E6%9C%9F%E6%9C%80%E7%9F%AD%E7%BD%B2%E9%95%B7-010448943.html	前警政署長張四良逝世享壽83歲 當年因319槍擊案辭職成任期最短署長 - Yahoo奇摩新聞	前警政署長張四良昨天（19日）凌晨逝世，享壽83歲。2004年因319槍擊案而請辭，警政署長任職僅九個月，為任期最短的署長。警政署已連繫家屬致意，並協助後續治喪事宜，預計12月7日舉行告別式。	https://s.yimg.com/os/creatr-uploaded-images/2024-11/3c2e2340-a6db-11ef-bbfd-0937cbc4516d	2024-11-20 09:01:30	Yahoo奇摩新聞
tw	https://tw.news.yahoo.com/%E5%9F%BA%E9%9A%86%E7%94%B7%E6%8E%A5%E7%A8%AE-%E5%B7%A6%E6%B5%81%E5%8F%B3%E6%96%B0-1%E5%B0%8F%E6%99%82%E5%BE%8C%E9%A9%9F%E9%80%9D-%E7%BE%85-%E9%88%9E-083819357.html	基隆男接種「左流右新」1小時後驟逝 羅一鈞、死者妻發聲了 - Yahoo奇摩新聞	即時中心／顏一軒報導基隆市一名59歲的陳姓男子本月17日上午赴信義區衛生所，接種流感及新冠疫苗，孰料返家休息1小時後，因心絞痛而被送往部立基隆醫院搶救，最終仍宣告不治。基隆地檢署今（19）日相驗，不排除解剖遺體。對此，衛福部疾管署發言人羅一鈞回應，該署尚未收到疫苗不良事件或疫苗受害救濟申請，若接獲後會全力協助；而死者妻子則痛心地說，丈夫的身體非常健康也無慢性疾病，不解為何會突然驟逝。	https://media.zenfs.com/ko/ftvn.com.tw/b650efca03c83a7bf8021a0dfdd1bb42	2024-11-19 08:47:28	Yahoo奇摩新聞
tw	https://tw.news.yahoo.com/%E5%85%A8%E5%AE%B6%E4%BA%BA%E7%BD%B9%E7%B3%96%E5%B0%BF%E7%97%85%E5%85%87%E6%89%8B%E6%98%AF%E5%AE%83-%E5%90%83%E5%AE%8C%E8%A1%80%E7%B3%96%E9%A3%86%E7%A0%B4400-%E9%86%AB-%E8%B6%85%E5%A4%9A%E4%BA%BA%E6%84%9B%E5%90%83-3%E6%8B%9B%E9%99%8D%E8%A1%80%E7%B3%96-000000472.html	全家人罹糖尿病兇手是它 吃完血糖飆破400！醫：超多人愛吃 3招降血糖 - Yahoo奇摩新聞	糖尿病是吃出來的！醫師表示，之前有一家人先後求診，結果通通確診糖尿病，罹病率高達100％，後來仔細詢問這家人平常飲食習慣，才發現三餐都吃加了辣椒醬及醬油的炒飯、炒麵。 全家人都愛吃炒飯、炒麵加辣	https://media.zenfs.com/ko/health_tvbs_com_tw_589/15091722f80523914d069f29a5ff20ee	2024-11-20 00:02:17	Yahoo奇摩新聞
tw	https://news.tvbs.com.tw/life/2692653	婚宴菜全素沒先說！親友餓到叫20份大披薩 外國新娘當場痛哭 - TVBS	婚禮本來應該是親友歡喜慶祝的場面，但卻因為婚宴餐點而搞砸了。國外一對素食主義的新人，為了賓客精心準備了豐盛的「全素食」大餐，沒想到親友卻完全不賞臉，甚至叫了20份外送大披薩，讓新娘瞬間流下難過的眼淚。	https://cc.tvbs.com.tw/img/upload/2024/11/20/20241120180212-57907668.jpg	2024-11-20 10:09:00	TVBS
tw	https://tw.news.yahoo.com/%E9%98%BF%E8%8C%B2%E6%B5%B7%E9%BB%98%E6%96%B0%E8%97%A5%E9%81%8E%E5%AF%A9%EF%BC%81%E5%8F%AF%E7%A7%BB%E9%99%A4%E9%A1%9E%E6%BE%B1%E7%B2%89-%E7%9C%9F%E6%AD%A3%E6%B8%9B%E7%B7%A9%E7%94%9A%E8%87%B3%E5%81%9C%E6%AD%A2%E7%97%85%E7%90%86%E8%AE%8A%E5%8C%96-%E5%B0%88%E5%AE%B6%EF%BC%9A%E9%87%8D%E5%A4%A7%E7%AA%81%E7%A0%B4-062252070.html	阿茲海默新藥過審！可移除類澱粉 真正減緩甚至停止病理變化 專家：重大突破 - Yahoo奇摩新聞	阿茲海默症新藥通過審查！失智症協會理事長徐文俊今天（19日）表示，近日通過台灣食藥署審查的阿茲海默藥物，是20年來首款，且不同於過往的症狀治療，是真的可以減緩甚至停止病理變化，改善病程進行治療的藥物，為重大突破。	https://s.yimg.com/os/creatr-uploaded-images/2024-11/44ca8180-a63e-11ef-befe-133a1cb18905	2024-11-19 06:22:52	Yahoo奇摩新聞
tw	https://tw.news.yahoo.com/%E3%80%8A%E8%8B%B1%E9%9B%84%E8%81%AF%E7%9B%9F%E3%80%8Bzeus%E9%9B%A2%E9%9A%8At1%E5%85%AC%E5%8F%B8%E5%A4%A7%E6%A8%93%E6%95%B4%E6%99%9A%E7%87%88%E7%81%AB%E9%80%9A%E6%98%8E%EF%BC%8C%E9%80%A3%E5%A4%9C%E5%88%AA%E9%99%A4%E9%81%B8%E6%89%8B%E8%B3%87%E6%96%99-044648976.html	《英雄聯盟》Zeus離隊T1公司大樓整晚燈火通明，連夜刪除選手資料 - Yahoo奇摩新聞	昨（19）日，今年達成《英雄聯盟》世界大賽「同陣容連霸」，寫下歷史的 T1 戰隊替轉會市場丟下大炸彈，宣布上路 Zeus 合約期滿而離隊，而消息一出馬上激起台灣、韓國網友的熱烈討論，許多 T1 的粉絲也都感到很難過，而韓國的 T1 大樓也被粉絲拍到，即便到了凌晨還是燈火通明，連 T1 的 CEO 也連夜開放粉絲問答（AMA），親上火線面對戰隊粉絲。	https://s.yimg.com/os/creatr-uploaded-images/2024-11/25040530-a6fa-11ef-9355-3d43ca08714a	2024-11-20 07:51:18	Yahoo奇摩新聞
tw	https://sports.ltn.com.tw/news/breakingnews/4868462	12強》台灣球迷高喊「陳陳大丈夫」 日本網友掀回憶殺：熱血沸騰！ - 自由時報	台灣隊投手陳冠宇登板時，大巨蛋場內都會響起「陳陳大丈夫」的應援曲，球迷也會一同高喊，引起日本網友關注。日媒《Full-Count》指出，「陳陳大丈夫」是陳冠宇過往在日職羅德時期的招牌口號，羅德球團也曾推出「陳陳大丈夫」的週邊商品，把這句口號印製在毛巾上，讓日本球	https://img.ltn.com.tw/Upload/sports/page/800S/2024/11/19/phpkmle01.jpg	2024-11-19 07:31:00	自由時報
tw	https://tw.stock.yahoo.com/news/%E3%80%90%E6%96%B0%E5%8F%B0%E5%B9%A3%E9%AB%98%E5%88%A9%E3%80%9124%E6%B4%BB%E5%AD%98%E4%BE%86%E4%BA%86%EF%BC%81%E4%B8%8A%E9%99%90%E7%99%BE%E8%90%AC%E5%85%83%E5%88%B0%E6%9C%9F%E9%A0%986000%E5%85%83%E5%88%A9%E6%81%AF-041156453.html	【新台幣高利】2.4%活存來了！上限百萬元到期領6000元利息 - Yahoo奇摩股市	新台幣高利活存再加碼！滙豐（台灣）商業銀行今（20）日表示，針對數位存款帳戶客戶推出新台幣高利活存專案，以加碼至三個月2.4% 的年利率，上限金額高達新台幣100萬元，成為市場上最具吸引力的選擇之一。即日起至2024年12月31日止，符合參加資格的「卓越理財」及「運籌理財One能戶」數位存款帳戶客戶，可享有完整三個月期的高利活動，期滿最高可獲得新台幣6,000元的利息。	https://s.yimg.com/ny/api/res/1.2/ntRgkgrQAyt1l7T.UOHjgQ--/YXBwaWQ9aGlnaGxhbmRlcjt3PTEyMDA7aD03NjY7Y2Y9d2VicA--/https://s.yimg.com/os/creatr-uploaded-images/2024-11/05fcb2e0-a6f5-11ef-a967-3b4a939f967d	2024-11-20 04:12:02	Yahoo奇摩股市
tw	https://www.mirrormedia.mg/story/20241119inv002	【陳啟昱小三曝光】外遇酒店名花 陳啟昱帳戶逾億現金提領一空 - 鏡週刊	台鹽前董事長陳啟昱涉嫌掏空公司遭通緝，台南地方法院日前重開羈押庭時他已人間蒸發，坊間盛傳他獲無保請回隔天，就從高雄林園海邊偷渡菲律賓，近日更盛傳他經常出入當地賭場。	https://v3-statics.mirrormedia.mg/images/31cceaa0-df4a-465e-9f9c-29a14a7eb44b-w1600.jpg	2024-11-20 10:55:01	鏡週刊
tw	https://sports.ltn.com.tw/news/breakingnews/4869819	12強直擊》台灣隊選手視角 東京巨蛋跟大巨蛋有3大不同點 - 自由時報	世界12強台灣隊今天把握唯一練習日適應東京巨蛋，視覺上明顯比台北大巨蛋亮多，外野手都花了一些時間適應，台灣隊長陳傑憲也跟大家分享經驗，如果是早場比賽，屋頂會更亮，要小心吃球。先前日本野手到台北大巨蛋比賽，許多選手都反應高飛球有點暗，而台灣野手到東京巨蛋則要適應很亮的燈光，陳晨威說，可能跟天花板有關係	https://img.ltn.com.tw/Upload/sports/page/800S/2024/11/20/php8T6yuz.jpg	2024-11-20 09:45:00	自由時報
tw	https://news.cnyes.com/news/id/5784937	光寶科新一代 600kW 液冷系統亮相SC24 因應輝達架構滿足AI運算需求 - Anue鉅亨	電供廠光寶科 (2301-TW) 於美國亞特蘭大超級運算大會（SC24）展出新一代高效能運算解決方案，搭配輝達 (NVDA-US) 架構推出電源、機櫃及液冷系統產品，包括已打入輝達推薦供應商清單的 600kW in-row CDU	https://cimg.cnyes.cool/prod/news/5784937/m/a1e0f857593043689c9424513e50b81e.jpg	2024-11-20 08:24:01	Anue鉅亨
tw	https://tw.news.yahoo.com/%E8%B6%99%E5%B0%91%E5%BA%B7%E6%91%94%E5%80%92%E9%80%B2%E5%8A%A0%E8%AD%B7%E7%97%85%E6%88%BF-%E9%86%AB%E6%8F%90%E9%86%921%E9%A1%9E%E4%BA%BA%E6%B3%A8%E6%84%8F-014846599.html	趙少康摔倒進加護病房 醫提醒1類人注意 - Yahoo奇摩新聞	[NOWnews今日新聞]前中廣董事長趙少康日前才去動了「開心」手術，沒想到19日又自爆，上週三自己在家摔一跤，腹痛嚴重，做超音波發現是「肝臟邊角破裂內出血」，因此住進加護病房。對此，胸腔科醫師蘇一峰...	https://media.zenfs.com/en/nownews.com/90855a5c95da564812f0535c5508e8ca	2024-11-20 01:57:00	Yahoo奇摩新聞
tw	https://www.ctee.com.tw/news/20241120700585-430201	鴻海大刀一揮 引爆鴻準殺機 股價大跌逾8％ - 工商時報	機殼廠鴻準（2354）因切入散熱液冷技術領域，搭上最熱題材，短線股價爆量飆漲，日前最高來到99.9元、逼近百元大關，成為盤面上人氣指標股之一，在股價短線漲幅已大下，母公司鴻海（2317）子公司寶鑫國際處分鴻準持股高達14,053張，套現逾13億元，在集團公司開始獲利了結下，觸發鴻準今（20）日殺盤，...	https://images.ctee.com.tw/newsphoto/2024-11-06/1024/A02AA2_PictureItem_Clipping_05_4.jpg	2024-11-20 01:44:00	工商時報
tw	https://tw.stock.yahoo.com/news/%E8%80%81%E5%85%AC%E8%A9%B2%E9%81%B8-%E6%88%BF%E6%9D%B1%E6%88%96%E5%B7%A5%E7%A8%8B%E5%B8%AB-%E7%B6%B2%E7%B2%BE%E7%AE%97%E8%83%8C%E5%BE%8C%E9%9A%B1%E5%BD%A2%E8%BA%AB%E5%AE%B6-%E7%AD%94%E6%A1%88-%E9%9D%A2%E5%80%92-045300308.html	老公該選「房東或工程師」？ 網精算背後隱形身家 答案一面倒 - Yahoo奇摩股市	科技業工程師在台灣是高薪的理想對象職業，但若是跟坐收高租金的房東比起來，可能未必吃香。有女網友在PTT（批踢踢實業坊）陷入二選一的抉擇，一個是租金年收150萬元的房東，另一個是年薪300萬元的工程師，網友竟一面倒選房東，還推算背後房產價值相當可觀，「工程師比個卵蛋」。	https://media.zenfs.com/ko/ebc__387/e3818aeb470673ddb277467069146b25	2024-11-19 05:03:10	Yahoo奇摩股市
tw	https://sports.ltn.com.tw/news/breakingnews/4869424	中國大師賽》34歲周天成苦戰82分鐘不敵法國19歲新星 男單32強出局 - 自由時報	台灣一哥周天成今天在超級750系列中國羽球大師賽，以17：21、21：18、13：21不敵法國19歲新星拉尼耶（Alex Lanier），無緣挺進男單16強。世界排名第9的周天成和拉尼耶過去交手3次，最近一次是北極公開賽，小天鏖戰3局奪勝，不過今年日本公開賽決賽時，拉尼耶則是直落二告捷捧冠。	https://img.ltn.com.tw/Upload/sports/page/800S/2024/11/20/phpthjOFC.jpg	2024-11-20 04:44:00	自由時報
tw	https://tw.news.yahoo.com/%E5%8B%9E%E5%8B%95%E9%83%A8%E5%85%AC%E5%8B%99%E5%93%A1%E8%81%B7%E5%A0%B4%E9%9C%B8%E5%87%8C%E7%99%BC%E7%94%9F%E6%86%BE%E4%BA%8B-%E8%B3%B4%E6%B8%85%E5%BE%B7%E8%87%B4%E6%AD%89%EF%BC%9A%E5%8A%A0%E5%BC%B7%E5%B0%8D%E6%94%BF%E5%BA%9C%E5%93%A1%E5%B7%A5%E9%97%9C%E6%87%B7%E4%BF%9D%E8%AD%B7-125953580.html	勞動部公務員職場霸凌發生憾事 賴清德致歉：加強對政府員工關懷保護 - Yahoo奇摩新聞	勞動部昨天公布勞動力發展署員工遭職場霸凌行政調查報告，遭疑懲處過輕，引發議論。總統賴清德今天晚間透過臉書表示，要向日前勞動部發生憾事的員工家屬、受到影響的公務人員致上歉意；要努力改變許多過去被認為理所當然的職場文化，更要杜絕職場上各種形式的霸凌。他強調每一名員工都是政府機關重要的人才，要加強對每一名員工的關懷和保護。	https://media.zenfs.com/zh-tw/cna.com.tw/16feb28fc5b953aa1ef633d856d6a60c	2024-11-20 12:59:53	Yahoo奇摩新聞
tw	https://tw.news.yahoo.com/%E5%BF%AB%E8%A8%8A-%E6%81%90%E6%9C%89%E5%A4%A7%E8%A6%8F%E6%A8%A1%E7%A9%BA%E8%A5%B2-%E7%BE%8E%E9%97%9C%E9%96%89%E9%A7%90%E7%83%8F%E5%85%8B%E8%98%AD%E4%BD%BF%E9%A4%A8-064324796.html	恐有大規模空襲 美關閉駐烏克蘭使館 - Yahoo奇摩新聞	[NOWnews今日新聞]美國國務院在社群平台X上發文，聲稱美國駐烏克蘭大使館，已收到週三可能發生「重大空襲」的警訊，緊急閉館。美國駐烏克蘭大使館官網呼籲美國公民，及早做好準備，隨時留意媒體或傳播管道...	https://media.zenfs.com/en/nownews.com/941de7cf4becd1e2bca3e6f1491a380e	2024-11-20 09:54:38	Yahoo奇摩新聞
tw	https://www.setn.com/News.aspx?NewsID=1566757	5女綠委拉住不給走！徐巧芯、丁學忠來救援 林思銘竟摔倒「西裝裂」 - 房產	立法院內政委員會今（20日）排審《選罷法》修正草案，包含國民黨立委許宇甄提案的研擬提高罷免門檻，民進黨立院黨團於清晨4時30分甲級動員，霸佔主席台，擋法案出委員會。衝突中，國民黨團書記長林思銘遭女綠委王美惠、黃捷、賴惠員、張雅琳、吳沛憶包圍，藍委徐巧芯、丁學忠等人來救援，拉扯中，林思銘竟不慎摔倒，西裝發出撕裂聲。國民黨籍召委徐欣瑩受訪時提到，書記長被攻擊，首席副書記長王鴻薇被性騷擾，民進黨當家鬧事	https://attach.setn.com/newsimages/2024/11/20/4900042-PH.jpg	2024-11-20 02:30:22	房產
tw	https://tw.news.yahoo.com/%E9%BB%91%E6%B5%AE%E9%9B%86%E5%9C%98%E7%88%86%E6%AC%A0%E8%96%AA-%E5%93%A1%E5%B7%A5%E9%9B%A2%E8%81%B7-%E6%B6%88%E8%B2%BB%E8%80%85%E6%86%82-%E5%84%B2%E5%80%BC%E9%87%91-%E6%89%93%E6%B0%B4%E6%BC%82-074834259.html	黑浮集團爆欠薪、員工離職！消費者憂「儲值金」打水漂 業者：退款可洽總部 - Yahoo奇摩新聞	「黑浮集團」創立13年，旗下「黑浮咖啡」連鎖店曾遍布全台，但近日被爆出欠薪，導致員工集體離職，不少消費者也擔憂自己的「儲值金」拿不回來。業者今（20）日澄清，集團並無倒閉，但確實出現短暫財務壓力，店休是因內部整頓，之後都會陸續營業，消費者若想退款可洽總部。	https://s.yimg.com/ny/api/res/1.2/TjPKoSsUCcMYVthAp8MxOw--/YXBwaWQ9aGlnaGxhbmRlcjt3PTEyMDA7aD01OTM7Y2Y9d2VicA--/https://media.zenfs.com/zh-tw/gotv_ctitv_com_tw_678/f053b2de57b18316ecdde27c20a2a428	2024-11-20 07:48:34	Yahoo奇摩新聞
tw	https://udn.com/news/story/7266/8372402	地牛翻身！12時23分嘉義縣規模4.6地震12縣市有感 最大震度嘉義縣4級 - 聯合新聞網	地牛翻身，中午12時23分在嘉義縣政府南南西方13.9公里即位於嘉義縣義竹鄉，發生芮氏規模4.6地震，12縣市有感，最大...	https://pgw.udn.com.tw/gw/photo.php?u=https://uc.udn.com.tw/photo/2024/11/20/1/30938447.jpg&s=Y&x=4&y=0&sw=1277&sh=852&exp=3600	2024-11-20 04:40:21	聯合新聞網
tw	https://www.cna.com.tw/news/aspt/202411200360.aspx	棒球12強複賽首戰台灣隊黃子鵬先發對委內瑞拉羅戈| 運動 - 中央社即時新聞	世界12強棒球賽複賽台灣隊明天首戰將與委內瑞拉交手，台灣隊推出在預賽先發對多明尼加、古巴好投的黃子鵬掛帥先發，對上中職富邦悍將的委內瑞拉洋投羅戈，是台灣最熟悉的敵人。	https://imgcdn.cna.com.tw/www/webphotos/WebOg/600/20241120/1200x630_764659391100.jpg	2024-11-20 10:52:00	中央社即時新聞
tw	https://udn.com/news/story/7325/8370864	南投草屯鎮長將補選…藍綠備戰 他可能改寫政治版圖 - 聯合新聞網	南投草屯鎮長簡景賢昨深夜猝逝，因任期未過半，依法將在3個月內完成補選，卻也讓原本應該在2026年登場的草屯鎮長之爭提前開...	https://pgw.udn.com.tw/gw/photo.php?u=https://uc.udn.com.tw/photo/2024/11/19/realtime/30934464.jpg&s=Y&x=0&y=20&sw=2755&sh=1836&exp=3600	2024-11-19 11:10:35	聯合新聞網
tw	https://udn.com/news/story/7320/8370349	板橋男輕生前曾怨施工粉塵 工地若違規屬實市府將開罰 - 聯合新聞網	新北市板橋某大樓昨下午傳出有民眾輕生，送醫後不治，該民眾後被發現曾多次向新北市府陳情一樓因施工造成整棟大樓灰塵四散，要求...	https://pgw.udn.com.tw/gw/photo.php?u=https://uc.udn.com.tw/photo/2024/11/19/realtime/30933169.png&s=Y&x=0&y=8&sw=1194&sh=796&exp=3600	2024-11-19 07:53:35	聯合新聞網
tw	https://www.businesstoday.com.tw/article/category/183015/post/202411200086/	輝達財報就要出爐、股價竟然這樣走！黃仁勳上菜3重點必看，台灣9家GB200供應鏈起床等開獎 - 今周刊-在今天看見明天	輝達(NVIDIA)在美國時間周三(11/20)盤後公布財報，市場預估營收可望達331.08億美元，年增率雖然達82%，但卻是6個季度成長最少的一次，每股盈餘（EPS）預估0.75美元。

市場認為，輝達利潤預計將達174億美元（約5661億元台幣），且過去10年來股價通常在財報公佈後都會上漲，AI浪潮更帶動輝達今年來市值暴增2.2兆美元，來到3.61兆美元。

華爾街分析師普遍樂觀看待輝達可望端出漂亮成績單，回顧輝達過去8個季度表現， 共有7次EPS超出市場預期 ，財報公佈日股價震幅約9.32%，最大漲幅曾高達24.4%，最大跌幅則是6.39%，財報公布當天股價上漲機率為62.5%。

不過，週三開盤輝達股價則是開低，跌幅超過1.9%，主要原因可能還是靜待財報開獎，買氣相對觀望。

本次財報觀察重點包括，Blackwell GPU是否能實現50-80億美元營收貢獻、毛利率預期75.02%，以及能否突破供應鏈限制，滿足市場需求。	https://doqvf81n9htmm.cloudfront.net/data/crop_article/166792/YUNG3234.jpg_1140x855.jpg_600x450.jpg	2024-11-20 14:49:58	今周刊-在今天看見明天
tw	https://www.cna.com.tw/news/aopl/202411200031.aspx	波羅的海2海底電纜遭切斷金融時報：瑞典追查中國船隻| 國際 - 中央社即時新聞	北歐波羅的海2條海底光纖通訊電纜被切斷後，調查人員現正注意一艘中國散裝貨船動向。歐洲對潛在破壞行為不安情緒加劇之際，這是近幾個月來第2起這類調查。	https://imgcdn.cna.com.tw/www/webphotos/WebCover/800/20241120/1668x1250_62256794915.jpg	2024-11-20 01:36:00	中央社即時新聞
tw	https://www.cna.com.tw/news/aopl/202411190031.aspx	川普證實上任遣返非法移民無證中國役齡男子優先| 國際 - 中央社即時新聞	美國總統當選人川普今天在社群媒體證實，上任後將頒布緊急狀態，遣返非法移民。媒體報導，川普列為優先遣返的對象包括法院已經發下驅逐令的無證移民、有犯罪記錄的無證移民以及無證中國役齡男子。	https://imgcdn.cna.com.tw/www/webphotos/WebOg/600/20241119/1440x756_986816365827.jpg	2024-11-19 01:12:00	中央社即時新聞
tw	https://news.cnyes.com/news/id/5785146	外資賣超312億元 狂倒鴻準逾4萬張 與投信對作航空雙雄 - Anue鉅亨	台股今 (20) 日終場失守五日線，收在 22688 點，下跌 160 點，外資繼昨日買超後今隨即反手調節，其中，鴻準因母公司鴻海公告調節持股，被外資狂倒 4 萬張，成為外資賣超榜首，但對航空雙雄操作不同調，買超長榮航 2.1	https://cimg.cnyes.cool/prod/news/5785146/m/0b507bf98ba44f6794f59708b2c364df.jpg	2024-11-20 11:47:04	Anue鉅亨
tw	https://www.cna.com.tw/news/ahel/202411193001.aspx	中央社趙世勳拍下花蓮震後景況獲卓越新聞獎| 生活 - 中央社即時新聞	第23屆卓越新聞獎今天頒發，中央社攝影記者趙世勳以記錄花蓮403震後景況的「迢迢回家路」榮獲單張新聞攝影獎，他感謝給予支援的長官、同事，更要致敬仍在新聞領域堅守崗位的攝影同業。	https://imgcdn.cna.com.tw/www/webphotos/WebOg/600/20241119/1200x630_842063464096.jpg	2024-11-19 08:53:00	中央社即時新聞
tw	https://udn.com/news/story/7001/8371559	12強賽／蔡總機上線！中華隊回程豪經艙起跳 「曾頌恩不能再坐相親位」 - 聯合新聞網	中華隊昨天前往日本東京，準備展開世界12強棒球賽複賽，機位爭奪戰成為這趟旅程的醍醐味，中華隊領隊、中職會長蔡其昌則在昨天...	https://pgw.udn.com.tw/gw/photo.php?u=https://uc.udn.com.tw/photo/2024/11/19/realtime/30931812.jpg&s=Y&x=0&y=0&sw=4661&sh=3107&exp=3600	2024-11-19 21:02:21	聯合新聞網
tw	https://www.cna.com.tw/news/aloc/202411190348.aspx	連江縣警局公布詐騙案統計被害人軍公教居多| 地方 - 中央社即時新聞	連江縣警察局今天公布全縣詐欺案件統計，今年1至10月全縣詐騙案被害人中，軍人佔4成，公教人員佔26%，軍公教族群為大宗。	https://imgcdn.cna.com.tw/www/WebPhotos/1024/20241119/1117x768_wmky_0_C20241119000218.jpg	2024-11-19 10:18:00	中央社即時新聞
tw	https://udn.com/news/story/8952/8372221	12強賽／大巨蛋賽後一幕讓美記者好吃驚：台灣球迷不肯離開 - 聯合新聞網	世界12強棒球賽中華隊打出精彩表現，拿下4勝1敗晉級四強。不只場上球員打得好，場下球迷更是全力相挺，攜手締造12強隊史最佳成績。台灣球迷的熱血應援，更是讓外國媒體感到驚艷。	https://pgw.udn.com.tw/gw/photo.php?u=https://uc.udn.com.tw/photo/2024/11/20/0/30938234.jpg&s=Y&x=0&y=0&sw=1280&sh=853&exp=3600	2024-11-20 04:19:29	聯合新聞網
tw	https://www.cna.com.tw/news/aipl/202411200010.aspx	美官員：中方因不滿對台軍售拒美中防長會晤| 政治 - 中央社即時新聞	美國五角大廈利用國防部長奧斯汀將出席在寮國舉行的東南亞國家協會國防部長擴大會議之際，向中方提出與中國防長董軍進行雙邊會談的請求，遭中方拒絕。媒體報導，理由是因美方近期的對台軍售。	https://imgcdn.cna.com.tw/www/webphotos/WebCover/800/20241120/1640x1230_714721277599.jpg	2024-11-19 23:13:00	中央社即時新聞
tw	https://udn.com/news/story/7266/8372984	下班帶傘！2縣市大雨特報 恐下到明天晚上 - 聯合新聞網	下班要帶傘，中央氣象署下午15時35分針對基隆及新北市發布大雨特報，恐一路下到明天晚上。	https://pgw.udn.com.tw/gw/photo.php?u=https://uc.udn.com.tw/photo/2024/11/20/1/30939987.jpg&s=Y&x=224&y=0&sw=1056&sh=704&exp=3600	2024-11-20 07:51:58	聯合新聞網
tw	https://ctinews.com/news/items/KwnKQlY0aY	疾管署傳「土皇帝組長霸凌」人身攻擊！羅一鈞證實整備組調職、辭職率高達37% - 中天新聞網	None	None	2024-11-20 09:02:57	中天新聞網
tw	https://tw.news.yahoo.com/%E5%8F%B0%E9%90%B5%E5%8F%B8%E6%A9%9F%E5%93%A1%E8%87%89%E8%89%B2%E7%99%BC%E7%B4%AB%E5%80%92%E8%87%A5%E9%A7%95%E9%A7%9B%E5%AE%A4-%E7%96%91%E5%BF%83%E8%82%8C%E6%A2%97%E5%A1%9E%E9%80%81%E9%86%AB%E4%B8%8D%E6%B2%BB-072948389.html	台鐵司機員臉色發紫倒臥駕駛室 疑心肌梗塞送醫不治 - Yahoo奇摩新聞	台鐵一列區間快車原定今天上午10時47分從花蓮和平火車站發車，時間到未離站，列車長查看發現林姓司機員倒在駕駛室失去意識，送醫不治；死因初判為心肌梗塞，詳細仍待進一步調查。台鐵緊急調度其他班次司機員駕駛原列車，延誤約24分鐘後發車。	https://s.yimg.com/os/creatr-uploaded-images/2024-11/fb3710a0-a710-11ef-bbca-761291425a89	2024-11-20 07:29:48	Yahoo奇摩新聞
