country_code	url	title	description	image_url	publish_date	source
tw	https://www.cna.com.tw/news/ahel/202410270079.aspx	台灣醫師赴加薩持針縫傷拿鉛筆畫下戰火無情| 生活 - 中央社即時新聞	飛越萬里踏上加薩，來自台灣的無國界醫生鄔逸群，一度是加薩南部唯一的整形外科醫師，他手持針線縫補散發煙硝味的傷口，也握著鉛筆在素描本，畫下戰火的無情與短暫寧靜。	https://imgcdn.cna.com.tw/www/webphotos/WebOg/600/20241027/600x315_719422726640.jpg	2024-10-27 05:21:00	中央社即時新聞
tw	https://sports.ettoday.net/news/2843696	快訊／來了！中信兄弟宣布奪冠封王優惠 共享冠軍榮耀 - ETtoday運動雲	中信兄弟在10月25日奪下中華職棒35年總冠軍，隊史10度奪下中職總冠軍，今天公布各項封王優惠共享冠軍榮耀。	https://cdn2.ettoday.net/images/7920/e7920195.jpg	2024-10-28 06:06:00	ETtoday運動雲
tw	https://www.ctee.com.tw/news/20241028700847-430201	台股上沖下洗摔150點川普投顧一席話這族群全嚇倒- 證券 - 工商時報	今（28）日台股開高走低，開盤高見23,547.12點，觸頂隨後即向下重挫300餘點，一度低見23,164.42點，在經過震盪起伏後，以23,198.07點作收，下跌150.38點，跌幅0.64％，成交量為3,282.75億元。 上周末美國總統候選人川普於受訪時再次拋出「台灣偷晶片生意」的負面言論，...	https://images.ctee.com.tw/newsphoto/2023-06-02/1024/20230602700445.jpg	2024-10-28 06:22:00	工商時報
tw	https://tw.sports.yahoo.com/news/12%E5%BC%B7-%E6%9B%BF%E8%A3%9C%E4%BA%BA%E9%81%B8%E6%9C%89%E8%80%83%E6%85%AE%E9%81%8E%E9%99%B3%E5%81%89%E6%AE%B7-%E6%9B%BE%E8%B1%AA%E9%A7%92-%E4%BB%96%E8%A1%A8%E7%A4%BA%E5%B7%B2%E7%B6%93%E9%97%9C%E6%A9%9F-065100805.html	12強／替補人選有考慮過陳偉殷 曾豪駒：他表示已經關機 - Yahoo奇摩運動	今年中職賽季隨著中信兄弟奪得總冠軍後落幕，不過棒球季還在繼續，接下來11月登場的世界12強，28日選手陸續會合在大巨蛋集訓，日前宣布陣容調整，古林睿煬、邱浩鈞、潘文輝因傷勢疲勞退出，由郭俊麟、黃恩賜、曾頌恩遞補參賽，總教練曾豪駒說明3位遞補選手的考量。	https://media.zenfs.com/ko/setn.com.tw/80f19eb24bae00045d66a66b4c111b9a	2024-10-28 06:51:00	Yahoo奇摩運動
tw	https://news.google.com/rss/articles/CCAiCzl1MUZhZlF6QWFnmAEB?oc=5	【完整版】王瑞德虧吳靜怡.張益贍:要不是你們棄暗投明「也是鬼的一環」! 白萬聖節集會批綠王瑞德狠諷昌「白賊鬼」 吳靜怡用APT.喻柯A錢手法│呂惠敏主持│【驚爆新聞線】20241027│三立新聞台 - 三立LIVE新聞	None	None	2024-10-27 16:00:06	三立LIVE新聞
tw	https://news.tvbs.com.tw/world/2665970	北韓士兵遭「丟包森林」！18人餓到逃走 被俄國抓回拘留 - TVBS	None	None	2024-10-28 01:33:00	TVBS
tw	https://tw.news.yahoo.com/%E5%BD%AD%E5%95%93%E6%98%8E%E5%96%8A%E5%90%8C%E5%B3%B6-%E5%91%BD%E5%B9%AB%E7%87%92%E5%9E%83%E5%9C%BE-%E8%94%A3%E8%90%AC%E5%AE%89-%E5%BE%9E%E6%BA%90%E9%A0%AD%E6%B8%9B%E9%87%8F%E6%89%8D%E6%98%AF%E6%A0%B9%E6%9C%AC%E8%A7%A3%E6%B1%BA%E4%B9%8B%E9%81%93-035524081.html	彭啓明喊同島一命幫燒垃圾 蔣萬安：從源頭減量才是根本解決之道 - Yahoo奇摩新聞	[周刊王CTWANT] 蔣萬安指出，台北市其實目前已經在協助其他縣市焚燒垃圾，在有餘裕的能力之下，協助包含桃園、雲林、南投。所以另一方面，一定要先確保台北市內的垃圾焚燒，不過目前也面臨北市焚化爐相對老舊，二方面也面臨大幅整改的需求，所以必須考量到台北市焚燒垃圾的整體安全。蔣萬安...	https://media.zenfs.com/ko/ctwant_com_582/9ed79e528bc16a6abb81625bb769695e	2024-10-28 08:56:10	Yahoo奇摩新聞
tw	https://news.google.com/rss/articles/CCAiC2dyakNfQmlDbDNRmAEB?oc=5	吃名店沙丁魚握壽司「滿嘴魚刺」 民眾氣壞投訴 - 台視新聞 TTV NEWS	None	None	2024-10-28 05:50:35	台視新聞 TTV NEWS
tw	https://www.chinatimes.com/realtimenews/20241028002402-260407	盛治仁2026選新北市長？ 本尊親回4字 - 中時新聞網	針對國民黨2026年角逐新北市長的人選，有媒體稱藍營高層力推雲朗觀光集團總經理盛治仁出馬，對此，盛稍早在臉書以「沒有的事」回應。盛治仁今（28）日上午11時許發文指出，對於媒體報導參選新北市長一事，他因周一會	https://images.chinatimes.com/newsphoto/2024-10-28/656/20241028002418.jpg	2024-10-28 05:33:47	中時新聞網
tw	https://www.ettoday.net/news/20241028/2843590.htm	快訊／列超思案被告！陳吉仲、林聰賢、陳駿季庭訊結束 均獲請回 - ETtoday新聞雲	台北地檢署追查超思公司進口雞蛋案，今(28日)上午傳喚前農業部長陳吉仲、中央畜產會董事長林聰賢、以及現任農業部長陳駿季等3人以被告身分到場說明。稍早庭訊結束，3人均獲請回。	https://cdn2.ettoday.net/images/7920/e7920033.jpg	2024-10-28 04:23:00	ETtoday新聞雲
tw	https://theinitium.com/article/20241028-whatsnew-mainland-halloween-shanghai-forbidden	憂政治表達重現，上海政府「嚴防」萬聖變裝，民眾「游擊」狂歡｜Whatsnew - Initium Media 端傳媒	上海官方對預期中的萬聖節活動採取「重拳出擊」，或和擔心現場民眾借萬聖節狂歡表達政治信息有關。	https://theinitium.com/wp-content/uploads/2024/10/GettyImages-1768675476.jpg	2024-10-27 22:58:00	Initium Media 端傳媒
tw	https://tw.news.yahoo.com/%E8%8F%AF%E7%82%BA%E5%A6%82%E4%BD%95%E5%8F%96%E5%BE%97%E5%8F%B0%E7%A9%8D%E9%9B%BB7%E5%A5%88%E7%B1%B3%E6%99%B6%E7%89%87-%E5%A4%96%E5%AA%92%E6%8F%AD%E8%BD%89%E4%BA%86%E5%A5%BD%E5%B9%BE%E6%89%8B-%E4%B8%8B%E5%96%AE%E7%96%91%E8%80%81%E5%AE%A2%E6%88%B6-084331284.html	華為如何取得台積電7奈米晶片？外媒揭轉了好幾手：下單疑老客戶 - Yahoo奇摩新聞	台積電先進制程晶片，遭爆出現在華為產品上，在全球半導體及美國政界引發喧然大波。市場關注華為究竟如何拿的到台積電晶片？根據《BBC中文網》分析，銷售過程可能轉了好幾手，以至於台積電很難去查證。	https://media.zenfs.com/ko/news_tvbs_com_tw_938/38e29d5f8350a5d67837adcfb958e19d	2024-10-28 08:43:31	Yahoo奇摩新聞
tw	https://tw.stock.yahoo.com/news/%E6%99%AF%E6%B0%A3%E7%87%88%E8%99%9F%E9%80%80%E5%9B%9E%E9%BB%83%E7%B4%85%E7%87%88-%E7%B6%B2%E5%96%8A%E3%80%8C%E8%A6%81%E5%B4%A9%E4%BA%86%EF%BC%9F%E3%80%8D%E5%B0%88%E5%AE%B6%E7%9C%8B%E6%B3%95%E5%87%BA%E7%88%90-093347770.html	景氣燈號退回黃紅燈 網喊「要崩了？」專家看法出爐 - Yahoo奇摩股市	國發會今日公布9月景氣燈號，再度由紅燈退回黃紅燈，台灣經濟發展研究中心執行長、中央大學經濟系教授吳大任受訪表示，雖然黃紅燈仍代表景氣不錯，且市場明顯對股市仍具信心，但台灣作為AI供應鏈，從出口結構上來看，都是以AI相關的資通訊與電子零組件居多，傳產為少，最大的風險就是在AI泡沫化。	https://media.zenfs.com/zh-tw/cna.com.tw/7f45e44a9b7a807abf39d29f7fe835e5	2024-10-28 09:33:48	Yahoo奇摩股市
tw	https://money.udn.com/money/story/5599/8319613	印尼禁售iPhone 16 原因是蘋果沒做到這件事 - 經濟日報	由於蘋果公司未能達到印尼當局的投資目標，旗下最新款的iPhone 16已在當地遭到禁售，不過，若是旅客或機組員基於個人用...	https://pgw.udn.com.tw/gw/photo.php?u=https://uc.udn.com.tw/photo/2024/10/27/realtime/30793933.jpg&x=0&y=0&sw=0&sh=0&sl=W&fw=1050&exp=3600	2024-10-27 11:59:28	經濟日報
tw	https://tw.stock.yahoo.com/news/%E4%BB%96%E5%95%8F%E7%BE%8E%E5%9C%8B%E5%A4%A7%E9%81%B8%E5%89%8D%E5%BE%8C%E8%A9%B2%E5%A6%82%E4%BD%95%E6%93%8D%E4%BD%9C-%E5%8F%B0%E7%A9%8D%E9%9B%BB%E6%88%90%E7%87%92%E8%85%A6%E9%A1%8C-%E7%B6%B2%E5%8F%8B%E7%AD%94-%E5%B7%9D%E6%99%AE%E7%95%B6%E9%81%B8%E6%89%8D%E6%98%AF%E5%88%A9%E5%A4%9A-121000630.html	他問美國大選前後該如何操作？台積電成燒腦題 網友答：川普當選才是利多 - Yahoo奇摩股市	[FTNN新聞網]記者蔡昀庭／台北報導美國總統大選前夕，候選人的一舉一動都備受矚目，川普（DonaldTrump）先前曾在採訪中輸出「保護費」言論，讓台股深跌1800點...	https://media.zenfs.com/ko/ftnn_com_tw_939/8b3479beab28ba1566bd700cf39c5c1e	2024-10-27 12:10:00	Yahoo奇摩股市
tw	https://tw.news.yahoo.com/%E6%96%B0%E5%8F%B0%E5%B9%A3%E5%B0%8D%E6%97%A5%E5%9C%93-%E7%94%9C%E7%94%9C%E5%83%B9-%E5%8F%88%E4%BE%86%E4%BA%86-10%E8%90%AC%E5%8F%AF%E5%A4%9A%E6%8F%9B4%E8%90%AC%E6%97%A5%E5%9C%93-033400111.html	新台幣對日圓「甜甜價」又來了 10萬可多換4萬日圓 - Yahoo奇摩新聞	新台幣對日圓「甜甜價」又來了 10萬可多換4萬日圓	https://media.zenfs.com/ko/ebc.net.tw/f90527d3bcb4f3d931b2de4c09721cf9	2024-10-28 03:54:36	Yahoo奇摩新聞
tw	https://udn.com/news/story/7266/8320683	東北季風影響4縣市大雨特報 恐一路下到晚上 - 聯合新聞網	中央氣象署上午11時50分針對北北基宜4縣市發布大雨特報，恐一路下到晚上。	https://pgw.udn.com.tw/gw/photo.php?u=https://uc.udn.com.tw/photo/2024/10/28/realtime/30797205.jpg&s=Y&x=0&y=22&sw=2666&sh=1776&exp=3600	2024-10-28 04:02:23	聯合新聞網
tw	https://udn.com/news/story/6656/8321448	妻收夫3億贈與再與3子女拋繼承 6歲私生女得繳5735萬遺產稅…違憲 - 聯合新聞網	陳姓男子2017年死亡，妻子和3名小孩拋棄繼承，6歲的私生女成唯一繼承人，女童經財政部北區國稅局告知生父2016年6月將...	https://pgw.udn.com.tw/gw/photo.php?u=https://uc.udn.com.tw/photo/2024/10/28/realtime/30799394.jpg&s=Y&x=188&y=0&sw=4794&sh=3196&exp=3600	2024-10-28 09:00:53	聯合新聞網
tw	https://stars.udn.com/star/story/10092/8321330	康芮來襲！五月天「一路向東」受影響 相信音樂說話了 - 噓！星聞	五月天及所屬相信音樂旗下藝人，將於11月1日起陸續在高雄、花蓮開唱，共計14組大咖、4場接力傳愛，但因康芮颱風進逼恐成為...	https://pgw.udn.com.tw/gw/photo.php?u=https://uc.udn.com.tw/photo/2024/10/28/1/30799136.jpg&s=Y&x=0&y=0&sw=1280&sh=853&sl=W&fw=800&exp=3600	2024-10-28 08:07:03	噓！星聞
tw	https://udn.com/news/story/6999/8320172	MLB／大谷翔平左肩傷勢無礙G3可望出賽 「今天狀況已經好到嚇人」 - 聯合新聞網	道奇隊日籍球星大谷翔平昨天跑壘造成左肩脫臼退場，明天能否出戰世界大賽第3戰？總教練羅伯茲（Dave Roberts）今天...	https://pgw.udn.com.tw/gw/photo.php?u=https://uc.udn.com.tw/photo/2024/10/28/1/30795678.jpg&s=Y&x=60&y=20&sw=1161&sh=774&exp=3600	2024-10-28 00:43:05	聯合新聞網
tw	https://tw.news.yahoo.com/%E9%9B%9E%E8%9B%8B%E4%BE%9B%E9%81%8E%E6%96%BC%E6%B1%82%E5%8D%BB%E8%AA%BF%E6%BC%B23%E5%85%83-%E6%B6%88%E5%9F%BA%E6%9C%83%E8%B3%AA%E7%96%91%E4%B8%8D%E5%90%88%E7%90%86%E3%80%81%E7%BC%BA%E4%B9%8F%E7%9B%A3%E7%9D%A3%E6%A9%9F%E5%88%B6-063321029.html	雞蛋供過於求卻調漲3元 消基會質疑不合理、缺乏監督機制 - Yahoo奇摩新聞	台北市蛋商公會27日宣布今天雞蛋批發價每台斤調漲新台幣3元，變成34元，產地價30日調漲為24.5元。消基會今天說，供過於求之下調漲非常不合理，質疑蛋價僅由蛋農、蛋商討論後決定，缺乏監督機制。	https://media.zenfs.com/zh-tw/cna.com.tw/9765480d9d652ee8c6fceee54d342f1a	2024-10-28 06:33:21	Yahoo奇摩新聞
tw	https://udn.com/news/story/7325/8319550	花蓮地震…台中高樓地區搖晃近20秒 中捷全線列車月台暫停2分鐘 - 聯合新聞網	嘉義縣中埔鄉今下午2時19分起，1個半小時內發生8起地震；不料到晚上6時21分，震央又在東部的花蓮，台中地區有感。台中捷...	https://pgw.udn.com.tw/gw/photo.php?u=https://uc.udn.com.tw/photo/2024/10/27/realtime/30793754.jpg&s=Y&x=0&y=908&sw=3024&sh=2016&exp=3600	2024-10-27 10:39:23	聯合新聞網
tw	https://tw.news.yahoo.com/%E5%8F%B0%E7%A9%8D%E9%9B%BB%E8%B5%B4%E7%BE%8E%E6%8A%95%E8%B3%87-ait%E8%B0%B7%E7%AB%8B%E8%A8%80-%E5%8D%8A%E5%B0%8E%E9%AB%94-%E5%AE%9A%E8%A6%81%E7%94%A8%E7%B6%A0%E8%83%BD-%E5%8F%B0%E7%81%A3%E6%B2%92%E8%BE%A6%E6%B3%95%E6%BB%BF%E8%B6%B3%E9%80%99%E4%BA%9B%E9%9C%80%E6%B1%82-082159027.html	台積電赴美投資 AIT谷立言：半導體一定要用綠能 台灣沒辦法滿足這些需求 - Yahoo奇摩新聞	下周二美國即將選出下一任總統，隨著共和黨候選人川普的勝選機率提高，10月25日接	https://media.zenfs.com/zh-tw/cmmedia.com.tw/e0c3b9dd4f0256b8de5816a974654585	2024-10-28 08:21:59	Yahoo奇摩新聞
tw	https://www.ettoday.net/news/20241028/2843933.htm	女兒遭侵犯母轟：一直勸和解 龜山警急調監視器「3聲明」喊冤 - ETtoday新聞雲	桃園市龜山區一名國小女童昨（27日）上午，在光天化日下遭陌生男子強擄侵犯，女童不斷尖叫求救、抵抗，27秒恐怖畫面曝光後引發譁然，目前警方已持拘票將男子帶回警詢並移送檢方。母親難過表示，得知對方有身障身分，她也沒對法律制裁抱有太多期望，只希望檢警可以多加管束，不要讓孩子活在恐懼中，另外，她不解地說「警察一直希望能和解就和解」，對此，警方發3聲明嚴正否認。	https://cdn2.ettoday.net/images/7920/e7920430.png	2024-10-28 11:17:00	ETtoday新聞雲
tw	https://udn.com/news/story/7320/8321995	大車底下救出傷者！國道聯結車、油罐車等6車重大車禍 2死1命危、4傷送醫 - 聯合新聞網	國道3號114.6公里今天晚間6輛大小車重大事故案，現場一片凌亂，消防人員後來在大車下方，再找到2人失去生命跡象（OHC...	https://pgw.udn.com.tw/gw/photo.php?u=https://uc.udn.com.tw/photo/2024/10/28/1/30800691.jpg&s=Y&x=0&y=92&sw=1109&sh=739&exp=3600	2024-10-28 16:13:46	聯合新聞網
tw	https://money.udn.com/money/story/5637/8321701	「PRIDE TOKEN」同志遊行驕傲慶 免費空投限量領取1000個「自豪幣」 - 經濟日報	第22屆台灣同志遊行10月26日登場，現場吸引來自世界各地的LGBTQ+族群共襄盛舉。「PRIDE TOKEN （https://x.com/thepridetoken?s=21）」也透過大遊行活動來力挺LGBTQ+族群「自豪做自己」。「PRIDE TOKEN」即日起歡慶台灣同志遊行，免費贈送「自豪幣」空投https://pride.web3gather.com讓民眾免費領取1000個「PRIDE TOKEN」，限量領取。	https://pgw.udn.com.tw/gw/photo.php?u=https://uc.udn.com.tw/photo/2024/10/28/2/30800117.jpg&x=0&y=0&sw=0&sh=0&sl=W&fw=1050&exp=3600	2024-10-28 11:03:06	經濟日報
tw	https://udn.com/news/story/122629/8319668	日職／「42：2」史上最大儲金下剋上 日本一的兩樣情 - 聯合新聞網	隨著橫濱DeNA在歷經一戰定生死的決戰擊敗中央聯盟優勝隊伍巨人軍之後，2024年的日本一總冠軍決賽，沒有辦法上演兩聯盟冠軍「軟銀VS.巨人」的直接對決戲碼。「軟銀VS.橫濱DeNA」的系列賽打完前兩戰	https://pgw.udn.com.tw/gw/photo.php?u=https://uc.udn.com.tw/photo/2024/10/27/0/30794072.jpg&s=Y&x=0&y=0&sw=1280&sh=853&exp=3600	2024-10-27 23:00:00	聯合新聞網
tw	https://www.ctee.com.tw/news/20241028700053-439901	AI伺服器台廠樂觀旺到明年- 日報 - 工商時報	美四大雲端服務業者（CSP）新一季財報即將陸續出爐，雖還未有具體數字，但皆看好AI應用將成為未來趨勢，將持續加碼投入AI研發；而CSP業者對於資本支出與雲端業務展望正向，亦反映在台主要伺服器ODM廠的出貨動能及業績表現上，台伺服器供應鏈如廣達、緯創、緯穎、英業達、鴻海等第三季皆繳出亮眼成績，並對第四...		2024-10-27 19:00:00	工商時報
tw	https://udn.com/news/story/7327/8321982	康芮颱風逼近！陳其邁對高雄5個行政區發預警 提醒居民要慎防 - 聯合新聞網	康芮颱風逼近，高雄市長陳其邁今晚針對高雄山區五個行政區提出預警。他表示，氣象署已對六龜區、甲仙區、茂林區、桃源區、那瑪夏...	https://pgw.udn.com.tw/gw/photo.php?u=https://uc.udn.com.tw/photo/2024/10/28/realtime/30800578.png&s=Y&x=0&y=400&sw=1389&sh=926&exp=3600	2024-10-28 13:38:09	聯合新聞網
tw	https://www.ettoday.net/news/20241028/2843518.htm	律師：美國根本沒在管黃牛！ 該處罰的是用電腦程式買票 - ETtoday新聞雲	睽違7年，天王周杰倫將在台北大巨蛋開唱，吸引無數粉絲爭相購票。然而，隨著門票一票難求，許多黃牛在網路社團高價轉售門票，最高喊到一張30萬元，造成嚴重黃牛亂象。律師林智群對此發表意見，指出美國根本沒在管黃牛票，大聯盟票價炒翻天，歌手演唱會門票高價轉售，根本沒人管，「真的應該管的是利用電腦程式買票行為」。	https://cdn2.ettoday.net/images/7911/e7911457.jpg	2024-10-28 03:15:00	ETtoday新聞雲
tw	https://news.google.com/rss/articles/CCAiCzBHbDdoUFk2YzU4mAEB?oc=5	遭鍾佳濱與綠營律師"圍攻"極盡欺辱! 周萬來據理不屈"苦撐一幕"令人不忍 - 中天新聞	None	None	2024-10-28 09:46:11	中天新聞
tw	https://tw.stock.yahoo.com/news/%E5%8F%B0%E7%A9%8D%E9%9B%BB%E5%93%A1%E5%B7%A5%E5%8F%AA%E6%84%9B%E8%B2%B7%E6%96%B0%E5%B1%8B%E9%A0%90%E5%94%AE%E3%80%81%E3%80%8C%E8%80%81%E5%85%AC%E5%AF%9313%E5%83%B9%E3%80%8D%E9%83%BD%E4%B8%8D%E8%A6%81%EF%BC%9F%E9%87%A3%E5%87%BA%E4%B8%80%E5%A0%86%E8%B3%A3%E8%82%9D%E5%B7%A5%E7%A8%8B%E5%B8%AB%EF%BC%9A%E9%83%BD%E4%BE%86%E9%84%89%E4%B8%8B%E4%BA%86%E9%82%84%E8%99%90%E8%87%AA%E5%B7%B1%EF%BC%9F-021947219.html	台積電員工只愛買新屋預售、「老公寓1/3價」都不要？釣出一堆賣肝工程師：都來鄉下了還虐自己？ - Yahoo奇摩股市	台積電上週六（10/26）舉辦運動會，台灣6萬名員工都能領到2萬元大紅包，讓不少人羨慕能進這家幸福企業，事實上，近年台灣房市的漲幅，很大部份來自台積電員工的貢獻，只要台積電有設廠的縣市地方，大批工程師把賣肝賺來的血汗錢投入房市、確實發揮實力撐起行情。	https://s.yimg.com/ny/api/res/1.2/u47J21kzTGTh1S4LbAJiyg--/YXBwaWQ9aGlnaGxhbmRlcjt3PTEyMDA7aD04MDE7Y2Y9d2VicA--/https://s.yimg.com/os/creatr-uploaded-images/2022-07/1fee4300-030d-11ed-ab3f-dfd5ef489f34	2024-10-28 02:20:41	Yahoo奇摩股市
tw	https://tw.news.yahoo.com/%E5%98%89%E7%BE%A9%E6%9C%80%E5%A4%A7%E7%99%BE%E8%B2%A8-%E9%80%B1%E6%9C%AB-%E7%89%87%E7%A9%BA-%E6%9C%89%E8%B3%BA%E9%8C%A2-%E5%9C%A8%E5%9C%B0%E4%BA%BA%E6%8C%BA%E7%88%86-003417198.html	嘉義最大百貨「週末一片空」有賺錢？在地人挺爆：一年能做20億 - Yahoo奇摩新聞	百貨公司是許多民眾週末購物的熱門去處。不過，近日有網友到嘉義耐斯百貨逛逛，但明明是百貨，週末時卻是一片冷清，讓他不禁好奇，「真的有賺錢嗎？」之前也有網友認為，耐斯百貨不是太好逛，怎麼有辦法經營這麼久？釣出大票在地人力挺，「在全台灣這規模的百貨公司裡算不差了」、「嘉義能逛的就只有耐斯好嗎」。	https://media.zenfs.com/zh-tw/news_tvbs_com_tw_938/7ec3028368dba519c0b50704f8805af8	2024-10-28 00:52:05	Yahoo奇摩新聞
tw	https://www.cna.com.tw/news/aopl/202410280185.aspx	日本眾議院大選自民黨慘敗 總裁石破茂無意下台 - 中央社即時新聞	由自民黨及公明黨所組的執政聯盟昨天在第50屆日本眾議院大選慘敗，形成「朝小野大」局面。首相、自民黨總裁石破茂今天在自民黨總部舉行記者會時被問及是否負起敗選責任時表示，他將持續帶頭進行政治改革、處理經濟課題等。	https://imgcdn.cna.com.tw/www/webphotos/WebOg/600/20241028/2000x1050_523412071762.jpg	2024-10-28 07:44:00	中央社即時新聞
tw	https://tw.stock.yahoo.com/news/631%E5%84%84%E5%85%83%E5%A8%81%E5%8A%9B%E5%BD%A9%E7%8D%8E%E8%90%BD%E5%8F%B0%E5%8D%97%E5%85%AD%E7%94%B2%EF%BC%81%E4%B8%80%E4%BA%BA%E7%8D%A8%E5%BE%97%E9%A0%AD%E7%8D%8E-%E6%A5%AD%E8%80%85%E9%A9%9A%E5%91%BC%EF%BC%9A%E6%89%8D%E5%89%9B%E5%8E%BB%E5%AA%BD%E7%A5%96%E5%BB%9F%E6%8B%9C%E6%8B%9C-140020553.html	6.31億元威力彩獎落台南六甲！一人獨得頭獎 業者驚呼：才剛去媽祖廟拜拜 - Yahoo奇摩股市	才剛拜完媽祖，台南市六甲區一家彩券行就幸運開出威力彩頭獎！6.31億元威力彩今（28）日晚間開在台南市六甲區「萬客來彩券行」，一人獨得。	https://s.yimg.com/ny/api/res/1.2/.0Vf5xKacBz4xF3SjqG02Q--/YXBwaWQ9aGlnaGxhbmRlcjt3PTEyMDA7aD02ODE7Y2Y9d2VicA--/https://s.yimg.com/os/creatr-uploaded-images/2024-10/63302680-9535-11ef-bbbb-026ae315f3f7	2024-10-28 14:00:21	Yahoo奇摩股市
tw	https://udn.com/news/story/7320/8321787	重返板橋下墜電梯現場 專家測新鋼索「一扭就裂」問題大 - 聯合新聞網	新北板橋「電梯大怒神」事件引發關注，市府有關單位及相關公會今下午重返現場會勘，盼釐清事故原因。板橋區公所表示，今先來初步...	https://pgw.udn.com.tw/gw/photo.php?u=https://uc.udn.com.tw/photo/2024/10/28/realtime/30800292.jpg&s=Y&x=0&y=0&sw=6000&sh=4000&exp=3600	2024-10-28 11:48:48	聯合新聞網
tw	https://tw.news.yahoo.com/%E5%9C%8B%E6%83%85%E5%A0%B1%E5%91%8A%E4%B8%BB%E5%8B%95%E6%AC%8A%E8%AE%8A%E7%B8%BD%E7%B5%B1-%E7%AB%8B%E6%B3%95%E9%99%A2%E7%A7%98%E6%9B%B8%E9%95%B7%E5%91%A8%E8%90%AC%E4%BE%86%E8%88%87%E9%8D%BE%E4%BD%B3%E6%BF%B1%E6%BF%80%E8%BE%AF-080800131.html	國情報告主動權變總統？立法院秘書長周萬來與鍾佳濱激辯 - Yahoo奇摩新聞	憲法法庭日前宣判國會擴權修法釋憲結果，立法院祕書長周萬來今赴立法院司法法制委員會報告並備詢，討論有關國會行使職權的後續。其中，有關賴清德總統宣布自己願意到立法院國情報告部分，立法院祕書長周萬來認為，大法官宣判《立法院職權行使法》15條之2被認定違憲，等同立法院就不能主動邀總統來報告了，要總統咨文，立院同意，不過，司委會召委、民進黨立委鍾佳濱堅持認為，立法院還是可以邀請總統來，雙方發生激辯。	https://media.zenfs.com/ko/setn.com.tw/f51b8177a212323eeed1e63dc47a4001	2024-10-28 08:08:00	Yahoo奇摩新聞
tw	https://newtalk.tw/news/view/2024-10-28/942086	謝步智觀點》以色列報仇報一半伊朗不再回擊中東大戰降溫美國成功拆彈| 國際 - Newtalk新聞	超過 100 台包含 F-35 在內的以色列戰機在 10 月 26 日出動，攻擊了伊朗的 20 個地點 ，根據紐約時報報導，伊朗全部的 S-300 導彈防空系統被炸毀、導彈和無人機的秘密生產基地受到重創，間接支援了烏克蘭，伊朗防空如同虛設。而擁有 100 多架戰機的伊朗，竟然沒有一架敢升空抵抗。對這	https://s.newtalk.tw/album/news/943/671f581f702e3.jpg	2024-10-28 09:29:50	Newtalk新聞
tw	https://www.setn.com/News.aspx?NewsID=1554667	柯文哲進看守所近2月她由「外觀」驚覺1件事：心理素質很強| 政治 - 三立新聞網 Setn.com	民眾黨主席柯文哲捲入京華城弊案，隨著2個月羈押期將滿，北檢聲請延長羈押禁見，北院將於31日開庭。北市議員鍾沛君由柯文哲的外觀發現，他是一個心理素質很強的人，強調可以質疑柯文哲有罪，但不能在過程中讓他穿小鞋。	https://attach.setn.com/newsimages/2024/09/05/4798527-PH.jpg	2024-10-27 22:18:00	三立新聞網 Setn.com
tw	https://news.tvbs.com.tw/local/2665959	回家了...台中翁散步遭無照猴撞死狠輾 身分確認妻淚認屍 - TVBS	None	None	2024-10-28 01:16:00	TVBS
tw	https://www.ettoday.net/news/20241028/2843396.htm	蚯蚓「大規模竄出地面」！畫面曝光 網目睹嚇呆：什麼情況 - ETtoday新聞雲	一名女網友昨（27）日經過屏東一處地面，發現地板全是蚯蚓，讓她嚇得直呼「這是什麼情況？太可怕了」有不少網友聯想到近日嘉義縣中埔鄉一連發生好幾起有感地震，猜測蚯蚓出沒恐怕與地震有關。對此，中央氣象署曾解釋過，蚯蚓大軍衝出地表與地震沒有直接關係。	https://cdn2.ettoday.net/images/7919/e7919561.jpg	2024-10-28 01:13:00	ETtoday新聞雲
tw	https://tw.news.yahoo.com/%E7%BE%8E%E5%9C%8B%E5%A4%A7%E9%81%B8%E6%9C%80%E6%96%B0%E6%B0%91%E8%AA%BF%E5%90%84%E5%AE%B6%E4%B8%80%E6%AC%A1%E7%9C%8B%EF%BD%9C%E8%B3%80%E9%8C%A6%E9%BA%97%E3%80%81%E5%B7%9D%E6%99%AE%E5%85%A8%E5%9C%8B%E3%80%81%E6%90%96%E6%93%BA%E5%B7%9E%E9%83%BD%E8%86%A0%E8%91%97-cnn%E5%B0%88%E5%AE%B6%EF%BC%9A%E5%8B%9D%E8%80%85%E6%A9%AB%E6%8E%83%E6%A9%9F%E7%8E%87%E9%AB%98-010613738.html	美國大選最新民調各家一次看｜賀錦麗、川普全國、搖擺州都膠著 CNN專家：勝者橫掃機率高 - Yahoo奇摩新聞	距離美國總統大選正式投票日（11/5）僅剩11天。多項最新民調顯示，共和黨總統候選人川普和民主黨總統候選人賀錦麗在全國和搖擺州的支持率還是難分軒輊，選情仍可能在最後一刻翻盤。	https://s.yimg.com/ny/api/res/1.2/nx5zGOhTSLwXwEu16Hiu3Q--/YXBwaWQ9aGlnaGxhbmRlcjt3PTEyMDA7aD04MDA7Y2Y9d2VicA--/https://s.yimg.com/os/creatr-uploaded-images/2024-10/801b1900-923b-11ef-be2c-2f163efe16b5	2024-10-28 01:07:36	Yahoo奇摩新聞
tw	https://www.mirrormedia.mg/story/20241028edi004	【有片】白委林國成嗆若欺人太甚「我們來衝總統府」 小草嗨翻、陳佩琪反應曝光 - 鏡週刊	京華城案檢廉持續偵辦，民眾黨主席柯文哲遭羈押至今將屆滿2個月，北檢已聲請延押柯文哲，預計本月31日開庭。民眾黨昨（27日）舉辦集會活動，立委林國成再次語出驚人，稱若有一天總統賴清德欺人太甚，逼到他們沒辦法時，喊話小草：「我們來衝總統府好不好？」	https://v3-statics.mirrormedia.mg/images/a4435885-c896-4256-b1a0-fefae0cf491c-w1600.jpg	2024-10-28 12:26:46	鏡週刊
