country_code	url	title	description	image_url	publish_date	source
tw	https://www.cna.com.tw/news/aopl/202410160382.aspx	澤倫斯基公布「勝利計畫」 5重點含全面非核戰略嚇阻| 國際 - 中央社即時新聞	烏克蘭總統澤倫斯基今天在國會公布廣受矚目的「勝利計畫」。主要盟友美國11月5日將舉行總統大選，值此危殆時刻，他敦促早已兵疲馬困的烏克蘭團結一心。	https://imgcdn.cna.com.tw/www/webphotos/WebCover/800/20241016/1760x1320_962618296500.jpg	2024-10-16 12:42:00	中央社即時新聞
tw	https://www.ettoday.net/news/20241016/2836558.htm	以色列轟炸黎巴嫩南部大城 市長在內6人喪命 - ETtoday新聞雲	以色列於今（16日）對黎巴嫩南部主要城鎮納巴蒂葉市的市政府大樓進行空襲，造成至少6人喪生，包括市長艾哈邁德·卡希爾（Ahmed Kahil）。根據路透社的報導，以色列軍方表示，海軍與地面部隊聯手襲擊了納巴蒂葉地區的多個真主黨目標，並摧毀了相關的地下設施。	https://cdn2.ettoday.net/images/7899/e7899178.jpg	2024-10-16 14:07:00	ETtoday新聞雲
tw	https://def.ltn.com.tw/article/breakingnews/4833357	國軍新一代抗彈板跟上世界? 王定宇爆得標廠商洗中國貨又沒產線 - 軍武	軍備局近日公開展示新一代抗彈板，軍備局當時稱新式抗彈板可抵擋共軍5.8公厘鋼芯彈，採陶瓷片及聚乙烯纖維三層複合式結構，抗彈板與其適配的新式戰鬥背心，明年將產製6萬組。但民進黨立委王定宇今天指出，新式抗彈板的表面塗層採用韌性較低的低階工業材料、炭化矽陶瓷得標廠商根本沒有生產線、防彈背心還使用國際軍隊都	https://img.ltn.com.tw/Upload/def/page/800/2024/10/17/4833357_1.jpg	2024-10-17 04:09:00	軍武
tw	https://www.setn.com/News.aspx?NewsID=1549051	柯文哲第5度提訊沒戴眼鏡？四叉貓、吳靜怡曝貓膩：打暗號「是大事」 - 三立新聞網 Setn.com	北檢持續對京華城弊案進行偵辦，昨（16）日上午第5度借提前台北市長柯文哲，這也是他時隔20天再度現身，不過卻有人發現，柯並有沒戴上眼鏡。對此，網紅四叉貓及政治評論員吳靜怡今（17）日接受廣播節目專訪時紛紛直指，柯文哲此舉是在對外「打暗號」。	https://attach.setn.com/newsimages/2024/10/17/4854617-PH.jpg	2024-10-17 03:34:00	三立新聞網 Setn.com
tw	https://newtalk.tw/news/view/2024-10-17/940540	無視中共干涉法議員：會見蔡英文的快樂超越一切| 國際 - Newtalk新聞	前總統蔡英文16日受邀參訪法國參議院，兩院近30位跨黨派議員出席，同聲挺台，稱台灣是永遠的朋友。議員告訴中央社，即使受到中共「勸阻」，但會見蔡英文的快樂超越一切。前總統蔡英文16日繼參訪法國最頂尖學府巴黎薩克雷大學後，馬不停蹄前往參議院會晤國會議員。議員熱情迎接蔡英文，並為其導覽擁有逾400年歷史的	https://s.newtalk.tw/album/news/941/6710282954000.jpg	2024-10-16 20:56:52	Newtalk新聞
tw	https://tw.news.yahoo.com/%E5%8B%9E%E9%95%B7-%E6%9C%88%E8%96%AA31000%E5%85%83%E4%BB%A5%E4%B8%8B-%E5%B0%B1%E6%98%AF%E4%BD%8E%E8%96%AA%E5%8B%9E%E5%B7%A5-030518074.html	勞長：月薪31000元以下 就是低薪勞工 - Yahoo奇摩新聞	對於「低薪勞工」的定義，勞動部長何佩珊今天(17日)在立法院衛環委員會時指出，依據經濟合作暨發展組織OECD定義，低薪勞工指的是薪水低於薪資中位數乘上三分之二的受薪勞工，以台灣來說，將是新台幣3萬1000元。 行政院經濟發展委員會17日召開第二次會議，由於第一次會議結論提到，為改善台灣低薪狀況，顧問認為應該先定義出低薪勞工，才能制定政策應對、支持。 勞動部長何佩珊17日在立法院衛環委員會、接受民進黨立委林淑芬質詢時答覆，依據經濟合作暨發展組織OECD定義，低薪勞工指的是薪水低於薪資中位數乘上三分之二的受薪勞工，以台灣來說，將是新台幣3萬1000元。她說：『(原音)我們低薪定義大概是參考OECD，薪資中位數的三分之二來定義。(請問現在中位數是多少？)大概4萬6000元，所以三分之二是3萬1000元。(所以比最低工資2萬8590元多個一兩千元的人算是低薪？)可以這麼說。』 不過，林淑芬接續指出，以勞動力發展署開出的文書相關職缺，起薪是2萬9261元，最多到3萬2000元，根本是政府帶頭給低薪。何佩珊則回應，明年這些工作都會調高到3萬2000元，相關預算都已編列，希望委員支持。 對於政府聘僱	https://s.yimg.com/ny/api/res/1.2/ctIH2Foimce92WK5BbXzog--/YXBwaWQ9aGlnaGxhbmRlcjt3PTEyMDA7aD02NzU7Y2Y9d2VicA--/https://media.zenfs.com/ko/rti.org.tw/1d87cd4655bcf2339a4edcdc1920e0d3	2024-10-17 03:27:45	Yahoo奇摩新聞
tw	https://tw.stock.yahoo.com/news/%E5%9C%8B%E7%99%BC%E6%9C%83%E4%BA%BA%E5%8F%A3%E5%A0%B1%E5%91%8A%E7%B5%82%E6%96%BC%E5%87%BA%E7%88%90%EF%BC%81%E9%A0%90%E4%BC%B046%E5%B9%B4%E5%BE%8C%E5%8F%B0%E7%81%A3%E7%B8%BD%E4%BA%BA%E5%8F%A3%E5%A4%A7%E6%B8%9B844%E8%90%AC%E4%BA%BA-084354971.html	國發會人口報告終於出爐！預估46年後台灣總人口大減844萬人 - Yahoo奇摩股市	按慣例國發會應在8月公布人口報告，遲至今（17）日下午終於公布，報告顯示，預估未來我國總人口將由2024年之2,340萬人，減少至2070年之1,497萬人，減少844萬人，其中幼年、青壯年人口大減，老年人口則是大幅增加，與此同時，由原3.6名青壯年人口扶養每1名老年人口，減少為每1名青壯年人口即需扶養1名老人。	https://s.yimg.com/ny/api/res/1.2/mE_4RTI7lgYY9VqSXt1aSw--/YXBwaWQ9aGlnaGxhbmRlcjt3PTEyMDA7aD04MDA7Y2Y9d2VicA--/https://s.yimg.com/os/creatr-uploaded-images/2023-08/692f92b0-50a7-11ee-bffb-58608c729e4c	2024-10-17 08:43:54	Yahoo奇摩股市
tw	https://def.ltn.com.tw/article/breakingnews/4833673	美國增開F-16產線有望交付 台灣合計207架成為次多「鳳」機大國 - 軍武	國防部長顧立雄今（17）日率官員赴立院外交及國防委員會業務報告並備質詢，立委林憶君質詢表示，我國將成為除美國外擁有最多F-16戰機的國家，面對少子化衝擊，國防部應針對飛行員、地勤等「人力問題」超前部署，為空軍規劃下一代戰機時前瞻10至20年，維護台海安全。國防部則回應表示，美國產線上有19架飛機正在	https://img.ltn.com.tw/Upload/def/page/800/2024/10/17/phpAfME4v.jpg	2024-10-17 07:17:00	軍武
tw	https://money.udn.com/money/story/11162/8295288	清華大學用一顆光子造出全世界最小量子電腦 - 經濟日報	清華大學物理系、前瞻量子科技研究中心教授褚志崧領導的研究團隊16日宣布，成功研發出全世界最小的量子電腦—僅僅使用一顆光子...	https://pgw.udn.com.tw/gw/photo.php?u=https://uc.udn.com.tw/photo/2024/10/16/realtime/30725589.jpg&x=0&y=0&sw=0&sh=0&sl=W&fw=1050&exp=3600	2024-10-16 04:39:29	經濟日報
tw	https://www.ettoday.net/news/20241017/2837119.htm	通霄濱海馬拉松600萬經費遭掏空 前會長10／12被發現陳屍車上 - ETtoday新聞雲	「2024年通霄濱海追風馬拉松」賽事即將在10月20日登場，但楊姓會長12日輕生身亡後，籌辦幹部接手會務、帳戶，赫然發現報名費500多萬、會款100餘萬遭挪用一空，指控楊涉嫌挪用公款、報警提告侵占，並緊急公告活動如期舉行，但賽事補給和總獎金將調整，希望跑友諒解。	https://cdn2.ettoday.net/images/7900/e7900681.jpg	2024-10-17 08:53:00	ETtoday新聞雲
tw	https://news.ltn.com.tw/news/society/breakingnews/4833086	政大性別友善廁所爆偷拍 24歲男校友被逮喊「只是想收藏」 - 自由時報	台北市國立政治大學今日爆出偷拍事件，一名女大生今日上午10時許在大勇樓性別友善廁所如廁時，突然發現隔板伸出一隻手機，驚覺遭到偷拍，憤怒衝出廁所堵住廁所門並報警，文山一分局警方獲報抵達現場，逮捕24歲的李姓男子，李男稱自己是政大校友，甚至離譜表示只是想自己收藏不會上傳，被警方依妨害性隱私及不實性影像罪移送台北地檢署偵辦。警方調查，當時女大生在使用廁所時，忽感覺後方有異樣，轉頭發現遭人用手機拍攝，女大生立即衝出並將隔壁廁所門壓住阻止犯嫌逃出，並請周遭熱心同學協助報警。	https://img.ltn.com.tw/Upload/news/600/2024/10/16/4833086_2_1.jpg	2024-10-16 15:17:23	自由時報
tw	https://news.tvbs.com.tw/life/2653996	停車「發票中1000萬」沒人領！獎落這縣市 17人中獎快領 - TVBS	快拿出發票對，1000萬否則要充公了！7、8月發票中獎號碼出爐，超商7-11、全家、全聯全開出1000萬大獎，17人爽中千萬，其中一名得主只是停車，就爽抱走1000萬。對此，國稅局提醒，請在期限內完成兌獎。	None	2024-10-17 02:13:00	TVBS
tw	https://newtalk.tw/news/view/2024-10-17/940546	｢小沈1500｣是時間還是金額 吳靜怡：柯文哲再不認會讓更多人曝光! - Newtalk新聞	民眾黨主席、前台北市長柯文哲涉入京華城重大弊案遭羈押逾1個月，又爆出基隆市長謝國樑也在柯文哲USB隨身碟名單中被記載「200」，謝國樑坦承家族企業的確與民眾黨有往來，引起輿論譁然。柯文哲前幕僚、政治評論員吳靜怡今（17）天清晨在臉書發文直言：「柯文哲再不認，隨身碟資料會讓更多人曝光，民眾黨要清楚，雖	https://s.newtalk.tw/album/album/1/67047a88408ba.jpg	2024-10-17 00:01:14	Newtalk新聞
tw	https://udn.com/news/story/6656/8297243	控風電商空手套白狼 羅智強：經濟部少罰400億懲罰違約金 - 聯合新聞網	再生能源再傳弊案，國民黨立委羅智強今指控，達德能源起初擁有允能風場百分之百股權，過程不斷釋出股份直至歸零，「這不是空手套...	https://pgw.udn.com.tw/gw/photo.php?u=https://uc.udn.com.tw/photo/2024/10/17/realtime/30730557.jpg&s=Y&x=0&y=11&sw=1477&sh=984&exp=3600	2024-10-17 01:48:44	聯合新聞網
tw	https://udn.com/news/story/7239/8298867	前防疫指揮官王必勝再傳異動 將轉戰東元 - 聯合新聞網	衛福部前政務次長也是中央疫情指揮官王必勝，赴凱基金控集團旗下中華開發資本出任資深副總不到二個月，傳出已辭去開發資本資深副...	https://pgw.udn.com.tw/gw/photo.php?u=https://uc.udn.com.tw/photo/2024/10/17/realtime/30734941.jpg&s=Y&x=0&y=400&sw=3644&sh=2429&exp=3600	2024-10-17 10:35:12	聯合新聞網
tw	https://tw.news.yahoo.com/%E7%A6%8D%E4%B8%8D%E5%96%AE%E8%A1%8C-%E6%99%9A%E9%96%93%E6%A8%B9%E6%9E%97%E4%B9%9F%E7%99%BC%E7%94%9F%E5%9A%B4%E9%87%8D%E8%BB%8A%E7%A6%8D-1%E4%BA%BA%E7%84%A1%E7%94%9F%E5%91%BD%E8%B7%A1%E8%B1%A1-142136657.html	禍不單行！晚間樹林也發生嚴重車禍 1人無生命跡象 - Yahoo奇摩新聞	即時中心／陳登隆、林耿郁報導今（17）天晚間台北市內湖區東湖市場，發生嚴重的車禍意外，造成3人不幸身亡；沒想到禍不單行，稍早新北市樹林區中正路也傳出嚴重的車禍意外，初步了解至少有3人受傷、其中1人到院前無生命跡象；目前警方仍在處理中。	https://media.zenfs.com/ko/ftvn.com.tw/f764fee9fda2cfec87abac6c903e59e5	2024-10-17 15:09:37	Yahoo奇摩新聞
tw	https://tw.sports.yahoo.com/news/%E5%8F%B0%E7%81%A3%E5%A4%A7%E8%B3%BD-%E5%85%84%E5%BC%9F3%E6%B4%8B%E6%8A%95%E5%B8%B6%E5%BE%B7%E4%BF%9D%E6%8B%89-%E7%8C%9B%E7%99%BB-%E5%85%8B%E8%BF%AA-%E5%BC%B5%E5%BF%97%E8%B1%AA%E5%B0%8F%E6%8B%89%E5%82%B7%E4%BB%8D%E6%9C%83%E5%9C%A832%E4%BA%BA%E5%90%8D%E5%96%AE-110448798.html	台灣大賽》兄弟3洋投帶德保拉、猛登、克迪 張志豪小拉傷仍會在32人名單 - Yahoo奇摩運動	中信兄弟將在今年台灣大賽交手統一獅，雙方將在本週六進行系列賽G1，兄弟32人名單也大致底定，總教練平野惠一透露，「洋投將會帶上德保拉、克迪與猛登，此外本季結束後將引退的周思齊將會以教練身份參戰台灣大賽。」	https://media.zenfs.com/zh-tw/tsna.com.tw/e3fb52dde1f1ce80cbb94644ad4ee03f	2024-10-17 11:04:48	Yahoo奇摩運動
tw	https://www.cna.com.tw/news/ahel/202410170092.aspx	台鐵便當升級健康餐盒脂肪大減、蔬菜增量| 生活 - 中央社即時新聞	兒時記憶升級，台鐵便當今天起變身百元健康餐盒，台鐵與國健署聯手推出熱量僅791大卡的茶香燻雞便當，使用紅藜、玉米等全穀，不使用油炸豆製品、肉品，脂肪大減、蔬菜增量。	https://imgcdn.cna.com.tw/www/webphotos/WebOg/600/20241017/1024x538_464734468069.jpg	2024-10-17 04:07:00	中央社即時新聞
tw	https://news.google.com/rss/articles/CCAiC2lMNFVMUzJsd2JZmAEB?oc=5	"AI是Real"法說太狂!台積電年營收看增3成.毛利率飆高...ADR刷新紀錄助攻台股直衝2萬4!?｜主播高昱晴｜【新聞午夜場】20241017｜非凡財經新聞 - USTV 非凡電視	None	None	2024-10-17 16:21:10	USTV 非凡電視
tw	https://news.tvbs.com.tw/life/2654075	天氣／下週恐「一次雙颱風」！ 專家：威力很強 - TVBS	None	None	2024-10-17 03:08:00	TVBS
tw	https://www.setn.com/News.aspx?NewsID=1548766	柯文哲令「黨部搬錢」不是現金？林冠年曝張晉源關鍵角色：可能是虛擬幣 - 三立新聞網 Setn.com	週刊報導，民眾黨主席柯文哲曾令貼身帳房「橘子」許芷瑜「去黨部搬錢」，前民眾黨新竹縣黨部執行長林冠年今（16）日在三立新聞「前進新台灣」節目表示，搬錢可能不是現金，以用詞來看更像是虛擬幣，「要想成有一個USB叫『黨部』，『黨部』搬多少錢出去變海外資產，才比較符合邏輯」。他認為，「橘子」至今仍待在海外就是為了將錢洗乾淨，他也指出，張晉源作為駭客、金流、海外資產高手，如今已成為關鍵。	https://attach.setn.com/newsimages/2024/10/16/4853760-PH.jpg	2024-10-16 08:27:00	三立新聞網 Setn.com
tw	https://tw.news.yahoo.com/%E9%AB%98%E4%B8%AD%E7%99%BC%E6%94%BE%E6%9C%8D%E5%8B%A4%E5%90%8C%E6%84%8F%E6%9B%B8%E5%BC%95%E5%AE%B6%E9%95%B7%E6%81%90%E6%85%8C-%E6%95%99%E8%82%B2%E9%83%A8%E5%AE%A3%E5%B8%83%E5%81%9C%E6%AD%A2%E4%BD%BF%E7%94%A8-072811319.html	高中發放服勤同意書引家長恐慌 教育部宣布停止使用 - Yahoo奇摩新聞	近日有部分高中發放青年服勤同意書，疑似要動員參戰，引起家長恐慌。教育部今天宣布，即日起停止使用同意書，後續將調整修正「學校青年服勤動員準備分類計畫」，未來相關計畫的執行，會研擬更完整且清楚的說明。	https://s.yimg.com/os/creatr-uploaded-images/2024-02/ef6d41c0-d3aa-11ee-b7a7-4ca2f6621aca	2024-10-17 07:28:12	Yahoo奇摩新聞
tw	https://news.tvbs.com.tw/politics/2654228	火爆！村民怒家園遭設光電板 業者踢館槓藍委 - TVBS	嘉義縣大埔鄉村民，不滿村落遭光電業者強行設置地面光電板，在當地引發嚴重抗爭，今(17日)天村民北上到行政院門口，向行政院長卓榮泰表達抗議，不過光電業者也到場踢館，一度和藍營立委槓上。	https://cc.tvbs.com.tw/img/upload/2024/10/17/20241017122933-b4a78cb8.jpg	2024-10-17 05:32:00	TVBS
tw	https://ctinews.com/news/items/JmxNYmNBa8	朱立倫下令！台電2000億撥補「不能讓它過」 民進黨錯誤能源政策請自己吞下 - 中天新聞網	None	None	2024-10-17 00:07:34	中天新聞網
tw	https://tw.news.yahoo.com/%E5%B9%95%E5%BE%8C-%E6%9F%AF%E6%96%87%E5%93%B2%E9%81%A0%E8%A6%AA-%E6%A9%98%E5%AD%90-%E8%A8%B1%E8%8A%B7%E7%91%9C%E6%9C%89%E5%A4%9A%E5%A4%A7%E5%92%96-%E6%9B%BE-230000810.html	幕後／柯文哲遠親「橘子」許芷瑜有多大咖？曾「現行犯」遭逮⋯竟動用市府秘書處長官求情 - Yahoo奇摩新聞	[FTNN新聞網]記者劉秀敏／綜合報導檢廉持續偵辦京華城弊案，近日週刊報導，柯文哲貼身帳房、綽號「橘子」的秘書許芷瑜在檢廉搜索前接獲柯文哲指示出境前往日...	https://media.zenfs.com/ko/ftnn_com_tw_939/ae304cb7b747af9570c34324e9b4252f	2024-10-16 23:00:00	Yahoo奇摩新聞
tw	https://tw.news.yahoo.com/%E6%96%B0%E8%8E%8A%E7%BF%B0%E5%93%81%E9%85%92%E5%BA%97%E7%A7%9F%E7%B4%84%E5%88%B0%E6%9C%9F%E6%B8%85%E5%80%89%E7%89%B9%E8%B3%A3-%E4%BA%BA%E6%BD%AE%E5%A4%A7%E7%88%86%E6%BB%BF-055703368.html	新莊翰品酒店租約到期清倉特賣 人潮大爆滿 - Yahoo奇摩新聞	財經中心／葉為襄、胡崇恩、SNG 台北報導新北市新莊翰品酒店10/26就要熄燈！飯店在地經營已經15年，讓好多附近民眾很不捨，飯店集團也以愛物惜物為出發點，要舉行三天清倉特賣活動，只是第一天的早上七點鐘一直到開賣10點鐘，人潮已經大爆滿。	https://media.zenfs.com/ko/ftvn.com.tw/c5a981cea67824420ef7a0ac016c1108	2024-10-17 10:04:03	Yahoo奇摩新聞
tw	https://news.tvbs.com.tw/sports/2654379	MLB季後賽／20打席敲17安！得點圈之鬼 大谷翔平續寫神紀錄 - TVBS	None	None	2024-10-17 06:09:00	TVBS
tw	https://www.cna.com.tw/news/ahel/202410160310.aspx	早期HER2乳癌易復發健保納新藥助降風險| 生活 - 中央社即時新聞	HER2乳癌易復發，早期患者術後未達病理完全緩解，復發機率高2倍，醫師提醒，把握術後殘留病灶用藥決定預後，健保署今年8月起納入抗體藥物複合體有條件給付，有助降低風險。	https://imgcdn.cna.com.tw/www/WebPhotos/1024/20241016/1024x768_wmky_0_C20241016000142.jpg	2024-10-16 09:45:00	中央社即時新聞
tw	https://tw.news.yahoo.com/%E7%8E%8B%E4%B8%96%E5%A0%85%E8%BD%9F%E8%B2%A1%E9%95%B7%E7%AA%81%E9%BB%9E%E5%90%8D%E8%B3%88%E6%B0%B8%E5%A9%95-%E5%8F%B0%E4%B8%8B%E7%AC%91%E6%88%90-%E7%89%87-021510497.html	王世堅轟財長突點名賈永婕 台下笑成一片 - Yahoo奇摩新聞	[NOWnews今日新聞]財政部長莊翠雲16日率所屬機關首長暨國營事業董事長、總經理赴立法院財政委員會報告並備質詢，民進黨立委王世堅質詢時相當激動，要莊翠雲將不合時宜的五大稅制降低，甚至怒轟她財政部長...	https://media.zenfs.com/ko/nownews.com/8c7ac486557ee679bc563d3f6161204c	2024-10-17 07:35:23	Yahoo奇摩新聞
tw	https://tw.news.yahoo.com/%E5%A4%AE%E8%A1%8C%E6%89%93%E7%82%92%E6%88%BF%E9%82%84%E6%9C%89%E7%AC%AC%E5%85%AB%E6%B3%A2%EF%BC%9F%E6%A5%8A%E9%87%91%E9%BE%8D%EF%BC%9A%E5%A4%A7%E5%AE%B6%E6%8B%9A%E5%91%BD%E8%B2%B7%E6%88%BF-%E5%B0%87%E5%82%AC%E5%8C%96%E6%88%BF%E5%B8%82%E6%B3%A1%E6%B2%AB-032218205.html	央行打炒房還有第八波？楊金龍：大家拚命買房 將催化房市泡沫 - Yahoo奇摩新聞	中央銀行9月祭出第七波選擇性信用管制，震撼市場，被稱作「金龍海嘯」。中央銀行總裁楊金龍今天表示，先前房市熱度高，大家拚命買房，恐將催化房市泡沫，影響金融穩定，央行出手是希望扭轉預期心理，讓市場冷卻，期待能讓房市軟著陸。至於後續是否會有第八波選擇性信用管制，楊金龍說，需要一點時間觀察，是否還需要加大力道，央行檢討後會做決定。	https://media.zenfs.com/ko/cna.com.tw/9e36776fcba49432a5f5eefdfad8f443	2024-10-17 04:20:15	Yahoo奇摩新聞
tw	https://news.google.com/rss/articles/CCAiCzE5RU9yVFEyNmRrmAEB?oc=5	台積電報喜ADR盤前飆7% 台指期夜盤漲400點 - 台視新聞 TTV NEWS	None	None	2024-10-17 13:55:33	台視新聞 TTV NEWS
tw	https://news.tvbs.com.tw/life/2653543	台灣1校「宣布倒閉」！校產全清光 內政部接手了 - TVBS	國民黨立委柯志恩質疑中州大學退場後，校地規劃從社宅變軍營。內政部今天表示，將做內政部民防訓練場域，以及警政署保二總隊中部機動中隊駐地，是一般民防教育及災防訓練場域而非軍營。	https://cc.tvbs.com.tw/img/upload/2024/10/17/20241017145130-6a2d6328.jpg	2024-10-17 06:55:00	TVBS
tw	https://udn.com/news/story/7323/8298359	影／京華城停工？中石化稱照法律 游淑慧曝1重點：盼說到做到 - 聯合新聞網	京華城是否停工，中石化今表示，已要求承攬京華廣場工程廠商，未來所有施工會遵照符合法律規定，也遵守主管機關下達的命令。議員...	https://pgw.udn.com.tw/gw/photo.php?u=https://uc.udn.com.tw/photo/2024/10/17/realtime/30733591.jpg&s=Y&x=121&y=0&sw=807&sh=538&exp=3600	2024-10-17 07:46:10	聯合新聞網
tw	https://news.google.com/rss/articles/CCAiC2JvelV1djlLejZRmAEB?oc=5	總預算協商破局韓國瑜宣布21日繼續談 藍白聯手明立法院再封殺? - 中天新聞	None	None	2024-10-17 07:25:31	中天新聞
tw	https://tw.news.yahoo.com/%E5%A4%A7%E5%B7%A8%E8%9B%8B%E5%8C%85%E5%BB%82%E9%81%AD%E7%96%91%E6%B7%AA%E7%A7%81%E4%BA%BA%E6%8B%9B%E5%BE%85%E6%89%80-%E9%81%A0%E9%9B%84%E5%97%86%E5%B8%82%E5%BA%9C%E7%84%A1%E6%AC%8A%E5%B9%B2%E6%B6%89-%E8%94%A3%E8%90%AC%E5%AE%89%E5%BC%B7%E8%AA%BF%E6%8D%8D%E8%A1%9B%E5%B8%82%E6%B0%91%E6%AC%8A%E7%9B%8A-063622474.html	大巨蛋包廂遭疑淪私人招待所 遠雄嗆市府無權干涉 蔣萬安強調捍衛市民權益 - Yahoo奇摩新聞	國民黨台北市議員耿葳質疑，大巨蛋近20間包廂僅少數曾開放租用，其餘恐淪為私人招待所。遠雄今天回應，大巨蛋為BOT案，市府無權涉及營運。台北市長蔣萬安則說，捍衛市民權益是市府立場，絕不妥協。台北市體育局指出，將爭取並確保市府、市民應有的權益，同時將遠雄配合度表現納入未來大巨蛋營運績效評估中考核。	https://media.zenfs.com/en/cna.com.tw/404751b4f9e39cbe6d4c4337779d4f16	2024-10-17 06:36:23	Yahoo奇摩新聞
tw	https://newtalk.tw/news/view/2024-10-17/940544	圍台軍演｢利劍B｣後首發聲習近平福建視察：增進台灣民眾國家認同| 中國 - Newtalk新聞	賴清德總統10日發表任內首次國慶演說重申中華人民共和國無權代表台灣，之後中國連日對台文攻武嚇，共軍14日還在台灣周圍進行「聯合利劍-2024B演習」。然而，中國官媒指稱。中共總書記習近平15至16日赴福建考察，要求在探索海峽兩岸融合發展新路上邁出更大步伐，建設好兩岸融合示範區，促進兩岸文化交流，增進	https://s.newtalk.tw/album/news/941/6710419be0fd9.jpg	2024-10-16 23:05:23	Newtalk新聞
tw	https://www.cna.com.tw/news/ahel/202410165004.aspx	花蓮近海地震規模5.2 最大震度3級 - 中央社即時新聞	根據中央氣象署最新資訊，16日21時58分發生芮氏規模5.2地震，地震深度25.2公里，震央位於花蓮縣政府東北東方8.9公里（位於花蓮縣近海），最大震度花蓮縣、宜蘭縣、南投縣3級。	https://imgcdn.cna.com.tw/www/webphotos/WebCover/800/20241016/1280x960_674312884699.jpg	2024-10-16 13:59:00	中央社即時新聞
tw	https://www.ettoday.net/news/20241017/2837200.htm	離奇瞬間曝！台中騎士路邊逆向竄出 迎面對撞公車慘死 - ETtoday新聞雲	台中市烏日區中山路三段609號前今(17日)下午2時50分發生一起離奇車禍！1名年約50歲的男騎士不明原因逆向行駛，撞上迎面駛來的公車，當場失去生命跡象，緊急送醫搶救後仍宣告不治，而當時的事發畫面也曝光！

	https://cdn2.ettoday.net/images/7900/e7900919.png	2024-10-17 10:03:00	ETtoday新聞雲
tw	https://money.udn.com/money/story/5603/8294937	羅文嘉拋兩岸協商「二六共識」國台辦明言拒絕：不要另起爐灶 - 經濟日報	解放軍圍台軍演隔日，海基會副董事長兼秘書長羅文嘉昨在馬祖拋出，兩岸可以在「馬祖協商」的構想，歡迎大陸海協會到南竿二六據點...	https://pgw.udn.com.tw/gw/photo.php?u=https://uc.udn.com.tw/photo/2024/10/16/realtime/30724656.jpg&x=0&y=0&sw=0&sh=0&sl=W&fw=1050&exp=3600	2024-10-16 03:03:35	經濟日報
tw	https://www.cna.com.tw/news/asoc/202410170383.aspx	北市東湖市場車禍3死2傷 15歲少年依過失致死帶回偵辦| 社會 - 中央社即時新聞	台北市東湖市場今晚發生嚴重車禍，15歲曾姓少年開車失控衝撞騎樓小吃店，導致2名客人、1名騎士死亡，小吃店女老闆及女店員則遭燙傷。警方初步將依涉嫌過失致死罪偵辦。	https://imgcdn.cna.com.tw/www/webphotos/WebOg/600/20241017/1200x630_243851166861.jpg	2024-10-17 13:12:00	中央社即時新聞
tw	https://news.google.com/rss/articles/CCAiC1R4T3hnNHRoZC1JmAEB?oc=5	圍台軍演13小時演習後 陸大秀肌肉再出兩狠招示警勿插手兩岸? - 中天新聞	None	None	2024-10-17 13:00:37	中天新聞
tw	https://news.cnyes.com/news/id/5745968	上任不到100天！以色列外長證實：哈瑪斯領導人辛瓦爾被擊斃 - Anue鉅亨	以色列外交部長卡茨周四（17 日）在一份聲明中表示，巴勒斯坦極端組織哈瑪斯領導人辛瓦爾（Yahya Sinwar）被以色列國防軍擊斃。	https://cimg.cnyes.cool/prod/news/5745968/m/9aa2c33936ea0fd7f042d0ccc037a0ce.jpg	2024-10-17 17:16:53	Anue鉅亨
