country_code	url	title	description	image_url	publish_date	source
tw	https://tw.news.yahoo.com/%E9%AB%98%E9%90%B5%E8%BB%8A%E5%BB%82%E5%87%BA%E7%8F%BE%E9%B4%BF%E5%AD%90%E9%A3%9B%E7%AB%84-%E6%97%85%E5%AE%A2%E9%A9%9A%E5%91%BC-%E9%A3%BC%E4%B8%BB%E8%A2%AB%E8%B6%95%E4%B8%8B%E8%BB%8A-050426772.html	高鐵車廂出現鴿子飛竄 旅客驚呼 飼主被趕下車 - Yahoo奇摩新聞	民眾搭乘高鐵列車發現車廂內有鴿子，時而悠哉漫步，時而來回飛竄，高鐵保全人員試圖捕捉引發旅客陣陣驚呼。台灣高鐵公司今天回應，經飼主招喚捕獲後，依契約拒絕運送該旅客，要求飼主攜帶鴿子下車。	https://s.yimg.com/os/creatr-uploaded-images/2024-11/94bb1460-9d8e-11ef-afef-6e52f9e11533	2024-11-08 05:04:29	Yahoo奇摩新聞
tw	https://www.nownews.com/news/6576433	李多慧環島第4天體力不支？直接躺路邊睡著 粉絲傻眼：太危險了 - NOWnews 今日新聞	中華職棒味全龍隊啦啦隊Dragon Beauties韓籍成員李多慧近日在台灣騎車環島，從東部開始出發，昨（7）日李多慧在從花蓮騎到台東的路上竟睏到受不了，當場停車睡在路邊。...	https://media.nownews.com/nn_media/thumbnail/2024/11/1731028418271-1939c58c65814dc198b9087d5f343205-1056x714.webp?unShow=false	2024-11-08 01:25:19	NOWnews 今日新聞
tw	https://udn.com/news/story/123098/8343420	美司法部急轉彎！特別檢察官打算「逐步結束」川普聯邦官司 - 聯合新聞網	美國共和黨總統候選人川普宣布勝選後，有望擺脫聯邦訴訟案。一名知情人士6日透露，美國司法部特別檢察官史密斯（Jack Sm...	https://pgw.udn.com.tw/gw/photo.php?u=https://uc.udn.com.tw/photo/2024/11/07/realtime/30857605.jpg&s=Y&x=0&y=0&sw=3318&sh=2212&exp=3600	2024-11-07 00:19:49	聯合新聞網
tw	https://news.google.com/rss/articles/CCAiC1Rnd0tFUnU3QUUwmAEB?oc=5	High tariffs could drive the Chinese economy 'into hell'? - 關鍵時刻	None	None	2024-11-08 02:30:06	關鍵時刻
tw	https://www.ettoday.net/news/20241107/2850378.htm	伸港再釀死亡車禍！母女遭撞飛落農田 媽重傷開刀、14歲女不治 - ETtoday新聞雲	伸港小姊妹2月22日穿越斑馬線遭撞飛，搶救8個月先後離世；未料日前又有一名媽媽騎乘機車載14歲女兒下課返家途中，行經彰新路七段401巷口，遭20歲的黃男駕車撞飛，雙雙摔落農田送醫急救，其女兒搶救7天後宣告不治，媽媽則是骨折手術仍在住院中。日前警方會同民代前往會勘，議員賴清美砲轟．該路口原本就光線昏暗，為何總是要等到發生憾事才防範。	https://cdn2.ettoday.net/images/7936/e7936722.jpg	2024-11-07 05:31:00	ETtoday新聞雲
tw	https://newtalk.tw/news/view/2024-11-07/943541	馬斯克要台灣供應商搬家! 稱有「地緣政治風險」 SpaceX直接提要求| 國際 - Newtalk新聞	據《路透社》獨家披露，美國企業家埃隆&amp;middot;馬斯克日前向給他的航太企業 SpaceX 提供零部件的臺灣供應商提出了一項要求：把生產業務搬出台灣。《路透社》稱，這一消息來自於受雇於這些台灣供應商的人員，以及相關商業文件。《路透社》還引用了一個給 SpaceX 的「星鏈」系統提供零部件的台灣供應	https://s.newtalk.tw/album/news/890/66d55b22caf8f.png	2024-11-07 05:28:36	Newtalk新聞
tw	https://pr.tsmc.com/chinese/news/3183	台積公司2024年10月營收報告|台灣積體電路製造股份有限公司 - TSMC Events	台灣積體電路製造股份有限公司今（8）日公佈2024年10月營收報告。2024年10月合併營收約為新台幣3,142億4,000萬元，較上月增加了24.8%，較去年同期增加了29.2%。累計2024年1至10月營收約為新台幣2兆3,400億8,600萬元，較去年同期增加了31.5%。	None	2024-11-08 08:39:44	TSMC Events
tw	https://udn.com/news/story/122663/8344781	首度與烏軍交火！ 美官員曝北韓軍首戰「相當多人被殺」 - 聯合新聞網	烏克蘭與美國資深官員指出，北韓軍已加入俄烏戰爭，與占領俄羅斯庫斯克地區的烏克蘭軍爆發衝突，首戰北韓部隊有「相當多人被殺」...	https://pgw.udn.com.tw/gw/photo.php?u=https://uc.udn.com.tw/photo/2024/11/07/realtime/30861155.jpg&s=Y&x=0&y=0&sw=4252&sh=2835&exp=3600	2024-11-07 08:20:51	聯合新聞網