country_code	url	title	description	image_url	publish_date	source
tw	https://www.setn.com/News.aspx?NewsID=1559906	我差點把命丟了！來台6年被黑道勒索綠能外商泣訴：台灣從根裡就爛透| 名家 - 三立新聞網 Setn.com	嫉惡如仇的總統賴清德五月就任後，鐵了心向綠電蟑螂全面開戰，五個多月來，從行政院長卓榮泰、經濟部長郭智輝到檢廉單位，無不拉高分貝，宣示強力掃蕩綠能犯罪。很顯然，賴政府願意直面問題，選擇以「肅貪查弊」，作為最主要的「殺蟑藥方」，大刀闊斧力拼整頓綠能亂象。綠電蟑螂在地方橫行的情況有多嚴重，從一家光電業外商的親身經歷可以窺知一二。	https://attach.setn.com/newsimages/2024/11/06/4882541-PH.jpg	2024-11-07 01:46:00	三立新聞網 Setn.com
tw	https://udn.com/news/story/7239/8343757	回擊雲豹否認炒股 郭智輝：放消息後股價就漲了1倍 - 聯合新聞網	經濟部長郭智輝今日加碼再批雲豹能源，他表示，自雲豹6月21日公布「輝達綠電100億度合約」消息後，股票就開始漲，漲了1倍...	https://pgw.udn.com.tw/gw/photo.php?u=https://uc.udn.com.tw/photo/2024/11/07/realtime/30858597.png&s=Y&x=0&y=8&sw=1034&sh=688&exp=3600	2024-11-07 03:02:16	聯合新聞網
tw	https://udn.com/news/story/7266/8344685	銀杏增為強颱！外圍環流接近雨轟2地區 最新路徑、對台影響曝光 - 聯合新聞網	中央氣象署表示，銀杏颱風今天下午2時發展成為強烈颱風，預計今天到明天通過呂宋島北端，接著進入南海，對台灣無直接影響，但外...	https://pgw.udn.com.tw/gw/photo.php?u=https://uc.udn.com.tw/photo/2024/11/07/realtime/30860905.png&s=Y&x=0&y=7&sw=956&sh=636&exp=3600	2024-11-07 07:55:17	聯合新聞網
tw	https://www.nownews.com/news/6575097	賀錦麗為何慘敗？CNN抓戰犯是拜登：無法被切割又留下內部裂痕 - NOWnews 今日新聞	2024美國大選的開票工作尚未完全結束，不過共和黨總統人選川普（Donald Trump）已經確定當選，民主黨候選人賀錦麗（Kamala Harris）成為美國史上首位女總統的希望落空...	https://media.nownews.com/nn_media/thumbnail/2024/09/1726119062540-58d23c4cf66b44b8823520a2bc5a4e49-1024x683.webp?unShow=false	2024-11-06 13:36:04	NOWnews 今日新聞
tw	https://udn.com/news/story/7266/8346198	熱帶擾動排排站 粉專：下周有機會再生成1至2個颱風 - 聯合新聞網	熱帶擾動排排站。氣象粉專「台灣颱風論壇｜天氣特急」今天表示，目前在西北太平洋上，還有3個熱帶擾動正在發展，預估下周有機會...	https://pgw.udn.com.tw/gw/photo.php?u=https://uc.udn.com.tw/photo/2024/11/08/realtime/30864946.jpg&s=Y&x=68&y=0&sw=1722&sh=1149&exp=3600	2024-11-08 01:56:15	聯合新聞網
tw	https://www.cna.com.tw/news/aopl/202411080017.aspx	美國大選側記》記者申請採訪川普造勢屢遭拒賀錦麗落敗支持者喊搬家| 國際 - 中央社即時新聞	Uber司機尼可拉斯開票夜一心三用，盯前行路線、追搖擺州選情，同時高分貝抱怨。他無法理解為什麼全國超過半數選民不買賀錦麗的帳，「你們台灣都在笑我們吧」。那時是凌晨，川普的選舉人票已過當選門檻。	https://imgcdn.cna.com.tw/www/webphotos/WebCover/800/20241108/1067x800_366023962107.jpg	2024-11-07 23:49:00	中央社即時新聞
tw	https://www.chinatimes.com/realtimenews/20241107003252-260423	立冬後走「乙亥」運！4生肖財氣暴漲賺大錢- 運勢 - 中時新聞網	None	https://images.chinatimes.com/newsphoto/2024-11-07/656/20241107003392.jpg	2024-11-07 07:30:24	中時新聞網
tw	https://www.cna.com.tw/news/asoc/202411070370.aspx	美籍性犯罪男子查處到案移民署將驅逐出境| 社會 - 中央社即時新聞	有性犯罪前科的美國籍男子今年10月入境來台，未按址居住且行蹤不明，引發各界關注。移民署今晚表示，經積極追查已於下午在台北市松山區將他查處到案，後續將依法驅逐出境。	https://imgcdn.cna.com.tw/www/webphotos/WebOg/600/20241107/1024x538_266264804761.jpg	2024-11-07 11:13:00	中央社即時新聞
tw	https://tw.stock.yahoo.com/news/%E5%8F%B0%E7%A9%8D%E9%9B%BB%E7%AB%99%E7%A9%A91090%E5%85%83%EF%BC%81%E8%A3%9C%E5%8A%A9%E6%AC%BE%E5%BF%AB%E8%90%BD%E8%A2%8B%E6%BF%80%E5%8B%B5%E5%8F%B0%E8%82%A1%E5%8B%81%E6%8F%9A145%E9%BB%9E%E6%94%B623553%E9%BB%9E-010334570.html	美降息一碼！台股上漲近300點...台積電勁揚20元至1085元 - Yahoo奇摩股市	聯準會降息一碼符合市場預期，外傳台積電美國補助款快到手，台積電ADR大漲4.1％，現股今（8）日也強漲，在最後一盤爆5142張後，收盤站穩1090元，挑戰前波高點1100元，激勵台股上漲145點，收在23553點。	https://media.zenfs.com/zh-tw/cna.com.tw/e471a7ffd9dbd8e37ea2692c80affa25	2024-11-08 01:03:45	Yahoo奇摩股市
tw	https://www.chinatimes.com/realtimenews/20241107005156-260407	為何選川普而非賀錦麗？美國選民街訪大吐真心話- 政治 - 中時新聞網	美國總統大選結果揭曉，川普即將重返白宮，《BBC News 中文》針對「川普贏了選舉」、「你認為賀錦麗為何會輸？」進行街訪。有美國選民認為「川普贏了選舉」是因為美國人想要的是修復美國的經濟；當被問到「你認為賀	https://images.chinatimes.com/newsphoto/2024-11-07/656/20241107005176.jpg	2024-11-07 12:42:47	中時新聞網
tw	https://www.cna.com.tw/news/aipl/202411070393.aspx	回應川普保護費論路透：台灣擬明年初擴大軍購| 政治 - 中央社即時新聞	美國總統當選人川普曾稱台灣應支付「保護費」。據路透報導，台灣可能於川普明年就職之初提出新的大規模軍購，藉此表示重視川普說法，凸顯台灣無意追求「白吃的午餐」，並向華府展現自我防衛的決心。	https://imgcdn.cna.com.tw/www/webphotos/WebOg/600/20241107/1200x630_39453765679.jpg	2024-11-07 12:04:00	中央社即時新聞
tw	https://www.ettoday.net/news/20241107/2850707.htm	綠議員限期蔣萬安搬出官舍 媒體人傻眼問：林延鳳是不是腦殘？ - ETtoday新聞雲	民進黨台北市議員林延鳳7日稱，市長獎萬安有豪宅卻申請住官舍，此行為造成年輕人的相對剝奪感，要求在期限內搬出，逼得蔣萬安澄清名下無房產。對此，媒體人朱凱翔表示，「市長不能住官舍？林延鳳是不是腦殘？」

	https://cdn2.ettoday.net/images/7924/e7924737.jpg	2024-11-07 12:26:00	ETtoday新聞雲
tw	https://www.storm.mg/article/5269130	川普當選顧立雄急入府開會 陳揮文點出賴清德首要之務：誰要去就拿錢買 - 風傳媒	美國總統大選結果在台灣時間6日揭曉，共和黨總統候選人、前總統川普（DonaldTrump）成為百餘年來，繼前總統克里夫蘭（GroverCleveland）再度捲土重來勝選的總統，國防部長顧立雄則取消立院行程，赴總統府開會。對此，媒體人陳揮文點出川普當選後，總統賴清德的「首要之務」	https://image.cache.storm.mg/styles/smg-800x533-fp/s3/media/image/2024/11/07/20241107-085454_U1085_M1003621_c231.jpg?9MyqIwSNGAN3.q0p..6FFIgAbZRkFILo&itok=BA4ylfBf	2024-11-07 01:35:00	風傳媒
tw	https://www.ettoday.net/news/20241108/2850806.htm	普丁控「台灣學烏克蘭」挑起危機！ 支持中國兩岸統一 - ETtoday新聞雲	俄羅斯總統普丁7日恭賀川普（Donald Trump）重新入主白宮，並表示他隨時準備好跟這位共和黨籍總統當選人對話。與此同時，普丁重申，中國是重要盟友，並暗指中國無意在台海發動攻擊，反而是台灣就像烏克蘭一般，不斷挑起危機。
	https://cdn2.ettoday.net/images/7937/e7937936.jpg	2024-11-08 01:00:00	ETtoday新聞雲
tw	https://news.google.com/rss/articles/CCAiC2FlSmFNQzREWnhNmAEB?oc=5	【全程字幕】火爆!卓榮泰"1句話"掌聲變嗆聲 "情勒台中人"掛保證"1秒翻車"被嗆爆 - 中天新聞	None	None	2024-11-08 06:04:02	中天新聞
tw	https://tw.news.yahoo.com/%E5%9C%8B%E9%81%933%E8%99%9F%E5%8D%97%E4%B8%8B288k%E7%A2%A7%E6%BD%AD%E9%9A%A7%E9%81%93%E8%81%AF%E7%B5%90%E8%BB%8A%E7%BF%BB%E8%A6%86-%E6%8B%96%E5%90%8A%E5%BE%8C%E6%81%A2%E5%BE%A9%E9%80%9A%E8%BB%8A-%E9%A7%95%E9%A7%9B%E6%B6%89%E9%85%92%E9%A7%95%E8%A2%AB%E9%80%81%E8%BE%A6-044655175.html	國道3號南下28.8K碧潭隧道聯結車翻覆 全線封閉受阻 - Yahoo奇摩新聞	國道3號南下28.8公里處、新店碧潭隧道路段，今天上午11時30分許發生聯結貨櫃車翻覆事故，由於翻覆車輛阻礙車道，造成全線封閉阻塞，車流被引導從新店出口下匝道。
國道公路警察局今天表示，自行脫困後送醫的駕駛涉酒駕，詢後依公共危險罪送辦。翻覆車輛於下午3時20分左右被拖吊離開現場。	https://s.yimg.com/os/creatr-uploaded-images/2024-11/169cc900-9d90-11ef-9ef3-7e2771926fdc	2024-11-08 04:47:07	Yahoo奇摩新聞
tw	https://tw.news.yahoo.com/%E8%B2%B4%E6%97%8F%E4%B8%AD%E5%AD%B8%E5%AF%8C%E4%BA%8C%E4%BB%A3%E7%B5%84%E5%9C%98%E8%A9%90%E9%A8%99%E6%92%884%E5%84%84-%E5%87%BA%E5%BA%AD%E8%B6%85%E5%9B%82%E5%BC%B5-%E6%88%91%E7%88%B8%E6%98%AF%E5%BA%AD%E9%95%B7-024550316.html	貴族中學富二代組團詐騙撈4億 出庭超囂張：我爸是庭長 - Yahoo奇摩新聞	[周刊王CTWANT] 據了解，陳逸軒與洪碩甫、陳冠羽、陳翊愷、馬佳毓都出身顯赫，他們畢業的學校更是當地知名貴族中學，陳畢業後考上律師，直接進入父親的事務所上班。陳逸軒平時消費奢華，不到30歲就戴價值7位數的勞力士水鬼，出入則以賓士代步，而他竟與詐騙集團勾結，與首腦在私人招待所大開...	https://media.zenfs.com/ko/ctwant_com_582/738b3c333e3d90a9c5fc8a7426cda397	2024-11-08 02:59:26	Yahoo奇摩新聞
tw	https://www.cna.com.tw/news/aopl/202411080021.aspx	川普首公布內閣競選經理威爾斯成第一位白宮女幕僚長| 國際 - 中央社即時新聞	美國總統當選人川普今天宣布，為他勝選立下汗馬功勞的競選團隊共同經理威爾斯（Susie Wiles）將成為美國史上首位女性白宮幕僚長，這是他當選後第一項重大人事任命。	https://imgcdn.cna.com.tw/www/webphotos/WebOg/600/20241108/1080x567_308558927448.jpg	2024-11-08 00:34:00	中央社即時新聞
tw	https://news.tvbs.com.tw/life/2678840	慟！台灣「老鷹專家」沈錦豐癌症病逝 國家痛失英才哀悼 - TVBS	None	None	2024-11-08 00:21:00	TVBS
tw	https://news.google.com/rss/articles/CCAiC3lYckRJcXZMVHA4mAEB?oc=5	台積電ADR漲4% 晶片補助將到手輝達再創天價!今取代英特爾納道瓊川普重返白宮台企墨國布局台股望迎MSCI資金活水｜主播陳韋如｜【非凡Morning Call】20241108｜非凡財經新聞 - USTV 非凡電視	None	None	2024-11-08 01:18:03	USTV 非凡電視
tw	https://tw.news.yahoo.com/%E7%AB%8B%E9%99%B6%E5%AE%9B%E6%BA%96%E7%B8%BD%E7%90%86%E8%A1%A8%E6%85%8B%E4%BA%86-%E5%90%8C%E6%84%8F%E4%BB%A5%E5%8F%B0%E7%81%A3%E5%90%8D%E7%BE%A9%E8%A8%AD%E4%BB%A3%E8%A1%A8%E8%99%95-%E6%98%AF%E5%80%8B%E9%8C%AF%E8%AA%A4-023955533.html	立陶宛準總理表態了！同意以台灣名義設代表處「是個錯誤」 - Yahoo奇摩新聞	據立陶宛當地媒體報導，在立陶宛總統「瑙塞達」表態，支持新政府致力恢復與中國大陸的外交關係時，立陶宛準總理「帕魯克斯」近日也表示，允許以「台灣」名義設立代表處，是立陶宛一項「重大的外交錯誤」，帕魯克斯也	https://media.zenfs.com/ko/bcc.com.tw/e32aadc134b78629a5a27143cb0b5973	2024-11-08 03:00:27	Yahoo奇摩新聞
tw	https://news.tvbs.com.tw/life/2678873	天氣／反聖嬰機率衝高！專家警告「今年冬天更低溫」 全台冷吱吱 - TVBS	受東北季風和銀杏颱風外圍環流影響，迎風面的基隆北海岸，東北部、東部和大台北山區雨勢明顯且持續，東北部地區更有局部豪雨，各地清晨偏涼，低溫19至22度，日夜溫差大。氣象專家林得恩提醒，從11月起，今年反聖嬰發生的機率將衝到最高峰，對台灣天氣造成一定程度的影響，冬天可能會更冷。	https://cc.tvbs.com.tw/img/upload/2024/11/08/20241108082820-8b817b88.jpg	2024-11-08 01:30:00	TVBS
tw	https://tw.stock.yahoo.com/news/%E5%B7%9D%E6%99%AE%E6%8A%97%E4%B8%AD%E4%B8%8D%E8%AE%8A-%E5%8F%B0%E7%A9%8D%E9%9B%BB%E6%98%AF%E5%8F%B0%E7%81%A3%E5%83%B9%E5%80%BC%E6%89%80%E5%9C%A8-%E7%BE%8E%E8%82%A1%E7%BA%8C%E5%BC%B7%E4%B9%8B%E4%B8%8B-%E5%8F%B0%E8%82%A1%E4%B8%8D%E6%9C%83%E5%BC%B1-023636081.html	川普抗中不變，台積電是台灣價值所在，美股續強之下，台股不會弱 - Yahoo奇摩股市	【財訊快報／黃啟乙】川普當選的風潮，一開始各國股市反應不一，但就台股而言，雖然選前不斷有不利台積電(2330)，甚至要台灣交出保護費的不利傳言，但最後可以看到台股表現得比想像中強！令大盤不僅保持強勢，甚至再向上突破中。依據川普第一任的歷史，是掀起美中對抗的開始，至此之後，中國已進一步成為頭號目標。故而，這一股抗中的國策，應不會有太大的改變！雖然川普不一定會對台灣特別好，但在抗中之下，台灣自然而然，便會成為受惠者！而且，美國的科技發展上，少不了台灣，更需要台積電，這正是台灣價值所在。所以，美股繼續走強之下，台股不會弱！	None	2024-11-08 02:46:17	Yahoo奇摩股市
tw	https://newtalk.tw/news/view/2024-11-08/943629	管仁健觀點》王定宇就輸邱瓈寬「大學聯考不會作弊」吧？ - Newtalk新聞	台灣藝人到中國表演，被迫要先發表促統言論，否則就被封殺。相反的台灣因為是民主國家，中國藝人來台灣開演場會，甚至高唱有統戰意味的歌曲，台灣政府基於民主理念，就是不能依法禁絕。雖然有很多台派鄉民對此憤憤不平，但本魯還是要堅持自己從戒嚴時代迄今仍不變的立場：政府與法律都必須保障言論自由，即使是大家都恨之入	https://s.newtalk.tw/album/news/944/672d2d356163d.jpg	2024-11-07 21:15:08	Newtalk新聞
tw	https://www.storm.mg/article/5268895	小耳朵》台灣官兵會用66火箭彈還精準命中 美軍看到淚流滿面 - 風傳媒	2024年義務役恢復一年期，首批義務役官兵11月6日在基地戰力鑑測中，進行紅隼火箭彈實彈射擊，驗證反裝甲武器射擊成效，使役男更加熟稔新式武器操作，提升部隊不對稱作戰能力，落實實戰化訓練目標。罕為人知的是，軍方在反裝甲火箭彈的使用上，有著讓美軍看了「感動流淚」的一面，甚至促使國軍加	https://image.cache.storm.mg/styles/smg-800x533-fp/s3/media/image/2024/11/06/20241106-105637_U29430_M1003183_3084.jpg?GtmoKDXNXLpc.z6GyiL6uyMXGddx7UN1&itok=FEBo1FnL	2024-11-07 00:30:00	風傳媒
tw	https://tw.news.yahoo.com/%E5%BF%AB%E8%A8%8A-%E6%9F%A5%E4%BA%AC%E8%8F%AF%E5%9F%8E%E9%87%91%E6%B5%81-%E9%BB%83%E7%8F%8A%E7%8F%8A-%E8%B2%AA%E6%B1%99%E6%A1%88-%E8%AD%89%E4%BA%BA%E8%A2%AB%E5%BB%89%E6%94%BF%E7%BD%B2%E7%B4%84%E8%AB%87-041745260.html	快訊／查京華城金流 黃珊珊「貪汙案」證人被廉政署約談 - Yahoo奇摩新聞	台北地檢署指揮廉政署偵辦京華城案進入第三個月，民眾黨主席柯文哲、前台北市副市長彭振聲、台北市議員應曉薇、威京集團主席沈慶京全部延押。為在最後押期內找到行賄金流，檢廉近日逐一傳喚曾被《鏡週刊》點名的中市府顧問蔡壁如、柯文哲妻陳佩琪、民眾黨立委黃珊珊。黃珊珊今（8）日稍早已抵達廉政署應訊。	https://media.zenfs.com/ko/news_tvbs_com_tw_938/c7ab4060cfcf551f112bed2733b2ecae	2024-11-08 04:34:46	Yahoo奇摩新聞
tw	https://www.chinatimes.com/realtimenews/20241108001017-260407?chdtv	台積電衰困美國沙漠？呂秀蓮：她要負很大責任- 政治 - 中時新聞網	台積電位於美國亞利桑那州首座晶圓廠已試產成功，預計12月初舉行完工典禮。前副總統呂秀蓮表示，台積電沒有到美國加州，起碼也要放在德州，怎會在亞利桑那州？這對台灣是很大的侮辱，當時的駐美大使、副總統蕭美琴要	https://images.chinatimes.com/newsphoto/2024-11-08/1024/20241108001028.jpg	2024-11-07 23:48:09	中時新聞網
tw	https://www.setn.com/News.aspx?NewsID=1560382	高雄惡火吞噬4命只剩她！奪命起火原因找到了 電動機車爆炸燒到剩骨架 - 三立新聞網 Setn.com	高雄市三民區鼎中路一棟10層樓大樓，1樓突然於今（7）日凌晨0時30許竄出火舌，導致董姓父子、董男哥哥、董妻乾姐共4人葬身火窟，董妻目前仍在醫院救治中；上午檢方重回現場勘驗，根據現場大火燒毀程度，研判疑似與電動機車爆炸引發大火有關，但詳細起火原因仍待調查釐清。	https://attach.setn.com/newsimages/2024/11/07/4883590-PH.jpg	2024-11-07 07:08:00	三立新聞網 Setn.com
tw	https://news.google.com/rss/articles/CBMiXkFVX3lxTE9VNmcyUml0eTg2bi1RM3JKLTJhMWx1X0xkYVpsRERzTEtqOXQ2ZEd6NTJfZnp4M3V3MEppWGs2M0xkT2Mzb1Q4NEhvNFc1eTB4STdrRGRuX2JYcTdsdEHSAWhBVV95cUxQVmQ1d1lNbVlibmhsSEJmb2NVNFUxRFBsT092T01pTkZQbDI1ang2bHN5UEtHa0tCRkxfYmd2ODVINUhtUFNNUlh0VlhlUlMtTmlyOGs3NjBOTVVZR2ZfSFBWdlhNdG4wWA?oc=5	日本「無碼AV網站」FC2創辦人下機秒被逮！ 遭通緝近10年 - ETtoday新聞雲	日本色情影音平台「FC2」主打讓所有人都可以免費觀賞、上傳成人影片，其中包含無碼色情片，一度成為日本的「無碼AV大平台」。然而FC2的創辦人高橋理洋7日從南韓入境日本時，因涉嫌違反猥褻電磁記錄陳列被警方逮捕。事實上，他早在2015年就因為FC2涉嫌違法被警方發出國際逮捕令，直到7日返國才首次被逮。	https://cdn2.ettoday.net/images/7938/e7938991.png	2024-11-08 08:02:00	ETtoday新聞雲
tw	https://tw.news.yahoo.com/%E5%B7%9D%E6%99%AE%E6%98%8E%E5%B9%B41%E6%9C%88%E5%B0%87%E9%87%8D%E8%BF%94%E7%99%BD%E5%AE%AE-%E7%99%BC-%E8%BE%AD%E8%81%B7%E4%BF%A1-%E7%B5%A6%E9%BA%A5%E7%95%B6%E5%8B%9E-%E7%B6%B2%E5%8F%AA%E6%9C%891%E8%A6%81%E6%B1%82-004236711.html	川普明年1月將重返白宮！發「辭職信」給麥當勞 網只有1要求 - Yahoo奇摩新聞	[周刊王CTWANT] 根據《華盛頓檢查者報》報導，川普（Donald Trump）的長子小唐納（Donald Trump Jr.）6日在IG貼出以川普名義發出的「辭職信」，上面的格式比照麥當勞的聲明，而收件人為麥當勞位於芝加哥總部的人力資源部門。內容提到，請接受這封信，作為我辭去麥當勞職務的正式通知，自2025...	https://media.zenfs.com/zh-tw/ctwant_com_582/77de5c8b8eaddd33ab8a6426ac1246f2	2024-11-08 00:59:22	Yahoo奇摩新聞
tw	https://news.tvbs.com.tw/politics/2678423	柯文哲收賄疑雲！議員索「市長電梯紀錄」遭拒 轟蔣萬安當遮羞布 - TVBS	None	None	2024-11-07 10:01:00	TVBS
tw	https://tw.stock.yahoo.com/news/%E5%8D%B0%E5%BA%A6%E7%A7%BB%E5%B7%A5%E8%A6%81%E4%BE%86%E4%BA%86%EF%BC%81%E5%8B%9E%E5%8B%95%E9%83%A8%E5%AE%A3%E5%B8%83-%E9%A6%96%E6%B3%A2%E5%BC%95%E9%80%B2%E5%8D%83%E5%90%8D%E8%A3%BD%E9%80%A0%E6%A5%AD%E7%A7%BB%E5%B7%A5-072043531.html	印度移工要來了！勞動部宣布 首波引進千名製造業移工 - Yahoo奇摩股市	印度移工要來了！繼今年2月簽署台印合作備忘錄（MOU），台印近日首次進行工作層級會議。勞動部長何佩珊今（8）日就會議結果說明，雙方同意初期採取小規模推動，初次引進製造業1000名移工，其中5%採用直聘制度，而未來也會視進展做滾動式修正。	https://s.yimg.com/ny/api/res/1.2/BDCqUajeJNYy.laRVn75Dg--/YXBwaWQ9aGlnaGxhbmRlcjt3PTEyMDA7aD02NzU7Y2Y9d2VicA--/https://s.yimg.com/os/creatr-uploaded-images/2024-11/75137680-9da1-11ef-abf8-15248fba36df	2024-11-08 07:20:44	Yahoo奇摩股市
tw	https://www.setn.com/News.aspx?NewsID=1560202	陳玉珍3分鐘過千億財劃法 星象揭露背後政治意圖 - 三立新聞網 Setn.com	立法院財政委員會昨（6）天審查財劃法部分條文修正草案，財委會本週輪值會議主席、國民黨立委陳玉珍在開會後3分鐘，宣布財劃法修法審查完竣送出委員會。對此，有占星師直言，這場跟前國民黨立委張慶忠30秒有得比的修法爭議反映出法案背後可能隱藏的深層意圖與財務公平性的嚴重問題。「這個背後的深層意圖，顯而易見，與左國（指中國）脫離不了關係」。	https://attach.setn.com/newsimages/2024/11/06/4882021-PH.jpg	2024-11-07 04:07:00	三立新聞網 Setn.com
tw	https://www.ettoday.net/news/20241108/2851036.htm	全台只剩1家！34年「必勝客歡樂吧敦化餐廳」宣布熄燈 - ETtoday新聞雲	又少一間！陪伴台北人34年的「必勝客歡樂吧敦化餐廳」宣布將於2025年1月結束營業，停業原因為租約到期。隨著敦化店歇業，必勝客歡樂吧全台也僅剩1家門市。	https://cdn2.ettoday.net/images/7938/e7938556.jpg	2024-11-08 05:38:00	ETtoday新聞雲
tw	https://news.google.com/rss/articles/CCAiC25tVzlhdUJ1NFRvmAEB?oc=5	20241108 公視早安新聞 完整版｜川普勝選帶來不確定性 美聯準會仍降息1碼提振就業 - 公視新聞網	None	None	2024-11-08 01:14:22	公視新聞網
tw	https://tw.news.yahoo.com/%E5%8F%B0%E7%81%A3%E9%80%B2%E5%85%A5-%E5%A4%A7%E5%9C%B0%E9%9C%87%E6%99%82%E4%BB%A3-%E4%BB%8A%E5%B9%B4%E8%A6%8F%E6%A8%A15-5%E5%B7%B235%E8%B5%B7%E5%89%B514%E5%B9%B4%E6%96%B0%E9%AB%98-042415233.html	台灣進入「大地震時代」 今年規模5.5已35起創14年新高 - Yahoo奇摩新聞	[周刊王CTWANT] 根據《ETtoday新聞雲》報導，今年規模5.5以上地震已超過35起，創下14年以來新高，據地震專家郭鎧紋指出，台灣與日本儼然進入「大地震時代」。地震專家郭鎧紋表示，三起地震的震央都圍繞在0403地震的震央，釋放的能量相當於0.088顆原子彈，且規模5.5地震是「0403強震」的餘震...	https://media.zenfs.com/ko/ctwant_com_582/0d55fe1616fac672e01c4b9eba6b5938	2024-11-07 04:31:33	Yahoo奇摩新聞
tw	https://udn.com/news/story/6925/8346892	影／美女老師長腿短裙跳三振舞...破10萬人觀看 嘉中運動會成嬌點 - 聯合新聞網	嘉義高中昨天舉行運動大會，有學生拿手機將教英文蔡姓女教師，與同學跳三振舞影片，貼在社群網站threads，女教師穿迷你短...	https://pgw.udn.com.tw/gw/photo.php?u=https://uc.udn.com.tw/photo/2024/11/08/realtime/30866694.jpg&s=Y&x=0&y=701&sw=869&sh=579&exp=3600	2024-11-08 06:09:15	聯合新聞網
tw	https://www.ftnn.com.tw/news/333387	臺鹽綠能掏空內幕3／揭！坐桶子「偷渡5大熱點」 前董座陳啟昱潛逃至少要花「這個數」 - FTNN新聞網	社會中心／調查報導被控掏空臺鹽綠能股份有限公司的臺鹽實業公司前董座陳啟昱，11月1日開庭未現身，3天後淪為通緝犯，一名知情人士透露，陳啟昱應該已經「坐桶子」偷渡出境，「南部偷渡的熱門地點有5個地方，包括台南的安平港、高雄的興達港和中芸港（林園地區）、屏東的東港和楓港。」外傳陳啟昱已逃至菲律賓或柬埔寨...	https://i01.ftnn.com.tw/a/24/311/24311010202647188cc492.png	2024-11-06 23:04:00	FTNN新聞網
tw	https://news.tvbs.com.tw/politics/2678862	王定宇槓上了！葛斯齊爆「帶美女喊我想要」怒反擊：什麼碗糕 - TVBS	None	None	2024-11-08 01:10:00	TVBS
tw	https://newtalk.tw/news/view/2024-11-07/943549	北院再裁准扣押京華城土地簡舒培：裁定書明指柯文哲收賄！重重打臉民眾黨| 政治 - Newtalk新聞	民眾黨主席柯文哲因涉京華城弊案遭羈押，檢廉認柯文哲等人涉違法圖利鼎越容積獎勵20%，聲請扣押京華城土地獲准，鼎越提抗告，高院發回更裁，地院日前更裁仍裁准扣押京華城土地。對此，民進黨台北市議員簡舒培今（7）日表示，裁定書明確寫出柯文哲就是有收賄，難道民眾黨要說法院裁定書也是科幻小說？台北地檢署偵辦京華	https://s.newtalk.tw/album/album/1/66e6519b49889.jpg	2024-11-07 06:28:41	Newtalk新聞
tw	https://technews.tw/2024/11/08/the-u-s-department-of-commerce-is-rumored-to-require-tsmc-to-cut-off-supply-of-chinas-sub-7nm-process/	美國禁令來了！傳商務部要求台積電斷供中國 7 奈米以下製程 - TechNews 科技新報 	根據中國媒體集微網的報導指出，從多個消息來源指出，晶圓代工龍頭台積電已經向目前所有中國 AI 晶片客戶發送正式電子郵件，宣布自下週 （11月11日） 起，暫停向中國的 AI／GPU 客戶供應所有 7 奈米及更先進製程技術。而台積電會做出這樣的決定，原因是來自於美國商務部的下令。然而，迄今為止，美國商...	https://img.technews.tw/wp-content/uploads/2024/01/18180253/407A8757_0.jpg	2024-11-08 05:14:32	TechNews 科技新報 
tw	https://www.setn.com/News.aspx?NewsID=1560115	雲端發票重複中獎！財政部澄清 鄉民「揪1細項」：就是作弊 - 三立新聞網 Setn.com	雲端發票抽獎活動重複中獎爭議！財政部政務次長李慶華昨（6）日澄清「活動並無人為操作」，4人也應無小額洗發票、載具歸戶異常等情形。不過PTT鄉民發現，報告書一欄寫「採調高積極參加者之權數值及給予優先抽獎機會」，被質疑「調權重就是作弊阿，事前根本沒公告」。	https://attach.setn.com/newsimages/2023/11/28/4426878-PH.jpg	2024-11-07 01:16:00	三立新聞網 Setn.com
