country_code	url	title	description	image_url	publish_date	source
tw	https://news.google.com/rss/articles/CCAiCzhRYWhjODVDVU9RmAEB?oc=5	受費半拖累台積電ADR跌2%!痛失台積電折扣基辛格傳11月訪台!聯發科前3季賺贏去年EPS 51.98元!台達電:Q4營收更好｜主播貝庭｜【5分鐘看台股】20241101｜非凡財經新聞 - USTV 非凡電視	None	None	2024-11-01 00:21:13	USTV 非凡電視
tw	https://udn.com/news/story/124252/8327288	劉德華沒放颱風假！明天小巨蛋演唱會照辦 北捷班距調整、平面高架段停駛 - 聯合新聞網	康芮颱風來勢洶洶，全台各縣市宣布明天停班停課，台北捷運今晚宣布，明天台北捷運文湖線、淡水信義線、松山新店線、板南線及中和...	https://pgw.udn.com.tw/gw/photo.php?u=https://uc.udn.com.tw/photo/2024/10/30/realtime/30813782.jpg&s=Y&x=18&y=0&sw=762&sh=508&exp=3600	2024-10-30 13:00:14	聯合新聞網
tw	https://news.google.com/rss/articles/CCAiC2Z0ZldBTC1oNjN3mAEB?oc=5	美超微會計疑雲費半摔4% 英特爾盤後漲CEO來台拜託生產?亞馬遜.谷歌.臉書法說共識:再增AI資本支出!伊朗恐報復以色列｜ 主播陳韋如｜【非凡Morning Call】20241101｜非凡財經新聞 - USTV 非凡電視	None	None	2024-11-01 01:31:16	USTV 非凡電視
tw	https://www.cna.com.tw/news/ahel/202410315002.aspx	颱風康芮挾強風豪雨撲台 花蓮泥流狂瀉、新北板橋慈惠宮牌樓倒塌【圖輯】 - 中央社即時新聞	颱風康芮挾強風豪雨侵襲台灣，各地陸續傳出災情。花蓮多處淹水無法通行，街道電線桿倒塌、貨車翻覆，多間鐵皮屋屋頂被吹掀；台中海線地區紅綠燈桿被強風吹歪，電線垂在半空中。中央社整理各地災情畫面。	https://imgcdn.cna.com.tw/www/webphotos/WebOg/600/20241031/1200x630_774649180610.jpg	2024-10-31 02:34:00	中央社即時新聞
tw	https://www.cna.com.tw/news/aipl/202410313003.aspx	微博出現海馬斯受訓照中華民國美國等4國旗並列| 政治 - 中央社即時新聞	國軍對美採購海馬斯多管火箭系統，陸軍今年派官兵赴美受訓。中國網友今天在微博貼出官兵在美受訓照片，可看到同班受訓人員在訓場合影時，中華民國國旗與美國、愛沙尼亞、羅馬尼亞等國旗並列，十分醒目。	https://imgcdn.cna.com.tw/www/webphotos/WebCover/800/20241031/1200x900_45801570440.jpg	2024-10-31 08:57:00	中央社即時新聞
tw	https://news.google.com/rss/articles/CBMiUEFVX3lxTFBOMUlwTDVvYTdBQXBxbXFVSTYwa040WXZjb0t5R185VTRwalpYRXZfZnFWQXhKUkNsYWRkUzExc1FRV0NnUC1aR0RXbnEzeDFX0gFWQVVfeXFMTTBvVXIwakdrcmFDdEZYUWZFdi12QWQwdGtaYXE3dGozRE42RUZnMFFkRmFpWmdlN0s0ZWtrWXBtc0V4N1RQTXdoME1QT0l1RXM3cXczNWc?oc=5	開戰黃捷 葉元之：我監督黃牛票問題錯了嗎？ - 聯合新聞網	黃牛票問題引發國民黨立委葉元之、民進黨立委黃捷之間的戰火，葉元之說，黃牛票問題嚴重，他監督文化部處理黃牛問題，錯了嗎？	None	2024-10-31 09:22:50	聯合新聞網
tw	https://tw.news.yahoo.com/%E7%9C%9F%E7%9A%84%E9%A2%A8%E9%9B%A8%E7%84%A1%E9%98%BB-%E9%A2%B1%E9%A2%A8%E5%81%87-%E5%94%AF-%E7%87%9F%E6%A5%AD-%E6%96%B0%E7%AB%B9%E5%B7%A8%E5%9F%8E%E7%84%A1%E6%87%BC%E5%BA%B7%E8%8A%AE-071952726.html	真的風雨無阻…颱風假「唯一營業」新竹巨城無懼康芮 美食街湧人潮 - Yahoo奇摩新聞	[周刊王CTWANT] 今天包括SOGO新竹店、新竹大遠百、大魯閣湳雅廣場、遠百竹北店都暫停營業1天，讓員工放颱風假去，唯有Big City遠東巨城購物中心今天正常營業，於上午11時開門迎接消費者，成為民眾放颱風假唯一的去處。且由於不少餐廳、小吃店都休息，外送人員也強制休颱風假，沒有外送服務，...	https://media.zenfs.com/zh-tw/ctwant_com_582/1170ab7beabc39353dc03b21c735a0ff	2024-10-31 07:19:52	Yahoo奇摩新聞
tw	https://www.cna.com.tw/news/aloc/202410310204.aspx	馬祖馬拉松延1天引民怨縣府：盡力協調| 地方 - 中央社即時新聞	颱風康芮影響，馬祖馬拉松延期1天，改為11月3日舉辦，昨天公布後引發部分參賽者反彈，連江縣府強調，盡力協調往返馬祖交通，讓跑者安心參賽。	https://www.cna.com.tw/img/pic_fb.jpg	2024-10-31 07:39:00	中央社即時新聞
tw	https://www.ctee.com.tw/news/20241101700058-439901	美股11月必漲！台股準備跟漲一波名師喊雙行情、六利多- 日報 - 工商時報	台股11月將迎曙光台股31日因康芮颱風休市，前一晚台指期夜盤續跌201點、收22,700點，隨美股四大主要指數收黑，31日亞股疲弱，法人表示，短線最大不確定因素仍是美國大選，尤其川普勝率大升，市場擔憂政策大轉彎；惟統計過去十年來，那斯達克指數11月上漲機率達100％，台股可望迎曙光。 彙整統一投顧董...	https://images.ctee.com.tw/newsphoto/2024-11-01/1024/A02AA2_PictureItem_Clipping_03_4.jpg	2024-10-31 19:00:00	工商時報
tw	https://www.cna.com.tw/news/aloc/202410310395.aspx	颱風康芮襲台關渡大橋景觀燈管線槽鬆脫道路封閉| 地方 - 中央社即時新聞	新北市府晚間表示，連結台北市關渡與新北淡水、五股、八里的關渡大橋，因附掛橋外的景觀燈管線槽損壞鬆脫，為顧及用路人安全，關渡橋暫時封閉，請用路人配合管制改道。	https://imgcdn.cna.com.tw/www/webphotos/WebCover/800/20241031/1080x810_961555911130.jpg	2024-10-31 14:13:00	中央社即時新聞