country_code	url	title	description	image_url	publish_date	source
tw	https://www.chinatimes.com/realtimenews/20241104001182-260402	已婚男演員假戲「真做」！摩鐵車上激戰人妻女星綠帽夫氣炸- 社會 - 中時新聞網	None	https://images.chinatimes.com/newsphoto/2024-11-04/656/20241104001185.jpg	2024-11-04 00:47:28	中時新聞網
tw	https://tw.sports.yahoo.com/news/12%E5%BC%B7%E8%B3%BD-%E6%9C%80%E6%B3%A8%E6%84%8F%E7%9A%84%E5%8F%B0%E7%81%A3%E6%8A%95%E6%89%8B-%E9%9F%93%E5%9C%8B%E9%9A%8A%E4%B8%8A%E5%A3%98%E9%81%94%E4%BA%BA%E7%A7%92%E5%9B%9E%E6%9E%97%E6%98%B1%E7%8F%89-053546355.html	12強賽》最注意的台灣投手 韓國隊上壘達人秒回林昱珉 - Yahoo奇摩運動	韓國媒體《SportsWorld》3日報導韓國隊上壘達人洪昌基訪問，媒體問到最注意的台灣投手，他不假思索表示林昱珉，洪昌基說隊友都一直提到「杭州亞運那名投手（林昱珉）」，會多看情蒐影片尋找攻略方式。	https://s.yimg.com/ny/api/res/1.2/5DX2OK2Ng5XV2Lfm.4Q3qQ--/YXBwaWQ9aGlnaGxhbmRlcjt3PTEyMDA7aD05MDE7Y2Y9d2VicA--/https://media.zenfs.com/ko/tsna.com.tw/e0cd374e68e212913ce4fc2e2e3e5f32	2024-11-04 05:43:46	Yahoo奇摩運動
tw	https://www.storm.mg/article/5266528	台積電傷勢取決於川普有多瘋？陳鳳馨列「川普震撼」三階段：小心美國對東芝那招 - 風傳媒	美國總統大選近日倒數階段，近日又再度重申「台灣該給美國保護費」的共和黨總統候選人川普（DonaldTrump）似多有領先民主黨對手賀錦麗（KamalaHarris）之勢。對此，媒體人陳鳳馨盤點若川普上任，對半導體龍頭、台灣「護國神山」台積電的「川普震撼」、及可能施加的手段。她特別	https://image.cache.storm.mg/styles/smg-800x533-fp/s3/media/image/2024/11/02/20241102-110308_U1085_M1002078_4bff.jpg?Y19Tj8igwKLldqunr5Mzq5Wwc8_Hgzta&itok=d0fCIcMu	2024-11-03 00:30:00	風傳媒
tw	https://www.cna.com.tw/news/ahel/202411040214.aspx	墮胎罪罰金擬調高5至8萬元醫憂灰色地帶造成心理壓力| 生活 - 中央社即時新聞	法務部預告修法，刑法墮胎罪罰金擬調高至新台幣8萬元，婦產科醫師擔心修法造成執業心理壓力，罰與不罰的灰色地帶，可能讓女性身體自主權倒退，解決少子化不是強迫不想生的人生育。	https://imgcdn.cna.com.tw/www/WebPhotos/1024/20240821/1024x768_wmky_0_C20240821000081.jpg	2024-11-04 08:43:00	中央社即時新聞
tw	https://sports.ltn.com.tw/news/breakingnews/4850345	MLB》大谷翔平率隊挑戰21世紀首度連霸 大聯盟官網：道奇王朝崛起！ - 自由時報	道奇在今年世界大賽以4勝1敗擊敗洋基，勇奪隊史第8座世界大賽冠軍，這也是他們近5年來的第2冠，大聯盟官網盛讚道奇毫無疑問建立起「王朝球隊」。國聯傳統勁旅道奇長年保有競爭力，近13個賽季勇奪12次分區冠軍，並連續12年打進季後賽，分別在2020年和2024年奪冠，	https://img.ltn.com.tw/Upload/sports/page/800S/2024/11/02/phpmpVBZX.jpg	2024-11-02 09:12:00	自由時報
tw	https://www.ettoday.net/news/20241104/2847997.htm	內事不決問張昭！東吳重臣墓確定在南京 兩枚金印認定身份 - ETtoday新聞雲	三國時代東吳陣營裡的首席文官張昭墓確定在南京南部新城油庫公園地塊，張昭墓近期已完成考古發掘，未來將進行原址保護，供民眾參訪。據了解，發現張昭墓的南部新城油庫公園地塊舊地名為「婁湖」，或與「婁侯」張昭葬於此地有關。此外，該地塊在民國時期曾為重要軍事機場油庫，周邊現存碉堡和停機庫。	https://cdn2.ettoday.net/images/7930/e7930985.jpg	2024-11-04 02:30:00	ETtoday新聞雲
tw	https://www.chinatimes.com/newspapers/20241103000359-260119	谷月涵：美股選後一定漲旺到明年初- 國際大事- 中國時報 - 中時新聞網	美國總統大選進入倒數計時，全球股市屏息以待。有「台灣先生」之稱的寬量國際策略長谷月涵（Peter Kurz）分析，美股選後不是小漲，就是大漲，他認為若共和黨總統候選人川普勝選，美股短期可能迎來一波短多長空的慶祝	https://images.chinatimes.com/newsphoto/2024-11-03/656/B02A00_P_04_02.jpg	2024-11-02 20:10:00	中時新聞網