country_code	url	title	description	image_url	publish_date	source
tw	https://tw.stock.yahoo.com/news/5%E5%BC%B5%E5%8D%83%E8%90%AC%E7%99%BC%E7%A5%A8%E6%B2%92%E4%BA%BA%E9%A0%98%EF%BC%81%E6%9C%80%E7%88%BD%E5%8F%AA%E8%8A%B135%E5%85%83-%E8%B3%BC%E8%B2%B7%E5%9C%B0%E9%BB%9E%E3%80%81%E6%98%8E%E7%B4%B0%E4%B8%80%E6%AC%A1%E7%9C%8B-022958446.html	5張千萬發票沒人領！最爽只花35元 購買地點、明細一次看 - Yahoo奇摩股市	財政部表示，113年7-8月期特別獎（新台幣1000萬元）、特獎（200萬元）中獎發票與100萬元雲端發票獎，截至目前各有5張、4張、4張未領。未領的千萬大獎發票包含臺中市南屯區全家便利商店開出的35元發票，以及手搖飲白巷子WHITE ALLEY開出的135元發票。	https://media.zenfs.com/en/cna.com.tw/a7ef86e6b317023d6bbc2e6a47ef612b	2024-11-21 02:32:57	Yahoo奇摩股市
tw	https://tw.news.yahoo.com/%E7%8D%A8%E5%AE%B6-%E5%9C%8B%E9%81%93%E8%AD%A6%E5%A4%A9%E6%A9%8B%E4%B8%8A%E5%8F%96%E7%B7%A0%E6%8B%8D%E7%85%A7-%E9%81%AD%E6%89%A3%E7%89%8C%E7%94%B7%E5%A4%A9%E5%A4%A9%E5%8F%8D%E6%8B%8Dpo%E7%B6%B2-061600013.html	獨家／國道警天橋上取締拍照 遭扣牌男天天反拍PO網 - Yahoo奇摩新聞	駕駛人都不喜歡收到罰單，就有民眾天天按時前往國道三號175公里處的天橋上，將員警執行取締超速的模樣拍照上傳臉書社團，甚至揶揄說「一男一女員警是神鵰俠侶！」警方說，疑似是這位民眾違規被取締，導致吊扣牌照、丟了工作，所以有這舉動。雖然他沒有過激言論，不過底下網友留言就比較沒有理性，員警提醒這些網友，小心會有觸法疑慮。	https://media.zenfs.com/ko/setn.com.tw/6679804211c8b1ccec93e0250d3b7ad1	2024-11-21 06:22:36	Yahoo奇摩新聞
tw	https://www.ctee.com.tw/news/20241121700066-439901	健保藥價四利多生技業狂歡- 日報 - 工商時報	健保署20日公布健保藥價修正條文，祭出上市新藥給予首發新藥優惠核價、首二張在國內製造學名藥或生物相似性藥證，比照原廠藥價格等四大藥價優惠改革重點。學名藥協會理事長陳誼芬認為，這是提供國內生技產業轉骨升級的關鍵契機，希望能盡快執行助力產業接軌國際。 健保署表示，此次藥物支付標準及藥價調整辦法部分條文修...	https://images.ctee.com.tw/newsphoto/2024-11-21/1024/A03AA3_PictureItem_Clipping_01_5.jpg	2024-11-20 19:00:00	工商時報
tw	https://sports.ltn.com.tw/news/breakingnews/4871260	12強直擊》東蛋美日大戰票房出爐 竟不敵台灣隊的大巨蛋 - 自由時報	世界12強今天晚場複賽上演被視為冠軍前哨戰的「日美大戰」，未料無論下層和上層的內野看台都有明顯的空位，最終票房僅開出25428人，比台北大巨蛋台灣主場平均票房還要低。今天是日本武士隊本屆12強首度在東京巨蛋亮相，雖然外野幾乎全滿，但內野的空位很明顯，跟去年3月經典賽差很多，去年東蛋只要有日本武士隊的	https://img.ltn.com.tw/Upload/sports/page/800S/2024/11/21/phpCVWKGG.jpg	2024-11-21 13:19:00	自由時報
tw	https://tw.sports.yahoo.com/news/%E6%BA%96%E5%82%99%E7%8B%A0%E9%9B%BB%E9%A6%99%E6%B8%AF-%E4%B8%AD%E8%8F%AF%E7%94%B7%E7%B1%83-%E5%A4%A2%E5%B9%BB%E9%9A%8A-%E7%A1%AC%E5%AF%A6%E5%8A%9B%E6%9C%89%E5%A4%9A%E5%BC%B7-%E9%81%8B%E5%BD%A9%E9%96%8B%E7%9B%A4-083237732.html	準備狠電香港！中華男籃「夢幻隊」硬實力有多強 運彩開盤一面倒 - Yahoo奇摩運動	亞洲盃資格賽第二階段賽事開打！中華男籃今（21）日晚間將在台北和平籃球館迎戰香港隊。本次比賽中華隊名單堪稱近年最強，陣容中匯集7名旅外球員及新歸化球員高柏鎧，甚至被外界譽為「夢幻隊」，球迷們高度期待能在主場拿下首勝。	https://s.yimg.com/ny/api/res/1.2/JwEVJAA8eZHI3_ronK06XA--/YXBwaWQ9aGlnaGxhbmRlcjt3PTEyMDA7aD03ODk7Y2Y9d2VicA--/https://media.zenfs.com/ko/gotv_ctitv_com_tw_678/6b5bd399bfa3d641c7a578a2018908d5	2024-11-21 08:32:37	Yahoo奇摩運動
tw	https://news.tvbs.com.tw/life/2692156	連鎖黑浮咖啡「欠薪倒店」！一排4間全關 業者回應了│TVBS新聞網 - TVBS	None	None	2024-11-20 05:38:00	TVBS
tw	https://tw.news.yahoo.com/%E5%B9%B4%E7%B5%82%E7%8D%8E%E9%87%91%E6%8E%80%E7%89%8C-%E4%BB%8A%E5%B9%B4%E4%BC%81%E6%A5%AD%E5%B9%B4%E7%B5%82%E7%8D%8E%E9%87%91%E5%B9%B3%E5%9D%871-12%E5%80%8B%E6%9C%88-%E9%80%99%E8%A1%8C%E6%A5%AD%E9%80%A313%E5%B9%B4%E7%A8%B1%E9%9C%B8-045434990.html	年終獎金掀牌！今年企業年終獎金平均1.12個月，這行業連13年稱霸 - Yahoo奇摩新聞	2024年千萬名勞工薪情如何？104人力銀行調查顯示，2024年整體年薪平均80.2萬元。半導體以平均103.5萬、8連...	https://s.yimg.com/ny/api/res/1.2/zn84D52uajtlWAGTYRAQtQ--/YXBwaWQ9aGlnaGxhbmRlcjt3PTEyMDA7aD04MDA7Y2Y9d2VicA--/https://media.zenfs.com/ko/udn.com/76f0e14c5b9513ebf5da54d48bca3b27	2024-11-21 04:57:57	Yahoo奇摩新聞
tw	https://sports.ltn.com.tw/news/breakingnews/4871146	12強》台灣歷史勝投王張奕再繳好投！坦言被球迷應援震撼：體力哪來的 - 自由時報	台灣今在12強複賽以0：2不敵委內瑞拉，不過投手群表現依舊亮眼，其中參加過2屆12強賽事的張奕，今天登板1.1無失分，他在退場時也特別把球丟給看台的球迷並揮手致意，賽後他也再度向球迷的加油聲致謝。張奕在本屆12強預賽就拿下2次勝投，連同2019年的2勝，累積4勝	https://img.ltn.com.tw/Upload/sports/page/800S/2024/11/21/phpOGUm0j.jpg	2024-11-21 10:40:00	自由時報
tw	https://www.cna.com.tw/news/aopl/202411210021.aspx	北溪天然氣管線爆炸案調查結果德媒揭烏克蘭「直徑行動」混合戰真相| 國際 - 中央社即時新聞	波羅的海近日傳出2海底電纜遭切斷，引發國際關注。與此同時，2年前震驚全歐、導致德國能源危機的北溪天然氣管線爆炸案「混合戰」真相日漸浮現，明鏡週刊昨刊載調查結果與作案過程，精彩宛若電影情節。	https://imgcdn.cna.com.tw/www/webphotos/WebOg/600/20241121/2000x1050_474924314189.jpg	2024-11-21 00:47:00	中央社即時新聞
tw	https://www.ftvnews.com.tw/news/detail/2024B21W0274	12強賽／強到像在開外掛！陳傑憲「6成67打擊率」引關注 賽後被要求藥檢 - 民視新聞網FTVn	體育中心／李明融報導世界棒球12強賽進入到4強循環賽階段，今天（21日）台灣隊首戰面對委內瑞拉，儘管最終以2比0吞下首敗，但「台灣隊長」陳傑憲的超狂表現引發官方關注，單場4個打席全上壘，包括敲出3安「猛打賞」，該場比賽結束之後打擊率是超水準的6成67，賽後官方還要求他接受藥檢。	https://cdn.ftvnews.com.tw/manasystem/FileData/News/2c2a357f-5e87-475f-aee7-0be0ea34bd92.jpg	2024-11-21 07:03:52	民視新聞網FTVn
tw	https://tw.stock.yahoo.com/news/%E6%8A%BD%E4%B8%AD%E4%B8%80%E5%BC%B5%E8%B3%BA84%E8%90%AC%E5%85%83-linepay%E6%96%B0%E8%82%A1%E7%94%B3%E8%B3%BC1125%E6%97%A5%E9%96%8B%E8%B7%91-065925500.html	抽中一張賺8.4萬元 LINEPay新股申購11/25日開跑 - Yahoo奇摩股市	台灣第一大行動支付業LINEPay（連加網路，興櫃代號7722）興櫃轉上市前，將於11月29日辦理公開承銷抽籤，新股申購25日開跑，計1748張承銷，每人可申購1張，承銷價508元，以興櫃價21日收盤均價592元計算，抽中一張最高可賺8.4萬元，報酬率為16.5%。	https://s.yimg.com/ny/api/res/1.2/IsCH0Q4KHVUuioK74ef8Dg--/YXBwaWQ9aGlnaGxhbmRlcjt3PTEyMDA7aD05MDA7Y2Y9d2VicA--/https://s.yimg.com/os/creatr-uploaded-images/2024-07/a0105f10-3aaf-11ef-bbfc-d087ffd6c9bb	2024-11-21 09:18:09	Yahoo奇摩股市
tw	https://www.cna.com.tw/news/acul/202411210062.aspx	臺灣漫遊錄獲美國國家圖書獎楊双子：我書寫是為了回答台灣人是什麼人| 文化 - 中央社即時新聞	作家楊双子的「臺灣漫遊錄」今天獲得「美國國家圖書獎」，她發表得獎感言說，一百年前台灣人對日本說「台灣是台灣人的台灣」，一百年後，台灣人對中國人說同樣一句話；這一百年來不變的是，「我們一直面對著身邊有強大而且具備侵略性的國家」。	https://imgcdn.cna.com.tw/www/webphotos/WebCover/800/20241121/1323x993_110616875587.jpg	2024-11-21 02:51:00	中央社即時新聞
tw	https://sports.ltn.com.tw/news/breakingnews/4870997	12強》台灣隊打出大驚奇 大聯盟記者盛讚是2001世界盃後「最驕傲的時刻」 - 自由時報	台灣隊今天在世界棒球12強複賽首戰，以0：2遭委內瑞拉完封，苦吞首敗。大聯盟官網記者摩洛西（Jon Paul Morosi）表示，無論台灣隊接下來的比賽結果如何，都將會是台灣棒球自2001年世界盃以來最自豪的時刻。	https://img.ltn.com.tw/Upload/sports/page/800S/2024/11/21/php0MiwIC.jpg	2024-11-21 09:33:00	自由時報
tw	https://www.cna.com.tw/news/aopl/202411220011.aspx	蒲亭：21日在烏克蘭成功實戰試射新型極音速中程飛彈| 國際 - 中央社即時新聞	俄羅斯總統蒲亭今天聲稱，為回應烏克蘭使用美國和英國長程打擊武器攻擊俄羅斯境內，俄方今天「在實戰條件下」，成功試射最新型極音速中程彈道飛彈。他說，這款飛彈名為「榛果樹」（Oreshnik）。	https://imgcdn.cna.com.tw/www/webphotos/WebOg/600/20241122/1454x763_362026586110.jpg	2024-11-21 21:52:00	中央社即時新聞
tw	https://tw.news.yahoo.com/5%E5%84%84%E9%AB%98%E4%B8%AD%E7%94%9F%E6%A1%88%E4%BA%8C%E5%AF%A9%E9%96%8B%E5%BA%AD-%E5%A4%8F%E7%94%B7%E9%99%A2%E5%A4%96%E5%A4%B1%E6%8E%A7%E6%89%AF%E6%8E%89%E6%B0%91%E7%9C%BE%E5%8F%A3%E7%BD%A9-050834379.html	5億高中生案二審開庭 夏男院外失控扯掉民眾口罩 - Yahoo奇摩新聞	（中央社記者趙麗妍台中21日電）賴姓男高三生案，一審依偽造文書將與賴男同婚的夏姓男子判1年6月；夏男今天二審出庭，在法院外情緒失控，狠瞪民眾揚言提告，更出手扯掉1名女子口罩，現場一度混亂。	https://s.yimg.com/cv/apiv2/social/images/yahoo_default_logo-1200x1200.png	2024-11-21 05:21:41	Yahoo奇摩新聞
tw	https://tw.stock.yahoo.com/news/%E9%87%91%E9%9B%9E%E4%B8%8D%E6%AD%A2-%E9%9A%BB-%E5%9C%8B%E7%99%BC%E5%9F%BA%E9%87%91-%E8%82%A1%E5%88%A9%E6%94%B6%E5%85%A5%E5%83%856%E6%88%90%E7%94%B1%E5%8F%B0%E7%A9%8D%E9%9B%BB%E8%B2%A2%E7%8D%BB-105811214.html	金雞不止一隻 國發基金：股利收入僅6成由台積電貢獻 - Yahoo奇摩股市	國發會21日針對國發基金投資績效說明，強調國庫原始撥交309億元設立國發基金，國發基金今年9月底淨值1兆2,998億億元，加計歷年賸餘累積繳庫數額3,364億元，合計1兆6,362億元，資產成長近52倍；2016年至2023年期間獲利新台幣1,660億元，較2008年至2015年期間的471億元大幅增加1,189億元，獲利成長3.5倍。	https://s.yimg.com/cv/apiv2/social/images/yahoo_default_logo-1200x1200.png	2024-11-21 10:58:11	Yahoo奇摩股市
tw	https://www.ctee.com.tw/news/20241121701493-430304	合庫金總資產突破5兆明年股利政策曝- 金融 - 工商時報	None	None	2024-11-21 08:26:00	工商時報
tw	https://www.chinatimes.com/realtimenews/20241122000831-260408	性愛趴、吸毒黑料爆不完！ 蓋茲閃退司法部長提名- 國際 - 中時新聞網	美國總統當選人川普欽點的美國司法部長人選、前聯邦眾議員蓋茨（Matt Gaetz）繼日前爆出買春、和未成年發生性行為等諸多爭議後，近日又被爆出更多新黑料，包括多次參與性愛趴還沒付錢，甚至疑似吸毒，引發包括共和黨	https://images.chinatimes.com/newsphoto/2024-11-22/656/20241122000832.jpg	2024-11-21 19:53:44	中時新聞網
tw	https://www.mirrormedia.mg/story/20241121edi041	疾管署「土皇帝」音檔曝光 飆高音喊「神經病」！霸凌調查報告下週四出爐 - 鏡週刊	不只勞動部發生霸凌案，衛福部疾管署疑似也出現霸凌案件，有網友於15日在社群Threads爆料，稱疾管署有一名「土皇帝」，常對同仁大聲咆哮、摔公文，甚至還人身攻擊辱罵。今（21日）有段關於該名「土皇帝」的錄音檔，也在網上曝光流傳。	https://v3-statics.mirrormedia.mg/images/7f76239d-7c21-4090-a048-2a12036c8eb2-w1600.jpg	2024-11-21 19:05:59	鏡週刊
tw	https://www.cna.com.tw/news/aloc/202411210368.aspx	馬祖廢棄軍事據點活化再生成府會攻防焦點| 地方 - 中央社即時新聞	曾作為馬祖國際藝術島作品舞台的南竿梅石營區特約茶室與53據點，後續活化再生成府會攻防焦點。議員要求應盡快重新開幕，增加明年度觀光亮點。	https://imgcdn.cna.com.tw/www/WebPhotos/1024/20241121/1152x768_wmky_0_C20241121000200.jpg	2024-11-21 10:55:00	中央社即時新聞
tw	https://tw.news.yahoo.com/%E6%94%BE%E6%A3%84%E7%AB%B9%E7%A7%91%E9%AB%98%E8%96%AA%E8%BD%89%E8%A1%8C%E5%BE%9E%E8%AD%A6-1%E5%B9%B4%E5%85%A7%E9%96%8B3%E5%8D%83%E5%BC%B5%E7%B4%85%E5%96%AE-111901473.html	放棄竹科高薪轉行從警 1年內開3千張紅單 - Yahoo奇摩新聞	交通部今年舉辦的金安獎，新竹市榮獲「促進道路交通安全績優獎」的員警王尹辰，在一年內開出三千多張罰單，罰鍰共兩百多萬元，不過他之前，是一名竹科的工程師！轉行從警六年，就是因為不想每天面對冷冰冰的機器，而是第一線接觸民眾，在辦案之中協助民眾，積極開單，也是希望有效宣導交通安全。	https://media.zenfs.com/ko/news_tvbs_com_tw_938/08c833bf995f325eb481cba5828ce470	2024-11-20 11:19:01	Yahoo奇摩新聞
tw	https://www.ettoday.net/news/20241121/2859629.htm	開價60萬元！日本AV女優香港賣淫被捕 「最優秀新人」也遭捲入 - ETtoday新聞雲	香港警方聯合澳門、日本、新加坡警方近期破獲一個跨境黑幫賣淫集團，拘捕5男60女，其中包含了日本AV女優麻宮若菜（麻宮わかな）。此外，曾獲「最優秀新人女優獎」的日本人氣AV女優Miru（坂道みる）也出現在賣淫集團的宣傳名單當中，不清楚是真有涉案，還是被冒用名號宣傳。	https://cdn2.ettoday.net/images/7959/e7959913.jpg	2024-11-21 14:05:00	ETtoday新聞雲
tw	https://tw.news.yahoo.com/%E4%BB%96%E6%94%B6%E8%97%8F-2063%E5%BC%B5%E9%9B%BB%E8%A9%B1%E5%8D%A1-%E6%94%BE20%E5%B9%B4%E6%8B%9A%E5%A2%9E%E5%80%BC-%E9%80%80%E8%B2%BB%E9%87%91%E9%A1%8D%E6%9B%9D%E5%85%89-%E7%B6%B2%E9%A9%9A%E5%91%86-021500047.html	他收藏「2063張電話卡」放20年拚增值！退費金額曝光 網驚呆 - Yahoo奇摩新聞	隨著科技進步，現代人幾乎人手一支智慧型手機，但手機還沒發明之前，不少台灣人都曾用過公共電話，「電話卡」也可說是當年人人必備。一名從事電信業的女網友表示，近日有民眾拿了2千多張光學電話卡上門要退費，照片曝光後立刻在網路上掀起熱議。	https://media.zenfs.com/ko/setn.com.tw/35ad87c70652d34e534bc4deeded6119	2024-11-21 02:21:26	Yahoo奇摩新聞
tw	https://tw.stock.yahoo.com/news/2025%E8%82%A1%E5%B8%82%E4%BC%9111%E5%A4%A9%EF%BC%81%E5%8F%B2%E4%B8%8A%E7%AC%AC%E4%BA%8C%E9%95%B7-%E4%B8%80%E6%96%87%E7%9C%8B%E6%87%82%E4%BD%95%E6%99%82%E5%B0%81%E9%97%9C%E3%80%81%E4%BC%91%E5%B8%82-100609525.html	2025股市休11天！史上第二長 一文看懂何時封關、休市 - Yahoo奇摩股市	投資人注意！證交所最新公告，明年1月22日（周三）為114年農曆春節前最後交易日（金龍年封關日），預計從明年1月23日至2月2日休市，台股休市時間長達11天，僅次於112年的12天。	https://s.yimg.com/ny/api/res/1.2/3wqwo9w4Fzxc3Mt3jI3U_Q--/YXBwaWQ9aGlnaGxhbmRlcjt3PTEyMDA7aD04MDA7Y2Y9d2VicA--/https://s.yimg.com/os/creatr-uploaded-images/2023-10/fa2f9790-7476-11ee-bfd9-66d9f0308ac4	2024-11-21 10:06:09	Yahoo奇摩股市
tw	https://udn.com/news/story/124274/8377285	公務員之死 賴清德致歉「還給離世同仁公道」檢討政院反霸凌機制 - 聯合新聞網	勞動部公務員之死案持續延燒，勞動部何佩珊部長已請辭獲准，總統賴清德今出席主持「海軍水星營區完工啟用典禮」時受訪表示，政府...	https://pgw.udn.com.tw/gw/photo.php?u=https://uc.udn.com.tw/photo/2024/11/22/realtime/30951347.png&s=Y&x=101&y=0&sw=1179&sh=786&exp=3600	2024-11-22 02:32:03	聯合新聞網
tw	https://sports.ltn.com.tw/news/breakingnews/4871483	12強直擊》台灣隊打線變陣！ 日媒關注的大砲扛四番 - 自由時報	世界12強台灣隊今天上午11點將對戰同樣1敗的美國隊，推派奇兵左投陳柏清先發搶開胡，台灣隊總教練曾豪駒也透露，吉力吉撈．鞏冠扛下先發四棒。曾總表示，其他棒次調整還有張政禹鎮守三壘，潘傑楷守一壘，其他棒次和守位不變。今天先發四棒的吉力吉撈，先前因原住民名獲得日本媒體關注，還稱呼他是「台湾の大砲」。	https://img.ltn.com.tw/Upload/sports/page/800S/2024/11/22/php8T7vCq.jpg	2024-11-22 01:58:00	自由時報
tw	https://news.tvbs.com.tw/local/2694387	快訊／嚴重！新北第二行政中心塔吊掉落 至少3人受傷1命危│TVBS新聞網 - TVBS	None	None	2024-11-22 02:06:00	TVBS
tw	https://tw.news.yahoo.com/%E5%A4%A7%E9%99%B8%E5%86%B7%E6%B0%A3%E5%9C%98%E4%B8%8B%E5%91%A8%E4%BE%86%E8%A5%B2-%E5%8C%97%E9%83%A8%E5%86%8D%E8%BD%89%E5%86%B7%E5%B9%B3%E5%9C%B0%E4%BD%8E%E6%BA%AB%E6%8E%A214%E2%84%83-095323324.html	大陸冷氣團下周來襲 北部再轉冷平地低溫探14℃ - Yahoo奇摩新聞	中央氣象署表示，東北季風持續影響至23日（周六），24、25日（周日、下周一）北部高溫可回升至攝氏26度左右；但下波東北季風26日（下周二）南下，27、28日（下周三、下周四）可能增強為大陸冷氣團，北部平地再轉冷，低溫下探14度。	https://media.zenfs.com/zh-tw/cna.com.tw/9f07f4162dbe80b92bbd787af6ccfaca	2024-11-21 09:53:24	Yahoo奇摩新聞
tw	https://tw.news.yahoo.com/%E5%8F%8D%E6%93%8A%E7%83%8F%E7%94%A8%E8%8B%B1%E7%BE%8E%E9%A3%9B%E5%BD%88-%E4%BF%84%E9%A6%96%E5%B0%84icbm-%E5%AE%98%E5%AA%92%E6%B0%A3%E7%98%8B-%E6%BA%96%E5%82%99%E7%82%B8%E6%AF%80%E8%8B%B1%E5%9C%8B%E5%BB%A3%E5%A0%B4-090830989.html	反擊烏用英美飛彈？俄首射ICBM 官媒氣瘋：準備炸毀英國廣場 - Yahoo奇摩新聞	即時中心／顏一軒報導美國總統拜登17日晚間批准烏克蘭可使用美製的ATACMS戰術遠程飛彈，攻擊俄羅斯境內的軍事目標。親近俄國總統普丁的消息來源指出，烏克蘭軍隊首次朝俄國西南部的庫斯克州（Kursk Oblast）發射12枚由英國提供的「暴風影」（Storm Shadow）遠程巡航飛彈。對此，俄國官媒怒嗆並要脅稱，他們準備好隨時在倫敦市中心的廣場，用上被西方國家暱稱為「撒旦2號」（Satan II）的RS-28薩爾馬特洲際彈道飛彈開炸！	https://media.zenfs.com/en/ftvn.com.tw/65309f3221db0db6710ad0236460be21	2024-11-21 09:08:30	Yahoo奇摩新聞
tw	https://sports.ltn.com.tw/news/breakingnews/4871455	MLB》全票當選！「法官」賈吉榮膺美聯MVP 創洋基暌違68年壯舉 - 自由時報	美聯MVP今日出爐，洋基重砲「法官」賈吉（Aaron Judge）全票當選，勇奪生涯第二座年度MVP。入圍美聯MVP決選名單的選手有洋基雙星賈吉、索托（Juan Soto）和皇家小惠特（Bobby Witt Jr），最終賈吉得到全部30張第一名選票、總計420分	https://img.ltn.com.tw/Upload/sports/page/800S/2024/11/22/php8gkREq.jpg	2024-11-22 00:14:00	自由時報
tw	https://tw.news.yahoo.com/%E5%96%89%E7%97%9B-%E5%92%B3%E5%97%BD%E5%85%A5%E5%88%97-%E9%86%AB%E7%A4%BA%E8%AD%A6%E7%BD%B9%E7%99%8C%E5%8D%81%E5%BE%B5%E5%85%86-%E9%AB%94%E9%87%8D%E9%80%9F%E4%B8%8B%E9%99%8D%E6%81%90-3%E7%99%8C%E4%B8%8A%E8%BA%AB-090439011.html	喉痛、咳嗽入列！醫示警罹癌十徵兆：體重速下降恐「3癌上身」 - Yahoo奇摩新聞	近幾年癌症已成為台灣十大死因之首，許多人罹癌時常已是晚期，錯失最佳治療時機。對此，胸腔暨重症醫師黃軒表示，事實上癌症在體內形成需要一段時間，身體也會透過許多警訊告知，一旦忽略，等到嚴重時才就醫，恐怕情況已惡化。同時，他也列出罹癌的10大前兆，民眾切勿輕忽。	None	2024-11-21 09:04:39	Yahoo奇摩新聞
tw	https://udn.com/news/story/124274/8376007	遭影射謝宜容娘家 御鼎興醬油蒐證擬提告 - 聯合新聞網	媒體報導涉霸凌的勞發署北分署長謝宜容為雲林人、娘家為雲林某知名傳產工廠，遭影射的御鼎興醬油除發聲明駁斥外，並針對網路不實...	https://pgw.udn.com.tw/gw/photo.php?u=https://uc.udn.com.tw/photo/2024/11/21/98/30948138.jpg&s=Y&x=0&y=0&sw=1073&sh=715&exp=3600	2024-11-21 10:22:03	聯合新聞網
tw	https://news.tvbs.com.tw/entertainment/2693695	自費飛東京看中華隊！樂天女孩驚喜「登巨蛋看板」 高顏質狂吸粉│TVBS新聞網 - TVBS	None	None	2024-11-21 08:21:00	TVBS
tw	https://tw.stock.yahoo.com/news/%E5%8F%B0%E5%8C%97%E8%82%A1%E5%B8%82-%E8%BC%9D%E9%81%94%E8%B2%A1%E5%A0%B1%E9%96%8B%E7%8D%8E-%E6%A6%82%E5%BF%B5%E8%82%A1-ai%E4%BC%BA%E6%9C%8D%E5%99%A8%E6%BC%B2%E8%B7%8C%E4%B8%8D-030706477.html	《台北股市》輝達財報開獎 概念股、AI伺服器漲跌不一 - Yahoo奇摩股市	【時報記者張漢綺台北報導】Nvidia(輝達)公布上季財報及本季財測，雖然均高於市場預期，但盤後股價下跌近3%，不過國內AI伺服器及Nvidia概念股走勢不一，伺服器導軌廠川湖(2059)、銅箔基板廠台光電(2383)與台燿(6274)盤中股價逆勢走高，電源散熱廠台達電(2308)、散熱廠奇鋐(3017)及雙鴻(3324)則連袂走弱。 備受市場關注的Nvidia財報在20日美股盤後公布，上季營收351億美元，優於市場估的332.5億美元，季增17%，年增率達94%，再創新高，其中數據中心銷售為308億美元，優於市場預期的291.4億美元；遊戲業務銷售收入為33億美元，高於分析們估的30.6億美元，經調整後毛利率為75%，符合市場預期，每股盈餘為0.81美元，明顯高於市場估的0.74美元，季升19%，年增率高達103%。 Nvidia預計，第4季營收為375億美元，上下各加減2%，高於分析師預估均值的370.9億美元，相當於年增率約70%，但遠遜上年同 期的265%增幅，經調整後利潤率為73%至74%，分析員預期為73.5%；此外，雖然新一代晶片Blackwell的產量將增加，卻受到一定	https://s.yimg.com/cv/apiv2/social/images/yahoo_default_logo-1200x1200.png	2024-11-21 03:17:52	Yahoo奇摩股市
tw	https://sports.ltn.com.tw/news/breakingnews/4871261	12強直擊》狂！美國44歲希爾先發完全宰制 日本24連勝亮黃燈 - 自由時報	世界12強美國隊今推派今年大聯盟最年長的44歲老投手希爾（Rich Hill），他對日本武士隊繳出4局無失分退場，僅被敲出1支安打，率隊在5局上結束以1：0領先日本隊。希爾只有在1局下被辰己涼介敲1安，接下來連續解決11名打者，總計58球投4局，猛飆5次三振無失分。由於日本隊先發高橋宏斗年僅22歲，	https://img.ltn.com.tw/Upload/sports/page/800S/2024/11/21/phpAmg7Hz.jpg	2024-11-21 11:33:00	自由時報
tw	https://tw.nextapple.com/finance/20241121/8156D46695720699821ADE5B890263E8	飆股神達再奔漲停！台股收跌132點 台積電跌15元報1010 - 壹蘋新聞網	【記者趙筱文／台北報導】美股主要指數漲跌互見，道瓊工業指數上揚139.53點，那斯達克指數下跌21.33點。台股21日開盤急速下跌近200點，至22,490.28。	https://static-cdn.nextapple.tw/prod/2024-11/8156D46695720699821ADE5B890263E8/9bd4b29a7bbd344a75452c72c9d42355_750.jpeg	2024-11-21 05:33:00	壹蘋新聞網
tw	https://udn.com/news/story/8952/8375866	12強賽／前MLB球員開轟救了委國 官網：黃子鵬失投滑球被逮中 - 聯合新聞網	委內瑞拉隊今天在世界12強棒球賽複賽首戰以2：0擊敗中華隊，培瑞茲（Carlos Perez）4局下兩分砲成為致勝一擊；...	https://pgw.udn.com.tw/gw/photo.php?u=https://uc.udn.com.tw/photo/2024/11/21/realtime/30947435.jpg&s=Y&x=0&y=0&sw=4840&sh=3204&exp=3600	2024-11-21 08:59:05	聯合新聞網
