country_code	url	title	description	image_url	publish_date	source
tw	https://news.tvbs.com.tw/life/2672865	「白晝之夜」嗨翻大安森林公園！夜行動物派對遊行登場 - TVBS	None	None	2024-11-02 12:59:00	TVBS
tw	https://def.ltn.com.tw/article/breakingnews/4851066	解放軍模擬美日匿蹤戰機攻擊上海 港媒爆180公里外即被偵獲 - 軍武	香港《南華早報》3日報導，中國軍事研究人員近日在發表的一篇論文中，揭露了模擬日本戰機突破中國防空系統、對上海發動空襲的電腦戰爭演習結果。研究顯示，美軍F-22或F-35等匿蹤戰機，可能在距離上海180公里處，即被中國陸基雷達偵測到。此項研究由解放軍國防大學聯合行動學院和北京市智能博弈國家重點實驗室合	https://img.ltn.com.tw/Upload/def/page/800/2024/11/03/4851066_1.jpg	2024-11-03 07:28:00	軍武
tw	https://news.google.com/rss/articles/CCAiC1FSSGM5bnFlNVhJmAEB?oc=5	【精華回顧】11/03 台灣 vs. 捷克 ｜ 台灣捷克國際交流賽 - 愛爾達體育家族 ELTA Sports	None	None	2024-11-03 13:29:46	愛爾達體育家族 ELTA Sports
tw	https://tw.sports.yahoo.com/news/12%E5%BC%B7%E3%80%8B%E5%8F%B0%E6%8D%B7%E4%BA%A4%E6%B5%81%E6%9E%97%E6%98%B1%E7%8F%89%E5%A5%BD%E6%8A%95-%E8%87%AA%E8%A9%95%E8%A1%A8%E7%8F%BE%E8%88%87%E5%A0%B4%E5%9C%B0%EF%BC%9A%E3%80%8C%E5%BE%88%E6%BB%BF%E6%84%8F%E3%80%8D-091222944.html	12強》台捷交流林昱珉好投 自評表現與場地：「很滿意」 - Yahoo奇摩運動	2024台灣捷克國際交流賽昨日（2日）首戰登板中繼1局的旅美投手林昱珉，第2戰賽前談到自己的表現，林昱珉表示：「因為只有1局而已，所以可以把所有的體力都放在那1局，對自己表現蠻滿意的，因為球速有出來，然後狀態蠻好的。」	https://s.yimg.com/ny/api/res/1.2/Nu1Qig_qft6uB9Pja8rcug--/YXBwaWQ9aGlnaGxhbmRlcjt3PTEyMDA7aD04MDA7Y2Y9d2VicA--/https://s.yimg.com/os/creatr-uploaded-images/2024-11/4002e600-9906-11ef-8fb6-7f0a4b02dbff	2024-11-03 09:12:22	Yahoo奇摩運動
tw	https://www.mirrormedia.mg/story/20241103edi009	柯文哲祕書許芷瑜傳「從日本轉往澳洲」 北檢、民眾黨都回應了 - 鏡週刊	台北地檢署調查京華城案進展迅速，日前已對柯文哲隨行祕書許芷瑜發布通緝，根據媒體報導，許芷瑜在檢方發布通緝前已經轉往澳洲。對此，民眾黨強烈質疑，認為這是「檢媒一體」現象的再現，並呼籲檢方公開消息來源以釋疑。	https://v3-statics.mirrormedia.mg/images/62fd92a6-7d59-4da6-86dc-54f47cbae787-w1600.webp	2024-11-03 22:54:39	鏡週刊
tw	https://www.cna.com.tw/news/aipl/202411040036.aspx	海馬斯多管火箭首批抵台58砲指部接裝訓練中| 政治 - 中央社即時新聞	為強化跨區增援及源頭打擊能力，台灣對美軍購29套海馬斯多管火箭系統（HIMARS），軍方人士今天證實，首批已在10月運抵台灣，目前正由陸軍58砲指部實施接裝訓練中。	https://imgcdn.cna.com.tw/www/webphotos/WebCover/800/20241104/1000x750_915035643218.jpg	2024-11-04 01:52:00	中央社即時新聞
tw	https://udn.com/news/story/7266/8335399	衛福部草案 代孕費百萬起跳 新制最快明年上路 - 聯合新聞網	衛福部版人工生殖法修正草案最快年底送至行政院，條文包括嚴格規定代孕者身心狀況、術前雙方需接受至少四次評估諮商，營養費及其...	https://pgw.udn.com.tw/gw/photo.php?u=https://uc.udn.com.tw/photo/2024/11/03/realtime/30836785.jpg&s=Y&x=0&y=16&sw=2191&sh=1460&exp=3600	2024-11-03 17:01:12	聯合新聞網
tw	https://www.storm.mg/article/5266823	辦不死柯文哲將塑造悲劇英雄？作家曝北檢苦惱這一事：民進黨挫咧等 - 風傳媒	民眾黨主席柯文哲涉京華城案被羈押禁見，台北地院日前召開延押庭後，裁定繼續延押2個月。對此，作家「漂浪島嶼」在臉書發文表示，若最終只剩圖利罪起訴柯文哲，將坐實押人取供的批評，所有的責難，將燒向整個政府，民進黨挫咧等。透過<Google新聞>追蹤風傳媒漂浪島嶼表示，京華案	https://image.cache.storm.mg/styles/smg-800x533-fp/s3/media/image/2024/11/01/20241101-051953_U18448_M1001937_3c5f.JPG?tk2qabpzJmCD8MI_zU2lTo.tqiMsRy92&itok=OSARqted	2024-11-03 02:18:00	風傳媒
tw	https://tw.sports.yahoo.com/news/%E6%97%A5%E8%81%B7-%E9%AE%91%E7%88%BE%E7%A5%9D%E8%B3%80%E6%A9%AB%E6%BF%B1dena%E5%A5%AA%E5%86%A0-%E7%90%83%E5%9C%98%E6%9C%89%E6%84%8F%E8%8A%B110%E5%84%84%E6%97%A5%E5%B9%A3%E6%89%BE%E4%BB%96%E8%A3%9C%E5%BC%B7-032936065.html	日職／鮑爾祝賀橫濱DeNA奪冠！球團有意花10億日幣找他補強 - Yahoo奇摩運動	體育中心／王人瑞報導橫濱DeNA拿下日本大賽冠軍後，鮑爾（Trevor Bauer） 也特別在個人推特上發文祝賀老東家拿下日本一，根據日媒最新報導，橫濱DeNA已經開始計畫補強，傳出可能會開出10億日圓，約台幣2.09億元的合約，找回鮑爾增加先發輪值陣容，	https://media.zenfs.com/en/ftvn.com.tw/3e2920c83b1343568235fe05288479c9	2024-11-04 03:32:25	Yahoo奇摩運動
tw	https://udn.com/news/story/7327/8335046	新鮮感消退？高雄壽山動物園人潮大幅下滑 比去年同期少近半 - 聯合新聞網	高雄駁二藝術特區、高流遊客持續增加，不過旗津遊客減少，斥資5.5億元改造的壽山動物園也有退燒跡象，光今年暑假比去年同期減...	https://pgw.udn.com.tw/gw/photo.php?u=https://uc.udn.com.tw/photo/2024/11/03/realtime/30836236.jpg&s=Y&x=0&y=34&sw=4608&sh=3072&exp=3600	2024-11-03 12:09:46	聯合新聞網
tw	https://newtalk.tw/news/view/2024-11-03/942910	劉德華演唱會遭全程直播PO網！粉絲氣炸：太扯… - Newtalk新聞	天王劉德華昨(2)日在台北小巨蛋舉辦演唱會，怎料竟有觀眾將3小時的演唱會全程直播，讓劉德華的粉絲氣炸開砲「會不會太扯啊」。劉德華睽違11年來台，原訂從10月31日起在台北小巨蛋舉辦「今天...is the day」演唱會，一連開唱4天，卻碰上康芮颱風攪局，改至11月2日中午補辦，一日連唱兩場。寵粉的	https://s.newtalk.tw/album/news/927/668260728b17f.jpg	2024-11-03 06:41:56	Newtalk新聞
tw	https://tw.news.yahoo.com/%E6%AD%90%E6%B4%B2%E7%AC%AC2%E6%85%98%E6%B4%AA%E6%B0%B4%E9%87%80%E9%80%BE200%E6%AD%BB-%E8%A5%BF%E7%8F%AD%E7%89%99%E7%8E%8B%E5%AE%A4%E5%8B%98%E7%81%BD%E9%81%AD%E4%B8%9F%E7%9F%B3%E5%A1%8A-%E7%81%BD%E6%B0%91%E6%80%92%E8%BD%9F%E6%AE%BA%E4%BA%BA%E7%8A%AF-235318589.html	歐洲第2慘洪水釀逾200死！ 西班牙王室勘災遭丟石塊「災民怒轟殺人犯」 - Yahoo奇摩新聞	[周刊王CTWANT] 當費利佩六世和萊蒂西亞王后（Queen Letizia of Spain）3日在瓦倫西亞市鎮「派波爾塔」（Paiporta）視察時，遭到群眾包圍，並被吆喝著「滾出去」、 「殺人犯」、「可恥」等侮辱性言辭，質問國王為何沒有採取措施，以避免悲劇發生。除了現場的謾罵，有人還向國王的隊伍投擲泥...	https://media.zenfs.com/zh-tw/ctwant_com_582/d0c02cfe6c638396608bd9cb528d23ea	2024-11-04 00:04:30	Yahoo奇摩新聞
tw	https://news.ltn.com.tw/news/life/breakingnews/4851242	週一東北季風增強 北東陰雨中南部多雲到晴 - 自由時報	None	None	2024-11-03 12:20:23	自由時報
tw	https://www.setn.com/News.aspx?NewsID=1557983	公投綁大選民調出爐！66.3％支持合併 政黨理念相近度綠營獲30.4％最高 - 房產	立法院內政委員會擬於4日排審《公民投票法修正草案》，國民黨團力拚恢復「公投綁大選」。國民黨立委羅智強發起的新國會智庫，今（3日）公布「公投綁大選」相關民調。根據民調數據，有66.3％表態支持（33.1%非常支持、33.2％還算支持）、21.3％不支持（10.9％不太支持、10.4%完全不支持）、12.3%不知道/沒意見、0.1%拒答。	https://attach.setn.com/newsimages/2024/11/03/4877743-PH.jpg	2024-11-03 06:40:39	房產
tw	https://tw.news.yahoo.com/25%E6%AD%B2%E7%94%B7%E7%84%A1%E7%85%A7%E8%B6%8A%E7%B4%9A%E9%A8%8E%E9%87%8D%E6%A9%9F-%E6%99%82%E9%80%9F%E7%A0%B4%E7%99%BE%E9%81%8E%E5%BD%8E-%E6%85%98%E6%91%94-%E6%93%8A%E8%90%BD4%E9%87%8D%E6%A9%9F%E4%B8%8B%E5%A0%B4%E6%85%98%E4%BA%86-020900306.html	25歲男無照越級騎重機！「時速破百過彎」慘摔…擊落4重機下場慘了 - Yahoo奇摩新聞	苗栗台3線獅潭路段發生重機連環撞事故，昨日（3日）上午8時許，新竹一名25歲林姓男子，沒有大型重機駕照卻越級騎乘重機，還以破百時速過彎，結果失控慘摔，連人帶車撞翻停在路邊的4輛重機，幸好林男有穿保護裝備沒受傷，但這下不只違規騎車被開罰，還得賠償眾人車損，維修費恐怕不便宜。	https://media.zenfs.com/ko/setn.com.tw/290e12106eba79ce6e3e8f0f433ec9f9	2024-11-04 02:16:23	Yahoo奇摩新聞
tw	https://ec.ltn.com.tw/article/breakingnews/4851323	獨家》雲端發票重複中獎爭議 調查局立案調查 - 自由財經	〔記者鄭琪芳／台北報導〕針對雲端發票抽獎活動重複中獎爭議，財政部長莊翠雲上週五在立法院表示，已協同法務部調查局一起調查。據了解，調查局已立案調查，預計本週開始約談相關人員，將調查相關單位有無行政	https://img.ltn.com.tw/Upload/business/page/800/2024/11/03/4851323_1.jpg	2024-11-03 23:00:00	自由財經
tw	https://www.cna.com.tw/news/aipl/202411030118.aspx	國軍英雄館將停止住宿軍友社：轉型休閒餐飲| 政治 - 中央社即時新聞	全台國軍英雄館傳出將停止提供住宿服務，經營各地國軍英雄館的軍友社今天證實，由於國軍英雄館受都市計畫、所有權等因素影響，無法依發展觀光條例申請登記「旅館業」，將朝健康休閒、餐飲服務轉型。	https://imgcdn.cna.com.tw/www/webphotos/WebOg/600/20241104/529x278_241541616395.jpg	2024-11-03 08:15:00	中央社即時新聞
tw	https://tw.news.yahoo.com/%E5%8F%B0%E4%B8%AD%E7%AB%A5%E9%A8%8E%E5%96%AE%E8%BB%8A%E9%81%8E%E6%96%91%E9%A6%AC%E7%B7%9A%E9%81%AD%E6%92%9E%E4%BA%A1-%E7%88%B6%E8%B3%AA%E7%96%91%E5%B0%8D%E6%96%B9%E8%BB%8A%E9%80%9F%E9%81%8E%E5%BF%AB-%E5%85%A9%E9%A7%95%E9%A7%9B%E4%BE%9D%E9%81%8E%E5%A4%B1%E8%87%B4%E6%AD%BB%E9%80%81%E8%BE%A6-%E7%9B%AE%E6%93%8A%E5%AD%B8%E7%AB%A5%E6%A0%A1%E6%96%B9%E5%AE%89%E6%8E%92%E8%BC%94%E5%B0%8E-035038690.html	台中童騎單車過馬路遭撞輾身亡 父質疑肇事車速過快 兩駕駛依過失致死送辦 - Yahoo奇摩新聞	台中一名11歲男童，昨天下午獨自騎自行車行經北屯區一處閃光黃、紅燈路口，沿行人穿越道穿越馬路時，先遭湯男騎機車撞上，男童倒地後又遭後方傅男開車輾過，傷重送醫不治；警方全案詢問後，今天將兩名駕駛依過失致死罪嫌送辦。男童父親今天表示，事故現場是斑馬線、閃黃燈路口，質疑對方車速過快。
另外，男童就讀學校今天啟動班級輔導，校方也找到目擊學童，請輔導老師介入輔導，降低心理衝擊。	https://media.zenfs.com/zh-tw/cna.com.tw/d537aa30a68d800cef262d5c9c2607b7	2024-11-04 05:10:15	Yahoo奇摩新聞
tw	https://tw.news.yahoo.com/%E4%B8%8D%E7%88%BD%E7%8E%8B%E5%AE%9A%E5%AE%87%E8%AA%AA%E5%8A%89%E5%BE%B7%E8%8F%AF%E5%AA%9A%E5%85%B1-%E9%82%B1%E7%93%88%E5%AF%AC%E6%86%A4%E6%80%92%E6%AE%BA%E5%8E%BB%E9%96%8B%E7%BD%B5-%E6%BB%BE%E5%9B%9E%E5%8E%BB%E8%80%8D%E4%BD%A0%E7%9A%84%E6%94%BF%E6%B2%BB%E5%AF%B6-%E6%88%91%E5%91%B8-035906823.html	不爽王定宇說劉德華媚共！邱瓈寬憤怒殺去開罵「滾回去耍你的政治寶」：我呸 - Yahoo奇摩新聞	[FTNN新聞網]記者蕭廷芬／綜合報導香港天王巨星劉德華相隔11年再度在台灣開唱，卻因撞上強颱康芮而無端捲入政治紛爭，先是民進黨立委王定宇稱劉德華是「媚共...	https://media.zenfs.com/ko/ftnn_com_tw_939/0ae6dbb4764d31198c1b38ede6166ac7	2024-11-04 04:14:38	Yahoo奇摩新聞
tw	https://tw.news.yahoo.com/%E6%98%8E%E5%A4%A9%E5%B0%B1%E5%88%B0%E6%9C%9F%E4%BA%86-%E9%82%84%E6%9C%893%E5%BC%B5%E5%8D%83%E8%90%AC%E7%99%BC%E7%A5%A8%E6%9C%AA%E9%A0%98%E7%8D%8E-020827228.html	明天就到期了！還有3張千萬發票未領獎 - Yahoo奇摩新聞	[NOWnews今日新聞]今（113）年5-6月期統一發票領獎期限只到明（5）日止，不過，財政部今（4）日表示，至目前為止，還有3張千萬特別獎中獎發票還沒有出面認領，消費金額最低只花21元就抱走千萬元...	https://media.zenfs.com/ko/nownews.com/3d60b05294fd62ae340e708e390bfbd7	2024-11-04 02:17:01	Yahoo奇摩新聞
tw	https://newtalk.tw/news/view/2024-11-03/942864	充當砲灰戰爭研究所：朝鮮軍頂多能替俄軍承擔十天傷亡| 國際 - Newtalk新聞	美國與北約證實，朝鮮部隊已在俄羅斯境內，並將與烏克蘭軍廝殺。戰爭研究所（the Study of War, ISW）稍早指出，俄軍每天大約傷亡 1,200 名，朝鮮就算能與俄軍同樣適應現代戰爭，也頂多只能幫莫斯科多撐10天。戰爭研究所指出，朝鮮軍隊的特遣隊可能多達 12,000 人，因此，「如果朝鮮	https://s.newtalk.tw/album/news/941/6713229d47886.jpg	2024-11-03 00:06:45	Newtalk新聞
tw	https://udn.com/news/story/7325/8336055	慘！撐不到雪季就陣亡...設備全毀 合歡山停車場收費全喊停 - 聯合新聞網	康芮颱風襲台，合歡山颳起17級強陣風，當地電力系統受損，啟用才滿半年的武嶺、合歡山莊停車場，繳費亭被吹垮，設備全毀，且因...	https://pgw.udn.com.tw/gw/photo.php?u=https://uc.udn.com.tw/photo/2024/11/04/realtime/30839092.jpg&s=Y&x=0&y=12&sw=1666&sh=1110&exp=3600	2024-11-04 05:20:16	聯合新聞網
tw	https://tw.stock.yahoo.com/news/%E5%8D%8A%E5%B0%8E%E9%AB%94-%E8%81%AF%E7%99%BC%E7%A7%91%E5%85%A5%E8%82%A1%E4%B8%96%E8%8A%AF-ky-%E5%A4%96%E8%B3%87-%E6%9C%89%E5%8A%A9%E6%B8%9B%E5%B0%91ai%E9%A0%98%E5%9F%9F%E6%BF%80%E7%83%88%E7%AB%B6%E7%88%AD-042014123.html	《半導體》聯發科入股世芯-KY 外資：有助減少AI領域激烈競爭 - Yahoo奇摩股市	【時報記者王逸芯台北報導】世芯-KY（3661）近期迎來聯發科（2454）的戰略投資，獲得董事會通過的私募增資使聯發科取得45萬股，持股比例約0.56%。美系外資在最新出具的研究報告中指出，儘管此次投資初期為財務性質，市場普遍認為此舉有助於雙方未來在AI專用晶片（AI ASIC）領域的合作與發展，並且避免過度激烈的競爭，對世芯-KY來說無疑是一大利好消息，因此，重申世芯-KY的加碼評等，目標價為3800元。 美系外資表示，根據雙方管理團隊的說法，此次投資最初為財務性質。然而，聯發科將AI專用晶片（AI ASIC）視為其長期增長的主要動力之一。儘管聯發科此次僅持有少量股權，但此戰略性投資至少能避免兩家AI ASIC領域的強者在未來展開過度激烈的競爭，對世芯-KY來說是好消息。 美系外資表示，目前尚未有具體合作計劃，但若未來有大型AI客戶需求來自亞洲的前後端設計服務以降低成本，世芯-KY與聯發科之間存在合作空間。在世芯-KY上週五的法說會上，針對擴展公司前端設計能力的計劃，世芯-KY表示更傾向於與IP及前端設計供應商建立合作夥伴關係，而非組建內部團隊。	https://s.yimg.com/cv/apiv2/social/images/yahoo_default_logo-1200x1200.png	2024-11-04 04:27:46	Yahoo奇摩股市
tw	https://sports.ltn.com.tw/news/breakingnews/4851109	MLB》砸10億美元奪冠的道奇有望再參加錢鬥！美媒點名值得注意人選 - 自由時報	道奇隊在今年順利捧起睽違4年的世界大賽獎盃，管理層也馬上就迎接休賽季的軍備競賽，《洛杉磯時報》記者哈里斯（Jack Harris）撰文點出道奇目前陣容能夠補強的方向，以及可能人選。哈里斯提到，明年道奇陣容最大的缺口預計會是外野以及先發輪值，就算球隊把貝茲（Moo	https://img.ltn.com.tw/Upload/sports/page/800S/2024/11/03/php6VNxoe.jpg	2024-11-03 09:03:00	自由時報
tw	https://www.cna.com.tw/news/aipl/202411040017.aspx	對中政策比一比賀錦麗偏務實、川普重交易都未承諾協防台灣| 政治 - 中央社即時新聞	美中戰略競爭格局持續，民主黨總統候選人賀錦麗、共和黨川普都視中國為主要對手，但政策不同。川普交易性格強，不可預測性高；賀錦麗大致延續拜登路線，重務實。兩人對協防台灣尚無承諾。	https://imgcdn.cna.com.tw/www/webphotos/WebOg/600/20241104/1955x1028_59651114544.jpg	2024-11-04 00:19:00	中央社即時新聞
tw	https://www.cna.com.tw/news/asoc/202411040122.aspx	統促黨幹部張孟崇與妻涉收中國7400萬元介選檢依反滲透法起訴| 社會 - 中央社即時新聞	中華統一促進黨中央委員張孟崇及妻子洪女從100年起收受中國7400萬元資助，為特定公投議題、罷免對象、候選人、政黨大肆宣傳，嘉義地檢署日前偵結，依反滲透法等起訴2人。	https://imgcdn.cna.com.tw/www/webphotos/WebCover/800/20241104/800x600_839818121782.jpg	2024-11-04 05:27:00	中央社即時新聞
tw	https://www.setn.com/News.aspx?NewsID=1557904	國道恐怖車禍！42歲男追撞殞命 535萬賓士豪車插進貨櫃車尾慘況曝光 - 三立新聞網 Setn.com	國道1號圓山段發生死亡車禍，林姓男子昨晚深夜11點多駕駛新車價535萬的賓士CLS53豪車，不明原因追撞前方貨櫃車，整台車頭插進貨櫃車車尾，林男被夾困車內，緊急搶救送醫後不治。	https://attach.setn.com/newsimages/2024/11/03/4877541-PH.jpg	2024-11-03 02:26:00	三立新聞網 Setn.com
tw	https://udn.com/news/story/7266/8335552	周四立冬！青蛇年犯沖4生肖當心 2生肖運勢一飛沖天 - 聯合新聞網	11月7日迎來節氣「立冬」，民俗專家廖大乙提醒，立冬是運勢轉換關鍵期，明年「青蛇年」犯太歲的屬蛇、豬、虎、猴4生肖當心，...	https://pgw.udn.com.tw/gw/photo.php?u=https://uc.udn.com.tw/photo/2024/11/04/realtime/30837673.jpg&s=Y&x=0&y=17&sw=2364&sh=1576&exp=3600	2024-11-03 23:14:30	聯合新聞網
tw	https://www.setn.com/News.aspx?NewsID=1558239	376萬卡友注意！4銀行「信用卡權益明年縮水」 停車、現金回饋入列 - 房產	對於許多民眾來說，辦信用卡前會相當注重每張卡所能提供的權益，然而，如今有多間銀行公告明年起信用卡權益變動，包括兆豐銀、第一銀、合庫銀與上海銀等，估計將有376萬卡友權益受到影響。	https://attach.setn.com/newsimages/2022/03/06/3554350-PH.jpg	2024-11-03 23:13:28	房產
tw	https://sports.ltn.com.tw/news/breakingnews/4851352	黑豹旗》冠軍戰結束後... 平鎮與穀保教練團爆發激烈口角 - 自由時報	穀保家商今天以14：9擊敗平鎮高中，拿下第12屆中信盃黑豹旗青棒賽冠軍，同時也是隊史第4冠。不過，賽後穀保球員衝上投手丘瘋狂慶祝結束後，接著兩隊列隊向對方握手致意，並向球迷敬禮答謝，雙方教練團卻發生嚴重口角，平鎮投手教練羅健銘情緒顯得十分激動，不斷對著穀保教練「激烈溝通」，所幸未釀成進一步衝突，只是	https://img.ltn.com.tw/Upload/sports/page/800S/2024/11/03/phpCHFIO3.jpg	2024-11-03 12:44:00	自由時報
tw	https://udn.com/news/story/6999/8334177	MLB／柯爾跳脫合約但洋基可用「鈔能力」留人 紐媒：放走他會很意外 - 聯合新聞網	世界大賽落幕，自由市場開始動起來，洋基隊王牌投手柯爾（Gerrit Cole）決定執行合約逃脫權，而現在主動權握在洋基手...	https://pgw.udn.com.tw/gw/photo.php?u=https://uc.udn.com.tw/photo/2024/11/03/1/30833486.jpg&s=Y&x=0&y=0&sw=1272&sh=848&exp=3600	2024-11-03 01:30:21	聯合新聞網
tw	https://www.cna.com.tw/news/aopl/202411040063.aspx	賓州為搖擺州重中之重賀錦麗陣營稱見3勝選跡象| 國際 - 中央社即時新聞	美大選倒數1天，在關鍵搖擺州賓州，民主黨賀錦麗陣營說，女性投票踴躍、川普支持者稱波多黎各為「垃圾島」可望激出挺賀的拉丁裔選票、逐戶催票僅見賀陣營志工。這3跡象顯示，賀應能贏賓州。	https://imgcdn.cna.com.tw/www/webphotos/WebOg/600/20241104/1024x538_910552132696.jpg	2024-11-04 03:32:00	中央社即時新聞
tw	https://news.tvbs.com.tw/local/2673746	快訊／落跑神隱第4日！南檢認陳啟昱逃亡 正式發布通緝 - TVBS	None	None	2024-11-04 02:27:00	TVBS
tw	https://www.ettoday.net/news/20241104/2847951.htm	快訊／貪11萬重判7年4月！高虹安藍洋裝現身高院笑回：謝謝 - ETtoday新聞雲	停職中的新竹市長高虹安在立委任內涉詐助理費，一審審理後認定詐領助理費11萬餘元，依貪汙等罪重判7年4月，高與檢方皆上訴。今(4日)高院開庭，再度傳喚高與4名助理出庭說明，外頭聚集抗議人士高喊「重判高虹安」，而稍早高虹安穿著藍色洋裝現身，面對媒體詢問是否有信心，僅微笑回應「謝謝」。

	https://cdn2.ettoday.net/images/7930/e7930861.png	2024-11-04 01:35:00	ETtoday新聞雲
tw	https://udn.com/news/story/7266/8335961	銀杏颱風恐跟東北季風共伴 氣象署：周五起影響 今晚變天北台濕涼 - 聯合新聞網	中央氣象署預報員官欣平上午指出，受東北季風增強影響，今傍晚起北台逐漸變天轉濕涼，周二到周四北台降溫明顯，低溫只有19度。...	https://pgw.udn.com.tw/gw/photo.php?u=https://uc.udn.com.tw/photo/2024/11/04/realtime/30838902.png&s=Y&x=0&y=64&sw=954&sh=636&exp=3600	2024-11-04 03:20:21	聯合新聞網
tw	https://www.setn.com/News.aspx?NewsID=1558345	律師：藍白應請檢方查明，誰洩漏偵查中內容給民眾黨黃國昌？ - 三立新聞網 Setn.com	國民黨立委吳宗憲今（4）日將以立法院司法委員會召委身份，率在野立委前往北檢考察，由於正值前台北市長、民眾黨主席柯文哲京華城案敏感時機，這次考察格外引人注目。黃帝穎律師在臉書發文，偵查不公開不能「雙標」，藍白應請北檢查清楚誰洩露偵查內容給民眾黨，而柯陣營至少揭露偵查內容3次。	https://attach.setn.com/newsimages/2024/11/03/4878095-PH.jpg	2024-11-04 02:48:00	三立新聞網 Setn.com
tw	https://news.google.com/rss/articles/CCAiC3ZUcW1xbVJiNzdnmAEB?oc=5	愛莉莎莎獲不起訴 黃國昌要求中選會道歉【最新快訊】 - 台視新聞 TTV NEWS	None	None	2024-11-04 06:40:15	台視新聞 TTV NEWS
tw	https://udn.com/news/story/10930/8335698	影／吳忠達戰死烏克蘭 他在戰場和俄軍交戰影片曝光… - 聯合新聞網	俄烏戰爭延燒，台籍烏克蘭雇傭兵吳忠達，在戰場遭遇猛烈砲火喪命，成為繼花蓮青年曾聖光後，第2位在俄烏戰爭中捐軀的台籍志願兵...	https://pgw.udn.com.tw/gw/photo.php?u=https://uc.udn.com.tw/photo/2024/11/04/realtime/30838174.jpg&s=Y&x=0&y=207&sw=345&sh=230&exp=3600	2024-11-04 01:41:05	聯合新聞網
tw	https://newtalk.tw/news/view/2024-11-04/942953	柯文哲酸侯友宜｢證明你不被需要｣民眾黨快4月沒主席蔡壁如表態了| 政治 - Newtalk新聞	民眾黨主席柯文哲涉入京華城弊案被裁定延押2個月，柯文哲向民眾黨請假3個月即將屆滿，民眾黨是否要改選黨主席、或推派代理主席，目前黨內有雜音。而喊出誰反對柯文哲無限期請假就公布誰名字的民眾黨中央委員江和樹則改口支持黃國昌代理主席；前民眾立委、台中市政府市政顧問蔡壁如也附和支持，但她也強調，若黨中央需要，	https://s.newtalk.tw/album/news/907/65aba9a20abda.jpg	2024-11-03 22:39:07	Newtalk新聞
tw	https://sports.ettoday.net/news/2848190	快訊／中信兄弟詹子賢行使自由球員 本季FA第一人 - ETtoday運動雲	中華職棒今天公布，中信兄弟詹子賢行使自由球員權利，是今年第一位行使FA的球員，	https://cdn2.ettoday.net/images/7781/e7781040.jpg	2024-11-04 06:14:00	ETtoday運動雲
tw	https://news.google.com/rss/articles/CBMiX0FVX3lxTFBwc09wa19WR3BQZXhsZmhlVVE5VHRWa2dOc3JZZHQ1dzNRM0tyZHZoX0xBVHl6Rk91MEFQQWVtMmNIRkgxX3ZZVk1IbVN0VzlaQXlfYXd6UXd4TldfWjY0?oc=5	房市交易降溫新案來人數這區域月減逾三成淪重災區- 房市 - 工商時報	None	None	2024-11-03 06:45:00	工商時報
tw	https://www.ettoday.net/news/20241104/2848003.htm	畫面曝光！特斯拉鬼切害運鈔車失控撞分隔島 千萬現鈔急戒護 - ETtoday新聞雲	高雄鳳山建國路靠近文昌街路口今（4）日發生一起運鈔車自撞車禍，由於車上載有千萬現鈔，引起關注。經警方調查，當時該輛運鈔車為閃避一輛鬼切的特斯拉，導致車輛失控往左撞上分隔島，車上2名保全因頸椎受傷無法動彈。所幸車上千萬現鈔在員警戒護下，由保全公司另派車輛載離，患者也順利送醫。	https://cdn2.ettoday.net/images/7931/e7931025.png	2024-11-04 02:55:00	ETtoday新聞雲
tw	https://www.ctee.com.tw/news/20241104700034-439901	美國大選＋FOMC會議本周登場台股11月迎5大利多- 日報 - 工商時報	本周是全球對議題關注度最集中的一周，眾所矚目的美國總統大選與FOMC會議將陸續登場，法人表示，無論是誰勝選，預期台股皆會呈現緩步墊高格局，本周有望朝10月28日的跳空缺口約23,164點邁進，支撐可先看8月第一波反彈高點22,500點左右。 在匯市方面，匯銀主管強調，美國在大選後市場應會震盪加劇，也...	https://images.ctee.com.tw/newsphoto/2024-11-04/1024/A01AA1_PictureItem_Clipping_01_4.jpg	2024-11-03 19:00:00	工商時報
