country_code	url	title	description	image_url	publish_date	source
tw	https://ctinews.com/news/items/4bnb7y2DWP	調查局1500人群組爆余正煌前主任傳霸凌還升官 法務部長剩6天回覆 - 中天新聞網	勞動部勞動力發展署北分署員工疑遭長官霸凌而輕生，行政院長卓榮泰昨要各部會一週內查清職場霸凌事件。國民黨立委徐巧芯今（21日）質詢時爆料，曾有霸凌紀錄的調查局前新竹市調站主任林維成，調離主管職後仍有霸凌行為，卻還被圈選為輔導員、傳要高升副處長，調查局1500人的群組都在罵，要法務部重啟調查，6天內回覆。	https://storage.ctinews.com/compression/files/default/cut-1732171034-dI0ZNiQ.webp	2024-11-21 06:45:00	中天新聞網
tw	https://sports.ltn.com.tw/news/breakingnews/4871146	12強》台灣歷史勝投王張奕再繳好投！坦言被球迷應援震撼：體力哪來的 - 自由時報	台灣今在12強複賽以0：2不敵委內瑞拉，不過投手群表現依舊亮眼，其中參加過2屆12強賽事的張奕，今天登板1.1無失分，他在退場時也特別把球丟給看台的球迷並揮手致意，賽後他也再度向球迷的加油聲致謝。張奕在本屆12強預賽就拿下2次勝投，連同2019年的2勝，累積4勝	https://img.ltn.com.tw/Upload/sports/page/800S/2024/11/21/phpOGUm0j.jpg	2024-11-21 10:40:00	自由時報
tw	https://tw.news.yahoo.com/%E6%B5%AA%E8%B2%BB%E9%8C%A2-%E8%97%A5%E5%B8%AB%E6%9B%9D-%E4%B8%8D%E5%90%833%E9%A1%9E%E4%BF%9D%E5%81%A5%E9%A3%9F%E5%93%81-%E7%B6%9C%E5%90%88%E7%B6%AD%E4%BB%96%E5%91%BD%E4%B9%9F%E4%B8%8A%E6%A6%9C-001944771.html	浪費錢！藥師曝「不吃3類保健食品」 綜合維他命也上榜 - Yahoo奇摩新聞	現代人長期習慣吃保健食品，不過，英國一名藥劑師透露自己「絕對不會吃」市面上販售的3種保健食品，例如維他命軟糖、綜合維他命、針對頭髮和皮膚指甲的保健食品。	https://s.yimg.com/ny/api/res/1.2/SoVT9Y6PtuMfYwRkvtKvhw--/YXBwaWQ9aGlnaGxhbmRlcjt3PTEyMDA7aD03OTU7Y2Y9d2VicA--/https://media.zenfs.com/ko/gotv_ctitv_com_tw_678/5d068959cb998ef6b74621116b4d7a81	2024-11-21 00:23:11	Yahoo奇摩新聞
tw	https://www.cna.com.tw/news/aopl/202411210021.aspx	北溪天然氣管線爆炸案調查結果德媒揭烏克蘭「直徑行動」混合戰真相| 國際 - 中央社即時新聞	波羅的海近日傳出2海底電纜遭切斷，引發國際關注。與此同時，2年前震驚全歐、導致德國能源危機的北溪天然氣管線爆炸案「混合戰」真相日漸浮現，明鏡週刊昨刊載調查結果與作案過程，精彩宛若電影情節。	https://imgcdn.cna.com.tw/www/webphotos/WebOg/600/20241121/2000x1050_474924314189.jpg	2024-11-21 00:47:00	中央社即時新聞
tw	https://money.udn.com/money/story/5710/8375566	輝達明年 GB300 傳導入新材料 CCL 三雄股價同步強漲收紅 | 集中市場 | 證券 - 經濟日報	市場傳出輝達（NVIDIA）明年 GB300 伺服器機板將升級採用新一代 M8 材料，法人看好，高階 銅箔基板（CCL ...	https://pgw.udn.com.tw/gw/photo.php?u=https://uc.udn.com.tw/photo/2024/11/21/2/30946822.jpg&s=Y&x=533&y=36&sw=693&sh=462&sl=W&fw=1050&exp=3600	2024-11-20 08:00:00	經濟日報
tw	https://news.google.com/rss/articles/CBMilgJBVV95cUxPRk4xR3JJcDFKUXNmUjhic0tsSVQ2M25zSWRnY0FIdXpZNl9BYm9PVjgtYkVDVGhCNVE2N04wOTVJZzFzMHZRek8xUU1aZnVmUWpldjFjZ2pUc2otY3h6WlNVMWtUNjN5S0F0eVFDbEpIMzI0ZjZRR29QbG1JUzR6U3pfMEZ3ZnNoY0VLWGpPTTd1WnRFU1BzQ0pILUxqaXZEREpMaUFvZ21vOTRWVVpKaTBCR0VOOWkzOHprc1RsVlk5SXJkVVZXTlFuWWhXLUNvWWlwcUYwdjRURnhDTDduWmVPbHJwVzA5Q0J3VFdJMmFCMk1mTVE4NVF0VWNUdmxtZk9FYVNsT0dCSXN1bm90WTc4ckpldw?oc=5	抽中一張賺8.4萬元 LINEPay新股申購11/25日開跑 - Yahoo奇摩股市	None	None	2024-11-21 09:18:09	Yahoo奇摩股市