country_code	url	title	description	image_url	publish_date	source
tw	https://tw.news.yahoo.com/%E9%BD%8A%E5%BB%B7%E6%B4%B9%E8%A2%AB%E8%AB%B7-%E9%9D%A0%E7%88%B8-%E9%99%B3%E6%96%87%E8%8C%9C%E6%8F%AD%E7%9C%9F%E7%9B%B8-%E9%83%AD%E8%91%A3%E5%87%BA%E6%89%8B%E5%8A%A9%E9%82%84%E9%BD%8A%E6%9F%8F%E6%9E%97%E5%8D%83%E8%90%AC%E6%AC%A0%E5%82%B5-003149730.html	齊廷洹被諷「靠爸」 陳文茜揭真相：郭董出手助還齊柏林千萬欠債 - Yahoo奇摩新聞	即時中心／周欣儀報導已故導演齊柏林兒子齊廷洹透露日前受邀至苗栗上台演講前，卻發生該活動承辦人疑似傳錯訊息「靠老爸的餘蔭吃一輩子」，讓齊廷洹覺得受到汙辱而離開。而資深媒體人陳文茜也透過臉書透露，曾在7年前為齊家發起募款，當時齊柏林身故約有6000萬債務，陳文茜也找到鴻海集團創辦人郭台銘，郭台銘出手3000萬，並強調「這筆錢希望能交給齊媽媽，而不是孩子」，確保2老能安享晚年。	None	2024-10-17 07:00:00	Yahoo奇摩新聞
tw	https://www.ettoday.net/news/20241017/2836658.htm	好天氣到明天！鋒面東北季風接力北東濕涼 2波降溫時間曝 - ETtoday新聞雲	天氣風險公司天氣分析師歐宗學指出，今天東北季風減弱，西半部大致多雲到晴，午後山區有零星短暫陣雨，明天各地仍是多雲到晴，周六鋒面及東北季風影響，基隆北海岸及東北部下雨時間長且較明顯，下周二晚間新一波的東北季風南下，北部、東半部又會轉陰雨，氣溫再降低1至2度。	https://cdn2.ettoday.net/images/6629/e6629088.jpg	2024-10-17 01:25:00	ETtoday新聞雲
tw	https://news.google.com/rss/articles/CBMiU0FVX3lxTE02RXl3WHQwT0VkY0NOb3NoWmstaFpTaWg3a2UzT0paQXAwZmMwd0NIdkY2eC1SNjdFWGU3ajE2dUF0TFgyNzVoRU9iNHpXUTd3d3Bj?oc=5	北市2立委危險了！傳上榜「獵殺名單」郭正亮斷言：罷免機率高 - TVBS	None	None	2024-10-17 00:36:00	TVBS
tw	https://www.cna.com.tw/news/aipl/202410170159.aspx	南非要求我代表處10月底前遷出首都外交部不排除反制| 政治 - 中央社即時新聞	知情人士今天表示，南非政府在駐南非代表處7日舉辦國慶酒會當天，要求駐館遷出首都普勒托利亞，並威脅「倘若不從就關閉代表處」；外交部長林佳龍已指示研議反制措施，不排除要求南非駐台辦事處遷出台北。	https://imgcdn.cna.com.tw/www/webphotos/WebCover/800/20241017/882x661_69218303763.jpg	2024-10-17 06:24:00	中央社即時新聞
tw	https://www.setn.com/News.aspx?NewsID=1548982	威力彩今飆4.9億！4星座4生肖財運爆棚 下注吉時方位曝光 - 三立新聞網 Setn.com	連槓22期的威力彩今（17）日晚間將再度開獎，頭獎上看4.9億，讓許多人躍躍欲試。對此，清水孟國際塔羅小孟老師也列出財運最旺的4星座和4生肖並曝光下注吉時，榜上有名的你不妨買一張彩券試試手氣。	https://attach.setn.com/newsimages/2023/01/13/4002830-PH.jpg	2024-10-16 22:31:00	三立新聞網 Setn.com
tw	https://udn.com/news/story/7323/8295836	新北議會爆衝突 議員罵主席「無能」 主席回嗆「無恥」 - 聯合新聞網	新北市議會今舉行二、三審各機關聯合業務報告及質詢，民進黨新北市議員陳永福質詢新烏路到安坑交流道道路開闢進度，他不滿市府今...	https://pgw.udn.com.tw/gw/photo.php?u=https://uc.udn.com.tw/photo/2024/10/16/realtime/30726913.jpg&s=Y&x=43&y=0&sw=1203&sh=802&exp=3600	2024-10-16 07:47:39	聯合新聞網
tw	https://www.ctee.com.tw/news/20241017700226-439901	京元電等15檔爆量大漲航空雙雄外資買超破萬張- 日報 - 工商時報	15檔尾盤爆量強勢股半導體設備廠ASML財報爆雷，半導體股應聲重挫，三大法人齊賣366億餘元，外資更提款340.8億元，外資逆勢加碼強勢股包括京元電子（2449）、華航（2610）、長榮航（2618）及緯創（3231）等15檔，股價表現強勢，成資金避風港。 受到美國擴大限制出口，中國大陸的訂單下滑等...	https://images.ctee.com.tw/newsphoto/2024-10-17/1024/A26AB2_PictureItem_Clipping_02_5.jpg	2024-10-16 19:00:00	工商時報
tw	https://udn.com/news/story/7003/8297501	TPBL／只有他敢發言！林書豪：感謝P讓我重燃對籃球熱情 - 聯合新聞網	TPBL例行賽將在本周末火熱開打，新北國王隊周六下午5點迎來首戰，客場對決高雄全家海神隊。國王當家球星林書豪昨天在個人社群發文，向PLG道別。

由於國內職籃兩聯盟今夏歷經從合併到再度分裂，結果反	https://pgw.udn.com.tw/gw/photo.php?u=https://uc.udn.com.tw/photo/2024/10/17/0/30731225.jpg&s=Y&x=0&y=108&sw=1280&sh=853&exp=3600	2024-10-17 03:23:04	聯合新聞網