country_code	url	title	description	image_url	publish_date	source
tw	https://www.cna.com.tw/news/aloc/202411200005.aspx	北市和平新生天橋落地走入歷史 護橋團體要求取回私物 - 中央社即時新聞	北市拆除和平新生天橋，南側橋面約今天凌晨1時30分左右被切割完成並落地，護橋團體一度大喊「把橋放回去」，並說還有許多與民眾共同創作的物品在橋上，應該還回來。	https://imgcdn.cna.com.tw/www/webphotos/WebOg/600/20241120/1200x630_148012599546.jpg	2024-11-19 18:50:00	中央社即時新聞
tw	https://udn.com/news/story/7320/8371772	奇蹟生還！宜蘭古魯林道找手機登山客 失聯近3天存活 - 聯合新聞網	新北55歲鍾姓男子16日隨山友到宜蘭大同鄉寒溪村古魯林道爬山，17日上午找手機脫隊失聯，宜蘭縣消防局等搜救單位連續搜救3...	https://pgw.udn.com.tw/gw/photo.php?u=https://uc.udn.com.tw/photo/2024/11/20/realtime/30936883.jpg&s=Y&x=0&y=17&sw=960&sh=640&exp=3600	2024-11-20 01:29:08	聯合新聞網
tw	https://www.cna.com.tw/news/asoc/202411200090.aspx	柯文哲稱被開價2億美元當副手 北檢查無不法簽結【獨家】 - 中央社即時新聞	民眾黨主席柯文哲競選總統時，稱有人喊價2億美元要他當副手，喊價者遭告發違反總統副總統選罷法。北檢認為，全案除柯文哲說法，查無其他證據證明有人喊價，因查無不法事證，已於今年簽結。	https://imgcdn.cna.com.tw/www/webphotos/WebCover/800/20241120/1007x755_551755567132.jpg	2024-11-20 03:29:00	中央社即時新聞
tw	https://tw.sports.yahoo.com/news/12%E5%BC%B7%E3%80%8B%E3%80%8C%E9%87%8E%E7%90%83%E7%95%99%E5%AD%B8%E3%80%8D%E7%B6%93%E9%A9%97%E5%8F%97%E5%88%B0%E5%A4%96%E5%AA%92%E9%97%9C%E6%B3%A8-%E9%99%B3%E5%82%91%E6%86%B2%EF%BC%9A%E3%80%8C%E8%AC%9D%E8%AC%9D%E9%82%A33%E5%B9%B4%E8%AE%93%E6%88%91%E7%8F%BE%E5%9C%A8%E8%83%BD%E4%BB%A3%E8%A1%A8%E5%8F%B0%E7%81%A3%E5%87%BA%E8%B3%BD%E3%80%8D-105329289.html	12強》「野球留學」經驗受到外媒關注 陳傑憲：「謝謝那3年讓我現在能代表台灣出賽」 - Yahoo奇摩運動	中華隊隊長陳傑憲今天（20日）在2024年第三屆世界12強棒球錦標賽複賽的賽前記者會受到外媒高度關注，陳傑憲也在記者會上大方分享過去在日本的留學經驗，「謝謝過去高中3年留學經驗，如果沒那些經驗，或許現在的我不會在這記者會，代表台灣出賽。」	https://s.yimg.com/ny/api/res/1.2/MokO0QMErt24nwrogI6UeQ--/YXBwaWQ9aGlnaGxhbmRlcjt3PTEyMDA7aD04MDA7Y2Y9d2VicA--/https://s.yimg.com/os/creatr-uploaded-images/2024-11/5a021750-a730-11ef-bdd7-aae8ece99e78	2024-11-20 10:53:29	Yahoo奇摩運動
tw	https://tw.sports.yahoo.com/news/%E7%B6%B2%E7%90%83-%E5%86%8D%E8%A6%8B%E4%BA%86%E8%A0%BB%E7%89%9B-%E8%A5%BF%E7%8F%AD%E7%89%99%E4%B8%8D%E6%95%B5%E8%8D%B7%E8%98%AD%E6%AD%A2%E6%AD%A5-%E7%B4%8D%E9%81%94%E7%88%BE%E5%91%8A%E5%88%A5%E6%88%B0%E8%90%BD%E6%95%97%E5%90%AB%E6%B7%9A%E8%AC%9D%E5%B9%95-011300170.html	網球／再見了蠻牛！西班牙不敵荷蘭止步 納達爾告別戰落敗含淚謝幕 - Yahoo奇摩運動	坐擁22座大滿貫賽金盃的西班牙網球名將納達爾（Rafael Nadal）台灣時間20日凌晨與西班牙隊友們出戰台維斯盃，這也是他職業生涯最終戰，8強賽面對荷蘭，納達爾先發上陣，面對范德贊德舒爾普最終在拚戰二盤後落敗，「小蠻牛」艾卡拉茲（Carlos Alcaraz）雖然拿下第2點，但第4點雙打西班牙兩盤戰到搶七落敗，確定1：2無緣晉級，納達爾在遺憾中結束自己的最後一舞。	https://media.zenfs.com/ko/setn.com.tw/bf0644d10ef20e570131611ed6400cb9	2024-11-20 01:18:57	Yahoo奇摩運動
tw	https://sports.ltn.com.tw/news/breakingnews/4869412	12強》「現在交手台灣隊10次會輸6場」南韓名將讚賞台灣棒球的銳變 - 自由時報	世界棒球12強賽B組預賽，南韓隊在預賽先後敗給台灣隊、日本隊，最後交出3勝2敗的成績排小組第三無緣複賽，台灣隊、日本隊則是挺進複賽。現年55歲的南韓名將梁埈赫在自己的YouTube頻道上直言，若南韓隊現在與台灣隊交手10場，南韓隊可能會輸掉6場。	https://img.ltn.com.tw/Upload/sports/page/800S/2024/11/20/php8jV1EH.jpg	2024-11-20 06:29:00	自由時報
tw	https://tw.stock.yahoo.com/news/%E7%83%8F%E5%85%8B%E8%98%AD%E4%B8%80%E5%B0%84%E9%A3%9B%E5%BD%88%EF%BC%81%E9%BB%83%E9%87%91%E5%AD%98%E6%91%BA%E7%99%BB%E4%B8%80%E5%91%A8%E9%AB%98%E9%BB%9E%E8%8B%A6%E4%B8%BB%E7%8D%B2%E5%88%A9%E5%9B%9E%E8%A3%9C%E8%BF%91%E8%90%AC%E5%85%83-021323945.html	烏克蘭一射飛彈！黃金存摺登一周高點…苦主獲利回補近萬元 - Yahoo奇摩股市	烏克蘭向俄羅斯發射飛彈，俄烏戰升溫，台銀黃金存摺每公克2766元，創一周高點。去年底砸20萬元買100公克的投資人，因受到「川普行情」等利空因素影響，帳上曾一度蒸發近2萬元，如今隨金價回升，短短五天回補近萬元，鬆了口氣。	https://s.yimg.com/ny/api/res/1.2/vAiihyS408rItnu.eChyrw--/YXBwaWQ9aGlnaGxhbmRlcjt3PTEyMDA7aD03OTg7Y2Y9d2VicA--/https://s.yimg.com/os/creatr-uploaded-images/2024-06/b6c13400-2740-11ef-b977-2b0c4220b523	2024-11-20 02:13:28	Yahoo奇摩股市
tw	https://sports.ettoday.net/news/2858917	古林睿煬轉戰日職火腿 統一獅舉辦歡送會 - ETtoday運動雲	古林睿煬在2018年季中新人選秀會獲得統一7-ELEVEn獅指名，開啟職棒生涯，2021年起成為獅隊重要本土先發一員，去年杭州亞運繳出亮眼成績，今年球季古林睿煬顯著成長，無論在球技、心態更趨穩定，本季10勝2敗，防禦率1.66，奪下聯盟防禦率王與年度最有價值球員。	https://cdn2.ettoday.net/images/7957/e7957989.jpg	2024-11-20 11:09:00	ETtoday運動雲
tw	https://www.ctee.com.tw/news/20241120700827-430201	中信金這句話吸引買盤搶進法人給出這個目標價- 證券 - 工商時報	中信金(2891)昨(19)日法說會上公司高層透露，今年前十月每股已賺超過3元，明年股利有機會達2元以上；由於現金殖利率有機會達5%以上，今(20)日中信金股價吸引買盤搶進，盤中漲幅逾3%，11點過後交易量已放大至近10萬張。法人認為，今年中信銀仍能提供穩定的收入，加上壽險子公司的獲利帶動，營運仍 ...	https://images.ctee.com.tw/newsphoto/2024-07-01/1024/20240701701718.jpg	2024-11-20 03:47:00	工商時報
tw	https://tw.news.yahoo.com/%E7%BE%8E%E8%B6%85%E5%BE%AE%E4%B8%8B%E5%B8%82%E8%AD%A6%E5%A0%B1%E6%9A%AB%E6%99%82%E8%A7%A3%E9%99%A4-%E6%89%BE%E5%88%B0%E6%96%B0%E6%9C%83%E8%A8%88%E5%B8%AB-%E4%BA%A4%E5%87%BA%E5%90%88%E8%A6%8F%E8%A8%88%E7%95%AB-ai%E5%A6%96%E8%82%A1%E7%9B%A4%E5%BE%8C%E5%A4%A7%E6%BC%B2%E8%BF%9140-031434348.html	美超微下市警報暫時解除！找到新會計師、交出合規計畫，AI妖股盤後大漲近40% - Yahoo奇摩新聞	伺服器大廠美超微解除下市危機露出一道曙光！公司於19日宣布已找到新的會計師事務所BDO USA，並提交了符合那斯達克上市要求的合規計畫。	https://media.zenfs.com/zh-tw/magazine.bnext.com.tw/8468aa7369fe8f520902eff60cf4b261	2024-11-19 09:27:27	Yahoo奇摩新聞
tw	https://news.tvbs.com.tw/life/2692796	LINE免費貼圖來了！「4實用爆款」限時載 這隱藏版永久用│TVBS新聞網 - TVBS	None	None	2024-11-20 12:07:00	TVBS