country_code	url	title	description	image_url	publish_date	source
tw	https://www.ctee.com.tw/news/20241020700398-431401	跑友怒了！台南趣味路跑領嘸完賽鑰匙圈、獎牌也發錯- 生活 - 工商時報	台南400「全民趣味路跑」20日清晨6點開跑，吸引近4400名跑者參賽，場面熱烈，不少跑者衝著完賽禮有咖波鑰匙圈而來，結果完賽卻發現根本領不到，只拿到毫不相關的鑰匙圈，另有跑者根本沒領到獎牌，甚至跑完8.8公里組的卻拿到3.5公里完賽獎牌，跑友抱怨「有被騙的感覺！」 此次全民趣味路跑結合分成8.8公...	https://images.ctee.com.tw/newsphoto/2024-10-20/1024/20241020700399.jpg	2024-10-20 03:57:00	工商時報
tw	https://www.ettoday.net/news/20241020/2838891.htm	15歲少年無照撞死3人 犯保士林分會出手了！派3律師助被害家屬 - ETtoday新聞雲	15歲曾姓少年在台北市無照駕車撞死3人案，犯保士林分會今天表示，指派專責律師任訴訟代理人，協助被害家屬進行後續刑、民事訴訟程序，確保家屬權益。

	https://cdn2.ettoday.net/images/7902/e7902068.jpg	2024-10-20 11:29:00	ETtoday新聞雲
tw	https://www.ettoday.net/news/20241020/2838726.htm	哈瑪斯領袖「攜家眷藏身地道」畫面曝光 妻拎百萬柏金包 - ETtoday新聞雲	以軍19日公布一段哈瑪斯領袖辛瓦（Yahya Sinwar）的身影，就在2023年10月7日哈瑪斯入侵以色列大開殺戒的前一天，辛瓦帶了妻小躲進地道，帶著大量物資及個人物品前往藏身據點。依據以軍阿拉伯語媒體發言人阿德拉伊的說法，辛瓦妻子手拎的是愛馬仕柏金包，價值3.2萬美元（約新台幣102萬元）。	https://cdn2.ettoday.net/images/7907/e7907489.jpg	2024-10-20 06:28:00	ETtoday新聞雲
tw	https://www.ettoday.net/news/20241020/2838847.htm	俄羅斯派軍艦從北韓運兵 抓到證據了！南韓衛星拍攝「關鍵一幕」 - ETtoday新聞雲	自從烏克蘭媒體本月初揭露，烏克蘭東部頓涅茨克州俄軍占領區，包括6名北韓（朝鮮）軍官因受到烏軍飛彈攻擊而死亡的消息後，北韓向俄國派兵的消息便甚囂塵上，甚至還獲得烏克蘭總統澤倫斯基證實，南韓官方更披露北韓派遣精銳特種部隊1.2萬兵力赴俄，南韓政府更公開拍攝到的衛星影像。	https://cdn2.ettoday.net/images/7907/e7907958.jpg	2024-10-20 10:40:00	ETtoday新聞雲
tw	https://sports.ltn.com.tw/news/breakingnews/4836790	台灣大賽》兩場大巨蛋湧入7萬7596人 兄弟荷包賺飽飽 - 自由時報	台灣大賽獅象爭霸，昨天首戰開出4萬人滿座票房，今天第2戰也湧入3萬7596名球迷觀戰，主場球隊兄弟靠這兩場「大巨蛋財」，荷包賺飽飽，至於後天換統一獅在大巨蛋當主人，預售票已賣出1萬8000張。	https://img.ltn.com.tw/Upload/sports/page/800S/2024/10/20/phpI5VyG4.jpg	2024-10-20 11:58:00	自由時報
tw	https://www.cna.com.tw/news/aopl/202410210003.aspx	媒體識讀1／NHK追溯安洵外洩文件點名台灣分析中國認知戰操控輿論手段| 國際 - 中央社即時新聞	日本放送協會（NHK）製作系列報導探討中國發起的「認知戰」，記者走訪各國採訪，追蹤今年2月外流的安洵文件與各國遭受網攻。其中，台灣Dcard平台去年出現「台灣將引進10萬印度勞工」謠言，甚至升高到號召群眾上街陳情，被認為可能是中國「認知戰」炒作。	https://imgcdn.cna.com.tw/www/webphotos/WebOg/600/20241021/1280x672_692438350324.jpg	2024-10-20 16:46:00	中央社即時新聞
tw	https://www.ctee.com.tw/news/20241021700058-439901	PCB材料、設備商結盟搶神山大單- 日報 - 工商時報	PCB供應鏈切入半導體產業概況台積電預估2024年資本支出上看300億美元，2025年的資本支出可望超車今年，龐大資本支出猶如對半導體上下游供應鏈釋出新台幣近1兆元大單，吸引PCB材料廠、設備商加速切足半導體應用，結盟搶進台積電供應鏈成為顯學。 台積電日前召開法說會，預估2024年資本支出略高於30...	https://images.ctee.com.tw/newsphoto/2024-10-21/1024/A03AA3_PictureItem_Clipping_02_4.jpg	2024-10-20 19:00:00	工商時報
tw	https://news.tvbs.com.tw/world/2657369	美選倒數17天 知名預測鬼才：「這人」勝選機率高 - TVBS	None	None	2024-10-20 02:44:00	TVBS
tw	https://news.tvbs.com.tw/entertainment/2658007	世紀破冰！洪榮宏愛女結婚「2個爸爸牽她進場」催淚畫面全看哭 - TVBS	None	None	2024-10-20 23:58:00	TVBS
tw	https://www.ettoday.net/news/20241020/2838574.htm	大巨蛋4萬人散場「捷運手扶梯擠滿人」 1狀況議員嚇壞：超危險 - ETtoday新聞雲	中華職棒台灣大賽昨（19日）晚開打，首次在台北大巨蛋登場，中信兄弟首戰擔任主場球隊，進場人數確定4萬，刷新史上新高紀錄，然而，賽事結束後，散場過程中出現了安全疏失，台北市議員李明賢表示，人潮塞在捷運聯通道，人流一直被往下擠，直呼「實在非常危險」。

	https://cdn2.ettoday.net/images/7906/e7906960.jpg	2024-10-20 02:05:00	ETtoday新聞雲
tw	https://newtalk.tw/news/view/2024-10-20/940983	柯文哲稱「帳簿除了李文宗沒人看過」吳靜怡：他被當京華城案斷點| 政治 - Newtalk新聞	前台北市長、民眾黨主席柯文哲涉入京華城弊案遭羈押近2個月，另外先前被踢爆政治獻金申報不實，仍有許多疑點尚未釐清，對於柯文哲先前宣稱木可公關整本帳簿除了時任競總財務長李文宗「沒有人看過」，政治評論家吳靜怡直指「第一時間就露出馬腳，一副想脫罪的異狀。」並揭露，李文宗就是柯文哲從2020年開始在京華城案設	https://s.newtalk.tw/album/news/674/66b82e9977ae7.jpg	2024-10-20 02:55:29	Newtalk新聞
tw	https://www.chinatimes.com/realtimenews/20241020003584-260402	10億詐騙西班牙通緝犯「2度」驅逐出境 班機目的地保密 - 中時新聞網	涉犯詐騙案的國際通緝犯、西班牙籍男子奧納德（Salvador Alejandro Llinas Onate）19日遭我方驅逐出境後，不料新加坡卻拒絕入境並於20日清晨遣返回台，經過幾番折騰移民署終於在20日晚間再次將他送上飛機，結束一波	https://images.chinatimes.com/newsphoto/2024-10-20/656/20241020003585.jpg	2024-10-20 15:39:52	中時新聞網
tw	https://www.ettoday.net/news/20241020/2838843.htm	毒品糾紛惹殺機！台中豪宅26歲男遭凌虐致死 警逮4嫌到案 - ETtoday新聞雲	台中市七期某豪宅昨（19）日晚間發生命案，1名許姓男子與劉姓男子等4人有毒品、債務糾紛，劉男等人追債不成，昨晚約許男到台中，涉嫌將其拘禁並施暴致死，警方接獲報案，將劉男等人查緝到案，全案警方依妨害自由、殺人、毒品等罪移送台中地檢署偵辦。
	https://cdn2.ettoday.net/images/7907/e7907806.jpg	2024-10-20 09:08:00	ETtoday新聞雲
tw	https://tw.stock.yahoo.com/news/156%E8%90%AC%E4%BA%BA%E5%A4%B1%E6%9C%9B%EF%BC%81%E6%98%9F%E5%AE%87%E8%88%AA%E7%A9%BA%E6%8A%BD%E7%B1%A4%E5%AE%8C%E6%88%90%E4%B8%AD%E7%8D%8E%E7%8E%87%E6%8F%90%E9%AB%98%E5%88%B0248-%E7%B6%B2%E5%95%8F%E3%80%8C%E6%8A%BD%E4%B8%AD%E8%A6%81%E4%B8%8D%E8%A6%81%E8%B3%A3%EF%BC%9F%E3%80%8D%E5%88%86%E6%9E%90%E5%B8%AB%E7%B5%A6%E7%AD%94%E6%A1%88-020716725.html	156萬人失望！星宇航空抽籤完成中獎率提高到2.48% 網問「抽中要不要賣？」分析師給答案 - Yahoo奇摩股市	156萬人失望！星宇航空（2646）抽籤今（21）天早上完成，因12萬件不合格，中獎機率提高到2.48%，但仍有156萬人沒抽中，花20元手續費「買了一個希望」。星宇不需「再撐現增價」今股價下跌失守31元關卡，一度跌到30.9元。新股將於10月25日撥券，沒抽中的22日還款。已有抽中網友在社群中分享中獎好消息，並詢問「抽中要不要賣？」資證證券分析師王兆立給答案。要不要賣？」資證證券分析師王兆立給答案。	https://s.yimg.com/ny/api/res/1.2/x9GwcyoojLmKtouMheiyaA--/YXBwaWQ9aGlnaGxhbmRlcjt3PTEyMDA7aD04MDA7Y2Y9d2VicA--/https://s.yimg.com/os/creatr-uploaded-images/2024-01/0a9109d0-b5cb-11ee-a6fe-70de4b1b9d87	2024-10-21 02:07:26	Yahoo奇摩股市
tw	https://news.ebc.net.tw/news/living/449280	逢甲夜市沒落有前兆？他買車輪餅 被老闆一舉動惹怒：不意外 - 東森新聞	有網友接著話題指出，10年前在逢甲夜市排隊買車輪餅時，老闆一舉動讓他一直到現在仍耿耿於懷，直言「夜市就是被他們玩壞的」。	https://img.news.ebc.net.tw/EbcNews/news/2024/10/20/1729462960_50248.jpg	2024-10-20 14:45:00	東森新聞
tw	https://udn.com/news/story/7266/8305287	氣象署：潭美颱風今可能生成 周四北轉是關鍵不排除發海警 - 聯合新聞網	熱帶性低氣壓TD24昨天下午生成，中央氣象署預報員趙竑上午指出，最快今天可增強為今年第20號颱風「潭美」，如果24日（周...	https://pgw.udn.com.tw/gw/photo.php?u=https://uc.udn.com.tw/photo/2024/10/21/realtime/30754213.png&s=Y&x=0&y=7&sw=956&sh=636&exp=3600	2024-10-21 03:00:21	聯合新聞網
tw	https://tw.news.yahoo.com/%E5%99%81%E7%88%86-%E7%9F%A5%E5%90%8D%E9%80%A3%E9%8E%96%E7%81%AB%E9%8D%8B-%E8%8F%9C%E7%9B%A4%E7%96%91%E6%9C%89%E8%80%81%E9%BC%A0%E5%B1%8E-%E5%AE%A2%E5%B4%A9%E6%BD%B0-%E6%8F%9B%E4%BA%86%E4%B9%9F%E4%B8%8D%E6%95%A2%E5%90%83-001138965.html	噁爆！知名連鎖火鍋「菜盤驚見老鼠屎」 客崩潰：換了也不敢吃 - Yahoo奇摩新聞	又爆食安問題！一位民眾近日到新北市新莊區某知名連鎖火鍋餐廳用餐，怎料上菜時竟發現菜盤中有一點一點的黑色痕跡，疑似是老鼠屎，即便服務人員表明可換菜盤他仍嚇壞，直呼「誰還敢吃！」	https://media.zenfs.com/ko/news_tvbs_com_tw_938/9a71ce43e695c43e65574093d571da1c	2024-10-21 00:29:37	Yahoo奇摩新聞
tw	https://tw.news.yahoo.com/%E5%BF%AB%E8%A8%8A-%E5%AE%89%E5%85%A8%E5%B8%BD%E9%83%BD%E7%A2%8E%E4%BA%86-%E6%9D%BF%E6%A9%8B24%E6%AD%B2%E7%84%A1%E7%85%A7%E7%94%B7%E9%A8%8E%E8%BB%8A%E5%87%BA%E4%BA%8B-%E9%9B%99%E8%BC%89%E9%84%B0%E8%BB%8A%E9%81%AD%E6%B3%A2%E5%8F%8A-%E7%94%B7%E6%AD%BB%E5%A5%B3%E5%82%B7-003858434.html	快訊/安全帽都碎了！板橋24歲無照男騎車出事 雙載鄰車遭波及「男死女傷」 - Yahoo奇摩新聞	最新消息，據板橋分局指出，今（21日）清晨5點57分左右，在板橋區環漢路21號越道發生一樁死亡車禍，車禍發生後接獲通報旋即趕往處理，經查事發經過為24歲沒有駕駛執照的陳姓男子，當時騎車沿著環和路堤外便道往樹林方向行駛時，撞上同向行駛，由18歲蔡姓男子騎乘的機車，雙方都摔倒在地，被蔡男載著的17歲黃姓少女也摔倒受傷，但蔡男傷勢嚴重，因撞擊路邊燈桿當場已無呼吸心跳，經緊急送往亞東醫院急救，仍於清晨7點45分宣告不治，確切肇責歸屬仍在釐清，若有更進一步的消息，《中天新聞網》會為您持續掌握。	https://s.yimg.com/ny/api/res/1.2/_S06wDml9aeJonW6ssXYLQ--/YXBwaWQ9aGlnaGxhbmRlcjt3PTEyMDA7aD05MDA7Y2Y9d2VicA--/https://media.zenfs.com/en/gotv_ctitv_com_tw_678/3656537d79ca8ac8cd9d4e714ac98e0f	2024-10-21 00:43:37	Yahoo奇摩新聞
tw	https://tw.news.yahoo.com/%E5%BF%AB%E8%A8%8A-%E6%AC%A0%E8%96%AA%E9%A2%A8%E6%B3%A2%E9%9B%AA%E4%B8%8A%E5%8A%A0%E9%9C%9C-%E5%8F%B0%E4%B8%AD%E5%AE%A2%E9%81%8B%E5%81%9C%E8%BB%8A%E5%A0%B4-9%E8%BB%8A%E7%87%92%E6%AF%80%E7%81%AB%E8%AD%A6-%E6%98%AF%E5%9B%9B%E6%96%B9%E9%9B%BB%E5%B7%B4%E7%9A%84%E8%BB%8A-012029868.html	快訊/欠薪風波雪上加霜！ 台中客運停車場「9車燒毀火警」是四方電巴的車 - Yahoo奇摩新聞	最新消息，台中市北屯區今（21日）凌晨發生的客運停車場大火，共有9輛電動巴士付之一炬，雖無人傷亡但財損慘重，現在查出車輛都是日前發生欠薪風波，目前已停業的「四方電巴」公司所有。	https://media.zenfs.com/en/gotv_ctitv_com_tw_678/cf70f32ede50a49a0650a8bec6e2abfa	2024-10-21 01:25:50	Yahoo奇摩新聞
tw	https://udn.com/news/story/7325/8304051	追星擠爆合歡山 遊客撲空還被「武嶺7080」氣炸 - 聯合新聞網	全台瘋追「紫金山－阿特拉斯彗星」，合歡山武嶺成追星熱點，不時塞車擠得像「菜市場」。今清晨山區降雨起霧，遊客撲空，更出現超...	https://pgw.udn.com.tw/gw/photo.php?u=https://uc.udn.com.tw/photo/2024/10/20/realtime/30750292.jpg&s=Y&x=0&y=8&sw=1104&sh=736&exp=3600	2024-10-20 06:38:09	聯合新聞網
tw	https://udn.com/news/story/7001/8304505	中職／林祖傑第9棒奪MVP史上第6人 餅總：可愛安打、可愛贏球 - 聯合新聞網	統一獅隊今天以10：3擊敗中信兄弟隊，在總冠軍賽扳成1勝1敗，林祖傑今天不只當「守備皇帝」，還當「打擊皇帝」，攻守俱佳獲...	https://pgw.udn.com.tw/gw/photo.php?u=https://uc.udn.com.tw/photo/2024/10/20/realtime/30751871.jpg&s=Y&x=0&y=27&sw=3833&sh=2554&exp=3600	2024-10-20 13:12:43	聯合新聞網
tw	https://www.cna.com.tw/news/aopl/202410210007.aspx	烏克蘭調查：俄羅斯軍工仍見台灣產品含從中國流入| 國際 - 中央社即時新聞	一項烏克蘭調查指出，來自台灣的工具機、微電子產品、化學品、半導體及微電子產品生產工具等，在烏克蘭戰爭於2022年2月爆發後，仍流入俄羅斯軍工業，管道包括俄羅斯直接及途經第三地進口。	https://imgcdn.cna.com.tw/www/webphotos/WebCover/800/20241021/910x682_992043518379.jpg	2024-10-20 19:53:00	中央社即時新聞
tw	https://news.tvbs.com.tw/politics/2657410	迎接大放假時代？朝野擬拚修法「增國定假日」 每年有望多放10天 - TVBS	None	None	2024-10-20 03:42:00	TVBS
tw	https://www.chinatimes.com/realtimenews/20241020003031-260407?chdtv	川普1句話秀出兩岸底牌？郭正亮驚：我的天啊- 政治 - 中時新聞網	美國共和黨總統候選人川普表示，當選後，如果中共「進入」台灣，將對中國大陸課150%至200%關稅，川普被追問，會不會動用軍事力量來應對台灣被封鎖時，川普表示，「我不必這麼做，因為他（大陸國家主席習近平）尊重我	https://images.chinatimes.com/newsphoto/2024-10-20/1024/20241020003046.jpg	2024-10-20 11:04:04	中時新聞網
tw	https://tw.sports.yahoo.com/news/mlb%E5%AD%A3%E5%BE%8C%E8%B3%BD%E3%80%8B%E5%A4%A7%E8%B0%B7%E7%BF%94%E5%B9%B3%E9%9B%99%E5%AE%89%E5%8A%A9%E9%81%93%E5%A5%87%E6%99%89%E7%B4%9A%E4%B8%96%E7%95%8C%E5%A4%A7%E8%B3%BD-%E5%B0%8D%E6%88%B0%E6%B4%8B%E5%9F%BA%E4%B8%8A%E6%BC%94%E5%8F%B2%E4%B8%8A%E7%AC%AC12%E5%BA%A6%E8%B1%AA%E9%96%80%E5%B0%8D%E6%B1%BA-032613020.html	MLB季後賽》大谷翔平雙安助道奇晉級世界大賽 對戰洋基上演史上第12度豪門對決 - Yahoo奇摩運動	MLB美國職棒大聯盟季後賽國聯冠軍賽G6，道奇在大谷翔平貢獻雙安、1打點，以及Tommy Edman、Will Smith各貢獻2分砲之下，終場以10比5、系列賽4比2淘汰大都會，晉級世界大賽對決美聯豪門球隊紐約洋基 ，首戰將在台灣時間10月26日進行。	https://s.yimg.com/ny/api/res/1.2/1khLTcRHYbXbw_7bQME_RQ--/YXBwaWQ9aGlnaGxhbmRlcjt3PTEyMDA7aD04MDA7Y2Y9d2VicA--/https://s.yimg.com/os/creatr-uploaded-images/2024-10/0f7c5a00-8f53-11ef-b5fa-fb758d820ac7	2024-10-21 03:33:45	Yahoo奇摩運動
tw	https://udn.com/news/story/6656/8305487	蔡壁如「證實」柯文哲看柯爸 陳智菡：諸多錯誤須澄清 - 聯合新聞網	民眾黨主席柯文哲申請戒護探視，18日傍晚到醫院探視住在加護病房的父親。民眾黨前立委蔡壁如昨天說柯文哲在探視前就看過柯爸的...	https://pgw.udn.com.tw/gw/photo.php?u=https://uc.udn.com.tw/photo/2024/10/21/realtime/30754856.jpg&s=Y&x=0&y=26&sw=3500&sh=2332&exp=3600	2024-10-21 04:04:44	聯合新聞網
tw	https://udn.com/news/story/6656/8305301	卓榮泰「點菜說」民眾黨團批角色錯亂 滿口幹話 - 聯合新聞網	立法院長韓國瑜今天下午將第三度召集朝野協商總預算案付委事宜，行政院長卓榮泰昨天深夜拋出「點菜說」增添變數。民眾黨立法院黨...	https://pgw.udn.com.tw/gw/photo.php?u=https://uc.udn.com.tw/photo/2024/10/21/realtime/30754254.jpg&s=Y&x=0&y=25&sw=2500&sh=1666&exp=3600	2024-10-21 03:06:22	聯合新聞網
tw	https://udn.com/news/story/7266/8303539	5縣市豪雨特報！恐一路下到晚上 - 聯合新聞網	中央氣象署上午針對宜蘭等5縣市發布豪雨特報，恐一路下到晚上。	https://pgw.udn.com.tw/gw/photo.php?u=https://uc.udn.com.tw/photo/2024/10/20/realtime/30748384.jpg&s=Y&x=0&y=0&sw=2443&sh=1629&exp=3600	2024-10-20 00:59:48	聯合新聞網
tw	https://udn.com/news/story/124246/8303270	藍提修法提高釋憲門檻 司法院反對：實質剝奪憲法法庭權限 - 聯合新聞網	國民黨立委翁曉玲提案修正憲法訴訟法，主張大法官「現有總額」為憲法增修條文第五條所定大法官人數，即十五位。不過，司法院在給...	https://pgw.udn.com.tw/gw/photo.php?u=https://uc.udn.com.tw/photo/2024/09/20/realtime/30566501.jpg&s=Y&x=228&y=0&sw=3576&sh=2385&exp=3600	2024-10-19 18:49:38	聯合新聞網
tw	https://www.ftvnews.com.tw/news/detail/2024A19W0100	蔡英文比利時逛大街「遭鏡反射真實模樣」！68歲狀態震撼網：KPOP女團 - 民視新聞網FTVn	政治中心／曾郁雅報導台灣前總統蔡英文5月卸下總統身分之後，除了好好給自己一段放空時光之外，也多次代表台灣出席活動，近期更飛往歐洲與台灣友好民主國家交流過往經驗，終於來到旅程最後一站比利時的蔡英文，在個人IG帳號PO出一段短片曝光海外最新身影，其中一幕街道落地窗反射蔡英文路過英姿，就讓不少網友瘋狂留言大讚：「真的好喜歡&.....	https://cdn.ftvnews.com.tw/manasystem/FileData/News/23a748b7-b17b-4c4e-9349-dd378b84adfa.jpg	2024-10-19 10:57:36	民視新聞網FTVn
tw	https://tw.news.yahoo.com/%E5%9C%9F%E7%9F%B3%E6%B5%81%E7%81%8C%E9%80%B2%E9%87%91%E5%B1%B1%E9%9D%88%E9%AA%A8%E5%A1%94-%E8%8B%A6%E4%B8%BB%E6%8F%AD%E7%8F%BE%E5%A0%B4%E6%85%98%E6%B3%81-%E6%82%B2%E5%96%8A-%E7%88%B8%E7%88%B8%E4%B8%8D%E7%9F%A5%E8%A2%AB%E6%B7%B9%E6%B2%92%E5%9C%A8%E5%93%AA-063043439.html	土石流灌進金山靈骨塔！苦主揭現場慘況 悲喊：爸爸不知被淹沒在哪 - Yahoo奇摩新聞	[周刊王CTWANT] 原PO在網路論壇Dcard發文，「在前幾天（10／15）家人看到新聞報導說，過世的爸爸所在的靈骨塔遭受到土石流，在當下電話聯絡不上，不知道爸爸的骨灰罈是不是有受創。經過家人討論，隔日出發前往金山的蓬萊陵園，到了現場看，寶塔受損比想像比圖片嚴重，外道路也多處坍塌」。女...	https://media.zenfs.com/ko/ctwant_com_582/94fb54669d6335e656e9e7cca291336c	2024-10-20 11:04:02	Yahoo奇摩新聞
tw	https://news.tvbs.com.tw/life/2658088	麥當勞送網紅《獵人》全套卡包遭炎上！鐵粉氣炸：直接滅火 - TVBS	None	None	2024-10-21 02:12:00	TVBS
tw	https://www.chinatimes.com/newspapers/20241021000353-260118	中東駐台3代表挨告險釀外交危機- 政治要聞- 中國時報 - 中時新聞網	「阿拉伯在台商務協會」（ACCT）為內政部登記的非政府組織，但該商會在社交媒體卻使用沙烏地阿拉伯、阿曼與約旦等國旗作為標誌，沙國等駐台代表擔心造成混淆、誤導及矇騙疑慮，要求ACCT撤除國旗，反被ACCT提告損害名	None	2024-10-20 20:10:00	中時新聞網
tw	https://newtalk.tw/news/view/2024-10-20/940980	民眾黨黨工沒領到340萬？柯文哲競總遭爆浮報員工薪資陳智菡認了| 政治 - Newtalk新聞	民眾黨主席柯文哲涉入京華城弊案遭羈押近2個月，民眾黨仍持續被外界踢爆政治獻金申報不實。前民眾黨新竹縣黨部執行長林冠年爆料柯文哲競選總統的政治獻金申報資料有助理被浮報薪資，網紅「四叉貓」劉宇席進一步揭露吹哨者沒領到的錢約340萬5200元並質問「這些錢哪裡去了？為什麼最後總帳還能做到平？」四叉貓在臉書	https://s.newtalk.tw/album/news/912/65e8396dab328.jpg	2024-10-20 01:15:44	Newtalk新聞
tw	https://www.ettoday.net/news/20241021/2838974.htm	快訊／美國、加拿大軍艦「昨穿越台灣海峽」 畫面曝光 - ETtoday新聞雲	美軍第7艦隊（位於日本神奈川縣橫須賀市）20日表示，美國與加拿大的軍艦昨天聯袂穿越台灣海峽。日媒指出，中國加強對台灣進行軍事施壓，美加軍艦穿越台海，目的在於牽制中國。

	https://cdn2.ettoday.net/images/7908/e7908163.jpg	2024-10-21 00:09:00	ETtoday新聞雲
tw	https://www.setn.com/News.aspx?NewsID=1550837	再丟新證據？陳時奮嗆凌濤「沒看過如此狡猾的抄襲者」：別怪我出手太重 - 三立新聞網 Setn.com	旅美學者陳時奮（翁達瑞）昨（19）日深夜爆料，指出國民黨智庫副執行長、桃園市議員凌濤就讀交大研究所時撰寫的論文疑似大量抄襲，靠作弊取得學歷。凌濤隨即反擊「拿舊聞來檢驗笑死人」、「歡迎跟陽明交大求證」，究竟是真是假引發各界關注。今（20）日午後，陳時奮又丟出新證據放話「別怪我出手太重」。	https://attach.setn.com/newsimages/2022/11/29/3941364-PH.jpg	2024-10-20 09:05:00	三立新聞網 Setn.com
tw	https://tw.news.yahoo.com/%E6%97%85%E5%AE%A2%E9%87%8F%E5%A4%A7%E6%B8%9B-%E5%9C%8B%E9%81%93%E5%AE%A2%E9%81%8B%E7%87%9F%E6%94%B6-%E6%9A%B4%E8%B7%8C42-%E5%8F%B0%E5%8C%97%E8%BD%89%E9%81%8B%E7%AB%992%E6%A8%93%E6%81%90%E6%88%90%E7%A9%BA%E5%9F%8E-073700777.html	旅客量大減！國道客運營收「暴跌42%」 台北轉運站2樓恐成空城 - Yahoo奇摩新聞	[FTNN新聞網]記者江佳蓉／綜合報導據公路局統計，國道客運去年載客量約為5209萬人次，與疫情前的8138萬人次相比，減少36%，總營收也從100億大幅跌至58億，減...	https://media.zenfs.com/ko/ftnn_com_tw_939/cab26e46b92dba66b050ad731f58a2a8	2024-10-20 07:37:00	Yahoo奇摩新聞
tw	https://www.ettoday.net/news/20241021/2839174.htm	獨／台中某高職學生重摔！「2樓看台區跑酷跳下」送醫搶救 - ETtoday新聞雲	台中市南區某高職今（21）日傳出驚悚意外，一名17歲高職男學生疑似在體育館內與同學打鬧，不明原因從二樓看台區「跑酷跳下」，導致該生當場重摔意識不清、頭部受傷。台中消防獲報後，立即出動2台救護車、5名消防員前往，緊急將人送往台中醫院治療搶救中。警方說，初步了解後該生並非墜樓意外，詳細過程仍待釐清。	https://cdn2.ettoday.net/images/7319/e7319109.jpg	2024-10-21 04:13:00	ETtoday新聞雲
tw	https://news.tvbs.com.tw/entertainment/2657461	吳慷仁缺席金鐘 直播看得獎瞬間「狂拭淚」虧導演更緊張 - TVBS	None	None	2024-10-20 05:37:00	TVBS
tw	https://tw.sports.yahoo.com/news/%E3%80%90mlb%E5%B0%88%E6%AC%84%E3%80%91%E5%A4%A2%E8%BF%B415%E5%B9%B4%E5%89%8D%E6%A6%AE%E6%99%AF%EF%BC%812009%E5%B9%B4%E7%B4%90%E7%B4%84%E6%B4%8B%E5%9F%BAvs%E4%BB%8A%E5%B9%B4%E6%B4%8B%E5%9F%BA%EF%BC%9F-011212334.html	【MLB專欄】夢迴15年前榮景！2009年紐約洋基vs今年洋基？ - Yahoo奇摩運動	紐約洋基連克堪薩斯皇家、克利夫蘭守護者，踩著美聯中區隊伍的墊腳石，前往世界大賽的殿堂，這是他們睽違15年，再度登上最終決戰舞台（上次是2009年，擊敗費城費城人），當年還是學生的球迷們，大多都已長為成人、步入社會洗鍊，漫漫等待恍如隔世，難怪大家都說：「長久支持一個球隊，需要有足夠的愛心和耐心。」實在是久違了（雖然還有其他球隊等更久…尤其「非豪門球隊」，畢竟大聯盟競爭相當激烈且殘酷）。	https://s.yimg.com/ny/api/res/1.2/8ORCKzhSNPP8KOYGpiXVcA--/YXBwaWQ9aGlnaGxhbmRlcjt3PTEyMDA7aD04NTY7Y2Y9d2VicA--/https://s.yimg.com/os/creatr-uploaded-images/2024-10/91d000c0-8f48-11ef-bc5f-a41a7c105540	2024-10-21 01:12:19	Yahoo奇摩運動
tw	https://www.chinatimes.com/realtimenews/20241020002274-260407?chdtv	柯文哲到底問吳宗憲什麼問題？ 當天同場的徐巧芯全說了- 政治 - 中時新聞網	資深媒體人黃暐瀚日前爆料，陷入京華城的民眾黨主席柯文哲，曾在搭機前往花蓮途中詢問檢察官出身的國民黨立委吳宗憲，被檢方扣押的USB是否能被破解，但遭吳否認，事後黃也為此道歉。國民黨立委徐巧芯透露，事發當天	https://images.chinatimes.com/newsphoto/2024-10-20/1024/20241020002313_20241020145227.jpg	2024-10-20 07:36:25	中時新聞網
tw	https://tw.sports.yahoo.com/news/%E4%B8%AD%E8%81%B7%E3%80%8B%E6%9E%97%E5%A8%81%E5%8A%A9%E5%BC%B7%E5%8B%A2%E5%9B%9E%E6%AD%B8%E8%81%B7%E6%A3%92%EF%BC%81%E5%87%BA%E4%BB%BB%E5%AF%8C%E9%82%A6%E6%82%8D%E5%B0%87%E5%89%AF%E9%A0%98%E9%9A%8A%E8%B2%A0%E8%B2%AC%E8%BE%B2%E5%A0%B4%E5%9F%B9%E8%A8%93-031053352.html	中職》林威助強勢回歸職棒！出任富邦悍將副領隊負責農場培訓 - Yahoo奇摩運動	富邦悍將球團21號透過新聞稿宣佈，將聘請執教經歷豐富的林威助教練，出任悍將球團副領隊一職，同時林威助將兼任悍將農場主管，負責統籌基地新秀之培訓重責，協助球隊厚植農場實力，林華韋領隊強調，「希望借重威助的長才，幫助悍將成為更具有競爭力的球隊。」	https://s.yimg.com/ny/api/res/1.2/Cf0gT7HKeG.MS2o4rHnDIg--/YXBwaWQ9aGlnaGxhbmRlcjt3PTEyMDA7aD02NzU7Y2Y9d2VicA--/https://s.yimg.com/os/creatr-uploaded-images/2024-10/be506ad0-8f58-11ef-afcf-c01ed20f059b	2024-10-21 03:56:15	Yahoo奇摩運動
