country_code	url	title	description	image_url	publish_date	source
tw	https://hk.news.yahoo.com/%E9%82%B1%E6%BE%A4%E7%94%9C%E8%9C%9C%E5%91%8A%E7%99%BD-%E4%BB%A5%E6%88%91%E5%A4%AA%E5%A4%AA%E7%82%BA%E6%A6%AE-%E8%B3%80%E8%A8%B1%E7%91%8B%E7%94%AF%E5%B0%81%E5%90%8E-075902537.html	邱澤甜蜜告白：以我太太為榮！賀許瑋甯封后 - Yahoo新聞	[NOWnews今日新聞]第59屆金鐘獎許瑋甯以《不夠善良的我們》拿下迷你劇集最佳女主角獎，繼去年《她和她的她》後，蟬聯后冠。許瑋甯在台上致詞還不忘感謝在家看轉播的老公邱澤，更說邱澤私下也偷偷發了很多...	https://media.zenfs.com/zh-tw/entertainment.nownews.hk/671cfa97a4be85b5be545d884cb7ad83	2024-10-20 07:59:02	Yahoo新聞
tw	https://sports.ltn.com.tw/news/breakingnews/4836938	國聯冠軍賽》道奇G6拚世界大賽門票！ MVP強打遭移出先發打線 - 自由時報	國聯冠軍賽G6今天登場，系列賽3：2領先的道奇將在主場力拚拿下世界大賽門票，不過MVP強打佛里曼（Freddie Freeman）礙於右腳踝傷勢，被移出先發打線。佛里曼在美國時間9月26日就遭遇右腳踝扭傷，季後賽至今都是帶傷上陣，但打擊狀態也受到影響，目前佛里曼	https://img.ltn.com.tw/Upload/sports/page/800S/2024/10/21/phpVCvATb.jpg	2024-10-21 00:07:00	自由時報
tw	https://tw.news.yahoo.com/%E5%A3%BD%E5%B1%B1%E5%8B%95%E7%89%A9%E5%9C%92-%E5%AD%94%E9%9B%80%E5%85%A8%E5%80%92%E5%9C%B0-%E5%9A%87%E5%A3%9E%E9%81%8A%E5%AE%A2-%E8%A2%AB%E7%96%91%E6%8E%9B%E4%BA%86-%E5%9C%92%E6%96%B9%E7%B7%8A%E6%80%A5%E7%99%BC%E8%81%B2-100024992.html	壽山動物園「孔雀全倒地」嚇壞遊客 被疑掛了！園方緊急發聲 - Yahoo奇摩新聞	[周刊王CTWANT] 壽山動物園方今日下午在IG公告，近日有遊客來通報園區鳥園的孔雀疑似「掛了」，全部倒地不起，非常擔心牠們的健康狀況；對此園方解釋，牠們不是集體罷工也不是生病，「只是舒服到一起日光浴，在享受生活啦！」非常感謝遊客們細心觀察。除此之外，園方也呼籲入園觀光的遊客們...	https://media.zenfs.com/zh-tw/ctwant_com_582/241ed7f4f5a4edd070963b0097e96234	2024-10-20 10:14:15	Yahoo奇摩新聞
tw	https://money.udn.com/money/story/5621/8303720	央行三條紅線 李同榮：這條一定爆、第八波打房來定了 - 經濟日報	央行總裁楊金龍日前在立院備詢表示，會滾動檢討第七波信用管制成效，並認同以房價是否修正、不動產放款集中度、不動產貸款金額等...	https://pgw.udn.com.tw/gw/photo.php?u=https://uc.udn.com.tw/photo/2024/10/20/realtime/30749066.jpg&x=0&y=0&sw=0&sh=0&sl=W&fw=1050&exp=3600	2024-10-20 02:55:52	經濟日報
tw	https://news.tvbs.com.tw/life/2658043	一包只要15元！全聯「1進口食材」大特價 婆媽瘋搶：月底救星 - TVBS	馬鈴薯口感綿密、營養價值豐富，還能完美融入各種風格料理，深受煮婦們喜愛。有網友分享，近日在全聯看到一款澳洲馬鈴薯，原價49元，現在特價只要15元，讓他嚇到驚呼「真是好運」。	https://cc.tvbs.com.tw/img/upload/2024/10/21/20241021090138-427bf0e4.jpg	2024-10-21 01:09:00	TVBS
tw	https://www.chinatimes.com/realtimenews/20241021001169-260410?chdtv	他中43億樂透當場退休！ 10年後近況曝光- 財經 - 中時新聞網	提起樂透，相信不少人都懷有一夕致富、立刻提前退休的夢想。而在英國倫敦，一名汽車維修員就是這樣的幸運兒！他在2014年只花了10英鎊（約新台幣406元）買樂透，就幸運抱回1.07億英鎊（約新台幣43.5億元）的大獎。10	https://images.chinatimes.com/newsphoto/2024-10-21/1024/20241021001174.jpg	2024-10-21 01:00:09	中時新聞網
tw	https://news.tvbs.com.tw/life/2657741	住6千元飯店 控沒給「一次性拖鞋」也無室內拖！飯店：配合政策 - TVBS	有民眾週六花6400元，入住墾丁知名親子飯店，但飯店沒有提供「一次性拖鞋」，也不提供可重複使用的室內拖鞋，最後消費者只好花100元買備品包，又多了一堆塑膠備品！飯店回應，今年10月開始，飯店就自主配合環保署政策，不再提供一次用備品。	https://cc.tvbs.com.tw/img/upload/2024/10/20/20241020174701-f416e2ec.jpg	2024-10-20 09:51:00	TVBS
tw	https://star.setn.com/news/1550679	金鐘慶功／《有生之年》橫掃6獎！林心如「從頭哭到尾」曝沒人找她演戲 - 娛樂星聞	今年大滿貫《有生之年》在第59屆金鐘獎橫掃等6項大獎，包括戲劇節目獎、男女主角獎、導演獎、男配角獎、最具潛力新人獎，19日深夜舉辦金鐘慶功宴，對此製作人林心如說心情非常開心，從謝展榮上台領獎，一直到最後楊貴媚、導演得獎，幾乎是從頭哭到尾。	https://attach.setn.com/newsimages/2024/10/20/4859106-PH.jpg	2024-10-20 04:06:31	娛樂星聞