country_code	url	title	description	image_url	publish_date	source
tw	https://udn.com/news/story/10930/8320061	成群坦克戰車深夜高雄「逛大街」 引民眾行注目禮搶拍 - 聯合新聞網	國軍地面部隊重大演習「長泰19號操演」今登場，將和中部裝甲586旅舉行聯兵旅對抗的南部機步333旅，昨深夜從高雄出發北上...	https://pgw.udn.com.tw/gw/photo.php?u=https://uc.udn.com.tw/photo/2024/10/28/realtime/30795013.jpg&s=Y&x=0&y=31&sw=4159&sh=2772&exp=3600	2024-10-27 23:29:00	聯合新聞網
tw	https://www.mirrormedia.mg/story/20241028edi035	解密「家寧頻道名稱內幕」 前學員公開服藥催眠過程：醫院給我注射大量排毒針 - 鏡週刊	網紅家寧近來拍片「行為」引發關注，不少網友猜測她因上心靈課程受到影響，而曾經是同校校友的孫生也特別發文關心，更意外釣到曾參加過同樣心靈課程的網友，一一解密課程內容。	https://v3-statics.mirrormedia.mg/images/ec207759-101e-4d0a-858c-e17e012fc28d-w1600.jpg	2024-10-28 14:38:38	鏡週刊
tw	https://tw.news.yahoo.com/%E6%96%B0%E5%8C%97%E5%A4%AA%E9%9B%A3%E5%BE%85-%E5%85%AC%E5%8B%99%E5%93%A1%E9%9B%A2%E8%81%B7%E7%8E%87-%E7%BC%BA%E9%A1%8D%E7%8E%87%E9%83%BD%E9%AB%98-074746398.html	新北太難待？ 公務員離職率、缺額率都高 - Yahoo奇摩新聞	中央近年成立許多新機關，吸走不少地方政府公務員，加上民間企業待遇提升，面臨雙邊搶人壓力，新北成為公務員流失重災區，新北人...	https://s.yimg.com/cv/apiv2/social/images/yahoo_default_logo-1200x1200.png	2024-10-28 07:47:46	Yahoo奇摩新聞
tw	https://sports.ltn.com.tw/news/breakingnews/4843470	世界大賽》山本由伸締造日本最強紀錄！ 賽後揭曉壓制洋基打線秘訣 - 自由時報	道奇在世界大賽G2以4：2擊敗洋基，系列賽2：0領先，日本先發強投山本由伸今主投6.1局僅失掉1分，繳出今年季後賽最新代表作，賽後記者會上，他也透露自己今天表現出色的原因。山本由伸此役只在3局上挨了索托（Juan Soto）一發陽春砲，之後連續解決洋基11位打者	https://img.ltn.com.tw/Upload/sports/page/800S/2024/10/27/phpUxz27Y.jpg	2024-10-27 05:12:00	自由時報
tw	https://udn.com/news/story/122629/8319626	硬調棒次等於自亂陣腳 洋基第三戰只能相信賈吉 - 聯合新聞網	季後賽前兩輪幾乎一路順風順水的洋基終於在世界大賽面臨背水一戰的巨大壓力。孰令為之？如果沒有總教練布恩（Aaron Boone）開幕戰最後一刻的連番爭議調度，大有機會在首戰告捷的洋基至少能與道奇戰成一比	https://pgw.udn.com.tw/gw/photo.php?u=https://uc.udn.com.tw/photo/2024/10/27/0/30794002.jpg&s=Y&x=0&y=0&sw=1280&sh=853&exp=3600	2024-10-27 23:00:00	聯合新聞網
tw	https://tw.stock.yahoo.com/news/world-gym%E8%AE%8A%E5%8F%B0%E7%81%A3%E5%93%81%E7%89%8C%EF%BC%81%E4%B8%96%E7%95%8C%E5%81%A5%E8%BA%AB-ky%E6%96%A5%E8%B3%87288%E5%84%84%E5%85%83%E6%94%B6%E8%B3%BC%E7%BE%8E%E5%9C%8B%E6%AF%8D%E5%85%AC%E5%8F%B8-%E6%8B%BF%E4%B8%8B%E5%85%A8%E7%90%83%E7%B6%93%E7%87%9F%E6%AC%8A-065238638.html	World Gym變台灣品牌！世界健身-KY斥資2.88億元收購美國母公司 拿下全球經營權 - Yahoo奇摩股市	世界健身-KY（2762）今（28）日宣布，已完成以900萬美元（約新台幣2.88億元）收購美國World Gym International（WGI）。此次收購不僅獲得World Gym品牌的全球經營權，還即時享有其271個國際據點的加盟權利金收入，預計將提升未來收入與淨利潤，此次收購的估值約為收益的7倍。世界健身-KY董事長暨總經理柯約翰（John Caraccio）表示，計畫明年展店15間、後年18間。	https://s.yimg.com/ny/api/res/1.2/KWoI5UhprS851ixTCQLl.Q--/YXBwaWQ9aGlnaGxhbmRlcjt3PTEyMDA7aD04NTA7Y2Y9d2VicA--/https://s.yimg.com/os/creatr-uploaded-images/2024-10/05b76c60-94f5-11ef-8f27-d914073fdd27	2024-10-28 06:52:38	Yahoo奇摩股市
tw	https://tw.news.yahoo.com/%E5%BC%B5%E5%BF%A0%E8%AC%80%E7%A4%BA%E8%AD%A6%E5%85%A8%E7%90%83%E5%8C%96%E5%B7%B2%E6%AD%BB-%E8%AC%9D%E9%87%91%E6%B2%B3-%E5%8F%B0%E7%A9%8D%E9%9B%BB%E9%80%86%E5%85%A8%E7%90%83%E5%8C%96%E5%8F%97%E7%9B%8A%E8%80%85-%E4%BE%9D%E6%AD%A4%E6%88%90%E7%A5%9E%E5%B1%B1-230649793.html	張忠謀喊「全球化已死」 謝金河點出台積電「追不上」的神山關鍵 - Yahoo奇摩新聞	護國神山台積電26日運動會，創辦人張忠謀伉儷進入會場，贏得全場歡呼，張忠謀兩次提出全球化已死，未來充滿挑戰。財訊傳媒董事長謝金河表示，台積電其實是逆全球化的受益者，以三星為鑑，最後的贏家只有技術門檻不斷拉高，而中國追不上，這是唯一生存之道，台積電能成為護國神山，關鍵也在這裡。	https://media.zenfs.com/ko/taisounds_com_380/e4adc83e522246c27b186bc552a793e7	2024-10-27 23:06:49	Yahoo奇摩新聞