country_code	url	title	description	image_url	publish_date	source
us	https://edition.cnn.com/2024/11/12/us/michigan-nazi-flags-anne-frank-theater/index.html	Demonstrators wave Nazi flags outside local theater performance of ‘The Diary of Anne Frank’ in Michigan - CNN	None	https://media.cnn.com/api/v1/images/stellar/prod/still-21117755-22792-338-still.jpg?c=16x9&q=w_800,c_fill	2024-11-12 14:41:00	CNN
us	https://www.bbc.com/news/articles/cpqd1rzw9r4o	COP29: Oil and gas 'gift of god', says host Azerbaijan president - BBC.com	Azerbaijan's president said countries should not be blamed for having fossil fuel reserves.	https://ichef.bbci.co.uk/news/1024/branded_news/14ff/live/df45e960-a0f4-11ef-99df-c9ce88d27eae.jpg	2024-11-12 13:54:01	BBC.com
us	https://edition.cnn.com/2024/11/12/us/laken-riley-killing-suspect-trial/index.html	Laken Riley killing: Judge to decide fate of undocumented migrant accused in student’s death that fueled political debate - CNN	None	https://media.cnn.com/api/v1/images/stellar/prod/still-21118657-1665221-7929999998-still.jpg?c=16x9&q=w_800,c_fill	2024-11-12 17:37:00	CNN
us	https://www.bbc.com/news/articles/ckgrkg02jz3o	Russian doctor jailed for five years over alleged Ukraine war remarks - BBC.com	Nadezhda Buyanova denied making the remarks and called the case absurd.	https://ichef.bbci.co.uk/news/1024/branded_news/ab61/live/3ff27af0-a10c-11ef-bdf5-b7cb2fa86e10.jpg	2024-11-12 17:15:22	BBC.com
us	https://www.nytimes.com/2024/11/12/health/robert-kennedy-jr-fda.html	Robert F. Kennedy Jr.’s FDA Wish List: Raw Milk, Stem Cells, Heavy Metals - The New York Times	Robert F. Kennedy Jr., one of President-elect Donald J. Trump’s advisers on health, is taking aim at the agency’s oversight on many fronts.	https://static01.nyt.com/images/2024/08/19/multimedia/00RFK-FDA-01/00RFK-FDA-01-facebookJumbo.jpg	2024-11-12 16:44:23	The New York Times
us	https://edition.cnn.com/2024/11/12/us/wisconsin-missing-kayaker-faked-death/index.html	A missing Wisconsin kayaker was initially believed to have drowned. Officials say he faked his own death - CNN	None	None	2024-11-12 20:32:00	CNN
us	https://thehill.com/homenews/campaign/4986331-pa-senate-race-recount/	Why DDHQ hasn’t called the Pennsylvania Senate race - The Hill	None	None	2024-11-12 18:22:00	The Hill
us	https://www.cbsnews.com/news/medicare-part-b-premium-2025-social-security/	Seniors will pay more for Medicare in 2025. Here's what to know. - CBS News	Medicare's Part B monthly premium is outpacing both inflation and Social Security's cost-of-living adjustment.	https://assets1.cbsnewsstatic.com/hub/i/r/2024/11/11/2b0170f6-41f5-46d1-984a-225b5449ab91/thumbnail/1200x630/c0e52bd57426baf6c891953d76795d2b/gettyimages-675764133-1.jpg?v=f619a2fc2fe5c36254958031a1f767d9	2024-11-11 20:47:00	CBS News
us	https://www.nytimes.com/2024/11/12/us/politics/trump-capitol-senate-thune-scott.html	As Congress Returns, Trump Casts a Long Shadow Over Capitol Hill - The New York Times	The president-elect is to visit Capitol Hill on Wednesday as Republican senators elect a majority leader. His staffing decisions are already depleting the narrow majority the G.O.P. expects in the House.	https://static01.nyt.com/images/2024/11/12/multimedia/12trump-transition-republican-leadership-elections-gtbq/12trump-transition-republican-leadership-elections-gtbq-facebookJumbo.jpg	2024-11-12 21:53:40	The New York Times
us	https://apnews.com/article/congress-senate-leadership-elections-house-trump-82730f474a365a0d6e6af78a84bceda7	Speaker Mike Johnson says Republicans are ‘ready to deliver’ on Trump’s agenda - The Associated Press	House Speaker Mike Johnson said Tuesday that Republicans are “ready to deliver” on President-elect Donald Trump’s mandate.	None	2024-11-12 21:18:00	The Associated Press
us	https://theconversation.com/3-reasons-why-a-trump-white-house-might-not-be-a-disaster-for-ukraine-in-fact-it-might-tighten-the-screws-on-russia-243227	3 reasons why a Trump White House might not be a disaster for Ukraine − in fact, it might tighten the screws on Russia - The Conversation Indonesia	Donald Trump has vowed to bring peace to Ukraine. But talk of a ‘deal’ has led to questions over Trump’s commitment to Kyiv.	https://images.theconversation.com/files/630954/original/file-20241108-15-ndffd3.jpg?ixlib=rb-4.1.0&rect=134%2C0%2C5407%2C2703&q=45&auto=format&w=1356&h=668&fit=crop	2024-11-12 13:47:24	The Conversation Indonesia
us	https://www.bbc.com/news/articles/c62l00g0k65o	Jack Teixeira: US airman sentenced to 15 years in prison - BBC.com	Teixeira leaked highly classified Pentagon documents to an online platform popular with gamers.	https://ichef.bbci.co.uk/news/1024/branded_news/f5b2/live/393adb20-a10d-11ef-9d70-9564a3cc52f2.jpg	2024-11-12 23:33:10	BBC.com
us	https://abcnews.go.com/US/wireStory/tennessee-fugitive-accused-killing-man-lying-bear-chase-115741512	Tennessee fugitive accused of killing a man and lying about a bear chase is caught in South Carolina - ABC News	None	None	2024-11-11 18:38:36	ABC News
us	https://www.politico.com/news/2024/11/12/rubio-news-triggers-maga-backlash-00189024	Rubio news triggers MAGA backlash - POLITICO	Some Trump diehards are holding out hope for Ric Grenell for the top foreign policy post.	https://static.politico.com/2f/3e/7f25eb194063a5d21ca6c76fe89d/https-delivery-gettyimages.com/downloads/2162458236	2024-11-12 17:08:21	POLITICO
us	https://apnews.com/article/explosion-louisville-business-kentucky-770141a93fc06e1a99028f5a9889d51d	Explosion at Kentucky business injures 11 workers, shatters windows in surrounding neighborhood - The Associated Press	At least 11 employees were taken to hospitals after an explosion at a Louisville, Kentucky, business that produces natural color for foods and drinks.	https://dims.apnews.com/dims4/default/e0c2322/2147483647/strip/true/crop/3924x2207+0+204/resize/1440x810!/quality/90/?url=https%3A%2F%2Fassets.apnews.com%2F08%2F3e%2Ff9c7ce085fad7b84a10ef47f9883%2F108f3b67bb564d50ae25bdf28054845c	2024-11-13 00:22:00	The Associated Press
us	https://edition.cnn.com/2024/11/12/politics/trump-picks-bill-mcginley-white-house-counsel/index.html	Trump picks Bill McGinley to serve as his White House counsel - CNN	None	https://media.cnn.com/api/v1/images/stellar/prod/gettyimages-99620523-restricted.jpg?c=16x9&q=w_800,c_fill	2024-11-13 00:11:00	CNN
us	https://abcnews.go.com/Politics/elon-musk-weighing-trump-staffing-decisions-sources/story?id=115730434	Elon Musk weighing in on Trump staffing decisions: Sources - ABC News	Several people close to Donald Trump have stressed to ABC News the significance and influence billionaire Elon Musk has had in the Trump orbit over the last week.	https://i.abcnewsfe.com/a/7775be29-b892-41cc-9a72-83e6804b561c/musk-trump-gty-jef-241111_1731338213207_hpMain_16x9.jpg?w=1600	2024-11-12 05:58:40	ABC News
us	https://www.politico.eu/article/ukraine-war-threat-america-nato-mark-rutte-message-donald-trump/	Ukraine war poses threat to America, NATO chief stresses in message to Trump - POLITICO Europe	None	None	2024-11-12 15:19:00	POLITICO Europe
us	https://www.texastribune.org/2024/11/12/texas-legislature-bills-filing/	Texas lawmakers target property taxes, abortion and gender transition care in first bills for the 2025 session - The Texas Tribune	Tuesday marked the first day lawmakers could file bills for next year’s legislative session.	https://thumbnails.texastribune.org/Ss1mOdHzMCpIK2Uine4FIJSBXxs=/1200x630/filters:quality(95)/static.texastribune.org/media/files/34f1fea26c67fad90d69db426b8128a7/Lege%20Budget%20Day%20JV%201.jpg	2024-11-12 21:06:46	The Texas Tribune
us	https://www.democracynow.org/2024/11/12/silky_shah_mass_deportations_under_trump	As Private Prison Stocks Soar, Immigrant Rights Activists Vow to Fight Trump’s Mass Deportation Plans - Democracy Now!	None	None	2024-11-12 13:00:00	Democracy Now!
us	https://www.pbs.org/newshour/politics/trump-taps-lee-zeldin-to-lead-epa	Trump taps Lee Zeldin to lead EPA - PBS NewsHour	Zeldin, who left Congress in January 2023, was a surprising pick for the role.	https://d3i6fh83elv35t.cloudfront.net/static/2024/11/2024-11-11T212756Z_345104029_RC2EL5A056IA_RTRMADP_3_USA-TRUMP-CABINET-1024x683.jpg	2024-11-11 22:17:38	PBS NewsHour
us	https://edition.cnn.com/2024/11/12/politics/elon-musk-vivek-ramaswamy-department-of-government-efficiency-trump/index.html	Elon Musk and Vivek Ramaswamy will lead new ‘Department of Government Efficiency’ in Trump administration - CNN	None	https://media.cnn.com/api/v1/images/stellar/prod/20241112-musk-ramaswamy-split.jpg?c=16x9&q=w_800,c_fill	2024-11-13 00:52:00	CNN
us	https://www.reuters.com/world/us/trump-says-he-will-nominate-fox-news-host-pete-hegseth-defense-secretary-2024-11-13/	Trump says he will nominate anti-'woke' Fox News host Pete Hegseth for defense secretary - Reuters	Hegseth is an Army National Guard veteran and according to his website served in Afghanistan, Iraq and Guantanamo Bay, Cuba.	https://www.reuters.com/resizer/v2/3YSALZ26O5KOVFXVEL7MXNQNUM.jpg?auth=a921d9a505dd0907d04a78b5c858ad10baef6db6910fdd5bacea62a8187ec162&height=1005&width=1920&quality=80&smart=true	2024-11-13 01:44:00	Reuters
us	https://www.foxnews.com/politics/trump-picks-former-intel-director-john-ratcliffe-head-cia	Trump picks former intel director John Ratcliffe to head the CIA - Fox News	John Ratcliffe, who previously served as President-elect Trump's principal intelligence advisor, has now been picked by Trump to serve as director of the CIA.	https://static.foxnews.com/foxnews.com/content/uploads/2024/11/gettyimages-1251946090-copy.jpg	2024-11-12 23:05:00	Fox News
us	https://edition.cnn.com/2024/11/12/politics/kristi-noem-homeland-security-secretary/index.html	First on CNN: Trump picks Kristi Noem to serve as his Homeland Security secretary - CNN	None	https://media.cnn.com/api/v1/images/stellar/prod/ap24288828291203.jpg?c=16x9&q=w_800,c_fill	2024-11-13 01:22:00	CNN
us	https://apnews.com/article/ten-commandments-law-blocked-public-schools-louisiana-87b3dde94e583fdbb9ecb26db42b0206	Federal judge blocks Louisiana law that requires classrooms to display Ten Commandments - The Associated Press	Louisiana Attorney General Elizabeth Murrill says the state will ask a federal appeals court to quickly stay a lower court's order declaring unconstitutional a law requiring that the Ten Commandments be displayed in every public classroom by Jan. 1.	https://dims.apnews.com/dims4/default/be65353/2147483647/strip/true/crop/5535x3113+0+288/resize/1440x810!/quality/90/?url=https%3A%2F%2Fassets.apnews.com%2Fca%2F37%2F7375cc65ea7e6e4f29dae97dbca3%2Fc6153de152f74f0fa21105759ad5a27e	2024-11-12 23:52:00	The Associated Press
us	https://news.google.com/rss/articles/CBMipwFBVV95cUxNSlVZbkFGV0xmZF9DTzN3bzZMT19sUy1fcGZUWXRzb2pKV3hqXzlXTXJHMW9VenpTOHlEanVISHpaT2lLcTdlZGw0NF9hQnp1MUU5U01NUThjVUtWcTdhc3hrTFhFMGhVODdvN1Y2eEF0UUNtczIxd19zSk04b0tYZjkwZHJPYk9xbmZhUklwTmVXRTYya2hqaU5YT3lSZUNXUjVNVmlvRQ?oc=5	No immunity decision in Trump’s hush money case as prosecutors weigh how to proceed - The Washington Post	The delay further throws into question whether President-elect Trump will be sentenced as scheduled for his felony convictions on Nov. 26.	https://www.washingtonpost.com/wp-apps/imrs.php?src=https://arc-anglerfish-washpost-prod-washpost.s3.amazonaws.com/public/CKPSTA6IEPGAM7BICAX5PA7TWE.JPG&w=1440	2024-11-12 20:15:09	The Washington Post
us	https://edition.cnn.com/2024/11/12/politics/mike-huckabee-palestinian-comments-trump-israel-ambassador/index.html	Mike Huckabee once said that ‘there’s really no such thing as a Palestinian’ - CNN	None	https://media.cnn.com/api/v1/images/stellar/prod/gettyimages-1259029207-restricted.jpg?c=16x9&q=w_800,c_fill	2024-11-13 00:45:00	CNN
us	https://weather.com/storms/hurricane/news/2024-11-12-western-caribbean-possible-tropical-storm-sara	Another Caribbean Late-Season Tropical Storm Will Form - The Weather Channel	The season's next named storm, Sara, will likely form in the western Caribbean in the coming days. Here's what we know right now. - Articles from The Weather Channel | weather.com	https://s.w-x.co/carib2pmtue.jpg	2024-11-12 14:49:17	The Weather Channel
us	https://www.cnbc.com/2024/11/12/faa-ban-us-haiti-flights.html	FAA bans U.S.-Haiti flights for 30 days after flights struck by gunfire - CNBC	A Spirit Airlines plane was struck by gunfire as it was trying to land at Port-au-Prince airport.	https://image.cnbcfm.com/api/v1/image/107362116-1705846633594-gettyimages-1744830474-SPIRIT_EARNS.jpeg?v=1731441475&w=1920&h=1080	2024-11-12 20:18:35	CNBC
us	https://edition.cnn.com/2024/11/12/politics/israel-gaza-humanitarian-situation-report/index.html	US has not assessed Israel is violating law on Gaza aid, will not change policy despite humanitarian groups’ findings - CNN	None	https://media.cnn.com/api/v1/images/stellar/prod/gettyimages-2183321805-copy.jpg?c=16x9&q=w_800,c_fill	2024-11-12 20:30:00	CNN
us	https://news.google.com/rss/articles/CBMimwFBVV95cUxQZ3NQby1pckxGUW1rUnktb2tONnVZU29jV3EyUk9XY0x5amM4emJrUENCUnFzRjhMV3g5dElqcFdfTEd1eDBZeS1tV1lxZVNEN0M0WGpHc1Q0X0t0a0dyalVLUmhkOERXOFExZ0FOTDZSaVB0OVpTM3VJdzh0R2dJdnYyYmZDcVZPNGcxSFBFTG9fSUZxZEVNZXd4RQ?oc=5	THE SOCIAL SECURITY FAIRNESS ACT HAS PASSED THE HOUSE - Congressman Clay Higgins	None	None	2024-11-13 00:28:34	Congressman Clay Higgins
us	https://www.ft.com/content/f036e577-7a52-4dd8-a3dc-7124f7613bce	Donald Trump’s cabinet picks signal tougher stance on China - Financial Times	Experts say appointments of Mike Waltz and others show president-elect is preparing more hawkish stance on Beijing	https://www.ft.com/__origami/service/image/v2/images/raw/https%3A%2F%2Fd1e00ek4ebabms.cloudfront.net%2Fproduction%2Fd9bd60fc-4138-4f33-9c28-d4dff871b388.jpg?source=next-article&fit=scale-down&quality=highest&width=700&dpr=1	2024-11-12 21:37:52	Financial Times
us	https://news.google.com/rss/articles/CBMimAFBVV95cUxON3VOSUo4enZ3bXVIMHVDUk5LWGlzV3l3dTVpVHJLYlA5ZnFaLVd1Z3BfSVhwelg0cHk2aGZYN0xIb3NzYWtBVjk0ZW4tN0JkMDdad2M5ZEcwbGo3TVRzZHk0WGE0aU9mY05iMlZyNHhyRkoxZEdMZEhjYkxwVV8zbUIyYjVVNEJtNVEzWmFFTlg3Uk5DRHkycA?oc=5	Archbishop of Canterbury resigns over mishandling of abuse allegations - The Washington Post	A report found Justin Welby took insufficient action on allegations against John Smyth, believed to be “the most prolific serial abuser” associated with the Church of England.	https://www.washingtonpost.com/wp-apps/imrs.php?src=https://arc-anglerfish-washpost-prod-washpost.s3.amazonaws.com/public/SBQBJ4VV33S6HYMICP3H55VS5E_size-normalized.jpg&w=1440	2024-11-12 19:46:53	The Washington Post
us	https://news.google.com/rss/articles/CBMilgFBVV95cUxQZGJKV3hnTWRGNU9paXdLQmhFc19Ga0x4eG1xSkhDSjlTaTJaMEpvNktOQUhwV1lUMVpHVXE5ZjdxX2N6X3NJVEFvNWZ1ZHF6aWRmTHhhMUl4OGhSbFVXWnpCblBRZF81NDk4UXp0UW5kNTJxWTVNX3RHY1FpeDdZXzlTRDE4WTEwekxzbmV0TTBKQVNXY2c?oc=5	Amsterdam Authorities Expect More Arrests Related to Attacks Around Soccer Match - The New York Times	So far, 62 people have been detained in connection with unrest surrounding a soccer match as officials said they continue to investigate antisemitic attacks, as well as incendiary behavior by both sides.	https://static01.nyt.com/images/2024/11/12/multimedia/12amsterdam-sub-ftlb/12amsterdam-sub-ftlb-facebookJumbo.jpg	2024-11-12 14:17:15	The New York Times
us	https://www.cnbc.com/2024/11/12/trump-backer-john-paulson-bows-out-as-possible-treasury-secretary-pick.html	Trump backer John Paulson bows out as possible Treasury secretary pick - CNBC	John Paulson said he would remain in involved in implementing economic policies of President-elect Donald Trump	https://image.cnbcfm.com/api/v1/image/108051644-1729693190097-gettyimages-2180508968-_jjj5541_qoxfhya3.jpeg?v=1729693218&w=1920&h=1080	2024-11-12 16:09:08	CNBC
us	https://www.bbc.com/news/articles/c1knpnlp1leo	Houthis attack US warships after US strikes in Yemen - BBC.com	The navy destroyers were unharmed and repelled the attack, the Pentagon said.	https://ichef.bbci.co.uk/news/1024/branded_news/9cc0/live/d8712830-a143-11ef-bdf5-b7cb2fa86e10.jpg	2024-11-12 23:46:14	BBC.com
us	https://www.azcentral.com/story/news/politics/elections/2024/11/12/where-is-kari-lake-has-she-conceded-the-arizona-senate-race/76234450007/	Where is Kari Lake? Has she conceded the Arizona Senate race? What to know - The Arizona Republic	Lake and her campaign have amplified social media posts that cast suspicion on how the election was handled.	https://www.azcentral.com/gcdn/authoring/authoring-images/2024/10/24/PPHX/75829215007-20241024-t-200500-z-1421338137-rc-24-raay-5-id-2-rtrmadp-3-usaelectiontrump.JPG?crop=3147,1771,x2,y41&width=3147&height=1771&format=pjpg&auto=webp	2024-11-13 00:26:26	The Arizona Republic
us	https://nypost.com/2024/11/12/us-news/biden-snaps-at-reporter-think-you-can-keep-from-getting-hit-in-the-head-by-a-camera-behind-you/	Biden snaps at reporter: 'Think you can keep from getting hit in the head by a camera behind you?' - New York Post 	None	None	2024-11-12 20:26:00	New York Post 
us	https://www.washingtonpost.com/education/2024/11/12/trump-close-education-department-proposal-explained/	Trump pledged to close the Education Department. What would that mean? - The Washington Post	The Department of Education provides about 10% of K-12 funding, enforces civil rights laws and runs the $1.6 trillion student loan program.	https://www.washingtonpost.com/wp-apps/imrs.php?src=https://arc-anglerfish-washpost-prod-washpost.s3.amazonaws.com/public/HEYJC7BRMB7KCCSHGCFVBJ6RIY.jpg&w=1440	2024-11-12 20:04:03	The Washington Post
us	https://edition.cnn.com/2024/11/12/climate/methane-rule-biden-trump/index.html	Biden just finalized a major climate rule. This one could be tricky for Trump to dismantle - CNN	None	None	2024-11-12 10:00:00	CNN
us	https://abc7.com/post/driver-rams-car-crowd-china-killing-35-police-say-he-was-upset-divorce/15540183/	Driver rams his car into crowd in China, killing 35. Police say he was upset about his divorce - ABC7 Los Angeles	None	None	2024-11-12 14:57:04	ABC7 Los Angeles
us	https://abcnews.go.com/US/delphi-double-murder-trial-jury-reaches-verdict-killing/story?id=114784404	Delphi man found guilty on all charges in murders of teen girls - ABC News	None	None	2024-11-12 05:06:02	ABC News
us	https://apnews.com/article/abu-ghraib-civil-trial-iraq-virginia-3a2841ec2892fb111b4e26a70e761208	Jury awards Abu Ghraib detainees $42 million, holds contractor responsible - The Associated Press	A U.S. jury has awarded $42 million to three former detainees of Iraq’s notorious Abu Ghraib prison, holding a Virginia-based military contractor responsible for contributing to their torture and mistreatment two decades ago.	https://dims.apnews.com/dims4/default/10664d3/2147483647/strip/true/crop/3335x1876+0+174/resize/1440x810!/quality/90/?url=https%3A%2F%2Fassets.apnews.com%2F33%2F85%2F9e370450dec9915860b4fdab3120%2F9386887779194adea398ff04aefedf58	2024-11-12 20:14:00	The Associated Press
us	https://www.forbes.com/sites/saradorn/2024/11/12/trumps-cabinet-here-are-his-picks-for-key-roles-elon-musk-vivek-ramaswamy-pete-hegseth-and-more/	Trump’s Cabinet: Here Are His Picks For Key Roles—Elon Musk, Vivek Ramaswamy, Pete Hegseth And More - Forbes	Trump is expected to make Marco Rubio his secretary of state, make Kristi Noem his secretary of homeland security and name Stephen Miller and Mike Waltz to key White House posts.
	https://imageio.forbes.com/specials-images/imageserve/67323c4e7476c20d02d08bc2/0x0.jpg?format=jpg&height=900&width=1600&fit=bounds	2024-11-13 01:08:00	Forbes
us	https://newrepublic.com/post/188297/supreme-court-trump-ally-mark-meadows-georgia-case	Supreme Court Slaps Down Trump Ally’s Desperate Ploy to Evade Justice - The New Republic	None	None	2024-11-12 16:35:03	The New Republic
us	https://www.aclu.org/press-releases/aclu-urges-house-to-kill-bill-that-could-give-trump-admin-power-to-crush-dissent-and-go-after-political-enemies	ACLU Urges House to Kill Bill that Could Give Trump Admin Power to Crush Dissent and Go After Political Enemies - ACLU	Under H.R. 9495, any tax-exempt organization that criticizes the government could have its status stripped away arbitrarily by a designation that it is...	https://www.aclu.org/wp-content/themes/aclu-wp/img/issues/press-release.jpg	2024-11-12 19:07:11	ACLU
us	https://edition.cnn.com/2024/11/12/us/university-of-rochester-wanted-posters/index.html	Hundreds of ‘wanted’ posters were plastered across the University of Rochester campus. Jewish faculty members were targeted - CNN	None	https://media.cnn.com/api/v1/images/stellar/prod/img-0653.JPG?c=16x9&q=w_800,c_fill	2024-11-12 22:49:00	CNN
us	https://news.google.com/rss/articles/CBMitwFBVV95cUxQOHRtZ3hWUjcteUZQT2pqQ3RERDhDYlIyOWpFd3BhWEFzMjAwRG8tdlAyNllDZExJSWt1ZTJMVFNOSy1RNGNsclhGMnEzZEExU1JZUmttaVJhdXJIY3ZsWmQ3dW5ocGRJX0d0dDkzcnJqaTkyaGNaMUhaTDVkMXBkdW9RdUZnUVFWeFdiM1p4Rm1Sdk9CZEJMZmNMSFd5bXZ0RXh1VWZXeDJzT01HdnlKQjc0VmFycWs?oc=5	Women suing over Idaho's abortion ban describe dangerous pregnancies, becoming 'medical refugees' - The Associated Press	Four women suing over Idaho’s strict abortion ban told a judge Tuesday how excitement over their pregnancies turned to grief and fear after they learned their fetuses were not likely to survive to birth — and how they had to leave the state to get abortions amid fears that pregnancy complications wo	None	2024-11-13 00:32:00	The Associated Press
us	https://edition.cnn.com/2024/11/12/politics/house-gop-math-trump-cabinet/index.html	Trump’s Cabinet picks could be complicated by GOP math in the House - CNN	None	https://media.cnn.com/api/v1/images/stellar/prod/ap081208013441.jpg?c=16x9&q=w_800,c_fill	2024-11-12 16:59:00	CNN