country_code	url	title	description	image_url	publish_date	source
us	https://www.politico.eu/article/moldova-warns-of-russian-disruptive-moves-against-overseas-voting-in-sundays-runoff/	Moldova warns of Russian ‘disruptive’ moves against overseas voting in Sunday’s runoff - POLITICO Europe	None	None	2024-11-02 11:14:00	POLITICO Europe
us	https://apnews.com/article/obamacare-affordable-care-act-harris-trump-kamala-9ac518845f3fd085bc68dcceed16b2c1	'Obamacare' enrollment opens, as Republicans threaten the health insurance program used by millions - The Associated Press	Americans can start signing up Friday for health care coverage offered through the Affordable Care Act marketplace for 2025.	https://dims.apnews.com/dims4/default/04b96b1/2147483647/strip/true/crop/3672x2066+0+191/resize/1440x810!/quality/90/?url=https%3A%2F%2Fassets.apnews.com%2F9d%2Fe6%2Ff81340057785fd4715f50689f217%2Faf52c5ed7afc4e688095a352fa75800c	2024-10-31 17:42:00	The Associated Press
us	https://nypost.com/2024/11/02/us-news/pnut-the-squirrels-grieving-family-gives-tearful-statement-on-tiktok-im-sad-im-disgusted/	P’nut the Squirrel’s grieving family gives tearful statement on TikTok: ‘I’m sad, I’m disgusted’ - New York Post 	None	None	2024-11-03 01:27:00	New York Post 
us	https://www.politico.com/news/2024/11/03/attack-on-central-israel-injures-11-as-irans-leader-promises-a-punishing-response-00186930	Attack on central Israel injures 11 as Iran’s leader promises a punishing response - POLITICO	Hezbollah said it had used missiles and explosive drones to target military and intelligence facilities.	https://static.politico.com/62/91/4af7c6364a529cd6a92683c4987b/israel-mideast-wars-68066.jpg	2024-11-03 05:05:00	POLITICO
us	https://www.reuters.com/world/europe/germanys-upstart-leftists-chip-pro-ukraine-consensus-2024-11-03/	Germany's upstart leftists chip at pro-Ukraine consensus - Reuters	The BSW wants mainstream parties to pay a high price for helping them govern three eastern states: their regional officials must join calls to stop arming Ukraine.	https://www.reuters.com/resizer/v2/UAQOKF72KVIWPMFK4UVB5Y3YQQ.jpg?auth=9a07a597b3073acda6e87a5a5fdc7b0884f359089a4273254bf7c726667a5c43&height=1005&width=1920&quality=80&smart=true	2024-11-03 08:48:11	Reuters
us	https://www.rollingstone.com/tv-movies/tv-movie-news/snl-weekend-update-goes-all-in-trump-mockery-before-presidential-election-1235151492/	‘SNL’ Weekend Update Goes All In On Trump Mockery Before Election - Rolling Stone	None	None	2024-11-03 05:25:44	Rolling Stone
us	https://www.washingtonpost.com/dc-md-va/2024/11/02/salem-virginia-trump-rally-youngkin/	Youngkin, long coy about Trump, welcomes him to Virginia with tribute, prayer - The Washington Post	Donald Trump’s stop in Salem gave the Virginia governor another chance to showcase his newfound devotion to the nation’s 45th president.	https://www.washingtonpost.com/wp-apps/imrs.php?src=https://arc-anglerfish-washpost-prod-washpost.s3.amazonaws.com/public/UH5JEWHQZORAH4XZ67EGQ3MXZI.JPG&w=1440	2024-11-03 05:56:47	The Washington Post
us	https://www.thedailybeast.com/trump-defends-puerto-rico-trashing-comedian-tony-hinchcliffe/	Trump Defends Puerto Rico-Trashing Comedian Tony Hinchcliffe - The Daily Beast	The former president also claimed he had “no idea” who Hinchcliffe was.	None	2024-11-02 21:10:00	The Daily Beast
us	https://edition.cnn.com/2024/11/03/politics/senate-seats-flip-election/index.html	The 10 Senate seats most likely to flip in 2024 - CNN	None	https://media.cnn.com/api/v1/images/stellar/prod/gettyimages-2170375406.jpg?c=16x9&q=w_800,c_fill	2024-11-03 09:28:00	CNN
us	https://www.nytimes.com/2024/11/03/world/europe/spain-floods-valencia-volunteers.html	After Deadly Floods in Spain, Thousands of Volunteers Help in Recovery Effort - The New York Times	As the country reels from a flood that has left at least 214 people dead, ordinary citizens have flocked to devastated areas to help clean, donate and rebuild.	https://static01.nyt.com/images/2024/11/03/multimedia/03spain-volunteers-01-pfwc/03spain-volunteers-01-pfwc-facebookJumbo.jpg	2024-11-03 12:54:00	The New York Times
us	https://edition.cnn.com/2024/11/03/us/conservative-christian-coming-out-gay-cec/index.html	After their son came out, this conservative Christian couple went into a closet of their own - CNN	None	https://media.cnn.com/api/v1/images/stellar/prod/10-017-053024-ats-christianparentslgbtqchildren.jpg?c=16x9&q=w_800,c_fill	2024-11-03 11:00:00	CNN
us	https://www.kgw.com/article/news/crime/suspect-vancouver-mall-shooting-arrested/283-875ae92e-6643-4508-9914-798069a94650	Suspect in Vancouver Mall shooting on Halloween night has been arrested - KGW.com	Police found Travis Ward, 22, at a residence on Saturday and arrested him for the shooting that killed one man and wounded two others.	https://media.kgw.com/assets/KGW/images/f95d2d34-2a10-4ea0-b1a9-218446418ae5/20241101T041024/f95d2d34-2a10-4ea0-b1a9-218446418ae5_1140x641.jpg	2024-11-03 04:38:00	KGW.com
us	https://www.bbc.com/news/articles/cly2d4evq5po	What Kamala Harris's years as a prosecutor tell us about her - BBC.com	She dealt with grisly murder cases and then became the state attorney general - the Democratic candidate's California career offers clues about how she might govern.	https://ichef.bbci.co.uk/news/1024/branded_news/1705/live/3c27fe60-9859-11ef-82c3-45a801b7330b.jpg	2024-11-03 09:51:01	BBC.com
us	https://apnews.com/article/lebanon-israel-hezbollah-captain-snatched-e4c2f600d821e8208069703aa1e8a00a	Israeli forces capture senior Hezbollah operative in north Lebanon, Israeli military official says - The Associated Press	An Israeli military official says Israeli naval forces have captured a senior Hezbollah operative in north Lebanon.	https://dims.apnews.com/dims4/default/a61b440/2147483647/strip/true/crop/8640x4860+0+450/resize/1440x810!/quality/90/?url=https%3A%2F%2Fassets.apnews.com%2F06%2Faf%2Fb6bacaa09880362a85df13a5e256%2F0dde7885412f4ee099bbb045b11b4033	2024-11-02 19:58:00	The Associated Press
us	https://www.politico.com/news/2024/11/03/swing-state-mrp-mega-poll-00186941	British ‘mega poll’ leans toward Harris victory - POLITICO	Election pollsters may be ‘herding’ and giving the impression Trump is stronger than he really is, Focaldata research suggests. 	https://static.politico.com/47/d8/baadafb844108a98032732953cf0/useuntil11-30-2024-kamala-harris-wisconsin-022.jpg	2024-11-03 09:00:00	POLITICO
us	https://www.pbs.org/newshour/politics/rejecting-gop-plea-supreme-court-lets-pennsylvania-count-contested-provisional-ballots	Rejecting GOP plea, Supreme Court lets Pennsylvania count contested provisional ballots - PBS NewsHour	The Supreme Court on Friday rejected an emergency appeal from Republicans that could have led to thousands of provisional ballots not being counted in Pennsylvania as the presidential campaigns vie in the final days before the election in the nation’s biggest battleground state.	https://d3i6fh83elv35t.cloudfront.net/static/2024/11/2024-10-30T224528Z_1074898103_RC24VAAIEKUA_RTRMADP_3_USA-ELECTION-PENNSYLVANIA-VOTING-MACHINES-1024x683.jpg	2024-11-02 19:19:00	PBS NewsHour
us	https://apnews.com/article/donald-trump-north-carolina-campaign-aacda8a46f20d1dc654ca9ef4c2c3de8	Trump will rally backers every day until the election in North Carolina, a swing state he won twice - The Associated Press	Donald Trump will rally supporters in North Carolina every day until Tuesday’s election. That's a flurry of late activity in the only swing state that he won in both his 2016 and 2020 campaigns.	https://dims.apnews.com/dims4/default/fe5c10b/2147483647/strip/true/crop/3358x1889+0+177/resize/1440x810!/quality/90/?url=https%3A%2F%2Fassets.apnews.com%2F89%2F9e%2Ffc707be1300da80d7699a77ae1e7%2Feb8ecf0b63f7462a9a021527499baa55	2024-11-03 03:47:00	The Associated Press
us	https://abcnews.go.com/US/tornado-warning-issued-university-oklahoma-campus/story?id=115436662	Tornado warning issued on University of Oklahoma campus - ABC News	None	None	2024-11-03 10:35:49	ABC News
us	https://edition.cnn.com/2024/11/03/business/video/saturday-night-live-maya-rudolph-kamala-harris-digvid	Kamala Harris speaks to Maya Rudolph’s Kamala Harris on SNL - CNN	None	https://media.cnn.com/api/v1/images/stellar/prod/gettyimages-2181938017.jpg?c=16x9&q=w_800,c_fill	2024-11-03 04:35:46	CNN
us	https://www.politico.eu/article/if-trump-wins-europe-will-have-to-adapt-in-its-stance-on-ukraine-orban-says/	If Trump wins, Europe will have to adjust its stance on Ukraine, Orbán says - POLITICO Europe	None	None	2024-11-03 14:02:00	POLITICO Europe
us	https://apnews.com/article/us-bomber-north-korea-missile-test-43b568921a7521468167fe30915cd943	US flies long-range bomber in drill with South Korea, Japan in reaction to the North's missile test - The Associated Press	The U.S. flew the B-1B bomber on Sunday to train with South Korean and Japanese fighter jets near the Korean Peninsula.	https://dims.apnews.com/dims4/default/d0bb07a/2147483647/strip/true/crop/3811x2144+0+196/resize/1440x810!/quality/90/?url=https%3A%2F%2Fassets.apnews.com%2F5c%2Fd6%2F5f849a3ab42f8f4551281164149f%2F73edeb87a35642d98c4b7c28b1a619f6	2024-11-03 10:30:00	The Associated Press
us	https://www.washingtonpost.com/weather/2024/11/02/sub-tropical-storm-patty-azores/	A subtropical storm named Patty has formed near the Azores, drifting east toward Spain - The Washington Post	The storm formed by surprise Saturday morning.	https://www.washingtonpost.com/wp-apps/imrs.php?src=https://arc-anglerfish-washpost-prod-washpost.s3.amazonaws.com/public/ORTKXQMSIFDCHBSFKNDZB4MD6A.jpg&w=1440	2024-11-02 21:40:23	The Washington Post
us	https://nypost.com/2024/11/02/us-news/shocking-footage-shown-in-daniel-penny-trial-shows-moment-emts-said-jordan-neely-had-a-pulse/	Shocking footage played at Daniel Penny trial shows officers saying Jordan Neely had a pulse - New York Post 	None	None	2024-11-03 02:35:00	New York Post 
us	https://www.pbs.org/newshour/world/irans-supreme-leader-threatens-a-crushing-response-to-israels-retaliatory-attack	Iran’s supreme leader threatens ‘a crushing response’ to Israel’s retaliatory attack - PBS NewsHour	Ayatollah Ali Khamenei spoke as Iranian officials are increasingly threatening to launch yet another strike against Israel after its Oct. 26 attack on the Islamic Republic that targeted military bases and other locations and killed at least five people.	https://d3i6fh83elv35t.cloudfront.net/static/2024/11/2024-10-27T100847Z_1434035760_RC2YSAAWVUP4_RTRMADP_3_ISRAEL-PALESTINIANS-LEBANON-IRAN-1024x683.jpg	2024-11-02 23:53:00	PBS NewsHour
us	https://edition.cnn.com/2024/11/03/politics/bill-clinton-cnn-interview/index.html	CNN Exclusive: Bill Clinton has hopes and fears on what comes after 2024 – for the country, the party and himself - CNN	None	https://media.cnn.com/api/v1/images/stellar/prod/ap24297808046738.jpg?c=16x9&q=w_800,c_fill	2024-11-03 14:37:00	CNN
us	https://www.theguardian.com/politics/2024/nov/03/who-is-new-conservative-leader-kemi-badenoch	Who is the new Tory leader, Kemi Badenoch? That depends on your perspective - The Guardian	The Guardian speaks to five people who have got to know Badenoch in Whitehall, parliament and on social occasions	https://i.guim.co.uk/img/media/3146c02cfaee2199dda32eab274b48b8b9503798/647_140_1827_1096/master/1827.jpg?width=1200&height=630&quality=85&auto=format&fit=crop&overlay-align=bottom%2Cleft&overlay-width=100p&overlay-base64=L2ltZy9zdGF0aWMvb3ZlcmxheXMvdGctZGVmYXVsdC5wbmc&enable=upscale&s=3f27f72262bfe517aed2a3921e63ec26	2024-11-03 13:49:00	The Guardian
us	https://www.bbc.com/news/articles/cz6jp80dx4no	Ex-officer found guilty in death of Breonna Taylor - BBC.com	Brett Hankison is the first officer convicted in the 2020 botched raid on Taylor's apartment	https://ichef.bbci.co.uk/news/1024/branded_news/2426/live/c5608eb0-98ca-11ef-8538-e1655f5a8342.jpg	2024-11-02 14:07:14	BBC.com
us	https://apnews.com/article/georgia-fulton-county-voting-elections-republican-aecacf60270810060469f988ff8f7b9b	Georgia judge rejects GOP lawsuit trying to block counties from accepting hand-returned mail ballots - The Associated Press	A Georgia judge has rejected a Republican lawsuit trying to block county election offices from opening on Saturday and Sunday to let voters return their mail ballots in person.	https://dims.apnews.com/dims4/default/df59e05/2147483647/strip/true/crop/4263x2398+0+222/resize/1440x810!/quality/90/?url=https%3A%2F%2Fassets.apnews.com%2F4b%2Fae%2F318cc622788280696c353a357d27%2F5f3281a4292d45e3a81724bb9f5c33c1	2024-11-03 02:55:00	The Associated Press
us	https://www.aljazeera.com/news/2024/11/3/us-election-2-days-left-what-polls-say-what-harris-and-trump-are-up-to	US election: 2 days left – What polls say, what Harris and Trump are up to - Al Jazeera English	Harris and Trump are locked in a dead heat in several swing states as one survey shows the Democrat leading in Iowa.	https://www.aljazeera.com/wp-content/uploads/2024/11/AP24304037053551-1730621668_fbacd8-1730621886.jpg?resize=1200%2C630&quality=80	2024-11-03 07:57:29	Al Jazeera English
us	https://www.aljazeera.com/news/2024/11/3/us-election-2024-understanding-the-united-states-in-20-maps	US Election 2024: Understanding the United States in 20 maps - Al Jazeera English	Al Jazeera looks at the US economy, demographics, geography and other indicators ahead of the November 5 elections.	https://www.aljazeera.com/wp-content/uploads/2024/11/INTERACTIVE_US-MAPS_COVER_2-NOV-2024-1730614103.png?resize=1200%2C630	2024-11-03 07:41:15	Al Jazeera English
us	https://edition.cnn.com/2024/11/03/politics/rfk-jr-fluoride-trump/index.html	RFK Jr. says Trump will recommend removing fluoride from public water if he wins reelection - CNN	None	https://media.cnn.com/api/v1/images/stellar/prod/gettyimages-2180628742-20241103132033185.jpg?c=16x9&q=w_800,c_fill	2024-11-03 13:26:00	CNN
us	https://www.nytimes.com/2024/11/02/us/elections/womens-march-washington.html	At Women’s March in Washington, Hope That They Will Hold Off Trump - The New York Times	Thousands of women rallied in the capital and across the country for a Kamala Harris presidency — and to proclaim their resistance to Republican aims to restrict women’s reproductive rights.	https://static01.nyt.com/images/2024/11/02/multimedia/02election-live-dc-march-grid-02-fbcw/02election-live-dc-march-grid-02-fbcw-facebookJumbo.jpg	2024-11-03 01:48:22	The New York Times
us	https://apnews.com/article/native-american-indigenous-voters-biden-trump-election-2024-6ca58c452dbd9a2af275dc1e31aacfc1	Native voters could swing US elections, but they're asking politicians: What have you done for us? - The Associated Press	In the leadup to U.S. elections, Democrats and Republicans have flocked the furthest reaches of 22 Native American reservations in Arizona in a bid to pick up votes.	https://dims.apnews.com/dims4/default/868faf0/2147483647/strip/true/crop/8640x4860+0+450/resize/1440x810!/quality/90/?url=https%3A%2F%2Fassets.apnews.com%2F71%2Fff%2Fbba90019571e5e04ce9b37226d0a%2Fb3f99d78838a41ea8909d27517534ab5	2024-10-30 15:35:00	The Associated Press
us	https://www.forbes.com/sites/davidaxe/2024/11/01/a-russian-commander-ordered-16-lightly-armed-scouts-to-attack-dug-in-ukrainian-machine-guns-only-eight-scouts-came-back/	A Russian Officer Ordered 16 Scouts To Attack Ukrainian Machine Guns - Forbes	North Korean reinforcements are on the way. But they might be cannon fodder, too.	https://imageio.forbes.com/specials-images/imageserve/6725253d8b57aef017eee536/0x0.jpg?format=jpg&crop=1280,600,x0,y106,safe&height=900&width=1600&fit=bounds	2024-11-01 19:34:18	Forbes
us	https://news.google.com/rss/articles/CBMiWkFVX3lxTE1MQ19abDB2dl8tdlAtdjEzOExUZTBMTXRxdUVVd3AxbThDblRhT0VHNlpldVU5VzltNUZUUUpRNFhoUGpDc0RtemRSeUlyYnJyUFlvR1R5ZE0xd9IBX0FVX3lxTE41ZFVVVUxXRV9TaVgydE4tREZOdXo3NktOMGxrUnJrNWRYeDRiUlc4dkhtM08wU1k4Z1UzR3d0RThJZC1Wc1JxdTlmWVY1QTgxR0d1cHd4dnpqVDNoeDVr?oc=5	Uganda: Lightning kills 14 at Palabek refugee camp - BBC.com	The children were attending a church service when the lightning struck, police say.	https://ichef.bbci.co.uk/news/1024/branded_news/7c8f/live/32eeb740-99cf-11ef-9260-19e6a950e830.png	2024-11-03 11:25:53	BBC.com
us	https://www.usatoday.com/story/news/nation/2024/11/02/daylight-saving-time-state-laws/75914727007/	Could daylight saving time ever be permanent? Where it stands in the states - USA TODAY	Americans really don't like changing their clocks twice a year. But should daylight saving time become permanent? Many states say yes.	https://www.usatoday.com/gcdn/authoring/authoring-images/2024/08/14/USAT/74796006007-usatsi-17277386.jpg?crop=1983,1117,x0,y385&width=1983&height=1117&format=pjpg&auto=webp	2024-11-03 13:14:22	USA TODAY
us	https://www.270towin.com/news/2024/11/02/state-play-how-2022s-closest-us-house-races-looking-2024_1674.html	State of Play: How 2022's Closest U.S. House Races are Looking in 2024 - 270toWin	The 2022 election in eleven districts was decided by a margin of less than 1%	https://www.270towin.com/uploads/10-closest-house-2022.png	2024-11-02 18:42:44	270toWin
us	https://apnews.com/article/hezbollah-israel-lebanon-buffer-zone-invasion-478f6970b049b3be52cc56c8e14b84e6	Israel's path of destruction in southern Lebanon raises fears of an attempt to create a buffer zone - The Associated Press	Satellite imagery and data collected by mapping experts show extensive destruction in 11 villages in southern Lebanon located immediately next to the border with Israel.	https://dims.apnews.com/dims4/default/0efe46b/2147483647/strip/true/crop/4231x2380+0+221/resize/1440x810!/quality/90/?url=https%3A%2F%2Fassets.apnews.com%2Fe2%2Fea%2Faab19d93ce464b94890c4ae85b9d%2Fa046ae2551924c318b7e08ba56193d59	2024-11-02 07:26:00	The Associated Press
us	https://www.bbc.com/news/articles/cy9jdpep4ydo	Politicians not ambitious enough to save nature, say scientists - BBC.com	Representatives of 196 countries have been meeting in Cali, Colombia, as part of the COP biodiversity summit. 	https://ichef.bbci.co.uk/news/1024/branded_news/837b/live/db344b80-985e-11ef-9117-610baa963618.jpg	2024-11-02 16:47:23	BBC.com
us	https://www.nytimes.com/2024/11/02/us/elections/biden-scranton-harris-campaign.html	Biden Returns to His Home Turf to Make Final Pitches for Harris - The New York Times	Though President Biden has made verbal gaffes on the campaign trail, the Harris campaign still considers him an asset in blue-collar communities like Scranton, Pa.	https://static01.nyt.com/images/2024/11/02/multimedia/02dc-biden-btkf/02dc-biden-btkf-facebookJumbo.jpg	2024-11-02 23:44:01	The New York Times
us	https://www.jsonline.com/story/news/politics/2024/11/02/kamala-harris-donald-trump-friday-night-downtown-milwaukee-pfister/76009878007/	Harris, Trump spend the night a few blocks apart in downtown Milwaukee - Milwaukee Journal Sentinel	After holding dueling rallies in Friday night, Vice Kamala Harris and Donald Trump stayed overnight just a few blocks away from each other in Milwaukee.	https://www.jsonline.com/gcdn/authoring/authoring-images/2024/11/02/PMJS/76010383007-image-10.jpeg?crop=4028,2267,x2,y550&width=3200&height=1801&format=pjpg&auto=webp	2024-11-02 14:22:56	Milwaukee Journal Sentinel
us	https://abcnews.go.com/US/truck-crash-kills-4-injures-17-michigan-interstate/story?id=115436484	Truck crash kills 4, injures 17 on Michigan interstate - ABC News	None	None	2024-11-03 08:20:16	ABC News
us	https://abcnews.go.com/Politics/2024-race-tight-reminder-votes-decided-7-swing/story?id=115398688	With 2024 race so tight, a reminder how few votes decided the 7 swing states in 2020 - ABC News	None	None	2024-11-03 10:06:29	ABC News
us	https://www.bbc.com/news/articles/c629xz8z15go	Montana man arrested for murder wrongly reported as bear attack - BBC.com	Police say DNA from a beer can led them to the suspect in the  brutal murder of a camper. 	https://ichef.bbci.co.uk/news/1024/branded_news/5322/live/26674a90-9958-11ef-9066-ade4b5fbebca.jpg	2024-11-03 10:51:26	BBC.com
us	https://www.fastcompany.com/91217776/election-may-decide-health-coverage-fate-for-millions-as-some-affordable-care-act-subsidies-are-set-to-expire	If Trump wins the election, 20 million people could lose their healthcare subsidies - Fast Company	Small-business owners worry about keeping their doors open if Biden-era tax credits end.	https://images.fastcompany.com/image/upload/f_webp,q_auto,c_fit,w_1024,h_1024/wp-cms-2/2024/10/p-1-91217776-capital-and-main-health-insurance-and-the-election.jpg	2024-10-30 07:34:39	Fast Company
us	https://www.aljazeera.com/news/2024/11/2/when-is-the-us-election-and-when-will-we-know-the-results	US election results: When can we expect the final outcome? - Al Jazeera English	As the US election approaches, we take a closer look at how the results will be processed and the potential timeline.	None	2024-11-02 10:25:51	Al Jazeera English
us	https://abcnews.go.com/International/wireStory/us-iranian-american-held-iran-tensions-high-israeli-115436308	US says Iranian-American held in Iran as tensions high following Israeli attack on country - ABC News	None	None	2024-11-03 15:38:11	ABC News
us	https://www.thebulwark.com/p/trump-liz-cheney-firing-squad-debate	Trump Fantasized About Liz Cheney’s Violent Death. The Rest Is Trivial. - The Bulwark	The firing squad vs. combat debate misses the ambiguity—and the importance—of the former president’s remarks.	https://substackcdn.com/image/fetch/w_1200,h_600,c_fill,f_jpg,q_auto:good,fl_progressive:steep,g_auto/https%3A%2F%2Fsubstack-post-media.s3.amazonaws.com%2Fpublic%2Fimages%2F37b58f7d-9e70-4b9b-a75a-ab4e27313bd5_5841x3894.jpeg	2024-11-02 20:47:00	The Bulwark
us	https://www.reuters.com/world/middle-east/woman-strips-off-clothes-iran-university-apparent-protest-reports-say-2024-11-02/	Woman strips off clothes at Iran university in apparent protest, reports say - Reuters.com	A young woman stripped to her underwear at an Iranian university on Saturday in an apparent protest against the country's strict Islamic dress code, according to online videos and media reports.	https://www.reuters.com/resizer/v2/466BJJQ7PVGY5O53NZ3KL65MHM.png?auth=b9c3bf166c40a6778eb5672993fde7c30a15f48329026674eff92afd8da1d0ca&height=1005&width=1920&quality=80&smart=true	2024-11-02 17:28:09	Reuters.com
us	https://apnews.com/article/spain-floods-valencia-chiva-edcef9ff9430d0d35e2f464b068cec7d	Crashing waves in a hilltop village, a night of terror from Spain’s floods - The Associated Press	The resident of Chiva spent a night of terror when the gorge of her village in eastern Spain quickly filled with rushing water and unleashed a wave of death and destruction.	https://dims.apnews.com/dims4/default/83d4763/2147483647/strip/true/crop/8309x4674+0+433/resize/1440x810!/quality/90/?url=https%3A%2F%2Fassets.apnews.com%2Fe4%2Fd9%2Fd5927870e43d4a0bab8ac7a5adb4%2F0848008db3514ea4b603fd3616dcae7d	2024-11-03 11:33:00	The Associated Press