country_code	url	title	description	image_url	publish_date	source
us	https://apnews.com/article/trump-chavezderemer-labor-secretary-unions-republicans-1bff41e4caef610dbf38ead24d292e67	Trump's Republican Party is increasingly winning union voters. It's a shift seen in his labor pick - The Associated Press	Working-class voters helped Republicans make steady election gains this year and expanded a coalition that increasingly includes rank-and-file union members.	https://dims.apnews.com/dims4/default/22c73bd/2147483647/strip/true/crop/4408x2480+0+228/resize/1440x810!/quality/90/?url=https%3A%2F%2Fassets.apnews.com%2F93%2F8d%2F62d2c3aa034d9f8b87627636d2b5%2F23610259b35845fbad6e31ae56a89126	2024-11-23 21:36:00	The Associated Press
us	https://www.pbs.org/newshour/politics/what-to-know-about-the-house-bill-that-could-punish-nonprofits-over-alleged-terrorist-ties	What to know about the House bill that could punish nonprofits over alleged ‘terrorist’ ties - PBS NewsHour	The House passed a bill Thursday that would empower the Treasury Department to eliminate the tax-exempt status of any nonprofit it deems to be supporting terrorism. A scholar of nonprofits, local governance and civil society explains the outcry over this measure.	https://d3i6fh83elv35t.cloudfront.net/static/2024/11/2024-11-12T164346Z_2110149030_RC2R3BAPN3H1_RTRMADP_3_USA-CONGRESS-REPUBLICANS-1024x683.jpg	2024-11-23 20:27:11	PBS NewsHour
us	https://www.politico.com/news/2024/11/23/taiwans-former-president-says-ukraine-needs-u-s-weapons-more-urgently-than-taipei-00191400	Taiwan’s former president says Ukraine needs US weapons more urgently than Taipei - POLITICO	Tsai Ing-wen’s comments come after a top U.S. military leader said supplying U.S. weapons to Kyiv was cutting into stockpiles that could be used in a war in Asia.	https://static.politico.com/1c/69/b688c5d84436a6634d61a1a2a1da/https-delivery-gettyimages.com/downloads/1727318512	2024-11-23 23:46:00	POLITICO
us	https://www.thedailybeast.com/republican-senator-kevin-cramer-offers-candid-explanation-for-why-matt-gaetzs-nomination-failed/	Republican Senator Offers Candid Explanation For Why Matt Gaetz’s Nomination Failed - The Daily Beast	None	None	2024-11-23 23:21:00	The Daily Beast
us	https://abcnews.go.com/US/thanksgiving-week-forecast-weather-impact-thanksgiving-travel/story?id=116166737	Thanksgiving week forecast: Weather could impact Thanksgiving travel - ABC News	None	None	2024-11-23 19:03:50	ABC News
us	https://www.bbc.com/news/articles/cx27kz9kk1do	Pakistan violence: Dozens killed in Pakistan sectarian attacks - BBC.com	More than 80 die in a tribal area of Pakistan riven by tensions between Shia and Sunni communities.	https://ichef.bbci.co.uk/news/1024/branded_news/316e/live/4a149ec0-aa47-11ef-9110-a9cc934a8e55.jpg	2024-11-24 10:00:49	BBC.com
us	https://www.pbs.org/newshour/politics/trump-names-a-fox-news-personality-a-covid-mandate-critic-and-an-anti-vaccine-doctor-to-key-public-health-roles	Trump names a Fox News personality, a COVID mandate critic and an anti-vaccine doctor to key public health roles - PBS NewsHour	Trump on Friday nominated Dr. Janette Nesheiwat to be the nation's next surgeon general, Dr. Marty Makary to lead the Food and Drug Administration, and doctor and former Rep. Dave Weldon, R-Fla., to lead the Centers for Disease Control and Prevention.	https://d3i6fh83elv35t.cloudfront.net/static/2024/11/Nesheiwat-Makary-Weldon-1024x683.png	2024-11-24 00:47:05	PBS NewsHour
us	https://edition.cnn.com/2024/11/24/us/reverend-william-barber-democrats-cec/index.html	This fiery evangelical pastor offers a blueprint for Democrats’ revival in Trump’s second term - CNN	None	https://media.cnn.com/api/v1/images/stellar/prod/gettyimages-2159848767.jpg?c=16x9&q=w_800,c_fill	2024-11-24 11:00:00	CNN
us	https://www.bbc.com/news/articles/cvg7x25m3gno	Laos methanol deaths: Three more tourists named - BBC.com	The local governor visited the hostel in which some of the victims were staying, promising justice for those responsible. 	https://ichef.bbci.co.uk/news/1024/branded_news/8b81/live/ef16aa30-aa6a-11ef-8f6a-9b281a908b60.jpg	2024-11-24 15:27:30	BBC.com
us	https://www.axios.com/2024/11/23/trump-liberal-cabinet-rfk-tulsi-gabbard-bessent	Behind the Curtain: Trump's liberal cabinet - Axios	This might be the most ideologically diverse cabinet of modern times.	https://images.axios.com/1mbIreAqCdFd7o1pU8L07p2Ug9g=/0x380:7959x4857/1366x768/2024/11/23/1732376045090.jpg	2024-11-23 15:57:49	Axios
us	https://www.politico.com/news/2024/11/24/fbi-background-checks-amy-klobuchar-trump-00191408	FBI background checks a necessity, Amy Klobuchar says - POLITICO	“In the end, it is the Republicans that are going to have to make a decision if these people are qualified for these jobs,” the senator said.	None	2024-11-24 16:36:23	POLITICO
us	https://www.bbc.com/news/articles/cze391y17z7o	Can RFK Jr make America's diet healthy again? - BBC.com	Kennedy's plans to ban dyes in cereals and fluoride in water could get major pushback from the food industry.	https://ichef.bbci.co.uk/news/1024/branded_news/ef40/live/435356d0-a82b-11ef-9c9f-85cfc89e7be6.jpg	2024-11-24 05:29:56	BBC.com
us	https://www.sfgate.com/weather/article/california-bay-area-storm-rainfall-records-19938499.php	Historic storm breaks 1,000-year rainfall record in parts of Bay Area - SFGATE	None	None	2024-11-23 21:36:03	SFGATE
us	https://www.nytimes.com/2024/11/23/us/storm-rain-atmospheric-river-california.html	Scenes From the Atmospheric River That Drenched California and the Pacific Northwest - The New York Times	The storm, driven by the season’s first major atmospheric river, inundated the region, killing at least three people and causing widespread power outages.	https://static01.nyt.com/images/2024/11/23/multimedia/00nat-storm-stack-wmtf/00nat-storm-stack-wmtf-facebookJumbo.jpg	2024-11-24 02:16:16	The New York Times
us	https://cointelegraph.com/news/bitcoin-spoofing-btc-price-97-4-k-record-profit-taking	Bitcoin 'spoofing' drives BTC price to $97K amid record profit-taking - Cointelegraph	Bitcoin contends with order book spoofing as sellers attempt to keep a $100,000 BTC price from becoming reality.	https://images.cointelegraph.com/cdn-cgi/image/format=auto,onerror=redirect,quality=90,width=1200/https://s3.cointelegraph.com/uploads/2024-11/01935e0b-77ea-7ffd-9caf-6182b7a0b9bd	2024-11-24 12:21:35	Cointelegraph
us	https://www.espncricinfo.com/story/aus-vs-ind-1st-test-undercooked-australia-lose-the-plot-in-perth-1461497	Undercooked Australia lose the plot in Perth - ESPNcricinfo	The way they have unraveled over the past three days is uncharacteristic of a side usually so calm, calculated and clinical	https://img1.hscicdn.com/image/upload/f_auto/lsci/db/PICTURES/CMS/391500/391593.6.jpg	2024-11-24 12:24:33	ESPNcricinfo
us	https://www.cnbc.com/2024/11/24/wicked-soars-with-114-million-domestic-opening-gladiator-snares-55point5-million.html	'Wicked' soars with $114 million domestic opening, 'Gladiator' snares $55.5 million - CNBC	Universal's "Wicked" tallied an estimated $114 million domestic opening and Paramount's "Gladiator II" is set to haul in $55.5 million.	https://image.cnbcfm.com/api/v1/image/108056071-1730438126015-wicked2_Cropped.jpg?v=1730438207&w=1920&h=1080	2024-11-24 16:30:28	CNBC
us	https://247sports.com/longformarticle/deion-sanders-colorado-intoxicated-by-success-in-37-21-upset-loss-at-kansas-damaging-big-12-title-hopes-240370353/	Deion Sanders: Colorado 'intoxicated' by success in 37-21 upset loss at Kansas, damaging Big 12 title hopes - 247Sports	Coach Prime reveals what went wrong in upset loss.	https://s3media.247sports.com/Uploads/Assets/511/769/12769511.jpg?width=1200&height=628&crop=1.91:1&fit=cover	2024-11-24 11:12:41	247Sports
us	https://www.forbes.com/sites/davidrvetter/2024/11/24/developing-nations-ngos-reject-disaster-cop29-climate-deal/	Developing Nations, NGOs Reject ‘Disaster’ COP29 Climate Deal - Forbes	The COP29 climate conference ends in "disaster," as wealthy nations delivered a deal on finance that was rejected by key developing countries.	https://imageio.forbes.com/specials-images/imageserve/6742eb0803cf2a3fcabfca66/0x0.jpg?format=jpg&height=900&width=1600&fit=bounds	2024-11-24 11:52:04	Forbes
us	https://apnews.com/article/trump-tulsi-gabbard-intelligence-director-russia-putin-0f661dd39bd16e248b16c049e6aa26c5	Republicans lash out at Democrats' claims that Trump intelligence pick Gabbard is 'compromised' - The Associated Press	Republican lawmakers are pushing back against criticism from some Democrats that President-elect Donald Trump’s pick to lead U.S. intelligence services is “compromised” by her comments supportive of Russia and a meeting with an ally of that country.	None	2024-11-24 18:39:00	The Associated Press
us	https://www.bbc.com/news/articles/cwy4j5j7503o	Rabbi Zvi Kogan was murdered in UAE, Israel says - BBC.com	The Israeli-Moldovan national went missing on Thursday, sparking a joint Mossad and Emirates investigation.	https://ichef.bbci.co.uk/news/1024/branded_news/a329/live/fbb513d0-aa3d-11ef-b439-f3906715f55d.jpg	2024-11-24 17:03:31	BBC.com
us	https://www.nytimes.com/2024/11/23/us/politics/trump-agriculture-secretary.html	Trump Picks Brooke Rollins, a Conservative Lawyer, to Lead Agriculture Dept. - The New York Times	Ms. Rollins is the chief executive of the America First Policy Institute, a think tank created to promote President-elect Donald J. Trump’s agenda.	https://static01.nyt.com/images/2024/11/23/multimedia/00dc-agriculture-Rollins-vgwb/00dc-agriculture-Rollins-vgwb-facebookJumbo.jpg	2024-11-24 04:20:56	The New York Times
us	https://www.nytimes.com/2024/11/24/world/europe/israel-lebanon-hezbollah.html	Hezbollah Fires Waves of Projectiles Into Israel After Deadly Strike in Beirut - The New York Times	The waves of attacks on Sunday came amid diplomatic efforts to reach a cease-fire in the conflict.	https://static01.nyt.com/images/2024/11/24/multimedia/24mideast-ledeall-zfcj/24mideast-ledeall-zfcj-facebookJumbo.jpg	2024-11-24 11:05:03	The New York Times
us	https://www.bbc.com/news/articles/ckgzv77qrnro	Sudan in danger of becoming a failed state, Jan Egeland warns - BBC.com	Sudan is disintegrating after more than 18 months of civil war, aid chief Jan Egeland warns	https://ichef.bbci.co.uk/news/1024/branded_news/e694/live/bcc4f390-aa59-11ef-9739-6bd0dfdfa161.jpg	2024-11-24 12:42:29	BBC.com
us	https://www.yahoo.com/news/dartmouth-sorority-2-fraternity-members-003055111.html	Dartmouth sorority, 2 fraternity members charged in death of student found in river - Yahoo! Voices	A Dartmouth College sorority and two members of a fraternity were charged in connection with the drowning death of Won Jang, whose body was found over the summer in the Connecticut River following an off-campus party, police said.	https://s.yimg.com/ny/api/res/1.2/F0GbgVet0L03iWa14mVyNA--/YXBwaWQ9aGlnaGxhbmRlcjt3PTEyMDA7aD03OTk-/https://media.zenfs.com/en/nbc_news_122/7e9b4a51d7dada2bd579e4b8f02787af	2024-11-24 00:30:00	Yahoo! Voices
us	https://edition.cnn.com/2024/11/23/middleeast/lebanon-strikes-beirut-basta-intl/index.html	Dozens killed by Israeli strikes in Lebanon, including 29 in central Beirut - CNN	None	https://media.cnn.com/api/v1/images/stellar/prod/2024-11-23t075645z-1550354878-rc2vabadaf8t-rtrmadp-3-israel-palestinians-lebanon.jpg?c=16x9&q=w_800,c_fill	2024-11-23 21:45:00	CNN
us	https://edition.cnn.com/2024/11/23/us/colorado-plane-crash-civil-air-patrol/index.html	2 killed, 1 injured when Civil Air Patrol plane crashes during training exercise in Colorado - CNN	None	https://media.cnn.com/api/v1/images/stellar/prod/still-21150503-60-still.jpg?c=16x9&q=w_800,c_fill	2024-11-24 04:42:17	CNN
us	https://apnews.com/article/trump-national-debt-inflation-economic-growth-spending-895ec1551122a0e1babf24b657f650bb	The rising price of paying the national debt is a risk for Trump's promises on growth and inflation - The Associated Press	Donald Trump has big plans for the economy. He also has big debt problem that'll be a hurdle to delivering on those plan.	https://dims.apnews.com/dims4/default/200be0a/2147483647/strip/true/crop/5795x3260+0+302/resize/1440x810!/quality/90/?url=https%3A%2F%2Fassets.apnews.com%2Fd7%2F55%2F2b1e4d4d2e684ec13cd22bcba54f%2Fbc4192e087704795a738260c492ad1f8	2024-11-24 12:40:00	The Associated Press
us	https://www.politico.com/news/2024/11/24/sherrod-brown-senate-run-00191406	Ohio's Sherrod Brown won't rule out running for Senate again - POLITICO	The Ohio Democrat was defeated earlier this month.	https://static.politico.com/98/f2/8011d66b48fe8e8846f06ea0a3cd/election-2024-ohio-senate-27966.jpg	2024-11-24 14:11:39	POLITICO
us	https://www.forbes.com/sites/danrunkevicius/2024/11/24/most-pro-crypto-treasury-weve-ever-seen-trumps-historic-move-could-spark-bitcoin-and-crypto-price-boom/	‘Most Pro-Crypto Treasury We’ve Ever Seen’—Trump’s Historic Move Could Spark Bitcoin And Crypto Price Boom - Forbes	If confirmed, Bessent could act as a catalyst for a crypto and bitcoin price boom by helping to establish a clear regulatory framework for digital assets.	https://imageio.forbes.com/specials-images/imageserve/6742e2dd31fdbf047a6ad478/0x0.jpg?format=jpg&height=900&width=1600&fit=bounds	2024-11-24 13:09:28	Forbes
us	https://www.thedailybeast.com/duckworth-knocks-hegseths-military-record-pretty-low-ranking/	Duckworth Knocks Hegseth’s Military Record: ‘Pretty Low Ranking’ - The Daily Beast	None	None	2024-11-24 16:25:00	The Daily Beast
us	https://scheerpost.com/2024/11/24/patrick-lawrence-the-icc-warrants-and-the-world-they-announce/	Patrick Lawrence: The ICC Warrants and the World They Announce - Scheerpost.com	None	None	2024-11-24 10:02:07	Scheerpost.com
us	https://www.theguardian.com/world/2024/nov/23/the-ukraine-missile-crisis-putins-shadow-war-against-the-west-finally-breaks-cover	The Ukraine missile crisis: Putin’s shadow war against the west finally breaks cover - The Guardian	After Kyiv used Storm Shadow missiles, Russia’s leader asserted his ‘right’ to attack the UK and US. In truth, he has been doing exactly that for two years now	https://i.guim.co.uk/img/media/6cecdd95755a710e68422dd6cc70fd5ac1be5063/0_0_6000_3600/master/6000.jpg?width=1200&height=630&quality=85&auto=format&fit=crop&overlay-align=bottom%2Cleft&overlay-width=100p&overlay-base64=L2ltZy9zdGF0aWMvb3ZlcmxheXMvdG8tZGVmYXVsdC5wbmc&enable=upscale&s=da367150d8174a6f32bbdcf203ffb8e2	2024-11-23 15:20:00	The Guardian
us	https://www.businessinsider.com/trump-military-mass-deportation-plan-legal-limits-experts-2024-11	Trump's vow to use US troops for mass deportations could face intense resistance — starting from within the military - Business Insider	Trump's plan to use the military for mass deportations faces sharp legal limits. The administration's few options come with major potential blowback.	https://i.insider.com/673e59fbfa0140cdd564964a?width=1200&format=jpeg	2024-11-24 09:01:00	Business Insider
us	https://news.google.com/rss/articles/CBMinAFBVV95cUxQRDMwU0ZHczRfVklrVVBOZVJGWm5TbUZBUE0tMzEzOENuMTlzMklLQnUzdFQ1dENjdHNaNHQ2VkM3T2J0X0RWc1hMU3FlaDhuc1l0a1MxM0FhWHVoYWhWY1NmdUdsbEozaExkOXUyazZEc3hlTXhWbnhEQ20ycnkzamppVUZwTzRsRUZxdkgyaXRPLUljX053SVJldWw?oc=5	Trump’s national security pick: I’m on same page as Jake Sullivan about ‘our adversaries’ - POLITICO	“We are hand in glove. We are one team with the United States in this transition," Rep. Mike Waltz  said.	None	2024-11-24 17:37:24	POLITICO
us	https://abcnews.go.com/US/transgender-residents-living-bathroom-ban-reflect-sarah-mcbride/story?id=116129609	Transgender residents living under bathroom ban reflect on Sarah McBride controversy - ABC News	None	None	2024-11-23 11:08:29	ABC News
us	https://www.cbssports.com/nfl/news/nfl-week-12-bold-predictions-drake-maye-leads-patriots-to-upset-over-tua-tagovailoa-dolphins/	NFL Week 12 bold predictions: Drake Maye leads Patriots to upset over Tua Tagovailoa, Dolphins - CBS Sports	Five bold predictions for a Week 12 that began with an upset in Cleveland	https://sportshub.cbsistatic.com/i/r/2024/11/08/28a13859-db2b-4dcc-968d-98c3ea1a80c4/thumbnail/1200x675/c3ebcf09b4600581bc91ff87247bba9e/getty-drake-maye-patriots.jpg	2024-11-24 16:29:00	CBS Sports
us	https://apnews.com/article/trump-project-2025-administration-nominees-843f5ff20131ccba5f056e7ccc5baf23	After Trump’s Project 2025 denials, he is tapping its authors and influencers for key roles - The Associated Press	During the campaign, President-elect Donald Trump denied knowing anything about the “ridiculous and abysmal” plans, even though some were written by his former aides and many allies. 	https://dims.apnews.com/dims4/default/80edd37/2147483647/strip/true/crop/3851x2166+0+200/resize/1440x810!/quality/90/?url=https%3A%2F%2Fassets.apnews.com%2F7c%2Fe0%2F119c35abe3589582672b9d9486ff%2Fb7f97bc6c48a426cb5263cdd653f6c53	2024-11-23 22:22:00	The Associated Press
us	https://www.nytimes.com/2024/11/24/us/politics/donald-trump-2024-campaign-transition.html	Trump Is Running His Transition Team on Secret Money - The New York Times	Breaking with past practice, President-elect Donald J. Trump has not agreed to disclose the donors paying for his planning effort or to limit their contributions.	https://static01.nyt.com/images/2024/11/23/multimedia/23pol-transition-fundraising-pqft/23pol-transition-fundraising-pqft-facebookJumbo.jpg	2024-11-24 10:03:55	The New York Times
us	https://www.cbssports.com/college-football/news/bowl-projections-alabama-exits-college-football-playoff-field-indiana-remains-among-at-large-teams/	Bowl projections: Alabama exits College Football Playoff field, Indiana remains among at-large teams - CBS Sports	There were some notable moves in the CFP projections this week amid the chaos of the Week 13 slate	https://sportshub.cbsistatic.com/i/r/2024/11/24/6f877217-17b7-46df-93a5-f0bb11de6002/thumbnail/1200x675/e1371d47af66491a79d9d848b985f3d2/bama-bowl-projections.png	2024-11-24 14:03:00	CBS Sports
us	https://www.formula1.com/en/latest/article/the-four-time-world-champions-verstappen-joins-in-the-all-time-list-and.DIIOvqAthyjnqsyOrzMon	The four-time world champions Verstappen now joins - Formula 1	Max Verstappen is now one of a select group of drivers in F1 history to become a four-time world champion, having sealed the title at the Las Vegas Grand Prix. In light of the Dutchman’s achievement, we’ve been taking a look at the famous names he joins on the all-time list – as well as the three who still remain ahead of him…	https://media.formula1.com/image/upload/t_16by9Centre/f_auto/q_auto/v1732445901/fom-website/2024/Las%20Vegas%20GP/Formula%201%20header%20template%20-%202024-11-24T105719.706.png	2024-11-24 16:30:09	Formula 1
us	https://www.nytimes.com/athletic/5940184/2024/11/24/ipswich-man-utd-amorim/	Ipswich Town 1 Manchester United 1 – That opening goal, Onana’s importance, what Amorim has to do - The Athletic - The Athletic	Our writers break down the action from Ruben Amorim's first match in charge of Manchester United	https://static01.nyt.com/athletic/uploads/wp/2024/11/24120702/GettyImages-2185794481-scaled.jpg?width=1200&height=630&fit=cover	2024-11-24 20:48:45	The Athletic
us	https://www.buckys5thquarter.com/2024/11/24/24304609/wisconsin-badgers-what-went-wrong-in-44-25-loss-to-nebraska-cornhuskers-coaching-errors	Badgers news: What Went Wrong in Wisconsin’s 44-25 loss to Nebraska - Bucky's 5th Quarter	None	None	2024-11-24 13:38:35	Bucky's 5th Quarter
us	https://www.sounderatheart.com/2024/11/stefan-frei-turns-in-performance-for-the-ages/	Stefan Frei turns in performance for the ages - Sounder At Heart	Sounders goalkeeper makes nine saves and at times seemed to put his teammates on his back.	https://www.sounderatheart.com/content/images/size/w1200/2024/11/USATSI_24840351.jpg	2024-11-24 14:07:04	Sounder At Heart
us	https://www.orlandosentinel.com/2024/11/24/florida-gators-ole-miss-rebels-football-sec-billy-napier-lane-kiffin-dj-lagway-caleb-banks/	3 things learned from UF’s upset of No. 9 Ole Miss - Orlando Sentinel	None	None	2024-11-24 11:01:29	Orlando Sentinel
us	https://www.theguardian.com/tv-and-radio/2024/nov/24/chuck-woolery-dead-wheel-of-fortune-love-connection	Chuck Woolery, host of Love Connection, dies aged 83 - The Guardian	A musician, the original Wheel of Fortune host and later a rightwing podcaster, Woolery died at home in Texas	https://i.guim.co.uk/img/media/723da2e7a5d74fb905bb3f8b8df583b3098a71fc/197_185_2574_1544/master/2574.jpg?width=1200&height=630&quality=85&auto=format&fit=crop&overlay-align=bottom%2Cleft&overlay-width=100p&overlay-base64=L2ltZy9zdGF0aWMvb3ZlcmxheXMvdGctZGVmYXVsdC5wbmc&enable=upscale&s=af2c83c0171f026f5ce88d232e50336e	2024-11-24 18:01:00	The Guardian
us	https://www.hogshaven.com/2024/11/24/24303698/commanders-vs-cowboys-how-to-watch-tv-schedule-injury-report-odds-and-more	Commanders vs Cowboys: How to watch, TV schedule, injury report, odds and more - Hogs Haven	Get ready for game day!	https://cdn.vox-cdn.com/thumbor/XccO1GgOBzq0GgR7PgjhqyA3OAw=/0x0:6000x3141/fit-in/1200x630/cdn.vox-cdn.com/uploads/chorus_asset/file/25751130/1931500597.jpg	2024-11-24 13:00:00	Hogs Haven
us	https://www.nbcsports.com/nfl/profootballtalk/rumor-mill/news/the-awkward-dance-continues-between-the-jets-and-aaron-rodgers	The awkward dance continues between the Jets and Aaron Rodgers - NBC Sports	The excuses for Rodgers's poor performance this season are emerging.	https://nbcsports.brightspotcdn.com/dims4/default/46f9be3/2147483647/strip/true/crop/8256x4644+0+430/resize/1440x810!/quality/90/?url=https%3A%2F%2Fnbc-sports-production-nbc-sports.s3.us-east-1.amazonaws.com%2Fbrightspot%2F0b%2F8d%2Fb60f0f0446979f3f5f177336e236%2Fhttps-delivery-gettyimages.com%2Fdownloads%2F2186533960	2024-11-24 14:34:21	NBC Sports
us	https://www.oddschecker.com/us/picks-parlays/football/nfl/20241124-vikings-vs-bears-prediction-pick-against-the-spread-latest-odds	Vikings vs. Bears Prediction, Pick Against the Spread, Latest Odds - OddsChecker	The Chicago Bears will host the Minnesota Vikings on Sunday afternoon for an NFC North divisional battle at Soldier Field. The Bears have shown signs of promise, but can they pull the upset against T.J. Hockenson and the Vikings today? Matt McCuen is expecting a close one in Chicago, and gives us several bonus picks from our oddschecker+ Positive EV Tool for Vikings vs. Bears.	https://images.oddschecker.com/pnq4hpds29uh/6K0ECrL8cgWQlh8RelCxMn/0d8620815064927a6ce4bd8a3b7a8019/GettyImages-1440703513.jpg	2024-11-24 13:56:00	OddsChecker
us	https://www.cbssports.com/nfl/news/pete-priscos-week-12-nfl-picks-rams-cool-off-red-hot-eagles-in-prime-time-chargers-top-ravens-on-mnf/	Pete Prisco's Week 12 NFL picks: Rams cool off red-hot Eagles in prime time, Chargers top Ravens on 'MNF' - CBS Sports	Pete Prisco reveals all his Week 12 picks, including an upset on Sunday night	https://sportshub.cbsistatic.com/i/r/2024/11/19/61a20240-c1cd-42bd-991a-e6d4a80bdf39/thumbnail/1200x675/0f62ccca4ffc9fc6954688290451163a/stafford-mcvay-g.jpg	2024-11-24 12:18:34	CBS Sports