country_code	url	title	description	image_url	publish_date	source
us	https://www.cbsnews.com/news/sinaloa-cartel-members-killed-mexico-troops/	19 suspected members of powerful Sinaloa cartel killed in shootout with troops in Mexico - CBS News	Sinaloa has seen a surge in violence since the July arrest of the cartel's co-founder Ismael "El Mayo" Zambada in the U.S.	https://assets1.cbsnewsstatic.com/hub/i/r/2024/10/23/aa6e12ca-249c-43aa-99ea-72a5e8083bb7/thumbnail/1200x630/0479c71df08d28227025cd4b66c50d4d/gettyimages-2178438302.jpg?v=b241b87adbbb7f0a227ed35b96d0cefa	2024-10-23 10:38:00	CBS News
us	https://www.cbsnews.com/news/suspect-identified-dnc-shootings-tempe-arizona/	Police identify suspect arrested in 3 attacks on DNC offices in Arizona - CBS News	The suspect was also arrested for allegedly hanging suspicious bags of white power from political signs lined with razor blades.	https://assets1.cbsnewsstatic.com/hub/i/r/2024/10/23/dd10522f-79e4-4f18-9b3d-8cc8ccba986f/thumbnail/1200x630/22085049cde130fd0d3110db14cac967/gettyimages-2097711914.jpg?v=c72f52c71e431fd7dde1ba5ae2f69280	2024-10-23 17:34:05	CBS News
us	https://abcnews.go.com/US/911-calls-released-trump-assassination-attempt-butler-county/story?id=115083281	911 calls from Trump assassination attempt in Butler County released - ABC News	None	None	2024-10-23 21:29:57	ABC News
us	https://edition.cnn.com/2024/10/23/politics/mcconnell-trump-gop-new-book/index.html	McConnell says ‘MAGA movement is completely wrong’ and Reagan ‘wouldn’t recognize’ Trump’s GOP - CNN	None	None	2024-10-23 22:51:00	CNN
us	https://www.usatoday.com/story/news/politics/2024/10/23/trump-mcdonalds-pennsylvania-yelp/75807528007/	Yelp disables reviews for PA McDonald's location after Trump's visit triggers wave of comments, ratings - USA TODAY	Yelp disabled commenting and reviews for the McDonald's in Feasterville, Pennsylvania that former President Donald Trump visited over the weekend.	https://www.usatoday.com/gcdn/authoring/authoring-images/2024/10/23/USAT/75808376007-20241020-t-182732-z-1811678416-rc-2-ioaa-6-s-7-nd-rtrmadp-3-usaelectiontrump.JPG?crop=5090,2863,x0,y0&width=3200&height=1800&format=pjpg&auto=webp	2024-10-23 17:18:29	USA TODAY
us	https://www.foxnews.com/politics/harris-trump-showdown-new-national-poll-shows-who-has-the-edge-2-weeks-election	Harris-Trump showdown: New national poll shows who has the edge 2 weeks from Election Day - Fox News	A new national poll from the Wall Street Journal is the latest to indicate former President Trump with a slight edge over Vice President Harris in the White House race to succeed President Biden	https://static.foxnews.com/foxnews.com/content/uploads/2024/10/trump-harris-pennsylvania-split.jpg	2024-10-24 01:32:00	Fox News
us	https://www.bbc.com/news/articles/c3de9kez3rko	Angela Rayner defends Labour after Trump campaign complaint - BBC.com	The row over Labour volunteers campaigning in the US election was raised at Prime Minister's Questions. 	https://ichef.bbci.co.uk/news/1024/branded_news/b7c0/live/dedc9890-9143-11ef-b4ff-9d87c6202a99.png	2024-10-23 19:57:11	BBC.com
us	https://apnews.com/article/michael-avenatti-stormy-daniels-vacated-sentence-trump-727e42e06f011be2e001e3173ce2f2bb	Federal appeals panel says suspended lawyer Michael Avenatti should be resentenced - The Associated Press	A federal appeals panel has vacated a 14-year sentence for suspended lawyer Michael Avenatti. Avenatti rose to fame representing porn star Stormy Daniels against former President Donald Trump and was later convicted of bilking his California clients.	https://dims.apnews.com/dims4/default/abc8d7f/2147483647/strip/true/crop/5760x3240+0+300/resize/1440x810!/quality/90/?url=https%3A%2F%2Fassets.apnews.com%2Fbd%2F8c%2Fda4191f3a8f6b7dcf45ba115de23%2F1bc38bf3662848df9b099954adcbd7ec	2024-10-23 20:38:00	The Associated Press
us	https://www.vox.com/today-explained-podcast/378929/north-carolina-election-2024-hurricane-helene-turnout	How Hurricane Helene scrambled the election in North Carolina - Vox.com	Will storm damage depress turnout in a key battleground state?	https://platform.vox.com/wp-content/uploads/sites/2/2024/10/gettyimages-2178247386_486427.jpg?quality=90&strip=all&crop=0%2C9.5104877894802%2C100%2C80.97902442104&w=1200	2024-10-22 11:00:00	Vox.com
us	https://www.wktv.com/news/local/national-and-international-news-in-focus-oct-22/article_90c691c9-77df-5d25-bf75-801fe08163c8.html	National and International News in Focus: Oct. 22 - WKTV	An “affordability shift” is taking root in the U.S. auto industry. The trend is being led by people who feel they can no longer afford a new vehicle that would	https://bloximages.newyork1.vip.townnews.com/wktv.com/content/tncms/assets/v3/editorial/2/a6/2a6bff40-8a40-11ef-b0dd-f7aa3fd3d1bf/670d375463a70.image.jpg?crop=1920%2C1008%2C0%2C35&resize=1200%2C630&order=crop%2Cresize	2024-10-22 14:17:56	WKTV
us	https://edition.cnn.com/2024/10/23/politics/video/trump-campaign-manager-chris-lacivita-tweets-kflile-ebof-digvid	New KFile report: Trump's campaign manager at one time pushed posts calling Jan 6 'sickening' - CNN	None	https://media.cnn.com/api/v1/images/stellar/prod/chris-lacivita.jpg?c=16x9&q=w_800,c_fill	2024-10-23 23:56:48	CNN
us	https://www.cbsnews.com/news/grizzly-bear-wyoming-fatally-struck-yearling-cub/	World famous grizzly bear fatally struck in Wyoming had yearling cub with her - CBS News	A 28-year-old grizzly bear was fatally struck on a highway in Wyoming, park officials said.	https://assets3.cbsnewsstatic.com/hub/i/r/2024/10/23/a4c476ec-42d9-433e-8e50-5f5d8b3251f1/thumbnail/1200x630/4d198b28a3690fa4a632f6297b2e6dc7/nps-grte-202305160001.jpg?v=c72f52c71e431fd7dde1ba5ae2f69280	2024-10-23 22:00:00	CBS News
us	https://www.bbc.com/news/articles/cq646evy26go	Key takeaways: What you missed from Harris's NBC interview - BBC.com	Harris answered questions about Joe Biden's dropping out of the race and whether she would pardon Donald Trump. 	https://ichef.bbci.co.uk/news/1024/branded_news/7dd7/live/b9ca87b0-90d0-11ef-bd1a-9ff4ed9729d9.jpg	2024-10-23 02:23:47	BBC.com
us	https://edition.cnn.com/2024/10/23/health/mcdonalds-e-coli-quarter-pounder-investigation/index.html	What we know about the McDonald’s E. coli outbreak investigation - CNN	None	https://media.cnn.com/api/v1/images/stellar/prod/gettyimages-660695038.jpg?c=16x9&q=w_800,c_fill	2024-10-24 02:44:00	CNN
us	https://www.cbsnews.com/news/four-space-station-fliers-undock-and-head-for-friday-splashdown-to-wrap-up-extended-mission/	Four space station fliers undock and head for Friday splashdown to wrap up extended mission - CBS News	Spending a month longer than planned aboard the ISS, three NASA astronauts and a Russian cosmonaut are finally headed home.	https://assets1.cbsnewsstatic.com/hub/i/r/2024/10/23/57b4f682-80da-4346-b5b5-ad26aacf7d76/thumbnail/1200x630/1cfc4ed0158194eb288589d123bb7350/crew-portrait-cropped.jpg?v=c72f52c71e431fd7dde1ba5ae2f69280	2024-10-23 22:51:29	CBS News
us	https://www.bbc.com/reel/video/p0jyrzsg/the-history-of-swing-states-in-the-us	The history of swing states in the US - BBC.com	The US Presidential elections did not always depend on just these seven states.	https://ichef.bbci.co.uk/images/ic/1024xn/p0jys4dp.jpg	2024-10-21 05:17:36	BBC.com
us	https://www.nba.com/pelicans/news/bulls-vs-pelicans-game-how-to-watch-live-stream-tv-channel-start-time-10-23-2024	How to Watch New Orleans Pelicans vs. Chicago Bulls: TV Channel, Live Stream, Radio, Start Time - Oct. 23, 2024 - NBA.com	Watch New Orleans Pelicans vs. Chicago Bulls live on TV or stream online. Game airs Wednesday, Oct. 23 at 7:00 pm CT. Get TV info, streaming options, and start time now!	https://cdn.nba.com/teams/uploads/sites/1610612740/2024/10/how-to-watch-new-orleans-pelicans-games.jpg	2024-10-23 19:31:00	NBA.com
us	https://nypost.com/2024/10/23/sports/yankees-can-turn-rotation-edge-into-world-series-winning-formula/	Yankees can turn rotation edge into World Series-winning formula - New York Post 	So much of the 120th World Series — the 12th between the Yankees and Dodgers — is going to hinge on starting pitching.	https://nypost.com/wp-content/uploads/sites/2/2024/10/newspress-collage-7hrztxfqt-1729728449059.jpg?quality=75&strip=all&1729714140&w=1024	2024-10-24 00:18:00	New York Post 
us	https://www.texastribune.org/2024/10/22/texas-voter-verification-lawsuit-paxton/	Texas sues Biden administration for not providing data on noncitizens - The Texas Tribune	Attorney General Ken Paxton accused the federal government of failing to provide citizenship data for registered voters, even as he acknowledged that the vast majority of the people on the rolls are lawful voters.	https://thumbnails.texastribune.org/uFhiiWO3mZm-D4fQ8JL1urOhmg8=/1200x630/filters:quality(95)/static.texastribune.org/media/files/3012ed17a6ea193cb262dcf6dfe00985/0523%20GOP%20Convention%20EH%2041.jpg	2024-10-23 03:08:29	The Texas Tribune
us	https://edition.cnn.com/2024/10/23/politics/us-israel-warn-potential-attack-sri-lanka/index.html	US and Israel warn of potential attack on tourist locations in Sri Lanka - CNN	None	https://media.cnn.com/api/v1/images/stellar/prod/gettyimages-673112576-restricted.jpg?c=16x9&q=w_800,c_fill	2024-10-24 03:26:00	CNN
us	https://apnews.com/article/turning-point-election-2024-donald-trump-2b3580134a6b19dff18771c3fdb0f11a	Donald Trump tells supporters to ‘just vote’ at lively Georgia rally organized by Charlie Kirk - The Associated Press	Republican Donald Trump is pushing supporters in Georgia to get out and vote for him in a state that could be crucial in the presidential election.	https://dims.apnews.com/dims4/default/f93adf0/2147483647/strip/true/crop/3174x1785+0+170/resize/1440x810!/quality/90/?url=https%3A%2F%2Fassets.apnews.com%2Fd2%2F4f%2F3d19f5ce16cc08ddfaac104325ad%2F6b31adc9b0cf4887ac3945d8175d7457	2024-10-24 03:38:00	The Associated Press
us	https://www.aljazeera.com/news/2024/10/23/gisele-pelicot-tells-mass-rape-trial-its-not-us-who-should-feel-shame	Gisele Pelicot tells mass rape trial ‘it’s not us who should feel shame’ - Al Jazeera English	Addressing French court for second time, Pelicot says she’s determined to change how society confronts sexual violence.	https://www.aljazeera.com/wp-content/uploads/2024/10/pelicot-1729713245.jpg?resize=1920%2C1440	2024-10-23 20:48:22	Al Jazeera English
us	https://www.whitehouse.gov/briefing-room/statements-releases/2024/10/23/statement-from-president-joe-biden-on-historic-decision-to-leverage-russian-sovereign-assets-to-support-ukraine/	Statement from President Joe Biden on Historic Decision to Leverage Russian Sovereign Assets to Support Ukraine - The White House	This summer, I led an effort to bring the G7 together to commit $50 billion in Extraordinary Revenue Acceleration loans to Ukraine backed by the profits	https://www.whitehouse.gov/wp-content/uploads/2021/01/wh_social-share.png	2024-10-23 17:11:06	The White House
us	https://www.cbsnews.com/news/georgia-secretary-of-state-office-cyberattack/	Georgia secretary of state's office says it repelled cyberattack - CBS News	The secretary of state's office in Georgia says it was unsuccessfully targeted by a cyberattack earlier this month.	https://assets3.cbsnewsstatic.com/hub/i/r/2024/10/24/02b0dfc0-6f7e-4748-8d1e-a71cc9d5d80d/thumbnail/1200x630/f2e0881401bdab2a35e0ecd0221f2c91/gettyimages-2180528163.jpg?v=c72f52c71e431fd7dde1ba5ae2f69280	2024-10-24 03:29:28	CBS News
us	https://abc7chicago.com/post/teen-arrested-after-5-family-members-killed-domestic-violence-incident-home-fall-city-washington-another-injured/15458601/	Teen arrested after 5 family members killed in 'domestic violence incident' at home in Fall City, Washington; another injured - ABC7 Chicago	None	None	2024-10-23 14:14:25	ABC7 Chicago
us	https://news.google.com/rss/articles/CCAiC204NGhhNEZKc1JJmAEB?oc=5	HORNETS at ROCKETS | FULL GAME HIGHLIGHTS | October 23, 2024 - NBA	None	None	2024-10-24 02:50:42	NBA
us	https://www.espn.com/soccer/story/_/id/41965785/with-bayern-crushed-barca-raphinha-look-ominous-pre-clasico	With Bayern crushed, Barça and Raphinha look ominous pre-Clásico - ESPN	Raphinha proved that he is in career-best form with a hat trick against Bayern Munich. Now, the Clasico awaits.	https://a.espncdn.com/combiner/i?img=%2Fphoto%2F2024%2F1023%2Fr1404787_1296x729_16%2D9.jpg	2024-10-23 23:26:00	ESPN
us	https://www.independent.co.uk/news/world/americas/us-politics/trump-harris-election-live-updates-town-hall-cnn-b2634340.html	Harris says she believes Trump is a ‘fascist’ at CNN Town Hall: Election 2024 Live Updates - The Independent	Kamala Harris interviewed Anderson Cooper in Pennsylvania as Donald Trump campaigned in Georgia	https://static.independent.co.uk/2024/10/23/09/2178013792.jpg?quality=75&width=1200&auto=webp	2024-10-24 02:10:14	The Independent
us	https://www.bbc.com/news/articles/c748l0zv4x8o	US warns Elon Musk that his $1m voter giveaway may be illegal - BBC.com	The Department of Justice is probing whether the prizes violate laws against paying people to vote. 	https://ichef.bbci.co.uk/news/1024/branded_news/6922/live/84b902d0-9185-11ef-8e6d-e3e64e16c628.jpg	2024-10-24 06:23:28	BBC.com
us	https://www.washingtonpost.com/world/2024/10/23/austin-north-korea-troops-russia/	North Korean troops are in Russia, would be ‘legitimate targets’ in Ukraine, U.S. says - The Washington Post	The Biden administration said that at least 3,000 North Korean troops are training in Russia, though it remains unclear if they’ll join the war.	https://www.washingtonpost.com/wp-apps/imrs.php?src=https://arc-anglerfish-washpost-prod-washpost.s3.amazonaws.com/public/Y2YI2BMS22PYFMPUR2EWAX62YQ_size-normalized.JPG&w=1440	2024-10-24 04:56:50	The Washington Post
us	https://edition.cnn.com/2024/10/23/media/los-angeles-times-endorsement-harris-resign/index.html	Los Angeles Times editor resigns after newspaper owner blocked plans to endorse Harris - CNN	None	https://media.cnn.com/api/v1/images/stellar/prod/gettyimages-2176620188.jpg?c=16x9&q=w_800,c_fill	2024-10-24 03:12:00	CNN
us	https://abcnews.go.com/US/accused-serial-killer-bruce-lindahl-idd-suspect-1979/story?id=115060299	Accused serial killer Bruce Lindahl ID'd as suspect in 1979 cold case murder: Police - ABC News	None	None	2024-10-23 19:47:01	ABC News
us	https://www.timesofisrael.com/idf-pounds-beirut-after-hezbollahs-simhat-torah-eve-rocket-fire-at-central-israel/	IDF pounds Beirut after Hezbollah’s Simhat Torah eve rocket fire at central Israel - The Times of Israel	None	None	2024-10-24 01:02:45	The Times of Israel
us	https://abcnews.go.com/International/turkey-reports-casualties-terrorist-attack-aerospace-facility/story?id=115063342	At least 5 dead in 'terrorist attack' on aerospace facility in Turkey, officials say - ABC News	None	None	2024-10-23 22:05:04	ABC News
us	https://edition.cnn.com/2024/10/23/politics/iranian-hackers-probed-us-election-websites/index.html	Iranian hackers have probed US election websites for vulnerabilities, Microsoft says - CNN	None	https://media.cnn.com/api/v1/images/stellar/prod/gettyimages-1319757302.jpg?c=16x9&q=w_800,c_fill	2024-10-24 01:36:00	CNN
us	https://www.yahoo.com/news/huge-top-georgia-election-official-210155020.html	'It's huge': Top Georgia election official makes explosive prediction about early voting turnout - Yahoo! Voices	Georgia Secretary of State Brad Raffensperger spoke with Fox News Digital about his state breaking early voting turnout records.	https://s.yimg.com/ny/api/res/1.2/KwYWOX7VWJqUD_nocmoNbg--/YXBwaWQ9aGlnaGxhbmRlcjt3PTEyMDA7aD02NzU7Y2Y9d2VicA--/https://media.zenfs.com/en/fox_news_text_979/ba613334bfd48b3988f8406377605adb	2024-10-23 21:01:55	Yahoo! Voices
us	https://deadline.com/2024/10/donald-trump-accused-groping-model-stacey-williams-jeffrey-epstein-1236157092/	Donald Trump Accused Of Groping Former Model Stacey Williams As Part Of “Twisted Game” With Jeffrey Epstein - Deadline	Donald Trump, the Presidential candidate, has been accused of groping former model Stacey Williams.	None	2024-10-24 08:54:00	Deadline
us	https://edition.cnn.com/2024/10/23/politics/video/border-wall-kamala-harris-cnn-town-hall-digvid	Cooper presses Harris on supporting border bill after calling border wall 'stupid,' 'useless' - CNN	None	https://media.cnn.com/api/v1/images/stellar/prod/20241023-cooper-harris-split.jpg?c=16x9&q=w_800,c_fill	2024-10-24 01:40:19	CNN
us	https://texasattorneygeneral.gov/news/releases/office-attorney-general-sets-record-straight-about-nikki-curtiss-death-rebutting-jeff-leachs-and-joe	Office of the Attorney General Sets the Record Straight About Nikki Curtis’s Death, Rebutting Jeff Leach’s and Joe Moody’s Lies About Convicted Child Murderer - Office of the Attorney General (.gov)	The Office of the Attorney General released the original autopsy report and other evidence to correct falsehoods amplified by a coalition interfering with the capital punishment proceedings in which Robert Roberson was scheduled to be executed for the murder of his two-year-old daughter Nikki.	https://texasattorneygeneral.gov/sites/default/files/images/admin/images/2019/PR-Twitter-Card.png	2024-10-24 00:16:01	Office of the Attorney General (.gov)
us	https://edition.cnn.com/2024/10/23/politics/national-mall-kamala-harris-speech/index.html	Harris to deliver closing argument speech at Ellipse, site of Trump’s January 6 rally - CNN	None	https://media.cnn.com/api/v1/images/stellar/prod/gettyimages-2179173305.jpg?c=16x9&q=w_800,c_fill	2024-10-23 22:21:00	CNN
us	https://apnews.com/article/boeing-earnings-strike-vote-new-ceo-af6c6dab8747d5b8189df97a55e6b8d9	Boeing factory workers vote to reject contract and continue 6-week strike - The Associated Press	Voting began just hours after Boeing reported losing $6.2 billion in the third quarter, largely because of huge write-downs in both its aircraft and defense businesses.	https://dims.apnews.com/dims4/default/0e11ee8/2147483647/strip/true/crop/4747x2670+0+247/resize/1440x810!/quality/90/?url=https%3A%2F%2Fassets.apnews.com%2F73%2F0a%2F0fad7ccf05c57cbaf374943026e7%2Fd2478689da464cd0b542647b7e67f68a	2024-10-24 03:55:00	The Associated Press
us	https://www.ft.com/content/b49d53e4-631a-402f-9dc1-d22f708f97fe	Tesla’s upbeat earnings and bullish forecast propel shares up 12% - Financial Times	Elon Musk’s carmaker predicts ‘slight growth’ in 2024 deliveries despite sluggish start to the year	https://www.ft.com/__origami/service/image/v2/images/raw/https%3A%2F%2Fd1e00ek4ebabms.cloudfront.net%2Fproduction%2Ffaa2b1bf-2589-49a0-9785-c01d3958b907.jpg?source=next-barrier-page	2024-10-24 01:31:25	Financial Times
us	https://www.aol.com/news/gop-attack-ads-california-house-175432719.html	GOP attack ads in California House races link Democrats to pedophiles - AOL	In some California races that could determine which party controls Congress next year, Republican attacks link Democrats to pedophiles.	https://s.yimg.com/ny/api/res/1.2/1ZD49GqN2Qz.ZTg6xQ35eQ--/YXBwaWQ9aGlnaGxhbmRlcjt3PTEyMDA7aD04MDA-/https://media.zenfs.com/en/aol_la_times_articles_830/7e07f4cc3ebedeadcaaf68601dc28ec7	2024-10-23 18:43:24	AOL
us	https://www.cnbc.com/2024/10/23/nobel-prize-winning-economists-donald-trump-agenda-endorse-harris.html	'Higher prices, larger deficits': 23 Nobel Prize-winning economists slam Trump agenda, endorse Harris - CNBC	Experts estimate that Donald Trump's budget plan would expand federal deficits by five times more than Vice President Kamala Harris' proposals.	https://image.cnbcfm.com/api/v1/image/108004530-1720705364298-Untitled-6.jpg?v=1729704307&w=1920&h=1080	2024-10-23 16:08:34	CNBC
us	https://news.google.com/rss/articles/CBMilgFBVV95cUxOSlFWbmZCWlN3bXo1alBwY3ZFMHM1bnhEVENnSENHNHFvTGE5UmdRN1ItZU9jczUxdW1Ra1FiQUd3N1NqX3d3S2VHbTY1NmQ5bU9iWnN2WnRBTUYxZ3c2bEJtWDJRdUtTeC12MVhiSlk4Qm5mNFYwTDhNS1RNZTdDNGN3cXBRUDZ4a3MzSUVxbkU1UHlLTVE?oc=5	Georgia citizenship audit finds few noncitizens on voter rolls - The Associated Press	Georgia’s top elections official says a check of voter rolls found that 20 of the 8.2 million people registered to vote in the state are not U.S. citizens.	None	2024-10-23 17:25:00	The Associated Press
us	https://news.google.com/rss/articles/CBMipwFBVV95cUxPSXJ4NjgtUkZRNVNQbW1FTW5WYktOM2pobW5zS1llbEhUODE2b2t6U0dZWlZscm83cEJrcjVjaElGano2ZmVGRk9keTlid2JTRzNxTU0tR0NJZ3pvb2JiZTExSGRjaEtnQ1ZBRXdhNWZBcmtWUFA1RnRaTXducEtINmVOdUVTWjlaNDhBNlNNR3hGOVRlWXNDOVlfc2x6UWZtTE1DSVpqMA?oc=5	Harris ad shows a Texas woman who lost baby and nearly died from sepsis amid strict abortion ban - The Associated Press	A striking new Kamala Harris campaign ad campaign that seeks to highlight increasingly perilous medical care for women since the fall of Roe tells the story of a Texas woman named Ondrea who got a life-threatening infection when she couldn’t get medical care after she miscarried, and now may no long	None	2024-10-23 14:22:00	The Associated Press
us	https://news.google.com/rss/articles/CBMinAFBVV95cUxOUl96VFVjMnVJajRHNUJhU2VkcUNDZmZwNTFycXhRXzAwX0pCN0s1aGtOeTctaE5LZG42M0o4T3JVU1Aya2plY211NEhQYmh4eU5XeHBiZ1pYanM3Z2FNYUluUEhWSEdZWkhtSWJLZWYwemJ3RGtTSkZxaHV4Y0lxOXB1RlBkXzQ4UThTTklaVTBKZ0Y2RUZabmxXa1nSAaIBQVVfeXFMTXRJTEVFX2xzQjU3YUVRb3NzNi1FOUd4TEJVZWZjUEI1dTBScG9TMmxENUdkanJyZlEwUV9lV05vbEhNY3R1RG5HeHhQWnFJc01vMWZ3MnQ5MmpzZjB1NW9ZSTZYYWQ3YnlSVnNxUTRSSHhrZ1NMMlNEVXlqQ0w0VjRTZzdGUGtpNFU0bV9pSlRsTkJ0Wm1aUkFxdmczYWkxQk93?oc=5	Apple and Goldman Sachs ordered to pay $89M over Apple Card failures - Fox Business	Apple and Goldman Sachs are being ordered by the Consumer Financial Protection Bureau to pay a combined $89 million in fines stemming from customer service issues with the Apple Card and regulatory violations.	https://a57.foxnews.com/static.foxbusiness.com/foxbusiness.com/content/uploads/2024/10/0/0/apple-card-tim-cook.jpg?ve=1&tl=1	2024-10-23 19:54:00	Fox Business
us	https://news.google.com/rss/articles/CCAiC2d6UjA3ckNYSUU4mAEB?oc=5	SUNS at CLIPPERS | FULL GAME HIGHLIGHTS | October 23, 2024 - NBA	None	None	2024-10-24 05:16:32	NBA
us	https://abcnews.go.com/538/trump-gained-538s-forecast-election-toss/story?id=114907042	Trump has gained in 538's forecast, but the election is still a toss-up - ABC News	None	None	2024-10-18 20:01:10	ABC News
us	https://www.cnbc.com/2024/10/23/stock-market-today-live-updates.html	S&P 500 futures are little changed after index posts three straight losing days: Live updates - CNBC	The Dow Jones Industrial Average and the S&P 500 racked up three consecutive losing sessions on Wednesday.	https://image.cnbcfm.com/api/v1/image/108051729-1729698442726-108051729-17296983512024-10-23t153356z_1152669396_rc2eqaaanosd_rtrmadp_0_usa-stocks.jpeg?v=1729698456&w=1920&h=1080	2024-10-24 08:04:00	CNBC