country_code	url	title	description	image_url	publish_date	source
us	https://www.bbc.com/news/articles/cvgxly3nzwpo	The week of rising stakes in the Ukraine war - BBC.com	Russia made its loudest threat yet of nuclear war, as Western powers bolstered Ukraine's arsenal.	https://ichef.bbci.co.uk/news/1024/branded_news/2f07/live/a14ab890-a8f4-11ef-bd0f-0d1ca4dde78e.jpg	2024-11-22 23:49:10	BBC.com
us	https://www.nytimes.com/2024/11/22/world/middleeast/israel-icc-jurisdiction-explained.html	How Can the I.C.C. Prosecute Leaders of Israel, Which Is Not a Member? - The New York Times	The jurisdiction of the court in The Hague can extend beyond member states.	https://static01.nyt.com/images/2024/11/22/multimedia/22israel-icc-explainer-01-cjhp/22israel-icc-explainer-01-cjhp-facebookJumbo.jpg	2024-11-23 02:13:37	The New York Times
us	https://www.govexec.com/management/2024/11/senator-previews-what-closing-down-education-department-would-actually-look/401264/	Senator previews what closing down the Education Department would actually look like - Government Executive	Many of the department’s core functions would transfer to other agencies.	https://cdn.govexec.com/media/img/cd/2024/11/22/112224_Getty_GovExec_MikeRoundsEdu/open-graph.jpg	2024-11-22 21:23:00	Government Executive
us	https://www.reuters.com/world/us/trump-picks-janette-nesheiwat-surgeon-general-2024-11-23/	Trump picks TV doctor Janette Nesheiwat as surgeon general - Reuters	None	None	2024-11-23 03:55:00	Reuters
us	https://www.aljazeera.com/news/2024/11/23/are-underwater-pipelines-cables-being-sabotaged-in-the-baltic-sea-why	Are underwater pipelines, cables being sabotaged in the Baltic Sea? Why? - Al Jazeera English	None	https://www.aljazeera.com/wp-content/uploads/2024/11/2024-11-19T094704Z_1402296280_RC298BAOOU07_RTRMADP_3_FINLAND-GERMANY-TELECOMS-1732220657.jpg?resize=1920%2C1440	2024-11-23 08:02:57	Al Jazeera English
us	https://www.politico.com/news/2024/11/23/trump-bondi-gaetz-justice-department-00191384	Swapping Bondi for Gaetz eases fears at Justice Department, but only a little - POLITICO	Some career lawyers agree that Pam Bondi is qualified to be attorney general, even as they worry that she will carry out Donald Trump's desire for retribution.	https://static.politico.com/7f/6b/773959e3492e9f9d66546aac6710/https-delivery-gettyimages.com/downloads/2154026022	2024-11-23 12:00:00	POLITICO
us	https://abcnews.go.com/US/thanksgiving-week-forecast-weather-impact-thanksgiving-travel/story?id=116166737	Thanksgiving week forecast: Weather could impact Thanksgiving travel - ABC News	Looking ahead to Thanksgiving, there may be issues for travelers across parts of the country due to cold temperatures and possible rain and snow across the country.	None	2024-11-23 19:03:50	ABC News
us	https://edition.cnn.com/2024/11/23/middleeast/lebanon-strikes-beirut-basta-intl/index.html	Dozens killed by Israeli strikes in Lebanon, including 20 in central Beirut - CNN	None	https://media.cnn.com/api/v1/images/stellar/prod/2024-11-23t075645z-1550354878-rc2vabadaf8t-rtrmadp-3-israel-palestinians-lebanon.jpg?c=16x9&q=w_800,c_fill	2024-11-23 21:05:00	CNN
us	https://www.axios.com/2024/11/23/trump-liberal-cabinet-rfk-tulsi-gabbard-bessent	Behind the Curtain: Trump's liberal cabinet - Axios	This might be the most ideologically diverse cabinet of modern times.	https://images.axios.com/1mbIreAqCdFd7o1pU8L07p2Ug9g=/0x380:7959x4857/1366x768/2024/11/23/1732376045090.jpg	2024-11-23 15:57:49	Axios
us	https://www.bbc.com/news/articles/c5yx9gwweeeo	South Africa's illegal 'zama-zama' mining industry: Gang-controlled 'towns' grow underground - BBC.com	Illegal miners live dangerously, but make roaring profits selling gold on the black-market.	https://ichef.bbci.co.uk/news/1024/branded_news/035f/live/375b7a00-a732-11ef-8cbc-bb7324b6d77d.jpg	2024-11-21 07:26:15	BBC.com
us	https://www.politico.com/news/2024/11/23/gaetz-trump-attempt-control-congress-00191343	What the Gaetz episode says about Trump’s attempts to control Congress - POLITICO	Republicans opted to quietly push back rather than vocally denounce a questionable Cabinet pick. Look out for that same strategy when it comes to spending and other nominees.	https://static.politico.com/dc/40/b18bbc7b4881a96d44da1c15dc69/trump-47824.jpg	2024-11-23 21:00:00	POLITICO
us	https://www.nytimes.com/2024/11/23/us/politics/scott-bessent-treasury-profile.html	How Scott Bessent Went From Democratic Donor to Trump Treasury Secretary Pick - The New York Times	The hedge fund investor predicted last year that President-elect Donald J. Trump’s political fortunes were on the rise.	https://static01.nyt.com/images/2024/11/15/multimedia/DC-BESSENTPROFILE-HFO-02-vqhc/DC-BESSENTPROFILE-HFO-02-vqhc-facebookJumbo.jpg	2024-11-23 16:41:24	The New York Times
us	https://apnews.com/article/trump-chavezderemer-labor-secretary-unions-republicans-1bff41e4caef610dbf38ead24d292e67	Trump's Republican Party is increasingly winning union voters. It's a shift seen in his labor pick - The Associated Press	Working-class voters helped Republicans make steady election gains this year and expanded a coalition that increasingly includes rank-and-file union members.	https://dims.apnews.com/dims4/default/22c73bd/2147483647/strip/true/crop/4408x2480+0+228/resize/1440x810!/quality/90/?url=https%3A%2F%2Fassets.apnews.com%2F93%2F8d%2F62d2c3aa034d9f8b87627636d2b5%2F23610259b35845fbad6e31ae56a89126	2024-11-23 21:36:00	The Associated Press
us	https://www.yahoo.com/news/well-well-well-trump-gives-193105961.html	Well, Well, Well: Trump Gives up the Game on Project 2025 - Yahoo! Voices	Donald Trump spent his entire campaign denying any connection to the far-right policy plan.	https://media.zenfs.com/en/the_new_republic_521/f18b1b41c75732e902894511ee7dc904	2024-11-22 19:31:05	Yahoo! Voices
us	https://www.nytimes.com/2024/11/23/us/storm-rain-atmospheric-river-california.html	Scenes From the Atmospheric River That Drenched California and the Pacific Northwest - The New York Times	The storm, driven by the season’s first major atmospheric river, inundated the region, killing at least two people and causing widespread power outages.	https://static01.nyt.com/images/2024/11/23/multimedia/00nat-storm-stack-wmtf/00nat-storm-stack-wmtf-facebookJumbo.jpg	2024-11-23 20:33:11	The New York Times
us	https://fortune.com/2024/11/23/elon-musk-wants-to-gut-the-government-like-he-did-at-twitter-but-his-doge-committee-is-nothing-like-his-private-sector-power/	Elon Musk wants to gut the government like he did at Twitter. But his private sector strategies are going to be tested at DOGE - Fortune	Unlike at Twitter, huge waves of government employee dismissals won't save much money.	https://fortune.com/img-assets/wp-content/uploads/2024/11/GettyImages-2185933741_4a67e1.jpg?resize=1200,600	2024-11-23 11:00:00	Fortune
us	https://www.ft.com/content/bec322d1-0d73-4903-8b41-5e6d5d9a358a	Covid lockdown sceptic is frontrunner to lead Trump health agency - Financial Times	Jay Bhattacharya at the NIH would be the latest ally of Robert F Kennedy Jr to take a role overseeing US healthcare	https://www.ft.com/__origami/service/image/v2/images/raw/https%3A%2F%2Fd1e00ek4ebabms.cloudfront.net%2Fproduction%2F678ba7f6-054b-4cad-be54-c12758ec9b97.jpg?source=next-article&fit=scale-down&quality=highest&width=700&dpr=1	2024-11-23 18:26:16	Financial Times
us	https://gothamist.com/news/feds-sign-off-on-nyc-congestion-pricing-clearing-way-for-tolls-to-start-jan-5	Feds sign off on NYC congestion pricing, clearing way for tolls to start Jan. 5 - Gothamist	The approval from the federal Department of Transportation represents a big bureaucratic step toward enacting the tolls.	https://api-prod.gothamist.com/images/348364/fill-1200x650|format-webp|webpquality-85/	2024-11-23 16:52:00	Gothamist
us	https://www.nytimes.com/2024/11/20/well/dr-oz-health-medicare-record.html	Dr. Oz, Tapped to Run Medicare, Has a Record of Promoting Health Misinformation - The New York Times	The heart surgeon turned TV star has championed healthy lifestyle habits. But he’s also promoted sham diet pills and ineffective Covid-19 treatments.	https://static01.nyt.com/images/2024/11/20/multimedia/WELL-OZ-HEALTH-vckq/WELL-OZ-HEALTH-vckq-facebookJumbo.jpg	2024-11-22 08:00:00	The New York Times
us	https://www.theguardian.com/world/2024/nov/23/the-ukraine-missile-crisis-putins-shadow-war-against-the-west-finally-breaks-cover	The Ukraine missile crisis: Putin’s shadow war against the west finally breaks cover - The Guardian	After Kyiv used Storm Shadow missiles, Russia’s leader asserted his ‘right’ to attack the UK and US. In truth, he has been doing exactly that for two years now	https://i.guim.co.uk/img/media/6cecdd95755a710e68422dd6cc70fd5ac1be5063/0_0_6000_3600/master/6000.jpg?width=1200&height=630&quality=85&auto=format&fit=crop&overlay-align=bottom%2Cleft&overlay-width=100p&overlay-base64=L2ltZy9zdGF0aWMvb3ZlcmxheXMvdG8tZGVmYXVsdC5wbmc&enable=upscale&s=da367150d8174a6f32bbdcf203ffb8e2	2024-11-23 15:20:00	The Guardian
us	https://www.bbc.com/news/articles/c0enj90r5d0o	Listeria outbreak: Recall issued as US says infant died - BBC.com	The listeria outbreak, linked to ready-to-eat meat, is known to have sickened 11 people.	https://ichef.bbci.co.uk/news/1024/branded_news/86db/live/2d24b1a0-a9bc-11ef-8ab9-9192db313061.jpg	2024-11-23 20:16:11	BBC.com
us	https://apnews.com/article/united-nations-climate-talks-baku-azerbaijan-finance-8ab629945660ee97d58cdbef10136f35	Nations at UN climate talks agree on $300B a year for poor countries in a compromise deal - The Associated Press	Negotiators will soon decide whether to accept a proposed $300 billion funding package for poor nations to curb and adapt to climate change — a plan hammered out early Sunday by the head of fractured United Nations climate talks.	https://dims.apnews.com/dims4/default/5135d4a/2147483647/strip/true/crop/8394x4722+0+437/resize/1440x810!/quality/90/?url=https%3A%2F%2Fassets.apnews.com%2Fab%2F23%2F90882641b47d9e324a5f37a2074b%2F9c08df3f78af4f05bdb7f752b590088e	2024-11-23 22:42:00	The Associated Press
us	https://www.washingtonpost.com/politics/2024/11/23/sebastian-gorka-trump-islam/	Gorka and his hard-right views on Islam head back to the White House - The Washington Post	Sebastian Gorka ruffled feathers among even reverent Trump loyalists and other Republicans, who have described him as fringe and underqualified.	https://www.washingtonpost.com/wp-apps/imrs.php?src=https://arc-anglerfish-washpost-prod-washpost.s3.amazonaws.com/public/7K7TVKF72LLDHJQPGYQKM2K4CI_size-normalized.jpg&w=1440	2024-11-24 00:03:19	The Washington Post
us	https://www.politico.com/news/2024/11/23/hegseth-women-in-combat-halifax-00191388	US allies repudiate doubts about women in combat - POLITICO	Canada's military chief drew a standing ovation at the Halifax International Security Forum for standing up for women on the front lines.	https://static.politico.com/f2/99/e56bff5548e38d1b6373d378252f/https-delivery-gettyimages.com/downloads/1184744193	2024-11-23 19:59:03	POLITICO
us	https://www.bbc.com/news/articles/cdxv700qg50o	Free shots and beer buckets in party town at centre of suspected methanol deaths - BBC.com	Six foreign tourists have died after apparently drinking contaminated alcohol in a remote Laos party town.	https://ichef.bbci.co.uk/news/1024/branded_news/a872/live/68dec380-a8f8-11ef-bdf5-b7cb2fa86e10.png	2024-11-23 00:27:30	BBC.com
us	https://apnews.com/article/kennedy-oz-cdc-fda-cms-hhs-790e278105172aece70094bbe6c3064a	A look at how some of Trump's picks to lead health agencies could help carry out Kennedy's overhaul - The Associated Press	Donald Trump's health team picks include a retired congressman, a surgeon and a former talk-show host.	https://dims.apnews.com/dims4/default/842cc49/2147483647/strip/true/crop/3554x1999+0+187/resize/1440x810!/quality/90/?url=https%3A%2F%2Fassets.apnews.com%2F9b%2F90%2Fe4aec8c46e87489bac5cc727102c%2Fc2ae26072bde4c7b9c9694b5af8c32c4	2024-11-23 19:54:00	The Associated Press
us	https://edition.cnn.com/2024/11/23/health/fluoride-drinking-water-dg/index.html	What to know about fluoride in drinking water - CNN	None	None	2024-11-23 10:00:00	CNN
us	https://www.bbc.com/news/articles/cwy4j5j7503o	Disappearance of Rabbi in UAE prompts Mossad investigation - BBC.com	Rabbi Zvi Kogan has been missing since Thursday, the Israeli prime minister's office said. 	https://ichef.bbci.co.uk/news/1024/branded_news/c2a3/live/85513710-a9e2-11ef-b3a4-21f061ab9b3e.jpg	2024-11-23 22:00:10	BBC.com
us	https://www.nytimes.com/2024/11/23/world/europe/russia-missile-threat-reactions.html	With Memes and in State Media, Many Russians Cheer on Putin’s Threats - The New York Times	While support for Vladimir V. Putin’s threats resounded in pro-war venues, some Russians reacted with worry, gallows humor and apathy to the suggestions of striking the West and using nuclear weapons.	https://static01.nyt.com/images/2024/11/23/multimedia/23russia-react-03-lkpf/23russia-react-03-lkpf-facebookJumbo.jpg	2024-11-23 10:03:42	The New York Times
us	https://www.bbc.com/news/articles/cz9xl79ny7eo	Judge postpones Trump sentencing for a third time - BBC.com	In what the president-elect's team is calling a victory, the judge paused all proceedings until he receives further arguments from both sides. 	https://ichef.bbci.co.uk/news/1024/branded_news/ca2f/live/2c82e6b0-a8e8-11ef-bf4f-33b3bf22f30d.jpg	2024-11-22 17:16:29	BBC.com
us	https://edition.cnn.com/2024/11/23/us/human-smuggling-indian-family-death/index.html	2 convicted in human smuggling case after Indian family froze to death on US-Canada border - CNN	None	https://media.cnn.com/api/v1/images/stellar/prod/ap24318736433844-copy.jpg?c=16x9&q=w_800,c_fill	2024-11-23 19:31:00	CNN
us	https://people.com/idaho-teen-charged-after-newborn-baby-found-dead-inside-of-safe-haven-box-8750780	Idaho Teen, 18, Charged After Newborn Baby Girl Found Dead Inside of Safe Haven Box - PEOPLE	An 18-year-old was arrested and charged one month after a newborn baby girl was found dead last month inside of an Idaho Safe Haven Baby Box, which are meant to be used to surrender healthy newborns.	https://people.com/thmb/TSDrvnJALI8FqenQLchNedZ02CA=/1500x0/filters:no_upscale():max_bytes(150000):strip_icc():focal(749x0:751x2)/safe-haven-baby-box-062323-1-4a570c1b50904478af55225340d9bbe6.jpg	2024-11-24 00:17:25	PEOPLE
us	https://www.espn.com/college-football/recap?gameId=401628429	Florida 24-17 Ole Miss (Nov 23, 2024) Game Recap - ESPN	None	None	2024-11-23 22:30:00	ESPN
us	https://news.google.com/rss/articles/CBMihwFBVV95cUxQMFJ2SlpIbXFIZ0piZ1pSV2k3SlRPczRRQWJIdlpuUkVBUmlaUkFIRTZGd2tTdW1sblJ1bEtaam9kUGo1TU1tRHBTLUN1dnJDaW5Jbkh4NUg4MUY0TFAwTWdrVWlXcnVKVXhRTTlZTkVKcTNqQWE3Nmxna0xLZ3lQUk1EUEI5eEnSAYwBQVVfeXFMTmM5U3dxcWdLaFc2UDlfTnVIU0VkZVV3b1l4VmdIdldoVFlkMFRMNUpWcXplX1FkeGpHNkkyajN6NkRaaVZPOWE0SldJcHNYZk5BOGtJVWx6OGRMYXRyeXNmZUUtYXNlUHdscTRDOUdqNzUzdl96MGJZR0F3NW9JNWRSalF3Z1pYY2dlNlI?oc=5	Trump taps Brooke Rollins as agriculture secretary - Fox News	President-elect Trump tapped Brooke Rollins, who served in his first administration as director of the Office of American Innovation and acting director of the Domestic Policy Council, as his agriculture secretary.	https://static.foxnews.com/foxnews.com/content/uploads/2024/11/gettyimages-1242253406.jpg	2024-11-23 21:33:00	Fox News
us	https://www.scmp.com/magazines/style/entertainment/article/3287720/meet-nancy-mace-who-introduced-transphobic-bathroom-bill-targeting-sarah-mcbride-she-grew-military	Meet Nancy Mace, who introduced the transphobic Capitol Hill bathroom bill - Style	The Republican South Carolina Representative admitted she deliberately targeted the former Delaware state senator – but seems unbothered by death threats.	https://cdn.i-scmp.com/sites/default/files/styles/og_image_scmp_generic/public/d8/images/canvas/2024/11/22/8a274310-4ae9-4076-add0-271e299053ee_2db485c9.jpg?itok=S_uljfM5&v=1732265162	2024-11-23 22:00:15	Style
us	https://www.sfgate.com/weather/article/sf-flood-warning-california-atmospheric-river-19937062.php	SF hit with rare flash flood warning amid California atmospheric river - SFGATE	The National Weather Service is urging the public to take precautions during intense flooding.	https://s.hdnux.com/photos/01/46/14/60/26790936/5/rawImage.jpg	2024-11-23 14:15:00	SFGATE
us	https://www.foxnews.com/us/dartmouth-sorority-fraternity-members-face-charges-following-death-student-20-party	Dartmouth sorority, fraternity members face charges after death of student, 20, at party - Fox News	The drowning death of a 20-year-old student at Dartmouth over the summer after an alcohol-fueled party has led to charges for a sorority and two fraternity members.	https://static.foxnews.com/foxnews.com/content/uploads/2024/11/darmouthsplit.jpg	2024-11-24 01:18:00	Fox News
us	https://apnews.com/article/housing-secretary-trump-scott-turner-nfl-727417b56d0e1f85a40eaf5f7d13d42f	What to know about Scott Turner, Trump’s pick for housing secretary - The Associated Press	President-elect Donald Trump has selected Scott Turner to lead the U.S. Department of Housing and Urban Development.	https://dims.apnews.com/dims4/default/839d353/2147483647/strip/true/crop/3000x1688+0+157/resize/1440x810!/quality/90/?url=https%3A%2F%2Fassets.apnews.com%2F89%2F8b%2F76611788ac9ce89695df6739e2d0%2F54bc03a46d6d438b9eb3aef3f0e0a9aa	2024-11-23 16:46:00	The Associated Press
us	https://edition.cnn.com/2024/11/23/politics/chinese-cyber-espionage-telecom-execs/index.html	National security officials meet with US telecom execs to share intel on Chinese cyber-espionage campaign, White House says - CNN	None	https://media.cnn.com/api/v1/images/stellar/prod/ap24291541269591-copy.jpg?c=16x9&q=w_800,c_fill	2024-11-23 23:01:00	CNN
us	https://www.cbsnews.com/news/senator-markwayne-mullin-blocks-promotion-lt-gen-christopher-donahue-afghanistan-withdrawal/	GOP senator blocks promotion of general involved in Afghanistan withdrawal, sources say - CBS News	Lt. Gen. Christopher Donahue was slated to be promoted to a four-star rank and take command of the U.S. Army in Europe.	https://assets3.cbsnewsstatic.com/hub/i/r/2024/11/23/88844d30-9bb1-47bd-96cc-6d3b9c4b2a61/thumbnail/1200x630/17b8f5feee9bb6482ad0bada264c319d/gettyimages-1258378963.jpg?v=b1635869826311f914073798d8df6484	2024-11-23 23:30:00	CBS News
us	https://www.cbsnews.com/news/kayaker-leg-amputated-tasmania-australia-rocks/	Kayaker's leg amputated at Tasmania river after 20-hour rescue to free him from rocks - CBS News	Officials said the man, a tourist in his 60s, was kayaking with friends in the Franklin River when he slipped and became trapped.	https://assets3.cbsnewsstatic.com/hub/i/r/2024/11/23/334525e8-e7ee-4b1b-ae9d-c8ea2a261406/thumbnail/1200x630/243e3809b2e9b0b0acfc7086bc90c8de/tasamia-police-rescue.jpg?v=b1635869826311f914073798d8df6484	2024-11-23 15:22:15	CBS News
us	https://www.theguardian.com/world/2024/nov/23/philippine-president-ferdinand-marcos-jrs-deputy-vows-to-have-him-assassinated-if-she-is-killed	Philippine president Ferdinand Marcos Jr’s deputy vows to have him assassinated if she is killed - The Guardian	Vice-president Sara Duterte tells press conference she has given an assassin the instructions, prompting referral from Marcos’s office over ‘active threat’	https://i.guim.co.uk/img/media/564b7355975ddbc3a15e9de7326026eeb8cad450/0_0_4572_2743/master/4572.jpg?width=1200&height=630&quality=85&auto=format&fit=crop&overlay-align=bottom%2Cleft&overlay-width=100p&overlay-base64=L2ltZy9zdGF0aWMvb3ZlcmxheXMvdGctZGVmYXVsdC5wbmc&enable=upscale&s=a4a650a5d1bf13c3f12dfaf90361a6ac	2024-11-23 06:59:00	The Guardian
us	https://www.washingtonpost.com/politics/2024/11/22/supreme-court-executive-authority-fcc-congress/	Supreme Court to examine power of Congress to delegate authority - The Washington Post	The cases explore whether Congress violated the Constitution when it allowed the Federal Communications Commission to gather fees to help pay for critical telecommunications services in communities that might not otherwise have it.	https://www.washingtonpost.com/wp-apps/imrs.php?src=https://arc-anglerfish-washpost-prod-washpost.s3.amazonaws.com/public/VZNX6ABBASTRCGB6PXA6EKFIWU.jpg&w=1440	2024-11-23 07:56:01	The Washington Post
us	https://www.indystar.com/story/sports/college/indiana/2024/11/23/ryan-day-ohio-state-chooses-to-run-up-score-vs-indiana-instead-of-run-out-clock-curt-cignetti/76529686007/	'Leave no doubt.' Ryan Day chooses to run up score vs. Indiana instead of run out clock. - IndyStar	Ohio State RB Treveyon Henderson went down at the 1-yard line to bleed out the clock vs. Indiana. Instead of taking a knee, the Buckeyes added a TD.	https://www.indystar.com/gcdn/authoring/authoring-images/2024/11/23/NCOD/76527748007-osu-24-iu-ac-036.JPG?crop=2999,1687,x0,y156&width=2999&height=1687&format=pjpg&auto=webp	2024-11-23 20:42:45	IndyStar
us	https://sports.yahoo.com/chaos-reigns-after-arizona-state-fans-prematurely-storm-field-in-upset-of-byu-003210760.html	Chaos reigns after Arizona State fans prematurely storm field in upset of BYU - Yahoo Sports	Arizona State ended up winning after an enormous delay in which the goal posts had to be set back up.	https://s.yimg.com/ny/api/res/1.2/OVMMcmUu65yG.0m2WPzQTA--/YXBwaWQ9aGlnaGxhbmRlcjt3PTEyMDA7aD04MDA7Y2Y9d2VicA--/https://s.yimg.com/os/creatr-uploaded-images/2024-11/b9e95710-a9fa-11ef-bdbb-8d638bbfa49f	2024-11-24 01:01:02	Yahoo Sports
us	https://www.si.com/nfl/giants-teammates-daniel-jones-brian-daboll-relationship-different	Giants Teammates Noticed Daniel Jones-Brian Daboll Relationship Was 'Different' in 2024 - Sports Illustrated	Jones was benched Monday and released Friday after six seasons in New York. 	https://images2.minutemediacdn.com/image/upload/c_crop,w_3676,h_2067,x_0,y_114/c_fill,w_1440,ar_16:9,f_auto,q_auto,g_auto/images/ImagnImages/mmsport/si/01jdd7s3t6x8sjbhaasd.jpg	2024-11-23 20:43:23	Sports Illustrated
us	https://www.nbcsports.com/soccer/news/pep-guardiola-reaction-what-did-man-city-boss-say-after-loss-to-tottenham	Pep Guardiola reaction — What did Man City boss say after loss to Tottenham? - NBC Sports	"We will be back. We will do it," said Pep Guardiola after Manchester City's losing streak hit five games as the Etihad Stadium saw a home Premier League loss for the first time since November 2022.	https://nbcsports.brightspotcdn.com/dims4/default/b1261dc/2147483647/strip/true/crop/2554x1437+0+0/resize/1440x810!/quality/90/?url=https%3A%2F%2Fnbc-sports-production-nbc-sports.s3.us-east-1.amazonaws.com%2Fbrightspot%2F36%2F40%2F736650d941d7bc820c8009c06ff4%2Fhttps-delivery-gettyimages.com%2Fdownloads%2F2185586232	2024-11-23 20:26:38	NBC Sports
us	https://www.cbssports.com/college-football/news/notre-dame-vs-army-live-stream-where-to-watch-tv-channel-prediction-pick-spread-football-game-odds/	Notre Dame vs. Army live stream, where to watch, TV channel, prediction, pick, spread, football game odds - CBS Sports	Notre Dame and Army are set to revive their rivalry inside Yankee Stadium	https://sportshub.cbsistatic.com/i/r/2024/11/19/95386b3d-5321-4d34-94f9-0134c23de116/thumbnail/1200x675/37e26d055b7989ecd0162cccb6cd82cf/file-2024-11-19t160602-359.jpg	2024-11-23 23:40:00	CBS Sports
us	https://sports.yahoo.com/ufc-macau-results-and-full-card-highlights-watch-every-finish-from-ufcs-early-morning-event-163759130.html	UFC Macau results and full card highlights: Watch every finish from UFC's early morning event - Yahoo Sports	See everything you missed from UFC's early morning event in Macau, headlined by Petr Yan's electric win over Deiveson Figueiredo.	https://s.yimg.com/ny/api/res/1.2/idTkGGR62gdWhqSx5Mk._g--/YXBwaWQ9aGlnaGxhbmRlcjt3PTEyMDA7aD04MDA7Y2Y9d2VicA--/https://s.yimg.com/os/creatr-uploaded-images/2024-11/9d8ec1f0-a9b8-11ef-bdb3-5825a73d5f40	2024-11-23 16:38:00	Yahoo Sports
us	https://www.deseret.com/sports/2024/11/23/byu-cougars-win-mens-womens-cross-country-ncaa-championship/	BYU Cougars win women’s NCAA cross country championship - Deseret News	None	None	2024-11-23 16:08:52	Deseret News