country_code	url	title	description	image_url	publish_date	source
us	https://calmatters.org/politics/elections/2024/11/california-election-results-november-2024/	Live California election results - CalMatters	Here are the California election results for ballot propositions, president, Congress and Legislature.	https://i0.wp.com/calmatters.org/wp-content/uploads/2024/11/110424-Election-Tracker-Illo-MG-CM.jpg?fit=2000%2C1333&ssl=1	2024-11-05 13:30:00	CalMatters
us	https://abcnews.go.com/538/10-state-legislative-chambers-flip-2024/story?id=115321491	The 10 state legislative chambers that could flip in 2024 - ABC News	None	None	2024-10-31 18:54:07	ABC News
us	https://www.cbsnews.com/news/whats-open-closed-election-day-2024/	What's open and closed on Election Day 2024? Check here before you go. - CBS News	On Election Day 2024, here's what is open and closed, including banks, stores, the post office and more.	https://assets3.cbsnewsstatic.com/hub/i/r/2024/11/04/291f14aa-cb2a-43dc-b357-eb77974e7d65/thumbnail/1200x630/c6943bcd87cd58d14699f83fda8f6a30/gettyimages-2182130560.jpg?v=379420b9063a2aadbcd559df18e2d1ae	2024-11-05 11:00:00	CBS News
us	https://edition.cnn.com/2024/11/05/politics/rudy-giuliani-bankruptcy-freeman-moss/index.html	Rudy Giuliani’s apartment was emptied weeks ago, victims in defamation case say - CNN	None	https://media.cnn.com/api/v1/images/stellar/prod/2023-12-15t230023z-377135717-rc2xx4a98gzq-rtrmadp-3-usa-trump-giuliani-20241105124541833-20241105124645547.JPG?c=16x9&q=w_800,c_fill	2024-11-05 17:27:00	CNN
us	https://www.cbsnews.com/news/adam-coy-guilty-columbus-ohio-andre-hill/	Former Columbus, Ohio, officer found guilty in shooting death of Black man who was holding cellphone and keys - CBS News	A former police officer in Columbus, Ohio, who shot and killed Andre Hill has been found guilty in the shooting.	https://assets1.cbsnewsstatic.com/hub/i/r/2024/10/29/1bfe6c3d-2f61-4972-b33e-ba72149509f5/thumbnail/1200x630/571884529d1988e4f1de8cbb79a3df43/ap24302839597531.jpg?v=379420b9063a2aadbcd559df18e2d1ae	2024-11-04 20:23:42	CBS News
us	https://www.bbc.com/news/articles/c937lvpl3vno	Endangered pygmy hippo calf Haggis born at Edinburgh zoo - BBC.com	Pygmy hippos are native to West Africa and experts believe there are only about 2,500 left in the wild.	https://ichef.bbci.co.uk/news/1024/branded_news/c2e5/live/f6177280-9b77-11ef-8538-e1655f5a8342.jpg	2024-11-05 08:41:31	BBC.com
us	https://finance.yahoo.com/news/last-minute-trump-promises--from-more-tariffs-to-less-chip-money--add-final-wrinkles-to-2024-contest-132610246.html	Last minute Trump promises — from more tariffs to less chip money — add final wrinkles to 2024 contest - Yahoo Finance	New economic policy promises typically aren't rolled out during the final weeks of a presidential campaign. But that's one more norm Donald Trump and his allies have been upending in recent days.	https://s.yimg.com/ny/api/res/1.2/frmjzDRTyGysOTSc.akYQw--/YXBwaWQ9aGlnaGxhbmRlcjt3PTEyMDA7aD04MDA7Y2Y9d2VicA--/https://s.yimg.com/os/creatr-uploaded-images/2024-11/7007f750-9af5-11ef-a7d7-4bb5a621c3e0	2024-11-05 13:26:11	Yahoo Finance
us	https://www.newsweek.com/georgia-donald-trump-kamala-harris-election-voting-poll-absentee-ballots-1980379	Thousands of Georgia Voters in Democratic County Might Not Have Ballots Counted - Newsweek	Georgia Supreme Court rules all absentee ballots must be received by the close of polls on Tuesday, despite a Cobb County error.	https://d.newsweek.com/en/full/2512622/donald-trump.jpg	2024-11-05 13:11:28	Newsweek
us	https://www.cbsnews.com/news/pennsylvania-fraudulent-voter-registration-applications-investigation/	What we know about reports of fraudulent voter registration applications in Pennsylvania - CBS News	Former President Donald Trump has mischaracterized investigations into a number of voter registration applications in Pennsylvania.	https://assets1.cbsnewsstatic.com/hub/i/r/2024/10/21/e185375d-aca6-41d0-b116-03a0db9f15f1/thumbnail/1200x630/ee8ffb9f6e924496ba191a9d81684e21/pennsylvania-mailin-ballots.jpg?v=379420b9063a2aadbcd559df18e2d1ae	2024-11-05 15:23:00	CBS News
us	https://www.pbs.org/newshour/politics/live-results-pennsylvania-election-2024	Live Results: Pennsylvania election 2024 - PBS NewsHour	Both presidential campaigns have fought hard for the Keystone State and its 19 electoral votes, the biggest prize of the tossup states. Follow live results here.	https://d3i6fh83elv35t.cloudfront.net/static/2024/11/2024-11-05T121715Z_454503622_RC20ZAA453M9_RTRMADP_3_USA-ELECTION-1024x683.jpg	2024-11-05 15:00:23	PBS NewsHour
us	https://www.bbc.com/news/articles/c36p55j598lo	Chaos and destruction as Israel strikes deep in Lebanon’s valley - BBC.com	The BBC's Quentin Sommerville spent two weeks with Lebanese Civil Defense Force crews in the Bekaa Valley.	https://ichef.bbci.co.uk/news/1024/branded_news/75c2/live/850bb2e0-9b9a-11ef-82c3-45a801b7330b.jpg	2024-11-05 10:06:37	BBC.com
us	https://www.cbsnews.com/news/kamala-harris-trump-tax-cuts-election-2024-what-to-know/	Harris and Trump both want major tax changes. Here's what they're proposing — and the impact on you. - CBS News	Harris and Trump both have proposed historically large tax overhauls. Here's what to know.	https://assets3.cbsnewsstatic.com/hub/i/r/2024/11/05/8ce4f7fa-58c9-43cb-9ee5-d621a1246c77/thumbnail/1200x630/661e94496a3e1acd206e8522dc8d208a/cbsn-fusion-new-bob-woodward-book-behind-the-scenes-conversations-trump-harris-thumbnail.jpg?v=379420b9063a2aadbcd559df18e2d1ae	2024-11-05 17:36:02	CBS News
us	https://news.google.com/rss/articles/CCAiC2dLNlh2OGIwM3BrmAEB?oc=5	Philadelphia district attorney says 'f around and find out' to Election Day interference - NBC News	None	None	2024-11-05 02:15:04	NBC News
us	https://www.nytimes.com/2024/11/04/well/weed-cannabis-america.html	How Cannabis Use is Changing Across the U.S. - The New York Times	As voters weigh in on measures that would broaden marijuana access, recent data reveals unexpected trends in who uses it, and how.	https://static01.nyt.com/images/2024/10/31/multimedia/WELL-WEED-TRENDS1-vmzl/WELL-WEED-TRENDS1-vmzl-facebookJumbo.jpg	2024-11-04 16:01:23	The New York Times
us	https://www.washingtonpost.com/politics/2024/11/04/atlanta-suburbs-trump-harris-forsyth-county/	Atlanta’s northern suburbs are likely to decide who wins Georgia - The Washington Post	Whoever wins or makes significant gains in Forsyth County, a conservative county that has rapidly become more diverse, is likely to carry the key swing state.	https://www.washingtonpost.com/wp-apps/imrs.php?src=https://arc-anglerfish-washpost-prod-washpost.s3.amazonaws.com/public/7HFZEGA64QYONPHVRQOJAAL6GY_size-normalized.JPG&w=1440	2024-11-04 19:00:31	The Washington Post
us	https://www.washingtonpost.com/politics/2024/11/05/election-day-polling-monitors-justice-department-missouri-texas/	Judge denies Missouri’s effort to block federal election monitors - The Washington Post	A U.S. district court judge ruled against Republican leaders who sought to bar federal monitors from polling sites in St. Louis County on Election Day. 	https://www.washingtonpost.com/wp-apps/imrs.php?src=https://arc-anglerfish-washpost-prod-washpost.s3.amazonaws.com/public/BNVZ5TWXF3W2XVKCPJIVKQSUF4.jpg&w=1440	2024-11-05 17:26:48	The Washington Post
us	https://www.nytimes.com/article/election-2024-results-needle.html	What You Need to Know About Election Night Results and The New York Times Needle - The New York Times	Here’s how we will bring you the latest vote totals and estimates of the outcome on the presidential race and other contests around the country.	https://static01.nyt.com/images/2024/11/04/insider/needle-explainer-promo/needle-explainer-promo-facebookJumbo.jpg	2024-11-05 19:41:40	The New York Times
us	https://www.seattletimes.com/seattle-news/politics/how-seattle-is-planning-for-potential-election-unrest/	How Seattle is planning for potential election unrest - The Seattle Times	Seattle staff are coordinating across departments and are prepared to activate the city’s Emergency Operations Center, Mayor Bruce Harrell's office said.	None	2024-11-05 14:00:00	The Seattle Times
us	https://www.reuters.com/world/middle-east/israeli-airstrikes-kill-least-30-palestinians-gaza-medics-say-2024-11-05/	Israel PM Netanyahu fires defence minister over 'crisis of trust' - Reuters	The Israeli military said, without giving details, that its forces had "eliminated terrorists" in the central Gaza Strip and Jabalia area.	https://www.reuters.com/resizer/v2/YVXAK7AUJRLIBPFNA7MMU6BG54.jpg?auth=2e2b062203a10112c060ab0e9b503170a69105ab180d3410278dd8f13a5e16b9&height=1005&width=1920&quality=80&smart=true	2024-11-05 21:15:28	Reuters
us	https://www.pbs.org/newshour/politics/man-arrested-when-trying-to-enter-u-s-capitol-with-a-torch-and-flare-gun-police-say	Man arrested when trying to enter U.S. Capitol with a torch and flare gun, police say - PBS NewsHour	U.S. Capitol Police say the man was stopped Tuesday during a security screening at the Capitol Visitor Center. Authorities say he smelled of fuel and was carrying the flare gun and torch. Officials have canceled public tours of the Capitol for the remainder of the day.	https://d3i6fh83elv35t.cloudfront.net/static/2024/11/2024-10-21T225454Z_1922857982_RC28PAAWMWJO_RTRMADP_3_USA-DAILYLIFE-1024x683.jpg	2024-11-05 19:10:53	PBS NewsHour
us	https://thehill.com/homenews/campaign/4972658-vance-lost-friendships-trump-support/	Vance says he’s lost friends over Trump support - The Hill	None	None	2024-11-05 16:48:00	The Hill
us	https://www.ft.com/content/638d1c32-1f2d-4c8a-a97f-0f3d297c4959	What would Donald Trump do if he lost? - Financial Times	After refusing to accept that he lost the 2020 election the former president has been casting doubt on this year’s vote 	https://www.ft.com/__origami/service/image/v2/images/raw/https%3A%2F%2Fd1e00ek4ebabms.cloudfront.net%2Fproduction%2Fb7591b32-04c6-4b16-aba2-c275234f7303.jpg?source=next-barrier-page	2024-11-05 18:16:35	Financial Times
us	https://www.pbs.org/newshour/politics/live-results-wisconsin-election-2024	Live Results: Wisconsin election 2024 - PBS NewsHour	Wisconsin is one of the most critical swing states this election, given its 10 electoral college votes and strong likelihood for a repeat, nail-bitingly close result. Follow live results here.	https://d3i6fh83elv35t.cloudfront.net/static/2024/11/2024-10-14T205841Z_142083543_RC2GY6A0ZJ0K_RTRMADP_3_USA-ELECTION-TIMELINE-1024x683.jpg	2024-11-05 15:00:05	PBS NewsHour
us	https://news.google.com/rss/articles/CBMihAFBVV95cUxOSElLYk5lQm5IMF9na3MxT05seXBRdU9faVQxMXBoWmx0MnZlLXRjTDFLYXhhYWN1MEdZcmlFQllvYlN5b29RU2tDaFZZVk1janRYOWZvUy1MWE93M2NGXzhPem0xeG5fLVlaSmRRVjJEV3RPVXZ6aTBKTjdzeEpCRTdMOWs?oc=5	After Spain’s Deadly Floods, Search for the Missing Grows Desperate - The New York Times	None	None	2024-11-05 20:17:32	The New York Times
us	https://www.cbsnews.com/news/migrants-anxiously-monitor-u-election-fearing-trump-win/	"They're very scared": Migrants anxiously monitor U.S. election, fearing Trump win - CBS News	While Vice President Kamala Harris has promised to keep current limits on asylum, former President Donald Trump has vowed to seal the southern border altogether.	https://assets1.cbsnewsstatic.com/hub/i/r/2024/11/05/28356bc2-5df4-4fe8-b27f-cbd7c93d61c6/thumbnail/1200x630/bf1936597d79f86efd53950281edc211/anxious-migrants.jpg?v=379420b9063a2aadbcd559df18e2d1ae	2024-11-05 13:12:04	CBS News
us	https://www.forbes.com/sites/alisondurkee/2024/11/05/heres-why-the-presidential-election-race-in-pennsylvania-and-wisconsin-may-take-days-to-call/	Here’s Why The Presidential Election Race In Pennsylvania And Wisconsin May Take Days To Call - Forbes	Two states can’t even start processing ballots until Election Day, let alone counting them.	https://imageio.forbes.com/specials-images/imageserve/67193a5d877cae5c25115717/0x0.jpg?format=jpg&crop=3398,1910,x0,y322,safe&height=900&width=1600&fit=bounds	2024-11-05 20:35:00	Forbes
us	https://news.google.com/rss/articles/CBMisAFBVV95cUxPM1pIUlFFNUtfUjR2X2hnVVViS2JxQ2FOaUVYNEluZUxTN0tzdFRDek55SjM2UzdCTDUyclVwSkg1WTJYeTBWYndZM0ZvaFZ5ZVBYbVpFNzZiQ1lDWlMzRGdCTVhobERPNjZkdDRDYm0yOHlmSFh3WXZBUGg0dHZqSXFHRTkwUTZsOXpmSkVyVzN0NTI0dEJTYjJIcnV4T1E0M3R6X1l5eHNVQUR1VXhhb9IBtgFBVV95cUxOOV9kN0w3YlFIZFlETkJ1bk1CM0xBQzRHbXg1VHZ4OG8yZjVjZWpqX0NITklWYkZ3MjJvNmhscnY4OWtlcWVwZ29zY3JFYVBRYnB1S2VUT3JnUDU2YTBZVDhMZlgtZUkwR0RjTVk2V045X0gwYl8wbDVIck5nTlc3THFUWTY2bjRuUEU2SHpDQjhHZXZrRlp4SzFSRTRFTHVtVDdWZHNOMEpMQThubHJ6X0JMOXBZdw?oc=5	Exit polls 2024: Fears for American democracy, economic discontent drive voters - ABC News	None	None	2024-11-05 22:21:13	ABC News
us	https://edition.cnn.com/election/2024/results/president	Election 2024: Presidential results - CNN	None	https://media.cnn.com/api/v1/images/stellar/prod/president-20241104230331395.png?c=16x9&q=w_800,c_fill	2024-11-05 21:00:00	CNN
us	https://weather.com/storms/hurricane/news/2024-11-04-tropical-storm-rafael-caribbean-gulf-hurricane	Tropical Storm Rafael To Become Hurricane In Caribbean Today; Could Brush Florida Keys Wednesday - The Weather Channel	Here's the latest on Rafael and where it may head next. - Articles from The Weather Channel | weather.com	https://s.w-x.co/110524_Rafael_4pm.jpg	2024-11-05 20:52:00	The Weather Channel
us	https://edition.cnn.com/2024/11/05/us/georgia-non-credible-bomb-threat-russia/index.html	Non-credible bomb threats against Atlanta-area polling places were from Russia, secretary of state says - CNN	None	None	2024-11-05 22:43:00	CNN
us	https://www.newsweek.com/clips-joe-rogan-opposing-donald-trump-viral-after-endorsement-1980256	Clips of Joe Rogan Opposing Donald Trump Go Viral After Endorsement - Newsweek	Joe Rogan's podcast is the most listened-to show on Spotify in the U.S. Both Donald Trump and JD Vance have been guests during the election campaign.	https://d.newsweek.com/en/full/2512445/joe-rogan.jpg	2024-11-05 14:40:25	Newsweek
us	https://news.google.com/rss/articles/CBMitgFBVV95cUxOc0J1VXYwVzN4MVFFdDB3OUctakNpZTExdTJfX251WW1DdVY1VW01Q09FenJ4bGZDVDlmOFJyYnctQlBOMXlTMDVRVmo3azIzX2g3Sk4wb3Y5ZEhvLUVHTUNWTExodVhMVkFqVGM1dTNiZHY3bWhlMWVfT21mdzlkMkU5WTdRSUJQeVF5Z2IzckhtMS00VHVzdUswbE9RQjd6WW4yRGFyT21PUXVhU09mcVZYalJZQQ?oc=5	Election Day 2024 live updates: 95% of absentee ballots returned; in-person voters get say - Detroit Free Press	Residents of Michigan, a key 2024 swing state, have a final chance to cast a vote for U.S. president and other key races. Get live updates here.	None	2024-11-05 21:31:56	Detroit Free Press
us	https://www.bbc.com/news/articles/cx2n4g86dw9o	Harris to watch election returns at alma mater Howard University - BBC.com	The Democratic nominee retains ties with the historically black university she attended in the 1980s.	https://ichef.bbci.co.uk/news/1024/branded_news/1375/live/e021dd00-9bbb-11ef-b282-0342587a70fd.jpg	2024-11-05 21:39:06	BBC.com
us	https://apnews.com/article/abortion-ballot-measures-harris-trump-florida-missouri-49c9073cbb6056b66a8a7d0d099795d1	Abortion is on the ballot in nine states and motivating voters across the US - The Associated Press	The future legality and availability of abortion hinges not only on ballot measures, as policies could shift depending on who controls Congress and the presidency.	None	2024-11-05 05:03:00	The Associated Press
us	https://abcnews.go.com/International/russia-suspected-plot-send-incendiary-devices-planes-sources/story?id=115497646	Russia suspected of plot to send incendiary devices on planes: Sources - ABC News	None	None	2024-11-05 07:17:41	ABC News
us	https://edition.cnn.com/2024/11/05/politics/voting-security-election-day/index.html	Voting nationwide has been mostly orderly, despite non-credible bomb threats from Russian origin - CNN	None	None	2024-11-05 19:38:00	CNN
us	https://www.aljazeera.com/news/2024/11/5/north-korean-troops-reportedly-on-russian-front-lines-amid-escalation-fears	North Korean troops reportedly on Russian front lines amid escalation fears - Al Jazeera English	A combat role for Pyongyang’s troops risks entry of third state into conflict prompted by Moscow’s invasion in 2022.	https://www.aljazeera.com/wp-content/uploads/2024/10/troops-1729253734.jpg?resize=1920%2C1440	2024-11-05 10:20:34	Al Jazeera English
us	https://www.forbes.com/sites/dereksaul/2024/11/05/election-betting-odds-trump-leads-harris-as-voting-enters-final-hours/	Election Betting Odds: Trump Leads Harris As Voting Enters Final Hours - Forbes	Yet poll-based prediction models consider it a toss-up between Harris and Trump.
	https://imageio.forbes.com/specials-images/imageserve/672a2001dc708812b6d71339/0x0.jpg?format=jpg&crop=1893,1262,x0,y67,safe&height=900&width=1600&fit=bounds	2024-11-05 21:19:00	Forbes
us	https://edition.cnn.com/2024/11/05/politics/polls-close-time-election-dg/index.html	An hour-by-hour guide to election night poll closings - CNN	None	None	2024-11-05 21:29:00	CNN
us	https://www.wsmv.com/2024/11/04/man-accused-attempting-use-weapon-mass-destruction-destroy-nashville-energy-facility-doj-says/	Man accused of attempting to use weapon of mass destruction to destroy Nashville energy facility, DOJ says - WSMV 4	The DOJ reports that he planned to use a drone with explosives attached to it and fly the drone into the substation.	https://gray-wsmv-prod.gtv-cdn.com/resizer/v2/RZCFWGEBO5EFZE2BYS64FZQESQ.jpg?auth=4cd2632445c2c4a91b0215ccbebb554df58d6d0197fe795a911d28e735e3b3c2&width=1200&height=600&smart=true	2024-11-04 22:35:00	WSMV 4
us	https://www.newsweek.com/gop-strategist-north-carolina-trump-1980460	GOP Strategist's North Carolina Warning for Trump: 'Something's Going On' - Newsweek	A Republican strategist suggested Trump might be concerned about North Carolina, a state he won in the last two elections.	https://d.newsweek.com/en/full/2512713/donald-trump.jpg	2024-11-05 15:46:04	Newsweek
us	https://www.pbs.org/newshour/politics/voters-face-dozens-of-ballot-measures-affecting-life-death-taxes-and-more	Voters face dozens of ballot measures affecting life, death, taxes and more - PBS NewsHour	Voters are deciding dozens of state ballot measures affecting the way people live, work and die.	https://d3i6fh83elv35t.cloudfront.net/static/2024/11/2024-11-05T200957Z_639777854_RC26ZAANCP60_RTRMADP_3_USA-ELECTION-1024x683.jpg	2024-11-05 20:41:07	PBS NewsHour
us	https://news.google.com/rss/articles/CBMi0wFBVV95cUxNVDdHU2tvRUFWZHhDQmhES1o5R1YyUXZyZjZfSFhITl95eUg3SXZvRzgtUzFiSnhiTTVhZXFqYklPQTBsLWlZc1hjNUtncTlwVWZ1ZkRVQVNmLVllNlk2bTk0bUgzdjRNdVdkREtXUktJaWJ2Tm5vc2pKbG5FNC1CNkZrWkdCOUY1M05YTjNLb0RZNndKcXQza2dXRDdCX0Myd0UyY29fZGJ5NGxWeDlTelUyb2NpSW5YdmRmVE52OFFLYnNQOHE3M0VUOThKNnZ5MENR?oc=5	What is the Electoral College and how does it determine the president? What to know amid popular vote results - Tennessean	None	None	2024-11-05 19:55:49	Tennessean
us	https://deadline.com/2024/11/kamala-harris-final-rally-philadelphia-1236167418/	Kamala Harris Tells Celebrity-Filled, Final 2024 Campaign Rally That “This Could Be One Of The Closest Races In History” - Deadline	None	None	2024-11-05 05:17:00	Deadline
us	https://www.aljazeera.com/features/2024/11/5/why-have-five-been-arrested-over-leaked-hamas-documents-in-israel	Why have five been arrested over leaked Hamas documents in Israel? - Al Jazeera English	PM Benjamin Netanyahu’s spokesman among those suspected of altering and leaking documents.	https://www.aljazeera.com/wp-content/uploads/2024/11/AP24302581952246-1730804267.jpg?resize=1920%2C1440	2024-11-05 12:46:37	Al Jazeera English
us	https://thehill.com/homenews/campaign/4972454-nicolle-wallace-on-vance-calling-harris-trash-you-just-effed-up/	Nicolle Wallace on Vance calling Harris ‘trash:’ ‘You just effed up’ - The Hill	None	None	2024-11-05 15:47:00	The Hill
us	https://www.politico.com/news/2024/11/05/state-vote-certification-preparations-00187117	Election officials threaten consequences for counties trying to stop certification - POLITICO	State election officials stress that certifying elections is a ministerial function — local election officials are duty-bound to certify results, and that it is not optional. 	https://static.politico.com/0b/62/aec6723245a39f5ae78f6e5f2b7e/election-2024-arizona-early-voting-75465.jpg	2024-11-05 10:00:00	POLITICO
us	https://www.foxnews.com/politics/what-we-know-about-georgias-4-million-votes-already-cast-ahead-election-day	What we know about Georgia's 4 million votes already cast ahead of Election Day - Fox News	More than half of Georgia's active voters have already cast ballots heading into Election Day on Tuesday. Fox News Digital took a look at who those people are.	https://static.foxnews.com/foxnews.com/content/uploads/2024/11/georgia-early-vote.jpg	2024-11-05 09:00:00	Fox News
us	https://www.pbs.org/newshour/politics/watch-live-election-2024-pbs-news-special-coverage	WATCH LIVE: Election 2024 PBS News special coverage - PBS NewsHour	Live streaming coverage begins noon on Election Day, highlighting our coverage from throughout the year.	https://d3i6fh83elv35t.cloudfront.net/static/2024/11/Election2024_KEYART_IPG_1920x1080-1024x576.jpg	2024-11-04 23:33:51	PBS NewsHour
us	https://apnews.com/article/israel-gaza-humanitarian-aid-blinken-austin-656d54b6ff0f37e6219f46deabc0baff	US gives Israel a ‘fail’ grade on improving aid to Gaza so far - The Associated Press	The Biden administration is stepping up criticism of Israel for not doing enough to improve humanitarian conditions in Gaza as a 30-day deadline looms for Israeli officials to meet certain requirements or risk potential restrictions on military assistance.	https://dims.apnews.com/dims4/default/d593f95/2147483647/strip/true/crop/8399x4724+0+437/resize/1440x810!/quality/90/?url=https%3A%2F%2Fassets.apnews.com%2F4b%2F7f%2Fa68ebbe86e243d26aa2836ee4c50%2Fcde81050adcc46a698e7e3ae51959d84	2024-11-05 00:27:00	The Associated Press