country_code	url	title	description	image_url	publish_date	source
us	https://www.aljazeera.com/news/2024/11/10/with-us-house-election-gains-republicans-close-in-on-unified-power	With US House election gains, Republicans close in on unified power - Al Jazeera English	Republicans five seats short of a majority in House of Representatives, with 19 races still uncalled.	https://www.aljazeera.com/wp-content/uploads/2024/11/2024-10-24T201913Z_291472763_RC24RAAKOD9H_RTRMADP_3_USA-ELECTION-TRUMP-1731253681.jpg?resize=1920%2C1440	2024-11-10 16:34:52	Al Jazeera English
us	https://www.usatoday.com/story/news/nation/2024/11/10/california-mountain-fire-130-structures-destroyed/76179563007/	Firefighters make progress, but Southern California wildfire rages on - USA TODAY	Firefighters increased containment of Ventura fire. People have been allowed bak into 1,000 evacuated homes. But 130 buildings have been destroyed.	https://www.usatoday.com/gcdn/authoring/authoring-images/2024/11/09/USAT/76155968007-2183800429.jpg?crop=5289,2976,x0,y276&width=3200&height=1801&format=pjpg&auto=webp	2024-11-10 20:50:40	USA TODAY
us	https://edition.cnn.com/2024/11/10/europe/russia-north-korea-forces-prepared-kursk-ukraine/index.html	Large group of Russian and North Korean forces prepared to retake Russia’s Kursk region from Ukraine - CNN	None	https://media.cnn.com/api/v1/images/stellar/prod/gettyimages-2166135142.jpg?c=16x9&q=w_800,c_fill	2024-11-10 21:13:00	CNN
us	https://www.politico.eu/article/germany-olaf-scholz-eu-affairs-green-cdu-politics-bild-lawmaker-spd/	Germany may hold election sooner than planned, Scholz says - POLITICO Europe	None	None	2024-11-10 22:43:00	POLITICO Europe
us	https://www.cnbc.com/2024/11/10/fed-kashkari-trump-tariffs-inflation-threat-global-trade-retaliation.html	Fed's Kashkari says Trump tariffs could reheat inflation if they provoke global trade 'tit for tat' - CNBC	Donald Trump unleashed China tariffs during his first term that essentially sparked a trade war after the country retaliated with its own U.S. import taxes	https://image.cnbcfm.com/api/v1/image/107412274-17151911262024-05-07t170350z_1854140672_rc2rl7ajrbek_rtrmadp_0_milken-conference.jpeg?v=1715191150&w=1920&h=1080	2024-11-10 18:04:56	CNBC
us	https://www.politico.eu/article/donald-trump-paris-agreement-climate-sustainability-us-cop29-global-pact-warm/	Why Trump’s 2nd withdrawal from the Paris Agreement will be different - POLITICO Europe	None	None	2024-11-10 21:26:00	POLITICO Europe
us	https://www.chicagobears.com/news/rapid-recap-bears-fall-to-patriots-at-soldier-field-2024-week-10	Rapid Recap: Bears fall to Patriots at Soldier Field - ChicagoBears.com	The Bears were held out of the end zone and generated only 142 yards of offense in a 19-3 loss to the Patriots Sunday at Soldier Field.	https://static.clubs.nfl.com/image/upload/t_editorial_landscape_12_desktop/bears/izxn1pohhml2jhmgbvjv	2024-11-11 01:33:11	ChicagoBears.com
us	https://edition.cnn.com/2024/11/10/politics/video/trump-cabinet-pick-process-haberman-ip-digvid	Haberman breaks down Trump's thinking as he makes top cabinet picks - CNN	None	None	2024-11-10 14:11:20	CNN
us	https://nypost.com/2024/11/10/us-news/nyt-has-yet-to-issue-correction-for-wrongly-claiming-trump-falsely-accused-fema-of-avoiding-supporters-homes/	NYT has yet to issue correction for wrongly claiming Trump 'falsely' accused FEMA of avoiding supporters' homes - New York Post 	A New York Times fact-check that claimed Donald Trump lied when he said FEMA deliberately neglected the storm-ravaged homes of his supporters has been debunked — but you’d never know it.	https://nypost.com/wp-content/uploads/sites/2/2024/11/newspress-collage-1n1w8i99n-1731266888953.jpg?quality=75&strip=all&1731249015&w=1024	2024-11-10 20:04:00	New York Post 
us	https://edition.cnn.com/2024/11/10/politics/video/fareeds-take-gps-2024-election-results-digvid	Fareed’s take: Democrats blew it by making three big mistakes - CNN	None	https://media.cnn.com/api/v1/images/stellar/prod/still-21077023-158747-92299999998-still.jpg?c=16x9&q=w_800,c_fill	2024-11-10 16:11:26	CNN
us	https://edition.cnn.com/2024/11/10/politics/elise-stefanik-trump-us-ambassador-to-un/index.html	Trump offers Rep. Elise Stefanik role of UN ambassador, sources say - CNN	None	https://media.cnn.com/api/v1/images/stellar/prod/ap24301758404276.jpg?c=16x9&q=w_800,c_fill	2024-11-11 03:11:00	CNN
us	https://deadline.com/2024/11/yellowstone-return-kevin-costner-exit-dutton-family-war-escalates-1236172226/	‘Yellowstone’ Back With Kevin Costner Exit As Dutton Family Civil War Reaches Fevered Pitch - Deadline	None	None	2024-11-11 02:33:00	Deadline
us	https://edition.cnn.com/2024/11/10/politics/mar-a-lago-trump-transition-epicenter/index.html	Inside Mar-a-Lago, the chaotic Trump epicenter: patio pitches, transition meetings and rogue guests - CNN	None	https://media.cnn.com/api/v1/images/stellar/prod/gettyimages-1423717043-20241111020221106.jpg?c=16x9&q=w_800,c_fill	2024-11-11 02:37:00	CNN
us	https://www.cbsnews.com/news/americans-fed-up-with-economy-turn-to-trump-60-minutes-transcript/	Fed up with the economy, Americans turn to Trump, giving him election sweep of swing states - CBS News	President-elect Donald Trump won Pennsylvania after losing the state in 2020. Scott Pelley visited to find out what was behind the shift this election.	https://assets2.cbsnewsstatic.com/hub/i/r/2024/11/10/51a01687-2df2-4f2b-931b-91a6fcf6d39f/thumbnail/1200x630/8e64e361380eac9d343e3448378d8d29/pa-election-video-pelley.jpg?v=c1d30b1df13c40bf65c6c1e6d9ac4ad7	2024-11-11 00:20:00	CBS News
us	https://apnews.com/article/arizona-house-schweikert-shah-congress-election-2024-d9074746d0ec216131127d223d9552f1	Republican David Schweikert wins reelection in affluent Arizona congressional district - The Associated Press	Republican Rep. David Schweikert has won reelection to a U.S. House seat representing Arizona. Schweikert defeated Democratic former state Rep.	https://dims.apnews.com/dims4/default/00dbb41/2147483647/strip/true/crop/2113x1189+0+110/resize/1440x810!/quality/90/?url=https%3A%2F%2Fassets.apnews.com%2F60%2F08%2F89f8d9134cd22fd41675dce55aa0%2F759b54d5d7c74ffb93694346c4bc5939	2024-11-11 03:15:00	The Associated Press
us	https://abcnews.go.com/US/wildfire-new-jersey-new-york-border-zero-percent-containment/story?id=115713454	Fire at New Jersey-New York border still uncontrolled after burning over 2,500 acres - ABC News	Firefighters reported 0% containment on a wildfire straddling the border of New Jersey and New York on Sunday.	https://i.abcnewsfe.com/a/2c1a3073-d030-448c-b7e0-b822d436596e/new-jersey-fires-gty-lv-241110_1731262441845_hpMain_16x9.jpg?w=1600	2024-11-11 00:06:19	ABC News
us	https://www.democratandchronicle.com/story/sports/football/nfl/bills/2024/11/10/buffalo-bills-indianapolis-colts-score-josh-allen-gritty-win-taron-johnson-tyler-bass/76126794007/	Josh Allen shakes off miscues to lead shorthanded Bills to gritty victory over Colts - Democrat & Chronicle	On a day when he wasn't his best, Josh Allen still delivered in a big way as the Bills rolled the Colts 30-20. Here are Sal Maiorana's observations.	https://www.democratandchronicle.com/gcdn/authoring/authoring-images/2024/11/10/PROC/76183777007-getty-images-2184060402.jpg?crop=2997,1686,x0,y68&width=2997&height=1686&format=pjpg&auto=webp	2024-11-11 00:45:00	Democrat & Chronicle
us	https://www.espn.com/nfl/story/_/id/42316165/new-orleans-saints-end-7-game-skid-darren-rizzi-debut	Saints snap skid, show 'belief' in Rizzi's debut - ESPN	Making his debut as interim coach, Darren Rizzi helped the struggling New Orleans Saints end their seven-game losing streak on Sunday afternoon, authoring a 20-17 victory over the Atlanta Falcons at the Superdome for the club's first win since Sept. 15.	https://a3.espncdn.com/combiner/i?img=%2Fphoto%2F2024%2F1110%2Fr1413206_1296x729_16%2D9.jpg	2024-11-11 00:05:00	ESPN
us	https://thehill.com/homenews/senate/4983506-trump-says-senate-gop-leader-candidates-must-agree-to-recess-appointments/	Trump says Senate GOP leader candidates must agree to recess appointments - The Hill	None	None	2024-11-11 04:40:00	The Hill
us	https://www.montgomeryadvertiser.com/story/news/crime/2024/11/10/one-dead-students-injured-in-tuskegee-university-homecoming-shooting/76176423007/	Montgomery man arrested in connection with Tuskegee University homecoming shooting - Montgomery Advertiser	A Montgomery man faces machine gun possession charges after allegedly leaving the scene of the shooting.	https://www.montgomeryadvertiser.com/gcdn/presto/2020/10/03/PMOY/a88d1d15-2e43-4f18-89e5-9dc06ce2d3da-tuskegee12.jpg?crop=2999,1687,x0,y440&width=2999&height=1687&format=pjpg&auto=webp	2024-11-10 22:52:30	Montgomery Advertiser
us	https://apnews.com/article/trump-homan-ice-border-czar-7dea915b5ea43896390b8020d254f887	Trump announces Tom Homan, former director of immigration enforcement, will serve as 'border czar' - The Associated Press	In an interview on Fox News Channel’s “Sunday Morning Futures,” Homan said that ICE would move to implement Trump’s plans in a “humane manner.”	https://dims.apnews.com/dims4/default/b4c53f9/2147483647/strip/true/crop/3291x1851+0+171/resize/1440x810!/quality/90/?url=https%3A%2F%2Fassets.apnews.com%2Fe9%2F0b%2F697acc09840759af45466cf691a8%2Fab6a6a63799a4e3dabac61b78a048ee9	2024-11-11 04:44:00	The Associated Press
us	https://edition.cnn.com/2024/11/10/us/new-york-wildfire-death/index.html	Volunteer forest ranger, 18, dies responding to New York wildfire that sent smoky haze over NYC - CNN	None	None	2024-11-11 00:13:00	CNN
us	https://www.bbc.com/news/articles/cd6v3zq2jvjo	Israeli strikes on north Lebanon and Gaza kill dozens, officials say - BBC.com	At least 20 children are among the dead in attacks north of Beirut and in northern Gaza, officials rescuers and medics say.	https://ichef.bbci.co.uk/news/1024/branded_news/6536/live/c6e188a0-9f89-11ef-8538-e1655f5a8342.jpg	2024-11-10 21:12:12	BBC.com
us	https://thehill.com/latino/4981445-immigration-trump-mass-deportations-southern-border/	Immigration advocates brace for Trump: ‘Buckle up’ - The Hill	None	None	2024-11-10 21:00:00	The Hill
us	https://edition.cnn.com/2024/11/10/middleeast/israel-netanyahu-pager-trump-intl-latam/index.html	Israel’s Netanyahu acknowledges pager attack, says he sees ‘eye-to-eye’ with Trump on Iran - CNN	None	None	2024-11-10 19:27:00	CNN
us	https://apnews.com/article/israel-palestinians-hamas-war-lebanon-hezbollah-iran-news-11-10-2024-aa1a248a1afccf5eefc471323f764e96	Israeli strikes kill dozens in Lebanon and isolated northern Gaza while Netanyahu and Trump speak - The Associated Press	Israeli strikes killed dozens of people on Sunday in Lebanon and the northern Gaza Strip, where the military has been waging a major offensive for more than a month.	https://dims.apnews.com/dims4/default/0348ea7/2147483647/strip/true/crop/8640x4860+0+450/resize/1440x810!/quality/90/?url=https%3A%2F%2Fassets.apnews.com%2Fe7%2F32%2F2d07513de60a2594df3115aeb0f5%2Fabf54050152d4a5f895b8499479f0589	2024-11-11 04:54:00	The Associated Press
us	https://www.usatoday.com/story/news/politics/elections/2024/11/10/bernie-sanders-kamala-harris-2024-democrats/76179933007/	'What does the Democratic Party stand for?' Sanders doubles down on criticism after Harris loss - USA TODAY	Sen. Bernie Sanders doubled down on accusing the Democratic Party of losing touch with the priorities of working-class Americans.	https://www.usatoday.com/gcdn/authoring/authoring-images/2024/11/07/USAT/76102341007-usatsi-24687534-168401916-lowres.jpg?crop=2015,1135,x0,y188&width=2015&height=1135&format=pjpg&auto=webp	2024-11-10 19:14:42	USA TODAY
us	https://news.google.com/rss/articles/CCAiC0poeXFSeEN0bndzmAEB?oc=5	Philadelphia Eagles vs. Dallas Cowboys | 2024 Week 10 Game Highlights - NFL	None	None	2024-11-11 00:44:50	NFL
us	https://www.denverpost.com/2024/11/10/broncos-chiefs-blocked-field-goal-loss/	Broncos’ Alex Forsyth after Chiefs block game-winning field goal attempt: “I have to be stouter” - The Denver Post	None	None	2024-11-10 22:27:22	The Denver Post
us	https://apnews.com/article/young-black-latino-men-trump-economy-jobs-9184ca85b1651f06fd555ab2df7982b5	Young Black and Latino men say they chose Trump because of the economy and jobs. Here's how and why - The Associated Press	Black and Latino voters moved toward Republican Donald Trump in this year's presidential election, and some of the biggest shifts were among men under age 45, and that helped expand his margin over Democrat Kamala Harris.	https://dims.apnews.com/dims4/default/c585e4a/2147483647/strip/true/crop/2779x1563+0+144/resize/1440x810!/quality/90/?url=https%3A%2F%2Fassets.apnews.com%2F9a%2Fb8%2F328744c2e8f4e7dfb5020510341f%2F62f15fd98d54480fba86adb77c4b785d	2024-11-10 19:14:00	The Associated Press
us	https://www.cbssports.com/nfl/news/2024-nfl-week-10-winners-and-losers-steelers-mike-tomlin-earns-another-big-win-cowboys-season-lost/	2024 NFL Week 10 winners and losers: Steelers' Mike Tomlin earns another big win; Vikings' Sam Darnold shaky - CBS Sports	A roundup of the best and worst performers from Sunday's action	https://sportshub.cbsistatic.com/i/r/2024/11/10/2d16a73e-31ad-421b-8090-742aa5ab2411/thumbnail/1200x675/042b542b9191abace7c5486f3f9be240/tomlin-g.jpg	2024-11-10 22:25:31	CBS Sports
us	https://www.si.com/nfl/vikings/news/vikings-survive-in-jacksonville-as-mac-jones-out-disasters-sam-darnold-01jcbtb31p3a	Vikings survive in Jacksonville as Mac Jones out-disasters Sam Darnold - Sports Illustrated	The Vikings' defense came up with three key takeaways late in a low-scoring win.	https://images2.minutemediacdn.com/image/upload/c_crop,w_4285,h_2410,x_0,y_24/c_fill,w_1440,ar_16:9,f_auto,q_auto,g_auto/images/ImagnImages/mmsport/inside_the_vikings/01jcbx73xwfhnyakz7hf.jpg	2024-11-11 00:26:47	Sports Illustrated
us	https://www.espn.com/nba/story/_/id/42317818/thunder-chet-holmgren-exits-vs-warriors-hip-injury	Holmgren (hip) leaves OKC loss after hard fall - ESPN	The Thunder detailed Chet Holmgren's injury as a right iliac wing fracture and said an update on his status will be provided in eight to 10 weeks.	None	2024-11-11 01:49:00	ESPN
us	https://www.reuters.com/world/us/biden-will-discuss-with-trump-top-us-priorities-wednesday-2024-11-10/	Trump, Putin speak as Biden plans to lobby Trump to stick with Ukraine - Reuters	The president-elect advised Putin not to escalate the Ukraine war, a source said, as President Biden plans to urge Trump not to abandon Kyiv.	https://www.reuters.com/resizer/v2/LRFCIR7U45PX5G7W5PARNLBAUM.jpg?auth=02939f8336595d240ca5b009210dc3ed6174272a3170f32da5e92d83df2e95e2&height=1005&width=1920&quality=80&smart=true	2024-11-11 05:34:00	Reuters
us	https://www.bbc.com/news/articles/c4gx7gjv22po	Garry Conille: Haiti's prime minister ousted after six months - BBC.com	The former United Nations official was brought in to lead Haiti through an ongoing, gang-led security crisis.	https://ichef.bbci.co.uk/news/1024/branded_news/ea1d/live/83040370-9fb5-11ef-b3a4-797e989bea84.jpg	2024-11-11 04:00:40	BBC.com
us	https://edition.cnn.com/2024/11/11/europe/russia-drone-strikes-ukraine-intl-latam/index.html	Ukraine’s war effort faces uncertain future as Russia mounts record drone strikes - CNN	None	https://media.cnn.com/api/v1/images/stellar/prod/gettyimages-2174128559.jpg?c=16x9&q=w_800,c_fill	2024-11-11 05:01:00	CNN
us	https://www.usatoday.com/story/news/politics/elections/2024/11/10/jamal-simmons-joe-biden-kamala-harris/76182658007/	Former Kamala Harris aide says Joe Biden should resign so she can serve as 47th president - USA TODAY	Former Harris communications director Jamal Simmons said on CNN that Joe Biden could step down, allowing Kamala Harris to serve as the 47th president.	https://www.usatoday.com/gcdn/authoring/authoring-images/2024/11/07/USAT/76107886007-20241106-t-213844-z-386439719-rc-2-ms-9-avkg-27-rtrmadp-3-usaelectiondemocrats.JPG?crop=3893,2191,x0,y202&width=3200&height=1801&format=pjpg&auto=webp	2024-11-10 21:33:45	USA TODAY
us	https://apnews.com/article/amsterdam-israel-palestinians-violence-demonstration-1d38014f40c0bc04250113add3ca9cbf	Amsterdam police detain pro-Palestinian protesters at banned demonstration - The Associated Press	Police have detained dozens of people for taking part in a demonstration in central Amsterdam that had been outlawed following violent clashes targeting fans of an Israeli soccer club.	https://dims.apnews.com/dims4/default/4ee8a14/2147483647/strip/true/crop/4896x2754+0+255/resize/1440x810!/quality/90/?url=https%3A%2F%2Fassets.apnews.com%2F2d%2F25%2F1be44fa1128f9cd3e793e2fbd193%2Fd3f16e020469402aabf1966d0a123d14	2024-11-10 20:23:00	The Associated Press
us	https://abcnews.go.com/Politics/sotomayor-plans-resign-supreme-court-sources/story?id=115715433	Sotomayor has no plans to resign from Supreme Court, sources say - ABC News	Despite speculation in liberal legal circles and talk among Democratic senators of urging Justice Sonia Sotomayor to resign, sources close to her say she has no plans to.	https://i.abcnewsfe.com/a/22dc6c18-dc14-4a3c-ab9d-21aa6b5fd225/sotomayor-supreme-court-justice-gty-lv-241110_1731272791886_hpMain_16x9.jpg?w=1600	2024-11-10 21:31:51	ABC News
us	https://www.live5news.com/2024/11/10/more-than-half-escaped-monkeys-now-captured-beaufort-county-facility-says/	More than half of escaped monkeys now captured in Beaufort County, facility says - Live 5 News WCSC	The CEO of a research facility where 43 primates escaped said Sunday night that more than half of them have been captured. 	https://gray-wcsc-prod.gtv-cdn.com/resizer/v2/57BQI5DNIVDYPNG7KZ5DZY2X5Y.jpg?auth=8de2a05772da1c37e2dd7f59886ea51eec14f3c0a0c8933cf56249d10ed207ee&width=1200&height=600&smart=true	2024-11-10 23:04:00	Live 5 News WCSC
us	https://www.aljazeera.com/news/2024/11/10/earthquake-rocks-cuba-as-residents-struggle-to-recover-from-recent-storms	Earthquake rocks Cuba as residents struggle to recover from recent storms - Al Jazeera English	Officials say efforts to assess damage are under way after 6.8-magnitude earthquake hits eastern Cuba.	https://www.aljazeera.com/wp-content/uploads/2024/11/AP24312648485082-1731278427.jpg?resize=1200%2C675	2024-11-10 23:08:50	Al Jazeera English
us	https://www.politico.com/news/2024/11/10/schumer-casey-mccormick-senate-orientation-00188644	Schumer withholds Senate orientation invite from McCormick - POLITICO	Democrats are holding out hope that Sen. Bob Casey can pick up enough votes to hold on to the Pennsylvania Senate seat.	https://static.politico.com/c2/8e/dbb8eee246d29fb8d332137690ec/https-delivery-gettyimages.com/downloads/2161710190	2024-11-10 22:01:54	POLITICO
us	https://apnews.com/article/trump-day-1-priorities-deportations-drilling-ukraine-6747c6e64b0440978f59450b928f61d1	Trump on Day 1: Begin deportation push, pardon Jan. 6 rioters and make his criminal cases vanish - The Associated Press	Donald Trump has ambitious Day 1 plans for when he moves back into the White House in January.	https://dims.apnews.com/dims4/default/d7dc966/2147483647/strip/true/crop/5576x3137+0+295/resize/1440x810!/quality/90/?url=https%3A%2F%2Fassets.apnews.com%2F26%2Fcf%2F2b6313f73117cb10e3a2e919dfb6%2F43623efa3d0347b3af7d9b37ca24f8b3	2024-11-11 05:07:00	The Associated Press
us	https://www.axios.com/2024/11/10/trump-sweeps-seven-swing-states	Trump officially sweeps all 7 swing states - Axios	He's also the first Republican in 20 years to win the popular vote.	https://images.axios.com/7d3tJeRRBwxfYAAgsx7196FLPh4=/0x58:4565x2626/1366x768/2024/11/06/1730933922830.jpg	2024-11-10 16:28:30	Axios
us	https://www.reuters.com/world/middle-east/qatar-pull-out-gaza-ceasefire-mediation-source-says-2024-11-09/	Qatar stalls its Gaza ceasefire mediation - Reuters	Qatar said it will resume efforts if parties show 'willingness and seriousness'.	https://www.reuters.com/resizer/v2/ONJP24AYYZNO3KDQLXGC6TJESY.jpg?auth=b023dc64b6df6b16ef7d1b5f41f43234d1f26cdfecda879979ec8090df50a8e1&height=1005&width=1920&quality=80&smart=true	2024-11-09 20:46:19	Reuters
us	https://sports.yahoo.com/the-jets-season-is-effectively-over-so-whats-left-for-aaron-rodgers-legacy-045226447.html	The Jets' season is effectively over, so what’s left for Aaron Rodgers’ legacy? - Yahoo Sports	It’s stunning to grapple with dire framing for Rodgers. But that’s where we are. You could hear it during his postgame comments after another humbling defeat.	https://s.yimg.com/ny/api/res/1.2/E3wTlVbyIY3B6WS45bh1QQ--/YXBwaWQ9aGlnaGxhbmRlcjt3PTEyMDA7aD04MDA7Y2Y9d2VicA--/https://s.yimg.com/os/creatr-uploaded-images/2024-10/4f6076a0-9fdf-11ef-bdca-26dcfcf786b1	2024-11-11 04:53:00	Yahoo Sports
us	https://www.detroitlions.com/news/recap-lions-at-texans-bates-goff-davis	RECAP: Lions at Texans - detroitlions.com	Tim Twentyman recaps the Detroit Lions’ 26-23 victory over the Houston Texans.	https://static.clubs.nfl.com/image/upload/t_editorial_landscape_12_desktop/lions/kefe1xiije6ax8crkgiu	2024-11-11 05:20:28	detroitlions.com
us	https://sports.yahoo.com/week-10-caredont-care-texans-offense-needs-nico-collins-back-but-is-he-a-fix-all-052722068.html	Week 10 Care/Don't Care: Texans offense needs Nico Collins back, but is he a fix-all? - Yahoo Sports	Fantasy football analyst Matt Harmon examines some of the biggest storylines coming out of Week 10's Sunday action.	https://s.yimg.com/ny/api/res/1.2/CANpDEBR1a7k23xn_UIBVw--/YXBwaWQ9aGlnaGxhbmRlcjt3PTEyMDA7aD04MDA7Y2Y9d2VicA--/https://s.yimg.com/os/creatr-uploaded-images/2024-10/08f20900-9fed-11ef-977c-d974847da48a	2024-11-11 05:27:22	Yahoo Sports
us	https://thehill.com/policy/defense/4979723-lloyd-austin-israel-gallant-call/	Austin calls former Israeli defense minister after Netanyahu dismissal - The Hill	None	None	2024-11-07 22:54:00	The Hill
us	https://apnews.com/article/steelers-commanders-score-66c0cf4819dabd025935ac9f5140ce2f	Russell Wilson’s TD pass to Mike Williams lifts the Steelers over the Commanders 28-27 - The Associated Press	Russell Wilson shook off his first interception in 11 months and hit trade-deadline pickup Mike Williams for a 32-yard touchdown with less than 2 1/2 minutes left in the fourth quarter to lift the Pittsburgh Steelers to a 28-27 comeback victory over Jayden Daniels and the Washington Commanders.	None	2024-11-10 23:03:00	The Associated Press