country_code	url	title	description	image_url	publish_date	source
us	https://www.whitehouse.gov/briefing-room/presidential-actions/2024/10/24/memorandum-on-advancing-the-united-states-leadership-in-artificial-intelligence-harnessing-artificial-intelligence-to-fulfill-national-security-objectives-and-fostering-the-safety-security/	Memorandum on Advancing the United States’ Leadership in Artificial Intelligence; Harnessing Artificial Intelligence to Fulfill National Security Objectives; and Fostering the Safety, Security, and Trustworthiness of Artificial Intelligence - The White House	MEMORANDUM FOR THE VICE PRESIDENT                THE SECRETARY OF STATE	https://www.whitehouse.gov/wp-content/uploads/2021/01/wh_social-share.png	2024-10-24 14:38:40	The White House
us	https://edition.cnn.com/2024/10/25/us/illinois-chicago-area-skull-identified-1866/index.html	Skull found during home renovations in 1978 identified as woman who died more than 150 years ago - CNN	None	None	2024-10-25 04:03:00	CNN
us	https://edition.cnn.com/2024/10/25/politics/poll-watchers-concerns/index.html	Election workers prepare to handle ‘concerning list’ of poll watchers who could disrupt the vote - CNN	None	https://media.cnn.com/api/v1/images/stellar/prod/gettyimages-2179764316.jpg?c=16x9&q=w_800,c_fill	2024-10-25 09:00:00	CNN
us	https://edition.cnn.com/2024/10/25/politics/benedictine-sisters-of-erie-pennsylvania-election-fraud-viral/index.html	Meet the Pennsylvania nuns falsely accused of voter fraud - CNN	None	https://media.cnn.com/api/v1/images/stellar/prod/still-21071572-2959159-159-still.jpg?c=16x9&q=w_800,c_fill	2024-10-25 08:00:00	CNN
us	https://www.washingtonpost.com/politics/2024/10/24/trump-arizona-immigrants-garbage-can-trash-rally/	Trump compares undocumented migrants to trash at insult-fueled rallies - The Washington Post	The Republican presidential nominee compared the United States to “a garbage can for the world” because of illegal border crossings.	https://www.washingtonpost.com/wp-apps/imrs.php?src=https://d1i4t8bqe7zgj6.cloudfront.net/10-25-2024/t_f4331247c5ff4c73b4b933826f630fdc_name_trump2.jpg&w=1440	2024-10-25 06:08:00	The Washington Post
us	https://www.wpr.org/news/green-bay-republican-wisconsin-senator-endorses-kamala-harris	Green Bay Republican, Wisconsin’s longest-serving state senator, endorses Kamala Harris - WPR	A Republican legislator who has served in the Wisconsin state Senate for nearly four decades announced that he will be voting for Vice President Kamala Harris, citing concerns about former President Donald Trump’s commitment to democratic ideals.	https://www.wpr.org/wp-content/uploads/2022/02/robert_cowles-771x514-1.jpg	2024-10-24 19:54:19	WPR
us	https://edition.cnn.com/2024/10/25/politics/video/anderson-cooper-charlamagne-tha-god-trump-video-digvid	‘That’s bulls***’: Watch Anderson Cooper and Charlamagne tha God debate coverage of Trump | CNN Politics - CNN	None	https://media.cnn.com/api/v1/images/stellar/prod/20241025-accharlamagne-super16x9.jpg?c=16x9&q=w_800,c_fill	2024-10-25 13:23:57	CNN
us	https://edition.cnn.com/2024/10/25/europe/russian-soldiers-north-korean-recruits-intercepts-intl/index.html	‘What the f**k to do with them?’ Russian soldiers heard condemning North Korean recruits in intercepted audio - CNN	None	https://media.cnn.com/api/v1/images/stellar/prod/still-21055511-40806-317-still.jpg?c=16x9&q=w_800,c_fill	2024-10-25 15:37:00	CNN
us	https://www.washingtonpost.com/national-security/interactive/2024/russia-biological-chemical-weapons-laboratory-expansion/	Satellite images show major expansion at Russian site with secret bioweapons past - The Washington Post	New construction at a military research site near Moscow reveals a specialized laboratory complex designed to research and handle deadly pathogens, experts say.	https://www.washingtonpost.com/wp-apps/imrs.php?src=https://arc-anglerfish-washpost-prod-washpost.s3.amazonaws.com/public/BFNVSU325BEPNGHWODVEAAE54I.png&w=1200	2024-10-25 16:00:03	The Washington Post
us	https://www.independent.co.uk/news/world/americas/us-politics/trump-mcdonalds-las-vegas-crowd-sizes-b2635516.html	Trump mocked for claiming 29,000 supporters flocked to see his McDonald’s stunt - The Independent	People were quick to point out the small population of the town where Trump’s McDonald’s stunt took place 	https://static.independent.co.uk/2024/10/25/10/2180022760.jpg?quality=75&width=1200&auto=webp	2024-10-25 10:03:09	The Independent
us	https://www.cbsnews.com/news/karim-khan-icc-war-crimes-charges-israel-netanyahu-hamas-sexual-misconduct-claims/	Karim Khan, ICC prosecutor seeking war crimes charges against Israel's Netanyahu, accused of sexual misconduct - CBS News	As ICC prosecutor Karim Khan sought charges against Hamas leaders and Israeli PM Netanyahu, he faced allegations of sexual misconduct.	https://assets2.cbsnewsstatic.com/hub/i/r/2024/10/25/32d4b526-ce80-47b5-bde3-4101b9699536/thumbnail/1200x630/9747e582597ccb9f9f55ecc1567cde2f/karim-khan-icc-2173491381.jpg?v=17b612a59ff4c1e4774d3d0d3ec005e8	2024-10-25 10:56:43	CBS News
us	https://www.nytimes.com/2024/10/24/us/army-homicide-fort-leonard-wood.html	Army Sergeant’s Body Was Found in a Fort Leonard Wood Dumpster - The New York Times	A person of interest was taken into custody after Sgt. Sarah Roque, 23, was found dead at Fort Leonard Wood, according to Army officials.	https://static01.nyt.com/images/2024/10/24/multimedia/24xp-armyarrest-ckhv/24xp-armyarrest-ckhv-facebookJumbo.jpg	2024-10-25 02:45:59	The New York Times
us	https://www.pbs.org/newshour/nation/stranded-astronauts-return-to-earth-after-being-delayed-by-hurricane-milton-and-capsule-safety-concerns	Stranded astronauts return to Earth after being delayed by Hurricane Milton and capsule safety concerns - PBS NewsHour	Four astronauts are back on Earth after a space station mission that lasted almost eight months.	https://d3i6fh83elv35t.cloudfront.net/static/2024/10/2024-10-09T161446Z_850070442_RC2WGAA6DUSA_RTRMADP_3_STORM-MILTON-1024x683.jpg	2024-10-25 13:32:24	PBS NewsHour
us	https://www.politico.com/news/2024/10/25/trump-madison-square-garden-rally-harris-00185465	Trump will use his Madison Square Garden rally to deliver his closing argument: Harris broke America - POLITICO	Trump has long wanted to hold an event in the arena.  	https://static.politico.com/21/cf/6c9963d34c0ea9d3fe6987a00ee1/election-2024-trump-50497.jpg	2024-10-25 09:00:00	POLITICO
us	https://www.cdc.gov/ecoli/outbreaks/where-people-got-sick-e-coli-o157-2024.html	Where People Got Sick: E. coli Outbreak, McDonald's Quarter Pounders - October 22, 2024 - CDC	Learn where sick people lived from this outbreak.	None	2024-10-22 20:47:04	CDC
us	https://news.google.com/rss/articles/CBMilAFBVV95cUxPb3hNcFBkQUpOVUxKbU5jOEJTZGxlZ243RW9FVlhDaVJtWDMyS3RrTXlwOFNkanhzY01pU2EzV2VqTGF0MWtNdm55OHg2V1VOYXZCUDlUMjM3cEtMMTNrOU8teGJUb2dRaEljZkNwOWxfbWdBd2c1YmxDSTREOGtwQ2MtTzZSYlNTcTFCYW9lRWxiekF3?oc=5	Governor Glenn Youngkin on Federal Judge Ordering Virginia to Reinstate Noncitizens Back Onto the Voter Rolls - Virginia Governor Ralph Northam - Proclamation	None	None	2024-10-25 15:12:36	Virginia Governor Ralph Northam - Proclamation
us	https://edition.cnn.com/2024/10/25/politics/cnn-poll-harris-trump/index.html	CNN Poll: Harris and Trump remain in a locked race and are tied heading into the final stretch - CNN	None	None	2024-10-25 16:52:00	CNN
us	https://apnews.com/article/kamala-harris-abortion-rights-2024-election-democrats-f228eedd3308dab2e1125fdf6029a4a2	Harris, Beyoncé team up for a Texas rally on abortion rights and hope battleground states hear them - The Associated Press	Vice President Kamala Harris is teaming up with Beyoncé for a rally in solidly Republican Texas. It's aimed at highlighting the medical fallout from the state’s strict abortion ban and putting the blame squarely on Donald Trump.	https://dims.apnews.com/dims4/default/fb9962b/2147483647/strip/true/crop/1061x597+0+68/resize/1440x810!/quality/90/?url=https%3A%2F%2Fassets.apnews.com%2Ff1%2F46%2Fd7316293569b99395c85624a2037%2Fb3214923f4624cdda4f9b4cdd7f0c5e2	2024-10-25 14:24:00	The Associated Press
us	https://www.bbc.com/news/articles/cjr4dnv91p7o	Joe Rogan interview emerges as Donald Trump's closing pitch - BBC.com	A stand-up comic with the most popular podcast in America is putting his imprint on a tight election.	https://ichef.bbci.co.uk/news/1024/branded_news/bf60/live/c820a2c0-926c-11ef-8e6d-e3e64e16c628.jpg	2024-10-25 15:00:31	BBC.com
us	https://news.google.com/rss/articles/CBMiwgFBVV95cUxPWlRWeGJKejNmTjd3Z05mZmt2UGVBYVAxUnplRGw4aFp2WU1ha0xsQllpblBIUjNWWEp1c0pmS0M3YloyMTRXektzdlJNSk9lQ1U3VWgwOXc0NVVCSlk3cXFYVVZ0Nl9tR3pqaVFRWVVJN1VlMXhaMXdYUmN6LVdJcnZ5UHhHdUNHRzljVU9nUHRSUVl4MDE3UHNwWEdkSXZYY09QZmNDQ0xqVk5pdlQwUjJzX1VQa292RG1PcG1EZl9IQQ?oc=5	Republicans’ Early Voting Surge: What We Know From Ballots So Far - Bloomberg	Donald Trump is sending mixed messages, but data shows Republicans are voting early in key swing states.	https://assets.bwbx.io/images/users/iqjWHBFdfxIU/i60pGGtKfgOs/v1/1200x800.jpg	2024-10-25 11:00:27	Bloomberg
us	https://news.google.com/rss/articles/CBMizwFBVV95cUxOTGZJaF9rWDI0TlQxTzUzbzRDSlFEeEoxSEc5THZ6dWN6M2xYaEg3UHNld0RxRkVncXQ4LWNwcF8yclUxeEJZYm1nS2NvLWpqN3RwMmExa1MwQWV0dkwzUnMxWTJTNmhEbmxoX3BvaXhwVUV6QktId0gwY0t6TXNycFl5R2JFZVlHaW1vMjVIZlROQlRtbVZHa1E0RGNPUmg0TzZSVk9iYkNZLWhjbjBzY2ppMnVWNUFERTlKeklqWEswVGxWY0RINVhYSURwSjg?oc=5	Johnson, McConnell ask Harris to ‘stop escalating the threat environment’ after Trump fascist remarks - POLITICO	None	None	2024-10-25 16:45:41	POLITICO
us	https://news.google.com/rss/articles/CBMiwwFBVV95cUxNSUxMMnlyRTNDUHBTVk1IQjU0ZDBOWjNWa2xBdXdKZEd0SkZzb2dMbF9TQkttZmJ2S05NX2JTSXFNQlBKcGZNYm1JNHN6bkg0WkJGOHZhSEsweVozQ0tKS1dJN2JyYVdzRXN6ZkhjSmRQbnhycU91TG81S2pid1k5UE9OOWwwSUdEM2E2anRFdWlQTk1pRFNUZHhSZGpSaWU1eDc0MlVxWFVFTFNJVmZyWmxUTDFiNk1DeHB5UWl3V3Y2Ync?oc=5	Elon Musk has been in regular contact with Putin for two years, says report - The Guardian	Alleged talks between billionaire and Russian president could have enormous security implications	https://i.guim.co.uk/img/media/a39cc5d7f5910f1b33ce354ecd4f9afe58568967/0_0_5829_3498/master/5829.jpg?width=1200&height=630&quality=85&auto=format&fit=crop&overlay-align=bottom%2Cleft&overlay-width=100p&overlay-base64=L2ltZy9zdGF0aWMvb3ZlcmxheXMvdGctZGVmYXVsdC5wbmc&enable=upscale&s=676c3459ff3e91a3d04b6c1621d2e027	2024-10-25 14:47:00	The Guardian
us	https://www.usatoday.com/story/news/nation/2024/10/25/fall-city-shooting-teen-charged/75820202007/	Washington teen accused of killing his family, surviving sister tells how she escaped - USA TODAY	The suspect's surviving 11-year-old sister told police she played dead and fled the home out her bedroom window.	https://www.usatoday.com/gcdn/authoring/authoring-images/2024/10/21/USAT/75781543007-getty-images-564573990.jpg?crop=4079,2295,x0,y142&width=3200&height=1801&format=pjpg&auto=webp	2024-10-25 13:06:34	USA TODAY
us	https://apnews.com/article/biden-indian-country-harris-arizona-election-0ac697174d60f8481924a09cbc0c6d51	Biden at last visits Indian Country, where he will apologize for 150-year-old boarding school policy - The Associated Press	President Joe Biden is using his first presidential visit to Indian Country to formally apologize to Native Americans for a government-run boarding school system that for decades forcibly separated Indian children from their parents.	https://dims.apnews.com/dims4/default/5f9fc6b/2147483647/strip/true/crop/4457x2507+0+234/resize/1440x810!/quality/90/?url=https%3A%2F%2Fassets.apnews.com%2Fec%2Fd9%2F8d67b102b7c6bc88aaf01551e571%2F359dcd4a36284f46b9509a107d69097e	2024-10-25 15:56:00	The Associated Press
us	https://www.bbc.com/news/articles/cpvz2rzm4k0o	Lebanon: Three journalists killed in Israeli air strike - BBC.com	Israel is accused of targeting a compound housing journalists in southern Lebanon. 	https://ichef.bbci.co.uk/news/1024/branded_news/90ca/live/64aa2f40-92b7-11ef-9504-b516e8b5f45f.jpg	2024-10-25 12:26:36	BBC.com
us	https://abcnews.go.com/US/wireStory/pennsylvania-county-election-workers-flagged-2500-possibly-fraudulent-115145683	Pennsylvania county says election workers flagged 2,500 possibly fraudulent voter registrations - ABC News	None	None	2024-10-25 14:52:35	ABC News
us	https://edition.cnn.com/2024/10/25/politics/fundraising-takeaways-elon-musk-harris-trump/index.html	Elon Musk keeps up pro-Trump spending spree as Harris continues to dominate money race, new filings show - CNN	None	https://media.cnn.com/api/v1/images/stellar/prod/harrismusk.jpg?c=16x9&q=w_800,c_fill	2024-10-25 07:27:00	CNN
us	https://thehill.com/homenews/education/4952192-student-loan-relief-debt-forgiveness-biden-hardship-rules/	8 million student loan borrowers would qualify for relief under Biden ‘hardship’ rules - The Hill	None	None	2024-10-25 09:00:00	The Hill
us	https://www.theguardian.com/commentisfree/2024/oct/25/stacey-williams-trump-epstein	A woman says Trump groped her in front of Jeffrey Epstein. Will anyone listen? - The Guardian	The muted response to Stacey Williams’ story is a bleak sign of how America has come to respond to these accusations	https://i.guim.co.uk/img/media/5d17a10d5651321cf9c7d4b9fa150df98ee0ee06/0_0_5000_3000/master/5000.jpg?width=1200&height=630&quality=85&auto=format&fit=crop&overlay-align=bottom%2Cleft&overlay-width=100p&overlay-base64=L2ltZy9zdGF0aWMvb3ZlcmxheXMvdGctb3BpbmlvbnMucG5n&enable=upscale&s=003c8bd225273100808b6c4c4c48d37e	2024-10-25 17:02:00	The Guardian
us	https://www.cnbc.com/2024/10/25/german-finance-minister-warns-of-retaliation-if-us-kicks-off-trade-war.html	German finance minister warns of retaliation if U.S. kicks off trade war - CNBC	German Finance Minister Christian Lindner on Friday warned that if the U.S. kicked off a trade war with the European Union, there could be retaliation. 	https://image.cnbcfm.com/api/v1/image/108053050-1729870271397-gettyimages-2179944355-IMF_WORLD_BANK.jpeg?v=1729870660&w=1920&h=1080	2024-10-25 15:55:41	CNBC
us	https://www.bbc.com/news/articles/crr957ee559o	Turkey: Kurdish militant group behind attack on aerospace firm - BBC.com	The PKK says it targeted the defence manufacturer because the weapons it produced had killed "thousands" of Kurds.	https://ichef.bbci.co.uk/news/1024/branded_news/b582/live/74b0c220-92e2-11ef-8e6d-e3e64e16c628.jpg	2024-10-25 08:52:49	BBC.com
us	https://apnews.com/article/king-charles-commonwealth-slavery-reparations-chogm-samoa-6488cbfb9367b81b8453ea6c6dc41cbd	King Charles tells summit the past can't be changed as leaders ask Britain to reckon with slavery - The Associated Press	King Charles III has told a summit of Commonwealth countries in Samoa that the past could not be changed as he indirectly acknowledged calls from some of Britain’s former colonies for a reckoning over its role in the trans-Atlantic slave trade.	https://dims.apnews.com/dims4/default/1c31a26/2147483647/strip/true/crop/4615x2596+0+241/resize/1440x810!/quality/90/?url=https%3A%2F%2Fassets.apnews.com%2Fad%2Fd8%2Ff9d2901cc2ddd1c0586ef5d342e8%2F37943e4711b340efb4073c1e4fdb730e	2024-10-25 08:34:00	The Associated Press
us	https://www.usatoday.com/story/news/nation/2024/10/25/baltimore-bridge-collapse-cleanup-settlement/75831166007/	Cargo ship owner in Baltimore bridge collapse agrees to pay $102M for cleanup - USA TODAY	The settlement will cover the federal costs incurred responding to the disaster, including clearing the debris to reopen the shipping channel in June.	https://www.usatoday.com/gcdn/authoring/authoring-images/2024/09/18/USAT/75274835007-20240610-t-223902-z-1985816775-rc-2-n-88-ad-0-nxl-rtrmadp-3-marylandincident.JPG?crop=5331,3000,x0,y276&width=3200&height=1801&format=pjpg&auto=webp	2024-10-25 04:21:18	USA TODAY
us	https://news.google.com/rss/articles/CBMiWkFVX3lxTE41VE00YXVQVWJxYU1XOWRENEZndGdrVDNwOFlaWWRHbElOWmF3YXNuYUxaR0RMWUZLQmRNM2IwOVlJRE9iRl91b3dmcVh4Y1A0czZ6VVJMLW5QUdIBX0FVX3lxTE5aYnRycTVmTUVCekNtdmV0SjNySHdyVHYyV3E2U2lNN010NDFSZG5PNTNTMWVsV3JocXVlRHBFRW5qYzVFMkJSRUdJY2NrdzBJUU1ZanBPbjlELVVHSUpz?oc=5	Brics: How an evolving and expanding bloc benefits India - BBC.com	Brics enables India to work with some of its closest friends and espouses principles close to Delhi's heart.	None	2024-10-25 06:09:24	BBC.com
us	https://edition.cnn.com/2024/10/24/politics/video/bruce-springsteen-kamala-harris-endorsement-digvid	Bruce Springsteen slams Trump while urging Americans to vote for Harris - CNN	None	https://media.cnn.com/api/v1/images/stellar/prod/still-21069912-3056917-784-still.jpg?c=16x9&q=w_800,c_fill	2024-10-24 23:02:05	CNN
us	https://www.kktv.com/2024/10/25/this-is-taking-up-over-year-my-life-victims-return-nature-case-react-plea-deal-federal-case/	‘This is taking up over a year of my life’: victims in the Return to Nature case react to plea deal in federal case - KKTV	Jon and Carrie Hallford, the owners of the Return to Nature Funeral Home, where nearly 200 bodies were found improperly stored changed their pleas to guilty in their federal cases Thursday.	https://gray-kktv-prod.gtv-cdn.com/resizer/v2/ST5YTREDXJBGNGGNATACOOYYOA.jpg?auth=4cb0d453cca5b43ad858f133160b0a6fcca4da4a03cd2e54d71bbe31c679ab9a&width=1200&height=600&smart=true	2024-10-25 04:25:00	KKTV
us	https://www.salon.com/2024/10/25/daddys-home-tucker-carlsons-bizarre-distills-false-promise-to-male/	"Daddy's home": Tucker Carlson's bizarre troll distills Trump's false promise to male voters - Salon	Trump wants dudes to believe he can bring women to heel, but instead, he'll leave men sadder and lonelier 	None	2024-10-25 10:00:00	Salon
us	https://abcnews.go.com/Politics/trump-denies-making-positive-comments-hitler/story?id=115142505	Trump denies making positive comments about Hitler - ABC News	His former chief of staff told The New York Times and The Atlantic he did.	None	2024-10-25 13:48:33	ABC News
us	https://ncnewsline.com/briefs/north-carolina-child-care-centers-struggle-to-reopen-in-the-aftermath-of-hurricane-helene/	North Carolina child care centers struggle to reopen in the aftermath of Hurricane Helene - NC Newsline	hurricane damage; child care centers; federal funding; stabilization grants; funding loss; historic flooding	None	2024-10-23 09:12:31	NC Newsline
us	https://nypost.com/2024/10/25/us-news/attorney-for-menendez-brothers-uncle-says-da-trying-to-rewrite-history-in-pursuit-to-free-pair/	Attorney for Menendez brothers’ uncle says DA trying to ‘rewrite history’ in pursuit to free pair - New York Post 	None	None	2024-10-25 08:37:00	New York Post 
us	https://apnews.com/article/migration-netherlands-wilders-asylum-38a5149bf59fad91d2368350405ba9dd	Hard-right Dutch government approves unprecedented package of measures to control migration - The Associated Press	The hard-right Dutch government has announced tough measures aimed at reining in asylum requests. They include a re-introduction of border checks and make the Netherlands the latest European nation to take a hardline stance against migration.	https://dims.apnews.com/dims4/default/93b9d83/2147483647/strip/true/crop/8640x4860+0+450/resize/1440x810!/quality/90/?url=https%3A%2F%2Fassets.apnews.com%2F91%2Faa%2Fff87f5d67ada07e2f32fda3a5fd2%2Ffa18037602c0426ca96f5424c33d86d1	2024-10-25 14:26:00	The Associated Press
us	https://www.thewrap.com/kamala-harris-cnn-town-hall-ratings/	Kamala Harris CNN Town Hall Draws 3.3 Million Viewers, On Par With Trump Fox News Town Hall - TheWrap	Kamala Harris' CNN town hall delivered solid ratings just under two weeks ahead of the 2024 election.	https://www.thewrap.com/wp-content/uploads/2024/10/Kamala-Harris-at-CNN-Town-Hall-Agrees-Donald-Trump-Is-a-Fascist.jpg	2024-10-24 20:33:33	TheWrap
us	https://apnews.com/article/israel-palestinians-hamas-war-lebanon-hezbollah-iran-news-10-24-2024-ab2b634abca70923712a655cd097a421	Israeli strike on Gaza shelter kills 17 as Blinken says cease-fire talks will resume - The Associated Press	Palestinian officials say an Israeli strike on a school where displaced people were sheltering in the central Gaza Strip has killed at least 17 people.	https://dims.apnews.com/dims4/default/4185239/2147483647/strip/true/crop/8640x4860+0+450/resize/1440x810!/quality/90/?url=https%3A%2F%2Fassets.apnews.com%2F26%2F69%2F5e018f906c3c1b9040a20462a434%2F1ad6cd6334c64c03a216fd65a5d08fa2	2024-10-24 20:59:00	The Associated Press
us	https://abcnews.go.com/US/judge-declines-reconsider-criminal-charges-alec-baldwin-fatal/story?id=115150438	Judge declines to reconsider criminal charges for Alec Baldwin in fatal 'Rust' shooting - ABC News	None	None	2024-10-25 16:41:15	ABC News
us	https://www.bbc.com/news/articles/cp35912v9rro	US rapper Lil Durk arrested in Florida on murder-for-hire charge - BBC.com	Durk is allegedly implicated in a 2022 shooting that killed the cousin of rival rapper Quando Rondo.	https://ichef.bbci.co.uk/news/1024/branded_news/6f3f/live/8b62b510-92e6-11ef-9e9f-f94aa162b9ae.jpg	2024-10-25 15:32:55	BBC.com
us	https://www.reuters.com/business/environment/climate-set-warm-by-31-c-without-greater-action-un-report-warns-2024-10-24/	Climate change: UN report says planet to warm by 3.1 C without greater action - Reuters	Current climate policies will result in global warming of more than 3 degrees Celsius (5.4 degrees Fahrenheit) by the end of the century, according to a United Nations report on Thursday, more than twice the rise agreed to nearly a decade ago.	https://www.reuters.com/resizer/v2/7PRBFNTUQRPIRDEHYLXBTBIQPY.jpg?auth=bd45d948225ec6ea6eb52b6fc7bc18143f74d368356eac56137182172e00d670&height=1005&width=1920&quality=80&smart=true	2024-10-24 21:44:19	Reuters
us	https://www.nationalreview.com/corner/a-year-ago-last-night-mike-johnson-won-the-speakers-gavel/	A Year Ago Last Night, Mike Johnson Won the Speaker’s Gavel - National Review	On October 2, 2023, eight House Republicans joined a united Democratic caucus in ousting Kevin McCarthy from the speakership.	https://i0.wp.com/www.nationalreview.com/wp-content/uploads/2023/11/mike-johnson-7.jpg?resize=300%2C300&ssl=1	2024-10-25 13:56:20	National Review
us	https://www.bbc.com/news/articles/c238kv8ddeyo	Lost Silk Road cities unearthed in Uzbekistan's high mountains - BBC.com	The discoveries of these high-altitude medieval cities challenge long-held assumptions of the trade network.	https://ichef.bbci.co.uk/news/1024/branded_news/fdaa/live/67576c60-92a0-11ef-8e6d-e3e64e16c628.jpg	2024-10-25 04:14:50	BBC.com
us	https://edition.cnn.com/2024/10/23/politics/nobel-prize-economists-harris-economic-plan/index.html	23 Nobel Prize-winning economists call Harris’ economic plan ‘vastly superior’ to Trump’s - CNN	None	https://media.cnn.com/api/v1/images/stellar/prod/20241018-trumpharrissplit101824.jpg?c=16x9&q=w_800,c_fill	2024-10-23 18:34:00	CNN
us	https://www.axios.com/2024/10/24/americans-election-day-violence-poll	Most Americans anticipate post-Election Day violence, but ready to accept results: Poll - Axios	A majority of Democrats and Republicans agree on the likelihood of violence.	https://images.axios.com/SCBMOJqrEJyvjb2zTh2nSgpayzw=/0x140:4200x2503/1366x768/2024/10/24/1729789732960.jpg	2024-10-24 17:54:48	Axios